,Unnamed: 0.1,Unnamed: 0,author,body,score,subreddit,link_id,over_18,controversiality,author_flair_text,created_utc,flair,sentiment
9435,77942,77942,HolographicHeart,I don't think we get flexed next week. The shield is going to want Aaron 'Karma Crystals' Rodgers in the primetime slot instead.,5.0,jaguars,t3_100sw1k,False,0.0,:WH1::WH2::WH3:,2023-01-01T18:29:08Z,jaguars,0.0386
9436,77943,77943,HolographicHeart,"Teal top
Black pants
Black socks",1.0,jaguars,t3_100wonw,False,0.0,:WH1::WH2::WH3:,2023-01-01T18:23:56Z,jaguars,0.2023
9437,77945,77945,HolographicHeart,Dougie P and Press Taylor really don't seem to have a good answer to Tampa 2. Hopefully Lovie is canned and takes that defensive scheme with him.,4.0,jaguars,t3_100p2qp,False,0.0,:WH1::WH2::WH3:,2023-01-01T14:33:34Z,jaguars,0.3208499999999999
9438,77947,77947,HolographicHeart,"Gardner has always struggled against teams with great front sevens, which New Orleans is in every way.",2.0,jaguars,t3_100p2qp,False,0.0,:WH1::WH2::WH3:,2023-01-01T13:41:49Z,jaguars,0.4019
9439,77948,77948,HolographicHeart,It legitimately bugs me that Trevor has looked like crap against Houston all 4 times he's played them.,7.0,jaguars,t3_100p2qp,False,0.0,:WH1::WH2::WH3:,2023-01-01T13:30:04Z,jaguars,0.3182
9440,77949,77949,HolographicHeart,"Feels like a monkey's paw scenario:

You get a franchise QB but your divisional opponent runs a defense he cannot play against.",8.0,jaguars,t3_100p2qp,False,0.0,:WH1::WH2::WH3:,2023-01-01T13:16:29Z,jaguars,-0.0139
9441,77950,77950,HolographicHeart,I hate Tampa 2.,3.0,jaguars,t3_100p2qp,False,0.0,:WH1::WH2::WH3:,2023-01-01T12:50:12Z,jaguars,-0.5719
9442,77952,77952,HolographicHeart,"The Houston game, while probably meaningless, worries me for two major reasons:

1. Lovie Smith teams always play their best football at the end of the season to provide support for job security.
2. Tampa 2. If Trevor is stifled yet again by this defensive look, expect to see a ton of it moving forward.",1.0,jaguars,t3_zyzyua,False,0.0,:WH1::WH2::WH3:,2022-12-30T12:04:57Z,jaguars,-0.061331616
9853,78848,78848,Holysmokesx,This Pitre dude is really good.,7.0,jaguars,t3_100p2qp,False,0.0,:Teal::Teal::Teal::Teal:,2023-01-01T14:12:19Z,jaguars,0.4927
9854,78849,78849,Holysmokesx,I'm a gamecock grad. Hate this.,2.0,jaguars,t3_1001yhe,False,0.0,:Teal::Teal::Teal::Teal:,2023-01-01T13:30:24Z,jaguars,-0.28595
9855,78850,78850,Holysmokesx,Tyson is special.,3.0,jaguars,t3_100p2qp,False,0.0,:Teal::Teal::Teal::Teal:,2023-01-01T13:20:10Z,jaguars,0.4019
9856,78853,78853,Holysmokesx,We have no way of knowing if it will be Saturday or Sunday do we?,1.0,jaguars,t3_zz4tjd,False,0.0,:Teal::Teal::Teal::Teal:,2022-12-30T12:51:42Z,jaguars,-0.296
10214,85331,85331,InquisitiveHawk,"My family moved to Georgia from Indiana, I started school in Georgia and quickly made lots of friends and reportedly had a great teacher. We move to Jacksonville, FL not long after being in Georgia; we may have even moved during my 1st grade of school, and I'm devastated. My parents tried, I had a going away party with my class and teacher, and my dad is trying to find anything positive to help me latch onto the Jacksonville move as a positive. I went from being an only child for the first four years of my life to then having two younger siblings and major changes within two years. I also was not an easy child, with ADHD, and other mental developmental issues.  


Two things were cemented into my life for many years:

My love for the Jaguars and my hatred for raisins and raisin bread. (The only thing I could latch onto as to why I didn't want to go to the new class/school. I was told they were making raisin bread by the school counselor and my dad in an attempt to excite me to go to class).",2.0,jaguars,t3_1035xms,False,0.0,:cockroach::Shield:,2023-01-04T12:11:47Z,jaguars,0.0586136832475662
10215,85336,85336,InquisitiveHawk,There are going to be games where he gets double-covered or locked up. I just hope he is team-oriented and isn't the diva some are saying he is.,3.0,jaguars,t3_102hu96,False,0.0,:cockroach::Shield:,2023-01-03T20:19:53Z,jaguars,0.2202
10216,85342,85342,InquisitiveHawk,All white and all black are the worst.,1.0,jaguars,t3_101r3al,False,0.0,:cockroach::Shield:,2023-01-03T13:43:19Z,jaguars,-0.6249
10217,85346,85346,InquisitiveHawk,"Umm... duh?  


I hate people who report like there's breaking news on something that's well established that the business of the week must end by Wednesday.",2.0,nfl,t3_10286o1,False,0.0,:Jaguars: Jaguars,2023-01-03T12:33:00Z,jaguars,-0.0129
10218,85354,85354,InquisitiveHawk,"Seems he's been plagued by injuries.

But I hope he works out whether it's as a veteran practice squad player or finds his way to performing strip sacks on the field.",2.0,jaguars,t3_101q2op,False,0.0,:cockroach::Shield:,2023-01-03T07:40:24Z,jaguars,0.29635
10219,85355,85355,InquisitiveHawk,Don't kink shame. For some that is a happy ending.,5.0,jaguars,t3_101rf4h,False,0.0,:cockroach::Shield:,2023-01-03T07:38:08Z,jaguars,0.37905
10220,85358,85358,InquisitiveHawk,You're missing something too since you're proselytizing on the internet.,2.0,nfl,t3_101tiwi,False,0.0,:Jaguars: Jaguars,2023-01-02T22:15:06Z,jaguars,-0.296
10221,85361,85361,InquisitiveHawk,Got ya. Yea... I was fearful of an arterial tear my self.,1.0,jaguars,t3_101vlmu,False,0.0,:cockroach::Shield:,2023-01-02T21:46:01Z,jaguars,-0.1646333333333333
10222,85362,85362,InquisitiveHawk,I hope you live with the consequences of your actions.,10.0,jaguars,t3_101vlmu,False,0.0,:cockroach::Shield:,2023-01-02T21:41:32Z,jaguars,0.4404
10223,85365,85365,InquisitiveHawk,"Sounds like they used an AED as well.  


Listed in critical condition and intubated.",2.0,jaguars,t3_101vlmu,False,0.0,:cockroach::Shield:,2023-01-02T21:12:21Z,jaguars,-0.0197499999999999
10224,85366,85366,InquisitiveHawk,"The Bills equipment staff are packing up the sideline. They aren't playing regardless, and I hope the NFL does the right thing.",7.0,jaguars,t3_101vlmu,False,0.0,:cockroach::Shield:,2023-01-02T20:58:54Z,jaguars,0.16
10225,85367,85367,InquisitiveHawk,Bills equipment staff are packing up. No official word.,5.0,jaguars,t3_101vlmu,False,0.0,:cockroach::Shield:,2023-01-02T20:56:33Z,jaguars,-0.148
10226,85369,85369,InquisitiveHawk,"From what I've heard, many people have said the Bengals fans have been amazing.  


As they should. It's not football anymore when an ambulance is on the field and a player receives CPR.",33.0,jaguars,t3_101vlmu,False,0.0,:cockroach::Shield:,2023-01-02T20:41:03Z,jaguars,0.0217
10227,85370,85370,InquisitiveHawk,"RIP dude, loving and heading thoughts to your family and friends.

We need better health care and health awareness in the US.",1.0,jaguars,t3_101masn,False,0.0,:cockroach::Shield:,2023-01-02T15:12:47Z,jaguars,0.5610999999999999
10228,85371,85371,InquisitiveHawk,"My dad explained to me why this man should never be not hated; as a young Jaguars fan, when the playbook stealing occurred.

Jeff and Fischer are synonymous with fuming anger.

All Jeffs that are Jaguars fans must call themselves by another name.",19.0,jaguars,t3_101jqyv,False,0.0,:cockroach::Shield:,2023-01-02T13:33:06Z,jaguars,-0.1136703703703703
10229,85373,85373,InquisitiveHawk,"Fuck no, they couldn't get their calls right EVEN in week 17.

That's a first down... when it was 4th and 9.

God, I'm so pissed at this idea I can't even formulate more of their fuckups.",1.0,jaguars,t3_100u6gm,False,0.0,:cockroach::Shield:,2023-01-01T21:08:12Z,jaguars,-0.1952851851851851
10230,85375,85375,InquisitiveHawk,Bro... I'm glad I'm not in Duval anymore... have fun with that...,1.0,jaguars,t3_100tlji,False,0.0,:cockroach::Shield:,2023-01-01T19:50:24Z,jaguars,0.3715
10231,85378,85378,InquisitiveHawk,"Dewey had an interception stolen from him.

DHAI!!!",13.0,jaguars,t3_100sw1k,False,0.0,:cockroach::Shield:,2023-01-01T15:02:44Z,jaguars,-0.0182925925925925
10232,85380,85380,InquisitiveHawk,"When will we be done with these inconsistent announcers who can't get their facts straight?

Trevor hasn't seen the field this half, when he has...

First down on a 3rd and 19...",2.0,jaguars,t3_100p2qp,False,0.0,:cockroach::Shield:,2023-01-01T14:32:56Z,jaguars,0.056575
10233,85381,85381,InquisitiveHawk,"Even the negative yardage run was smart, kept the clock running by going backwards out of bounds.",2.0,jaguars,t3_100p2qp,False,0.0,:cockroach::Shield:,2023-01-01T14:30:22Z,jaguars,-0.25
10234,85382,85382,InquisitiveHawk,"I'm a bit concerned with how open these missed throws are. But, I'll take the W.",5.0,jaguars,t3_100p2qp,False,0.0,:cockroach::Shield:,2023-01-01T14:26:08Z,jaguars,-0.074
10235,85385,85385,InquisitiveHawk,That glove legit was stuck to the ball.......,4.0,jaguars,t3_100p2qp,False,0.0,:cockroach::Shield:,2023-01-01T14:16:08Z,jaguars,-0.25
10236,85386,85386,InquisitiveHawk,Unacceptable! How do you allow someone to kick a 56 yard FG?!?,3.0,jaguars,t3_100p2qp,False,0.0,:cockroach::Shield:,2023-01-01T14:04:03Z,jaguars,0.0138259259259259
10545,87534,87534,ItWasAlwaysUs,Lot J looked silly and dumb.,1.0,jaguars,t3_102oryr,False,0.0,:JAX:,2023-01-04T12:37:13Z,jaguars,-0.4939
10546,87535,87535,ItWasAlwaysUs,Why would he cover a tight end? His coverage in the game was very strong.,1.0,jaguars,t3_103459q,False,0.0,:JAX:,2023-01-04T12:33:00Z,jaguars,0.27815
10547,87536,87536,ItWasAlwaysUs,Actual leadership is cool,1.0,jaguars,t3_10359kr,False,0.0,:JAX:,2023-01-04T12:31:08Z,jaguars,0.3182
10548,87537,87537,ItWasAlwaysUs,Evan Engram wasn’t playing against him and Sauce deserves the fans because he’s that good,1.0,nfl,t3_102vdeo,False,0.0,:Jaguars: Jaguars,2023-01-04T08:40:30Z,jaguars,0.5719
10549,87539,87539,ItWasAlwaysUs,Excellent. The old stadium has a fine location and structure. No need to tear it down and tear down a neighborhood just to build up the new one.,1.0,jaguars,t3_102oryr,False,0.0,:JAX:,2023-01-04T08:30:53Z,jaguars,-0.0550074074074074
10550,87540,87540,ItWasAlwaysUs,Thoughtful words from him,1.0,nfl,t3_102j208,False,0.0,:Jaguars: Jaguars,2023-01-04T08:30:06Z,jaguars,0.3818
10725,89801,89801,Jaglawyer11,"All the elite defenders he played against first in the AFC Central (Pitt, Baltimore, etc) as well as players from the elite Tampa defense all say he’s a Hall of Famer and deserves it.  He averaged 4.6 yards per carry….look up where that ranks—and surpassed 10k yards.",3.0,nfl,t3_103ls78,False,0.0,:Jaguars: Jaguars,2023-01-04T20:09:52Z,jaguars,0.16215
10726,89802,89802,Jaglawyer11,Perfect example of why “pro bowls” shouldn’t mean a damn thing when considering a player for the Hall.  It’s nothing but a popularity contest.  He had enough accolades against the Dolphins alone….,7.0,nfl,t3_103ls78,False,0.0,:Jaguars: Jaguars,2023-01-04T19:58:26Z,jaguars,-0.0480407407407407
10727,89803,89803,Jaglawyer11,As great a player as Fred was he’s an even better man off the field.  I’ve been blessed to have gotten to know him.  I think he will eventually when people really examine his numbers.,8.0,nfl,t3_103ls78,False,0.0,:Jaguars: Jaguars,2023-01-04T19:56:25Z,jaguars,0.0958814814814814
10728,89804,89804,Jaglawyer11,That’s a rock solid 15 but my man Fred Taylor left out again.  It’s ridiculous he can’t get in the top 15.,17.0,nfl,t3_103ls78,False,0.0,:Jaguars: Jaguars,2023-01-04T19:45:19Z,jaguars,-0.06965
10729,89805,89805,Jaglawyer11,No offense but I never want to relive ‘99 again….,56.0,jaguars,t3_103kztz,False,0.0,🐀 🐀 🐀 🐀 🐀 🐀 🐀 ,2023-01-04T19:25:13Z,jaguars,0.0096
10730,89807,89807,Jaglawyer11,Fuck that.  Just win Saturday night.,72.0,nfl,t3_1034mkv,False,0.0,:Jaguars: Jaguars,2023-01-04T08:43:11Z,jaguars,0.157375
10731,89808,89808,Jaglawyer11,Great News!  Keep fighting Damar!!!,3.0,nfl,t3_1034vuf,False,0.0,:Jaguars: Jaguars,2023-01-04T08:41:55Z,jaguars,-0.0282444444444444
10732,89813,89813,Jaglawyer11,I can support this after 27 years of cooking in the Sun at that stadium….,67.0,nfl,t3_102pmsz,False,0.0,:Jaguars: Jaguars,2023-01-03T19:29:28Z,jaguars,0.4019
10733,89814,89814,Jaglawyer11,Lot J would have been incredible too damn shame it was voted down….,8.0,jaguars,t3_102oryr,False,0.0,🐀 🐀 🐀 🐀 🐀 🐀 🐀 ,2023-01-03T19:22:13Z,jaguars,-0.7463
10734,89817,89817,Jaglawyer11,I pray this is true!!!,1.0,nfl,t3_101x02h,False,0.0,:Jaguars: Jaguars,2023-01-02T21:42:22Z,jaguars,0.1723
10735,89818,89818,Jaglawyer11,I pray this news is true!!,1.0,nfl,t3_101x2t8,False,0.0,:Jaguars: Jaguars,2023-01-02T21:41:47Z,jaguars,0.1647
10736,89819,89819,Jaglawyer11,Fuck it just go beat the Titans.,3.0,jaguars,t3_101sbdf,False,0.0,🐀 🐀 🐀 🐀 🐀 🐀 🐀 ,2023-01-02T18:52:59Z,jaguars,-0.5423
10737,89823,89823,Jaglawyer11,Good.  Fuck that guy.,-1.0,nfl,t3_101cg1v,False,1.0,:Jaguars: Jaguars,2023-01-02T10:40:33Z,jaguars,-0.16105
10738,89825,89825,Jaglawyer11,Fuck you Kayvon.,13.0,nfl,t3_100ufus,False,0.0,:Jaguars: Jaguars,2023-01-01T22:52:23Z,jaguars,-0.5423
10739,89827,89827,Jaglawyer11,Agreed it didn’t seem like he was reading a schedule…,2.0,jaguars,t3_10123ei,False,0.0,🐀 🐀 🐀 🐀 🐀 🐀 🐀 ,2023-01-01T21:43:07Z,jaguars,0.5574
10740,89829,89829,Jaglawyer11,Just win next week regardless of the date and time and you can bet your ass they’ll have a national TV audience the following week.,5.0,jaguars,t3_100zwmm,False,0.0,🐀 🐀 🐀 🐀 🐀 🐀 🐀 ,2023-01-01T20:18:34Z,jaguars,0.0772
10741,89832,89832,Jaglawyer11,Blow this shit squad out,4.0,jaguars,t3_100p2qp,False,0.0,🐀 🐀 🐀 🐀 🐀 🐀 🐀 ,2023-01-01T12:10:06Z,jaguars,-0.5574
10742,89833,89833,Jaglawyer11,How the fuck was that a first down?  No replay,1.0,jaguars,t3_100oq9e,False,0.0,🐀 🐀 🐀 🐀 🐀 🐀 🐀 ,2023-01-01T12:06:55Z,jaguars,-0.283575
10743,89834,89834,Jaglawyer11,Fuck the Texans and their battle red uniforms…,7.0,jaguars,t3_100oq9e,False,0.0,🐀 🐀 🐀 🐀 🐀 🐀 🐀 ,2023-01-01T11:51:11Z,jaguars,-0.7269
10744,89835,89835,Jaglawyer11,"Emmitt Smith, Eric Dickerson and Marcus Allen….all equally terrible.",1.0,nfl,t3_zzjqeu,False,0.0,:Jaguars: Jaguars,2022-12-31T09:52:39Z,jaguars,-0.4767
10745,89838,89838,Jaglawyer11,Easily his biggest 4th quarter comeback.,6.0,jaguars,t3_zz8wrh,False,0.0,🐀 🐀 🐀 🐀 🐀 🐀 🐀 ,2022-12-30T14:59:22Z,jaguars,0.34
10746,89843,89843,Jaglawyer11,"The automatic assumption that this team is in the playoffs already is baffling to me.  Kind of like 1999 automatically assuming we were going to the Super Bowl before the AFC Title game.

https://youtu.be/WYSlGaQsC8I

Dobbs looked capable of converting play action passes with Henry leading the way….the Titans game will not be a joke.",24.0,jaguars,t3_zysnjl,False,0.0,🐀 🐀 🐀 🐀 🐀 🐀 🐀 ,2022-12-30T05:46:14Z,jaguars,0.243
11257,90902,90902,Jaguars4life,Yo dude exactly! You feel like you are on death’s door when you fly Spirit haha!,4.0,jaguars,t3_10334sk,False,0.0,:Clemson::JAX:,2023-01-04T17:52:44Z,jaguars,0.3787
11258,90905,90905,Jaguars4life,Curious anyone in here have a fear of flying?,2.0,jaguars,t3_10334sk,False,0.0,:Clemson::JAX:,2023-01-04T14:31:34Z,jaguars,-0.2263
11259,90910,90910,Jaguars4life,I’m high again and I want Taco Bell.,3.0,jaguars,t3_1027lpe,False,0.0,:Clemson::JAX:,2023-01-03T19:40:20Z,jaguars,0.0772
11260,90911,90911,Jaguars4life,Are Sgt Peppers Lonely Hearts Club Band and Pet Sounds 2 of the greatest rock albums of all time?,1.0,jaguars,t3_1027lpe,False,0.0,:Clemson::JAX:,2023-01-03T15:10:13Z,jaguars,0.7906
11261,90914,90914,Jaguars4life,God this is like a kick to the balls twice in a row!,19.0,jaguars,t3_101masn,False,0.0,:Clemson::JAX:,2023-01-02T14:20:51Z,jaguars,0.5983
11262,90916,90916,Jaguars4life,Hoping the Bengals win tomorrow cause I wanna go into Kansas City in the divisional round and do like what we did to Pittsburgh in 2017.,5.0,jaguars,t3_10180zo,False,0.0,:Clemson::JAX:,2023-01-02T12:00:53Z,jaguars,0.8442
11263,90917,90917,Jaguars4life,"If this is a free talk thread then let me share you one of my favorite stories of 2022.

There was a month or 2 search to find a lost SpongeBob Got Milk add from 2001 and it’s just one of the cutest and charming ads you will ever see! [The commercial here](https://youtu.be/0On_quxxljY)",7.0,jaguars,t3_10180zo,False,0.0,:Clemson::JAX:,2023-01-02T11:52:23Z,jaguars,0.1152148148148148
11264,90919,90919,Jaguars4life,Lloyd and Muma have bright futures TBH,7.0,jaguars,t3_100p2qp,False,0.0,:Clemson::JAX:,2023-01-01T14:24:15Z,jaguars,0.4404
11265,90921,90921,Jaguars4life,I can remember when Key was considered a potential Number 1 overall pick at one point.,3.0,jaguars,t3_100p2qp,False,0.0,:Clemson::JAX:,2023-01-01T12:10:13Z,jaguars,0.0772
11266,90922,90922,Jaguars4life,Honestly like that the season ends on the 2nd Sunday in January and the Super Bowl is in the 2nd Sunday in February now!,1.0,jaguars,t3_100oq9e,False,0.0,:Clemson::JAX:,2023-01-01T11:56:08Z,jaguars,0.8655
11267,90923,90923,Jaguars4life,Well “It Don’t Come Easy”,1.0,jaguars,t3_zzupry,False,0.0,:Clemson::JAX:,2022-12-31T22:01:28Z,jaguars,0.2732
11268,90924,90924,Jaguars4life,Having a steak and eggs burrito for brunch that is always like a power up to me!,3.0,jaguars,t3_zzupry,False,0.0,:Clemson::JAX:,2022-12-31T11:31:24Z,jaguars,0.4199
11269,90925,90925,Jaguars4life,Dear Trevor I wrote you but you still ain’t calling,10.0,jaguars,t3_zzupry,False,0.0,:Clemson::JAX:,2022-12-31T11:16:04Z,jaguars,0.2023
11270,90926,90926,Jaguars4life,"Dido said once in her song White Flag and it’s how I feel about the Jaguars 

“I will go down with this ship

And I won't put my hands up and surrender

There will be no white flag above my door

I'm in love and always will be”",8.0,jaguars,t3_zzupry,False,0.0,:Clemson::JAX:,2022-12-31T10:03:29Z,jaguars,0.4588
11271,90927,90927,Jaguars4life,All hail the Hypotoad!,4.0,jaguars,t3_zzupry,False,0.0,:Clemson::JAX:,2022-12-31T09:43:15Z,jaguars,0.1511
11272,90930,90930,Jaguars4life,TLC is the ultimate guilty pleasure band for me like CrazySexyCool hooks you and makes you a fan,3.0,jaguars,t3_zyzyua,False,0.0,:Clemson::JAX:,2022-12-30T11:08:12Z,jaguars,0.6908
11273,90932,90932,Jaguars4life,"Tracking the 2023 Baseball Hall of Fame writer ballots and the only players so far tracking over the 75% needed to join the Veterans Committee inductee Fred McGriff in Cooperstown in July is Scott Rolen and Todd Helton.

[The ballot tracker here](https://onedrive.live.com/view.aspx?resid=F2E5D8FC5199DFAF!47464&ithint=file%2cxlsx&authkey=!AOiVOHV1SzKLAR0)",1.0,jaguars,t3_zyzyua,False,0.0,:Clemson::JAX:,2022-12-30T10:34:01Z,jaguars,0.156225
11274,90933,90933,Jaguars4life,As a Clemson fan I would be excited!,2.0,jaguars,t3_zyimsf,False,0.0,:Clemson::JAX:,2022-12-30T09:36:17Z,jaguars,0.6114
11591,92021,92021,JaguarsDTWD,God please be ok,5.0,nfl,t3_101tiwi,False,0.0,:Jaguars: Jaguars,2023-01-02T20:06:40Z,jaguars,0.6808
11833,92825,92825,Jalfaar,Grandma found discounted jags clothes at Kmart for Christmas in 95/96. I was 9 and I've been a fan ever since!,1.0,jaguars,t3_1035xms,False,0.0,Speedo Jaxson de Ville ,2023-01-04T17:50:11Z,jaguars,0.2029999999999999
11834,92830,92830,Jalfaar,Oh wow he pulls it off. I had to double bc I thought it was Trevor at first.,65.0,jaguars,t3_100tb0h,False,0.0,Speedo Jaxson de Ville ,2023-01-01T15:04:23Z,jaguars,0.146475
11835,92831,92831,Jalfaar,Rest our sweet sweet prince for the remainder of the day! Here is to 8-8!,8.0,jaguars,t3_100p2qp,False,0.0,Speedo Jaxson de Ville ,2023-01-01T13:55:49Z,jaguars,0.1856
12670,97859,97859,JohnShepard_N7,Lol only since 2000,15.0,jaguars,t3_101jcob,False,0.0,Jaggin' Off :jof:,2023-01-02T12:46:06Z,jaguars,0.4215
13414,99201,99201,JohnnySnark,Haven't been but it is a luxury suit. It is basically a party deck and gives you access to the pools.,3.0,nfl,t3_102hskb,False,0.0,:Jaguars: Jaguars,2023-01-04T00:40:33Z,jaguars,0.20095
13415,99202,99202,JohnnySnark,They don't realize shit and have zero self reflection,6.0,nfl,t3_102j208,False,0.0,:Jaguars: Jaguars,2023-01-03T17:05:30Z,jaguars,0.4449
13416,99203,99203,JohnnySnark,Well we did sit Trevor in the second half,20.0,nfl,t3_102klm4,False,0.0,:Jaguars: Jaguars,2023-01-03T17:03:25Z,jaguars,0.2732
13417,99204,99204,JohnnySnark,"Listen, we got pools in our damn stadium, of course we are goofy",42.0,nfl,t3_102hskb,False,0.0,:Jaguars: Jaguars,2023-01-03T17:00:24Z,jaguars,-0.4019
13418,99206,99206,JohnnySnark,They really are some of the worst kind of conspiracy theorists,14.0,nfl,t3_101x9bo,False,0.0,:Jaguars: Jaguars,2023-01-02T21:52:59Z,jaguars,-0.8176
13419,99207,99207,JohnnySnark,"It's provocative, it gets the texans losing",56.0,jaguars,t3_101rf4h,False,0.0,:Santa:,2023-01-02T17:43:49Z,jaguars,-0.3818
13420,99208,99208,JohnnySnark,Yeah you're right,1.0,jaguars,t3_10180zo,False,0.0,:Santa:,2023-01-02T16:06:57Z,jaguars,0.296
13725,100550,100550,JoshHero,Average tickets sold this year for home games is 59636. That includes the 86216 number from London this year too.,4.0,jaguars,t3_102oryr,False,0.0,Santa Jag :Santa:,2023-01-03T21:26:54Z,jaguars,0.0386
13726,100560,100560,JoshHero,Theres very few things can be compared to. Wwe decided to continue the show after Owen Hart fell “because the show must go on”. It was a poor choice then and the NFL got this 100% correct.,5.0,jaguars,t3_101wa3r,False,0.0,Santa Jag :Santa:,2023-01-03T01:00:44Z,jaguars,-0.1589
13727,100566,100566,JoshHero,"They sat their starters last week too. An extra day don’t mean anything when they have already been sitting for weeks. 

A rolling golem gathers no rust. Let’s Fucking Go Boys!",2.0,jaguars,t3_101t87p,False,0.0,Santa Jag :Santa:,2023-01-02T21:37:52Z,jaguars,-0.0185
13728,100567,100567,JoshHero,Saturday night game is better. Don’t need to wake up the next day to do anything besides watch more football.,13.0,jaguars,t3_101t87p,False,0.0,Santa Jag :Santa:,2023-01-02T21:36:05Z,jaguars,0.1101
13729,100570,100570,JoshHero,The Jags already fired him once. Don’t worry there’s lots of NFL teams looking for a Rocket Surgeon,16.0,jaguars,t3_101j6bi,False,0.0,Santa Jag :Santa:,2023-01-02T13:54:53Z,jaguars,-0.35955
13730,100571,100571,JoshHero,QBs haven’t really put up good numbers all year vs the Texans. The RBs have feasted all year vs the Texans. This was the game plan.,2.0,jaguars,t3_101exvn,False,0.0,Santa Jag :Santa:,2023-01-02T12:04:24Z,jaguars,0.0180629629629629
13731,100572,100572,JoshHero,Woody has said terrible things about the Jags but he’s just a lovable idiot on Around the Horn so I forgive him.,3.0,jaguars,t3_10136ou,False,0.0,Santa Jag :Santa:,2023-01-02T11:57:18Z,jaguars,0.4709
13795,106919,106919,Leiby02,What do you want them to do? Cut around shots  inside the stadium speculating about injury? This isn’t about money it’s about respect for the man laying on the field not showing the injury over and over,1.0,nfl,t3_101tiwi,False,0.0,:Jaguars: Jaguars,2023-01-02T20:04:26Z,jaguars,0.1573259259259259
13966,108968,108968,Lesbereal476,This was honestly a genius prediction I just hope we win by a few more points,3.0,jaguars,t3_103mots,False,0.0,:Shield:,2023-01-04T20:22:50Z,jaguars,0.8658
13967,108969,108969,Lesbereal476,"They should show it on the Jumbotron before the game! They want the fans loud AF, that’d do it",22.0,jaguars,t3_103kztz,False,0.0,:Shield:,2023-01-04T19:33:21Z,jaguars,0.0386
13968,108970,108970,Lesbereal476,"I’m probably going to get downvoted to hell for this so I’ll preface this by saying my intent is not to dismiss what happened Monday because it was tragic and scary. How many of you are in positions in your jobs where if this happened to someone that was close to you at work while at work,  your entire team would get to make the choice to not work?  I’m not saying that to be an asshole or to discount what they have been through but if we are saying that they deserve this right, maybe we need to explore our own work cultures because this is certainly isn’t an opportunity that’s afforded to 98% of the workforce.",489.0,nfl,t3_103huxg,False,0.0,:Jaguars: Jaguars,2023-01-04T17:37:02Z,jaguars,0.2262592592592592
13969,108971,108971,Lesbereal476,"Man, that changed quickly after Stidham had a good game.",20.0,nfl,t3_103i8ua,False,0.0,:Jaguars: Jaguars,2023-01-04T17:19:21Z,jaguars,0.4404
13970,108972,108972,Lesbereal476,"I know we are all rooting for DH but we need to take the updates as they come and not overanalyze them. Sometimes we forget this is his medical information and most of us probably don’t want our medical info out there. So when we get good news that they are seeing signs of improvement, we need to stop asking for the evidence, results, etc, give the man/his family privacy and be grateful for his progress. 

Side note: when limited medical info has been provided, these threads have blown up with misinformation so the “vague” updates are probably for the best.",74.0,nfl,t3_103b90y,False,0.0,:Jaguars: Jaguars,2023-01-04T12:48:24Z,jaguars,0.1138015625
13971,108973,108973,Lesbereal476,Great news! Hope he continues to trend upwards!,30.0,nfl,t3_1034vuf,False,0.0,:Jaguars: Jaguars,2023-01-04T08:42:32Z,jaguars,0.411
13972,108974,108974,Lesbereal476,"We don’t know all the logistics of we got to this decision but I’m sure it will all come out in the next couple of days. Right now, I’m just glad the NFL made the right decision in the end and hope that Hamlin is okay.",4.0,nfl,t3_101wcas,False,0.0,:Jaguars: Jaguars,2023-01-02T21:10:36Z,jaguars,0.501575
13973,108975,108975,Lesbereal476,"No one gives a fuck about the Playoff implications of this game right now, Skip. FFS",1.0,nfl,t3_101vqoe,False,0.0,:Jaguars: Jaguars,2023-01-02T20:40:54Z,jaguars,-0.46565
13974,108976,108976,Lesbereal476,"I didn’t even mean football. A talk show, sports center, anything besides making these folks talk about this non stop",1.0,nfl,t3_101tiwi,False,0.0,:Jaguars: Jaguars,2023-01-02T20:29:52Z,jaguars,-0.148
