,Unnamed: 0.1,Unnamed: 0,author,body,score,subreddit,link_id,over_18,controversiality,author_flair_text,created_utc,flair,sentiment
201,967,967,4thTimesAnAlt,And Ari Meirov please. All they do is repackage other peoples' tweets. Like Carlos Mencia or Amy Schumer.,2.0,nfl,t3_103cr20,False,0.0,:Jaguars: Jaguars :Bears: Bears,2023-01-04T13:45:48Z,jaguars,0.1321851851851851
202,969,969,4thTimesAnAlt,"But it was a blown call to rule him down. On a turnover, referees are instructed to let the play finish because they're automatically reviewed. If he gets up, scores, and is then ruled down on review, fine. So to blow the whistle and negate what likely would've been a touchdown is *absolutely* a blown call.",14.0,nfl,t3_1035bc3,False,0.0,:Jaguars: Jaguars :Bears: Bears,2023-01-04T09:22:11Z,jaguars,0.01795625
203,970,970,4thTimesAnAlt,"MYLES. JACK. WASN'T. FUCKING. DOWN.

Also the PI against Bouye late in the 1st half was bullshit. At worst that should've been offsetting since both guys were basically throwing punches",267.0,nfl,t3_1035bc3,False,0.0,:Jaguars: Jaguars :Bears: Bears,2023-01-04T08:52:30Z,jaguars,-0.1012285714285714
204,971,971,4thTimesAnAlt,"Seriously, a Patek Philippe might as well be Unobtanium for 99% of people.",5.0,jaguars,t3_102ucuf,False,0.0,MJCleo Knows All,2023-01-04T08:23:32Z,jaguars,0.1027
205,975,975,4thTimesAnAlt,It's likely just a maintenance day on a short week. I'm not worried about it.,45.0,nfl,t3_102nsg5,False,0.0,:Jaguars: Jaguars :Bears: Bears,2023-01-03T17:57:15Z,jaguars,0.11175
206,980,980,4thTimesAnAlt,"Not impossible, but definitely difficult. But it would make sense to have contingency plans in place in case of natural disaster, terrorist attack, or other unexpected/unforseen issues that could pop up. I'd honestly be more shocked if the NFL *didn't* have an alternative Super Bowl site picked with a crew ready to start work immediately if needed.",6.0,nfl,t3_10286o1,False,0.0,:Jaguars: Jaguars :Bears: Bears,2023-01-03T11:10:54Z,jaguars,0.1276185185185185
207,988,988,4thTimesAnAlt,Thank you for taking him so Urban Meyer couldn't.,3.0,nfl,t3_101trzk,False,0.0,:Jaguars: Jaguars :Bears: Bears,2023-01-02T19:40:43Z,jaguars,0.3612
208,989,989,4thTimesAnAlt,"Seriously, one okay year against a pretty meh conference and the Bears *TRADED UP* for him. Jesus, that was baffling.",93.0,nfl,t3_101trzk,False,0.0,:Jaguars: Jaguars :Bears: Bears,2023-01-02T19:40:19Z,jaguars,0.119175
209,990,990,4thTimesAnAlt,"Remember when Matt Barkley was basically a guaranteed Top 10 pick, then went back to school and completely destroyed his draft stock?",70.0,nfl,t3_101trzk,False,0.0,:Jaguars: Jaguars :Bears: Bears,2023-01-02T19:36:34Z,jaguars,-0.4005
210,994,994,4thTimesAnAlt,"This is bullshit. Gone way too soon. Rest in Peace, Uche",1.0,jaguars,t3_101masn,False,0.0,MJCleo Knows All,2023-01-02T15:32:48Z,jaguars,0.1590666666666666
211,995,995,4thTimesAnAlt,It's bullshit that guys like Uche are gone way too soon. Rest in Peace,22.0,nfl,t3_101n55d,False,0.0,:Jaguars: Jaguars :Bears: Bears,2023-01-02T15:31:49Z,jaguars,0.1916
212,998,998,4thTimesAnAlt,"Mia is saying that she's hearing Green Bay - Detroit for SNF and we'd be the Saturday afternoon game.

Which is fucking horseshit",14.0,jaguars,t3_100yacs,False,0.0,MJCleo Knows All,2023-01-01T18:49:02Z,jaguars,-0.074
213,1016,1016,4thTimesAnAlt,"And let's be honest, Trevor is way fucking better than Daniel Jones",9.0,jaguars,t3_zz31rz,False,0.0,MJCleo Knows All,2022-12-30T13:24:45Z,jaguars,0.7574
214,1017,1017,4thTimesAnAlt,"For those who don't know, when a helicopter goes down in water they have a nasty tendency to flip with the rotors disintegrating and throwing shrapnel everywhere. While this one had an engine failure which probably slowed the rotors a good amount, I'm still surprised it stayed upright enough for people to escape and swim to the surface.",1.0,nfl,t3_zz1noo,False,0.0,:Jaguars: Jaguars :Bears: Bears,2022-12-30T10:28:17Z,jaguars,0.0086499999999999
349,1629,1629,55North,Teal Tops White Pants are still supreme in my heart,1.0,jaguars,t3_101r3al,False,0.0,:Grumpy:,2023-01-03T14:38:59Z,jaguars,0.9022
352,1633,1633,55North,Not Minshews fault; you should have supplied him with more Single Moms,1.0,nfl,t3_100ogza,False,0.0,:Jaguars: Jaguars,2023-01-01T13:41:40Z,jaguars,0.3089
353,1634,1634,55North,"Hey, it's halftime for my game; what the hell is happening here?",0.0,nfl,t3_100ogza,False,0.0,:Jaguars: Jaguars,2023-01-01T13:40:11Z,jaguars,-0.6808
354,1636,1636,55North,"And the titans lost this week... *it's beautiful*

(Hope you win next week)",4.0,nfl,t3_100ogxh,False,0.0,:Jaguars: Jaguars,2023-01-01T13:36:37Z,jaguars,0.8519
355,1637,1637,55North,Idk. That interception still feels like the Jaguars,6.0,nfl,t3_100ogxh,False,0.0,:Jaguars: Jaguars,2023-01-01T13:09:44Z,jaguars,0.154925
356,1638,1638,55North,*clears throat *  DUUUUUVAL,13.0,nfl,t3_100ogxh,False,0.0,:Jaguars: Jaguars,2023-01-01T13:01:48Z,jaguars,0.0772
357,1639,1639,55North,A scape on Trevor's hand... I can feel the beginning of the end,3.0,nfl,t3_100ogxh,False,0.0,:Jaguars: Jaguars,2023-01-01T12:45:32Z,jaguars,0.123475
510,2564,2564,5James5,Waiting for their lawyers to figure out how they can keep the revenue from the ads they sold that haven’t played yet if they cancel the game,13.0,jaguars,t3_101vlmu,False,0.0,:LJ1::LJ2::LJ3::LJ4:,2023-01-02T20:44:30Z,jaguars,0.1027
548,5065,5065,AHashBrown_,First time ever Josh made a play in coverage,3.0,jaguars,t3_100p2qp,False,0.0,:420:,2023-01-01T13:13:51Z,jaguars,0.34
705,6654,6654,AZBiGii,KICK THEIR ASS DEWEY,8.0,jaguars,t3_103nyhz,False,0.0,:WH1::WH2::WH3:,2023-01-04T22:51:40Z,jaguars,-0.5423
706,6655,6655,AZBiGii,I actually like the duo staying in Dallas. Pollard might be better but Zeke has been looking good too from sharing snaps imo,8.0,nfl,t3_1029wxu,False,0.0,:Jaguars: Jaguars,2023-01-03T09:22:46Z,jaguars,0.51985
707,6656,6656,AZBiGii,What a great teammate,102.0,nfl,t3_101xss3,False,0.0,:Jaguars: Jaguars,2023-01-02T22:15:33Z,jaguars,0.6249
708,6658,6658,AZBiGii,I put money down that Dougie P has more influence on the roster than Baalke but at least we don't hate him anymore,2.0,nfl,t3_101ml72,False,0.0,:Jaguars: Jaguars,2023-01-02T14:27:07Z,jaguars,0.612
785,6898,6898,AccountSeventeen,You’re awesome. Seriously.,7.0,nfl,t3_102klm4,False,0.0,:Jaguars: Jaguars :Giants: Giants,2023-01-03T18:03:50Z,jaguars,0.067275
786,6901,6901,AccountSeventeen,Just curious why you don’t wanna use the JTA shuttle?,1.0,jaguars,t3_101l657,False,0.0,:JA41h:,2023-01-02T16:25:05Z,jaguars,0.3182
787,6903,6903,AccountSeventeen,"Better chance people are out doing other stuff on Saturday night.

Sunday at 8 pm, most are home and resting in front of the TV.",7.0,nfl,t3_101nnf7,False,0.0,:Jaguars: Jaguars :Giants: Giants,2023-01-02T15:27:01Z,jaguars,0.14985
1050,7835,7835,AceWolf18,I'd recommend Dicks Sporting Goods in Town Center. They usually have plenty,2.0,jaguars,t3_102i1d8,False,0.0,:JAX47::JAX48: It was always the Jags:JAX47::JAX48:,2023-01-03T14:56:51Z,jaguars,0.0903
1051,7837,7837,AceWolf18,"With the win over Houston, yes",2.0,jaguars,t3_100uccb,False,0.0,:JAX47::JAX48: It was always the Jags:JAX47::JAX48:,2023-01-01T15:50:07Z,jaguars,0.7579
1292,9370,9370,Afghan_Kegstand,Behind enemy lines!,15.0,jaguars,t3_103n2kn,False,0.0,Calvin Ridley :CR4:,2023-01-04T20:41:23Z,jaguars,-0.5848
1293,9371,9371,Afghan_Kegstand,"Local liquor store in the Jax area,  hit me in the Dm if you want to know the exact one but I’m told they are all over the city",1.0,jaguars,t3_103ki87,False,0.0,Calvin Ridley :CR4:,2023-01-04T18:49:03Z,jaguars,0.0387
1294,9373,9373,Afghan_Kegstand,Shoot me a DM,1.0,jaguars,t3_103ki87,False,0.0,Calvin Ridley :CR4:,2023-01-04T18:47:13Z,jaguars,-0.34
1295,9375,9375,Afghan_Kegstand,"*clears search history*

Yeah, what a toolbag!",19.0,jaguars,t3_102ucuf,False,0.0,Calvin Ridley :CR4:,2023-01-04T11:27:23Z,jaguars,0.4199
1296,9376,9376,Afghan_Kegstand,I grabbed one at my local liquor store for display. DM me if you want me to get one for you.,2.0,jaguars,t3_102vch2,False,0.0,Calvin Ridley :CR4:,2023-01-04T11:17:41Z,jaguars,0.0386
1297,9377,9377,Afghan_Kegstand,Is the seating reduction for structure to hold up the “Pringle chip” roof?  Also can’t wait to hear the locals moan about paying for upgrades that every other team has to pay for.,16.0,jaguars,t3_102oryr,False,0.0,Calvin Ridley :CR4:,2023-01-03T18:41:56Z,jaguars,-0.125
1298,9380,9380,Afghan_Kegstand,"I’m always interested in hearing why out of conference teams also hate the Titans, was there something specific that caused it for Buffalo?",2.0,jaguars,t3_101rv3l,False,0.0,Calvin Ridley :CR4:,2023-01-03T16:50:58Z,jaguars,-0.25
1299,9381,9381,Afghan_Kegstand,Never underestimate a team that gets to play spoiler to a hated division rival.,22.0,jaguars,t3_102df2p,False,0.0,Calvin Ridley :CR4:,2023-01-03T12:18:45Z,jaguars,-0.2292
1300,9382,9382,Afghan_Kegstand,"Yeah, I think it mentions that on the page, I’ve never used the service.",1.0,jaguars,t3_102clhr,False,0.0,Calvin Ridley :CR4:,2023-01-03T12:16:45Z,jaguars,0.296
1301,9383,9383,Afghan_Kegstand,"Ahh, ok yeah I see it.  Deceptive graphic lol",13.0,jaguars,t3_102df2p,False,0.0,Calvin Ridley :CR4:,2023-01-03T11:17:27Z,jaguars,0.342425
1302,9384,9384,Afghan_Kegstand,I’d thought we needed a pats loss too?,15.0,jaguars,t3_102df2p,False,0.0,Calvin Ridley :CR4:,2023-01-03T11:13:16Z,jaguars,-0.3182
1303,9386,9386,Afghan_Kegstand,A guy can only dream!  He is entering the “go chase a ring” portion of his career.,3.0,jaguars,t3_102clhr,False,0.0,Calvin Ridley :CR4:,2023-01-03T10:48:23Z,jaguars,0.0791
1304,9387,9387,Afghan_Kegstand,Same.  I’m trying not to burn through all my titans hate in the lead up.,2.0,jaguars,t3_102clhr,False,0.0,Calvin Ridley :CR4:,2023-01-03T10:47:11Z,jaguars,-0.28595
1305,9388,9388,Afghan_Kegstand,"No problem, scream your damn head off! I want this beating to be so bad that Derrick Henry retires in the locker room post game and catches an Uber to Yulee.",11.0,jaguars,t3_102clhr,False,0.0,Calvin Ridley :CR4:,2023-01-03T10:44:54Z,jaguars,-0.3445749999999999
1306,9390,9390,Afghan_Kegstand,It took him about a game and a half to get re-adjusted but he’s been solid since.  We do need a better slot though.,4.0,jaguars,t3_102bjgr,False,0.0,Calvin Ridley :CR4:,2023-01-03T10:12:20Z,jaguars,0.276775
1307,9391,9391,Afghan_Kegstand,"4 division champs, top one gets a bye, the other 3 play a wildcard team so 7 total teams from each conference.",1.0,jaguars,t3_101y9ih,False,0.0,Calvin Ridley :CR4:,2023-01-02T22:51:30Z,jaguars,0.7184
1308,9392,9392,Afghan_Kegstand,Because the bengals clinched the division and aren’t in the wildcard running as a division champ,1.0,jaguars,t3_101y9ih,False,0.0,Calvin Ridley :CR4:,2023-01-02T22:46:30Z,jaguars,0.4767
1309,9393,9393,Afghan_Kegstand,"Buffalo beats New England, NYJ beat Miami, and Cleveland beats Shittsburgh and we get a wildcard even with a loss to the Tits.",1.0,jaguars,t3_101y9ih,False,0.0,Calvin Ridley :CR4:,2023-01-02T22:41:29Z,jaguars,-0.4939
1310,9395,9395,Afghan_Kegstand,The Bengals fans cheering the Bills team walking into the tunnel was fucking classy.,54.0,jaguars,t3_101vlmu,False,0.0,Calvin Ridley :CR4:,2023-01-02T20:35:37Z,jaguars,0.7574
1311,9397,9397,Afghan_Kegstand,"Be cool guys, as long as MJD picks the Titans we’ll be fine.",80.0,jaguars,t3_101u0ar,False,0.0,Calvin Ridley :CR4:,2023-01-02T20:06:19Z,jaguars,0.4767
1312,9398,9398,Afghan_Kegstand,"Exactly why the packers game seemed perfect for Saturday, they can both play with playoffs in the balance before the games sunday.",10.0,jaguars,t3_101t87p,False,0.0,Calvin Ridley :CR4:,2023-01-02T19:38:55Z,jaguars,0.7269
1313,9399,9399,Afghan_Kegstand,"It is, but in the grand scheme of things, it goes Monday night, Sunday night, Thursday night/Saturday night.





London games.",20.0,jaguars,t3_101t87p,False,0.0,Calvin Ridley :CR4:,2023-01-02T19:36:48Z,jaguars,0.1531
1314,9400,9400,Afghan_Kegstand,"Ahh, we’ll I’ll be your closed caption “I don’t know how you can be a Jaguars fan and not hate the Tennessee Titans, I mean HATE them…”",9.0,jaguars,t3_101rv3l,False,0.0,Calvin Ridley :CR4:,2023-01-02T18:17:43Z,jaguars,-0.0348
1315,9401,9401,Afghan_Kegstand,"Naw, looks like he’s a regular here.",0.0,jaguars,t3_101rv3l,False,0.0,Calvin Ridley :CR4:,2023-01-02T18:08:20Z,jaguars,0.3612
1316,9403,9403,Afghan_Kegstand,"Yeah, agree but does that instantly evaporate as soon as Lamar gets back out there?  I feel like they’ll use week 17 as a tune up and be rolling heading into the wildcards",2.0,jaguars,t3_101jcob,False,0.0,Calvin Ridley :CR4:,2023-01-02T13:39:47Z,jaguars,0.262875
1317,9404,9404,Afghan_Kegstand,Cheers to that!,5.0,jaguars,t3_101jqyv,False,0.0,Calvin Ridley :CR4:,2023-01-02T12:50:50Z,jaguars,0.5255
1318,9405,9405,Afghan_Kegstand,"No context, this sentence still sounds like it’s from Duval.",37.0,jaguars,t3_101jqyv,False,0.0,Calvin Ridley :CR4:,2023-01-02T12:41:45Z,jaguars,0.1531
1319,9406,9406,Afghan_Kegstand,"If we get a lame Lamar, 100% agree.",3.0,jaguars,t3_101jcob,False,0.0,Calvin Ridley :CR4:,2023-01-02T12:38:59Z,jaguars,-0.0772
1320,9407,9407,Afghan_Kegstand,What would be everyone’s preference of wildcard matchup?  I lean toward the Chargers but I’ll be honest that I havnt watched a ton of their recent games.,11.0,jaguars,t3_101jcob,False,0.0,Calvin Ridley :CR4:,2023-01-02T12:30:10Z,jaguars,0.3326
1321,9411,9411,Afghan_Kegstand,Gonna run some sort of reverse wildcat with 2 QB’s lol,7.0,jaguars,t3_101ftl0,False,0.0,Calvin Ridley :CR4:,2023-01-02T10:36:01Z,jaguars,0.4215
1322,9412,9412,Afghan_Kegstand,"The team facilities are going to be very nice, but man do we need to renovate the entire area around the stadium.",21.0,jaguars,t3_101cyfw,False,0.0,Calvin Ridley :CR4:,2023-01-02T08:54:17Z,jaguars,0.2609
1323,9413,9413,Afghan_Kegstand,What the fuck was that?,2.0,nfl,t3_100yos5,False,0.0,:Jaguars: Jaguars,2023-01-02T01:19:57Z,jaguars,-0.5423
1324,9415,9415,Afghan_Kegstand,"Middle market 3 year extension, gives him another shot at a big pay day.",25.0,jaguars,t3_100vn1f,False,0.0,Calvin Ridley :CR4:,2023-01-01T16:48:03Z,jaguars,-0.1027
1325,9417,9417,Afghan_Kegstand,That was the sketchiest weirdly close blowout I’ve ever watched.,-18.0,jaguars,t3_100tff2,False,0.0,Calvin Ridley :CR4:,2023-01-01T15:19:12Z,jaguars,-0.296
1326,9418,9418,Afghan_Kegstand,Bonus points for borderline cross-dressing in the state of Texas.,20.0,jaguars,t3_100tb0h,False,0.0,Calvin Ridley :CR4:,2023-01-01T15:03:34Z,jaguars,0.5423
1327,9419,9419,Afghan_Kegstand,Engram got that dog in him!  We better resign him.,4.0,jaguars,t3_100p2qp,False,0.0,Calvin Ridley :CR4:,2023-01-01T13:46:17Z,jaguars,0.064
1328,9420,9420,Afghan_Kegstand,"No as in you think he sends Trevor back out, or no you don’t think CJ is the second best?",1.0,jaguars,t3_100p2qp,False,0.0,Calvin Ridley :CR4:,2023-01-01T13:32:32Z,jaguars,0.2023
1329,9421,9421,Afghan_Kegstand,"Alright Doug, time to show everybody that we also have the 2nd best QB in the division in CJ!",6.0,jaguars,t3_100p2qp,False,0.0,Calvin Ridley :CR4:,2023-01-01T13:30:29Z,jaguars,0.7574
1330,9422,9422,Afghan_Kegstand,It’s a serious red flag lately if Pete Carole is willing to let you go in FA or via a trade.,2.0,jaguars,t3_zzy0m1,False,0.0,Calvin Ridley :CR4:,2023-01-01T07:53:49Z,jaguars,-0.0772
1331,9427,9427,Afghan_Kegstand,Well played!,2.0,jaguars,t3_zz1t6h,False,0.0,Calvin Ridley :CR4:,2022-12-30T16:39:03Z,jaguars,0.5848
1332,9428,9428,Afghan_Kegstand,"Designs plays, helps formulate the game plan, hands on with the offense, takes over play calling if needed, provided the eye in the sky view, assistant *to* the regional manager.",1.0,jaguars,t3_zz9j0l,False,0.0,Calvin Ridley :CR4:,2022-12-30T14:08:09Z,jaguars,0.6124
1333,9429,9429,Afghan_Kegstand,I intentionally left out press for his lack of dirty nickname.,7.0,jaguars,t3_zz1t6h,False,0.0,Calvin Ridley :CR4:,2022-12-30T13:45:51Z,jaguars,-0.6369
1334,9430,9430,Afghan_Kegstand,I like that our guy gets a little more fierce when we win.,32.0,jaguars,t3_zz9fkq,False,0.0,Calvin Ridley :CR4:,2022-12-30T13:41:09Z,jaguars,0.743
1335,9431,9431,Afghan_Kegstand,Very true lol,2.0,jaguars,t3_zz4tjd,False,0.0,Calvin Ridley :CR4:,2022-12-30T11:48:26Z,jaguars,0.7328
1336,9432,9432,Afghan_Kegstand,"Yeah, it can get splotchy though and look worse.  I did it with my jeep fender flares lol",3.0,jaguars,t3_zz4tjd,False,0.0,Calvin Ridley :CR4:,2022-12-30T11:16:37Z,jaguars,0.154175
1337,9433,9433,Afghan_Kegstand,That’s the magic trick that will make me take the clown mask off.,19.0,jaguars,t3_zz31rz,False,0.0,Calvin Ridley :CR4:,2022-12-30T11:14:51Z,jaguars,-0.0516
1338,9436,9436,Afghan_Kegstand,"They were given the option to buy up to 8.  So yeah, probably some speculative buys, should probably wait until the matchup is set though to really cash in.",4.0,jaguars,t3_zz4tjd,False,0.0,Calvin Ridley :CR4:,2022-12-30T10:45:05Z,jaguars,0.21955
1339,9437,9437,Afghan_Kegstand,"Given the extra time, I’m confident that DP-Cooter will have Trevor ready.",29.0,jaguars,t3_zz1t6h,False,0.0,Calvin Ridley :CR4:,2022-12-30T08:29:44Z,jaguars,0.6908
1340,9438,9438,Afghan_Kegstand,We are used to having late season games be important.  Just not important to us specifically.  Like when we knocked the Colts out the last week.,41.0,jaguars,t3_zyyuie,False,0.0,Calvin Ridley :CR4:,2022-12-30T08:08:28Z,jaguars,0.1111037037037037
1561,10603,10603,Alldemjimmies,"I still think he will be in Carolina with Jim Harbaugh

Edit: Wrong Harbaugh.",1.0,nfl,t3_103ggx5,False,0.0,:Jaguars: Jaguars,2023-01-04T17:45:49Z,jaguars,-0.4767
1562,10606,10606,Alldemjimmies,"I watched his god damn movies. Like, old Nic Cage - legit. But he kept existing and making shitty movies in wigs. Fuck him.",1.0,jaguars,t3_101jqyv,False,0.0,Mark Brunell :MarkBrunell:,2023-01-02T19:10:50Z,jaguars,-0.174879296875
1563,10608,10608,Alldemjimmies,Ah yes the weird brother of the Watt family - to the same style of Cooper Manning,2.0,nfl,t3_101pb3n,False,0.0,:Jaguars: Jaguars,2023-01-02T18:37:39Z,jaguars,0.25
1564,10609,10609,Alldemjimmies,I love this team. I love these guys. I love Doug. What a time to be a Jags fan!,14.0,jaguars,t3_10180zo,False,0.0,Mark Brunell :MarkBrunell:,2023-01-02T04:10:09Z,jaguars,0.147295703125
1994,13502,13502,AnchorsAweigh89,I’ve been a fan as a long as I can remember. My grandad grew up a fan of the Tampa Bay Bucs until the Jaguars started as a franchise. I grew up in Daytona Beach and my grandad started following the Jags when they formed. My grandad took me to the Jags inaugural game and first ever home game against the Houston Oilers. I stayed a fan ever since.,1.0,jaguars,t3_1035xms,False,0.0,:WH1::WH2::WH3:,2023-01-04T09:59:59Z,jaguars,0.064250944
1997,13505,13505,AnchorsAweigh89,"Prayers for Hamlin. Life is fragile, it’s a gift we need to treasure. Remind your loved ones how much they mean to you bros.",7.0,nfl,t3_102a9j5,False,0.0,:Jaguars: Jaguars,2023-01-03T10:36:54Z,jaguars,0.2692333333333334
1998,13506,13506,AnchorsAweigh89,"Ehh if the Packers were Saturday and they won it would still screw Seattle, that would make their game meaningless in that scenario.",3.0,jaguars,t3_101t87p,False,0.0,:WH1::WH2::WH3:,2023-01-02T19:43:31Z,jaguars,0.1027
1999,13507,13507,AnchorsAweigh89,"I’m more bugged that the NFL went with the ratings grab of Aaron Rogers in a do or die game over fairness. Packers/Lions and Seahawks/Rams should happen at the same time given the scenarios between them. I’m not surprised they did, but it’s still lame.",10.0,jaguars,t3_101t87p,False,0.0,:WH1::WH2::WH3:,2023-01-02T19:35:20Z,jaguars,-0.2277333333333333
2000,13508,13508,AnchorsAweigh89,"Pass rush getting heat is good, I’m not sure how strong the olines of the Jets and Texans are but the Tits oline right now is… not good. The boys should be able to feast on them!",13.0,jaguars,t3_101tg1z,False,0.0,:WH1::WH2::WH3:,2023-01-02T19:12:40Z,jaguars,-0.17605
2001,13509,13509,AnchorsAweigh89,"It’s fine, most of the starters only played a little over a half. If they come out and play the way they are capable of they will take care of business.",18.0,jaguars,t3_101sbdf,False,0.0,:WH1::WH2::WH3:,2023-01-02T18:22:12Z,jaguars,0.524475
2002,13510,13510,AnchorsAweigh89,Oooh we gonna fuck the Tits at the Bank,36.0,jaguars,t3_101jqyv,False,0.0,:WH1::WH2::WH3:,2023-01-02T12:34:32Z,jaguars,-0.6597
2003,13511,13511,AnchorsAweigh89,"Back home after a nice trip to the Smoky mountains in Noooooorth Caroliiiiiina, back to work tomorrow boooo. Buuut looking forward to being at the Bank Saturday night to yell at the Tits!!",3.0,nfl,t3_101em0x,False,0.0,:Jaguars: Jaguars,2023-01-02T11:31:08Z,jaguars,-0.0170777777777777
2004,13512,13512,AnchorsAweigh89,"It was fine. Not great, but they made the plays they needed to and controlled the game. Second half was vanilla as you would figure with most of the starters out. I’d rather have a game like this now that Dougie P can pick on and make improvements from than have it happen this Saturday against the Tits so I’m very good with it.",2.0,jaguars,t3_101exvn,False,0.0,:WH1::WH2::WH3:,2023-01-02T11:14:42Z,jaguars,0.189058984375
2005,13513,13513,AnchorsAweigh89,"Until the defense makes adjustments to it. Streveler is limited in what he can do, we were already starting to key off on it when he needed to make more throws. Willis is similar in that regard if they bring him in to change up on us. And we have some tape on him compared to none with Strev.",4.0,jaguars,t3_101ftl0,False,0.0,:WH1::WH2::WH3:,2023-01-02T10:10:34Z,jaguars,-0.0030359375
2006,13516,13516,AnchorsAweigh89,"Nice game today, and it was a coach’s dream. Jags took care of business and were solid all around, though there were some lapses and things to clean up. Resting a bunch of starters in the 2nd half was a great bonus. Good game but not their best, which is promising since they handled things with ease yet you can see they can still hit the burners and hit another level for next week against the Tits.",8.0,jaguars,t3_100sw1k,False,0.0,:WH1::WH2::WH3:,2023-01-01T16:47:27Z,jaguars,0.119012109375
2007,13517,13517,AnchorsAweigh89,Tits would win via division record tie breaker since they would both be 8-9 and 1-1 head to head. Tits would edge us out 4-2 vs 3-3 in the division if they win next week.,4.0,jaguars,t3_100sw1k,False,0.0,:WH1::WH2::WH3:,2023-01-01T16:44:08Z,jaguars,0.3303
2008,13518,13518,AnchorsAweigh89,We shall praise in the House of HIM,6.0,jaguars,t3_100ompl,False,0.0,:WH1::WH2::WH3:,2023-01-01T12:37:11Z,jaguars,0.5574
2009,13519,13519,AnchorsAweigh89,Why yes I am hungover thank you very much. DuUuval.,5.0,jaguars,t3_100l644,False,0.0,:WH1::WH2::WH3:,2023-01-01T09:34:18Z,jaguars,0.159225
2010,13524,13524,AnchorsAweigh89,I prefer to think of it like Yu-Gi-Oh. We sacrificed Urban in order to summon a more powerful version of HIM.,4.0,jaguars,t3_zzljcw,False,0.0,:WH1::WH2::WH3:,2022-12-31T15:19:19Z,jaguars,0.328
2091,13647,13647,AnesthesiaOnTheSide,"Not sure, but they were johnny on the spot. They absolutely saved his life.",1.0,nfl,t3_101vg1n,False,0.0,:Jaguars: Jaguars,2023-01-02T20:36:02Z,jaguars,0.2069
2092,13648,13648,AnesthesiaOnTheSide,That’s my guess from the replay. It looks like he took a shot to the chest. Maybe [commotio cordis](https://www.ahajournals.org/doi/full/10.1161/circep.111.962712).,2.0,nfl,t3_101uur1,False,0.0,:Jaguars: Jaguars,2023-01-02T20:16:32Z,jaguars,0.0401333333333333
2093,13650,13650,AnesthesiaOnTheSide,Love this sub.,2.0,jaguars,t3_100p2qp,False,0.0,Stoner Jag :420:,2023-01-01T12:23:44Z,jaguars,0.6369
2240,14721,14721,Atom800,I think teal pants white jersey is usually last in the ones I’ve seen. Maybe just wishful thinking because I love real on white and don’t like teal on black very much,1.0,jaguars,t3_101r3al,False,0.0,Fred Taylor :28b:,2023-01-03T08:52:07Z,jaguars,0.38585
2241,14727,14727,Atom800,The way Telvin loved football would make you think it had been around for less than 18 years.,6.0,jaguars,t3_1012iyy,False,0.0,Fred Taylor :28b:,2023-01-02T08:21:48Z,jaguars,0.5994
2242,14732,14732,Atom800,"Yeah, it would be correct to say week 18 will almost certainly will decide if the Jags go to the playoffs (tiny chance at wildcard) but week 18 will definitely decide the division.",8.0,nfl,t3_100kz42,False,0.0,:Jaguars: Jaguars,2023-01-01T09:29:05Z,jaguars,0.7354
2243,14734,14734,Atom800,I wasn’t opposed to Byron but I wanted Doug the last 2 years. Glad it finally worked out,10.0,jaguars,t3_1000z43,False,0.0,Fred Taylor :28b:,2022-12-31T16:33:56Z,jaguars,0.2294
2244,14739,14739,Atom800,Tom Brady has ended every playoff appearance by the Jags since he joined the league. The only way he can do it this year is the Super Bowl.,8.0,nfl,t3_zzez2s,False,0.0,:Jaguars: Jaguars,2022-12-31T02:44:28Z,jaguars,0.2997
2245,14742,14742,Atom800,Doesn’t matter how great he’s looked if he’s not available.,5.0,jaguars,t3_zz97zy,False,0.0,Fred Taylor :28b:,2022-12-30T16:42:20Z,jaguars,0.6369
2365,15836,15836,BalkyFromMeepos,Is Cam Robinson missing from the photo?,1.0,jaguars,t3_102ucuf,False,0.0,Bold City Brigade :BoldCity:,2023-01-04T10:01:34Z,jaguars,-0.296
2366,15837,15837,BalkyFromMeepos,I didn't know Rex Ryan had family who played for the Jags.,14.0,jaguars,t3_1035xms,False,0.0,Bold City Brigade :BoldCity:,2023-01-04T09:54:53Z,jaguars,0.34
2367,15838,15838,BalkyFromMeepos,Please upvote this comment. Uche was such a good dude and contributor to the Jags organization.,20.0,jaguars,t3_1027lpe,False,0.0,Bold City Brigade :BoldCity:,2023-01-03T10:02:55Z,jaguars,0.29975
2546,21696,21696,BillllyOcean,"Lost my first set of seats right on the 50 in the 400s because Chase decided now was a good time for fraud protection. Managed to get tickets one section over, but I’m stoked! Lfg!!",6.0,jaguars,t3_zyzyua,False,0.0,:LJ1::LJ2::LJ3::LJ4:,2022-12-30T09:25:10Z,jaguars,-0.001929296875
