,Unnamed: 0.1,Unnamed: 0,author,body,score,subreddit,link_id,over_18,controversiality,author_flair_text,created_utc,flair,sentiment
21231,151246,151246,TFlo904,"I did a bit of digging last night about why things went so bad in San Fran and it was a combo of his picks not hitting and Jim being someone that's difficult to be around for extended periods of times. It seems from these last couple of drafts that Baalke's avoided some of his previous mistakes and that Doug is right Coach for us. Only time will tell the full story but as it stands, this franchise is pointed up and as long as we have Trevor, we have a chance",3.0,jaguars,t3_101luev,False,0.0,:CJ1::CJ2::CJ3:,2023-01-02T15:34:16Z,jaguars,0.0245407407407407
21232,151247,151247,TFlo904,he probably doesn't want to keep getting those questions throughout the week,1.0,jaguars,t3_101j6bi,False,0.0,:CJ1::CJ2::CJ3:,2023-01-02T15:29:33Z,jaguars,-0.0572
21233,151248,151248,TFlo904,Seattle loss to Rams makes a Lions win to get in.,4.0,nfl,t3_101nnf7,False,0.0,:Jaguars: Jaguars,2023-01-02T15:26:08Z,jaguars,0.3612
21234,151250,151250,TFlo904,You don't want a cake walk into the playoffs and the level of competition is above what you've been playing.,1.0,nfl,t3_1013712,False,0.0,:Jaguars: Jaguars,2023-01-02T14:38:19Z,jaguars,0.1476
21235,151251,151251,TFlo904,"""You play to win the game.""",2.0,jaguars,t3_10150na,False,0.0,:CJ1::CJ2::CJ3:,2023-01-02T14:25:17Z,jaguars,0.7351
21236,151253,151253,TFlo904,The steeler's games have been fun to watch for the fourth quarter alone these last 3 weeks.,6.0,nfl,t3_10156ji,False,0.0,:Jaguars: Jaguars,2023-01-02T07:06:50Z,jaguars,0.3182
21237,151255,151255,TFlo904,"more like Major Dud, or turdy, or fugly",1.0,nfl,t3_100r8fs,False,0.0,:Jaguars: Jaguars,2023-01-02T03:58:13Z,jaguars,0.0609
21238,151256,151256,TFlo904,"woah ho ho, dipshit 2 flair 2 furious",8.0,nfl,t3_100s3o4,False,0.0,:Jaguars: Jaguars,2023-01-02T02:56:36Z,jaguars,-0.7783
21239,151258,151258,TFlo904,I think you continue to let things run their course as we're building something positive here,2.0,jaguars,t3_1011cyg,False,0.0,:CJ1::CJ2::CJ3:,2023-01-01T23:10:28Z,jaguars,0.5574
21240,151260,151260,TFlo904,😂,1.0,nfl,t3_1013712,False,0.0,:Jaguars: Jaguars,2023-01-01T23:06:31Z,jaguars,0.4404
21241,151261,151261,TFlo904,That part is true too lol,0.0,nfl,t3_1013712,False,0.0,:Jaguars: Jaguars,2023-01-01T23:05:54Z,jaguars,0.6808
21242,151262,151262,TFlo904,It would be bittersweet but it'll make them so hungry and dangerous next season. Lions V Jags Superbowl 2024,5.0,nfl,t3_1013712,False,0.0,:Jaguars: Jaguars,2023-01-01T23:05:06Z,jaguars,-0.172575
21243,151264,151264,TFlo904,Maybe not fun for you titans fans. I hope y'all get healthy next season and the Texans get a QB and make the afcs a top division and one that when it's all said and done just make those games feel like a rivalry again,15.0,nfl,t3_1013712,False,0.0,:Jaguars: Jaguars,2023-01-01T22:56:49Z,jaguars,0.3174249999999999
21244,151265,151265,TFlo904,The jag hate is real. We're used to it though and people will have to pay attention to us now. Hopefully week 18 is a super fun game and that the jags finish with a 9 game win streak to end the season,58.0,nfl,t3_1013712,False,0.0,:Jaguars: Jaguars,2023-01-01T22:50:10Z,jaguars,0.2769740740740741
21245,151266,151266,TFlo904,"Yes our D is for real. We played Justin Herbert, Derek Carr, Patrick Mahomes, Dak Prescott, Lamar Jackson, Jalen Hurts, Daniel Jones, Russ Wilson, Matt Ryan, Jared Goff",9.0,jaguars,t3_1011j7h,False,0.0,:CJ1::CJ2::CJ3:,2023-01-01T22:46:39Z,jaguars,0.0115249999999999
21246,151269,151269,TFlo904,It's going to be hilarious when Detroit beats Green Bay and neither team make the playoffs,91.0,jaguars,t3_10136ou,False,0.0,:CJ1::CJ2::CJ3:,2023-01-01T22:38:23Z,jaguars,0.4019
21247,151270,151270,TFlo904,Gonna be hilarious when Detroit and Green Bay is Sunday night and Detroit wins and clinches the playoffs for the Seahawks.,175.0,nfl,t3_1013712,False,0.0,:Jaguars: Jaguars,2023-01-01T22:31:08Z,jaguars,0.7506
21248,151273,151273,TFlo904,lose to the titans but that's not likely,1.0,jaguars,t3_100sw1k,False,0.0,:CJ1::CJ2::CJ3:,2023-01-01T15:04:10Z,jaguars,-0.2144
21249,151274,151274,TFlo904,"also one of the 4 defenses this year to pitch a shut out (24-0 against colts)

Jags defense stat wise looks middling but they play very well. They had the one 40 burger, and only allowed 30+ points 2 other times. It's a lot better defense then they are given credit for",3.0,jaguars,t3_100sw1k,False,0.0,:CJ1::CJ2::CJ3:,2023-01-01T15:03:27Z,jaguars,0.2703333333333333
21250,151275,151275,TFlo904,"2:40 left in the 4th, at the time I started writing this, meaning this popped up with like 6 or more minutes left in the game, is this the earlies post game thread where we win?",6.0,jaguars,t3_100sw1k,False,0.0,:CJ1::CJ2::CJ3:,2023-01-01T14:47:38Z,jaguars,0.743
21251,151277,151277,TFlo904,"nope, that's old jags, new jags win by 30",3.0,nfl,t3_100qk98,False,0.0,:Jaguars: Jaguars,2023-01-01T13:07:32Z,jaguars,0.5859
21252,151280,151280,TFlo904,it means the difference between a winning and losing season. It means everything when Trevor is 0-3 against them. And that we haven't beat them since 2017,3.0,jaguars,t3_100l644,False,0.0,:CJ1::CJ2::CJ3:,2023-01-01T12:31:36Z,jaguars,0.0074925925925925
21253,151283,151283,TFlo904,I have believed since the beginning of the season that the jags could get 9-10 wins. During the 5 game losing streak I waivered a bit thinking maybe 7 but anyway I believe in victory ✌️,1.0,nfl,t3_1000imb,False,0.0,:Jaguars: Jaguars,2022-12-31T15:38:24Z,jaguars,0.0418249999999999
21254,151291,151291,TFlo904,"I throw on the Rich Eisen Roku channel when I need something background to kille time before work. My favorite Episodes are when Suzy fills in lol, Rich is awesome too",1.0,nfl,t3_zyvyxg,False,0.0,:Jaguars: Jaguars,2022-12-31T03:06:54Z,jaguars,0.60235
21255,151292,151292,TFlo904,"I fucking hate Mark Schlereth. Dude still hates the jags and talks shit about them every time he calls one of their games. And if you don't know, Mark was on the 96 broncos team that the jags beat in the divisional round",41.0,nfl,t3_zzjqeu,False,0.0,:Jaguars: Jaguars,2022-12-30T21:48:38Z,jaguars,-0.1068592592592592
21256,151295,151295,TFlo904,"Last place team in the entire NFL with a shot to win the division (I believe they will) and if he gets a playoff win, how does he not get coty? Eagles HC Sirianni has an argument with having the best team record and making a Superbowl run but there's still time.",1.0,jaguars,t3_zysnjl,False,0.0,:CJ1::CJ2::CJ3:,2022-12-30T15:50:23Z,jaguars,0.312825
21257,151296,151296,TFlo904,"Lawrence, then the rest

But the other 9 qbs I see being great the next decade: Burrow, Mahomes, Allen, Jackson, Herbert, Hurts, Purdy, Goff, Prescott",1.0,nfl,t3_zzbb06,False,0.0,:Jaguars: Jaguars,2022-12-30T15:19:46Z,jaguars,0.3612
21258,151297,151297,TFlo904,"It was 98. 97 we were one and done with the broncos still being mad about the year before. They also painted the end zone black for the patriots game as the day before that game was a college bowl game.

https://www.youtube.com/watch?v=l06VrRS5RV8&ab\_channel=BartSimpson",6.0,nfl,t3_zyhbgd,False,0.0,:Jaguars: Jaguars,2022-12-30T05:24:15Z,jaguars,-0.0077171875
21259,151298,151298,TFlo904,I was kind of hoping the NFC playoffs would shake out with a Cowboys V Eagles game where a healthy Dak plays and a healthy Jalen plays.,1.0,nfl,t3_zyi1df,False,0.0,:Jaguars: Jaguars,2022-12-30T04:33:16Z,jaguars,0.5823
21260,151300,151300,TFlo904,"As a dude with long hair, I think Trevor's hair is fine and I hope he ignores all those Delilahs telling Samson to cut his hair. It always seems like it's some short haired or bald dude ragging on his hair. They're all jealous and insecure.",2.0,jaguars,t3_zyimsf,False,0.0,:CJ1::CJ2::CJ3:,2022-12-30T00:23:46Z,jaguars,-0.1885592592592593
21638,160853,160853,The_Brodhisattva,I literally have it on on my phone with an airpod in lmao it's a struggle but I'm getting paid double time to watch the Texans eat shit so ¯\_(ツ)_/¯,1.0,jaguars,t3_100p2qp,False,0.0,WE ARE SO GREAT,2023-01-01T13:23:56Z,jaguars,-0.6249
21639,160854,160854,The_Brodhisattva,Say no more fam. I'm at work but I'll put him on tonight!,1.0,jaguars,t3_100p2qp,False,0.0,WE ARE SO GREAT,2023-01-01T13:22:06Z,jaguars,-0.074
22320,164093,164093,Tmac719,oh we aint losing on Saturday.  it'll be 9-8.,16.0,nfl,t3_102rwv3,False,0.0,:Jaguars: Jaguars,2023-01-03T21:21:09Z,jaguars,0.0731
22321,164094,164094,Tmac719,"Shanahan would be another great choice as well.  and honestly they all would, I of course have a bit of bias being a Jags fan.  But I'm not going to feel robbed by any means if he doesn't get it.

I was just shocked to see the odds that high.  and again, this all comes down to IF we beat the Titans on Saturday.",8.0,nfl,t3_102rwv3,False,0.0,:Jaguars: Jaguars,2023-01-03T21:17:17Z,jaguars,-0.0115337279999999
22322,164095,164095,Tmac719,lol,20.0,nfl,t3_102rwv3,False,0.0,:Jaguars: Jaguars,2023-01-03T20:59:29Z,jaguars,0.4215
22323,164097,164097,Tmac719,Thanks!,2.0,jaguars,t3_10283ck,False,0.0,:JAX0:,2023-01-03T11:01:36Z,jaguars,0.4926
22324,164099,164099,Tmac719,I dont think he gets it either as no one in the national spotlight cares about us but the improvement year over year is far beyond the improvement of the other teams,4.0,jaguars,t3_10283ck,False,0.0,:JAX0:,2023-01-03T08:10:03Z,jaguars,0.8555
22325,164100,164100,Tmac719,"ahhh you're right...and I even double checked that and still missed it.  they did win it back to back then.

&#x200B;

and you're right.  it's also part popularity contest and I get that, they'll give it to someone else and all of these guys on the list have done a great job but even from as non-biased of an opinion I can have, I don't see how you look at the numbers and not say its Doug Pederson",2.0,jaguars,t3_10283ck,False,0.0,:JAX0:,2023-01-03T08:08:56Z,jaguars,0.1473484375
22326,164101,164101,Tmac719,Lmao I love it,1.0,jaguars,t3_100p2qp,False,0.0,:JAX0:,2023-01-01T13:04:49Z,jaguars,0.8442
22327,164103,164103,Tmac719,Yeah sorry dawg I'm just tired.  Pretty sure I was still drunk walking my dog this morning,2.0,jaguars,t3_100l644,False,0.0,:JAX0:,2023-01-01T11:49:32Z,jaguars,0.17585
22480,167114,167114,TrevorIsTheGOAT,"That's the point dude. They're being forced to talk about football.

Edit: his first comment originally said ""fuck these guys nobody cares about their feelings right now"" before he edited it",4.0,nfl,t3_101vfjs,False,0.0,:Jaguars: Jaguars,2023-01-02T20:33:26Z,jaguars,-0.0936444444444444
22481,167115,167115,TrevorIsTheGOAT,"I mean, how would you like to be forced to talk to a national audience about football right now?

Edit: his comment originally said ""fuck these guys nobody cares about their feelings right now"", then he edited it like a bitch",18.0,nfl,t3_101vfjs,False,0.0,:Jaguars: Jaguars,2023-01-02T20:25:49Z,jaguars,-0.24275
22482,167116,167116,TrevorIsTheGOAT,"I'm not saying it would explain a loss, just that it's bullshit on principle.

If we lose it's because we choked.",4.0,nfl,t3_101oibn,False,0.0,:Jaguars: Jaguars,2023-01-02T16:27:19Z,jaguars,-0.531875
22483,167118,167118,TrevorIsTheGOAT,Us losing a day of rest while the Titans are coming off Thursday Night Football is bullshit,14.0,nfl,t3_101oibn,False,0.0,:Jaguars: Jaguars,2023-01-02T16:15:48Z,jaguars,-0.7506
22484,167120,167120,TrevorIsTheGOAT,Tell that to the Jets fans when Frank Gore got the 1st down lol,15.0,nfl,t3_100qgbx,False,0.0,:Jaguars: Jaguars,2023-01-01T13:05:30Z,jaguars,0.4215
22485,167121,167121,TrevorIsTheGOAT,Holy fuck can ETN go a single game without losing grip of the ball?,7.0,jaguars,t3_100p2qp,False,0.0,:TL16:,2023-01-01T12:28:39Z,jaguars,-0.3217
22486,167122,167122,TrevorIsTheGOAT,Idk what you mean I'm already erect for Frank Gore,14.0,jaguars,t3_zzfxl6,False,0.0,:TL16:,2022-12-30T22:02:16Z,jaguars,-0.1027
22866,169319,169319,Tuxedo38,We are very streaky in creating turnovers though and we’ve forced nine in our four game win streak.,2.0,nfl,t3_101gnre,False,0.0,:Jaguars: Jaguars,2023-01-02T10:57:42Z,jaguars,0.5046
23493,170988,170988,UnhingedCorgi,"Yea my guess is they rule the Bills/Bengals as no contest. Trying to cram it in topples too many other dominoes. Some teams will lose the opportunity to advance their seeding, but that seems like the least worst option at this point.",17.0,nfl,t3_102to5a,False,0.0,:Jaguars: Jaguars,2023-01-03T22:51:44Z,jaguars,0.2653703703703703
23494,170991,170991,UnhingedCorgi,"And they probably overheard it all:

“There’s no pulse”, “starting compressions”, “cut through the jersey and pads”, “get the AED”... I’m not sure if EMT’s use the robot voice AED that says “shock advised…administering shock, please stand clear…BZZZT” or if they have a different type, but either way I bet they heard the command to zap and they heard the zap. 

I’d need some time to process what the fuck just happened",12.0,nfl,t3_102r95u,False,0.0,:Jaguars: Jaguars,2023-01-03T21:03:58Z,jaguars,-0.346875
23495,170994,170994,UnhingedCorgi,So could we have him by the Super Bowl?,3.0,jaguars,t3_102hu96,False,0.0,Bortles 2020 :2020:,2023-01-03T18:35:33Z,jaguars,0.5994
23496,170999,170999,UnhingedCorgi,"Probably easier than trying to find last minute hotels for everyone. And after something like this happens, there’s no place like home. Good on the Bills sending everyone home instead of waiting around in limbo in a Cincy hotel.",30.0,nfl,t3_101xhdl,False,0.0,:Jaguars: Jaguars,2023-01-02T22:04:57Z,jaguars,0.1396666666666667
23497,171002,171002,UnhingedCorgi,Wouldn’t Saturday night be just as big of a spotlight? Maybe bigger since there’s no work the next day and no full slate of games prior.,17.0,jaguars,t3_101t87p,False,0.0,Bortles 2020 :2020:,2023-01-02T19:17:27Z,jaguars,-0.26335
23498,171003,171003,UnhingedCorgi,Stripes would help us not look like a Pilates class,3.0,jaguars,t3_101r3al,False,0.0,Bortles 2020 :2020:,2023-01-02T18:02:06Z,jaguars,0.1506
23499,171004,171004,UnhingedCorgi,All teal makes us look like gymnasts. Teal/white is superior. Teal/black also good. Does anyone even care about socks?,29.0,jaguars,t3_101r3al,False,0.0,Bortles 2020 :2020:,2023-01-02T17:48:58Z,jaguars,0.160884375
23500,171008,171008,UnhingedCorgi,I agree. Celebrating when you injure someone is over the line. It suggests you have a desire to injure people.,50.0,nfl,t3_101jg9z,False,0.0,:Jaguars: Jaguars,2023-01-02T13:09:49Z,jaguars,0.2108888888888888
23501,171029,171029,UnhingedCorgi,I think he’s earned it too. He’s picked up and drafted some great contributors. To include Doug.,19.0,jaguars,t3_1011cyg,False,0.0,Bortles 2020 :2020:,2023-01-01T23:32:28Z,jaguars,0.0694333333333333
23502,171031,171031,UnhingedCorgi,That and maybe their crew has no idea who any of our players are. NBC might not even have any jags graphics made. They may not even know we exist.,206.0,nfl,t3_1013712,False,0.0,:Jaguars: Jaguars,2023-01-01T23:04:26Z,jaguars,-0.0109629629629629
23503,171032,171032,UnhingedCorgi,Just as big a stage as Sunday night. And an extra day off before the playoffs 😎,30.0,jaguars,t3_10136ou,False,0.0,Bortles 2020 :2020:,2023-01-01T22:42:03Z,jaguars,0.2294
23504,171033,171033,UnhingedCorgi,Yea here I am wondering why Saturday is so bad. It’s still prime time. We’ll be only one of two games that day. Might draw an even bigger audience?,3.0,jaguars,t3_100zwmm,False,0.0,Bortles 2020 :2020:,2023-01-01T21:40:08Z,jaguars,-0.002615625
23505,171035,171035,UnhingedCorgi,We takin them with us to the top,4.0,jaguars,t3_100u6gm,False,0.0,Bortles 2020 :2020:,2023-01-01T21:09:44Z,jaguars,0.2023
23506,171041,171041,UnhingedCorgi,"If (when) we make a Super Bowl, I want these dudes calling it. For real. They feel like our crew at this point. So many others sound bored or bias against us. But these two were with us and able to sound interested while we were shit.",30.0,jaguars,t3_100u6gm,False,0.0,Bortles 2020 :2020:,2023-01-01T17:31:28Z,jaguars,-0.077174592
23507,171045,171045,UnhingedCorgi,I know that look all too well,6.0,jaguars,t3_100t01e,False,0.0,Bortles 2020 :2020:,2023-01-01T15:24:15Z,jaguars,0.2732
23508,171046,171046,UnhingedCorgi,"Kept momentum and no injuries. Perfect. 

Playoffs start next week, LFG!",5.0,jaguars,t3_100sw1k,False,0.0,Bortles 2020 :2020:,2023-01-01T14:50:11Z,jaguars,0.0525814814814814
23509,171047,171047,UnhingedCorgi,What was this penalty? Holding or a personal foul? I can’t even tell what they thought it was. Just looks like a DL being dominated.,32.0,nfl,t3_100rhgk,False,0.0,:Jaguars: Jaguars,2023-01-01T14:30:05Z,jaguars,0.088181640625
23510,171048,171048,UnhingedCorgi,I’m suddenly much happier with our travon walker pick,7.0,nfl,t3_100r3qi,False,1.0,:Jaguars: Jaguars,2023-01-01T14:25:33Z,jaguars,0.5267
23511,171049,171049,UnhingedCorgi,This aged like milk left out in the sun for a year,8.0,jaguars,t3_100s6ev,False,0.0,Bortles 2020 :2020:,2023-01-01T14:14:00Z,jaguars,0.3612
23512,171050,171050,UnhingedCorgi,"*chuckles* I’m in danger…

-tablets on the sideline",260.0,nfl,t3_100s3o4,False,0.0,:Jaguars: Jaguars,2023-01-01T14:11:26Z,jaguars,0.2732
23513,171052,171052,UnhingedCorgi,"Scoring drive: 1 play, 62 yards, 0:09. Beautiful!",6.0,jaguars,t3_100p2qp,False,0.0,Bortles 2020 :2020:,2023-01-01T12:57:25Z,jaguars,0.403
23514,171054,171054,UnhingedCorgi,Bout carried him into the end zone too 😂,2.0,jaguars,t3_100p2qp,False,0.0,Bortles 2020 :2020:,2023-01-01T12:16:02Z,jaguars,0.4404
23515,171076,171076,UnhingedCorgi,He’s Blake Bortles if Bortles only ever played the Steelers,108.0,nfl,t3_zzztmj,False,0.0,:Jaguars: Jaguars,2022-12-31T14:24:38Z,jaguars,0.34
23516,171077,171077,UnhingedCorgi,"Same, it’s a gamble for sure but I think we only lose like a 6th round pick if he doesn’t work out? I can live with that",11.0,nfl,t3_zzztmj,False,0.0,:Jaguars: Jaguars,2022-12-31T14:14:33Z,jaguars,0.0225
23517,171113,171113,UnhingedCorgi,"“Honey your jersey arrived but it was already dirty, can you believe that? Anyway I threw it in the wash it should be almost done”",3.0,jaguars,t3_zyudu5,False,0.0,Bortles 2020 :2020:,2022-12-30T01:49:59Z,jaguars,-0.148175
23759,171833,171833,Vanc_Trough,You must have missed the fact that he didn’t have control of the ball when he was contacted. No one is saying MJ wasn’t contacted. He was contacted before the recovery.,4.0,nfl,t3_1035bc3,False,0.0,:Jaguars: Jaguars ,2023-01-04T17:55:02Z,jaguars,-0.0438518518518518
23760,171834,171834,Vanc_Trough,"2017 AFC Championship Game. Myles Jack wasn’t down on the fumble recovery. 
#MJWD",1.0,nfl,t3_1035bc3,False,0.0,:Jaguars: Jaguars ,2023-01-04T17:51:43Z,jaguars,0.0163111111111111
23761,171835,171835,Vanc_Trough,Don’t blow turnovers dead if you think the person recovering is down. Review that shit after the fact to see if a player was down.,1.0,nfl,t3_103fset,False,0.0,:Jaguars: Jaguars ,2023-01-04T17:48:59Z,jaguars,-0.4408499999999999
23762,171836,171836,Vanc_Trough,Definitely need to retire 32.,10.0,jaguars,t3_103a8yu,False,0.0,:WH1::WH2::WH3:,2023-01-04T16:22:54Z,jaguars,0.4019
23763,171837,171837,Vanc_Trough,"Well, he’s officially turned heel.",5.0,nfl,t3_103cszv,False,0.0,:Jaguars: Jaguars ,2023-01-04T16:17:39Z,jaguars,0.2732
23764,171838,171838,Vanc_Trough,"So, they’ll remove a win from the titans and a loss from the Jags? Then Week 18 won’t matter!",0.0,nfl,t3_1035zzw,False,0.0,:Jaguars: Jaguars ,2023-01-04T10:40:22Z,jaguars,0.14065
23765,171839,171839,Vanc_Trough,"Born in Jacksonville, lived in Macclenny for a very long time. My dad bought us season tickets in the 90s, can’t remember exactly when, and have been a fan since.",1.0,jaguars,t3_1035xms,False,0.0,:WH1::WH2::WH3:,2023-01-04T10:00:58Z,jaguars,0.1591
23766,171840,171840,Vanc_Trough,"Honestly, I could not care less. I need some damn shade. If you’ve never been to a 1300 game in Jacksonville then it’s quite the experience. Bring sunscreen.",18.0,nfl,t3_102pmsz,False,0.0,:Jaguars: Jaguars ,2023-01-03T20:29:48Z,jaguars,-0.00590625
23767,171842,171842,Vanc_Trough,You get it 😊,4.0,nfl,t3_101w4k8,False,0.0,:Jaguars: Jaguars ,2023-01-02T21:18:12Z,jaguars,0.7184
23768,171844,171844,Vanc_Trough,"Yep. This isn’t news. 

Sounds like they got return of spontaneous circulation (ROSC). He wouldn’t be expected to be breathing on his own because they would have intubated him",66.0,nfl,t3_101w4k8,False,0.0,:Jaguars: Jaguars ,2023-01-02T20:59:29Z,jaguars,0.02373125
23769,171845,171845,Vanc_Trough,"They did CPR almost immediately and got a heart rate back. Can’t imagine he was deprived of oxygen and any oxygen they administered is routine care. 

The real problem is going to be the underlying cause of the cardiac arrest. Traumatic arrest. Underlying heart condition. Etc.",6.0,jaguars,t3_101vlmu,False,0.0,:WH1::WH2::WH3:,2023-01-02T20:57:59Z,jaguars,0.0138611818415637
23770,171846,171846,Vanc_Trough,They are absolutely cancelling this.,3.0,nfl,t3_101vybp,False,0.0,:Jaguars: Jaguars ,2023-01-02T20:55:05Z,jaguars,-0.2716
23771,171847,171847,Vanc_Trough,This is best possible news in my opinion. Sounds like they got return of spontaneous circulation (ROSC). He wouldn’t be expected to be breathing on his own because they would have intubated him,15.0,jaguars,t3_101vlmu,False,0.0,:WH1::WH2::WH3:,2023-01-02T20:50:56Z,jaguars,0.0637222222222222
23772,171848,171848,Vanc_Trough,This is good news in my opinion. Sounds like they got return of spontaneous circulation (ROSC). He wouldn’t be expected to be breathing on his own because they would have intubated him,6.0,nfl,t3_101vffm,False,0.0,:Jaguars: Jaguars ,2023-01-02T20:28:14Z,jaguars,0.0564444444444444
23773,171853,171853,Vanc_Trough,Crazy considering we put up 31 points.,1.0,jaguars,t3_101exvn,False,0.0,:WH1::WH2::WH3:,2023-01-02T12:06:15Z,jaguars,-0.34
23774,171857,171857,Vanc_Trough,Man. His mom out there dumb AF.,5.0,jaguars,t3_1012iyy,False,0.0,:WH1::WH2::WH3:,2023-01-02T02:42:24Z,jaguars,-0.2553
23776,171861,171861,Vanc_Trough,"Let’s close this shit out, Ravens!",1.0,jaguars,t3_100uccb,False,0.0,:WH1::WH2::WH3:,2023-01-01T21:52:14Z,jaguars,-0.6749
23777,171866,171866,Vanc_Trough,Damn!,15.0,jaguars,t3_100ztir,False,0.0,:WH1::WH2::WH3:,2023-01-01T19:57:52Z,jaguars,-0.4574
23778,171868,171868,Vanc_Trough,No I think the Bills have to win and jets are also involved.,1.0,jaguars,t3_100sw1k,False,0.0,:WH1::WH2::WH3:,2023-01-01T15:01:58Z,jaguars,0.3818
23779,171869,171869,Vanc_Trough,That’s a bullshit call. That was an INT.,6.0,jaguars,t3_100p2qp,False,0.0,:WH1::WH2::WH3:,2023-01-01T14:53:47Z,jaguars,-0.146475
23780,171872,171872,Vanc_Trough,I think we need Miami and chargers to lose.,3.0,jaguars,t3_100p2qp,False,0.0,:WH1::WH2::WH3:,2023-01-01T14:39:57Z,jaguars,-0.4019
23781,171876,171876,Vanc_Trough,Top 2 and he ain’t 2.,7.0,nfl,t3_zzztmj,False,0.0,:Jaguars: Jaguars ,2022-12-31T16:09:50Z,jaguars,0.2023
23782,171877,171877,Vanc_Trough,Need a fresh update after tomorrow!,4.0,nfl,t3_yhiy9w,False,0.0,:Jaguars: Jaguars ,2022-12-31T15:41:37Z,jaguars,0.3802
24300,173618,173618,VomitingPotato,"Nah. You're golden. I'm sure if you get there early and let fan services know it's his first game they'll hook you up. Great seats. You'll see it all. He'll probably only care where Jaxson De Ville is the whole game, but just keep him engaged and have fun. It should be an epic first game for lil man. The stadium is gonna be electric!",10.0,jaguars,t3_103jcia,False,0.0,STEAL :StealTheShow: THE SHOW,2023-01-04T18:09:32Z,jaguars,0.0017358390629291
24301,173619,173619,VomitingPotato,"Congrats on missing Mularkey, Gus and Bologna Boy.",4.0,jaguars,t3_10334sk,False,0.0,STEAL :StealTheShow: THE SHOW,2023-01-04T15:31:43Z,jaguars,0.296
24302,173621,173621,VomitingPotato,"My wife got pregnant and we decided to move back to FL. I wanted to move to Tally where we have people. She wanted to move to Jax where she has family. 

I told my wife I would move to Jax if she let me get season tickets. She called my bluff. I spent 17 years suffering through, well you were there, you know. And now Trevor and Doug are here to repay my loyalty with a dynasty and several Lombardis.",3.0,jaguars,t3_1035xms,False,0.0,STEAL :StealTheShow: THE SHOW,2023-01-04T11:47:04Z,jaguars,0.072369387755102
24303,173624,173624,VomitingPotato,Someone on the DL that can get pressure,3.0,jaguars,t3_102bjgr,False,0.0,STEAL :StealTheShow: THE SHOW,2023-01-03T10:27:47Z,jaguars,-0.296
24304,173626,173626,VomitingPotato,Gregg Williams is like if Bill Romanowksi was a DC. Total scumbag.,1.0,jaguars,t3_101vb55,False,0.0,STEAL :StealTheShow: THE SHOW,2023-01-03T06:28:06Z,jaguars,-0.24455
24305,173627,173627,VomitingPotato,"Steve McNair and Josh Dobbs are pretty much the same guy, right?",1.0,jaguars,t3_101jqyv,False,0.0,STEAL :StealTheShow: THE SHOW,2023-01-02T16:08:46Z,jaguars,0.4939
24306,173628,173628,VomitingPotato,Way too young. He was such a great guy too. Remember his family would come see him at the end of practice all the time. So sad.,1.0,jaguars,t3_101masn,False,0.0,STEAL :StealTheShow: THE SHOW,2023-01-02T15:06:55Z,jaguars,-0.1216359374999999
24307,173629,173629,VomitingPotato,Hey Mods! Can this be made into Texans flair? Would be great for next year's Trash threads.,1.0,jaguars,t3_100t01e,False,0.0,STEAL :StealTheShow: THE SHOW,2023-01-02T07:28:13Z,jaguars,0.2083
24308,173632,173632,VomitingPotato,A snake will always be a snake. I don't trust what moves he will make or what he will do to protect himself when/if things go sideways. Would prefer Doug handpicks his guy. Otherwise would prefer Baalke be as invisible a member of the front office as we have ever had. Cannot forget the history around the man.,0.0,jaguars,t3_1011cyg,False,0.0,STEAL :StealTheShow: THE SHOW,2023-01-02T05:30:29Z,jaguars,0.03385792
