,Unnamed: 0.1,Unnamed: 0,author,body,score,subreddit,link_id,over_18,controversiality,author_flair_text,created_utc,flair,sentiment
33164,226317,226317,itz_ritz,"The Titans are still the division champions until there are 0 seconds on the game clock on Saturday and we have more points than they do. We've been burned so many times by that franchise I can't even count. I believe we're the better team this year, but damnit we gotta win the game first.",29.0,jaguars,t3_101qjlz,False,0.0,:Shield:,2023-01-02T18:03:19Z,jaguars,0.143374074074074
33165,226318,226318,itz_ritz,Lol,1.0,jaguars,t3_100s6ev,False,0.0,:Shield:,2023-01-01T14:30:54Z,jaguars,0.4215
33166,226320,226320,itz_ritz,"It doesn't  matter who starts at QB, we should prepare for either player. Next week will be our Superbowl and we need to be prepared for anything and everything. The team we play next week will not look anything like what we saw tonight and they are hungry and driven like we are to win and get to the post season. Who wants it more? I hope it's us, and our players and coaches prove it to the fans at the bank next Sunday (night).",5.0,jaguars,t3_zyqq2l,False,0.0,:Shield:,2022-12-30T01:35:38Z,jaguars,0.094550368
33167,226321,226321,itz_ritz,I have a feeling it's gonna be Dan Campbell in Detroit. They have a similar Cinderella story as us but they've also garnered tons of support and recognition from other fan bases due to their participation in hard knocks.,4.0,jaguars,t3_zysnjl,False,0.0,:Shield:,2022-12-30T01:33:03Z,jaguars,0.3868
33168,226322,226322,itz_ritz,"Not necessarily a depth player, but Luke Fortner is definitely unsung. This rookie replaced beloved Brandon Linder at center and we never hear about him during the games. For an offensive lineman, that's the ultimate praise. Dude does his job effectively and clearly has a rapport with his QB. We give props to Baalke for Walker, Lloyd and Muma in this draft class, but Fortner was a top 3rd round pick and was an absolute slam dunk.",15.0,jaguars,t3_zyr72m,False,0.0,:Shield:,2022-12-30T01:28:08Z,jaguars,-0.029750272
33169,226323,226323,itz_ritz,Don't you see the flair? That's clearly Jamal Agnew. Of course he has Shads number.,8.0,jaguars,t3_zyqg6a,False,0.0,:Shield:,2022-12-30T01:21:33Z,jaguars,0.0703888888888888
33170,226324,226324,itz_ritz,"Watching Dobbs tonight reminded me of Streveler last week. A fresh arm with a different body of work to prepare for, but nothing scary. What you see is what you get. We have to plan for the run since that will be what they will focus their offense on against us.",7.0,jaguars,t3_zyqd8y,False,0.0,:Shield:,2022-12-30T01:12:30Z,jaguars,-0.0527515625
33725,228016,228016,jaguar_28,That the Tory holt special?,4.0,nfl,t3_103fkwr,True,0.0,:Jaguars: Jaguars,2023-01-04T15:28:31Z,jaguars,0.4019
33726,228017,228017,jaguar_28,I’ll see you at the Super Bowl!,19.0,jaguars,t3_103d945,False,0.0,Waluigi number one! :Waluigi:,2023-01-04T14:40:48Z,jaguars,0.636
33727,228018,228018,jaguar_28,We are also 7-0 when I don’t wear jags gear (see my post from a few weeks back) I will continue to be in solidarity!,86.0,jaguars,t3_103d945,False,0.0,Waluigi number one! :Waluigi:,2023-01-04T14:26:12Z,jaguars,0.3595
33728,228020,228020,jaguar_28,"Glad I’m not in a money leauge, potentially millions of underground money on the line",2.0,nfl,t3_1035zzw,False,0.0,:Jaguars: Jaguars,2023-01-04T09:42:25Z,jaguars,0.4588
33729,228023,228023,jaguar_28,"One of my sisters friends was a backup punter from OSU, he is 6”1 and can dunk like it’s no big deal. A lot of them are very athletic and would beat the average Joe in most sports.",10.0,nfl,t3_102h7mi,False,0.0,:Jaguars: Jaguars,2023-01-03T13:59:38Z,jaguars,0.131675
33730,228024,228024,jaguar_28,"He didn’t get hit in the head, might be a heart condition",1.0,nfl,t3_101tiwi,False,0.0,:Jaguars: Jaguars,2023-01-02T20:13:27Z,jaguars,0.6369
33731,228026,228026,jaguar_28,"This is the most rational reply so far, totally agree. I would love a chaos bowl as well haha",1.0,nfl,t3_101m12p,False,0.0,:Jaguars: Jaguars,2023-01-02T18:58:53Z,jaguars,0.45765
33732,228030,228030,jaguar_28,"6 points allowed the last to games, if we were a bad defense we would have done worse. We are average",3.0,nfl,t3_101gnre,False,0.0,:Jaguars: Jaguars,2023-01-02T11:36:38Z,jaguars,-0.181725
33733,228032,228032,jaguar_28,You have a sad life,1.0,nfl,t3_100kz42,False,0.0,:Jaguars: Jaguars,2023-01-02T11:32:10Z,jaguars,-0.4767
33734,228033,228033,jaguar_28,"Sigh being defended by titans fans from this turd, appreciate it though, looking forward to Saturday.",7.0,nfl,t3_1013712,False,0.0,:Jaguars: Jaguars,2023-01-02T11:30:29Z,jaguars,0.4215
33735,228034,228034,jaguar_28,Yeah he was banned from our sub,1.0,nfl,t3_zt224s,False,0.0,:Jaguars: Jaguars,2023-01-02T11:28:47Z,jaguars,-0.2023
33736,228035,228035,jaguar_28,Joey is hilarious when micd up,10.0,nfl,t3_101c1le,False,0.0,:Jaguars: Jaguars,2023-01-02T07:38:58Z,jaguars,0.4019
33737,228037,228037,jaguar_28,"Another thing to note is their qb, Evan’s had good seasons with some below average quarterbacks, AJ had Andy Dalton playing his best ball, kind of hard to pick but I think Evan’s is a more durable player who will end up in the top 10 yards all time at this rate",2.0,nfl,t3_1011gc6,False,0.0,:Jaguars: Jaguars,2023-01-01T21:36:10Z,jaguars,0.7007
33738,228038,228038,jaguar_28,He’s better than AJ IMO but that’s a good comp,6.0,nfl,t3_1011gc6,False,0.0,:Jaguars: Jaguars,2023-01-01T21:11:55Z,jaguars,0.7003
33739,228039,228039,jaguar_28,That had a 3% chance of happening going into the week but is looking more plausible by the minute,5.0,nfl,t3_100xqlc,False,0.0,:Jaguars: Jaguars,2023-01-01T18:30:10Z,jaguars,0.128
33740,228040,228040,jaguar_28,"Weird I also agree with that, for some reason 😬",1.0,nfl,t3_100xzeu,False,0.0,:Jaguars: Jaguars,2023-01-01T18:26:37Z,jaguars,-0.1531
33741,228041,228041,jaguar_28,Save a leg for me,3.0,jaguars,t3_100t8h8,False,0.0,Waluigi number one! :Waluigi:,2023-01-01T15:25:10Z,jaguars,0.4939
33742,228044,228044,jaguar_28,What is this 2 qb nonsense,4.0,jaguars,t3_100p2qp,False,0.0,Waluigi number one! :Waluigi:,2023-01-01T12:20:38Z,jaguars,-0.4019
33743,228045,228045,jaguar_28,Good way to statt,2.0,jaguars,t3_100p2qp,False,0.0,Waluigi number one! :Waluigi:,2023-01-01T12:09:09Z,jaguars,0.4404
33744,228048,228048,jaguar_28,"No I was using an example of not agreeing hurts was top 5 and it had upvotes, not accusing you lol",2.0,nfl,t3_zzztmj,False,0.0,:Jaguars: Jaguars,2022-12-31T18:58:26Z,jaguars,-0.1769
33745,228049,228049,jaguar_28,"Hurts, Trevor, and Herbert have not accomplished anything yet, not for certain at all

Edit: which one of you cavemen reported me to the Reddit mental health hotline?

This comment of mine had 29 upvotes",1.0,nfl,t3_zzztmj,False,0.0,:Jaguars: Jaguars,2022-12-31T18:15:51Z,jaguars,-0.18615
33746,228050,228050,jaguar_28,I never said hurts was,1.0,nfl,t3_zzztmj,False,0.0,:Jaguars: Jaguars,2022-12-31T16:23:15Z,jaguars,0.3724
33747,228051,228051,jaguar_28,"Completely agree, wining an MVP does not guarantee top 5 status, just look at Matt Ryan or Cam Newton",4.0,nfl,t3_zzztmj,False,0.0,:Jaguars: Jaguars,2022-12-31T14:52:20Z,jaguars,0.1182
33748,228052,228052,jaguar_28,He had a down year last year as well tbh,20.0,nfl,t3_zzztmj,False,0.0,:Jaguars: Jaguars,2022-12-31T13:14:08Z,jaguars,0.2732
33749,228053,228053,jaguar_28,It certainly has not correlated to wins,11.0,nfl,t3_zzztmj,False,0.0,:Jaguars: Jaguars,2022-12-31T12:35:50Z,jaguars,-0.1526
33750,228055,228055,jaguar_28,"Hurts, Trevor, and Herbert have not accomplished anything yet, not for certain at all

Edit: which one of you cavemen reported me to the Reddit mental health hotline?",29.0,nfl,t3_zzztmj,False,0.0,:Jaguars: Jaguars,2022-12-31T12:28:31Z,jaguars,-0.7446
33751,228057,228057,jaguar_28,"Are only bad losses of the season are the broncos, colts and Texans, every other loss was too a playoff team or a contender",13.0,jaguars,t3_zzen6i,False,0.0,Waluigi number one! :Waluigi:,2022-12-30T17:47:02Z,jaguars,-0.7906
33752,228058,228058,jaguar_28,If the jaguars make a playoff run talking heads will act like they knew this was going to happen all along,194.0,nfl,t3_zz9csv,False,0.0,:Jaguars: Jaguars,2022-12-30T13:41:24Z,jaguars,0.3612
33753,228059,228059,jaguar_28,No,22.0,nfl,t3_zz19mm,False,0.0,:Jaguars: Jaguars,2022-12-30T08:02:56Z,jaguars,-0.296
34222,231079,231079,jaxjags4life,Trash best way to describe this. NFL refs are garbage. Thib is disgusting. He should be fined and suspended. If that shit was pat or josh that’s a call all day,2.0,nfl,t3_100qxbz,False,0.0,:Jaguars: Jaguars,2023-01-01T22:05:57Z,jaguars,-0.134557792
34476,232266,232266,jaxmagicman,No what Bart was saying. I saw the tackle live. I'm good.,3.0,nfl,t3_103bfp1,False,0.0,:Jaguars: Jaguars,2023-01-04T19:14:44Z,jaguars,0.135837037037037
34477,232268,232268,jaxmagicman,"What could have possibly been illegal about it? 

I need to see the video.",10.0,nfl,t3_103bfp1,False,0.0,:Jaguars: Jaguars,2023-01-04T14:40:18Z,jaguars,-0.13935
34478,232271,232271,jaxmagicman,"The Jags are coming off short rest and the Titans are coming off extra rest for their game. That just doesn't seem fair. The issue isn't the Titans getting more rest, it's the Jags getting short rest at the same time.",1.0,nfl,t3_1038mkb,False,0.0,:Jaguars: Jaguars,2023-01-04T12:12:16Z,jaguars,-0.0267888888888888
34479,232272,232272,jaxmagicman,Zac Taylor still looks like he is emotional about it. And it wasn't even his player. Shows how much this has hurt everyone involved.,53.0,nfl,t3_103abgj,False,0.0,:Jaguars: Jaguars,2023-01-04T12:08:55Z,jaguars,-0.157911111111111
34480,232273,232273,jaxmagicman,The Bengals actually do. It means they won the AFC North. The Ravens game means nothing this week.,1.0,nfl,t3_1035zzw,False,0.0,:Jaguars: Jaguars,2023-01-04T11:40:15Z,jaguars,0.0635444444444444
34481,232274,232274,jaxmagicman,"Also available:

Phillip Rivers Drew Brees Andrew Luck Ben Roethlisberger Ryan Fitzpatrick Robert Griffin III Alex Smith Eli Manning Chad Powers",48.0,nfl,t3_103571l,False,0.0,:Jaguars: Jaguars,2023-01-04T09:39:24Z,jaguars,0.4588
34482,232275,232275,jaxmagicman,That seems to open more problems. It gives the Chiefs the 1 seed and eliminates the Ravens from the division.,1.0,nfl,t3_102fr55,False,0.0,:Jaguars: Jaguars,2023-01-03T15:52:58Z,jaguars,-0.1144
34483,232276,232276,jaxmagicman,"Detroit is a home game for the Bills now, they've already won there twice this year.",2.0,nfl,t3_102fr55,False,0.0,:Jaguars: Jaguars,2023-01-03T15:52:04Z,jaguars,0.5719
34484,232277,232277,jaxmagicman,"It would favor both the Chiefs and Bengals. Ravens and Bills get screwed in this scenario. Because if the Bills won last night, they would be the 1 seed this morning. If the game is forfeited or no contest they are the 2 seed. The Ravens don't get a chance at the division.",1.0,nfl,t3_102fekk,False,0.0,:Jaguars: Jaguars,2023-01-03T14:51:40Z,jaguars,-0.045466432
34485,232278,232278,jaxmagicman,"Chiefs release a statement saying they will take a no contest in their game they played this week.

Ravens releasing one saying they are ok with the Bengals being given a tie or no contest and will accept the 5 seed. 

Are 2 statements that could make this all come out ok. It gives the Bills the 1 seed for now and the Bengals get the division. 

It hurts the Chiefs and Ravens but they gain mad props from the rest of the league.",2.0,nfl,t3_102fekk,False,0.0,:Jaguars: Jaguars,2023-01-03T14:44:33Z,jaguars,-0.037392608
34486,232280,232280,jaxmagicman,"Sucks for the Ravens even more. If the game isn't played, Bengals win the division no matter what happens this week.",9.0,nfl,t3_102fekk,False,0.0,:Jaguars: Jaguars,2023-01-03T14:35:52Z,jaguars,-0.4077
34487,232281,232281,jaxmagicman,"I agree, and just deleted.

SO really, it looks like it matter no what except for a tie. That's crazy.",1.0,nfl,t3_102fekk,False,0.0,:Jaguars: Jaguars,2023-01-03T13:15:39Z,jaguars,-0.0811888888888889
34488,232282,232282,jaxmagicman,"My guess is they wait to see what happens next week. If it all plays out and the game has no bearing on the seedings, then they don't play it. If there are ties that can be broken by H2H, then they play it in week 19 and push the playoff start a week. Cancel pro bowl.",12.0,nfl,t3_102fekk,False,0.0,:Jaguars: Jaguars,2023-01-03T12:38:26Z,jaguars,-0.07836875
34489,232283,232283,jaxmagicman,Ravens are already in the playoffs. Why would they have to play for a seed.,1.0,nfl,t3_102fe4h,False,0.0,:Jaguars: Jaguars,2023-01-03T12:31:29Z,jaguars,0.17
34490,232284,232284,jaxmagicman,That's my guess too and probably the best option.,4.0,nfl,t3_102fe4h,False,0.0,:Jaguars: Jaguars,2023-01-03T12:30:28Z,jaguars,0.6369
34491,232285,232285,jaxmagicman,"I would like to give a huge shoutout to the mods of /r/nfl . They have been on it, deleting the low effort COVID jokes and troll conspiracy theories. It was probably a rough night for you guys. Good job.",27.0,nfl,t3_102a9j5,False,0.0,:Jaguars: Jaguars,2023-01-03T12:13:12Z,jaguars,0.103915234375
34492,232286,232286,jaxmagicman,Is it possible there were multiple ambulances and it was a different one waiting for her? I’ve seen tweetd about it but no official word.,1.0,nfl,t3_101w4k8,False,0.0,:Jaguars: Jaguars,2023-01-02T21:14:22Z,jaguars,-0.21075
34493,232287,232287,jaxmagicman,Game suspended for tonight. That’s good at least.,2.0,nfl,t3_101tiwi,False,0.0,:Jaguars: Jaguars,2023-01-02T21:01:14Z,jaguars,0.101025
34494,232288,232288,jaxmagicman,It wasn’t more violent than normal hits. He even stood up after and then collapsed.,2.0,nfl,t3_101tiwi,False,0.0,:Jaguars: Jaguars,2023-01-02T20:58:29Z,jaguars,-0.295625
34495,232289,232289,jaxmagicman,What did that jackass do?,1.0,nfl,t3_101tiwi,False,0.0,:Jaguars: Jaguars,2023-01-02T20:48:22Z,jaguars,-0.4215
34496,232291,232291,jaxmagicman,I saw a few jackasses making COVID vaccine jokes.,2.0,nfl,t3_101tiwi,False,0.0,:Jaguars: Jaguars,2023-01-02T20:32:13Z,jaguars,-0.4215
34497,232292,232292,jaxmagicman,Has a pulse but isn’t breathing on his own? How does that happen to a healthy 24-year old man?,1.0,nfl,t3_101tiwi,False,0.0,:Jaguars: Jaguars,2023-01-02T20:30:07Z,jaguars,0.20095
34498,232293,232293,jaxmagicman,Hamlin was in on the tackle. He stood up after then collapsed. They had to perform CPR and had to get the ambulance out to get him to the hospital.,1.0,nfl,t3_101tiwi,False,0.0,:Jaguars: Jaguars,2023-01-02T20:27:28Z,jaguars,-0.0303555555555555
34499,232294,232294,jaxmagicman,"They are suspending the game. Hopefully until they hear Hamlin is ok. If not, game over.",10.0,nfl,t3_101tiwi,False,0.0,:Jaguars: Jaguars,2023-01-02T20:17:50Z,jaguars,0.0446555555555555
34500,232295,232295,jaxmagicman,Of course the coaches want to play. They shouldn’t have given them a choice.,1.0,nfl,t3_101tiwi,False,0.0,:Jaguars: Jaguars,2023-01-02T20:15:41Z,jaguars,0.100475
34501,232296,232296,jaxmagicman,"Wow, that shit was scary.",4.0,nfl,t3_101tiwi,False,0.0,:Jaguars: Jaguars,2023-01-02T19:59:43Z,jaguars,-0.4588
34502,232297,232297,jaxmagicman,"Fuck the running game, have Burrows and Allen throw 80 times each tonight",5.0,nfl,t3_101tiwi,False,0.0,:Jaguars: Jaguars,2023-01-02T19:56:09Z,jaguars,-0.5423
34503,232298,232298,jaxmagicman,Seattle is SO fucked. There’s no way the NFL lets them win Sunday. It would make the GB vs DET win and in if they lose.,2.0,nfl,t3_101npbp,False,0.0,:Jaguars: Jaguars,2023-01-02T19:34:14Z,jaguars,0.1031481481481481
34504,232300,232300,jaxmagicman,The NFL can make sure that won’t happen.,1.0,nfl,t3_1013712,False,0.0,:Jaguars: Jaguars,2023-01-02T08:06:33Z,jaguars,0.3182
34505,232301,232301,jaxmagicman,I would think that it’s more the best thing for the NFL is for Seattle to lose because then it sets up Lions vs Packers as a win and in game.,1.0,nfl,t3_1013712,False,0.0,:Jaguars: Jaguars,2023-01-02T08:04:38Z,jaguars,0.7635
34506,232302,232302,jaxmagicman,I expect 100 horseshit calls against Seahawks to gurantee they lose to set up the win and in game.,0.0,nfl,t3_1013712,False,0.0,:Jaguars: Jaguars,2023-01-02T08:01:10Z,jaguars,0.2732
34507,232303,232303,jaxmagicman,What results should I be rooting for now to help the Jags?,12.0,jaguars,t3_100sw1k,False,0.0,:CJ1::CJ2::CJ3:,2023-01-01T15:24:25Z,jaguars,0.4019
34508,232305,232305,jaxmagicman,"Other than the Jags, it's been that way for me as well.",1.0,nfl,t3_100nt26,False,0.0,:Jaguars: Jaguars,2023-01-01T15:03:57Z,jaguars,0.2732
34509,232306,232306,jaxmagicman,"There has been almost no coverage of the Cards vs Falcons game which has been really close. :)


EDIT: Just as I say that.",3.0,nfl,t3_100nt26,False,0.0,:Jaguars: Jaguars,2023-01-01T14:58:53Z,jaguars,0.1724
34510,232307,232307,jaxmagicman,"So with the Pats winning, what do the Jags need to get the Wild Card?

EDIT: I think I prefer the easy method. Win and IN next week.",2.0,jaguars,t3_100p2qp,False,0.0,:CJ1::CJ2::CJ3:,2023-01-01T14:52:01Z,jaguars,0.2637407407407407
34511,232309,232309,jaxmagicman,Does nobody want to win the NFC South?,2.0,nfl,t3_100nt26,False,0.0,:Jaguars: Jaguars,2023-01-01T14:06:31Z,jaguars,-0.0857
34512,232312,232312,jaxmagicman,"I'd listen to this guy, he knows what bad football looks like.",3.0,nfl,t3_100nt26,False,0.0,:Jaguars: Jaguars,2023-01-01T13:58:37Z,jaguars,-0.25
34513,232313,232313,jaxmagicman,THERE'S A CJ BETHERD ALERT!!!,2.0,nfl,t3_100nt26,False,0.0,:Jaguars: Jaguars,2023-01-01T13:56:55Z,jaguars,0.1046
34514,232314,232314,jaxmagicman,"Yeah, time to get the starters out.",2.0,jaguars,t3_100p2qp,False,0.0,:CJ1::CJ2::CJ3:,2023-01-01T13:56:14Z,jaguars,0.296
34515,232315,232315,jaxmagicman,"Jags back in the Red Zone.

The last team to get in the red zone this game didn't get shown on the Red Zone Channel. Though I don't blame them.",2.0,nfl,t3_100nt26,False,0.0,:Jaguars: Jaguars,2023-01-01T13:50:53Z,jaguars,0.0861333333333333
34516,232318,232318,jaxmagicman,Lovie Smith has just given up. How can you punt when you're in plus territory? I don't care if it is 6 yards. You gained 30 yards of field position.,3.0,nfl,t3_100nt26,False,0.0,:Jaguars: Jaguars,2023-01-01T13:24:49Z,jaguars,0.07123125
34517,232319,232319,jaxmagicman,Jags with 4th down stop. NICE! In the red zone.,1.0,nfl,t3_100nt26,False,0.0,:Jaguars: Jaguars,2023-01-01T13:13:24Z,jaguars,0.0418481481481481
34518,232320,232320,jaxmagicman,"Damn Lawrence. You like throwing INTs vs the Texans.

Not going to blame you, Zay Jones looks like he stopped running.",4.0,nfl,t3_100nt26,False,0.0,:Jaguars: Jaguars,2023-01-01T13:09:26Z,jaguars,0.1549481481481481
34519,232322,232322,jaxmagicman,TYSON CAMPBELL!!! He's a bad MFer!,2.0,nfl,t3_100nt26,False,0.0,:Jaguars: Jaguars,2023-01-01T13:01:31Z,jaguars,-0.2924
34520,232323,232323,jaxmagicman,DAMN ETN!!! GOOD JOB!!,3.0,nfl,t3_100nt26,False,0.0,:Jaguars: Jaguars,2023-01-01T12:56:00Z,jaguars,0.0342222222222222
34521,232324,232324,jaxmagicman,Not even close. The owner was paying for happy endings. Watson was forcing them.,7.0,nfl,t3_100nt26,False,0.0,:Jaguars: Jaguars,2023-01-01T12:39:47Z,jaguars,0.0635444444444444
34522,232326,232326,jaxmagicman,And Jason from the Good Place is having a grand time.,4.0,nfl,t3_10025yw,False,0.0,:Jaguars: Jaguars,2023-01-01T10:14:14Z,jaguars,0.7096
34523,232327,232327,jaxmagicman,I will always love Blake Bortles. He was such a fun player.,1.0,nfl,t3_zzztmj,False,0.0,:Jaguars: Jaguars,2023-01-01T09:01:58Z,jaguars,0.414525
34524,232328,232328,jaxmagicman,"First, I absolutely would have taken it. Second, I would have thought that it was a good year and if we do good in the draft we might have a chance at the division next year because we are obviously out of the running this year with that record.",1.0,nfl,t3_1000imb,False,0.0,:Jaguars: Jaguars,2023-01-01T08:56:25Z,jaguars,0.38915
34525,232364,232364,jaxmagicman,Believe it or not the AIRBnBs around there are pretty affordable. I stayed in a 4-bedroom house the last time I went for a about $70 a night.,5.0,jaguars,t3_zz92uf,False,0.0,:CJ1::CJ2::CJ3:,2022-12-30T15:57:48Z,jaguars,0.123475
34739,232876,232876,jayharper08,So fucking scary. 😢,8.0,nfl,t3_101uzj8,True,0.0,:Jaguars: Jaguars,2023-01-02T20:04:35Z,jaguars,-0.3838249999999999
34740,232877,232877,jayharper08,Doesn’t matter. Still had sex.,6.0,jaguars,t3_1013o3e,False,0.0,:FT28b::FT28c:,2023-01-01T23:20:21Z,jaguars,0.00645
34741,232878,232878,jayharper08,BITCH!,3.0,nfl,t3_100zqd0,False,0.0,:Jaguars: Jaguars,2023-01-01T19:38:59Z,jaguars,-0.6239
34742,232879,232879,jayharper08,Now it’s time to sit the starters and get ready for next week. Fuck the tits.,4.0,jaguars,t3_100p2qp,False,0.0,:FT28b::FT28c:,2023-01-01T13:51:44Z,jaguars,-0.2395499999999999
35063,233686,233686,jaylkae66,Are they really just gonna bombard us with commercials?  I mean I don’t know what else they could do but cmon please don’t play the whopper whopper whopper one,7.0,nfl,t3_101tiwi,False,0.0,:Jaguars: Jaguars,2023-01-02T20:08:17Z,jaguars,0.36135
35064,233687,233687,jaylkae66,"Terrible terrible news.  Drafted and retired as a Jag, and covered them a lot on his YouTube channel.

Unbelievable that both of our starting guards from the MJD era are gone.  RIP Uche and Vince.",6.0,jaguars,t3_101masn,False,0.0,:AC38a::AC38b:,2023-01-02T15:21:29Z,jaguars,0.009772265625
35065,233691,233691,jaylkae66,Snoop runs hard,4.0,jaguars,t3_100p2qp,False,0.0,:AC38a::AC38b:,2023-01-01T14:07:36Z,jaguars,-0.1027
35066,233693,233693,jaylkae66,Sympathy flag,3.0,jaguars,t3_100p2qp,False,0.0,:AC38a::AC38b:,2023-01-01T12:36:40Z,jaguars,0.3612
35067,233694,233694,jaylkae66,"Loose ball, take a drink",7.0,jaguars,t3_100p2qp,False,0.0,:AC38a::AC38b:,2023-01-01T12:27:52Z,jaguars,-0.3182
35451,235763,235763,jcpmojo,"Surprised to see GB so far to the right. I've only watched them a couple times this year, and it didn't seem like ARod had much time before the defense was in his face.",3.0,jaguars,t3_103kmr7,False,0.0,Fred Taylor,2023-01-04T19:44:19Z,jaguars,-0.0212249999999999
35452,235768,235768,jcpmojo,"He didn't gain control of the ball until after the contact, he was still bobbling it, so the contact was irrelevant.  It was a clean FR, he stood up and started running with a clear path to the end zone. It was the definition of terrible officiating.",25.0,nfl,t3_1035bc3,False,0.0,:Jaguars: Jaguars,2023-01-04T11:14:23Z,jaguars,-0.1022703703703703
35453,235771,235771,jcpmojo,I've been subbed to his channel. So sad.,1.0,jaguars,t3_101xpch,False,0.0,Fred Taylor,2023-01-02T22:43:29Z,jaguars,-0.2628
35454,235774,235774,jcpmojo,"A 39 year old former NFL offensive lineman died today of a heart attack, too, and they did the same thing on his thread. It's just asinine.",19.0,nfl,t3_101uzj8,True,0.0,:Jaguars: Jaguars,2023-01-02T20:35:22Z,jaguars,-0.167625
35455,235775,235775,jcpmojo,"I was trying to put myself in the shoes of the Bills coach and figure out what I could possibly say to the team in the locker room. I finally decided I would have to tell them with their permission I was going to forfeit the game. I wouldn't want to go back on the field to coach, and there's no way I could ask any of them to go out and play with any sort of passion. If we can't give 100%, we're only asking for more injuries, and I couldn't live with that.",3.0,nfl,t3_101uzj8,True,0.0,:Jaguars: Jaguars,2023-01-02T20:26:40Z,jaguars,0.02493125
35456,235776,235776,jcpmojo,"Holy crap, really? I just started watching his podcast, too. Damn, he was such an awesome guy, too.",6.0,nfl,t3_101p6pw,False,0.0,:Jaguars: Jaguars,2023-01-02T18:06:47Z,jaguars,0.0991925925925926
35571,238634,238634,jun2san,The message was so fucking ambiguous that no wonder people were confused about it. It’s as if someone tweeted something insensitive like “a heart attack has never stopped a football game before. Why should it now?” Then end the tweet with “but that’s totally irrelevant.” Only Skip Bayless can sound like a stroke victim and have people defend him.,-6.0,nfl,t3_101y66n,False,0.0,:Jaguars: Jaguars,2023-01-03T03:10:30Z,jaguars,0.0706407407407407
35572,238635,238635,jun2san,"If that many people misunderstood him, maybe it was pretty poorly worded.",0.0,nfl,t3_101y66n,False,0.0,:Jaguars: Jaguars,2023-01-03T03:00:57Z,jaguars,0.2023
35573,238636,238636,jun2san,"I feel so bad for him. He’s not a terrible QB, but Eagles fans are just brutal.",8.0,jaguars,t3_100sw1k,False,0.0,Reddit Switcheroo Guy,2023-01-01T16:01:26Z,jaguars,-0.52095
35574,238639,238639,jun2san,The show is actually really good.,1.0,nfl,t3_100ogxh,False,0.0,:Jaguars: Jaguars,2023-01-01T12:58:01Z,jaguars,0.4927
35862,239863,239863,jwil06,"Considering the talent around him this year, I’d be stoked if I were a bears fan",1.0,nfl,t3_103bsa0,False,0.0,:Jaguars: Jaguars,2023-01-04T13:40:48Z,jaguars,0.6249
35865,239870,239870,jwil06,Worst is when the game temp says like 65 and people show up in hoodies not realizing you're about to sit in a literal sauna,152.0,nfl,t3_102pmsz,False,0.0,:Jaguars: Jaguars,2023-01-03T19:48:00Z,jaguars,-0.3818
35866,239871,239871,jwil06,Last Thursday Night game I went to was against Tennessee and it was in the like 50s... perfection.,26.0,nfl,t3_102pmsz,False,0.0,:Jaguars: Jaguars,2023-01-03T19:37:33Z,jaguars,0.7351
35867,239872,239872,jwil06,"Honestly only feels bearable to go to games that are played at night. So since we don't get night games, the shade should be a boom for sales.",557.0,nfl,t3_102pmsz,False,0.0,:Jaguars: Jaguars,2023-01-03T19:16:27Z,jaguars,0.164925
35868,239873,239873,jwil06,I really couldn’t stand RC as a broadcaster a couple years ago. His work on Pivot changed my mind but I also think it made him a better broadcaster on other outlets as well. Props to him,2.0,nfl,t3_101zzxm,False,0.0,:Jaguars: Jaguars,2023-01-03T07:22:11Z,jaguars,0.0842111111111111
35869,239874,239874,jwil06,Maddening having people you love fall into it man.,1.0,nfl,t3_101v056,False,0.0,:Jaguars: Jaguars,2023-01-02T20:30:08Z,jaguars,0.25
