,Unnamed: 0.1,Unnamed: 0,author,body,score,subreddit,link_id,over_18,controversiality,author_flair_text,created_utc,flair,sentiment
13016,67757,67757,DisenfranchisedCynic,I like them all. What did we give up to trade at #2? I’m assuming Rams pick + something?,1.0,detroitlions,t3_yi1mgk,False,0.0,Sun God,2022-10-31T07:57:14Z,detroitlions,0.0133777777777777
13017,67759,67759,DisenfranchisedCynic,I don’t see any reasonable arguments against it.,13.0,nfl,t3_yhxg85,False,0.0,:Lions: Lions :Lions: Lions,2022-10-31T00:25:59Z,detroitlions,-0.4019
13018,67762,67762,DisenfranchisedCynic,Lmao he is so goated.,4.0,nfl,t3_yfllci,False,0.0,:Lions: Lions :Lions: Lions,2022-10-28T13:42:39Z,detroitlions,0.5994
13019,67763,67763,DisenfranchisedCynic, Damnit. Can I see one negative stat list that we aren’t on?,4.0,nfl,t3_yfpomr,False,0.0,:Lions: Lions :Lions: Lions,2022-10-28T13:21:11Z,detroitlions,-0.4176249999999999
13020,67764,67764,DisenfranchisedCynic,No cat teams :-/,8.0,nfl,t3_yfcpdx,False,0.0,:Lions: Lions :Lions: Lions,2022-10-28T00:14:43Z,detroitlions,-0.5267
13893,73898,73898,Electronic_Shirt_426,"We also took $9mil off the books for next year, that's going to help a lot in FA.",5.0,nfl,t3_yjfz30,False,0.0,:Lions: Lions,2022-11-01T13:31:40Z,detroitlions,0.4019
14132,75495,75495,Ephan,"This off-season was great, we could convince ourselves there was hope. Can we go back.",191.0,detroitlions,t3_yjojwb,False,0.0,Welcome to Detroit!,2022-11-01T19:16:56Z,detroitlions,0.21005
14133,75496,75496,Ephan,"I still think we need to move on from goff with how hot and cold he can be, but damn the games where he's going off are fun.",2.0,detroitlions,t3_yhgf44,False,0.0,Welcome to Detroit!,2022-10-30T12:54:04Z,detroitlions,0.2263
14134,75497,75497,Ephan,Cominsky had a super low snap count last game since his hand is still healing. May take a bit for him to get back to where he was at the start of the season since his hand is now a blunt club.,5.0,detroitlions,t3_yg4y4j,False,0.0,Welcome to Detroit!,2022-10-28T23:51:51Z,detroitlions,0.42655
14135,75499,75499,Ephan,"They'll play one snap where they get several personal fouls and ejected by the refs for making plays in a lions uniform. 

/s",12.0,detroitlions,t3_yfqozq,False,0.0,Welcome to Detroit!,2022-10-28T10:19:40Z,detroitlions,0.131675
14136,75500,75500,Ephan,Sucks. Dude had a killer preseason and was looking like a total run game mauler. Bet our short yardage conversion rate would be way better if he had stayed healthy.,96.0,detroitlions,t3_yfqr74,False,0.0,Welcome to Detroit!,2022-10-28T10:17:15Z,detroitlions,0.1667222222222222
14514,76151,76151,Evanredditz,"Look for news about Lions going for a DB, as well as Jamaal, Decker, and Evan Brown",-1.0,detroitlions,t3_yjhxuw,False,0.0,Welcome to Detroit!,2022-11-01T14:12:39Z,detroitlions,0.2732
14515,76154,76154,Evanredditz,So glad we fired him & didn’t replace Glenn with him. Would have been even more of a dumpster fire.,1.0,detroitlions,t3_yih2cp,False,0.0,Welcome to Detroit!,2022-10-31T14:38:27Z,detroitlions,-0.28875
14516,76156,76156,Evanredditz,"I’d like it more if he stayed with Florida one more year. Then we could see if he’s ready to make a jump with his arm, along with that freak athleticism",2.0,detroitlions,t3_yhfee6,False,0.0,Welcome to Detroit!,2022-10-30T09:35:12Z,detroitlions,0.03895
14517,76157,76157,Evanredditz,I figured this would be the popular opinion.,4.0,detroitlions,t3_yhfee6,False,0.0,Welcome to Detroit!,2022-10-30T09:34:08Z,detroitlions,0.4215
14518,76158,76158,Evanredditz,"This. I want him to stay one more year just to give him that time. If not, I think he’s a late round pick.",3.0,detroitlions,t3_yhfee6,False,0.0,Welcome to Detroit!,2022-10-30T09:32:44Z,detroitlions,0.0085777777777777
14519,76159,76159,Evanredditz,"Fair enough; I do think he has his problems, and he could be a big project. He just really impresses me with that athleticism.",1.0,detroitlions,t3_yhfee6,False,0.0,Welcome to Detroit!,2022-10-30T09:31:59Z,detroitlions,0.2371249999999999
14520,76160,76160,Evanredditz,"All I did was voice my opinion. If you disagree, that’s fine, but I don’t understand why it’s a problem that I think otherwise.",3.0,detroitlions,t3_yhfee6,False,0.0,Welcome to Detroit!,2022-10-30T09:29:45Z,detroitlions,-0.30295
14521,76161,76161,Evanredditz,"We wore these for our first win last season
Now we wear them for our second..maybe?",27.0,detroitlions,t3_yh0cp7,False,0.0,Welcome to Detroit!,2022-10-29T21:02:27Z,detroitlions,0.5859
15159,78072,78072,Fangletron,"Truth.  The last few years, the Lions are doing the dumbest things.  They barely draft any talent then when they do, they trade it away for a sub par replacement.  You can’t say you’re building through the draft when you trade away the great players you drafted!",-12.0,detroitlions,t3_ykhfso,False,0.0,FTW Lions,2022-11-02T16:49:15Z,detroitlions,0.18100859375
15160,78073,78073,Fangletron,"Whatever you have to tell yourself homer-bot, clearly you are related to someone on the Lions sanitation team.  You are the homer that can and will - make a fool of yourself.  TBH, we are both Lions fans and therefore both clowns.  

Andy Reid has 238 regular season victories.  At this point it would take Coach Meathead 79 seasons to equal that.  

Andy Reid has coached 35 playoff games, won a Superbowl and is a future HOF coach.

Comparing Coach Caffeine Big Gulp to HOF Andy Reid is the most colossal waste of time I have ever seen. Congrats to you Don Quixote.  You win!",0.0,detroitlions,t3_yhok19,False,0.0,FTW Lions,2022-11-01T00:40:54Z,detroitlions,0.0752632890843313
15161,78074,78074,Fangletron,"What’s coach Reid’s career coaching record and how many times has he been to the playoffs?  Finally: how many playoff wins does he have vs how many overall wins does Coach meatheads have?

Ps,
You can’t include the preseason win against the awful Colts.",-1.0,detroitlions,t3_yhok19,False,0.0,FTW Lions,2022-10-31T07:22:41Z,detroitlions,0.1577222222222222
15162,78075,78075,Fangletron,Please tell more about how this zoo crew of trashcans with clip boards can have a winning season?,1.0,detroitlions,t3_yhok19,False,0.0,FTW Lions,2022-10-31T06:59:54Z,detroitlions,0.6908
15163,78076,78076,Fangletron,"Are you comparing Dan Meathead Super caffeine Campbell to, checks phone, Andy Reid?  An actual NFL Head coach who schemes, prepares, makes adjustments at halftime and isn’t a Cro-Magnon in sweat pants?  You homers are clowns.",-2.0,detroitlions,t3_yhok19,False,0.0,FTW Lions,2022-10-31T06:58:31Z,detroitlions,0.0222
15164,78078,78078,Fangletron,Y’all know Jim Caldwell cursed this team when he was fired.,3.0,detroitlions,t3_yhq8ss,False,0.0,FTW Lions,2022-10-30T17:03:29Z,detroitlions,-0.5574
15165,78079,78079,Fangletron,Grit is dumb AF.  Have a game plan.  This screams I have no idea what I’m doing.,3.0,detroitlions,t3_yhoa8y,False,0.0,FTW Lions,2022-10-30T16:51:50Z,detroitlions,-0.1944777777777777
15166,78080,78080,Fangletron,There is a lot of truth in this.  At least he went 6-2 once.,2.0,detroitlions,t3_yhoa8y,False,0.0,FTW Lions,2022-10-30T16:51:01Z,detroitlions,0.07955
15167,78083,78083,Fangletron,"Technically, we are a worse defense and worse coaching.",-5.0,detroitlions,t3_yhok19,False,1.0,FTW Lions,2022-10-30T16:46:55Z,detroitlions,-0.6908
15168,78084,78084,Fangletron,"We are Lions fans, so yes!",10.0,detroitlions,t3_yhok19,False,0.0,FTW Lions,2022-10-30T16:46:07Z,detroitlions,0.5836
15169,78085,78085,Fangletron,"Cleaned house.  What a joke.  We were awful.  If you replace bad players with worse players, what do you call that?  A rebuild?  Oh, it’s a Detroit Lions Rebuild.",-5.0,detroitlions,t3_yhok19,False,1.0,FTW Lions,2022-10-30T16:44:53Z,detroitlions,-0.0038576131687242
15170,78086,78086,Fangletron,This team is way worse.  At least we had Stafford and could force a punt or three.  Worst defense.  Worst scheme.  Worse record.  Just a dumpster fire.  I would sack Coach Meathead if he doesn’t fire AG.,43.0,detroitlions,t3_yhok19,False,0.0,FTW Lions,2022-10-30T15:24:10Z,detroitlions,-0.0596184999447509
15171,78088,78088,Fangletron,Cut that mother.  Make an example.  Hold these players responsible.,10.0,detroitlions,t3_yhmx85,True,0.0,FTW Lions,2022-10-30T15:20:13Z,detroitlions,0.0959481481481481
15172,78089,78089,Fangletron,"Sports gambling, the surest way to the poor house.  Factor in betting on the Lions and it just accelerates the freeway to oblivion.  Good luck!",1.0,detroitlions,t3_yfdr90,False,0.0,FTW Lions,2022-10-29T06:21:20Z,detroitlions,0.243074074074074
15173,78090,78090,Fangletron,1-5 is more like a sieve than grit.  Help us JC!,1.0,detroitlions,t3_yfobun,False,0.0,FTW Lions,2022-10-29T06:17:22Z,detroitlions,0.333725
16200,84010,84010,FloridaJit999,I don’t blame him this team blows bruh :(,1.0,detroitlions,t3_yjd7vm,False,0.0,Sun God,2022-11-02T17:15:23Z,detroitlions,-0.6486
16731,87732,87732,Fricktator,"I also am shocked people still buy the ""Leno took his show back"" narrative. As if a host has the ability to make demands like that. The Tonight Show ratings dropped under Conan and Leno's 10 o'clock show wasn't getting the views that shows did in that time slot the previous season.",-7.0,nfl,t3_yiswmx,False,0.0,:Lions: Lions,2022-10-31T22:06:55Z,detroitlions,0.0533148148148148
16732,87736,87736,Fricktator,"21-7 lead and you lose after not scoring in the 2nd half. Now you're record on the season is 1-6 after going 3-13-1 last year. 

I like Dan Campbell as a guy, but he's not it. I thought Ben Johnson could be an easy replacement,  but I'm starting to think he's great at designing plays in his office, but not at adjusting to defenses in game. 

I'd rather roll the dice on someone else next season than continue with Campbell.",36.0,nfl,t3_yho6x4,False,0.0,:Lions: Lions,2022-10-30T15:01:00Z,detroitlions,0.0375201919999999
16733,87737,87737,Fricktator,21-7 lead and now you're record is 1-6 after not scoring in the 2nd half. I love Dan Campbell. He isn't it. I'd rather roll the dice with someone else midway through this tear down rebuild rather than build it with the wrong guy.,3.0,nfl,t3_yhilfb,False,0.0,:Lions: Lions,2022-10-30T14:53:41Z,detroitlions,-0.1092234375
16734,87738,87738,Fricktator,"Fire everybody. 

One thing goes wrong and the whole team falls apart.",5.0,nfl,t3_yhilfb,False,0.0,:Lions: Lions,2022-10-30T14:25:33Z,detroitlions,-0.32335
16735,87739,87739,Fricktator,That's a flag if the QB plays for any other team.,7.0,nfl,t3_yhilfb,False,0.0,:Lions: Lions,2022-10-30T14:23:43Z,detroitlions,0.25
16736,87740,87740,Fricktator,"If he's there, I wouldn't hate taking Bryce Young with the Lions first round pick and trading back with the Rams 1st round pick and turning it into two picks that we use on defensive players.",2.0,nfl,t3_yhilfb,False,0.0,:Lions: Lions,2022-10-30T13:57:43Z,detroitlions,0.4763
17381,91368,91368,GODDAMN_FARM_SHAMAN,There were no good Alabama QBs... Until there were. It's a stupid argument.,2.0,detroitlions,t3_yjojwb,False,0.0,Ooooh Yeahhhh!,2022-11-01T21:14:58Z,detroitlions,-0.4401
17382,91369,91369,GODDAMN_FARM_SHAMAN,lol the secondary has looked like chickens running around with their head cut off all year but somehow that has nothing to do with AP? The defensive talent is not great but players constantly being out of position and not communicating is not a symptom of a talent issue.,29.0,detroitlions,t3_yih2cp,False,0.0,Ooooh Yeahhhh!,2022-10-31T12:52:36Z,detroitlions,0.3397
17383,91370,91370,GODDAMN_FARM_SHAMAN,Based on a long history of fired Lions coaches... no.,32.0,detroitlions,t3_yih2cp,False,0.0,Ooooh Yeahhhh!,2022-10-31T12:29:10Z,detroitlions,-0.5574
17384,91371,91371,GODDAMN_FARM_SHAMAN,Do you watch him play? Marvin Harrison Jr. is a god but Smith-Njigba has been out the entire year and the other guys have been pretty average. His ability to throw in super tight windows is insane.,36.0,detroitlions,t3_ygrtj9,False,0.0,Ooooh Yeahhhh!,2022-10-29T14:59:10Z,detroitlions,0.2716925925925926
17870,98598,98598,I_Am_Not_That_Man,But he’s SPECIAL!,58.0,nfl,t3_ygl7by,False,0.0,:Lions: Lions,2022-10-29T10:44:52Z,detroitlions,0.7133
17871,98599,98599,I_Am_Not_That_Man,Yes.,1.0,nfl,t3_ygl7by,False,0.0,:Lions: Lions,2022-10-29T10:44:31Z,detroitlions,0.4019
18237,100429,100429,Ilovelamp024," No doubt Goff was more money, but Bridgewater was on a 3 year $63M contract at Carolina. So it’s not like he was chump change",2.0,detroitlions,t3_ykisbl,False,0.0,Onzuwhatevethefuck,2022-11-02T21:46:38Z,detroitlions,-0.131675
18238,100430,100430,Ilovelamp024,"I hear ya man, wasn’t trying to come off at you or anything at all… definitely entitled to your opinion as well…I was just trying to stick up for the Rams trade, as I thought it was great move. 

To Each their own obviously",2.0,detroitlions,t3_ykisbl,False,0.0,Onzuwhatevethefuck,2022-11-02T21:32:31Z,detroitlions,0.209
18239,100431,100431,Ilovelamp024,"Yeah I disagree, first I would have Jared Goff much higher than teddy Bridgewater. Second, when you do that trade, it’s not the 32nd pick in the trade. It’s too first round picks…. The first pick was late, but you can’t assume it be 32 (ppl were speculating 20-25ish). Not including they also got a 3rd with it.

 Downvote me all too want but I’d much rather have the Rams trade then that Carolina trade",5.0,detroitlions,t3_ykisbl,False,0.0,Onzuwhatevethefuck,2022-11-02T20:10:23Z,detroitlions,0.0064477987825788
18240,100432,100432,Ilovelamp024,I’m just curious why you think they should have taken the Carolina trade? From everything I’ve read they offered a 1st (which was 1.07 I believe or something like that) and teddy bridgewater. I would much rather have two firsts (granted they will be later than 1.07) and Jared Goff… I still think BH made the right move there personally,2.0,detroitlions,t3_ykisbl,False,0.0,Onzuwhatevethefuck,2022-11-02T17:55:08Z,detroitlions,0.1352518518518518
18241,100433,100433,Ilovelamp024,"If you are refusing the blue koolaid, why are you actively here?",0.0,detroitlions,t3_yjlukt,False,0.0,Onzuwhatevethefuck,2022-11-01T17:05:03Z,detroitlions,-0.1027
18242,100434,100434,Ilovelamp024,"We listening to a guy named Thor Nystrom? Lol… not saying it’s a win or lose on either side but to say it’s a steal is a joke

Also I think it got to factor in the 13$M he’s owed next year",1.0,detroitlions,t3_yjkq62,False,0.0,Onzuwhatevethefuck,2022-11-01T16:56:12Z,detroitlions,-0.1191
18243,100435,100435,Ilovelamp024,"Hey Jaarad Davis is still there, so one jersey is still relevant lol",37.0,detroitlions,t3_yjk49h,False,0.0,Onzuwhatevethefuck,2022-11-01T15:27:48Z,detroitlions,0.4215
18244,100436,100436,Ilovelamp024,😂 trade a te and that symbolizes “full tank mode”,4.0,detroitlions,t3_yjia08,False,0.0,Onzuwhatevethefuck,2022-11-01T15:09:59Z,detroitlions,0.4404
18245,100437,100437,Ilovelamp024,Yeah Brock this year unless Mitchell gets caught up to speed. I’d have to imagine they address this gap in the offseason,3.0,detroitlions,t3_yjdcpl,False,0.0,Onzuwhatevethefuck,2022-11-01T11:43:05Z,detroitlions,0.074
18246,100439,100439,Ilovelamp024,I am shocked at this…. This guy was seen as the next D coordinator last year,20.0,detroitlions,t3_yiha5p,False,0.0,Onzuwhatevethefuck,2022-10-31T11:46:58Z,detroitlions,-0.07955
18247,100440,100440,Ilovelamp024,😂 you are 1000% right on this,2.0,detroitlions,t3_yhp6zg,False,0.0,Onzuwhatevethefuck,2022-10-30T18:51:06Z,detroitlions,0.4404
18248,100441,100441,Ilovelamp024,"Agreed, it wasn’t a sure thing, nothing is…. All I’m saying it’s 4th and 2… you’ve been killing the clock, and have been driving …. Try and get the two yards for a new set of downs, and continue killing the clock. Not throw a 25 yard td to a wr who has good coverage…. That was my main frustration",1.0,detroitlions,t3_yhnx6y,False,1.0,Onzuwhatevethefuck,2022-10-30T16:08:03Z,detroitlions,-0.083888576
18249,100442,100442,Ilovelamp024,"Dan Campbell is on a 6 year deal… no way we fired him. We are still paying Matt Patricia this year, plus what other coach would want to come to a team that just fires coaches after 1 1/2 years. Dan Campbell has a minimum of 1 more season with us imo…

Let’s just hope Holmes uses that cap space we’ve been fighting to get, drafts right, and this ship turns next year",1.0,detroitlions,t3_yhp6zg,False,0.0,Onzuwhatevethefuck,2022-10-30T16:00:22Z,detroitlions,0.016874074074074
18250,100443,100443,Ilovelamp024,"I completely agree… not even a attempt by the refs to review the spot of the ball…..the whole game is on the line with this play, and you aren’t even going to review it? Complete bull crap by the officials",2.0,detroitlions,t3_yho4kk,False,0.0,Onzuwhatevethefuck,2022-10-30T15:57:44Z,detroitlions,-0.0879499999999999
18251,100444,100444,Ilovelamp024,"I disagree, when he went back and knee touched in looked like a little less than 1/2 a foot behind the 1st down line imo…. Still don’t get how they don’t at least review the spot of the ball",4.0,detroitlions,t3_yho4kk,False,0.0,Onzuwhatevethefuck,2022-10-30T14:58:27Z,detroitlions,-0.00645
18252,100445,100445,Ilovelamp024,"Yeah that upset me… Goff had time, and rather than take the for sure thing for a 1st, he takes a shot in the end zone",20.0,detroitlions,t3_yhnx6y,False,0.0,Onzuwhatevethefuck,2022-10-30T14:47:37Z,detroitlions,0.2263
18253,100446,100446,Ilovelamp024,How is Charles Harris still out? Did not think he’d be out for a month. We need him back as I think it will bolster his play if McNeil and Paschal keep doing their thing,2.0,detroitlions,t3_yhheay,False,0.0,Onzuwhatevethefuck,2022-10-30T11:36:46Z,detroitlions,0.1133333333333333
19396,102980,102980,JaHoog,Anyone who has ever played football understands. Low numbers are better.,-4.0,nfl,t3_yk8a39,False,0.0,:Lions: Lions,2022-11-02T14:48:26Z,detroitlions,0.18615
20729,105455,105455,Jew_3,The Lions are about to embark on an epic 15 game winning streak. This is our year!,7.0,detroitlions,t3_ykp470,False,0.0,Rodrigo!,2022-11-02T21:49:34Z,detroitlions,0.131675
20730,105456,105456,Jew_3,😂🤣😂,1.0,nfl,t3_yjmbv4,False,0.0,:Lions: Lions,2022-11-02T20:59:51Z,detroitlions,0.8402
20731,105457,105457,Jew_3,Skol for the first round of the playoffs this year as well.,1.0,detroitlions,t3_yjmvvx,False,0.0,Rodrigo!,2022-11-02T20:58:59Z,detroitlions,0.2732
20732,105458,105458,Jew_3,"Man, we could have gotten to draft Mr. Irrelevant  for like 10 years in a row. What was BH thinking 😂",2.0,detroitlions,t3_ykisbl,False,0.0,Rodrigo!,2022-11-02T20:24:36Z,detroitlions,0.1869333333333333
20733,105459,105459,Jew_3,"I was, and still am, a big fan of AP, but when the game plan was to jam at the line, and the DBs failed to do that, it’s a problem. When the employees consistently fail to be effectively developed and managed, the manager gets fired.",35.0,detroitlions,t3_yknirv,False,0.0,Rodrigo!,2022-11-02T20:07:03Z,detroitlions,-0.52095
20734,105460,105460,Jew_3,"I think players want to play for MCDC, because he has a positive culture. I really do think we will be able to attract a solid free agent or two.",-1.0,detroitlions,t3_ykdj6r,False,1.0,Rodrigo!,2022-11-02T15:12:45Z,detroitlions,0.56105
20735,105461,105461,Jew_3,Because we are trying to make a running offense. And we need defensive players.,-1.0,detroitlions,t3_yjda5q,False,0.0,Rodrigo!,2022-11-01T11:32:33Z,detroitlions,-0.0496
20736,105464,105464,Jew_3,"That’s fair,",1.0,detroitlions,t3_yhsnhd,False,0.0,Rodrigo!,2022-10-30T23:22:23Z,detroitlions,0.3182
20737,105465,105465,Jew_3,"We have so so little talent for so little cap
Room because of Robert Quinn.",1.0,detroitlions,t3_yhr38f,False,0.0,Rodrigo!,2022-10-30T18:35:17Z,detroitlions,0.4676
20738,105466,105466,Jew_3,🤣😂,0.0,detroitlions,t3_yhsmas,False,0.0,Rodrigo!,2022-10-30T18:28:40Z,detroitlions,0.7269
20739,105467,105467,Jew_3,"The Dolphins 23 playoff appearances, 5 AFC titles and 2 Super Bowls tell me you have exactly no clue what it feels like to be a Lions fan.",5.0,detroitlions,t3_yhsnhd,False,0.0,Rodrigo!,2022-10-30T18:27:45Z,detroitlions,0.7579
20740,105469,105469,Jew_3,Nowhere near as bad as a trade for a certain senate candidate.,3.0,detroitlions,t3_yhswqr,False,0.0,Rodrigo!,2022-10-30T18:21:54Z,detroitlions,0.6059
20741,105470,105470,Jew_3,Maybe give a 4-23 coach a few more defensive players and see if he can become a 14-30 coach.,-2.0,detroitlions,t3_yhop2v,False,0.0,Rodrigo!,2022-10-30T15:43:45Z,detroitlions,0.101
20742,105471,105471,Jew_3,"I do think we should give him 3-5 years so that in the future, coaches know they can install new schemes and get different personnel without being fired in year 2.",-1.0,detroitlions,t3_yhop2v,False,0.0,Rodrigo!,2022-10-30T15:35:24Z,detroitlions,0.4449
20743,105472,105472,Jew_3,"Why do people think a good coach will take this job? Especially if we fire coaches every 2.5 years. The only reason to take it will be for the 10 year, 45 mil contract and know you can go back to being a coordinator after year 3 (with a multi month vacation in year two). No top level coach will want to do that. They want to be a top level coach.",-3.0,detroitlions,t3_yhop2v,False,0.0,Rodrigo!,2022-10-30T15:24:09Z,detroitlions,0.051141408
21048,109476,109476,Jruzzin,I mean yeah it would be great to get them but I’m not sure I’d give up 3 future 1st rounders. 1st rounders should always be solid starters and we need a lot more solid starters.,1.0,detroitlions,t3_yjia08,False,0.0,Yas Lions,2022-11-01T17:59:09Z,detroitlions,0.22475
21049,109477,109477,Jruzzin,Lol. I don’t see that happening but it would be amazing.,1.0,detroitlions,t3_yjia08,False,0.0,Yas Lions,2022-11-01T17:40:47Z,detroitlions,0.472925
21050,109479,109479,Jruzzin,I’d do that in a heartbeat but i highly doubt another team would make that trade.,4.0,detroitlions,t3_yjia08,False,0.0,Yas Lions,2022-11-01T16:03:18Z,detroitlions,-0.5704
21051,109480,109480,Jruzzin,No. It is impossible to get the Anderson and a top QB.,9.0,detroitlions,t3_yjia08,False,0.0,Yas Lions,2022-11-01T15:52:59Z,detroitlions,0.10115
21052,109481,109481,Jruzzin,"How? Take Anderson 1 and then use your later lock on a QB?

Idk but i think you NEED Stroud or Young if you’re taking a QB.",4.0,detroitlions,t3_yjia08,False,0.0,Yas Lions,2022-11-01T15:50:15Z,detroitlions,-0.0172
21053,109482,109482,Jruzzin,I’d rather trade then Swift honestly. Love me some Jamaal.,2.0,detroitlions,t3_yjgbj9,False,0.0,Yas Lions,2022-11-01T15:19:30Z,detroitlions,0.464925
21054,109483,109483,Jruzzin,I'm fine with it as well. It does sting though thinking about how just a few years ago we spent the 8th overall pick on him.,3.0,detroitlions,t3_yjd7vm,False,0.0,Yas Lions,2022-11-01T12:30:25Z,detroitlions,0.1101
21055,109484,109484,Jruzzin,"Call of Duty does as well, probably.",2.0,detroitlions,t3_yifhn5,False,0.0,Yas Lions,2022-11-01T09:08:08Z,detroitlions,0.2732
21056,109486,109486,Jruzzin,"Generational talent at QB or pass rush on a rookie deal can do a lot for a team that drafts well. Historically, they don’t draft well. But i think Holmes knows what he’s doing so right now I’d take the picks. Next year they need to make big strides toward winning though and be pushing for a wildcard.",2.0,detroitlions,t3_yiask9,False,0.0,Yas Lions,2022-10-31T12:32:40Z,detroitlions,0.1382851562499999
21057,109487,109487,Jruzzin,"Yep, I’m sick of these loser excuses man.",1.0,detroitlions,t3_yho4cq,False,0.0,Yas Lions,2022-10-30T21:30:12Z,detroitlions,-0.6705
21058,109488,109488,Jruzzin,Okudah is having a nice season. But yeah I’m sure it’s both.,1.0,detroitlions,t3_yho4cq,False,0.0,Yas Lions,2022-10-30T21:29:53Z,detroitlions,0.453175
21059,109489,109489,Jruzzin,"I don’t want to fire him yet but i don’t 100% agree with this. Amani had a really nice season last year and he’s regressed completely. That makes me question the scheme. The whole defensive team talent I’d say is slightly better than last year with adding Rodrigo, Hutch, paschel, and Okudah but we are even worse. Last week they played well against the cowboys because it seemed like they schemed well. 

I don’t want to fire him but I don’t want to keep excuses this historically bad level of play.",2.0,detroitlions,t3_yho4cq,False,0.0,Yas Lions,2022-10-30T21:27:55Z,detroitlions,-0.0480117305384087
21060,109490,109490,Jruzzin,"You’re delusional. It’s not like we’re just not good, we are the WORST and we do have more talent than we had last season with okudah playing well, hutch, and pascal. So how do you explain a massive regression when the talent has slightly improved?",1.0,detroitlions,t3_yhgf44,False,0.0,Yas Lions,2022-10-30T15:12:59Z,detroitlions,0.1694222222222222
21061,109491,109491,Jruzzin,Eh. Defense was pretty bad yet again... Couldn’t get a 3rd down stop.,2.0,detroitlions,t3_yhgf44,False,0.0,Yas Lions,2022-10-30T14:59:17Z,detroitlions,-0.125
21062,109492,109492,Jruzzin,Last week we schemed well and our “talentless” defense showed up against a really good Cowboys offense. If you think coaching isn’t the reason why you’re literally the last ranked defense then you don’t know anything.,7.0,detroitlions,t3_yhgf44,False,0.0,Yas Lions,2022-10-30T14:58:36Z,detroitlions,0.2007
21063,109493,109493,Jruzzin,Lol at this rate he’ll be lucky if he beats his record from last season.,3.0,detroitlions,t3_yfobun,False,0.0,Yas Lions,2022-10-28T16:06:07Z,detroitlions,0.6808
21064,109494,109494,Jruzzin,I get where you’re coming from but the positivity when there isn’t anything to be positive about does stunt change. Would be nice to have something to be deserving of being excited about.,2.0,detroitlions,t3_yfncjw,False,0.0,Yas Lions,2022-10-28T14:47:29Z,detroitlions,0.539625
