,Unnamed: 0.1,Unnamed: 0,author,body,score,subreddit,link_id,over_18,controversiality,author_flair_text,created_utc,flair,sentiment
40370,240933,240933,caint1154,"Dude did you watch Levis against Tennessee? He was horrible! 

If Bryce Young stays healthy, he will be an elite NFL QB. He has better arm talent than Stroud or Levis, and he can routinely create plays outside the pocket. Goff can’t do that.",3.0,detroitlions,t3_yjx4kn,False,1.0,Logo,2022-11-02T04:46:02Z,detroitlions,0.03554352
40371,240934,240934,caint1154,You’re right I read it wrong,1.0,detroitlions,t3_yjec27,False,0.0,Logo,2022-11-01T12:39:59Z,detroitlions,-0.4767
40372,240935,240935,caint1154,I would think we’re looking to acquire DB. No way we trade Okudah.,11.0,detroitlions,t3_yjefhq,False,0.0,Logo,2022-11-01T12:17:14Z,detroitlions,-0.148
40373,240936,240936,caint1154,We’re not really gonna pay Goff 30 mill next year are we?,4.0,detroitlions,t3_yjec27,False,1.0,Logo,2022-11-01T12:14:09Z,detroitlions,0.1285
40374,240937,240937,caint1154,"But that 2nd rounder could be anything! It could even be a tight end!

just kidding I love the trade no way we’re gonna pay him what he’ll want",2.0,detroitlions,t3_yjd7vm,False,0.0,Logo,2022-11-01T11:57:31Z,detroitlions,0.1702
40375,240938,240938,caint1154,"I want you to ask yourself 2 questions:

Are the 2022 Detroit lions a well coached football team?

Have the 2022 Detroit lions made progress over 2021?

Right now to me both to me both of these answers are no. If that remains after our last game, he’s gotta go.",5.0,detroitlions,t3_yjaf9u,False,0.0,Logo,2022-11-01T10:52:17Z,detroitlions,0.0079140625
40376,240940,240940,caint1154,"Stop. It.

We are drafting our franchise qb. I think if we can acquire more picks via trade, we should consider drafting 2.",0.0,detroitlions,t3_yitd3j,False,0.0,Logo,2022-11-01T04:38:52Z,detroitlions,-0.00115625
40377,240941,240941,caint1154,"Forget about Lamar Jackson. Even if Baltimore would part with him, which I doubt, they would want like 3 firsts for him. We would also have to sign him to $50 mill/year which would destroy our cap for years.

Don’t be like Carolina/Washington and bring in these retreads and be surprised when it doesn’t work out.",3.0,detroitlions,t3_yitd3j,False,0.0,Logo,2022-11-01T04:35:26Z,detroitlions,0.0981035156249999
40378,240942,240942,caint1154,I don’t even care for the “0 points in the second half” take. Like bro our offense had 3 possessions the entire 2nd half! You can’t realistically expect your offense to execute perfectly the whole game to win. Our defense shoulders the vast majority of blame for the loss.,3.0,detroitlions,t3_yim56r,False,0.0,Logo,2022-10-31T16:36:47Z,detroitlions,-0.069003515625
40379,240944,240944,caint1154,"45. As a kid in Toledo I followed the oilers because I loved Warren Moon. Then Moon got traded to Minnesota and I naturally transitioned to Barry and the Lions.  

I’ve lived in S Carolina for the last 12 years and don’t follow the tigers and pistons anymore (doesn’t help they suck too) but I can’t seem to shake the Lions.",2.0,detroitlions,t3_yiljo3,False,0.0,Logo,2022-10-31T16:29:39Z,detroitlions,-0.061784375
40380,240945,240945,caint1154,To me they’ve gotta win at least 5 games to show some kind of progress. Otherwise ownership has to take a hard look at what kind of situation they want next year. Don’t bring Campbell back just to fire him halfway thru your new franchise QBs rookie season. Ask J Fields and T lawerence how that worked out for them.,10.0,detroitlions,t3_yikf3c,False,0.0,Logo,2022-10-31T14:03:09Z,detroitlions,-0.0187484375
40381,240946,240946,caint1154,The NFC is so bad watch the rams sneak into the 7 seed and upset the Vikings. Fuck.,4.0,detroitlions,t3_yiask9,False,0.0,Logo,2022-10-31T08:26:29Z,detroitlions,-0.495225
40382,240947,240947,caint1154,"I agree? I mean it’s been a fucking all around effort! 

Coaching?  Sucks.

Defense?  Sucks.

Secondary? See above.

Qb play? Inconsistent: sucks.

Jack Fox?  You’re cool.",5.0,detroitlions,t3_yhvzky,False,0.0,Logo,2022-10-30T19:59:39Z,detroitlions,0.0263240256411226
40383,240948,240948,caint1154,"All teams have to play thru injury, but when you have no depth to begin with it kills you. Our 2 starting safeties out against waddle and Tyreek. Not gonna be a good time. We had 4 guys playing in our secondary today who don’t make many nfl rosters. Couple that with Levi, C Harris, and R okwara all out and this is what you get. We needed everyone to be healthy for our defense just to be average this year. 

Draft all defense after Bryce.",7.0,detroitlions,t3_yhpras,False,0.0,Logo,2022-10-30T16:14:01Z,detroitlions,0.0284778290872486
40384,240949,240949,caint1154,The ref should tell him to back up like in fucking pee wee football.,18.0,detroitlions,t3_yhmx85,True,0.0,Logo,2022-10-30T15:19:04Z,detroitlions,0.3612
40385,240950,240950,caint1154,"Our secondary is ass. Parker, Hughes, Harris, Oruwarie, juju, none of these losers would even make most nfl rosters. AG may suck too but we just don’t have the personnel, especially in the secondary.",6.0,detroitlions,t3_yho3e1,False,0.0,Logo,2022-10-30T15:16:35Z,detroitlions,-0.053174074074074
40386,240951,240951,caint1154,This is my concern. Drafting your franchise QB into a situation where the entire coaching staff is hot seated is a terrible idea. And I’m afraid that’s a place we’re heading directly towards now.,12.0,detroitlions,t3_yho3e1,False,0.0,Logo,2022-10-30T15:13:09Z,detroitlions,-0.0529666666666666
40387,240952,240952,caint1154,"I’m beginning to believe the only reason our defense “played better” against Dallas is because Dallas was playing conservative with Dak just back. Any team that wants to sling it around the field on us just does. 

I don’t know if firing Glenn would do any good or not. Our secondary outside of Okudah is just full of losers. Missing Walker and Elliot killed us today.",11.0,detroitlions,t3_yho1tg,False,0.0,Logo,2022-10-30T15:02:12Z,detroitlions,-0.174282176
40388,240953,240953,caint1154,I don’t know man I’m just numb. Tough ask with Waddle and Tyreek and no Tracy Walker or D Elliot. Maybe we just don’t have the personnel on defense? 1 fucking punt the whole game and it’s not even like our defense stopped them they had penalties.,8.0,detroitlions,t3_yho4cq,False,0.0,Logo,2022-10-30T14:57:40Z,detroitlions,-0.0904078125
40389,240955,240955,caint1154,"I’m talking about how a hypothetical GM should be evaluating college QBs. Like it shouldn’t matter where they go to school.

Oh and by the way, the 6/7 of the guys above were 1st rounders.",5.0,detroitlions,t3_ygu3u3,False,0.0,Logo,2022-10-29T19:25:27Z,detroitlions,0.0424222222222222
40390,240956,240956,caint1154,Cj looks pretty good to me. I’m beginning to suspect some may be biased against where he goes to school.,6.0,detroitlions,t3_ygu3u3,False,0.0,Logo,2022-10-29T19:20:53Z,detroitlions,-0.073575
40391,240957,240957,caint1154,Yeah I didn’t know what to do with that. I just remember him destroying Clemson in the orange bowl and I think they were in the big 12 by then,1.0,detroitlions,t3_ygu3u3,False,0.0,Logo,2022-10-29T19:17:41Z,detroitlions,-0.2047
40392,240958,240958,caint1154,"So if Urban Meyer would’ve had the sense to start Burrow and Joe would’ve stayed at OSU he would’ve then sucked in the NFL? Whatever. 

I guess Josh Allen saved his NFL career by going to Wyoming so he wouldn’t have any weapons. Gimme a break.

If a QB has the IQ and physical talent then he’ll be successful in the NFL, said captain obvious.",2.0,detroitlions,t3_ygu3u3,False,1.0,Logo,2022-10-29T19:12:18Z,detroitlions,0.152646784
40393,240959,240959,caint1154,B Young>CJ Stroud for sure.,1.0,detroitlions,t3_ygrtj9,False,0.0,Logo,2022-10-29T15:40:27Z,detroitlions,0.3182
40394,240960,240960,caint1154,"Bryce Young would be the biggest slam dunk NFL QB pick since Andrew luck, if not for his height.",8.0,detroitlions,t3_ygthjg,False,0.0,Logo,2022-10-29T15:28:02Z,detroitlions,0.1027
40395,240961,240961,caint1154,"I friggin hate Alabama so believe me, I don’t relish backing them. I don’t believe it matters at all where a qb went to college. Mahomes went to Texas Tech. Josh Allen went to friggin Wyoming. The best OSU nfl starting QB is Joe Burrow, who couldn’t get on the field there and went to LSU!

The random distribution of where successful nfl qbs went to college is both fascinating and terrifying.",5.0,detroitlions,t3_ygrtj9,False,0.0,Logo,2022-10-29T15:26:01Z,detroitlions,0.1114904921124828
40396,240962,240962,caint1154,Lot of OSU hate in this sub.,46.0,detroitlions,t3_ygrtj9,False,0.0,Logo,2022-10-29T15:11:17Z,detroitlions,-0.5719
40397,240963,240963,caint1154,"Jalen Hurts, Mac Jones, and Tua are all currently starting qbs. Pretty sure no other college has that many current starting qbs.",6.0,detroitlions,t3_ygrtj9,False,0.0,Logo,2022-10-29T15:09:30Z,detroitlions,0.136125
40398,240964,240964,caint1154,"Bryce Young is awesome. His mobility and arm talent are second to none. But his accuracy is his most stunning attribute. I have been watching football for 35 years, and I cannot remember any college qb as accurate as Bryce Young.

But…

His height terrifies me. He’s shorter than drew Brees and Russell Wilson. He’s the same height as Kyler Murray, and Kyler looks like a little kid on the field.

There’s a reason NFL scouts and gms prefer 6’2+ QBs",38.0,detroitlions,t3_ygrtj9,False,0.0,Logo,2022-10-29T15:06:20Z,detroitlions,0.0055101598799228
40399,240965,240965,caint1154,"If we can get a third or better trade him. His blocking and effort are uneven and he seems to fall down immediately after catch. But even more so, he will want top 5 TE money next year and he simply isn’t worth that.

He’s not a bust or anything but for fucks sake stop taking TEs in the first round.",14.0,detroitlions,t3_ygot3h,False,0.0,Logo,2022-10-29T13:35:09Z,detroitlions,-0.1628703125
40400,240966,240966,caint1154,I feel attacked,3.0,nfl,t3_ygl7by,False,0.0,:Lions: Lions,2022-10-29T12:23:10Z,detroitlions,-0.4588
40401,240968,240968,caint1154,The officiating was horrible too. I’ll never forget Beebe running out of bounds like 3 steps and then back in for a TD. I was like 13 when that game happened and I was so upset I didn’t go to school the next day.,2.0,nfl,t3_yg6l2u,False,0.0,:Lions: Lions,2022-10-29T09:01:36Z,detroitlions,-0.0386185185185185
40402,240969,240969,caint1154,And it’s not even like they came all way back and won by a fg or something. They blew Houston out. How the fuck can an nfl team be up 24 and then get blown out!?,3.0,nfl,t3_yg6l2u,False,0.0,:Lions: Lions,2022-10-29T08:59:24Z,detroitlions,-0.03506640625
40403,240970,240970,caint1154,Actually it was 28-3 at half. Houston returned the 2nd half opening kickoff for a TD. Not that I remember that horrifying afternoon in great detail. 🤢,2.0,nfl,t3_yg6l2u,False,0.0,:Lions: Lions,2022-10-29T08:57:17Z,detroitlions,0.00641875
40404,240973,240973,caint1154,"I just can’t believe anyone would give up a first for Hock. He is not considered a top 5 TE by the rest of the league. 

But I didn’t think anyone would give up 2 firsts for Stafford either so….",12.0,detroitlions,t3_yfjv5p,False,0.0,Logo,2022-10-28T05:46:52Z,detroitlions,-0.0167888888888888
41000,249952,249952,drfjgjbu,There’s usually a few guys available way in the late rounds with no college production but an RAS of like 9. I feel like those guys have better odds of becoming solid contributors (especially on special teams) than a lot of less athletic players who put up numbers in college.,5.0,nfl,t3_yk7w11,False,0.0,:Lions: Lions,2022-11-02T11:44:45Z,detroitlions,0.517625
41001,249953,249953,drfjgjbu,Not like we got a bad player out of that pick,27.0,nfl,t3_yk9dpy,False,0.0,:Lions: Lions,2022-11-02T11:23:54Z,detroitlions,-0.6818
41002,249956,249956,drfjgjbu,"As a kid I didn’t know you were allowed to root for teams that won a bunch of championships (I didn’t watch hockey) and I assumed most people just didn’t see the team they liked win it all before they died. I don’t know how I thought the logistics of that worked, but child me never considered that a team has to win the championship every year or that those teams had fans too, who were happy when they won.",3.0,nfl,t3_yjdah3,False,0.0,:Lions: Lions,2022-11-02T00:58:20Z,detroitlions,0.7024
41003,249959,249959,drfjgjbu,"Total, not straight.",1.0,nfl,t3_yhky8x,False,0.0,:Lions: Lions,2022-10-30T12:52:39Z,detroitlions,-0.2369
41004,249960,249960,drfjgjbu,"NFL+ has it, but the UI is much worse than international game pass.",5.0,detroitlions,t3_yg4z2m,True,0.0,48,2022-10-28T22:06:32Z,detroitlions,-0.631
41005,249964,249964,drfjgjbu,"Top 5 guys on the depth chart, so this year it was Decker, Jackson, Ragnow, Vaitai, Sewell, 2021 it was the same, and 2020 it was Decker, Jackson, Ragnow, Joe Dahl, Vaitai. Dahl missed the end of 2020, Decker missed the beginning of 2021, Ragnow missed most of the year starting right before Decker came back, and in 2022 Vaitai missed week 1 with a back injury and went on IR for most likely the entire season due to surgery. 

I don’t know if there are other teams that have similar streaks going or not, but I thought this one at least seemed significant.",32.0,nfl,t3_yfsqp0,False,0.0,:Lions: Lions,2022-10-28T11:50:12Z,detroitlions,0.0103259259259259
41006,249965,249965,drfjgjbu,"One of these years it’ll be true. It finally happened with Brady falling off, maybe the other thing people constantly say every offseason will come true next year.",71.0,nfl,t3_yfsqp0,False,0.0,:Lions: Lions,2022-10-28T11:23:31Z,detroitlions,0.253375
42573,258519,258519,future_shoes,I think like 2 out of the last 10 super bowl winners had qbs on their rookie deals. Pretty sure there were more super bowl winners over that timeframe that had added a vet QB to take them over the top.,8.0,detroitlions,t3_ykdj6r,False,0.0,Ragnowrok,2022-11-02T17:08:36Z,detroitlions,0.680125
42574,258521,258521,future_shoes,"There is no way Holmes actually believes this.  If you are contending for a super bowl you don't try away a TE that has shown the ability to take over a game for picks, even if you don't plan to resign him in 2 years.  He is just talking shit to report.  He knows it, the report knows it, and the fans should know it.",0.0,detroitlions,t3_ykbt01,False,1.0,Ragnowrok,2022-11-02T16:36:23Z,detroitlions,-0.02343125
42575,258523,258523,future_shoes,What would be jamaals comp pick value of he is doesn't resign with the lions?  Like a 5th or a 6th rounder?,1.0,detroitlions,t3_yjgbj9,False,0.0,Ragnowrok,2022-11-01T17:58:31Z,detroitlions,0.3137
42576,258525,258525,future_shoes,"Unless there is some sort of fundamental disconnect or internal problem in the organization with the coach, you give them a third year.  All rebuilds are built around a 3 year plan.  Now if you happen to be able accelerate that like the giants seem to be doing more power to you but you can't give some the marching orders of a 3 year rebuild and fire them after two just for W-L record.  That is not going to be helpful on the whole. 

Also the the whole FO strategy can't be more obvious they were leaning into a 3 year rebuild. Just look at the playera drafted (potential over immediate impact) and FA moves or lack thereof.  Everything has been set up to build a foundation in year 1 and 2, then compete in year 3.  Renigging on that plan because year 2 started out super rough, is cutting off your nose to spite your face at this point.",6.0,detroitlions,t3_yikf3c,False,0.0,Ragnowrok,2022-10-31T16:00:12Z,detroitlions,-0.0006099005877971
42577,258527,258527,future_shoes,No worries doe,1.0,detroitlions,t3_yhomq8,False,0.0,Ragnowrok,2022-10-30T19:22:54Z,detroitlions,0.3252
42578,258528,258528,future_shoes,What are you talking about? AO started the year injured and then after he came back lost his starting spot for a while.   How is that consistent?  Also Elliot was out today forcing JuJu Hughes to start.  The secondary has been shuffling players from game 1.,4.0,detroitlions,t3_yhomq8,False,0.0,Ragnowrok,2022-10-30T19:18:58Z,detroitlions,-0.00097984
42579,258529,258529,future_shoes,"I mean the talent level on the secondary is going backwards due to injury.  Seems like every game the announcers are talking about how it is someone's first game as a starter on defense.

Also I didn't say I'm excusing it, I just said I'm withholding judgment until year 3.  The other option I guess is shit can MCDC and Holmes <2 years into a long term rebuild but that seems like a worse idea.",6.0,detroitlions,t3_yhomq8,False,0.0,Ragnowrok,2022-10-30T18:58:33Z,detroitlions,-0.11630625
42580,258530,258530,future_shoes,This is one of the reasons I have accepted giving MCDC and Co until next season to really judge them.  The secondary on a talent level just is so wanting.  It was also a three year plan to be competitive so let's see what happens when Holmes actually has some money to throw at secondary FAs.,11.0,detroitlions,t3_yhomq8,False,0.0,Ragnowrok,2022-10-30T17:45:51Z,detroitlions,0.1262185185185185
43688,265030,265030,hurthands,Shut the hell up,1.0,detroitlions,t3_yhgf44,False,0.0,20,2022-10-30T14:04:59Z,detroitlions,-0.6808
43689,265031,265031,hurthands,shut the hell up,5.0,detroitlions,t3_yhgf44,False,0.0,20,2022-10-30T14:03:31Z,detroitlions,-0.6808
44728,271066,271066,jakemcqueen52,"When I was 21 I lost my Mom, uncle, great uncle, family dog, and my 19 year old nephew to suicide in a 5 month span. It was 1 funeral after the next. 

It completely shattered us",1.0,nfl,t3_yj8d00,False,0.0,:Lions: Lions,2022-11-02T07:37:41Z,detroitlions,-0.2302185185185185
45104,276241,276241,joelbartlett33,"Honestly might have been, cuz they took the 1st offside penalty, try to gettem to take another and redo a down burning some clock.

I mean really, at the 1/2 yard line does it really matter if you are offsides or not?

If I was an interior Dline I’d try and move up as close/over as I could to try and sneak it past refs in  that situation. If they score and call it, no difference. If they dont score and call it, whats a couple inches difference make?",1.0,detroitlions,t3_yhmx85,True,0.0,JAMO,2022-10-31T07:58:20Z,detroitlions,-0.0116784
45979,285267,285267,ldwr011,Don't talk shit about Bubbles.,2.0,nfl,t3_yhilfb,False,0.0,:Lions: Lions,2022-10-30T12:13:49Z,detroitlions,0.4449
46626,289796,289796,modabs,They saw a couple great catches he made in Ben Johnson’s offense and went nuts,141.0,detroitlions,t3_yk901o,False,0.0,MC⚡DC,2022-11-02T11:01:37Z,detroitlions,0.2023
46627,289797,289797,modabs,Why do we get fucked left right and sideways by refs in literally every game? The nfl legit has an agenda against us,-1.0,detroitlions,t3_yk8apy,False,0.0,MC⚡DC,2022-11-02T10:47:14Z,detroitlions,-0.164925
46628,289799,289799,modabs,"Maybe in terms of what we got for the trade, but losing Slay in the middle of what was a revamp, not a rebuild, because some egotistical  fuck got his feelings hurt made a lot less sense than losing a tight end in a non-tight end heavy offense, on an expiring contract, in year 2 of a multi year rebuild.",31.0,detroitlions,t3_yk36aa,False,0.0,MC⚡DC,2022-11-02T07:02:05Z,detroitlions,-0.9666
46629,289800,289800,modabs,"Because they’ll actually use him, it’s almost like he was never schemed properly here",21.0,detroitlions,t3_yjkeek,False,0.0,MC⚡DC,2022-11-01T15:51:13Z,detroitlions,0.2975
46897,293708,293708,my_man_44,Who was OSU quarterback to be good in the pros? It's not a good pattern lol,-4.0,detroitlions,t3_ygrtj9,False,1.0,Nice lead you've got there...,2022-10-29T18:16:39Z,detroitlions,0.1607
47042,294755,294755,nameisEmery,That throw to Hock was understated. That was exactly where it needed to be. Good on Hock for the YAC but goddamn that was a beauty.,19.0,detroitlions,t3_yhgf44,False,0.0,Ooooh Yeahhhh!,2022-10-30T12:24:15Z,detroitlions,0.1529333333333333
47043,294756,294756,nameisEmery,Joseph is a hard. Fucking. Hitter. 2 big FF in 2 games with huge hits. Love it.,14.0,detroitlions,t3_yhgf44,False,0.0,Ooooh Yeahhhh!,2022-10-30T12:17:12Z,detroitlions,0.155483136
48281,301648,301648,qoqmarley," Five sacks in seven games played is really good for a rookie pass rusher. He is on pace for a 10 sack season. If he does that he will be in some elite company. Hell if he only gets one more sack, he will move past JJ Watts rookie year stats.",24.0,nfl,t3_ykgxbd,False,0.0,:Lions: Lions,2022-11-02T19:12:31Z,detroitlions,-0.105893359375
48341,303235,303235,reubenheart,"He’s the worst pick, not the worst player. What I mean is, given where our team was at at that moment, the player we would have taken otherwise would have been transformative to the franchise and that current team’s trajectory. We could very well have won it all that year. Our defense was already historically great. At AD to that, next to prime Suh? Sky’s the limit. Conversely for eg. Mike Williams was picked last minute instead of Demarcus Ware. Another brutal what if, but Ware would have been a building block in an at best mediocre team, it wouldn’t have instantly translated to post season success. In 2014 we were a stacked team already and Ebron gave us 25 catches and 1 TD that year.",3.0,detroitlions,t3_yjej5e,False,0.0,Nice lead you've got there...,2022-11-01T17:18:34Z,detroitlions,0.0075430755336299
48342,303237,303237,reubenheart,"No he's the worst because we would have taken Aaron Donald otherwise. That was the 2014 draft, when we had prime Suh and would go 11-5. With AD, I think we make a deep playoff run instead of getting bounced by the 'boys in the first round. Suh and AD would have been lights out for a few years at least. Ebron didn't did shit for us.",7.0,detroitlions,t3_yjej5e,False,0.0,Nice lead you've got there...,2022-11-01T15:47:38Z,detroitlions,0.08874224
48343,303238,303238,reubenheart,Eric Ebron. Our worst pick ever.,39.0,detroitlions,t3_yjej5e,False,0.0,Nice lead you've got there...,2022-11-01T12:21:14Z,detroitlions,-0.31245
49243,308501,308501,silentguy876,ahh yes the lions of the last 8 years,-1.0,detroitlions,t3_yid0pd,False,1.0,I wanna die,2022-10-31T09:37:46Z,detroitlions,0.4019
49244,308502,308502,silentguy876,"You'd rather be the Raiders with McDaniel? If you think losing with this team is bad, the raiders were projected to win more than 8 games and traded for Davante Adams who just had a whooping 17 yrds in a game",3.0,detroitlions,t3_yid0pd,False,1.0,I wanna die,2022-10-31T09:23:39Z,detroitlions,-0.1591
49245,308504,308504,silentguy876,"let me just ignore all of it because theres one point i cant bear to listen over and over again as a negative to someone's blocking. 

NOT ALL HOLDINGS ARE THE LINEMAN/BLOCKERS FAULT. I keep seeing this as a negative against hockenson and now Penei, that because of holding they are bad blockers. 

It most often is them blocking correctly and the runner/guy with the ball bouncing to a position where a legal block would constitute as holding.",3.0,detroitlions,t3_yhzur8,False,0.0,I wanna die,2022-10-30T23:03:36Z,detroitlions,-0.212753125
49246,308505,308505,silentguy876,"> Caldwell was the best coach the Lions have had in at least the last 10 years.

And yet it was the right call to move on from him, what happened after him does not mean it wasnt the right decision",28.0,nfl,t3_yhrbk7,False,0.0,:Lions: Lions,2022-10-30T21:27:45Z,detroitlions,0.159225
49247,308506,308506,silentguy876,"not to be overly optimistic, but except for the bills they all look winnable. 

We'll still only win 2 of those games but hey, the chance is there",-2.0,detroitlions,t3_yho1tg,False,1.0,I wanna die,2022-10-30T14:55:43Z,detroitlions,0.46325
49248,308508,308508,silentguy876,my god is hutch getting held,18.0,detroitlions,t3_yhgf44,False,0.0,I wanna die,2022-10-30T14:08:21Z,detroitlions,0.2732
49249,308511,308511,silentguy876,i guess thats why Parker was cut to start the season,3.0,detroitlions,t3_yhgf44,False,0.0,I wanna die,2022-10-30T12:55:57Z,detroitlions,-0.2732
49250,308513,308513,silentguy876,i find it weird that we are reviewing it for it to be a fumble against us but because it went out of bounds its still our ball,3.0,detroitlions,t3_yhgf44,False,0.0,I wanna die,2022-10-30T12:41:20Z,detroitlions,-0.09
49251,308514,308514,silentguy876,"RPO on the fumble play, thats going to kill us all game",4.0,detroitlions,t3_yhgf44,False,0.0,I wanna die,2022-10-30T12:17:28Z,detroitlions,-0.5106
49252,308515,308515,silentguy876,my god that celebration GOATED,8.0,detroitlions,t3_yhgf44,False,0.0,I wanna die,2022-10-30T12:08:16Z,detroitlions,0.2732
49657,310634,310634,sliccricc83,Once again I'm telling you we should nationalize the lions. Anyone who ran for governor on the platform of making them OUR lions would win with record breaking bipartisan support,11.0,detroitlions,t3_yk67rq,False,0.0,Commin' 4 Dem Kneecaps,2022-11-02T09:44:35Z,detroitlions,0.37895
49658,310640,310640,sliccricc83,Position coaches always fall on their swords for the higher ups. Just the way the game is played,1.0,detroitlions,t3_yih2cp,False,0.0,Commin' 4 Dem Kneecaps,2022-10-31T12:10:58Z,detroitlions,0.17
49659,310644,310644,sliccricc83,Petition to rename scary terry very scary terry,55.0,nfl,t3_yhtgri,False,0.0,:Lions: Lions,2022-10-30T18:43:08Z,detroitlions,-0.7713
49660,310645,310645,sliccricc83,Don't drag the Tennessee Valley Authority into this,216.0,nfl,t3_yfvjmi,False,0.0,:Lions: Lions,2022-10-28T16:03:33Z,detroitlions,0.242
51005,313490,313490,smokeshowliker,Hello mr Glenn if u could stop third and longs it would be greatly appreciated,4.0,detroitlions,t3_yhgf44,False,0.0,Dan Friggin' Campbell,2022-10-30T13:11:53Z,detroitlions,0.3384
