,Unnamed: 0.1,Unnamed: 0,author,body,score,subreddit,link_id,over_18,controversiality,author_flair_text,created_utc,flair,sentiment
21065,109495,109495,Jruzzin,"Idk why this got downvoted. They have 1 win against the worst team in the league, this is literally the most likely outcome.",5.0,detroitlions,t3_yfncjw,False,0.0,Yas Lions,2022-10-28T11:31:07Z,detroitlions,-0.064275
21066,109496,109496,Jruzzin,"^(Oof, you're going to keep losing money this season then my man.)",2.0,detroitlions,t3_yfdr90,False,0.0,Yas Lions,2022-10-28T08:54:36Z,detroitlions,-0.3818
21067,109497,109497,Jruzzin,"
That would be nice. No chance though.",2.0,detroitlions,t3_yfjv5p,False,0.0,Yas Lions,2022-10-28T08:11:35Z,detroitlions,0.0115249999999999
21635,112930,112930,Kewlerd,"I think that’s it 
Weird how college teams are now playing NFL teams",4.0,seahawks,t3_yk8h92,False,0.0,:det1:​,2022-11-02T12:36:55Z,detroitlions,0.0258
21636,112934,112934,Kewlerd,Good,1.0,nfl,t3_yjjygg,False,1.0,:Lions: Lions,2022-11-01T15:15:38Z,detroitlions,0.4404
21637,112936,112936,Kewlerd,Bears in our division and just got better.,1.0,detroitlions,t3_yjfuj6,False,0.0,Sun God,2022-11-01T13:00:29Z,detroitlions,0.4404
21638,112937,112937,Kewlerd,I like this,4.0,nfl,t3_yj7lcb,False,0.0,:Lions: Lions,2022-11-01T08:54:44Z,detroitlions,0.3612
21639,112938,112938,Kewlerd,Draft wise though we’re at the top 😎,32.0,nfl,t3_yj7lcb,False,0.0,:Lions: Lions,2022-11-01T07:49:44Z,detroitlions,0.7845
21640,112939,112939,Kewlerd,Ruined SCORIGAMI with extra point :(,1.0,nfl,t3_yisqtg,False,0.0,:Lions: Lions,2022-10-31T21:49:56Z,detroitlions,-0.7184
21641,112941,112941,Kewlerd,FUCK YOU BENGALS,4.0,nfl,t3_yisqtg,False,0.0,:Lions: Lions,2022-10-31T21:44:33Z,detroitlions,-0.5423
21642,112942,112942,Kewlerd,MISS IT MISS IT WE NEED SCORIGAMI,2.0,nfl,t3_yisqtg,False,0.0,:Lions: Lions,2022-10-31T21:44:06Z,detroitlions,-0.296
21643,112943,112943,Kewlerd,"WERE SO CLOSE TO SCORIGAMI. Just get a TD Bengals, go for 2 because you have nothing to lose, and miss it. 32-12",7.0,nfl,t3_yisqtg,False,0.0,:Lions: Lions,2022-10-31T21:38:19Z,detroitlions,0.0186111111111111
21644,112947,112947,Kewlerd,"The only possible shutoutigamis within 50 points are 4-0 and 46-0

I’m sad now",1.0,nfl,t3_yisqtg,False,0.0,:Lions: Lions,2022-10-31T20:56:41Z,detroitlions,-0.4767
21645,112951,112951,Kewlerd,But we ourselves are dumpster fire of a game,1.0,detroitlions,t3_yhuifx,False,0.0,Sun God,2022-10-31T10:45:50Z,detroitlions,-0.6124
21646,112952,112952,Kewlerd, Yep,7.0,nfl,t3_yhu9yo,False,0.0,:Lions: Lions,2022-10-30T18:50:26Z,detroitlions,0.296
21647,112953,112953,Kewlerd,Sure! Let’s start with a super bowl winning quarter back. Let’s start with this Matthew Stafford guy. I’m sure he’ll bring us victory,3.0,detroitlions,t3_yhq8ss,False,0.0,Sun God,2022-10-30T17:02:10Z,detroitlions,0.09365078125
21648,112954,112954,Kewlerd,I think I am immune from being sad after losing now,3.0,detroitlions,t3_yhocr7,False,0.0,Sun God,2022-10-30T15:04:04Z,detroitlions,-0.5423
21649,112955,112955,Kewlerd,If we score 13 straight points and don’t let the dolphins score at all it’s scorigami,2.0,detroitlions,t3_yhgf44,False,0.0,Sun God,2022-10-30T14:21:59Z,detroitlions,0.2263
21650,112957,112957,Kewlerd,BIG COCK HOCK,1.0,detroitlions,t3_yhgf44,False,0.0,Sun God,2022-10-30T12:21:13Z,detroitlions,-0.1531
22145,119378,119378,Kstoffeefan,"You don’t need first rounders to contribute on defence to have a good defence.  Building a great defence is about making the most of day 2-3 picks.  Some of the best players on this defence, and ones that could play on other teams are 2nd, 3rd, and 6th rounders.",1.0,detroitlions,t3_yifhn5,False,0.0,Welcome to Detroit!,2022-10-31T13:24:07Z,detroitlions,0.3611481481481481
22146,119380,119380,Kstoffeefan,"I agree that it wasn’t a sure thing, and that Swift is likely covered there, but the photo lacks all context.  We don’t know what the exact routes are called for the play.  Swift stops when he sees Goff staring down field.  St Brown has two steps on his defender and is past the line of scrimmage; a well placed ball here to St. Brown’s left side gets the yardage.",0.0,detroitlions,t3_yhnx6y,False,0.0,Welcome to Detroit!,2022-10-30T20:25:43Z,detroitlions,0.100483984375
22147,119392,119392,Kstoffeefan,Jamo was also teammates with Stroud which is a weird fact.,9.0,detroitlions,t3_ygrtj9,False,0.0,Welcome to Detroit!,2022-10-29T14:38:40Z,detroitlions,-0.1779
22426,125747,125747,LionintheATL,Another year wasted for Rodgers is a year we all support. FTP is the mantra of the NFCN for a reason,1.0,nfl,t3_yjqq4u,False,0.0,:Lions: Lions :NFL: NFL,2022-11-01T20:24:49Z,detroitlions,-0.032
22427,125748,125748,LionintheATL,I personally see that as a win for the rest of the NFCN,10.0,nfl,t3_yjqq4u,False,0.0,:Lions: Lions :NFL: NFL,2022-11-01T19:53:50Z,detroitlions,0.5859
22428,125752,125752,LionintheATL,The Commanders are the only team to have lost to the Lions. You’ll be fine,5.0,nfl,t3_yhu9bi,False,0.0,:Lions: Lions :NFL: NFL,2022-10-30T21:10:31Z,detroitlions,0.0216
23020,126964,126964,LionsC2H5OH,You have fun drafting another QB with your first round,7.0,detroitlions,t3_ykfxbu,False,0.0,Ragnowrok,2022-11-02T15:38:08Z,detroitlions,0.5106
23021,126965,126965,LionsC2H5OH,"Reminder that Goff has been to the super bowl more recently than A-A-Ron.

So much for ""coming in peace"" FTP",14.0,detroitlions,t3_ykfxbu,False,0.0,Ragnowrok,2022-11-02T15:37:42Z,detroitlions,0.421
23469,128570,128570,LionsSchemer,"Ah yes, because the team I root for also did something I didn’t agree with (and a totally different injury that has proven to be much less impactful) i should be willing to take players who have an insanely high ridk of never matching their talent again?",1.0,nfl,t3_yil0rg,False,0.0,:Lions: Lions,2022-11-01T09:39:35Z,detroitlions,-0.0542
23471,128573,128573,LionsSchemer,"Could be, I still veer on the side the Achillies are not worth the risk no matter what, seen it kill so much talent the last few years. Dont really blame teams for not wanting that risk",4.0,nfl,t3_yil0rg,False,0.0,:Lions: Lions,2022-10-31T14:04:09Z,detroitlions,0.142625
24866,137141,137141,MichiganMedium,"Thing about the Slay trade is that he should have been traded the year prior.  
Hear me out - Slay was a good player for the lions but they should have realized their assets and utilized them to build instead of shipping him out in a spat at the end of a contract. The interest and demand he would have drawn a year earlier likely would have netted more than his actual trade.   
The Hockenson situation seems similar to me except that they moved when they should have so as to maximize his return.  They get much less for TJ if he’s moved next year at the end of his contract and after so many snaps.",6.0,detroitlions,t3_yk36aa,False,0.0,Tecmo Barry,2022-11-02T07:29:52Z,detroitlions,0.00362368
24867,137142,137142,MichiganMedium,It’s tough to grade him strictly in the TE arena when many games he’s relied upon to be the teams #1 receiver.,2.0,detroitlions,t3_yjmy5z,False,0.0,Tecmo Barry,2022-11-01T18:55:04Z,detroitlions,-0.128
24868,137143,137143,MichiganMedium,"The point seems to be that they’re getting anything for him at all since he likely would not have extended and even if he did it certainly wouldn’t have been for cheap.   
Reminds me of what should have happened with Slay. Traded for a 4th when he could have fetched more the year prior.  This was the time to move him if they were going to.",1.0,detroitlions,t3_yjoa61,False,0.0,Tecmo Barry,2022-11-01T18:30:58Z,detroitlions,0.001328125
25892,147063,147063,OlacAttack,First time I’ve seen it and it’s funny,1.0,nfl,t3_yhilfb,False,0.0,:Lions: Lions,2022-10-30T14:31:10Z,detroitlions,0.4404
25893,147064,147064,OlacAttack,"“Michigan legacy makeup artist”

Lmao, this is gold",1.0,nfl,t3_yhilfb,False,0.0,:Lions: Lions,2022-10-30T14:29:44Z,detroitlions,0.5994
25894,147065,147065,OlacAttack,Did Anzalone slap the ref on the shoulder after that Hill run?,5.0,detroitlions,t3_yhgf44,False,0.0,DETROIT -VS- EVERYBODY,2022-10-30T14:09:40Z,detroitlions,0.1531
25895,147068,147068,OlacAttack,This is my favorite story of the day,1.0,detroitlions,t3_yhgf44,False,0.0,DETROIT -VS- EVERYBODY,2022-10-30T12:59:16Z,detroitlions,0.4588
26125,150797,150797,PM_ME_UR_HIP_DIMPLES,If they are taking on purpose they aren’t hiding it well,1.0,detroitlions,t3_yhgf44,False,0.0,JAMO,2022-10-30T13:59:44Z,detroitlions,-0.0258
26126,150798,150798,PM_ME_UR_HIP_DIMPLES,They could tell us the play and who they are throwing to and convert,8.0,detroitlions,t3_yhgf44,False,0.0,JAMO,2022-10-30T12:58:38Z,detroitlions,0.34
26127,150799,150799,PM_ME_UR_HIP_DIMPLES,My goodness. It’s the. The…. The…ENDZONE?!,4.0,detroitlions,t3_yhgf44,False,0.0,JAMO,2022-10-30T12:07:46Z,detroitlions,0.000146816
26373,151343,151343,ParticularCanary3130,Watch the Vikings win the super bowl this year with him. Lol They at least seem to have the division. The only part I'm sad about with this trade is that it's in division. That's going to hurt seeing him on the other side :(,1.0,detroitlions,t3_yjd7vm,False,0.0,Sun God,2022-11-01T11:45:24Z,detroitlions,-0.205726953125
26374,151344,151344,ParticularCanary3130,But has he Played like an 8th overall.....no,2.0,detroitlions,t3_yjd7vm,False,0.0,Sun God,2022-11-01T11:42:32Z,detroitlions,0.7469
27061,152561,152561,Pinkaroundme,Reynolds used to Goff’s ducks. He throws a dart and couldn’t come up with it. All good. Glad we got something on that last drive,0.0,detroitlions,t3_yhgf44,False,0.0,Growley Cats,2022-10-30T13:30:55Z,detroitlions,0.142225
27062,152562,152562,Pinkaroundme,Goff is playing lights out rn,8.0,detroitlions,t3_yhgf44,False,0.0,Growley Cats,2022-10-30T13:26:41Z,detroitlions,0.2023
27063,152563,152563,Pinkaroundme,No one,4.0,detroitlions,t3_yhgf44,False,0.0,Growley Cats,2022-10-30T12:35:48Z,detroitlions,-0.296
27064,152564,152564,Pinkaroundme,Got to love teams getting an extra 4 downs against us every fucking game,14.0,detroitlions,t3_yhgf44,False,0.0,Growley Cats,2022-10-30T12:35:31Z,detroitlions,0.6369
28537,164147,164147,RedWingWay,F5 F5 F5 This crap. F5 F5,2.0,nfl,t3_yjiacj,False,0.0,:Lions: Lions,2022-11-01T14:20:41Z,detroitlions,-0.1147
28538,164150,164150,RedWingWay,Just happy it wasn't GB.,8.0,nfl,t3_yjd7dk,False,0.0,:Lions: Lions,2022-11-01T11:54:04Z,detroitlions,0.5719
28539,164151,164151,RedWingWay,We are in full rebuild and Hock has a massive contract coming down the barrel next season. This makes sense for Detroit. If you can get a second for him it is a very good move for Detroit.,19.0,nfl,t3_yjd7dk,False,0.0,:Lions: Lions,2022-11-01T11:42:04Z,detroitlions,0.1642333333333333
28540,164153,164153,RedWingWay,Other NFC North brothers don't forget for just a dollar a day YOU can help a Lions fan beer fund.,8.0,nfl,t3_yhueqk,False,0.0,:Lions: Lions,2022-10-30T19:06:52Z,detroitlions,0.0601
28541,164156,164156,RedWingWay,I have read this twice. My dick is now in the ceiling fan. I am awaiting further instructions.,1.0,nfl,t3_yhobjl,False,0.0,:Lions: Lions,2022-10-30T15:14:53Z,detroitlions,-0.0277777777777777
28542,164161,164161,RedWingWay,So Help Me Todd Bowles.,1.0,nfl,t3_yhilfb,False,0.0,:Lions: Lions,2022-10-30T12:52:40Z,detroitlions,0.4576
28543,164162,164162,RedWingWay,Can Barry play today?,3.0,nfl,t3_yhilfb,False,0.0,:Lions: Lions,2022-10-30T12:03:02Z,detroitlions,0.34
28544,164164,164164,RedWingWay,Swift. The fastest car always in the garage.,3.0,nfl,t3_yhilfb,False,0.0,:Lions: Lions,2022-10-30T11:56:31Z,detroitlions,0.050575
28545,164166,164166,RedWingWay,"Hello Dolphins. 

Welcome to the self depreciating, miserable drunk Detroit Lions fan base. May we all rejoice in no injuries, few flags and the promise of a Monday not pissed off at work for the 3 millionth time.",12.0,nfl,t3_yhilfb,False,0.0,:Lions: Lions,2022-10-30T11:48:00Z,detroitlions,0.2408222222222222
28546,164168,164168,RedWingWay,"Broncos Country 

Lets Ride Share!",0.0,nfl,t3_yhdqmn,False,0.0,:Lions: Lions,2022-10-30T10:41:27Z,detroitlions,0.3595
28547,164169,164169,RedWingWay,Listening to this both is like watching The View. Can they shut up for 5 seconds?,5.0,nfl,t3_yhdqmn,False,0.0,:Lions: Lions,2022-10-30T10:23:01Z,detroitlions,0.0903
28548,164171,164171,RedWingWay,"Looks at documents in computer.

Opens a 1TB file titled Lions Choke Jobs",1.0,nfl,t3_yg6l2u,False,0.0,:Lions: Lions,2022-10-29T11:04:17Z,detroitlions,-0.27115
28549,164172,164172,RedWingWay,People who can play football,1.0,nfl,t3_ygl7by,False,0.0,:Lions: Lions,2022-10-29T11:00:27Z,detroitlions,0.34
28550,164173,164173,RedWingWay,Looks like Twitter founder Jack Dorsey is almost finished a new social media platform to rival twitter. This might get interesting.,12.0,nfl,t3_yfoylw,False,0.0,:Lions: Lions,2022-10-28T10:44:52Z,detroitlions,0.29125
28954,165980,165980,RelativeMacaron1585,"I would die, please God no",3.0,detroitlions,t3_yjgbj9,False,0.0,MC⚡DC,2022-11-01T19:19:53Z,detroitlions,-0.4019
28955,165981,165981,RelativeMacaron1585,"The Goff haters are more vocal than the Goff supporters, I personally wouldn't say that this sub's consensus is that we even go for a QB. We have 2 first round picks, I personally say we use our first (and literally every single other one) on the defense and if a QB somehow (unlikely imo) falls to our second first rounder then we take him, if that's not the scenario then I say we just buff up our defense. We have been shown multiple times that the offense is not the issue with this team. Goff has played fantastic all year barring the game against NE (though the entire team collapsed) and the game against Dallas (one of the best Defenses in the League). Goff is not an elite QB but there's no reason to get a QB if he's a perfectly suitable QB for now.",1.0,detroitlions,t3_yifhn5,False,0.0,MC⚡DC,2022-11-01T01:22:24Z,detroitlions,0.155611296
28956,165982,165982,RelativeMacaron1585,WOW GOFF AMAZING PLAY,4.0,detroitlions,t3_yhgf44,False,0.0,MC⚡DC,2022-10-30T13:26:55Z,detroitlions,0.875
28957,165983,165983,RelativeMacaron1585,I missed these 4th down attempts,6.0,detroitlions,t3_yhgf44,False,0.0,MC⚡DC,2022-10-30T13:26:30Z,detroitlions,-0.296
28958,165986,165986,RelativeMacaron1585,Good choice MCDC,9.0,detroitlions,t3_yhgf44,False,0.0,MC⚡DC,2022-10-30T12:40:40Z,detroitlions,0.4404
28959,165989,165989,RelativeMacaron1585,"Tbf, someone posted a video of him flipped so it looked like he was right handed and he looked really good. I think it's some weird thing because he's left handed",2.0,detroitlions,t3_yhgf44,False,0.0,MC⚡DC,2022-10-30T12:34:11Z,detroitlions,0.0897
28960,165991,165991,RelativeMacaron1585,"Even the refs aren't blind, what's going on?????",4.0,detroitlions,t3_yhgf44,False,0.0,MC⚡DC,2022-10-30T12:29:11Z,detroitlions,0.12425
28961,166000,166000,RelativeMacaron1585,I think it did lol,2.0,detroitlions,t3_yhgf44,False,0.0,MC⚡DC,2022-10-30T12:12:26Z,detroitlions,0.4215
29080,169656,169656,RoyalRaptor711,"He spelled skol wrong. Anyway, I'll miss hock. Was one of my favorite Lions and the first jersey I got for the team.",105.0,detroitlions,t3_yjjrmo,False,0.0,JAMO,2022-11-01T15:12:53Z,detroitlions,0.1182666666666666
29979,176724,176724,Shavon1,Has to be Young or Stroud. Not a fan of Levis or Richardson.,10.0,detroitlions,t3_yjx4kn,False,0.0,Ragnowrok,2022-11-02T01:14:17Z,detroitlions,-0.12055
30127,177886,177886,ShippingNotIncluded,1st ballot 15mins of Fame Hall of Famer,2.0,detroitlions,t3_ykbt5g,False,0.0,70s logo,2022-11-02T14:22:55Z,detroitlions,0.4404
30128,177887,177887,ShippingNotIncluded,The new curse,2.0,detroitlions,t3_yk67rq,False,0.0,70s logo,2022-11-02T14:18:12Z,detroitlions,-0.5423
30129,177892,177892,ShippingNotIncluded,"I think fans are mad they attached draft picks with him, but realistically that just means he’s not worth a 2nd rounder straight up.

I like the trade, Hockerson was good but not game changer level for a TE",20.0,detroitlions,t3_yjskfo,False,0.0,70s logo,2022-11-01T21:27:41Z,detroitlions,0.1534749999999999
30130,177895,177895,ShippingNotIncluded,"Trust me, we didn’t have to make this trade to go into “tank mode”

We’ve been in “suck mode” for close to a decade now",3.0,detroitlions,t3_yjia08,False,0.0,70s logo,2022-11-01T15:41:55Z,detroitlions,0.5106
30131,177896,177896,ShippingNotIncluded,"Average to above-average TE at best. Never lived up to the hype which sucks for Detroit, but no longer matters for his new team.

With that being said, he’ll probably be 10x better now",38.0,detroitlions,t3_yjkeek,False,0.0,70s logo,2022-11-01T15:39:09Z,detroitlions,0.1074666666666666
30132,177898,177898,ShippingNotIncluded,lol they not us,1.0,detroitlions,t3_yjijdm,False,0.0,70s logo,2022-11-01T15:36:25Z,detroitlions,0.4215
30133,177899,177899,ShippingNotIncluded,"*“A lot of people”*

Ngl I laughed when I read that",-10.0,detroitlions,t3_yjej5e,False,0.0,70s logo,2022-11-01T15:20:48Z,detroitlions,0.4588
30134,177902,177902,ShippingNotIncluded,Source: Trust me bro,1.0,detroitlions,t3_yjgbj9,False,0.0,70s logo,2022-11-01T13:34:10Z,detroitlions,0.5106
30135,177903,177903,ShippingNotIncluded,"No doubt there were some, but I believe the majority was on board with vs Ed Oliver",2.0,detroitlions,t3_yjej5e,False,0.0,70s logo,2022-11-01T13:33:17Z,detroitlions,0.1419
30136,177906,177906,ShippingNotIncluded,"So 30yrs of mediocrity was cool, but you draw the line giving away an underperforming TE?

😂😂😂",3.0,detroitlions,t3_yjep9f,False,0.0,70s logo,2022-11-01T12:40:09Z,detroitlions,0.5478999999999999
30137,177907,177907,ShippingNotIncluded,I thought the W-L record was a dead giveaway,8.0,detroitlions,t3_yjesve,False,0.0,70s logo,2022-11-01T12:38:02Z,detroitlions,-0.6486
30138,177908,177908,ShippingNotIncluded,"I loved how this sub hated drafting Ebron that high, but was totally cool with picking Hock a few years later…I wonder why 🙃",-4.0,detroitlions,t3_yjej5e,False,1.0,70s logo,2022-11-01T12:31:51Z,detroitlions,0.5006
30139,177910,177910,ShippingNotIncluded,"lol I was confused when he said Top 5, like where? Top 5 in the Midwest? Allen Park? 5mi radius?",6.0,detroitlions,t3_yjduei,False,0.0,70s logo,2022-11-01T12:06:18Z,detroitlions,0.005449609375
30140,177911,177911,ShippingNotIncluded,"You tripping, the Lions lucky they even got this for him. Hockerson never lived up to the Top 10 hype",2.0,detroitlions,t3_yjdxnv,False,0.0,70s logo,2022-11-01T12:04:06Z,detroitlions,0.206525
30141,177912,177912,ShippingNotIncluded,At the end of the season if this team doesn’t have more wins than last season,1.0,detroitlions,t3_yjaf9u,False,0.0,70s logo,2022-11-01T11:58:10Z,detroitlions,0.6115
30142,177913,177913,ShippingNotIncluded,End of an *error*,-1.0,detroitlions,t3_yjd7vm,False,0.0,70s logo,2022-11-01T11:49:48Z,detroitlions,-0.4019
30143,177914,177914,ShippingNotIncluded,"Did he give a reasoning why he left out the 2020 class (Burrow, Tua, Herbert) , probably one of the strongest QB classes in recent memory?",12.0,detroitlions,t3_yjaqlc,False,0.0,70s logo,2022-11-01T10:22:46Z,detroitlions,0.4404
30144,177922,177922,ShippingNotIncluded,"History says you’re right. Not many HCs start of this poorly and turn out to be good.

3 seasons the charm. Most fans will be tired of him if they start off this bad next season",6.0,detroitlions,t3_yilzuu,False,0.0,70s logo,2022-10-31T16:37:04Z,detroitlions,-0.166
30145,177923,177923,ShippingNotIncluded,More potential and better track record of being this good of a QB.,1.0,detroitlions,t3_yiocev,False,0.0,70s logo,2022-10-31T16:27:49Z,detroitlions,0.7607
30146,177926,177926,ShippingNotIncluded,"IMO this move isn’t going to drastically change the play on the field because Pleasant wasn’t out there lining up or calling plays (to my knowledge).

This entire staff should be held accountable for the regression of the defense.",2.0,detroitlions,t3_yih2cp,False,0.0,70s logo,2022-10-31T14:17:54Z,detroitlions,0.256925
30147,177927,177927,ShippingNotIncluded,"Dude been inconsistent his whole career. That’s exactly why LA dumped him, only a foolish team (uh oh) would entertain the thought of keeping him long term

Bridge QB at best",1.0,detroitlions,t3_yii7fq,False,0.0,70s logo,2022-10-31T14:14:28Z,detroitlions,0.20095
30148,177928,177928,ShippingNotIncluded,Is he going to fire himself for his mental errors?,-9.0,detroitlions,t3_yikf3c,False,0.0,70s logo,2022-10-31T14:11:57Z,detroitlions,-0.5859
30149,177929,177929,ShippingNotIncluded,0pts in the 2nd half isn’t good no matter how you spin it. It’s on him and the rest of the “Goffense”,2.0,detroitlions,t3_yilal0,False,0.0,70s logo,2022-10-31T14:10:15Z,detroitlions,0.106625
30150,177930,177930,ShippingNotIncluded,"Wrong head, especially if he’s credited with Okudah turning it around.


IMO this is just foreshadowing of the DC getting canned at season’s end, and Campbell the following",4.0,detroitlions,t3_yih2cp,False,1.0,70s logo,2022-10-31T14:08:43Z,detroitlions,-0.021625
30151,177933,177933,ShippingNotIncluded,Tanking? This team just this bad,8.0,detroitlions,t3_yhogh0,False,0.0,70s logo,2022-10-30T15:08:48Z,detroitlions,-0.314
30152,177937,177937,ShippingNotIncluded,This aged well,3.0,detroitlions,t3_ygrtj9,False,0.0,70s logo,2022-10-30T07:03:16Z,detroitlions,0.2732
30153,177938,177938,ShippingNotIncluded,lol pass on Bryce Young to draft JJ McCarthy…UofM finally beats MSU and y’all start fooling,18.0,detroitlions,t3_yh28g8,False,0.0,70s logo,2022-10-29T23:21:32Z,detroitlions,0.4278
30154,177939,177939,ShippingNotIncluded,I don’t want Bobby Lane,3.0,detroitlions,t3_yh38z3,False,0.0,70s logo,2022-10-29T22:51:49Z,detroitlions,0.0772
30155,177943,177943,ShippingNotIncluded,"Shinola Hotel

Visit Riverwalk 

Try a Coney

Josh Allen throws 3 INTs, Lions win

You’re welcome",30.0,detroitlions,t3_ygy5z3,False,0.0,70s logo,2022-10-29T18:28:32Z,detroitlions,0.7783
30156,177945,177945,ShippingNotIncluded,"Nobody would be hating on CJ Stroud if he went to Oklahoma State instead of OSU.

Hell, Fields has ZERO help and somehow has more wins than we have right now.",15.0,detroitlions,t3_ygu3u3,False,0.0,70s logo,2022-10-29T18:22:14Z,detroitlions,0.0081499999999999
30157,177950,177950,ShippingNotIncluded,"Even if he struggles against them, it shouldn’t negate the massive improvement he’s had",33.0,detroitlions,t3_yfso83,False,0.0,70s logo,2022-10-28T12:52:03Z,detroitlions,0.128
30158,177951,177951,ShippingNotIncluded,"Did Will Anderson get caught with cocaine, weapons of mass destruction and a dead body in his car?",2.0,detroitlions,t3_yffuis,False,0.0,70s logo,2022-10-28T07:15:03Z,detroitlions,-0.8979
30159,177952,177952,ShippingNotIncluded,The only other team you could’ve made a case for was the Chicago Cubs before they won their WS.,5.0,detroitlions,t3_yfcnxc,False,0.0,70s logo,2022-10-28T07:00:58Z,detroitlions,0.5719
30160,177953,177953,ShippingNotIncluded,It’ll be a miracle if someone gave up a 1st for Hock…just another reason why you don’t draft TEs as high as we did him,42.0,detroitlions,t3_yfjv5p,False,0.0,70s logo,2022-10-28T06:38:20Z,detroitlions,0.5859
32130,185409,185409,SpikedZer0,"True, but they can’t afford to pay him what he will demand. Too much depth behind him to justify paying him a massive contract next offseason. Might as well get value back. Especially without any picks in next years draft.",7.0,denverbroncos,t3_yjgqgg,False,0.0,DT,2022-11-01T13:33:40Z,detroitlions,0.03344296875
32538,186868,186868,Stuffdood,"Yes, fire the guy who would have masterminded a very quick turnaround and created a 6-1 team. What a dumbass comment",18.0,detroitlions,t3_ykbt01,False,0.0,Ooooh Yeahhhh!,2022-11-02T14:06:08Z,detroitlions,-0.19915
32539,186870,186870,Stuffdood,Oh this is Beary interesting,1.0,nfl,t3_yjf5jb,False,0.0,:Lions: Lions,2022-11-01T12:34:32Z,detroitlions,0.4019
32940,191598,191598,TBoneTheOriginal,"Ah, sorry about that. I already updated it with ARSB for desktop but forgot about this one.",3.0,detroitlions,t3_yjq12t,False,0.0,Don't Stop Believin',2022-11-01T21:50:17Z,detroitlions,-0.0193
32941,191600,191600,TBoneTheOriginal,Don’t give a fuck unless Barry’s back eating,6.0,detroitlions,t3_yjd7vm,False,0.0,Don't Stop Believin',2022-11-01T12:22:14Z,detroitlions,-0.5423
32942,191613,191613,TBoneTheOriginal,Wins do create *more* money though. Talking about profits negates OP‘s point of it being a curse.,5.0,detroitlions,t3_yi90yw,False,0.0,Don't Stop Believin',2022-10-31T08:23:49Z,detroitlions,0.098525
32943,191614,191614,TBoneTheOriginal,No doubt lol,1.0,detroitlions,t3_yhgf44,False,0.0,Don't Stop Believin',2022-10-30T13:35:38Z,detroitlions,-0.0572
32944,191615,191615,TBoneTheOriginal,Games like this renew my faith in Goff. He has it in him… Campbell just needs to figure out how to unlock it every week.,9.0,detroitlions,t3_yhgf44,False,0.0,Don't Stop Believin',2022-10-30T13:33:25Z,detroitlions,0.16215
32945,191616,191616,TBoneTheOriginal,"It’s not just ARSB, it’s the entire offense. When things don’t go as planned, Goff struggles. When his weapons are there, he feels more confident.",2.0,detroitlions,t3_yhgf44,False,0.0,Don't Stop Believin',2022-10-30T12:50:50Z,detroitlions,0.0010407407407407
32946,191617,191617,TBoneTheOriginal,I want to see all blues like last week but with a matte blue helmet. Give me all the blue.,1.0,detroitlions,t3_yh0cp7,False,0.0,Don't Stop Believin',2022-10-29T21:26:52Z,detroitlions,0.056575
35306,211627,211627,Try2Relate2AllSides,He started the season healthy. Was injured by halftime week 1.,1.0,nfl,t3_ykfrxh,False,0.0,:Lions: Lions,2022-11-02T21:48:08Z,detroitlions,-0.100475
