,Unnamed: 0.1,Unnamed: 0,author,body,score,subreddit,link_id,over_18,controversiality,author_flair_text,created_utc,flair,sentiment
1063,7020,7020,ADuckUnreal,"I enjoy the atmosphere.

I’m looking forward to going Sunday because I’m not sure how many more opportunities there will be to see Aaron Rodgers play in person.  Even if you hate the guy off the field, he’s one of the best to ever do it on the field.",1.0,detroitlions,t3_yk5x83,False,0.0,Welcome to Detroit!,2022-11-02T10:43:54Z,detroitlions,0.1182592592592592
1064,7022,7022,ADuckUnreal,I don’t think he’s injured often enough for Holmes to be interested 🤣,1.0,detroitlions,t3_yjsh2b,False,0.0,Welcome to Detroit!,2022-11-02T05:40:46Z,detroitlions,0.4939
1065,7024,7024,ADuckUnreal,"I had as much hope for this regime as anybody to start, and I was chugging the koolaid. 

It’s a continuous cycle that keeps repeating, and I feel myself turning more and more sour on this regime (MCDC mostly).  I’m slowly but surely becoming the dreaded (gasp) S.O.L. fan. 

I still watch every game.  I still badly ***WANT*** them to succeed.  I still hold out hope that they will figure it out.  I still rock my Lions gear almost daily.  

But I EXPECT them to lose, and I will continue to expect that until they prove otherwise.",10.0,detroitlions,t3_yjf860,False,0.0,Welcome to Detroit!,2022-11-01T13:04:17Z,detroitlions,-0.0604525484198126
1066,7025,7025,ADuckUnreal,"A few weeks shy of 40.  I remember watching Barry as a kid, and really started following the team when Harrington was drafted.",1.0,detroitlions,t3_yiljo3,False,0.0,Welcome to Detroit!,2022-10-31T17:45:14Z,detroitlions,-0.0625
1067,7026,7026,ADuckUnreal,Found Dan Campbell’s burner account 🤣,0.0,detroitlions,t3_yho4cq,False,0.0,Welcome to Detroit!,2022-10-30T15:28:45Z,detroitlions,0.4939
1580,8083,8083,Acexbandz,Gives them an extra play and our defense is terrible. Better to give them one chance instead of two. If we had a good defense DC would have accepted the penalties well at least the last one.,3.0,detroitlions,t3_yhgf44,False,0.0,Sun God,2022-10-30T13:23:01Z,detroitlions,0.3196888888888889
1581,8084,8084,Acexbandz,"It was single high man, of course he was late! We need to be playing nickel cover 4 or something not no man coverage. AG calls his defense like he’s playing Madden.",2.0,detroitlions,t3_yhgf44,False,0.0,Sun God,2022-10-30T13:00:48Z,detroitlions,0.2396888888888888
1582,8085,8085,Acexbandz,I’m done with AG it’s simple just put out to high safety’s and I guarantee tua under throws several interceptions. AG is calling man against the fastest WR core in the league.. get this guy out of here! Meanwhile Ben Johnson’s coaching his ass off. NO EXCUSES I’m done with him!,4.0,detroitlions,t3_yhgf44,False,0.0,Sun God,2022-10-30T12:58:41Z,detroitlions,-0.1574421875
1583,8086,8086,Acexbandz,I don’t wanna come off as a conspiracy theorist… but it seems every week when the lions get a 3rd down stop there’s always an “illegal contact” to negate it. Not to mention that was definitely a catch/ fumble out of bounds. Lions will always be against the opposing team and the refs. I’m sick of it man.,6.0,detroitlions,t3_yhgf44,False,0.0,Sun God,2022-10-30T12:44:14Z,detroitlions,-0.123016796875
2623,13322,13322,Apollo_Krill,Id like to see Pimpleton elevated.,1.0,nfl,t3_ygr2gi,False,0.0,:Lions: Lions,2022-10-29T22:41:33Z,detroitlions,0.3612
2624,13324,13324,Apollo_Krill,Cornerback or linebacker would be very helpful,2.0,nfl,t3_ygl7by,False,0.0,:Lions: Lions,2022-10-29T15:18:09Z,detroitlions,0.4754
2817,13716,13716,Ardaric42,"Between Paschal and Rodrigo there are some thicc ass thighs on this D

Anyone got the thigh measurables for the upcoming draft class?  We can predict the picks now.",2.0,detroitlions,t3_yf8i0z,True,0.0,MC⚡DC,2022-10-28T00:37:58Z,detroitlions,-0.135575
2984,14462,14462,Arjak987,Oh this stat hurts especially bad,39.0,nfl,t3_ykgxbd,False,0.0,:Lions: Lions,2022-11-02T17:56:37Z,detroitlions,-0.7841
3204,15779,15779,Arro,Lol nice addition,1.0,detroitlions,t3_yhoj0o,True,0.0,Logo,2022-10-30T17:53:36Z,detroitlions,0.6808
5687,31238,31238,BrantMKF,dont like it at all,1.0,detroitlions,t3_yjd9q6,False,0.0,DETROIT -VS- EVERYBODY,2022-11-01T11:37:31Z,detroitlions,-0.2755
5688,31239,31239,BrantMKF,"ill say this again, what happened to the run blocking? it was straight up elite week 1 and 2. it isnt bad right now just not the same at all",3.0,detroitlions,t3_yhgf44,False,0.0,DETROIT -VS- EVERYBODY,2022-10-30T14:40:29Z,detroitlions,0.124525
5689,31240,31240,BrantMKF,why is parker playing over jacobs😭😭😭,6.0,detroitlions,t3_yhgf44,False,0.0,DETROIT -VS- EVERYBODY,2022-10-30T12:57:41Z,detroitlions,-0.8176
5690,31241,31241,BrantMKF,"it just looks weird cuz hes left handed, when u mirror the video his mechanics looks fine",1.0,detroitlions,t3_yhgf44,False,0.0,DETROIT -VS- EVERYBODY,2022-10-30T12:33:52Z,detroitlions,0.0258
6045,33644,33644,CanIGitSumChiknStrpz,It hurts now…. But just wait. It will hurt.,23.0,nfl,t3_ykdt1f,False,0.0,:Lions: Lions,2022-11-02T18:38:56Z,detroitlions,-0.1932222222222222
6477,38200,38200,ChefCurrySauce,This place is a disaster,4.0,detroitlions,t3_ykczhw,False,0.0,Spiciest Memelord,2022-11-02T15:29:54Z,detroitlions,-0.6249
6478,38201,38201,ChefCurrySauce,No one’s trading anything of substance for Jared Goff,27.0,detroitlions,t3_yk65qs,False,0.0,Spiciest Memelord,2022-11-02T09:07:37Z,detroitlions,-0.296
6479,38203,38203,ChefCurrySauce,All I know is that we have probably the least amount of talent in the league and we traded a talented player to a division rival for a pick swap,-1.0,detroitlions,t3_yje60k,False,1.0,Spiciest Memelord,2022-11-01T12:00:41Z,detroitlions,0.7269
6480,38204,38204,ChefCurrySauce,I’m so tired of caring about the draft at Halloween,128.0,detroitlions,t3_yje5a7,False,0.0,Spiciest Memelord,2022-11-01T11:59:13Z,detroitlions,0.0697
6481,38205,38205,ChefCurrySauce,"You’re about to be pummeled with downvotes for this opinion but I agree that a lot of his moves have been sus 

Defensive drafting outside of Hutch (a gimme pick), McNeil (okay), and Rodrigo (a great find) has ranged from bad (Barnes, Melifonwu) to horrific (Levi). 

Not really sure what his deal is with injured players and signing back tons of dudes who suck.

Not ready to say that I don’t like him, because I think he’s proven to be more competent than Campbell, but a lot of his moves are questionable",-5.0,detroitlions,t3_yjduei,False,1.0,Spiciest Memelord,2022-11-01T11:50:50Z,detroitlions,-0.1586962962962963
6482,38206,38206,ChefCurrySauce,I hate this team with all my heart and soul,-11.0,detroitlions,t3_yjdfal,False,1.0,Spiciest Memelord,2022-11-01T11:33:55Z,detroitlions,0.128
6483,38207,38207,ChefCurrySauce,What the fuck is going the fuck on? Are you fucking kidding me?,53.0,detroitlions,t3_yjd7vm,False,0.0,Spiciest Memelord,2022-11-01T11:26:09Z,detroitlions,-0.1095999999999999
6484,38213,38213,ChefCurrySauce,I was agreeing with you and talking about who you were talking to,0.0,detroitlions,t3_yih2cp,False,1.0,Spiciest Memelord,2022-10-31T12:40:26Z,detroitlions,0.34
6485,38215,38215,ChefCurrySauce,Literally all of his comments are going to bat for the organization trying anything and everything to explain why X move was a great move lol,2.0,detroitlions,t3_yih2cp,False,1.0,Spiciest Memelord,2022-10-31T12:28:07Z,detroitlions,0.7845
6486,38216,38216,ChefCurrySauce,Why anyone would want Glenn anywhere near this coaching staff anymore is beyond me,9.0,detroitlions,t3_yihp8t,False,0.0,Spiciest Memelord,2022-10-31T12:02:29Z,detroitlions,0.0772
6487,38217,38217,ChefCurrySauce,"A change at OC inherently marks a change in offensive philosophy/scheme/playcalling.

A change at DB coach doesn’t carry nearly the same implications. The defense is rotten top to bottom - that starts with Aaron Glenn.",5.0,detroitlions,t3_yiha5p,False,0.0,Spiciest Memelord,2022-10-31T11:56:57Z,detroitlions,-0.1003259259259259
6488,38218,38218,ChefCurrySauce,"People who can’t see this for what it is, a “we need a head” move, have no idea about corporate governance.

Extremely transparent and unlikely to result in any meaningful change",24.0,detroitlions,t3_yiha5p,False,0.0,Spiciest Memelord,2022-10-31T11:50:31Z,detroitlions,0.0851
6489,38219,38219,ChefCurrySauce,"This is the biggest “sacrificial lamb” move I’ve ever seen lol 

Also, rebuild’s definitely on track right? This staff is up to 2 firings now. I’m sure that was the plan all along",14.0,detroitlions,t3_yih2cp,False,1.0,Spiciest Memelord,2022-10-31T11:46:35Z,detroitlions,0.1309
7168,39502,39502,Chic-Fil-A_is_Dope,Can’t have anything nice in Detroit,1.0,detroitlions,t3_yhgf44,False,0.0,Sun God,2022-10-30T14:26:42Z,detroitlions,0.4215
7169,39503,39503,Chic-Fil-A_is_Dope,If Amani blows one more coverage I may lose my head,2.0,detroitlions,t3_yhgf44,False,0.0,Sun God,2022-10-30T13:55:38Z,detroitlions,-0.4019
7170,39505,39505,Chic-Fil-A_is_Dope,Every big play is Oruwarie on coverage,2.0,detroitlions,t3_yhgf44,False,0.0,Sun God,2022-10-30T13:12:43Z,detroitlions,0.34
7553,43434,43434,CluelessFlunky,"There's even more of young qbs succeeding with stud wr.

Mahomes to tyreek.

Watson to Hopkins

Josh allen to diggs.

Burrow to Chase

Tua to tyreek 

Herbert to Allen

Hurts to Brown

Stafford to Calvin 

Luck to Hilton

Kyler to Hopkins 

Dak and Amari

Lamar and mandrews I guess.

Since like 2009 I feel like Winston and teddy bridge water are the only qbs that failed with great wrs.",6.0,nfl,t3_yii69r,False,0.0,:Lions: Lions,2022-10-31T15:36:22Z,detroitlions,0.139186048
7554,43441,43441,CluelessFlunky,He's getting a lot of criticism in our sub. Most people agree at this point if there isn't drastic change he should be gone by end of the season.,46.0,nfl,t3_yhrbk7,False,0.0,:Lions: Lions,2022-10-31T04:44:06Z,detroitlions,0.09855
7555,43442,43442,CluelessFlunky,"Just cause matty p and imo campbell aren't the right guys. Doesn't make caldwell good.

Caldwell wasn't awful but he refused to fire his guys that hampered the offense. 

Our oline coach under him was hated from what I remember.

He also would never get the full potential out of the offense. 

Lions had prime stafford. Calvin, golden, and marvin but the offense would never really look amazing till the last quarter where they had to play risky. 

I like caldwell as a coach, but he wasn't taking the lions past the wild card.",1.0,nfl,t3_yhrbk7,False,0.0,:Lions: Lions,2022-10-31T04:42:34Z,detroitlions,0.0124304941177368
7556,43456,43456,CluelessFlunky,I did hear that but I was curious why he isnt like a full on coordinator. Seem like many teams should begging for him to join.,6.0,nfl,t3_yffd1n,False,0.0,:Lions: Lions,2022-10-28T00:40:38Z,detroitlions,0.3042999999999999
7952,44531,44531,CoRe23,C is for Crappy ah ah ah,4.0,detroitlions,t3_yhqi2x,False,0.0,Peni Swell,2022-10-30T17:03:54Z,detroitlions,-0.5574
8162,45861,45861,Codegreenman,The most lions move is winning 3 meaningless games year end and taking us out of the Young/Stroud conversation entirely,4.0,detroitlions,t3_yjo5ye,False,0.0,Sun God,2022-11-01T18:22:23Z,detroitlions,0.128
12465,66817,66817,Diligent_String1966,Thanks coach.,7.0,nfl,t3_ykpe87,False,0.0,:Lions: Lions,2022-11-02T21:57:02Z,detroitlions,0.4404
12466,66818,66818,Diligent_String1966,existence is pain,8.0,nfl,t3_ykpe87,False,0.0,:Lions: Lions,2022-11-02T21:55:37Z,detroitlions,-0.5106
12468,66821,66821,Diligent_String1966,">Okudah on a roll: For all the success the Dolphins had throwing the football Sunday – 382 yards and three touchdowns – only one completion and 18 of those yards came against cornerback Jeff Okudah in his coverage area. Through seven games, Okudah still hasn't allowed a touchdown.

-Tim Twentyman",39.0,nfl,t3_ykpe87,False,0.0,:Lions: Lions,2022-11-02T21:37:48Z,detroitlions,0.0211814814814814
12469,66822,66822,Diligent_String1966,He’s our best LB too.,20.0,nfl,t3_ykpe87,False,0.0,:Lions: Lions,2022-11-02T21:35:03Z,detroitlions,0.6369
12970,67703,67703,DisenfranchisedCynic,"Alright, that’s it. Fuck first round tight ends!",7.0,detroitlions,t3_ykee0i,False,0.0,Sun God,2022-11-02T20:32:28Z,detroitlions,-0.2299
12971,67704,67704,DisenfranchisedCynic,This is the timeline I want.,18.0,detroitlions,t3_ykee0i,False,0.0,Sun God,2022-11-02T20:16:00Z,detroitlions,0.0772
12972,67705,67705,DisenfranchisedCynic,"Do you understand why we had to scrap our defense? Because fat ass Patricia gave the bag to a bunch of players that only work in his shitty bend don’t break defense. Did you watch the game on Monday night? One of Patricia’s guys, Trey Flowers, blew his coverage all night and looked foolish for the bengals. This is a guy BQ and MP gave a 5 year/$90 million deal. It’s not DC’s fault the defense is as shitty as it is. He’s made a few questionable decisions, but the guy is learning on the job with a bunch of practice squad scraps.",1.0,detroitlions,t3_ykcow1,False,0.0,Sun God,2022-11-02T14:26:15Z,detroitlions,-0.0263262553382154
12973,67706,67706,DisenfranchisedCynic,"You guys make way too much about Detroit as a bad destination. You think Cleveland is a better city? If not, how did they have some of the biggest signings the last few years? This is not basketball. The average playing career is very short in football and players are going to go where the money is. That’s why we’re clearing cap space.",60.0,detroitlions,t3_ykdj6r,False,0.0,Sun God,2022-11-02T14:17:07Z,detroitlions,0.0056644568758573
12974,67707,67707,DisenfranchisedCynic,"Y’all are wild. What do you want him to say? “Yeah it wasn’t a good trade in retrospect”. He obviously didn’t feel he was an important enough piece to take into the next couple years. If he doesn’t see him as a key piece in the offense, why wouldn’t he deal him for picks next year?",3.0,detroitlions,t3_ykbt01,False,1.0,Sun God,2022-11-02T14:13:32Z,detroitlions,-0.0382612799999999
12975,67708,67708,DisenfranchisedCynic,"You’re technically right, considering we started with practically nothing. But it’s a textbook rebuild in this case because we have and are in process of clearing all the gnarly contracts off the books and tearing down the remnants of past leadership. It’s not a perpetual rebuild with this front office like it was with past management because we are not holding onto big money players just treading water.",2.0,detroitlions,t3_ykbt01,False,0.0,Sun God,2022-11-02T13:37:28Z,detroitlions,0.1204
12976,67709,67709,DisenfranchisedCynic,"They also have Nick Chubb, Kareem Hunt, Amari Cooper and Miles Garrett. What kind of take is this? You think the browns have a worse roster than us?",6.0,detroitlions,t3_yjr2tr,False,0.0,Sun God,2022-11-01T22:18:12Z,detroitlions,-0.1589
12977,67710,67710,DisenfranchisedCynic,"Yeah, not gonna happen. They weren’t a tight end away from beating the top AFC teams. They barely beat us.",2.0,detroitlions,t3_yjojwb,False,0.0,Sun God,2022-11-01T21:44:00Z,detroitlions,-0.0219259259259259
12978,67711,67711,DisenfranchisedCynic,Awesome. Happy to have you.,1.0,detroitlions,t3_yjl88t,False,0.0,Sun God,2022-11-01T18:25:22Z,detroitlions,0.442175
12979,67713,67713,DisenfranchisedCynic,Might be worth taking a look?,16.0,detroitlions,t3_yjmf04,False,0.0,Sun God,2022-11-01T16:48:53Z,detroitlions,0.2263
12980,67714,67714,DisenfranchisedCynic,Worth the pickup? Asking for a friend…,66.0,nfl,t3_yjmbv4,False,0.0,:Lions: Lions :Lions: Lions,2022-11-01T16:46:23Z,detroitlions,0.056575
12981,67715,67715,DisenfranchisedCynic,Lol hopefully that turns into a bull in a china shop when he’s trucking over DBs.,6.0,detroitlions,t3_yjlvn1,True,0.0,Sun God,2022-11-01T16:41:59Z,detroitlions,0.6705
12982,67716,67716,DisenfranchisedCynic,Great points. Most Detroit fans would rather tread water for eternity than do a thorough rebuild. Hopefully it works out for your 6ers and the lions at some point. May I ask how you came to Lions fandom when you have the best NFC team in your backyard?,5.0,detroitlions,t3_yjl88t,False,0.0,Sun God,2022-11-01T16:39:31Z,detroitlions,0.012534765625
12983,67717,67717,DisenfranchisedCynic,"So it’s not just us who miss in the draft sometimes? Big, if true…",9.0,detroitlions,t3_yjlpy7,False,0.0,Sun God,2022-11-01T16:34:47Z,detroitlions,-0.038275
12984,67720,67720,DisenfranchisedCynic,I agree. They obviously feel that the offense isn’t losing out long-term by dealing him. The picks we got will also be used to move in the draft to get our guys.,1.0,detroitlions,t3_yjkeek,False,0.0,Sun God,2022-11-01T16:02:26Z,detroitlions,-0.0485555555555555
12985,67721,67721,DisenfranchisedCynic,What are you talking about? You’d rather have a first round TE who has only had like 5 great games for us instead of the draft flexibility to turn a mid round first into a top 10 first?,5.0,detroitlions,t3_yjkq62,False,0.0,Sun God,2022-11-01T16:00:34Z,detroitlions,0.43445
12986,67722,67722,DisenfranchisedCynic,Yeah I agree. But since we need so many pieces on defense I’d rather fill other areas with top picks. We need help at almost every position.,1.0,nfl,t3_yjea45,False,0.0,:Lions: Lions :Lions: Lions,2022-11-01T14:55:13Z,detroitlions,0.2051148148148148
12987,67723,67723,DisenfranchisedCynic,You’re a glutton for punishment haha. My fiancé is from Sac so I definitely have a soft spot for them but I’m not what you’d call a fan.,1.0,detroitlions,t3_yjg7qb,False,0.0,Sun God,2022-11-01T14:52:17Z,detroitlions,0.28935
12988,67724,67724,DisenfranchisedCynic,That’s true… but if he goes all we have left is a shot at hitting on draft picks and rookie learning curves. Although 2 top 5s and potentially a top 16 has me torn.,1.0,nfl,t3_yjea45,False,0.0,:Lions: Lions :Lions: Lions,2022-11-01T14:34:29Z,detroitlions,0.07655
12989,67725,67725,DisenfranchisedCynic,"Okay, I hope not. He’s our only consistent on offense right now. Would rather swift go unfortunately.",42.0,detroitlions,t3_yjgbj9,False,0.0,Sun God,2022-11-01T13:19:20Z,detroitlions,-0.0571111111111111
12990,67726,67726,DisenfranchisedCynic,I think you got hit with the laughing stick.,7.0,detroitlions,t3_yjge77,False,0.0,Sun God,2022-11-01T13:18:19Z,detroitlions,0.4939
12991,67727,67727,DisenfranchisedCynic,I think we’re on the same page? I’m in agreement that it’s a good move. Expiring as in after next year…,1.0,detroitlions,t3_yje60k,False,0.0,Sun God,2022-11-01T13:16:40Z,detroitlions,0.0807666666666666
12992,67728,67728,DisenfranchisedCynic,Pistons back on top in Detroit!,13.0,detroitlions,t3_yjg7qb,False,0.0,Sun God,2022-11-01T13:13:12Z,detroitlions,0.2714
12993,67730,67730,DisenfranchisedCynic,"I think swift for a solid secondary piece on a good contract would be great. Carolina dealt their generational RB(CMC) and Foreman has been killing it in his place. Swift is so talented, but it’s a moot point if we can only use him on like 40% of snaps.",2.0,detroitlions,t3_yje82x,False,0.0,Sun God,2022-11-01T12:33:24Z,detroitlions,0.1962851851851852
12994,67731,67731,DisenfranchisedCynic,Swift for Slay lol,11.0,detroitlions,t3_yjefhq,False,0.0,Sun God,2022-11-01T12:29:32Z,detroitlions,0.5574
12995,67732,67732,DisenfranchisedCynic,No worries! Thanks for the response.,1.0,detroitlions,t3_yjd7vm,False,0.0,Sun God,2022-11-01T12:21:45Z,detroitlions,0.316875
12996,67733,67733,DisenfranchisedCynic,"The crosspost had all the trade details in the title instead of redirecting to a link, as well as the r/nfl discussion in it. It’s all good though.",2.0,detroitlions,t3_yjd7vm,False,0.0,Sun God,2022-11-01T12:15:27Z,detroitlions,0.2885
12997,67734,67734,DisenfranchisedCynic,"First you fleece us for Slay, now you want our only decent secondary player? Begone!",60.0,nfl,t3_yjea45,False,0.0,:Lions: Lions :Lions: Lions,2022-11-01T12:13:42Z,detroitlions,0.0193
12998,67735,67735,DisenfranchisedCynic,"Please god, no.",4.0,nfl,t3_yjea45,False,0.0,:Lions: Lions :Lions: Lions,2022-11-01T12:12:26Z,detroitlions,0.5267
12999,67738,67738,DisenfranchisedCynic,"Here’s a take: Same ol’ Lions would have held onto him way too long to where he either walked for a compensatory pick or we had to pay top TE money to keep him, putting us in cap hell once again. This is a forward thinking move, getting draft capital to fix the worst aspects of our team. I love it.",21.0,detroitlions,t3_yje4zc,False,0.0,Sun God,2022-11-01T12:08:01Z,detroitlions,0.1192777777777777
13000,67739,67739,DisenfranchisedCynic,I don’t understand how people can be upset with this. Do people not understand he’s an expiring asset and we need so many pieces on the other side of the ball. We now have so much more capital to move up on our firsts next year.,6.0,detroitlions,t3_yje60k,False,0.0,Sun God,2022-11-01T12:04:12Z,detroitlions,0.0259925925925925
13001,67740,67740,DisenfranchisedCynic,"Bro, no. You want some as volatile as him at the helm? He just bought twitter for twice over its value for his vanity.",15.0,detroitlions,t3_yje7ne,False,0.0,Sun God,2022-11-01T12:01:52Z,detroitlions,0.0512444444444444
13002,67741,67741,DisenfranchisedCynic,"To me, this signals we are going all in on next year and I love it. Clearing cap space to fill major holes we have in FA next year, and obtaining draft capital. I wouldn’t be surprised if we deal that 3rd to move up on either of our firsts next year.",1.0,detroitlions,t3_yjdfal,False,1.0,Sun God,2022-11-01T12:00:06Z,detroitlions,0.0990222222222222
13003,67742,67742,DisenfranchisedCynic,Haha this gave me a shameful laugh.,5.0,nfl,t3_yjd7dk,False,0.0,:Lions: Lions :Lions: Lions,2022-11-01T11:51:42Z,detroitlions,0.5267
13004,67743,67743,DisenfranchisedCynic,Divisional trades **GONE WRONG**,6.0,nfl,t3_yjd7dk,False,0.0,:Lions: Lions :Lions: Lions,2022-11-01T11:50:43Z,detroitlions,-0.5904
13005,67745,67745,DisenfranchisedCynic,"Fuck Dean Blandino in particular, too.",26.0,nfl,t3_yjd7dk,False,0.0,:Lions: Lions :Lions: Lions,2022-11-01T11:44:04Z,detroitlions,-0.5423
13006,67746,67746,DisenfranchisedCynic,"Considering we have a couple other TEs that have shown promise, it’s better to get some value out him before he walks after next year. There is no way we are in a position to pay him what he’d want.",3.0,nfl,t3_yjd7dk,False,0.0,:Lions: Lions :Lions: Lions,2022-11-01T11:42:48Z,detroitlions,0.03215
13007,67747,67747,DisenfranchisedCynic,"Based on Brad Holmes drafting strategy, I wouldn’t be surprised if he deals away that second to move up on one of our two first round draft picks next year.",1.0,nfl,t3_yjd7dk,False,0.0,:Lions: Lions :Lions: Lions,2022-11-01T11:40:42Z,detroitlions,0.2263
13008,67748,67748,DisenfranchisedCynic,All in on the 2023 draft and I’m fucking ready.,2.0,detroitlions,t3_yjd9dm,False,0.0,Sun God,2022-11-01T11:31:38Z,detroitlions,0.4201
13009,67750,67750,DisenfranchisedCynic,"We are a better team on offense than we were last year, for sure. Defensively, we suck. It’s a mixture of subpar players, coaching and injuries. But again, this is year why our rebuild isn’t comparable to other teams. We absolutely gutted our team and have no long contract, big money veterans to fill in the gaps and lead the young guys we do have. It’s a trial by fire for everyone on the defensive side of the ball and we’re getting exposed. All we can do is draft more defense and sign some free agents. I think AG is gone before the end of the season unless he is able to produce some kind of consistent improvement in the next couple weeks.",0.0,detroitlions,t3_yih2cp,False,0.0,Sun God,2022-10-31T19:27:16Z,detroitlions,0.0662818020999431
13010,67751,67751,DisenfranchisedCynic,"If you have about twenty minutes… [this guy](https://youtu.be/X4JfibGjhsk) did a very in-depth breakdown of both Young and Stroud, highlighting their strengths and weaknesses. I learned a lot about both.",1.0,detroitlions,t3_yifhn5,False,0.0,Sun God,2022-10-31T19:04:33Z,detroitlions,0.0129
13011,67752,67752,DisenfranchisedCynic,"The Seahawks definitely were not in a rebuild. They traded Russ and got a lot of draft capital, but that’s not a rebuild. They still had Penny, Lockett, Metcalf, Diggs, a bunch of veterans and then the emergence of Geno and KWIII. 

The giants had a first round Top 10 QB, Saquon Barkley, and a bunch of experience on both sides of the ball. The Jets also have a bunch of top prospects playing with a mix of veteran leadership. 

What did we start with? On defense, we have like 1 or 2 guys from the previous regime? We’re snagging guys off of the practice squad to start games for us. Offense, we started with no wide receiver talent besides hockensen. Now we’ve improved far beyond what those teams are doing offensively. Point is, our rebuild is not the same.",1.0,detroitlions,t3_yih2cp,False,0.0,Sun God,2022-10-31T17:14:46Z,detroitlions,-0.0015445281658194
13012,67753,67753,DisenfranchisedCynic,"A lot of players have openly come out against artificial turf recently. Although it’s not necessarily the source of *all* of our injuries, I believe we should be taking every step we can to reduce the number of injuries to our players. It would be not only an investment in our players, but if even one or two of our injuries are reduced each year, our potential success as well.",7.0,detroitlions,t3_yik1pd,False,0.0,Sun God,2022-10-31T16:25:01Z,detroitlions,0.2842777777777778
13013,67754,67754,DisenfranchisedCynic,I’m fucking here for it. What do we have to lose?,10.0,detroitlions,t3_yijzkh,False,0.0,Sun God,2022-10-31T14:42:39Z,detroitlions,-0.20095
13014,67755,67755,DisenfranchisedCynic,They all played the lions 7-8 times eh?,5.0,detroitlions,t3_yhwy9m,False,0.0,Sun God,2022-10-31T09:03:48Z,detroitlions,0.34
13015,67756,67756,DisenfranchisedCynic,What are you referring to? I’m unaware,1.0,detroitlions,t3_yiask9,False,0.0,Sun God,2022-10-31T08:13:17Z,detroitlions,-0.10115
