,Unnamed: 0.1,Unnamed: 0,author,body,score,subreddit,link_id,over_18,controversiality,author_flair_text,created_utc,flair,sentiment
25879,239202,239202,creativename87639,"BREAKING NEWS: entire eagles coaching staff being interviewed by other teams for next season. Seriously tho, Is this common?",1.0,nfl,t3_10bdw5n,False,0.0,:Eagles: Eagles,2023-01-14T08:28:04Z,eagles,-0.08895
25994,242607,242607,davydog,Mahomes wishes,0.0,nfl,t3_10emlf2,False,1.0,:Eagles: Eagles,2023-01-17T15:54:27Z,eagles,0.1531
25995,242608,242608,davydog,Rooting for your team is toxic?  No wonder cowboys fans fucking suck.,0.0,nfl,t3_10eilaj,False,0.0,:Eagles: Eagles,2023-01-17T15:52:17Z,eagles,-0.3295
25996,242613,242613,davydog,I just don’t think the Vikings are all that good,-1.0,nfl,t3_10cusg7,False,0.0,:Eagles: Eagles,2023-01-15T16:21:08Z,eagles,0.4404
25997,242616,242616,davydog,Ahhhh I didn’t even think about him throwing from a different hand. That’s actually a really good point,1.0,nfl,t3_10cph1u,False,0.0,:Eagles: Eagles,2023-01-15T14:34:53Z,eagles,0.369825
25998,242617,242617,davydog,"Is Thomson fucking all of the dolphins receivers wives or something? He’s making decent enough throws, they’re just refusing to catch them",7.0,nfl,t3_10cph1u,False,0.0,:Eagles: Eagles,2023-01-15T14:33:37Z,eagles,-0.20095
25999,242620,242620,davydog,"Well shit alright, let’s go",1.0,nfl,t3_10cph1u,False,0.0,:Eagles: Eagles,2023-01-15T13:51:10Z,eagles,-0.128
26000,242621,242621,davydog,Is this a joke?,1.0,nfl,t3_10cph1u,False,0.0,:Eagles: Eagles,2023-01-15T12:06:02Z,eagles,0.296
26001,242622,242622,davydog,"Herbert gets more excuses than any other QB in the league. Why does everyone think he’s gods gift to football? He’s a #7 - #10 QB in this league. That’s good, why not just accept he’s not this elite football guru that the media has painted him to be?",4.0,nfl,t3_10cmrt5,False,1.0,:Eagles: Eagles,2023-01-15T10:34:23Z,eagles,0.0523312499999999
26002,242623,242623,davydog,Man Al Michaels needs to retire. That was the most exciting series of events and he was so pedestrian about it,1.0,nfl,t3_10c5u87,False,0.0,:Eagles: Eagles,2023-01-14T22:32:17Z,eagles,0.27065
26663,245959,245959,devonta_smith,Hoping we play CJGJ in the slot and Blankenship at safety. Depending on Josiah Scott to show up in a playoff game is courting disaster,6.0,nfl,t3_10fcjmb,False,0.0,:Eagles: Eagles,2023-01-18T12:58:52Z,eagles,-0.1148
26664,245966,245966,devonta_smith,"Lmfao

I'd be lying if I said I wasn't at least a little bit concerned that this could end up being an all time great coaching move...

But for now, this is even better than the time he smashed a watermelon with a sledgehammer for... reasons, I guess?",8.0,eagles,t3_10bujaz,False,0.0,always open,2023-01-14T13:24:08Z,eagles,0.455575
26665,245969,245969,devonta_smith,"You're the one heavily editing all your comments, seems to suggest you do care. Again, it's top 5 avg, not top 10. As stated in my first reply",1.0,eagles,t3_10ba6d5,False,0.0,always open,2023-01-14T08:44:48Z,eagles,0.0242481481481481
26666,245972,245972,devonta_smith,"I've clearly added something, considering you've gone back and substantially edited each of your previous comments in this thread based on what I've said to try and save face 

Still not sure where you got 28m from btw, you'll prob edit that too once you realize you're wrong again",3.0,eagles,t3_10ba6d5,False,0.0,always open,2023-01-14T08:27:45Z,eagles,0.2115
26667,245973,245973,devonta_smith,"Since you're being a dick, I'll speak plainly. You're a moron.",4.0,eagles,t3_10ba6d5,False,0.0,always open,2023-01-14T08:10:14Z,eagles,-0.3746
26668,245976,245976,devonta_smith,"> I thought this would go without saying

r/confidentlyincorrect 

""Teams must offer the selected player a one-year contract no less than either the average of the top-five salaries at that player’s position based on April of the current year or 120% of the player’s previous year’s salary, **whichever is greater**""


That 120% rule is to compensate for players' lack of long term security when repeatedly being tagged. Even if the tag worked like you thought it did, why would Hurts play for like 1.5m again next year when he's earned a 40+m/year raise?",3.0,eagles,t3_10ba6d5,False,0.0,always open,2023-01-14T07:59:00Z,eagles,0.280975
26669,245978,245978,devonta_smith,the context is pre-draft analysis before either one played a snap in the pros. Sauce is obviously #1 in a redraft and it's not really close,17.0,nfl,t3_10b196p,False,0.0,:Eagles: Eagles,2023-01-13T13:52:57Z,eagles,0.085
26670,245979,245979,devonta_smith,safe to say he's earned it. happy for you guys,38.0,nfl,t3_10b077k,False,0.0,:Eagles: Eagles,2023-01-13T13:09:40Z,eagles,0.39605
26671,245980,245980,devonta_smith,"> they’ll break down eventually

as will the frozen dirt on which we're playing! *taps head*",8.0,eagles,t3_10b01xd,False,0.0,always open,2023-01-13T13:06:13Z,eagles,-0.0561
26672,245981,245981,devonta_smith,pretty sure Pouncey over Kelce was a snub at least one of those years too,1.0,eagles,t3_10b25qk,False,0.0,always open,2023-01-13T13:04:25Z,eagles,0.4019
26673,245982,245982,devonta_smith,Panthers have made 2 Super Bowls in their <30 year existence. I think the Jags would be a solid comp but obviously they've got their QB already,3.0,nfl,t3_10b1smt,False,0.0,:Eagles: Eagles,2023-01-13T12:56:31Z,eagles,0.18845
26674,245983,245983,devonta_smith,"All good, enjoy your modern Ronnie Lott!",6.0,nfl,t3_10b196p,False,0.0,:Eagles: Eagles,2023-01-13T12:44:24Z,eagles,0.75
26675,245984,245984,devonta_smith,I'd be talking so much shit as a Jets fan rn but Stingley's ceiling is equally ridiculous,0.0,nfl,t3_10b077k,False,0.0,:Eagles: Eagles,2023-01-13T12:43:49Z,eagles,-0.6173
26676,245985,245985,devonta_smith,"> Unless you mean Bama's recent crop of receivers?

Google my username + Stingley sometime ;)

I'm referencing LSU practices",2.0,nfl,t3_10b196p,False,1.0,:Eagles: Eagles,2023-01-13T12:41:06Z,eagles,0.11315
26677,245986,245986,devonta_smith,[when a guy shows up like this on draft night and his rookie year performance somehow makes it seem like he was being modest](https://www.si.com/.image/ar_1:1%2Cc_fill%2Ccs_srgb%2Cfl_progressive%2Cq_auto:good%2Cw_1200/MTg5MjE4NTU0NDAxMjY5NjUx/usatsi_18169467.jpg),340.0,nfl,t3_10b077k,False,0.0,:Eagles: Eagles,2023-01-13T12:38:25Z,eagles,0.6124
26678,245987,245987,devonta_smith,"Extrapolating AAC domination to the NFL is far from a sure thing. Nobody other than Sauce expected him to be THIS good.

Stingley was arguably the best player on the 2019 LSU team as a true freshman and routinely locked down 2 of the most prolific young WRs the NFL has ever seen in Jets Jefferson and Ja'Marr Chase",34.0,nfl,t3_10b196p,False,0.0,:Eagles: Eagles,2023-01-13T12:31:47Z,eagles,0.3076740740740741
26679,245990,245990,devonta_smith,That's insanely impressive,2.0,eagles,t3_10azko3,False,0.0,always open,2023-01-13T12:22:48Z,eagles,0.5106
26680,245991,245991,devonta_smith,"Remember when Diggs got 1st team All Pro over Slay solely because of leading the league in INTs? 

Remember when CJGJ led the league in INTs despite missing 5 games and didn't receive any recognition?",2.0,eagles,t3_10azko3,False,0.0,always open,2023-01-13T12:14:49Z,eagles,0.11175
27041,246644,246644,dextersdad,Not worried at all about the offense vs their defense. More worried about the opposite,10.0,nfl,t3_10fcjmb,False,0.0,:Eagles: Eagles,2023-01-18T11:47:34Z,eagles,-0.154925
27042,246647,246647,dextersdad,Love tee higgins softly pushing off then complaining about no dpi,8.0,nfl,t3_10d0b65,False,0.0,:Eagles: Eagles,2023-01-15T21:21:18Z,eagles,0.296
27043,246648,246648,dextersdad,They put up a pretty decent fight for the most obvious one and done team in playoffs,1.0,nfl,t3_10cusg7,False,0.0,:Eagles: Eagles,2023-01-15T18:48:05Z,eagles,0.1531
27044,246650,246650,dextersdad,No clue why they declined the holding,3.0,nfl,t3_10cusg7,False,0.0,:Eagles: Eagles,2023-01-15T16:56:17Z,eagles,-0.296
27045,246651,246651,dextersdad,Wasn't this game supposed to be over 30 minutes ago? Was there a delay?,2.0,nfl,t3_10cph1u,False,0.0,:Eagles: Eagles,2023-01-15T15:40:52Z,eagles,-0.1591
27046,246653,246653,dextersdad,The opposite. He might be the only player on that offense who isn't overrated.,17.0,nfl,t3_10ccb3s,False,0.0,:Eagles: Eagles,2023-01-15T00:07:52Z,eagles,-0.125
27047,246654,246654,dextersdad,"Chargers weapons are genuinely some of the most overrated in the nfl. Ekeler is great in fantasy but not a complete back. Allen is fine but not a superstar. Williams wasn't here but is more bust than boom when he actually is on the field. Then who do they have? Everett and Palmer? Meh. The weapons are pretty mid, not sure why everyone thinks they're so good",93.0,nfl,t3_10canr5,False,0.0,:Eagles: Eagles,2023-01-15T00:05:23Z,eagles,0.0579192927122116
27048,246656,246656,dextersdad,If there's one team I wouldnt be surprised to see blow this,1.0,nfl,t3_10c5u87,False,0.0,:Eagles: Eagles,2023-01-14T21:21:05Z,eagles,-0.1695
27049,246657,246657,dextersdad,Al must have been so excited to watch a decent game finally. Poor guy,8.0,nfl,t3_10c5u87,False,0.0,:Eagles: Eagles,2023-01-14T20:42:40Z,eagles,-0.118475
27050,246658,246658,dextersdad,Punt is the white flag. They just want to go home now,1.0,nfl,t3_10c5u87,False,0.0,:Eagles: Eagles,2023-01-14T20:37:57Z,eagles,0.0386
27051,246659,246659,dextersdad,Surprised the network hasn't stepped in. Throw some flags to keep the ratings up,1.0,nfl,t3_10c5u87,False,0.0,:Eagles: Eagles,2023-01-14T20:29:48Z,eagles,0.056575
27052,246660,246660,dextersdad,"Even if his arm didn't get hit, I'm not really sure what the plan was",1.0,nfl,t3_10c5u87,False,0.0,:Eagles: Eagles,2023-01-14T20:22:29Z,eagles,-0.2912
27053,246661,246661,dextersdad,Well they get ridley next year at least,5.0,nfl,t3_10c5u87,False,0.0,:Eagles: Eagles,2023-01-14T20:06:46Z,eagles,0.2732
27054,246662,246662,dextersdad,Hard to blame him for the first 2 but that was awful,4.0,nfl,t3_10c5u87,False,0.0,:Eagles: Eagles,2023-01-14T19:56:01Z,eagles,-0.7096
27055,246663,246663,dextersdad,Sucks to have the tide changed by a bs illegal man downfield call in the red zone. As an eagles fan I know the pain very well,-1.0,nfl,t3_10c1h5t,False,1.0,:Eagles: Eagles,2023-01-14T17:49:27Z,eagles,-0.1312249999999999
27056,246665,246665,dextersdad,Geno had been so good in the pocket all game until that point,5.0,nfl,t3_10c1h5t,False,0.0,:Eagles: Eagles,2023-01-14T17:39:12Z,eagles,0.5777
27057,246667,246667,dextersdad,Ah there's the Pete Carroll we know and love,4.0,nfl,t3_10c1h5t,False,0.0,:Eagles: Eagles,2023-01-14T16:46:37Z,eagles,0.6369
27058,246668,246668,dextersdad,"So why was there a commercial there? 5 minutes into the quarter they cut away without saying anything, then resumed without saying anything so no injury",1.0,nfl,t3_10c1h5t,False,0.0,:Eagles: Eagles,2023-01-14T16:26:13Z,eagles,0.1104
27059,246669,246669,dextersdad,They didn't even bother to give an excuse as to why they're going to a commercial,4.0,nfl,t3_10c1h5t,False,0.0,:Eagles: Eagles,2023-01-14T16:23:59Z,eagles,0.3261
27060,246670,246670,dextersdad,"Don't forget Brandon Graham. 34 years old coming off a torn Achilles with 11 sacks, and somehow has 0 comeback player of the year buzz.",57.0,nfl,t3_10audm8,False,0.0,:Eagles: Eagles,2023-01-13T09:57:10Z,eagles,-0.082625
27222,249322,249322,dmarques,I dont care who we play but I'd love to see the 49ers get bounced at home,9.0,eagles,t3_10bz8re,False,0.0,The Human Cape,2023-01-14T17:24:37Z,eagles,0.7708
27937,255289,255289,eaglesnation11,"Am I wrong in thinking the Texans are the best HC opening? Three have serious flaws

- Colts (Irsay)

- Cardinals (Big money tied to a non elite QB)

- Broncos (Big money tied to a bad QB)

And the difference between Carolina and Houston is that with Houston you’re guaranteed Stroud or Young without trading up. You have a ton of draft capital and basically no one under contract for big money 2024 and beyond. It’s basically like you get a blank canvas to work with. It’s a lot of work, but ultimately I’d rather not be tied to bad contracts",7.0,nfl,t3_10eebka,False,0.0,:Eagles: Eagles,2023-01-17T13:08:30Z,eagles,-0.127890016
27938,255291,255291,eaglesnation11,That’ll be something for sure,2.0,eagles,t3_10e1b96,False,0.0,Hungry Dogs Run Faster,2023-01-16T21:36:23Z,eagles,0.3182
27939,255292,255292,eaglesnation11,"I agree it’s just been domination. I don’t want to sound like an ungrateful fan either, but I just noticed thus far there’s no real memories to take away like there has been in past seasons (even not so good ones ie the 2007 Yellowjackets game). I guess it’s a good thing",8.0,eagles,t3_10e1b96,False,0.0,Hungry Dogs Run Faster,2023-01-16T21:29:06Z,eagles,0.1067518518518518
27940,255293,255293,eaglesnation11,"I mean 2018 had the Sunday Night Football game upset vs the Rams

2019 had the Division Clinching Game vs Dallas at the Linc the day after Christmas

2021 had the big opening win in Atlanta under the new HC and new QB.

I think all of those games were personally more exciting than any game this year so far",-7.0,eagles,t3_10e1b96,False,0.0,Hungry Dogs Run Faster,2023-01-16T21:27:13Z,eagles,0.34465
27941,255294,255294,eaglesnation11,Yeah if we can’t beat the Giants at home we’re shit,10.0,eagles,t3_10d0h1e,False,0.0,Hungry Dogs Run Faster,2023-01-15T18:56:30Z,eagles,-0.34
27942,255295,255295,eaglesnation11,"Barkley/CMac don’t have the OL we do. Those teams need a superstar to have a good run game, we don’t",2.0,eagles,t3_10d0arc,False,0.0,Hungry Dogs Run Faster,2023-01-15T18:50:08Z,eagles,0.2202
27943,255307,255307,eaglesnation11,We need to normalize the fact that a vast majority of octogenarians can’t work effectively anymore. A shame that so many of them are basically in charge of running our country,9.0,nfl,t3_10ci3p0,False,0.0,:Eagles: Eagles,2023-01-15T10:01:23Z,eagles,-0.12825
27944,255308,255308,eaglesnation11,"I think we were too ready to crown him as elite. He’s never finished higher than 10th in ANY/A which in my opinion is the best stat for QB efficiency. He’s still clearly a Top 10 QB, but there’s a large gap between him and the first 3 IMO",6.0,nfl,t3_10ci3p0,False,0.0,:Eagles: Eagles,2023-01-15T09:59:28Z,eagles,0.2014888888888889
27945,255309,255309,eaglesnation11,Had an awkward experience yesterday. Girlfriend and I went for massages and at the end we presented our Groupon which knocked a $109 couples massage down to $98. We tipped them $25 at the end (over 20% of the original bill) and they asked for more.,13.0,nfl,t3_10ci3p0,False,0.0,:Eagles: Eagles,2023-01-15T09:25:53Z,eagles,0.1003962962962963
27946,255316,255316,eaglesnation11,"One of Parsons, Garrett, Reddick and Judon had to miss it unfortunately",1.0,nfl,t3_10aztmm,False,0.0,:Eagles: Eagles,2023-01-13T12:35:45Z,eagles,-0.4588
28213,256220,256220,eaglessb999,Fuck no. Seattle was the worst team in the playoffs. We actually know how to play defense and besides You guys will be out by next round. You will not get the chance to play us,1.0,nfl,t3_10ccf3s,False,0.0,:Eagles: Eagles,2023-01-15T00:52:25Z,eagles,0.057642578125
28214,256221,256221,eaglessb999,"Purdy is a product of the system. Shanahan is the same guy that turned matt ryan into an mvp, took jimmy gs bumass to a super bowl, and made matt schaub a pro bowler.",-1.0,nfl,t3_10ccf3s,False,0.0,:Eagles: Eagles,2023-01-15T00:40:08Z,eagles,0.2997
28215,256222,256222,eaglessb999,Did we watch two different games? Was your recievers not wide open on every play?. You guys have great weapons and coaching. But the truth is 100% of quarterbacks in this league could throw to wide open guys like purdy does.,-1.0,nfl,t3_10ccf3s,False,0.0,:Eagles: Eagles,2023-01-15T00:34:39Z,eagles,0.2075874999999999
28216,256223,256223,eaglessb999,im stating the obvious that hurts has a great supporting cast. Unlike purdy hurts makes throws on time and he doesn’t throw it to the defense as much as purdy. Purdy got lucky today Seattle couldve had a couple picks,-7.0,nfl,t3_10ccf3s,False,0.0,:Eagles: Eagles,2023-01-15T00:28:53Z,eagles,0.1202777777777777
28217,256224,256224,eaglessb999,Yes hurts also has a great supporting cast.,-5.0,nfl,t3_10ccf3s,False,0.0,:Eagles: Eagles,2023-01-15T00:25:28Z,eagles,0.765
28218,256225,256225,eaglessb999,Im not hating im making an observation. You guys have great coaching and weapons that make it very easy for him,-9.0,nfl,t3_10ccf3s,False,0.0,:Eagles: Eagles,2023-01-15T00:22:38Z,eagles,0.430075
28219,256227,256227,eaglessb999,Brock Purdy isn’t good. Id could throw to wide open receivers that get a ton of yac. He was late on a lot of throws as well,-20.0,nfl,t3_10ccf3s,False,0.0,:Eagles: Eagles,2023-01-15T00:18:57Z,eagles,0.1073777777777777
28433,258914,258914,evarol,Giants doing great - but that last play was a false start,2.0,eagles,t3_10cush2,False,0.0,:helmet:,2023-01-15T16:23:52Z,eagles,0.6858
28434,258915,258915,evarol,Vikings defense is ass,2.0,eagles,t3_10cush2,False,0.0,:helmet:,2023-01-15T16:11:27Z,eagles,-0.4588
28707,264955,264955,gobirds18_,🤣🤣🤣,3.0,eagles,t3_10dxy0w,False,0.0,:batman:,2023-01-16T21:08:33Z,eagles,0.8625
28708,264956,264956,gobirds18_,😂😂😂,1.0,eagles,t3_10dxy0w,False,0.0,:batman:,2023-01-16T21:08:04Z,eagles,0.8271
28709,264958,264958,gobirds18_,Cowboys suck lmfao,3.0,eagles,t3_10dxy0w,False,0.0,:batman:,2023-01-16T19:18:18Z,eagles,0.1531
28710,264964,264964,gobirds18_,Yeah we’re absolutely terrified 🙄 fucking bums,18.0,eagles,t3_10d0xv1,False,0.0,:batman:,2023-01-15T19:15:19Z,eagles,-0.4754
28711,264965,264965,gobirds18_,Fuck yeah we’re confident. Giants suck.,0.0,eagles,t3_10d0h1e,False,0.0,:batman:,2023-01-15T19:10:35Z,eagles,-0.163625
28712,264966,264966,gobirds18_,😈😈😈,3.0,eagles,t3_10d0d68,False,0.0,:batman:,2023-01-15T18:52:28Z,eagles,0.8402
28713,264967,264967,gobirds18_,We’re gonna fucking kill them,1.0,eagles,t3_10d0d68,False,0.0,:batman:,2023-01-15T18:51:59Z,eagles,-0.7178
28714,264969,264969,gobirds18_,Giants and Vikings both fucking suck lol,5.0,eagles,t3_10cush2,False,0.0,:batman:,2023-01-15T18:47:52Z,eagles,-0.0296
28715,264971,264971,gobirds18_,Can’t wait to whoop some New York ass,7.0,eagles,t3_10cush2,False,0.0,:batman:,2023-01-15T18:47:00Z,eagles,-0.5423
28716,264978,264978,gobirds18_,Please jags 🙏🙏🙏,3.0,jaguars,t3_10c8mbn,False,0.0,:PHI::Pedwagon:,2023-01-14T22:28:21Z,eagles,0.3182
28717,264984,264984,gobirds18_,Holy fuck the jaguars suck,3.0,eagles,t3_10c5u92,False,0.0,:batman:,2023-01-14T20:23:26Z,eagles,-0.7506
28718,264985,264985,gobirds18_,Holy fuck,0.0,jaguars,t3_10c5xd6,False,0.0,:PHI::Pedwagon:,2023-01-14T20:22:37Z,eagles,-0.5423
28898,265531,265531,gotham_cronie,Might be able to find a free trial somewhere,2.0,nfl,t3_10b9ga5,False,0.0,:Eagles: Eagles,2023-01-13T23:20:24Z,eagles,0.5106
29074,266775,266775,greetedworm,"""It’s not as hard as it appears""

Oh fr? Have you told every other QB in the NFL history that? Apparently they're out of the loop on how easy it is seeing as how none of them have done it.",33.0,nfl,t3_10fa8yb,False,0.0,:Eagles: Eagles,2023-01-18T10:28:24Z,eagles,0.1496222222222222
29075,266777,266777,greetedworm,"This isn't even remotely close to being a cherry picked stat. 

Shit like this is why the internet sucks, people's first reaction to everything is to hate and make some dumb comment for attention.",118.0,nfl,t3_10fa8yb,False,0.0,:Eagles: Eagles,2023-01-18T10:10:15Z,eagles,-0.4455
29076,266780,266780,greetedworm,"Your second paragraph is probably true. But saying salary cap has no effect on competition is absolutely not true. look at any sports league without a salary cap whether that be the MLB or European club soccer, the teams that spend the most win and you don't win if you don't spend.",15.0,nfl,t3_10f6n3v,False,0.0,:Eagles: Eagles,2023-01-18T08:08:35Z,eagles,0.0187555555555555
29077,266789,266789,greetedworm,"Yeah, I mean QB is a much more valuable position. Although my biased opinion of Eli is quite low so I think he drags Peyton down quite a bit.",12.0,nfl,t3_10aztmm,False,0.0,:Eagles: Eagles,2023-01-13T13:10:54Z,eagles,-0.148025
29078,266790,266790,greetedworm,"Kelce brothers have gotta be the best non-manning brother duo in NFL history at this point. Honestly, they could end up better than the mannings if you control for positional value. Both will definitely end their careers top 5 all time at their position and both might even have arguments for #1 all time.",52.0,nfl,t3_10aztmm,False,0.0,:Eagles: Eagles,2023-01-13T12:52:04Z,eagles,0.1807333333333333
29079,266791,266791,greetedworm,Maybe Eagles fans have talked about him enough to change this but Hassan Reddick has had a monster year tied for 2nd in sacks and tied for first in both forced fumbles and fumble recoveries.,3.0,nfl,t3_10audm8,False,0.0,:Eagles: Eagles,2023-01-13T08:31:48Z,eagles,-0.6124
29286,267590,267590,hosker2,Make a play defense!,2.0,buffalobills,t3_10cko8y,False,0.0,:PHI:,2023-01-15T15:39:23Z,eagles,0.4926
29287,267591,267591,hosker2,No McDermott noooooooo,2.0,buffalobills,t3_10cko8y,False,0.0,:PHI:,2023-01-15T15:27:54Z,eagles,-0.296
29696,268913,268913,howd_he_get_here,Winning team here. Y'all sure put up one heck of a fight! I just stopped by to let you know you should be proud of your squad :+),39.0,nfl,t3_10d3xck,False,0.0,:Eagles: Eagles,2023-01-16T00:34:11Z,eagles,0.1013851851851851
29697,268914,268914,howd_he_get_here,"Well that's just not true lol

Edit: Not even the worst RTP call this season. By like... a lot",1.0,nfl,t3_10cusg7,False,0.0,:Eagles: Eagles,2023-01-15T18:46:24Z,eagles,0.2269
29879,269283,269283,hsl164,And the No Clear Recovery game. 4th and 9 in overtime and Dak gets the TD without giving us a shot at striking back.,1.0,eagles,t3_10edvk9,False,0.0,=LEGEND,2023-01-17T12:23:28Z,eagles,-0.2023
29880,269284,269284,hsl164,"No team deserves the blown 3 touchdown leads in the 4th quarter and back to back overtime 4th and 15s more. Schwartz sucked, he was the main reason 2018-2019’s teams were 9-7 instead of 11-5/12-4",2.0,eagles,t3_10edvk9,False,0.0,=LEGEND,2023-01-17T12:20:45Z,eagles,-0.3034
29881,269285,269285,hsl164,No amount of refball can turn this shit around. Tampa is totally gassed.,6.0,eagles,t3_10dxy0w,False,0.0,=LEGEND,2023-01-16T21:03:50Z,eagles,-0.188575
29882,269286,269286,hsl164,Hopefully a bunch of them take team friendly backloaded deals to keep the window open longer.,1.0,eagles,t3_10dxy0w,False,0.0,=LEGEND,2023-01-16T21:02:57Z,eagles,0.7096
29883,269287,269287,hsl164,"When Brady retires permanently this time, and the Bucs officially enter tankmode this off-season or at the next deadline, what players would y’all like to trade for?",1.0,eagles,t3_10dxy0w,False,0.0,=LEGEND,2023-01-16T20:43:16Z,eagles,0.3612
29884,269289,269289,hsl164,"It’s about 4 cougars taking a road trip to see the 28-3 game. If their destination were LII instead of the previous year, it would be so much better. Imagine them Karen-ing out at the strip sack 😂😂😂",3.0,eagles,t3_10dxy0w,False,0.0,=LEGEND,2023-01-16T20:21:04Z,eagles,0.3301666666666666
29885,269290,269290,hsl164,I hope Nick Bosa beats the shit out of them and they drain their tank on the 49ers and getting a last second field goal if that’s the case.,3.0,eagles,t3_10dxy0w,False,0.0,=LEGEND,2023-01-16T20:19:11Z,eagles,0.7845
29886,269292,269292,hsl164,"They wouldn't have lost to the Saints if they scored 31, and Hurts is a far superior quarterback. No way in hell he throws that many interceptions in one quarter.",3.0,eagles,t3_10c5u92,False,0.0,=LEGEND,2023-01-14T23:09:53Z,eagles,-0.3062
29887,269295,269295,hsl164,"I really, really hope they prove us wrong but I just know if we don't make it to the Super Bowl, it will be because of Steichen/Gannon and not any particular player. I got downvoted to hell in early 2021 for calling the mostly millennial coaching staff ""the Backstreet Boys"". I just hope the inexperience it doesn't rear its ugly head at the worst possible time. I feel like the window is this year and this year only because we can't keep all of our 1-year contract ballers especially on defense.",2.0,eagles,t3_10c5u92,False,0.0,=LEGEND,2023-01-14T22:42:32Z,eagles,0.127114453125
29888,269296,269296,hsl164,If I were Joey Bosa I'd be all up in that weasel's face. 30 is closer than he thinks and the window is closing. Looks like we have a home for both of our inept coordinators now XDXDXD,1.0,eagles,t3_10c5u92,False,0.0,=LEGEND,2023-01-14T22:39:34Z,eagles,0.1204
29889,269297,269297,hsl164,Firing Doug was a mistake. He'd have had this stacked roster 16-1 at worst.,7.0,eagles,t3_10c5u92,False,0.0,=LEGEND,2023-01-14T22:37:59Z,eagles,-0.458925
29890,269299,269299,hsl164,They're slobbering all over Purdy like he plays for the Cowboys. I don't think he's seen a defensive line as deep as ours. I just don't want to see them treat the divisional round like a trap game and blow it.,11.0,eagles,t3_10c6ul7,False,0.0,=LEGEND,2023-01-14T19:56:28Z,eagles,0.1554518518518518
29891,269300,269300,hsl164,The D-line is their biggest problem. It's telling that their only semblance of a pass rush is a 36 year old who's been a journeyman mercenary since leaving the Legion of Boom after their Super Bowls.,1.0,eagles,t3_10bz8re,False,0.0,=LEGEND,2023-01-14T19:39:19Z,eagles,0.199225
30630,276097,276097,inchipwetrust,Prepare for bosco decoy plays. These guys are gonna be sooo keyed in on him,41.0,eagles,t3_10fepgw,False,0.0,you gon feel it cooley,2023-01-18T12:45:28Z,eagles,0.0625
30631,276098,276098,inchipwetrust,Even if you count those dudes as worth a td (I don’t) it’s still a 20 point difference lol,8.0,eagles,t3_10enavx,False,0.0,you gon feel it cooley,2023-01-17T15:49:39Z,eagles,0.5719
