,Unnamed: 0.1,Unnamed: 0,author,body,score,subreddit,link_id,over_18,controversiality,author_flair_text,created_utc,flair,sentiment
6,2607,2607,1n_pla1n_s1ght,That *is* a fun fact,1.0,eagles,t3_10dhhwh,False,0.0,Eagles gonna Eagle,2023-01-16T13:46:29Z,eagles,0.5106
632,4037,4037,215Kurt,I'm still bitter about him. I knew he was a diamond in the rough for one reason. He went to OSU and was drafted by (former Oregon coach) Chip Kelly his first year as a HC.,1.0,nfl,t3_10fgmty,False,0.0,:Eagles: Eagles,2023-01-18T17:15:20Z,eagles,0.0221666666666666
633,4042,4042,215Kurt,the good ol' [receiving corpse](https://i.pinimg.com/originals/ce/d7/cf/ced7cfd62a505a4a01bb6ef2e78cda1e.jpg),2.0,nfl,t3_10e6lfq,False,0.0,:Eagles: Eagles,2023-01-17T15:47:18Z,eagles,0.4404
634,4054,4054,215Kurt,"I don't know why you're being so defensive, replying rude as shit to everyone asking about it and downvoting us lol. It's not like I said you're lying, I simply said that I searched and found nothing and would like to read more about it. Relax big guy",8.0,eagles,t3_10crb2g,False,0.0,LII CHAMPS,2023-01-15T19:43:48Z,eagles,0.0411629629629629
635,4056,4056,215Kurt,"I have Westbrook, Dawk, and Trotter in those colors. Those are a top 3 Eagles uni for me lol",3.0,eagles,t3_10crb2g,False,0.0,LII CHAMPS,2023-01-15T18:54:26Z,eagles,0.2787
636,4066,4066,215Kurt,[Damn right.](https://media0.giphy.com/media/x70p0tqMsvqMM/giphy.gif),1.0,eagles,t3_10bsgrj,False,0.0,LII CHAMPS,2023-01-14T18:19:28Z,eagles,-0.100475
637,4069,4069,215Kurt,Like Bobby Boucher,2.0,eagles,t3_10bej5l,False,0.0,LII CHAMPS,2023-01-14T14:58:05Z,eagles,0.3612
638,4070,4070,215Kurt,It's just how it's made. No aesthetic difference whatsoever.,1.0,eagles,t3_10btjg9,False,0.0,LII CHAMPS,2023-01-14T14:56:37Z,eagles,-0.148
639,4071,4071,215Kurt,Where is this from? I really want one but since AimeeSmith is gone I can't find a reputable shop,1.0,eagles,t3_10bsgrj,False,0.0,LII CHAMPS,2023-01-14T14:55:21Z,eagles,0.03815
640,4073,4073,215Kurt,"It's unbiasedly the Eagles for the reasons you listed. They just went 14-3 with the #1 seed, have an MVP caliber QB on his rookie deal, AND have a top 10 pick next year on top of (HOPEFULLY) #32.",1.0,nfl,t3_10alf0o,False,0.0,:Eagles: Eagles,2023-01-13T22:10:53Z,eagles,0.36065
641,4075,4075,215Kurt,Donnie was pretty damn good.,2.0,eagles,t3_10aeosh,False,0.0,LII CHAMPS,2023-01-13T15:58:26Z,eagles,0.5267
927,11306,11306,Acrobatic-Dark-4402,Amazing. Absolutely outstanding,22.0,nfl,t3_10e14xs,False,0.0,:Eagles: Eagles,2023-01-16T21:09:38Z,eagles,0.470375
928,11307,11307,Acrobatic-Dark-4402,You’re a pro-Watson Brown fan? That checks out,16.0,nfl,t3_10e0mmr,False,0.0,:Eagles: Eagles,2023-01-16T20:56:34Z,eagles,0.07955
929,11308,11308,Acrobatic-Dark-4402,Can never root for an injury. I want him to completely fuck up and whiff on every tackle/play he tries to make. But I want him to be healthy when he does it,5.0,nfl,t3_10e0mmr,False,0.0,:Eagles: Eagles,2023-01-16T20:49:53Z,eagles,0.1283777777777778
930,11309,11309,Acrobatic-Dark-4402,Hate to see that. Hope it’s not too serious,60.0,nfl,t3_10e0mmr,False,0.0,:Eagles: Eagles,2023-01-16T20:45:51Z,eagles,0.097275
931,11310,11310,Acrobatic-Dark-4402,Tom Brady abandoned his family for this,9.0,nfl,t3_10dxy2f,False,0.0,:Eagles: Eagles,2023-01-16T20:45:02Z,eagles,-0.4588
932,11311,11311,Acrobatic-Dark-4402,Tom Brady abandoned his family for this,9.0,nfl,t3_10e0ixl,False,0.0,:Eagles: Eagles,2023-01-16T20:41:53Z,eagles,-0.4588
933,11313,11313,Acrobatic-Dark-4402,Would be absolutely hilarious if Dallas loses this game by 2 or 3 points,27.0,nfl,t3_10e0fnb,False,0.0,:Eagles: Eagles,2023-01-16T20:36:26Z,eagles,0.1761
934,11315,11315,Acrobatic-Dark-4402,"Weird, their food turned me off their food",0.0,nfl,t3_10dxy2f,False,0.0,:Eagles: Eagles,2023-01-16T19:56:02Z,eagles,-0.1779
935,11316,11316,Acrobatic-Dark-4402,That kid is slow as shit. Mom is running sideways and filming and she still kept up with him,5.0,nfl,t3_10dxy2f,False,0.0,:Eagles: Eagles,2023-01-16T19:54:43Z,eagles,-0.13935
936,11317,11317,Acrobatic-Dark-4402,*Sad Raven noises*,1.0,nfl,t3_10d519h,False,0.0,:Eagles: Eagles,2023-01-15T22:31:33Z,eagles,-0.4767
937,11318,11318,Acrobatic-Dark-4402,Argument could be made that the AFC West looked like the tougher division heading into the season,1.0,nfl,t3_10d4xjc,False,0.0,:Eagles: Eagles,2023-01-15T22:28:09Z,eagles,0.1779
938,11320,11320,Acrobatic-Dark-4402,Battle of the almost lost to backups,282.0,nfl,t3_10d4v2f,False,0.0,:Eagles: Eagles,2023-01-15T22:22:27Z,eagles,-0.5584
939,11321,11321,Acrobatic-Dark-4402,🎵 One of these teams is not like the others 🎵,30.0,nfl,t3_10d4trd,False,0.0,:Eagles: Eagles,2023-01-15T22:20:44Z,eagles,-0.2755
940,11326,11326,Acrobatic-Dark-4402,Reagor didn’t drop it! Reagor didn’t drop it!,3.0,nfl,t3_10cusg7,False,0.0,:Eagles: Eagles,2023-01-15T18:39:48Z,eagles,-0.25365
941,11327,11327,Acrobatic-Dark-4402,"Dude bobbled it, lost a shoe, and still liked better than Reagor",11.0,nfl,t3_10cusg7,False,0.0,:Eagles: Eagles,2023-01-15T18:24:14Z,eagles,0.5267
942,11329,11329,Acrobatic-Dark-4402, Vikings missed a great opportunity to do some snow angels,1.0,nfl,t3_10cusg7,False,1.0,:Eagles: Eagles,2023-01-15T17:53:27Z,eagles,0.6908
943,11330,11330,Acrobatic-Dark-4402,These games have been way better than I expected,1.0,nfl,t3_10cph1u,False,0.0,:Eagles: Eagles,2023-01-15T13:51:16Z,eagles,0.4404
944,11331,11331,Acrobatic-Dark-4402,The Dolphins winning this game with some dude they pulled out the stands playing quarterback would be hilarious,5.0,nfl,t3_10cph1u,False,0.0,:Eagles: Eagles,2023-01-15T13:47:41Z,eagles,0.7845
1061,12510,12510,Akarious,Dodgers as well,1.0,nfl,t3_10fl8ed,False,0.0,:Eagles: Eagles,2023-01-18T22:29:19Z,eagles,0.2732
1062,12515,12515,Akarious,tbf it takes time to adjust to a backup QB esp if you have to change the game plan. Y'all forget how bad the 2017 offense looked post-Wentz injury until the Falcons game. With the 1st seed pretty much locked up and Hurts returning they didn't try to change things up too much.,3.0,eagles,t3_10elvl4,False,0.0,I Hurts myself today to see if I still feel,2023-01-17T18:05:08Z,eagles,-0.0856333333333333
1063,12516,12516,Akarious,Love Hurts but Mahomes' stats was insane this year.,19.0,eagles,t3_10elvl4,False,0.0,I Hurts myself today to see if I still feel,2023-01-17T18:01:20Z,eagles,-0.4588
1064,12518,12518,Akarious,He'll die behind that oline,5.0,eagles,t3_10dxy0w,False,0.0,I Hurts myself today to see if I still feel,2023-01-16T22:33:51Z,eagles,-0.5994
1065,12519,12519,Akarious,Commentator curse strikes again....,5.0,nfl,t3_10dxy2f,False,0.0,:Eagles: Eagles,2023-01-16T19:58:52Z,eagles,-0.7184
1066,12520,12520,Akarious,Who says you can't teach an old dog new tricks 😅,2.0,nfl,t3_10dxy2f,False,0.0,:Eagles: Eagles,2023-01-16T19:54:39Z,eagles,0.25
1067,12522,12522,Akarious,"Samsung going crazy with displays, like their tablet prototype",1.0,nfl,t3_10dxy2f,False,0.0,:Eagles: Eagles,2023-01-16T19:44:57Z,eagles,0.0258
1068,12523,12523,Akarious,Why do misses always seem to be wide right than left?,1.0,nfl,t3_10dxy2f,False,0.0,:Eagles: Eagles,2023-01-16T19:42:57Z,eagles,-0.2263
1069,12525,12525,Akarious,punters MVP so far lol,4.0,nfl,t3_10dxy2f,False,0.0,:Eagles: Eagles,2023-01-16T19:33:47Z,eagles,0.4728
1070,12526,12526,Akarious,lmao,3.0,nfl,t3_10dxy2f,False,0.0,:Eagles: Eagles,2023-01-16T19:23:39Z,eagles,0.5994
1071,12527,12527,Akarious,Going to be a defensive battle huh?,3.0,nfl,t3_10dxy2f,False,0.0,:Eagles: Eagles,2023-01-16T19:22:21Z,eagles,-0.3612
1072,12528,12528,Akarious,Well that was quick..,2.0,nfl,t3_10dxy2f,False,0.0,:Eagles: Eagles,2023-01-16T19:20:04Z,eagles,0.2732
1073,12530,12530,Akarious,Yep check the edit,1.0,nfl,t3_10dxy2f,False,0.0,:Eagles: Eagles,2023-01-16T19:13:24Z,eagles,0.296
1074,12531,12531,Akarious,No way Brady going out on a bad note. He'll be back if he loses tonight,7.0,nfl,t3_10dxy2f,False,0.0,:Eagles: Eagles,2023-01-16T19:11:42Z,eagles,-0.3318
1075,12533,12533,Akarious,"Fair enough, but do try mutton biriyani before giving up on Indian cuisine",2.0,nfl,t3_10du4y8,False,0.0,:Eagles: Eagles,2023-01-16T18:17:09Z,eagles,0.5789
1076,12534,12534,Akarious,Might be because you might be one of the people for whom[ cilantro tastes like soap](https://www.britannica.com/story/why-does-cilantro-taste-like-soap-to-some-people). A lot of Indian food uses it.,9.0,nfl,t3_10du4y8,False,0.0,:Eagles: Eagles,2023-01-16T18:08:03Z,eagles,0.0903
1077,12535,12535,Akarious,Fair enough. Heard about it on the Rich Eisen show from one of the insiders who didn't go into much detail.,1.0,nfl,t3_10d4voy,False,0.0,:Eagles: Eagles,2023-01-16T03:17:06Z,eagles,0.35825
1078,12537,12537,Akarious,"Ravens' defense must be pissed, only allowed 17 points against Burrow",188.0,nfl,t3_10d4voy,False,0.0,:Eagles: Eagles,2023-01-15T22:59:15Z,eagles,-0.5719
1079,12538,12538,Akarious,Didn't Jerruh say McCarthy was safe no matter what last week on his radio show??,37.0,nfl,t3_10d4voy,False,0.0,:Eagles: Eagles,2023-01-15T22:52:18Z,eagles,0.106625
1080,12542,12542,Akarious,Now I understand why Raven fans want Roman gone.,5.0,nfl,t3_10d0b65,False,0.0,:Eagles: Eagles,2023-01-15T22:14:05Z,eagles,0.0772
1081,12546,12546,Akarious,Have to say this might be one of the best wildcard weekends in a long while,6.0,nfl,t3_10d0b65,False,0.0,:Eagles: Eagles,2023-01-15T21:41:04Z,eagles,0.6369
1082,12547,12547,Akarious,Vikings give signs of hope only to stab you in the chest more than the Jets,3.0,nfl,t3_10d0f7u,False,0.0,:Eagles: Eagles,2023-01-15T20:59:36Z,eagles,-0.2263
1083,12550,12550,Akarious,I swear if the NFC divisional is 49ers plus NFCE....,3.0,eagles,t3_10cush2,False,0.0,I Hurts myself today to see if I still feel,2023-01-15T18:40:08Z,eagles,-0.6841
1084,12551,12551,Akarious,If giants win they are our match-up next week,2.0,eagles,t3_10cush2,False,0.0,I Hurts myself today to see if I still feel,2023-01-15T18:33:58Z,eagles,0.5859
1085,12552,12552,Akarious,That's pretty much game unless Vikings get a stop,4.0,nfl,t3_10cusg7,False,0.0,:Eagles: Eagles,2023-01-15T18:30:36Z,eagles,0.25
1086,12553,12553,Akarious,It's okay not groundbreaking and they edited it for a lower age rating so gets kinda weird in some places,1.0,nfl,t3_10cusg7,False,0.0,:Eagles: Eagles,2023-01-15T17:18:37Z,eagles,-0.2431
1087,12555,12555,Akarious,"it was a variety of reasons where there is blame to go around for everyone involved. 
Wentz was regressing and wasn't willing to be coached. Poor drafting by Howie and other FO decisions trying to prolong the SB window had backfired. 
Laurie had gotten a bit too hands-on by the end where He would critique the game in a weekly meeting with Howie and Doug.

 The main tipping point at the end was the clusterfuck that was the coaching staff since most of Doug's circle was Andy Reid's tree (most of the SB year coaches were from Chip Kelly's time or who were brought on by Howie/Jeff). Initially, Pederson was going to return but in the exit interview, He wanted to promote from within but with how stagnant the offense had become Jeff vetoed it once and asked him come back with other choices. Doug refused and was fired",130.0,nfl,t3_10cagft,False,0.0,:Eagles: Eagles,2023-01-15T03:03:45Z,eagles,-0.0954532658282567
1088,12556,12556,Akarious,Plus he got fired pretty late into the hiring cycle so most teams were already set on who they were getting.,8.0,nfl,t3_10cak7o,False,0.0,:Eagles: Eagles,2023-01-14T23:57:06Z,eagles,-0.1027
1089,12557,12557,Akarious,Urinatingtree has to do a legacy of failure vid on this 😂,2.0,nfl,t3_10cak7o,False,0.0,:Eagles: Eagles,2023-01-14T23:32:20Z,eagles,-0.1027
1090,12565,12565,Akarious,"Not a hernia, was a groin injury. Lane talked about it on the Pat MacAfee show.",1.0,nfl,t3_10az571,False,0.0,:Eagles: Eagles,2023-01-14T01:07:47Z,eagles,-0.105375
1408,16585,16585,Avery-Bradley,SO good,2.0,nfl,t3_10f9ej5,False,0.0,:Eagles: Eagles,2023-01-18T20:51:02Z,eagles,0.6028
1409,16587,16587,Avery-Bradley,Yep he will,4.0,eagles,t3_10enemu,False,0.0,I'm a Celtics fan too. I'm sorry.,2023-01-17T15:37:51Z,eagles,0.296
1410,16588,16588,Avery-Bradley,"Yep, 100%",40.0,eagles,t3_10enemu,False,0.0,I'm a Celtics fan too. I'm sorry.,2023-01-17T15:37:46Z,eagles,0.296
1411,16589,16589,Avery-Bradley,I'd be stunned if Reich isn't a head coach tbh,3.0,eagles,t3_10eh4s3,False,0.0,I'm a Celtics fan too. I'm sorry.,2023-01-17T11:23:19Z,eagles,-0.1027
1412,16590,16590,Avery-Bradley,"I bought a Nick Foles Super Bowl jersey, it's legit but unfortunately it fits a size smaller than the jersey says. It sucks I can't wear it, but at least I have a nice decoration to hang in my room now!",1.0,eagles,t3_10e9ir2,False,0.0,I'm a Celtics fan too. I'm sorry.,2023-01-17T11:14:55Z,eagles,0.209125
1413,16591,16591,Avery-Bradley,"Obviously getting past the Giants is the #1 priority. But I’ll be honest, the Niners scare the shit out of me. We have a better shot against the Cowboys than the Niners IMO",2.0,eagles,t3_10dxy0w,False,0.0,I'm a Celtics fan too. I'm sorry.,2023-01-16T22:20:08Z,eagles,0.2321777777777778
1414,16593,16593,Avery-Bradley,"https://www.google.com/maps/d/u/0/viewer?ll=46.525132211894935%2C1.9040666723411714&z=6&mid=1y4c86B0V0cnbkGLtd4ZBBoMW6NAAltdk

Looks like there's an Eagles bar",11.0,eagles,t3_10d501c,False,0.0,I'm a Celtics fan too. I'm sorry.,2023-01-15T23:24:42Z,eagles,0.3612
1415,16595,16595,Avery-Bradley,"But the problem wasn’t that you were down by 3. You were down by a touchdown, with a backup quarterback. You can’t assume that you’ll score a touchdown. In that situation, you need to call a timeout to talk it over with your backup quarterback",16.0,nfl,t3_10d4vzm,False,0.0,:Eagles: Eagles,2023-01-15T22:26:23Z,eagles,-0.002148046875
1416,16597,16597,Avery-Bradley,"The way I see the Giants, if we commit a mistake, they will capitalize. We can’t overlook them, and we need to go all in. The fact that they just dropped 31 worries me.

Edit: I definitely phrased this wrong… the way I see it, teams like the Dolphins and Seahawks made a lot of “dumb” penalties in the playoffs like false start and delay of game. The Giants didn’t do that today. They’re disciplined and we should have that same mentality - no mistakes. 

That all being said, we have a much better defense than the Vikings",14.0,eagles,t3_10d0h1e,False,0.0,I'm a Celtics fan too. I'm sorry.,2023-01-15T19:07:46Z,eagles,0.0811149251465922
1417,16598,16598,Avery-Bradley,I think he needed a change of scenery. I know there was some disputes between Howie and Doug about Mike Groh; I still remember posting Mike Groh Has To Go,3.0,eagles,t3_10c5u92,False,0.0,I'm a Celtics fan too. I'm sorry.,2023-01-14T23:00:42Z,eagles,-0.1366
1418,16599,16599,Avery-Bradley,The user meant if there was any justification that would support bringing Staley back,3.0,nfl,t3_10capy9,False,0.0,:Eagles: Eagles,2023-01-14T22:45:39Z,eagles,0.4019
1419,16602,16602,Avery-Bradley,You read my mind lol,1.0,eagles,t3_10c5u92,False,0.0,I'm a Celtics fan too. I'm sorry.,2023-01-14T21:56:44Z,eagles,0.4215
1420,16603,16603,Avery-Bradley,Give him a real OC and this offense will pop off. Also no Mike Williams,1.0,eagles,t3_10c5u92,False,0.0,I'm a Celtics fan too. I'm sorry.,2023-01-14T21:55:24Z,eagles,-0.224775
1421,16604,16604,Avery-Bradley,I feel like the NFL has been calling a lot of Ineligible man downfield flags this season,2.0,eagles,t3_10c5u92,False,0.0,I'm a Celtics fan too. I'm sorry.,2023-01-14T21:55:02Z,eagles,0.3612
1422,16605,16605,Avery-Bradley,"Also an Eagles fan, this is pretty crazy, go Jags",6.0,jaguars,t3_10c8mbn,False,0.0,:PHI:,2023-01-14T21:52:27Z,eagles,0.4767
1423,16606,16606,Avery-Bradley,"I feel you, I'm just not as high on Siposs personally. I probably should've stated this directly but obviously go BPA, but if you're torn between a couple of positions, then that's where I'd lean punter. But yeah BPA now and always",2.0,eagles,t3_10c5u92,False,0.0,I'm a Celtics fan too. I'm sorry.,2023-01-14T21:43:22Z,eagles,0.1003666666666666
1424,16608,16608,Avery-Bradley,Agreed,1.0,eagles,t3_10c5u92,False,0.0,I'm a Celtics fan too. I'm sorry.,2023-01-14T21:32:26Z,eagles,0.2732
1425,16609,16609,Avery-Bradley,"Wait I apologize, I might've mistyped it out - I think we should draft a punter in the fifth rounder, sorry about that",1.0,eagles,t3_10c5u92,False,0.0,I'm a Celtics fan too. I'm sorry.,2023-01-14T21:31:21Z,eagles,0.0258
1426,16610,16610,Avery-Bradley,This was really good analysis,1.0,nfl,t3_10agdjr,False,0.0,:Eagles: Eagles,2023-01-14T21:30:11Z,eagles,0.4927
1427,16611,16611,Avery-Bradley,"IMO yes, it's worth a fifth rounder, Siposs has struggled since last year and we've seen what having a great punter can do to teams",1.0,eagles,t3_10c5u92,False,0.0,I'm a Celtics fan too. I'm sorry.,2023-01-14T21:25:06Z,eagles,0.743
1428,16612,16612,Avery-Bradley,Oh wow you saw it? Nice,6.0,nfl,t3_10c8tqk,False,0.0,:Eagles: Eagles,2023-01-14T21:17:54Z,eagles,0.357225
1429,16614,16614,Avery-Bradley,"The craziest part about this is that if the Chargers win, Staley is guaranteed coming back, rip Chargers fans",1.0,eagles,t3_10c5u92,False,0.0,I'm a Celtics fan too. I'm sorry.,2023-01-14T21:04:14Z,eagles,0.5574
1430,16615,16615,Avery-Bradley,"He honestly should be fired in general, Staley is okay but imagine if they got a Sean Payton? They'd be a top 5 offense - Herbert, Ekeler, Keenan Allen, Mike Williams - Joey Bosa, Khalil Mack, Asante Samuel",1.0,eagles,t3_10c5u92,False,0.0,I'm a Celtics fan too. I'm sorry.,2023-01-14T20:57:12Z,eagles,-0.016125
1431,16619,16619,Avery-Bradley,Hurts was legitimately terrible in that playoff game. [Even the Bucs players and staff thought midgame that Hurts wasn't good](https://thelibertyline.com/2022/01/22/buccaneers-jalen-hurts-micd-up/),1.0,eagles,t3_10c5u92,False,0.0,I'm a Celtics fan too. I'm sorry.,2023-01-14T20:20:33Z,eagles,-0.422125
1432,16620,16620,Avery-Bradley,"First was deflected twice by the defensive line, second was on 4th and 7 and should've been DPI, but the third was 100% on him IMO",2.0,eagles,t3_10c5u92,False,0.0,I'm a Celtics fan too. I'm sorry.,2023-01-14T20:17:11Z,eagles,0.0129
1433,16622,16622,Avery-Bradley,"Slay is 32 years old, you have to start planning for his replacement at some point. I doubt Bradberry will stay tbh, he’s talked about wanting to be paid (I’d have to look up a source for that quote) this off-season. I think we’re going to prioritize re-signing CJGJ and Edwards first and foremost. Then, we need to make sure we have enough money to re-sign Jalen Hurts and DeVonta Smith for next offseason",1.0,eagles,t3_10bej5l,False,0.0,I'm a Celtics fan too. I'm sorry.,2023-01-14T12:41:58Z,eagles,-0.05621875
1434,16623,16623,Avery-Bradley,This sounds too insane to be true,2070.0,nfl,t3_10bel2o,False,0.0,:Eagles: Eagles,2023-01-13T21:54:46Z,eagles,0.0258
1435,16624,16624,Avery-Bradley,"There's no guarantee that Sanders leaves. Normally I'd say he's almost certainly gone (due to how expensive running backs can cost and the durability), but this free agency is **stacked** with running backs. I honestly have no clue, and I could see him returning.

That all being said, as much as Bijan makes sense for this team (and how a guy like CMC positively affects the 49ers), we have much bigger needs than a first round running back. We're desperate for a CB. We could also use the DT/DE depth. I'd much rather Howie take a swing for those positions than a running back in the first round. I'm also slightly opening up to the possibility of OL in the first round, though I'm not as sold on it being a first round need.

Ideally I'd like Howie to draft RB in the third round, as long as he likes the prospect and isn't just drafting BPA",7.0,eagles,t3_10bej5l,False,0.0,I'm a Celtics fan too. I'm sorry.,2023-01-13T21:50:09Z,eagles,0.0946515614103207
1436,16625,16625,Avery-Bradley,"Lol all good man! I randomly picked up the Eagles as a kid (since Mark Sanchez, I ain't no bandwagon) and then the Celtics stuck cause of Boston. 

Maybe I subconsciously like green?",8.0,eagles,t3_10bdao8,False,0.0,I'm a Celtics fan too. I'm sorry.,2023-01-13T21:21:28Z,eagles,0.1437703703703703
1437,16626,16626,Avery-Bradley,"Oh man that would be a tough loss if we lost Gannon, Steichen, Brian Johnson, and Wilson in the same off-season",31.0,eagles,t3_10bdao8,False,0.0,I'm a Celtics fan too. I'm sorry.,2023-01-13T20:43:57Z,eagles,-0.6249
1438,16629,16629,Avery-Bradley,"Gimme DeSean Jackson for offense, though they would be good too",1.0,nfl,t3_10awlix,False,0.0,:Eagles: Eagles,2023-01-13T15:03:35Z,eagles,0.2263
1439,16631,16631,Avery-Bradley,"wow, that's huge, he should stay in this class",1.0,nfl,t3_10awlix,False,0.0,:Eagles: Eagles,2023-01-13T14:57:03Z,eagles,0.7269
1440,16633,16633,Avery-Bradley,"I highly doubt this is true, but if it's true, you gotta imagine that that's fireable offense, right?",0.0,nfl,t3_10b18hv,False,0.0,:Eagles: Eagles,2023-01-13T14:48:09Z,eagles,0.2967
1441,16636,16636,Avery-Bradley,"Aiyuk is fucking filthy, he's so elite. He has the occasional bad drop still, but he's one of the best route runners in the NFL",2.0,nfl,t3_10audm8,False,0.0,:Eagles: Eagles,2023-01-13T14:35:51Z,eagles,0.32345
1442,16637,16637,Avery-Bradley,Javon Hargrave - whoever signs him this free agency is getting a beast,1.0,nfl,t3_10audm8,False,0.0,:Eagles: Eagles,2023-01-13T14:30:40Z,eagles,0.596
1443,16638,16638,Avery-Bradley,"Wow, I'm stunned",1.0,nfl,t3_10b4lxe,False,0.0,:Eagles: Eagles,2023-01-13T14:29:11Z,eagles,0.5267
1635,18531,18531,BigBlackSabbathFlag,"Thank you, I was a bit confused and the announcers never addressed why he was on the sideline.",1.0,nfl,t3_10efdc3,False,0.0,:Eagles: Eagles,2023-01-17T19:43:10Z,eagles,0.0516
1636,18533,18533,BigBlackSabbathFlag,Why was Bosa on the sideline during Jags last drive? Was it the coaches decision? Season on the line you’d think you would want your best on the field.,1.0,nfl,t3_10efdc3,False,0.0,:Eagles: Eagles,2023-01-17T16:45:30Z,eagles,0.2235
1637,18537,18537,BigBlackSabbathFlag,Some bad blocking from players that rarely block. Andrews comes close to making the tackle.,14.0,nfl,t3_10d459g,False,0.0,:Eagles: Eagles,2023-01-15T22:50:41Z,eagles,-0.14275
1638,18538,18538,BigBlackSabbathFlag,"Well put, I always had respect for him even though a change was inevitable.",2.0,eagles,t3_10caipa,False,0.0,:eagles: Eagles,2023-01-14T22:43:56Z,eagles,0.6369
1639,18540,18540,BigBlackSabbathFlag,He's an Eagle legend. Hollywood made a feature film about him. There's footage from a game he played against the Giants where he had a cut and the blood was green.,4.0,eagles,t3_10c38qf,False,0.0,:eagles: Eagles,2023-01-14T19:01:46Z,eagles,0.0257333333333333
1640,18541,18541,BigBlackSabbathFlag,Looks like you got moderated,1.0,eagles,t3_10bca20,False,0.0,:eagles: Eagles,2023-01-14T03:40:23Z,eagles,0.3612
1946,20148,20148,Birdamus,I love that this dude looks so fucking pissed that he has to answer Bosco meme questions at his presser.,10.0,eagles,t3_10fepgw,False,0.0,Fred Barnett,2023-01-18T13:09:07Z,eagles,-0.1459
1947,20149,20149,Birdamus,"I really don’t understand the sentiment on this sub that we should throw him away because he’s not worth the money.

The highest paid FA RB [contracts](https://www.spotrac.com/nfl/contracts/running-back/) are $15/16 mil a year, and they’re from ‘19(Zeke) and ‘20 (Kamara, McCaffrey, Henry, Cook).

Chubb resigned in ‘21 for 3/36, and he’s the best pure runner in football.

You’re telling me Howie can’t structure a 10-12 mil a year contract that’s got some front-loaded bonus, cheap middle year, and back-loaded year if we need to cut or restructure? Of course he can, he’s fucking Howie.

I don’t want Gainwell/Scott and some rookie who has to learn pass protection next year. Re-sign Boobie and draft his replacement in the late rounds so you can cut him/restructure when needed. It’s not that hard.

This is his first year over 200 carries. RBs break down after those 300+ carry seasons. He hasn’t even hit 800 career carries yet. He’s nowhere near washed.",7.0,eagles,t3_10fa1xs,False,0.0,Fred Barnett,2023-01-18T10:29:43Z,eagles,1.972394541656365e-07
1948,20151,20151,Birdamus,"You’re welcome… now seriously, get this outta here. 

You know Godzilla defeats Ghidora, right?",1.0,eagles,t3_10et7cg,False,0.0,Fred Barnett,2023-01-17T19:15:30Z,eagles,-0.203575
1949,20152,20152,Birdamus,Take this shit to r/nfceastmemewar,9.0,eagles,t3_10et7cg,False,0.0,Fred Barnett,2023-01-17T19:12:13Z,eagles,-0.5574
1950,20157,20157,Birdamus,Holy shit that video is amazing,85.0,nfl,t3_10efath,False,0.0,:Eagles: Eagles,2023-01-17T10:36:17Z,eagles,0.0516
1951,20158,20158,Birdamus,For sure… they’re in *much* better hands than they were under Gettelman and Shurmur/Judge.,2.0,nfl,t3_10ee6mj,False,0.0,:Eagles: Eagles,2023-01-17T10:28:07Z,eagles,0.4404
1952,20159,20159,Birdamus,"Y’all turned your season around something fierce, but the facts are you haven’t beat any team with more than 10 wins yet. But that’s what the playoffs are about - chance to prove it on the biggest stages.",-3.0,nfl,t3_10ee6mj,False,1.0,:Eagles: Eagles,2023-01-17T09:56:45Z,eagles,0.3691
1953,20160,20160,Birdamus,"Andy Dalton, Justin Fields and Mac Jones all had 108+ passer ratings in games vs the Vikes. 

Danny Dimes gonna get a reality check against a real defense.",-10.0,nfl,t3_10ee6mj,False,0.0,:Eagles: Eagles,2023-01-17T09:51:07Z,eagles,0.064
1954,20161,20161,Birdamus,We dropped 48 on them the last time we both played our starters.,-6.0,nfl,t3_10ee6mj,False,0.0,:Eagles: Eagles,2023-01-17T09:39:13Z,eagles,0.34
1955,20162,20162,Birdamus,"But neither of us could sweep the Washington Danny Snyders, crazy.",18.0,nfl,t3_10ee6mj,False,0.0,:Eagles: Eagles,2023-01-17T09:09:00Z,eagles,-0.4767
