,Unnamed: 0.1,Unnamed: 0,author,body,score,subreddit,link_id,over_18,controversiality,author_flair_text,created_utc,flair,sentiment
15600,136905,136905,Pendraflare59,Dolphins receivers out here giving vibes of old Eagles receivers with these drops lol,1.0,nfl,t3_10cph1u,False,0.0,:Eagles: Eagles :Bills: Bills,2023-01-15T13:13:03Z,eagles,0.6369
15601,136906,136906,Pendraflare59,Skylar Thimpson's dad drove 15 hours from Missouri? Geez that's some devotion,2.0,nfl,t3_10cph1u,False,0.0,:Eagles: Eagles :Bills: Bills,2023-01-15T13:06:07Z,eagles,0.2294
15602,136907,136907,Pendraflare59,Love how that housewife calls out Dak for flipping the table 😆,2.0,nfl,t3_10cph1u,False,0.0,:Eagles: Eagles :Bills: Bills,2023-01-15T13:02:22Z,eagles,0.7884
15603,136908,136908,Pendraflare59,Is it wrong that I kinda enjoy these Craig Robinson Pizza Hut ads?,2.0,nfl,t3_10cph1u,False,0.0,:Eagles: Eagles :Bills: Bills,2023-01-15T12:57:54Z,eagles,-0.0498
15604,136909,136909,Pendraflare59,172-19 yards... Is that bad,2.0,nfl,t3_10cph1u,False,0.0,:Eagles: Eagles :Bills: Bills,2023-01-15T12:53:25Z,eagles,-0.5423
15605,136911,136911,Pendraflare59,Yeah I think that's a catch,2.0,nfl,t3_10cph1u,False,0.0,:Eagles: Eagles :Bills: Bills,2023-01-15T12:43:19Z,eagles,0.296
15606,136912,136912,Pendraflare59,Am I crazy or does that third down horn sound like an NHL goal horn?,1.0,nfl,t3_10cph1u,False,0.0,:Eagles: Eagles :Bills: Bills,2023-01-15T12:39:19Z,eagles,0.0258
15607,136913,136913,Pendraflare59,That's Super Bowl LII ref Gene Steratore to you!,1.0,nfl,t3_10cph1u,False,0.0,:Eagles: Eagles :Bills: Bills,2023-01-15T12:34:34Z,eagles,0.636
15608,136915,136915,Pendraflare59,"lol there you go Bills, this could be over quick",1.0,nfl,t3_10cph1u,False,0.0,:Eagles: Eagles :Bills: Bills,2023-01-15T12:30:12Z,eagles,0.4215
15609,136917,136917,Pendraflare59,"I was in Tampa Bay for Busch Gardens Christmas Town on December 16 and it was like 66 at most but was in the mid-50s. I was able to wear a fleece and shorts, one person said those in Florida were likely thrilled to have some colder weather but not those that came for vacations 😛",2.0,nfl,t3_10cph1u,False,0.0,:Eagles: Eagles :Bills: Bills,2023-01-15T12:26:50Z,eagles,0.166625
15610,136920,136920,Pendraflare59,"Not an ideal start. No need to get greedy, take the points",5.0,nfl,t3_10cph1u,False,0.0,:Eagles: Eagles :Bills: Bills,2023-01-15T12:08:55Z,eagles,-0.37535
15611,136921,136921,Pendraflare59,"Hope it's nice there, I know Florida has not been quite as warm as of recent 😛",1.0,nfl,t3_10cph1u,False,0.0,:Eagles: Eagles :Bills: Bills,2023-01-15T12:02:56Z,eagles,0.7832
15612,136923,136923,Pendraflare59,Shouldn't have played Mike Williams in a meaningless game :\\,50.0,nfl,t3_10cb6v4,False,0.0,:Eagles: Eagles :Bills: Bills,2023-01-14T23:20:18Z,eagles,-0.6041
15613,136924,136924,Pendraflare59,"I seriously fell asleep during the fourth quarter. Amazing.

Go Dougie P!",1.0,nfl,t3_10cak7o,False,0.0,:Eagles: Eagles :Bills: Bills,2023-01-14T22:34:29Z,eagles,0.0585111111111111
15614,136926,136926,Pendraflare59,When I think that song the first thing I think of is Guitar Hero and the warning messages you're given the first time you're about to play it 😆,1.0,nfl,t3_10c5u87,False,0.0,:Eagles: Eagles :Bills: Bills,2023-01-14T20:53:26Z,eagles,0.7269
15615,136927,136927,Pendraflare59,Well there goes the shutout at least,6.0,nfl,t3_10c5u87,False,0.0,:Eagles: Eagles :Bills: Bills,2023-01-14T20:48:46Z,eagles,0.2732
15616,136928,136928,Pendraflare59,Okay those graphics were more entertaining than anything else this game has had lmfao,2.0,nfl,t3_10c5u87,False,0.0,:Eagles: Eagles :Bills: Bills,2023-01-14T20:37:46Z,eagles,0.8221
15617,136929,136929,Pendraflare59,"""I don't know what you've been told...""

They ain't worried? lol yeah they are",1.0,nfl,t3_10c5u87,False,0.0,:Eagles: Eagles :Bills: Bills,2023-01-14T20:32:04Z,eagles,0.362075
15618,136930,136930,Pendraflare59,"lmfao what is this, the Jaguars are the ones Chargering, not the Chargers",5.0,nfl,t3_10c5u87,False,0.0,:Eagles: Eagles :Bills: Bills,2023-01-14T20:28:54Z,eagles,0.5423
15619,136931,136931,Pendraflare59,"I would say this game is over, but I'm curious on if the Chargers could find some amazing way to Charger this one",3.0,nfl,t3_10c5u87,False,0.0,:Eagles: Eagles :Bills: Bills,2023-01-14T20:15:59Z,eagles,0.8462
15620,136932,136932,Pendraflare59,Well this game is going ugly fast,2.0,nfl,t3_10c5u87,False,0.0,:Eagles: Eagles :Bills: Bills,2023-01-14T19:57:05Z,eagles,-0.296
15621,136937,136937,Pendraflare59,"This team did come back from down 17 against Dallas not too long ago. So yeah, still lots to play",2.0,nfl,t3_10c5u87,False,0.0,:Eagles: Eagles :Bills: Bills,2023-01-14T19:22:53Z,eagles,0.2992
15622,136938,136938,Pendraflare59,"Hopefully, given we actually have a real matchup and not some TNF scrub game",2.0,nfl,t3_10c5u87,False,0.0,:Eagles: Eagles :Bills: Bills,2023-01-14T19:15:00Z,eagles,0.4019
15623,136939,136939,Pendraflare59,"Hello again Al Michaels, so great to hear your voice over that roaring theme once more!",20.0,nfl,t3_10c5u87,False,0.0,:Eagles: Eagles :Bills: Bills,2023-01-14T19:08:30Z,eagles,0.7603
15624,136940,136940,Pendraflare59,lol just remembered that the Jaguars stadium has a pool,1.0,nfl,t3_10c5u87,False,0.0,:Eagles: Eagles :Bills: Bills,2023-01-14T19:03:58Z,eagles,0.4215
16238,145253,145253,PsychologicalCase10,"Jalen Hurts. All offseason I had to hear so many Watson an Wilson takes. I’m glad we stuck with Jalen Hurts. Wasn’t really our choice cause neither Watson or Wilson wanted to come here, but Jalen Hurts has proven he can lead the team.",1.0,nfl,t3_10afhr1,False,0.0,:Eagles: Eagles,2023-01-13T00:25:04Z,eagles,-0.176687109375
16287,147013,147013,Pyromelter,Hock seemed to put 110% in every game and he balled out in that playoff game. I get that detroit improved after the trade but you can't put that on him.,2.0,nfl,t3_10dk4oq,False,0.0,:Eagles: Eagles,2023-01-16T18:27:45Z,eagles,0.13085
16288,147014,147014,Pyromelter,"I hate social media subtweeting.

Hate it. I wish we could all grow TF up.",2.0,nfl,t3_10dj6ee,False,0.0,:Eagles: Eagles,2023-01-16T18:24:28Z,eagles,0.0492407407407407
16289,147015,147015,Pyromelter,"If he were getting paid like a costco hot dog, he could win, because the vikings could pay premium pass rushers, DB's, OL, etc. And then he could just be Brad Johnson or Trent Dilfer and game manage a superior overall team to a championship.

At 35 million a year, this article is spot on. They are paying prime steak prices for hot dog quality.",3.0,nfl,t3_10dgt7k,False,0.0,:Eagles: Eagles,2023-01-16T18:22:56Z,eagles,0.0145
16612,148160,148160,RJMonster,Maddox is hopefully back for the SB if we get to that point. Any team in the AFC is gonna be airing that ball out.,18.0,eagles,t3_10enemu,False,0.0,:helmet:92%er,2023-01-17T15:15:24Z,eagles,0.100475
16613,148161,148161,RJMonster,"Giants are looking sharp with an improved secondary so I'm glad Hurtss should be at full strength. Gonna be a tough game  
34-20 Eagles",27.0,nfl,t3_10enel9,False,0.0,:Eagles: Eagles,2023-01-17T15:12:20Z,eagles,0.151425
16614,148163,148163,RJMonster,This feels like those Facebook post where you tag your friends for an adventure,1.0,nfl,t3_10d17sp,False,0.0,:Eagles: Eagles,2023-01-16T08:22:53Z,eagles,0.7845
16615,148164,148164,RJMonster,Great footwork but got full completion at the second step. This game feels like it should be 34-17 with how much Allen and Diggs are going off,106.0,nfl,t3_10ct8ng,False,0.0,:Eagles: Eagles,2023-01-15T14:00:41Z,eagles,0.2735
16616,148165,148165,RJMonster,Ima leave it because he’s gonna strike manning level fear,1.0,nfl,t3_10c5u87,False,0.0,:Eagles: Eagles,2023-01-14T22:34:34Z,eagles,-0.5994
16617,148167,148167,RJMonster,I FUCKING LOVE DOUG P,2.0,nfl,t3_10c5u87,False,0.0,:Eagles: Eagles,2023-01-14T22:15:18Z,eagles,0.6697
16889,149366,149366,ReconGhost189,"God San Fran is gonna slaughter whoever wins this, tbh I’d rather have one of these two than the giants they’re looking that bad.",5.0,eagles,t3_10dxy0w,False,0.0,SCOTTISH EAGLE,2023-01-16T20:09:24Z,eagles,0.3182
16890,149369,149369,ReconGhost189,Oh damn,39.0,nfl,t3_10cup54,False,0.0,:Eagles: Eagles,2023-01-15T14:57:11Z,eagles,-0.4019
16891,149371,149371,ReconGhost189,"Honestly don’t see much to worry about with Purdy, it’s mainly great scheming by SF49er coaches but that stuff won’t work against a defence like ours.",2.0,eagles,t3_10bz8re,False,0.0,SCOTTISH EAGLE,2023-01-14T17:50:16Z,eagles,0.7543
17038,150354,150354,Renkan,The Foles disrespect smh,16.0,nfl,t3_10dy20q,False,0.0,:Eagles: Eagles :Ravens: Ravens,2023-01-16T23:15:50Z,eagles,-0.6249
17740,154334,154334,Rsubs33,No one thought the Eagles and the Cowboys were going to be bad this season just the Commanders and Giants.,1.0,nfl,t3_10e2wx9,False,0.0,:Eagles: Eagles,2023-01-17T06:09:32Z,eagles,-0.6908
17896,155324,155324,RunGoldenRun717,"""Fuck off, we're trying to tank. But tom is trying to make the playoffs still""",97.0,nfl,t3_10fgs1q,False,0.0,:Eagles: Eagles,2023-01-18T16:22:02Z,eagles,-0.135575
17897,155325,155325,RunGoldenRun717,Listen to the Kelces' New Heights podcast with him. None of this is true.,7.0,nfl,t3_10fgs1q,False,0.0,:Eagles: Eagles,2023-01-18T16:21:01Z,eagles,0.21075
17898,155331,155331,RunGoldenRun717,"QB Sneaks, AJ Brown took the ball of that guys shoulder, AJ brown 3 tds against Steelers, 17-0 lead on dallas. Game winning drive vs the Colts where jalen just took over and ran for like 40 yards, Beat the absolute shit out of the giants at the meadowlands (that whole game was fun to watch). I think they have been SO good that they make things look relatively routine. We havent had many close games. The offense just works. The D has played well. But there still have been good moments this year.",1.0,eagles,t3_10e1b96,False,0.0,Go0o0 BiiiRrDdsS,2023-01-18T13:18:45Z,eagles,0.095056551266904
17899,155336,155336,RunGoldenRun717,"I dont think its possible to understate how fired up this team is going to come out. I think for exactly the reason you said. They havent been ""locked in"" in a while. They are mentally fresh as well as physically.. They will have all the gas in the tank for this one.",24.0,eagles,t3_10f8xie,False,0.0,Go0o0 BiiiRrDdsS,2023-01-18T09:13:13Z,eagles,0.0208896319999999
17900,155337,155337,RunGoldenRun717,Daniel Wheels scrambles. That being said im not TOO worried about it but it is something we need to limit. Hes gunna get his. There will be big plays he makes with his legs. We just need to limit them.,4.0,eagles,t3_10f8xie,False,0.0,Go0o0 BiiiRrDdsS,2023-01-18T09:11:42Z,eagles,0.01018224
17901,155343,155343,RunGoldenRun717,No they're on the internet crowning themselves champs for beating an 8-9 default playoff team,-11.0,nfl,t3_10ekex3,False,0.0,:Eagles: Eagles,2023-01-17T13:44:40Z,eagles,-0.34
17902,155347,155347,RunGoldenRun717,"I had a Dallas fan tell me with a straight face (metaphorically) that ""Brady balled out tonight"". They think their defense is so superior that Brady had a great game, they just shut the rest of the team down. That whole state is delusional",-6.0,nfl,t3_10ekex3,False,1.0,:Eagles: Eagles,2023-01-17T13:09:26Z,eagles,0.1133259259259259
17903,155352,155352,RunGoldenRun717,When you're team is so un-toxic that this is a tweet haha lets go boys,6.0,eagles,t3_10eim39,False,0.0,Go0o0 BiiiRrDdsS,2023-01-17T12:49:26Z,eagles,0.4588
17904,155367,155367,RunGoldenRun717,"You can buy when you get there. Prepay If you can, that way you know what lot you're in. But you can always pull up, pay, and find a spot",11.0,eagles,t3_10dos4f,False,0.0,Go0o0 BiiiRrDdsS,2023-01-16T13:27:02Z,eagles,-0.0510333333333333
17905,155369,155369,RunGoldenRun717,"To borrow a phrase from Liverpool FC, you'll never walk alone",3.0,eagles,t3_10dnlob,False,0.0,Go0o0 BiiiRrDdsS,2023-01-16T12:47:35Z,eagles,0.1877
17906,155371,155371,RunGoldenRun717,Seriously tho he's not eating enough. He looks like a skeleton in the face. Did giselle do all the cooking?,1.0,nfl,t3_10cz41h,False,0.0,:Eagles: Eagles,2023-01-16T12:14:59Z,eagles,0.0335444444444444
17907,155372,155372,RunGoldenRun717,"Stop Saquon. Stop Daniel Wheels. Im not worried about danny dimes. We'll defend the passes. but we cant let him run for 7 first downs like the vikings did (yes, 7 of his runs or scrambles resulted in a first down on sunday)",3.0,eagles,t3_10d4fax,False,0.0,Go0o0 BiiiRrDdsS,2023-01-16T10:11:07Z,eagles,0.15687968
17908,155381,155381,RunGoldenRun717,He was targeted but every time the ball was in the air he wouldn't adjust to it and make an awkward attempt and not catch it.,9.0,eagles,t3_10d2via,False,0.0,Go0o0 BiiiRrDdsS,2023-01-15T21:31:56Z,eagles,-0.2263
17909,155383,155383,RunGoldenRun717,He didn't do shit all year. I doubt it. He was barely on the field other than special teams,13.0,eagles,t3_10d2via,False,0.0,Go0o0 BiiiRrDdsS,2023-01-15T21:15:35Z,eagles,0.1103111111111111
17910,155388,155388,RunGoldenRun717,Bachelor Brady to the city of sin lol,2.0,nfl,t3_10cz41h,False,0.0,:Eagles: Eagles,2023-01-15T18:10:56Z,eagles,-0.2023
17911,155455,155455,RunGoldenRun717,Where did you get a lamp like this? Can't imagine it's NFL licensed. That's awesome,6.0,eagles,t3_10bwunn,False,0.0,Go0o0 BiiiRrDdsS,2023-01-14T14:52:11Z,eagles,0.2216777777777777
17912,155476,155476,RunGoldenRun717,For sure. Just hope he can still move like he needs to. Like you said hopefully he's just sandbaggin it right now.,1.0,eagles,t3_10az1va,False,0.0,Go0o0 BiiiRrDdsS,2023-01-13T15:21:06Z,eagles,0.2973851851851852
17913,155481,155481,RunGoldenRun717,"If anyone caught him on the pat mcafee show... he basically said like yeah its my groin, i need my groin, im playing no question, but if i get smoked then im out. So it really feels like we shouldnt expect the world from him this post season but hes so damn tough hes not gunna sit until he knows he cant go anymore.",1.0,eagles,t3_10az1va,False,0.0,Go0o0 BiiiRrDdsS,2023-01-13T13:40:52Z,eagles,-0.2887
17914,155482,155482,RunGoldenRun717,Very fair eagles fan right here,26.0,eagles,t3_10b01xd,False,0.0,Go0o0 BiiiRrDdsS,2023-01-13T13:37:42Z,eagles,0.6318
17915,155483,155483,RunGoldenRun717,I mean im gunna be pissed either way but obviously the offense has shown us how good they can be. If they lay an egg thats pretty frustrating. We've SEEN the defense give up 30+. but we've also seen them play lights out. So i think either way its okay to be pissed off. but we're not going to be calling for anyones head.,1.0,eagles,t3_10b01xd,False,0.0,Go0o0 BiiiRrDdsS,2023-01-13T13:37:08Z,eagles,-0.0118690757887517
17977,157638,157638,SL-Apparel,Trading LeSean McCoy for the corpse of kiko alonso,2.0,nfl,t3_10a97jx,False,0.0,:Eagles: Eagles,2023-01-13T03:55:42Z,eagles,-0.5719
18083,160753,160753,Selthboy,"Toradol shots, to be honest.",10.0,nfl,t3_10az571,False,0.0,:Eagles: Eagles,2023-01-13T11:55:16Z,eagles,0.5106
18084,160754,160754,Selthboy,"A. Q. Shipley who played center for 12 years was asked about this on the PMS a few days ago. He had the exact same injury as Lane Johnson and said that Toradol could fix it lol.

“I had that same injury. It’s painful, but you can deal with it, and get it fixed after the season…” -quote from that segment",19.0,nfl,t3_10az571,False,0.0,:Eagles: Eagles,2023-01-13T11:54:44Z,eagles,-0.084565625
18125,161695,161695,Sgobirds,You don’t care if your team advances or not? Lol what a statement. Happy cake day!,92.0,nfl,t3_10essr9,False,0.0,:Eagles: Eagles ,2023-01-17T18:42:35Z,eagles,0.2689259259259259
18220,162196,162196,ShootHoopsNotPeople,As someone from the town it happened in 100% some snob all worked up over some light trash talk.,8.0,nfl,t3_10eh3z8,False,0.0,:Eagles: Eagles,2023-01-17T16:41:32Z,eagles,-0.4588
18221,162197,162197,ShootHoopsNotPeople,"Yeah pulling doesn't get called either, but it doesn't really happen on sneaks. It wouldn't make much sense to have a lineman turn around and pull the QB.",1.0,nfl,t3_10eh3z8,False,0.0,:Eagles: Eagles,2023-01-17T16:37:25Z,eagles,0.038275
18222,162198,162198,ShootHoopsNotPeople,Two tickets to paradise,1.0,nfl,t3_10e13sw,False,0.0,:Eagles: Eagles,2023-01-16T21:43:54Z,eagles,0.6369
18223,162204,162204,ShootHoopsNotPeople,"Sure, the Eagles are 1-1 against him. But for my entire childhood we were 0-1 and he was the guy who wrecked the best chance we had at a Super Bowl in decades. Can't really just flip a switch and start liking him, especially with all the winning he did in between.",1.0,nfl,t3_10dkzz8,False,0.0,:Eagles: Eagles,2023-01-16T17:46:25Z,eagles,0.3585074074074074
18224,162205,162205,ShootHoopsNotPeople,"I saw Ruiz' QB rankings this year and I'm pretty sure it's his shtick. I basically don't read anything from him. Just checked real quick and he currently has Lawrence at 7 and Dak at 5 on his rankings, while Hurts hasn't moved from between from anywhere between spots 9-11 since week 9.",2.0,nfl,t3_10do4vk,False,0.0,:Eagles: Eagles,2023-01-16T17:32:49Z,eagles,-0.1340666666666666
18225,162206,162206,ShootHoopsNotPeople,Not sure how that's relevant,0.0,nfl,t3_10do4vk,False,0.0,:Eagles: Eagles,2023-01-16T17:29:09Z,eagles,-0.2411
18226,162208,162208,ShootHoopsNotPeople,Part of it is how calmly Doug looks at him and says sure like he didn't just suggest one of the ballsiest trick play calls in football history.,19.0,nfl,t3_10drui7,False,0.0,:Eagles: Eagles,2023-01-16T17:18:48Z,eagles,0.8074
18227,162210,162210,ShootHoopsNotPeople,It was by far the best game he played all year. He was basically already a lock for being the second QB off the board but that game against that defense really propelled him into the discussion with Bryce IMO.,7.0,nfl,t3_10diivy,False,0.0,:Eagles: Eagles,2023-01-16T17:15:33Z,eagles,0.2863
18228,162211,162211,ShootHoopsNotPeople,"Yeah, this was a comment complaint among OSU fans. He did use he legs better to pick up some easy yards against Georgia which was a big development, it was also absolutely needed which it wasn't from him for 90% of the year.",2.0,nfl,t3_10diivy,False,0.0,:Eagles: Eagles,2023-01-16T17:13:43Z,eagles,0.35015
18229,162219,162219,ShootHoopsNotPeople,Gonna lose my voice with how much I've been yelling at coaches to sneak it this weekend. Thank god the Giants did on that 4th and less than a yard after lining up in the shot gun before taking a time out.,1.0,nfl,t3_10cw1jy,False,0.0,:Eagles: Eagles,2023-01-15T19:19:58Z,eagles,0.047525
18230,162224,162224,ShootHoopsNotPeople,That throw is so nasty how on earth do you fit that in there,1.0,nfl,t3_10cqqz7,False,0.0,:Eagles: Eagles,2023-01-15T12:25:05Z,eagles,-0.4795
18231,162226,162226,ShootHoopsNotPeople,That throw is so nasty how on earth do you fit that in there,1.0,nfl,t3_10cqroo,False,0.0,:Eagles: Eagles,2023-01-15T12:22:24Z,eagles,-0.4795
18232,162227,162227,ShootHoopsNotPeople,"I've seen the ""kicker recovers their own kick"" move but usually the other team basically has the middle of the field vacated. Not the case here and they still went for it, pretty awesome.",4.0,nfl,t3_10calaq,False,0.0,:Eagles: Eagles,2023-01-15T11:19:19Z,eagles,0.4037
18233,162235,162235,ShootHoopsNotPeople,"He's been awesome this year, much better than I expected. Us having two good to elite corners on the outside is a big change of pace for the Eagles but a very welcome one as a fan.",1.0,nfl,t3_10ax63y,False,0.0,:Eagles: Eagles,2023-01-13T12:22:20Z,eagles,0.62435
18234,162236,162236,ShootHoopsNotPeople,Then what's the point of holding back if he's gonna be disrespected by something anyways,1.0,nfl,t3_10ah5l2,False,0.0,:Eagles: Eagles,2023-01-13T11:19:25Z,eagles,-0.4588
19022,169431,169431,SourBerry1425,"Come to Philly Gronk, we’re kinda like BUF and it’s not quite as cold!",0.0,nfl,t3_10ftp7f,False,1.0,:Eagles: Eagles,2023-01-18T23:43:08Z,eagles,0.3609
19023,169435,169435,SourBerry1425,Add DJack and I MIGHT feel pity,1.0,nfl,t3_10dwvve,False,0.0,:Eagles: Eagles,2023-01-16T18:21:02Z,eagles,-0.296
19024,169436,169436,SourBerry1425,"Nick Foles, Darren Sproles and Boston Scott 3 headed monster with Brian Dawkins on defense can’t be stopped 🔥🔥🔥",4.0,nfl,t3_10dwvve,False,0.0,:Eagles: Eagles,2023-01-16T18:05:44Z,eagles,-0.765
19025,169437,169437,SourBerry1425,It is the Cowboys lol,-3.0,nfl,t3_10dkzz8,False,1.0,:Eagles: Eagles,2023-01-16T11:54:18Z,eagles,0.4215
19026,169438,169438,SourBerry1425,The 3 most loaded rosters in the league are in the NFC,10.0,nfl,t3_10dkzz8,False,0.0,:Eagles: Eagles,2023-01-16T11:33:14Z,eagles,-0.6633
19027,169440,169440,SourBerry1425,This is very scary but Boston Scott has fresh legs so not worried,9.0,nfl,t3_10dim8g,False,0.0,:Eagles: Eagles,2023-01-16T10:25:23Z,eagles,0.5351
19028,169444,169444,SourBerry1425,Don’t know why that’s so surprising to you,21.0,nfl,t3_10aztmm,False,0.0,:Eagles: Eagles,2023-01-13T11:20:47Z,eagles,0.4101
19029,169445,169445,SourBerry1425,He had a 1st team worthy season but Trent is just different,25.0,nfl,t3_10aztmm,False,0.0,:Eagles: Eagles,2023-01-13T11:19:36Z,eagles,0.2382
19173,169740,169740,SquidTwister,"> lmaooooo say goodbye to your job dude

God damn this is so mean lol",7.0,nfl,t3_10e13er,False,0.0,:Eagles: Eagles,2023-01-16T21:09:04Z,eagles,0.3566
19733,175720,175720,Tall_Bed,What a shame,1.0,nfl,t3_10dq027,False,0.0,:Eagles: Eagles ,2023-01-16T15:08:22Z,eagles,-0.4767
19867,185399,185399,Trinityliger,Hope you’re ready to learn Chinese brett Maher,4.0,nfl,t3_10dxy2f,False,0.0,:Eagles: Eagles,2023-01-16T20:46:27Z,eagles,0.6597
19868,185400,185400,Trinityliger,Looks like a Q collar to prevent concussions. A few lacrosse players wear them too,2.0,nfl,t3_10dxy2f,False,0.0,:Eagles: Eagles,2023-01-16T20:26:48Z,eagles,0.09545
19870,185403,185403,Trinityliger,AITA: Dude at the bengals bar was wearing a cowboys starter jacket and kept yelling “how bout them boys” and I said “don’t they play tomorrow”. He didn’t like that and asked “are we gonna have a problem”. I then assumed the position and let out a “goooo biiiirds” on loop,4.0,eagles,t3_10d0axj,False,0.0,Smitty,2023-01-15T23:40:16Z,eagles,0.0527259259259259
19871,185404,185404,Trinityliger,sounds like someone bet the over,2.0,nfl,t3_10d0b65,False,0.0,:Eagles: Eagles,2023-01-15T20:39:13Z,eagles,0.3612
19872,185405,185405,Trinityliger,"Giants cover

Danny Dimes over 39.5 rush

Saquon anytime TD

free fuckin money",6.0,eagles,t3_10cush2,False,0.0,Smitty,2023-01-15T16:38:41Z,eagles,0.5106
19873,185406,185406,Trinityliger,Maybe it’s because I work with a salty Vikings fan but does anyone else get more joy out of watching these whiner babies lose more so than the Giants?,9.0,eagles,t3_10cush2,False,0.0,Smitty,2023-01-15T16:32:30Z,eagles,0.2357
20186,187162,187162,Turbulent-Hovercraft,Only issue I have is that the Jags fans were very low energy,4.0,nfl,t3_10c5u87,False,0.0,:Eagles: Eagles,2023-01-14T22:33:14Z,eagles,-0.0038
20187,187164,187164,Turbulent-Hovercraft,This is sickening lol,2.0,nfl,t3_10c5u87,False,0.0,:Eagles: Eagles,2023-01-14T22:26:20Z,eagles,-0.1531
20188,187165,187165,Turbulent-Hovercraft,"Sean Payton is sitting in the dark parking lot making 2019 Joker facial expressions in the shadows right now. 

In his powder blue and gold suit.",11.0,nfl,t3_10c5u87,False,0.0,:Eagles: Eagles,2023-01-14T22:20:13Z,eagles,0.032
20189,187166,187166,Turbulent-Hovercraft,Yeah the weird schizo clicking sounds and rapid cuts like it’s from a 2000s horror movie,2.0,nfl,t3_10c5u87,False,0.0,:Eagles: Eagles,2023-01-14T22:17:55Z,eagles,-0.4404
20190,187169,187169,Turbulent-Hovercraft,I do think that accursed Ukulele Xylophone era of the 2010s is mostly behind us now thankfully,2.0,nfl,t3_10c5u87,False,0.0,:Eagles: Eagles,2023-01-14T22:14:28Z,eagles,0.4215
20191,187170,187170,Turbulent-Hovercraft,"Refs be like:

“Bosa is a Bad Boy. Unsportsmanlike Conduct, 15 yard Penalty, Touchdown Chargers.”",5.0,nfl,t3_10c5u87,False,0.0,:Eagles: Eagles,2023-01-14T22:13:25Z,eagles,-0.2919
20192,187171,187171,Turbulent-Hovercraft,Still angry at refs to be excited about this comeback,7.0,nfl,t3_10c5u87,False,0.0,:Eagles: Eagles,2023-01-14T22:12:03Z,eagles,-0.2263
20193,187172,187172,Turbulent-Hovercraft,"These commercial songs get more annoying and obnoxious every year 

One year it’s just gonna be a bass drum, a voice sample loop of some drunk lady screaming and some drunk guy singing “WHOPPER WHOPPER WHOPPER WHOPPPER WHOOPER”",6.0,nfl,t3_10c5u87,False,0.0,:Eagles: Eagles,2023-01-14T22:07:23Z,eagles,-0.9128
20194,187173,187173,Turbulent-Hovercraft,If they overturn this Doug’s challenge neglect Achilles Heel may prove fatal,2.0,nfl,t3_10c5u87,False,0.0,:Eagles: Eagles,2023-01-14T22:06:05Z,eagles,-0.7351
20196,187182,187182,Turbulent-Hovercraft,Chargers gonna choke and it will be glorious,8.0,jaguars,t3_10c5xd6,False,0.0,:PHI:,2023-01-14T20:48:10Z,eagles,0.1779
20197,187183,187183,Turbulent-Hovercraft,"Hey, we’re rooting for you guys. Save the sanctimony.",3.0,jaguars,t3_10c5xd6,False,0.0,:PHI:,2023-01-14T20:05:03Z,eagles,0.24695
20198,187184,187184,Turbulent-Hovercraft,It’s also fake,1.0,nfl,t3_10c1h5t,False,0.0,:Eagles: Eagles,2023-01-14T18:05:16Z,eagles,-0.4767
20199,187187,187187,Turbulent-Hovercraft,##INELIGIBLE MAN DOWNFIELD IS A FAKE PENALTY,26.0,nfl,t3_10c1h5t,False,0.0,:Eagles: Eagles,2023-01-14T17:57:31Z,eagles,-0.7269
20200,187188,187188,Turbulent-Hovercraft,Refs just shooting the corpse now,7.0,nfl,t3_10c1h5t,False,0.0,:Eagles: Eagles,2023-01-14T17:55:24Z,eagles,-0.5719
20201,187189,187189,Turbulent-Hovercraft,"Ineligible Cocksucker Downfield is the dumbest shit this year, fake penalty",1.0,nfl,t3_10c1h5t,False,0.0,:Eagles: Eagles,2023-01-14T17:47:56Z,eagles,-0.9524
20202,187190,187190,Turbulent-Hovercraft,Oh shit already the 4th? Yeah this game is over.,-1.0,nfl,t3_10c1h5t,False,0.0,:Eagles: Eagles,2023-01-14T17:44:28Z,eagles,0.0086499999999999
