,Unnamed: 0.1,Unnamed: 0,author,body,score,subreddit,link_id,over_18,controversiality,author_flair_text,created_utc,flair,sentiment
8931,75861,75861,ItsjustJim621,Poverty franchise,40.0,eagles,t3_10d0d68,False,0.0,1 + 6 + 4 = 7,2023-01-15T18:55:04Z,eagles,-0.5106
9003,78651,78651,Jackpot777,"As a Manchester United fan that hates the Glazer family with the fury of a thousand supernovas: this result pleases me. Now if only the Earth can open up and also destroy the Cowboys, I can die happy.",-1.0,nfl,t3_10dxy2f,False,1.0,:Eagles: Eagles,2023-01-16T22:29:33Z,eagles,-0.2730499999999999
9004,78652,78652,Jackpot777,I just had a cardiac arrest reading this.,1.0,nfl,t3_10dxy2f,False,0.0,:Eagles: Eagles,2023-01-16T22:26:19Z,eagles,-0.34
9005,78653,78653,Jackpot777,"Uh oh, brought to us by Burger King, someone is going to get folded in half the wrong way.",3.0,nfl,t3_10dxy2f,False,0.0,:Eagles: Eagles,2023-01-16T22:24:48Z,eagles,-0.4767
9006,78655,78655,Jackpot777,It wouldn't be football without a worrying injury on the field and an annoying Burger King ad shortly after.,2.0,nfl,t3_10dxy2f,False,0.0,:Eagles: Eagles,2023-01-16T22:21:32Z,eagles,0.17
9007,78656,78656,Jackpot777,"Welcome to Whose Touchdown Is It Anyway?, where the penalties are all made up and the points don't matter (much).",4.0,nfl,t3_10dxy2f,False,0.0,:Eagles: Eagles,2023-01-16T22:17:55Z,eagles,0.4453
9008,78657,78657,Jackpot777,"Hate to say it, but the anti-vaxxers are probably typing furiously right now.",4.0,nfl,t3_10dxy2f,False,1.0,:Eagles: Eagles,2023-01-16T22:14:28Z,eagles,-0.7351
9117,81551,81551,JediJack16,Lol,1.0,eagles,t3_10f4m2r,False,0.0,:sb52: ,2023-01-18T14:47:02Z,eagles,0.4215
9118,81554,81554,JediJack16,Agreed!,2.0,eagles,t3_10f4m2r,False,0.0,:sb52: ,2023-01-18T13:20:48Z,eagles,0.3382
9119,81558,81558,JediJack16,"This is my biggest fear for the game, if we don't gameplan well for Jones' legs, it could get ugly.",1.0,eagles,t3_10f4m2r,False,0.0,:sb52: ,2023-01-18T11:32:05Z,eagles,-0.8081
9120,81563,81563,JediJack16,"It's not an illegal play, it's not a crazy trick play that takes a long time to learn. You line up, snap the ball, and push the butt. Stop complaining  about it being too good, when you can use it yourself as well.",1.0,eagles,t3_10eqvq2,False,0.0,:sb52: ,2023-01-18T10:32:54Z,eagles,0.1080555555555555
9121,81565,81565,JediJack16,"The way Hurts performed this season, they would be insane to not give him an extension.",2.0,eagles,t3_10elvl4,False,0.0,:sb52: ,2023-01-18T10:17:52Z,eagles,-0.7003
9122,81567,81567,JediJack16,"If we play the niners in the conference championship, it is gonna be a really close game. Also me and my mom are Eagles fans, and my dad is a niners fan, so that would be VERY interesting.",1.0,eagles,t3_10eorzy,False,0.0,:sb52: ,2023-01-18T09:49:07Z,eagles,0.5225
9123,81568,81568,JediJack16,At first I didn't realize you were being sarcastic and thought Kurt Warner. I am the definition of dumb.,6.0,eagles,t3_10eorzy,False,0.0,:sb52: ,2023-01-18T09:46:01Z,eagles,-0.3178
9124,81578,81578,JediJack16,Fuck the cowgirls. That is the only thing me and my friend (who is a giants fan) can agree on when it comes to football.,1.0,eagles,t3_10drkkc,False,0.0,:sb52: ,2023-01-16T15:20:20Z,eagles,0.259725
9178,84295,84295,John_C60,Yeah I saw that. Thanks. Don’t understand the difference still,3.0,eagles,t3_10btjg9,False,0.0,:eagles: Eagles,2023-01-14T11:45:26Z,eagles,0.0598962962962963
9179,84296,84296,John_C60,Thanks. But this is the same Eagles team store site,1.0,eagles,t3_10btjg9,False,0.0,:eagles: Eagles,2023-01-14T11:15:50Z,eagles,0.1101
9741,89245,89245,KoBxElucidator,"He is Eren Yeager from Attack on Titan. Never satisfied. ""If I wipe out the entire NFL, will rent finally be paid in full?""",5.0,eagles,t3_10fm11o,False,0.0,You want Philly Philly?,2023-01-18T19:58:28Z,eagles,-0.0537888888888888
9742,89246,89246,KoBxElucidator,Nice troll account,1.0,eagles,t3_10fcwyz,False,0.0,You want Philly Philly?,2023-01-18T19:40:27Z,eagles,0.4215
9743,89250,89250,KoBxElucidator,They are the biggest fair weather fans. Where were they when the Eagles fans took over their shit stadium for the past decade?,3.0,eagles,t3_10f4m2r,False,0.0,You want Philly Philly?,2023-01-18T16:43:58Z,eagles,-0.19915
9744,89251,89251,KoBxElucidator,Nah I'll be enjoying my pizza hut stuffed crust when the Eagles win,10.0,eagles,t3_10fcwyz,False,0.0,You want Philly Philly?,2023-01-18T16:39:53Z,eagles,0.7783
9745,89252,89252,KoBxElucidator,I honestly would be surprised if he plays again this season based on what I've heard.,3.0,eagles,t3_10fiud6,False,0.0,You want Philly Philly?,2023-01-18T16:24:03Z,eagles,0.7096
9746,89253,89253,KoBxElucidator,"Lane Johnson has to be a T-800 or something. Bodily injuries don't affect him. That makes Jalen Hurts a T-1000. He can turn any part of his body into a weapon, arms and legs.",7.0,eagles,t3_10fg7ez,False,0.0,You want Philly Philly?,2023-01-18T14:44:23Z,eagles,-0.1037937499999999
9747,89254,89254,KoBxElucidator,Some CLOWN named Micah Parsons said that Jalen Hurts is a system QB,39.0,eagles,t3_10fg7ez,False,0.0,You want Philly Philly?,2023-01-18T14:43:07Z,eagles,-0.4767
9748,89255,89255,KoBxElucidator,I know. That's obvious. I was making a joke.,4.0,eagles,t3_10fcwyz,False,0.0,You want Philly Philly?,2023-01-18T14:40:42Z,eagles,0.0986666666666666
9749,89256,89256,KoBxElucidator,Gonna order myself a stuffed crust pepperoni pie when the Eagles win,8.0,eagles,t3_10fcwyz,False,0.0,You want Philly Philly?,2023-01-18T12:39:24Z,eagles,0.5859
9750,89258,89258,KoBxElucidator,Oh yeah. All day to get absolutely hammered then watch the Eagles lay the hammer down on the Giants.,5.0,eagles,t3_10fcwyz,False,0.0,You want Philly Philly?,2023-01-18T11:53:19Z,eagles,0.074
9751,89259,89259,KoBxElucidator,"Not to Giants fans. They had a nearly healthy offense that couldn't do anything against the Eagles defense. The just choose to ignore that. And they fail to recognize in the latest matchup that the Eagles were running a vanilla scheme to keep Hurts healthy and not reveal their strategy since there was a good chance they'd see each other in the playoffs. Also, look at how the Giants players celebrated after the win against the Vikings. They blew their load. That was their SB. To the Eagles, it's just another step to win this game, not the final victory.",35.0,eagles,t3_10fcwyz,False,0.0,You want Philly Philly?,2023-01-18T11:49:22Z,eagles,0.0734358726501464
9752,89261,89261,KoBxElucidator,"I swear Eagles vs Giants is becoming THE most popular upset pick (probably a lot of 49ers and Cowboys fans hoping for an ""easier"" NFCC). I hope the Giants get decked in the mouth and the Eagles don't look back. Getting 2017 vibes with everyone counting them out. Love it! Bring it on!",17.0,eagles,t3_10f4m2r,False,0.0,You want Philly Philly?,2023-01-18T10:46:58Z,eagles,0.027706976
9753,89262,89262,KoBxElucidator,"This is why sustained success is so difficult in this league. Once you've had a good season or 2, players just are going to be priced out and hit FA to get paid. Now watch him go to another team and GASH the Eagles next time he plays them. As is tradition :(",1.0,eagles,t3_10fa1xs,False,0.0,You want Philly Philly?,2023-01-18T10:36:09Z,eagles,-0.086703125
9754,89263,89263,KoBxElucidator,"Honestly starting the first quarter rusty with the week off and the Giants gain momentum by scoring early. That I can definitely see happening. However, after the bye against the Steelers they looked perfectly fine, so maybe my fear isn't warranted.",3.0,eagles,t3_10f8xie,False,0.0,You want Philly Philly?,2023-01-18T09:01:31Z,eagles,0.1953555555555556
9755,89265,89265,KoBxElucidator,Eagles have been pretty good in the redzone this season overall. The RPO strategy works really well there.,3.0,eagles,t3_10enyoc,False,0.0,You want Philly Philly?,2023-01-18T07:42:05Z,eagles,0.350925
9756,89267,89267,KoBxElucidator,"Yeah now it's ""oh you have the least number of rings in the division"". The measuring stick always moves. That's why I don't listen to them. They'll keep saying some garbage.",2.0,eagles,t3_10el43v,False,0.0,You want Philly Philly?,2023-01-18T07:37:27Z,eagles,0.00095625
9757,89268,89268,KoBxElucidator,"It hurts when it doesn't happen, yes. But I feel like it doesn't get me down for too long.",1.0,eagles,t3_10el43v,False,0.0,You want Philly Philly?,2023-01-18T07:35:28Z,eagles,0.0873749999999999
9758,89269,89269,KoBxElucidator,Sports are weird like that. Any team in the playoffs can get hot and go on a run. 2022 Phillies run though was fun as hell.,3.0,eagles,t3_10el43v,False,0.0,You want Philly Philly?,2023-01-18T07:32:19Z,eagles,-0.098574074074074
9759,89271,89271,KoBxElucidator,We live rent free in their heads so bad,3.0,eagles,t3_10evhxp,False,0.0,You want Philly Philly?,2023-01-17T21:11:18Z,eagles,-0.294
9760,89272,89272,KoBxElucidator,"Exactly. All I really want is a competitive team on the field that regularly makes the playoffs (and make some noise there every now and then). Maybe a few more rings in my lifetime would be fantastic though! What I don't want is consistent mediocrity or just an overall bad team. One or two years of it in a rebuild, fine. But consistently bad? That's honestly why I HATED the 2010s Phillies.",8.0,eagles,t3_10el43v,False,0.0,You want Philly Philly?,2023-01-17T13:50:03Z,eagles,-0.0776240588530289
9761,89273,89273,KoBxElucidator,I've just become numb to it,4.0,eagles,t3_10eiym2,False,0.0,You want Philly Philly?,2023-01-17T13:42:36Z,eagles,-0.34
9762,89274,89274,KoBxElucidator,Seeing at least one SB win in my lifetime has made me less salty over bad and mediocre seasons. This season got me back to feeling hungry for winning it all again.,79.0,eagles,t3_10el43v,False,0.0,You want Philly Philly?,2023-01-17T13:41:02Z,eagles,0.3357
9763,89278,89278,KoBxElucidator,Would be hilarious if 3 XPs is what costs the Cowboys this game,6.0,eagles,t3_10dxy0w,False,0.0,You want Philly Philly?,2023-01-16T20:42:42Z,eagles,0.4019
9764,89282,89282,KoBxElucidator,What is with our fanbase with this victim complex? Bunch of wusses. It's called you be a cocky and overconfident maniac until the Lombardi is won or you're knocked out. That's the Philly way!,18.0,eagles,t3_10dgwbm,False,0.0,You want Philly Philly?,2023-01-16T09:23:46Z,eagles,0.0003054687499999
9765,89284,89284,KoBxElucidator,BoSco gonna get a hat trick,120.0,eagles,t3_10df8wx,False,0.0,You want Philly Philly?,2023-01-16T09:16:45Z,eagles,-0.0516
9766,89285,89285,KoBxElucidator,Eagles fans got first dibs and almost an entire week to buy tickets after an amazing regular season. Should be at the minimum 80-20.,33.0,eagles,t3_10dgxtg,False,0.0,You want Philly Philly?,2023-01-16T09:15:36Z,eagles,0.146475
9767,89286,89286,KoBxElucidator,"I want that Lombardi trophy in Philly, but at the same time I would not be TOO mad if the Bengals won. My dad-in-law was a Bengals fan, and he passed away in a car accident last year. Wouldn't mind them winning it all if it's not the Eagles.",1.0,eagles,t3_10d0d68,False,0.0,You want Philly Philly?,2023-01-16T08:57:51Z,eagles,-0.1294148148148148
9768,89287,89287,KoBxElucidator,I meannnnn most Giants fans look like they're from Jersey Shore,2.0,eagles,t3_10d0d68,False,0.0,You want Philly Philly?,2023-01-16T08:55:33Z,eagles,0.3612
9769,89288,89288,KoBxElucidator,"A great Saturday of football. Doug vs Andy, then Eagles vs Giants",2.0,eagles,t3_10d501c,False,0.0,You want Philly Philly?,2023-01-16T08:52:41Z,eagles,0.156225
9770,89291,89291,KoBxElucidator,Giants>Cowboys>Bills is my favorite road to the SB,1.0,eagles,t3_10d0d68,False,0.0,You want Philly Philly?,2023-01-15T19:54:56Z,eagles,0.4588
9771,89292,89292,KoBxElucidator,"Probably the most optimal matchup after the Seahawks. If the Eagles can't beat the G-men, they weren't making it far anyway.",0.0,eagles,t3_10d0h1e,False,0.0,You want Philly Philly?,2023-01-15T19:30:02Z,eagles,0.105025
9772,89294,89294,KoBxElucidator,"On one hand, fuck the Giants I never want them to succeed. On the other, gotta stay away from the Brady black magic.",7.0,eagles,t3_10cush2,False,0.0,You want Philly Philly?,2023-01-15T18:11:55Z,eagles,0.099375
9773,89295,89295,KoBxElucidator,"The league needs to just remove the 7th seed. It's a joke, and a 7th seed has yet to not be curbstomped by the 2nd seed. It's just a free win.",3.0,eagles,t3_10cpgv1,False,0.0,You want Philly Philly?,2023-01-15T12:58:37Z,eagles,0.2983555555555555
9774,89297,89297,KoBxElucidator,"When I'm wearing birds gear around Pittsburgh, and they yell Go Birds at me, I say it back loud enough so every Yinzer around me can hear it from a 3 block radius.",1.0,eagles,t3_10cmqs4,False,0.0,You want Philly Philly?,2023-01-15T11:08:59Z,eagles,-0.4404
9775,89299,89299,KoBxElucidator,Yes please. Would love it. Doug vs his former team. Wouldn't be mad at any outcome tbh,5.0,jaguars,t3_10cb1l8,False,0.0,:PHI2:,2023-01-14T23:56:31Z,eagles,0.10921875
9776,89300,89300,KoBxElucidator,I am so glad I did. I felt this weird urge to keep watching this one. I'm so glad I did.,1.0,eagles,t3_10c5u92,False,0.0,You want Philly Philly?,2023-01-14T23:01:42Z,eagles,0.1673777777777777
9777,89301,89301,KoBxElucidator,Nah it was Big Dick Nick (but Doug is a close second coming from an Eagles fan),11.0,jaguars,t3_10cb1l8,False,0.0,:PHI2:,2023-01-14T23:00:24Z,eagles,0.1531
9778,89304,89304,KoBxElucidator,It's the witch brew that gave Nick super powers only when it's the playoffs,7.0,eagles,t3_10catha,False,0.0,You want Philly Philly?,2023-01-14T22:55:49Z,eagles,0.34
9779,89309,89309,KoBxElucidator,This justifies it that Doug P is an amazing coach. All the shit he got after 2017-18 that everyone was saying it was his coordinators. Fuck em! Doug P is a LEGEND!,11.0,eagles,t3_10c5u92,False,0.0,You want Philly Philly?,2023-01-14T22:36:38Z,eagles,-0.0429707031249999
9780,89310,89310,KoBxElucidator,Staley should be fired tonight,3.0,eagles,t3_10c5u92,False,0.0,You want Philly Philly?,2023-01-14T22:31:56Z,eagles,-0.5574
9781,89312,89312,KoBxElucidator,"Idk if the Eagles should've fired Doug. Get rid of Wentz yes, but Doug?",8.0,eagles,t3_10c5u92,False,0.0,You want Philly Philly?,2023-01-14T22:28:54Z,eagles,-0.0459
9782,89313,89313,KoBxElucidator,Why the fuck would you pass on 3rd and 1 with less than 2 minutes left?,1.0,eagles,t3_10c5u92,False,0.0,You want Philly Philly?,2023-01-14T22:25:49Z,eagles,-0.5423
9783,89315,89315,KoBxElucidator,"How dare I disrespect Douggie ""Ice Cream"" P. He's coaching a hell of a second half.",1.0,eagles,t3_10c5u92,False,0.0,You want Philly Philly?,2023-01-14T22:13:20Z,eagles,-0.8126
9784,89317,89317,KoBxElucidator,So happy for Dicker the Kicker!,3.0,eagles,t3_10c5u92,False,0.0,You want Philly Philly?,2023-01-14T21:35:03Z,eagles,0.6468
9785,89319,89319,KoBxElucidator,I want to fly down to Jacksonville and save Doug myself,4.0,eagles,t3_10c5u92,False,0.0,You want Philly Philly?,2023-01-14T20:32:36Z,eagles,0.5423
9786,89321,89321,KoBxElucidator,Lol Dallas lost to this guy xD,3.0,eagles,t3_10c5u92,False,0.0,You want Philly Philly?,2023-01-14T20:26:49Z,eagles,0.6486
9787,89322,89322,KoBxElucidator,"Wow. Trevor is seeing Casper, the Boo Brothers, Slimer, Gozer, and Nearly Headless Nick at the same fucking time.",5.0,eagles,t3_10c5u92,False,0.0,You want Philly Philly?,2023-01-14T20:22:54Z,eagles,0.146475
9788,89323,89323,KoBxElucidator,"For the record, Brady has never lost to the Cowboys",1.0,eagles,t3_10c5u92,False,0.0,You want Philly Philly?,2023-01-14T20:21:48Z,eagles,0.2411
9789,89324,89324,KoBxElucidator,It was fun for two quarters and a half. I'll give you that.,4.0,eagles,t3_10c5u92,False,0.0,You want Philly Philly?,2023-01-14T20:20:49Z,eagles,0.12765
9790,89325,89325,KoBxElucidator,Ngl kinda happy that Herbert can show us what he's got in the playoffs. Patrick Mahomes needs a true divisional rival. Don't want the Chiefs to run the AFC West table for decades like Brady did with the Pats. A shit division that stayed shit for YEARS was a big reason for the Pats dynasty.,5.0,eagles,t3_10c5u92,False,0.0,You want Philly Philly?,2023-01-14T20:18:29Z,eagles,-0.172264453125
9791,89326,89326,KoBxElucidator,"Hurts development came from sheer willpower and good fortune. He focused on what he wasn't good at, not on perfecting what he already was good at like most QBs do. Would be interesting if Fields follows a similar path.",1.0,eagles,t3_10c5u92,False,0.0,You want Philly Philly?,2023-01-14T20:15:31Z,eagles,0.1808222222222222
9792,89327,89327,KoBxElucidator,"With my Wentz comment, I am just saying don't automatically count on Doug to develop Lawrence. As soon as those coordinators from 2017-18 left, he looked pretty pedestrian. Hurts issue was he couldn't throw a ball with perfect timing and accuracy. Trevor has an entirely different set of issues. But like you said, we shall see.",1.0,eagles,t3_10c5u92,False,0.0,You want Philly Philly?,2023-01-14T20:14:37Z,eagles,0.1024750399999999
9793,89328,89328,KoBxElucidator,"I want Fields to work out. Out of all the QBs in the class, he shows the most potential imho. Would love to see his style of play vs the Eagles and Hurts more often.",1.0,eagles,t3_10c5u92,False,0.0,You want Philly Philly?,2023-01-14T20:11:05Z,eagles,0.1836259259259259
9794,89329,89329,KoBxElucidator,It wasn't Doug that made Wentz look good for a season. He was average to shit after the 2017-18 post-SB poaching.,1.0,eagles,t3_10c5u92,False,0.0,You want Philly Philly?,2023-01-14T20:09:44Z,eagles,-0.1686
9795,89330,89330,KoBxElucidator,"2021 QB draft class is looking to be PRETTY bad overall. Overhyped as hell. Trevor shows flashes but is very inconsistent, Wilson is a loser that hunts MILFs, Mac Jones is overrated as hell, and Justin Fields MAYBE is okay, but I need to see some development next season.",4.0,eagles,t3_10c5u92,False,0.0,You want Philly Philly?,2023-01-14T20:03:34Z,eagles,-0.3689296296296296
9796,89331,89331,KoBxElucidator,Very boring set of games today so far,7.0,eagles,t3_10c5u92,False,0.0,You want Philly Philly?,2023-01-14T19:58:05Z,eagles,-0.3804
9797,89332,89332,KoBxElucidator,This game has no relevance to us until the SB,1.0,eagles,t3_10c5u92,False,0.0,You want Philly Philly?,2023-01-14T19:57:03Z,eagles,-0.296
9798,89336,89336,KoBxElucidator,"I trust our offense to get some points. It's going to be on the Eagles defense to force Purdy to win with his own talent, which he isn't ready for. If the Eagles can score over 20 or so points, they can totally win. It's very doable with how lethal the offense has been all season.",1.0,eagles,t3_10bz8re,False,0.0,You want Philly Philly?,2023-01-14T18:19:39Z,eagles,-0.01104453125
9799,89337,89337,KoBxElucidator,Exactly. Buccaneers faced the Eagles last season and dominated the 7th seed. It's just showing why having a 7th seed is a joke and a free win for the 2nd seed.,7.0,eagles,t3_10bz8re,False,0.0,You want Philly Philly?,2023-01-14T18:18:15Z,eagles,0.2839666666666666
9800,89338,89338,KoBxElucidator,They have a game manager QB who all he has to do is screen passes and quick slants. Easiest job in the NFL. Key to beating them will be going up multiple scores and force him to have to win it with his own talent with deep shots.,7.0,eagles,t3_10bz8re,False,0.0,You want Philly Philly?,2023-01-14T18:11:49Z,eagles,0.2326333333333333
9801,89339,89339,KoBxElucidator,"Was a tough task for the Seahawks winning. I think upsets are more possible with the other two matchups. Still, Eagles are most likely going to have to face one or both of 49ers and Cowboys on their way to the SB. If they are truly the best team in the NFC, they will win.",1.0,eagles,t3_10bz8re,False,0.0,You want Philly Philly?,2023-01-14T18:09:30Z,eagles,0.1849765625
9802,89340,89340,KoBxElucidator,Looking like 49ers vs Eagles NFCC is near inevitable. Honestly it's a coin flip to who wins that.,1.0,eagles,t3_10bz8re,False,0.0,You want Philly Philly?,2023-01-14T17:58:00Z,eagles,0.47615
9803,89341,89341,KoBxElucidator,Eagles vs Cowboys NFC Championship would be both amazing and very stressful. Would HATE losing to them.,8.0,eagles,t3_10bz8re,False,0.0,You want Philly Philly?,2023-01-14T17:09:57Z,eagles,-0.477225
9804,89342,89342,KoBxElucidator,"Teams that can't score reliably. I trust our offense to get up a few scores on them, especially when the crowd factor isn't there.",2.0,eagles,t3_10bz8re,False,0.0,You want Philly Philly?,2023-01-14T16:27:11Z,eagles,0.1591
9805,89343,89343,KoBxElucidator,Purdy is not a franchise QB. They're just using him as a game manager and getting the ball into skill position player's hands and using an elite defense to keep the opponent from getting ahead so they don't need to rely on deep throws. Get up by a score or 2 and SF is beatable.,2.0,eagles,t3_10bz8re,False,0.0,You want Philly Philly?,2023-01-14T16:24:18Z,eagles,0.0142222222222222
9806,89345,89345,KoBxElucidator,I'd worry about Brady. He's smart enough to read what the defense is giving him when they're playing soft zone. He also handles pass rushes pretty well. He gets the ball out quick.,12.0,eagles,t3_10b01xd,False,0.0,You want Philly Philly?,2023-01-13T11:41:37Z,eagles,0.0505453124999999
9807,89346,89346,KoBxElucidator,"I'd be a bit worried though on Hurts' longevity. That would be two seasons in a row where he's hampered by a nagging injury in the playoffs. Last year it was the ankle. I'd be getting Embiid vibes (an elite player who can't make it through the playoffs without some kind of pretty serious injury). Needless to say, I think it's Gannon's scheme that will be the biggest problem. We have yet to see it against anyone above a Kirk Cousins/Dak level QB and worked effectively.",0.0,eagles,t3_10b01xd,False,1.0,You want Philly Philly?,2023-01-13T11:38:48Z,eagles,0.0619054269547325
9808,89347,89347,KoBxElucidator,"So many idiots on facebook are failing to tell the difference between this and the Player Voted All-Pro xD also, Bradberry definitely earned it over Slay, especially in the latter half of the season. Slay has fallen a bit off a cliff.",1.0,eagles,t3_10azko3,False,0.0,You want Philly Philly?,2023-01-13T11:33:57Z,eagles,-0.057125
9809,89348,89348,KoBxElucidator,"The man is gonna be a royal pain in the ass next time the Eagles play the Jets. As soon as the Jets fix their stupid QB situation, they are a WC playoff team imo",29.0,eagles,t3_10azko3,False,0.0,You want Philly Philly?,2023-01-13T11:26:43Z,eagles,-0.4282749999999999
9810,89349,89349,KoBxElucidator,"I can name a few players better than Reddick. Not a knock against him at all, it's just a deep talent pool.",4.0,eagles,t3_10azko3,False,0.0,You want Philly Philly?,2023-01-13T11:26:03Z,eagles,0.3208499999999999
9811,89350,89350,KoBxElucidator,Kelce to the HOF on first year of eligibility. Also fuck Steichen for getting Hurts injured.,-4.0,eagles,t3_10azko3,False,0.0,You want Philly Philly?,2023-01-13T11:12:07Z,eagles,-0.42595
9812,89351,89351,KoBxElucidator,I mean it's weird how open Nick and Hurts have been about this injury for the past week when they they were tight lipped for weeks. I have a sneaking suspicion that it's all a ploy to lull the divisional opponent into a false sense of security.,11.0,eagles,t3_10az2me,False,0.0,You want Philly Philly?,2023-01-13T10:56:48Z,eagles,-0.2241749999999999
9813,89352,89352,KoBxElucidator,His Long Johnson is only inferior to that of Big Dick Nick's,2.0,eagles,t3_10az2lk,False,0.0,You want Philly Philly?,2023-01-13T10:55:08Z,eagles,-0.7184
9814,89354,89354,KoBxElucidator,I trust this team to get it done,9.0,eagles,t3_10az2me,False,0.0,You want Philly Philly?,2023-01-13T10:54:03Z,eagles,0.5106
9815,89355,89355,KoBxElucidator,Nah I'm okay with it. Some relatively stress-free football for a week.,3.0,eagles,t3_10aamm9,False,0.0,You want Philly Philly?,2023-01-13T10:28:03Z,eagles,0.032
9816,89356,89356,KoBxElucidator,"I can see it, especially with the season he had. I don't think the Eagles have the cap room to keep more than 1 or 2 of their big FAs. I can see Howie trading or picking up a DT in the draft (especially if Cox is also gone), and Davis gets more playing time.",3.0,eagles,t3_10a7dh3,False,0.0,You want Philly Philly?,2023-01-13T10:24:35Z,eagles,0.0905333333333333
9817,89357,89357,KoBxElucidator,"4th quarter against the Cowboys, it's after the 2 minute warning, up by less than a TD. Cowboys are nearing the endzone. 3rd and 4. Hargrave absolutely demolishes Dak for a sack fumble, recovers it, and somehow runs the 60 yards for a BIG MAN TD. I would be ugly crying.",3.0,eagles,t3_10ae3i2,False,0.0,You want Philly Philly?,2023-01-13T10:21:17Z,eagles,-0.1502288
9818,89359,89359,KoBxElucidator,"It's more that they have this culture of the ""Steelers Way"" that time and again since the Ben Roethlisberger fiasco has been shown to be a load of shit. That and some pretty bad drafting, holding onto Ben when he was a dying corpse for quite a while, and a refusal to fix their O-line. They're stuck in purgatory atm (I live in Pittsburgh so I listen to their sports talk radio often. I know allllll their problems). I am a Kenny Pickett fan though since I like Pitt football, so I really hope he works out.",3.0,eagles,t3_10ae3i2,False,0.0,You want Philly Philly?,2023-01-13T10:14:53Z,eagles,0.14171312
9819,89360,89360,KoBxElucidator,I meant what I said ;D,4.0,eagles,t3_10ae33k,False,0.0,You want Philly Philly?,2023-01-13T08:17:02Z,eagles,0.368
9978,90705,90705,Kryptyx,Bro he's as down like Brady's completion % this game.,6.0,nfl,t3_10dy20q,False,0.0,:Eagles: Eagles,2023-01-16T21:13:48Z,eagles,0.3612
9979,90706,90706,Kryptyx,I usually don't like the guests but having an ex-player really makes it better because they are still engaged in the game. Deion has been a great guest so far.,7.0,nfl,t3_10dy20q,False,0.0,:Eagles: Eagles,2023-01-16T19:47:55Z,eagles,0.5135000000000001
9980,90709,90709,Kryptyx,I called to see if you're alive but username checks out.,1.0,nfl,t3_10cusg7,False,0.0,:Eagles: Eagles,2023-01-15T19:01:21Z,eagles,0.2023
