,Unnamed: 0.1,Unnamed: 0,author,body,score,subreddit,link_id,over_18,controversiality,author_flair_text,created_utc,flair,sentiment
17675,149792,149792,PioneerDinosaur,I got a ridiculously soft spot for QBs from Hawaii,1.0,nfl,t3_xtnmex,False,0.0,:Dolphins: Dolphins,2022-10-02T12:21:59Z,miamidolphins,-0.34
17676,149793,149793,PioneerDinosaur,Mariota is so funny,2.0,nfl,t3_xtnmex,False,0.0,:Dolphins: Dolphins,2022-10-02T12:20:39Z,miamidolphins,0.5777
17678,149795,149795,PioneerDinosaur,Finally some good fuckin news. Hopefully nothing like this ever happens again,16.0,nfl,t3_xt9geo,False,0.0,:Dolphins: Dolphins,2022-10-01T18:42:00Z,miamidolphins,0.1854
17679,149798,149798,PioneerDinosaur,The NFLPA fired the guy the NFLPA hired. How fast can we make this about the Dolphins,-5.0,nfl,t3_xt1uz4,False,0.0,:Dolphins: Dolphins,2022-10-01T13:23:01Z,miamidolphins,-0.13935
17680,149799,149799,PioneerDinosaur,"Oh I’m sorry an hour or so later I just realized you were talking about the hit that multiple doctors said Tua had no head injury on, I was confused I thought we were talking about the concussion. Tua probably won’t play football for 24 days after this concussion tho don’t worry, john Harbaugh did play Lamar in the same game he was pulled for a potential concussion as well so keep going off",-25.0,nfl,t3_xs8su7,False,0.0,:Dolphins: Dolphins,2022-09-30T15:52:33Z,miamidolphins,0.1407999999999999
17681,149800,149800,PioneerDinosaur,No I don’t think I’ll just let a coach pretend he’s never seen that before when he’s literally done it himself,-37.0,nfl,t3_xs8su7,False,0.0,:Dolphins: Dolphins,2022-09-30T15:04:58Z,miamidolphins,-0.3818
17682,149801,149801,PioneerDinosaur,Agreed,12.0,nfl,t3_xs8su7,False,0.0,:Dolphins: Dolphins,2022-09-30T14:11:43Z,miamidolphins,0.2732
17683,149802,149802,PioneerDinosaur,Ok John but who started Joe Flacco immediately after Kiko Alonso made him do the check please pose?,15.0,nfl,t3_xs8su7,False,1.0,:Dolphins: Dolphins,2022-09-30T13:56:55Z,miamidolphins,0.5499
17684,149803,149803,PioneerDinosaur,Oh so we’re just completely making shit up now,1.0,nfl,t3_xrq1lh,False,0.0,:Dolphins: Dolphins,2022-09-30T05:49:08Z,miamidolphins,-0.5965
18860,154200,154200,ProtectTheHell,Definitely not with Omar. Dude knows nothing about qb play.,4.0,miamidolphins,t3_xut86z,False,0.0,.,2022-10-03T18:24:23Z,miamidolphins,-0.028725
18861,154204,154204,ProtectTheHell,Let's investigate the NFLPA for failing to protect the players from the NFL.,8.0,miamidolphins,t3_xs2z2n,False,0.0,.,2022-09-30T09:42:13Z,miamidolphins,-0.1779
19364,159606,159606,Roctopuss,he dead,2.0,nfl,t3_xuqcry,False,0.0,:Dolphins: Dolphins :Chiefs: Chiefs,2022-10-04T13:35:35Z,miamidolphins,-0.6486
19365,159607,159607,Roctopuss,Bro has got a healthy B cup there,4.0,nfl,t3_xu4k9g,False,0.0,:Dolphins: Dolphins :Chiefs: Chiefs,2022-10-03T00:04:58Z,miamidolphins,0.4019
19366,159612,159612,Roctopuss,"A) obviously, but it was a bit weird that even the announcers didn't mention it

B) I'm fully aware, it's not my tweet, and it's kinda missing the point

C) Man, if you can't see that ball bounce off the turf and back into his hands idk what to say?

&#x200B;

Are you seriously equating lunatics complaining to OSHA about the sun to a potentially blown turnover call in the 4th quarter?",-2.0,miamidolphins,t3_xsbvem,False,1.0,AKIMBO WADDLES,2022-09-30T15:52:18Z,miamidolphins,-0.465875
19367,159614,159614,Roctopuss,"""NFL Chief Medical Officer Dr. Allen Sills says Tua Tagovailoa was checked for concussion symptoms every day since Sunday. Points out independent neuro expert had to clear him. Once review is done, full results will be released publicly.""",-5.0,nfl,t3_xsa829,False,1.0,:Dolphins: Dolphins :Chiefs: Chiefs,2022-09-30T14:56:27Z,miamidolphins,0.0424222222222222
19368,159615,159615,Roctopuss,""" NFL Chief Medical Officer Dr. Allen Sills says Tua Tagovailoa was checked for concussion symptoms every day since Sunday. Points out independent neuro expert had to clear him. Once review is done, full results will be released publicly.""",0.0,nfl,t3_xsa829,False,1.0,:Dolphins: Dolphins :Chiefs: Chiefs,2022-09-30T14:56:00Z,miamidolphins,0.0424222222222222
19369,159616,159616,Roctopuss,"Why does no one seem to understand that Tua being cleared to play last week and this week is completely out of ""Miami's"" hands. It's the job of an independent, third party neurologist to clear a player to play. If it's the professional opinion of said neurologist that the player is okay and has not suffered a concussion, what team is going to hold that player out? Has that ever even happened?

If anything has failed Tua, it's either the NFL's protocol, or the neurologist who treated Tua. But I guess don't let that stop you from dunking on Miami, by all means.",-22.0,nfl,t3_xsa829,False,0.0,:Dolphins: Dolphins :Chiefs: Chiefs,2022-09-30T14:41:09Z,miamidolphins,0.0405409486454046
19370,159617,159617,Roctopuss,"She's actually fine! contrary to all the twitter docs diagnoses, she diddn't have a stroke, just a complicated migraine.

Seems like there's a lesson to be learned here, I can't quite put my finger on it...",10.0,nfl,t3_xs4tug,False,0.0,:Dolphins: Dolphins :Chiefs: Chiefs,2022-09-30T14:24:40Z,miamidolphins,0.1304518518518518
20977,166611,166611,SkyzYn,Flipside: Imagine how good we'll be when we're not giving up 107 QBR & 50% Conversion Rate.,5.0,nfl,t3_xw0uc3,False,0.0,:Dolphins: Dolphins ,2022-10-05T10:51:35Z,miamidolphins,0.2177
20979,166615,166615,SkyzYn,"Yep, that's the end result - coaching players to stay on the ground after any heavy hit.",15.0,nfl,t3_xt9geo,False,0.0,:Dolphins: Dolphins ,2022-10-01T21:55:52Z,miamidolphins,0.296
20980,166616,166616,SkyzYn,"Even aside for the innocuous 'Player trips over his feet' situations, there's soooo many times where a player is very slow to get up but isn't considered for concussion.  That's certainly a form of instability, right?",58.0,nfl,t3_xt9geo,False,0.0,:Dolphins: Dolphins ,2022-10-01T19:15:21Z,miamidolphins,0.17
20981,166617,166617,SkyzYn,"Yup, no snaps.  Tanner Conner (another UDFA) gets 2nd place behind Kader with 4 offensive snaps.

* Tindall increasing reps on special teams, 0 defensive snaps. 
* Ezukanma has been on inactive list.
* Cameron Goode is on practice squad.
* Skylar Thompson has been inactive until Bengals game.",6.0,nfl,t3_xt03m1,False,0.0,:Dolphins: Dolphins ,2022-10-01T14:45:39Z,miamidolphins,0.000259885116598
20982,166618,166618,SkyzYn,"> by all accounts he passed protocol tests throughout the week from both this doctor and team doctors

My understanding is that if there is suspicion a player suffered a concussion (it's not an absolute science), they'll monitor and run the tests throughout the week regardless as best practices.  I'm not sure if he was technically in protocol or not, the wording was ambiguous in the tweet.",5.0,nfl,t3_xt1t9e,False,0.0,:Dolphins: Dolphins ,2022-10-01T14:37:26Z,miamidolphins,-0.158825
20983,166619,166619,SkyzYn,"Nope, same 'Return-to-Participation Protocol' regardless of if a concussion is suspected or confirmed.

'Confirmed' being less than scientific here, as it's not something verifiable since it's based on symptoms unless there's something like internal bleeding.  The lack of hard science is likely also why these things are treated equally throughout the week.",14.0,nfl,t3_xt1t9e,False,0.0,:Dolphins: Dolphins ,2022-10-01T14:26:21Z,miamidolphins,-0.1022148148148148
20984,166620,166620,SkyzYn,"Yes - I'm noting that the policy as written entirely incentivizes players to just remain on the ground motionless.  There's players taking far worse concussions than Tua did against the Bills on a weekly basis, which don't even get tested in the tent.

It's out-of-sight, out-of-mind for the league.  If they really took it seriously, anyone who loses mobility would be pulled for the game and taken to protocol for the week.  My note is that the concern is ***not*** player safety.  This is just saving face because it was more visible.",0.0,nfl,t3_xt2c2s,False,0.0,:Dolphins: Dolphins ,2022-10-01T13:59:23Z,miamidolphins,-0.0114221343449931
20985,166621,166621,SkyzYn,"Most likely case is that NFLPA believes shaking his head like that should have been seen as neurological regardless of if the stumble was blamed on the back issue.

That would have removed him for the rest of the Bills game, but by all accounts he passed protocol tests throughout the week from both this doctor and team doctors.",24.0,nfl,t3_xt1t9e,False,0.0,:Dolphins: Dolphins ,2022-10-01T13:54:02Z,miamidolphins,-0.07955
20986,166622,166622,SkyzYn,"Players are laid out on the turf for 10+ seconds a dozen times a game.  That sort of a policy would kill the league from a reputation standpoint, and fans would be outraged as soon as a star player goes down late in the season.",-3.0,nfl,t3_xt2c2s,False,1.0,:Dolphins: Dolphins ,2022-10-01T13:50:00Z,miamidolphins,-0.42405
22622,171641,171641,SportsBall89,No,1.0,nfl,t3_xwgbp0,False,0.0,:Dolphins: Dolphins :Lions: Lions,2022-10-05T17:43:03Z,miamidolphins,-0.296
22623,171649,171649,SportsBall89,He’s also a piece of shit who is using this as an excuse to put his name out there,1.0,nfl,t3_xrz1ig,False,0.0,:Dolphins: Dolphins :Lions: Lions,2022-09-30T23:58:31Z,miamidolphins,-0.5106
22624,171650,171650,SportsBall89,He’s not cursed. He just has a hero complex. Throw the fucking ball away,1.0,miamidolphins,t3_xrrs3p,False,0.0,3️⃣4️⃣ Run Ricky Run,2022-09-30T23:57:40Z,miamidolphins,0.0619333333333333
22625,171651,171651,SportsBall89,But but… it’s so clear to them that it HAS to be connected.. I mean.. they once knew a person who seen something similar.. /s,5.0,miamidolphins,t3_xs7bj1,False,0.0,3️⃣4️⃣ Run Ricky Run,2022-09-30T18:13:37Z,miamidolphins,0.1689
22626,171652,171652,SportsBall89,I think he does get that luckily Tua can move the rest of his body. Jesus Christ you are all so fucked,9.0,nfl,t3_xs3gr6,False,0.0,:Dolphins: Dolphins :Lions: Lions,2022-09-30T15:58:56Z,miamidolphins,-0.2553999999999999
22627,171653,171653,SportsBall89,Sorry. I didn’t realize you were the worlds greatest neurologist and can make diagnoses just by looking ab someone on a tv,3.0,miamidolphins,t3_xrr0dp,False,0.0,3️⃣4️⃣ Run Ricky Run,2022-09-30T00:55:39Z,miamidolphins,0.29915
23991,177090,177090,TheDollaLama,Twitter just looks for any reason to be toxic. It's the same community that was making memes of Tua just minutes after his injury. They look for low hanging fruit in order to be relevant.,13.0,miamidolphins,t3_xsaaae,False,0.0,🐆🐧🐬,2022-09-30T14:51:45Z,miamidolphins,-0.1379
23992,177091,177091,TheDollaLama,"If we had to activate a 3rd QB as a precaution, then yeah perhaps we shouldn't have put Tua out there in the first place.",1.0,miamidolphins,t3_xs8hqc,False,1.0,🐆🐧🐬,2022-09-30T13:39:26Z,miamidolphins,0.296
26162,188170,188170,Victorbanner,Happy for Terry,1.0,nfl,t3_xttat6,False,0.0,:Dolphins: Dolphins,2022-10-02T15:01:50Z,miamidolphins,0.5719
27228,198592,198592,_LouSandwich_,Thats all well and good. Until Tom fucking Brady is affected. Then it will be draconian.,89.0,nfl,t3_xs86sf,False,0.0,:Dolphins: Dolphins,2022-09-30T17:12:23Z,miamidolphins,-0.0015074074074074
27320,202492,202492,ahappylittlecloud,This Lamar Jackson guy is pretty good. Someone should probably sign him to a long term contract.,9.0,nfl,t3_xtt2g7,False,0.0,:Dolphins: Dolphins,2022-10-02T12:27:35Z,miamidolphins,0.181725
28083,205875,205875,antent,He's always been like that,-1.0,nfl,t3_xtt2g7,False,0.0,:Dolphins: Dolphins,2022-10-02T15:00:21Z,miamidolphins,0.3612
28084,205876,205876,antent,scumbag,1.0,nfl,t3_xtt2g7,False,0.0,:Dolphins: Dolphins,2022-10-02T14:53:20Z,miamidolphins,-0.6369
28085,205877,205877,antent,Why you gotta curse Pickett like that 😞,1.0,nfl,t3_xtnmex,False,0.0,:Dolphins: Dolphins,2022-10-02T13:59:16Z,miamidolphins,-0.6249
28086,205879,205879,antent,"Even if they lose, the fact they just put up 21 unanswered to take the lead kind of shows they're not frauds.",2.0,nfl,t3_xtnmex,False,0.0,:Dolphins: Dolphins,2022-10-02T13:26:03Z,miamidolphins,0.0005
28087,205880,205880,antent,Where's all the *Eagles fraud* commenters now?,4.0,nfl,t3_xtnmex,False,0.0,:Dolphins: Dolphins,2022-10-02T13:23:00Z,miamidolphins,-0.5859
28088,205882,205882,antent,He gets it done but he's so uncomfortable to watch when he runs and idk why exactly,2.0,nfl,t3_xtnmex,False,0.0,:Dolphins: Dolphins,2022-10-02T13:05:05Z,miamidolphins,-0.731
28089,205883,205883,antent,Yes. I'm sure the Bills have never done that. Ever. Y'all cannot take a joke. Maybe treat yourself to a nice bowl of ice cream and try to smile.,-4.0,nfl,t3_xtt2g7,False,0.0,:Dolphins: Dolphins,2022-10-02T12:54:14Z,miamidolphins,0.1498177279999999
28090,205884,205884,antent,The Bills have at least 11 jokes whenever they have players on the field.,-3.0,nfl,t3_xtt2g7,False,1.0,:Dolphins: Dolphins,2022-10-02T12:50:53Z,miamidolphins,0.25
28091,205885,205885,antent,You have no idea lol,-5.0,nfl,t3_xtt2g7,False,0.0,:Dolphins: Dolphins,2022-10-02T12:48:09Z,miamidolphins,-0.5472
28092,205886,205886,antent,It's just an obvious joke to make. Low hanging fruit. It's not that serious.,-4.0,nfl,t3_xtt2g7,False,1.0,:Dolphins: Dolphins,2022-10-02T12:45:30Z,miamidolphins,-0.0003259259259259
28093,205887,205887,antent,I appreciate you not taking it too seriously. Good teams have bad games. It's just fun to poke a little after some Bills fans have gotten way too cocky about their success.,1.0,nfl,t3_xtt2g7,False,0.0,:Dolphins: Dolphins,2022-10-02T12:44:06Z,miamidolphins,0.2448814814814814
28094,205888,205888,antent,Yeah. You?,0.0,nfl,t3_xtt2g7,False,0.0,:Dolphins: Dolphins,2022-10-02T12:42:52Z,miamidolphins,0.074
28095,205889,205889,antent,So the Bills can't play in the sun or rain. Bills fans screaming for winter hoping the snow is their one true savior.,-4.0,nfl,t3_xtt2g7,False,1.0,:Dolphins: Dolphins,2022-10-02T12:40:24Z,miamidolphins,0.1648
28096,205890,205890,antent,This is the most original joke I've ever seen. Biased because I'm a SQL dev,2.0,nfl,t3_xtt2g7,False,0.0,:Dolphins: Dolphins,2022-10-02T12:08:27Z,miamidolphins,0.0187499999999999
28097,205896,205896,antent,"Does Harbaugh or any of the other people criticizing Miami have any comment on [this hit Gage took](https://www.youtube.com/watch?v=V6ioz5DRzNg&t=565s) and the fact he's only on the injury report with a ""hamstring""? Did he go through concussion protocol? Is anyone making a big deal bout this one?",-10.0,nfl,t3_xsm6tf,False,0.0,:Dolphins: Dolphins,2022-10-01T00:23:07Z,miamidolphins,-0.025437037037037
28296,206334,206334,anthonyterms,"> Tyreek has to pull up on every deep ball thrown his way

There's like, 3 QBs in the world that won't make Tyreek slow up on deep throws though.",-2.0,nfl,t3_xutb4e,False,0.0,:Dolphins: Dolphins,2022-10-03T15:25:08Z,miamidolphins,0.3612
28297,206335,206335,anthonyterms,"Regardless of performance, he’s been the best. I don’t think any of our picks have even gotten any snaps outside of preseason lol. Maybe Tindall? The rest haven’t played afaik.",12.0,nfl,t3_xt03m1,False,0.0,:Dolphins: Dolphins,2022-10-01T13:09:15Z,miamidolphins,0.094073828125
28298,206336,206336,anthonyterms,"My bad for getting annoyed about someone bringing up something completely irrelevant after watching someone get seriously hurt. Also, never once supported Tyreek aside from doing the heinous act of cheering for my football team. You can go through every team and find at least one guy from the past 5 years who has done some awful shit, be it player or staff. I'm sure as a Pats fan you're well aware of this.",3.0,nfl,t3_xrrkp3,False,0.0,:Dolphins: Dolphins,2022-09-30T12:21:16Z,miamidolphins,0.1265488281249999
28299,206337,206337,anthonyterms,"People would crack massage jokes if someone on the Browns got seriously hurt, even if it wasn't Watson. Most people are just irony poisoned and detached from reality on this website.",5.0,nfl,t3_xrrkp3,False,0.0,:Dolphins: Dolphins,2022-09-30T01:07:29Z,miamidolphins,-0.418875
28543,210126,210126,baggio1000000,"In Canada, we have a streaming service called DAZN. They eventually take commercials out, and just have the game. I couldn't wait for that though. 

I really was worried all day about spoilers, so I still prefer live, even with tedious commercials.",2.0,nfl,t3_xwbqhy,False,0.0,:Dolphins: Dolphins,2022-10-05T14:28:55Z,miamidolphins,-0.08915
28544,210129,210129,baggio1000000,"I missed the last 2 live dolphins games due to work. But watching later on demand and fast forwarding commercials was fantastic! 
Just gotta watch out for spoilers.",7.0,nfl,t3_xwbqhy,False,0.0,:Dolphins: Dolphins,2022-10-05T13:45:08Z,miamidolphins,0.0628481481481481
28805,212629,212629,bartscrc,Yup both are great institutions! Ohio cities are one of the best places to be if you need medical care. I am thrilled to be fortunate enough to live and work here so bias will always be inherent ;),1.0,nfl,t3_xrp2wc,False,0.0,:Dolphins: Dolphins,2022-09-30T12:23:53Z,miamidolphins,0.3491888888888889
29455,217513,217513,brainstorm0694,I think the guys point is Higgins literally had a concussion and played and people aren’t upset he played but Tua “looked like” he had a concussion despite test saying otherwise and people are upset he played,1.0,nfl,t3_xs86sf,False,0.0,:Dolphins: Dolphins,2022-09-30T16:23:25Z,miamidolphins,0.0772
29456,217514,217514,brainstorm0694,Flacco concussion was far worse as Tua passed all concussion tests while Flacco obviously couldn’t,-16.0,nfl,t3_xs8su7,False,0.0,:Dolphins: Dolphins,2022-09-30T16:16:14Z,miamidolphins,-0.4767
30980,226528,226528,cooljazz,Dolphins fan here - I think the old miami uniforms and logo are so much better than their current space-age dolphin logo and softer aqua color. Give me the old logo with the Dolphin wearing a helmet in a sunburst!,3.0,nfl,t3_xvrjm0,False,0.0,:Dolphins: Dolphins,2022-10-05T08:15:44Z,miamidolphins,0.16705
30981,226529,226529,cooljazz,I don't know what it is (nostalgia?) but I think the old uniforms for many teams look so much better than their modern counterparts.,1.0,nfl,t3_xvrjm0,False,0.0,:Dolphins: Dolphins,2022-10-05T08:13:05Z,miamidolphins,0.3224
30982,226530,226530,cooljazz,"Thanks for this post. I think people see the stumbling and immediately assume concussion, yet ignore the fact he exhibited no other symptoms for concussion for days after. I feel like even if they did sit Tua this past week  and he gets sacked like that in the jets game in October, he'd probably respond exactly the same way, and we'd be seeing this same response from /nfl",1.0,nfl,t3_xse3i2,False,0.0,:Dolphins: Dolphins,2022-10-01T07:34:14Z,miamidolphins,0.1569
30983,226531,226531,cooljazz,Agree 100% with everything you said.,-1.0,nfl,t3_xs9gl3,False,0.0,:Dolphins: Dolphins,2022-09-30T20:16:34Z,miamidolphins,0.3612
30984,226532,226532,cooljazz,"While it's true that concussions seems to get worse as they accumulate, that was a pretty nasty rag doll into the ground. That could certainly have caused the same fencing response because of how much force was used.",2.0,nfl,t3_xs86sf,False,0.0,:Dolphins: Dolphins,2022-09-30T19:59:07Z,miamidolphins,0.125525
30985,226533,226533,cooljazz,Wouldn't releasing medical records violate some HIPAA rule?,1.0,nfl,t3_xs86sf,False,0.0,:Dolphins: Dolphins,2022-09-30T19:57:43Z,miamidolphins,-0.4939
30986,226534,226534,cooljazz,Agree 100%.,1.0,nfl,t3_xs86sf,False,0.0,:Dolphins: Dolphins,2022-09-30T19:56:35Z,miamidolphins,0.3612
31602,230515,230515,dcpains,"I’m much less worried about a miscommunication pick on a short week where he didn’t practice, got thrown into the game mid-way, and the Tua situation happened, then I would be from a miss-throw",2.0,nfl,t3_xvel37,False,0.0,:Dolphins: Dolphins,2022-10-04T15:55:58Z,miamidolphins,-0.228
31603,230519,230519,dcpains,"Yeah people are seeing scapegoat solely from the side of coverup, he could also be a scapegoat so that the NFLPA can look tough on the issue",59.0,nfl,t3_xt4qi6,False,0.0,:Dolphins: Dolphins,2022-10-01T15:38:22Z,miamidolphins,-0.5719
31604,230520,230520,dcpains,"So head coach is also head medical expert now? And you didn’t answer my question. If McDaniel said no I don’t trust the doctors, held him out, and then 5 weeks later the same thing happened, is he to blame?",8.0,nfl,t3_xt1uz4,False,0.0,:Dolphins: Dolphins,2022-10-01T15:36:29Z,miamidolphins,-0.0257333333333333
31605,230522,230522,dcpains,"Mcdaniel made a good point, and that’s if he can’t trust the doctors or Tua, then when does he put him back in? Concussions aren’t linear. You don’t give it a week and it’ll definitely be fine. If Tua got a second one 5 weeks from now, is that also Mcdaniel’s fault?",14.0,nfl,t3_xt1uz4,False,0.0,:Dolphins: Dolphins,2022-10-01T14:45:47Z,miamidolphins,-0.063709765625
31606,230523,230523,dcpains,"I didn’t even clock that, that’s my bad",3.0,nfl,t3_xsm6tf,False,0.0,:Dolphins: Dolphins,2022-10-01T02:17:50Z,miamidolphins,-0.5423
31607,230525,230525,dcpains,So trust the assessment whether they say it is or isn’t a concussion?,0.0,nfl,t3_xsm6tf,False,1.0,:Dolphins: Dolphins,2022-10-01T00:53:29Z,miamidolphins,0.5563
31608,230526,230526,dcpains,"Lamar also left a game last season for concussion protocol then later re-entered the game and played the next game

Edit: rookie season not last season",51.0,nfl,t3_xsm6tf,False,0.0,:Dolphins: Dolphins,2022-10-01T00:31:20Z,miamidolphins,0.34
31609,230527,230527,dcpains,I imagine a lot of it is where you come from tbf. Wouldn’t be surprised if the UK focuses a lot more on proper brexit-ball style stuff from a younger age.,1.0,nfl,t3_xsa829,False,0.0,:Dolphins: Dolphins,2022-09-30T21:08:41Z,miamidolphins,0.11315
31610,230528,230528,dcpains,He wasn’t in the concussion protocol because he didn’t fail any of the tests.,36.0,nfl,t3_xsf2cf,False,0.0,:Dolphins: Dolphins,2022-09-30T18:42:09Z,miamidolphins,-0.5423
31611,230529,230529,dcpains,There is no degree that gives weight to filing murder charges over a diagnosis you made over a 7 second clip,84.0,nfl,t3_xse3i2,False,0.0,:Dolphins: Dolphins,2022-09-30T17:38:43Z,miamidolphins,-0.8402
31612,230530,230530,dcpains,That thread about the chargers guard getting a seizure while flying was straight up creepy. Felt like people where hoping it would happen so they could say told you so,120.0,nfl,t3_xsdcuh,False,0.0,:Dolphins: Dolphins,2022-09-30T16:57:58Z,miamidolphins,0.3808749999999999
31613,230531,230531,dcpains,"Unless the kid is playing at a very high level, they’re not going to be heading the ball until they’re at least 13 or 14, at which point they can make decisions for themselves and actively avoid heading the ball. I played till 18 and still play Sunday league and I’ve never had a header",0.0,nfl,t3_xsa829,False,1.0,:Dolphins: Dolphins,2022-09-30T16:43:08Z,miamidolphins,0.349525
31614,230532,230532,dcpains,Idk what’s crazy about that statement lol. A guy working hard on his physical therapy and getting into playing shape will come back from an injury faster then a guy who doesn’t,7.0,nfl,t3_xs8hsc,False,0.0,:Dolphins: Dolphins,2022-09-30T16:33:20Z,miamidolphins,-0.17
31615,230533,230533,dcpains,The post with 12k upvotes calling for us to lose all our draft picks is from a Bills fan site writer. I’m sure the “concern” is totally legitimate,4.0,nfl,t3_xs8su7,False,0.0,:Dolphins: Dolphins,2022-09-30T16:31:51Z,miamidolphins,0.133425
31616,230535,230535,dcpains,"Thanks for your diagnoses doc, I’ll be sure to pass it along to Tua, the coaching staff, the medical staff, the independent neurologist, and the university of Cincinnati hospital",9.0,nfl,t3_xrt6fd,False,1.0,:Dolphins: Dolphins,2022-09-30T07:44:44Z,miamidolphins,0.6369
31617,230536,230536,dcpains,He literally got suplexed onto his head and neck by a 340 pound nose tackle. I don’t know why people are acting like that wouldn’t be a concussion for every player in the league,2.0,nfl,t3_xrrfxs,False,0.0,:Dolphins: Dolphins,2022-09-30T07:42:35Z,miamidolphins,0.1806
31819,232932,232932,dedodelobo,The man became a doctor last week like everyone else on. Here. No position except KnOwLeDgE,1.0,nfl,t3_xrmkyk,False,1.0,:Dolphins: Dolphins,2022-09-30T01:01:13Z,miamidolphins,-0.0852888888888888
31853,234483,234483,dolfanchris,"Tuck your chin, throw arms out wide, slap thigh when super kicking ball down the field to Waddle and Hill, get better on mic",8.0,miamidolphins,t3_xv2dng,False,0.0,VERIFIED ,2022-10-04T05:47:18Z,miamidolphins,0.8126
31854,234484,234484,dolfanchris,It’s illegal in rugby as well.,1.0,miamidolphins,t3_xs4y9h,False,0.0,VERIFIED ,2022-10-01T09:11:17Z,miamidolphins,-0.3612
32410,238168,238168,dudeman93,"So my iphone, my smart watch, my OnStar, my myChevy app, and my insurance app can all detect if I've been in a crash and alert emergency response. 

Big brother is watching.",2.0,nfl,t3_xuz9pb,False,0.0,:Dolphins: Dolphins,2022-10-03T21:36:54Z,miamidolphins,-0.025675
32411,238169,238169,dudeman93,Can we just skip to the kissing?,1.0,nfl,t3_xuz9pb,False,0.0,:Dolphins: Dolphins,2022-10-03T21:32:38Z,miamidolphins,0.5719
32412,238170,238170,dudeman93,"Idk if I answer the question and give them the publicity they so badly crave...

It's an animal rights group, fwiw.",1.0,nfl,t3_xuz9pb,False,0.0,:Dolphins: Dolphins,2022-10-03T21:29:05Z,miamidolphins,-0.1647
32413,238171,238171,dudeman93,Promise?,3.0,nfl,t3_xuz9pb,False,0.0,:Dolphins: Dolphins,2022-10-03T21:27:37Z,miamidolphins,0.3182
32414,238175,238175,dudeman93,"Tua was ""clearly ready to play"" as he played the entire second half and helped to win the game.",2.0,nfl,t3_xuq23t,False,0.0,:Dolphins: Dolphins,2022-10-03T20:53:10Z,miamidolphins,0.9153
32415,238177,238177,dudeman93,"TIL no one on Twitter knows what a ""streaker"" is smh...",19.0,nfl,t3_xuz9pb,False,0.0,:Dolphins: Dolphins,2022-10-03T20:35:03Z,miamidolphins,-0.5423
