,Unnamed: 0.1,Unnamed: 0,author,body,score,subreddit,link_id,over_18,controversiality,author_flair_text,created_utc,flair,sentiment
160,1755,1755,03Jinx03,I’m still very disappointed his name is pronounced Zappy and not Zap. Zap is a 100 times cooler imo.,178.0,nfl,t3_xvjewe,False,0.0,:Dolphins: Dolphins,2022-10-04T12:11:17Z,miamidolphins,-0.1314
1081,6482,6482,AK-11,"Nobody will ever be better at running 8 yards, turning and catching the ball, and falling forward for two more.",55.0,nfl,t3_xwhyaf,False,0.0,:Dolphins: Dolphins,2022-10-05T15:51:09Z,miamidolphins,0.3182
1082,6483,6483,AK-11,I was joking before but damn maybe Flores does have his fingerprints all over this teams handling of the rookie qb.,2.0,nfl,t3_xvjzan,False,0.0,:Dolphins: Dolphins,2022-10-04T17:12:07Z,miamidolphins,-0.4767
1083,6484,6484,AK-11,Hill and Waddle are making Tua look like a top tier qb too. Granted there’s more change than just them but Hill especially has made Tua look completely different this year.,1.0,nfl,t3_xvka7g,False,0.0,:Dolphins: Dolphins,2022-10-04T14:54:38Z,miamidolphins,0.19165
1084,6486,6486,AK-11,Fun fact; Moore’s head was fine after the hit but he stayed down so long because he tweaked his back. /s,9.0,nfl,t3_xu89jf,False,0.0,:Dolphins: Dolphins,2022-10-03T02:49:26Z,miamidolphins,0.0929
1085,6487,6487,AK-11,Alex Smith would like a word,1.0,nfl,t3_xtmatc,False,0.0,:Dolphins: Dolphins,2022-10-03T02:42:36Z,miamidolphins,0.3612
1086,6491,6491,AK-11,Hey Welker might not have been amazing while he was here but he certainly was as soon as he left and was actually used correctly. Slightly /s,37.0,nfl,t3_xrrhy5,False,0.0,:Dolphins: Dolphins,2022-09-30T00:58:06Z,miamidolphins,0.066225
1088,6493,6493,AK-11,You’re not wrong but I would think him being discharged so quickly would be a good sign. Could just be me trying to cling to any hope because I’m such a fan of his but I can’t imagine they wouldn’t at least keep him overnight if they thought it was more serious than a concussion (not that those aren’t serious).,2.0,nfl,t3_xrsls2,False,0.0,:Dolphins: Dolphins,2022-09-30T00:50:06Z,miamidolphins,0.204425
1089,6494,6494,AK-11,Remember one year in the playoffs some dude literally was questionable with a “body injury” turns out it was upper and lower.,24.0,nfl,t3_xrrfxs,False,0.0,:Dolphins: Dolphins,2022-09-30T00:36:53Z,miamidolphins,-0.5267
1415,7129,7129,AMontyPython,"So he gave 3 guesses, then a whole year. Sounds like he’s throwing stuff at a dartboard. 

Also what are these podcast? Unless it’s somebody with direct knowledge, sounds like a take, trying to be a hot take.",18.0,miamidolphins,t3_xuq00k,False,0.0,:helmet90:,2022-10-03T12:53:09Z,miamidolphins,0.09594375
1416,7131,7131,AMontyPython,"I think we all saw this coming. 
It’s fine. Teddy and our defense can beat the Jets",125.0,miamidolphins,t3_xuq00k,False,0.0,:helmet90:,2022-10-03T12:38:33Z,miamidolphins,0.0651444444444444
2111,9714,9714,AgelessJohnDenney,"> I have confidence that we could find a team that would be spending willing to spend a 5th, 4th or maybe even a 3rd for him.

You have confidence in a fairy tale.",1.0,miamidolphins,t3_xuq2rx,False,0.0,:CW91:,2022-10-04T01:14:59Z,miamidolphins,0.38295
2112,9715,9715,AgelessJohnDenney,"Skylar Thompson isn't with much because he hasn't started.

But once he *does* start he'll be worth a lot, because he'll clearly be good...even though he isn't worth anything right now because he hasn't started.

Yeah man, logic is sound. Why start the proven mid-QB when you can start the absolute wildcard who might lose us the game? Trade value!!",0.0,miamidolphins,t3_xuq2rx,False,0.0,:CW91:,2022-10-03T23:44:54Z,miamidolphins,0.0095642875514403
2113,9716,9716,AgelessJohnDenney,"Skylar Thompson is a rookie 7th round pick who has never taken a regular season snap. Where is this ""valuable trade bait"" that you're talking about? Who is trading for him? A conditional 6th round pick is worth giving away a cheap backup when your starter hasn't ever played a full season?",1.0,miamidolphins,t3_xuq2rx,False,0.0,:CW91:,2022-10-03T20:01:24Z,miamidolphins,0.086340625
2114,9718,9718,AgelessJohnDenney,"Were you in this sub after Gase was fired? Because it was *exactly* the same. Every thread multiple people took the opportunity to shit on him and bemoan his failures.

And it was the same way when Tannenbaum was replaced by Grier. Honestly it still is because Tannenbaum has a TV gig now and his opinions on the Dolphins are almost never positive.

This is just what happens during regime changes. It's especially prevalent this time because of the tumultuous happenings after Flores left(lawsuit, allegations, tamperings, etc.).

The posthumous whining you're seeinf has nothing to do with Flores being black and everything to do with the circling of the wagons fanbases perform under any attack.",16.0,miamidolphins,t3_xuiyb6,False,0.0,:CW91:,2022-10-03T10:55:18Z,miamidolphins,-0.0765300270438194
2115,9719,9719,AgelessJohnDenney,Let people have fun,36.0,miamidolphins,t3_xukyzh,False,0.0,:CW91:,2022-10-03T09:55:22Z,miamidolphins,0.5106
2116,9723,9723,AgelessJohnDenney,So what you're saying is that we should trust the medical professionals who cleared Tua to go back in?,7.0,nfl,t3_xsm6tf,False,0.0,:Dolphins: Dolphins,2022-10-01T11:04:43Z,miamidolphins,0.5719
2117,9725,9725,AgelessJohnDenney,">body checking is encouraged

Lol body checking is not the thing about hockey I would have mentioned. Routinely turning into a boxing match on ice where headshots are the only acceptable swing, with the refs literally just watching, is wild.",8.0,nfl,t3_xs86sf,False,0.0,:Dolphins: Dolphins,2022-09-30T13:30:53Z,miamidolphins,0.32125
2118,9726,9726,AgelessJohnDenney,"The NFL does not care about player's health where head injuries are concerned. This is pretty much undeniable.

The NFL *does* care about the *perception* of how much they care about CTE. Big TBI's like Tua's look horrible, and the NFL doesn't want that for their image. They aren't going to clear stars just to get them back on the field because this situation is exactly the PR nightmare they are trying to avoid. See: not allowing Travis Kelce to return to a playoff game last year. There's no reason to believe the neurologists that are conducting these tests are pressured from the NFL to clear players.",101.0,nfl,t3_xry1pb,False,0.0,:Dolphins: Dolphins,2022-09-30T06:43:29Z,miamidolphins,-0.0198909294353786
2119,9727,9727,AgelessJohnDenney,"And then he was immediately tested by an independent doctor and was cleared to return. 

My back has locked up before. I stumbled. Because you need your back muscles to walk.

I don't know what Tua's injury was. All I know is that:

1. Both a concussion and a seized back can cause you to lose your legs and fall.

2. An independent neurologist said Tua did not have a concussion.

3. Tua said he hurt his back.

4. Reddit doctors refuse to believe any of the previous three things.

Whatever the truth of the matter is, I just hope Tua is okay.",15.0,nfl,t3_xry1pb,False,0.0,:Dolphins: Dolphins,2022-09-30T06:35:51Z,miamidolphins,0.0509832280685712
2120,9728,9728,AgelessJohnDenney,"Look, at this point it doesn't matter whether Tua actually had a head injury last Sunday. The world has decided he did, and any evidence to the contrary is just part of the coverup at this point.

EDIT: I want to clarify that I meant it doesn't matter *as far as public opinion is concerned*. It obviously matters very much whether or not Tua was concussed already.",27.0,nfl,t3_xry1pb,False,0.0,:Dolphins: Dolphins,2022-09-30T06:25:31Z,miamidolphins,0.0083921875
3076,13697,13697,Andresgeo,You’re not fooling me with that Bengals flair Jets fan,12.0,nfl,t3_xutb4e,False,0.0,:Dolphins: Dolphins,2022-10-03T14:52:52Z,miamidolphins,0.5511
3077,13702,13702,Andresgeo,I wouldn’t hold you against that either. We’ve seen the NFL botch easy decisions.,1.0,nfl,t3_xt9geo,False,0.0,:Dolphins: Dolphins,2022-10-02T12:25:27Z,miamidolphins,0.2202
3081,13706,13706,Andresgeo,That’s what the NFLPA is looking into. As of right now they have fired the independent doctor. No one said they are done with firing other staff. Let’s see where this ends and make a decision after all the findings and consequences come out.,2.0,nfl,t3_xt9geo,False,0.0,:Dolphins: Dolphins,2022-10-02T08:32:06Z,miamidolphins,-0.043546875
3082,13707,13707,Andresgeo,"Totally agree with the analogy, but like you said he had two doctors tell him he’s good.",7.0,nfl,t3_xt9geo,False,0.0,:Dolphins: Dolphins,2022-10-01T20:28:31Z,miamidolphins,0.84
3083,13708,13708,Andresgeo,If you actually believe that then I’m done arguing here because you are delusional and clearly trolling.,1.0,nfl,t3_xt9geo,False,0.0,:Dolphins: Dolphins,2022-10-01T20:25:20Z,miamidolphins,-0.0772
3084,13709,13709,Andresgeo,Yes I know that and I can promise you if the independent doctor/team doctor told McDaniel Tua can not play against Bills/Bengals and tua went to McDaniel saying “nah I’m fine” I promise you McDaniel doesn’t play him. He trusted the medical staff to give him the correct diagnostic on his QB and they failed to do so. So how is that on McDaniel?,-1.0,nfl,t3_xt9geo,False,1.0,:Dolphins: Dolphins,2022-10-01T19:08:42Z,miamidolphins,0.0227592592592592
3085,13710,13710,Andresgeo,"It most likely was, but why would McDaniel not believe the doctors that are paid to make sure players are safe to play. If a doctor misevaluated Tua how is McDaniel and the coaching staff supposed to know",20.0,nfl,t3_xt9geo,False,0.0,:Dolphins: Dolphins,2022-10-01T19:06:47Z,miamidolphins,0.218
3086,13711,13711,Andresgeo,Why the staff? If anything the Dolphins medical team for even telling the coaching staff Tua was good to go back out there.,-18.0,nfl,t3_xt9geo,False,1.0,:Dolphins: Dolphins,2022-10-01T18:47:01Z,miamidolphins,0.2202
3087,13712,13712,Andresgeo,Dude don’t make us fans look bad dude. Just cause it happens with another org doesn’t mean what we did is any less wrong. Like damn dude.,57.0,nfl,t3_xt76bp,False,0.0,:Dolphins: Dolphins,2022-10-01T17:17:05Z,miamidolphins,-0.0842629629629629
3304,22099,22099,Bepis_Inc,"Tua’s never had an issue with it, but 2 TBIs in 4 days can have some massive enduring effects. It seems like Tua’s alright now, but the brain is a real tricky and fragile thing",3.0,nfl,t3_xt1t9e,False,0.0,:Dolphins: Dolphins,2022-10-01T15:03:37Z,miamidolphins,0.045
4144,29594,29594,BlackRobotHole,"Seeing a ref wheeled off on a cart is funny to me. It’s just a hamstring, so it’s okay to laugh right?",7.0,miamidolphins,t3_xtq773,False,0.0,🐬 🐧 🐆 ,2022-10-02T16:15:16Z,miamidolphins,0.45925
4145,29600,29600,BlackRobotHole,"Also if he sits Tua, the stupid QB controversy starts all over again. I think Tua himself would choose to play in order to avoid that nonsense he’s been hearing since he was drafted.",1.0,nfl,t3_xrrhf6,False,0.0,:Dolphins: Dolphins :Dolphins: Dolphins,2022-09-30T13:31:52Z,miamidolphins,-0.3122749999999999
4809,35800,35800,CCbaxter90,"But he was cleared by an independent practitioner, so what’s your point?",1.0,nfl,t3_xrsgcg,False,0.0,:Dolphins: Dolphins,2022-09-30T08:52:38Z,miamidolphins,0.1531
5278,40178,40178,CaptainFrosty88,i love tua,11.0,miamidolphins,t3_xsdabb,False,0.0,#ChaseTheTank,2022-09-30T17:16:18Z,miamidolphins,0.6369
5279,40179,40179,CaptainFrosty88,"no. because frankly i don’t really care about that game, since tua went down my drive to watch or care about the score went to 0. On to next week with teddy",11.0,miamidolphins,t3_xsbvem,False,0.0,#ChaseTheTank,2022-09-30T15:43:33Z,miamidolphins,0.0857
5280,40180,40180,CaptainFrosty88,i think tua got pretty lucky. this is best case scenario and personally i think we see him back in 3 weeks,3.0,miamidolphins,t3_xrybrw,False,0.0,#ChaseTheTank,2022-09-30T07:30:15Z,miamidolphins,0.49805
6183,44399,44399,ChrisTRD289,"Which makes it worse because the neurological doctor went ""its all good""",10.0,nfl,t3_xt4qi6,False,0.0,:Dolphins: Dolphins,2022-10-01T15:36:37Z,miamidolphins,-0.0516
6184,44400,44400,ChrisTRD289,"That said, I feel the UNC should have been able to overrule what an orthopedist would say when it looked like a head injury. So the UNC was like, ""yeah, sounds good"".. Wtf.",18.0,nfl,t3_xt4qi6,False,0.0,:Dolphins: Dolphins,2022-10-01T15:34:47Z,miamidolphins,0.1914499999999999
6185,44403,44403,ChrisTRD289,"Thanks man, you too!",2.0,nfl,t3_xsm6tf,False,0.0,:Dolphins: Dolphins,2022-10-01T10:23:41Z,miamidolphins,0.4926
6186,44405,44405,ChrisTRD289,Correct. Im not saying anything about Tua. Im just trying to inform people of how awful they can be and how people can seemingly discredit something they have no experience with.,6.0,nfl,t3_xsm6tf,False,0.0,:Dolphins: Dolphins,2022-10-01T09:07:21Z,miamidolphins,-0.2123
6187,44407,44407,ChrisTRD289,Honestly sort of. 15 mins later I could get up walk and run. I did not play an NFL snap though.,-2.0,nfl,t3_xsm6tf,False,1.0,:Dolphins: Dolphins,2022-10-01T07:06:34Z,miamidolphins,-0.0691407407407407
6188,44408,44408,ChrisTRD289,"Ive moved wrong before and spasms came out if nowhere. Crippling spasms where I fell to the ground. So intense that I couldnt breathe. My wife had had to hold me up a bunch of times. Happened building a sand castle with my son. I finally had fusion surgery last year. L4-L5.

Also, certain back pain can cause tremendous pain in your legs.

Edit: I like how im being down voted for this....",-4.0,nfl,t3_xsm6tf,False,1.0,:Dolphins: Dolphins,2022-10-01T05:43:08Z,miamidolphins,0.0314950921310204
6297,46107,46107,Cidolfus,"Players with suspected head trauma are reevaluated throughout the week without being in protocol (which refers to the steps required to be reinstated). Ongoing monitoring still occurs outside of ""the protocol"".",8.0,nfl,t3_xt1t9e,False,0.0,:Dolphins: Dolphins,2022-10-01T14:34:24Z,miamidolphins,-0.142975
6835,49415,49415,CopaceticVindication,enjoy your like extra 20 bucks u bum,2.0,miamidolphins,t3_xwcp8c,False,0.0,:ZT:,2022-10-05T14:31:52Z,miamidolphins,0.6908
6836,49417,49417,CopaceticVindication,"imma be real, jones isnt gonna play this year imo",72.0,miamidolphins,t3_xwcp8c,False,0.0,:ZT:,2022-10-05T09:56:32Z,miamidolphins,-0.2584
6837,49418,49418,CopaceticVindication,"I was so hype i really thought we got our gronk stopper.

lol",56.0,nfl,t3_xwaxrq,False,0.0,:Dolphins: Dolphins :Lions: Lions,2022-10-05T08:54:56Z,miamidolphins,0.21075
6838,49420,49420,CopaceticVindication,Yeah he's good and all but can you imagine getting a super athletic OLB like Dion Jordan? I bet hes doing even better than this bum.,358.0,nfl,t3_xwaxrq,False,0.0,:Dolphins: Dolphins :Lions: Lions,2022-10-05T08:49:44Z,miamidolphins,0.446
6839,49422,49422,CopaceticVindication,TOP HALF OF THE LEAGUE BABY LETS GO,8.0,nfl,t3_xuzfp8,False,0.0,:Dolphins: Dolphins :Lions: Lions,2022-10-03T18:54:37Z,miamidolphins,0.2023
6840,49423,49423,CopaceticVindication,Ok ravens can you just not,1.0,nfl,t3_xtydcx,False,0.0,:Dolphins: Dolphins :Lions: Lions,2022-10-02T15:05:54Z,miamidolphins,0.296
6841,49424,49424,CopaceticVindication,I mean it was a bad play but bro this is a cringe post,31.0,miamidolphins,t3_xtvfr6,False,0.0,:ZT:,2022-10-02T13:10:13Z,miamidolphins,-0.1406
6842,49425,49425,CopaceticVindication,"I mean the NFLPA is just a weak union, even compared to other sports unions, Congress is effective at what it wants to be, the NFLPA isnt really effective at anything.",8.0,nfl,t3_xtb9wz,False,0.0,:Dolphins: Dolphins :Lions: Lions,2022-10-01T20:15:13Z,miamidolphins,-0.3758
6843,49426,49426,CopaceticVindication,"No, Congress is really powerful, it just uses its power to stuff their own pockets and suck their rich friends dicks/bank accounts.",56.0,nfl,t3_xtb9wz,False,0.0,:Dolphins: Dolphins :Lions: Lions,2022-10-01T20:08:54Z,miamidolphins,0.7841
6844,49427,49427,CopaceticVindication,"Nah, I would guess hes back like week 8 or 9",-6.0,nfl,t3_xtb3ed,False,0.0,:Dolphins: Dolphins :Lions: Lions,2022-10-01T20:08:08Z,miamidolphins,0.2732
6845,49428,49428,CopaceticVindication,"Yeah like that post about the quote literally leaves off the part where he says he wanted to make sure it wasnt a spinal or neck injury first, like concussions are super bad, but being paralyzed right away is even worse.",30.0,nfl,t3_xtb3ed,False,0.0,:Dolphins: Dolphins :Lions: Lions,2022-10-01T20:07:54Z,miamidolphins,-0.2732
6846,49429,49429,CopaceticVindication,"Yeah I think the flag was fine but it 100% doesnt warrant a fine, its not like he went out of his way to hurt tua.",57.0,nfl,t3_xt3s4g,False,0.0,:Dolphins: Dolphins :Lions: Lions,2022-10-01T14:51:11Z,miamidolphins,-0.7994
6847,49430,49430,CopaceticVindication,"Thats extra crazy, if its dolphins related, incompetence is always my first guess.",340.0,nfl,t3_xt1uz4,False,0.0,:Dolphins: Dolphins :Lions: Lions,2022-10-01T13:10:56Z,miamidolphins,-0.6908
6848,49431,49431,CopaceticVindication,"Well first off everyone fucking tampers bro lmfao, dont act like its some actual big sin

Also this dude isnt affiliated with the dolphins, the NFLPA hired him. If it comes out the dolphins side fucked up too, sure throw the book at them but to blame us for this dude fucking up is actually delusional .",7.0,nfl,t3_xt1uz4,False,0.0,:Dolphins: Dolphins :Lions: Lions,2022-10-01T13:09:37Z,miamidolphins,-0.305575
6849,49432,49432,CopaceticVindication,Hope its just the start and this isnt just like making this dude a fall guy without actually changing things,875.0,nfl,t3_xt1uz4,False,0.0,:Dolphins: Dolphins :Lions: Lions,2022-10-01T13:05:05Z,miamidolphins,0.1999
6850,49433,49433,CopaceticVindication,"Lmfao ok, us trying to take brady isnt even the top 20 actual bad things the dolphins or any franchise has done.",20.0,nfl,t3_xt1uz4,False,0.0,:Dolphins: Dolphins :Lions: Lions,2022-10-01T13:04:23Z,miamidolphins,-0.1511
6851,49434,49434,CopaceticVindication,"Lol im not saying we're the victims here at all, I was more making a joke how the ravens always blow us out(atleast until the last two games)",-4.0,nfl,t3_xs8su7,False,0.0,:Dolphins: Dolphins :Lions: Lions,2022-09-30T19:46:44Z,miamidolphins,0.4522
6852,49435,49435,CopaceticVindication,That dude literally had his joker moment lmfao,8.0,miamidolphins,t3_xs4y9h,False,0.0,:ZT:,2022-09-30T14:57:04Z,miamidolphins,0.6124
6853,49436,49436,CopaceticVindication,Ive watched enough House episodes to know this guy clearly knows his stuff,17.0,nfl,t3_xs75cy,False,0.0,:Dolphins: Dolphins :Lions: Lions,2022-09-30T14:49:37Z,miamidolphins,0.4019
6854,49437,49437,CopaceticVindication,"with how many times you guys have blown us out, you have an odd way of showing gratitude!",5.0,nfl,t3_xs8su7,False,0.0,:Dolphins: Dolphins :Lions: Lions,2022-09-30T14:03:59Z,miamidolphins,0.3164
6855,49438,49438,CopaceticVindication,"I was talking more about how yall always seem to beat the shit out of us but honestly remembering that yall had cam cameron, it makes sense why the ravens hate us lmao.",10.0,nfl,t3_xs8su7,False,0.0,:Dolphins: Dolphins :Lions: Lions,2022-09-30T13:56:10Z,miamidolphins,0.7783
6856,49439,49439,CopaceticVindication,I mean he has good reasoning here but im pretty sure harbaugh has just hated us forever.,-105.0,nfl,t3_xs8su7,False,0.0,:Dolphins: Dolphins :Lions: Lions,2022-09-30T13:46:04Z,miamidolphins,0.34
7086,52728,52728,Darthron911,I hope they just let him sit vs the Jets. Let this BS cool down a bit. We should be able to beat the Jets without him.,21.0,miamidolphins,t3_xtb4ra,False,0.0,:Grier:,2022-10-01T19:57:39Z,miamidolphins,0.0516666666666666
7087,52731,52731,Darthron911,You and your fake ass account can piss off.,0.0,miamidolphins,t3_xsj5m9,False,0.0,:Grier:,2022-10-01T14:29:17Z,miamidolphins,-0.8519
7088,52732,52732,Darthron911,"I would think the UNC falls on the NFL and not the Dolphins. Unfortunately, I’m pretty sure someone on the training staff will be a scapegoat and be let go as well. Such BS…",14.0,miamidolphins,t3_xt1rw3,False,0.0,:Grier:,2022-10-01T13:14:17Z,miamidolphins,0.0401333333333333
7089,52733,52733,Darthron911,"OP, I credited you with this info and shared it with other Fins fans on Twitter. Just in case you see it flying around. Great work by you to get this info!",0.0,miamidolphins,t3_xsj5m9,False,0.0,:Grier:,2022-10-01T11:56:29Z,miamidolphins,0.2418
7090,52735,52735,Darthron911,It’s ridiculous,1.0,miamidolphins,t3_xs2roz,False,0.0,:Grier:,2022-09-30T19:40:07Z,miamidolphins,-0.3612
7118,53867,53867,DaveAnson,"It’s annoying for UK viewers to not get pregame, and then just to watch that same stream and adverts via gamepass when the game kicks off

My only other quarrel is the way they display player names without spaces between them like ‘KylerMurray’. It’s a bit ugly and clunky if I’m being honest",1.0,nfl,t3_xwgbp0,False,0.0,:Dolphins: Dolphins,2022-10-05T15:57:03Z,miamidolphins,-0.0129
8098,64826,64826,Duffleman0609,I agree,3.0,nfl,t3_xwb27i,False,0.0,:Dolphins: Dolphins,2022-10-05T08:47:53Z,miamidolphins,0.3612
8099,64827,64827,Duffleman0609,Chiefs and Dolphins have been pretty good buddies especially when we beat the Pats for them,1.0,nfl,t3_xvvl1d,False,0.0,:Dolphins: Dolphins,2022-10-04T19:46:59Z,miamidolphins,0.7269
8100,64828,64828,Duffleman0609,Divisions are all even so I doubt they will expand anytime in the near future,1.0,nfl,t3_xvqdba,False,0.0,:Dolphins: Dolphins,2022-10-04T15:55:10Z,miamidolphins,-0.1226
8101,64829,64829,Duffleman0609,Where Delay of game,3.0,nfl,t3_xu1rd3,False,0.0,:Dolphins: Dolphins,2022-10-02T17:26:06Z,miamidolphins,-0.3182
8756,72685,72685,FatKidsUniting,Bills are frauds,4.0,miamidolphins,t3_xtq773,False,0.0,.,2022-10-02T12:39:08Z,miamidolphins,-0.5106
9658,79113,79113,FriendlySpaceWizard,"Awesome, thank you for the advice fam.
As always, FTJ!!!",2.0,miamidolphins,t3_xvgrh0,False,0.0,FTJ,2022-10-04T10:22:47Z,miamidolphins,0.0283333333333333
9659,79116,79116,FriendlySpaceWizard,"They need to take every game seriously.
Still Fuck’em",2.0,miamidolphins,t3_xu4tzx,False,0.0,FTJ,2022-10-03T12:13:05Z,miamidolphins,-0.044475
9660,79117,79117,FriendlySpaceWizard,Fuck the Jets,10.0,miamidolphins,t3_xu4tzx,False,0.0,FTJ,2022-10-02T21:20:55Z,miamidolphins,-0.5423
10838,85757,85757,Gregus1032,"""Oh, they're an ""R""? That means... right handed? I'm left handed. It's good to see diversity. I'll vote for them""",8.0,nfl,t3_xwgbp0,False,0.0,:Dolphins: Dolphins,2022-10-05T17:34:34Z,miamidolphins,0.017616
10839,85758,85758,Gregus1032,"I heard he made a comment about what happened to Tua last Thursday was something he's never seen or something to that effect.

I haven't seen the exact quote but comments in the dolphins sub has mentioned it a few times.

Edit: Just to be clear, OP made a dumb point. I'm just relaying the info",2.0,nfl,t3_xw0uc3,False,0.0,:Dolphins: Dolphins,2022-10-05T11:29:46Z,miamidolphins,-0.01111875
10840,85763,85763,Gregus1032,Unless you're Prince Andrew. Then all you want is stuff that's minor.,481.0,nfl,t3_xvop5w,False,0.0,:Dolphins: Dolphins,2022-10-04T18:57:10Z,miamidolphins,0.0386
10841,85764,85764,Gregus1032,I love a lot of the newer Corvettes. If I had the money I'd probably get one.,14.0,nfl,t3_xvop5w,False,0.0,:Dolphins: Dolphins,2022-10-04T18:53:07Z,miamidolphins,0.159225
10842,85767,85767,Gregus1032,You must be new. For the next 5 years minimum people are going to be calling Mike McDaniel a shit bag piece of shit and Tua had the worst concussion in all of sports and he died.,33.0,miamidolphins,t3_xvlbjl,False,0.0,:MIA13:,2022-10-04T16:24:28Z,miamidolphins,-0.47115
10843,85769,85769,Gregus1032,"No idea. 6% sales tax which isn't huge. 

My guess is the rural areas probably don't require a lot of funding. But with it being such a hot spot for vacations it probably adds up.",1.0,nfl,t3_xutb4e,False,0.0,:Dolphins: Dolphins,2022-10-04T08:02:06Z,miamidolphins,-0.0049234375
10844,85771,85771,Gregus1032,">Property Tax
In New Jersey, property taxes average nearly 2% on the assessed value of your home, one of the highest in the country. Florida, on average, has a property tax of 0.97%, which is 50% lower.",8.0,nfl,t3_xutb4e,False,0.0,:Dolphins: Dolphins,2022-10-03T18:39:26Z,miamidolphins,-0.0629999999999999
10845,85777,85777,Gregus1032,That's pretty cool. Good for him,4.0,miamidolphins,t3_xtzhxy,False,0.0,:MIA13:,2022-10-02T17:37:56Z,miamidolphins,0.387825
10846,85780,85780,Gregus1032,"First, it 100% could have been a concussion on Sunday 

The way Tua fell is *exactly* how I fell when my back locked up years ago when I was jogging.

Knees got weak and I fell and nothing was going to keep me up. 

As far as the head shaking, I've whacked my head on many things and shook my head. Doesn't mean I had a concussion. 

You can't diagnose these things over a broadcast. 

Again, it's quite plausible that he had a concussion. But the dolphins followed the protocol. If it wasn't caught what is Mike McDaniel supposed to do? 

If the team doctors thought it was possible he had a concussion and was cleared, the team doctors should be fired. If Mike McDaniel heard ""well. It's possible but he's ok now"" he should be 110% in trouble.",1.0,nfl,t3_xt9geo,False,0.0,:Dolphins: Dolphins,2022-10-02T11:40:12Z,miamidolphins,-0.0153950414551568
10847,85781,85781,Gregus1032,Good thing I have several d&d sessions planned out.,2.0,miamidolphins,t3_xt1rw3,False,0.0,:MIA13:,2022-10-01T15:19:51Z,miamidolphins,0.4404
10848,85783,85783,Gregus1032,"In another post that mentioned this quote I replied saying this same thing.

The initial tweets and news said concussion *and* neck injury. It's quite possible the neck injury isn't bad (he was in a neck brace in the dolphins locker room, might be precautionary).

The initial reaction from Tua looks like it could have been a lot worse.",1.0,nfl,t3_xs3gr6,False,0.0,:Dolphins: Dolphins,2022-09-30T13:09:45Z,miamidolphins,-0.0440546875
