,Unnamed: 0.1,Unnamed: 0,author,body,score,subreddit,link_id,over_18,controversiality,author_flair_text,created_utc,flair,sentiment
10849,85784,85784,Gregus1032,"He was brought down with a lot more force last night than Sunday. Your head doesn't need to bounce to cause a concussion. I think people are glossing over that.

He could have gotten a concussion Sunday, but that hit alone last night was really rough.",2.0,nfl,t3_xry1pb,False,0.0,:Dolphins: Dolphins,2022-09-30T11:14:57Z,miamidolphins,-0.0903
10850,85785,85785,Gregus1032,"Have you ever had a back injury and try to walk?

What happened to Tua when he fell down after that first hit is exactly what happens to someone when their back locks up or gives out.

The knees give and then you wobble and then you fall. As someone with a bad back I've had this happen a few times.

As far as shaking his head. I've done the same thing after knocking my head against pipes or hitting the edge of the door way getting into a car.

Could have there been a concussion. Yes. Absolutely. But you can't diagnose something like that through a broadcast.",1.0,nfl,t3_xry1pb,False,0.0,:Dolphins: Dolphins,2022-09-30T11:06:03Z,miamidolphins,-0.03909833217215
10851,85786,85786,Gregus1032,Same here. I've hurt my back mid run playing football. Knees give out and you topple over.,-1.0,nfl,t3_xrsgcg,False,0.0,:Dolphins: Dolphins,2022-09-30T05:14:04Z,miamidolphins,-0.0424222222222222
10852,85787,85787,Gregus1032,"I've thrown out my back before playing football mid run.

Knees gave out, strides got really short really quickly (I probably only got 2-3 more strides in) and i just fell and I couldn't get up on my own for a while. A short 10-20 minute rest and I was able to play again.

That being said, it could have been a concussion or it could have been both. If there were concussion symptoms and they let him back in, there needs to be major major penalties.

I don't want to see any player like what Tua was last night.",1.0,nfl,t3_xrsgcg,False,1.0,:Dolphins: Dolphins,2022-09-30T05:12:24Z,miamidolphins,0.0525000150034293
10853,85789,85789,Gregus1032,"That's not what he's implying. The official initial tweets said there was neck injury.

He's saying that the only injury is a concussion. His neck and everything else appears to be fine.",2.0,nfl,t3_xrrfxs,False,0.0,:Dolphins: Dolphins,2022-09-30T04:30:25Z,miamidolphins,0.0176453125
11278,88220,88220,HappyGilOHMYGOD,Dude is good on Madden,15.0,nfl,t3_xwlmw7,False,0.0,:Dolphins: Dolphins,2022-10-05T16:28:38Z,miamidolphins,0.4404
11279,88222,88222,HappyGilOHMYGOD,"I'm convinced apple doesn't want people to use their phones, with how fucking awful their interface is",2.0,nfl,t3_xuz9pb,False,0.0,:Dolphins: Dolphins,2022-10-03T20:05:02Z,miamidolphins,-0.2059
11280,88223,88223,HappyGilOHMYGOD,Maybe Jimmy wouldn't be dog shit if he targeted his all pro TE,5.0,nfl,t3_xuz9pb,False,0.0,:Dolphins: Dolphins,2022-10-03T20:03:17Z,miamidolphins,0.4449
11281,88225,88225,HappyGilOHMYGOD,I hate literally everything about ESPN's football broadcast. It's fucking terrible.,2.0,nfl,t3_xuz9pb,False,0.0,:Dolphins: Dolphins,2022-10-03T19:59:23Z,miamidolphins,-0.405775
11282,88230,88230,HappyGilOHMYGOD,Rams win 39-31,3.0,nfl,t3_xuz9pb,False,0.0,:Dolphins: Dolphins,2022-10-03T19:10:55Z,miamidolphins,0.5859
11283,88235,88235,HappyGilOHMYGOD,"Not having any Tua news is driving me nuts.

Yes I know it's only Sunday",3.0,miamidolphins,t3_xtq773,False,0.0,:MIA74:,2022-10-02T21:00:13Z,miamidolphins,0.1214
11284,88236,88236,HappyGilOHMYGOD,"The jets aren't the clown show we're used to them being. Teddy is really bad. Game could go either way, unfortunately",46.0,miamidolphins,t3_xu5xth,False,0.0,:MIA74:,2022-10-02T20:47:00Z,miamidolphins,-0.1783222222222222
11285,88237,88237,HappyGilOHMYGOD,The anti Rodgers special,6.0,nfl,t3_xu4kna,False,0.0,:Dolphins: Dolphins,2022-10-02T20:42:19Z,miamidolphins,0.1027
11286,88240,88240,HappyGilOHMYGOD,Yes,1.0,miamidolphins,t3_xswhaa,False,0.0,:MIA74:,2022-10-02T00:12:26Z,miamidolphins,0.4019
11287,88242,88242,HappyGilOHMYGOD,I don't understand why teddy is still getting chances. He's terrible. I'd rather run wildcat all game than watch him *play*,-8.0,miamidolphins,t3_xt6gsy,False,0.0,:MIA74:,2022-10-01T16:21:00Z,miamidolphins,0.0678592592592592
11288,88243,88243,HappyGilOHMYGOD,"Fans and sports media are going after the dolphins coaching staff, which has literally ZERO to do with any of this. The independent doctor and team doctor are at fault here.",77.0,miamidolphins,t3_xt67z6,False,0.0,:MIA74:,2022-10-01T16:09:13Z,miamidolphins,-0.20095
11289,88245,88245,HappyGilOHMYGOD,He literally does have a back injury though... In addition to the concussion. Just watch him throw last Thursday. It's pretty easy to see,-2.0,nfl,t3_xt1uz4,False,1.0,:Dolphins: Dolphins,2022-10-01T14:22:32Z,miamidolphins,0.180078515625
11290,88246,88246,HappyGilOHMYGOD,It's a great scheme when we're not down to our 2nd and 3rd string DBs.,2.0,miamidolphins,t3_xsfbed,False,0.0,:MIA74:,2022-09-30T18:07:50Z,miamidolphins,0.6249
11502,89431,89431,Hbnick4,"I don’t need to look at someone’s ancestors to understand and exhibit equality. 

Their ancestors mean nothing to who they are as a person.

I believe everyone in the world deserves to be treated equal, until they’ve shown they don’t.

Sadly anything, ANYBODY says it’s clearly exhibiting racism in your mind.. 

Tua is better without Flores..
That’s all I care about",3.0,miamidolphins,t3_xuiyb6,False,0.0,Tank for Tua,2022-10-03T10:12:06Z,miamidolphins,0.056575
11503,89432,89432,Hbnick4,"Idk if you’ve been paying attention or not, but Mike McDaniel is black..

Have you seen the support he’s received? 

As a major supporter of Brian Flores, I think you’re believing in something that truly isn’t there.

Brian Flores DID push Minkah Fitzpatrick (a black player) to the point of him wanting a trade..

This whole post is about Mack Hollins (a black player) who is being appreciated on another team..

Flores isn’t getting hate because of his skin colour, he’s getting hate because of how he managed his players/team..",6.0,miamidolphins,t3_xuiyb6,False,0.0,Tank for Tua,2022-10-03T09:54:40Z,miamidolphins,-0.144076953125
11504,89434,89434,Hbnick4,"Sadly, as a high meme poster as myself, there’s not much I can post",7.0,miamidolphins,t3_xtbr2k,False,0.0,Tank for Tua,2022-10-01T20:34:53Z,miamidolphins,-0.4215
11505,89435,89435,Hbnick4,"As a Canadian..

Thanksgiving is Sunday..

So I agree",3.0,miamidolphins,t3_xtb4ra,False,0.0,Tank for Tua,2022-10-01T20:15:58Z,miamidolphins,0.20865
11777,91940,91940,HisMajestyDylanMoses,Twelve pack of beer would work as well?,7.0,nfl,t3_xt1uz4,False,0.0,:Dolphins: Dolphins,2022-10-01T14:06:17Z,miamidolphins,0.2732
11778,91941,91941,HisMajestyDylanMoses,"I would not be surprised if you are right, and if anyone on the Fins knew he had a concussion and put him in the game there should be hell to pay.",7.0,nfl,t3_xt1uz4,False,0.0,:Dolphins: Dolphins,2022-10-01T14:05:33Z,miamidolphins,-0.7695
11779,91942,91942,HisMajestyDylanMoses,u/bajesus I have been having intermittent back pain combined with brief but strong headaches. What are your thoughts?,6.0,nfl,t3_xt1uz4,False,1.0,:Dolphins: Dolphins,2022-10-01T14:03:03Z,miamidolphins,0.12765
11780,91943,91943,HisMajestyDylanMoses,"I agree my first thought was concussion, but a medical doctor attributed the stumble and symptoms to back pain. My only point is that we don't know, and should await the results of the investigation. No one should besides attending doctors and medical experts with access to his analysis and Tua's symptoms at the time dispositively say he got a concussion just like no one should dispositively say he didn't--we are just football fans.",5.0,nfl,t3_xt1uz4,False,1.0,:Dolphins: Dolphins,2022-10-01T13:59:26Z,miamidolphins,-0.0852037037037037
11781,91946,91946,HisMajestyDylanMoses,You're wasting your time. Might as well be speaking different languages. Some people want to believe what they want to believe and they won't let someone better educated than them tell them differently.,-8.0,nfl,t3_xs8to6,False,0.0,:Dolphins: Dolphins,2022-09-30T14:12:32Z,miamidolphins,-0.0524296296296296
11782,91947,91947,HisMajestyDylanMoses,Doesn't fit the narrative,16.0,nfl,t3_xs75cy,False,0.0,:Dolphins: Dolphins,2022-09-30T13:12:30Z,miamidolphins,-0.2755
11814,92656,92656,Holy_Toast,[they seem to like each other enough ](https://reddit.com/r/miamidolphins/comments/xriqxn/tua_and_fitzmagic_jamming_on_the_ukuleles/),8.0,nfl,t3_xrr0g4,False,0.0,:Dolphins: Dolphins,2022-09-30T01:45:25Z,miamidolphins,0.3612
11905,94952,94952,HotPie_,"Yeah, by standing next to him.",50.0,nfl,t3_xuk88l,False,0.0,:Dolphins: Dolphins,2022-10-03T09:55:25Z,miamidolphins,0.296
11906,94958,94958,HotPie_,"I wouldn't trust any opinion from someone who hasn't treated Tua. Only people who know what's going on are the ones who have been treating him. This doctor can have his educated opinion, but he doesn't have the facts.",1.0,miamidolphins,t3_xswrla,False,0.0,Slow Cheetah,2022-10-01T10:01:25Z,miamidolphins,-0.0148999999999999
12000,96070,96070,Ileokei,"I lucked into the win last week. I should bow out now however I am a degenerate. 

Good luck all!",6.0,miamidolphins,t3_xwijd2,False,0.0,Dolphins,2022-10-05T15:05:32Z,miamidolphins,0.2734148148148148
12001,96074,96074,Ileokei,This might be good for me,1.0,miamidolphins,t3_xtxvud,False,0.0,Dolphins,2022-10-03T22:58:01Z,miamidolphins,0.4404
12002,96078,96078,Ileokei,Slow down there little fella. All I’ve seen is a scapegoat to make you internet doctors feel better. Let’s wait and see.,1.0,nfl,t3_xs8to6,False,0.0,:Dolphins: Dolphins,2022-10-01T15:13:15Z,miamidolphins,0.0057333333333333
12003,96079,96079,Ileokei,Trump won the election. The earth is flat. Area 51 has aliens and the government is covering it up. It’s easy to make stuff up if you see what you want to see.,1.0,nfl,t3_xs8to6,False,0.0,:Dolphins: Dolphins,2022-10-01T11:21:30Z,miamidolphins,0.125708984375
12004,96080,96080,Ileokei,Yes,1.0,nfl,t3_xs8to6,False,0.0,:Dolphins: Dolphins,2022-10-01T10:47:50Z,miamidolphins,0.4019
12005,96081,96081,Ileokei,We see people out every single day across the NFL with concussion protocol failures. Are you implying that Tua is so good at faking that only he can fake the doctors?,1.0,nfl,t3_xry1pb,False,0.0,:Dolphins: Dolphins,2022-10-01T07:21:08Z,miamidolphins,-0.2871
12006,96082,96082,Ileokei,Two different doctors cleared him. Actual medical experts. With degrees and everything. They get paid to be doctors. Two of them.,-1.0,nfl,t3_xs8to6,False,0.0,:Dolphins: Dolphins,2022-10-01T07:09:24Z,miamidolphins,3.2864e-05
12007,96083,96083,Ileokei,Two different doctors cleared him with no concussion.,1.0,nfl,t3_xs8to6,False,0.0,:Dolphins: Dolphins,2022-10-01T07:08:04Z,miamidolphins,-0.2023
12008,96085,96085,Ileokei,The team doctor and the neurologist have to agree 100% or he couldn’t play.,1.0,nfl,t3_xs8to6,False,0.0,:Dolphins: Dolphins,2022-10-01T07:06:08Z,miamidolphins,0.5994
12009,96086,96086,Ileokei,"This is incorrect. Both the team doctor and the neurologist have to agree. If either of them is not 100%, then he doesn’t play.",1.0,nfl,t3_xs8to6,False,0.0,:Dolphins: Dolphins,2022-10-01T07:04:51Z,miamidolphins,0.1534666666666666
12010,96087,96087,Ileokei,Thank you. This is the appropriate response.,1.0,nfl,t3_xs8to6,False,0.0,:Dolphins: Dolphins,2022-10-01T07:00:05Z,miamidolphins,0.0903
12011,96088,96088,Ileokei,Your comment reeks of upvote desperation.,-12.0,nfl,t3_xs873i,False,0.0,:Dolphins: Dolphins,2022-10-01T06:55:43Z,miamidolphins,-0.4588
12012,96089,96089,Ileokei,"If Tua is medically cleared, he should play if he wants to. No reason to sit him to make you and the rest of the internet feel better.",1.0,nfl,t3_xs873i,False,0.0,:Dolphins: Dolphins,2022-10-01T06:52:33Z,miamidolphins,0.194325
12013,96090,96090,Ileokei,The majority of these comments in this thread come off as desperation of random people around the internet trying to get their opinions upvoted.,0.0,nfl,t3_xs873i,False,0.0,:Dolphins: Dolphins,2022-10-01T06:51:02Z,miamidolphins,-0.4588
12014,96091,96091,Ileokei,"Or Tua was never “put in harms way” despite what you and the other highly decorated internet doctors believe. 

At a minimum 2 doctors looked at him on the day of the Bills game. Then every day after that a doctor looked at him. They all say it was not a concussion. Forgive this guy for not buying into the internet PHD’s. If it weren’t for all the necessary schooling and brains……What might have been",-1.0,nfl,t3_xs873i,False,0.0,:Dolphins: Dolphins,2022-10-01T06:46:33Z,miamidolphins,0.0075971943587105
12015,96092,96092,Ileokei,Because you’ve been duped by the internet experts.,-1.0,nfl,t3_xs873i,False,0.0,:Dolphins: Dolphins,2022-10-01T06:33:12Z,miamidolphins,-0.4215
12016,96093,96093,Ileokei,"If he clears protocol, he should play. Fuck the internet and their opinions.",0.0,nfl,t3_xs873i,False,0.0,:Dolphins: Dolphins,2022-10-01T06:28:16Z,miamidolphins,-0.170675
12017,96094,96094,Ileokei,"If this is true, and that’s a big if, And if Arian Foster has long term issues related to concussions, it’s his own fault not the NFL’s. This is like not wearing a seatbelt and blaming the car manufacturers when your seriously injured in an accident. Fuck Arian Foster for not taking responsibility for his own health. Fuck him for suggesting that because he’s an idiot, everyone else must be as well.",-12.0,nfl,t3_xsf2cf,False,0.0,:Dolphins: Dolphins,2022-10-01T06:18:05Z,miamidolphins,-0.21902421875
12624,100960,100960,Iotatl,minor marriage injury too...,1.0,nfl,t3_xvop5w,False,0.0,:Dolphins: Dolphins,2022-10-04T18:51:44Z,miamidolphins,-0.4215
12625,100961,100961,Iotatl,more like witch craft....LET'S BURN HIM AT THE STAKES!,7.0,nfl,t3_xu5ddf,False,0.0,:Dolphins: Dolphins,2022-10-03T04:38:08Z,miamidolphins,0.0789
12626,100962,100962,Iotatl,I'm still pissed he dropped that dime from Tua....,2.0,nfl,t3_xu5ddf,False,0.0,:Dolphins: Dolphins,2022-10-03T04:36:29Z,miamidolphins,-0.6369
12627,100964,100964,Iotatl,juju just shitting all over Mike Tomlin huh...,3.0,nfl,t3_xu4kna,False,0.0,:Dolphins: Dolphins,2022-10-02T20:21:34Z,miamidolphins,-0.4215
12628,100965,100965,Iotatl,Solid response by Tampa to keep the game respectable.,5.0,nfl,t3_xu4kna,False,0.0,:Dolphins: Dolphins,2022-10-02T20:17:43Z,miamidolphins,0.5423
12629,100966,100966,Iotatl,"My God, Patrick is just on another level than any other QB in the NFL.",12.0,nfl,t3_xu4kna,False,0.0,:Dolphins: Dolphins,2022-10-02T20:10:16Z,miamidolphins,0.2732
12630,100967,100967,Iotatl,"I think he already shit his pants, and didn't want that visual on television.",3.0,nfl,t3_xty8c9,False,0.0,:Dolphins: Dolphins,2022-10-02T19:02:45Z,miamidolphins,-0.5889
12631,100968,100968,Iotatl,"Pretty good debut for the kid... tough ask to play on the road against Green Bay, but he stood his ground.",1.0,nfl,t3_xu3pjd,False,0.0,:Dolphins: Dolphins,2022-10-02T18:56:16Z,miamidolphins,0.5423
12632,100971,100971,Iotatl,Just saw the TD was taken away because of a penalty... SMH,1.0,miamidolphins,t3_xtq773,False,0.0,:MIA74:,2022-10-02T16:44:53Z,miamidolphins,-0.7213
12633,100972,100972,Iotatl,I can't help to think the Tua situation is caused an increase in concussion evaluations today...,16.0,miamidolphins,t3_xtq773,False,0.0,:MIA74:,2022-10-02T16:10:27Z,miamidolphins,0.0108
12634,100973,100973,Iotatl,Mack Hollins with a great TD... Miss him alot in Miami,7.0,miamidolphins,t3_xtq773,False,0.0,:MIA74:,2022-10-02T16:07:57Z,miamidolphins,0.5423
12635,100975,100975,Iotatl,Kyler Murray is playing fucking awful!,8.0,miamidolphins,t3_xtq773,False,0.0,:MIA74:,2022-10-02T15:59:44Z,miamidolphins,-0.4186
12636,100976,100976,Iotatl,The national media treats Trevor wit such kid gloves. The bias is obvious.,8.0,nfl,t3_xtybfx,False,1.0,:Dolphins: Dolphins,2022-10-02T15:29:15Z,miamidolphins,-0.05135
12637,100977,100977,Iotatl,Ravens are fucking morons....,13.0,miamidolphins,t3_xtq773,False,0.0,:MIA74:,2022-10-02T15:06:38Z,miamidolphins,-0.3804
12638,100982,100982,Iotatl,I hope he doesn't rush coming back...I would think Miami will force him to sit at least the Jets game.,29.0,miamidolphins,t3_xsdabb,False,0.0,:MIA74:,2022-09-30T16:39:50Z,miamidolphins,0.4404
12969,104259,104259,JT99-FirstBallot,"Get VPN. 

Login to said VPN from somewhere else, like Brazil or Costa rica

Go to NFL.gamepass.com

Pay somewhere around $100 via Paypal and enjoy.",5.0,nfl,t3_xwbqhy,False,0.0,:Dolphins: Dolphins :Lions: Lions,2022-10-05T19:26:55Z,miamidolphins,0.3243
12970,104267,104267,JT99-FirstBallot,I guess since it's primary Ravens it is fine. But had it been Dolphins Ravens I'd be more conflicted lol. Ravens have seemed to be the team to always hurt us when it comes to playing in or getting into the playoffs the last 20 years.,1.0,nfl,t3_xuhrw4,False,0.0,:Dolphins: Dolphins :Lions: Lions,2022-10-03T11:22:12Z,miamidolphins,-0.0501074074074074
12971,104268,104268,JT99-FirstBallot,Your dual flair confuses me and kinda makes me sick.,2.0,nfl,t3_xuhrw4,False,0.0,:Dolphins: Dolphins :Lions: Lions,2022-10-03T11:16:46Z,miamidolphins,-0.6527
12972,104270,104270,JT99-FirstBallot,And then proceeds to be used the same way by the Steelers and embraces it publicly like he didn't complain about it as a reason to leave before. Hypocrite.,7.0,nfl,t3_xu0jbk,False,0.0,:Dolphins: Dolphins :Lions: Lions,2022-10-03T02:19:09Z,miamidolphins,0.132075
12973,104272,104272,JT99-FirstBallot,I like the Suplexing Trains Sabin better.,4.0,nfl,t3_xu0jbk,False,0.0,:Dolphins: Dolphins :Lions: Lions,2022-10-03T02:13:08Z,miamidolphins,0.6597
12974,104273,104273,JT99-FirstBallot,"Doesn't sound like he says butthole. I can't make out what he says but definitely doesn't sound like it. Maybe ""I've never had a broke finger.""",2.0,nfl,t3_xu2cs6,False,0.0,:Dolphins: Dolphins :Lions: Lions,2022-10-03T01:31:28Z,miamidolphins,0.1229518518518518
12975,104280,104280,JT99-FirstBallot,"Damned if you do, damned if you don't with /r/NFL knuckleheads.",9.0,nfl,t3_xs873i,False,1.0,:Dolphins: Dolphins :Lions: Lions,2022-09-30T16:44:50Z,miamidolphins,-0.6369
12976,104282,104282,JT99-FirstBallot,Then it's no longer chili and is a sauce... Good chili should stand on it's own,3.0,nfl,t3_xrqw4j,False,0.0,:Dolphins: Dolphins :Lions: Lions,2022-09-30T07:39:19Z,miamidolphins,0.1779
13705,120246,120246,LukeHarper4President,These posts read like a child/teenager and I really don’t feel like dealing with Chris Hanson.,-2.0,nfl,t3_xtyp7n,False,0.0,:Dolphins: Dolphins,2022-10-02T16:27:27Z,miamidolphins,0.6444
13706,120247,120247,LukeHarper4President,"Steelers fan gonna steelers fan I guess. Probably refreshing to have a qb who didn’t rape someone.


Blake Bortles looked great in his first game too. He only threw 2 INTs though.",-12.0,nfl,t3_xtyp7n,False,0.0,:Dolphins: Dolphins,2022-10-02T16:21:48Z,miamidolphins,0.03043984375
13707,120248,120248,LukeHarper4President,"Amazing? Amazing wins you games. 

He looked alright.",-8.0,nfl,t3_xtyp7n,False,0.0,:Dolphins: Dolphins,2022-10-02T16:09:33Z,miamidolphins,0.1958777777777777
13708,120254,120254,LukeHarper4President,Guess we don’t need hospitals and doctors because WebMD will save the day.,0.0,nfl,t3_xs0eg0,False,0.0,:Dolphins: Dolphins,2022-09-30T12:45:01Z,miamidolphins,0.4939
13709,120256,120256,LukeHarper4President,"Again, as someone who has suffered concussions and seen others get one, this reads more like your heart is in the right place and what you saw made you uncomfortable.",-2.0,nfl,t3_xs0eg0,False,1.0,:Dolphins: Dolphins,2022-09-30T11:11:47Z,miamidolphins,0.352
13710,120260,120260,LukeHarper4President,You take that logic and common sense and get the hell outta here,-4.0,nfl,t3_xs0eg0,False,0.0,:Dolphins: Dolphins,2022-09-30T10:47:28Z,miamidolphins,-0.6808
13965,121528,121528,Marathoner2010,Damn! The reversible!? Gotta be the most 1990s piece of clothing. Wear those with a pair of And1 tear away pants and you’d be back in the Marino days.,2.0,miamidolphins,t3_xvu7r0,False,0.0,Abdul Jabbar,2022-10-05T10:30:05Z,miamidolphins,-0.00178671875
13966,121529,121529,Marathoner2010,Can confirm. Have 2 different Abdul-Jabbar jerseys and Phins fans LOVE them when I wear to games.,6.0,miamidolphins,t3_xvu7r0,False,0.0,Abdul Jabbar,2022-10-05T07:56:26Z,miamidolphins,0.35625
13967,121533,121533,Marathoner2010,"Spot on.

The fact that after beating the Bills, the circle jerk team of the NFL media, the Super Bowl favorites, everything pumped out by ESPN, CBS, etc. post game was not about the Phins, or the win or even the game itself… it was about the butt punt. I had about 4 notifications about the butt punt and not a single, “Dolphins are for real” one.

Tells you all you need to know about how we are viewed by everyone else.",6.0,miamidolphins,t3_xs66wf,False,0.0,Abdul Jabbar,2022-09-30T12:30:46Z,miamidolphins,0.00519632
13968,121534,121534,Marathoner2010,"Idk. He’s looked wayyyy better this year. He’s injured constantly, and he hasn’t lived up to his hype, I’ll give you that, but Teddy ain’t it.",3.0,miamidolphins,t3_xrudrk,False,0.0,Abdul Jabbar,2022-09-30T07:07:07Z,miamidolphins,-0.026337037037037
13969,121535,121535,Marathoner2010,Same group that has spent the last 3 seasons calling him Tua Turntheballova and making fun of his underthrows all the sudden cares so much about Tua. That sub is pathetic.,3.0,miamidolphins,t3_xrts34,False,0.0,Abdul Jabbar,2022-09-30T05:44:52Z,miamidolphins,-0.1001999999999999
13970,121536,121536,Marathoner2010,"Agreed. Turned it off. Just kind of emotionless after that. 

Probably won’t watch any games on Sunday. Gonna take a break from football here for a little.",1.0,miamidolphins,t3_xrt1mj,False,0.0,Abdul Jabbar,2022-09-30T05:42:23Z,miamidolphins,8.742400000000001e-05
13971,121537,121537,Marathoner2010,I’d rather have Skyler out there than the guy who failed to make Jerry Jeudy and Courtland Sutton relevant. Teddy is washed.,29.0,miamidolphins,t3_xrudrk,False,0.0,Abdul Jabbar,2022-09-30T05:38:52Z,miamidolphins,-0.12765
16422,136673,136673,OatmealCremePiez,"I am a Mets fan. Between Tua getting hurt Thursday, Virginia Tech getting dicked and the Mets getting SWEPT in the biggest series of the year, it’s safe to say I did not enjoy my weekend",9.0,miamidolphins,t3_xug97g,False,0.0,Tuanigamanuolepola Tagovailoa,2022-10-03T09:12:37Z,miamidolphins,-0.1612
16423,136674,136674,OatmealCremePiez,For sure cooler than “it’s dolphin time” 😂,5.0,miamidolphins,t3_xug97g,False,0.0,Tuanigamanuolepola Tagovailoa,2022-10-03T09:11:28Z,miamidolphins,0.6369
16424,136675,136675,OatmealCremePiez,Welcome and fins up!!!,4.0,miamidolphins,t3_xug97g,False,0.0,Tuanigamanuolepola Tagovailoa,2022-10-03T09:06:44Z,miamidolphins,0.13875
16425,136682,136682,OatmealCremePiez,"Ah see, I didn’t know that. I appreciate the insight",5.0,nfl,t3_xs0eg0,False,0.0,:Dolphins: Dolphins,2022-09-30T09:28:33Z,miamidolphins,0.20095
16426,136683,136683,OatmealCremePiez,"He got discharged from the hospital, were they just supposed to leave him by himself in Cincinnati?",0.0,nfl,t3_xs0eg0,False,0.0,:Dolphins: Dolphins,2022-09-30T09:16:56Z,miamidolphins,-0.0516
16427,136684,136684,OatmealCremePiez,"Great news. I hope I don’t see him on the field for awhile, I want him to be selfish with his rehab",76.0,miamidolphins,t3_xs1kr7,False,0.0,Tuanigamanuolepola Tagovailoa,2022-09-30T08:40:02Z,miamidolphins,0.169125
17423,146083,146083,Pabst34,"Hill and Waddle help tremendously. That's my point. A QB's success is derived from coaching, weapons, protection and even his team's defense. For all we know, had Brady been drafted by a shit team with a shit coach and zero pass blocking, he'd be Sam Darnold.",3.0,nfl,t3_xvjayn,False,0.0,:Dolphins: Dolphins ,2022-10-04T12:10:47Z,miamidolphins,-0.195767578125
17424,146084,146084,Pabst34,"Let's get metaphysical. What makes a great QB? 

Tua is a good example. His flaws and attributes are obvious. On one hand, he's under sized with below average arm strength and he's slow afoot. But, he also has one of the quickest releases in the game, extreme intermediate accuracy along with solid pocket awareness.

So, in a Bruce Arians ""go deep"" type offense, Tua would be a liability. But, pair him with adequate playmakers in an RPO or West Coast, Tua can work magic.",2.0,nfl,t3_xvjayn,False,0.0,:Dolphins: Dolphins ,2022-10-04T11:32:03Z,miamidolphins,0.0351787846088409
17561,146462,146462,ParsnipSpecialist902,He could of been a super bowl champion if only 🙁,1.0,nfl,t3_xw0fod,False,0.0,:Dolphins: Dolphins,2022-10-05T08:03:43Z,miamidolphins,0.7713
17670,149785,149785,PioneerDinosaur,Didn’t mean to make you take another drink I’m just in awe at this lad lol,1.0,nfl,t3_xu4kna,False,0.0,:Dolphins: Dolphins,2022-10-02T22:16:48Z,miamidolphins,0.4215
17671,149786,149786,PioneerDinosaur,Dink and dunk Mahomes is the greatest QB I’ve ever seen. Tyreek going to Miami actually worked out incredibly well for both parties it’s looking like,6.0,nfl,t3_xu4kna,False,0.0,:Dolphins: Dolphins,2022-10-02T22:08:27Z,miamidolphins,0.5414749999999999
17672,149787,149787,PioneerDinosaur,I swear to fucking god Chris nowinski better be tweeting up a storm about every fucking return in this game,1.0,nfl,t3_xu4kna,False,0.0,:Dolphins: Dolphins,2022-10-02T22:03:07Z,miamidolphins,0.624
17673,149788,149788,PioneerDinosaur,"John Harbaugh says he’s never seen anything like Tua’s concussion and yet he’s coaching this game like he has a concussion, curious",5.0,nfl,t3_xtnmex,False,0.0,:Dolphins: Dolphins,2022-10-02T15:04:43Z,miamidolphins,0.3999
17674,149790,149790,PioneerDinosaur,Cooper Rush is fucking ridiculous?,5.0,nfl,t3_xtnmex,False,0.0,:Dolphins: Dolphins,2022-10-02T14:25:01Z,miamidolphins,-0.4201
