,Unnamed: 0.1,Unnamed: 0,author,body,score,subreddit,link_id,over_18,controversiality,author_flair_text,created_utc,flair,sentiment
32416,238180,238180,dudeman93,"Is that commercial implying that rent is not already affecting my credit score? If so, why the fuck have I been paying on time religiously for the last ten years?",6.0,nfl,t3_xuz9pb,False,0.0,:Dolphins: Dolphins,2022-10-03T19:40:22Z,miamidolphins,-0.1757
32758,244571,244571,finsnfeathers,Damn you went all in on the Sporano regime 😆 RIP,2.0,miamidolphins,t3_xvu7r0,False,0.0,17,2022-10-05T17:56:15Z,miamidolphins,-0.0516
32759,244573,244573,finsnfeathers,Don’t forget the starter jacket lol,1.0,miamidolphins,t3_xvu7r0,False,0.0,17,2022-10-05T14:43:08Z,miamidolphins,0.2263
32760,244575,244575,finsnfeathers,Nice I did everything but the bus since I’m coming from the west lol. Trying to figure out if I wanna stay the night before or drive in that morning,1.0,miamidolphins,t3_xvu7r0,False,0.0,17,2022-10-05T14:01:58Z,miamidolphins,0.1702
32761,244576,244576,finsnfeathers,Strike a nerve? You’re lurking on your rivals sub dude lol. Shoulda bought a Hernandez jersey 🤣,2.0,miamidolphins,t3_xvu7r0,False,0.0,17,2022-10-05T14:00:56Z,miamidolphins,0.1952481481481481
32762,244577,244577,finsnfeathers,Cry about it Pats fan,1.0,miamidolphins,t3_xvu7r0,False,0.0,17,2022-10-05T13:58:13Z,miamidolphins,-0.2023
32763,244578,244578,finsnfeathers,"Probably won’t get the rest out till I wash it once lol

https://i.imgur.com/vBcSc37.jpg",2.0,miamidolphins,t3_xvu7r0,False,0.0,17,2022-10-05T13:56:50Z,miamidolphins,0.4215
32764,244580,244580,finsnfeathers,"Yeah ok dude, I’m sure lots of people in r/MiamiDolphins decided to beat their wives because of my post title 🙄",3.0,miamidolphins,t3_xvu7r0,False,1.0,17,2022-10-05T13:53:24Z,miamidolphins,0.6908
32765,244581,244581,finsnfeathers,"Yeah okay buddy 

https://i.imgur.com/1DS4rmX.jpg",1.0,miamidolphins,t3_xvu7r0,False,0.0,17,2022-10-05T13:50:49Z,miamidolphins,0.4767
32766,244585,244585,finsnfeathers,"Damn good idea, almost forgot about him",1.0,miamidolphins,t3_xvu7r0,False,0.0,17,2022-10-05T13:47:21Z,miamidolphins,0.0516
32767,244587,244587,finsnfeathers,Dude said ‘twas 🤓,6.0,miamidolphins,t3_xvu7r0,False,0.0,17,2022-10-04T20:35:48Z,miamidolphins,-0.296
32768,244588,244588,finsnfeathers,"Chill my dude, it came from the package today like that",7.0,miamidolphins,t3_xvu7r0,False,1.0,17,2022-10-04T19:06:23Z,miamidolphins,0.3612
32769,244589,244589,finsnfeathers,The sub has spoken 🫡 can’t wait to see their reactions lol,11.0,miamidolphins,t3_xvu7r0,False,0.0,17,2022-10-04T19:01:53Z,miamidolphins,0.4215
32770,244591,244591,finsnfeathers,"Seems like we’ve forgone extensive tackling drills in camp in favor of player health. But our LBs aren’t just failing to wrap up they’re taking bad angles as well they know better. They need to learn from our safeties they’re tackling machines and smaller than baker, roberts, Phillips, etc",1.0,miamidolphins,t3_xu6x0p,False,0.0,17,2022-10-03T15:20:40Z,miamidolphins,0.0804444444444444
32771,244592,244592,finsnfeathers,"Tua can definitely learn from this and protect himself, particularly his head by not trying to play so much hero ball especially when it’s not necessary within the context of the game.

But the NFLPA has failed it’s players and Tua and the Dolphins are paying the price for it. The NFLPA should have bargained for the independent neurologist to have final say on concussion and concussion like injuries. I can’t believe they have them as just an advisor and there is an apparent lack of protocol that doesn’t take into account concussion symptoms coinciding with other sports injuries that also mimic concussion symptoms. 

The NFL and each teams medical staff ultimately failed it’s players as well but the players have a union FOR THIS EXACT REASON and more than one head should roll for this.",2.0,miamidolphins,t3_xuncvi,False,0.0,17,2022-10-03T15:15:38Z,miamidolphins,-0.041267104
32772,244594,244594,finsnfeathers,"I mean idk what you want from the coaches, this scheme has its strengths and weaknesses like all other ones. They prioritize loading up the box, stopping the run and forcing and offense to be one dimensional. Then get aggressive with pressures and disguises of all sorts to confuse the QB and force back breaking mistakes. 

The rules favor the offense to the degree these days so much. Do you know what one of the best schemes has been the past decade or two? This NE scheme. It’s stood the test of time unlike the Pete Carroll Cover 3 or Vic Fangio Cover 4 schemes. I’d say they’ve played pretty well this year given the circumstances. 

we’ve dropped a lot of picks and missed our fair share of tackles against some of the AFCs best offenses. That’s coaching and execution more than the scheme, maybe even a talent problem at linebacker.",0.0,miamidolphins,t3_xsfbed,False,0.0,17,2022-09-30T20:29:32Z,miamidolphins,0.00947634627238
32773,244595,244595,finsnfeathers,Phillips and a lot of the other LBs have left big plays on the field because of tackling,7.0,miamidolphins,t3_xsfbed,False,0.0,17,2022-09-30T18:23:13Z,miamidolphins,0.25
32774,244596,244596,finsnfeathers,Yeah which kind of makes sense on first and second down when you have to play the run as well but even when we have them backed up seems like only Ingram can consistently beat a guy 1 on 1,2.0,miamidolphins,t3_xsfbed,False,0.0,17,2022-09-30T18:21:59Z,miamidolphins,0.7391
32775,244597,244597,finsnfeathers,"Yup even when they rush 4 and use stunts, you see how well the opponents lines pass them off compared to our line. Eventually you have to straight up beat the man across from you but even the QBs have had to hold the ball we can’t seem to beat the blocks 😒",3.0,miamidolphins,t3_xsfbed,False,0.0,17,2022-09-30T18:20:20Z,miamidolphins,-0.04485
32776,244598,244598,finsnfeathers,"Probably dropped a half dozen at least. Normally we catch at least half of those, but we also got lucky in the sense that the fumbles we forced bounced to Ingram",16.0,miamidolphins,t3_xsfbed,False,0.0,17,2022-09-30T18:18:43Z,miamidolphins,-0.0386
32777,244599,244599,finsnfeathers,I’d love that for tua but I’m going to the jets game and as a paying customer…sit tua.,35.0,miamidolphins,t3_xse0et,False,0.0,17,2022-09-30T17:38:42Z,miamidolphins,0.3818
32778,244600,244600,finsnfeathers,"I’m definitely having a harder time with it now. I bought tickets a few weeks back to the jets game next week, but now it feels so somber even with tua out of the hospital.",2.0,miamidolphins,t3_xrs9vm,False,0.0,17,2022-09-30T14:18:24Z,miamidolphins,-0.255425
32779,244601,244601,finsnfeathers,"I get it, I kept thinking about tua as well. But I was hoping that would light a huge fire under this team and would’ve been so sick to see them rally for a big win for tua. And up until this play, it was looking like it would happen",4.0,miamidolphins,t3_xrs9vm,False,0.0,17,2022-09-30T14:07:22Z,miamidolphins,0.2730740740740741
33653,249069,249069,goodbiforever,the Belichick version of he’s so good (4x),60.0,nfl,t3_xu4zlo,False,0.0,:Dolphins: Dolphins,2022-10-02T20:12:13Z,miamidolphins,0.5777
33654,249070,249070,goodbiforever,Mahomes is a cheat code lmao,3.0,nfl,t3_xu4kna,False,0.0,:Dolphins: Dolphins,2022-10-02T20:08:31Z,miamidolphins,0.2263
33655,249071,249071,goodbiforever,pacheco scary,1.0,nfl,t3_xu4kna,False,0.0,:Dolphins: Dolphins,2022-10-02T20:04:55Z,miamidolphins,-0.4939
33656,249072,249072,goodbiforever,"love you uce, rest up🧡",172.0,nfl,t3_xsdcuh,False,0.0,:Dolphins: Dolphins,2022-09-30T16:44:53Z,miamidolphins,0.8555
34024,250489,250489,hebleb,Nice to have 2 future HoF backup QBs on the roster now,102.0,miamidolphins,t3_xuqdy1,False,0.0,91,2022-10-03T12:55:40Z,miamidolphins,0.4215
34025,250490,250490,hebleb,"Unfortunately, this place is also far from immune from that kind of homerism",18.0,miamidolphins,t3_xug97g,False,0.0,91,2022-10-03T07:32:27Z,miamidolphins,-0.0516
34026,250492,250492,hebleb,Was a good idea to involve a lot of kicks in this game so the British didn't get too confused,2326.0,nfl,t3_xttauf,False,0.0,:Dolphins: Dolphins,2022-10-02T11:40:08Z,miamidolphins,0.5943
34027,250494,250494,hebleb,I don't get that impression from him,-4.0,nfl,t3_xt5k9x,False,0.0,:Dolphins: Dolphins,2022-10-01T16:33:57Z,miamidolphins,-0.1695
34028,250495,250495,hebleb,Apparently without the authority to do anything about it anyway,1.0,miamidolphins,t3_xt67z6,False,0.0,91,2022-10-01T16:31:55Z,miamidolphins,-0.0572
34029,250496,250496,hebleb,Team doctor also deserves some blame,7.0,miamidolphins,t3_xt67z6,False,0.0,91,2022-10-01T16:09:52Z,miamidolphins,-0.34
34030,250497,250497,hebleb,Generally still good advice,297.0,nfl,t3_xt1uz4,False,0.0,:Dolphins: Dolphins,2022-10-01T13:17:48Z,miamidolphins,0.4404
34031,250499,250499,hebleb,It's just that McDaniel just finished a press conference and every sentence of it is being posted here separately,90.0,nfl,t3_xs88a5,False,0.0,:Dolphins: Dolphins,2022-09-30T13:49:23Z,miamidolphins,0.0772
34471,255142,255142,imsmitty3,@mods can we please have MacGruber as our sub profile picture?,12.0,miamidolphins,t3_xsf8j7,False,0.0,PhinsUP,2022-09-30T22:54:35Z,miamidolphins,0.3182
34889,260878,260878,john-33,My favorite Tua supporter on Reddit!,106.0,nfl,t3_xsdcuh,False,0.0,:Dolphins: Dolphins,2022-09-30T17:18:59Z,miamidolphins,0.6588
34890,260879,260879,john-33,I’m sure the competitor in him wants to be back ASAP but no way the dolphins rush him back after everything that happened,35.0,nfl,t3_xsdcuh,False,0.0,:Dolphins: Dolphins,2022-09-30T16:51:59Z,miamidolphins,-0.2846
34891,260880,260880,john-33,"Yeah this guys an idiot, waste of time arguing with someone like that",8.0,nfl,t3_xry1pb,False,0.0,:Dolphins: Dolphins,2022-09-30T07:07:46Z,miamidolphins,-0.6597
34892,260881,260881,john-33,How the fuck is this tone deaf? I’m not defending the dolphins at all we don’t have any answers yet. Are you new to the internet? If somehow the dolphins did everything correctly and he didn’t have a head injury Sunday and this was his only head issue this season you don’t think people will still criticize the decision to let him play?,15.0,nfl,t3_xry1pb,False,0.0,:Dolphins: Dolphins,2022-09-30T06:31:45Z,miamidolphins,-0.116818359375
34893,260882,260882,john-33,"People will blame him no matter what, it’s the internet even if they’re proved wrong they’ll think they’re right",27.0,nfl,t3_xry1pb,False,0.0,:Dolphins: Dolphins,2022-09-30T06:15:10Z,miamidolphins,-0.6782
35523,263499,263499,jrbill1991,"Well, he is not related to the Miami Dolphins, so he is an independent doctor. 

Players are incentivized? lmao, what is that? They are not kids. 

It's clear that the doctor followed the protocols and the same protocols are shitty and that is the NFL's problem, not the Dolphins.",1.0,miamidolphins,t3_xrphxc,False,0.0,:MIA66:,2022-10-05T16:54:46Z,miamidolphins,-0.109497376
35524,263500,263500,jrbill1991,"I think Teddy is more than capable to beat the Jets, he has weapons everywhere and our defense is no joke.",2.0,miamidolphins,t3_xu4tzx,False,0.0,:MIA66:,2022-10-03T04:51:49Z,miamidolphins,-0.1052
35525,263502,263502,jrbill1991,"The funniest thing is that the NFL fined a bunch of players today, hell, they even fined a player who made a sexy dance after a touchdown but go see if they fined that scumbag. 

Even Wilkins got fined for getting his helmet ripped off by that bitch Josh Allen.",8.0,miamidolphins,t3_xt9n87,False,0.0,:MIA66:,2022-10-01T19:26:16Z,miamidolphins,-0.4746749999999999
35526,263503,263503,jrbill1991,"It's only a PR move, the NFL is the most desperate league in the world, every negative thing they push the panic button and freak the hell out.

As you said, if that son of a bitch Matt Milano didn't push Tua to the ground, nothing would change and the shitty protocols would still be in place.",16.0,miamidolphins,t3_xt9n87,False,0.0,:MIA66:,2022-10-01T19:03:39Z,miamidolphins,-0.6444
35527,263504,263504,jrbill1991,Let's just sit and watch the entire league blame the Dolphins for a shitty protocol that has been in place for years.,89.0,miamidolphins,t3_xt9n87,False,0.0,:MIA66:,2022-10-01T18:43:47Z,miamidolphins,-0.7184
35528,263505,263505,jrbill1991,"He needs to protect himself. 

If there's no play, don't hold on to the ball, throw it away.",12.0,miamidolphins,t3_xt2ljk,False,0.0,:MIA66:,2022-10-01T17:01:18Z,miamidolphins,-0.03375
35529,263506,263506,jrbill1991,"Well, unless you have proof, it will continue being a conspiracy theory. 

It's how this work.",2.0,miamidolphins,t3_xt1rw3,False,0.0,:MIA66:,2022-10-01T16:44:09Z,miamidolphins,-0.07955
35530,263507,263507,jrbill1991,"Dude, do you even know how hard it is to get a doctor's degree? Do you really think a doctor would take the risk to get in legal trouble and lose the license because of a few mil? 

Stop with the conspiracy theories bullcrap.",3.0,miamidolphins,t3_xt1rw3,False,0.0,:MIA66:,2022-10-01T16:39:10Z,miamidolphins,-0.3105592592592592
35531,263508,263508,jrbill1991,"Uhh, why in the actual fuck an independent doctor who doesn't give a shit if Tua plays or not would jeopardize his/her livelihood and future because of pressure from the Dolphins?",14.0,miamidolphins,t3_xt1rw3,False,0.0,:MIA66:,2022-10-01T13:52:28Z,miamidolphins,0.0062
35532,263509,263509,jrbill1991,"Just do what I do, don't watch them. 

I don't waste my time watching Screaming A Smith or Skip Baseless anymore, and like 5 or 6 years ago I watched them every single day. The moment a realized it was only bullshit and no knowledge, I dropped it. 

And sports tv shows today follow that same model. All of them.",1.0,miamidolphins,t3_xs87x5,False,0.0,:MIA66:,2022-09-30T20:34:59Z,miamidolphins,-0.00526224
35533,263510,263510,jrbill1991,"She was spot on, especially about all the conspiracy theories out there. We have a bunch of big guys in the media asking for people to get fired or sued without knowing what happened, and to jump to conclusions before all is played out is totally irresponsible and unfair to the professionals who treated Tua.

And those same big guys didn't say shit prior to the game, but we know what it is, they want to go with the flow, all these conspiracy theories bullshit is great for the ratings and clicks.

Great to see people in the media that at least think.",18.0,miamidolphins,t3_xsgdyq,False,0.0,:MIA66:,2022-09-30T19:54:33Z,miamidolphins,0.115616015625
35534,263511,263511,jrbill1991,"It's football...

Yeah, going at the QB's knee was okay back in the day, it's not anymore. 

This is the problem with the sport, people like you, that think it's okay people to rip each other heads for your pleasure of the oLd GoOd FoOtBaLl...

You don't slam dunk QBs to the ground.",9.0,miamidolphins,t3_xs7qwz,False,0.0,:MIA66:,2022-09-30T16:45:07Z,miamidolphins,0.548425
35535,263512,263512,jrbill1991,If that was Tom Brady or Aaron Rodgers it would 100% be a penalty,14.0,miamidolphins,t3_xs8hqc,False,0.0,:MIA66:,2022-09-30T15:10:40Z,miamidolphins,-0.4588
35536,263513,263513,jrbill1991,"Get lost, dumb fuck",9.0,miamidolphins,t3_xs4xlx,False,0.0,:MIA66:,2022-09-30T14:55:06Z,miamidolphins,-0.8442
35537,263514,263514,jrbill1991,"Can we please at least just wait to see how Teddy goes after a full week of practice taking first-team snaps? 

Also, let's see what McDaniel can do with a playbook design for Teddy",7.0,miamidolphins,t3_xs8dzk,False,0.0,:MIA66:,2022-09-30T13:45:57Z,miamidolphins,0.07955
35538,263515,263515,jrbill1991,"Man, see right there? How can anyone hate Tua Tagovailoa? 

Get well, King Tua.",204.0,miamidolphins,t3_xs80n1,False,0.0,:MIA66:,2022-09-30T13:05:43Z,miamidolphins,0.0275222222222222
35539,263516,263516,jrbill1991,"I believe the only injury he got for not holding on to the ball too long was his rib injury, the rest of them, in college and pros is because he held the ball too much.

He needs to be educated on that, If I were the Dolphins, I'd put him and Marino in the same room and let Marino try to educate him on that, give him the advices, he needs to throw the ball away when there's no play and he needs to understand that.

Take the sack, take the grounding, heck even take a horrible interception, don't put your body on the line like that.",8.0,miamidolphins,t3_xs2w85,False,0.0,:MIA66:,2022-09-30T11:46:01Z,miamidolphins,-0.1372592592592592
35540,263518,263518,jrbill1991,"He got cleared by an INDEPENDENT DOCTOR, do I need to put this all on caps for you to understand? Because I've been saying that over ten times people still don't care. How do you think the Dolphins are in the wrong here when a doctor who doesn't give a shit if Tua plays or not says he can play? 

Also about the back, you also can affect your neck from back injuries, when you are feeling something in your neck, usually you make movements with your head. That's why we need the word of a fucking doctor for us to come to conclusions.",1.0,miamidolphins,t3_xrphxc,False,0.0,:MIA66:,2022-09-30T10:51:56Z,miamidolphins,0.0085168639999999
35541,263519,263519,jrbill1991,"I think you are not understanding me. I am not talking about the play yesterday, that happened unfortunately and Dolphins nor the NFL couldn't do anything to stop that, it's a vicious and violent sport, and it's part of this game. That could have happened to anyone. 

I am talking about what happened Sunday, and as of now, Sunday it was not a concussion.",1.0,miamidolphins,t3_xrphxc,False,0.0,:MIA66:,2022-09-30T10:40:03Z,miamidolphins,-0.0128515625
35542,263520,263520,jrbill1991,"Lmao, I think you need to be on the protocol as well.",4.0,miamidolphins,t3_xs33at,False,0.0,:MIA66:,2022-09-30T10:20:09Z,miamidolphins,0.7184
35543,263521,263521,jrbill1991,"I don't get how some people think Skyler can be this savior. 

We are 3-1 it's not the time to put a 7th rounder with 0 snaps in the NFL to play, don't get me wrong, what he did in the preseason means absolutely nothing, he faced a bunch of practice squad guys and the defenses never use all of their plays and packages in the preseason, especially the good ones. He was facing a bunch of vanilla schemes. 

Teddy is on the helm until Tua is back, period.",12.0,miamidolphins,t3_xs33at,False,0.0,:MIA66:,2022-09-30T10:19:10Z,miamidolphins,0.01359375
35544,263523,263523,jrbill1991,"He got cleared by a doctor, who is not a Miami Dolphins employee. 

I am sorry, but as of now, he is more qualified than you and me on everything about head trauma. 

Everything else is just conspiracy theories as of now, that's why we need to let it play out.",2.0,miamidolphins,t3_xrphxc,False,0.0,:MIA66:,2022-09-30T09:40:30Z,miamidolphins,-0.1453851851851851
35545,263524,263524,jrbill1991,"I know people who had back injuries and had their legs shaking, and trembling as well. Only a DOCTOR can make the right diagnosis.

What I know is that an independent doctor cleared him from concussion past Sunday.

Anything other than that is just assumptions.",2.0,miamidolphins,t3_xrphxc,False,0.0,:MIA66:,2022-09-30T09:37:51Z,miamidolphins,0.0053515625
35546,263526,263526,jrbill1991,"I saw it, but does it matter? My opinion means shit, I am not a neurologist. 

Making assumptions doesn't help.",2.0,miamidolphins,t3_xrphxc,False,0.0,:MIA66:,2022-09-30T09:21:45Z,miamidolphins,-0.1634666666666666
35547,263527,263527,jrbill1991,"People don't know jack shit about anything. People are forgetting the most important thing here, there was an independent doctor who evaluated Tua and cleared him from concussion. Do people really think a doctor who has no relationship with the Miami Dolphins would do anything that could compromise his reputation, and risk his career only to benefit the Dolphins in any way? 

I think we need to let it play out and see what happens. A lot of internet doctors out here.",18.0,miamidolphins,t3_xrphxc,False,0.0,:MIA66:,2022-09-30T05:23:29Z,miamidolphins,0.013700288
36020,265555,265555,just4kix_305,"I think the changes are good, I was just pointing out that the joint statement said ""there have been no conclusions regarding medical errors or protocol violations"". Literally a few hours before a bunch of reports have confirmed the UNC got terminated for making ""several mistakes"". 

I'm sure at this point everyone just wants full transparency.",1.0,nfl,t3_xt9ebe,False,0.0,:Dolphins: Dolphins,2022-10-01T19:21:52Z,miamidolphins,0.0427888888888888
36021,265556,265556,just4kix_305,"This is a great change and finally some common sense prevailing. 

That being said, it's almost guaranteed there will be a scenario coming one of these years in a crucial playoff game where an impact player will accidentally trip over their feet following a play and get ruled out immediately. Whatever fanbase this happens to will absolutely lose their shit.",3.0,nfl,t3_xt9ebe,False,0.0,:Dolphins: Dolphins,2022-10-01T19:00:18Z,miamidolphins,-0.2374555555555555
36022,265557,265557,just4kix_305,Didn't they just fire the UNC who worked last sunday's game? Wonder why this wasn't announced along with the statement.,-4.0,nfl,t3_xt9ebe,False,0.0,:Dolphins: Dolphins,2022-10-01T18:30:20Z,miamidolphins,0.0646
36024,265559,265559,just4kix_305,"Correct, but if the Neurologist goes along with it and says “yeah you’re right, it’s orthopedic, and he’s passing all the other tests” then the loophole is definitely in play. 

This feels like a scapegoat situation until all the medical evidence is revealed. Hopefully all of that is released soon",12.0,nfl,t3_xt4qi6,False,0.0,:Dolphins: Dolphins,2022-10-01T16:18:27Z,miamidolphins,0.1566925925925925
36427,267774,267774,kmartcowboy,"this is horrible i’m so sorry, hopefully mods can pin this to the top of the sub",69.0,miamidolphins,t3_xwpo0y,False,0.0,:ZT:,2022-10-05T19:18:32Z,miamidolphins,-0.081
36428,267775,267775,kmartcowboy,yea i prolly shoulda made that more specific i guess lol,2.0,miamidolphins,t3_xwg7u3,False,0.0,:ZT:,2022-10-05T14:47:16Z,miamidolphins,0.4215
36429,267777,267777,kmartcowboy,nah that’s not the stitched one,1.0,miamidolphins,t3_xwbp4o,False,0.0,:ZT:,2022-10-05T09:42:50Z,miamidolphins,-0.1027
36430,267779,267779,kmartcowboy,"just got my holland throwback jersey in the mail yesterday, favorite player rn",34.0,miamidolphins,t3_xvwr3k,False,0.0,:ZT:,2022-10-04T21:10:57Z,miamidolphins,0.4588
36431,267780,267780,kmartcowboy,can we as fans stop using the phrase “gang signs”? sounds extremely insensitive,3.0,miamidolphins,t3_xvnyx1,False,0.0,:ZT:,2022-10-04T15:56:39Z,miamidolphins,-0.2212
36432,267781,267781,kmartcowboy,"speaking of refs fucking up, why isn’t anyone talking about the play clock hitting 0 and resetting before that patriots touchdown on sunday?",26.0,nfl,t3_xvmvge,False,0.0,:Dolphins: Dolphins,2022-10-04T13:50:18Z,miamidolphins,0.34
36433,267782,267782,kmartcowboy,"yup, fuck em",1.0,nfl,t3_xuwijs,False,0.0,:Dolphins: Dolphins,2022-10-04T06:59:01Z,miamidolphins,-0.5423
36434,267783,267783,kmartcowboy,"maybe he was confusing our game with the tua situation , only logical assumption",4.0,miamidolphins,t3_xusenj,False,0.0,:ZT:,2022-10-03T21:55:32Z,miamidolphins,-0.2263
36435,267785,267785,kmartcowboy,very well said,0.0,miamidolphins,t3_xuyld5,False,0.0,:ZT:,2022-10-03T19:44:36Z,miamidolphins,0.3384
36436,267786,267786,kmartcowboy,"you won’t have to see that till the playoffs most likely, easiest schedule in the league",0.0,nfl,t3_xuwijs,False,0.0,:Dolphins: Dolphins,2022-10-03T17:30:48Z,miamidolphins,0.4728
36437,267787,267787,kmartcowboy,"how is this getting downvoted?? crazy how tua gets hurt and suddenly the dolphins aren’t even mentioned anymore, if he comes back they’re just as scary as they were before.",4.0,nfl,t3_xuwijs,False,0.0,:Dolphins: Dolphins,2022-10-03T17:24:42Z,miamidolphins,-0.4201
36438,267791,267791,kmartcowboy,"liked the harbaugh jab at the end, cant believe he said that in his interview 🙃",107.0,miamidolphins,t3_xusenj,False,0.0,:ZT:,2022-10-03T14:25:19Z,miamidolphins,0.4215
36439,267793,267793,kmartcowboy,"yea i can’t even get behind people breaking down plays/going over that game. i just really wanna forget it even happened, pray for tuas health and beat the jets with teddy",4.0,miamidolphins,t3_xug97g,False,0.0,:ZT:,2022-10-03T11:59:01Z,miamidolphins,0.0157
36440,267794,267794,kmartcowboy,fuck that’s horrible,1.0,nfl,t3_xu2ty9,False,0.0,:Dolphins: Dolphins,2022-10-03T11:50:23Z,miamidolphins,-0.7906
36441,267795,267795,kmartcowboy,yea that fucking fournette 50+ rushing yards felt like a lock around 6pm yesterday…,11.0,nfl,t3_xuiyxu,False,0.0,:Dolphins: Dolphins,2022-10-03T08:33:57Z,miamidolphins,0.3612
36442,267797,267797,kmartcowboy,can we stop with these takes please,1.0,miamidolphins,t3_xu1tbj,False,0.0,:ZT:,2022-10-02T17:41:56Z,miamidolphins,0.0258
36443,267798,267798,kmartcowboy,bad take,11.0,miamidolphins,t3_xtr6fr,False,0.0,:ZT:,2022-10-02T10:28:04Z,miamidolphins,-0.5423
36444,267799,267799,kmartcowboy,yea but no one’s saying “he’s fine play him sunday” lol that’s extremely fucked up,0.0,nfl,t3_xtl0z1,False,1.0,:Dolphins: Dolphins,2022-10-02T10:27:24Z,miamidolphins,-0.3269
36445,267800,267800,kmartcowboy,"who is actually saying this?? this is why most dolphins fans are upset in here. people keep putting words in our mouths. most fans (cant speak for all of them but the majority of our sub) just want tua to take the time he needs to heal, no matter if he comes back in a few weeks, a month, next season, whatever. we just want tua to get better for tua not just the team",1.0,nfl,t3_xtl0z1,False,1.0,:Dolphins: Dolphins,2022-10-02T10:13:13Z,miamidolphins,0.10165712
