,Unnamed: 0.1,Unnamed: 0,author,body,score,subreddit,link_id,over_18,controversiality,author_flair_text,created_utc,flair,sentiment
17239,152032,152032,RedLightning2811,What’s wrong with you,1.0,nfl,t3_xs3gr6,False,0.0,:Patriots: Patriots,2022-09-30T12:27:51Z,patriots,-0.4767
17850,163233,163233,ShanePerkins,That sack may have lost us the game lol,12.0,nfl,t3_xty42y,False,0.0,:Patriots: Patriots,2022-10-02T18:02:59Z,patriots,0.128
17851,163234,163234,ShanePerkins,He's so good. We criminally under utilize rbs,1.0,nfl,t3_xty42y,False,0.0,:Patriots: Patriots,2022-10-02T18:02:22Z,patriots,0.123175
17852,163236,163236,ShanePerkins,If zappe pulls out the W here then plays lights out next week do we have a qb controversy?,8.0,nfl,t3_xty42y,False,0.0,:Patriots: Patriots,2022-10-02T17:47:58Z,patriots,0.25
17853,163238,163238,ShanePerkins,Patriots winning in the 4th led by zappe exactly what we expected,8.0,nfl,t3_xty42y,False,0.0,:Patriots: Patriots,2022-10-02T17:45:11Z,patriots,0.5267
17854,163241,163241,ShanePerkins,"Being a pats fan for the last 20+ years I need to know.
Why is it so hard for people to spell belichick",11.0,nfl,t3_xty42y,False,0.0,:Patriots: Patriots,2022-10-02T17:40:31Z,patriots,-0.0296
17855,163243,163243,ShanePerkins,I don't think it was reset properly after the delay,-1.0,nfl,t3_xty42y,False,0.0,:Patriots: Patriots,2022-10-02T17:31:28Z,patriots,-0.3182
17856,163244,163244,ShanePerkins,Didn't look nearly as bad in the replay,0.0,nfl,t3_xty42y,False,1.0,:Patriots: Patriots,2022-10-02T17:30:45Z,patriots,-0.5423
18408,166756,166756,Sithlordbelichick,He didn’t look bad,10.0,patriots,t3_xu4gxg,False,0.0,MAC10 enjoyer,2022-10-02T19:35:12Z,patriots,-0.5423
18409,166757,166757,Sithlordbelichick,Our offense has been completely out of whack since late 2019.,9.0,patriots,t3_xtzk6b,False,0.0,MAC10 enjoyer,2022-10-02T16:12:12Z,patriots,-0.25
18444,168289,168289,Skippertech,"I honestly don't even think Zappe played that well lol. He hit a few throws thanks to great play design. 

I feel like you can't really play that game though. What happens if Hoyer doesn't get concussed? Patriots are probably a touchdown better with Hoyer over Zappe",1.0,nfl,t3_xvel37,False,0.0,:Patriots: Patriots,2022-10-04T14:06:25Z,patriots,0.090231008
18445,168290,168290,Skippertech,"I mean, is bringing a NFC contender to OverTime on the road with your rookie 3rd string QB not worth anything?",1.0,nfl,t3_xvel37,False,0.0,:Patriots: Patriots,2022-10-04T10:10:04Z,patriots,-0.6807
18549,175261,175261,TakeOneFour,"Browns feel like the only unambiguous villains at this point, and I don't see how any team can do anything *on the field* to take that from them. I don't doubt Snyder's ability to do something truly horrific to take the title from them off the field, though.",3.0,nfl,t3_xu4k9g,False,0.0,:Patriots: Patriots ,2022-10-03T09:36:16Z,patriots,-0.2749
19029,179240,179240,Thabass,ZAPPE IS GOOD.,2.0,patriots,t3_xtxcj6,False,0.0,LET MAC PASS,2022-10-02T17:44:24Z,patriots,0.4404
22120,200503,200503,YaBoiJim777,"EPA is expected points added for anyone confused

Not sure what the size of the circle means?",1.0,nfl,t3_xuooef,False,0.0,:Patriots: Patriots,2022-10-04T09:37:42Z,patriots,-0.5043
22121,200509,200509,YaBoiJim777,I have a parlay that wins +1400 if Detroit wins. Best way to hedge? They’re down 10 with 6 min left,2.0,nfl,t3_xtnmex,False,0.0,:Patriots: Patriots,2022-10-02T14:58:15Z,patriots,0.1008629629629629
22861,202964,202964,YoungDaquan,"We’ve had one of the hardest schedules in the league and let two of those games slip away. We started 2-4 last year. The Patriots always get better after September. 

If Mac was healthy, I’d be more excited for this upcoming stretch of 6-7 games",3.0,nfl,t3_xvrwfi,False,1.0,:Patriots: Patriots,2022-10-04T17:16:53Z,patriots,0.192275
22862,202965,202965,YoungDaquan,Good thing the season is a *little* longer than four weeks,18.0,nfl,t3_xvrwfi,False,0.0,:Patriots: Patriots,2022-10-04T17:06:14Z,patriots,0.4404
22863,202966,202966,YoungDaquan,Jared Goff way better than the 49ers dealt with until they got Jimmy. Jimmy also missed a lot of games which didn’t help,6.0,nfl,t3_xuy1c8,False,0.0,:Patriots: Patriots,2022-10-03T21:11:17Z,patriots,0.1741
22864,202969,202969,YoungDaquan,I’m sad bro,0.0,nfl,t3_xu3lee,False,0.0,:Patriots: Patriots,2022-10-02T18:51:44Z,patriots,-0.4767
22865,202971,202971,YoungDaquan,"The Patriots were tied 1st in explosive (20+ yards) pass plays from a tweet I saw I’d have to double check. 

They definitely might be forcing it a bit",2.0,nfl,t3_xscv98,False,0.0,:Patriots: Patriots,2022-09-30T19:38:41Z,patriots,0.2634499999999999
23449,216377,216377,bigxbluexwwex,Do y’all think that AB will do some even wilder shit by the end of the year after the pool incident?,4.0,nfl,t3_xvfvem,False,0.0,:Patriots: Patriots,2022-10-04T16:39:33Z,patriots,-0.5574
23822,224062,224062,bubbastars,Well this game has been a big FU from the coaching staff to all the haters here,9.0,patriots,t3_xtxcj6,False,0.0,:Pat_Patriot:,2022-10-02T17:45:44Z,patriots,-0.8192
23823,224063,224063,bubbastars,"https://nflcommunications.com/Pages/NFL-to-Celebrate-the-League's-International-Diversity-with-Helmet-Initiative-in-Weeks-4-and-5.aspx

NFL’s official communications^

TLDR: This and next week, players and coaches will be wearing flags to celebrate the league’s international diversity. 

Pats coaches seem to be embracing it more than most other teams. Kinda cool.",1.0,patriots,t3_xtxcj6,False,0.0,:Pat_Patriot:,2022-10-02T16:52:28Z,patriots,0.1050481481481481
23824,224064,224064,bubbastars,Lmao did anyone catch what he said?,1.0,patriots,t3_xtxcj6,False,0.0,:Pat_Patriot:,2022-10-02T16:51:40Z,patriots,0.5994
23825,224065,224065,bubbastars,"https://nflcommunications.com/Pages/NFL-to-Celebrate-the-League's-International-Diversity-with-Helmet-Initiative-in-Weeks-4-and-5.aspx

This and next week, players and coaches will be wearing flags to celebrate the league’s international diversity. 

Pats coaches seem to be embracing it more than most other teams. Kinda cool.",1.0,patriots,t3_xtxcj6,False,0.0,:Pat_Patriot:,2022-10-02T16:47:08Z,patriots,0.1050481481481481
23843,225140,225140,bun39,True. Maybe misworded. I was just being technical with the way I said it.,1.0,nfl,t3_xtximw,False,0.0,:Patriots: Patriots,2022-10-02T14:48:07Z,patriots,0.0156111111111111
23844,225141,225141,bun39,Exactly my thoughts. Not every leak has to be super exciting or shocking.,11.0,nfl,t3_xtximw,False,0.0,:Patriots: Patriots,2022-10-02T14:46:06Z,patriots,0.37665
23845,225142,225142,bun39,"Technically internal, not an exciting ""leak"", but a ""leak"" nonetheless I thought worth sharing.",17.0,nfl,t3_xtximw,False,0.0,:Patriots: Patriots,2022-10-02T14:43:34Z,patriots,0.3927
24418,227774,227774,certain_entropy,pats officially worst team in the afc east :(,7.0,nfl,t3_xty42y,False,0.0,:Patriots: Patriots,2022-10-02T18:48:50Z,patriots,-0.7906
24419,227775,227775,certain_entropy,nah pats go prevent and give up the field goal,1.0,nfl,t3_xty42y,False,0.0,:Patriots: Patriots,2022-10-02T18:38:16Z,patriots,-0.0772
24420,227776,227776,certain_entropy,This game is already past my bed time :( Watching in Europe sucks,3.0,nfl,t3_xty42y,False,0.0,:Patriots: Patriots,2022-10-02T18:37:04Z,patriots,-0.6597
24421,227779,227779,certain_entropy,">According to New York Giants owner and NFL competition committee member, John Mara, the league reached a unanimous agreement that it should be ruled a completion in the future. They've also acknowledged that it's time to create a clear definition of what a catch is to prevent further confusion. 

[https://www.nbcsports.com/washington/redskins/three-years-later-nfl-now-says-cowboys-dez-bryant-did-fact-catch-it](https://www.nbcsports.com/washington/redskins/three-years-later-nfl-now-says-cowboys-dez-bryant-did-fact-catch-it)",2.0,nfl,t3_xty42y,False,0.0,:Patriots: Patriots,2022-10-02T18:17:37Z,patriots,0.0630666666666666
24422,227780,227780,certain_entropy,dez bryant catch no catch,2.0,nfl,t3_xty42y,False,0.0,:Patriots: Patriots,2022-10-02T18:14:04Z,patriots,-0.296
24423,227781,227781,certain_entropy,when do the automatic booth reviews happen? Is it after the 2 minute warning?,3.0,nfl,t3_xty42y,False,0.0,:Patriots: Patriots,2022-10-02T18:12:54Z,patriots,-0.17
24424,227782,227782,certain_entropy,"Do we start zappe next week over hoyer if Hoyer clears to see if Zappe has room to grow? He's definitely green, but he made some nice throws",3.0,nfl,t3_xty42y,False,0.0,:Patriots: Patriots,2022-10-02T18:05:49Z,patriots,0.3571499999999999
24425,227783,227783,certain_entropy,an allegory for the lack our passing game,1.0,nfl,t3_xty42y,False,0.0,:Patriots: Patriots,2022-10-02T18:01:14Z,patriots,-0.3182
24426,227784,227784,certain_entropy,yes.,2.0,nfl,t3_xty42y,False,0.0,:Patriots: Patriots,2022-10-02T17:55:08Z,patriots,0.4019
24427,227785,227785,certain_entropy,"whoa that's crazy. Apparently he was a slow grower in highschool and wasn't see as a elite prospect early on for the colleges.

>Souza, Rodgers' former position coach at Pleasant Valley High School in Chico, California, would politely field these inquiries while examining a photo collage of former players on his desk.""There's Aaron as a sophomore at about 5'6"", 125 pounds. He's just a midget. How did people miss on him? Here it is,"" Souza said....""The reality is, he arrived as a 5'3"" freshman, his \[junior varsity\] year I think he was 5'7"" and his senior year he started at 6'0"", 180 pounds,"" Souza recalled. ""But Aaron always had an incredible understanding for the game.  
>  
>...  
>  
>Jackson attempted to help elevate his star's status shortly before the 2001 season, when they attended a camp at the University of Illinois.   
""We took him to this camp at Illinois and \[it\] felt like he was the best quarterback on their campus. The frustrating part for us was trying to convince coaches to look past his size and give him a little time to mature,"" Jackson said. ""College coaches wanted highly rated quarterback recruits who they felt were already proven and physically prepared. We just wanted someone to give him a chance.""  
Rodgers added approximately two inches and 15 pounds as a senior, according to Souza, and even though he also excelled as a student, he still struggled to attract attention as a possible Division I scholarship athlete.  
""Our society in sports, especially football, is so driven by the 'eye test.' At quarterback, they want you to look a certain way. I'm sure that definitely deterred some people from giving him an opportunity,"" Jackson said.  


[https://bleacherreport.com/articles/2582998-from-junior-college-to-1st-round-pick-the-college-recruitment-of-aaron-rodgers](https://bleacherreport.com/articles/2582998-from-junior-college-to-1st-round-pick-the-college-recruitment-of-aaron-rodgers)",1.0,nfl,t3_xty42y,False,0.0,:Patriots: Patriots,2022-10-02T17:50:02Z,patriots,0.0026761695915174
24428,227786,227786,certain_entropy,It's impressive that Stevenson was a JUCO player. Last Chance U was eye-opening on how difficult those players have it. It's probably easier to win the lottery than make it to the NFL.,4.0,nfl,t3_xty42y,False,0.0,:Patriots: Patriots,2022-10-02T17:43:37Z,patriots,0.2596888888888889
24429,227787,227787,certain_entropy,"\> More than 200 NFL players will celebrate the “growing number of nationalities and cultures that make up the fabric of the league” by wearing international flags on their helmets in Weeks 4 and 5

https://news.sportslogos.net/2022/09/29/nfl-players-coaches-executives-to-wear-international-flags-in-weeks-4-5/football/",3.0,nfl,t3_xty42y,False,0.0,:Patriots: Patriots,2022-10-02T17:37:39Z,patriots,0.6124
24430,227788,227788,certain_entropy,Belichick offseason workout really paying off. That had to be like a sub 4.4 run,12.0,nfl,t3_xty42y,False,0.0,:Patriots: Patriots,2022-10-02T17:36:02Z,patriots,0.1806
24431,227789,227789,certain_entropy,"\>More than 200 NFL players will celebrate the “growing number of nationalities and cultures that make up the fabric of the league” by wearing international flags on their helmets in Weeks 4 and 5

Bill Belichick is of Croatian heritage. [https://news.sportslogos.net/2022/09/29/nfl-players-coaches-executives-to-wear-international-flags-in-weeks-4-5/football/](https://news.sportslogos.net/2022/09/29/nfl-players-coaches-executives-to-wear-international-flags-in-weeks-4-5/football/)  


Edit: Thank you kind stranger. Also another article about Belichick's Croatian heritage: [https://www.croatiaweek.com/bill-belichick-i-am-proud-of-my-croatian-heritage/](https://www.croatiaweek.com/bill-belichick-i-am-proud-of-my-croatian-heritage/)",2.0,nfl,t3_xty42y,False,0.0,:Patriots: Patriots,2022-10-02T17:27:02Z,patriots,0.1015259259259259
24432,227790,227790,certain_entropy,It is the Jones who was promised.,10.0,nfl,t3_xty42y,False,0.0,:Patriots: Patriots,2022-10-02T16:49:40Z,patriots,0.3612
24642,232957,232957,ctpatsfan77,"His role isn't to be QB1, it's to keep them from needing to spend significantly more on a veteran backup. And I think he's succeeded at that.",5.0,nfl,t3_xuscn0,False,0.0,:Patriots: Patriots,2022-10-03T19:26:26Z,patriots,0.21075
24643,232960,232960,ctpatsfan77,"Cole Strange ✔️ 

Tyquan Thornton TBD

Marcus Jones ✔️

Jack Jones ✔️

Pierre Strong TBD

Bailey Zappe ✔️",22.0,nfl,t3_xuscn0,False,0.0,:Patriots: Patriots,2022-10-03T14:48:13Z,patriots,0.3612
24703,233686,233686,dafire123,Same old sorry ass rams (in the regular season),2.0,nfl,t3_xv36xa,False,0.0,:Patriots: Patriots,2022-10-04T02:44:21Z,patriots,-0.5859
24704,233688,233688,dafire123,This does not bode well,50.0,nfl,t3_xtl0jb,False,0.0,:Patriots: Patriots,2022-10-02T05:18:43Z,patriots,-0.2057
24705,233689,233689,dafire123,"Ofc, a falcons fan posting this too 😭",12.0,nfl,t3_xtefu9,False,0.0,:Patriots: Patriots,2022-10-01T22:43:11Z,patriots,-0.2023
24981,236230,236230,dank-nuggetz,"I mean Mac was by far and away the best rookie QB last year and would have been the 1st QB drafted this year if he was a year younger. He finished last year as the 14th-16th ranked QB (and higher in some individual metrics), which for a rookie is pretty damn good. Idk if it changes the trajectory of the Colts that much, but you guys would not be saying it was a whiffed pick if you grabbed Mac last year.",4.0,nfl,t3_xuk88l,False,0.0,:Patriots: Patriots,2022-10-03T10:43:33Z,patriots,0.0649111111111111
25416,242449,242449,dolladollaclinton,Maybe they will try even harder to let you win!,2.0,nfl,t3_xwiyhb,False,0.0,:Patriots: Patriots,2022-10-05T17:05:38Z,patriots,0.6239
25500,245621,245621,fast328,HAPPY CAKE DAY :D,5.0,patriots,t3_xw8y69,False,0.0,Bills = 0 Superbowls ,2022-10-05T09:30:32Z,patriots,0.7906
25501,245633,245633,fast328,No,1.0,patriots,t3_xuk75l,False,0.0,Bills = 0 Superbowls ,2022-10-03T13:48:07Z,patriots,-0.296
25502,245637,245637,fast328,Dude had to cross the line for the sake of a joke,1.0,patriots,t3_xs616o,False,1.0,Bills = 0 Superbowls ,2022-09-30T13:48:14Z,patriots,0.296
27643,276572,276572,mdmcnally1213,"Really the last 3.. Dugger and Onwenu make up for the rest of the 2020 draft, plus I still think Uche and Jennings have rotational upside, they just aren't studs. If we have two great starters and two rotations EDGE players, that's a great result IMO.",18.0,nfl,t3_xve6h6,False,0.0,:Patriots: Patriots,2022-10-04T08:29:29Z,patriots,0.42405
28463,288171,288171,noshingsomepods,"In Tom Brady's 1st start filling in for Bledsoe, the Patriots scored 44 points against the Peyton Colts who had by far the worst defense in the league that year.

If that happens again I'll uh, start looking into churches I guess.",11.0,nfl,t3_xwkl3h,False,0.0,:Patriots: Patriots,2022-10-05T15:15:03Z,patriots,-0.13935
28464,288172,288172,noshingsomepods,"It's trespassing, misdemeanor and a fine.  He'll also almost certainly have the lawsuit dismissed, it's fine.",8.0,nfl,t3_xwjzg0,False,0.0,:Patriots: Patriots,2022-10-05T15:08:01Z,patriots,0.176375
28465,288173,288173,noshingsomepods,"After Monica Seles, any athlete is justified in annihilating someone who runs onto the field.  Obviously don't do anything once they're not a threat, but yeah, go right ahead and give them your best JACKED UP shot.  If they end up really hurt, oh well, pretty easy to stay in your seat.",8.0,nfl,t3_xwjzg0,False,1.0,:Patriots: Patriots,2022-10-05T15:07:12Z,patriots,0.3075074074074074
28466,288174,288174,noshingsomepods,Lions living the all gas no brakes life.,31.0,nfl,t3_xwkl3h,False,0.0,:Patriots: Patriots,2022-10-05T15:03:38Z,patriots,-0.296
28467,288176,288176,noshingsomepods,Beasley has refused his last shot.,2.0,nfl,t3_xwevfj,False,1.0,:Patriots: Patriots,2022-10-05T11:25:56Z,patriots,-0.296
28468,288178,288178,noshingsomepods,"Yeah, there's basically no good argument either way for starting or sitting a rookie.  Give the coaches time, throw some scrub out there to eat shit until the rookie's ready, then start him when you think he's good to go.  

Steelers were always gonna live and die on what their defense could drag them to this year, and Watt died in the first game, so welp.

Now Pickett's had a month, hopefully won't piss himself and can throw some jump balls to their ridiculous receivers.",9.0,nfl,t3_xvinqy,False,0.0,:Patriots: Patriots,2022-10-04T15:52:19Z,patriots,0.039873828125
28469,288179,288179,noshingsomepods,"Most holding as screamed at by fans is not actually holding. The second the pass rusher executes a rip move, the OL can hold.  That's why you can see a pass rusher with a tackle straight up choking his head and that's perfectly legal.",-1.0,nfl,t3_xv61pg,False,0.0,:Patriots: Patriots,2022-10-04T08:44:32Z,patriots,0.1719333333333333
28470,288180,288180,noshingsomepods,"Broadcasters should realize not showing them isn't going to stop people from running on since everyone has a cellphone anyway and we'll get the footage regardless.  

And since Monica Seles happened, you got a perfectly valid reason to drop 'em.  So give the players open season, first guy to them gets to put a complete freebie JACKED UP hit on 'em, then let security drag 'em off the field.",2.0,nfl,t3_xv1ktc,False,0.0,:Patriots: Patriots,2022-10-03T22:32:31Z,patriots,0.2314444444444444
28471,288181,288181,noshingsomepods,"Yeah I could see a situation where a kicker or punter was an emergency fill in for Team A (like say their starter got a drug suspension or something), gets cut once that's over, then immediately signed by a TNF team that lost their guy that week.",1.0,nfl,t3_xuv6uq,False,0.0,:Patriots: Patriots,2022-10-03T16:07:08Z,patriots,-0.3182
28472,288182,288182,noshingsomepods,Or Adrian Peterson using his charity funds to pay for hotel orgies:  https://www.washingtonpost.com/news/early-lead/wp/2014/10/06/adrian-peterson-investigation-alleges-use-of-charity-funds-for-hotel-room-orgy/,19.0,nfl,t3_xukyxw,False,0.0,:Patriots: Patriots,2022-10-03T11:47:09Z,patriots,0.34
28473,288184,288184,noshingsomepods,"Yeah, there was an OTL investigation almost a decade ago of ~115 of them:  https://www.espn.com/espn/otl/story/_/id/9109024/top-athletes-charities-often-measure-charity-experts-say-efficient-effective-use-money

Basically you should presume any athlete's charity is a way to funnel money to their shittiest friends and family members.  There's so many good charities to donate to, check charitynavigator and donate in the guy's name or something instead please.",49.0,nfl,t3_xukyxw,False,0.0,:Patriots: Patriots,2022-10-03T11:14:19Z,patriots,0.524275
28474,288187,288187,noshingsomepods,"The phrase ""several mistakes"" needing so many layers of scare quotes around them Tua's hands were curled up trying to make them as he was laying on the field",-4.0,nfl,t3_xt1t9e,False,0.0,:Patriots: Patriots,2022-10-01T14:10:11Z,patriots,-0.6908
28475,288188,288188,noshingsomepods,No?  I'm basing this off the dude the league dragged out to piss on Chris Borland's retirement from concussion concerns.,15.0,nfl,t3_xsf2cf,False,0.0,:Patriots: Patriots,2022-10-01T00:16:35Z,patriots,-0.2202
28476,288189,288189,noshingsomepods,"I'm not more qualified then a doctor to say smoking causes cancer.  However, unlike a Doctor working for Philip Morris, I'm unlikely to be lying.  

The NFL has a severe credibility problem as they've repeatedly been shown to be lying about and suppressing evidence of concussions and CTE, with many many examples of players giving evidence of malpractice by team doctors.  

Based on that, why would a right thinking person trust the NFL in this without overwhelming evidence backing them up?",5.0,nfl,t3_xs86sf,False,0.0,:Patriots: Patriots,2022-09-30T22:54:49Z,patriots,0.067330859375
28477,288190,288190,noshingsomepods,"The NFL planned to use helmet sensors in 2015 to measure impact that could lead to potentially damaging head trauma. Twenty colleges used them first, and after receiving those initial readings, the NFL completely buried the program immediately.

https://www.espn.com/espn/otl/story/_/id/12348395/nfl-teams-use-concussion-sensors-helmets-2015",148.0,nfl,t3_xskiju,False,0.0,:Patriots: Patriots,2022-09-30T22:31:29Z,patriots,-0.0269222222222222
28478,288191,288191,noshingsomepods,"Heck, they still have those guys around.  One of the league's favorite CTE deniers, Joseph Maroon, is still the neurosurgeon for the Steelers as well as the medical director of the WWE.",184.0,nfl,t3_xsf2cf,False,0.0,:Patriots: Patriots,2022-09-30T20:09:31Z,patriots,0.2294
28479,288192,288192,noshingsomepods,They also tended to have very fundamentally sound running backs over the last twenty years thanks to Ivan Fears,21.0,nfl,t3_xsfznp,False,0.0,:Patriots: Patriots,2022-09-30T18:58:10Z,patriots,-0.0258
28480,288194,288194,noshingsomepods,"Didn't qualify for minimum passing plays.

Hah, looking at the best games by the AFC East last year, the top two were... Mac against the Jaguars then Zach against the Jaguars.  Then Allen  vs Chiefs, Mac vs Browns, 4 more Allen games, then 2 Mac games to round out the top 10 and every game over an 80.",3.0,nfl,t3_xscr25,False,0.0,:Patriots: Patriots,2022-09-30T16:38:55Z,patriots,0.1565148148148148
28481,288197,288197,noshingsomepods,"A whole bunch of aired interviews with players talking about the constant misery they're in along with all the stories of former players killing themselves changed little, so I have little hope this will either.

Hell, the Dolphins will likely run Tua out against the Jets in a week and maybe we'll watch a man smash more decades off his life",4.0,nfl,t3_xs5ta3,False,0.0,:Patriots: Patriots,2022-09-30T11:50:50Z,patriots,-0.5297499999999999
28482,288198,288198,noshingsomepods,"Same as it's been since the CTE news first started hitting.  A modest, sustained decline in the # of kids playing football with more youth leagues, especially outside the south, switching to non-contact. 

Time will tell if it causes a cultural drop off over time like say, Boxing had with the eradication of the HS boxing clubs through the 70's.",8.0,nfl,t3_xs5ta3,False,0.0,:Patriots: Patriots,2022-09-30T11:36:33Z,patriots,0.0567111111111111
30017,295139,295139,pccb123,Heard for 3 years in Boston sports media and our sub how we should cut our losses and swap Harry (ASU hero) to AZ for a Isabella (UMass hero) lol here is Bill’s chance!,18.0,nfl,t3_xvp5xq,False,0.0,:Patriots: Patriots,2022-10-04T17:00:20Z,patriots,0.8172
30022,295151,295151,pccb123,Thanks! I’m kinda stoked for you guys and Geno ngl.,10.0,nfl,t3_xu4ap7,False,0.0,:Patriots: Patriots,2022-10-02T21:05:14Z,patriots,0.12315
30023,295152,295152,pccb123,Can anyone who has watched some of these two teams tell me what is going on lol is Geno any good? Are the broncos junk? Upside down world?,11.0,nfl,t3_xu4ap7,False,0.0,:Patriots: Patriots,2022-10-02T20:00:46Z,patriots,0.0255851851851851
30025,295154,295154,pccb123,"Team just went toe to toe with Rodgers with a third string rookie QB lol we are obv still rebuilding and have totally change the offense so there are kinks to work out but you cant say we have 0 talent. Im also not sure what you mean but by ""not kidding ass like everybody else"". We must see very different posts on here lol",9.0,nfl,t3_xu3l5k,False,0.0,:Patriots: Patriots,2022-10-02T19:08:34Z,patriots,0.1683296296296296
30028,295157,295157,pccb123,I’m sure he’s legit terrified lol,1.0,nfl,t3_xty42y,False,0.0,:Patriots: Patriots,2022-10-02T18:37:59Z,patriots,0.0258
30029,295158,295158,pccb123,"Yeah, let Zappe cook!",1.0,nfl,t3_xty42y,False,0.0,:Patriots: Patriots,2022-10-02T18:35:07Z,patriots,0.3595
30030,295159,295159,pccb123,I’m having a heart attack.,3.0,nfl,t3_xty42y,False,0.0,:Patriots: Patriots,2022-10-02T18:13:15Z,patriots,0.2732
31191,307658,307658,snufalufalgus,"Rex did that type of shit routinely. Once against the Pats he sent out all of the Jets players who had been cut by the Pats as his captains, including current Vikings head coach Kevin O'Connell",13.0,nfl,t3_xuvvpp,False,0.0,:Patriots: Patriots,2022-10-04T01:36:29Z,patriots,-0.27595
32770,321605,321605,theWhiteKnightttt,"20 long years every single week, I kept hearing about these so called trap games. I always wondered what they meant by that. And I never understood why they didn’t bring it up after the game?",268.0,nfl,t3_xwb586,False,0.0,:Patriots: Patriots,2022-10-05T10:17:10Z,patriots,-0.0139777777777777
