,Unnamed: 0.1,Unnamed: 0,author,body,score,subreddit,link_id,over_18,controversiality,author_flair_text,created_utc,flair,sentiment
786,9856,9856,AdonisSebastian,He played guard for us his rookie year.,5.0,nfl,t3_xuoli2,False,0.0,:Patriots: Patriots,2022-10-03T13:15:26Z,patriots,0.34
787,9857,9857,AdonisSebastian,No,2.0,nfl,t3_xu3l5k,False,0.0,:Patriots: Patriots,2022-10-03T07:52:12Z,patriots,-0.296
788,9858,9858,AdonisSebastian,You mean Hell has frozen over with you guys 4-0 and us in last place.,168.0,nfl,t3_xu3l5k,False,0.0,:Patriots: Patriots,2022-10-02T18:53:11Z,patriots,-0.6808
1762,13767,13767,AlexTheCool1557,I wish they would put the “we are all patriots” on the collars of these.,2.0,patriots,t3_xwmaco,False,0.0,:jersey10::jersey10:,2022-10-05T21:31:10Z,patriots,0.4019
1763,13772,13772,AlexTheCool1557,Who? Ryan Mallet? He wasn’t that great,8.0,patriots,t3_xuxtz4,False,0.0,:jersey10::jersey10:,2022-10-03T21:43:00Z,patriots,0.2083
1764,13773,13773,AlexTheCool1557,I’m not mad,8.0,patriots,t3_xu3lyo,False,0.0,:jersey10::jersey10:,2022-10-02T18:48:18Z,patriots,0.3875
1765,13775,13775,AlexTheCool1557,Aj Hawk Special,1.0,patriots,t3_xtxcj6,False,0.0,:jersey10::jersey10:,2022-10-02T18:01:09Z,patriots,0.4019
1766,13776,13776,AlexTheCool1557,It’s the AJ Hawk special,3.0,patriots,t3_xtxcj6,False,0.0,:jersey10::jersey10:,2022-10-02T18:00:46Z,patriots,0.4019
1767,13777,13777,AlexTheCool1557,I wanna say I saw a stat saying he’s been getting doubled but not quite sure if I’m just thinking that,1.0,patriots,t3_xtxcj6,False,0.0,:jersey10::jersey10:,2022-10-02T17:54:04Z,patriots,-0.4153
1768,13779,13779,AlexTheCool1557,Zappe has done what he needs to do. Who know with Mac we might have a more aggressive play call possibly creating more turnovers. Zappe is doing good,0.0,patriots,t3_xtxcj6,False,0.0,:jersey10::jersey10:,2022-10-02T17:51:50Z,patriots,0.1974888888888889
1769,13781,13781,AlexTheCool1557,It’s the AJ Hawk special,2.0,patriots,t3_xtxcj6,False,0.0,:jersey10::jersey10:,2022-10-02T17:39:18Z,patriots,0.4019
1770,13782,13782,AlexTheCool1557,Well Rodgers is gonna warm up,2.0,patriots,t3_xtxcj6,False,0.0,:jersey10::jersey10:,2022-10-02T17:07:49Z,patriots,0.4588
1771,13785,13785,AlexTheCool1557,I just heard from my sources that Tom Brady has been traded to the Patriots mid game. He is on his way now guys don’t worry.,3.0,patriots,t3_xtxcj6,False,0.0,:jersey10::jersey10:,2022-10-02T16:26:08Z,patriots,-0.2202
1772,13786,13786,AlexTheCool1557,We can still win this game,1.0,patriots,t3_xtxcj6,False,0.0,:jersey10::jersey10:,2022-10-02T16:24:56Z,patriots,0.5859
1773,13787,13787,AlexTheCool1557,We lose.,1.0,patriots,t3_xtxcj6,False,0.0,:jersey10::jersey10:,2022-10-02T16:15:55Z,patriots,-0.4019
1774,13788,13788,AlexTheCool1557,In this case it’s probably to get zappe comfortable,3.0,patriots,t3_xtxcj6,False,0.0,:jersey10::jersey10:,2022-10-02T16:15:13Z,patriots,0.5106
1775,13790,13790,AlexTheCool1557,"Zappe looks overwhelmed, sucks that his first drive is on the opposite end of the field",11.0,patriots,t3_xtxcj6,False,0.0,:jersey10::jersey10:,2022-10-02T15:58:44Z,patriots,-0.3182
1776,13791,13791,AlexTheCool1557,Yep,1.0,patriots,t3_xtxcj6,False,0.0,:jersey10::jersey10:,2022-10-02T15:57:30Z,patriots,0.296
1777,13792,13792,AlexTheCool1557,Guys calm down…. David Andrews is the emergency qb,3.0,patriots,t3_xtxcj6,False,0.0,:jersey10::jersey10:,2022-10-02T15:55:21Z,patriots,-0.1113499999999999
1778,13794,13794,AlexTheCool1557,Let’s shoot for 3!,2.0,patriots,t3_xtxcj6,False,0.0,:jersey10::jersey10:,2022-10-02T15:53:33Z,patriots,-0.4003
2496,17517,17517,ArkBirdFTW,Brady’s the only QB with a winning record when throwing more than 50 times. He’s 20-9. No one else in NFL history has more than 5 wins,4.0,nfl,t3_xwoizy,False,0.0,:Patriots: Patriots,2022-10-05T20:25:12Z,patriots,0.1576407407407407
2497,17518,17518,ArkBirdFTW,idk man if I spend over a decade of my life working towards a singular goal I better ball out when I make it,1.0,nfl,t3_xvu7wf,False,0.0,:Patriots: Patriots,2022-10-05T04:03:57Z,patriots,0.3612
2498,17519,17519,ArkBirdFTW,It’s not about proving anything he just genuinely loves playing football. There’s this quote from him that encapsulates it perfectly “I’ve got a little sickness in me that still wants to throw a freaking spiral”,17.0,nfl,t3_xvop5w,False,0.0,:Patriots: Patriots,2022-10-04T22:19:15Z,patriots,0.337625
2499,17520,17520,ArkBirdFTW,It won’t immediately but for most of these old QBs the course of a whole season makes it much worse,9.0,nfl,t3_xvop5w,False,0.0,:Patriots: Patriots,2022-10-04T18:55:18Z,patriots,-0.631
2500,17521,17521,ArkBirdFTW,Really sad rn thinking about the possibility of noodle arm Brady. Don’t ever wanna see that man struggling late Peyton/Brees style :(,33.0,nfl,t3_xvop5w,False,0.0,:Patriots: Patriots,2022-10-04T17:27:26Z,patriots,-0.4768
2501,17526,17526,ArkBirdFTW,That 2014 week 5 game vs the Bengals is one of my favorite regular season games,5.0,nfl,t3_xrzauk,False,0.0,:Patriots: Patriots,2022-09-30T12:59:39Z,patriots,0.4588
3837,24853,24853,BeastlyMandible,"I have no issues with the way the team played today. We should not have been in that game come the second quarter, let alone in OT with them. 

But the fact of the matter is you have the ball in Green Bay territory in OT, a field goal wins it, it's 3rd and 5. You pass for some reason, it's almost picked, and then you punt to Aaron Rodgers with 6 mins to go.

You run it on third, you get 2-3 yards, you get a fourth and 2, which you go for.
If you don't get it, oh well. At least you put your team in the best position to win the game.
Punting on the opposing side of the field in OT on 4th and <8 is stupid as fuck
And for a coach that constantly sings the mantra of ""doing what's best for the football team"" he sure as fuck continues to put the team in situations where the easiest road to victory is thrown away in favor of a far more convoluted and difficult venture.

Anyway,

Go Pats",11.0,patriots,t3_xu3lyo,False,0.0,AWWWWW YEEEAAH,2022-10-02T18:57:49Z,patriots,-0.0023587606862475
3838,24855,24855,BeastlyMandible,"All goes back to that third. Why throw it. Run it for an automatic 2-3 like you have been, and set up the 4th and 1-2. 

Instead you throw it, almost get picked, and then punt on the Green Bay side of the field with dwindling time.

Just dumb.",7.0,patriots,t3_xtxcj6,False,0.0,AWWWWW YEEEAAH,2022-10-02T18:42:58Z,patriots,-0.0992304
3839,24856,24856,BeastlyMandible,Hoes sayin Tails never fails obv weren't watching SB 51 smh my head fake fans,10.0,patriots,t3_xtxcj6,False,0.0,AWWWWW YEEEAAH,2022-10-02T18:27:39Z,patriots,-0.471
3840,24857,24857,BeastlyMandible,"Should not have stopped running, worse case scenario you set up a manageable fourth. 

Play action deep shot with the rookie fourth rounder ain't it, Matty.",2.0,patriots,t3_xtxcj6,False,0.0,AWWWWW YEEEAAH,2022-10-02T18:03:45Z,patriots,0.0832
3841,24858,24858,BeastlyMandible,"The quant nerds told me from 2018-2021 how Wynn was so great and I never saw it. 

Wynn is an absolute liability and should be left in green bay.",1.0,patriots,t3_xtxcj6,False,0.0,AWWWWW YEEEAAH,2022-10-02T16:44:58Z,patriots,0.0834499999999999
3842,24859,24859,BeastlyMandible,Terrible call,9.0,patriots,t3_xtxcj6,False,0.0,AWWWWW YEEEAAH,2022-10-02T16:00:09Z,patriots,-0.4767
3843,24860,24860,BeastlyMandible,"My brother in christ, have you watched Wynn play? He's a penalty machine lol",2.0,patriots,t3_xtxcj6,False,0.0,AWWWWW YEEEAAH,2022-10-02T15:58:23Z,patriots,0.0592
3844,24861,24861,BeastlyMandible,Wynn is potentially the biggest dumbass I've watched play football lol.,3.0,patriots,t3_xtxcj6,False,0.0,AWWWWW YEEEAAH,2022-10-02T15:55:33Z,patriots,0.1531
3845,24862,24862,BeastlyMandible,At that point I think you just line up Harris with Stevenson and run the triple option lol,1.0,patriots,t3_xtxcj6,False,0.0,AWWWWW YEEEAAH,2022-10-02T15:53:17Z,patriots,0.4215
3846,24864,24864,BeastlyMandible,Probably Joe Judge at this point lol,3.0,patriots,t3_xtxcj6,False,0.0,AWWWWW YEEEAAH,2022-10-02T15:49:11Z,patriots,0.4215
3847,24865,24865,BeastlyMandible,"When given the opportunity, Wynn will always disappoint",2.0,patriots,t3_xtxcj6,False,0.0,AWWWWW YEEEAAH,2022-10-02T15:46:24Z,patriots,0.0258
4456,25748,25748,Beef-523,These are what they should go with 100%. Absolutely LOVE these concepts. I hate the blue shirt/blue pants home jerseys. Blue on white looks so much better,1.0,patriots,t3_xvucnt,False,0.0,:3-28:,2022-10-05T12:09:06Z,patriots,0.098325
5469,31956,31956,BlueRabbitx,"Can’t argue this ranking, though as good as the Steelers organization is, turning around a season with a rook qb isn’t easy",14.0,nfl,t3_xwfn85,False,0.0,:Patriots: Patriots,2022-10-05T12:24:55Z,patriots,0.5267
5470,31957,31957,BlueRabbitx,"In addition to the position, there was also the Shaq Mason trade.

But ultimately, I don’t really give a hoot what our GM does in the draft as long as the product on the field is enjoyable to watch.",6.0,patriots,t3_xvlwdg,False,0.0,:Pat_Patriot:,2022-10-04T14:14:05Z,patriots,0.29635
5471,31959,31959,BlueRabbitx,Do we have a cool nick name yet for the All-Jones secondary?,13.0,patriots,t3_xu4kkz,False,0.0,:Pat_Patriot:,2022-10-03T09:57:33Z,patriots,0.3182
5472,31960,31960,BlueRabbitx,"In fairness, we had similar complaints about Josh last year. (“Oh look, another screen pass”)

I’m excited they’re letting Mac chuck the ball downfield, for better or worse.

Overall Matt is doing a way better job than what was expected of him when he took this role, so kudos to him",17.0,patriots,t3_xuk75l,False,0.0,:Pat_Patriot:,2022-10-03T09:38:54Z,patriots,0.284237037037037
5473,31961,31961,BlueRabbitx,"Bill probably told him before he went in “DO NOT GIVE UP AN INTERCEPTION”

Thus underthrowing and holding ball too long

Kid did well in his first NFL action.  Kind of reminded me of Bills monsoon game last year, in a way",11.0,patriots,t3_xu3nvi,False,0.0,:Pat_Patriot:,2022-10-03T07:01:06Z,patriots,0.0683
5474,31962,31962,BlueRabbitx,Could argue that coaching was why we were in a position to “steal a game they had no business winning”.,0.0,patriots,t3_xu3lyo,False,1.0,:Pat_Patriot:,2022-10-02T19:32:35Z,patriots,-0.5574
5475,31963,31963,BlueRabbitx,Side note.  Fuck those “my cousin from Boston” commercials,5.0,patriots,t3_xtxpy8,False,0.0,:Pat_Patriot:,2022-10-02T17:45:34Z,patriots,-0.27115
5476,31964,31964,BlueRabbitx,Fingers crossed Zappe isn’t worse than Hoyer,5.0,patriots,t3_xtxcj6,False,0.0,:Pat_Patriot:,2022-10-02T16:11:10Z,patriots,-0.4767
5477,31966,31966,BlueRabbitx,"Interestingly, Bengals were supposed to have a hugely upgraded and intimidating o-line.

The fact they’re playing poorly, and our line seems to be decent, is extremely surprising. 

Especially since you-know-who is our o-line coach.  It’s almost as if the media doomers were…. Wrong?",1.0,patriots,t3_xs2jgw,False,0.0,:Pat_Patriot:,2022-09-30T20:50:04Z,patriots,-0.094589728
6070,42039,42039,CargoCulture,It was the classic Spider 2 Y Mama play,1.0,nfl,t3_xrq2vl,False,0.0,:Patriots: Patriots,2022-09-30T11:56:33Z,patriots,0.34
7402,60068,60068,DetBabyLegs,I throw balls far. Want good words? Date a languager,36.0,nfl,t3_xwjzg0,False,0.0,:Patriots: Patriots,2022-10-05T20:21:35Z,patriots,0.0548777777777777
7409,60101,60101,DetBabyLegs,"He still sort of did it this game just not as in-depth. A couple times he was like ""they should do this"" and they did it. One time they didn't do what he thought they should do and was like ""ooh interesting to see them make that choice.""

So he still does it a bit.",65.0,nfl,t3_xukc98,False,0.0,:Patriots: Patriots,2022-10-03T13:32:07Z,patriots,0.04545
7410,60106,60106,DetBabyLegs,Are you suggesting that if a team had 100 bad calls against them and the other team had one bad call on a scoring play that would somehow be worse? Not sure how that logic works.,-18.0,nfl,t3_xu3lee,False,0.0,:Patriots: Patriots,2022-10-02T20:04:21Z,patriots,-0.327325
7411,60107,60107,DetBabyLegs,"There were plenty of bad penalties the other way, too…",-10.0,nfl,t3_xu3lee,False,1.0,:Patriots: Patriots,2022-10-02T19:51:21Z,patriots,-0.5423
7412,60108,60108,DetBabyLegs,Yeah he’s not an asshole to reporters. He’s just not going to give out any information that opponents can use against him. That means he refuses to openly answer like 75% of questions,117.0,nfl,t3_xu3oa4,False,0.0,:Patriots: Patriots,2022-10-02T19:44:48Z,patriots,0.131362962962963
7418,60124,60124,DetBabyLegs,"I think the OG one was either about Jon Snow or Russel Wilson, but I’m too lazy to look it up right now",1.0,nfl,t3_xs88a5,False,0.0,:Patriots: Patriots,2022-10-01T12:39:58Z,patriots,-0.5023
7419,60125,60125,DetBabyLegs,"Some of us, I assume, are nice people",29.0,nfl,t3_xt0u6f,False,0.0,:Patriots: Patriots,2022-10-01T12:39:19Z,patriots,0.4215
7420,60126,60126,DetBabyLegs,Oh God that sub can be infuriating. And I’m a regular.,20.0,nfl,t3_xt0u6f,False,0.0,:Patriots: Patriots,2022-10-01T12:37:27Z,patriots,-0.07955
7421,60127,60127,DetBabyLegs,Mr Bad Comprehension,5.0,nfl,t3_xt0u6f,False,0.0,:Patriots: Patriots,2022-10-01T12:36:42Z,patriots,-0.5423
7422,60129,60129,DetBabyLegs,Damn I did too and didn’t notice until your comment. I was thinking damn I must have missed that episode,2.0,nfl,t3_xs8to6,False,0.0,:Patriots: Patriots,2022-10-01T11:59:45Z,patriots,-0.400175
7423,60130,60130,DetBabyLegs,History will remember them as best friends,3.0,nfl,t3_xs88a5,False,0.0,:Patriots: Patriots,2022-09-30T18:14:39Z,patriots,0.8074
7424,60132,60132,DetBabyLegs,Just want to Tua Toungeovailoa if you know what I mean,5.0,nfl,t3_xs88a5,False,0.0,:Patriots: Patriots,2022-09-30T16:38:42Z,patriots,0.0772
7425,60133,60133,DetBabyLegs,I love the number of comments I get about that. Indicates people are actually reading the whole thing!,102.0,nfl,t3_xs88a5,False,0.0,:Patriots: Patriots,2022-09-30T16:08:51Z,patriots,0.167625
7427,60142,60142,DetBabyLegs,"Damn, Freudian slip…",38.0,nfl,t3_xs88a5,False,0.0,:Patriots: Patriots,2022-09-30T15:22:16Z,patriots,-0.4019
7428,60143,60143,DetBabyLegs,Damn I didn’t even read it all and I posted it,94.0,nfl,t3_xs88a5,False,0.0,:Patriots: Patriots,2022-09-30T15:04:52Z,patriots,-0.4019
7432,60149,60149,DetBabyLegs,"I think I remember it smelling worse the longer you hold it under.

I'm really glad we got to have this conversation today.",25.0,nfl,t3_xs88a5,False,0.0,:Patriots: Patriots,2022-09-30T14:50:52Z,patriots,0.1355749999999999
7433,60153,60153,DetBabyLegs,"McDaniel's not gay but he wants to live in a log cabin in the woods with Tua. They won't ever have sex, but there will be a simmering erotic undercurrent as McDaniel stand in the kitchen window watching him tighten his ass as he chops wood, shirtless, sweat pouring off his body. McDaniel will run upstairs and masturbate, the entire time forcing myself to think of women while my thoughts drift back to Tua. He won't be able to climax and he'll eventually go back downstairs, angry. Sometimes they will look across the table and catch each other's eyes, and in that second, anything is possible, but they both deny themselves and go back to what we were doing. One day one of them will die, and the other will bury him outside the log cabin. Then he'll go inside, pen a brief missive to his departed friend, and commit suicide, never able to deal with life without his one true platonic love.",601.0,nfl,t3_xs88a5,False,0.0,:Patriots: Patriots,2022-09-30T14:39:49Z,patriots,0.0454875485554488
8545,77891,77891,HammyFresh,"Despite the circumstances, we had the chance to and should have won that game.",6.0,patriots,t3_xu3lyo,False,0.0,MAC JONES BAYBAY,2022-10-02T18:48:42Z,patriots,0.6908
8546,77892,77892,HammyFresh,"Despite the circumstances, we had the chance to and should have won that game.",8.0,patriots,t3_xtxcj6,False,0.0,MAC JONES BAYBAY,2022-10-02T18:48:35Z,patriots,0.6908
8547,77893,77893,HammyFresh,Regardless of what happens in OT... being tied with the Packers at Lambeau Field through 4 quarters with our 3rd string QB is an accomplishment and we should feel good about the rest of the season.,11.0,patriots,t3_xtxcj6,False,0.0,MAC JONES BAYBAY,2022-10-02T18:26:24Z,patriots,0.4404
8548,77895,77895,HammyFresh,Surprise them and air this shit out on 1st down.,8.0,patriots,t3_xtxcj6,False,0.0,MAC JONES BAYBAY,2022-10-02T18:15:58Z,patriots,-0.4854
8549,77897,77897,HammyFresh,The run game is cooking. Really wish we handed that off on 2nd down.,3.0,patriots,t3_xtxcj6,False,0.0,MAC JONES BAYBAY,2022-10-02T18:02:57Z,patriots,0.2288
8550,77898,77898,HammyFresh,Josh McCown for the win.,2.0,patriots,t3_xtxcj6,False,0.0,MAC JONES BAYBAY,2022-10-02T17:51:20Z,patriots,0.5859
8551,77900,77900,HammyFresh,Tied game. 4th Quarter. Bailey Zappe. What the fuck is today lol,16.0,patriots,t3_xtxcj6,False,0.0,MAC JONES BAYBAY,2022-10-02T17:36:44Z,patriots,-0.044475
8552,77901,77901,HammyFresh,"Fuck it, we'll take it.",5.0,patriots,t3_xtxcj6,False,0.0,MAC JONES BAYBAY,2022-10-02T17:24:42Z,patriots,-0.5423
8553,77902,77902,HammyFresh,"If you were calling the game over after GB went up 4 points, do us real fans a favor and get the fuck out and never come back. Go bandwagon a contending team.",18.0,patriots,t3_xtxcj6,False,0.0,MAC JONES BAYBAY,2022-10-02T16:51:56Z,patriots,-0.050575
8554,77904,77904,HammyFresh,Wynn is so bad that we aren't going to have a QB before long.,4.0,patriots,t3_xtxcj6,False,0.0,MAC JONES BAYBAY,2022-10-02T16:45:44Z,patriots,-0.6696
8555,77905,77905,HammyFresh,They can call everything on us but miss a blatant pick play on the Packers only score of the game. Okie doke.,4.0,patriots,t3_xtxcj6,False,0.0,MAC JONES BAYBAY,2022-10-02T16:24:48Z,patriots,0.074
8556,77907,77907,HammyFresh,We're down by 4. If you give up that easy I suggest you go bandwagon a contending team.,1.0,patriots,t3_xtxcj6,False,0.0,MAC JONES BAYBAY,2022-10-02T16:13:30Z,patriots,0.2202
8557,77908,77908,HammyFresh,DMac runs him down if that pick play doesn't happen.,2.0,patriots,t3_xtxcj6,False,0.0,MAC JONES BAYBAY,2022-10-02T16:12:19Z,patriots,0.34
8558,77909,77909,HammyFresh, If that was our play it gets called a pick 100% of the time.,5.0,patriots,t3_xtxcj6,False,0.0,MAC JONES BAYBAY,2022-10-02T16:10:10Z,patriots,0.34
8559,77911,77911,HammyFresh,Welp. This is about to be really bad or really good.,4.0,patriots,t3_xtxcj6,False,0.0,MAC JONES BAYBAY,2022-10-02T15:53:53Z,patriots,-0.07655
8992,81083,81083,HunterMantisToboggan,I mid-life crisised early too with my version - a Miata. No regrets. I say go for it,2.0,nfl,t3_xvop5w,False,0.0,:Patriots: Patriots,2022-10-05T07:08:38Z,patriots,0.0306111111111111
9816,93640,93640,Johnbgt,Everyone in this damn comment section is acting as if a close L mean shit. WE ARE FUCKING LOSING,1.0,patriots,t3_xu3lyo,False,0.0,:Pat_Patriot:,2022-10-02T19:03:57Z,patriots,-0.3339
9817,93641,93641,Johnbgt,It doesn't matter how fucking close we get. Bottom line is we're losing these games.,1.0,patriots,t3_xu3lyo,False,0.0,:Pat_Patriot:,2022-10-02T19:02:37Z,patriots,-0.195675
9818,93642,93642,Johnbgt,Damn if you're so well knowledged in football why don't you become a coach?,1.0,patriots,t3_xu3lyo,False,0.0,:Pat_Patriot:,2022-10-02T19:01:52Z,patriots,0.0107
9819,93643,93643,Johnbgt,I know I'm being dramatic I'm just so used to the old days when we were winning all the time. This is just new to me,2.0,patriots,t3_xu3lyo,False,0.0,:Pat_Patriot:,2022-10-02T18:56:56Z,patriots,0.131675
9820,93644,93644,Johnbgt,I'm just used to the deep playoff run patriots. It's just so weird,1.0,patriots,t3_xu3lyo,False,0.0,:Pat_Patriot:,2022-10-02T18:55:38Z,patriots,-0.1526
9821,93646,93646,Johnbgt,As of now the only person I trust in the patriots organization is Kraft. Belichick hasn't done jack shit since Brady left.,-3.0,patriots,t3_xu3lyo,False,1.0,:Pat_Patriot:,2022-10-02T18:52:50Z,patriots,0.3501
9822,93647,93647,Johnbgt,Fuck this shit. Belichick needs to swallow his fucking pride and hire an offense coordinator. This shit is ridiculous,4.0,patriots,t3_xtxcj6,False,0.0,:Pat_Patriot:,2022-10-02T18:42:10Z,patriots,-0.2522296296296296
9827,93673,93673,Johnbgt,I know. I just want to know what the NFL will do about this. I dont give a flying fuck what  McDaniels has to say,1.0,nfl,t3_xs88a5,False,0.0,:Patriots: Patriots,2022-09-30T17:15:15Z,patriots,-0.1721888888888888
10983,108827,108827,Lord_Burgess,Those Washington uniforms make them look like if construction workers wore football uniforms,11.0,nfl,t3_xtnmex,False,0.0,:Patriots: Patriots,2022-10-02T13:41:34Z,patriots,0.3612
10984,108828,108828,Lord_Burgess,Feels so good to be here for redzone after 3 weeks of early starts,2.0,nfl,t3_xtnmex,False,0.0,:Patriots: Patriots,2022-10-02T12:23:20Z,patriots,0.4927
11569,110305,110305,LoveToyKillJoy,What possible value is there to saying? Do you want to bet on the game?,5.0,nfl,t3_xsc1hr,False,0.0,:Patriots: Patriots,2022-09-30T16:39:06Z,patriots,0.1236
11940,113026,113026,LukeyMagukey,Please no,4.0,patriots,t3_xtb3wk,False,0.0,:3-28:,2022-10-01T22:56:36Z,patriots,0.0258
11995,113171,113171,MFreak,"""oh this one is a 'D'? Hmmm, maybe they're ambiDextrous! That's a great skill, they have my vote!""",8.0,nfl,t3_xwgbp0,False,0.0,:Patriots: Patriots,2022-10-05T20:55:50Z,patriots,0.2196
11996,113174,113174,MFreak,"What's weird about the stat chasing piece is that he's thrown like, what, 6 times downfield in 4 games including multiple good catches? I only watched 3 of the 4 games so many the Texans game was deep shot after deep shot, but feels like there's a bigger issue that he's not taking shots downfield more so than he is doing so to a detrimental level",9.0,nfl,t3_xwg4hf,False,0.0,:Patriots: Patriots,2022-10-05T12:19:41Z,patriots,0.3941249999999999
13205,120863,120863,Moss81-,Y’all better not put an S at the end of your Jone,1.0,patriots,t3_xwflux,False,0.0,16-0,2022-10-05T15:51:10Z,patriots,0.4404
13206,120865,120865,Moss81-,This defense is literally spooky,3.0,patriots,t3_xtxcj6,False,0.0,16-0,2022-10-02T17:04:50Z,patriots,0.128
13207,120866,120866,Moss81-,#IM SCREAMING,1.0,patriots,t3_xtxcj6,False,0.0,16-0,2022-10-02T16:47:06Z,patriots,-0.3818
13208,120868,120868,Moss81-,Our line is offensive,2.0,patriots,t3_xtxcj6,False,0.0,16-0,2022-10-02T16:44:58Z,patriots,-0.4588
13209,120869,120869,Moss81-,"#YOU HEAR ME. LETS PUT IN THIS WORK BOYS 2 MF MINS LETS GOOOOOOOO 

IMAGINE DEVIN SCREAMING LETS GOOOOOOOOO",5.0,patriots,t3_xtxcj6,False,0.0,16-0,2022-10-02T16:42:37Z,patriots,-0.258
13210,120870,120870,Moss81-,"Death.

Taxes.

**Stevenson feasting**",11.0,patriots,t3_xtxcj6,False,0.0,16-0,2022-10-02T16:38:47Z,patriots,-0.0222
13211,120871,120871,Moss81-,#BRO IM SCARED ASF RN BUT I STILL BELIEVE IN OUR BOYS,3.0,patriots,t3_xtxcj6,False,0.0,16-0,2022-10-02T16:30:36Z,patriots,-0.2382
13212,120874,120874,Moss81-,"I had some Chunky Soup “Chili Mac” flavor. I put Some salt and pepper + some a little bit of cheese and it actually was better than I expected. Had it with some fruit punch body armor. 

Now I take a walk and burn this off 💪",3.0,nfl,t3_xsw1hz,False,0.0,:Patriots: Patriots,2022-10-01T15:25:22Z,patriots,0.00688125
13213,120875,120875,Moss81-,Least angry Buffalo sports enthusiast,6.0,nfl,t3_xs40lk,False,0.0,:Patriots: Patriots,2022-09-30T15:57:59Z,patriots,0.6372
13214,120878,120878,Moss81-,Bro can WEEI have any semblance of respect for another human being outside of Boston…at all?!?,3.0,patriots,t3_xs616o,False,0.0,16-0,2022-09-30T15:22:56Z,patriots,0.131375
13460,122615,122615,Mulligan0816,That thumbnail image holy shit lol,1.0,nfl,t3_xul9e3,False,0.0,:Patriots: Patriots,2022-10-04T13:40:44Z,patriots,-0.2023
13461,122619,122619,Mulligan0816,Fuck. Yes. Good shit JJ!,6.0,nfl,t3_xtnmex,False,0.0,:Patriots: Patriots,2022-10-02T16:48:45Z,patriots,-0.0581296296296296
13462,122621,122621,Mulligan0816,Hahahahha wtf was that roughing the passer?,3.0,nfl,t3_xtnmex,False,0.0,:Patriots: Patriots,2022-10-02T14:56:50Z,patriots,-0.5859
14540,131091,131091,OTheOwl,"Boston sports fans are the worse. It is a combination of expecting to always be contention to win the championship coupled with the most toxic sports radio in the country.

There are ""fans"" saying we should move on from Mac and BB.",3.0,nfl,t3_xu3l5k,False,0.0,:Patriots: Patriots,2022-10-03T09:35:29Z,patriots,0.0680888888888889
14554,131105,131105,OTheOwl,"I wanted Zappe to rip it but the odds of a turnover would be much higher and that game came down to a field goal. The Patriots game plan was solid, and you have to imagine if Hoyer did not get knocked out or if Mac was not injured that we might have won it.",3.0,nfl,t3_xty42y,False,0.0,:Patriots: Patriots,2022-10-02T19:27:50Z,patriots,0.381
15389,138405,138405,Patriots80,Tampa is starting to feel like a recent Lakers squad adding a rotating slew of aging high-profile names who just bounce in and out for 3-4 games or one season to play with Brady (LeBron),50.0,nfl,t3_xwevfj,False,0.0,:Patriots: Patriots,2022-10-05T11:21:43Z,patriots,0.5994
16247,140726,140726,Phantom255x,"Oh my bad lol, Tua is still fresh on my mind lol. 

I don't disagree with you btw. I'd keep Mac out this weekend",15.0,nfl,t3_xs3oop,False,0.0,:Patriots: Patriots,2022-09-30T10:26:17Z,patriots,0.0519962962962962
16248,140727,140727,Phantom255x,Tbf there's a huge difference between this and something like a concussion/head/neck injury,-19.0,nfl,t3_xs3oop,False,0.0,:Patriots: Patriots,2022-09-30T10:21:51Z,patriots,0.25
16249,140728,140728,Phantom255x,Boston/New York/Philly are all in a class of their own compared to everyone else lol,18.0,nfl,t3_xs3oop,False,0.0,:Patriots: Patriots,2022-09-30T10:16:10Z,patriots,0.4215
16250,140729,140729,Phantom255x,"I like Stewart and he seems like a great guy IRL but I hate that Felger + Mazz + Murray have made him this ""Stu's phone"" guy",5.0,nfl,t3_xs3oop,False,0.0,:Patriots: Patriots,2022-09-30T10:12:17Z,patriots,-0.25
