,Unnamed: 0.1,Unnamed: 0,author,body,score,subreddit,link_id,over_18,controversiality,author_flair_text,created_utc,flair,sentiment
32771,321608,321608,theWhiteKnightttt,"It’s amazing to watch the Bills and Dolphins succeed like they have this year. Heck even the Jets are 2-2 and they are loaded with talent finally. ( That doesn’t mean the jets will know how to develop them. Burn.) Anyways. As a millennial I’ve never experienced seeing these 3 teams as legit contenders. Maybe back in 02’ when Bledsoe played for the Bills or between 09-10 when Rex Ryan coached the Jets but it was very rare the last 21 years. 
If the Patriots don’t make the playoffs ( not looking great ) I’ll be cheering for the Bills a wild man.",3.0,nfl,t3_xu3l5k,False,0.0,:Patriots: Patriots,2022-10-03T13:24:18Z,patriots,0.0029674396932125
32772,321610,321610,theWhiteKnightttt,"As a Patriots fan this has been one of the most exciting years to watch. The Bills and Dolphins are great teams.The Jets have a boatload of young talent and are 2-2 somehow. Going over to the NFC the Lions actually have a real nucleus of players. Goff, Swift, St. Brown, Jameson Williams will be good for the next 5 years. Draft 5 defenders next year, sign 2 decent ones and boom, the Lions can compete with anyone.",1.0,nfl,t3_xtz3tx,False,0.0,:Patriots: Patriots,2022-10-03T08:55:42Z,patriots,0.034488704
32773,321613,321613,theWhiteKnightttt,"When did I say he’ll be fine because it happens a lot ?? I clearly said he’ll have neurological problems. 

 but they won’t be as bad as some people are making them out to be. The brain has the ability to heal itself and most traumatic brain injuries you end up in a coma. He was on the team plane last night joking around. He’ll be okay.",-3.0,nfl,t3_xs23xp,False,0.0,:Patriots: Patriots,2022-09-30T14:52:20Z,patriots,0.0354898333177502
32774,321614,321614,theWhiteKnightttt,"You want the NFL to take a fair and transparent stance? They’ve done everything in their power to reduce head injuries. Last year they had the least amount of concussions they’ve ever had. They implemented the concussion protocol 10 years ago. They now have medical experts who will pull players from games that appear to have been concussed regardless of how they test. They won’t let said player go back in no matter what. They’ve changed the helmets 5 times in the last 12 years that are much safer. This year they added concussion helmet pads that go over the helmet in training camp. Concussion numbers were lower than ever in camp.  

Ultimately Tua made the decision to go back out there and play last night. He easily could’ve reported symptoms to the team and sat the game out. NFL Players are VERY educated when it comes to concussions.",-1.0,nfl,t3_xs23xp,False,0.0,:Patriots: Patriots,2022-09-30T14:44:29Z,patriots,0.0025437363055063
32775,321615,321615,theWhiteKnightttt,"Yes I did. Having neurological issues when you get older is common with everybody. His issues will occur sooner but when you’re a multi-millionaire , your healthcare is typically better than the average person. He’ll be fine like I said.",-5.0,nfl,t3_xs23xp,False,0.0,:Patriots: Patriots,2022-09-30T14:30:47Z,patriots,0.166263671875
32776,321618,321618,theWhiteKnightttt,"People are overreacting to the Tua injury. Anybody who says they might not watch football ever again is just seeking attention from other redditors. This is a violent contact sport. We see someone go into the fencing position almost every single year. Weather it be a star QB or a special teamer colliding with another special teamer. He was laughing and joking on the team plane. On a scale of traumatic brain injuries, this is one of least traumatic. It was more than a concussion but stop acting like he’s going to be a vegetable at 40. he’ll have some neurological issues when he’s older but almost all NFL players do. He’s going to be fine. Everyone thought players like Wes Welker and Tedy Bruschi would be vegetables by now. Neither are.",1.0,nfl,t3_xs23xp,False,1.0,:Patriots: Patriots,2022-09-30T14:04:19Z,patriots,0.0031442730664954
32777,321619,321619,theWhiteKnightttt,"The NFL is getting harder to watch? That’s strange because it’s the most watched program on cable. But not only the most watched program, the top 20 most watched tv programs this month are all NFL games. Not one tv show did better than any NFL game.",-6.0,nfl,t3_xrm1t7,False,0.0,:Patriots: Patriots,2022-09-30T00:12:36Z,patriots,0.1254390625
33617,328878,328878,untitled298,I’ll take one SNF GDT please and thank you,2.0,nfl,t3_xtnmex,False,0.0,:Patriots: Patriots :49ers: 49ers,2022-10-02T19:21:28Z,patriots,0.5859
33618,328879,328879,untitled298,Bill hates this man more than he’s hated anything in his entire life,9.0,nfl,t3_xty42y,False,0.0,:Patriots: Patriots :49ers: 49ers,2022-10-02T18:15:02Z,patriots,-0.8107
33619,328880,328880,untitled298,"Packers fans, y’all should be pissed. There’s no excuse to not throw that flag",13.0,nfl,t3_xty42y,False,0.0,:Patriots: Patriots :49ers: 49ers,2022-10-02T17:26:00Z,patriots,-0.187825
33968,332559,332559,watsonthedragon,grab the strainer,4.0,nfl,t3_xs88a5,False,0.0,:Patriots: Patriots,2022-09-30T13:40:00Z,patriots,-0.2023
34141,340014,340014,youraveragecupcake,No strange or jakc jones?,1.0,nfl,t3_xw6488,False,0.0,:Patriots: Patriots,2022-10-05T08:07:32Z,patriots,0.1511
34142,340015,340015,youraveragecupcake,"Defense is doing alright. I'd say the only bad game was the Ravens, even then it's the turnovers from the offense that killed us. Plus Lamar is on a mvp run right now.

Patricia isn't doing that bad at oc actually. It's fun for everyone to hate on him but he's called decent games and learned from the previous ones.

Not saying we will be a dynasty, pretty sure that ship sailed once we no longer had the greatest coach and qb combo. But we can be a good team still.",3.0,nfl,t3_xvrwfi,False,0.0,:Patriots: Patriots,2022-10-05T07:38:11Z,patriots,0.1013792152929476
34244,340745,340745,zetablunt,There was this old backup we had in the early 00s who wound up being pretty good in addition to those guys,2.0,nfl,t3_xu1rq2,False,0.0,:Patriots: Patriots :Patriots: Patriots,2022-10-03T17:37:22Z,patriots,0.7269
