,Unnamed: 0.1,Unnamed: 0,author,body,score,subreddit,link_id,over_18,controversiality,author_flair_text,created_utc,flair,sentiment
8505,96529,96529,RSN_Kabutops,WHAT THE FUCK JUST HAPPENED I WANT TO DIE,5.0,nfl,t3_ynwlod,False,0.0,:Falcons: Falcons,2022-11-06T14:51:57Z,falcons,-0.7964
8506,96530,96530,RSN_Kabutops,It's so dumb that someone can get wrapped up and thrown to the ground yet somehow not ruled that their progress had been stopped at any point,3.0,nfl,t3_ynwlod,False,0.0,:Falcons: Falcons,2022-11-06T14:27:46Z,falcons,-0.4005
8507,96533,96533,RSN_Kabutops,Good. Suspend him next season so they're bad then too,27.0,nfl,t3_ynoosz,False,0.0,:Falcons: Falcons,2022-11-06T06:52:17Z,falcons,-0.2524499999999999
9996,107134,107134,SlopingGiraffe,"They really ""i can't be racist I've got a black friend""ed a gunshot victim",2.0,nfl,t3_yqz7b3,False,0.0,:Falcons: Falcons,2022-11-09T17:42:47Z,falcons,0.2778
9997,107135,107135,SlopingGiraffe,Lafleur should really take the part where he makes his qb make shit throws out of the playbook,2.0,nfl,t3_yqxs1l,False,1.0,:Falcons: Falcons,2022-11-09T16:50:56Z,falcons,-0.5574
9998,107136,107136,SlopingGiraffe,They are but even dumber is the person that spent 8 bucks on a parody schefter account,3.0,nfl,t3_yqtn4i,False,0.0,:Falcons: Falcons,2022-11-09T13:57:16Z,falcons,-0.5023
9999,107137,107137,SlopingGiraffe,He really inspired the hell out of that best defense in the league and deadly run game. Couldn't have done it without him,7.0,nfl,t3_yqswol,False,0.0,:Falcons: Falcons,2022-11-09T13:35:41Z,falcons,0.12885
10000,107138,107138,SlopingGiraffe,It'd be kind of a sick joke to make about a random dead guy,72.0,nfl,t3_yqnc05,False,0.0,:Falcons: Falcons,2022-11-09T10:57:38Z,falcons,-0.7506
10001,107139,107139,SlopingGiraffe,"My favorite Tarvaris Jackson story is when he pointed a gun to his wifes head and threatened to kill her she said “You better be accurate, because you ain’t accurate on the field.”",204.0,nfl,t3_yqnc05,False,0.0,:Falcons: Falcons,2022-11-09T10:47:56Z,falcons,-0.6369
10002,107140,107140,SlopingGiraffe,It's pretty easy to control the result when you set the parameters,37.0,nfl,t3_yqo3kd,False,0.0,:Falcons: Falcons,2022-11-09T10:41:11Z,falcons,0.7269
10003,107141,107141,SlopingGiraffe,I'm a chaos enjoyer,40.0,nfl,t3_yqnc05,False,0.0,:Falcons: Falcons,2022-11-09T10:15:07Z,falcons,-0.128
10004,107143,107143,SlopingGiraffe,Saying a guy is in hot water because there's like 10 tweets calling him a dumbass might be editorializing a little bit,35.0,nfl,t3_ypylzw,False,0.0,:Falcons: Falcons,2022-11-08T15:12:15Z,falcons,-0.2732
10005,107144,107144,SlopingGiraffe,"Taysom Hill, he's probably the only one that plays all of those positions",131.0,nfl,t3_ypwy1l,False,0.0,:Falcons: Falcons,2022-11-08T14:07:03Z,falcons,0.25
10006,107145,107145,SlopingGiraffe,I mean you could say that about a lot of teams. Drafting is really hard,6.0,nfl,t3_ypwjvh,False,0.0,:Falcons: Falcons,2022-11-08T13:56:41Z,falcons,-0.08805
10007,107147,107147,SlopingGiraffe,He already was a consultant for them when they struggled,5.0,nfl,t3_ypt43r,False,0.0,:Falcons: Falcons,2022-11-08T11:55:52Z,falcons,-0.34
10008,107148,107148,SlopingGiraffe,"Offensive coordinator – [Kyle Shanahan](https://en.m.wikipedia.org/wiki/Kyle_Shanahan)

Quarterbacks – [Matt LaFleur](https://en.m.wikipedia.org/wiki/Matt_LaFleur)

Assistant head coach/wide receivers – [Raheem Morris](https://en.m.wikipedia.org/wiki/Raheem_Morris)

Running backs – [Bobby Turner](https://en.m.wikipedia.org/wiki/Bobby_Turner)

Tight ends – [Wade Harman](https://en.m.wikipedia.org/wiki/Wade_Harman)

Offensive line – [Chris Morgan](https://en.m.wikipedia.org/w/index.php?title=Chris_Morgan_(American_football\)&action=edit&redlink=1)

Assistant offensive line – [Keith Carter](https://en.m.wikipedia.org/wiki/Keith_Carter_(American_football\))

Offensive assistant – [Mike LaFleur](https://en.m.wikipedia.org/wiki/Mike_LaFleur)

Offensive assistant – [Mike McDaniel](https://en.m.wikipedia.org/wiki/Mike_McDaniel)

That staff was unbelievably loaded",1013.0,nfl,t3_yppyj7,False,0.0,:Falcons: Falcons,2022-11-08T09:58:52Z,falcons,-0.9349
10009,107149,107149,SlopingGiraffe,guess who was on that offensive staff,1209.0,nfl,t3_yppyj7,False,0.0,:Falcons: Falcons,2022-11-08T09:50:49Z,falcons,-0.4588
10010,107150,107150,SlopingGiraffe,"The argument isn't that turf is the root cause, the argument is that it's contributing to injuries that happen less on natural grass. It doesn't have to be an even distribution at all, the injuries are not caused by the turf exclusively

You would know that if you just looked it up instead of doubling down on something you haven't even bothered googling",12.0,nfl,t3_yppcm5,False,0.0,:Falcons: Falcons,2022-11-08T09:47:20Z,falcons,0.016225
10011,107151,107151,SlopingGiraffe,"""I refuse to acknowledge the well documented Correlation because I don't really notice it""",29.0,nfl,t3_yppcm5,False,0.0,:Falcons: Falcons,2022-11-08T09:29:25Z,falcons,-0.0258
10012,107152,107152,SlopingGiraffe,The O and D lines are surprisingly weak,1.0,nfl,t3_ypl332,False,0.0,:Falcons: Falcons,2022-11-08T06:49:56Z,falcons,-0.1779
10013,107153,107153,SlopingGiraffe,Lottery draft hasn't done anything to prevent tanking in the NBA,25.0,nfl,t3_ypki0k,False,0.0,:Falcons: Falcons,2022-11-08T06:31:02Z,falcons,0.0258
10014,107155,107155,SlopingGiraffe,"Good, absolute. Best of all time? Yeah I don't know about that one",33.0,nfl,t3_yp7jpj,False,0.0,:Falcons: Falcons,2022-11-07T20:00:23Z,falcons,0.1857444444444444
10015,107156,107156,SlopingGiraffe,Does he sound as drunk as these tweets make him look,129.0,nfl,t3_yp7vpw,False,0.0,:Falcons: Falcons,2022-11-07T19:56:41Z,falcons,-0.34
10016,107157,107157,SlopingGiraffe,Complete nonsense at all levels in indy at the moment,407.0,nfl,t3_yp7ri4,False,0.0,:Falcons: Falcons,2022-11-07T19:50:07Z,falcons,-0.4019
10017,107159,107159,SlopingGiraffe,">A lot of players come from poor backgrounds

This is true

> and did have to work part time at a young age

This is made up. Some did, sure. A lot of them did not. 

> Also the criticism you get as a retail worker or in your office job is not comparable to the criticism athletes get lmao. Your social media pages arent flooded with hate (and sometimes your family’s) and threats.

Yeah neither is the compensation or the praise",32.0,nfl,t3_yp75ro,False,0.0,:Falcons: Falcons,2022-11-07T19:41:58Z,falcons,0.1171276920438957
10018,107160,107160,SlopingGiraffe,No nerds and no pussies allowed - Jim Irsay,633.0,nfl,t3_yp7cgx,False,0.0,:Falcons: Falcons,2022-11-07T19:31:54Z,falcons,-0.5267
10019,107161,107161,SlopingGiraffe,"Hopefully someone followed up with ""what experience specifically does he have""",21.0,nfl,t3_yp78uc,False,0.0,:Falcons: Falcons,2022-11-07T19:26:55Z,falcons,0.4019
10020,107162,107162,SlopingGiraffe,"every once in a while players make comments that make it extremely obvious they have never worked a normal job a day in their lives

Thinking being corrected by strangers is exclusive to athletes is one of those",124.0,nfl,t3_yp75ro,False,0.0,:Falcons: Falcons,2022-11-07T19:23:46Z,falcons,0.128
10021,107163,107163,SlopingGiraffe,I for one embrace the full on nepotism chaos crash and burn the Colts are doing,7.0,nfl,t3_yp6bz0,False,0.0,:Falcons: Falcons,2022-11-07T18:45:18Z,falcons,-0.6249
10022,107166,107166,SlopingGiraffe,"Well to be fair it's not like they have cameras all around the stadium that could easily map out the place and find the location of the ball with a simple program....

Oh wait",60.0,nfl,t3_yp3ifz,False,0.0,:Falcons: Falcons,2022-11-07T16:58:56Z,falcons,0.5705
10023,107167,107167,SlopingGiraffe,"PJ walker threw the longest pass in nfl history against us and would have won the game with it if his kicker didn't miss

This is a try to win move, not a tanking move",0.0,nfl,t3_yp1zsc,False,0.0,:Falcons: Falcons,2022-11-07T16:05:54Z,falcons,0.8378
10024,107168,107168,SlopingGiraffe,How the fuck are we ever gonna get xmen if the nfl keeps doing this shit,199.0,nfl,t3_yp0f5v,False,0.0,:Falcons: Falcons,2022-11-07T15:08:17Z,falcons,-0.8294
10025,107171,107171,SlopingGiraffe,Sure doesn't seem like they're losing despite of his efforts,3.0,nfl,t3_yow4cq,False,0.0,:Falcons: Falcons,2022-11-07T12:43:31Z,falcons,-0.3421
10026,107172,107172,SlopingGiraffe,Give Jim Irsay a piss test before he announces the interim HC,30.0,nfl,t3_yow4lb,False,0.0,:Falcons: Falcons,2022-11-07T12:42:57Z,falcons,-0.4019
10027,107173,107173,SlopingGiraffe,Mark Davis can't afford to pay 3 coaches 100 mill over the next 5 years,49.0,nfl,t3_yosbp4,False,0.0,:Falcons: Falcons,2022-11-07T10:43:20Z,falcons,0.0762
10028,107174,107174,SlopingGiraffe,Nothing says a coach is getting fired soon more than an owner publicly stating that they're not being fired,75.0,nfl,t3_yosbp4,False,0.0,:Falcons: Falcons,2022-11-07T10:36:46Z,falcons,-0.1719
10029,107175,107175,SlopingGiraffe,We all saw it coming after Irsay gave him the kiss of death and publicly stated that he believes in him,4254.0,nfl,t3_yos85f,False,0.0,:Falcons: Falcons,2022-11-07T10:32:21Z,falcons,-0.6124
10030,107177,107177,SlopingGiraffe,The titans and chiefs really don't like each other,5.0,nfl,t3_yo9k43,False,0.0,:Falcons: Falcons,2022-11-06T20:00:08Z,falcons,-0.3374
10031,107178,107178,SlopingGiraffe,That's hard man,8.0,nfl,t3_yo9k43,False,0.0,:Falcons: Falcons,2022-11-06T19:59:03Z,falcons,-0.1027
10032,107179,107179,SlopingGiraffe,"Mina Kimes said it best

The Chargers just Chargered there and the Falcons responded by Falconing",167.0,nfl,t3_yo2ek5,False,0.0,:Falcons: Falcons,2022-11-06T14:54:42Z,falcons,0.6369
10033,107180,107180,SlopingGiraffe,Falcons damn near Falconed whew,2.0,nfl,t3_yo1tkw,False,0.0,:Falcons: Falcons,2022-11-06T14:34:39Z,falcons,-0.4019
10034,107181,107181,SlopingGiraffe,So they offered less value than the bears,97.0,nfl,t3_ynn3gp,False,0.0,:Falcons: Falcons,2022-11-06T05:27:17Z,falcons,0.2748
10035,107182,107182,SlopingGiraffe,You don't think part of the issue is that you're going out of your way to try to force people to say nice things about them?,13.0,nfl,t3_yng70l,False,0.0,:Falcons: Falcons,2022-11-05T23:19:39Z,falcons,0.4215
10036,107184,107184,SlopingGiraffe,"They are above average when they play 10 snaps per game


Now they have to start",79.0,nfl,t3_ymzzz5,False,0.0,:Falcons: Falcons,2022-11-05T13:16:23Z,falcons,0.34
10037,107185,107185,SlopingGiraffe,"That's okay, our CBs are gonna be Darren Hall, Isaiah Oliver, Dee Alford and Cornell Armstrong",212.0,nfl,t3_ymzzz5,False,0.0,:Falcons: Falcons,2022-11-05T12:13:42Z,falcons,0.2263
10038,107186,107186,SlopingGiraffe,I always saw Kamara as more of an offender,1094.0,nfl,t3_ymvrm6,False,0.0,:Falcons: Falcons,2022-11-05T09:40:00Z,falcons,-0.4144
10039,107187,107187,SlopingGiraffe,There's a bigger chance you fuck up a snap exchange if it's snapped 15 yards. You're risking turnovers,7.0,nfl,t3_ym8og3,False,0.0,:Falcons: Falcons,2022-11-04T14:59:08Z,falcons,-0.2494
10040,107188,107188,SlopingGiraffe,"QBR is an efficiency stat, nothing else. His QBR is high because he gets asked to throw a whole lot less than his peers. More throws = Harder to be efficient",5.0,nfl,t3_ym0i23,False,0.0,:Falcons: Falcons,2022-11-04T11:31:36Z,falcons,0.1538777777777777
10041,107189,107189,SlopingGiraffe,"preaching to the choir man. We all want them to pass the ball more, but we all (at least most of us) just also know that Mariota sucks ass.",14.0,nfl,t3_ym0i23,False,0.0,:Falcons: Falcons,2022-11-04T10:59:36Z,falcons,-0.4169
10042,107190,107190,SlopingGiraffe,Because they run the ball and he's not the best run blocking tight end on the roster lol,14.0,nfl,t3_ym0i23,False,0.0,:Falcons: Falcons,2022-11-04T10:26:58Z,falcons,-0.4885
10043,107191,107191,SlopingGiraffe,"To an extent sure, but it's definitely as much by design as it is anything else.

 Smith is extremely stubborn rubbing the ball",22.0,nfl,t3_ym0i23,False,0.0,:Falcons: Falcons,2022-11-04T09:38:58Z,falcons,-0.069575
10195,109520,109520,Superbadd,dude loves to shit on the falcons about the super bowl. Steeler fans are so entitled man it’s wild,13.0,falcons,t3_ymvura,False,0.0,helmetblack,2022-11-05T11:50:27Z,falcons,0.35815
10385,110422,110422,Suqqa_Madiq,"Not a ravens fan but I was so high on Lamar, seemed like a generational talent. Yes he's made good passes in his career but he's VASTLY underdelivered so far. What's the odds you trade him while his value is still there. I don't think he's worth a first but his draft selection may give the illusion he is",3.0,falcons,t3_yoprtl,False,0.0,I miss Pat :(,2022-11-07T10:24:44Z,falcons,0.009362890625
10386,110423,110423,Suqqa_Madiq,"We literally stickied the Koo video last week. We sticky dumb shit all the time. We will continue to sticky dumb shit, because this is an online forum, not some corporate discussion board. This place is meant to be fun.

Also your comment pretty clearly implied you wanted it removed. 
>These are just some of the rules of the subreddit you moderate...maybe do your fucking job as a mod instead of stickying it to the top of the subreddit",4.0,falcons,t3_yo3kx6,False,0.0,I miss Pat :(,2022-11-06T21:00:35Z,falcons,0.0550854552469135
10387,110425,110425,Suqqa_Madiq,"Let's break this down.

> toxic troll

He's not toxic, or a troll. He posted this in the discord and a bunch of us laughed, so I told him to post it here.

>posts a low content post

This is not something that would fall under low content. Low content is to prevent stuff like title only posts or things that would be better suited as a comment in a GDT or PGT.

>calling one of our own players a clown

Bro if I removed every comment that could be taken as a personal attack against a player, there wouldn't be a subreddit. We have [this](https://www.reddit.com/r/falcons/comments/yo4iyk/i_fucking_hate_jonathan_vilma/) which could be taken as a personal attack against Vilma. We have [this](https://www.reddit.com/r/falcons/comments/yo2q78/mf_fumbled_a_fumble/) which is also making fun of Graham, and also has tons of comments going after him. And lord knows theres 87 posts about hating Mariota, shit there's even been posts specifically calling him a clown. 

This was something made in jest, not an actual attack like most other posts.

>maybe do your fucking job

As for this, this really doesn't warrant this kind of response. You want to have a constructive conversation about the state of the subreddit or the rules? You guys can always DM me about it, just can't make any promises about a quick response. But this? This doesn't accomplish anything but further spreading toxicity. Really doesn't warrant the shots like that.",-3.0,falcons,t3_yo3kx6,False,1.0,I miss Pat :(,2022-11-06T20:37:55Z,falcons,0.0219085047097507
10388,110426,110426,Suqqa_Madiq,"Because it's a meme bro, it isn't that deep. You guys are getting super pissy over a joke that really doesn't mean that much.",-16.0,falcons,t3_yo3kx6,False,0.0,I miss Pat :(,2022-11-06T18:15:28Z,falcons,0.36345
10834,112172,112172,Sure_Whatever__,"Either way, does it matter? 
 
Would you rather have Watson masturbate in front of you with jizz to clothing contact or have Kamara come at you, punching you in the face, with all the rage and intent to harm he showed in the video?",1.0,nfl,t3_ymo1ur,False,0.0,:Falcons: Falcons,2022-11-05T19:37:37Z,falcons,-0.39175
10835,112177,112177,Sure_Whatever__,"You've really can move that responsibility onus around like a gymnasts. 
 
* The child grew up with absent yet good parents
 
* The child friends were bad influences 
 
* The Parents can be good, yet child just bad
 
We've gone full circle.
 
At the end of the day, if a 17yr is out shooting people the onus is on him.  And most likely the parenting. I mean if your teenager is out running the streets, killing at such a young age then you're not doing your job as a parent.
 
And being loving & caring does not equate to good parenting, per se.
 
A lady with a tiny dog that bits everyone could very well be loving and caring parent but their blind eye, or lack of concern in correcting such behavior highlights a lack of ""good"" parenting.",1.0,nfl,t3_ymcn2w,False,0.0,:Falcons: Falcons,2022-11-05T12:51:31Z,falcons,0.0040076099244362
10836,112178,112178,Sure_Whatever__,Talented Roster w/ Shit Coaching vs Shit Roster w/ Talented Coaching...  Can't wait!,1.0,nfl,t3_ym4aq4,False,0.0,:Falcons: Falcons,2022-11-05T10:56:31Z,falcons,-0.2244
10837,112179,112179,Sure_Whatever__,"No you placed the blame here:
 
> Might have good parents but... **aren’t around as much as needed**
 
This is blaming the child's upbringing for their actions.  Which can be true but baring any mental issues, if someone's parenting results in a violent child that terrorizes others then ""good"" is hardly the word I'd use to describe said parenting method.",1.0,nfl,t3_ymcn2w,False,0.0,:Falcons: Falcons,2022-11-05T10:38:33Z,falcons,-0.5738
10838,112180,112180,Sure_Whatever__,"So first you put the onus on the lack of parenting and now you put the onus on the friends.

When is the onus ever on the individual at hand for what they did?",2.0,nfl,t3_ymcn2w,False,0.0,:Falcons: Falcons,2022-11-05T09:49:57Z,falcons,0.297525
10839,112181,112181,Sure_Whatever__,"> Might have good parents but they both work multiple jobs and aren’t around as much as needed.

Long story short, my parents were great and worked a combined 6 jobs. 2 full-time and 4 part-time.  Holidays (Thanksgiving/Christmas) were done in the 1-2hr between their shifts.  Sometimes we spent the whole holiday but said hour on our own. 
 
We didn't go beating people up.  
 
Such violent tenancies come from a ""fuck life"" or ""try me"" mindset.  And having working parents doesn't naturally nurture such notions.",5.0,nfl,t3_ymcn2w,False,0.0,:Falcons: Falcons,2022-11-05T09:01:11Z,falcons,-0.0442353018403053
10840,112182,112182,Sure_Whatever__,"> One is punching somebody and the other is sexually assaulting
 
While I get what you're saying, context matters.  
 
You wouldn't say that violent acts of aggression are less serious than lewd acts of indecency would you? 
 
If you had to be on receiving in of either an impromptu Watson masturbation moment where some of his nut lands on your pants or a Kamara face-fracturing, beat down, which would you opt for?",2.0,nfl,t3_ymo1ur,False,1.0,:Falcons: Falcons,2022-11-05T08:40:41Z,falcons,0.0078851851851851
10935,115804,115804,Thatguywhowantstoget,"Hahaha, just had to laugh at that",4.0,falcons,t3_ynvs08,False,0.0,:2:,2022-11-06T14:52:48Z,falcons,0.802
11786,119718,119718,TheRayATL,We really hoping for a missed kick again lol,8.0,falcons,t3_ynvs08,False,0.0,:Juliostare:,2022-11-06T14:50:32Z,falcons,0.5709
11787,119719,119719,TheRayATL,Nice!,1.0,falcons,t3_yn5iss,False,0.0,:Juliostare:,2022-11-05T16:20:46Z,falcons,0.4753
11788,119720,119720,TheRayATL,Return of Jalen Mayfield? Lmao,34.0,falcons,t3_yn5iss,False,0.0,:Juliostare:,2022-11-05T15:40:54Z,falcons,0.2997
12069,121081,121081,Thecrimsoncreampuff,Oh shit,3.0,falcons,t3_ypsj0n,False,0.0,Avery Williams,2022-11-08T18:41:12Z,falcons,-0.5574
12070,121083,121083,Thecrimsoncreampuff,Except the offensive talent has been mediocre this year,7.0,falcons,t3_ynhnsd,False,0.0,Avery Williams,2022-11-06T10:32:53Z,falcons,-0.0516
12071,121084,121084,Thecrimsoncreampuff,I miss him,1.0,falcons,t3_yncz3p,False,0.0,Avery Williams,2022-11-05T21:53:11Z,falcons,-0.1531
12072,121085,121085,Thecrimsoncreampuff,He’s their 4th option in the passing game it’s gonna be hard to produce to his contract,1.0,falcons,t3_ymt5fp,False,0.0,Avery Williams,2022-11-05T18:20:45Z,falcons,-0.1027
13102,125016,125016,TyGuy69420,I feel like Jeff Saturday didnt even know that was coming. He's just watching ESPN is like I'm what now?,16.0,nfl,t3_youfdn,False,0.0,:Falcons: Falcons,2022-11-07T13:53:15Z,falcons,0.2709
13187,125663,125663,VanJesus,Lmao I did what he asked but okay buddy love you too,1.0,nfl,t3_yn69hs,False,0.0,:Falcons: Falcons,2022-11-06T13:27:31Z,falcons,0.891
13188,125664,125664,VanJesus,Yes,1.0,nfl,t3_yn69hs,False,0.0,:Falcons: Falcons,2022-11-06T13:25:49Z,falcons,0.4019
13189,125665,125665,VanJesus,"Well I don’t think you want to look down that avenue, Kirk Cousins first pass attempt was his rookie year, in week 5, it was 3,675 days until he got 3,000 completions. Matthew Stanford’s first completion was week 1 of his rookie year, it was 3,031 days, it took Cousins 1 year, and 279 days longer. Cousins first full season wasn’t until his 4th year, but like you said it should be based on the calendar 👍.",0.0,nfl,t3_yn69hs,False,0.0,:Falcons: Falcons,2022-11-06T01:43:46Z,falcons,0.1800259259259259
13190,125666,125666,VanJesus,"Firstly, I would like to start out by saying I do give a shit about your day, I hope it was good. Fewest attempts literally doesn’t translate to fastest. Maybe they throw the ball a lot less (therefore taking longer), maybe he had 1 completion a game and it took 3,000 games. Least amount of games to 3,000, now that’s fast, youngest ever to 3,000, now that’s fast. Now how am I supposed to know that nobody wants information, am I psychic, no. I saw a question, did research, found an answer, gave the answer. To me it seemed like the OP did indeed want information, he was actively asking a question and seeking answers. But hey what do I know 🤷‍♂️. I hope you have a great day tomorrow buddy, and good luck to the Vikings.",-6.0,nfl,t3_yn69hs,False,0.0,:Falcons: Falcons,2022-11-06T00:49:10Z,falcons,0.1027349809000421
13191,125667,125667,VanJesus,"Well you know what they say, bad karma gets you bad karma. I was just dishing out to you what you were dishing out to me buddy, because you were being combative. No I was not being snarky or pretentious, I was stating undeniable facts that are as a matter of fact true statements. Unless we find a Time Machine and use it to get Cousins there in fewer games, and at a younger age the facts will never change. I can’t change the truth but I can speak about it. Goodnight buddy I hope you have sweet dreams, don’t let the bed bugs bite. And enjoy the games tomorrow I hope you guys win.",-2.0,nfl,t3_yn69hs,False,0.0,:Falcons: Falcons,2022-11-06T00:43:35Z,falcons,0.1418493733781964
13192,125668,125668,VanJesus,"“Is Kirk Cousins’s 3,000 completions on only 4,487 pass attempts the new “fastest” to 3k completions?” Fastest does not translate to fewest attempts, he does clarify later in his second question that he was referring to fewest attempts, but I came here specifically to answer the question in the title, and to point out that no he was not indeed the “fastest”. And, unless you're severely mentally handicapped(this one is you) or pretending to not understand on purpose I can come here and address one question and not both.",-11.0,nfl,t3_yn69hs,False,0.0,:Falcons: Falcons,2022-11-06T00:39:31Z,falcons,-0.2962749999999999
13193,125669,125669,VanJesus,"Combative? This is two people having a logical conversation, I’m not sure either of us are being combative, but if one of us is I would say it’s you, seeing as your responses have not put forth anything useful to the conversation and you’re downvoting everything i post. If having logical conversations is weird then I’m sorry. We can speak gibberish if you prefer, let me know bud. xoxo. Maybe try reading my responses in a less aggressive voice in your head. I’m sure that the tone you’re projecting of my comments is why you’re seeing them as combative. I hope you have a great day, friend.",-3.0,nfl,t3_yn69hs,False,0.0,:Falcons: Falcons,2022-11-06T00:34:52Z,falcons,0.1150538849830627
13194,125670,125670,VanJesus,"“Is Kirk Cousins’s 3,000 completions on only 4,487 pass attempts the new “fastest” to 3k completions?“

I answered the first of two questions. Question clearly states “fastest”",-21.0,nfl,t3_yn69hs,False,0.0,:Falcons: Falcons,2022-11-06T00:29:09Z,falcons,0.20095
13195,125671,125671,VanJesus,"You literally answered no question, you said “this just means they threw the ball more” Fastest to 3,000 completions, no. Youngest to 3,000 completions, no by a long shot, matthew Stanford was *5 years* younger when he hit 3,000 completions. Least attempts to 3,000 completions, yes ✅.",-5.0,nfl,t3_yn69hs,False,0.0,:Falcons: Falcons,2022-11-06T00:26:05Z,falcons,0.0901148148148148
13196,125672,125672,VanJesus,"It also answers the question, no he was not the fastest. He may have needed the least amount of attempts, but again, I was answering the question.",-22.0,nfl,t3_yn69hs,False,0.0,:Falcons: Falcons,2022-11-06T00:17:42Z,falcons,-0.074
13820,134104,134104,atheist_x,Thanks for sharing this! I am rolling!,21.0,nfl,t3_yppzs0,False,0.0,:Falcons: Falcons,2022-11-08T14:42:07Z,falcons,0.179425
14217,144640,144640,captaincampbell42,FREE MATT RYAN,1.0,nfl,t3_yos85f,False,0.0,:Falcons: Falcons,2022-11-07T16:52:55Z,falcons,0.5106
14281,148420,148420,coreynj2461,No kicker is going to go perfect for the season. Wasnt Koos fault,39.0,falcons,t3_yo4qmw,False,0.0,Get Fucking Set!,2022-11-06T18:10:14Z,falcons,0.24475
14282,148423,148423,coreynj2461,New Jersey fan here. For Vick. After he got in trouble I just decided to stick with the team.,1.0,falcons,t3_yn7kjm,False,0.0,Get Fucking Set!,2022-11-06T07:39:25Z,falcons,-0.1221814814814814
14379,148785,148785,d1dOnly,We are missing our #1 & #2 CBs and the pass rush has been bad since...(google's when Abraham left)...2013.,1.0,nfl,t3_ynwlod,False,0.0,:Falcons: Falcons,2022-11-06T13:22:12Z,falcons,-0.6908
14380,148786,148786,d1dOnly,"Arthur Smith. Considering our rosters last year and this year, we are very happy with Smith.",3.0,nfl,t3_ynwlod,False,0.0,:Falcons: Falcons,2022-11-06T12:06:25Z,falcons,0.30575
