,Unnamed: 0.1,Unnamed: 0,author,body,score,subreddit,link_id,over_18,controversiality,author_flair_text,created_utc,flair,sentiment
14381,148787,148787,d1dOnly,Seems both Chargers and Falcons fans are expecting a loss today.,5.0,nfl,t3_ynwlod,False,0.0,:Falcons: Falcons,2022-11-06T11:54:14Z,falcons,-0.3182
14382,148788,148788,d1dOnly,"Chargers have no WRs, Falcons have no CBs. This game is what happens when a stoppable force meets a movable object.",5.0,nfl,t3_yno8k2,False,0.0,:Falcons: Falcons,2022-11-06T07:11:37Z,falcons,-0.131675
15258,157700,157700,endofautumn,Perfect. The comment and the TD.,29.0,nfl,t3_yo0sze,False,0.0,:Falcons: Falcons,2022-11-06T14:04:46Z,falcons,0.142975
15776,161431,161431,gamers542,Because unfortunately a lot in the media don't care about his off field issues. Just the football.,20.0,nfl,t3_ypnsxf,False,0.0,:Falcons: Falcons,2022-11-08T12:19:08Z,falcons,-0.153975
15777,161433,161433,gamers542,The bright side is that the AFC South is the Titans one to lose.,2.0,nfl,t3_yod5o7,False,0.0,:Falcons: Falcons,2022-11-07T06:09:55Z,falcons,0.0516
16089,164555,164555,hogaway,Skip Bayless: allow me to introduce myself,11.0,nfl,t3_yr4cel,False,0.0,:Falcons: Falcons,2022-11-09T23:01:51Z,falcons,0.2263
16090,164557,164557,hogaway,Yes,5.0,falcons,t3_yr1rjp,False,0.0,AJ Terrelldactyl,2022-11-09T21:10:55Z,falcons,0.4019
16091,164561,164561,hogaway,Tbf the Patriots sacked Ehlinger 9 times. They lowkey saved him,7.0,falcons,t3_yprpc3,False,0.0,AJ Terrelldactyl,2022-11-08T11:18:06Z,falcons,0.21075
16092,164564,164564,hogaway,Which is why I'm surprised Jewish team owners haven't been more outspoken. Maybe because they're billionaires? I'm from the UK and the idea of antisemitism has always seemed outdated to me until these current events,1.0,nfl,t3_yp4ybg,False,0.0,:Falcons: Falcons,2022-11-07T18:51:54Z,falcons,0.0083814814814814
16093,164565,164565,hogaway,Apparently the anti-hate messages on helmets and in endzones don't apply to Jews. I'm honestly surprised there's been hardly any supportive dialogue about it,18.0,nfl,t3_yp4ybg,False,0.0,:Falcons: Falcons,2022-11-07T18:06:01Z,falcons,0.3512
16094,164566,164566,hogaway,>We're digging into deep pass attempts (passes of 20-plus air yards) to determine who was the best at heaving the ball downfield in 2021,2.0,falcons,t3_yoh7zk,False,0.0,AJ Terrelldactyl,2022-11-07T16:28:08Z,falcons,0.6369
16095,164567,164567,hogaway,"[Next Gen Stats](https://www.nfl.com/news/next-gen-stats-top-10-nfl-deep-passers-of-2021-three-qbs-playing-for-new-teams-i) had Ryan as the second best deep passer last year, with a completion percentage of 47.6% (highest in the top 10 list) with a expected completion percentage of 29.9% (lowest in the top 10 list). So I'd say he was pretty accurate downfield

There are also these QB grids for [Ryan last year](https://nextgenstats.nfl.com/charts/player/2021/matt-ryan/RYA238179/2021/all/qb-grid) and [Mariota this year](https://nextgenstats.nfl.com/charts/player/2022/marcus-mariota/MAR186347/2022/all/qb-grid). Even I was shocked to see Mariota have a 0 passer rating in the deep middle versus Ryan's 139.2",13.0,falcons,t3_yoh7zk,False,0.0,AJ Terrelldactyl,2022-11-07T12:48:24Z,falcons,-0.0275999999999999
16096,164568,164568,hogaway,"I know Pitts is our sweet prince, but there were plenty of times last year when he just gave up on routes, and this year I keep seeing him jog at the top of his route. He needs it to be coached out of him.

Now I've never played football, but don't you hold the ball with your outside hand? I feel Drake would've had less chance of fumbling if he was smart and put the ball in his left hand. Maybe I'm telling myself that because it's easier to change than a hero complex.

As a Mariota 'supporter' even I have to admit he played poorly. No one played well in that game (other than maybe Oliver, Grady, and Pinion)",10.0,falcons,t3_youkhx,False,0.0,AJ Terrelldactyl,2022-11-07T12:27:32Z,falcons,-0.0244350758855336
16097,164569,164569,hogaway,"Surely this will be investigated for tanking, right?",7.0,nfl,t3_youjbg,False,0.0,:Falcons: Falcons,2022-11-07T12:03:59Z,falcons,0.4404
16098,164570,164570,hogaway,"I'd normally agree but this game was very winnable. No Bosa, JC Jackson, Keenan Allen, Mike Williams. Maybe the worst rushing defence versus our top 3 rushing attack",12.0,falcons,t3_yooj1i,False,0.0,AJ Terrelldactyl,2022-11-07T12:01:57Z,falcons,-0.2461111111111111
16099,164572,164572,hogaway,Any shot at offensive rookie of the year?,0.0,falcons,t3_yoelmc,False,0.0,AJ Terrelldactyl,2022-11-07T09:23:10Z,falcons,-0.4588
16100,164573,164573,hogaway,If he missed a 30 yarder with 3 seconds left then fair enough. But he missed a 50 yarder with 12 minutes left. Our offence and defence did nothing in those 12 minutes,1.0,falcons,t3_yo2n5v,False,0.0,AJ Terrelldactyl,2022-11-06T16:28:15Z,falcons,-0.1133111111111111
16101,164574,164574,hogaway,"That's a shit way to lose, but I'm seeing too many people blaming Koo for missing a 50 yard FG, or saying we should cut Graham when he's been solid and our only IDL besides Grady",4.0,falcons,t3_yo2n5v,False,0.0,AJ Terrelldactyl,2022-11-06T15:09:56Z,falcons,-0.9001
16102,164575,164575,hogaway,Mariota and Pitts have no chemistry,5.0,falcons,t3_ynvs08,False,0.0,AJ Terrelldactyl,2022-11-06T14:37:36Z,falcons,-0.296
16103,164576,164576,hogaway,I'm convinced Huntley has the fastest acceleration in the league,8.0,falcons,t3_ynvs08,False,0.0,AJ Terrelldactyl,2022-11-06T13:53:21Z,falcons,0.4019
16104,164578,164578,hogaway,AJ Terrell puts his body on the line in a lot of plays. I think last year he got a concussion and hurt his shoulder from landing funny when diving for PBUs. Also a physical tackler,1.0,nfl,t3_ymczrv,False,0.0,:Falcons: Falcons,2022-11-04T20:30:06Z,falcons,0.0035259259259259
16105,164579,164579,hogaway,Before this season I was excited having no expectations and just embracing the chaos. Turns out to be the most fun team in years AND we're competing,5.0,nfl,t3_ym0i23,False,0.0,:Falcons: Falcons,2022-11-04T20:23:39Z,falcons,0.142575
16106,164580,164580,hogaway,Falcons-Saints is such a rivalry we barely care about the other two teams,8.0,nfl,t3_ymas8p,False,0.0,:Falcons: Falcons,2022-11-04T17:37:03Z,falcons,0.4417
16107,164581,164581,hogaway,"When I heard of Ray Guy's passing, I wanted to see how Pinion was doing. I knew he was doing well but I was surprised to see he's been historically great for us. I hope he can stay a bit longer",2.0,falcons,t3_yljzm2,False,0.0,AJ Terrelldactyl,2022-11-04T12:30:45Z,falcons,0.2424444444444444
16350,167186,167186,iguanoman_,Proud to have allowed 3 of those,1.0,nfl,t3_yo7om6,False,0.0,:Falcons: Falcons :Lions: Lions,2022-11-06T19:56:45Z,falcons,0.4767
16351,167187,167187,iguanoman_,Shit like this is why team subs are no better than Twitter. Y'all are the real clowns,4.0,falcons,t3_yo3kx6,False,0.0,GET FUCKING SET,2022-11-06T19:19:44Z,falcons,-0.1358
16352,167189,167189,iguanoman_,"I am immune, sorry",4.0,nfl,t3_yo0g1v,False,0.0,:Falcons: Falcons :Lions: Lions,2022-11-06T13:44:32Z,falcons,0.2263
16353,167190,167190,iguanoman_,Drake with the noodle arms smh,2.0,nfl,t3_yo0g1v,False,0.0,:Falcons: Falcons :Lions: Lions,2022-11-06T13:43:59Z,falcons,-0.3182
16678,169314,169314,infiniteh00p,YES,1.0,nfl,t3_yos85f,False,0.0,:Falcons: Falcons,2022-11-07T14:15:13Z,falcons,0.4019
17016,179859,179859,kingbmj11,We got a steal in Allgier,6.0,nfl,t3_ynwlod,False,0.0,:Falcons: Falcons,2022-11-06T14:12:13Z,falcons,-0.4939
17377,186511,186511,mdmorris1703,Kiss Patterson on the lips,6.0,falcons,t3_yo2n5v,False,0.0,:Juliostare:,2022-11-06T15:03:28Z,falcons,0.4215
17378,186512,186512,mdmorris1703,Our game to win and Our game to lose lol,1.0,falcons,t3_yo2n5v,False,0.0,:Juliostare:,2022-11-06T15:02:19Z,falcons,0.5994
17379,186513,186513,mdmorris1703,I went from screaming yes to screaming no,2.0,falcons,t3_ynvs08,False,0.0,:Juliostare:,2022-11-06T14:51:47Z,falcons,-0.5719
17380,186516,186516,mdmorris1703,Fr all of the ones drafted are playing crazy for their teams,1.0,falcons,t3_ynvs08,False,0.0,:Juliostare:,2022-11-06T14:13:05Z,falcons,-0.1531
17381,186518,186518,mdmorris1703,Did someone just get hurt,9.0,falcons,t3_ynvs08,False,0.0,:Juliostare:,2022-11-06T14:03:26Z,falcons,-0.5267
17382,186520,186520,mdmorris1703,Put someone on Palmer please,2.0,falcons,t3_ynvs08,False,0.0,:Juliostare:,2022-11-06T12:47:46Z,falcons,0.3182
17941,192752,192752,nanowerx,"She didn't even run for Reelection because she knew she would have been slaughtered at the polls, nobody likes this obviously unrelatable woman.",10.0,falcons,t3_yp7pox,False,0.0,The Riddessance Cometh,2022-11-08T06:54:41Z,falcons,0.4215
17942,192753,192753,nanowerx,I have a feeling the winner of the NFC South will be determined on that final game with the Bucs.,2.0,falcons,t3_yopm17,False,0.0,The Riddessance Cometh,2022-11-07T11:25:56Z,falcons,0.3109
17943,192754,192754,nanowerx,"LMAO, I just rewatched The Longest Yard a few days ago, such a good movie, one of Adam Sandlers best",3.0,falcons,t3_yontfl,False,0.0,The Riddessance Cometh,2022-11-07T11:21:31Z,falcons,0.9141
17944,192755,192755,nanowerx,"Yes, Carolina just out-Falconed us",2.0,falcons,t3_yo307s,False,0.0,The Riddessance Cometh,2022-11-06T18:07:52Z,falcons,0.4019
17945,192756,192756,nanowerx,"Yeah, let me check out a spreadsheet instead of my own fucking eyes every week 🙄

He throws 'average' because 90% of our passing plays is just slants and dumping it off for short gains. When it matters he cannot throw for shit and is a terrible QB",2.0,falcons,t3_yo2n5v,False,0.0,The Riddessance Cometh,2022-11-06T15:30:01Z,falcons,0.11785
17946,192757,192757,nanowerx,Nobody cares what capeshit movie you are going to see while the Falcons play Thursday.,2.0,falcons,t3_yo2n5v,False,0.0,The Riddessance Cometh,2022-11-06T15:26:26Z,falcons,0.6597
17947,192758,192758,nanowerx,"We didn't have to run it all the way down, just run out the clock, get it in fieldgoal range then hope Koo corrected himself. Instead they make back to back deep passes that Mariota had been overthrowing the entire game and gave them back the ball with 4 minutes to play with.",1.0,falcons,t3_yo2n5v,False,0.0,The Riddessance Cometh,2022-11-06T15:19:35Z,falcons,0.2801
17948,192759,192759,nanowerx,All we can do is hope for a missed field goal 🙏,6.0,falcons,t3_ynvs08,False,0.0,The Riddessance Cometh,2022-11-06T14:48:48Z,falcons,0.1779
17949,192760,192760,nanowerx,"Jesus Christ, STOP DRAWING UP PLAYS WHERE MARIOTA  HAS TO THROW MORE THAN 7 YARDS DOWNFIELD!!!",3.0,falcons,t3_ynvs08,False,0.0,The Riddessance Cometh,2022-11-06T14:37:02Z,falcons,-0.0496
17950,192761,192761,nanowerx,"Ugh, if London goes down instead of getting stripped and Koo makes that FG, I would be a lot less nervous going into these final minutes",11.0,falcons,t3_ynvs08,False,0.0,The Riddessance Cometh,2022-11-06T14:33:38Z,falcons,-0.5584
17951,192762,192762,nanowerx,"I don't know what the hell happened that 2nd quarter, but man this team is just full of fire for the other 3",2.0,falcons,t3_ynvs08,False,0.0,The Riddessance Cometh,2022-11-06T14:15:26Z,falcons,-0.7096
17952,192763,192763,nanowerx,"That 2nd quarter sucked ass, but momentum has noticeably shifted. Hopefully we keep running the ball and running the clock",2.0,falcons,t3_ynvs08,False,0.0,The Riddessance Cometh,2022-11-06T14:03:15Z,falcons,0.075375
17953,192764,192764,nanowerx,Falcons making sure you watch every last minute of the game,3.0,falcons,t3_ynvs08,False,0.0,The Riddessance Cometh,2022-11-06T13:49:27Z,falcons,0.3182
17954,192765,192765,nanowerx,😬,4.0,falcons,t3_ynvs08,False,0.0,The Riddessance Cometh,2022-11-06T13:41:05Z,falcons,-0.34
17955,192766,192766,nanowerx,Chargers QB has no problem getting rid of the ball on half second blitzes....,0.0,falcons,t3_ynvs08,False,0.0,The Riddessance Cometh,2022-11-06T13:23:51Z,falcons,0.3089
17956,192767,192767,nanowerx,Guess you missed all the comments praising him on that first drive...,3.0,falcons,t3_ynvs08,False,0.0,The Riddessance Cometh,2022-11-06T12:40:32Z,falcons,0.3182
17957,192768,192768,nanowerx,Crazy how this absolute stud has been passed around the NFL.,2.0,falcons,t3_ynvs08,False,0.0,The Riddessance Cometh,2022-11-06T12:34:14Z,falcons,-0.34
17958,192769,192769,nanowerx,Or a good QB that you could trust to throw the ball on more than a slant when you needed them to...,9.0,falcons,t3_ylzvq3,False,0.0,The Riddessance Cometh,2022-11-04T15:37:52Z,falcons,0.7351
18343,194756,194756,nerdyintentions,"He's still on the board but he's no longer CEO so he's less involved in the day to day.

But why would Amazon have to give it up TNF regardless? It's just a broadcast deal. The NFL controls the schedule and everything related to the game. Amazon just broadcasts it. What advantage would the Commanders have because of this?",1.0,nfl,t3_yl7vfv,False,0.0,:Falcons: Falcons,2022-11-04T11:01:18Z,falcons,0.0466329539609053
18400,196906,196906,nusm,"According to Vilma, there are a number of grown men on the field.",4.0,falcons,t3_ynvs08,False,0.0,#10 Bartkowski,2022-11-06T13:55:46Z,falcons,0.0772
18401,196907,196907,nusm,"Sorry, he’s still busy looking for the real killer. 🙄",4.0,falcons,t3_ynvs08,False,0.0,#10 Bartkowski,2022-11-06T13:49:11Z,falcons,-0.1702
18402,196909,196909,nusm,"Man, Algiers is a hard runner",2.0,falcons,t3_ynvs08,False,0.0,#10 Bartkowski,2022-11-06T13:41:14Z,falcons,-0.1027
18403,196911,196911,nusm,Alright let’s answer with a scoring drive to end the half,5.0,falcons,t3_ynvs08,False,0.0,#10 Bartkowski,2022-11-06T12:53:06Z,falcons,0.25
18404,196912,196912,nusm,"“Remember that Jonathan?”

Ha ha ha!",5.0,falcons,t3_ynvs08,False,0.0,#10 Bartkowski,2022-11-06T12:36:25Z,falcons,0.6239
18405,196915,196915,nusm,52 seconds left in the 1st quarter and the Chargers have run 3 plays.,4.0,falcons,t3_ynvs08,False,0.0,#10 Bartkowski,2022-11-06T12:30:44Z,falcons,0.25
18406,196919,196919,nusm,It’s beautiful to see everything working!,2.0,falcons,t3_ynvs08,False,0.0,#10 Bartkowski,2022-11-06T12:19:32Z,falcons,0.636
18407,196920,196920,nusm,I hope they get a win for you!,2.0,falcons,t3_ynvs08,False,0.0,#10 Bartkowski,2022-11-06T12:16:57Z,falcons,0.7901
18408,196921,196921,nusm,Not a fan of the solid black. I like the white pants with the black jerseys a lot better.,2.0,falcons,t3_ynvs08,False,0.0,#10 Bartkowski,2022-11-06T12:04:05Z,falcons,0.306575
19258,211684,211684,therealking78,"Same, I was doing everything I could to convince myself he might fall to us",11.0,falcons,t3_ypwvyb,False,0.0,:Juliostare:,2022-11-08T17:46:20Z,falcons,0.25
19259,211686,211686,therealking78,"Even if it was a td he still made a GREAT play, get over yourself",0.0,falcons,t3_ynvs08,False,0.0,:Juliostare:,2022-11-06T14:28:04Z,falcons,0.8038
19260,211687,211687,therealking78,It’s johnathan Vilma an ex saint that hasn’t tried to hide it as he’s called our last two games,1.0,falcons,t3_ynvs08,False,0.0,:Juliostare:,2022-11-06T13:48:30Z,falcons,-0.1779
19261,211688,211688,therealking78,“ThE FaLcOnS hAvE nO FiGhT”- all the tiny over dramatic fake fans here,12.0,falcons,t3_ynvs08,False,0.0,:Juliostare:,2022-11-06T13:46:58Z,falcons,-0.6486
19262,211689,211689,therealking78,Jonathan Vilma just is not a good commentator,10.0,falcons,t3_ynvs08,False,0.0,:Juliostare:,2022-11-06T12:39:08Z,falcons,-0.3412
19263,211691,211691,therealking78,"I’m glad to hear it, you won’t be disappointed. Hopefully it’s not too crowded when you go",1.0,falcons,t3_ylh2sv,False,0.0,:Juliostare:,2022-11-04T10:53:32Z,falcons,0.1944999999999999
19495,213767,213767,thisnamehastobeused,I’m very glad I was wrong,1.0,falcons,t3_ynvs08,False,0.0,:Juliostare:,2022-11-06T14:32:35Z,falcons,0.0498
19496,213769,213769,thisnamehastobeused,His elbow as down. Not the fact he was stopped,1.0,falcons,t3_ynvs08,False,0.0,:Juliostare:,2022-11-06T14:28:39Z,falcons,-0.11315
19497,213770,213770,thisnamehastobeused,"Was that on tranquil, because if it was, it makes it 1000% better",8.0,falcons,t3_yo0ya0,False,0.0,:Juliostare:,2022-11-06T14:03:56Z,falcons,0.4767
19498,213771,213771,thisnamehastobeused,Straight up. When chargers got the ball he was so calm. Then when the falcons got it he sounded pissed,4.0,falcons,t3_ynvs08,False,0.0,:Juliostare:,2022-11-06T13:49:00Z,falcons,-0.1531185185185185
19499,213772,213772,thisnamehastobeused,I feel both right now. Like fuck this team for putting us in this position but I love this team for not being down 35-0 like some other teams,1.0,falcons,t3_ynvs08,False,0.0,:Juliostare:,2022-11-06T13:47:47Z,falcons,0.4304
19500,213773,213773,thisnamehastobeused,Fuck Velma and his “looking at a grown man” shit. So fricken annoying,7.0,falcons,t3_ynvs08,False,0.0,:Juliostare:,2022-11-06T13:45:18Z,falcons,-0.42655
19501,213774,213774,thisnamehastobeused,I would Much rather give up firsts on 2nd and first then these dumb 3rd downs,2.0,falcons,t3_ynvs08,False,0.0,:Juliostare:,2022-11-06T12:44:35Z,falcons,-0.5106
19502,213776,213776,thisnamehastobeused,Sadly yes,1.0,falcons,t3_ynvs08,False,0.0,:Juliostare:,2022-11-06T12:06:06Z,falcons,-0.0258
19503,213777,213777,thisnamehastobeused,I’m from Minnesota. So obviously the Vikings but I just have never liked them. I was drawn the falcons ever since I first started actually paying attention to football. I was like 8 and just liked their design and pattern. When I grew up I stayed for the fan base and all the amazing players that played for this team.,3.0,falcons,t3_yn7kjm,False,0.0,:Juliostare:,2022-11-05T19:36:48Z,falcons,0.1887304
19600,218533,218533,wayward_prince,How dare you say that Kirk Cousins is a better QB than Kyler Murray? Shame on you.,1.0,nfl,t3_ym29ik,False,0.0,:Falcons: Falcons,2022-11-05T01:14:05Z,falcons,-0.12825
