,Unnamed: 0.1,Unnamed: 0,author,body,score,subreddit,link_id,over_18,controversiality,author_flair_text,created_utc,flair,sentiment
1268,19940,19940,BlueDreams420,That Pitts play was great play calling. He was wide open and scores is Mariota just makes the throw.,2.0,falcons,t3_ynvs08,False,0.0,The Future,2022-11-06T15:01:09Z,falcons,0.209
1269,19941,19941,BlueDreams420,Cornell Armstrong is bad,1.0,falcons,t3_ynvs08,False,0.0,The Future,2022-11-06T14:56:16Z,falcons,-0.5423
1270,19942,19942,BlueDreams420,Davis just pissed down his leg smh,2.0,falcons,t3_ynvs08,False,0.0,The Future,2022-11-06T14:55:19Z,falcons,-0.7579
1271,19943,19943,BlueDreams420,My god how do.you fumble without being touched 😭😭😭,6.0,falcons,t3_ynvs08,False,0.0,The Future,2022-11-06T14:54:19Z,falcons,-0.802
1272,19944,19944,BlueDreams420,Bro we're missing AJ and Heyward. These are 3rd and 4th string guys. We've also held Herbert to under 200 yards so...,1.0,falcons,t3_ynvs08,False,0.0,The Future,2022-11-06T14:36:34Z,falcons,-0.0109629629629629
1980,24290,24290,Captain_Wide,"I'm in a crossroads with this team because I like Kenny, but Vilma just truly annoys me",3.0,falcons,t3_yo4iyk,False,0.0,Tanklantic City,2022-11-07T00:24:57Z,falcons,0.2263
2172,25716,25716,Chessh2036,"68 passes for Mahomes, Two off the record I believe. Chiefs scratched and clawed for every inch. Titans defense really stepped up, feel bad for them.",15.0,nfl,t3_yod5o7,False,0.0,:Falcons: Falcons,2022-11-06T22:59:00Z,falcons,-0.1529333333333333
2173,25717,25717,Chessh2036,Todd Downing not using Malik Willis running ability was wild. Running the option with Henry surely would have worked better than whatever that was.,1.0,nfl,t3_yod5o7,False,0.0,:Falcons: Falcons,2022-11-06T22:58:01Z,falcons,0.4297
2180,25735,25735,Chessh2036,Falcons brought in the Atlanta Braves base running coach to teach Michael Vick how to slide…he still didn’t.,10.0,nfl,t3_ymczrv,False,0.0,:Falcons: Falcons,2022-11-05T00:53:53Z,falcons,0.4404
3003,36090,36090,DLFresh,Cmon y’all :(,3.0,nfl,t3_yo7ygk,False,0.0,:Falcons: Falcons,2022-11-06T18:47:49Z,falcons,-0.4404
3651,41680,41680,Digitydoggimmeahigh5,"No pjs starting, they want to lose games because the 5th they traded for baker becomes a 4th if they do well enough",9.0,falcons,t3_yqt9vi,False,0.0,:Juliostare:,2022-11-09T18:29:01Z,falcons,-0.3612
3652,41684,41684,Digitydoggimmeahigh5,He was literally the best corner since peak revis last year lol fewest yards allowed fewest tds fewest catches fewest YAC allowed (0 btw) guy had a top 7 season statistically ever that’s why he was talked about,15.0,falcons,t3_ypwvyb,False,0.0,:Juliostare:,2022-11-08T16:25:05Z,falcons,0.8316
3653,41686,41686,Digitydoggimmeahigh5,He’s only gaining 2000 🤦‍♂️,-8.0,falcons,t3_ypaecu,False,0.0,:Juliostare:,2022-11-08T05:20:16Z,falcons,0.4215
3654,41687,41687,Digitydoggimmeahigh5,What the fuck risk 30000 to win 2000 💀,10.0,falcons,t3_ypaecu,False,0.0,:Juliostare:,2022-11-07T23:43:30Z,falcons,-0.2023
3655,41690,41690,Digitydoggimmeahigh5,"The falcons are the nfls punching bag, whenever they choke it’s must see news I never saw a damn thing about the chiefs game being a choke job",1.0,falcons,t3_yohjg9,False,0.0,:Juliostare:,2022-11-07T22:30:27Z,falcons,-0.6948
3656,41693,41693,Digitydoggimmeahigh5,"No, there’s a fatal flaw here, we can’t get over .500",1.0,falcons,t3_yoqb3h,False,0.0,:Juliostare:,2022-11-07T22:09:59Z,falcons,-0.5423
3657,41695,41695,Digitydoggimmeahigh5,I actually can’t believe we found another way to lose a football game which hasn’t been done yet,29.0,falcons,t3_yo2n5v,False,0.0,:Juliostare:,2022-11-06T15:10:34Z,falcons,-0.4019
3658,41696,41696,Digitydoggimmeahigh5,Taquon Graham :Cut him there literally isn’t an alternative,7.0,falcons,t3_yo2n5v,False,0.0,:Juliostare:,2022-11-06T15:08:26Z,falcons,-0.2732
3659,41697,41697,Digitydoggimmeahigh5,Get him on tell graham get a tfl or get cut,6.0,falcons,t3_ynvs08,False,0.0,:Juliostare:,2022-11-06T14:55:52Z,falcons,-0.2732
3660,41699,41699,Digitydoggimmeahigh5,Trade him for a 7th no need for that liability to take up a roster spot,2.0,falcons,t3_ynvs08,False,0.0,:Juliostare:,2022-11-06T14:54:03Z,falcons,-0.4588
3661,41700,41700,Digitydoggimmeahigh5,Get him the fuck out of there I’m on the ridder train now,3.0,falcons,t3_ynvs08,False,0.0,:Juliostare:,2022-11-06T14:38:42Z,falcons,-0.5423
3662,41703,41703,Digitydoggimmeahigh5,Alright mariota lead a drive prove why you should be our qb for the next weeks,8.0,falcons,t3_ynvs08,False,0.0,:Juliostare:,2022-11-06T14:32:47Z,falcons,0.25
3663,41704,41704,Digitydoggimmeahigh5,Why is koo only good in the clutch,6.0,falcons,t3_ynvs08,False,0.0,:Juliostare:,2022-11-06T14:19:18Z,falcons,0.4404
3664,41706,41706,Digitydoggimmeahigh5,He’s just like Patterson built like a tank but has hands,3.0,falcons,t3_ynvs08,False,0.0,:Juliostare:,2022-11-06T14:17:50Z,falcons,0.3612
3665,41709,41709,Digitydoggimmeahigh5,Wow lmao,1.0,falcons,t3_ynvs08,False,0.0,:Juliostare:,2022-11-06T13:46:45Z,falcons,0.8271
3666,41712,41712,Digitydoggimmeahigh5,"Trade evans, everyone on our DL other than Grady graham and AK cut Armstrong",2.0,falcons,t3_ynvs08,False,0.0,:Juliostare:,2022-11-06T13:13:58Z,falcons,-0.2732
3667,41714,41714,Digitydoggimmeahigh5,If we don’t draft 7 defenders next year I’ll be disappointed,8.0,falcons,t3_ynvs08,False,0.0,:Juliostare:,2022-11-06T12:52:25Z,falcons,-0.4215
3668,41716,41716,Digitydoggimmeahigh5,Stupid by hall no reason to sit in your zone there,4.0,falcons,t3_ynvs08,False,0.0,:Juliostare:,2022-11-06T12:44:08Z,falcons,-0.6808
3669,41717,41717,Digitydoggimmeahigh5,“In there for the injured Eric lindstrom” 💀💀💀💀,14.0,falcons,t3_ynvs08,False,0.0,:Juliostare:,2022-11-06T12:38:07Z,falcons,-0.4019
3670,41719,41719,Digitydoggimmeahigh5,Core-Darell I understand the confusion every announcer seems to pronounce it differently,4.0,falcons,t3_ynvs08,False,0.0,:Juliostare:,2022-11-06T12:17:17Z,falcons,-0.296
3671,41720,41720,Digitydoggimmeahigh5,There we go defence,2.0,falcons,t3_ynvs08,False,0.0,:Juliostare:,2022-11-06T12:16:05Z,falcons,0.1027
3672,41721,41721,Digitydoggimmeahigh5,Don’t get too confident our pass defence is putrid,4.0,falcons,t3_ynvs08,False,0.0,:Juliostare:,2022-11-06T12:12:29Z,falcons,0.5574
3673,41724,41724,Digitydoggimmeahigh5,"For sure, I’m predicting less than 10 pass attempts",3.0,falcons,t3_ynv69v,False,0.0,:Juliostare:,2022-11-06T10:56:31Z,falcons,0.3182
3674,41726,41726,Digitydoggimmeahigh5,I think we should just roll with our 3 if it ain’t broke don’t fix it,1.0,falcons,t3_yn0vh1,False,0.0,:Juliostare:,2022-11-06T08:04:38Z,falcons,-0.4215
3675,41728,41728,Digitydoggimmeahigh5,My dad fell in love with prime time when he was a kid and now I’m here 🤷‍♂️,1.0,falcons,t3_yn7kjm,False,0.0,:Juliostare:,2022-11-05T20:41:51Z,falcons,0.6369
3676,41729,41729,Digitydoggimmeahigh5,"I know, he definitely wants to stay healthy to get a bag before he declines but I still feel like that’s a big workload for healthy players so could end bad for him coming off of injury",6.0,falcons,t3_yn1vf7,False,0.0,:Juliostare:,2022-11-05T13:41:24Z,falcons,-0.0889
3677,41730,41730,Digitydoggimmeahigh5,Damn I love him but is playing 2 times in 5 days a good idea for him? We should’ve waited till Thursday we weren’t desperate for him back,26.0,falcons,t3_yn1vf7,False,0.0,:Juliostare:,2022-11-05T13:35:59Z,falcons,0.035475
3919,44981,44981,DrLeoMarvin,"6-2, we were on a crazy high energy come back against the bucs when that RTP bullshit call killed our fourth down turnover chance",1.0,nfl,t3_ym0i23,False,0.0,:Falcons: Falcons :Dolphins: Dolphins,2022-11-05T07:15:11Z,falcons,-0.8225
3920,44987,44987,DrLeoMarvin,its a pissing competition of who's gonna be the best loser and we are all just setting ourselves up to be pleasantly surprised if it comes our way.  Love this shit lol,4.0,nfl,t3_ym0i23,False,0.0,:Falcons: Falcons :Dolphins: Dolphins,2022-11-04T12:10:34Z,falcons,0.382525
3921,44988,44988,DrLeoMarvin,"My dad was a preacher and ran a ministry, he was also good friends with legendary Falcons QB Steve Bartkowski.  Bart would come be the face of a golf tournament for him every year to raise money for like two decades.  Bart is a super christian.",8.0,nfl,t3_ym0i23,False,0.0,:Falcons: Falcons :Dolphins: Dolphins,2022-11-04T12:08:45Z,falcons,0.2665407407407407
3922,44989,44989,DrLeoMarvin,A positive falcons post on my front page for r/nfl?!?! Didn't think the day would come,32.0,nfl,t3_ym0i23,False,0.0,:Falcons: Falcons :Dolphins: Dolphins,2022-11-04T12:07:07Z,falcons,0.168775
4383,47662,47662,Eddy_Vinegar,(Wiping away tears) this would be beautiful and I would name my next kid Terry Fontenot (first name) if this happens,12.0,falcons,t3_ypr7ey,False,0.0,:Juliostare:,2022-11-08T16:20:18Z,falcons,0.4588
4384,47665,47665,Eddy_Vinegar,People need to just relax and be happy that this team is competitive because nobody NOBODY thought we were gonna be in the position we’re in right now this year.  People forget that Marcus was brought in because the Watson deal fell thru and Matt needed to be traded.  Without Marcus we would prob have Felipe as qb😅.,2.0,falcons,t3_yoi2cz,False,0.0,:Juliostare:,2022-11-07T14:04:11Z,falcons,0.1251592592592592
4385,47667,47667,Eddy_Vinegar,"HE IS WHO WE THOUGHT HE WAS, still gives us the best chance to win, Drake & Pitts aren’t without blame (honestly once Koo missed that FG I expected the worse)",1.0,falcons,t3_yo2o1w,False,0.0,:Juliostare:,2022-11-07T09:55:11Z,falcons,0.6435
4386,47668,47668,Eddy_Vinegar,"Not really even mad at this guy, more frustrated with London and Pitts but oh well",1.0,falcons,t3_yo3kx6,False,0.0,:Juliostare:,2022-11-07T09:53:11Z,falcons,0.3006
4387,47669,47669,Eddy_Vinegar,This is funny to me b/c ALOT of people in this sub did not want fields and pointed to his struggles as to reasons why it’s good we didn’t get him…now that the Bears figured out literally something that most people already figured out we wanna swap him for Pitts?? Mannnnnn gtfo,8.0,falcons,t3_yopqg3,False,0.0,:Juliostare:,2022-11-07T09:50:01Z,falcons,0.133175
4388,47670,47670,Eddy_Vinegar,"“After a tight game, presented by Nickelodeon” had me dying 🤣🤣🤣",37.0,falcons,t3_yoqb3h,False,0.0,:Juliostare:,2022-11-07T09:46:58Z,falcons,0.8625
4792,58392,58392,HeatCreator,"Fooey, Allen is generational, ZERO chance he won’t bounce back",-1.0,nfl,t3_yp1rtf,False,0.0,:Falcons: Falcons,2022-11-07T17:38:37Z,falcons,0.25
4879,60385,60385,HotJacket115,That's STILL GOOD,1.0,falcons,t3_ynvs08,False,0.0,:Juliostare:,2022-11-06T14:51:55Z,falcons,0.5622
4880,60386,60386,HotJacket115,That's alright koo,1.0,falcons,t3_ynvs08,False,0.0,:Juliostare:,2022-11-06T14:19:10Z,falcons,0.25
4924,60617,60617,IAmMeThatIsWhoIAm,"It’s all homeopathy, so pretty much a bowl of water and some potpourri.",16.0,nfl,t3_ynyc43,False,0.0,:Falcons: Falcons :Eagles::bandwagon: Eagles Bandwagon,2022-11-06T14:45:16Z,falcons,0.6269
4925,60619,60619,IAmMeThatIsWhoIAm,"I’m so happy he’s been bad this year. Dude is and always has been a dickhead, fuck him.",41.0,nfl,t3_ynyc43,False,0.0,:Falcons: Falcons :Eagles::bandwagon: Eagles Bandwagon,2022-11-06T14:36:57Z,falcons,-0.379675
4974,64075,64075,Jayttic,"It’s hard to argue that when drake fumbled in the redzone, Ko missed a FG and Marcus and Kyle have no chemistry when Kyle was wide open for a walk in TD on our last pass. Was it perfect? No - but we were in a position to win all game",6.0,falcons,t3_yo4qmw,False,0.0,Matt “Get Fucking Set” Ryan,2022-11-06T18:23:01Z,falcons,0.2632518518518518
4975,64076,64076,Jayttic,I agree with everything but coaching. We had a chance to get at least 17 points with just the three plays I’ve highlighted- I still truly believe Arthur Smith is getting the most out of this unit,6.0,falcons,t3_yo4qmw,False,0.0,Matt “Get Fucking Set” Ryan,2022-11-06T17:53:58Z,falcons,0.402325
4976,64077,64077,Jayttic,I agree but I also want to highlight that we had at least 17 points on the board that we didn’t get because of those 3 plays,6.0,falcons,t3_yo4qmw,False,0.0,Matt “Get Fucking Set” Ryan,2022-11-06T16:30:42Z,falcons,0.7783
4977,64078,64078,Jayttic,Love Troy on the blitz - more please - I called that after the chargers first scoring drive,2.0,falcons,t3_ynvs08,False,0.0,Matt “Get Fucking Set” Ryan,2022-11-06T13:34:21Z,falcons,0.7778
4978,64079,64079,Jayttic,"On the Chargers scoring drive they converted:

•	⁠3rd & 15
•	⁠3rd & 7
•	⁠3rd & 10

We are just awful on 3rd down.",2.0,falcons,t3_ynvs08,False,0.0,Matt “Get Fucking Set” Ryan,2022-11-06T12:58:48Z,falcons,-0.4588
4979,64081,64081,Jayttic,"Man we gave up so many 3rd downs, painful drive - Oliver was amazing on that drive and made a lot of open field tackles.

This is gonna be shoot out - don’t be shocked if we start sending Troy on a blitz on 3rd downs to get some type of pressure - Grady gonna have to put on his cape for us",2.0,falcons,t3_ynvs08,False,0.0,Matt “Get Fucking Set” Ryan,2022-11-06T12:53:28Z,falcons,-0.298225
4980,64082,64082,Jayttic,Last year Matt PFF great was 77.1 at center with 988 snaps - take that information anyway you would like,6.0,falcons,t3_yneamj,False,0.0,Matt “Get Fucking Set” Ryan,2022-11-05T22:41:17Z,falcons,0.765
5477,65707,65707,JeffMurdock_,"I checked to confirm because I wanted to send a screenshot to my fantasy league chat. Unfortunately, [that's not Tua](https://www.nytimes.com/interactive/2022/11/08/us/elections/results-florida-us-senate.html).

Expand the full list of candidates. It's some independent named Tuan Nguyen.",11.0,nfl,t3_yqlbke,False,0.0,:Falcons: Falcons ,2022-11-09T12:36:39Z,falcons,0.0145749999999999
6720,72705,72705,KerryUSA,I mean this is sweet but who’s saying no in that situation lol “gtfo here Lucas you’re messing up my rhythm”,2.0,nfl,t3_yol54f,False,0.0,:Falcons: Falcons ,2022-11-07T13:18:36Z,falcons,0.4404
6722,72714,72714,KerryUSA,"But will it be two 1st and a 2nd? I get both sides because if he’s a generational talent there’s no guarantee you get equal value back in return. 

With current state in Carolina it’s also harder to sell the fan base on “few more years fr this time”",3.0,nfl,t3_yntswy,False,0.0,:Falcons: Falcons ,2022-11-06T11:01:27Z,falcons,0.1656444444444444
6723,72716,72716,KerryUSA,"Short answer 9ers, Cowboys, Vikings? Long answer we don’t know who’s hot or who’s healthiest by then but a bye and home field in Philly in December will be tough no matter how you slice it.",6.0,nfl,t3_ynq2ae,False,0.0,:Falcons: Falcons ,2022-11-06T08:27:07Z,falcons,-0.1085
6724,72717,72717,KerryUSA,Lol I attributed their slow start to tnf and being away but definitely felt like the “woke up” In the second half.,6.0,nfl,t3_ynq2ae,False,0.0,:Falcons: Falcons ,2022-11-06T08:20:37Z,falcons,0.8271
6725,72718,72718,KerryUSA,"Good teams capitalize off their opponents mistakes (pretty sure their turnover differential is like -13) 

Panthers got lucky and blew it…twice",7.0,nfl,t3_ynq2ae,False,0.0,:Falcons: Falcons ,2022-11-06T08:10:43Z,falcons,0.8807
7059,79496,79496,Lionzblade,"From tn,from the braves",7.0,falcons,t3_yn7kjm,False,0.0,Grady Jarrett 97,2022-11-05T18:56:15Z,falcons,0.4404
7464,82546,82546,Motor_Rub_4848,Everyone saying they wanted Sauce and I'll admit I did too but after seeing London I'm glad we got London. We needed the receiver more than another corner. We already have some pretty good depth at corner considering Hall has seen quite a bit of playtime from the last two years. When we get our starters back we're gonna have a mean secondary.,-1.0,falcons,t3_ypwvyb,False,0.0,It puts the lotion on the Rid...,2022-11-08T23:09:02Z,falcons,0.0480082031249999
7465,82549,82549,Motor_Rub_4848,I ain't gonna lie that kinda looks a lot like shit.,7.0,falcons,t3_yp4z5g,False,0.0,It puts the lotion on the Rid...,2022-11-08T00:28:06Z,falcons,-0.2732
7466,82550,82550,Motor_Rub_4848,A loss to the Falcons that is not only his last game but also wins us the division and knocks the Bucs out of a playoff spot. If you ain't cumming to the thought of that then you oughta just cut it off.,9.0,falcons,t3_yp8x9w,False,0.0,It puts the lotion on the Rid...,2022-11-08T00:26:15Z,falcons,0.0283249999999999
7467,82552,82552,Motor_Rub_4848,I mean as long as he can run block who cares.,2.0,falcons,t3_yneamj,False,0.0,It puts the lotion on the Rid...,2022-11-06T01:54:42Z,falcons,0.0258
7468,82553,82553,Motor_Rub_4848,"I was born in Michigan and was moved out to Pennsylvania when I was younger. Wasn't really into football at that time but my step father liked the Patriots and my mom likes the Bears. Being from out of the area and a weird kid I had few friends those I did have all liked sports so I soon took a liking to football. 

My friends liked the following teams the Vikings, Chargers, Lions, Titans, and Rams. 

Being in Northeast PA I had to deal with many Eagles fans, Giants fans, and Steelers fans as well they were almost all quite a bother.

That eliminated so many teams to pick from. I then narrowed it down more from there and decided between the Falcons, Ravens, and the Texans. 

I liked the Falcons colors and being a weirdo I thought the Ravens being a spooky bird was cool as well. The Texans being the newest team in the league also made me think twice about them as they would be forever the underdog and everyone loves a good underdog. Almost made sense being a new fan to pick the newest team so no one could call me out for a bandwagon pick.

I chose the Falcons.

It was really cemented after we lost the NFC Championship Game to the Eagles and then came back to beat them in the first game of the season the following year.",1.0,falcons,t3_yn7kjm,False,0.0,It puts the lotion on the Rid...,2022-11-05T20:16:08Z,falcons,-0.0492447295678569
7469,82554,82554,Motor_Rub_4848,I mean we've been watching Mariota all year and he's the prime example of a bad QB that's plays some great games here and there. I don't wanna name any one game specifically but he's something else. He will complete 10 to 15 passes in a row one games and then go back to looking like hell the next.,1.0,nfl,t3_ymy21e,False,0.0,:Falcons: Falcons,2022-11-05T14:15:56Z,falcons,-0.1447592592592592
7470,82555,82555,Motor_Rub_4848,Yeah but like FTS.,1.0,nfl,t3_ymas8p,False,0.0,:Falcons: Falcons,2022-11-05T03:16:11Z,falcons,0.5927
7471,82556,82556,Motor_Rub_4848,This worked well for us against the browns as well. The Injury gods have spoken and the playing field has been leveled.,3.0,falcons,t3_ym8u45,False,0.0,It puts the lotion on the Rid...,2022-11-04T23:10:57Z,falcons,-0.0015249999999999
7472,82557,82557,Motor_Rub_4848,I'm glad you posted this just for this I remember glazing over this in the offseason or preseason at some point but forgot all about it. This is a good idea not just because I want the chance to see my team play but because we don't always want to see backups play the last week of the season. Could potentially stop  people from having to see shitty games which has been a trend on Thursdays already.,2.0,falcons,t3_ym2gi3,False,0.0,It puts the lotion on the Rid...,2022-11-04T14:03:59Z,falcons,-0.1437074074074074
8242,90973,90973,OhItsKillua,Falcons defense at the end of games remains undefeated in awfulness,6.0,nfl,t3_youooc,False,0.0,:Falcons: Falcons,2022-11-07T12:03:03Z,falcons,0.128
8243,90975,90975,OhItsKillua,"Sucks for him and the Giants, know he'll probably get plenty of shit from sticks in the mud that think players should wrap themselves in bubble wrap until they retire.",-9.0,nfl,t3_yormrg,False,0.0,:Falcons: Falcons,2022-11-07T10:16:30Z,falcons,-0.7269
8244,90979,90979,OhItsKillua,"Yep, feel like they're doing more harm than good putting him out there. He clearly should just sit back and continue to learn in practice and on the bench this season.",2.0,nfl,t3_yod5o7,False,0.0,:Falcons: Falcons,2022-11-07T05:01:28Z,falcons,0.3188249999999999
8364,92148,92148,PWNtimeJamboree,He’s having the best year of his life,2.0,nfl,t3_yqnc05,False,0.0,:Falcons: Falcons,2022-11-09T11:24:06Z,falcons,0.6369
8365,92149,92149,PWNtimeJamboree,"i agree. its why i want to see Ridder before the year is over. i want to know if we have anything in him before we go into the offseason. although, i dont hear particularly great things about how he looks in practice.",2.0,nfl,t3_yq89h9,False,0.0,:Falcons: Falcons,2022-11-09T09:19:29Z,falcons,-0.1285578125
8366,92150,92150,PWNtimeJamboree,until we abandon for absolutely no reason and ask Mariota to throw deep.....,5.0,nfl,t3_yq89h9,False,0.0,:Falcons: Falcons,2022-11-09T08:05:29Z,falcons,-0.659
8367,92161,92161,PWNtimeJamboree,Penix is who I really want. That dude would light it up in this offense,1.0,falcons,t3_yontfl,False,0.0,WAP - WET ASS PITTSY,2022-11-07T19:16:12Z,falcons,-0.115725
8368,92164,92164,PWNtimeJamboree,"thanks, Poopin!",2.0,falcons,t3_yontfl,False,0.0,WAP - WET ASS PITTSY,2022-11-07T13:21:15Z,falcons,0.4926
8369,92165,92165,PWNtimeJamboree,100%. its my favorite football movie. its so over the top and ridiculous,3.0,falcons,t3_yontfl,False,0.0,WAP - WET ASS PITTSY,2022-11-07T13:01:15Z,falcons,0.0136777777777777
8370,92166,92166,PWNtimeJamboree,"i still think Penix ends up projecting as a 1st rounder by the time the draft comes around, and my god he would be so good in our offense....",1.0,falcons,t3_yontfl,False,0.0,WAP - WET ASS PITTSY,2022-11-07T12:35:35Z,falcons,0.5915
8371,92168,92168,PWNtimeJamboree,"after watching him at UF during his career, hes one of the best route runners ive ever seen. hes also a human joystick. he doesnt have the straight line speed that Tyreek has, but he will fill that void flawlessly.",12.0,nfl,t3_yom344,False,0.0,:Falcons: Falcons,2022-11-07T10:38:44Z,falcons,0.1161888888888889
8372,92169,92169,PWNtimeJamboree,"goddammit we're really about to do that shit again, huh? im praying one of the Big 4 QB's can fall to us wherever we end up.",6.0,falcons,t3_yontfl,False,0.0,WAP - WET ASS PITTSY,2022-11-07T08:40:39Z,falcons,0.04125
8373,92170,92170,PWNtimeJamboree,"yeah im just over it with this guy. 8 years and he still cant hit a guy unless its within 10 yards. at this rate it's clear hes not a long term answer, so plug in Ridder and see what you've got so you know for the offseason whether you want to address QB or not.",8.0,falcons,t3_yontfl,False,0.0,WAP - WET ASS PITTSY,2022-11-07T08:29:04Z,falcons,0.1577629629629629
8374,92171,92171,PWNtimeJamboree,Only the Falcons can lose like this. I’ve seen the Falcons lose in so many ways that I’ve never seen before over the last 5 years that I can’t even keep track of them all anymore. It’s unreal.,25.0,nfl,t3_yo2ej2,False,0.0,:Falcons: Falcons,2022-11-06T15:08:36Z,falcons,-0.0465666666666666
8375,92172,92172,PWNtimeJamboree,I had this whole idea worked up for tomorrows wallpaper with Mariota missing Pitts when he’s wide open but now I don’t even know how to react with this one. What the fuck bro.,1.0,falcons,t3_ynvs08,False,0.0,WAP - WET ASS PITTSY,2022-11-06T14:59:47Z,falcons,-0.309425
8376,92173,92173,PWNtimeJamboree,"I’m consistently amazed at the new and creative ways the Falcons lose. 

Only the fucking Falcons can get a game saving fumble recovery and literally just drop the ball on the ensuing return and give it back and lose.",14.0,falcons,t3_ynvs08,False,0.0,WAP - WET ASS PITTSY,2022-11-06T14:56:55Z,falcons,-0.161275
8492,96511,96511,RSN_Kabutops,Not as blatant as what happened to Claypool though. They NEVER call DPI at the end of the game... until it benefits the same guy who routinely gets whatever calls he needs.,-9.0,nfl,t3_yo2gah,False,0.0,:Falcons: Falcons,2022-11-06T18:51:24Z,falcons,0.1909
8493,96514,96514,RSN_Kabutops,Check down God forsure,0.0,nfl,t3_yo2gah,False,0.0,:Falcons: Falcons,2022-11-06T18:39:36Z,falcons,0.2732
8494,96515,96515,RSN_Kabutops,"Refs never have. From the roughing call to a DPI call with 8 seconds to go, they never fail.",-15.0,nfl,t3_yo2gah,False,0.0,:Falcons: Falcons,2022-11-06T18:38:51Z,falcons,0.2155
8495,96517,96517,RSN_Kabutops,"Falcons Seahawks 2016.

Falcons Panthers last week.

Rams Saints NFCCG end of regulation and overtime.

That's just out my ass in 10 seconds. Cmon",1.0,nfl,t3_yo2gah,False,0.0,:Falcons: Falcons,2022-11-06T18:31:42Z,falcons,-0.021692
8496,96519,96519,RSN_Kabutops,Brady always gets the help he needs,-2.0,nfl,t3_yo2gah,False,1.0,:Falcons: Falcons,2022-11-06T18:26:27Z,falcons,0.4019
8497,96521,96521,RSN_Kabutops,I genuinely don't give a fuck. That's completely unacceptable,1.0,nfl,t3_ynwlod,False,0.0,:Falcons: Falcons,2022-11-06T15:03:42Z,falcons,-0.1469999999999999
8498,96522,96522,RSN_Kabutops,I'm done with the Falcons for the year. Pathetic,0.0,nfl,t3_yo2k4w,False,0.0,:Falcons: Falcons,2022-11-06T15:03:04Z,falcons,-0.28595
8499,96523,96523,RSN_Kabutops,Just blow it up. Worst team in the league by far regardless of record.,-3.0,nfl,t3_ynwlod,False,1.0,:Falcons: Falcons,2022-11-06T15:00:55Z,falcons,-0.31245
8500,96524,96524,RSN_Kabutops,"Sit Mariota for good. Cut Graham. 

Fuck this",1.0,nfl,t3_ynwlod,False,0.0,:Falcons: Falcons,2022-11-06T14:58:12Z,falcons,-0.1948111111111111
8501,96525,96525,RSN_Kabutops,You don't have to be a professional offensive player to know to hold onto the fucking football,1.0,nfl,t3_ynwlod,False,0.0,:Falcons: Falcons,2022-11-06T14:57:10Z,falcons,-0.4588
8502,96526,96526,RSN_Kabutops,Right tackle holding like hell and of course it's missed,4.0,nfl,t3_ynwlod,False,0.0,:Falcons: Falcons,2022-11-06T14:55:49Z,falcons,-0.6486
8503,96527,96527,RSN_Kabutops,Cut Graham after the game what the fuck was that,5.0,nfl,t3_ynwlod,False,0.0,:Falcons: Falcons,2022-11-06T14:54:49Z,falcons,-0.6808
8504,96528,96528,RSN_Kabutops,HOW DO YOU FUCKING DROP THE BALL LIKE THAT,6.0,nfl,t3_ynwlod,False,0.0,:Falcons: Falcons,2022-11-06T14:53:06Z,falcons,0.0276
