,Unnamed: 0.1,Unnamed: 0,author,body,score,subreddit,link_id,over_18,controversiality,author_flair_text,created_utc,flair,sentiment
6764,45846,45846,EkimJT,"""fire joe woods"" echo chamber rhetoric can be eye-roll worthy at times in here

but this is impossible to defend (no pun intended)

why would you permit the All-Pro receiver to get free releases however he likes? no brackets in coverage?

come on man, it's not like you had Higgins & Boyd out there with him. the answers to questions with football are hardly ever easy & I'm certainly no expert, but I really scratch my head here with the lack of adjustment

EDIT: lol I didn't even realize during broadcast how often a safety was getting matched up on this dude 1-on-1... what the hell",49.0,browns,t3_zk9lt1,False,0.0,:orange_pants:,2022-12-12T14:05:16Z,browns,-0.083276953125
6765,45847,45847,EkimJT,"yes the browns have a shiny new QB that can throw well but the offense is still predicated on a run-first mentality and when the line suddenly goes from top 10 to bottom 5 in a matter of basically a month, it can be very jarring",19.0,browns,t3_zjh4s8,False,0.0,:orange_pants:,2022-12-11T18:58:41Z,browns,0.3071
6948,48327,48327,EwwBitchGotHammerToe,Thank you. Yeesh. Like we're just gonna pretend like before this week he didn't have literally the worst QBR rating in the whole league for starting QB's.,1.0,nfl,t3_zgmiyj,False,0.0,:Browns: Browns,2022-12-09T12:20:23Z,browns,-0.0292888888888888
6949,48328,48328,EwwBitchGotHammerToe,"Lol no reason to be pessimistic. Okay sorry Ill hold back my Browns fan misery while not remembering Baker's 4 year career in Cleveland. I fucking loved the dude because he killed it in the attitude department. And you're right, I'm not wrong, but if I am, good for him. He's not intentionally bad, his resiliency is off the charts, but in the heat of the moment, dude will let you down.",0.0,nfl,t3_zgmiyj,False,0.0,:Browns: Browns,2022-12-09T12:18:32Z,browns,0.072203744
6950,48337,48337,EwwBitchGotHammerToe,"This is what Baker does. Swoons you with random big plays when you literally have nothing to lose, only to fuck up when it actually matters. 

I sincerely hope this isn't the case for him snd the Rams, I loved the dude, but my 4 years of watching him every week says different.",-4.0,nfl,t3_zgmiyj,False,1.0,:Browns: Browns,2022-12-09T02:38:40Z,browns,0.2176666666666666
7144,51734,51734,Fact0ry0fSadness,"I really wish they didn't have non football guests in Manningcast. I love it when it's just Eli and Peyton talking football or when they have a player or coach on who can discuss the game. But when it's just inane chatter with some celeb who barely knows the game and they completely ignore it, I have to turn it off. I'd rather listen to Buck and Aikman actually call the game.",38.0,nfl,t3_zkhefs,False,0.0,:Browns: Browns :Lions: Lions,2022-12-13T07:25:15Z,browns,-0.0239109375
7145,51735,51735,Fact0ry0fSadness,"This chair ad is corny as fuck. ""synthesizes the universe's elements: hot, cold, and touch."" The fuck? And that chair better give me a damn blowjob for how much they want for it.",6.0,nfl,t3_zkhaat,False,0.0,:Browns: Browns :Lions: Lions,2022-12-12T22:03:57Z,browns,-0.004012109375
7146,51736,51736,Fact0ry0fSadness,2 hot mic fucks in one night? The broadcast gods have blessed us.,8.0,nfl,t3_zkhaat,False,0.0,:Browns: Browns :Lions: Lions,2022-12-12T22:02:22Z,browns,0.180525
7147,51737,51737,Fact0ry0fSadness,Ugh. This is like one of those games on RedZone they only show when the others are in commercial break.,9.0,nfl,t3_zkhaat,False,0.0,:Browns: Browns :Lions: Lions,2022-12-12T21:32:09Z,browns,0.075225
7148,51739,51739,Fact0ry0fSadness,Lmao they probably thought they got a good ass game with Rams/Packers preseason,4.0,nfl,t3_zkhaat,False,0.0,:Browns: Browns :Lions: Lions,2022-12-12T20:31:34Z,browns,0.5106
7149,51741,51741,Fact0ry0fSadness,Anyone else think it's odd that State Farm uses Mahomes as their spokesman when the Cardinals stadium is State Farm Field. That would be like Progressive using Dak or something.,2.0,nfl,t3_zkhaat,False,0.0,:Browns: Browns :Lions: Lions,2022-12-12T19:57:51Z,browns,0.10105
7150,51746,51746,Fact0ry0fSadness,They forget these guys are human and just treat them like pawns in a game. It's pretty fucked up honestly.,2.0,nfl,t3_zk7znh,False,0.0,:Browns: Browns :Lions: Lions,2022-12-12T15:01:37Z,browns,0.2288
7151,51751,51751,Fact0ry0fSadness,Haha I'm in the game thread the day after. Nobody knows I'm here. Penis.,11.0,nfl,t3_zjgzk0,False,0.0,:Browns: Browns :Lions: Lions,2022-12-12T13:10:29Z,browns,0.0169925925925925
7152,51767,51767,Fact0ry0fSadness,Fair enough. There's so many idiots on this sub it's hard to tell who is joking and who's being serious lol.,2.0,nfl,t3_zj9h6o,False,0.0,:Browns: Browns :Lions: Lions,2022-12-12T08:12:24Z,browns,0.30895
7153,51768,51768,Fact0ry0fSadness,Clowning on your own team to support Deshaun Watson? That's definitely a choice.,3.0,nfl,t3_zj9h6o,False,0.0,:Browns: Browns :Lions: Lions,2022-12-12T07:31:07Z,browns,0.301425
7154,51769,51769,Fact0ry0fSadness,Agreed. Then we can bench him and fire the FO and get a QB who isn't a rapist.,3.0,nfl,t3_zj9h6o,False,0.0,:Browns: Browns :Lions: Lions,2022-12-12T07:28:56Z,browns,0.2474
7155,51770,51770,Fact0ry0fSadness,"I really wish Jacoby had nailed that TD to DPJ early in the game, and Watson scored nothing.",1.0,nfl,t3_zj9h6o,False,0.0,:Browns: Browns :Lions: Lions,2022-12-12T07:28:16Z,browns,0.4576
7156,51772,51772,Fact0ry0fSadness,"If the Broncos lose, it's because of punting there.",6.0,nfl,t3_zizm5l,False,0.0,:Browns: Browns :Lions: Lions,2022-12-11T17:13:03Z,browns,-0.4019
7157,51773,51773,Fact0ry0fSadness,The universe is going to will the Broncos into winning just for the meme.,3.0,nfl,t3_zizm5l,False,0.0,:Browns: Browns :Lions: Lions,2022-12-11T17:01:45Z,browns,0.5267
7158,51777,51777,Fact0ry0fSadness,"They probably stayed away from that because of how well known the Golden State Warriors are. Different sport but I can see how it would cause confusion and accusations of Washington ""ripping off"" the name.",3.0,nfl,t3_zi87um,False,0.0,:Browns: Browns :Lions: Lions,2022-12-10T22:57:48Z,browns,-0.2794999999999999
7159,51778,51778,Fact0ry0fSadness,Wouldn't the promo for the game be made by NBC? The NFL doesn't create the network specific promos and highlight reels.,9.0,nfl,t3_zi679m,False,0.0,:Browns: Browns :Lions: Lions,2022-12-10T22:47:25Z,browns,0.0748
7160,51782,51782,Fact0ry0fSadness,"So far nobody in this thread has defended Watson or said he didn't do what he's accused of. Nor has anyone made up excuses or said it's ""ok"" for Browns fans to support him. You're the one making strawmen here. 

People are just calling out the hypocrisy of being against Watson and the Browns but still actively supporting the team which enabled him originally and was complicit in his actions. 

The conclusion here shouldn't be that it's ok to support the Browns because the Texans supported him too. It should be that both are shitty organizations for enabling Watson, but you're the one who seems to be unable to admit that.",4.0,nfl,t3_zh948m,False,0.0,:Browns: Browns :Lions: Lions,2022-12-09T16:20:17Z,browns,0.0197680255486968
7162,51785,51785,Fact0ry0fSadness,"I don't think it's fair to say the ""vast majority"" of fans support him. It's more like 50/50 at most. Almost every Browns fan I know dislikes Watson and wishes we kept Baker or Jacoby. I only know one or two that actively support him.",4.0,nfl,t3_zgnsa2,False,0.0,:Browns: Browns :Lions: Lions,2022-12-09T08:58:04Z,browns,0.1593703125
7266,52646,52646,FakePhillyCheezStake,No u,2.0,browns,t3_zj0twv,False,0.0,:browns:,2022-12-11T12:53:47Z,browns,-0.296
7267,52648,52648,FakePhillyCheezStake,"Torn between wanting the Browns to win and Watson to suck so we get rid of him.

Screw the Browns for making games suck more than they already did",-5.0,browns,t3_zj0twv,False,1.0,:browns:,2022-12-11T12:33:55Z,browns,-0.26175
7502,56992,56992,Gamesgar0,Your best argument is a guy that played 15 years ago?,1.0,browns,t3_zkf2ub,False,0.0,:browns:,2022-12-13T10:14:14Z,browns,0.6249
7503,56993,56993,Gamesgar0,There are medical professionals that work with him every single day. If they felt as if playing the rest of the season would cause long term damage then they wouldn’t be playing him.,0.0,browns,t3_zkf2ub,False,0.0,:browns:,2022-12-12T18:52:44Z,browns,-0.07655
7754,59223,59223,Geeman447,"Yeah I’ll take the DC from the 49ers in a heart beat as HC. Stefanski isn’t going to change, it can get bette rebut the core issues will always be there. I’m ready to move on",-4.0,browns,t3_zm1ftt,False,0.0,:brownie-elf:,2022-12-14T15:43:18Z,browns,0.1482
7755,59231,59231,Geeman447,"I’m out as it is. I’ve seen enough from him, he isn’t going to ‘change’. His plays don’t favor the best players and has a history of his best weapons begging to get out of town away from him.",-1.0,browns,t3_zk9lt1,False,0.0,:brownie-elf:,2022-12-12T22:02:39Z,browns,0.2935666666666667
7756,59235,59235,Geeman447,Herbie is just better,3.0,nfl,t3_zjgzk0,False,0.0,:Browns: Browns,2022-12-11T21:42:49Z,browns,0.4404
7757,59236,59236,Geeman447,Don’t disrespect my Boise state legend Jay Ajayi like that!,3.0,nfl,t3_zjgzk0,False,0.0,:Browns: Browns,2022-12-11T21:36:58Z,browns,-0.1511
7758,59238,59238,Geeman447,Yea it is😂,1.0,nfl,t3_zjgzk0,False,0.0,:Browns: Browns,2022-12-11T21:21:30Z,browns,0.4404
7759,59243,59243,Geeman447,Literally think only Tyreek would be able to do that. Wtf just happened,4.0,nfl,t3_zjgzk0,False,0.0,:Browns: Browns,2022-12-11T20:18:08Z,browns,-0.29295
7760,59244,59244,Geeman447,"Sadly yes, hate seeing him off the field.",1.0,nfl,t3_zjgzk0,False,0.0,:Browns: Browns,2022-12-11T20:15:16Z,browns,-0.5859
7761,59245,59245,Geeman447,"Sure, but you have to take ours in that trade",1.0,nfl,t3_zjgzk0,False,0.0,:Browns: Browns,2022-12-11T20:13:28Z,browns,0.1655
7762,59246,59246,Geeman447,Tua isn’t making that throw. Jeez Herbert is crazy.,13.0,nfl,t3_zjgzk0,False,0.0,:Browns: Browns,2022-12-11T20:11:17Z,browns,-0.17
7763,59247,59247,Geeman447,No way dude. They sold on the season after the suspension. They were playing for next year from the start,1.0,browns,t3_zj92fp,False,0.0,:brownie-elf:,2022-12-11T16:56:22Z,browns,0.0564703703703703
7764,59250,59250,Geeman447,Chubb had the first before? What the fuck are these spots.,3.0,browns,t3_zj0twv,False,0.0,:brownie-elf:,2022-12-11T14:44:38Z,browns,-0.27115
7765,59251,59251,Geeman447,What in the fuck are you thinking dion??😂😂😂😂😂,3.0,browns,t3_zj0twv,False,0.0,:brownie-elf:,2022-12-11T14:42:24Z,browns,0.327425
7766,59252,59252,Geeman447,That’s a stefanski move right there. Moving the ball easily and then outsmarts himself into a likely 3 and out,1.0,browns,t3_zj0twv,False,0.0,:brownie-elf:,2022-12-11T14:41:20Z,browns,0.17
7767,59253,59253,Geeman447,Yeah guys. Wow that was incredible.,4.0,browns,t3_zj0twv,False,0.0,:brownie-elf:,2022-12-11T14:35:32Z,browns,0.36695
7768,59254,59254,Geeman447,Two straight screens. Ugh,3.0,browns,t3_zj0twv,False,0.0,:brownie-elf:,2022-12-11T14:35:02Z,browns,-0.154175
7769,59255,59255,Geeman447,We take Chubb out because hunt is the better pass catcher. Yet he drops passes like once a game it seems,5.0,browns,t3_zj0twv,False,0.0,:brownie-elf:,2022-12-11T14:34:12Z,browns,0.2907
7770,59256,59256,Geeman447,Not one of these soft ass players can tackle. It’s annoying. Like who TF is number 51,3.0,browns,t3_zj0twv,False,0.0,:brownie-elf:,2022-12-11T14:26:01Z,browns,0.0757592592592592
7771,59257,59257,Geeman447,I love him. Told them to keep giving him the fucking ball. He still wants it. Let’s go Njoku.,3.0,browns,t3_zj0twv,False,0.0,:brownie-elf:,2022-12-11T14:23:15Z,browns,0.007800390625
7772,59261,59261,Geeman447,We won’t. Which is annoying.,3.0,browns,t3_zj0twv,False,0.0,:brownie-elf:,2022-12-11T14:09:23Z,browns,-0.20095
7773,59262,59262,Geeman447,Yeah this is over.,3.0,browns,t3_zj0twv,False,0.0,:brownie-elf:,2022-12-11T14:09:07Z,browns,0.296
7774,59263,59263,Geeman447,We can’t fucking block. This is ridiculous,3.0,browns,t3_zj0twv,False,0.0,:brownie-elf:,2022-12-11T14:04:25Z,browns,-0.303775
7775,59265,59265,Geeman447,If the bengals score we have lost already,3.0,browns,t3_zj0twv,False,0.0,:brownie-elf:,2022-12-11T13:51:08Z,browns,-0.3182
7776,59266,59266,Geeman447,Bro these refs need to take the fucking half off. And shocker. Was wondering when we’d get the dumbass Jed play.,3.0,browns,t3_zj0twv,False,0.0,:brownie-elf:,2022-12-11T13:32:09Z,browns,-0.1156777777777777
7777,59267,59267,Geeman447,I’m glad CLOWNey will be gone next year. Man isn’t worth it. Only cares about money and legit has made it known his whole career. Got his money and does nothing all year.,-2.0,browns,t3_zj0twv,False,1.0,:brownie-elf:,2022-12-11T13:30:23Z,browns,0.0340031249999999
7778,59268,59268,Geeman447,I’m getting so fucking annoyed.,3.0,browns,t3_zj0twv,False,0.0,:brownie-elf:,2022-12-11T13:28:54Z,browns,-0.489
7779,59269,59269,Geeman447,John Johnson being ass on a play? Noooo,3.0,browns,t3_zj0twv,False,0.0,:brownie-elf:,2022-12-11T13:27:06Z,browns,-0.0683
7780,59270,59270,Geeman447,I hate our annoying soft zone. Especially against burrow who loves releasing it super fastp,3.0,browns,t3_zj0twv,False,0.0,:brownie-elf:,2022-12-11T13:17:54Z,browns,0.2236
7781,59271,59271,Geeman447,Crazy how a DT actually helps on the Defense. I didn’t know DTs or LBs were important.,5.0,browns,t3_zj0twv,False,0.0,:brownie-elf:,2022-12-11T13:12:45Z,browns,0.145625
7782,59272,59272,Geeman447,"I hate seeing Chubb on the bench in the redzone. I love hunt, just wish we can have them both out there",12.0,browns,t3_zj0twv,False,0.0,:brownie-elf:,2022-12-11T13:12:08Z,browns,0.249275
7783,59273,59273,Geeman447,Are our WRs even getting open? Or is Watson really struggling reading the field?,2.0,browns,t3_zj0twv,False,0.0,:brownie-elf:,2022-12-11T13:09:00Z,browns,-0.2377
7784,59277,59277,Geeman447,Oh this is a fucking joke. Someone bring some bottles.,5.0,browns,t3_zj0twv,False,0.0,:brownie-elf:,2022-12-11T12:57:27Z,browns,0.089925
7785,59278,59278,Geeman447,Oh for fucks sake. It’s not worth it ever. Punts are so frustrating😂,3.0,browns,t3_zj0twv,False,0.0,:brownie-elf:,2022-12-11T12:55:51Z,browns,-0.1072555555555555
7786,59280,59280,Geeman447,Our DBs turn up big for these bengals games. It’s pretty funny,2.0,browns,t3_zj0twv,False,0.0,:brownie-elf:,2022-12-11T12:53:27Z,browns,0.36345
7787,59281,59281,Geeman447,Hey Kevin maybe use the best RB in football. That may help get your QB into a rhythm. Ffs,2.0,browns,t3_zj0twv,False,0.0,:brownie-elf:,2022-12-11T12:49:58Z,browns,-0.1270555555555555
7788,59283,59283,Geeman447,Oh bullshit,1.0,browns,t3_zj0twv,False,0.0,:brownie-elf:,2022-12-11T12:43:58Z,browns,-0.5859
7789,59285,59285,Geeman447,Uh Watson got the first down last time? The fuck,8.0,browns,t3_zj0twv,False,0.0,:brownie-elf:,2022-12-11T12:13:44Z,browns,-0.27115
7790,59286,59286,Geeman447,Hmm those bengals DBs weren’t talking shit that play when Chubb ran em over,3.0,browns,t3_zj0twv,False,0.0,:brownie-elf:,2022-12-11T12:12:20Z,browns,-0.296
7791,59287,59287,Geeman447,Really hoping he does okay. There’s been WAYY too much hype after one game for him. This just seems like a recipe for it turning out bad,8.0,nfl,t3_zipief,False,0.0,:Browns: Browns,2022-12-11T08:49:38Z,browns,-0.0606851851851851
8098,60257,60257,Godszn,Stefanski is too busy worrying about jersey colour schemes and not 4th down playcall schemes smh,1.0,browns,t3_zm4d19,False,0.0,:chubbatman:,2022-12-14T23:35:58Z,browns,-0.5719
8099,60258,60258,Godszn,"Playoffs were definitely difficult but because we assumed the offense would suck. 

defensive failure and losing some of those early games really really suck",100.0,browns,t3_zkm7f3,False,0.0,:chubbatman:,2022-12-12T22:51:46Z,browns,-0.610175
8100,60259,60259,Godszn,he is - we should still be a pass first offense,2.0,browns,t3_zke17b,False,0.0,:chubbatman:,2022-12-12T19:27:23Z,browns,-0.25
8101,60260,60260,Godszn,In no world is running on that play 80-90% likely to succeed given how we’ve run the ball,7.0,browns,t3_zke17b,False,0.0,:chubbatman:,2022-12-12T18:03:27Z,browns,0.5267
8102,60261,60261,Godszn,"Well if we don’t become a pass first offense with deshaun then I’m afraid he won’t be our head coach for very long. 

I also don’t think he’s rigid to being run first - I guess we’ll see",2.0,browns,t3_zke17b,False,0.0,:chubbatman:,2022-12-12T17:58:03Z,browns,-0.05755
8103,60262,60262,Godszn,"I want to see us embrace a pass heavy offense. That should be the end goal with watson at QB, and especially so with our run game sucking",1.0,browns,t3_zke17b,False,0.0,:chubbatman:,2022-12-12T17:52:05Z,browns,0.038275
8104,60263,60263,Godszn,"The playcall worked, execution didn’t. 

Look - I’d rather keep our 230m starting QB in the game, but I get the logic and it’s a unique situation where Brissett has history of being a QB sneak god and has recently played 11 games for us. 

All I’m saying is I’m not gonna armchair QB individual plays for the most part. I care about offensive production as a whole Over the remaining 4 games. I’m encouraged by the improvement from Houston to bengals game and think we’re on the right track. 

Next step imo is for stefanski to fully embrace Watson and be aggressive as a pass first offense (especially so given that our run game is legit bad right now).",5.0,browns,t3_zke17b,False,0.0,:chubbatman:,2022-12-12T17:50:45Z,browns,-0.0714204218106995
8105,60264,60264,Godszn,"the play worked but yeah he was too cute. He definitely gets too cute from time to time but that happens all the time across the NFL. Everyone loved the 4th down against the texans where Bryant got the ball.

I'm focused on how the offense looks as a whole these last 4 games as Watson shakes rust off and gets acclimated in the offense.",23.0,browns,t3_zke17b,False,0.0,:chubbatman:,2022-12-12T16:44:21Z,browns,0.021715625
8106,60265,60265,Godszn,it's his new MO. only negative stuff since we ditched baker and got Deshaun.,6.0,browns,t3_zk9dkz,False,0.0,:chubbatman:,2022-12-12T14:21:50Z,browns,-0.28595
8107,60266,60266,Godszn,"It’s WatsonSZN now, and I want stefanski to call games like it is for the rest of the season. 

Our run game and oline are legit just really bad right now, passing is in general more effective, deshaun is our 230m QB, and he needs all the reps he can get. We should be a heavy passing team from here on out. It’s been ugly watching Kevin try to run the ball the last few games. 

Sucks our season is over but it’s no surprise. The negative reaction is quite hilarious from my point of view 

Let’s see how deshaun and stefanski do over these last 4 games. It looked vastly better than last week and I want to see it even better for the final 4

After DT, WR is our next biggest need. Need more speed",-1.0,browns,t3_zjy4e6,False,1.0,:chubbatman:,2022-12-12T07:57:37Z,browns,0.010880682939291
8915,63474,63474,Hartzler44,"False. As far as I can tell, the offense was MUCH better with Brissett. You're definitely right on the rapist part though",2.0,nfl,t3_zizm5l,False,0.0,:Browns: Browns,2022-12-11T12:35:35Z,browns,-0.1394888888888888
8916,63479,63479,Hartzler44,"Probably won't event take that much. Playoff hopes we're enough to get everyone bought into the Guardians, even after ""they'd never watch the team again""",1.0,nfl,t3_zi87um,False,0.0,:Browns: Browns,2022-12-11T08:30:08Z,browns,0.21075
9231,65791,65791,IncorrectCitation,"Please dont comment on things you know nothing about.

>WR Amari Cooper was ruled questionable with a hip injury he suffered Thursday in practice.

https://www.clevelandbrowns.com/news/injury-report-browns-list-wr-amari-cooper-as-questionable-vs-bengals",5.0,browns,t3_zh3igo,False,0.0,:brownie-elf:,2022-12-09T13:52:09Z,browns,-0.0773259259259259
9499,68044,68044,IonnoFry,"Lmao I’m telling this to all my family at the watch party today

(Although we did make chili for the game…)",3.0,browns,t3_zio9bv,False,0.0,Please win for my dad's sanity,2022-12-11T10:28:26Z,browns,0.765
10257,70741,70741,Jay_Dubbbs,"Which is honestly wild in retrospect considering he  attended law school while playing for the Vikings still. During the off-season, he worked at a law firm. 

When he became a MN Supreme Court justice, he was the first AA in the state to do so.",44.0,nfl,t3_zm0d89,False,0.0,:Browns: Browns :Bills: Bills,2022-12-14T22:59:35Z,browns,0.2852333333333333
10258,70762,70762,Jay_Dubbbs,"That is one thing this last CBA did that was great for former/current players

It used to be 4 years, now it’s 3 and the average pension per year increased from 30,000 to 46,000
Per year.

If you only play the 3, it’s like $21K a year for life and then also the NFL matches 2-1 on 401K too.",4.0,nfl,t3_zgupxe,False,0.0,:Browns: Browns :Bills: Bills,2022-12-09T13:28:03Z,browns,0.483475
10822,80646,80646,MAXHEADR0OM,"Why can’t northeast Ohioans ever have anything nice. God dammit it’s the most depressing region. You’d think there was a factory here that runs on depression, because they sure get a ton of it from me.",3.0,browns,t3_zj0twv,False,1.0,:chubb:,2022-12-11T15:06:17Z,browns,-0.1200111111111111
10823,80647,80647,MAXHEADR0OM,Deshaun lives in their heads rent free.,1.0,browns,t3_zj0twv,False,0.0,:chubb:,2022-12-11T15:02:02Z,browns,0.5106
10824,80648,80648,MAXHEADR0OM,"Hey Denzel, LOOK BACK AT THE PLAY. Jesus dude, we could get some INTs too if we paid any attention at all.",2.0,browns,t3_zj0twv,False,0.0,:chubb:,2022-12-11T14:40:07Z,browns,0.1206
10825,80652,80652,MAXHEADR0OM,I feel bad for Myles. Dude gets held on every play and never gets a call.,5.0,browns,t3_zj0twv,False,0.0,:chubb:,2022-12-11T12:55:34Z,browns,0.034425
10826,80653,80653,MAXHEADR0OM,Fucking NFL. They will ALWAYS find a way to fuck the browns over whenever they can. That holding call was BS.,6.0,browns,t3_zj0twv,False,0.0,:chubb:,2022-12-11T12:53:16Z,browns,-0.0602555555555555
10827,80654,80654,MAXHEADR0OM,Watson sucks. That was a bad deal. Put Jacoby back in.,-12.0,browns,t3_zj0twv,False,0.0,:chubb:,2022-12-11T12:31:42Z,browns,-0.0736333333333333
10828,80658,80658,MAXHEADR0OM,"I don’t really get what was so special about that drive. He was moved down the field, what, like 40 yards with two penalties and he threw an int in that mess? I’m glad Rams fans can be happy but I don’t think they yet understand the dark days that lie ahead with Baker. He’s a narcissist with a bad attitude and a big ego. He’s been coddled his entire athletic career and he answers to no one but himself. He brought the Browns down in the locker room, then did the same at Carolina. He’ll do the same at LA.",-3.0,browns,t3_zgldld,False,1.0,:chubb:,2022-12-09T05:30:43Z,browns,-0.0006407008498645
10908,81252,81252,MUSinfonian,"Fourth down play wasn't bad.  DPJ got separation.  Jacoby just couldn't hit the broadside of a barn.

Jacoby hits that and nobody cares about the play.",8.0,browns,t3_zjy4e6,False,0.0,:brownie-elf:,2022-12-12T10:27:31Z,browns,0.1674359375
10909,81255,81255,MUSinfonian,There is absolutely no shot that is a catch.,1.0,browns,t3_zj0twv,False,0.0,:brownie-elf:,2022-12-11T13:21:43Z,browns,-0.3597
10910,81256,81256,MUSinfonian,Fuck Jerome Boger.,3.0,browns,t3_zj0twv,False,0.0,:brownie-elf:,2022-12-11T13:01:28Z,browns,-0.5423
10911,81257,81257,MUSinfonian,What in the absolute FUCK are these holding calls.,12.0,browns,t3_zj0twv,False,0.0,:brownie-elf:,2022-12-11T12:43:44Z,browns,-0.6408
10912,81258,81258,MUSinfonian,Well one was a challenge.,2.0,browns,t3_zj0twv,False,0.0,:brownie-elf:,2022-12-11T12:38:42Z,browns,0.34
10913,81259,81259,MUSinfonian,Pocket awareness was not that great that drive but still not looking too horrible. Just need to continue to clean it up.,2.0,browns,t3_zj0twv,False,0.0,:brownie-elf:,2022-12-11T12:34:56Z,browns,0.297825
10914,81261,81261,MUSinfonian,"Listen, if you’re bringing in the sneak god, you should be sneaking. 

Or, like, maybe a screen or something. That wasn’t necessarily a bad read but he’s not *that* accurate.",4.0,browns,t3_zj0twv,False,0.0,:brownie-elf:,2022-12-11T12:14:33Z,browns,-0.0521148148148148
10915,81262,81262,MUSinfonian,"Let’s wait until he’s off the script, but yes, he’s looking much better (or shall I say calmer) this week.",2.0,browns,t3_zj0twv,False,0.0,:brownie-elf:,2022-12-11T12:11:58Z,browns,0.8922
10916,81264,81264,MUSinfonian,"If Hilton is out, we might catch a break with their DB’s like Halloween.",2.0,browns,t3_zj0twv,False,0.0,:brownie-elf:,2022-12-11T12:09:22Z,browns,0.3612
11321,83522,83522,McWinkerbean,"What about Stefanski's job this season? Should the Browns really be 5-7? I think the record should be better. He hasn't done a good job this season or last season. Bottom line, wins/loses.",0.0,browns,t3_zm1ftt,False,0.0,:brown-jersey:,2022-12-14T19:12:19Z,browns,-0.0101248
11322,83523,83523,McWinkerbean,"Browns are a 5 win team. They will miss the playoffs again after missing them last year.  This years team has catastrophically failed in some games that should have been won. Players aren’t executing.  Offensive play calling has contributed to the losing. 

AB and Stefanski signed off on a trade that gave a record contract to a suspected sexual predator who was then suspended 11 games. 

I can’t understand those on this sun holding water for Stefanski or AB.",5.0,browns,t3_zm1ftt,False,0.0,:brown-jersey:,2022-12-14T16:53:05Z,browns,-0.0139346615780839
11323,83526,83526,McWinkerbean,Brissett is fine if everything else is working the way it should.,1.0,browns,t3_zkm7f3,False,0.0,:brown-jersey:,2022-12-13T08:09:15Z,browns,0.2023
