,Unnamed: 0.1,Unnamed: 0,author,body,score,subreddit,link_id,over_18,controversiality,author_flair_text,created_utc,flair,sentiment
57,4804,4804,80Juice,"Bieniemy has failed to land a HC job after multiple interviews, I'm pretty leary of him.",2.0,browns,t3_zm1ftt,False,0.0,Praying for Elijah Moore 🙏 ,2022-12-14T20:32:32Z,browns,-0.0258
58,4805,4805,80Juice,"He's a solid coach, for some reason he was never my favorite I guess. His scheme isn't QB friendly that's for sure, takes a good QB to work well.",1.0,browns,t3_zm1ftt,False,0.0,Praying for Elijah Moore 🙏 ,2022-12-14T20:23:40Z,browns,0.2285499999999999
59,4806,4806,80Juice,"I know, but saying ""he has his face in the play sheet on the sideline"" as a point against him isn't a valid argument. That's literally his job.",1.0,browns,t3_zm1ftt,False,0.0,Praying for Elijah Moore 🙏 ,2022-12-14T20:19:35Z,browns,0.17425
60,4808,4808,80Juice,"If you don't think head coaches have a hand in the offensive game plan and studying the play sheet during the game, you're not watching the NFL",2.0,browns,t3_zm1ftt,False,0.0,Praying for Elijah Moore 🙏 ,2022-12-14T20:04:04Z,browns,0.3818
61,4809,4809,80Juice,"Priefer has always been sloppy. Blocked FGs, bad holding, penalties on returns and illegal blocking all the time.",5.0,browns,t3_zm1ftt,False,0.0,Praying for Elijah Moore 🙏 ,2022-12-14T18:36:36Z,browns,-0.44785
62,4810,4810,80Juice,Lol like 6 other teams were pushing hard for Watson,0.0,browns,t3_zm1ftt,False,0.0,Praying for Elijah Moore 🙏 ,2022-12-14T17:33:35Z,browns,0.5994
63,4811,4811,80Juice,Lol,1.0,browns,t3_zm1ftt,False,0.0,Praying for Elijah Moore 🙏 ,2022-12-14T17:32:42Z,browns,0.4215
64,4812,4812,80Juice,Saw someone on Twitter wanting Bill O'Brien for DC lol,1.0,browns,t3_zm1ftt,False,0.0,Praying for Elijah Moore 🙏 ,2022-12-14T16:10:46Z,browns,0.4215
65,4814,4814,80Juice,"Imo there's no difference between letting Brissett take that play vs other teams calling RB Jump passes at the goal line or targeting a OT in short yardage. 
Saints also would bring in Taysom for plays when Brees was their QB. 

I'd also rather see more split work than run Chubb in the dirt. 

These are pretty subjective debates, but looking at his entire body of work, I just can't agree with firing Stefanski yet.",2.0,browns,t3_zm1ftt,False,0.0,Praying for Elijah Moore 🙏 ,2022-12-14T15:57:17Z,browns,0.0447078125
66,4815,4815,80Juice,"As far as I know Stefanksi is a offensive head coach. Wards misuage falls on Wood's shoulders in my opinion. Whether or not Stefanski should become involved is a entirely different problem, but currently I'm not blaming him for any defensive issues. 

Throwing around Watsons contract for why he should be on the field for one very specific situation, is not a factor. For me I understand the strategy behind that play call, it didn't work, not a firable mistake. 

The strength of a RB committee is the interchangeability based on their strengths. Hunt should be in on 3rd downs for pass pro *and* a recieving threat from the backfield, which he's more respected at than Chubb. The entire point of having literally 2 starters at RB is to keep them both fresh and wear down the defense. If Chubb was in on the entire drive and we put Hunt in the game in the redzone, that's not bad coaching, thats *good coaching* and *literally our offensive scheme*",1.0,browns,t3_zm1ftt,False,0.0,Praying for Elijah Moore 🙏 ,2022-12-14T15:26:42Z,browns,0.0510740393750832
67,4816,4816,80Juice,"I'd defend AB more than Stefanski. I pray he's here until he retires. He's aggressive but smart with money, he's not afraid to go after team needs in free agency and he works well with the coaches, understanding what we need for our system. 
So far his only weakness has been some of his draft picks",0.0,browns,t3_zm1ftt,False,0.0,Praying for Elijah Moore 🙏 ,2022-12-14T15:16:48Z,browns,-0.0451093749999999
68,4817,4817,80Juice,"I agree, I think AB and Stefanski were a major part of the Watson move. He'll get a full year with Watson before Haslam even considers firing him.",19.0,browns,t3_zm1ftt,False,0.0,Praying for Elijah Moore 🙏 ,2022-12-14T15:11:54Z,browns,-0.0797
69,4818,4818,80Juice,"4th and 1 play is a complete non factor. Everyone in the NFL knows Brissett is a threat in short yardage sneak situations, so passing it there is a ballsy chess move. If DPJ could've hung on to that, we'd be praising Stefanski for that very same call right now.
It's not good NFL business to go clean house in the middle of the season, firing both Priefer and Woods after the Jets game wouldn't have been smart, *even if they deserved it* 
I don't see any horrendous missusage of personnel, so you'll have to further explain that. 
He's not perfect, I'm not saying that, he bugs me with not taking 3 points early in games and his play calling with a lead is often too conservative. All I'm saying is I think he deserves a full year with Watson and hopefully a new DC and special teams coordinator.",2.0,browns,t3_zm1ftt,False,0.0,Praying for Elijah Moore 🙏 ,2022-12-14T15:08:34Z,browns,0.1057209576474622
70,4820,4820,80Juice,Pipe dream I know,15.0,browns,t3_zm1ftt,False,0.0,Praying for Elijah Moore 🙏 ,2022-12-14T14:56:02Z,browns,0.25
71,4821,4821,80Juice,I want Staley fired so we can hire him at DC,29.0,browns,t3_zm1ftt,False,0.0,Praying for Elijah Moore 🙏 ,2022-12-14T14:55:41Z,browns,-0.5106
72,4822,4822,80Juice,"I agree we are not going to change anyone's mind, but why do you dislike him? I fail to see the other sides motives on this. He's not the loud commanding locker room personality, but there are many successful coaches that aren't screaming like Robert Saleh.
Mike McDaniel for example is a fan favorite and he's worse than Stefanski.",1.0,browns,t3_zm1ftt,False,0.0,Praying for Elijah Moore 🙏 ,2022-12-14T14:54:05Z,browns,0.110489453125
73,4823,4823,80Juice,"He made Brisset rank like top 7 in QBR through the first half of the season, how does he deserve it? Defensive problems team issues fall almost entirely on Woods and Priefer.",2.0,browns,t3_zm1ftt,False,1.0,Praying for Elijah Moore 🙏 ,2022-12-14T14:50:55Z,browns,-0.0632499999999999
74,4824,4824,80Juice,"And Bowles as well, blew it with a near perfect team simply handed to him.",6.0,browns,t3_zm1ftt,False,0.0,Praying for Elijah Moore 🙏 ,2022-12-14T14:47:46Z,browns,0.7003
75,4825,4825,80Juice,"For the record I don't agree, but I wanted to share these odds because they're ridiculous.",2.0,browns,t3_zm1ftt,False,0.0,Praying for Elijah Moore 🙏 ,2022-12-14T14:43:57Z,browns,-0.2512
76,4826,4826,80Juice,"I don't mind a DB heavy scheme like we're trying to do *but* we desperately need to implement two things. 

1. Add some quality DTs. Myles and Clowney would be twice as good, if the OC had to account for good DTs as well. Part of the reason our run D is so bad, is the guys in the trenches are depth pieces or 6th round rookies getting no push. 

2. Disguise blitzes and bring more pressure. Stop putting Myles on a island and calling it a day. I finally saw some disguised pressure against Burrow last week and it worked really well, but we hadn't been consistent with it. Good example of this is Quinn in Dallas.",2.0,browns,t3_zlywuk,False,0.0,Praying for Elijah Moore 🙏 ,2022-12-14T14:42:42Z,browns,0.04252617721081
679,6323,6323,84Cressida,"Watson can over come it though

(Just ignore his 4-12 record his final season in Houston that everyone placed zero blame or accountability on him for)",0.0,browns,t3_zm1ftt,False,1.0,:browns:,2022-12-14T15:50:39Z,browns,-0.5994
680,6324,6324,84Cressida,I’ve decided this too. Yay pro choice!,1.0,nfl,t3_zlyym4,False,0.0,:Browns: Browns,2022-12-14T13:24:51Z,browns,0.28535
681,6327,6327,84Cressida,Damn right 😤,1.0,nfl,t3_zkmiyo,False,0.0,:Browns: Browns,2022-12-12T23:59:08Z,browns,-0.4019
682,6328,6328,84Cressida,Bill trying to catch legendaries with Great Balls,27.0,nfl,t3_zkmdtj,False,0.0,:Browns: Browns,2022-12-12T23:04:41Z,browns,0.6249
683,6329,6329,84Cressida,Lamar hasn’t been mentioned because he hasn’t exactly played well this year and they’ve not made a deep post-season run with him.,-9.0,nfl,t3_zkah4c,False,0.0,:Browns: Browns,2022-12-12T17:12:43Z,browns,0.5423
684,6330,6330,84Cressida,The playoffs were cancelled from 2003-2019 and then only resumed in 2020 due to COVID,103.0,nfl,t3_zkah4c,False,0.0,:Browns: Browns,2022-12-12T17:10:54Z,browns,-0.25
685,6333,6333,84Cressida,Lol,8.0,nfl,t3_zjpchy,False,0.0,:Browns: Browns,2022-12-12T00:16:33Z,browns,0.4215
686,6335,6335,84Cressida,The best part too is that Burrow has a ton of respect for Baker and supported him over the off-season. Loved the rivalry we had until it was taken.,684.0,nfl,t3_zj9h6o,False,0.0,:Browns: Browns,2022-12-11T15:27:22Z,browns,0.515325
687,6336,6336,84Cressida,I truly think prophetic,2.0,browns,t3_zj92fp,False,1.0,:browns:,2022-12-11T15:20:56Z,browns,0.4404
688,6337,6337,84Cressida,Eh that’s always been the case for years after game day. Win or lose,15.0,nfl,t3_zj98bq,False,0.0,:Browns: Browns,2022-12-11T15:18:21Z,browns,0.1366
689,6339,6339,84Cressida,Giants have come crashing back down to earth and are ahead currently. Very good chance you can overtake them,50.0,nfl,t3_zj98jv,False,0.0,:Browns: Browns,2022-12-11T15:15:43Z,browns,0.3337
690,6342,6342,84Cressida,"He had 7 with us that were games we won. Including a 14-0 deficit his very first game. 

He had several more that he brought us back in that were lost for one reason or another. 

He has his problems, but he did more than his fair share to get us back into games we lost.",1.0,nfl,t3_zj0r0q,False,0.0,:Browns: Browns,2022-12-11T15:08:53Z,browns,0.058116796875
691,6343,6343,84Cressida,"He legit has always been overrated to me, regardless of his off field problems",10.0,nfl,t3_zj0r0q,False,0.0,:Browns: Browns,2022-12-11T15:06:55Z,browns,-0.4019
692,6344,6344,84Cressida,"Going to need to post a stat that says he has the worst of all QB’s to ever play. 

And even if that is the case, Watson going a bang up job to catch up",1.0,nfl,t3_zj0r0q,False,0.0,:Browns: Browns,2022-12-11T15:06:19Z,browns,-0.100475
693,6346,6346,84Cressida,Baker is 3 days removed from a historic 4Q comeback,3.0,nfl,t3_zj0r0q,False,0.0,:Browns: Browns,2022-12-11T15:04:38Z,browns,-0.7034
694,6349,6349,84Cressida,"Down 13 with 4 left to play. 

I know a QB that can come back from that 👀",6.0,nfl,t3_zj0r0q,False,0.0,:Browns: Browns,2022-12-11T15:02:25Z,browns,0.085
695,6350,6350,84Cressida,Honestly was pretty entertaining a game if only for the absurdity,11.0,nfl,t3_zj8doc,False,0.0,:Browns: Browns,2022-12-11T15:01:14Z,browns,0.8442
696,6351,6351,84Cressida,Probably wrong for judging Engram with having Eli’s corpse and Daniel Jones,7.0,nfl,t3_zj6yyu,False,0.0,:Browns: Browns,2022-12-11T14:29:17Z,browns,-0.7783
697,6353,6353,84Cressida,Why? He was awful. Would love him at DC tho,1.0,browns,t3_zj0twv,False,0.0,:browns:,2022-12-11T14:12:38Z,browns,0.1613222222222222
698,6355,6355,84Cressida,Laughs in Baker Mayfield!!,11.0,nfl,t3_zj0r0q,False,0.0,:Browns: Browns,2022-12-11T14:09:56Z,browns,0.135275
699,6356,6356,84Cressida,He’s had a noticeable decline. Nobody bothered to pin any of it on him though and always blamed Pete,3.0,nfl,t3_zj0r0q,False,0.0,:Browns: Browns,2022-12-11T14:08:36Z,browns,-0.32985
700,6358,6358,84Cressida,Are we getting our money’s worth about of massage boy yet?,4.0,nfl,t3_zj0r0q,False,0.0,:Browns: Browns,2022-12-11T14:01:02Z,browns,0.2263
701,6360,6360,84Cressida,With a sorry ass QB!,-7.0,browns,t3_zj0twv,False,0.0,:browns:,2022-12-11T13:59:39Z,browns,-0.6239
702,6361,6361,84Cressida,Rape apologist,0.0,browns,t3_zj0twv,False,0.0,:browns:,2022-12-11T13:53:50Z,browns,-0.6908
703,6363,6363,84Cressida,Watson sucks!!,2.0,browns,t3_zj0twv,False,0.0,:browns:,2022-12-11T13:50:38Z,browns,-0.104975
704,6366,6366,84Cressida,I hate Watson but that’s ridiculous. He didn’t have control over that,5.0,nfl,t3_zj0r0q,False,0.0,:Browns: Browns,2022-12-11T13:06:15Z,browns,-0.1702
705,6367,6367,84Cressida,"I wonder what people will say if Watson loses today to a team that Baker pretty much dominated??

Especially since a ton mocked Al Michaels saying they don’t want him back",3.0,nfl,t3_zj0r0q,False,0.0,:Browns: Browns,2022-12-11T13:05:39Z,browns,-0.04765
706,6373,6373,84Cressida,Honestly I think it’s hilarious. Still don’t know how I missed the word,3.0,nfl,t3_zi0fzf,False,0.0,:Browns: Browns,2022-12-11T01:19:05Z,browns,0.0247
707,6374,6374,84Cressida,This shit seems like a repeat of last year,29.0,browns,t3_zij3ve,False,0.0,:browns:,2022-12-11T01:17:12Z,browns,-0.2732
708,6378,6378,84Cressida,Seriously I keep hearing that Rodgers has o WR’s,1.0,browns,t3_zh3igo,False,0.0,:browns:,2022-12-10T03:00:20Z,browns,-0.1779
709,6379,6379,84Cressida,"Jets country, let’s win.",28.0,nfl,t3_zhc422,False,0.0,:Browns: Browns,2022-12-09T22:10:05Z,browns,0.5859
710,6380,6380,84Cressida,Fun fact. He gave Zac Taylor and the Bengals their first road win in like two years by fumbling the last drive to win the game,11.0,nfl,t3_zhgwee,False,0.0,:Browns: Browns,2022-12-09T21:22:20Z,browns,0.5666
711,6383,6383,84Cressida,"CMC was also misused in Carolina. 

As for Landry, he had 1000 yards seasons and two pro bowls with Baker. In 2021 he was also injured a lot and quite frankly it looks like he has lost some. Hasn’t done anything of note this year",0.0,browns,t3_zh3igo,False,0.0,:browns:,2022-12-09T18:33:09Z,browns,-0.022575
712,6384,6384,84Cressida,Our fans don’t like to hear it. But Baker’s and DeShit’s career arcs are going to be linked from here on out until both are retired.,6.0,nfl,t3_zh948m,False,0.0,:Browns: Browns,2022-12-09T18:02:11Z,browns,0.0903
713,6386,6386,84Cressida,Wow.,15.0,nfl,t3_zh6wxe,False,0.0,:Browns: Browns,2022-12-09T14:28:17Z,browns,0.5859
714,6388,6388,84Cressida,Yeah. We’ve seen top QB’s like the Rams new QB throw to guys like Ben Skironic and win. Zero excuses,25.0,browns,t3_zh3igo,False,0.0,:browns:,2022-12-09T12:33:25Z,browns,0.1067962962962962
715,6389,6389,84Cressida,If he plays well or at least decent it will do a world of good for him to get interest in him back up,3.0,nfl,t3_zgpviw,False,0.0,:Browns: Browns,2022-12-09T02:43:21Z,browns,0.8402
940,7642,7642,Abiv23,"If we re-sign him do we get back our deadcap?

We are already paying him 6M next year (void year)

With his injury history i doubt many teams make an offer",1.0,browns,t3_zl7n9p,False,0.0,:dawgpound15:,2022-12-14T10:58:04Z,browns,-0.3243
1275,8943,8943,AgonizingSquid,Nah I think he'll get fired after next season imo,6.0,browns,t3_zm1ftt,False,0.0,:brown-jersey:DW is a Sex Predator,2022-12-14T16:49:38Z,browns,-0.6124
2014,16258,16258,Bandoot,"E - Elite 

L - Elite

I - Elite

T - Elite

E - Elite",1.0,browns,t3_zm1a6m,False,0.0,:Baghead:,2022-12-14T20:30:23Z,browns,0.5766
2015,16259,16259,Bandoot,"hes 

E

L

I

T

E",1.0,browns,t3_zj92fp,False,0.0,:Baghead:,2022-12-11T19:13:44Z,browns,0.5766
2016,16261,16261,Bandoot,think it was because brssett this year is like 95% on 4th and 1 or less they wanted to trick the defense into selling out on the QB sneak. obviously didn't work,1.0,nfl,t3_zj0r0q,False,0.0,:Browns: Browns,2022-12-11T12:16:56Z,browns,0.105375
2775,21343,21343,BuckyMcFly99,And this time we don’t have any incentive with a draft pick. Our incentive is building chemistry,48.0,browns,t3_zkf2ub,False,0.0,:dawg:,2022-12-12T18:25:47Z,browns,0.2709
3174,23035,23035,CD23tol,Thanks!,2.0,browns,t3_zlywuk,False,0.0,:chubbatman:,2022-12-14T16:31:42Z,browns,0.4926
3175,23036,23036,CD23tol,"keep 4-3 base

we do not have the players to run 3-4, guys like Myles and JOK aren't fits in that scheme

let the man corners play press man

Bring extra pressure off the edge to create mismatches for Myles/Clowney be it delpit. JOK, Emerson, Ward... just send some heat

Do not be named Joe Woods",51.0,browns,t3_zlywuk,False,0.0,:chubbatman:,2022-12-14T12:51:58Z,browns,0.146475
3176,23037,23037,CD23tol,"I mean, I'm going to vote yes",-17.0,nfl,t3_zlubpf,False,0.0,:Browns: Browns,2022-12-14T10:07:02Z,browns,0.4019
3177,23038,23038,CD23tol,"Watson should hit the minimum for attempts this year, will be interesting to see where he lands.

Obviously the Houston game will have some of weight and affect the data, but if he can still be near that top right quadrant after 2 years off, I’ll take it",2.0,browns,t3_zlqhhc,False,0.0,:chubbatman:,2022-12-14T07:42:24Z,browns,0.248475
3178,23040,23040,CD23tol,Sad thing is there’s a lot of people that did and think because he didn’t it’s a failed traded and everyone needs to lose their jobs now,6.0,browns,t3_zku967,False,0.0,:chubbatman:,2022-12-13T11:27:24Z,browns,-0.8442
3179,23041,23041,CD23tol,"First 7 weeks tied for league best record at 5-2, Last 7 tied for 2nd worst record weeks 2-5

Last playoff spot by virtue of tiebreaker, snuck in, let's dance",4.0,browns,t3_zkxtxb,False,0.0,:chubbatman:,2022-12-13T09:15:55Z,browns,0.4404
3180,23046,23046,CD23tol,"QB who hasn't played in 2 years is not being told to just take deep shots and make tight window throws immediately after returning...

How is that a bad thing, he was awful vs Houston, looked ""comfortable"" and about 70% of himself vs Cincy, have to think things will ramp up as the season ends and hopefully the last 2 or 3 games he's playing like his old self. 

But man not aggressive enough... find a new angle",83.0,browns,t3_zku967,False,0.0,:chubbatman:,2022-12-13T07:24:17Z,browns,0.133125
3181,23048,23048,CD23tol,I'd love for at the end of the season to see the first 11 games compared to the last 6 and see how much changed,22.0,browns,t3_zk9dkz,False,0.0,:chubbatman:,2022-12-12T14:08:33Z,browns,0.6369
3182,23050,23050,CD23tol,"I will lose faith in Stefanski if he stands by Woods and refuses to fire him. 

Like really simple guys, Boyd and Higgins out, man up chase, safety blanket the route, let someone else beat you

Myles was getting pressure all game, force burrow to come off his first read and maybe that gives myles that fraction of a second he needs to turn QB hits into sacks",104.0,browns,t3_zk9lt1,False,0.0,:chubbatman:,2022-12-12T14:01:04Z,browns,0.1588
3183,23051,23051,CD23tol,"No, Myles bad, he no win game by himself, he get sack vs bad teams no good team, trade him now, fire everyone",10.0,browns,t3_zk8hae,False,0.0,:chubbatman:,2022-12-12T13:24:50Z,browns,-0.931
3184,23052,23052,CD23tol,lol the monday after 1-15 or 0-16 were a lot darker than today,14.0,browns,t3_zk3xwg,False,0.0,:chubbatman:,2022-12-12T11:32:51Z,browns,0.4215
3185,23055,23055,CD23tol,"He'd have to be suspended by the team for one of the next games for his contract to not toll.

There is absolutely a zero percent chance we are going to suspend him for a game for cap reasons, that's how you get him to demand a release and any release is a damn near 200M dead cap hit for us making it actually impossible for us to field a roster",3.0,browns,t3_zjy4e6,False,0.0,:chubbatman:,2022-12-12T09:06:06Z,browns,-0.534975
3186,23056,23056,CD23tol,"Bengals only needed 30 yards of offense to score after a 4th down punt from their 17 own yard line...

Like that plus a flea flicker was the majority of their offense, it's crazy how that we have Burrow's number and it took a combination of a gimmick play and 53 yards in penalties for them to get 2 of their TDs

This team man just pisses me off",8.0,browns,t3_zjy4e6,False,0.0,:chubbatman:,2022-12-12T08:44:55Z,browns,-0.3818
3187,23058,23058,CD23tol,"Schwartz having stone hands was a big killer, Coop and DPJ can get open but how they get open is route running, so there will always be times where nothing seems to be open because the DB didn't bite on a stutter step or head fake, we need someone to just get separation.

I wonder what Mecole Hardman's price would be in FA",1.0,browns,t3_zjy4e6,False,0.0,:chubbatman:,2022-12-12T08:10:43Z,browns,-0.212975
3188,23059,23059,CD23tol,"He's the best player at his position in the NFL and on a reasonable contract. 

Like a ""realistic"" offer to me is the Eagles saying here is the Saints (top 5-10) pick we got in the deal for them to take Olave, Kenneth Gainwell to replace Chubb then the Eagles 2024 1st (assuming pick 25-32)

It's a ridiculous price to pay and I'd almost never trade Chubb but say we got the 6th overall pick plus another 1st and a young RB  back... you have to think it over",0.0,browns,t3_zjy4e6,False,1.0,:chubbatman:,2022-12-12T08:02:05Z,browns,0.185025
3189,23060,23060,CD23tol,"We did make it a one score game, then the first play after the kickoff Mixon ran it 60 yards up the sideline and like a minute later the Bengals made it a 2 score game again",-9.0,browns,t3_zjy4e6,False,0.0,:chubbatman:,2022-12-12T07:57:24Z,browns,0.5994
3190,23061,23061,CD23tol,">Just this season?

Well no....

>Last year the offense let the team down, this year the defense is",3.0,browns,t3_zjy4e6,False,0.0,:chubbatman:,2022-12-12T07:53:06Z,browns,0.07655
3191,23062,23062,CD23tol,"To me Stef is on the hot seat if he refuses to fire Woods (Ideally Priefer as well but at minimum Woods)

Watson was flirting with 300 yards and multiple TDs, just have to keep cleaning up ball placement. If all of a sudden over these next 4 games we have a QB throwing for 300+ and 2-3TDs on close to 70% completion and the offense overall is humming, stef is safe.",4.0,browns,t3_zjy4e6,False,0.0,:chubbatman:,2022-12-12T07:52:27Z,browns,0.225575
3192,23063,23063,CD23tol,The big one is getting healthy at Center. Chubb is more likely to do Chubb things (or any RB for that matter) when they aren’t being met 1-2 yards into the back field because the center got blown up before the hand off took place,6.0,browns,t3_zjy4e6,False,0.0,:chubbatman:,2022-12-12T07:17:09Z,browns,0.355775
3193,23064,23064,CD23tol,Oh that’s all that is people are wanting us to trade Myles and Chubb to recoup assets to rebuild again… typical reactionary fans and media,37.0,browns,t3_zjy4e6,False,0.0,:chubbatman:,2022-12-12T07:12:40Z,browns,0.1779
3194,23065,23065,CD23tol,"This season is being defined as one where we never really saw complimentary ball.

For the most part it was the defense and special teams.

2 score lead vs the Jets under 2 min left-> Loss

Falcons have a scout team RB in-> Lol he outplayed Chubb

Chargers average under 70 RuYd/Game->Ekeler go brrr

Watson finally gets into a rhythm and connects with Njoku to make it 16-10-> Mixon 60 yard fun first play Bengals get the ball back, quickly make it 23-10

That’s not even mentioning all the penalties, the returning kicks from 3 yards into the EZ and only getting to the 15. The blocked kicks, the mental lapses, the missed tackles…etc 

Last year the offense let the team down, this year the defense is",10.0,browns,t3_zjy4e6,False,0.0,:chubbatman:,2022-12-12T07:11:36Z,browns,-0.0867152343749999
3195,23066,23066,CD23tol,"Frodholt sucks

Why are we running less/less effective-> Frodholt

Why did it seem Jacoby was uneasy in the pocket his last couple games-> Frodholt

Why does Watson looked rushed at times-> Frodholt

Why does the defense commit so many penalties-> Woods? No, actually Frodholt

We need stability at Center

Also Jed’s been awful too, just not nearly as awful as our 3rd/4th string C",41.0,browns,t3_zjh4s8,False,0.0,:chubbatman:,2022-12-11T19:01:33Z,browns,-0.0220749999999999
3196,23067,23067,CD23tol,Lol no,19.0,browns,t3_zjgq1j,False,0.0,:chubbatman:,2022-12-11T18:48:37Z,browns,0.1531
3197,23068,23068,CD23tol,"Watson had a better stat line that Burrow, night and day compared to last week.

He made plays like the QB we saw he was back in houston

It sucks but the season is essentially over now

Just get the offense in sync the rest of the year

Defense and special team penalties gave Cincy too many extra opportunities. 

Whatever…

Frodholt sucks and our run game is suffering because of it",52.0,browns,t3_zj92fp,False,0.0,:chubbatman:,2022-12-11T15:09:36Z,browns,-0.1289444444444444
3198,23069,23069,CD23tol,Just a bunch of near misses on O and drive killing penalties on D,11.0,browns,t3_zj0twv,False,0.0,:chubbatman:,2022-12-11T15:02:49Z,browns,-0.743
3199,23070,23070,CD23tol,"I mean that was a perfect ball and DPJ didn’t catch it

Like maybe half a dozen QBs in the league  can put the ball there",2.0,browns,t3_zj0twv,False,0.0,:chubbatman:,2022-12-11T14:53:38Z,browns,0.7351
3200,23071,23071,CD23tol,Right off DPJs chest… damn,7.0,browns,t3_zj0twv,False,0.0,:chubbatman:,2022-12-11T14:52:20Z,browns,-0.4019
3201,23073,23073,CD23tol,"Went from a Oh my God Watson!

To Oh my God, Watson.",11.0,browns,t3_zj0twv,False,0.0,:chubbatman:,2022-12-11T14:36:40Z,browns,0.22115
3202,23074,23074,CD23tol,Just need to have their defense commit a bunch of penalties,1.0,browns,t3_zj0twv,False,0.0,:chubbatman:,2022-12-11T14:34:38Z,browns,0.4019
3203,23076,23076,CD23tol,And there’s the defense we know and hate,5.0,browns,t3_zj0twv,False,0.0,:chubbatman:,2022-12-11T14:25:06Z,browns,-0.4939
3204,23077,23077,CD23tol,More of that please,6.0,browns,t3_zj0twv,False,0.0,:chubbatman:,2022-12-11T14:22:51Z,browns,0.3744
3205,23079,23079,CD23tol,"3rd and 3, penalty then no blocking

Like this team is so mentally soft",6.0,browns,t3_zj0twv,False,0.0,:chubbatman:,2022-12-11T14:04:38Z,browns,-0.4453
3206,23081,23081,CD23tol,"Not saying he’s been perfect 

But missing a lot is a massive exaggeration",1.0,browns,t3_zj0twv,False,0.0,:chubbatman:,2022-12-11T13:58:47Z,browns,-0.1154
3207,23083,23083,CD23tol,"His incompletions were the Hail Mary, spiking it instead of a sack, a tipped pass and 2 misses 

Stop",1.0,browns,t3_zj0twv,False,0.0,:chubbatman:,2022-12-11T13:56:30Z,browns,-0.4215
3208,23085,23085,CD23tol,"Chubb gets stuffed for 1 yard  2 plays earlier…


Why aren’t we running in short yardage",2.0,browns,t3_zj0twv,False,0.0,:chubbatman:,2022-12-11T13:51:02Z,browns,0.25
