,Unnamed: 0.1,Unnamed: 0,author,body,score,subreddit,link_id,over_18,controversiality,author_flair_text,created_utc,flair,sentiment
20686,161095,161095,brandon520,That seems dumb. He's had a lot of issues since Baker has gotten hurt. At least give him a full year with Watson. Expectations should be playoffs.,117.0,browns,t3_zm1ftt,False,0.0,:browns:,2022-12-14T14:35:10Z,browns,-0.01022421875
20687,161099,161099,brandon520,I don't care. I loved Bakers attitude.  He was the dude.  Unfortunate it just didn't pan out for us with him.,7.0,browns,t3_zg6koc,False,0.0,:browns:,2022-12-09T07:54:09Z,browns,-0.1068480468749999
21534,164998,164998,burningburningburnin,No the run was doing fantastic with 18 rushes for 14 yards,2.0,nfl,t3_zj98bq,False,0.0,:Browns: Browns,2022-12-11T17:48:43Z,browns,0.34
21535,164999,164999,burningburningburnin,"Try not to draft a rapist punter next drafts

/u/JokerDeSilva10 specially for you: https://nypost.com/2022/08/26/bills-made-aware-of-matt-araiza-rape-allegations-last-month/",-13.0,nfl,t3_zj98bq,False,0.0,:Browns: Browns,2022-12-11T17:47:25Z,browns,-0.7096
21536,165000,165000,burningburningburnin,Need the same energy for Jackson Carmen,-5.0,nfl,t3_zj98bq,False,0.0,:Browns: Browns,2022-12-11T17:46:37Z,browns,0.2732
21544,165014,165014,burningburningburnin,Glad to hear you stopped supporting them when he was on the roster,1.0,nfl,t3_zj0r0q,False,0.0,:Browns: Browns,2022-12-11T14:08:56Z,browns,0.6124
21545,165016,165016,burningburningburnin,Damn I love Diggs now,2.0,nfl,t3_zj60ev,False,0.0,:Browns: Browns,2022-12-11T13:58:43Z,browns,0.3612
21546,165017,165017,burningburningburnin,"No just saying by that logic you actively supported a wifebeater

Glad you walked right into that one though",0.0,nfl,t3_zj0r0q,False,0.0,:Browns: Browns,2022-12-11T13:54:09Z,browns,0.6597
21547,165019,165019,burningburningburnin,"Did you start supporting the Bengals in 2018?

Also, missing this same energy for the Texans, Saints, Falcons and Panthers",0.0,nfl,t3_zj0r0q,False,0.0,:Browns: Browns,2022-12-11T13:48:10Z,browns,0.0972
21550,165023,165023,burningburningburnin,That was such a clear false start,7.0,nfl,t3_zj0r0q,False,0.0,:Browns: Browns,2022-12-11T13:01:38Z,browns,0.3818
21551,165024,165024,burningburningburnin,Burrow must be god awful then,-1.0,nfl,t3_zj0r0q,False,0.0,:Browns: Browns,2022-12-11T12:33:46Z,browns,-0.2263
21552,165025,165025,burningburningburnin,"Lad they were smiling, understand the hate boner but I doubt you'll find many players in the league that hate Deshaun. And I'm definitely not saying that's a good thing",1.0,nfl,t3_zj0r0q,False,0.0,:Browns: Browns,2022-12-11T12:24:25Z,browns,0.1243749999999999
21553,165026,165026,burningburningburnin,Getting a receiver close to as wide open as you'll get in the end zone is questionable?,1.0,nfl,t3_zj0r0q,False,0.0,:Browns: Browns,2022-12-11T12:23:21Z,browns,-0.296
21557,165033,165033,burningburningburnin,"As a Baker fan, there's nothing I love more than this. Kid deserves a good situation and I think he can perform very well. It was definitely the right move for both sides for him to leave the Browns but very glad to see this",5.0,nfl,t3_zgpviw,False,1.0,:Browns: Browns,2022-12-09T02:45:42Z,browns,0.3069
21772,167525,167525,central2nowhere,Orange pants and white face masks need to be worn every game next year,7.0,browns,t3_zm4d19,False,0.0,:brownie-elf:,2022-12-14T16:54:58Z,browns,-0.296
21773,167527,167527,central2nowhere,Good drive. Let’s hope our defense is pissed after the ref job on their last drive and take the ball away.,2.0,browns,t3_zj0twv,False,0.0,:brownie-elf:,2022-12-11T13:15:10Z,browns,0.00895
21774,167528,167528,central2nowhere,Tony Fields: from hero to zero,2.0,browns,t3_zj0twv,False,0.0,:brownie-elf:,2022-12-11T13:05:38Z,browns,0.5574
21775,167529,167529,central2nowhere,"We all seeing this shit, right? NFL wants Burrow and the Bengals as their new Cinderella",3.0,browns,t3_zj0twv,False,0.0,:brownie-elf:,2022-12-11T13:03:35Z,browns,-0.1607
22359,170888,170888,chubbinmypants,"Nice, bring him back on the cheap. Good guy Conklin.",42.0,browns,t3_zl7n9p,False,0.0,:chubb:,2022-12-13T15:44:00Z,browns,0.325575
22360,170889,170889,chubbinmypants,And you supported them so fuck you.,3.0,nfl,t3_zl60oi,False,1.0,:Browns: Browns,2022-12-13T14:38:43Z,browns,-0.3597
22361,170890,170890,chubbinmypants,It is remarkable. Thanks for the compliment and recognition.,-2.0,nfl,t3_zl60oi,False,0.0,:Browns: Browns,2022-12-13T14:38:19Z,browns,0.49855
22362,170892,170892,chubbinmypants,Clowney gives up on plays early all the fucking time,2.0,browns,t3_zj0twv,False,0.0,:chubb:,2022-12-11T13:31:08Z,browns,0.25
22363,170893,170893,chubbinmypants,"Yeah, fuck the Raiders",3.0,browns,t3_zgy2r8,False,0.0,:chubb:,2022-12-09T09:55:17Z,browns,-0.3182
22714,173306,173306,dannymuffins,"He hasn't had a drop issue with us, but we're used to seeing a shitload of drops over the years.",1.0,nfl,t3_zlrw0r,False,0.0,:Browns: Browns,2022-12-14T09:18:24Z,browns,0.1045
23378,174860,174860,datgenericname,(X) Doubt,1.0,browns,t3_zm1ftt,False,0.0,:browns:,2022-12-14T14:47:20Z,browns,-0.3612
23379,174865,174865,datgenericname,"I would argue that we had the LBs earlier in the year, they just all got injured. Our DTs were just so bad that on run plays they exposed our LBs to get constantly hit by the opposing offensive line.

At any rate, I hope that AB can address the DT issue this off-season.",4.0,browns,t3_zlywuk,False,0.0,:browns:,2022-12-14T13:57:56Z,browns,0.0372444444444444
23380,174866,174866,datgenericname,I think Myles could do it too - he’s that gifted - but I also think he is still better in the 4-3 than a 3-4.,8.0,browns,t3_zlywuk,False,0.0,:browns:,2022-12-14T13:42:02Z,browns,0.5927
23381,174867,174867,datgenericname,"Stay with a base 4-3 because our personnel fit that scheme best. We got the talent for a great defense, why change the system that they all work in?

However, the new guy has got to be more creative with the coverages, allow our DBs to play more man, and not go into prevent when we’re only up by 3.

Additionally, we gotta bring more pressure and use more stunts to get to the QB on defense. We got Myles, JOK, and Clowney and all three are great pas rushers, but we don’t like to overload all three to one side, run a simple stunt to confuse the offensive line, blitz DBs, or even send a basic Cover 0 full house blitz when it 3rd and long. 

In other words, play to our strengths, allow our players to be aggressive, and set them up to actually be successful.",38.0,browns,t3_zlywuk,False,0.0,:browns:,2022-12-14T13:12:22Z,browns,0.1246262881515775
23382,174879,174879,datgenericname,🔥🔥🔥FIRE JOE WOODS🔥🔥🔥,3.0,browns,t3_zk9lt1,False,0.0,:browns:,2022-12-12T14:34:40Z,browns,-0.875
23383,174880,174880,datgenericname,"
When Baker was here, we were able to run the ball consistently all year. Outside of Conklin and Hurbert getting hurt, the offensive line was mainly intact all year and was a big part of the offense being so successful.

This year, we were able to run the ball at a great clip early in the season, but we had some issues with o-line creep up (mainly injuries to the center of the line). We haven’t been able to run the ball consistently since. Combine that with having a career backup and then a quarterback who hasn’t played in 2 yrs throwing the ball, and I am not surprised the offense is as bad as the stats say. 

Turns out being able to run the ball consistently make an offense work better, who knew?",23.0,browns,t3_zk9dkz,False,0.0,:browns:,2022-12-12T14:12:57Z,browns,0.0308428755144032
23384,174883,174883,datgenericname,">> or is there any FA RTs worth bringing in?

A silent but deadly one from within our own facility is prolly what we’ll do, but hopefully we can rip one off the market this off-season.",9.0,browns,t3_zjy4e6,False,0.0,:browns:,2022-12-12T08:19:28Z,browns,0.331525
23385,174884,174884,datgenericname,Same. They trade Myles and/or Chubb and I’ll suddenly have a lot of free time on Sundays.,16.0,browns,t3_zjy4e6,False,0.0,:browns:,2022-12-12T08:14:04Z,browns,0.2553
23386,174887,174887,datgenericname,"James Hudson will prolly be our RT after this year. He was pretty good filling in before for Conklin.

As far as LT, well…idk",5.0,browns,t3_zjh4s8,False,0.0,:browns:,2022-12-11T19:51:05Z,browns,0.0807666666666666
23387,174889,174889,datgenericname,They can if their playing the Raiders lol,-7.0,browns,t3_zj92fp,False,0.0,:browns:,2022-12-11T18:37:28Z,browns,0.5574
23388,174892,174892,datgenericname,The o-line is missing their starting and backup centers. It’s really affecting our offense.,40.0,browns,t3_zj92fp,False,0.0,:browns:,2022-12-11T15:20:14Z,browns,-0.2290999999999999
23389,174893,174893,datgenericname,"After this game, I think he is starting to come into form (a good amount of this throws were there, but the WR dropped it). So prolly expect him to make another step forward next week to consistently make plays.

Reality is that we are done chasing a wildcard slot and are going to use the rest of the year to get the offense fully figured out with Watson.",1.0,browns,t3_zj92fp,False,0.0,:browns:,2022-12-11T15:17:26Z,browns,-0.0467333333333333
23390,174894,174894,datgenericname,"Stefanski can design a great offense, but he’s gotta make the call to get rid of Priefer and Woods. They’re liabilities and are wasting the talent on this team.",24.0,browns,t3_zj92fp,False,0.0,:browns:,2022-12-11T15:13:20Z,browns,-0.023525
23391,174895,174895,datgenericname,"I mean, he was actually playing better. Can’t make your receivers catch the ball.

The interception was bad though, I’ll give you that one.",5.0,browns,t3_zj0twv,False,0.0,:browns:,2022-12-11T15:07:06Z,browns,-0.1595851851851852
23392,174896,174896,datgenericname,I tolerate the Bengals. I loathe the Steelers and Ratbirds.,3.0,browns,t3_zj0twv,False,0.0,:browns:,2022-12-11T15:06:13Z,browns,-0.24695
23393,174897,174897,datgenericname,"Well, the receiver was supposed to catch the ball when he gets his hands on it, but it didn’t happen.",2.0,browns,t3_zj0twv,False,0.0,:browns:,2022-12-11T15:03:32Z,browns,0.1406
23394,174898,174898,datgenericname,I wouldn’t say 4 is accurate. They’ve definitely been playing with fire and want to win; they’ve just been very undisciplined on ST and defense.,1.0,browns,t3_zj0twv,False,0.0,:browns:,2022-12-11T14:59:59Z,browns,0.38585
23395,174899,174899,datgenericname,"WRs blew it there at the end. Sucks, but is what it is.",2.0,browns,t3_zj0twv,False,0.0,:browns:,2022-12-11T14:54:37Z,browns,-0.09505
23396,174900,174900,datgenericname,"Score the TD and then play good defense.

It’s asking a lot of this Browns team, but it’s doable.",2.0,browns,t3_zj0twv,False,0.0,:browns:,2022-12-11T14:47:25Z,browns,0.175075
23397,174902,174902,datgenericname,"Agreed. Watson was late on the throw and threw it a bit short, but it was a great play by the safety just to get there.",1.0,browns,t3_zj0twv,False,0.0,:browns:,2022-12-11T14:40:51Z,browns,0.53095
23398,174903,174903,datgenericname,He’s doing more in two games than Russell has been able to all year. I think we’ll be fine.,1.0,browns,t3_zj0twv,False,0.0,:browns:,2022-12-11T14:38:19Z,browns,0.10115
23399,174906,174906,datgenericname,I could care less if we didn’t get a single turnover if we could just consistently get stops. That’s what the real issue is.,2.0,browns,t3_zj0twv,False,0.0,:browns:,2022-12-11T14:32:24Z,browns,0.09545
23400,174907,174907,datgenericname,The Warden taking an afternoons worth of frustration out on Chase there lol,11.0,browns,t3_zj0twv,False,0.0,:browns:,2022-12-11T14:27:51Z,browns,0.1531
23401,174908,174908,datgenericname,"We finally get a TD, and on queue, our defense gives up a huge run.",2.0,browns,t3_zj0twv,False,0.0,:browns:,2022-12-11T14:25:50Z,browns,0.4215
23402,174909,174909,datgenericname,I think Watson is starting to show he can sling it in this offense.,1.0,browns,t3_zj0twv,False,0.0,:browns:,2022-12-11T14:25:01Z,browns,-0.3071
23403,174912,174912,datgenericname,"We scored quite a few last game.

Oh, you mean on offense? Yeah…it’s been awhile lol",3.0,browns,t3_zj0twv,False,0.0,:browns:,2022-12-11T13:52:51Z,browns,0.1127222222222222
23404,174913,174913,datgenericname,This is the optimism I can get behind.,2.0,browns,t3_zj0twv,False,0.0,:browns:,2022-12-11T13:48:52Z,browns,0.5423
23405,174916,174916,datgenericname,We have more yardage than the Bengals. The defense has been playing pretty decent so far today.,1.0,browns,t3_zj0twv,False,0.0,:browns:,2022-12-11T13:19:25Z,browns,0.33525
23406,174917,174917,datgenericname,Watson has been playing just fine. Wtf are you watching?,3.0,browns,t3_zj0twv,False,0.0,:browns:,2022-12-11T13:18:14Z,browns,-0.1975
23407,174918,174918,datgenericname,"We got points. Yay!

Edit : that’s a good thing.",4.0,browns,t3_zj0twv,False,0.0,:browns:,2022-12-11T13:13:24Z,browns,0.2102111111111111
23408,174919,174919,datgenericname,"It’s 7-0. The refs and Priefer just fucked us there, but the game isn’t over yet.",3.0,browns,t3_zj0twv,False,0.0,:browns:,2022-12-11T13:05:28Z,browns,-0.20095
23409,174920,174920,datgenericname,The running into the kicker was a big fuck up. The PI and the hands to the face calls were bullshit calls.,1.0,browns,t3_zj0twv,False,0.0,:browns:,2022-12-11T13:04:49Z,browns,-0.428525
23410,174922,174922,datgenericname,"Bengals couldn’t do anything offense, so the refs and Preifer help them drive down the field.",8.0,browns,t3_zj0twv,False,0.0,:browns:,2022-12-11T13:02:11Z,browns,0.1779
23411,174923,174923,datgenericname,Refball baby! Woo!,4.0,browns,t3_zj0twv,False,0.0,:browns:,2022-12-11T12:58:39Z,browns,0.26275
23412,174924,174924,datgenericname,"Ravens are gonna collapse again this year just like last. 

Bummer.",18.0,browns,t3_zij3ve,False,0.0,:browns:,2022-12-11T07:25:03Z,browns,-0.235375
23413,174931,174931,datgenericname,"Eh…the defense is a bit iffy this year (obligatory 🔥🔥🔥FIRE JOE WOODS 🔥🔥🔥) but I get what you are saying. 

They’re not the ‘PoVeRtY fRaNcHiSe’ that folks want them to forever be. They’re at least competitive in most games now, which is way better than what we have seen from them since the turn of the century.",1.0,nfl,t3_zgmwwh,False,0.0,:Browns: Browns :Chargers: Chargers,2022-12-09T11:57:12Z,browns,0.1705703703703703
23800,176316,176316,deviden,"Ahh great - so ESPN are sweating over all the smart analysts outside their network moving to stats like EPA/DVOA and CPOE and away from their closed-source proprietary QBR number, and have come up with a new closed source ""FPI"" stat for their guys to push.

QBR - the stat that had Tim Tebow rated as one of them best QBs in the league until they quietly corrected some of the hidden underlying math. Idk why we should trust FPI when we have perfectly good open source metrics to use instead.",1.0,browns,t3_zk9dkz,False,0.0,:crazy-joe:,2022-12-14T11:20:51Z,browns,0.3943777777777777
23801,176317,176317,deviden,"To be fair to ESPN - plenty of the Cleveland guys hate the team, franchise, and indeed themselves even more than Trotter does so sometimes it's a case of picking your poison. 

That said, ESPN can eat a dick. They've got some good people but I'm not wading through the shit ones to get to them.",1.0,browns,t3_zk9dkz,False,0.0,:crazy-joe:,2022-12-14T11:15:48Z,browns,0.1886851851851851
23802,176318,176318,deviden,"the misuse of data by hot take artists makes me want to block every source of NFL content except The Athletic, Football Outsiders, The Ringer (Ben Solak is the man) and a handful of others.",1.0,browns,t3_zku967,False,0.0,:crazy-joe:,2022-12-14T10:58:49Z,browns,-0.3818
23803,176319,176319,deviden,"Probably for the remainder of this roster cycle, unless there's a complete meltdown in Berea, or unless Stefanski fails with Watson on offense in 2023, or Stefanski refuses to hire a proper DC to replace Joe Woods.

Zac Taylor was AWFUL until he had both a franchise QB to elevate his offense and hired a great DC to handle that side of the ball, then he has had great success. Stefanski got us a playoff win with a mid QB and a terrible defense, he deserve the chance to have at least one year with a real QB talent and one more shot to hire a real DC. 

We're basically locked in to this group of veterans until the 2025 offeason before it's possible for any kind of rebuild so we might as well see it out unless there's some truly egregious Hue Jackson/Freddie shit unfolding. 

If shit doesn't work out then by Jan 2025 we'll be looking at least stable/mediocre rather than league's worst dumpster fire (which we were from '99 all the way up until Stefanski/Berry), and we can give the new coach the chance to rebuild the roster his way either around Watson or with the knowledge that Watson can be traded or dumped within a year or two.",2.0,browns,t3_zjgq1j,False,0.0,:crazy-joe:,2022-12-12T10:04:27Z,browns,-0.170671968
23804,176320,176320,deviden,"people might want to work with the Haslams if they prove to the league that they can give a coach like Stefanski a decent run at the job and build some stability into what has been the most unstable franchise in the league since '99

¯\\\_(ツ)_/¯",1.0,browns,t3_zjgq1j,False,0.0,:crazy-joe:,2022-12-12T09:42:07Z,browns,0.0018
23805,176321,176321,deviden,"These idiots seem to spend a lot of time on football but apparently only 1999-2018 Browns football because they dont have any idea how the sport works, or how successful teams operate. 

You trade away Chubb and/or Myles and the locker room is DEAD. They will read that as the franchise giving up on the roster and starting a rebuild *because that's what rebuilding teams do*. 

I fuckin' swear, the Cleveland sports media and loud sections of the fanbase are worse than the team. Every 2 years demanding a rebuild because that's all they've ever known, as though repeating the same bullshit cycle of short term moves and knee-jerk firings is somehow eventually gonna land us on a hall of fame HC/QB/GM trio and take us to the Promised Land like spinning a roulette wheel. 

Fire Stefanski

Fire Berry

Trade Chubb

Trade Garrett

And then what? Back to where we were in 2016, with a demotivated roster with no stars, and a Hue Jackson tier coach desperate enough to take the job because nobody good would go anywhere near a franchise that has CHOSEN to be among the worst in the league instead of seeing out a playoff winning coach's tenure. 

I guess then some of these pathologically miserable fans will finally be happy - they'll have a team they can relentlessly hate every week, repeat the same old complaints at, because for these people it's better not to have any hope at all than for a team to fall short.",17.0,browns,t3_zjy4e6,False,0.0,:crazy-joe:,2022-12-12T09:39:13Z,browns,-0.0092849253714084
23806,176322,176322,deviden,"I love this idea that Cleveland firing Stefanski is gonna result in us getting the opportunity to hire someone like Kyle Shanahan - probably a top 5 active coach in the league, who had the kind of clout that allowed him to specifically choose his destination and go to one of the great winning franchises of all time. 

Like all the best coaches around the NFL are just DESPERATE for the opportunity to work for Jimmy Haslam and bet their family's future and wellbeing on a franchise that has yet to prove it can even get one head coach to see out a full 5 year contract.  

Maybe if Stefanski is given a decent amount of time and job security by the time we come to a hiring cycle we won't be getting our invitations to interviews turned down by HC candidates like we were when we fired Kitchens and hired Stefanski.",3.0,browns,t3_zjgq1j,False,0.0,:crazy-joe:,2022-12-12T09:16:41Z,browns,0.1452074074074074
23807,176323,176323,deviden,"I guess this idea that KS is just an OC is some talk radio meme that wont die, right?

Just look at the other team in Ohio, Zac Taylor. Absolutely sucked ass for two years on both sides of the ball, terrible record, until he got the franchise QB in good health and managed to hire the right defensive coordinator. 

There's no good reason not to give Stefanski the same opportunity - a year with this guy that's supposed to be a FQB and one more go at getting the right DC in Berea.",1.0,browns,t3_zjgq1j,False,0.0,:crazy-joe:,2022-12-12T09:07:45Z,browns,-0.022831640625
23808,176324,176324,deviden,"""untouchable"", jfc. 

dude's not above criticism but I swear you're all so burned by the Browns hire-fire-fail-hire-fire-fail cycle since 1999 you dont know any other way that football can be. 

The reality is that most HC hires are duds. Most of the time when you fire a guy with an above .500 record (like Stefanski), who's been dealing with a bunch of adversity, and you do it before they've had a full go at it, the chances are the next guy you'll get is worse. So when you've got a guy who's average or above you keep them until you've got someone better lined up for an interview, that's how the good franchises do it.

We'd also be subjected to Watson demanding a big say in the next hiring. You know who he wanted in Houston? Eric Bienemy. YIKES.

When Stefanski was hired other coaches were turning down Cleveland's requests to interview them. That's how bad this organization and owner's rep is around the league. You're not getting the next Sean McVay or Kyle Shanahan if you dont give KS a fair run at the job, you're getting the next Hackett/Kitchens/McAdoo/Rhule instead - i.e. what we've mostly had since '99. The good coaches know what's up and know which franchises you take an interview with.

Just look at the other team in Ohio, the young coach they hired. Absolutely sucked ass for two years, terrible record, until he got the franchise QB in good health and managed to hire the right defensive coordinator. There's no good reason not to give Stefanski the same opportunity - a FQB and one more go at getting the right DC in Berea.",9.0,browns,t3_zjgq1j,False,0.0,:crazy-joe:,2022-12-12T08:53:56Z,browns,0.0031886757900098
23809,176325,176325,deviden,I've seen people here blame Stefanski for Watson deciding not to keep the ball on a zone-read play. These people literally don't know how offense works but they sure as shit got some strong opinions about it.,5.0,browns,t3_zjgq1j,False,0.0,:crazy-joe:,2022-12-12T08:40:43Z,browns,0.2174
23810,176326,176326,deviden,"Then why do you do this to yourself? Is someone forcing you to watch Browns football and hang around in a fans forum?

You don’t have to be miserable, there’s a world of hobbies and interests out there.",1.0,browns,t3_zj92fp,False,0.0,:crazy-joe:,2022-12-11T16:13:36Z,browns,-0.0986666666666666
24159,179414,179414,dullpencils,Did you hear them say “Josh Johnson” earlier lol,1.0,browns,t3_zj0twv,False,0.0,IN MYLES WE TRUST,2022-12-11T14:24:05Z,browns,0.4215
24160,179415,179415,dullpencils,"I know you guys are mad but I love that 4th down call. Wide open in the end zone, Brissett just didn’t make the throw.",10.0,browns,t3_zj0twv,False,0.0,IN MYLES WE TRUST,2022-12-11T12:14:47Z,browns,0.1727
24647,181830,181830,fear865,I was up 2 points against my opponent going into last night. They had Kyler Murray. Sucks that’s how I won this week but I’m now 2nd place in the league somehow,4.0,browns,t3_zkxtxb,False,0.0,:joe-cool:,2022-12-13T09:10:58Z,browns,0.0510333333333333
24648,181832,181832,fear865,Are we sure Joe Woods is a real person?,13.0,browns,t3_zk9lt1,False,0.0,:joe-cool:,2022-12-12T14:04:54Z,browns,0.3182
24649,181834,181834,fear865,If we don't fire woods this offseason Stefanski is going to be on the hottest of seats,12.0,nfl,t3_zk1tia,False,0.0,:Browns: Browns,2022-12-12T10:13:02Z,browns,0.2584
24650,181836,181836,fear865,Pretty solid thanks for asking. Rams winning last night helped the Browns chances to sneaking into the playoffs,3.0,browns,t3_zgldld,False,0.0,:joe-cool:,2022-12-09T10:09:00Z,browns,0.511375
25088,184072,184072,foxmag86,And a Jon Gruden email has leaked.,2.0,nfl,t3_zl6715,False,0.0,:Browns: Browns,2022-12-13T23:37:32Z,browns,-0.3182
25089,184073,184073,foxmag86,And a Gruden email will leak.,1.0,nfl,t3_zl3xa0,False,0.0,:Browns: Browns,2022-12-13T23:35:22Z,browns,-0.34
25090,184087,184087,foxmag86,"I didn't expect to win, but late in the game trailing 23-10 our offense had **3** separate drives to try and make it a one score game, and couldn't do it.  That was disappointing to me.",63.0,browns,t3_zjy4e6,False,0.0,:browns:,2022-12-12T07:51:15Z,browns,-0.3839
25091,184092,184092,foxmag86,I WANT YOUR TESTICLES IN THE C-GAP!!!,2.0,browns,t3_zj92fp,False,0.0,:browns:,2022-12-11T16:12:41Z,browns,0.055625
25092,184099,184099,foxmag86,Isn’t it obnoxious to get anywhere in New York City?,-3.0,nfl,t3_zh0joo,False,0.0,:Browns: Browns,2022-12-09T18:02:15Z,browns,-0.4588
25093,184100,184100,foxmag86,It really is such a bland and boring stadium. And this was around the time when awesome stadiums were starting to be built￼.  You would think for the New York teams they would have went all out.￼,3.0,nfl,t3_zh0joo,False,0.0,:Browns: Browns,2022-12-09T18:01:15Z,browns,0.0576481481481481
25386,185961,185961,gettin,"NBA renamed their MVP trophy after Jordan....

Will the NFL name an award after Brady?

Belichick?",3.0,nfl,t3_zkxsym,False,0.0,:Browns: Browns :Browns: Browns,2022-12-13T12:24:17Z,browns,0.135575
25387,185962,185962,gettin,"If he got his arm removed by an Andean Condor, he would still be ready for Week 1.  Dude is that tough.

Let him play.",10.0,browns,t3_zkf2ub,False,0.0,:browns:,2022-12-12T17:50:49Z,browns,0.1124888888888889
25388,185963,185963,gettin,"1. OL - shit

2. Secondary - shit

3. TEs, RBs and WRs - good

4. Special Teams - shit

5. DC - shit

6. Playcalling - shit

7. QB - incomplete (see what I did there?)

8. DL - shitty shit

9. LBs - shit",-3.0,browns,t3_zjy4e6,False,0.0,:browns:,2022-12-12T11:56:13Z,browns,-0.0573046119156562
