,Unnamed: 0.1,Unnamed: 0,author,body,score,subreddit,link_id,over_18,controversiality,author_flair_text,created_utc,flair,sentiment
25389,185965,185965,gettin,"Who, Burrow or Watson? I think youre missing my point...",1.0,browns,t3_zj92fp,False,0.0,:browns:,2022-12-11T22:16:47Z,browns,-0.148
25390,185966,185966,gettin,"Burrow does not have his key receivers:  OMG, how can he function?  Just wait until they are all healthy

Watson has a shell of an OLine:  Why did the Browns shell out for this bum?",4.0,browns,t3_zj92fp,False,0.0,:browns:,2022-12-11T19:45:56Z,browns,0.20095
25391,185967,185967,gettin,"Agree. You cannot win in this league without a top flight QB.  These last games will get him ready for next year.  This team sucks, I dont know what everyone wants Watson to do this year.",1.0,browns,t3_zj92fp,False,0.0,:browns:,2022-12-11T15:23:42Z,browns,-0.07516875
25392,185968,185968,gettin,"""we need to clean that up""

No question he will say that.  Good call.",40.0,browns,t3_zj92fp,False,0.0,:browns:,2022-12-11T15:20:00Z,browns,0.2522
25393,185969,185969,gettin,"Kevski coaches like a poker player with a short stack.  He knows that he is good when he plays from a lead but cannot play from behind.  And he is wiling to risk early points in order for the chance to score an early TD.

He does not have faith that his offense can come from behind, and that is how he justifies going for on 4th down early and taking early shots.",3.0,browns,t3_zj92fp,False,0.0,:browns:,2022-12-11T15:18:58Z,browns,-0.1295703125
25394,185970,185970,gettin,"""We have to limit mistakes""

""I thought Deshaun played well and I liked his effort""

""Too many penalties - and that starts with me""

-Kevski, in 20 minutes",180.0,browns,t3_zj92fp,False,0.0,:browns:,2022-12-11T15:14:14Z,browns,0.5859
25395,185972,185972,gettin,"Cooper - only 6 targets

Chubb - only 14 carries (2 targets)

22 plays to your top offensive threats out of a total of 64 plays

That ain't enough",0.0,browns,t3_zj0twv,False,1.0,:browns:,2022-12-11T14:55:59Z,browns,-0.1868
25396,185974,185974,gettin,"Burrow gets a tipped pass intercepted and it is a ""gift""... 

If this was your first NFL game after emerging from a coma, you would think that Burrow has 4 Super Bowl rings",2.0,browns,t3_zj0twv,False,0.0,:browns:,2022-12-11T14:45:22Z,browns,0.4098
25397,185975,185975,gettin,"If this was Brisket we would all be bitching about the defense, penalties, and coaching.

But since it's Watson, it is his fault that they cannot scheme to get Cooper open, stop Chase, or commit 37 holding penalties?",0.0,browns,t3_zj0twv,False,1.0,:browns:,2022-12-11T14:40:24Z,browns,-0.313225
25398,185977,185977,gettin,"I think the Bengals are better than the Browns this year.

I also think the Bengals are better than every team but 3-4 in the whole league.

However, the Browns match up pretty well and with less penalties and a new Defensive Coordinator, they can be right there with them ... next year",4.0,browns,t3_zj0twv,False,0.0,:browns:,2022-12-11T14:29:09Z,browns,0.2626777777777777
25399,185979,185979,gettin,"I don't know who needs to hear this, but Watson is not the reason why the Browns are losing this game.",0.0,browns,t3_zj0twv,False,1.0,:browns:,2022-12-11T14:10:34Z,browns,-0.5267
25400,185980,185980,gettin,"If Emerson is the Browns best cover guy this year, why is he not on Chase?  

Their other wideout threats are all hurt, right?",3.0,browns,t3_zj0twv,False,0.0,:browns:,2022-12-11T14:08:10Z,browns,-0.2083249999999999
25401,185981,185981,gettin,Weird - it's almost like they are throwing short passes underneath and quick outs every play...  any adjustments?,3.0,browns,t3_zj0twv,False,0.0,:browns:,2022-12-11T13:58:06Z,browns,0.4417
25402,185982,185982,gettin,"Too many penalties.

JJ3 got burned on the TD.

Watson looked much better.

Let's see what happens, Browns get the ball to start the 2nd half...",4.0,browns,t3_zj0twv,False,0.0,:browns:,2022-12-11T13:43:03Z,browns,0.027525
25403,185984,185984,gettin,More impressed  w the Browns D than anything.,4.0,browns,t3_zj0twv,False,0.0,:browns:,2022-12-11T12:42:05Z,browns,0.5256
25404,185985,185985,gettin,Can they give the Bengals 34 replays before they decide to challenge?  WTF?,8.0,browns,t3_zj0twv,False,0.0,:browns:,2022-12-11T12:20:57Z,browns,-0.27365
25405,185987,185987,gettin,"I see a lot of QBs on that list that have better W-L records and better playoff records.  I get you are a fan and all, but from what I see he is just a guy.  Nothing special.",-3.0,nfl,t3_zh5mqw,False,0.0,:Browns: Browns :Browns: Browns,2022-12-09T15:00:44Z,browns,-0.0586407407407407
25406,185988,185988,gettin,Agree 100%,1.0,nfl,t3_zh5mqw,False,0.0,:Browns: Browns :Browns: Browns,2022-12-09T13:58:59Z,browns,0.3612
25407,185989,185989,gettin,"Guy is WAY under 0.500 as a starting QB and has zero playoff wins. Maybe, just maybe, he is not a good QB?  Just a thought.",-2.0,nfl,t3_zh5mqw,False,0.0,:Browns: Browns :Browns: Browns,2022-12-09T13:56:22Z,browns,-0.0167296296296296
25408,185992,185992,gettin,Had to get to the third paragraph before the excuses rolled in.  Impressive.,1.0,nfl,t3_zgzi1t,False,0.0,:Browns: Browns :Browns: Browns,2022-12-09T13:22:03Z,browns,0.2553
25409,185993,185993,gettin,"And he is overrated as well.  Thanks for making my point.
When these rankings came out, this (along with many others) had Carr in or close to the top 10.  If not for Wilson, he would be the worst QB in his division by a lot.

Like I said, Jake Delhomme.

Are you related to him or something?",0.0,nfl,t3_zgzi1t,False,0.0,:Browns: Browns :Browns: Browns,2022-12-09T13:12:22Z,browns,0.0073588648834019
25410,185994,185994,gettin,"I think they should, but they should not get a home field game unless they seed in the top 4.",0.0,nfl,t3_zh3oiu,False,0.0,:Browns: Browns :Browns: Browns,2022-12-09T12:47:14Z,browns,0.296
25411,185995,185995,gettin,I think I hit a nerve with super fan,-1.0,nfl,t3_zgzi1t,False,0.0,:Browns: Browns :Browns: Browns,2022-12-09T12:26:13Z,browns,0.7351
25412,185996,185996,gettin,"Hey, it is Free Talk.  So there.",-1.0,nfl,t3_zgzi1t,False,0.0,:Browns: Browns :Browns: Browns,2022-12-09T12:23:28Z,browns,0.12765
25413,185997,185997,gettin,"> Derek Carr

Quick search shows him over your boy Kirk and Jalen Hurts.  He is the modern day Jake Delhomme.

https://www.sportingnews.com/us/nfl/news/nfl-quarterback-rankings-2022-qbs-best-worst/su5vrdsuvm0dnr2aaaxsudiz",-5.0,nfl,t3_zgzi1t,False,0.0,:Browns: Browns :Browns: Browns,2022-12-09T12:09:08Z,browns,-0.0176555555555555
25414,185999,185999,gettin,Lost in the whole Baker comeback last night is the fact that Derek Carr is one of the most OVERRATED QBs in the NFL and is STILL getting a pass (no pun intended) as the conversation is all about the Rams and Baker,-1.0,nfl,t3_zgzi1t,False,1.0,:Browns: Browns :Browns: Browns,2022-12-09T12:00:39Z,browns,-0.3182
26347,189121,189121,gryffon5147,"Stefanski isn't getting fired this year unless Haslam loses his mind. 

He's part of the core group that brought Watson in, I'm sure all sorts of promises were made on what kind of offense they'd build in the coming years.  

Besides, who is even out there that we'd bring in?  Some coordinator on some hot team? 

Definitely need to rethink his entire staff and roster - we really need to get back to the drawing board.",53.0,browns,t3_zm1ftt,False,0.0,:browns:,2022-12-14T14:54:46Z,browns,0.081044032
26348,189125,189125,gryffon5147,Lol that's how I read it,18.0,browns,t3_zl7n9p,False,0.0,:browns:,2022-12-13T16:26:57Z,browns,0.4215
26349,189132,189132,gryffon5147,"Good drive.  Just keep slinging it out to DPJ, Njoku and Cooper.",4.0,browns,t3_zj0twv,False,0.0,:browns:,2022-12-11T14:23:48Z,browns,0.1101
26350,189133,189133,gryffon5147,"This O-line has just regressed with injuries, penalties and mistakes.",4.0,browns,t3_zj0twv,False,0.0,:browns:,2022-12-11T14:04:38Z,browns,-0.3612
26351,189134,189134,gryffon5147,It can be done.  Bengals aren't playing like some super team either.  Reminds me of the Bucs game.,1.0,browns,t3_zj0twv,False,0.0,:browns:,2022-12-11T14:00:31Z,browns,0.0328333333333333
26352,189137,189137,gryffon5147,Exactly lol,1.0,browns,t3_zj0twv,False,0.0,:browns:,2022-12-11T13:48:12Z,browns,0.4215
26353,189138,189138,gryffon5147,He's the least of our problems in today's game.,0.0,browns,t3_zj0twv,False,0.0,:browns:,2022-12-11T13:47:19Z,browns,-0.4019
26354,189139,189139,gryffon5147,At least Cade has confidence lol,7.0,browns,t3_zj0twv,False,0.0,:browns:,2022-12-11T13:34:30Z,browns,0.7269
26355,189140,189140,gryffon5147,Significant penalties on both of Bengals TD drives.  What a mess.,3.0,browns,t3_zj0twv,False,0.0,:browns:,2022-12-11T13:30:30Z,browns,-0.130025
26356,189141,189141,gryffon5147,Our play calling just isn't that creative.,4.0,browns,t3_zj0twv,False,0.0,:browns:,2022-12-11T13:14:13Z,browns,-0.0015
26357,189142,189142,gryffon5147,"Ward is just not good, and he's being paid like a pro-bowler.",-4.0,browns,t3_zj0twv,False,1.0,:browns:,2022-12-11T13:02:33Z,browns,0.0243
26358,189143,189143,gryffon5147,NFL is such a shitty product compared to college football.,5.0,browns,t3_zj0twv,False,0.0,:browns:,2022-12-11T12:59:01Z,browns,-0.5574
26359,189144,189144,gryffon5147,Goddamn so many unnecessary penalties.,3.0,browns,t3_zj0twv,False,0.0,:browns:,2022-12-11T12:57:59Z,browns,-0.4767
26360,189147,189147,gryffon5147,Should have run that play on 3rd down.,1.0,browns,t3_zj0twv,False,0.0,:browns:,2022-12-11T12:15:50Z,browns,0.34
26361,189153,189153,gryffon5147,Yeah.  I don't even like the dude when he wins.  Dude has absolutely zero goodwill with me if he's a loser - he better play a lot better this week.,0.0,browns,t3_zh3igo,False,1.0,:browns:,2022-12-09T16:04:08Z,browns,0.2484629629629629
26362,189154,189154,gryffon5147,"""best"" cb",1.0,browns,t3_zh3igo,False,0.0,:browns:,2022-12-09T16:02:21Z,browns,0.6369
26363,189155,189155,gryffon5147,"Half the team is ""questionable""",6.0,browns,t3_zh3igo,False,0.0,:browns:,2022-12-09T16:01:36Z,browns,-0.296
26409,189364,189364,gsnumis,LMAO,2.0,browns,t3_zj0twv,False,0.0,:dawg:,2022-12-11T14:42:51Z,browns,0.5994
26410,189365,189365,gsnumis,Fuck yourself,1.0,browns,t3_zj0twv,False,0.0,:dawg:,2022-12-11T14:39:51Z,browns,-0.5423
26411,189366,189366,gsnumis,I was hopeful but I’m also a realist and I think we knew this was a least a possibility. For as much as we gave up we need to let him try and work through the issues while finishing up this season.,1.0,browns,t3_zj0twv,False,0.0,:dawg:,2022-12-11T13:59:29Z,browns,0.07115
26412,189368,189368,gsnumis,Missed less than burrow so far,1.0,browns,t3_zj0twv,False,0.0,:dawg:,2022-12-11T13:55:55Z,browns,-0.296
26413,189369,189369,gsnumis,Can’t watch the game and all I see are comments about how bad Watson looks. His stat line is comparable to burrows at this point in the game so what am I missing or is it just browns fans being browns fans?,13.0,browns,t3_zj0twv,False,0.0,:dawg:,2022-12-11T13:53:45Z,browns,-0.283575
26530,190340,190340,hatmantc,yes they would have to change the logo for this to happen.,-1.0,browns,t3_zltu14,False,0.0,:brownie-elf:,2022-12-14T10:08:18Z,browns,0.4019
26531,190342,190342,hatmantc,">and penalties matter…

they sure do. when you give up 58 yards on one drive that ends in a TD",5.0,browns,t3_zjy4e6,False,0.0,:brownie-elf:,2022-12-12T11:09:23Z,browns,0.07955
26532,190343,190343,hatmantc,Offense has been pretty good most of the year though,74.0,browns,t3_zjgq1j,False,0.0,:brownie-elf:,2022-12-11T18:45:49Z,browns,0.6249
27595,198382,198382,jake753,It’s the holiday season. “Fuck you” from a Steelers fan is my Merry Christmas.,17.0,steelers,t3_zlx26e,False,0.0,:CLE1::CLE2: Cleveland Browns,2022-12-14T15:01:23Z,browns,0.450625
27596,198383,198383,jake753,"Not exactly sure either. As u/Sage296 said, it’s likely the whole Ben era.",6.0,steelers,t3_zlx26e,False,0.0,:CLE1::CLE2: Cleveland Browns,2022-12-14T12:26:52Z,browns,-0.060275
27597,198385,198385,jake753,"Typically I would agree, but I have a *deep respect* for Rooney when the Browns were moved from Cleveland to Baltimore. 

[Here is the article about the move with Rooney’s words](https://www.deseret.com/1995/11/13/19204296/steelers-browns-rivalry-could-be-coming-to-an-end?_amp=true)

Note the classy move from Steelers fans wearing Orange armbands for Browns fans.",3.0,browns,t3_zldvvo,False,0.0,:joe-cool:,2022-12-14T11:32:23Z,browns,0.3976
27598,198387,198387,jake753,"That’s more than fair. Bandwagon fans suck ass, especially those that are holier than thou when it comes to fandom.",6.0,browns,t3_zldvvo,False,0.0,:joe-cool:,2022-12-14T09:45:20Z,browns,-0.28095
27599,198389,198389,jake753,"If we can’t do it, I want the Bengals to do it. 

If the Browns AND the Bengals can’t do it, I want the Steelers to do it.

If the Browns AND the Bengals AND the Steelers can’t do it, I want any Lake Erie Bro to do it.

Fuck the Ravens. Fuck Art Modell.

Edit: downvotes to the right.",17.0,browns,t3_zldvvo,False,0.0,:joe-cool:,2022-12-13T21:24:14Z,browns,-0.0175033864883401
27600,198390,198390,jake753,"Poor one for me too, thanks.",4.0,browns,t3_zl5q9d,False,0.0,:joe-cool:,2022-12-13T14:41:11Z,browns,-0.0516
27601,198391,198391,jake753,"Yes hi, I would like to die please.",89.0,browns,t3_zl5q9d,False,0.0,:joe-cool:,2022-12-13T14:18:53Z,browns,0.3818
27602,198395,198395,jake753,My man woke up and chose violence. Wandering into the Browns subreddit with a baseball bat and swinging at peoples heads because they don’t share your opinion is ballsy as hell.,11.0,browns,t3_zjy4e6,False,0.0,:joe-cool:,2022-12-12T07:35:42Z,browns,-0.419575
27603,198396,198396,jake753,"In no way shape or form am I defending a rapist. The Browns sold their soul for this bitch ass QB, so in doing so they are going to see what they spent money on. That’s not excusing a rapist and just telling it like it is.",3.0,nfl,t3_zj9u3s,False,0.0,:Browns: Browns,2022-12-11T16:09:55Z,browns,0.1270148148148148
27604,198397,198397,jake753,So rape is ok if the player is collecting a paycheck to ride pine? Get the fuck out of town with that bullshit ass argument.,1.0,nfl,t3_zj98bq,False,1.0,:Browns: Browns,2022-12-11T16:07:19Z,browns,-0.59825
27605,198398,198398,jake753,"Literally never said that. Also, you have a child rapist on your team that the Bengals knew about before drafting him. So there’s that.",-1.0,nfl,t3_zj98bq,False,1.0,:Browns: Browns,2022-12-11T15:57:19Z,browns,-0.0788444444444444
27606,198399,198399,jake753,"I absolutely agree. But no one asked me. His past talent was not worth it given his morals. 

Had someone asked me, I would have given up those picks for Dak and not looked back.",3.0,nfl,t3_zj9u3s,False,0.0,:Browns: Browns,2022-12-11T15:46:40Z,browns,0.012617578125
27607,198400,198400,jake753,"Not sure how how this is “true colors.” Looking at his on the field play and setting aside the fact that he’s a serial sexual assaulter who deserves to burn in hell, he didn’t play a bad game today. You see my flair and assume I’m defending him being a gigantic piece of shit.",-4.0,nfl,t3_zj98bq,False,1.0,:Browns: Browns,2022-12-11T15:42:10Z,browns,-0.463725
27608,198401,198401,jake753,"Yes, looking at his game only and not taking into account that he’s a serial sexual assaulter, he didn’t do bad today.",-8.0,nfl,t3_zj98bq,False,0.0,:Browns: Browns,2022-12-11T15:40:20Z,browns,-0.2023
27609,198402,198402,jake753,"Allegations aside, he didn’t look bad today. Lot of issues with the Browns o-line. Can’t run the ball if the O-Line can’t block.

Edit: definitely bad wording. I genuinely hope the dude burns in hell for eternity, but not looking at the off field issues, he didn’t play as bad as r/NFL is making it out to be.",-30.0,nfl,t3_zj98bq,False,0.0,:Browns: Browns,2022-12-11T15:31:50Z,browns,-0.120248736
27610,198404,198404,jake753,We need to fix the o-line for sure. Can’t get the run game going if the line gets beat at the snap.,1.0,browns,t3_zj92fp,False,0.0,:joe-cool:,2022-12-11T15:12:03Z,browns,0.07955
27611,198405,198405,jake753,Not sure about that screen play. They are burning us in every other facet but that was just a bad call for the Bengals.,2.0,nfl,t3_zj0r0q,False,0.0,:Browns: Browns,2022-12-11T14:28:09Z,browns,-0.3197
27612,198406,198406,jake753,GOOD OL ZONE COVERAGE. HAS WORKED ALL SEASON RIGHT?,6.0,nfl,t3_zj0r0q,False,0.0,:Browns: Browns,2022-12-11T14:26:00Z,browns,0.1101
27613,198407,198407,jake753,Lol fucking NOPE,2.0,nfl,t3_zj0r0q,False,0.0,:Browns: Browns,2022-12-11T14:24:50Z,browns,0.4215
27614,198408,198408,jake753,Browns defense needs to be better here,4.0,nfl,t3_zj0r0q,False,0.0,:Browns: Browns,2022-12-11T14:24:30Z,browns,0.5267
27615,198409,198409,jake753,Can’t complain about not running the ball when this oline is a turnstile,7.0,browns,t3_zj0twv,False,0.0,:joe-cool:,2022-12-11T14:16:58Z,browns,-0.3612
27616,198410,198410,jake753,This oline is struggling hard right now,2.0,browns,t3_zj0twv,False,0.0,:joe-cool:,2022-12-11T14:15:10Z,browns,-0.4939
27617,198412,198412,jake753,"A lot of people aren’t going to like that call, but I have no problem with it.",6.0,browns,t3_zj0twv,False,0.0,:joe-cool:,2022-12-11T12:14:11Z,browns,0.5628
27618,198414,198414,jake753,u/RedditsDarkKnight sees a post about Browns defense and said “you want to feel good about a player not Watson? Not on my fucking watch!”,5.0,nfl,t3_ziwm3b,False,0.0,:Browns: Browns,2022-12-11T10:00:46Z,browns,0.142975
27619,198415,198415,jake753,Yeah but it’s totally different. Carman is a bench player so it doesn’t count!,9.0,browns,t3_ziva0n,False,0.0,:joe-cool:,2022-12-11T09:25:56Z,browns,0.038275
27620,198416,198416,jake753,I have the flu. I hate everything.,3.0,browns,t3_ziva0n,False,0.0,:joe-cool:,2022-12-11T09:20:33Z,browns,-0.3813999999999999
27621,198420,198420,jake753,Casually not mentioning Carmen.,-7.0,bengals,t3_zhufxq,False,0.0, ,2022-12-10T12:26:10Z,browns,0.1779
27622,198422,198422,jake753,..they said doing verbal somersaults. So rape of a minor is cool if you are riding pine?,-31.0,bengals,t3_zhufxq,False,0.0, ,2022-12-10T11:44:51Z,browns,-0.28545
27623,198423,198423,jake753,"My point is that every team has shitty people on in. I’m going to keep supporting the Browns (minis Watson, feel free to break his legs) just like you’re going to continue to support your team with people like Carman and Mixon on the team.

Further, it’s kind of hilarious that on a post about Browns fans doing mental gymnastics to justify Watson, you specifically are doing mental gymnastics to justify Carman.

Edit: Being downvoted for asking you to break Watson’s legs. Smh",-61.0,bengals,t3_zhufxq,False,0.0, ,2022-12-10T11:30:13Z,browns,-0.0596193279999999
27624,198426,198426,jake753,"No worries, I’ll just do your job for you 😉",3.0,browns,t3_zhsp37,False,0.0,:joe-cool:,2022-12-10T10:49:39Z,browns,0.3252
27625,198427,198427,jake753,I feel like this didn’t need it own post but instead is more of a reply to the thread below this one. I haven’t seen Will Fullers name pop up at all until just now. It’s not like everyone is pounding the table for him.,33.0,browns,t3_zhsp37,False,0.0,:joe-cool:,2022-12-10T07:38:59Z,browns,-0.0847925925925926
27626,198428,198428,jake753,I miss him 😢,1.0,kansascitychiefs,t3_zgmm7r,False,0.0,Browns Helmet,2022-12-09T21:51:04Z,browns,-0.5719
28047,199498,199498,jenso2k,"yup, even if he was the best special teams coach on the planet I wouldn’t give a single fuck if we fired him. that being said he also isn’t a good special teams coach, so good riddance",25.0,browns,t3_zm1ftt,False,0.0,:brownie-elf:,2022-12-14T18:15:41Z,browns,0.4138
28048,199499,199499,jenso2k,"he’s so big for us, imagine our receivers without him. it would literally be Coop and everyone else lol",2.0,browns,t3_zm1a6m,False,0.0,:brownie-elf:,2022-12-14T16:42:33Z,browns,0.21075
28049,199503,199503,jenso2k,"that’s how older browns fans feel (and younger too i’m sure, but most of browns friends hate the steelers more) which I understand, and believe me I don’t like the ravens at all, but that was before my time. if you grow up in certain parts of ohio there’s a very annoying split of steelers and browns fans, which makes the steelers very hateable (plus Big Ben and the fact they used to stomp us constantly). at least the Ravens have Lamar who is super likeable",11.0,nfl,t3_zl15zg,False,0.0,:Browns: Browns,2022-12-13T17:28:09Z,browns,0.2560148148148148
28050,199504,199504,jenso2k,"for the first time ever for me it’s basically a three way tie, i’ve never disliked the bengals as much as I have lately. but usually it’s steelers -> ravens -> bengals, with steelers and ravens swapping spots sometimes",16.0,nfl,t3_zl15zg,False,0.0,:Browns: Browns,2022-12-13T17:11:52Z,browns,0.077225
28051,199505,199505,jenso2k,yeah? well my brain suggests that we’re trying to ease him back in after he didn’t play for 700 fucking days. but i’m no datalogist tbf,1.0,browns,t3_zku967,False,0.0,:brownie-elf:,2022-12-13T09:22:54Z,browns,-0.0497148148148148
28052,199507,199507,jenso2k,besides QB it’s always seemed like the hardest position to me. not only from a talent standpoint but also from a mental standpoint,17.0,nfl,t3_zk8w0y,False,0.0,:Browns: Browns,2022-12-12T22:51:26Z,browns,0.20345
28053,199511,199511,jenso2k,"our O-line is what lost us the game, or at least the chance at a close game. Watson played well, the defense was decent (good enough to win). but our run game couldn’t get going because of it and Watson was constantly pressured",6.0,browns,t3_zjh4s8,False,0.0,:brownie-elf:,2022-12-11T20:47:01Z,browns,-0.0132925925925925
28054,199512,199512,jenso2k,his first season coaching us we went 11-5 and almost won the divisional game..,3.0,browns,t3_zj92fp,False,0.0,:brownie-elf:,2022-12-11T15:19:18Z,browns,0.5279
28055,199513,199513,jenso2k,"these fucking announcers and refs are going to drive me insane, that was so clearly a first",5.0,browns,t3_zj0twv,False,0.0,:brownie-elf:,2022-12-11T14:49:47Z,browns,0.2002
28056,199514,199514,jenso2k,"as good as Jacoby has been for us, I already see why Deshaun is gonna be way better",9.0,browns,t3_zj0twv,False,0.0,:brownie-elf:,2022-12-11T14:45:59Z,browns,0.7003
28057,199515,199515,jenso2k,wtf is that spot??!,15.0,browns,t3_zj0twv,False,0.0,:brownie-elf:,2022-12-11T14:43:39Z,browns,-0.15805
28058,199516,199516,jenso2k,why did he try to pitch that back 😭 at least we got the pick!! that’s huge,8.0,browns,t3_zj0twv,False,0.0,:brownie-elf:,2022-12-11T14:41:58Z,browns,0.0166999999999999
28059,199517,199517,jenso2k,and… 😞,2.0,browns,t3_zj0twv,False,0.0,:brownie-elf:,2022-12-11T14:35:36Z,browns,-0.4767
28060,199518,199518,jenso2k,OKAY WATSON,2.0,browns,t3_zj0twv,False,0.0,:brownie-elf:,2022-12-11T14:35:00Z,browns,0.2263
28061,199522,199522,jenso2k,"bro the one announcer literally sounds sad about it lmao, “he breaks… the plane :,(((((“",4.0,browns,t3_zj0twv,False,0.0,:brownie-elf:,2022-12-11T14:23:00Z,browns,0.2023
28062,199525,199525,jenso2k,"yes, these guys suck",3.0,browns,t3_zj0twv,False,0.0,:brownie-elf:,2022-12-11T13:59:55Z,browns,-0.0516
28063,199526,199526,jenso2k,"i was about to fucking go off lmao, thank god",2.0,browns,t3_zj0twv,False,0.0,:brownie-elf:,2022-12-11T13:57:17Z,browns,0.83
28064,199527,199527,jenso2k,yeah because every fucking sack there’s a phantom call,1.0,browns,t3_zj0twv,False,0.0,:brownie-elf:,2022-12-11T13:56:06Z,browns,0.296
28065,199528,199528,jenso2k,"I literally don’t even care about the playoffs, it isn’t likely we make them anyways. I just want to keep our winstreak against Cinci alive, their fanbase is so goddamn annoying. for the first time in my life i’m starting to dislike the Bengals more than the Steelers/Ravens, which is insane",3.0,browns,t3_zj0twv,False,0.0,:brownie-elf:,2022-12-11T13:52:55Z,browns,-0.2669185185185185
28066,199529,199529,jenso2k,"great try tbh, deshaun is looking way better this game (obviously not back to form yet, but def better)",11.0,browns,t3_zj0twv,False,0.0,:brownie-elf:,2022-12-11T13:34:27Z,browns,0.81
28067,199530,199530,jenso2k,is it just me or is this the most boring game we’ve had all year,11.0,browns,t3_zj0twv,False,0.0,:brownie-elf:,2022-12-11T13:21:55Z,browns,-0.3804
28068,199531,199531,jenso2k,"this sub lmao, you’ll see 5 “THROW THE BALL” and 5 “RUN THE BALL” comments in a 5 minute span",9.0,browns,t3_zj0twv,False,0.0,:brownie-elf:,2022-12-11T13:09:27Z,browns,0.5994
28069,199532,199532,jenso2k,great pass,1.0,browns,t3_zj0twv,False,0.0,:brownie-elf:,2022-12-11T13:08:28Z,browns,0.6249
28070,199533,199533,jenso2k,what the absolute fuck is that call,2.0,browns,t3_zj0twv,False,0.0,:brownie-elf:,2022-12-11T12:57:59Z,browns,-0.5423
28071,199534,199534,jenso2k,"i’m really liking how Alex Wright is coming along, Berrys picks this draft are looking very solid",3.0,browns,t3_zj0twv,False,0.0,:brownie-elf:,2022-12-11T12:52:11Z,browns,0.5975
28072,199535,199535,jenso2k,"aghhh why, just sneak it!! i guarantee we get that",3.0,browns,t3_zj0twv,False,0.0,:brownie-elf:,2022-12-11T12:13:38Z,browns,0.125
28073,199538,199538,jenso2k,"for sure, I could definitely see him playing another couple seasons which is just fucking ridiculous lol",85.0,nfl,t3_zhvdlo,False,0.0,:Browns: Browns,2022-12-10T11:07:57Z,browns,0.7257
28074,199539,199539,jenso2k,"I agree with you completely, a lot of people in this sub have no idea what they’re talking about. Cooper DPJ Njoku is a fantastic pass catching trio, and add in David Bell who should def improve, and maybe Schwartz if he can figure his shit out in the offseason and we’re more than fine. Watson hit almost 5000 yards passing with a worse group of pass catchers. We now have a very expensive QB, we’re no longer in “sign all the receivers!” land.",-2.0,browns,t3_zhsp37,False,0.0,:brownie-elf:,2022-12-10T10:48:59Z,browns,-0.1098421875
