,Unnamed: 0.1,Unnamed: 0,author,body,score,subreddit,link_id,over_18,controversiality,author_flair_text,created_utc,flair,sentiment
13471,97689,97689,OptimisticRealist__,"I have a very hard time seeing him being there in the 4th. In my latest mock i penciled him in in the early 3rd, and thats before the combine. If he performes well hes almost guaranteed to go earlier, imo",3.0,browns,t3_10jd4u3,False,0.0,:orange_pants:,2023-01-23T09:36:07Z,browns,0.0377111111111111
13472,97690,97690,OptimisticRealist__,"Entirely depends on how the board falls. For example, my pre combine expectation is, that many WRs who are regarding 1st round picks will actually be day 2 guys. Imo Addison is the only one that could be considered a 1st round lock.

That means that there is tremendous value to be had in the 2nd round with WRs, so depending on who is available this might be a route to go.

The DL depth this year is also pretty solid.

So if the board falls well, i could see is move back a few slots to get and additional 5th or something, as ammunition to trade back up in the 3rd later on.

I have a hard time seeing us trading out of the 2nd entirely, at this point. But theres still a lot of time between now and the draft.",11.0,browns,t3_10jf29s,False,0.0,:orange_pants:,2023-01-23T09:34:41Z,browns,-0.0009158294677734
13473,97707,97707,OptimisticRealist__,"I said it when Burrow and Herbert were drafted, that id give Baker in a heartbeat for either one of them. 

Was called a hater. My sentiment is still true to this day.",8.0,browns,t3_10iryea,False,0.0,:orange_pants:,2023-01-22T14:56:42Z,browns,0.0936666666666666
13474,97708,97708,OptimisticRealist__,"And would they have changed the outcome? No. People watch these football movies with these grandiose half time speeches and expect real life coaches to be this way too. Its hilarious. This is real life, not hollywood. 

The only think players genuinely care about it authenticity, a coach throwing a tantrum wont magically make a WR catch the ball better or a kicker kick better lol",2.0,browns,t3_10hn0fo,False,0.0,:orange_pants:,2023-01-22T09:32:38Z,browns,0.1418939814814814
13475,97716,97716,OptimisticRealist__,"Absolutely irresponsible having the guy play in this condition. Sooner or later this will get ugly.

This adoration of athletes playing in conditions they have no business playing in is so absurd. Yeah, its cool you are passionate and want to win - doesnt make it any less stupid and dangerous. 

Now cue the neckbeards in mom's basement who would call Mahomes ""soft"" if he sat out lol",-1.0,nfl,t3_10i1il6,False,1.0,:Browns: Browns,2023-01-21T16:12:09Z,browns,0.1158860479999999
13476,97717,97717,OptimisticRealist__,"The point is respect towards others. Im european and grew up playing soccer, which i played semi professionally for a while. When i was young a talent scout brought me into one of my country's pro teams. There we had a very talented squad of U16s, probably the best in the nation.

Our coach, however, was one of the old school type who would constantly yell, lash out and throw fits when something went wrong.

Now, when you first encounter that as an impressionable youth (inwas 14 at the time) it scares you - when you play scared, youre more prone to making mistakes. Furthermore, after a while you just grow numb to the yelling because you expect it, and youve heard it all before. The point is, many people underestimate the negative demotivating aspect such a behavior can have on some players.

Save to say, we finished 4th and were behijd the expectations. The coach ""retired"" (aka was sacked) and in came a new, younger one. He was the complete opposite, he was calm and methodical in his approach. A lot more focused on tactics rather than yelling, and when we made mistakes he would explain in the team meetings what exactly went wrong, what he expects us to do differently in this situation etc. He gave us constructive criticism and essentially a toolkit to deal with whatever we encountered in the pitch.
We finished 1st the very next year. (Shoutout coach P.)

So yeah, my point is that i do think having an unwavering presence in times of chaos can do a lot for the psyche of athletes, especially when things dont go right. I think it can kinda prevent players falling into a negative self enforcing spiral, if that makes sense.",5.0,browns,t3_10hn0fo,False,0.0,:orange_pants:,2023-01-21T07:54:40Z,browns,-0.0408543438583472
13477,97718,97718,OptimisticRealist__,"Well said. If i showed up to the office to find my boss yelling at me in a choleric tantrum, it wouldnt motivate me to work better, id think what a dolt that guy is and search for a new job lol. 

Respect is the key word here as you said. The players are grown men, treat them with respect not like some cattle.",20.0,browns,t3_10hn0fo,False,0.0,:orange_pants:,2023-01-21T05:08:12Z,browns,0.1763265625
13478,97719,97719,OptimisticRealist__,"This is an excerpt from the full interview that was posted here earlier: https://www.reddit.com/r/Browns/comments/10h2ko5/kevin_stefanski_instudio_923_the_fan_ken_carmen/?utm_medium=android_app&utm_source=share

Just wanted to share this particular quote since it has been a rather hot topic recently. 
In my opinion Stefanski is a 100% correct here, cooler heads prevail.",76.0,browns,t3_10hn0fo,False,0.0,:orange_pants:,2023-01-21T03:04:49Z,browns,0.074
13479,97722,97722,OptimisticRealist__,"The chargers are really going to ruin Herbert, arent they? One of the most gifted QBs to come out of college in the last 10 years and they are gonna blow it",1.0,nfl,t3_10gkfdd,False,0.0,:Browns: Browns,2023-01-20T07:23:44Z,browns,-0.1551
14013,105072,105072,PsychologicalGuest97,"They still might see themselves as overlooked by the media or something, I don’t know.",3.0,browns,t3_10l4vm7,False,0.0,:brownie-elf: Brownie sees you when you’re sleeping,2023-01-25T16:42:47Z,browns,-0.0258
14014,105073,105073,PsychologicalGuest97,"I may get flak for this, but also Terry Bradshaw in a way. The championships won seemed to be more so a product of the Steelers defense during the 1970’s. Not saying Terry didn’t play a role, he obviously did, but he wasn’t an elite QB. May be hard to judge though since it was a long time ago.",3.0,browns,t3_10l22vw,False,0.0,:brownie-elf: Brownie sees you when you’re sleeping,2023-01-25T16:41:24Z,browns,-0.001859375
14015,105075,105075,PsychologicalGuest97,"Panthers. Week 1 curse broken, for now.",2.0,browns,t3_10l4vm7,False,0.0,:brownie-elf: Brownie sees you when you’re sleeping,2023-01-25T15:11:06Z,browns,-0.3825
14016,105078,105078,PsychologicalGuest97,"I’m a little surprised they haven’t scored more than 30 points, at least once in the past 6 games, considering the weapons they have on offense.",10.0,browns,t3_10kixhq,False,0.0,:brownie-elf: Brownie sees you when you’re sleeping,2023-01-24T17:20:30Z,browns,-0.5095
14017,105083,105083,PsychologicalGuest97,The 49ers offense is good too. It’s not just their defense winning games.,1.0,browns,t3_10k6o56,False,0.0,:brownie-elf: Brownie sees you when you’re sleeping,2023-01-24T11:22:29Z,browns,0.288675
14018,105084,105084,PsychologicalGuest97,"As you did, everyone should be allowed to talk and criticize so long as it doesn’t instigate fighting.",3.0,bengals,t3_10k6awh,False,0.0, Browns,2023-01-24T09:25:23Z,browns,-0.6249
14019,105086,105086,PsychologicalGuest97,"I played basketball growing up. It was a lot of fun. Learned more about the game by playing it, more than I may have been able to learn if I only watched the Cavs. I still enjoy watching the Cavs though, even in the post-LBJ years.",2.0,browns,t3_10jvvi4,False,0.0,:brownie-elf: Brownie sees you when you’re sleeping,2023-01-24T05:30:43Z,browns,0.145958984375
14020,105087,105087,PsychologicalGuest97,"Yeah, comparing the Bengals to the Ravens and Steelers, in terms of hatred, seems weird to me. There is a legit rival with the Steelers, and with the Ravens, I cannot think of a team I despise more. I don’t love the Bengals or anything but I certainly don’t hate them nearly as much as the Steelers and Ravens.",6.0,browns,t3_10jqle1,False,0.0,:brownie-elf: Brownie sees you when you’re sleeping,2023-01-23T17:40:43Z,browns,-0.0889592592592592
14021,105088,105088,PsychologicalGuest97,"Really? That is not the impression I gathered myself. There are probably some out there, but for the most part, they seemed to have conducted themselves well, and I am mainly a Browns fan.

Like I just went over to their sub, and there are several comments, some highly upvoted, saying not to troll, be gracious, etc.

[Here is one](https://www.reddit.com/r/bengals/comments/10ixf53/comment/j5h7i6v/?utm_source=share&utm_medium=web2x&context=3)

[Another one](https://www.reddit.com/r/bengals/comments/10ixf53/comment/j5h3xvt/?utm_source=share&utm_medium=web2x&context=3)

[One more](https://www.reddit.com/r/bengals/comments/10ixf53/comment/j5h68ey/?utm_source=share&utm_medium=web2x&context=3)

Again, not saying there aren't some being cocky, but the general sentiment has mostly been well-mannered.",0.0,buffalobills,t3_10jccvd,False,1.0,:still-bill:,2023-01-23T10:31:46Z,browns,0.0710512
14022,105089,105089,PsychologicalGuest97,"It’s kind of weird to imply most Bengal fans have “no love” for the Bills when, after what happened to Damar, many people donated, shared their condolences, and even held vigils outside the stadium.",4.0,buffalobills,t3_10jccvd,False,0.0,:still-bill:,2023-01-23T10:22:47Z,browns,0.1045
14023,105090,105090,PsychologicalGuest97,Pretty sure they are joking,-6.0,buffalobills,t3_10jccvd,False,0.0,:still-bill:,2023-01-23T10:18:00Z,browns,0.7506
14024,105092,105092,PsychologicalGuest97,"Ofc Maher is choking now, but when I played against him in fantasy he kicked ass and knocked me out of the playoffs",0.0,nfl,t3_10iwzvh,False,0.0,:Browns: Browns,2023-01-22T18:27:05Z,browns,-0.5647
14025,105094,105094,PsychologicalGuest97,That looks like a fumble in my opinion.,2.0,nfl,t3_10irx3e,False,0.0,:Browns: Browns,2023-01-22T16:38:07Z,browns,0.3612
14026,105095,105095,PsychologicalGuest97,I’m disappointed the Lions missed the playoffs. They were getting hot too near the end of the season.,1.0,browns,t3_10iryea,False,0.0,:brownie-elf: Brownie sees you when you’re sleeping,2023-01-22T16:31:50Z,browns,-0.16215
14027,105096,105096,PsychologicalGuest97,The Bills aren’t bad but the expectations people had for them going into the season was definitely higher than their worth,1.0,nfl,t3_10irx3e,False,0.0,:Browns: Browns,2023-01-22T16:26:29Z,browns,0.5647
14028,105098,105098,PsychologicalGuest97,"The NFL is not worse than the NBA. Players openly violate rules all the time, often in more egregious ways. One example of this was when the Cavs were facing the Celtics this year and Jaylen Brown traveled to the moon and back, but it wasn’t called.",2.0,browns,t3_10iryea,False,0.0,:brownie-elf: Brownie sees you when you’re sleeping,2023-01-22T15:46:11Z,browns,-0.0410851851851851
14029,105099,105099,PsychologicalGuest97,"Jags impressed me but they had a good shot at winning the division. Colts and Texans both sucked so they were only competing really with the Titans, and they imploded like a dying star at the end of the regular season. Football is all about getting hot at the right time, and the Jags did just that. Have to wait and see if they can be good consistently.",2.0,browns,t3_10iryea,False,0.0,:brownie-elf: Brownie sees you when you’re sleeping,2023-01-22T15:44:09Z,browns,0.111570703125
14030,105100,105100,PsychologicalGuest97,Unfortunately there are people there who want to excise Browns fans from the sub. It’s not a lot of them but definitely a vocal bunch.,8.0,browns,t3_10itkhy,False,0.0,:brownie-elf: Brownie sees you when you’re sleeping,2023-01-22T15:34:32Z,browns,0.20665
14031,105101,105101,PsychologicalGuest97,That play was **worse** than the helmet to helmet. That one has a larger impact on the outcome of the game.,1.0,browns,t3_10i3cwz,False,0.0,:brownie-elf: Brownie sees you when you’re sleeping,2023-01-22T06:22:24Z,browns,-0.044475
14032,105102,105102,PsychologicalGuest97,"All was going well for my career. I had a sports scholarship to Ohio State. But, tragedy struck when I suffered a high ankle sprain. At that point, I couldn’t play a snap of football again. Could have been the next Peyton Manning.",11.0,nfl,t3_10i45z6,False,0.0,:Browns: Browns,2023-01-21T17:04:45Z,browns,0.006237024
14033,105106,105106,PsychologicalGuest97,"Humans are complicated. Some respond better to calmness under given situations. Being calm when making strategic decisions usually means you’re less likely to overlook something. 

The fiery persona can definitely function as a motivator for players, but when making strategic decisions, maintaining a level head is almost a requirement to calling good plays.",4.0,browns,t3_10hn0fo,False,0.0,:brownie-elf: Brownie sees you when you’re sleeping,2023-01-21T09:14:38Z,browns,0.22
14034,105107,105107,PsychologicalGuest97,I didn’t say you were calling for Kev to be a douche bag. All I said was employing both attitudes should be done situationally.,10.0,browns,t3_10hn0fo,False,0.0,:brownie-elf: Brownie sees you when you’re sleeping,2023-01-21T09:08:28Z,browns,-0.0903
14035,105108,105108,PsychologicalGuest97,"I do not see how this quote vindicates “Kevin out-thinking himself in critical moments”. All that’s being said is he gets mad but maintains composure for the sake of being able to think clearly. If anything, this suggests **the exact opposite** of your claim; maintaining composure helps Kevin think through his decisions, thus decreasing the likelihood of making a mistake in critical moments. That isn’t the same as “over-thinking”.",8.0,browns,t3_10hn0fo,False,0.0,:brownie-elf: Brownie sees you when you’re sleeping,2023-01-21T07:20:38Z,browns,-0.0112953125
14036,105109,105109,PsychologicalGuest97,"Some like a calm collected leader and others a fiery one. Honestly, a coach should adhere to both attitudes depending on the situation and players they are speaking to.",24.0,browns,t3_10hn0fo,False,0.0,:brownie-elf: Brownie sees you when you’re sleeping,2023-01-21T07:13:38Z,browns,0.3144
14037,105110,105110,PsychologicalGuest97,"Funnily enough I’ve seen more Vikings fans say the call did not meaningfully affect the outcome of that game than Rams fans.

I swear that Tracy Porter keeps them up at night. Waking up in a cold sweat from that Favre interception like 14 years ago.",16.0,saints,t3_10gyspm,False,0.0,Gold Helmet,2023-01-20T16:38:25Z,browns,0.1309777777777777
14379,105860,105860,ReddyMcRedditorface,"Oh shit, bill on bill violence.",1.0,browns,t3_10iryea,False,0.0,TANY,2023-01-22T16:26:04Z,browns,-0.8271
14380,105861,105861,ReddyMcRedditorface,"When all of the motivations factor each other out, cincy has looked like a much better team.",3.0,browns,t3_10iryea,False,0.0,TANY,2023-01-22T16:13:37Z,browns,0.6597
14381,105862,105862,ReddyMcRedditorface,The same reason most of the league hates us.,3.0,browns,t3_10itkhy,False,0.0,TANY,2023-01-22T15:56:29Z,browns,-0.4404
14720,107479,107479,Richard__Cranium,"Romo was always obnoxious if your team played against any of his favorite players or teams.

I get that nobody can truly be unbiased when it comes to commentators, but he would be so fucking hard to listen to sometimes.",1.0,nfl,t3_10jkfag,False,0.0,:Browns: Browns,2023-01-24T07:24:12Z,browns,0.0138
14721,107480,107480,Richard__Cranium,"Hell, for the fuck of it OBJ is going to the Patriots as well.

And Zeke.",6.0,nfl,t3_10jqsa2,False,0.0,:Browns: Browns,2023-01-24T07:20:58Z,browns,-0.19765
14722,107482,107482,Richard__Cranium,"It's 100% the only reason I subscribe to YouTube TV. I try to get my money's worth and watch other shit/Christmas specials and stuff (even watch the commercials for the nostalgia factor sometimes lol). The second the Superbowl is over that shit is cancelled til September.

You are spot on about that.",14.0,nfl,t3_10ja8rc,False,0.0,:Browns: Browns,2023-01-23T20:06:27Z,browns,-0.0336140625
14723,107484,107484,Richard__Cranium,"I've always just assumed he does a good job of knowing how to answer questions that get his fans amped up and excited. I'm sure there's a fair amount of confidence/cockiness, but he's just selling his brand for the most part (at least that's how it seems to me).

Honestly his playoff/Superbowl window answer got me sort of hyped as well.

I can see how his responses/answers would be irritating if someone already had a slightly negative view of him though.",3.0,nfl,t3_10ix5gn,False,0.0,:Browns: Browns,2023-01-23T05:33:33Z,browns,-0.14123828125
14724,107488,107488,Richard__Cranium,"I think the public opinion on some people shifts when they appear to be forced into everything, like we're being forced to try and like him. There's just something artificial about everything he appears in. Snoop Dogg and him have been involved with some (or all, I don't know) of the Jake and Logan Paul boxing crap, as like color commentator/hosts for the events. I'm sure some people associate them with helping sort of make a mockery of things

I'm sure he's honestly a decent person, but he reminds me of the Rock. Someone I can enjoy, but they're forced into shit by Hollywood (or whomever) so much you just start to resent them/anything they're in. 

Anyone would do the same if they were in their shoes though. Snoop Dogg, Pete, the Rock, etc. all make some serious money doing all this shit.",2.0,nfl,t3_10g8sbe,False,0.0,:Browns: Browns,2023-01-20T05:46:48Z,browns,-0.0846598087549209
14725,107489,107489,Richard__Cranium,"Dude's considered a dinosaur to kids lol, nobody is looking up to him. If anything, it would probably be better than the garbage TikTok or YouTube celebrities kids look up to though.

I do get sick of seeing him and Pete Davidson shoehorned into everything though. They must be like a late middle aged corporate executives ideal candidate for someone that appeals to old folks and millennials or something.",-1.0,nfl,t3_10g8sbe,False,0.0,:Browns: Browns,2023-01-20T05:31:13Z,browns,0.154015234375
14726,107490,107490,Richard__Cranium,Sounds exactly like the type of shit Freddie Kitchens would do on the Browns.,1.0,nfl,t3_10g9jtd,False,0.0,:Browns: Browns,2023-01-20T05:18:05Z,browns,-0.2732
15195,111277,111277,S0mnariumx,"That non-call caused me to get blackout drunk, blow money I didn't have at a titty bar and lose all my keys. I'm still dealing with the consequences of watching that game",16.0,nfl,t3_10inqus,False,0.0,:Browns: Browns,2023-01-22T13:21:58Z,browns,-0.156225
15618,118598,118598,SpartaWillBurn,Obviously the NFL is scripted every game. But how mad must Shazier and Hamlin of been when they read that weeks script.,10.0,nfl,t3_10l0kxo,False,0.0,:Browns: Browns,2023-01-25T16:19:49Z,browns,-0.3243
15619,118599,118599,SpartaWillBurn,Terrible play call. They called this little dump off pass on a 3rd and 29?,4.0,browns,t3_10kkyv9,False,0.0,bad,2023-01-25T07:40:05Z,browns,-0.2043249999999999
15620,118602,118602,SpartaWillBurn,The losses will continue until morale improves!,7.0,browns,t3_10jvvi4,False,0.0,bad,2023-01-24T07:41:37Z,browns,0.1007
15621,118605,118605,SpartaWillBurn,"We need to stop trying to be so cute and just pick the best players available. History has told us the lower you go in the draft the less likely you will find a star. 

Now obviously the draft is a total crapshoot from top to bottom.",0.0,browns,t3_10jf29s,False,1.0,bad,2023-01-23T09:37:21Z,browns,0.0843555555555555
15622,118606,118606,SpartaWillBurn,People who gave the finger in every photo they were in 15+ years ago are all either in prison or have multiple felonies.,20.0,nfl,t3_10gz2lj,False,0.0,:Browns: Browns,2023-01-20T09:05:28Z,browns,-0.7783
16796,125375,125375,ThatOneOtherAsshole,"That’s fair, I was just being hyperbolic lol",2.0,browns,t3_10ixt31,False,0.0,:brownie-elf:,2023-01-23T08:48:50Z,browns,0.6249
16797,125379,125379,ThatOneOtherAsshole,The Bengals just look like an infinitely better team.,11.0,browns,t3_10iryea,False,0.0,:brownie-elf:,2023-01-22T16:19:39Z,browns,0.6597
17984,141012,141012,ZincFishExplosion,"Yeah, this isn't a new thing. 

I'd also argue that there's more quality analysis now than ever before; you just have to know where to look for it.",2.0,nfl,t3_10ldf2r,False,0.0,:Browns: Browns,2023-01-25T19:01:30Z,browns,-0.096
17985,141016,141016,ZincFishExplosion,"Amen. 

Elway did it on the biggest stage in football in the crowning achievement of his career yet I had totally forgotten about it because Rosenfels did it so much better and made the move iconic.",11.0,nfl,t3_10l518b,False,0.0,:Browns: Browns,2023-01-25T12:16:45Z,browns,0.1233
17986,141018,141018,ZincFishExplosion,"True. I couldn't find division odds and at least they offer an idea of how Vegas views each team.

As for ""no true powerhouse"".... Man, I don't know at this point with the Bengals. Last year, I was able to convince myself they're a good-not-great team that just got hot at the right time, but it's becoming a lot harder to dismiss them. I mean, they just manhandled the Bills.",1.0,nfl,t3_10koype,False,0.0,:Browns: Browns,2023-01-25T12:10:10Z,browns,0.00862688
17987,141019,141019,ZincFishExplosion,Super Bowl 58 odds have the Browns (+4500) behind the Jets and Broncos (both at +4000).  The other teams mentioned here are way farther down the list.,1.0,nfl,t3_10koype,False,0.0,:Browns: Browns,2023-01-25T10:06:47Z,browns,0.14985
17988,141027,141027,ZincFishExplosion,"They should have had his back in that instance. Doesn't make his current take any less idiotic and entitled imo.

edit: And the NFLPA did appeal Brady's suspension, right? Or am I misremembering? How did they not have his back?",9.0,nfl,t3_10k8z06,False,0.0,:Browns: Browns,2023-01-24T13:33:10Z,browns,-0.0005679999999999
17989,141028,141028,ZincFishExplosion,I sincerely believe Cal McNair would learn a lot about being an owner by looking at the decisions Randy Lerner made with the Browns after inheriting the team.,2.0,nfl,t3_10k4nx5,False,0.0,:Browns: Browns,2023-01-24T13:19:58Z,browns,0.4767
17990,141029,141029,ZincFishExplosion,"> Anyone saying he's ""Good"" as a head coach never watched most of his games in Houston.

I basically said the same in another comment. 

It's mindboggling. Did I step into a wormhole and get sent to an alternate reality where BOB wasn't an abrasive asshole who never won anything? In this world did he NOT run the Texans into the ground?",5.0,nfl,t3_10k4nx5,False,0.0,:Browns: Browns,2023-01-24T13:10:20Z,browns,-0.018199072
17991,141030,141030,ZincFishExplosion,"I live in SE Texas and follow the Texans closely, more so than the Browns. All this BOB love is crazy to me. It really shows that your average NFL fan doesn't know jack about the Texans. 

BOB was a confrontational, egomaniacal dick who ran two GMs out of town. He wanted that power and, with it, he anointed Jack Easterby as his right hand man. 

As a coach, his crowning achievement is a divisional game where he turned a 24-0 first half lead into a twenty point blowout. The man constantly estranged players (usually the best ones) while rewarding subpar guys who were loyal to him. By the end, he had become such a colossal prick that JJ Watt cussed him out on the practice field. 

The only thing I'll say in his favor is that the QB situation in Houston sucked for most of his time there, though I wonder how much of that was because he wanted certain guys (with Hoyer being the obvious example). Regardless, for a guy billed as a QB whisperer and offensive genius, his offenses never came close to the hype.

Long short of it - even if somebody thinks BOB is great with the X's and O's, his power-tripping assholery is enough that no sane person should want him around their team.",11.0,nfl,t3_10k4nx5,False,0.0,:Browns: Browns,2023-01-24T12:59:20Z,browns,0.039522091592327
17992,141032,141032,ZincFishExplosion,">And really it was just one bad trade that he made with DHop that suddenly eclipses a lot of good accomplishments

This is SO not true. He has a rather long list of trades, contract extensions, and personnel decisions that were baffling and terrible.",6.0,nfl,t3_10k4nx5,False,0.0,:Browns: Browns,2023-01-24T11:26:01Z,browns,-0.388425
17993,141033,141033,ZincFishExplosion,"Guy tried to trip one of his union brothers, a play considered dangerous enough to be made illegal, and then he complains about the union not having his back.",78.0,nfl,t3_10k8z06,False,0.0,:Browns: Browns,2023-01-24T10:26:44Z,browns,-0.7845
17994,141035,141035,ZincFishExplosion,"Thing is, he wanted the GM job. BOB won a power struggle with Rick Smith after a bad 2017 season. He then hired ""his guy"", Brian Gaine, whom he also could not work with, which ended with BOB becoming GM too.",5.0,nfl,t3_10k4nx5,False,0.0,:Browns: Browns,2023-01-24T09:58:05Z,browns,-0.0303555555555555
17995,141036,141036,ZincFishExplosion,The best local sports cheap heat that I've ever seen is Elias and Kevin Owens getting booed in Seattle for a solid five minutes after ragging on them for losing the Sonics.,9.0,nfl,t3_10jw7zq,False,0.0,:Browns: Browns,2023-01-24T00:30:23Z,browns,0.4939
17996,141037,141037,ZincFishExplosion,"Lol. I don't doubt it. For the last decade or so I  only watch Browns games, ignore the commercials, and listen to sports talk.",1.0,nfl,t3_10jdafm,False,0.0,:Browns: Browns,2023-01-23T21:40:13Z,browns,-0.0741777777777777
17997,141043,141043,ZincFishExplosion,"Thanks. 

And yeah, I thought of mentioning the MM, but in my mind it was designed with the intent of running another play. Or rather, the defense had to worry about defending the sidelines because there was enough time for another. It wasn't a situation where it was eight dudes playing deep.",4.0,nfl,t3_10jdafm,False,0.0,:Browns: Browns,2023-01-23T10:50:33Z,browns,0.0399812499999999
