,Unnamed: 0.1,Unnamed: 0,author,body,score,subreddit,link_id,over_18,controversiality,author_flair_text,created_utc,flair,sentiment
365,5772,5772,84Cressida,"TBF, it’s still pretty impressive",4.0,nfl,t3_10l7o19,False,0.0,:Browns: Browns,2023-01-25T14:04:59Z,browns,0.7579
366,5774,5774,84Cressida,"He technically was 38 when he played his last game and got hurt. 

He probably retires earlier if he saw more consistent action.",13.0,nfl,t3_10l4h6l,False,0.0,:Browns: Browns,2023-01-25T13:39:00Z,browns,-0.0625
367,5776,5776,84Cressida,"Hey now, 

It would devastate a lot of us!",2.0,nfl,t3_10kf7i4,False,0.0,:Browns: Browns,2023-01-24T14:45:01Z,browns,-0.6588
368,5778,5778,84Cressida,They would’ve lost to Houston but thankfully my constipation subsided that day,0.0,nfl,t3_10ke5ad,False,0.0,:Browns: Browns,2023-01-24T14:10:30Z,browns,0.4678
369,5781,5781,84Cressida,There was a player on the Pats that liked a tweet criticizing him. It’s rare but nice to see,12.0,steelers,t3_10il3fc,False,0.0,:CLE1::CLE2: Cleveland Browns,2023-01-22T17:17:45Z,browns,0.3052499999999999
370,5782,5782,84Cressida,Definitely flashes. We’ll see how he does with Schwartz,1.0,steelers,t3_10il3fc,False,0.0,:CLE1::CLE2: Cleveland Browns,2023-01-22T17:16:09Z,browns,0.100475
371,5785,5785,84Cressida,"Burrow can beat Allan, Mahomes, Brady, but not Baker and I will forever find that funny.",17.0,nfl,t3_10iwy43,False,0.0,:Browns: Browns,2023-01-22T17:07:09Z,browns,0.5927
372,5788,5788,84Cressida,Who the hell outside of Buffalo debated that?,2.0,nfl,t3_10irx3e,False,0.0,:Browns: Browns,2023-01-22T16:38:21Z,browns,-0.6808
373,5791,5791,84Cressida,Shouldn’t that be a penalty on 49?,1.0,nfl,t3_10irx3e,False,0.0,:Browns: Browns,2023-01-22T15:02:27Z,browns,-0.4588
374,5792,5792,84Cressida,"I hate Watson, but there’s no indication that his teammates or anyone in the league hates him. Quite the opposite, unfortunately. 

The players we are losing on defense were awful anyway. Besides Myles, everyone on that D-line is replaceable. 

We just hired Jim Schwartz a few days ago.",2.0,nfl,t3_10ikjai,False,0.0,:Browns: Browns,2023-01-22T13:24:27Z,browns,-0.005899584
375,5794,5794,84Cressida,He will never get the credit for it. He played really well in the playoffs and the moment did not look big for him.,1.0,browns,t3_10i3kip,False,0.0,:browns:,2023-01-21T17:44:08Z,browns,0.21935
376,5796,5796,84Cressida,Yes. And 2020 too.,4.0,nfl,t3_10h63ft,False,0.0,:Browns: Browns,2023-01-20T15:50:28Z,browns,0.100475
916,7462,7462,Abiv23,"We have an advocate in the building in DW, you could tell from training camp how much he liked being in something similar to his Clemson uni in the pros",1.0,browns,t3_10l3ohc,False,0.0,:dawgpound15:,2023-01-25T13:00:03Z,browns,0.4215
917,7484,7484,Abiv23,your team desperately tried to get Watson,7.0,nfl,t3_10ikjai,False,0.0,:Browns: Browns,2023-01-22T12:52:30Z,browns,-0.3818
1073,8330,8330,AgonizingSquid,"The real reason is bc of the sunk cost fallacy going on in this sub. Next season is what this season was to the bills, pressure cooker. Stefanski on hot seat, Watson needs to play like top 5 QB, defense needs to be much better, alot of young guys need to make a big jump from last year. Excuses are out the door now. We have a lot of money tied up and people from this sub are hoping for restructure, we have fan blogs making up fake rumors about Hopkins being traded here.",1.0,browns,t3_10kerje,False,0.0,:brown-jersey:DW is a Sex Predator,2023-01-25T11:15:41Z,browns,0.05628
1074,8344,8344,AgonizingSquid,"Just getting a QB was never enough, the QB is.fucking ass. The FO and ownership severely overrated the roster thinking they were a QB away from winning a Superbowl overreacting from one playoff win",2.0,browns,t3_10iryea,False,0.0,:brown-jersey:DW is a Sex Predator,2023-01-22T22:35:36Z,browns,0.182875
1075,8345,8345,AgonizingSquid,"Youre a buckeyes fan, take this ""L"" I'm sure you're used to the primetime ones by now",2.0,browns,t3_10iryea,False,0.0,:brown-jersey:DW is a Sex Predator,2023-01-22T22:33:23Z,browns,0.5574
1076,8346,8346,AgonizingSquid,"The trade could very easily be the worst trade of all time, how's that random shit? Lol",0.0,browns,t3_10iryea,False,0.0,:brown-jersey:DW is a Sex Predator,2023-01-22T22:29:23Z,browns,0.031
1077,8347,8347,AgonizingSquid,"Nah it's bc he was damaged goods, dude had a bevy of allegations and didn't play a full season",1.0,browns,t3_10iryea,False,0.0,:brown-jersey:DW is a Sex Predator,2023-01-22T22:26:26Z,browns,-0.6526
1078,8348,8348,AgonizingSquid,"It comes down to ownership, Lerner didn't care and Jimmy is playing fantasy football, Jimmy is literally the dumber version of Jerrah",2.0,browns,t3_10iryea,False,0.0,:brown-jersey:DW is a Sex Predator,2023-01-22T22:22:17Z,browns,-0.5152
1079,8349,8349,AgonizingSquid,"Jimmy Haslam is worse than listening to idiot fans, he listens to his own self and surrounds himself with yes-men",1.0,browns,t3_10iryea,False,0.0,:brown-jersey:DW is a Sex Predator,2023-01-22T22:20:40Z,browns,-0.7506
1080,8350,8350,AgonizingSquid,"Mike Brown is known for being very patient, sometimes to the teams detriment. This time it looks like he's given everyone enough time to figure it out and they now have a contender",3.0,browns,t3_10iryea,False,0.0,:brown-jersey:DW is a Sex Predator,2023-01-22T22:19:09Z,browns,0.2294
1081,8351,8351,AgonizingSquid,Not giving a shit anymore literally made my fall the most fun in recent memory,2.0,browns,t3_10iryea,False,0.0,:brown-jersey:DW is a Sex Predator,2023-01-22T22:17:29Z,browns,0.6685
1082,8352,8352,AgonizingSquid,"Def top 15, better than Kyler and dak",24.0,nfl,t3_10j1s8j,False,0.0,:Browns: Browns :Chargers: Chargers,2023-01-22T20:55:18Z,browns,0.5719
1083,8353,8353,AgonizingSquid,Purdy is top 10 QB fight me I don't care,22.0,nfl,t3_10j1s8j,False,0.0,:Browns: Browns :Chargers: Chargers,2023-01-22T20:47:32Z,browns,-0.5312
1084,8354,8354,AgonizingSquid,Hoping Maher has to attempt the game tying kick for max drama,1.0,nfl,t3_10iwzvh,False,0.0,:Browns: Browns :Chargers: Chargers,2023-01-22T20:22:45Z,browns,0.4215
1085,8355,8355,AgonizingSquid,Lol wipe some baby powder on it,1.0,browns,t3_10iryea,False,0.0,:brown-jersey:DW is a Sex Predator,2023-01-22T16:45:21Z,browns,0.4215
1086,8356,8356,AgonizingSquid,"I don't see this Bengals team beating the eagles, the eagles are playing on a different level",7.0,browns,t3_10iryea,False,0.0,:brown-jersey:DW is a Sex Predator,2023-01-22T16:43:58Z,browns,-0.296
1087,8357,8357,AgonizingSquid,I'm sure they regretted it when they saw how great Watson was,1.0,browns,t3_10iryea,False,0.0,:brown-jersey:DW is a Sex Predator,2023-01-22T16:40:15Z,browns,0.5859
1088,8358,8358,AgonizingSquid,Their defense has looked pretty bad,1.0,browns,t3_10iryea,False,0.0,:brown-jersey:DW is a Sex Predator,2023-01-22T16:38:39Z,browns,0.0516
1089,8359,8359,AgonizingSquid,You didnt notice the league has changed a bit in 3 years? Holy fuck get real the browns are an even worse team now. Playoff wins aren't made out of hope and butterflies,1.0,browns,t3_10iryea,False,0.0,:brown-jersey:DW is a Sex Predator,2023-01-22T16:35:08Z,browns,0.17
1090,8360,8360,AgonizingSquid,Your problem is here that the browns looked much better with Jacoby than with Watson. Go ahead and make excuses but reality is the browns need to get a lot better with Watson.,2.0,browns,t3_10iryea,False,0.0,:brown-jersey:DW is a Sex Predator,2023-01-22T16:33:41Z,browns,0.30925
1091,8361,8361,AgonizingSquid,Lol I'm sure they're totally missing out not being browns fans haha wtf,1.0,browns,t3_10iryea,False,0.0,:brown-jersey:DW is a Sex Predator,2023-01-22T16:31:35Z,browns,0.204
1092,8362,8362,AgonizingSquid,"Browns wouldn't have beat the Packers once this year that's for sure, highly doubt they would beat the Vikings twice, if the browns were in that division last year i don't see them being more successful than the lions honestly",2.0,browns,t3_10iryea,False,0.0,:brown-jersey:DW is a Sex Predator,2023-01-22T16:21:00Z,browns,0.765
1093,8363,8363,AgonizingSquid,"Lol we both know the browns would have ruined burrow, there's no doubt in my mind they ruin Josh Allen",3.0,browns,t3_10iryea,False,0.0,:brown-jersey:DW is a Sex Predator,2023-01-22T16:19:10Z,browns,-0.457
1094,8364,8364,AgonizingSquid,"Lol Bengals surrounded burrow with the best wr corps in the NFL and a top 10 RB. Its on the browns for continually making the wrong picks, having instability at coaching and being completely worlds worst at developing players in our lifetime",5.0,browns,t3_10iryea,False,0.0,:brown-jersey:DW is a Sex Predator,2023-01-22T16:18:19Z,browns,-0.2004
1095,8365,8365,AgonizingSquid,"Stop making excuses for the browns poor play, literally every year full of excuses",1.0,browns,t3_10iryea,False,0.0,:brown-jersey:DW is a Sex Predator,2023-01-22T16:12:57Z,browns,-0.4404
1096,8366,8366,AgonizingSquid,"They definitely looked like they belonged in the playoffs, they definitely would hang with either of the team playing right now",1.0,browns,t3_10iryea,False,0.0,:brown-jersey:DW is a Sex Predator,2023-01-22T16:12:03Z,browns,0.8271
1097,8367,8367,AgonizingSquid,So the browns finished 4th in the division and you think they will make the playoffs with average QB play? Lol,2.0,browns,t3_10iryea,False,0.0,:brown-jersey:DW is a Sex Predator,2023-01-22T16:09:06Z,browns,0.29575
1098,8368,8368,AgonizingSquid,"Look across the league, was Lawrence a bust? Was hurtz a bust? No offense but this is on the browns 100%, they fucked the rebuild... It's not enough to just be spooky in the NFL, things can turn around way too fast. Browns have been spooky for 5 years now and have been passed up by the jaguars, Bengals, eagles, Steelers, chargers, dolphins, jets, giants, Seahawks, lions, (anyone else I'm missing) in less time.",6.0,browns,t3_10iryea,False,0.0,:brown-jersey:DW is a Sex Predator,2023-01-22T16:07:33Z,browns,-0.0653896
1099,8369,8369,AgonizingSquid,Lawrence has the ability to be top 5 QB even the best imo,1.0,browns,t3_10iryea,False,0.0,:brown-jersey:DW is a Sex Predator,2023-01-22T15:37:11Z,browns,0.8074
1100,8370,8370,AgonizingSquid,"Highly doubt they beat KC, they are hitting their stride and mahomes is literally playing on one foot",1.0,browns,t3_10iryea,False,0.0,:brown-jersey:DW is a Sex Predator,2023-01-22T15:36:25Z,browns,-0.2484
1101,8371,8371,AgonizingSquid,They would be worse than the Bengals??? They have the best wr corps in the nfl,3.0,browns,t3_10iryea,False,0.0,:brown-jersey:DW is a Sex Predator,2023-01-22T15:35:35Z,browns,0.17765
1102,8372,8372,AgonizingSquid,How about the jaguars 1 year rebuild. Jimmy Haslam is destroying what was left of this franchise,3.0,browns,t3_10iryea,False,0.0,:brown-jersey:DW is a Sex Predator,2023-01-22T15:34:26Z,browns,-0.2787
1103,8373,8373,AgonizingSquid,"Watching these games goes to show how truly far the browns have to go. The QB play is incredible, Deshaun has an extremely far way to go to literally just compete for a playoff spot.",3.0,browns,t3_10iryea,False,0.0,:brown-jersey:DW is a Sex Predator,2023-01-22T15:33:32Z,browns,0.2801
1104,8376,8376,AgonizingSquid,"Having gone to 3, were alot more than I was comfortable with. I hope you didn't walk by the pit, there was some pretty disgusting shit on display",1.0,nfl,t3_10ikjai,False,1.0,:Browns: Browns :Chargers: Chargers,2023-01-22T10:51:25Z,browns,0.0145
1105,8396,8396,AgonizingSquid,It's really hard to judge bc of how poor the QB play was,1.0,browns,t3_10hwitv,False,0.0,:brown-jersey:DW is a Sex Predator,2023-01-21T14:37:40Z,browns,-0.3384
1106,8397,8397,AgonizingSquid,"Everywhere stump has been the run game has been amazing, stump and Callahan are the most valuable assets on the browns period",8.0,browns,t3_10hwitv,False,0.0,:brown-jersey:DW is a Sex Predator,2023-01-21T14:06:18Z,browns,0.847
1107,8398,8398,AgonizingSquid,"He's been a solid 2 for the browns, I think he'd still be a raw project for many other teams",-1.0,browns,t3_10hwitv,False,1.0,:brown-jersey:DW is a Sex Predator,2023-01-21T14:04:54Z,browns,0.1531
1108,8399,8399,AgonizingSquid,He sucks too,-5.0,browns,t3_10hw85u,False,1.0,:brown-jersey:DW is a Sex Predator,2023-01-21T13:55:18Z,browns,-0.3612
1109,8400,8400,AgonizingSquid,"Haslam needs to go, I was disappointed to google and see he's only in his 60s",13.0,browns,t3_10hzm94,False,0.0,:brown-jersey:DW is a Sex Predator,2023-01-21T13:52:12Z,browns,-0.4767
1110,8403,8403,AgonizingSquid,I could totally see carr being the next Carson Wentz sans injuries. I would be more surprised watching him carry a team than if I was to see him fail in the NFL.,2.0,nfl,t3_10hwpxh,False,0.0,:Browns: Browns :Chargers: Chargers,2023-01-21T13:34:42Z,browns,-0.15985
1111,8404,8404,AgonizingSquid,"Sounds exactly like the baker situation, where will the raiders now find a sex predator to give 230 guaranteed",60.0,nfl,t3_10hwpxh,False,0.0,:Browns: Browns :Chargers: Chargers,2023-01-21T13:29:39Z,browns,0.3612
1112,8405,8405,AgonizingSquid,Win win situation,1.0,nfl,t3_10hwpxh,False,0.0,:Browns: Browns :Chargers: Chargers,2023-01-21T13:24:25Z,browns,0.8225
1113,8408,8408,AgonizingSquid,Lol jets and dolphins two of the biggest options from his old division,1.0,nfl,t3_10hufqj,False,0.0,:Browns: Browns :Chargers: Chargers,2023-01-21T11:44:50Z,browns,0.4215
1114,8414,8414,AgonizingSquid,"""they doubted that i wouldnt accept the request that i originally made""",4.0,nfl,t3_10h625i,False,0.0,:Browns: Browns :Chargers: Chargers,2023-01-20T16:19:41Z,browns,-0.508
1115,8415,8415,AgonizingSquid,i dont know the juice is worth the squeeze,1.0,nfl,t3_10h625i,False,0.0,:Browns: Browns :Chargers: Chargers,2023-01-20T16:16:57Z,browns,0.2263
1116,8432,8432,AgonizingSquid,"Only explanation is that Berry thinks the bottom half of his roster is so shit that Prefers performance is excusable, which then fuck you Andrew berry",0.0,browns,t3_10gvbpu,False,0.0,:brown-jersey:DW is a Sex Predator,2023-01-20T09:00:23Z,browns,-0.8449
1634,10532,10532,Allstar9_,"I get it, we hear the same stuff about Stefanski. But at some point, these are grown adults. I can see blaming pockets of poor play in the season but it’s the playoffs, if the players need coaches to get psyched up, that’s on the players.",31.0,nfl,t3_10iy7uj,False,0.0,:Browns: Browns,2023-01-22T18:09:37Z,browns,-0.1168666666666666
1635,10533,10533,Allstar9_,"Seems like the players are a bit arrogant too, are they not? How do you come into this weekend without energy and juice? It’s literally the playoffs",97.0,nfl,t3_10iy7uj,False,0.0,:Browns: Browns,2023-01-22T17:57:45Z,browns,-0.0294444444444444
1636,10534,10534,Allstar9_,"Josh cries like a god damn child, jesus",16.0,nfl,t3_10irx3e,False,0.0,:Browns: Browns,2023-01-22T16:40:49Z,browns,-0.2023
1637,10536,10536,Allstar9_,I completely doubted the Bengals in the off-season but they match up SO well against the other AFC teams. Elite pass game and a good run game. I hope we get to see them against the 49ers or eagles in the Super Bowl. Would be a perfect matchup.,2.0,nfl,t3_10irx3e,False,0.0,:Browns: Browns,2023-01-22T16:37:37Z,browns,0.2010289062499999
1638,10540,10540,Allstar9_,They’ve got some massive flaws and Josh Allen being so hot/cold doesn’t help. Interesting team to watch all year,1.0,nfl,t3_10irx3e,False,0.0,:Browns: Browns,2023-01-22T14:33:35Z,browns,0.314
1639,10543,10543,Allstar9_,Have the bills tried playing defense?,6.0,nfl,t3_10irx3e,False,0.0,:Browns: Browns,2023-01-22T14:20:18Z,browns,0.3182
1640,10544,10544,Allstar9_,They sure as hell were contending for the playoffs. Either player health is priority or it isn’t. There’s no middle ground,-2.0,nfl,t3_10i3bol,False,0.0,:Browns: Browns,2023-01-21T16:54:42Z,browns,-0.1175777777777777
1641,10545,10545,Allstar9_,"Pulling your starting QB when still in the fight for the playoffs is the exact hypocrisy I was going for. And you’re proving my point. As long as it’s a star player, it’s okay to overlook the overall health. Appreciate it",-2.0,nfl,t3_10i3bol,False,0.0,:Browns: Browns,2023-01-21T16:42:20Z,browns,0.11312734375
1642,10546,10546,Allstar9_,"Nah, just love seeing the general consensus on how to handle injuries when it’s a star player.",2.0,nfl,t3_10i3bol,False,1.0,:Browns: Browns,2023-01-21T16:24:47Z,browns,0.5859
1643,10547,10547,Allstar9_,"Same people who trashed the Browns for allowing Baker to play. Seems a bit different when it’s a star player, doesn’t it?",3.0,nfl,t3_10i3bol,False,1.0,:Browns: Browns,2023-01-21T16:22:55Z,browns,0.085
1644,10548,10548,Allstar9_,"I thought teams needed to make the decision that saves the players from themselves? Ofcourse Mahomes wants to play, coaching staff/training staff need to save him from himself",19.0,nfl,t3_10i3bol,False,0.0,:Browns: Browns,2023-01-21T16:20:17Z,browns,0.3404
1989,16196,16196,Bandoot,"> Things will surely get better for you all right?

lol",2.0,browns,t3_10jqle1,False,0.0,:Baghead:,2023-01-23T18:34:29Z,browns,0.385825
1990,16198,16198,Bandoot,It’s a RB in 2023 I doubt he gets taken in the first at all,4.0,nfl,t3_10ixaxu,False,0.0,:Browns: Browns,2023-01-22T22:15:28Z,browns,-0.3612
2969,22679,22679,CD23tol,"Have to find the exact stats but we ran the ball more than we should’ve at least at the start of the year, mostly due to Brissett at QB, but basically we needed to throw more but favored the run",4.0,browns,t3_10k6o56,False,0.0,:chubbatman:,2023-01-24T09:46:29Z,browns,0.627
2970,22686,22686,CD23tol,Well that ends any DHop to the Pats rumors,84.0,nfl,t3_10k4nx5,False,0.0,:Browns: Browns,2023-01-24T06:53:29Z,browns,0.2732
2971,22693,22693,CD23tol,"If every WR and DT projected to go in the 1st and 2nd round is gone then trade down

If not, take one of those guys 

Hell I wouldn’t be surprised if we moved our 2nd for a vet at a position of need with control",31.0,browns,t3_10jf29s,False,0.0,:chubbatman:,2023-01-23T09:39:20Z,browns,-0.5719
2972,22694,22694,CD23tol,"That’s close to where I’m at also

Is it him developing these guys or is it Ward was a top 5 pick,  Newsome was a 1st rounder and Emerson was just a gem or was it really Howard and Woods’s development 

Given Schwartz runs a lot more man friendly scheme to the satisfaction of our corners I guess we’ll see if they’re still looking lost or if they find that consistency",12.0,browns,t3_10jce09,False,0.0,:chubbatman:,2023-01-23T07:41:19Z,browns,0.7076
2973,22695,22695,CD23tol,"With how sparse quality OL play seems to be across the league, Pocic should have a decent market and could get a top 10 C contract, roughly 5-7x more than what we paid him last year, I’m not sure we can afford a 4th top 10 OL contract

Also wish Howard gets a new gig, if Schwartz retains him then maybe there is something more to be seen from him, our corners are good to elite depending on the guy but like the rest of the D were way too inconsistent last year",37.0,browns,t3_10jce09,False,0.0,:chubbatman:,2023-01-23T07:29:59Z,browns,0.7946
2974,22696,22696,CD23tol,Ya but that doesn’t help that argument so it’s invalid/s,8.0,browns,t3_10iryea,False,0.0,:chubbatman:,2023-01-22T17:29:49Z,browns,0.0772
2975,22697,22697,CD23tol,"Bills traded up for Allen

KC traded up for Mahomes

It wasn’t like they sucked and had a QB fall into their laps like the Bengals did",12.0,browns,t3_10iryea,False,0.0,:chubbatman:,2023-01-22T17:28:13Z,browns,0.25
3281,23427,23427,CLCUBING,"> DE - using both 42 and 99 at that position is an overkill

The pick at 42 (Tuipulotu) is a DT who is listed at both on different sites. He would play DT for us

>we just moved away from a FB using system for a reason, so i have a hard time seeing us draft one. RB, sure i could see that, but not a FB imo.

If you watch Leupke play, he plays more like a RB than a FB. Hes a strong runner and also great catching the ball on vertical routes. Hes had games like 18 rush 115 yards 2 TD, 3 rec 65 yards 1 TD vs Arizona, and 20 rush 146 yards 2 TD vs South Dakota. Its basically getting a RB with an interesting skillset who can also be used as a FB on random plays.",1.0,browns,t3_10jd4u3,False,0.0,:browns:,2023-01-23T17:19:28Z,browns,0.0917584526855306
3282,23428,23428,CLCUBING,"I would love To'o To'o in the 5th, but sadly I doubt he would still be on the board",2.0,browns,t3_10jd4u3,False,0.0,:browns:,2023-01-23T15:01:59Z,browns,-0.6542
3283,23429,23429,CLCUBING,"Did another PFF Mock, how did I do?

**2.42: Tuli Tuipulotu, DE/DT, USC**

Adding much needed help to our DLine. Biggest need filled.

**3.99: Byron Young, DE, Tennessee**

Adding a DE to help fill the void Clowney will leave

**4.111: Cam Jones, LB, Indiana**

Adding a LB to bolster a room that was heavily injured

**4.126: Marvin Mins, WR, Oklahoma**

Adding a WR to fill another significant need

**5.143: Xavier Hutchinson, WR, Iowa State**

Adding a 2nd WR to beef up the WR room

**6.188: Chamarri Conner, S, Virginia Tech**

Adding some nice to have safety depth

**7.234: Hunter Leupke, FB, North Dakota State**

Adding a FB with good running and receiving skills to potentially be a Kareem Hunt replacement, while also allowing us to roster a FB",4.0,browns,t3_10jd4u3,False,0.0,:browns:,2023-01-23T15:00:31Z,browns,0.215683203125
3284,23430,23430,CLCUBING,"Correct me if I'm wrong but the deal was basically that he watched his buddies stab two guys to death during a fight outside a nightclub, his buddies even bragged in his limo after the fight about the stabbings, and he lied to the cops and tried to cover it up because he thought it would hurt his reputation? (And also the white suit he was wearing was never found which calls into question whether he participated or not?)",35.0,nfl,t3_10j5mbz,False,0.0,:Browns: Browns,2023-01-23T01:09:10Z,browns,-0.245625
3664,24683,24683,Cinephile1998,I thought he would reunite with Pederson in Jacksonville as some kind of senior offensive assistant,18.0,nfl,t3_10le1jp,False,0.0,:Browns: Browns,2023-01-25T23:46:59Z,browns,-0.4588
3665,24684,24684,Cinephile1998,I'll only watch if MCDC plays himself,7.0,nfl,t3_10lfbrv,False,0.0,:Browns: Browns,2023-01-25T23:32:32Z,browns,0.25
3666,24685,24685,Cinephile1998,Shanahan might never call a pass play again,147.0,nfl,t3_10l3ug9,False,0.0,:Browns: Browns,2023-01-25T14:39:33Z,browns,0.34
3667,24686,24686,Cinephile1998,"I suspect Ridley will have some rust, but if he can regain his 2020 form, he'll be that number 1 for you guys. Worst case scenario, you have two high-end WR2s. Even without a true alpha, that is one of the most complete groups of skill position players in the league (at least on paper).",1.0,nfl,t3_10kakmr,False,0.0,:Browns: Browns,2023-01-25T10:58:52Z,browns,-0.1792666666666666
3668,24687,24687,Cinephile1998,"Hyatt is very divisive as a prospect, but I think he can be the player Schwartz was meant to be. Stefanski clearly wants a speed threat. Cooper, DPJ, Hyatt, and Bell would be a well-rounded receiving corps",5.0,browns,t3_10kfb52,False,0.0,:chubb:,2023-01-24T22:09:39Z,browns,-0.0140962962962962
3669,24689,24689,Cinephile1998,"Calvin Ridley, Christian Kirk, Zay Jones, Evan Engram, Travis Etienne. That has to be a top 10 group of weapons in the league right?",3.0,nfl,t3_10kakmr,False,0.0,:Browns: Browns,2023-01-24T18:44:27Z,browns,-0.1366
3670,24692,24692,Cinephile1998,Brady and Wilson might get along. Brady will help Zach pick up MILFs and Zach will help Brady pick up coeds,11.0,nfl,t3_10jqx83,False,0.0,:Browns: Browns,2023-01-24T09:58:57Z,browns,0.32985
3671,24696,24696,Cinephile1998,"*slaps roof of franchise tag* 

This bad boy can fit so many RBs in it",1.0,nfl,t3_10jl1oq,False,0.0,:Browns: Browns,2023-01-23T22:52:14Z,browns,-0.3869
3672,24697,24697,Cinephile1998,50 million is a shit load of dimes for ol' Danny,9.0,nfl,t3_10jq1n0,False,0.0,:Browns: Browns,2023-01-23T22:42:31Z,browns,-0.5574
3673,24699,24699,Cinephile1998,Good guy Dalton Schultz. He knew fans would blame Brett Maher and decided to take all the heat,3.0,nfl,t3_10iwzvh,False,0.0,:Browns: Browns,2023-01-22T20:42:35Z,browns,-0.0599
3674,24701,24701,Cinephile1998,That's a nice score,3.0,nfl,t3_10iwzvh,False,0.0,:Browns: Browns,2023-01-22T19:02:45Z,browns,0.4215
3675,24704,24704,Cinephile1998,Bengals fans told me this game would be fixed. Are refs just making it interesting?,1.0,nfl,t3_10irx3e,False,0.0,:Browns: Browns,2023-01-22T16:26:26Z,browns,0.20095
3676,24706,24706,Cinephile1998,Tony Romo? Saying something stupid? Impossible!,1.0,nfl,t3_10irx3e,False,0.0,:Browns: Browns,2023-01-22T15:19:59Z,browns,-0.0585222222222222
3677,24707,24707,Cinephile1998,"Thank God, I thought it was just me",2.0,nfl,t3_10irx3e,False,0.0,:Browns: Browns,2023-01-22T14:52:20Z,browns,0.5574
3678,24708,24708,Cinephile1998,Stay strong king 👑✊️,1.0,nfl,t3_10ioam1,False,0.0,:Browns: Browns,2023-01-22T13:40:51Z,browns,0.5106
3679,24710,24710,Cinephile1998,"How was Neal? I feel like everytime I saw a Giants game, he wasn't really special, and I saw a lot of Giants fans saying he sucks. Do most think he's a bust, or is it similar to AT's rookie struggles and it looks like there is something to build on?",1.0,nfl,t3_10ib0k2,False,0.0,:Browns: Browns,2023-01-22T12:06:12Z,browns,-0.0395444444444444
3680,24711,24711,Cinephile1998,"A true WR1, IOL, CB, LB",1.0,nfl,t3_10i6kla,False,0.0,:Browns: Browns,2023-01-21T20:43:16Z,browns,0.4215
3681,24713,24713,Cinephile1998,"Um, quick question? 

What the fuck?",6.0,nfl,t3_10i6kla,False,0.0,:Browns: Browns,2023-01-21T19:35:20Z,browns,-0.27115
3682,24716,24716,Cinephile1998,Henne still haunts my nightmares,1.0,nfl,t3_10i1il6,False,0.0,:Browns: Browns,2023-01-21T16:06:39Z,browns,-0.25
3683,24718,24718,Cinephile1998,Flawless logic,9.0,nfl,t3_10i1il6,False,0.0,:Browns: Browns,2023-01-21T15:28:03Z,browns,0.5106
3684,24720,24720,Cinephile1998,"I know all these guys are mouthpieces, but Rap has always struck me as the most honest and least slimey",31.0,nfl,t3_10h9bub,False,0.0,:Browns: Browns,2023-01-20T22:02:21Z,browns,0.5251
