,Unnamed: 0.1,Unnamed: 0,author,body,score,subreddit,link_id,over_18,controversiality,author_flair_text,created_utc,flair,sentiment
10412,74397,74397,JohnnyFire,"This has been obvious for decades, though. Defense is a tremendous signifier of a playoff caliber team. In terms of Super Bowls and total team defense, winners listed first:

* 2012: BAL (12th) vs SF (2nd)

* 2013: SEA (1st) vs DEN (22nd)

* 2014: NE (8th) vs SEA (1st)

* 2015: DEN (4th) vs CAR (6th)

* 2016: NE (1st) vs LAR (23rd)

* 2017: PHI (4th) vs NE (5th)

* 2018: NE (7th) vs ATL (25th)

* 2019: KC (7th) vs SF (8th)

* 2020: TB (8th) vs KC (11th)

* 2021: LAR (15th) vs CIN (17th)

Not a single year since 2012 has a team in the bottom half of the league in defense won a Super Bowl. In fact, in all but 2 instances, the team with the stronger overall defense overall won. And why? Because every goddamned team in the league is desperately chasing their Tom Brady unicorn and sacrificing every other aspect of competent team building to do so. Completely forgetting that while Brady himself played to a HOF level, he also nearly every year had a defense in the top half of the league, if not in the top 10. It's why going to get Deshaun only made sense if this team was set on the other side of the ball, and they clearly, bluntly, were not.

Coming out of 2022, our remaining teams are 1st (SF), 5th (CIN), 8th (PHI), and 16th (KC). Hell, in the last round alone, you also had the 2nd (BUF), 6th (DAL), and 12th (JAX). You could argue that, of those 7 teams, all but 1 (SF) have their long term QB in place, and that all drafted that QB in the last 6 years, but also, all 7 of those teams also drafted that QB, built around the strengths and weaknesses of that QB, and, most importantly, ensured the other side of the ball was ready to go.",1.0,browns,t3_10kixhq,False,0.0,:brownie-elf:,2023-01-25T09:13:22Z,browns,0.0608260221369925
10413,74399,74399,JohnnyFire,"Yeah, I'm not trying to shit on what gets fans and a fanbase motivated but every possible combination of Conference Championship games had tickets sold.

Like, even knowing that the NFL is angling for neutral site championship games - the only reason that was on the table was because, you know...a player almost like...died?

Maybe I'm just not getting it, I don't know.",106.0,nfl,t3_10ix6gh,False,0.0,:Browns: Browns,2023-01-22T17:16:03Z,browns,0.1034185185185185
10753,80408,80408,MAXHEADR0OM,So boring. It’s the same teams every year.,-3.0,nfl,t3_10iwzvh,False,1.0,:Browns: Browns,2023-01-22T20:42:36Z,browns,-0.0951
10754,80409,80409,MAXHEADR0OM,"Throw a bomb, Dak.",1.0,nfl,t3_10iwzvh,False,0.0,:Browns: Browns,2023-01-22T20:38:16Z,browns,-0.4939
10755,80412,80412,MAXHEADR0OM,69 at halftime awww yeah.,9.0,nfl,t3_10iwzvh,False,0.0,:Browns: Browns,2023-01-22T19:08:59Z,browns,0.296
10756,80414,80414,MAXHEADR0OM,Bills were tired I guess.,1.0,nfl,t3_10irx3e,False,0.0,:Browns: Browns,2023-01-22T16:59:43Z,browns,-0.4404
10757,80415,80415,MAXHEADR0OM,Dang. Sad to see it end but proud of our lake bros. Great season guys. We’ll see ya in the fall!,6.0,buffalobills,t3_10isf7a,False,0.0,:CLE: :still-bill:,2023-01-22T16:56:02Z,browns,0.0963777777777777
10758,80416,80416,MAXHEADR0OM,My god the bills are blowing it. They look terrible.,13.0,nfl,t3_10irx3e,False,0.0,:Browns: Browns,2023-01-22T16:14:35Z,browns,-0.17005
10759,80420,80420,MAXHEADR0OM,The Browns. Our organization is a giant ball of shit rolling down an endless hill.,2.0,nfl,t3_10ikjai,False,0.0,:Browns: Browns,2023-01-22T12:36:59Z,browns,-0.2787
10760,80428,80428,MAXHEADR0OM,Late to the party but dang it I’m so disappointed. I wanted to see the Jags win.,1.0,nfl,t3_10i6fjv,False,0.0,:Browns: Browns,2023-01-21T19:09:47Z,browns,0.1218249999999999
11278,83450,83450,McWinkerbean,"Cowboys fans can downvote me all they want the numbers are the numbers. 

I think you make some good points.  I did watch the game Sunday.  I have a good friend who is a huge boys fan so I get a lot of his input. 

My point is purely on the numbers here.",-1.0,nfl,t3_10kzemf,False,0.0,:Browns: Browns,2023-01-25T16:44:57Z,browns,0.035361344
11279,83451,83451,McWinkerbean,He is really good. But his 13 sacks to Garrett's 16? Feels like a reach.,-12.0,nfl,t3_10kzemf,False,0.0,:Browns: Browns,2023-01-25T11:39:09Z,browns,0.1455148148148148
11280,83452,83452,McWinkerbean,"I think they are rad. 

If you are a fan of a certain age you generally don't want to see any drastic changes to the uniforms as the classic unis remind you of the good old days.

If you are a younger fan, generally want to see something updated as the jerseys mostly mean nothing to me.

I am 40 and would like to see some updated looks. I was disappointed when they went back to a more ""classic"" look this last go around. But I get it. If they swing for the fences and miss its a loooonnng time until they can change back. Safer to just go something classic.",6.0,browns,t3_10l3ohc,False,0.0,:brown-jersey:,2023-01-25T11:12:47Z,browns,0.0501917558193206
11281,83456,83456,McWinkerbean,Right.  Brutal.,1.0,browns,t3_10hz5vh,False,0.0,:brown-jersey:,2023-01-21T19:25:25Z,browns,-0.31245
11998,88833,88833,MyChubbGotRubbed,"It has to be beating Tom Brady at home.

The 4th and 10 touchdown catch to win that game by Chief was the best catch of the season, too.",32.0,browns,t3_10l4vm7,False,0.0,:browns:,2023-01-25T11:59:42Z,browns,0.3054
11999,88834,88834,MyChubbGotRubbed,It’s not that deep lol,3.0,nfl,t3_10jls33,False,0.0,:Browns: Browns :Browns: Browns,2023-01-23T21:49:28Z,browns,-0.3252
12000,88835,88835,MyChubbGotRubbed,"This is definitely your guy Baltimore, call the search party off",21.0,nfl,t3_10jls33,False,0.0,:Browns: Browns :Browns: Browns,2023-01-23T13:59:25Z,browns,0.6597
12001,88836,88836,MyChubbGotRubbed,"That’s such a bad take.

That roster is not really remarkable in any way and Daboll made Danny look like a viable option this year.",3.0,nfl,t3_10ijuc2,False,0.0,:Browns: Browns :Browns: Browns,2023-01-22T07:41:08Z,browns,-0.217175
12002,88837,88837,MyChubbGotRubbed,I think I would’ve struck the Broncos part off of my resume,10.0,nfl,t3_10ijs19,False,0.0,:Browns: Browns :Browns: Browns,2023-01-22T07:34:53Z,browns,-0.25
12003,88838,88838,MyChubbGotRubbed,Pederson is definitely the best thing that could’ve happened for Trevor.,344.0,nfl,t3_10i69qe,False,0.0,:Browns: Browns :Browns: Browns,2023-01-21T18:33:09Z,browns,0.7845
13091,95626,95626,OldheadBoomer,"When Baker threw that first completion in the Jets game, I felt like the guy who was sitting in God's lap. 

As time progressed, and reality sunk in, I became like you, here for the game but not so emotionally invested that it affects my day-to-day life.",11.0,browns,t3_10jvvi4,False,0.0,:brownie-elf:,2023-01-24T01:07:34Z,browns,0.18535
13439,97635,97635,OptimisticRealist__,"Yes, signing Antonio Brown after he was accused of sexual assault and then went on to threaten the woman; having an owner who gets totally legal happy end massages and a TE who went on a killing spree sure are hallmarks of an organization who knows about how to judge a character, you are right.",10.0,nfl,t3_10l9rdn,False,0.0,:Browns: Browns,2023-01-25T17:58:04Z,browns,-0.4988
13440,97636,97636,OptimisticRealist__,"So, are we ready to talk about how the Bengals drafted Jacksom Carman despite knowing about him being accused of raping a 15 year old? Or is this sort of stuff only relevant when its about Watson?

https://www.si.com/nfl/2022/04/29/bengals-jackson-carman-rape-allegation-zac-taylor-nfl-draft",0.0,nfl,t3_10kxg4n,False,1.0,:Browns: Browns,2023-01-25T17:55:29Z,browns,-0.0248333333333333
13441,97637,97637,OptimisticRealist__,So is Mixon gonna throw a tantrum over this trash talk as well? So disrespectful /s,0.0,nfl,t3_10l7o19,False,0.0,:Browns: Browns,2023-01-25T17:54:23Z,browns,-0.044475
13442,97642,97642,OptimisticRealist__,Now watch them give Purdy the award and the NFL milking this story for the next 10 years like Waller's addiction,2.0,nfl,t3_10kyp53,False,0.0,:Browns: Browns,2023-01-25T14:22:45Z,browns,0.7184
13443,97643,97643,OptimisticRealist__,"Spelling it out for you:

Gardner was dominant at the CB position, period. Not just in comparison to other very, very good rookie CBs like Woolen or Emerson, but compared to the entire position. He was arguably better than elite guys like Surtain or Ramsey.

Hutchinson was the best DE in this rookie class, no doubt. But would you say he was better than Myles? Than Bosa? Than Parsons, Crosby, Watt or Sweat? No.",2.0,nfl,t3_10kyp53,False,0.0,:Browns: Browns,2023-01-25T11:52:26Z,browns,0.0001696278572082
13444,97644,97644,OptimisticRealist__,"If a RB has 10 tens, 9 of which go for 2 yards then he breaks one for 25 certainly is less sustainable and consistent than having a RB who gets 5 yards per carry.

A big play with the first RB is an outlier that doesnt negate the total ineffectiveness on the other carries. 
Again, not saying Walker isnt good just that people are, imo, overrating him based on a few plays they saw on the highlights.",2.0,nfl,t3_10kyp53,False,0.0,:Browns: Browns,2023-01-25T11:46:30Z,browns,-0.0277074074074074
13445,97645,97645,OptimisticRealist__,"It would be, because Gardner was that dominant. If Gardner wasnt in this class we dont have to have this debate, but since he is, i just dont see any way how he doesnt win it",3.0,nfl,t3_10kyp53,False,0.0,:Browns: Browns,2023-01-25T11:39:57Z,browns,-0.31295
13446,97646,97646,OptimisticRealist__,"My point is, i can easily name 3 DEs that are better than Hutch (Myles, Bosa x2, Parsons, ...).

But can you name 3 CBs that have been better than Gardner this year? No.",0.0,nfl,t3_10kyp53,False,1.0,:Browns: Browns,2023-01-25T11:15:39Z,browns,0.0898777777777777
13447,97647,97647,OptimisticRealist__,Just didnt think he was that impressive. Id say ourside of some big plays he was rather inefficient. PFF wrote an article about how he was less efficient than Allegeier,-9.0,nfl,t3_10kyp53,False,0.0,:Browns: Browns,2023-01-25T11:14:32Z,browns,0.1675555555555555
13448,97648,97648,OptimisticRealist__,You know your argument is bad when you are using tackles to compare a DE to a CB lol,5.0,nfl,t3_10kyp53,False,0.0,:Browns: Browns,2023-01-25T11:12:38Z,browns,-0.4939
13449,97649,97649,OptimisticRealist__,"Yes, absurd.

Hutchinson was good for a rookie, Gardner was elite at his position. Period.

Walker was less efficient than Allegeier, just for reference, but had a few flashy splash plays. Wilson was far more consistent.

So yes, any other than these two winning would indeed be absurd.",-13.0,nfl,t3_10kyp53,False,1.0,:Browns: Browns,2023-01-25T08:32:17Z,browns,0.1274101573216735
13450,97650,97650,OptimisticRealist__,"Nothing beats a hollywood-esque story like mr irrelevant playing well for 6 games. Now watch him win the award lol.

Total farce imo, Olave would have deserved it more. Hell, Cross or Linderbaum wouldve deserved it more than Purdy",241.0,nfl,t3_10kyp53,False,0.0,:Browns: Browns,2023-01-25T07:43:21Z,browns,-0.182505859375
13451,97655,97655,OptimisticRealist__,">Lol see you finally can use your words. Was it that hard?

Yes, because its a waste of time arguing about a trade that, quite frankly would not be an intelligent course of action, lets put it that way.

>Open your eyes. Don’t ever compare JSN to Corey Coleman.

Corey Coleman has actually played a down in the NFL, youre right.

Until a guy actually steps on an NFL field, there is a wide range of potential outcomes - and when hes on there, there still is a wide range of outcomes.
Ever took a moment to think why the draft is such a crap shoot and good GMs have a hit rate of around 50%?

Every single year there is guys that everybody is convinced are guaranteed hits and that there is no eay they are a bust - and then 2 years later they are catching balls from Johnny Football in the fan controlled league. Thats a story that is literally as old as the draft itself.

>Decent slot corner for the browns. Didn’t he grade out PFF at 70?

By that logic you would have to cut Ward

>You can find a quality slot corner like I said

Damn, i wonder why not more teams do it since its so easy. 

Thats like walking up to an NFL GM and saying ""have you ever thought about drafting good players?"". Yeah, duh lol

>Greg Newsome will be a good solider but he’s clearly frustrated playing in the slot

So ill take it you have some insider info that you have been hiding from the rest of us?

>That’s where he’s best. 

Since youre talking about PFF, you do realise that he graded higher in 2022 than he did in 2021 right?

>You don’t need a guy of Newsome’s value in the slot, it’s waste of talent

Man if only the 2015 Broncos had you as their GM, they could have traded that scrub Chris Harris jr and might had actually won the SB... oh wait

>Newsome + 2nd is probably worth a late first rounder. Garrett Wilson went in the 10 top. We don’t have enough ammo for that my friend. 

Why stop at the top 10? Throw Njoku and Wills into the mix and gun for the 1 overall pick. 

>He’s worth that type of package and more

Not even close.

>His stock is slightly slower because of the injury. That allows a team like the Browns to get s great player at cheaper value. Duh.

Garrett Wilson went top 10 in a stacked WR class, JSN is lucky to go in the first in a weak WR class, just for reference. Oh and btw the first WR off the board this year had a torn ACL, just for the record.

So anyways, im already wasting way too many words on something that had already been summed up neatly: thats a horrible trade.",3.0,browns,t3_10kfb52,False,0.0,:orange_pants:,2023-01-24T19:54:15Z,browns,-0.0204933788974698
13452,97659,97659,OptimisticRealist__,">No football knowledge or strategy used. 

>Lol the state of this sub.

The irony, my friend.

I guarantee you, if you worked in the Browns FO and came up with ""hey, lets trade Newsome, a 2nd and another mid round pick for JSN"" they would send you packing in no time.

>I put in my points about Newsome’s play, his desire to play outside,

Which he still this year when we werent in nickel

>his desire to be paid like a top corner

He is entering year 3 out of 5, lets put off the money talk for another year or two, shall we

>This same place was begging for Garrett Wilson for Baker

That is such a false equivalency lol.

People were for Wilson, when the cost was 1 1st round pick, not Newome + 2nd + whatever

>You’re getting a great receiver. 

JSN has played exactly 0, in words zero, downs in the NFL. He is literally as likely to end up like Corey Coleman as he is likely to be as good as Olave.

So in your masterplan you are giving up a young, cheap high quality CB who has already proven to be good and is under team control for at least another 3 years, for one lottery ticket on a guy who you hope might be as good while giving up additional assets in the process. 

Thats tanking your franchise 101 right there.

And since you professed your love for football strategy, we havent even touched on the fact that in todays NFL you need at least 3 good CBs, minimum, not only as depth but also because a substantial amount of time teams play in nickel or even dime.

Oh but i forgot, finding good corners ""cant be difficult"" since the Browns traded away a 30 year old vet with 1 year left back to the place where his family was for a 5th round pick.  Youre right, silly me. I wonder why none of the nfl GMs has picked up on that yet.

JSN might turn out to be a good player, who knows, but in no universe does he warrant that type of trade package.",2.0,browns,t3_10kfb52,False,0.0,:orange_pants:,2023-01-24T19:15:20Z,browns,-0.0142695926261305
13453,97661,97661,OptimisticRealist__,">Why wouldn’t you do it? You can’t even give a reason. Just “Bad trade OMG” but no solid reasoning.

Why wouldnt i do it? Cause its a comically terrible trade. Like, it is genuinely such a bad proposition that its legit difficult to even put into words because its obviously bad on so many different fronts",0.0,browns,t3_10kfb52,False,0.0,:orange_pants:,2023-01-24T18:56:26Z,browns,-0.1451391203703703
13454,97670,97670,OptimisticRealist__,">The Bengals D has been getting the job done and is the real untold story of their team's success the last two seasons.

And yet, going into last season their fanbase was upset that Anarumo still had a job and Zac Taylor was all but guaranteed to be fired after the season - until they went on an unlikely SB run. 

Crazy, how these things work",18.0,browns,t3_10kixhq,False,0.0,:orange_pants:,2023-01-24T17:23:06Z,browns,-0.1778962962962963
13455,97672,97672,OptimisticRealist__,"Good lord no lol

And quite frankly, the amount of people here not having an issue with this trade is wild",7.0,browns,t3_10kfb52,False,0.0,:orange_pants:,2023-01-24T16:40:07Z,browns,0.1451
13456,97673,97673,OptimisticRealist__,">If that mattered Zeke would have got it over dak, but that’s not how it went.


QB is a lot more valuable than RB ; DE is not more valuable than CB by the same amount, thats first.

Secondly

>hutch plays a more valuable position clearly had a bigger impact so it should go to him.

Have you looked at Gardner's metrics? He was dominant. Teams flat out avoided him at times. 

So no, i dont agree with that notion of Hutchinson having had a ""bigger impact"" at all.

As i said, Hutchinson was good for a rookie, Gardner was great for an NFL player period. 
Let me put it this way: its easy to find 3 DEs that are better than Hutch (eg Myles, Bosa x2, Parsons).

However its difficult to find 3 CBs that were better than Gardner this year.",11.0,nfl,t3_10kd48a,False,0.0,:Browns: Browns,2023-01-24T15:15:04Z,browns,0.0180326582625999
13457,97674,97674,OptimisticRealist__,"Nah. Hutchinson was good for a rookie, but nobody would name him as a top 3 DE.

Gardner is a legit top 3 CB not just among rookies, but in the entire league.",28.0,nfl,t3_10kd48a,False,0.0,:Browns: Browns,2023-01-24T14:46:20Z,browns,0.0843629629629629
13458,97675,97675,OptimisticRealist__,"Wow, so edgy. 

Look, what i said is nothing but a fact, whether you like it or not.",1.0,nfl,t3_10jpbz4,False,0.0,:Browns: Browns,2023-01-24T14:43:56Z,browns,0.397625
13459,97676,97676,OptimisticRealist__,"So, are we ready to talk about how the Bengals drafted Jacksom Carman despite knowing about him being accused of raping a 15 year old? Or is this sort of stuff only relevant when its about Watson?

https://www.si.com/nfl/2022/04/29/bengals-jackson-carman-rape-allegation-zac-taylor-nfl-draft",-1.0,nfl,t3_10jpbz4,False,0.0,:Browns: Browns,2023-01-24T12:08:37Z,browns,-0.0248333333333333
13460,97677,97677,OptimisticRealist__,">I did/do have an issue with going for it on 4th down instead of taking points.

Hes quite literally ranked among the best in terms of points added on 4th downs.

>And IMHO, he's soft too

As is further proven by play off teams exclusively being made up by raging cholerics... oh wait.

I will die on this hill, but this obsession with having a guy yell at grown men is beyond ridiculous and im 99% certain is the result of football movies, where a HC gives passionate half time speeches etc.

Just wait til people learn about how half time adjustments are nothing but a myth",9.0,browns,t3_10k6o56,False,0.0,:orange_pants:,2023-01-24T10:02:54Z,browns,-0.01168096
13461,97678,97678,OptimisticRealist__,">One thing to note here: This is from a decision-making standpoint during the games based on their 4th down decisions, timeout usage, delay of game avoidance, etc.

>It has nothing to do with the talent on their roster and how well the coaches did over/under-achieving on that

Link: https://twitter.com/sumersports/status/1616477512300625940?t=RWrZmDPM5hCAtKcrm6rS_w&s=19",1.0,browns,t3_10k2dmm,False,0.0,:orange_pants:,2023-01-24T04:24:26Z,browns,0.1466
13462,97679,97679,OptimisticRealist__,">We historically have had a rough time drafting WRs. DPJ looks like a winning pick, but beyond that we don’t pick receivers well. Steelers have amazing luck at that position. 

I the last 10 years the Steelers WR draft picks were: (correct me if i forgot someone, was just going off memory here)

Toney Clemons (2012), Justin Brown and Marcus Wheaton (2013), Martavis Bryant (2014), Sammie Coates (2015), DeMarcus Ayers (2016), JuJu (2017), James Washington (2018), Diontae (2019), Claypool (2020), Pickens and Austin (2022).

Out of those, Diontae is the only one i would comfortably call a draft hit. Pickens looks the part but has to prove he can do it again.

Claypool and Washington are meh, Bryant showed flashed but flamed out. The rest is essentially 6 guys named Fred. 

If we are being very generous, thats roughly a .50 success rate. I dont know if i would call that amazing luck, tbh.

>I think Pickens will be a thorn in our side for awhile. He’s a good player with a lot of qualities u want in a WR. I don’t think he’s chase good (few are) but he could well be a top 15-25 guy in the league.

With guys like that, every year theres a non zero chance for some major meltdown.

AB was a great WR for 6 years, then randomly grew a blonde stache and started wilding.",1.0,browns,t3_10jf29s,False,0.0,:orange_pants:,2023-01-23T17:10:16Z,browns,0.0442875476182468
13463,97680,97680,OptimisticRealist__,"I mean dont quote me on that, i just think ive read that hell be 24 on a scouting preview last year. Either way, he will be at the senior bowl so he is an older prospect regardless.

Dont get me wrong, i love the guys potential and if he shows out at the SB and combine i could see a team fall in love with him and take him in the 25+ range. But personally, as of right now, i think hes a solid day 2 guy.",1.0,browns,t3_10jd4u3,False,0.0,:orange_pants:,2023-01-23T17:00:25Z,browns,0.114734375
13464,97681,97681,OptimisticRealist__,"Going into the offseason we have Myles and Wright at DE. I expect at least one veteran addition be it via trade or FA at DE - using both 42 and 99 at that position is an overkill imo and couldve been spent more efficiently.

Similar thing with WR - Cooper, DPJ are locks, Grant and Bell very likely, which leaves 2 spots, of which i wouldnt be surprised to see one being filled with a vet. Having Woods/Hutchinson/Mims/Baldwin, who they like, and Felton battle it out for WR6 seems excessive.

Lastly, we just moved away from a FB using system for a reason, so i have a hard time seeing us draft one. RB, sure i could see that, but not a FB imo.",2.0,browns,t3_10jd4u3,False,0.0,:orange_pants:,2023-01-23T16:54:09Z,browns,0.0248323816872428
13465,97682,97682,OptimisticRealist__,"Meh, its not like Pickens didnt throw tantrums in Pitt. He is who he is, he is talented enough to be a very good player, sure. But its not like we passed on Jamar Chase or something.

Furthermore, another reason i didnt really have him on the radar for us was, that i thought his skill srt was pretty much redundant with what we already had in DPJ. 

Pickens is an outside X, but what we lack(ed) was someone who had speed and/or could operate in the slot. Pickens and his ~4.50 40 time wasnt that guy.

Regarding Emerson, not saying his a HoF lock but people around here are severely overlooking how well he played this year, especially how consistent he was. Woolen and Gardner got all the attention, but Emerson was actually playing at a very high level as well (allowed 5.3 yards per target and was top 10 in passes defended)",1.0,browns,t3_10jf29s,False,0.0,:orange_pants:,2023-01-23T16:49:38Z,browns,0.0933217754602432
13466,97684,97684,OptimisticRealist__,"Schwartz ran a low 4.22 and went in the late 3rd, just for reference",2.0,browns,t3_10jd4u3,False,0.0,:orange_pants:,2023-01-23T15:51:20Z,browns,-0.2732
13467,97685,97685,OptimisticRealist__,"I can see why tho. 

Last year, Pickens was one of the more difficult prospects to evaluate. I had a 1st round grade on him (had him graded higher than Burks), but the character issues eventually led to me taking him off the board, when i was trying to put myself in ABs and KSs shoes, as i thought he wouldnt be the type of personality they would bring in. 

Guys like Pickens, Callaway, Josh Gordon et al are not for everyone, and i get it. The draft already is a crap shoot as it is, so taking a gamble on guys like that adds even more uncertainty to the mix.

One way or another, Emerson (another draft favorite of mine actually, so i might be a bit biased) also had a terriffic rookie year. He was legit very good and just didnt get any love by the media. But dude is a baller.",1.0,browns,t3_10jf29s,False,0.0,:orange_pants:,2023-01-23T13:03:05Z,browns,-0.0004070088386535
13468,97686,97686,OptimisticRealist__,"Certainly, just said i think he will go earlier than 4th round due to his speed and overall solid play this year. Dont think he would go in the first 2 rounds and dont think he would be good value for us in at 42. Doubt hed be there at 99.",1.0,browns,t3_10jd4u3,False,0.0,:orange_pants:,2023-01-23T10:20:00Z,browns,-0.0239
13469,97687,97687,OptimisticRealist__,"I just dont think that NFL teams view this WR class as a first round class, value wise. Imo the value is in the 2nd round and later.

Better value going DL, OT and DB early, especially in the first half of the 1st round. I would not be surprised if less than 3 WRs were taken in the 1st. 
None of the WRs this year really is a blue chip type of guy.",3.0,browns,t3_10jf29s,False,0.0,:orange_pants:,2023-01-23T10:13:47Z,browns,-0.00083264
13470,97688,97688,OptimisticRealist__,"2 / 42 - Keeanu Benton, DT

3 / 99 - Xavier Hutchinson, WR

4 / 111 - Dalton Kincaid, TE

4 / 126 - Gerrvarius Owens, S

5 / 143 - Henry To'o To'o, LB

6 / 188 - Darius Rush, CB

7 / 234 - Javion Cohen, G",1.0,browns,t3_10jd4u3,False,0.0,:orange_pants:,2023-01-23T10:06:33Z,browns,0.6369
