,Unnamed: 0.1,Unnamed: 0,author,body,score,subreddit,link_id,over_18,controversiality,author_flair_text,created_utc,flair,sentiment
17998,141044,141044,ZincFishExplosion,"Yes, thank you! I should have remembered the Saints/Jags game. Think I may have watched it live, actually.

No recollection of the Miami one at all though.",13.0,nfl,t3_10jdafm,False,0.0,:Browns: Browns,2023-01-23T10:46:12Z,browns,-0.071384375
17999,141045,141045,ZincFishExplosion,"At the bar I'd watch games at (like ten years ago) there were these six or seven regulars from Chicago. All but one of them owned a Gould jersey. 

Dude is a legend.",183.0,nfl,t3_10jfkzz,False,0.0,:Browns: Browns,2023-01-23T10:40:25Z,browns,0.0133777777777777
18000,141046,141046,ZincFishExplosion,"Now, when teams get to fighting, it happens here and it finishes here. Two teams enter, one team leaves.",1.0,nfl,t3_10jgge1,False,0.0,:Browns: Browns,2023-01-23T10:31:45Z,browns,-0.0903
18001,141047,141047,ZincFishExplosion,"I'm probably showing my ignorance (just look at my flair!), but I can't think of a single instance of an NFL team scoring in that kind of situation - one last play where they need a touchdown yet it is too far a hail mary.

Moss's lateral to Moe Williams kind of fits the bill, but that was at the half.",13.0,nfl,t3_10jdafm,False,0.0,:Browns: Browns,2023-01-23T10:27:03Z,browns,0.0455481481481481
18292,145650,145650,average_white_male,"I'm saying $10 million AAV is a random bar that doesn't stop us from building a complete team. It isn't a horrible finance decision that has sunk us. 

For example: Bitonio and Teller by AAV cost $7 million more than Trent Williams.

But we pay Chubb $4 million less than CMC by AAV. 

We pay Amari $3 million less than Deebo. 

Kittle and Njoku are the same. 

So we have more AAV contracts above $10 million in this scenario (which is probably not the best scenario), but the entire money being spent, by AAV, is even. This tweet also doesn't look at immediate future needs...the 49ers could go pay their RT McGlinchey, they could go pay Aiyuk. That puts them at 6, but I wouldn't say signing those guys are bad finance decision that sinks their team-building.

You're right though, every team needs to hit on rookies to compete. I would only argue we have/are doing that on the defensive side instead of the offensive which lets us spend more on offense right now.",3.0,browns,t3_10kerje,False,0.0,:dawg:,2023-01-25T10:42:18Z,browns,-0.0699473443877051
18293,145651,145651,average_white_male,"Not weird overall, just in this case. Someone else pointed out they're probably pointing out that the Browns won't sign any big FA on offense. But the comparison to other teams feels pointless. For example, if KC sign Creed Humphrey, Trey Smith, and bring back Orlando Brown, are they now in a ""bad"" spot paying 10 million plus to QB, WR, C, RT, RG, and TE1? Not at all. I don't even think our offense was bad this year...we're saving cash on the other side of the ball.

And in Bitonio's case it would be him cut/retire after the 2024 season, so the 15 million in cash owed in 2025 wouldn't exist against his AAV. We've paid all his guaranteed money already. 

But yeah, you have to pay the bill at some point. We're betting on the cap rising.",2.0,browns,t3_10kerje,False,0.0,:dawg:,2023-01-25T08:16:15Z,browns,0.0029532405332599
18294,145652,145652,average_white_male,"AAV feels like a weird way to do it when contracts can be so heavily skewed in guarantees vs. cap hits vs. acutal cash given. 

Like Bitonio makes an actual $4 million in cash in 2024, but in 2025 he makes $15 million. He could be retired, cut, or reworked the entire deal by 2025. But it would be included in the AAV figure of $10 million. 

So I'm long winded in saying I don't understand the point here.",43.0,browns,t3_10kerje,False,0.0,:dawg:,2023-01-24T15:13:29Z,browns,-0.001816704
18295,145653,145653,average_white_male,"Peyton came out and said that recently on MNF about halftime adjusting being a myth. Something like ""You get into the locker room, go to the bathroom, pound some oranges, then coach tells you to get back out there"".",2.0,browns,t3_10k6o56,False,0.0,:dawg:,2023-01-24T10:34:03Z,browns,0.1806
18296,145654,145654,average_white_male,"Y'all would have fired Shanahan after his 23-25 start in the first 3 seasons. 

Or BB after his 20-28 start.

Or Payton after his 25-23 start.

Or Zac Taylor after his 16-32 start.

Or Mike McCarthy after his 27-21 start.

HCs are learning on the job like players do. It isn't binary you're a HOF coach or bad with no improvement. 

Stefanski is 26-24 currently.

Obviously, these situations all differ, but all these coaches have been to SBs in the next one or two years I believe, except BB who was 3 years.",8.0,browns,t3_10k6o56,False,0.0,:dawg:,2023-01-24T10:30:13Z,browns,-0.0009280764273156
18297,145655,145655,average_white_male,Is above .500 winning percentage not successful?,4.0,browns,t3_10hn0fo,False,0.0,:dawg:,2023-01-21T09:39:46Z,browns,0.0844
19113,147843,147843,baconboyloiter,This is what I tell my Bengals fan friends when they try to convince me to hop on the bandwagon. The Bengals get four games of fandom from me a season,3.0,browns,t3_10jqle1,False,0.0,:brownie-elf:,2023-01-24T09:22:49Z,browns,0.18765
19114,147844,147844,baconboyloiter,I want to like the Bengals because I grew up in Cincinnati but the divisional layout forces me to hate them. Also I am tired of getting shit from Bengals fans,2.0,browns,t3_10jqle1,False,0.0,:brownie-elf:,2023-01-24T09:21:02Z,browns,-0.5367
19384,154511,154511,bigmistaketoday,"Hey look, the browns getting shit on by r/nfl, shocking stuff",-3.0,nfl,t3_10l9rdn,False,1.0,:Browns: Browns ,2023-01-25T18:07:22Z,browns,-0.743
19385,154516,154516,bigmistaketoday,"Especially if the team in the game is a small market team. Why would you play in Cincinnati or Indianapolis when you could have the game in LA and collect revenue for hotels, taxes, et Al.",2.0,nfl,t3_10kxg4n,False,0.0,:Browns: Browns ,2023-01-25T10:16:08Z,browns,0.17
19387,154526,154526,bigmistaketoday,"Highmark Stadium? More like Lowpoint Stadium, amirite?",4.0,nfl,t3_10ix6bc,False,0.0,:Browns: Browns ,2023-01-22T19:06:21Z,browns,0.21005
19388,154527,154527,bigmistaketoday,Clever girl.,4.0,nfl,t3_10ix6bc,False,0.0,:Browns: Browns ,2023-01-22T19:05:22Z,browns,0.4588
19389,154528,154528,bigmistaketoday,Underrated architecture all over the place. Love it!,6.0,nfl,t3_10iyf28,False,0.0,:Browns: Browns ,2023-01-22T18:40:51Z,browns,0.3348
19390,154534,154534,bigmistaketoday,"Man, it just has to hurt *bad*",2.0,nfl,t3_10irx3e,False,0.0,:Browns: Browns ,2023-01-22T17:10:41Z,browns,-0.7845
19391,154535,154535,bigmistaketoday,"But like in Vogue, no, you're never gonna get it

'Cause I'm the one with the fat mad skills

And I won't choke like the buffalo bills",2.0,nfl,t3_10irx3e,False,0.0,:Browns: Browns ,2023-01-22T17:08:37Z,browns,0.0155
19392,154542,154542,bigmistaketoday,"It's like car companies said, ""Oh people want trucks but they don't want truck trucks,"" and I'm out here saying, ""No, I want a truck truck."" I mean, how often do people even ride in your backseats? Unless you have kids, my guess is almost never. And then, trying putting 2x4s in one of those, it just doesn't work.",1.0,nfl,t3_10ii308,False,0.0,:Browns: Browns ,2023-01-22T08:29:20Z,browns,0.0009921875
19393,154543,154543,bigmistaketoday,"Get the Tacoma, you won't regret it. Only problem i see with these is that the most popular model is the supercab. Not a problem really because I think you can still get the one with jump seats, but just annoying to see so many ""trucks"" that are really SUVs with an open back.",1.0,nfl,t3_10ii308,False,0.0,:Browns: Browns ,2023-01-22T08:22:10Z,browns,-0.1248333333333333
19394,154544,154544,bigmistaketoday,A good amount up here (butler county).,2.0,nfl,t3_10ii308,False,0.0,:Browns: Browns ,2023-01-22T08:19:04Z,browns,0.4404
19395,154545,154545,bigmistaketoday,"It simply does not end. We are so deep in gun culture and violence that there is no way, save maybe a giant ray from space that removes all violent tendencies from people, to change how people act. I'm not anti-gun by any means, but the toxic mix of deadly force and easy availability of the means to end lives borders on insane. This is not what ""founding fathers"" meant when they said we should have the right to bear arms.",6.0,nfl,t3_10ii308,False,0.0,:Browns: Browns ,2023-01-22T08:17:53Z,browns,-0.0098328125
19396,154547,154547,bigmistaketoday,"My daughter 17, has a Jeff Garcia Browns jersey. She got it from her cousin like 10 years ago.",2.0,nfl,t3_10ii308,False,0.0,:Browns: Browns ,2023-01-22T08:12:57Z,browns,0.1806
19397,154551,154551,bigmistaketoday,"Disagree. What else is he going to discuss? I find it refreshing that a guy who knows what he’s talking about shares his knowledge instead of just making gossipy comments. It’s not like what happens on the field is a secret, everyone sees it.",3.0,nfl,t3_10i3vwq,False,0.0,:Browns: Browns ,2023-01-22T07:20:21Z,browns,-0.07197890625
19398,154552,154552,bigmistaketoday,Being 13-4 means you’re a pretty good team imo.,6.0,nfl,t3_10iat31,False,0.0,:Browns: Browns ,2023-01-22T06:23:36Z,browns,0.7269
19399,154557,154557,bigmistaketoday,"Eagles offense was marching, I thought this was the right play. Turns out the eagles offense kept marching lol",1.0,nfl,t3_10i9ypv,False,0.0,:Browns: Browns ,2023-01-21T21:49:43Z,browns,0.126825
19400,154567,154567,bigmistaketoday,"Mahomes is a great qb and good dude, I can’t hate him. I can hate when announcers refer to players by first name alone, that sucks.",4.0,nfl,t3_10i6fjv,False,0.0,:Browns: Browns ,2023-01-21T18:49:47Z,browns,-0.27335
19403,154582,154582,bigmistaketoday,The red ones were amazing,2.0,nfl,t3_10hdwqv,False,0.0,:Browns: Browns ,2023-01-21T08:41:44Z,browns,0.5859
19405,154610,154610,bigmistaketoday,What about the one from like 1980 where Herm Edwards got the scoop and score when all the Giants had to do was kneel lol,1.0,nfl,t3_10gmf1m,False,0.0,:Browns: Browns ,2023-01-20T08:13:13Z,browns,0.7096
20285,158982,158982,bowhunter6274,"HIS WOLVERINES ARE GONNA FUCKING CROAK

THEY CALL HIM DOCTOR CHOKE

BET ON HIM, YOU'LL GO BROKE

CAUSE CHAD HENNE IS A MOTHERFUCKING JOKE",4.0,browns,t3_10i3cwz,False,0.0,:browns:,2023-01-21T19:05:39Z,browns,-0.836
20673,160970,160970,brandon520,Its probably not a responsible move as a parent.,1.0,browns,t3_10kkyv9,False,0.0,:browns:,2023-01-25T16:49:24Z,browns,-0.2411
20674,160972,160972,brandon520,True. I signed them up for misery.,1.0,browns,t3_10kkyv9,False,0.0,:browns:,2023-01-25T06:29:23Z,browns,-0.1805749999999999
20675,160973,160973,brandon520,"Reminds me of the early 2000s, losing a game cause a player remover their helmet.",3.0,browns,t3_10kkyv9,False,0.0,:browns:,2023-01-24T22:02:39Z,browns,-0.3818
20676,160974,160974,brandon520,"Oh man, I just saw it. Hahaha. How embarrassing 😳",18.0,browns,t3_10kkyv9,False,0.0,:browns:,2023-01-24T20:05:19Z,browns,-0.0653333333333333
21087,164459,164459,burningburningburnin,"He's coached a top 10 Defense, 5 years in a row, no chance they're firing him",0.0,nfl,t3_10j65nc,False,0.0,:Browns: Browns,2023-01-23T06:36:35Z,browns,-0.212
21091,164465,164465,burningburningburnin,"One thing to note here: This is from a decision-making standpoint during the games based on their 4th down decisions, timeout usage, delay of game avoidance, etc.

It has nothing to do with the talent on their roster and how well the coaches did over/under-achieving on that

Literally the follow up tweet and it says it in the graphic. Also it literally measures added win probability so that doesn't make any sense and how else would you judge game management?",2.0,nfl,t3_10h26kp,False,0.0,:Browns: Browns,2023-01-20T12:47:18Z,browns,0.2392185185185185
21092,164466,164466,burningburningburnin,"Yeah and that's why the author of the tweet even says so himself, read a bit and calm down lad. It's an interesting stat",4.0,nfl,t3_10h26kp,False,0.0,:Browns: Browns,2023-01-20T12:35:33Z,browns,0.3365249999999999
22276,170773,170773,chubbinmypants,"I don't think there's any team that plays majority of the snaps in their ""base"" formation. I think it's safe to assume 5 DBs will be on the field majority of the time. 

https://www.footballoutsiders.com/stat-analysis/2022/2021-defensive-personnel-cowboys-and-bills-abandon-base",1.0,browns,t3_10kfb52,False,0.0,:chubb:,2023-01-25T12:32:25Z,browns,0.0581925925925926
22277,170774,170774,chubbinmypants,I was fairly confident there would be 5 DBs on the field majority of the time. Do you know of something that suggests otherwise?,2.0,browns,t3_10kfb52,False,0.0,:chubb:,2023-01-24T22:49:24Z,browns,0.123475
22278,170775,170775,chubbinmypants,This tweet is directed at the fans who want to trade for Hopkins or Cooks which just isn't going to happen.,9.0,browns,t3_10kerje,False,0.0,:chubb:,2023-01-24T17:20:37Z,browns,0.0772
22279,170776,170776,chubbinmypants,Most fans have a warped perception on how trades work in the NFL. It's not as cut and dry as it is in the NBA.,8.0,browns,t3_10kerje,False,0.0,:chubb:,2023-01-24T16:03:34Z,browns,0.10285
22280,170777,170777,chubbinmypants,"I understand but a lot of those contracts are results of them hitting free agency because they weren't re-signed by their current team.

I should also rephrase, I don't think DPJ is worth $10M+ based on where the money is being spent right now.  DPJ definitely had success making tough, contested catches and I think he has value but I can't imagine the Browns going into a bidding war over DPJ. 

And for the OL, Callahan was comfortable going into last season with Nick Harris so I'm not too worry about it.",1.0,browns,t3_10kerje,False,0.0,:chubb:,2023-01-24T15:45:25Z,browns,0.153865625
22281,170778,170778,chubbinmypants,"I get what you're saying and I agree we need to add another young, cheap talent to mainly replace what Schwartz should be in the offense, but DPJ and Cooper actually combined for more 20+ yard plays than Higgins and Chase on fewer targets. And we already know Chubb provides big plays. 

I like the talent we have between Njoku, Chubb & Cooper and the OL is still very good when healthy. It just depends on how Watson performs.",2.0,browns,t3_10kerje,False,0.0,:chubb:,2023-01-24T15:38:31Z,browns,0.061783203125
22282,170779,170779,chubbinmypants,It sucks the Browns weren't able to capitalize on all the really good WRs drafted in the last 4 years. I like DPJ and he's definitely exceeded expectations but I question his ceiling due to the fact he isn't a great route runner and he really isn't good at getting open. He was fantastic at making tough catches this past season but I'm all for looking at WR with the 42nd pick.,6.0,browns,t3_10kerje,False,0.0,:chubb:,2023-01-24T14:53:41Z,browns,0.0106222222222222
22283,170780,170780,chubbinmypants,"DPJ isn't worth $10M+ a year. Also, who is talking about adding a $10M+ player to the offense? QB1, RB1, TE1 and WR1 are all sorted and the OL is returning all the starters.",15.0,browns,t3_10kerje,False,0.0,:chubb:,2023-01-24T14:35:16Z,browns,-0.0340555555555555
22284,170783,170783,chubbinmypants,Stefanski's choices on 4th down are great. Still needs to work on timeouts tho.,3.0,browns,t3_10k6o56,False,1.0,:chubb:,2023-01-24T08:47:49Z,browns,0.156225
22285,170784,170784,chubbinmypants,You're right but at least they had that bad year with TO haha,4.0,browns,t3_10jfwo1,False,0.0,:chubb:,2023-01-23T16:40:17Z,browns,-0.1901
22286,170786,170786,chubbinmypants,It's happened twice. Obviously Andy Dalton isn't close to Joe Burrow but Dalton to Green was better than anything the Browns have had in the last 20 years.,31.0,browns,t3_10jfwo1,False,0.0,:chubb:,2023-01-23T11:44:34Z,browns,0.29635
22287,170787,170787,chubbinmypants,"Definitely didn't help but it was mainly due to the DL. 

Myles, Clowney and Winovich all missing time didn't help but Clowney still saw a huge drop in production.  And Jordan Elliott is not a starter in this league. The FO needs to add at least 4 contributors to the DL this offseason through the draft and FA.",5.0,browns,t3_10je4e5,False,0.0,:chubb:,2023-01-23T10:41:32Z,browns,-0.00342265625
22288,170788,170788,chubbinmypants,"Basically the same thing happened last year, too. Started the year off somewhat slow plus getting whooped by the Browns at the halfway mark, made a run to end the year coinciding with a Ravens collapse due to Lamar being injured and secured the AFCN.",79.0,browns,t3_10jfwo1,False,0.0,:chubb:,2023-01-23T10:10:24Z,browns,-0.24695
22289,170789,170789,chubbinmypants,"Bringing in players who can be disruptive in the backfield along the entire DL will be the main objective this offseason. 

There were huge drop-offs in sacks, TFLs, and pressures from 2021 to 2022.",2.0,browns,t3_10je4e5,False,0.0,:chubb:,2023-01-23T09:37:10Z,browns,-0.07955
22290,170791,170791,chubbinmypants,">Yup that’s the recipe

Then the last two Super Bowl winners didn't do their cooking by the book.",7.0,browns,t3_10iryea,False,0.0,:chubb:,2023-01-22T17:32:17Z,browns,0.7906
22291,170792,170792,chubbinmypants,"Pass rush > thicc boy 

Draft someone like Tuli Tuipulotu.",1.0,browns,t3_10gjyd7,False,0.0,:chubb:,2023-01-20T07:37:04Z,browns,0.3612
23212,174535,174535,datgenericname,Biggest win of the year for sure,11.0,browns,t3_10l4vm7,False,0.0,:browns:,2023-01-25T12:42:55Z,browns,0.7269
23213,174541,174541,datgenericname,Against because fuck ‘em.,1.0,browns,t3_10jqle1,False,0.0,:browns:,2023-01-23T20:55:32Z,browns,-0.5423
23214,174543,174543,datgenericname,Agreed. Eagles are a really scary team this year.,4.0,browns,t3_10iryea,False,0.0,:browns:,2023-01-22T16:46:22Z,browns,-0.20235
23215,174544,174544,datgenericname,"It would be whatever to me. They’ve been to the Super Bowl more often than us (obviously), but we have more NFL championships in general than them. With how many times they’ve gotten there, they are bound to get one eventually (granted, the Bills in the late 80’s / early 90’s said the same thing and well…)

And besides, we smacked them this year in Cleveland and would make smacking them that much better next year.

Edit: I cleaned up what I was trying to say.",0.0,browns,t3_10iryea,False,0.0,:browns:,2023-01-22T16:43:01Z,browns,0.049965625
23216,174545,174545,datgenericname,Then offer to settle with them giving us their 1st round pick and Stephon Diggs.,1.0,browns,t3_10iryea,False,0.0,:browns:,2023-01-22T16:38:32Z,browns,0.34
23217,174550,174550,datgenericname,I guess I can understand keeping Howard. He was able to coach up our lower draft pick/ UFA DBs when Ward and Newsome had issues this year and got them to play pretty well.,1.0,browns,t3_10gvbpu,False,0.0,:browns:,2023-01-20T07:23:33Z,browns,0.33525
23692,176130,176130,deviden,"The most important thing in football is a QB, the next most important thing is having a great skill position group, the next after that is having a DC who can piece together excellent gameplans against top QBs and cobble together something average or above without elite pieces across the board, the next is having a baseline acceptable or above OL group with well coached blocking rules.

The Bengals have got all those things. Landed ass backwards into having an elite QB and elite WR both on rookie contracts, so everything else on the salary cap side is EASY MODE because their most expensive pieces are cost controlled, but they should be credited for how they've spent that cap wisely and in such a way that their roster doesn't have any shit players. 

Everyone they have is functional/playable or above and their assistant coach group are all really good. I dont rate Zach Taylor much as a schemer or on anything other than his leadership, honestly, but with our Callahan's son as their OC and Lou Anaroumo as DC they've completely mitigated any weaknesses they have around Burrow.

I don't understand why Lou isn't getting HC offers because what he's doing with their defense - in terms of week to week gameplans, negating any weaknesses, fucking with the best QBs in the league, everyone knowing their jobs - is Bellichick tier. 

> its pretty frustrating to see a division rival fail to the top, which is what happened

My feelings exactly. Also... I will never forgive Ohio State for hiding Burrow. He should have been ours in the tank years.",2.0,browns,t3_10jfwo1,False,0.0,:crazy-joe:,2023-01-25T05:44:18Z,browns,-0.00464296565728
23693,176138,176138,deviden,"Don’t worry, someone in the fan base will come up with a way of saying how this reflects poorly on Stefanski and Berry.",8.0,browns,t3_10h3kwy,False,0.0,:crazy-joe:,2023-01-20T16:52:21Z,browns,-0.1531
24544,181675,181675,fear865,He’s taking some serious Jazz Baths,52.0,nfl,t3_10jlbae,False,0.0,:Browns: Browns,2023-01-23T13:40:39Z,browns,-0.0772
24545,181676,181676,fear865,Specially when said head coach has a losing record against their team,2.0,nfl,t3_10jjmpw,False,0.0,:Browns: Browns,2023-01-23T12:50:08Z,browns,-0.3818
24546,181677,181677,fear865,"Cause Grossi is a browns beat reporter, albeit a really bad one",7.0,nfl,t3_10jjmpw,False,0.0,:Browns: Browns,2023-01-23T12:34:45Z,browns,-0.5849
24547,181679,181679,fear865,Depends on the timeline. If he has the Bills OC job in a year or two then the wait would be worth it to have Josh Allen as your QB instead of the current question mark the Jets have,14.0,nfl,t3_10iogtf,False,0.0,:Browns: Browns,2023-01-22T11:24:56Z,browns,0.11315
24548,181682,181682,fear865,On the other hand. Lamar szn 👀,6.0,nfl,t3_10hb3zq,False,0.0,:Browns: Browns,2023-01-20T16:47:22Z,browns,0.123475
25028,183798,183798,foxmag86,"> I just don't get how Buffalo is given the home playoff game vs the Bengals.

How do you not understand it?  They both played 16 games.  Team with the better record got the home playoff game.

> Cinci was up in the regular season before the game was stopped.

It was the first freaking quarter.  So because a team is leading in the first quarter they're guaranteed to win?

> If Cinci won that game they would both have a 13-4 record and be 9-3 in conference play.

But they didn't win that game.",6.0,nfl,t3_10jahyf,False,0.0,:Browns: Browns,2023-01-23T10:14:55Z,browns,-0.0598338425567884
25029,183801,183801,foxmag86,Lol I actually had the same thought.,166.0,nfl,t3_10ixaxu,False,0.0,:Browns: Browns,2023-01-22T18:40:02Z,browns,0.4215
25030,183803,183803,foxmag86,2019 had the same Super Bowl hype.  But yes I agree 2021 was a big letdown but in my opinion I feel the hype and excitement going into 2019 was bigger because it was the first time we were supposed to be good in forever.,10.0,nfl,t3_10inqus,False,0.0,:Browns: Browns,2023-01-22T14:26:56Z,browns,0.62125
25031,183804,183804,foxmag86,"2019 Cleveland Browns.  

In 2018 it seemed we finally found our franchise qb in Baker Mayfield.  He broke the rookie touchdown record, the team finished with 7 wins, which felt like winning the Super Bowl around here.  We had just been through a 4-44 stretch so expectations were super low. 

We finished the 2018 season 5-3, and had one of the top offenses with Freddie Kitchens calling plays.  That offseason we picked up OBJ and Kareem Hunt.   That was to go along with a bunch of young exciting talent (Chubb, Myles, njoku, Landry)

Expectations were out of control going into 2019.  The season kicked off vs TEN and we went right down the field and scored with ease.  Fans were ready to book their Super Bowl tickets.  

Then…we missed the extra point.  Finished the game with 19 penalties and got blown out.  Started the season out 2-2 but finished a very disappointing 6-10.  Coaching staff and front office were wiped out after the season.",130.0,nfl,t3_10inqus,False,0.0,:Browns: Browns,2023-01-22T12:19:41Z,browns,-0.0041183150782328
25032,183805,183805,foxmag86,His 2010 season has to go down as a top 5 individual performance since 1999.,9.0,browns,t3_10iejcd,False,0.0,:browns:,2023-01-22T12:09:21Z,browns,0.2023
25210,185678,185678,gettin,Troll. Blocked.,1.0,browns,t3_10kixhq,False,0.0,:browns:,2023-01-25T15:46:37Z,browns,-0.1366
25211,185679,185679,gettin,"I cannot figure out if this is a joke or not.

Stable club?  They won 12 this year and 10 last year.

They won 25 games in the 5 years prior to 2021 combined.
The fan base wanted the coach fired.  They are a lot of things, but I would not call them stable, at least not yet.",-3.0,browns,t3_10kixhq,False,0.0,:browns:,2023-01-25T08:34:39Z,browns,-0.0599055126886145
25212,185680,185680,gettin,Hendrickson and Reader and Hubbard are all very good.  They control the line of scrimmage and apply pressure without having to blitz.,5.0,browns,t3_10kixhq,False,0.0,:browns:,2023-01-25T08:19:14Z,browns,-0.0248249999999999
25213,185681,185681,gettin,"If a Bengals fan comes on here to read what the Browns fans think, that is petty in my eyes.",-2.0,browns,t3_10kixhq,False,0.0,:browns:,2023-01-25T07:23:20Z,browns,0.128
25214,185682,185682,gettin,"The Bengals are winning with Defense, and I dont care who knows it.

Why are you so concerned with how a Bengals fan thinks?  Who cares?",-4.0,browns,t3_10kixhq,False,0.0,:browns:,2023-01-25T07:05:18Z,browns,0.1998444444444444
25215,185683,185683,gettin,Yes. But LV had to beat Nick Mullens to even get in thr playoffs. Very weak team.,-11.0,browns,t3_10kixhq,False,0.0,:browns:,2023-01-24T17:47:43Z,browns,-0.1493481481481481
25216,185684,185684,gettin,It is unreal how lucky they have been.,5.0,browns,t3_10kixhq,False,1.0,:browns:,2023-01-24T17:27:17Z,browns,0.4215
