,Unnamed: 0.1,Unnamed: 0,author,body,score,subreddit,link_id,over_18,controversiality,author_flair_text,created_utc,flair,sentiment
7352,82340,82340,Motor_Rub_4848,49ers I need the Eagles out before the Superbowl otherwise it'll be Super Calloff Sunday.,0.0,falcons,t3_10j4oji,False,0.0,It puts the lotion on the Rid...,2023-01-23T11:11:58Z,falcons,0.5994
7353,82342,82342,Motor_Rub_4848,Don't have the draft capital to trade for him. Don't have the salary cap to sign him if he gets cut. You can look forward to picking off a different bum on their shitty roster next year,10.0,falcons,t3_10irjtr,False,0.0,It puts the lotion on the Rid...,2023-01-22T14:03:43Z,falcons,-0.2161555555555555
7354,82347,82347,Motor_Rub_4848,"The question stated was more about how his work with Ridder and Mariota made him a good potential OC candidate but it's not just about his work with them it's about his body of work as a whole. 

In the NFL he has 3 years as the Texans RB coach. Those 3 years Houston had a RB get over 1200 yards and gave Houston a rushing attack that would allow them to make the playoffs one year even. 

Eventually left to pursue becoming a QB coach. That didn't pan out until he had 3 more years as a RB coach with da Bears that had one fruitful season then came to Atlanta and got the QB coaching job he was looking for.

I'd say his past successful years as a RB coach would give him plenty of looks especially now with extra experience as a QB coach. The league has also been slowly shifting back to run first with how defenses have now evolved to defend the pass so heavily(smaller but faster linebackers that can drop back into coverage but end up getting bullied by big backs now). If your one of the many teams not set at QB your looking at London and realizing you may want to switch to a run first offense.",3.0,falcons,t3_10ghirn,False,0.0,It puts the lotion on the Rid...,2023-01-20T10:29:26Z,falcons,-0.0343755290150642
7854,83173,83173,Mr3Jays,"I’d rather them stick with ridder for a year and have said so numerous times, but I’ve been a fan of Lamar since he was at Louisville so I’ll definitely get up if he ends up in ATL",31.0,falcons,t3_10lghpm,False,0.0,:Juliostare:,2023-01-25T20:05:14Z,falcons,0.7856
7855,83175,83175,Mr3Jays,Hell no.,1.0,falcons,t3_10kf9qk,False,0.0,:Juliostare:,2023-01-24T20:38:02Z,falcons,-0.6808
7856,83176,83176,Mr3Jays,"Unpopular opinion, but I’d take DQ at DC over Shanahan at OC. Yes, Shanahan got the most of our offense while he was here, but he has a habit of making bonehead decisions in big games and moments. DQ’s defenses have never been the reason for losing games when he was a coordinator. I know Dallas just loss, but that was the first time the 9ers have been held under 30 points since Purdy has been playing. I think our current offensive scheme with DQ helming the defense would be an outstanding combination.",-5.0,falcons,t3_10k7rw8,False,0.0,:Juliostare:,2023-01-24T10:20:51Z,falcons,0.07614352
7857,83179,83179,Mr3Jays,"Not as bad as this one. I had SUCH high hopes for our Dirty Birds back then. Watching that game, I could feel my soul being slowly sucked out of my body. Depressing day overall.",3.0,nfl,t3_10jp2u6,False,0.0,:Falcons: Falcons,2023-01-23T16:18:22Z,falcons,-0.12284453125
7858,83180,83180,Mr3Jays,I’ve never understood the disdain for Joe Buck. I’ve always thought he was good.,71.0,nfl,t3_10jp5sf,False,0.0,:Falcons: Falcons,2023-01-23T16:16:48Z,falcons,0.3133
7859,83190,83190,Mr3Jays,No. I want to see Ridder for a full off season and year as the starter.,1.0,falcons,t3_10hhiwa,False,0.0,:Juliostare:,2023-01-21T08:11:24Z,falcons,0.0386
8039,85006,85006,NewFocus3-5,I’m sayin. Don’t do a former mvp like that lol. Definitely time for dude to hang it up though,2.0,nfl,t3_10kkn4n,False,0.0,:Falcons: Falcons,2023-01-25T17:05:30Z,falcons,0.2060333333333333
8040,85008,85008,NewFocus3-5,"Nothing huge, but there was the strip club incident after the week 1 loss to the bears. We don’t need a James Harden under center in Atlanta.",0.0,falcons,t3_10kw5os,False,0.0,:Juliostare:,2023-01-25T10:12:28Z,falcons,-0.1329
8041,85010,85010,NewFocus3-5,"Please stop the Lance train before it gets going. He’s made a minimal amount of pass attempts in his career and barely seen the field. There are injury questions, off the field character questions (Atlanta is one of the last places you need those questions), and his mobility isn’t THAT impressive. Ridder is a better option, unless a miracle happens and Stroud or Young are available to us in the draft.",1.0,falcons,t3_10kw5os,False,0.0,:Juliostare:,2023-01-25T09:45:01Z,falcons,0.20102578125
8042,85011,85011,NewFocus3-5,Jets or Falcons. Whoever plays their cards better this offseason.,1.0,nfl,t3_10koype,False,0.0,:Falcons: Falcons,2023-01-25T08:26:40Z,falcons,0.2997
8043,85012,85012,NewFocus3-5,"I’m going Hutchinson and KW3. Really hard not to pick the two Jets, that franchise was just such a shit show this season. Can’t wait to see Wilson blossom into one of the league’s premier receivers.",3.0,nfl,t3_10kyp53,False,1.0,:Falcons: Falcons,2023-01-25T08:12:08Z,falcons,-0.0719777777777777
8044,85014,85014,NewFocus3-5,"Pash rush, a tall safety for over the top, veteran O-Lineman, veteran WR if we can land one",1.0,falcons,t3_10ive5l,False,0.0,:Juliostare:,2023-01-24T19:43:47Z,falcons,0.5574
8045,85016,85016,NewFocus3-5,He’s literally only thrown 157 attempts. He’s not proven on the field yet and there’s questionable off the field stuff. Ridder is a better option.,2.0,falcons,t3_10j0ux5,False,0.0,:Juliostare:,2023-01-24T15:06:26Z,falcons,0.1139111111111111
8046,85017,85017,NewFocus3-5,I feel you. I like our young weapons on offense. I think we need to resign Pruitt and add a veteran OL plus WR. Obviously we’re going to have to build the defense from the ground up.,1.0,falcons,t3_10jrqwi,False,0.0,:Juliostare:,2023-01-24T14:55:21Z,falcons,0.0054374999999999
8047,85018,85018,NewFocus3-5,"I didn’t realize what his market value is going to be in free agency. I’m all for giving Ridder a full season to develop, it was just a thought.",1.0,falcons,t3_10jrqwi,False,0.0,:Juliostare:,2023-01-24T11:01:33Z,falcons,0.3427
8049,85020,85020,NewFocus3-5,"Painful at the time, but now it’s just funny to think about him.",16.0,falcons,t3_10jww7y,False,0.0,:Juliostare:,2023-01-24T07:29:01Z,falcons,0.4404
8050,85021,85021,NewFocus3-5,"Yeah, I didn’t research his market value. Absolutely not for 25 million a year. I think The Giants will even have a hard time making a decision on that.",-7.0,falcons,t3_10jrqwi,False,0.0,:Juliostare:,2023-01-23T20:48:30Z,falcons,-0.0135888888888888
8051,85022,85022,NewFocus3-5,"I’m just terrified of the idea/possibility of ending up with ACTUAL Ryan Tannehill this off-season. I’m being super impatient right now, I can acknowledge that.",4.0,falcons,t3_10jrqwi,False,0.0,:Juliostare:,2023-01-23T20:44:50Z,falcons,0.0478499999999999
8052,85023,85023,NewFocus3-5,"Wow. Yeah, no.",1.0,falcons,t3_10jrqwi,False,0.0,:Juliostare:,2023-01-23T20:43:06Z,falcons,0.294475
8053,85024,85024,NewFocus3-5,Something like 3 or 4 years for 10-15 million a year.,0.0,falcons,t3_10jrqwi,False,1.0,:Juliostare:,2023-01-23T20:07:17Z,falcons,0.3612
8054,85025,85025,NewFocus3-5,"I mostly agree with you. I just think there’s room for consideration. I’m all for riding with Ridder next season I just don’t want the wheels to fall off mid season, but then again that may be what we need to get what we want long term.",2.0,falcons,t3_10jrqwi,False,1.0,:Juliostare:,2023-01-23T20:03:57Z,falcons,0.0644111111111111
8055,85029,85029,NewFocus3-5,"The Brady/Manning era has skewed our perception of the playoffs and the actual reality of winning a Super Bowl. We’ve seen such a decline in star player leadership since the transition to the Mahomes/Allen/Burrow era. Not directing anything at those 3 qbs, they’re solid leaders.",2.0,nfl,t3_10jgge1,False,0.0,:Falcons: Falcons,2023-01-23T12:31:06Z,falcons,0.080937037037037
8056,85031,85031,NewFocus3-5,"9ers because we beat them, but the bengals are getting hot at the perfect time.",2.0,falcons,t3_10iwlzy,False,0.0,:Juliostare:,2023-01-22T18:36:49Z,falcons,0.7227
8057,85033,85033,NewFocus3-5,Yeah let’s draft the kid who’s tied for 69th in sacks,1.0,falcons,t3_10hp1h6,False,0.0,:Juliostare:,2023-01-21T15:30:28Z,falcons,0.296
8138,89780,89780,OGyuckmouth,It's the only successful NFL walk-off lateral touchdown. Happened multiple times in college but only once in the league,16.0,nfl,t3_10jdafm,False,0.0,:Falcons: Falcons,2023-01-23T10:55:10Z,falcons,0.146475
8196,90390,90390,OhItsKillua,Big thing with the 49ers is their weakness is their secondary and the Eagles having AJ and Devonta. They should be able to abuse that all day.,31.0,nfl,t3_10ij8ww,False,0.0,:Falcons: Falcons,2023-01-22T07:49:14Z,falcons,-0.423825
8197,90391,90391,OhItsKillua,"That defensive line is ridiculous, I don't think any team has the personnel to shut them down. Just a bunch of monsters coming for your QB every pass play. To top it off they'll probably replace them with another defensive linemen at 10 in the draft.",241.0,nfl,t3_10ij8ww,False,0.0,:Falcons: Falcons,2023-01-22T07:12:38Z,falcons,0.1006185185185185
8198,90396,90396,OhItsKillua,"Yeah I really don't see why you wouldn't get that especially as a QB. Pretty sure anyone that does mma or boxing isn't supposed to get lasik for reasons I don't recall, but I think an NFL player would be fine.",13.0,nfl,t3_10i82vp,False,0.0,:Falcons: Falcons,2023-01-21T20:06:27Z,falcons,0.37695
8199,90410,90410,OhItsKillua,"I mean Odell was a 1 year rental, hard to consider somewhere there for a long term period. Pretty sure that same was true for Von as well lol. 

Also not like they left by their own volition, Rams don't have the cap space for those guys.",8.0,nfl,t3_10h625i,False,0.0,:Falcons: Falcons,2023-01-20T16:26:15Z,falcons,0.0048296296296296
8200,90411,90411,OhItsKillua,"Dynasty? They are not a dynasty. Who have they even had leave the team either for that matter, their stars are all on contracts still.",20.0,nfl,t3_10h625i,False,0.0,:Falcons: Falcons,2023-01-20T14:49:55Z,falcons,-0.0086
8307,91897,91897,PWNtimeJamboree,"biggest non-call? yes

best non-call? also yes.",3.0,falcons,t3_10gx7iw,False,0.0,WAP - WET ASS PITTSY,2023-01-20T11:06:06Z,falcons,0.2211333333333333
8756,98295,98295,RayzorBeak,"Dawgs fan.

Going to UGA for a grad cert now.

Likely going to GT for a Doctorate after.

Still a Dawgs fan lol.",9.0,falcons,t3_10lig53,False,0.0,:2::7::8::11:,2023-01-25T22:25:30Z,falcons,0.18420546875
8757,98298,98298,RayzorBeak,"He fits the team in a variety of ways. It’s a run first offense that AS brought over from Tennessee, the team that mimics the Ravens a lot in the AFC and actually knocked them out as a 1 seed. We have big threats that Lamar never had in Baltimore, with Pitts and London. We have a 1K bruising back in Allgeier and CP. We have a solid run blocking Oline. 

One of those articles said you have under 25 year olds at WR1, TE1, LG1, and HB1. That’s a wonderful young core. 

He would come to a weak division void of franchise QBs, in a conference much weaker at QB than the AFC (let’s say Rodgers goes to the Jets and Brady to Vegas. Even worse of a conference at QB). 

He would sell tickets to the Benz, jersey sales would be top 5 in the league (yes I’d def get one), and energize a city that’s Black Mecca in the US right now, and a fanbase that remembers Vick and what could have been. 

Lamar is a fit for many reasons. 
Lamar is also an expensive ass fit for many reasons. 

All it comes down to is what the owner wants, the GM and HC want in a QB, and what Lamar wants. 

This is very possible, so don’t just discount it because you think it’s expensive and illogical. It’s not our money to spend or our team to run.",13.0,falcons,t3_10lghpm,False,0.0,:2::7::8::11:,2023-01-25T21:46:32Z,falcons,1.8475568871385445e-05
8758,98300,98300,RayzorBeak,Boy Lamar got it easy when he come here! Lol,1.0,falcons,t3_10l814u,False,0.0,:2::7::8::11:,2023-01-25T18:39:51Z,falcons,0.3339
8759,98302,98302,RayzorBeak,"I saw enough of the Watson to Atlanta rumors to know this isn’t official until shit goes down. 

It’s a great fit but other than that, we’ll have to see.",7.0,falcons,t3_10l0rlg,False,0.0,:2::7::8::11:,2023-01-25T09:47:58Z,falcons,0.11595
8760,98305,98305,RayzorBeak,Nah they’ll move to San Antonio like they almost did after Katrina.,8.0,falcons,t3_10koub5,False,0.0,:2::7::8::11:,2023-01-24T23:01:17Z,falcons,0.2732
8761,98308,98308,RayzorBeak,"You must be trolling or not a fan during this time lol. 
I see Turner 33, Tuggle 58, and Brooking 56.

All of those are Falcon legends…",7.0,falcons,t3_10knex2,False,0.0,:2::7::8::11:,2023-01-24T22:46:04Z,falcons,0.0078333333333333
8762,98309,98309,RayzorBeak,"Opponents can't score if they don't have the ball.

Lamar with QB runs mixed in with runs by CP and Allgeier, taking 10 minutes off the clock each quarter.

28 points a game.

We're on our way y'all! lol",2.0,falcons,t3_10kfojl,False,0.0,:2::7::8::11:,2023-01-24T19:03:31Z,falcons,0.0843
8763,98313,98313,RayzorBeak,"Matt Ryan started from the get go on a playoff bound team, against starting defenses and QBs.

Ridder, no disrespect, couldn't beat out bum Mariota for most of the year, and then played 4 games at the end against a Cardinals and Bucs defense resting starters, and a Saints, Ravens, Cardinals, and Bucs team missing/resting their starting QBs.

I don't think we can take much out of those starts, outside of the fact that he looked decent. 

I also think the timing of the starts and the results further cements my belief that AS and TF do NOT believe in him as the franchise QB.....yet. 

I'll continue to harp that they took a flyer on the kid in the third, with their 4th pick of the draft, because he was still there and they liked his Mariota clone-ness.

I think a big fish QB is still what they want, and maybe it's because the owner is breathing down their necks demanding it.",-3.0,falcons,t3_10k6s5n,False,1.0,:2::7::8::11:,2023-01-24T10:35:43Z,falcons,-0.0137221257716049
8764,98314,98314,RayzorBeak,"Kyle Shanahan is THE offensive genius in the NFL.

His scheme, inherited a lot from his father, is brilliant and effective.

Zone blocking done to an art, where late round backs and UDFAs become studs quickly, like Terrell Davis, Alfred Morris, Devanta Freeman and Tevin Coleman here, Mostert in SF, etc.

Not to mention the receivers who become studs in his system.

Taylor Gabriel, Julio, Hooper, and Sanu here.

Kittle and Deebo in SF.

He literally makes players stars and wins while doing it. Could already have 2 Super Bowl rings had he not overthought his 4th quarters.

He'll get one eventually.

&#x200B;

Don't even get me started on Arthur Smith as a comparison. He hasn't done diddly squat outside of establishing a run game from the 1950s.",-4.0,falcons,t3_10k7rw8,False,0.0,:2::7::8::11:,2023-01-24T10:30:29Z,falcons,4.449104839215294e-05
8765,98315,98315,RayzorBeak,I don’t even think the gimpy ankle has much of an impact. The Bengals just have a confidence that can’t be matched.,-2.0,nfl,t3_10jpbz4,False,0.0,:Falcons: Falcons :Falcons: Falcons,2023-01-23T20:59:01Z,falcons,0.2553
8766,98316,98316,RayzorBeak,He edited his post lol. It said “we’re not all fucking criminals or something” lol,5.0,nfl,t3_10jnnhj,False,0.0,:Falcons: Falcons :Falcons: Falcons,2023-01-23T20:57:43Z,falcons,0.465225
8767,98323,98323,RayzorBeak,Did you write that from your 15 min break in jail? Lol,158.0,nfl,t3_10jnnhj,False,0.0,:Falcons: Falcons :Falcons: Falcons,2023-01-23T15:47:38Z,falcons,0.21075
8768,98324,98324,RayzorBeak,"Bad look for us fans...

Philly fans? 

Not really a shocking thing unfortunately.",56.0,nfl,t3_10jnnhj,False,0.0,:Falcons: Falcons :Falcons: Falcons,2023-01-23T15:34:23Z,falcons,-0.127325
8769,98325,98325,RayzorBeak,"Red throwback helmets.

Black jersey.

White pants.

Our current throwback set, yes.",1.0,falcons,t3_10ixgwj,False,0.0,:2::7::8::11:,2023-01-23T15:30:25Z,falcons,0.100475
8770,98326,98326,RayzorBeak,"No you’re right. What’s made it easier for me is the other teams actually. Seeing United and the Braves and the Dawgs win titles in the past 5-6 years has been great. I never thought I’d see a local team win a title much less a local team win back to back. 

That’s allowed me to ease some Falcon burden and treat them like the child you have that isn’t great at much but bless his heart lol.",1.0,falcons,t3_10j1kp7,False,0.0,:2::7::8::11:,2023-01-23T12:45:03Z,falcons,0.23275888
8771,98329,98329,RayzorBeak,"The point was more about how Dallas props up QBs picked later or UDFAs like Romo and expects them to be the saviors and when they’re not, they get shocked why.",-5.0,nfl,t3_10j55j9,False,0.0,:Falcons: Falcons :Falcons: Falcons,2023-01-23T00:05:01Z,falcons,0.5365
8772,98330,98330,RayzorBeak,Retire Matt. Come home and go into the Ring of Honor.,6.0,nfl,t3_10j42mk,False,0.0,:Falcons: Falcons :Falcons: Falcons,2023-01-23T00:03:57Z,falcons,0.24695
8773,98331,98331,RayzorBeak,"Which is why I hated the Rams winning it, even if he was a Dawg. It just felt corporate and shallow, like their team. A team built for a temporary gratification, in a city that never really cared for pro football and the league trying to hard to make it relevant. 

Then they fell back into mediocrity and the Bengals are still here, as expected, with a stud young QB and WR core, and HB, and defense. 

The Bengals deserved to win it last year but I’m sure they’ll get there eventually.",37.0,nfl,t3_10j4l4t,False,0.0,:Falcons: Falcons :Falcons: Falcons,2023-01-22T23:58:57Z,falcons,0.1326995839999999
8774,98332,98332,RayzorBeak,No intruding. It intrudes on his football fantasies.,33.0,nfl,t3_10j4l4t,False,0.0,:Falcons: Falcons :Falcons: Falcons,2023-01-22T23:56:41Z,falcons,-0.074
8775,98333,98333,RayzorBeak,"I’ll root for Kyle here but I’d be fine with the Eagles getting there. I like Hurts and his redemption arc since his Bama days, and I couldn’t stand him at Bama as a Dawgs fan. 

Nevertheless it’s all moot. I’m going for the Bengals to win it all. Joe Burr is that guy. Just a damn winner.",24.0,falcons,t3_10j4oji,False,0.0,:2::7::8::11:,2023-01-22T23:54:59Z,falcons,0.0482750557270233
8776,98335,98335,RayzorBeak,"Dak is a 4th round pick who chanced into a starting role for the biggest media marketed team in America. Unfortunately for him, he was elevated to savior status without really being that guy. 

4th rounder from a SEC West average team. 
Come on now.",-6.0,nfl,t3_10j55j9,False,1.0,:Falcons: Falcons :Falcons: Falcons,2023-01-22T23:52:17Z,falcons,-0.0053125
8777,98336,98336,RayzorBeak,"It’s the unneeded allure of that team. The Steelers, who I’ve had a soft spot for growing up in the early 2000s, have a bigger fanbase in North America, especially Mexico, and they don’t get the media hype year in and out like the Cowboys do. 

They actually decried the Americas Team nickname in the 70s first. 

Having coworkers who are fans also increases my hatred for them. I’m talking people that are born and raised in Georgia and have parents born and raised in Georgia but are Cowboys fans because they were winning in the 70s and 90s and the Falcons were not. 

Talk about 2nd generation bandwagoning.",29.0,falcons,t3_10j1kp7,False,0.0,:2::7::8::11:,2023-01-22T21:49:39Z,falcons,0.016026015946502
8778,98337,98337,RayzorBeak,"Lol that game will never leave us huh. My younger brother is turning 28 tomorrow and he was born around 1:30 am, so yes, he reminded me that he will be 28 in 3 hours. 

Smh",13.0,falcons,t3_10j1kp7,False,0.0,:2::7::8::11:,2023-01-22T21:46:56Z,falcons,-0.0293148148148148
8779,98338,98338,RayzorBeak,"Another reason I want the Bengals to win this, is to avoid that neutral site AFC title game. Arthur Blank shouldn’t get revenue from an easy out like that. Stop watching other teams win conference titles, pro or college, on your turf. Build a damn winner.",2.0,nfl,t3_10irx3e,False,0.0,:Falcons: Falcons :Falcons: Falcons,2023-01-22T14:28:08Z,falcons,0.104190625
8780,98339,98339,RayzorBeak,Lol that was a joke because the narrative the league wanted a winner in LA badly was being touted. They still nearly won that game.,1.0,nfl,t3_10irx3e,False,0.0,:Falcons: Falcons :Falcons: Falcons,2023-01-22T14:26:21Z,falcons,0.4535749999999999
8781,98340,98340,RayzorBeak,Which is hilarious to think.,2.0,nfl,t3_10irx3e,False,0.0,:Falcons: Falcons :Falcons: Falcons,2023-01-22T14:25:10Z,falcons,0.4019
8782,98341,98341,RayzorBeak,"Bengals are really fun team to watch, with great young talent, a near Super Bowl last year had the league not demanded a LA title to hype up the average pro football market, and sweet uniforms.",6.0,nfl,t3_10irx3e,False,0.0,:Falcons: Falcons :Falcons: Falcons,2023-01-22T14:24:38Z,falcons,0.9587
8783,98342,98342,RayzorBeak,The Snow Tiger strikes!,3.0,nfl,t3_10irx3e,False,0.0,:Falcons: Falcons :Falcons: Falcons,2023-01-22T14:08:25Z,falcons,-0.4199
8784,98343,98343,RayzorBeak,"Crazy idea. Keep someone off his coaching tree. Instead we let the LaFleur bros go, and Mike McDaniel as well I believe. Basically anyone that was here with him.",7.0,falcons,t3_10ip9bt,False,0.0,:2::7::8::11:,2023-01-22T14:00:44Z,falcons,0.015746875
8785,98344,98344,RayzorBeak,"Kyle Shanahan effect...

Shame we couldn't be in a situation to keep him as the HC.",3.0,falcons,t3_10ip9bt,False,0.0,:2::7::8::11:,2023-01-22T13:19:06Z,falcons,-0.4767
8786,98346,98346,RayzorBeak,"I agree with the belief that Ridder isn’t the future because I don’t believe he was picked to be that guy. If he was on the 9ers and starting right now, he may be that guy. We don’t have the offensive genius play caller (Smith hasn’t shown enough yet outside of old school effective running) or the experienced weapons. 

Ridder is on a team that has few offensive weapons, no second or third legit receiver, or a solid defense. 

They don’t have the time to see if he develops. 

I still feel that this team is being set up for a veteran stud QB, and Blank is asking that guy put butts in seats.

It ain’t Carr either.",0.0,falcons,t3_10hwrnk,False,1.0,:2::7::8::11:,2023-01-21T14:00:18Z,falcons,-0.0003048806194697
8787,98349,98349,RayzorBeak,"If Stroud is there, which is impossible, you better go get him. 
Do not keep passing on top tier QB1 talent without a plan. 
There was no plan when we passed on Fields. 
Ryan got dumped unceremoniously and we got egg on our face for Watson. Then we got stuck with a mediocre Mariota and quickly took a flyer on a QB in a very weak class last year, just to fill the room and see “what happens”. 

Stroud isn’t Fields, or any of these previous OSU QBs. 
The guy is more Mahomes like. He sits in the pocket and passes, and runs when needed, as we saw against Georgia. 

Again, this point is moot. He’s going 1st or 2nd overall anyways.

The crazy chance he is there at 8, we’re taking him over whoever that Iowa guy is because TF believes in BPA.",15.0,falcons,t3_10hp1h6,False,0.0,:2::7::8::11:,2023-01-21T09:59:02Z,falcons,-0.0093338071510627
8788,98350,98350,RayzorBeak,"Is he motivated to return and be great? Will he want to show the 9ers they gave up to early? Were the reports that TF and AS wanted him at 4 but SF jumped over us true? 

If so, I’d take a flyer on him. He has more natural talent than Ridder.",5.0,falcons,t3_10hhiwa,False,0.0,:2::7::8::11:,2023-01-20T23:22:14Z,falcons,0.146353568
8789,98356,98356,RayzorBeak,"We made the mistake of not hiring a Shanahan type before hiring Quinn. This team had Julio, Ryan, Roddy, etc. on it. We were paying the offense and clearly nearly won a title on offense. 

The fact Blank went after a defensive guy who didn’t help the defense much at all, didn’t develop 1st round talent who became busts several times, set us back.",12.0,falcons,t3_10ha3kb,False,0.0,:2::7::8::11:,2023-01-20T17:12:33Z,falcons,0.1663392
8790,98358,98358,RayzorBeak,"Why do these teams pick these guys and cross their fingers their talent will override their character or attitudes? Zach Wilson had these potential issues coming out and lo and behold, they transpire as expected. 

And no, I’m not really asking. We see what Cleveland did for Watson, or how the NFC South chased him as well. 

Talent, or potential talent, is the ultimate deciding factor.",0.0,nfl,t3_10gnfdb,False,0.0,:Falcons: Falcons :Falcons: Falcons,2023-01-20T11:40:43Z,falcons,0.1156548799999999
8791,98361,98361,RayzorBeak,"I think it works but the new one is better simply from a evolution standpoint. The old one looks like a throwback. The new one looks better on merchandise now. 

However, I want those Coke Red throwback helmets to be permanent and the throwback logo looks amazing on those. 

I don’t think the new logo would look as good on red helmets so it’s an interesting Situation. 

Maybe they can merge the two for a baby lol.",9.0,falcons,t3_10h18tq,False,0.0,:2::7::8::11:,2023-01-20T11:33:10Z,falcons,0.0931614690500685
8792,98362,98362,RayzorBeak,"Maybe they should add those stripes down the pant legs. If you look good, you play good and win good or something. 

Someone tell Blank! The reason we suck is because we don’t look good lol.",5.0,falcons,t3_10gvup5,False,0.0,:2::7::8::11:,2023-01-20T08:10:46Z,falcons,0.1199265625
8793,98363,98363,RayzorBeak,"I laughed when this happened to them but from strictly a football viewing standpoint, this was a really bad no call lol. Almost insane lol.

At least they had a shot in over time to still win the game so it didn’t end here, even if it could have to avoid a complete moaning and groaning aftermath.",82.0,falcons,t3_10gx7iw,False,0.0,:2::7::8::11:,2023-01-20T08:06:49Z,falcons,0.069137037037037
