,Unnamed: 0.1,Unnamed: 0,author,body,score,subreddit,link_id,over_18,controversiality,author_flair_text,created_utc,flair,sentiment
18794,207399,207399,ssovm,"Besides the primary ones.
- Bengals having Joe Burrow is an extreme advantage. That guy has the makings of one of the future greats. The way he plays is so confident and effortless. The entire team is boosted with his presence. It worked out for the Bengals perfectly to have the greatest college QB drop in their laps like that. Obviously Jags could be in a similar situation next year. Their GM deserves a lot of credit for the team he built. 
- John Lynch has made some mistakes (like the Trey Lance trade), but his ability to manage talent is head and shoulders above Dimitroff’s. I think Terry Fontenot could be as good as that. The next couple of years will be telling. 

I think it boils down to the GMs. Dimitroff really destroyed the team and we’re just now getting out of it.",4.0,falcons,t3_10j488o,False,0.0,Rise up,2023-01-23T08:13:20Z,falcons,-0.0416208921817002
18795,207400,207400,ssovm,A creative playcall designed to get Zeke pancaked on prime time.,1.0,nfl,t3_10j1tig,False,0.0,:Falcons: Falcons,2023-01-22T20:53:41Z,falcons,0.4404
18796,207401,207401,ssovm,WHAT A CATCH! That concussion helmet helped out haha,3.0,nfl,t3_10iwzvh,False,0.0,:Falcons: Falcons,2023-01-22T19:46:52Z,falcons,0.2294
18797,207405,207405,ssovm,He’s not sexy by any means but he’s passionate and calls a good game!,2.0,nfl,t3_10ikjai,False,0.0,:Falcons: Falcons,2023-01-22T11:48:05Z,falcons,0.834
18798,207406,207406,ssovm,Mariota will likely be released. Ridder is playing better.,3.0,nfl,t3_10ikjai,False,0.0,:Falcons: Falcons,2023-01-22T11:47:12Z,falcons,0.28595
18799,207407,207407,ssovm,Matter of opinion. I would rank them above average personally. Not perfect in my eyes but look cleaner than many other jerseys.,3.0,nfl,t3_10ikjai,False,0.0,:Falcons: Falcons,2023-01-22T11:44:17Z,falcons,0.0053555555555555
18800,207408,207408,ssovm,He was a good WR the first year so yeah I guess so.,4.0,nfl,t3_10ikjai,False,0.0,:Falcons: Falcons,2023-01-22T11:43:18Z,falcons,0.6972
18801,207409,207409,ssovm,"Just because you don’t know doesn’t mean they lack direction. Out of everyone on the NFCS, they have by far the most direction. It’s looking good at the moment. Biggest question mark is at QB and the debates are going hard about if we try to acquire Lamar or stick with Ridder.",8.0,nfl,t3_10ikjai,False,0.0,:Falcons: Falcons,2023-01-22T11:41:41Z,falcons,0.00060703125
18802,207411,207411,ssovm,"I feel like he somehow got the blue checkmark and just starts spouting stuff hoping to become legitimate. Then maybe by being this way, he can get real sources",3.0,falcons,t3_10hwrnk,False,0.0,Rise up,2023-01-21T21:17:16Z,falcons,0.16215
18803,207412,207412,ssovm,The Watson stuff was by that Jake ATL guy actually. And that guy was right until he wasn’t (Cleveland offered Watson an offer he couldn’t refuse).,4.0,falcons,t3_10hwrnk,False,0.0,Rise up,2023-01-21T18:40:33Z,falcons,-0.148
18804,207413,207413,ssovm,Cam Marino is legit the target to that “source? I made it up” meme. Dude isn’t to be trusted. He makes shit up,2.0,falcons,t3_10hwrnk,False,0.0,Rise up,2023-01-21T18:39:32Z,falcons,-0.10955625
18805,207414,207414,ssovm,It’s the falcons. Unfortunately that’s how it is. But he does get some attention on fantasy folks looking ahead which is cool.,0.0,falcons,t3_10hoa2w,False,0.0,Rise up,2023-01-21T10:42:33Z,falcons,0.1121222222222222
18806,207415,207415,ssovm,"I think the logic was sound. Trying to bolster your weakness which was defense. Presumably, your GM and HC should be able to identify good talent while letting the offense be the engine of the team.",6.0,falcons,t3_10ha3kb,False,0.0,Rise up,2023-01-20T20:51:20Z,falcons,0.1552777777777777
18807,207416,207416,ssovm,"Think you’re misplacing blame here. Dimitroff should’ve managed that better. He was a dumpster fire in many aspects in hindsight. Hiring staff, finding defensive talent, and those atrocious contracts.",1.0,falcons,t3_10ha3kb,False,0.0,Rise up,2023-01-20T20:48:22Z,falcons,0.086978125
18808,207417,207417,ssovm,"I actually wish we fired Dimitroff with Mike Smith. Dude whiffed on virtually every defensive first rounder in the Quinn era. Can’t build a good defense when Keanu can’t cover, and Vic and Takk just busting. 

DQ is capable of calling plays and coaching a team. But god damn the GM needs to draft some talent.",10.0,falcons,t3_10ha3kb,False,0.0,Rise up,2023-01-20T20:46:13Z,falcons,0.110778464
19180,209600,209600,techno-wizardry,As a Falcons fan I endorse celebrating this occasion yearly,1.0,nfl,t3_10h7l8n,False,0.0,:Falcons: Falcons,2023-01-21T02:29:50Z,falcons,0.8074
19221,211479,211479,the_penis_taker69,We still won though,12.0,falcons,t3_10k9ig8,False,0.0,FTS,2023-01-24T12:20:02Z,falcons,0.5719
19222,211525,211525,the_penis_taker69,tbf that's a lot better than the Saints potentially winning it there,20.0,falcons,t3_10jhy1r,False,0.0,FTS,2023-01-23T15:04:59Z,falcons,0.743
19223,211536,211536,the_penis_taker69,"The last 3 super bowls have been teams winning their second, so maybe",9.0,nfl,t3_10jfdsi,False,0.0,:Falcons: Falcons,2023-01-23T09:59:03Z,falcons,0.8074
19224,211537,211537,the_penis_taker69,Eagles since I want a super bowl of endless yardage and points,5.0,falcons,t3_10j4oji,False,0.0,FTS,2023-01-23T09:48:37Z,falcons,0.6369
19225,211562,211562,the_penis_taker69,"Yeah teal makes no sense for the Jaguars, this actually looks like a jaguar",0.0,nfl,t3_10h9m8u,False,0.0,:Falcons: Falcons,2023-01-21T10:06:16Z,falcons,0.3612
19226,211577,211577,the_penis_taker69,I kind of like that actually,14.0,nfl,t3_10h9m8u,False,0.0,:Falcons: Falcons,2023-01-20T19:25:42Z,falcons,0.2975
19397,213439,213439,thisnamehastobeused,That was the most awkward 15 seconds at the beginning of the video,12.0,falcons,t3_10j5g30,False,0.0,:Juliostare:,2023-01-23T09:47:22Z,falcons,-0.2247
19398,213442,213442,thisnamehastobeused,Just because you hear an opinion doesn’t make you auto believe it? And have you not been paying attention to the shit show of Atlanta the last few years? If I was a fear weather fan I would’ve dipped 2 years ago. And Buffalo hasn’t exactly been smooth sailing ether. Sure we’ve made the playoffs but there’s been some bad times in there dude. If I wanted to be a fair weather fan I would choose to be a fan of the most hated nfl team right now and a team that has more holes then the human body,1.0,nfl,t3_10irx3e,False,0.0,:Falcons: Falcons :Bills: Bills,2023-01-22T15:43:58Z,falcons,-3.752572016460972e-05
19399,213443,213443,thisnamehastobeused,"Okay, let’s think. Hmmmm what’s going to be more people? Multiple different podcasts and shows? Or over half a subreddit with more then 100k people? What a question that is my guy. Also in response to that bs fair weather fan bull, I’ve been a falcons fan for 6 years and a bills fan for 5 so get out of here with that shit",1.0,nfl,t3_10irx3e,False,0.0,:Falcons: Falcons :Bills: Bills,2023-01-22T15:26:07Z,falcons,0.0929048503943758
19400,213444,213444,thisnamehastobeused,Do you not have a clue what you said? You said “I remember when people…” NOTHING about announcers. Do you have like short term memory loss and can’t read what you’ve typed? Or do you like ignoring that because it makes you look more correct.,1.0,nfl,t3_10irx3e,False,0.0,:Falcons: Falcons :Bills: Bills,2023-01-22T15:15:54Z,falcons,-0.009675
19401,213445,213445,thisnamehastobeused,Literally every nfl fan calling Allen a cry baby for talking shit.,1.0,nfl,t3_10irx3e,False,0.0,:Falcons: Falcons :Bills: Bills,2023-01-22T15:03:24Z,falcons,-0.6597
19402,213446,213446,thisnamehastobeused,Damn. They might have to cancel the game if it gets any lower,2.0,nfl,t3_10irx3e,False,0.0,:Falcons: Falcons :Bills: Bills,2023-01-22T14:55:39Z,falcons,-0.347425
19403,213447,213447,thisnamehastobeused,So much snow I honest to god didn’t know it was him,1.0,nfl,t3_10irx3e,False,0.0,:Falcons: Falcons :Bills: Bills,2023-01-22T14:53:15Z,falcons,0.6597
19404,213449,213449,thisnamehastobeused,He’s been taking contact like that all year. Allen likes to look for that contact.,1.0,nfl,t3_10irx3e,False,0.0,:Falcons: Falcons :Bills: Bills,2023-01-22T14:52:01Z,falcons,0.30105
19405,213451,213451,thisnamehastobeused,"Trick question, Vilma sucking off the saints",1.0,nfl,t3_10irx3e,False,0.0,:Falcons: Falcons :Bills: Bills,2023-01-22T14:48:14Z,falcons,-0.0516
19406,213452,213452,thisnamehastobeused,You try throwing it more then 10 yards with a d-line man on your back and the ball in your hand weird from trying to hold on to it,0.0,nfl,t3_10irx3e,False,0.0,:Falcons: Falcons :Bills: Bills,2023-01-22T14:32:26Z,falcons,0.3612
19407,213453,213453,thisnamehastobeused,Yeah lmao how dumb of him to throw it to a check down,0.0,nfl,t3_10irx3e,False,0.0,:Falcons: Falcons :Bills: Bills,2023-01-22T14:29:51Z,falcons,0.4215
19408,213454,213454,thisnamehastobeused,They had a good defense before half the team broke or tore something,1.0,nfl,t3_10irx3e,False,0.0,:Falcons: Falcons :Bills: Bills,2023-01-22T14:08:13Z,falcons,0.1531
19409,213461,213461,thisnamehastobeused,Or we don’t want a guy to be playing with an injury. We’ve beat mahomes before my guy we’re not afraid we just don’t want a top guy in the nfl to fuck his shit up in the playoffs,1.0,nfl,t3_10i1il6,False,0.0,:Falcons: Falcons :Bills: Bills,2023-01-21T16:20:17Z,falcons,-0.403675
19410,213463,213463,thisnamehastobeused,I just want someone who can generate pressure at this point,11.0,falcons,t3_10hjkgv,False,0.0,:Juliostare:,2023-01-21T00:30:03Z,falcons,-0.2263
19535,215789,215789,ueeediot,Weak ass schedule because NFC south twice.,1.0,falcons,t3_10l814u,False,0.0,to tha house,2023-01-25T23:37:53Z,falcons,-0.8964
19536,215803,215803,ueeediot,Hearing Matt Ryan during the pregame say that Shannahan wants to run his offense through the run game....,3.0,falcons,t3_10j1kp7,False,0.0,to tha house,2023-01-23T09:19:30Z,falcons,-0.25
19537,215806,215806,ueeediot,"Part 2 the AFC

AFC SOUTH

The Texans or the Colts.

Both teams have good draft status, but the Texans are going to get a premeir QB.  The Colts are tied to an agkng QB they need to move and make moves to get a new one.  But neither team is hamstrung.

AFC EAST

The Pats are in probably the worst place with Miami a close second if Tua cant stay healthy, but at least they made the playoffs.

AFC NORTH

Everyone has direction here.

AFC WEST

easily the Broncos

Winner?

The Broncos are adrift.

Overall winner is still the Saints.  Being 60m over the cap is quite detrimental to having positive direction.  Second place is the Broncos.",1.0,nfl,t3_10ikjai,False,0.0,:Falcons: Falcons,2023-01-22T14:04:53Z,falcons,0.005051346153783
19538,215808,215808,ueeediot,"There has to be at least one per division, right?  

NFC SOUTH

The Saints are close to 60m over the cap, have no real options at QB, and almost all of the specialty positions are aging and have bad contracts.  It looks like Saints are going to be their pre Brees selves for a minute.

NFC EAST

3 playoff teams and the Commanders.  Are the Commanders adrift?  They have cap space and a good coaching staff.  If they can keep Dan Snyder locked away from the team l, they could be ok.

NFC NORTH

Agree with it, or not, all the teams in this division have direction.

NFC WEST

A question for 49ers fans.  Are you trading Purdy or Garrapalo this offseason?  (Never mind, I was reminded that Jimmy G is a FA)

Rams are in dissaray, but 1 year removed from a championship, so its understandable.  

Cardinals are in a really bad place, too.  But have the 3rd pick.  

NFC WINNER

Saints.  And its not even close.  60m over the cap leaves them with nothing.  At least the Cardinals and Commanders have cap space and young players.",1.0,nfl,t3_10ikjai,False,0.0,:Falcons: Falcons,2023-01-22T12:01:35Z,falcons,3.610119470683775e-07
19539,215817,215817,ueeediot,"You want fame?

Just. Win. Baby.",9.0,falcons,t3_10hoa2w,False,0.0,to tha house,2023-01-21T11:15:18Z,falcons,0.038548046875
19540,215819,215819,ueeediot,"Would be nice, bjt no politically correct way to do it.   Remember, Shanny had taken the 49ers job before the SB

Were you going to fire the coach that had, to that point, built up the team and had them on the precipice of a SB trophy and cut a deal with Shanny behind Quinn's back?

Hindsight being what it is.",44.0,falcons,t3_10ha3kb,False,0.0,to tha house,2023-01-20T18:19:05Z,falcons,-0.0545851851851851
19541,215820,215820,ueeediot,Its too bad the HC dkdnt bave the stones to control his staff.,0.0,falcons,t3_10ha3kb,False,0.0,to tha house,2023-01-20T18:16:27Z,falcons,-0.5423
