,Unnamed: 0.1,Unnamed: 0,author,body,score,subreddit,link_id,over_18,controversiality,author_flair_text,created_utc,flair,sentiment
385,7973,7973,Aggravating_Sink_717,"That too, but it’s a lot easier to fool keyboard warriors on the internet than FOs and coaches who’s job it is to mull over the film tbf",2.0,falcons,t3_10hoa2w,False,0.0,:Juliostare:,2023-01-21T10:50:42Z,falcons,-0.0387
386,7974,7974,Aggravating_Sink_717,"Yeah because then you have fantasy gurus telling everyone to take him in the 1st round, and demanding he get traded off the team if he doesn’t average 150 yds and 2 tds a game, like Kyle Pitts",6.0,falcons,t3_10hoa2w,False,0.0,:Juliostare:,2023-01-21T10:47:35Z,falcons,0.4215
1176,14358,14358,Bacun,It's one thing to just watch it at regular hours but to make an effort to stay up just to get ass blasted lol. I feel you.,2.0,nfl,t3_10k85td,False,0.0,:Falcons: Falcons,2023-01-24T18:45:14Z,falcons,-0.065425
1704,20908,20908,BoricuaBeef,"Happy he made it. While we meme, it must have been hard on him this past week.",1.0,nfl,t3_10iwzvh,False,0.0,:Falcons: Falcons ,2023-01-22T19:27:40Z,falcons,0.0916249999999999
1705,20909,20909,BoricuaBeef,Choosing between your mom and your sister is always hard.,1.0,nfl,t3_10iwzvh,False,0.0,:Falcons: Falcons ,2023-01-22T18:48:33Z,falcons,-0.1027
1978,24260,24260,Captain_Wide,"Yeah, I definitely want that for us too, I just had an idea of how Atlanta would decorate the field for a neutral site",7.0,falcons,t3_10jhy1r,False,0.0,Tanklantic City,2023-01-23T11:57:36Z,falcons,0.6369
2063,25354,25354,Chessh2036,"The only way that song should EVER be played is if you win a championship. Not wild card, divisional, etc. Play it early and it will curse you.",42.0,nfl,t3_10izx9h,False,0.0,:Falcons: Falcons,2023-01-22T23:48:26Z,falcons,-0.0598
3230,36624,36624,DRW0813,"Could you imagine a coaching staff with Kyle Shanahan, Dan Quinn, and Matt Lafleur? Maybe with a dominant QB and Hall of Fame WR?",1.0,nfl,t3_10jtp2k,False,0.0,:Falcons: Falcons,2023-01-23T20:03:44Z,falcons,0.2202
3231,36632,36632,DRW0813,And this game is boring now.,5.0,nfl,t3_10irx3e,False,0.0,:Falcons: Falcons,2023-01-22T16:16:26Z,falcons,-0.3182
3232,36633,36633,DRW0813,Bullshit call,1.0,nfl,t3_10irx3e,False,1.0,:Falcons: Falcons,2023-01-22T15:10:36Z,falcons,-0.5859
3233,36634,36634,DRW0813,Who would have thought that the Jags/Chiefs game would be the most competitive game of the week,4.0,nfl,t3_10irx3e,False,0.0,:Falcons: Falcons,2023-01-22T15:03:26Z,falcons,0.2484
3234,36636,36636,DRW0813,Come on Bills. I don't want another snoozefest,2.0,nfl,t3_10irx3e,False,0.0,:Falcons: Falcons,2023-01-22T14:30:04Z,falcons,-0.0286
3235,36637,36637,DRW0813,Seeing Singletary block a guy a foot taller than him,3.0,nfl,t3_10irx3e,False,0.0,:Falcons: Falcons,2023-01-22T14:13:57Z,falcons,-0.4404
3236,36640,36640,DRW0813,"When Ridder came in, we started throwing the ball more. But Pitts was already injured at that point. Next year he should be seeing a ton more action.",23.0,nfl,t3_10ikjai,False,0.0,:Falcons: Falcons,2023-01-22T10:14:12Z,falcons,-0.0611
3237,36641,36641,DRW0813,"We have a 5 offensive line, top 5 run game, young talent in Allgeier, London, and Pitts. And 70million in capspace. We can rebuild our defense this off-season and hope that Ridder is decent",54.0,nfl,t3_10ikjai,False,0.0,:Falcons: Falcons,2023-01-22T09:05:12Z,falcons,0.181237037037037
3238,36642,36642,DRW0813,"We have a top 5 offensive line, a top 5 run game, young talent in Allgeier, Pitts, and London. And 70million in capspace. We are fine. Rebuild our defense this off-season and hope Ridder is decent",48.0,nfl,t3_10ikjai,False,0.0,:Falcons: Falcons,2023-01-22T09:03:43Z,falcons,0.1456468749999999
3239,36643,36643,DRW0813,"Well, my evening is free now",4.0,nfl,t3_10i6kla,False,0.0,:Falcons: Falcons,2023-01-21T20:26:06Z,falcons,0.6597
3240,36647,36647,DRW0813,And that's the game. Jags didn't embarrass themselves,1.0,nfl,t3_10i1il6,False,0.0,:Falcons: Falcons,2023-01-21T18:14:08Z,falcons,0.11175
3241,36648,36648,DRW0813,Is Henne that bad?,3.0,nfl,t3_10i1il6,False,0.0,:Falcons: Falcons,2023-01-21T16:09:33Z,falcons,-0.5423
3242,36649,36649,DRW0813,Of course he wants to be out there. It's the coaching staff's job to say no,1.0,nfl,t3_10i1il6,False,0.0,:Falcons: Falcons,2023-01-21T16:06:31Z,falcons,-0.148
4054,46686,46686,EchoedTruth,"agreed fully

&#x200B;

we should run with Ridder next year and if he faceplants we pick high in the draft, win win",7.0,falcons,t3_10lghpm,False,0.0,Ridder Supremacist,2023-01-25T20:52:06Z,falcons,0.8658
4055,46687,46687,EchoedTruth,"because the ""anyone but Matt"" crowd that heavily intersects with the ""bring back Vick"" crowd got a taste of what life was like with a ""mobile rushing QB"" from Mariota... so now they're gunshy and want to roll with Ridder (which I'm fine with)",23.0,falcons,t3_10lghpm,False,0.0,Ridder Supremacist,2023-01-25T20:25:19Z,falcons,0.7096
4056,46689,46689,EchoedTruth,Fuck both of them for costing us a SB.,4.0,falcons,t3_10k7rw8,False,0.0,Ridder Supremacist,2023-01-24T10:42:57Z,falcons,-0.5423
4057,46690,46690,EchoedTruth,He'd make a fantastic QB Coach / OC / AHC one day.,1.0,falcons,t3_10isad2,False,0.0,Ridder Supremacist,2023-01-24T09:37:37Z,falcons,0.5574
4058,46692,46692,EchoedTruth,"That's my fucking QB

&#x200B;

Also he'll be great at whatever media job he lands, though I'd love to see him coaching",18.0,falcons,t3_10isad2,False,0.0,Ridder Supremacist,2023-01-22T15:42:07Z,falcons,0.8519
4059,46695,46695,EchoedTruth,"He can run our offense, and is a worthy backup to Ridder. Yes.",2.0,falcons,t3_10im96q,False,0.0,Ridder Supremacist,2023-01-22T11:30:48Z,falcons,0.257525
4060,46698,46698,EchoedTruth,Faking side effects to sew fear. I mean it’s not far removed from protecting pedos and putting bounties on peoples heads.,4.0,falcons,t3_10i9q8a,False,0.0,Ridder Supremacist,2023-01-22T10:48:32Z,falcons,-0.1796
4061,46699,46699,EchoedTruth,"I mean… everything? He was the only reason OSU was in the playoff game. But his game resembles Ridder and I don’t know enough about his pro style adaptability, maturity, etc. 

Ridder is a known quantity and I can’t say I saw Stroud do anything Ridder can’t. People seem to forget he almost beat us in the Sugar (?) Bowl 2 years ago.",1.0,falcons,t3_10hp1h6,False,0.0,Ridder Supremacist,2023-01-22T10:46:36Z,falcons,-0.0062861111111111
4062,46704,46704,EchoedTruth,Devils advocate but we did take two Bulldogs in the last draft IJS 🤷‍♂️🤷‍♂️,10.0,falcons,t3_10hp1h6,False,0.0,Ridder Supremacist,2023-01-21T16:06:30Z,falcons,0.2022
4063,46705,46705,EchoedTruth,"I mean I get that, but that’s any passing QB. You’re correct that Carr can’t make mid players look better. Matty made a 1k receiver out of Harry “tripped by invisible gnomes during a playoff winning TD reception” Douglas",7.0,falcons,t3_10hwrnk,False,0.0,Ridder Supremacist,2023-01-21T14:52:43Z,falcons,0.2245
4064,46712,46712,EchoedTruth,Carr isn’t even a Matt Ryan type. He’s like a great value Alex Smith.,30.0,falcons,t3_10hwrnk,False,0.0,Ridder Supremacist,2023-01-21T13:46:00Z,falcons,0.4201
4291,47425,47425,Eddy_Vinegar,"Rams might not have a choice, might have to be either Ramsey, Floyd or Donald and with Jalen having a down year might be the one they choose to move on from to save some cap space.  Might not take much to get him either but time will tell, honestly I just love the idea.  It’s like you instantly improve your defense (and help your pass rush) before the draft evens starts",5.0,falcons,t3_10l7rrw,False,0.0,:Juliostare:,2023-01-25T19:08:36Z,falcons,0.3919814814814815
4292,47426,47426,Eddy_Vinegar,Would fucking love that ! Get it done Terry !!,5.0,falcons,t3_10l7rrw,False,0.0,:Juliostare:,2023-01-25T19:06:15Z,falcons,0.0258851851851851
4293,47428,47428,Eddy_Vinegar,Probably relocate to St. Louis or some shit,1.0,falcons,t3_10koub5,False,0.0,:Juliostare:,2023-01-25T13:51:49Z,falcons,-0.5574
4294,47429,47429,Eddy_Vinegar,"Steve Wilks outta get a look to, he’d be a good DC and players seem to like him",2.0,falcons,t3_10l2cuz,False,0.0,:Juliostare:,2023-01-25T13:50:50Z,falcons,0.6597
4295,47431,47431,Eddy_Vinegar,"Thanks for the perspective!  Falcons fans have a love/hate relationship with Shanahan, and maybe a hate/hate relationship with DQ lol",0.0,falcons,t3_10k7rw8,False,0.0,:Juliostare:,2023-01-24T14:42:31Z,falcons,0.3339
4296,47432,47432,Eddy_Vinegar,😂,-4.0,falcons,t3_10k7rw8,False,0.0,:Juliostare:,2023-01-24T11:26:56Z,falcons,0.4404
4297,47433,47433,Eddy_Vinegar,"The real answer lol, his ass might be on the hot seat in Texas btw",-5.0,falcons,t3_10k7rw8,False,0.0,:Juliostare:,2023-01-24T10:07:42Z,falcons,-0.1779
4298,47434,47434,Eddy_Vinegar,It was either that or another Lamar/ lets sign (carr/jones/jacoby) as a backup post lol but you’re right Shanahan for sure even tho Quinn has done some good things while In Dallas,-1.0,falcons,t3_10k7rw8,False,1.0,:Juliostare:,2023-01-24T10:05:25Z,falcons,0.8271
4299,47436,47436,Eddy_Vinegar,"Burrow looks like THAT DUDE, but I think Philly wins it again",1.0,falcons,t3_10iwlzy,False,0.0,:Juliostare:,2023-01-23T13:30:06Z,falcons,0.7783
4764,58149,58149,HeatCreator,"I don’t care what any of you say, some people can’t be saved. It might hurt you, make you feel uncomfy, but it’s reality.",21.0,nfl,t3_10k8yle,False,0.0,:Falcons: Falcons,2023-01-24T20:33:54Z,falcons,0.0316
4765,58152,58152,HeatCreator,"Next time the Cowboys get a bracket that doesn’t have them facing SF, I actually think they might win it all at this point lmaoo",1.0,nfl,t3_10jfo19,False,0.0,:Falcons: Falcons,2023-01-23T20:03:01Z,falcons,0.5859
4766,58153,58153,HeatCreator,"It’s crazy, teams in this range are ACTUALLY in worse position. Mediocrity is such a trap that you can get caught in.",2.0,nfl,t3_10jgge1,False,0.0,:Falcons: Falcons,2023-01-23T12:44:24Z,falcons,-0.358525
4767,58154,58154,HeatCreator,"You know, after a certain event, and with Mahomes’ injury.. I really thought it was Buffalo’s year. This one is gonna keep them up at night if they can’t bring one home..",54.0,nfl,t3_10ix3wl,False,0.0,:Falcons: Falcons,2023-01-22T17:09:07Z,falcons,-0.0065888888888888
4846,60142,60142,HotJacket115,ceo of anti fun,1.0,nfl,t3_10iwzvh,False,0.0,:Falcons: Falcons,2023-01-22T20:34:40Z,falcons,0.25
4847,60144,60144,HotJacket115,fair,1.0,nfl,t3_10iwzvh,False,0.0,:Falcons: Falcons,2023-01-22T18:49:26Z,falcons,0.3182
4848,60154,60154,HotJacket115,"Falcons jags super bowl next year, you heard it here first",2.0,nfl,t3_10i1il6,False,0.0,:Falcons: Falcons,2023-01-21T15:57:15Z,falcons,0.5994
4849,60155,60155,HotJacket115,Soccer fan L,1.0,nfl,t3_10i1il6,False,0.0,:Falcons: Falcons,2023-01-21T15:56:41Z,falcons,0.7213
4899,60571,60571,IAmMeThatIsWhoIAm,"You can see him panic a little and reach for the ball with his other hand when he drops it.

We don't need to make excuses for Mahomes, he made a mistake, people are allowed to make mistakes.

But we shouldn't pretend that their mistakes are actually genius-level decisions.",27.0,nfl,t3_10ja8rc,False,0.0,:Falcons: Falcons :Eagles::bandwagon: Eagles Bandwagon,2023-01-23T10:44:49Z,falcons,-0.2101222222222222
4900,60573,60573,IAmMeThatIsWhoIAm,"2 minute warning? commercials. 

injury? commercials. 

Turnover? You’ll never guess, commercials.",20.0,nfl,t3_10iwzvh,False,0.0,:Falcons: Falcons :Eagles::bandwagon: Eagles Bandwagon,2023-01-22T18:55:42Z,falcons,-0.000332518861454
4901,60575,60575,IAmMeThatIsWhoIAm,I miss when Romo would just talk about what teams were about to do and somehow get everything right instead of just talking about how great Josh Allen is when he throws the ball too far out of bounds for his receivers to catch it.,23.0,nfl,t3_10irx3e,False,0.0,:Falcons: Falcons :Eagles::bandwagon: Eagles Bandwagon,2023-01-22T15:51:08Z,falcons,0.5423
4902,60576,60576,IAmMeThatIsWhoIAm,My favourite is the saints sub voting for themselves to win the Super Bowl as if that was ever going to happen lmao,50.0,nfl,t3_10ioup2,False,0.0,:Falcons: Falcons :Eagles::bandwagon: Eagles Bandwagon,2023-01-22T13:41:09Z,falcons,0.9118
4903,60577,60577,IAmMeThatIsWhoIAm,Down 21 and punting lol,11.0,nfl,t3_10i6kla,False,0.0,:Falcons: Falcons :Eagles::bandwagon: Eagles Bandwagon,2023-01-21T21:32:46Z,falcons,0.4215
4904,60578,60578,IAmMeThatIsWhoIAm,I’m pretty sure that’s incomplete but naturally we get commercials instead of replays lol,17.0,nfl,t3_10i1il6,False,0.0,:Falcons: Falcons :Eagles::bandwagon: Eagles Bandwagon,2023-01-21T18:14:53Z,falcons,0.7543
4905,60581,60581,IAmMeThatIsWhoIAm,Collinsworth moans Mahomes when he’s having sex with his wife.,11.0,nfl,t3_10i1il6,False,0.0,:Falcons: Falcons :Eagles::bandwagon: Eagles Bandwagon,2023-01-21T16:47:07Z,falcons,-0.1531
4906,60582,60582,IAmMeThatIsWhoIAm,"Really looks like a fumble. 

Only Collinsworth can pretend that accidentally dropping the ball is the big brain play and was 100% what Mahomes meant to do.",16.0,nfl,t3_10i1il6,False,0.0,:Falcons: Falcons :Eagles::bandwagon: Eagles Bandwagon,2023-01-21T16:09:33Z,falcons,0.052975
4908,60585,60585,IAmMeThatIsWhoIAm,"I mean, it's clearly bullshit that it wasn't a call, but the Saints got away with a facemask on the Rams' previous drive, so they can go fuck themselves.

And also they're the Saints, so they can go fuck themselves harder.",19.0,nfl,t3_10gy9lu,False,0.0,:Falcons: Falcons :Eagles::bandwagon: Eagles Bandwagon,2023-01-20T11:03:47Z,falcons,-0.4569
4935,64008,64008,Jayttic,"Yeah he is great in the slot, but he has such long arms, can’t help but wonder if he has improved on the outside. But he may be ass still on the outside. I just feel with those long arms he would be great in press man coverage",1.0,falcons,t3_10hxuvy,False,0.0,Matt “Get Fucking Set” Ryan,2023-01-21T17:07:09Z,falcons,0.1642259259259259
4936,64009,64009,Jayttic,"I would like to see Oliver have one more try on the outside, but yes, he should come back",4.0,falcons,t3_10hxuvy,False,0.0,Matt “Get Fucking Set” Ryan,2023-01-21T17:04:44Z,falcons,0.6486
5459,65641,65641,JeffMurdock_,"Argentina is not his club team. He moved to his second club team last year, but he would've been a good answer prior to that.

Among current soccer players, only Igor Akinfeev has been playing at his first and only club (CSKA Moscow) since before Rodgers was drafted by the Packers.",3.0,nfl,t3_10l248n,False,0.0,:Falcons: Falcons ,2023-01-25T12:43:43Z,falcons,0.1332888888888889
5703,67010,67010,JesusOfSurbaria,My little brother is 8 years old and could’ve chase a better play than this.,1.0,nfl,t3_10j1rc5,False,0.0,:Falcons: Falcons,2023-01-22T20:46:33Z,falcons,0.6486
6166,70281,70281,Joshuary81,"Im personally enjoying a list of loosing. Saints,Browns, GB, Brady, Cowboys. 49ers next, but with a lost lead. Im ok if they make the SB, i just need them to lose a lead. Everyone else is alright by me.",1.0,nfl,t3_10j5jm9,False,0.0,:Falcons: Falcons,2023-01-25T06:10:35Z,falcons,0.041450944
6554,72102,72102,KerryUSA,I’ve never heard this before and not sure why isn’t talked about more,253.0,nfl,t3_10k7x1v,False,0.0,:Falcons: Falcons ,2023-01-24T10:40:13Z,falcons,-0.2411
6556,72109,72109,KerryUSA,Lol y’all funny. I’m rooting for bengals and know that’s incomplete,-1.0,nfl,t3_10irx3e,False,1.0,:Falcons: Falcons ,2023-01-22T15:11:37Z,falcons,0.1727
6557,72110,72110,KerryUSA,That’s incomplete unfortunately,0.0,nfl,t3_10irx3e,False,1.0,:Falcons: Falcons ,2023-01-22T15:10:27Z,falcons,-0.34
6558,72114,72114,KerryUSA,My family are eagles fans except me and my sister who is a cowboys fan. I hope y’all face off so once and for all someone will have ultimate bragging rights for the foreseeable future.,0.0,nfl,t3_10i39ke,False,0.0,:Falcons: Falcons ,2023-01-21T16:38:40Z,falcons,0.29975
6559,72115,72115,KerryUSA,"Hate to see it, although I’ll say it makes y’all enduring again like no one likes when someone wins all the time but he’s literally curry of the nfl and one of the few players I’ll watch just to watch them play. 

If he goes on and Roger Clemons this shit then just another chapter in his hof story",2.0,nfl,t3_10i1il6,False,0.0,:Falcons: Falcons ,2023-01-21T16:07:50Z,falcons,-0.22675
6560,72119,72119,KerryUSA,Lol wait those exist? What can they even say other than his voice sounds weird,1.0,nfl,t3_10i1il6,False,0.0,:Falcons: Falcons ,2023-01-21T15:47:49Z,falcons,0.0164249999999999
6561,72123,72123,KerryUSA,Crazy to think how unregulated the sports world was back in the day. Same for fans lol my family is from Philly and the vet stories they have back when they spray painted concrete green and called it astroturf,3.0,nfl,t3_10hr21e,False,0.0,:Falcons: Falcons ,2023-01-21T14:09:08Z,falcons,0.1257499999999999
6913,77134,77134,LifeTableWithChairs,It would certainly sell better than a Philly vs. Saints game,1.0,nfl,t3_10l0kxo,False,0.0,:Falcons: Falcons,2023-01-25T20:32:08Z,falcons,0.6486
6914,77136,77136,LifeTableWithChairs,"There are a ton of regional missed opportunities for games in the NFL.  Due to how the conferences/divisions line up, some of the fiercest regional rivalries only play each other once every 4 years.  For example,

* Michigan v. Ohio is a HUGE opportunity for capitalizing on that rivalry, but Detroit only plays Cincinnati and Cleveland once every 4 years each.
* Dallas v. Houston would make a great annual 'Texas Bowl' between Texas' two largest hubs.
* Philly v. Pitt would be the best-selling game of both teams' seasons every year
* NYG v. NYJ for a Battle for New York
* LAR v. LAC for a Battle for LA
* Atlanta v. Tennessee is another missed opportunity

Instead of having each NFL team play some random team week 16 and 17, like a Philly v. LAC game, these games should be devoted to regional rivalries who otherwise wouldn't play each other that often.",5.0,nfl,t3_10l0kxo,False,0.0,:Falcons: Falcons,2023-01-25T20:10:55Z,falcons,0.079164864
6915,77139,77139,LifeTableWithChairs,"Since Tom's moving to another team, more like Bridgewater to TampaFlorida",1.0,nfl,t3_10koype,False,0.0,:Falcons: Falcons,2023-01-25T08:49:10Z,falcons,0.4201
6919,77165,77165,LifeTableWithChairs,"We praise Seattle for the Russell Wilson trade, but maybe we should also be scolding GB for not making the same trade when they had the chance.  It was clear when Adams left that it wouldn't be a SB-calibre team, and with Rodgers' cap hit they should've already gone into a rebuild.",1.0,nfl,t3_10k65n6,False,0.0,:Falcons: Falcons,2023-01-24T09:38:08Z,falcons,0.337375
6920,77166,77166,LifeTableWithChairs,"Any team that accepts that deal would be idiots to TAKE IT.  Realistically, maybe you could get a 20th-40th overall pick.",1.0,nfl,t3_10k65n6,False,0.0,:Falcons: Falcons,2023-01-24T09:36:28Z,falcons,0.07955
6921,77167,77167,LifeTableWithChairs,"Maybe if Rodgers were 33.  Dude's not Brady.  Why would any team in their right mind trade that much for a 39 year/old QB with a $31M cap hit next season?

If I'm GB, it's rebuild time.  You're not going to win another SB with Rodgers because he's too expensive for you to get him the WR weapons he needs.  Trade Rodgers away for the best deal in draft picks you can get and begin the rebuild and search for the next GB QB.",2.0,nfl,t3_10k65n6,False,0.0,:Falcons: Falcons,2023-01-24T09:35:17Z,falcons,0.0862611111111111
6922,77170,77170,LifeTableWithChairs,"If he's so great, why couldn't he hang onto one of the 32 starting QB jobs?",1.0,nfl,t3_10jg6bt,False,0.0,:Falcons: Falcons,2023-01-24T06:40:19Z,falcons,0.7384
6923,77176,77176,LifeTableWithChairs,Exactly.  I'm pretty bearish that Stetson Bennet would be that great at all in the NFL since he's also pretty old for a Draft candidate.,7.0,nfl,t3_10jg6bt,False,0.0,:Falcons: Falcons,2023-01-23T11:19:34Z,falcons,0.44425
6924,77180,77180,LifeTableWithChairs,"Specifically, him being 'consistently Top-25' means that he was never really in the Bottom-7 who were really at a threat of becoming a backup instead of being traded to another team who would make him their starter.

This year, by QBR, he was #24.  Last year he was #8.  In 2020 he was #4.",29.0,nfl,t3_10jg6bt,False,0.0,:Falcons: Falcons,2023-01-23T10:53:33Z,falcons,-0.002213671875
6925,77182,77182,LifeTableWithChairs,"The difference is development.  Some players keep getting better after college.  Others peaked.

2012 Draft Class QBs:

1. Andrew Luck: retired early to be with his family
2. RG3: plagued by injuries, great rookie year though
3. Ryan Tannehill: Consistently a Top-25 QB, always going to be a starter somewhere, but never *the* guy
4. Brandon Weeden: Didn't perform well in rookie season, went 0-5 next season, backup until retirement
5. Russell Wilson: 9 Pro Bowl Appearances.  4 OPoY awards.  From 2012-2021, he always had a great Passer Rating, with only 3 seasons under 100.
6. Nick Foles: Not great as a starting QB, but played very well during the Eagles' Playoff Run in 2017
7. Kirk Cousins: Consistently a Top-15 QB.  Passer Rating from 2015-Present was always between 92-107.  4 Pro Bowl appearances.",58.0,nfl,t3_10jg6bt,False,0.0,:Falcons: Falcons,2023-01-23T10:43:45Z,falcons,9.465833032344431e-06
6927,77188,77188,LifeTableWithChairs,This is the best system.  You make it so easy for QBs to succeed that your QB is easily replaceable.  Then you can pay <$10m/year to your QB and use that money to beef up other aspects of your team.,1.0,nfl,t3_10gk7a9,False,0.0,:Falcons: Falcons,2023-01-20T10:10:38Z,falcons,0.0841777777777777
7346,82332,82332,Motor_Rub_4848,"I tried to like college ball I really did. I started watching football in 2004 so ya know I had to become a Hokies fan with them having Marcus Vick and us drafting Mike. Fell out of it pretty quickly.

I found it hard to keep allegiances in college football. Every 4 years or so it's an entirely new group of guys out there. You like a certain player? Well too fucking bad the Saints just drafted him now he's on your most hated team. I had to pick between the NFL and college. So I went with the NFL where my favorite players may stay in Atlanta for their entire careers.

PS. I also always really hated the once your down your down rule. If I made a diving catch on a ball and no one touched me I sure as hell should be able to get up and take off.

PSS. I also hated the only one foot in bounds rule I like the extra finesse receivers have to have when playing near the sidelines.",6.0,falcons,t3_10lig53,False,0.0,It puts the lotion on the Rid...,2023-01-25T23:15:05Z,falcons,-0.0164137645513273
7347,82333,82333,Motor_Rub_4848,"This whole post is wrong. He's been praised for the speed  he picked up the playbook and style of offense.

He starts games slow but when he's in a rhythm he's making solid quick reads. His instinct and ability to make plays outside of the pocket aren't his main issues his biggest issue is his accuracy. 

He started slow in those first four games but you could see him calm down and make improvements and  improvisations as those games progressed. He's made the expected rookie mistakes. He also has the huddle very well under control as a rookie. I expected a lot more technical penalities and false starts when he took over but he manages that well.

I'd rather him hang in the pocket when he's supposed to and make reads. Mariota was too quick to give up on plays and would just take off and run. I much prefer to see the rookie develop the right way and not the Mariota way. Learning the correct read on RPOs isn't gonna remain an issue for him he's a smart kid.",1.0,falcons,t3_10l34vh,False,0.0,It puts the lotion on the Rid...,2023-01-25T23:02:20Z,falcons,0.0336380225531038
7348,82336,82336,Motor_Rub_4848,"This guy doesn't bird bro. We got off the Cordarrelle Train over at Allgeier Station. We keep him around now to return kicks, play WR, and cheer us all up since he's such a good dude but we don't need to ride him all day anymore.",1.0,nfl,t3_10koype,False,0.0,:Falcons: Falcons,2023-01-25T00:11:19Z,falcons,0.1953
7349,82337,82337,Motor_Rub_4848,"Give me this. I think regardless of Ridder we win our division. Saints are looking at cap space hell and are missing their first round pick. Tampa Bay is slightly better off for cap space but if Brady leaves they're going to fall into obscurity. Us and Carolina will be fighting for first just judging off of current roster strength, available cap space, and draft capital.",1.0,nfl,t3_10koype,False,0.0,:Falcons: Falcons,2023-01-25T00:05:01Z,falcons,0.03841504
7350,82338,82338,Motor_Rub_4848,"I don't know if y'all realize this but we played the majority of last year without a QB at all. We're all just hoping we set up around Ridder for another year this way even if he doesn't pan out we will have a strong team thats just a QB away. Trading for Lamar sets us back he's not winning enough games with the Ravens defense so he's certainly not winning with ours.

Regardless of what happens with our QB we had one of the best run games in the NFL last year. Add damn near 70 million in cap space to our defense and a WR2 and were first in the NFC South. Gonna be fun to watch the division flip next season with Atlanta and Carolina fighting over first place.",30.0,nfl,t3_10koype,False,0.0,:Falcons: Falcons,2023-01-24T23:56:32Z,falcons,0.015199916409465
7351,82339,82339,Motor_Rub_4848,I've said it before and I'll say it again. He left at a very emotional time for himself(he just got benched again by a coach who stated daily that he had faith in him and then he had a baby). I wouldn't mind him coming back purely as a backup QB and not under his current contract. He already knows the system we run. So if he was to take a pay cut and know he's only coming back as a backup/mentor to Ridder than I could rock with that.,3.0,falcons,t3_10kgfey,False,0.0,It puts the lotion on the Rid...,2023-01-24T18:21:43Z,falcons,-0.07132656
