,Unnamed: 0.1,Unnamed: 0,author,body,score,subreddit,link_id,over_18,controversiality,author_flair_text,created_utc,flair,sentiment
9051,99603,99603,RoninFerret67,"Falcons as the homer pick. Unless something unforeseen happens, this division is wide open and I see no reason why we can’t win it. Not gonna guarantee anything given our history but we definitely have a shot at it",11.0,nfl,t3_10koype,False,0.0,:Falcons: Falcons,2023-01-24T21:38:12Z,falcons,0.2059222222222222
9052,99604,99604,RoninFerret67,The Bills didn’t show up. Really disappointing game for them.,26.0,buffalobills,t3_10ix6nq,False,0.0,:ATL:,2023-01-22T17:08:41Z,falcons,-0.27065
9053,99605,99605,RoninFerret67,True. No disrespect to Marty either. He was a helluva coach,1.0,buffalobills,t3_10isf7a,False,0.0,:ATL:,2023-01-22T17:02:09Z,falcons,0.0517444444444444
9054,99608,99608,RoninFerret67,“Cocktail Coordinator” has to be the least funny football-based commercial ever,2.0,nfl,t3_10i6kla,False,0.0,:Falcons: Falcons,2023-01-21T21:11:43Z,falcons,-0.3412
9655,106638,106638,SlopingGiraffe,Blocking and contested catching baby,53.0,nfl,t3_10koype,False,0.0,:Falcons: Falcons,2023-01-25T01:50:09Z,falcons,-0.3818
9656,106639,106639,SlopingGiraffe,He's also not exactly in great shape for a 64 year old,24.0,nfl,t3_10kkn4n,False,0.0,:Falcons: Falcons,2023-01-24T18:11:15Z,falcons,-0.5096
9657,106643,106643,SlopingGiraffe,"Bills fans are gonna hate it but it's a terrible thing to play revolving doors with OCs because their first year wasn't perfect

For what it's worth, a lot of falcons fans wanted Kyle Shanahan fired after 2015. Disregarding the whole Super Bowl thing he obviously went on to have a top 10 offense all time and an mvp qb in 2016",82.0,nfl,t3_10kfm0v,False,0.0,:Falcons: Falcons,2023-01-24T14:44:04Z,falcons,-0.013975
9658,106644,106644,SlopingGiraffe,But the fact that the NY Post remains incredibly popular despite everyone full well knowing it's bullshit proves you wrong...,31.0,nfl,t3_10ju3g5,False,0.0,:Falcons: Falcons,2023-01-24T05:45:25Z,falcons,-0.8142
9659,106645,106645,SlopingGiraffe,"Every Anthony Richardson draft take is like

Elite prospect

Potential to become top 10 QB in 7-8 years if drafted by dome team with the greatest qb coach in the nfl and prime Jerry Rice and Randy Moss at receiver",11.0,nfl,t3_10jnf1e,False,0.0,:Falcons: Falcons,2023-01-23T15:16:30Z,falcons,0.8658
9660,106647,106647,SlopingGiraffe,Sean Payton would be better. Could hide the shit out of Daks weaknesses,2.0,nfl,t3_10jlc79,False,0.0,:Falcons: Falcons,2023-01-23T13:40:30Z,falcons,0.21125
9661,106648,106648,SlopingGiraffe,"What kind of hard work can you do to treat  a high ankle sprain?

Really went hardcore at staying off that thing",161.0,nfl,t3_10jlbae,False,0.0,:Falcons: Falcons,2023-01-23T13:39:14Z,falcons,0.0629
9662,106649,106649,SlopingGiraffe,Well to be fair there's a constant 10-15db of noise pollution at all times from all the strip joints in Jacksonville,4.0,nfl,t3_10jgsor,False,0.0,:Falcons: Falcons,2023-01-23T10:42:38Z,falcons,0.5267
9663,106650,106650,SlopingGiraffe,"I think he's talking about using the Hamlin thing and creating a narrative, not penalties",20.0,nfl,t3_10izx9h,False,0.0,:Falcons: Falcons,2023-01-22T19:16:12Z,falcons,0.296
9664,106653,106653,SlopingGiraffe,the bills kinda suck at playing in the snow for a team that plays in the snow a lot,111.0,nfl,t3_10it9wq,False,0.0,:Falcons: Falcons,2023-01-22T14:27:41Z,falcons,-0.0183
9665,106654,106654,SlopingGiraffe,People are going to overreact when you set a ridiculously high standard like he has,6.0,nfl,t3_10is974,False,0.0,:Falcons: Falcons,2023-01-22T13:45:37Z,falcons,-0.2263
9666,106655,106655,SlopingGiraffe,Oh for sure but that's also a league wide issue. Leading the league in penalties is enough to take you out of the top 5 unless you're an ungodly blocker imo,27.0,nfl,t3_10il2cg,False,0.0,:Falcons: Falcons,2023-01-22T09:26:50Z,falcons,0.142525
9667,106656,106656,SlopingGiraffe,14 penalties this season though... That'd be a lot for a top 5 LG,34.0,nfl,t3_10il2cg,False,0.0,:Falcons: Falcons,2023-01-22T08:59:18Z,falcons,0.2023
9668,106662,106662,SlopingGiraffe,Fucking camera guy was on it lol,90.0,nfl,t3_10i82vp,False,0.0,:Falcons: Falcons,2023-01-21T19:59:13Z,falcons,0.4215
9669,106663,106663,SlopingGiraffe,Well get a better chip then,9.0,nfl,t3_10i7imj,False,0.0,:Falcons: Falcons,2023-01-21T19:39:53Z,falcons,0.6124
9670,106664,106664,SlopingGiraffe,"There's literally cameras all over the stadium

Make a grid around the field

Use lasers

Use the chip that's already in the ball

Pretty much anything but a chain",37.0,nfl,t3_10i7imj,False,0.0,:Falcons: Falcons,2023-01-21T19:34:49Z,falcons,0.2732
9671,106665,106665,SlopingGiraffe,He made about 67k for this game after the fine is paid,665.0,nfl,t3_10i1qmm,False,0.0,:Falcons: Falcons,2023-01-21T15:12:57Z,falcons,0.2023
9672,106666,106666,SlopingGiraffe,"Kirk Cousins took less money to get it all guaranteed, that's not setting the bar for a top Free Agent QB",4.0,nfl,t3_10hzwhh,False,0.0,:Falcons: Falcons,2023-01-21T14:15:23Z,falcons,0.6249
9673,106667,106667,SlopingGiraffe,"Because a tweet is a really bad way to convey information lol

If he had no issue telling it to a reporter on record why did he play coy in any press conference about the topic?",-2.0,nfl,t3_10hzwhh,False,0.0,:Falcons: Falcons,2023-01-21T14:13:58Z,falcons,-0.2006
9674,106669,106669,SlopingGiraffe,"I know this is an easy gotcha but two things

OP was clearly referencing the tweet from earlier this week that was by an anonymous source

Also Lamar doesn't say the money he turned down was guaranteed in that tweet, just that he turned down between 160-180 mill",1.0,nfl,t3_10hzwhh,False,0.0,:Falcons: Falcons,2023-01-21T14:04:33Z,falcons,0.6705
9675,106670,106670,SlopingGiraffe,I mean yeah but you also absolutely should not ignore that contract. That's the bar now,7.0,nfl,t3_10hzwhh,False,1.0,:Falcons: Falcons,2023-01-21T13:58:10Z,falcons,0.14155
9676,106672,106672,SlopingGiraffe,That's pretty far below the 230 million guaranteed the sex offender got,95.0,nfl,t3_10hzwhh,False,0.0,:Falcons: Falcons,2023-01-21T13:53:16Z,falcons,0.1779
9677,106673,106673,SlopingGiraffe,"The falcons could do pretty much anything this offseason, but moving up would be genuinely surprising to me. Too many needs",10.0,nfl,t3_10hueib,False,0.0,:Falcons: Falcons,2023-01-21T10:37:43Z,falcons,0.097975
9678,106674,106674,SlopingGiraffe,Saints and bucs don't have the cap space to take on a contract like his unless they make some serious magic,7.0,nfl,t3_10hueib,False,0.0,:Falcons: Falcons,2023-01-21T10:20:23Z,falcons,0.296
9679,106675,106675,SlopingGiraffe,"Schefter also says the entire NFC South is in the market for a qb, Brady is looking for a new team with a winning history and Derek Carr is likely to be traded",444.0,nfl,t3_10hueib,False,0.0,:Falcons: Falcons,2023-01-21T10:00:07Z,falcons,-0.2577
9680,106677,106677,SlopingGiraffe,ok but you understand that you indirectly drove attention to the tweet causing more people to see the conspiracy line,5.0,nfl,t3_10h7fv7,False,0.0,:Falcons: Falcons,2023-01-20T14:56:05Z,falcons,-0.6124
9681,106678,106678,SlopingGiraffe,No you just linked to the tweet to give it attention lol,15.0,nfl,t3_10h7fv7,False,0.0,:Falcons: Falcons,2023-01-20T14:40:06Z,falcons,0.1531
9682,106679,106679,SlopingGiraffe,"> If we see any funny stuff from refs this weekend, we’ll know why",19.0,nfl,t3_10h7fv7,False,0.0,:Falcons: Falcons,2023-01-20T14:38:10Z,falcons,0.4404
9683,106680,106680,SlopingGiraffe,Well yeah... He died for a bit,4.0,nfl,t3_10h1stx,False,0.0,:Falcons: Falcons,2023-01-20T10:54:21Z,falcons,-0.15105
10374,110386,110386,Suqqa_Madiq,Yes that's literally what OP said lol.,9.0,falcons,t3_10iwrie,False,0.0,I miss Pat :(,2023-01-23T12:06:59Z,falcons,0.6705
10375,110390,110390,Suqqa_Madiq,"Hope you were here for April Fools last year, put a ton of work into that lol.",13.0,falcons,t3_10gvup5,False,0.0,I miss Pat :(,2023-01-20T10:53:01Z,falcons,0.3612
10866,112818,112818,Sweatsock_Pimp,Publicly? Probably not. But I’d venture to guess that no one likes being shown up like that on national TV.,1.0,nfl,t3_10ixaxu,False,1.0,:Falcons: Falcons,2023-01-22T21:18:26Z,falcons,-0.1236999999999999
11466,117300,117300,TheBeardedSingleMalt,"> Why is everyone obsessed with ""names""??

Because they're not good with evaluating skill",7.0,falcons,t3_10l8q3l,False,0.0,GET FUCKING SET,2023-01-25T19:36:31Z,falcons,-0.2366
11467,117320,117320,TheBeardedSingleMalt,I hate to say it but this season was his *last shot*.  He probably could have had 1 more season somewhere...if he wasn't taking snaps behind 5 road cones and was getting lit up left and right.,222.0,falcons,t3_10kf9qk,False,0.0,GET FUCKING SET,2023-01-24T15:03:19Z,falcons,-0.082275
11468,117322,117322,TheBeardedSingleMalt,2 or 3 of our Mariota wins were against depleted defenses.,20.0,falcons,t3_10k9ig8,False,0.0,GET FUCKING SET,2023-01-24T12:29:07Z,falcons,0.6597
11469,117323,117323,TheBeardedSingleMalt,"That's the same argument I made over the years.

DQ *inherited* one of the best defenses in the NFL, with some of the top players at their positions, under a defensive-minded probably future HoF head coach.

The same argument could be made for Eric Bieniemy.  Not knocking his ability, but he's the OC under a future HoF Offensive Minded HC with an offensive absolutely stacked with talent.",20.0,falcons,t3_10k7rw8,False,0.0,GET FUCKING SET,2023-01-24T10:50:30Z,falcons,-0.176453125
11470,117326,117326,TheBeardedSingleMalt,I guess we're gonna need another star WR because Ridder is gonna need to be putting up 40 pts a game since our non-existence defense is gonna be giving up 40 pts.,5.0,falcons,t3_10jt4xw,False,0.0,GET FUCKING SET,2023-01-24T08:46:40Z,falcons,0.4404
11471,117327,117327,TheBeardedSingleMalt,"Fuck the cowboys.

1. DQ

2. My sister is a fan

3. Because even when they suck you can't not hear aMeRiCa'S tEaM on TV",3.0,falcons,t3_10j32x7,False,0.0,GET FUCKING SET,2023-01-24T08:25:47Z,falcons,-0.075525536
11472,117328,117328,TheBeardedSingleMalt,"yes, bobby petrino",5.0,falcons,t3_10jww7y,False,0.0,GET FUCKING SET,2023-01-24T08:24:17Z,falcons,0.4019
11473,117335,117335,TheBeardedSingleMalt,"Or Rodgers and Wilson a couple years back.  Hell I'll never forget the Falcons game against the Packers where Falcons were up by like 2 TDs with a couple minutes left and Collinsworth^less was still pimpin Rodgers up like ""All he needs to do here is score, recover and onside an onside kick, march down the field and...""

It's fucking unbearable because even during Ryan's MVP season it pained him to say something positive",12.0,nfl,t3_10ja8rc,False,0.0,:Falcons: Falcons,2023-01-23T11:18:10Z,falcons,0.1091
11474,117336,117336,TheBeardedSingleMalt,I'd actually enjoy another SB trip for them just to blow their lead.,20.0,falcons,t3_10j4oji,False,0.0,GET FUCKING SET,2023-01-23T07:37:00Z,falcons,0.4939
11475,117341,117341,TheBeardedSingleMalt,"Quinn overstayed his welcome by 2 years.  Maybe he really is a savant DC when that's his *only* responsibility.  He got exposed bad though, scapegoated coaches to save his own skin, and definitely let his ego get in the way",5.0,falcons,t3_10ha3kb,False,0.0,GET FUCKING SET,2023-01-20T20:46:40Z,falcons,0.1080592592592592
11476,117347,117347,TheBeardedSingleMalt,After that good season in Cleveland he decided to chase the money and just flopped.,0.0,nfl,t3_10gxz1o,False,0.0,:Falcons: Falcons,2023-01-20T08:56:03Z,falcons,0.4404
11477,117348,117348,TheBeardedSingleMalt,"Shhh, it doesn't feed their narrative that *they* are the only ones who got snubbed.",12.0,nfl,t3_10gy9lu,False,1.0,:Falcons: Falcons,2023-01-20T08:52:05Z,falcons,-0.4588
11766,119661,119661,TheRayATL,My man Matty Ice looking handsome,5.0,nfl,t3_10irx3e,False,0.0,:Falcons: Falcons,2023-01-22T13:45:54Z,falcons,0.4939
11767,119664,119664,TheRayATL,Its hilarious listening to car sales people doing mental gymnastics to justify/explain their BS markups. $3k markup on a CRV sport touring hybrid. Almost $5k markup on a CRV Ex-L. My brother found a used 2020 tundra sold by a chevy dealer and they were doing a $6k markup. $6k markup on a USED car made by another company. Wild,5.0,nfl,t3_10gz2lj,False,0.0,:Falcons: Falcons,2023-01-20T14:00:40Z,falcons,0.000128608
13505,128403,128403,Wayne93,Well he likes them younger girls to suck more. If you haven’t seen his interview before it kinda makes you wonder about the guy.,7.0,nfl,t3_10ja8rc,False,0.0,:Falcons: Falcons,2023-01-23T09:38:34Z,falcons,0.0625
13641,131354,131354,Zucchini_Official,"Gotta love cherry picking the data. If you expand to 14 games, it’s 4 games.",1.0,nfl,t3_10jm3k9,False,0.0,:Falcons: Falcons,2023-01-24T10:30:57Z,falcons,0.3183249999999999
13749,131797,131797,airodell13,ruined my life two weeks later,3.0,falcons,t3_10ip9bt,False,0.0,:Juliostare:,2023-01-22T15:31:22Z,falcons,-0.4767
13750,131799,131799,airodell13,gg,-4.0,jaguars,t3_10i43u7,False,0.0,:ATL:,2023-01-21T18:00:07Z,falcons,0.296
13751,131801,131801,airodell13,GET A STOP MAN,1.0,jaguars,t3_10i43u7,False,0.0,:ATL:,2023-01-21T17:56:32Z,falcons,-0.296
13752,131802,131802,airodell13,CMON DEFENSE GET A TURNOVER,3.0,jaguars,t3_10i43u7,False,0.0,:ATL:,2023-01-21T17:50:13Z,falcons,0.128
13753,131804,131804,airodell13,trash defense,0.0,jaguars,t3_10i1ubl,False,1.0,:ATL:,2023-01-21T16:32:14Z,falcons,0.128
13754,131805,131805,airodell13,defense is so ass,1.0,jaguars,t3_10i1ubl,False,0.0,:ATL:,2023-01-21T16:31:55Z,falcons,-0.5095
13755,131806,131806,airodell13,this defense is so hard to watch,0.0,jaguars,t3_10i1ubl,False,0.0,:ATL:,2023-01-21T16:30:24Z,falcons,-0.0498
13756,131807,131807,airodell13,can y’all force one incompletion? 😂,8.0,jaguars,t3_10i1ubl,False,0.0,:ATL:,2023-01-21T16:25:58Z,falcons,0.2202
13851,137669,137669,benderzone,Code switching? I'd call it well socialized.,17.0,falcons,t3_10jn9be,False,0.0,Jerry Glanville's love child,2023-01-23T18:17:10Z,falcons,0.1366
13931,139626,139626,big_krill,What the fuck lol,1.0,nfl,t3_10j1r2d,False,0.0,:Falcons: Falcons,2023-01-22T20:45:22Z,falcons,-0.1779
13932,139627,139627,big_krill,"Nahhh I’m always gonna blame the WR that is openly antagonizing his all pro QB, but Diggs is about the definition of a diva WR so I’m not surprised",17.0,nfl,t3_10iwu0d,False,0.0,:Falcons: Falcons,2023-01-22T16:56:08Z,falcons,-0.6646
13933,139628,139628,big_krill,"Not saying we are destined for greatness…. But we have a lot of cap space and have young pieces already

The direction is continue to build the defense and search for that coveted franchise QB, a position a lot of teams are in",10.0,nfl,t3_10ikjai,False,0.0,:Falcons: Falcons,2023-01-22T09:49:03Z,falcons,0.09505
14339,148706,148706,d1dOnly,"The first QB to say ""I'll take less money if it means getting a better team around me"" is going to win a lot of games.",11.0,nfl,t3_10ku5eu,False,0.0,:Falcons: Falcons,2023-01-25T07:31:50Z,falcons,0.7717
15448,158622,158622,externalkyuubi9,"If 49ers win this game, this is where the game changed",442.0,nfl,t3_10j0krx,False,0.0,:Falcons: Falcons,2023-01-22T19:50:18Z,falcons,0.5859
15910,164276,164276,hogaway,"This is one of the few cases I'd say 'fuck it' and give everything for Maxx. We can't get a good EDGE to save our lives, let alone a young top 5 one. I'd actually have hope if we got a guy like him",2.0,falcons,t3_10l34vh,False,0.0,AJ Terrelldactyl,2023-01-25T11:31:22Z,falcons,0.2166592592592592
15911,164279,164279,hogaway,"If only the Cowboys were as good at football as they were at marketing. Even the best NBA player of our era is a bandwagon 90s Cowboys fan (although I think Lebron switched to the Browns after the Watson trade).

I actually like a lot of Cowboys players, both now and historically. But the thought of Skip Bayless shouting 'how bout them cowboys' after a super bowl win makes my heart wince.",3.0,falcons,t3_10j1kp7,False,0.0,AJ Terrelldactyl,2023-01-22T22:34:50Z,falcons,0.2762375
15912,164280,164280,hogaway,At least its for a good cause. Cowboys are to the entire NFL what the Saints are to us,105.0,falcons,t3_10j1kp7,False,0.0,AJ Terrelldactyl,2023-01-22T20:53:34Z,falcons,0.1101
15913,164282,164282,hogaway,"I kinda feel people are voting for Flores due to his HC career, and not realising Vic Fangio is one of the best defensive minds in the league. Since 2011, 8/11 of his defences have been top 10 in points, 5 of which were top 3. Flores has never even been a DC (I'd be happy if we got him, but Fangio is a different level)",43.0,falcons,t3_10hzfoc,False,0.0,AJ Terrelldactyl,2023-01-21T15:48:20Z,falcons,0.1714999999999999
16277,167015,167015,iguanoman_,Mr. Bereft Comedy,1.0,nfl,t3_10kzh47,False,0.0,:Falcons: Falcons :Lions: Lions,2023-01-25T13:25:53Z,falcons,0.3612
16278,167017,167017,iguanoman_,"You misunderstand - the Falcons are the only team in any sport that I cheer for from the state of Georgia. 

[This ](https://i.imgur.com/fSp9FZN.jpg)is basically me looking at every other Falcons fan in existence who roots for the rest of the teams in the state",2.0,nfl,t3_10j25vl,False,0.0,:Falcons: Falcons :Lions: Lions,2023-01-22T22:28:57Z,falcons,0.209675
16279,167018,167018,iguanoman_,I wish I liked the other Georgia teams... Just me and the Falcons suffering for eternity,1.0,nfl,t3_10j25vl,False,0.0,:Falcons: Falcons :Lions: Lions,2023-01-22T22:21:11Z,falcons,0.34
16280,167020,167020,iguanoman_,Classic Falcons fans making everything about us smh,8.0,nfl,t3_10iy7d5,False,0.0,:Falcons: Falcons :Lions: Lions,2023-01-22T19:34:27Z,falcons,-0.3182
16281,167022,167022,iguanoman_,It's a bad game to be an underdog sympathizer,3.0,nfl,t3_10i1il6,False,0.0,:Falcons: Falcons :Lions: Lions,2023-01-21T18:22:18Z,falcons,-0.5423
16282,167024,167024,iguanoman_,Nice bandwagon fallacy you got there,22.0,nfl,t3_10h7l8n,False,0.0,:Falcons: Falcons :Lions: Lions,2023-01-20T19:41:17Z,falcons,0.4215
16654,167948,167948,ilnemo,"Mercedes Benz being located between two MARTA stations is about as good as it gets for Atlanta public transportation. 

I truly don't understand why everyone thinks Atlanta could magically find the space or money to recreate century old train infrastructure akin to NYC, Boston, or Chicago.

Edit: For anyone thinking of bringing up busses, [bitch you ride the MARTA bus](https://www.youtube.com/watch?v=vQTuYo6HmiQ)",3.0,nfl,t3_10kxg4n,False,0.0,:Falcons: Falcons,2023-01-25T14:03:11Z,falcons,-0.1300555555555555
16770,171107,171107,javi_af,The only sports team your city has wins one 10 years ago and you think you can talk 😑 get another sports team oh wait .. no one wants to go to gloomy ass Seattle,4.0,nfl,t3_10jgge1,False,0.0,:Falcons: Falcons,2023-01-23T11:26:47Z,falcons,-0.3818
16848,173258,173258,jharden10,Stop with the Kaput and the Jesus commercials.,4.0,nfl,t3_10iwzvh,False,0.0,:Falcons: Falcons,2023-01-22T19:34:55Z,falcons,-0.296
16849,173261,173261,jharden10,"Tbh: Until the Eagles SB run, I thought their jerseys were blue, not green. I was confused when Eagles fans kept on kept calling their unis green for some reason.",1.0,nfl,t3_10i6kla,False,0.0,:Falcons: Falcons,2023-01-21T20:31:59Z,falcons,-0.1591
17216,183355,183355,lertyvahrye,"But it wouldn't be a renaissance? He was amazing for the Cardinals he was just suspended the first part of the year. You're acting like he fell off and hasn't played well when that's just not the case. Hopkins is a top 10 receiver, maybe top 5. Teams with lots of cap space or a Superbowl window would love him",3.0,nfl,t3_10kimm8,False,0.0,:Falcons: Falcons,2023-01-24T20:26:35Z,falcons,0.14221664
17217,183357,183357,lertyvahrye,"my dad, who i had never seen cry before in my life, looked at me, wiped away a tear and said: ""a little part of me just died, son""",2.0,nfl,t3_10k7x1v,False,0.0,:Falcons: Falcons,2023-01-24T17:03:10Z,falcons,-0.2607
17218,183360,183360,lertyvahrye,"It honestly might be. Eagles D line is even more terrifying than Dallas', it's up to the Eagles to coach as well as Dan Quinn did vs the 49ers to create pressure",7.0,nfl,t3_10k8m9z,False,1.0,:Falcons: Falcons,2023-01-24T11:15:38Z,falcons,-0.1141
17221,183363,183363,lertyvahrye,"Belicheck loves Hopkins, I'm sure it could happen",3.0,nfl,t3_10k4nx5,False,0.0,:Falcons: Falcons,2023-01-24T07:56:18Z,falcons,0.7184
17222,183368,183368,lertyvahrye,Except the chargers game lol,24.0,nfl,t3_10jg6bt,False,0.0,:Falcons: Falcons,2023-01-23T10:43:01Z,falcons,0.4215
17223,183370,183370,lertyvahrye,I'm starting to think they might not win,12.0,nfl,t3_10iwgwf,False,0.0,:Falcons: Falcons,2023-01-22T16:38:41Z,falcons,-0.4717
17224,183371,183371,lertyvahrye,"Tbf, Eagles schedule wasn't exactly hard either",37.0,nfl,t3_10iam0t,False,0.0,:Falcons: Falcons,2023-01-22T00:07:10Z,falcons,0.0762
17225,183372,183372,lertyvahrye,"He's suspended indefinitely, so technically he could be denied playing next year. That would be stupid, but it's possible",0.0,nfl,t3_10i69qe,False,1.0,:Falcons: Falcons,2023-01-21T19:05:14Z,falcons,-0.3072249999999999
17228,183377,183377,lertyvahrye,"He posted that on Instagram after the fact, because of the dumb reactions to his tweet. You can't edit a tweet, and it might be misconstrued again if he deleted it, so he posted on Instagram to clarify.",0.0,nfl,t3_10hb3zq,False,0.0,:Falcons: Falcons,2023-01-20T19:14:47Z,falcons,-0.12765
17229,183378,183378,lertyvahrye,"No, he's staying, it means he's excited for the next season",3.0,nfl,t3_10hb3zq,False,0.0,:Falcons: Falcons,2023-01-20T17:27:07Z,falcons,0.34
17230,183379,183379,lertyvahrye,"He posted this on Instagram, except with more pictures of him on the Dolphins and the caption is ""excited for next season."" Stop overanalyzing, he's staying in Miami and he'll play next year",123.0,nfl,t3_10hb3zq,False,0.0,:Falcons: Falcons,2023-01-20T17:07:18Z,falcons,0.1108
17231,183380,183380,lertyvahrye,Lmao no he's gonna be a dolphin next year 100%,12.0,nfl,t3_10hb3zq,False,0.0,:Falcons: Falcons,2023-01-20T17:05:17Z,falcons,0.4019
17287,184538,184538,masterfroo24,"Same as SB51. #1 O (Falcons) vs #1 D (Patriots).

Weird, that one got cancelled too.",54.0,nfl,t3_10kjio6,False,0.0,:Falcons: Falcons,2023-01-25T03:48:44Z,falcons,-0.1339666666666666
17288,184549,184549,masterfroo24,Us Falcons. We have 60m in cap space and Ridder showed great potential as QB.,4.0,nfl,t3_10hrco9,False,0.0,:Falcons: Falcons,2023-01-21T09:35:00Z,falcons,0.31245
17436,186890,186890,memccarty,Shanahan has no clock management skills. I know.,7.0,nfl,t3_10iwzvh,False,0.0,:Falcons: Falcons,2023-01-22T18:57:51Z,falcons,-0.074
17472,188442,188442,mnightshamalama2,"The ""let's get the fuck out of here already"" play",8.0,nfl,t3_10j1rvp,False,0.0,:Falcons: Falcons,2023-01-22T20:47:54Z,falcons,-0.2732
17473,188443,188443,mnightshamalama2,He literally hugged him lol,1.0,nfl,t3_10irx3e,False,0.0,:Falcons: Falcons,2023-01-22T16:25:58Z,falcons,0.6705
17474,188446,188446,mnightshamalama2,Seems like Romo heard the criticism last week. He's been pretty flat with his voice and tame on his love for Allen,0.0,nfl,t3_10irx3e,False,0.0,:Falcons: Falcons,2023-01-22T15:46:52Z,falcons,0.380625
17744,191422,191422,murph32xx,That read out so well in my head. Especially the lines for Dennis. Just the right amount of sass..,6.0,nfl,t3_10jnnhj,False,0.0,:Falcons: Falcons,2023-01-24T01:31:39Z,falcons,0.0151888888888888
17773,192495,192495,nanowerx,"This is wild:

>In his first four games, 23-year-old Matty Ice threw for 669 yards, two touchdowns, and two interceptions on 55-of-105 passing (52.4%). He fumbled the ball once while posting a 6.4 Y/A and 5.9 AY/A, coming out of those contests with a .500 record.

>In comparison, 23-year-old Ridder threw for 708 yards and two touchdowns with no interceptions on 73-of-115 passing (63.5%), good for a 6.2 A/Y and 6.5 AY/Y. Ridder did fumble it three times but also finished with an even 2-2 record. Even if it is marginal, the stats say Ridder’s first four games were more productive.",51.0,falcons,t3_10k6s5n,False,0.0,The Riddessance Cometh,2023-01-24T08:32:35Z,falcons,0.0014232
18316,194264,194264,nerdyintentions,Saints sub predicted they would win the division and the SB 😅,1.0,nfl,t3_10ioup2,False,0.0,:Falcons: Falcons,2023-01-22T14:28:02Z,falcons,0.743
18792,207367,207367,ssovm,"I never went to a football school for undergrad and my family isn’t into football. Simply put it’s hard for me to appreciate it. The fandom and traditions are cool. But the weird competition is what turns me off. UGA for example is hard pressed to make the national championship without a perfect record. This means they’re just beating up on bad college teams. The lack of parity is a turn off. 

And besides the playoffs, I don’t really enjoy seeing the imperfections you sometimes see in college. Each play seems less interesting and I quickly look to do something else. 

One day I’d like to go to a Georgia game though. 

Just my two cents.",0.0,falcons,t3_10lig53,False,1.0,Rise up,2023-01-25T23:34:19Z,falcons,0.0034605558076085
18793,207374,207374,ssovm,This tells me that AI isn’t ready to take over the world.,0.0,falcons,t3_10kavkz,False,0.0,Rise up,2023-01-24T16:03:12Z,falcons,0.3612
