,Unnamed: 0.1,Unnamed: 0,author,body,score,subreddit,link_id,over_18,controversiality,author_flair_text,created_utc,flair,sentiment
13543,75617,75617,JSchnizzle,True but I was talking more about what tua performance looked worse,7.0,nfl,t3_zp5pyd,False,0.0,:Chargers: Chargers,2022-12-18T13:26:41Z,chargers,-0.5023
13544,75618,75618,JSchnizzle,Tbh I feel like it was more egregious to have 25 yards for almost 3 quarters against one of the worst defenses in the nfl.,83.0,nfl,t3_zp5pyd,False,0.0,:Chargers: Chargers,2022-12-18T13:12:38Z,chargers,-0.2263
13545,75632,75632,JSchnizzle,"Somehow the chargers defense was the one that managed to torpedo their offense lol, just an insane aberration going from having like almost 300 air yards vs the niners with some missed throws from tua and having a solid run game against the bills and losing on a last second field goal to having 145 yards through the air and a run game that got stuffed multiple times against the chargers. How the fuck does that even happen.",19.0,nfl,t3_zoq95f,False,0.0,:Chargers: Chargers,2022-12-17T23:00:20Z,chargers,-0.33945
13546,75635,75635,JSchnizzle,Yeah well they didn't so what's your point?,9.0,nfl,t3_zohvc1,False,0.0,:Chargers: Chargers,2022-12-17T16:29:31Z,chargers,0.5106
14114,79899,79899,JustIn_HerButt,Hopefully Chargers learned their lesson with the Jags. No more underestimating the AFC South. Even the Texans gave them a run.,1.0,nfl,t3_zquon9,False,0.0,:Chargers: Chargers,2022-12-20T22:28:55Z,chargers,-0.0180037037037037
14116,79905,79905,JustIn_HerButt,"I bet they're a bit more sore than you are on Monday, but I get what you're saying",1.0,nfl,t3_znrfc1,False,0.0,:Chargers: Chargers,2022-12-17T11:53:35Z,chargers,-0.2255
14117,79906,79906,JustIn_HerButt,Sometimes that stuff takes time. Being comfortable on the field and behind a microphone are two different skill sets.,2.0,nfl,t3_znrfc1,False,0.0,:Chargers: Chargers,2022-12-17T11:51:50Z,chargers,0.2553
14118,79907,79907,JustIn_HerButt,It was an good omen for that game,8.0,nfl,t3_zo93e0,False,0.0,:Chargers: Chargers,2022-12-17T11:38:20Z,chargers,0.4404
14670,85185,85185,LakeShowBoltUp,Couldn’t have been any worse than Jakobi’s lateral,1.0,nfl,t3_zrcw4i,False,0.0,:Chargers: Chargers,2022-12-21T00:55:10Z,chargers,-0.4767
14671,85188,85188,LakeShowBoltUp,Rivers was a great stop gap for your Colts.  I hope they bounce back quickly next year.  Certainly feel like they are just a QB and coach away.  Saturday isn’t the guy.  Didn’t mean to offend you so greatly with that statement.  I hope you have a good night.,5.0,nfl,t3_zqx3no,False,0.0,:Chargers: Chargers,2022-12-20T22:19:22Z,chargers,0.1090230195473251
14672,85189,85189,LakeShowBoltUp,I agree on the bleak future and keep getting downvoted for suggesting they blow it all up for draft picks to rebuild sooner.,14.0,nfl,t3_zr78xi,False,0.0,:Chargers: Chargers,2022-12-20T20:42:03Z,chargers,0.3612
14673,85190,85190,LakeShowBoltUp,"Each team can only play 5 primetime games a season.  Monday will mark our 5th and final.  Originally SNF against the Rams would be 5, but because our game against the Dolphins got bumped into Sunday Night, we are no longer eligible to play another regular season prime time game after Monday night.",1.0,chargers,t3_zr7tcu,False,0.0,Felipe Rios,2022-12-20T20:41:01Z,chargers,0.0383259259259259
14674,85191,85191,LakeShowBoltUp,"Lol, I thought we had another case of the guy last night calling Foles as the Colts new starting Quarterback, with his insider info.",30.0,nfl,t3_zr78xi,False,0.0,:Chargers: Chargers,2022-12-20T20:24:00Z,chargers,0.4215
14675,85192,85192,LakeShowBoltUp,Would you want Bill coaching your team?,1.0,nfl,t3_zr78xi,False,0.0,:Chargers: Chargers,2022-12-20T20:21:35Z,chargers,0.0772
14676,85193,85193,LakeShowBoltUp,I’ve heard Payton.  Would be floored at McVay or Shanahan wanting out of their good organizations.  Where did you hear that?,93.0,nfl,t3_zr78xi,False,0.0,:Chargers: Chargers,2022-12-20T20:20:37Z,chargers,0.0489333333333333
14677,85195,85195,LakeShowBoltUp,"Rams ain’t the first team yet.  Chargers are having real home games this season while Rams have been consistently outnumbered when playing division opponents like the Cardinals.

Speaking of choking, maybe your Vikings or Cardinals could teach my Chargers how to win a Superbowl",3.0,nfl,t3_zr41i3,False,0.0,:Chargers: Chargers,2022-12-20T18:32:48Z,chargers,0.1241666666666666
14678,85196,85196,LakeShowBoltUp,"And an insult to boot!  

I hope your Bengals have a good close to the season.",8.0,nfl,t3_zr46mz,False,0.0,:Chargers: Chargers,2022-12-20T18:29:31Z,chargers,0.2111
14679,85197,85197,LakeShowBoltUp,"I was so bummed to not get Sewell a couple of drafts ago, but Slater was a god send.  Hoping Sewell has a long and successful career.",45.0,nfl,t3_zr3t2r,False,0.0,:Chargers: Chargers,2022-12-20T18:22:14Z,chargers,0.480475
14680,85198,85198,LakeShowBoltUp,"The Chargers are the Nets.  Frequently sexy, some of the best players, never champions.",7.0,nfl,t3_zr41i3,False,0.0,:Chargers: Chargers,2022-12-20T18:19:36Z,chargers,0.3513
14681,85199,85199,LakeShowBoltUp,No Chargers v 9ers :(,49.0,nfl,t3_zr46mz,False,0.0,:Chargers: Chargers,2022-12-20T18:15:45Z,chargers,-0.6249
14682,85200,85200,LakeShowBoltUp,I just fell down a rabbit hole thanks to this.  Found another video where X-Factor says Red Extreme banged his wife. Might explain the water bottle throw.,27.0,nfl,t3_zr0hqq,False,0.0,:Chargers: Chargers,2022-12-20T18:10:01Z,chargers,0.0163111111111111
14683,85201,85201,LakeShowBoltUp,"Here is hoping the Chargers will run more press coverage next season, like we did the last two games against the Fish and Titans, as that is what made Jackson Mr Int.  We tried to force him into a man and zone guy, which was obviously not his strong suit.",16.0,chargers,t3_zqs4fr,False,0.0,Felipe Rios,2022-12-20T13:57:02Z,chargers,-0.039
14684,85202,85202,LakeShowBoltUp,"Chargers: Finally getting healthy, beat two playoff teams, 2nd in passing yards 

Chargers Doomers: We have no hope against this losing team and need to fire our offensive coordinator",18.0,nfl,t3_zqx3no,False,0.0,:Chargers: Chargers,2022-12-20T13:29:50Z,chargers,-0.7721
14685,85205,85205,LakeShowBoltUp,"Been loud and proud in my Staley love all year.  That being said, still needs to win a playoff game to keep the job, with Sean Payton actively campaigning for the position all season.  Here is hoping Staley delivers and is our coach for a long time.",11.0,chargers,t3_zqx2n5,False,0.0,Felipe Rios,2022-12-20T13:24:21Z,chargers,0.2511703703703703
14686,85207,85207,LakeShowBoltUp,"Be thankful he can down on his back and not his groin, throwing arm or throat.",17.0,nfl,t3_zqw74c,False,0.0,:Chargers: Chargers,2022-12-20T12:50:12Z,chargers,0.5719
14687,85208,85208,LakeShowBoltUp,"I’d like us to successfully run the ball more too.  We are 3rd lowest in rushing attempts for a reason though.  We are 2nd lowest in YPC.  This is why Lombardi gave up running on first down early in the year, and it all stems from poor O-Line play.",1.0,chargers,t3_zqfe6g,False,0.0,Felipe Rios,2022-12-20T12:45:48Z,chargers,-0.0716046875
14688,85209,85209,LakeShowBoltUp,"Continuity is so important in offensive line play, but a talent like Slater demands a shake up.  I'd move Slater back to LT and push Salyer inside to Feiler's spot, then put Feiler on the bench.

Our offensive line is atrocious this season.  Herbert has been hit the 2nd most of any QB.  If we could make these changes, it would open up our run game and give Herbert more time, enabling Lombardi to run a less Vanilla offense without putting Herbert's broken rib cartilage at even greater risk.",9.0,chargers,t3_zquzfj,False,0.0,Felipe Rios,2022-12-20T12:09:52Z,chargers,0.057203584
14689,85210,85210,LakeShowBoltUp,"Tell me your proposed solution.  I doubt it will be executable with the offensive line, but I’d love to hear it.",1.0,chargers,t3_zqfe6g,False,0.0,Felipe Rios,2022-12-20T11:59:31Z,chargers,0.3889
14690,85211,85211,LakeShowBoltUp,For an injured offensive line and a big drop off in Feiler?  That is not the offensive coordinator.  That is football.,1.0,chargers,t3_zqfe6g,False,0.0,Felipe Rios,2022-12-20T11:51:32Z,chargers,0.0108407407407407
14691,85212,85212,LakeShowBoltUp,"hint hint: look at the below average offensive line that couldn't keep our QBs ribs in tact either

Hebert has been hit the 2nd most of any QB this season, with an average length of pocket time before releasing or being hurried, and people are acting like the Chargers should have a better run game or be throwing deep balls more frequently.  Those ideas don't mesh.",1.0,chargers,t3_zqfe6g,False,0.0,Felipe Rios,2022-12-20T11:37:10Z,chargers,0.085
14692,85213,85213,LakeShowBoltUp,"OBJ, Von Miller, important role players like their starting LT and many more",1.0,nfl,t3_zqf4n9,False,0.0,:Chargers: Chargers,2022-12-20T10:37:30Z,chargers,0.5106
14693,85216,85216,LakeShowBoltUp,"Absolutely, I saw Popper tweeting how loud it got when Tennessee missed their FG.  It has come a long way since the days at Stubhub, when us Chargers fans were outnumbered 20 to 1.",1.0,chargers,t3_zq4qq0,False,0.0,Felipe Rios,2022-12-20T10:22:48Z,chargers,-0.074
14694,85217,85217,LakeShowBoltUp,"I've sat everywhere at SoFi except the 500s, not a bad seat in the house.  I have season seats in section 110, 2nd to the last row.  Typically once you get down to the 100s, the farther back the better.  If you get too close, it can be hard to follow the action and all you can see are the helmets and upper bodies.  Still, sitting that close is awesome and something I think everyone should do once.  Those field level suites though, absolute garbage.  You cannot see over the players standing in front of you.",5.0,chargers,t3_zqq76q,False,0.0,Felipe Rios,2022-12-20T10:20:52Z,chargers,0.0018058187611332
14695,85218,85218,LakeShowBoltUp,"Everyone knows r/the_darnold is the GEQBUS.  He is a football god and a great family man.  Don’t believe the FAKE NEWS LIBRHULE media reports Sam got Mono while on the Jets.  Sam is happily married, and would never cheat on his wife with these fat gorgeous mono-riddled sluts!!!!!",1.0,nfl,t3_zqfwdx,False,0.0,:Chargers: Chargers,2022-12-20T00:02:05Z,chargers,0.02925296
14696,85219,85219,LakeShowBoltUp,Bill Belichek Retirement Special,-1.0,nfl,t3_zqfb71,False,1.0,:Chargers: Chargers,2022-12-19T23:57:39Z,chargers,0.4019
14697,85220,85220,LakeShowBoltUp,"A lot of very smart people - doctors, lawyers, even lady doctors - are predicting Sam Darnold will win his 3rd Superbowl MVP this season.",3.0,nfl,t3_zqfwdx,False,0.0,:Chargers: Chargers,2022-12-19T23:55:26Z,chargers,0.7778
14698,85222,85222,LakeShowBoltUp,"People hated on Lombardi for his short pass game, like it was a bad decision, and not something done to protect Herbert who had broken rib cartilage and was playing behind an injured offensive line. Now that Herbert is healthier again we’ve been executing mid to deep routes the last three weeks, but no one has acknowledged it.  The Lombardi bad talk just got a little quieter as we started this win streak.",-10.0,chargers,t3_zqfe6g,False,0.0,Felipe Rios,2022-12-19T23:35:54Z,chargers,0.0035
14699,85223,85223,LakeShowBoltUp,I got downvoted to hell after the Super Bowl for suggesting the Rams would have a season like this and would be better off blowing it up for draft picks than running it back without a significant number of last year’s stars.,-7.0,nfl,t3_zqf4n9,False,0.0,:Chargers: Chargers,2022-12-19T23:12:41Z,chargers,0.4378
14700,85224,85224,LakeShowBoltUp,I thought that Jerry Tillery unsportsmanlike conduct last week was clutch.  That was the best thing he ever did for the Chargers.  Much more so than the 3.5 season of below average play he gave the Bolts.,6.0,nfl,t3_zqexiy,False,0.0,:Chargers: Chargers,2022-12-19T23:06:56Z,chargers,0.1841
14701,85225,85225,LakeShowBoltUp,Do you want to try to get healthy and run it back next season or blow it all up for draft picks and rebuild?,28.0,nfl,t3_zqe10y,False,0.0,:Chargers: Chargers,2022-12-19T23:03:39Z,chargers,0.4588
14702,85226,85226,LakeShowBoltUp,"Nothing is more serene than a Philadelphia sports fan, they are the embodiment of zen.",69.0,nfl,t3_zqcgnk,False,0.0,:Chargers: Chargers,2022-12-19T21:47:25Z,chargers,-0.1019
14703,85227,85227,LakeShowBoltUp,"Joe Lombardi: Has offense with 2nd most passing yards in NFL

Stuck in Past Lions Fans and doomer Chargers fans: This is literally unwatchable",1.0,nfl,t3_zqcyzb,False,0.0,:Chargers: Chargers,2022-12-19T21:44:49Z,chargers,-0.4588
14704,85228,85228,LakeShowBoltUp,Chargers are going to get flexed out of SNF against the Rams because of this Rams loss,4.0,nfl,t3_zqcyzb,False,0.0,:Chargers: Chargers,2022-12-19T21:40:57Z,chargers,-0.3182
14705,85230,85230,LakeShowBoltUp,"It was unfortunate being ranked as the most injured team all season, but thankfully the Bolts are still alive and getting healthy at just the right time.  

Here is hoping Mac Jones is walking again today after that brutal stiff arm yesterday.",10.0,nfl,t3_zq4f0w,False,0.0,:Chargers: Chargers,2022-12-19T20:26:16Z,chargers,0.04715
14706,85231,85231,LakeShowBoltUp,I stopped at Colts beat the Chargers next Monday,11.0,nfl,t3_zq8kwj,False,0.0,:Chargers: Chargers,2022-12-19T20:20:14Z,chargers,-0.2263
14707,85232,85232,LakeShowBoltUp,I feel like games are won and lost at the line of scrimmage,29.0,chargers,t3_zq6nt8,False,0.0,Felipe Rios,2022-12-19T20:16:18Z,chargers,0.5994
14708,85233,85233,LakeShowBoltUp,I’d like a refund on this man’s jersey,69.0,chargers,t3_zq35u0,False,0.0,Felipe Rios,2022-12-19T14:57:19Z,chargers,0.3612
14709,85234,85234,LakeShowBoltUp,"I’d rather have a guy who leads by example, playing through broke ribs, than a guy who leads through the camera and loses the locker room like Jamies Finger Licking Good Winston",86.0,nfl,t3_znrfc1,False,0.0,:Chargers: Chargers,2022-12-16T17:53:40Z,chargers,0.2732
14710,85235,85235,LakeShowBoltUp,"He went to the team facility and lifted weights on Monday, according to his interview with Jim Rome.  No shopping.",60.0,nfl,t3_znrfc1,False,0.0,:Chargers: Chargers,2022-12-16T17:17:56Z,chargers,-0.148
14711,85237,85237,LakeShowBoltUp,Because it is much better than making their star QB’s family look like Bozos.,18.0,nfl,t3_znrfc1,False,0.0,:Chargers: Chargers,2022-12-16T17:05:22Z,chargers,0.6597
14712,85239,85239,LakeShowBoltUp,"Eckler too, booing the no lifting right behind Herbo",130.0,nfl,t3_znrfc1,False,0.0,:Chargers: Chargers,2022-12-16T16:56:05Z,chargers,-0.296
14713,85240,85240,LakeShowBoltUp,This is the greatest video ever and shows why Herbert will be the GOAT,165.0,chargers,t3_znqq0h,False,0.0,Felipe Rios,2022-12-16T16:21:26Z,chargers,0.6369
14714,85241,85241,LakeShowBoltUp,"Derwin James also doubtful, according to Pop

[https://twitter.com/danielrpopper/status/1603862738278617088](https://twitter.com/danielrpopper/status/1603862738278617088)",27.0,chargers,t3_znpshj,False,0.0,Felipe Rios,2022-12-16T15:37:58Z,chargers,-0.34
14715,85242,85242,LakeShowBoltUp,"Goofy is cool, personally though I like Goff better",2.0,nfl,t3_znon1u,False,0.0,:Chargers: Chargers,2022-12-16T15:12:47Z,chargers,0.7717
14716,85243,85243,LakeShowBoltUp,"I am predicting an injury free game for the Chargers, but u/JSchnizzle isn't so lucky and is pummeled in the parking lot for spreading that bad juju",24.0,chargers,t3_znnwg3,False,0.0,Felipe Rios,2022-12-16T14:46:35Z,chargers,-0.8557
14717,85244,85244,LakeShowBoltUp,"Absolutely, this is a good game to be cautious.  Titans have the 4th worst passing offense this season.  Take away Henry's one big run, and he is averaging 3 YPC over their losing streak.  Let the guys who played last week shine and bring DJ back when he is 100.",6.0,chargers,t3_znnt8u,False,0.0,Felipe Rios,2022-12-16T14:34:39Z,chargers,0.051190625
14718,85245,85245,LakeShowBoltUp,"Take away his one big run, and Henry is averaging 3 YPC over the Titans losing streak.  I don't know if he is physically capable of carrying the team this week.",8.0,chargers,t3_znnwg3,False,0.0,Felipe Rios,2022-12-16T14:32:16Z,chargers,0.09545
14719,85247,85247,LakeShowBoltUp,"Absolutely, that guy has still not addressed his deleted tweet, like every other reporter does when they get something wrong.",19.0,chargers,t3_znnt8u,False,0.0,Felipe Rios,2022-12-16T14:18:05Z,chargers,-0.1531
14720,85248,85248,LakeShowBoltUp,"The NFL's 2nd worst pass D is injured and going against Hebro.  I'm expecting to see a lot of throws on Sunday, much like this past week vs the Miami Fish.",19.0,chargers,t3_znnwg3,False,0.0,Felipe Rios,2022-12-16T14:17:04Z,chargers,-0.0139749999999999
14721,85249,85249,LakeShowBoltUp,"Based on how Staley has handled practice partcipation v playing in the past, I expect DJ to be out Sunday",26.0,chargers,t3_znnt8u,False,0.0,Felipe Rios,2022-12-16T14:12:19Z,chargers,0.2023
14722,85250,85250,LakeShowBoltUp,"He’s been lame the last few weeks.  Take out his one big run, and he is averaging 3 yards per carry over this losing streak.",1.0,chargers,t3_zmyh0u,False,0.0,Felipe Rios,2022-12-16T13:44:06Z,chargers,-0.334775
14994,85752,85752,LedZepp42,Damn that's rough. Regardless of who it is. My best friend's mom died of liver failure due to cirrhosis which isn't necessarily the same but it wasn't a quick and easy way to go out. Best wishes to him and his family.,27.0,chargers,t3_zr0v9h,False,0.0,13,2022-12-20T16:22:47Z,chargers,0.202180078125
14995,85754,85754,LedZepp42,LETS FUCKING GO HERB TO MIKE IS THAT SHIT I DO LIKE,3.0,chargers,t3_zp7gk8,False,0.0,13,2022-12-18T18:24:12Z,chargers,-0.2732
14996,85755,85755,LedZepp42,"for real...we would have like zero time on the clock if we didnt use them, we get a chance here",2.0,chargers,t3_zp7gk8,False,0.0,13,2022-12-18T18:21:24Z,chargers,0.5423
14997,85756,85756,LedZepp42,we need bosa and derwin back so bad,3.0,chargers,t3_zp7gk8,False,0.0,13,2022-12-18T18:16:24Z,chargers,-0.6696
14998,85757,85757,LedZepp42,"fucking great play by tranq, we really needed that",5.0,chargers,t3_zp7gk8,False,0.0,13,2022-12-18T18:05:38Z,chargers,0.7947
14999,85758,85758,LedZepp42,"i want callahan back next year, dudes been so good",15.0,chargers,t3_zp7gk8,False,0.0,13,2022-12-18T17:52:49Z,chargers,0.6176
15000,85762,85762,LedZepp42,/r/chargers and having a meltdown the second the opposing team does anything remotely positive. name a more dynamic duo,2.0,chargers,t3_zp7gk8,False,0.0,13,2022-12-18T16:30:35Z,chargers,0.3589
15001,85763,85763,LedZepp42,our line is weak sauce man,2.0,chargers,t3_zp7gk8,False,0.0,13,2022-12-18T16:16:44Z,chargers,-0.4404
15002,85764,85764,LedZepp42,"herbert threw that ball a little behind him, couldve been a better pass",0.0,chargers,t3_zp7gk8,False,0.0,13,2022-12-18T16:10:43Z,chargers,0.4404
15003,85765,85765,LedZepp42,i mean if you can give herbert an extra .5 seconds worth of time in the pocket we might be able to run deeper routes. dude has no time,2.0,chargers,t3_zp7gk8,False,0.0,13,2022-12-18T16:09:21Z,chargers,-0.0914249999999999
15004,85766,85766,LedZepp42,sofi turf really be dropping fools with no mercy jesus man,10.0,chargers,t3_zp7gk8,False,0.0,13,2022-12-18T16:01:42Z,chargers,-0.6781
15005,85767,85767,LedZepp42,"true, at least we didnt pay english 51 milly like we did butler",1.0,chargers,t3_zp7gk8,False,0.0,13,2022-12-18T15:57:58Z,chargers,0.6804
15006,85768,85768,LedZepp42,"no, p47 thunderbolts are dope ass planes and were instrumental in world war 2",1.0,chargers,t3_zp7gk8,False,0.0,13,2022-12-18T15:53:54Z,chargers,-0.8126
15007,85769,85769,LedZepp42,lol remember donald butler?,3.0,chargers,t3_zp7gk8,False,0.0,13,2022-12-18T15:51:04Z,chargers,0.4215
15008,85770,85770,LedZepp42,"tannehill wrapped up by mack first drive, carted to locker room, defense looking solid. offense is rolling, completed a 4th and 2 on the like 15-20, kelley ran in for a score after ek went to the tent to get his arm looked at",4.0,chargers,t3_zp7gk8,False,0.0,13,2022-12-18T15:48:41Z,chargers,0.1323
15009,85771,85771,LedZepp42,"good shit kelley, well deserved. dudes running hard for us",3.0,chargers,t3_zp7gk8,False,0.0,13,2022-12-18T15:41:58Z,chargers,-0.025675
15010,85772,85772,LedZepp42,"this drive is looking solid, herb is on his game today",6.0,chargers,t3_zp7gk8,False,0.0,13,2022-12-18T15:38:14Z,chargers,0.1531
15011,85773,85773,LedZepp42,"hope tannehill isnt hurt too bad, fuck injuries",9.0,chargers,t3_zp7gk8,False,0.0,13,2022-12-18T15:37:34Z,chargers,0.6157
15012,85774,85774,LedZepp42,herbert on roll outs is a thing of beauty,4.0,chargers,t3_zp7gk8,False,0.0,13,2022-12-18T15:34:52Z,chargers,0.5859
15013,85775,85775,LedZepp42,Yep that's pretty much it. I wanted to spoon my eyeballs out when I saw it for the first time lol,1.0,chargers,t3_zoru4z,False,0.0,13,2022-12-18T11:44:36Z,chargers,0.375675
16288,88833,88833,LoganRoyKent,This is awesome. Thanks for that. Well done,22.0,chargers,t3_zsdjzb,False,0.0,⚡️,2022-12-21T23:52:43Z,chargers,0.1631444444444444
16289,88839,88839,LoganRoyKent,Big NFL strikes again,17.0,chargers,t3_zs7ky3,False,0.0,⚡️,2022-12-21T20:51:38Z,chargers,-0.3612
16290,88842,88842,LoganRoyKent,Can’t really hurt to find out. Even if it is just depth.,36.0,chargers,t3_zrrhk2,False,0.0,⚡️,2022-12-21T09:54:18Z,chargers,-0.142725
16291,88844,88844,LoganRoyKent,"I think the deadline for that was yesterday

Edit: yep. Only the last game of the year can be flexed on just 6 days’ notice. Otherwise it’s 12, which is two Tuesdays prior. [“Fans and ticket holders must be aware that NFL games in flex weeks are subject to change 12 days in advance (6 days in Week 18) and should plan accordingly.”](https://www.nfl.com/schedules/flexible-scheduling-procedures)",5.0,chargers,t3_zrhjdw,False,0.0,⚡️,2022-12-21T09:25:17Z,chargers,0.00115625
16292,88847,88847,LoganRoyKent,What absolute drunken cunts both of them were.,12.0,chargers,t3_zrb97k,False,0.0,⚡️,2022-12-20T23:26:11Z,chargers,-0.5994
16293,88849,88849,LoganRoyKent,Well surely he’s less depressed now! Why don’t you reach out to him and bring him back?,3.0,chargers,t3_zr3dzy,False,0.0,⚡️,2022-12-20T21:40:12Z,chargers,0.091625
16294,88850,88850,LoganRoyKent,"Dicker is awesome, but let’s not get a-dickhead of ourselves.",6.0,chargers,t3_zr5vva,False,0.0,⚡️,2022-12-20T21:38:41Z,chargers,0.3716
16295,88851,88851,LoganRoyKent,I doubt kicking it versus going for it in that scenario would lower the score. It dropped because the kick got backed up from the penalty.,3.0,chargers,t3_zr16er,False,0.0,⚡️,2022-12-20T16:47:55Z,chargers,-0.363175
16504,89202,89202,MIBPJ,Teams in the mix tend to play better and are less likely to put their players on ice.,1.0,nfl,t3_zqy4bm,False,0.0,:Chargers: Chargers,2022-12-21T22:06:39Z,chargers,0.6486
16505,89203,89203,MIBPJ,Thought that might be the case but then you'd have to go all the way back to Week 7 for Fields to have 4 TDs under pressure wand when you do that Allen still comes up as first with 7 and Fields remains tied for 5th.,8.0,nfl,t3_zrzpy6,False,0.0,:Chargers: Chargers,2022-12-21T14:34:28Z,chargers,-0.4215
16506,89204,89204,MIBPJ,PFF seems like a pretty solid company whose social media and outward-facing analysts do them a disservice by making them look bad.,8.0,nfl,t3_zrzpy6,False,0.0,:Chargers: Chargers,2022-12-21T14:30:52Z,chargers,0.4215
16507,89205,89205,MIBPJ,"I have no clue how this tweet arrived at that because PFF shows Allen with a 11 TDs under pressure and a whole bunch of guys with 4 or more. Fields is tied for 5th.

[source](https://imgur.com/a/9dfVqAm)",59.0,nfl,t3_zrzpy6,False,0.0,:Chargers: Chargers,2022-12-21T14:28:17Z,chargers,-0.0195074074074074
16508,89207,89207,MIBPJ,"I don't think the author would disagree with that either but that's not the point. I haven't watched the Pat McAfee video so I'm not sure what aspect of the article Rodgers is calling out but the article does include direct quotes from former and current Packers players, including Jordan Love, backing up the idea that Rodgers uses older hand signals that can confuse young players:

>“Aaron will bring signals back from five or six years ago that he used to have in an older offense,” Love said. “He’ll just signal it out there and you just kind of got to know, and if you don’t know, you just have to figure it out. It’s hard for the young guys.”

>Love is now in his third year in Green Bay, but he still hasn’t seen the full vault. “The older guys will remember them and know them, but we will see it on the side and we’ll be like, what’s that signal?” Love said. “I don’t know. Go ask him and figure it out.”",4.0,nfl,t3_zr0img,False,0.0,:Chargers: Chargers,2022-12-20T16:30:12Z,chargers,0.0027047803211247
16509,89208,89208,MIBPJ,"Matters less when they have the presumptive MVP. But for reals, that's a flaw and realistically every team has some flaw (Hurts is injured, Purdy might get exposed, Bengals O-line sucks, Cowboys haven't looked like the Cowboys the past few weeks, etc) but it feels like the top 6 are solidified and you have to overlook much bigger or multiple issues for everyone else.",3.0,nfl,t3_zqy4bm,False,0.0,:Chargers: Chargers,2022-12-20T15:58:04Z,chargers,-0.42505
16510,89209,89209,MIBPJ,"Damn thats a huge bummer considering age. Does anyone know what is going on?

He also played for the Chargers at one point. In fact the last play the *San Diego* Chargers ever ran was a hand off to Hillman.",302.0,nfl,t3_zqzr51,False,0.0,:Chargers: Chargers,2022-12-20T15:24:01Z,chargers,0.1896578125
