,Unnamed: 0.1,Unnamed: 0,author,body,score,subreddit,link_id,over_18,controversiality,author_flair_text,created_utc,flair,sentiment
527,1313,1313,-tripleu,"Starting to like Staley again and won’t be mad if this team passes on Payton. However, I still want Lombardi gone no matter what.",15.0,chargers,t3_zqiihb,False,0.0,"Sell the team, Spanos. ",2022-12-20T10:32:54Z,chargers,-0.015325
528,1316,1316,-tripleu,Bracing for Malik Wills to play like he’s in Madden against us. We always struggle against mobile backup QBs.,5.0,chargers,t3_zp7gk8,False,0.0,"Sell the team, Spanos. ",2022-12-18T15:33:01Z,chargers,-0.0092499999999999
529,1317,1317,-tripleu,Missed these former color rush uniforms.,3.0,chargers,t3_zp7gk8,False,0.0,"Sell the team, Spanos. ",2022-12-18T15:27:05Z,chargers,-0.296
530,1318,1318,-tripleu,I can immediately tell you’re from the UK because you spelled favorite “favourite” lol. Welcome!,4.0,chargers,t3_zp7gk8,False,0.0,"Sell the team, Spanos. ",2022-12-18T15:23:34Z,chargers,0.429725
531,1320,1320,-tripleu,Chiefs win the OT coin toss again…why do they always get so lucky???,11.0,chargers,t3_zp7gk8,False,0.0,"Sell the team, Spanos. ",2022-12-18T15:05:49Z,chargers,0.20765
532,1321,1321,-tripleu,"So since the Dolphins lost and if the Jets lose, is it okay if the Patriots win? Because I don’t want to root for the Raiders. Fuck them.",1.0,chargers,t3_zp7gk8,False,0.0,"Sell the team, Spanos. ",2022-12-18T14:50:52Z,chargers,-0.1656
533,1322,1322,-tripleu,"Chiefs struggling right now, tie game. But I still fully expect the Chiefs to win because they’re the new Patriots and will get any calls their way.",2.0,chargers,t3_zp7gk8,False,0.0,"Sell the team, Spanos. ",2022-12-18T14:46:11Z,chargers,0.262175
1049,2425,2425,2agrant,Nothing about the offense on Sunday was hot,6.0,chargers,t3_zs0ie2,False,0.0,10,2022-12-21T15:30:36Z,chargers,0.1877
1050,2427,2427,2agrant,This is even funnier now,1.0,nfl,t3_znji2n,False,0.0,:Chargers: Chargers :Bills: Bills,2022-12-19T18:06:07Z,chargers,0.4019
1051,2429,2429,2agrant,"mmm I have thoughts of Derwin, Bosa and Slater all being back and healthy right for the playoffs. The only team I absolutely don't want to play in the 1st round is Buffalo.",6.0,nfl,t3_zpyrus,False,0.0,:Chargers: Chargers :Bills: Bills,2022-12-19T12:33:05Z,chargers,-0.083875
1052,2430,2430,2agrant,"I was there and it was happening a lot. The first red zone series that the Dolphins had they were being bombarded with snow balls. The stadium shut down a ton of it real fast after that. There was people getting kicked out all over the place. 

Like you said, it was a perfect storm but it was still frustrating to watch even though I was rooting for the Bills.",1.0,nfl,t3_zptu0s,False,0.0,:Chargers: Chargers :Bills: Bills,2022-12-19T09:59:37Z,chargers,-0.03802
1053,2431,2431,2agrant,Throwing snowballs at players mid play is kind of scummy though,6.0,nfl,t3_zptu0s,False,0.0,:Chargers: Chargers :Bills: Bills,2022-12-19T09:49:58Z,chargers,0.34
1054,2432,2432,2agrant,"I was there, it wasn't lol",5.0,nfl,t3_zpelqz,False,0.0,:Chargers: Chargers :Bills: Bills,2022-12-18T20:00:28Z,chargers,-0.3252
1055,2433,2433,2agrant,Yea he was a little off all game but at the end of the day all that matters is he made the clutch plays when the Chargers needed it,39.0,nfl,t3_zpdcrc,False,0.0,:Chargers: Chargers :Bills: Bills,2022-12-18T19:34:01Z,chargers,0.3919
1056,2434,2434,2agrant,"I'm here and it's snowing pretty hard already

Edit: I'm sitting in the Big Tree Inn as reference for all you Buffalo folk",23.0,nfl,t3_zob4gd,False,0.0,:Chargers: Chargers :Bills: Bills,2022-12-17T12:26:24Z,chargers,0.4215
1057,2435,2435,2agrant,"I love this team but if they want me to believe in them at all, they need to come out swinging against the Titans. I've seen them win so many amazing must win games just to fall flat on their face in the next one and go back to square one",109.0,chargers,t3_zo5g79,False,0.0,10,2022-12-17T07:08:49Z,chargers,0.57355
1058,2437,2437,2agrant,Oh so you agree he's easily replaceable?,0.0,nfl,t3_znji2n,False,0.0,:Chargers: Chargers :Bills: Bills,2022-12-16T14:12:53Z,chargers,0.6344
1059,2438,2438,2agrant,excuse me sir,2.0,nfl,t3_znji2n,False,0.0,:Chargers: Chargers :Bills: Bills,2022-12-16T12:46:48Z,chargers,0.0772
1060,2439,2439,2agrant,I have you tagged and will be delighting in your misery if Hurts tears his ACL in the next month,-5.0,nfl,t3_znji2n,False,0.0,:Chargers: Chargers :Bills: Bills,2022-12-16T12:46:15Z,chargers,-0.7269
1061,2440,2440,2agrant,We went from possibly watching the best division of all time this season to having to watch the worst division of all time,2.0,nfl,t3_znge5h,False,0.0,:Chargers: Chargers :Bills: Bills,2022-12-16T08:56:35Z,chargers,0.0258
2255,6792,6792,A_Livins,"Probably just a coding issue on ESPN's side. I think the number it's pulling is for some reason only account for their rushing yards on a single team instead of their total yards.

For example, McCaffrey's rushing yards for SF this year is 393, which would fall right in between Rachaad White and Michael Carter where that 50th (that McCaffrey is listed as out of place) is missing.",1.0,nfl,t3_zsbwiz,False,0.0,:Chargers: Chargers,2022-12-21T22:35:56Z,chargers,-0.0900888888888888
2256,6793,6793,A_Livins,"I'm guessing it's some sort of sorting issue with the fact that they have each played for multiple teams. Jeff Wilson, James Robinson, and Eno Benjamin all have the same thing.",3.0,nfl,t3_zsbwiz,False,0.0,:Chargers: Chargers,2022-12-21T22:24:47Z,chargers,0.085
2257,6794,6794,A_Livins,"To be fair, the three that made it above him are also in front of him in yards from scrimmage this year. But Ekeler does have them all beat in TDs.",75.0,chargers,t3_zs7ky3,False,0.0,#BoltUp,2022-12-21T19:11:16Z,chargers,0.07955
2258,6795,6795,A_Livins,"Man, people keeping bringing up the run/run/pass offense thing like the Chargers don't throw the ball on two thirds of their plays, [second most in the league](https://www.teamrankings.com/nfl/stat/passing-play-pct).",12.0,chargers,t3_zr647v,False,0.0,#BoltUp,2022-12-20T19:55:40Z,chargers,0.3612
2259,6798,6798,A_Livins,Where are you pulling that from? The points per play and red zone TD numbers are actually worse over the last three games than their season average.,14.0,chargers,t3_zqfe6g,False,0.0,#BoltUp,2022-12-20T00:20:34Z,chargers,-0.08895
2260,6799,6799,A_Livins,"[The Chargers are t-25th in the NFL in red zone TDs](https://www.teamrankings.com/nfl/stat/red-zone-scoring-pct)

The Chargers are [1st in the league in third downs per game](https://www.teamrankings.com/nfl/stat/third-downs-per-game), while only [9th in first downs](https://www.teamrankings.com/nfl/stat/first-downs-per-game) (For comparison, the Chiefs are 1st in first downs while 29th in third downs)

[The Chargers are 21st in points per play](https://www.teamrankings.com/nfl/stat/points-per-play)

The Chargers are only above average in scoring in one quarter. They rank [23rd in the first](https://www.teamrankings.com/nfl/stat/1st-quarter-points-per-game), [2nd in the second](https://www.teamrankings.com/nfl/stat/2nd-quarter-points-per-game), [30th in the third](https://www.teamrankings.com/nfl/stat/3rd-quarter-points-per-game), and [t-24th in the fourth](https://www.teamrankings.com/nfl/stat/4th-quarter-points-per-game).

A quote from [Daniel Popper's ""Final Thoughts"" article today](https://theathletic.com/4019737/2022/12/19/chargers-titans-week-15-analysis/): ""In Herbert’s four best EPA/dropback games of the season, Lombardi has called play action on at least 48 percent of Herbert’s early down dropbacks, according to TruMedia. In Herbert’s four worst EPA/dropback games of the season, Lombardi has called play action on less than 38 percent of Herbert’s dropbacks. That included Sunday, which was Herbert’s third-worst EPA/dropback performance of the season. Herbert used play action on 37.5 percent of his dropbacks, according to TruMedia. Against the Raiders in Week 13, which was Herbert’s second-worst EPA/dropback game of the season, Lombardi called play action on just 25 percent of Herbert’s dropbacks, according to TruMedia... The next week against the Dolphins, Lombardi made play action a feature part of the game plan. Herbert used play action on 57.9 percent of his dropbacks, and the Chargers finished with their fourth-best EPA/drive of the season, according to TruMedia.""",27.0,chargers,t3_zqfe6g,False,0.0,#BoltUp,2022-12-20T00:11:50Z,chargers,0.0424929260256547
2261,6800,6800,A_Livins,"The red zone offense is terrible compared to the players we have. Prime example against the Dolphins when they get into a goal-to-go situation and throw a grand total of zero passes into the end zone, instead throwing short and trying to rely on a receiver making a guy miss.

If the team gets behind the sticks in a drive, he calls too many quick hitters to try and chip away at the yards, which defenses have clearly keyed on, instead of attacking.

Said play-calling also applies to early downs. It feels like this team wants to get every drive to 3rd and short, instead of attacking on first and second downs.

He tends to drift away from what works too quickly. The Chargers operate very well in the play action game, but it will get left behind for drives at a time.

Herbert is one of the best QBs on the run, and yet we'll run a ton of plays that keep him in the pocket and under distress instead of rolling. Look at how the offense moved up and down the field against Miami, and tell me why they can't lean on that more often.

Too many route concepts where players are running routes that bring them to a dead stop (curls, hitches, etc) instead of letting Herbert use his accuracy to hit guys on the move, especially over the middle.",79.0,chargers,t3_zqfe6g,False,0.0,#BoltUp,2022-12-19T23:44:33Z,chargers,-0.07783470669549
2262,6803,6803,A_Livins,"This is a serious issue, but DO NOT speculate or assume what this ""family issue"" may be. Wait for more details to come out before passing judgment.

UPDATE: [Can confirm @julianneLimaTV report that #Chargers CB J.C. Jackson was booked within the past couple hours at the Bristol County Jail and House of Correction regarding a **""non-violent family issue,""** according to a spokesman for @BristolSheriff.](https://twitter.com/JeffMillerLAT/status/1604946005203382272)",1.0,chargers,t3_zq35u0,False,0.0,#BoltUp,2022-12-19T15:01:02Z,chargers,-0.000151171875
2263,6805,6805,A_Livins,"Well, we know he's pretty damn good at the piano, so I guess it isn't too far out of the realm of possibility.",10.0,chargers,t3_zphuxo,False,0.0,#BoltUp,2022-12-18T22:44:40Z,chargers,0.6705
2264,6811,6811,A_Livins,"Hey everyone who was bitching about the timeouts, THAT RIGHT THERE is why you take them.",6.0,chargers,t3_zp7gk8,False,0.0,#BoltUp,2022-12-18T18:24:06Z,chargers,-0.2732
2265,6812,6812,A_Livins,K9 has been on fire these last few drives.,4.0,chargers,t3_zp7gk8,False,0.0,#BoltUp,2022-12-18T18:14:18Z,chargers,-0.34
2266,6813,6813,A_Livins,THE TRANQUILLIZER,3.0,chargers,t3_zp7gk8,False,0.0,#BoltUp,2022-12-18T18:04:39Z,chargers,-0.0258
2267,6814,6814,A_Livins,Nice play K9!,2.0,chargers,t3_zp7gk8,False,0.0,#BoltUp,2022-12-18T18:03:54Z,chargers,0.6696
2268,6816,6816,A_Livins,Don't think not having turf is gonna help him when 240+ lb Derrick Henry falls on your ankle.,1.0,chargers,t3_zp7gk8,False,0.0,#BoltUp,2022-12-18T17:54:28Z,chargers,0.4019
2269,6818,6818,A_Livins,Ekeler's balance is INSANE.,2.0,chargers,t3_zp7gk8,False,0.0,#BoltUp,2022-12-18T17:46:08Z,chargers,-0.5319
2270,6819,6819,A_Livins,"If we get there, there's a chance we have Slater, Bosa, and Derwin back.",2.0,chargers,t3_zp7gk8,False,0.0,#BoltUp,2022-12-18T17:30:06Z,chargers,0.25
2271,6821,6821,A_Livins,"Uh, that would be the stupidest thing in the world. Pass interference happened before the pick, so it would take the pick off the board.",1.0,chargers,t3_zp7gk8,False,0.0,#BoltUp,2022-12-18T17:18:54Z,chargers,-0.131675
2680,9201,9201,Aduckonquack97,Calmest Chargers fan,5.0,chargers,t3_zp7gk8,False,0.0,Bolt Up Brochachos,2022-12-18T16:49:06Z,chargers,0.5994
3193,11449,11449,AgentLemon22,I feel like he’s going to be a Diggs type player for us. Always hyping up the QB when he’s clearly having a down moment,6.0,nyjets,t3_zqqig3,False,0.0,:Retired_Mangold: Nick Mangold,2022-12-20T09:47:45Z,chargers,0.29125
4163,14442,14442,AssssCrackBandit,"I also think with Derwin out, Staley has simplified the defense a bit, which has really helped young players like K9, Adderley, Drue, etc",11.0,chargers,t3_zqzj1m,False,0.0,.,2022-12-21T06:15:45Z,chargers,0.4588
4164,14443,14443,AssssCrackBandit,This might be a dumb question but I was thinking about it during the game - would have been an option to just let Tennessee score on purpose? It's almost impossible to stop the Titans on 1st and goal anyway so I was thinking maybe they could just let them score and then the Chargers would have 1 minute and all their timeouts to try and get a FG/ Plus letting them score on purpose so early would almost guarantee there would be no chance than Tennessee would go for 2,3.0,chargers,t3_zq2ydw,False,0.0,.,2022-12-19T20:40:04Z,chargers,-0.19255
4165,14450,14450,AssssCrackBandit,I think the Niners game absolutely counts as a great defensive game plan by Staley,5.0,chargers,t3_zptu4k,False,0.0,.,2022-12-19T11:43:39Z,chargers,0.6369
4166,14451,14451,AssssCrackBandit,"Exactly, especially since Vrabel has a history of going for 2 instead of the XP to go to OT",7.0,chargers,t3_zptu4k,False,0.0,.,2022-12-19T11:42:07Z,chargers,0.516
4167,14452,14452,AssssCrackBandit,Yup at least it's not like the old years where my asshole would pucker up every time we fielded a punt lol,1.0,chargers,t3_zpe3d1,False,0.0,.,2022-12-19T11:40:49Z,chargers,0.1754
4168,14453,14453,AssssCrackBandit,"Yup he had that pretty clutch PD yesterday too, which is so unlike him from earlier in the year lol",4.0,chargers,t3_zptio6,False,0.0,.,2022-12-19T11:39:13Z,chargers,0.7184
4169,14455,14455,AssssCrackBandit,Exactly. He came into the season with 4 WRs ahead of him. The fact that he was even able to produce at all as a WR2 is pretty good. And he definitely had some really clutch catches and Herbert seemed to trust him,5.0,chargers,t3_zpoxee,False,0.0,.,2022-12-19T11:23:35Z,chargers,0.22503125
4170,14462,14462,AssssCrackBandit,"Honestly, with the way the NFL is nowadays and with the extra game, I imagine both will probably be throwing for 5k each season. Herbert got it last year and IIRC both Herbert and Burrow are on pace for it this year",4.0,nfl,t3_zphvwf,False,0.0,:Chargers: Chargers,2022-12-19T07:26:00Z,chargers,0.1147
4171,14466,14466,AssssCrackBandit,"At least that's not that bad because there are a bunch of elite QBs in the league (Josh Allen, Lamar, Herbert, Hurts, etc) who have not made the SB. At least Herbie wont be singled out lol",2.0,chargers,t3_zpe7qv,False,0.0,.,2022-12-18T20:04:22Z,chargers,0.19465
4172,14468,14468,AssssCrackBandit,"Honestly I dont wanna get ahead of ourselves but I would love to win a playoff game too because the goalposts for Justin will just shift and people will say ""Hasn't even won a playoff game""",33.0,chargers,t3_zpe7qv,False,0.0,.,2022-12-18T19:40:36Z,chargers,0.8751
4173,14469,14469,AssssCrackBandit,"I think he's still in that 10-12 range currently, but he can def crack the top 10 one day soon. I need to see more than a 6 game stretch before I can crown someone a top 10 QB",-1.0,nfl,t3_zpdv1j,False,0.0,:Chargers: Chargers,2022-12-18T19:31:54Z,chargers,0.17515
4174,14470,14470,AssssCrackBandit,Trevor will be ok. He has some stinkers but then has some games where he will flash. I think he will end up as a solid above average QB,-2.0,nfl,t3_zpdv1j,False,0.0,:Chargers: Chargers,2022-12-18T19:26:14Z,chargers,0.0340222222222222
4175,14471,14471,AssssCrackBandit,Damn maybe I woulda been more clutch if I was religious 😭,12.0,chargers,t3_zpd2jc,False,0.0,.,2022-12-18T19:11:19Z,chargers,-0.7003
4176,14472,14472,AssssCrackBandit,"Honestly. 

I don't care that he can't make 50+ yarders. But having a guy who is automatic from 45 yds or less, including in super clutch situations, is honestly pretty valuable",9.0,chargers,t3_zpd2jc,False,0.0,.,2022-12-18T19:10:28Z,chargers,0.2941703703703703
4177,14473,14473,AssssCrackBandit,"Depends. Last year, it was Herbert putting up video game numbers but our defense gave up an insane 27 PPG so we would always concede a last minute TD/FG to win. 

This year, the defense has really stepped up as of late (despite a horrible first half of the season) but Lombardi is a football terrorist who has turned our offense into pure dink and dunk and only lets Herbert air it out in desperate situations. Not to mention the entire oline dying considering we were starting 4 practice squad players/rookies on the oline last week",50.0,nfl,t3_zpdcrc,False,0.0,:Chargers: Chargers,2022-12-18T19:04:11Z,chargers,-0.0477828125
4178,14475,14475,AssssCrackBandit,"Honestly, I swear the most unlucky things happen to us. Like even just last week with that stupid Tyreek fumble TD",13.0,nfl,t3_zpakqo,False,0.0,:Chargers: Chargers,2022-12-18T18:58:48Z,chargers,-0.007775
4179,14477,14477,AssssCrackBandit,The Titans are gifting us this game which makes it that much more frustrating. We should be up by multiple scores by now,5.0,chargers,t3_zp7gk8,False,0.0,.,2022-12-18T17:28:45Z,chargers,-0.123175
4180,14478,14478,AssssCrackBandit,Prolly gonna be avoiding twitter and /r/nfl for a while lol,3.0,chargers,t3_zp7gk8,False,0.0,.,2022-12-18T17:25:04Z,chargers,0.1027
4181,14479,14479,AssssCrackBandit,Why does this team always ruin my sundays,5.0,chargers,t3_zp7gk8,False,0.0,.,2022-12-18T17:01:44Z,chargers,-0.5859
4182,14480,14480,AssssCrackBandit,Lmao yes because this was clearly Herbert’s fault,11.0,nfl,t3_zpakqo,False,0.0,:Chargers: Chargers,2022-12-18T16:42:35Z,chargers,0.765
4183,14482,14482,AssssCrackBandit,"Oh yeah Jax is waaaay nicer than it was even just 10 yrs ago. Lot of development. I visit every few months since my parents live in St Johns. Beach bars are fun and if we’re feeling bougie, I’ll hit up St Aug lol",2.0,nfl,t3_zp8ox8,False,0.0,:Chargers: Chargers,2022-12-18T16:23:08Z,chargers,0.193691015625
4184,14483,14483,AssssCrackBandit,"Riverside is honestly pretty dead nowadays, the beach bars are way better imo for a younger crowd",7.0,nfl,t3_zp8ox8,False,0.0,:Chargers: Chargers,2022-12-18T16:15:52Z,chargers,0.5859
4185,14517,14517,AssssCrackBandit,The other factor is that Feiler plays on the same side as Slater and seems to have good communication with him. So having Slater return might restore Feiler's play to last year's level due to the increased chemistry/communication,5.0,chargers,t3_znpshj,False,0.0,.,2022-12-16T17:47:48Z,chargers,0.4952499999999999
4478,17392,17392,BaamZahard,It’s not purely a matter of effort it’s also a result of roster construction. You guys run the top for 7 years straight now so we literally built to try and topple you. But the other half is that you’re our measuring stick and so we always play up. It’s the burden of the crown my friend,14.0,nfl,t3_zqy4bm,False,0.0,:Chargers: Chargers ,2022-12-20T16:54:58Z,chargers,0.059148046875
4479,17393,17393,BaamZahard,Being perhaps the only answer doesn’t mean it’s the right answer. Means we lost the right answer somewhere along the way. Ah well.  Can’t be helped. Great work my boltchacho,12.0,nfl,t3_zqy4bm,False,0.0,:Chargers: Chargers ,2022-12-20T14:55:00Z,chargers,0.12665648
4480,17394,17394,BaamZahard,Chargers feel simultaneously too high and too low. Smh,52.0,nfl,t3_zqy4bm,False,0.0,:Chargers: Chargers ,2022-12-20T14:44:34Z,chargers,-0.2274
4481,17395,17395,BaamZahard,Putting the L into power ranking darLings,93.0,nfl,t3_zqy4bm,False,0.0,:Chargers: Chargers ,2022-12-20T14:44:08Z,chargers,0.7865
4966,21913,21913,Big_Ugly_Cripple,It's crazy that the 2020 draft has put out 3 of the top 6 afc QBs and 4 of the top 10 overall.,2.0,nfl,t3_zs7hhi,False,0.0,:Chargers: Chargers,2022-12-21T20:43:09Z,chargers,0.0516
4967,21914,21914,Big_Ugly_Cripple,I need to remember to stop reading the Twitter comments.,3.0,chargers,t3_zqe13v,False,0.0,Chargers,2022-12-20T01:16:15Z,chargers,-0.296
4968,21915,21915,Big_Ugly_Cripple,If he can't stay in GB he's not good enough to be in our top 5.,2.0,chargers,t3_zq06b9,False,0.0,Chargers,2022-12-19T12:57:47Z,chargers,-0.1546
4969,21916,21916,Big_Ugly_Cripple,True. I think Baker being there also keeps it in that spot. I don't think any match up is big enough to keep Wolford on prime time.,21.0,chargers,t3_zq0119,False,0.0,Chargers,2022-12-19T12:55:53Z,chargers,0.0156111111111111
4970,21917,21917,Big_Ugly_Cripple,"Idk if it's quite a 50/50 split but yeah fans have either stayed with team or stopped following NFL altogether. 

Side note there was a vote on the ballot to keep the team in SD payed for by a tax on hotels but the people voted against it. Spanks isn't a great owner and there are parts he could have handled better but he didn't drop the city and leave over night or anything.",16.0,nfl,t3_zpukfx,False,0.0,:Chargers: Chargers,2022-12-19T12:51:21Z,chargers,0.0636518518518518
4971,21918,21918,Big_Ugly_Cripple,Seriously go send him anywhere in the NFC south. Would be perfect.,243.0,nfl,t3_zpw9bs,False,0.0,:Chargers: Chargers,2022-12-19T12:46:47Z,chargers,0.1035249999999999
4972,21919,21919,Big_Ugly_Cripple,Hey I'm as devoted as anyone but I also recognize we come out flat after big wins. Just gotta watch and root for them to come out swinging!,6.0,chargers,t3_zo5g79,False,0.0,Chargers,2022-12-17T14:02:29Z,chargers,0.196125
5362,24682,24682,Bolt4Life,I'm officially old. I saw TLaw and thought Ty Law lmao,1.0,nfl,t3_zqv0yo,False,0.0,:Chargers: Chargers,2022-12-21T03:43:57Z,chargers,0.37895
5543,25622,25622,BoltGang17,What is probate court? I'm not American and the Wikipedia article is confusing to me. Could this be over failing to pay child support for example?,10.0,nfl,t3_zq30fh,False,0.0,:Chargers: Chargers,2022-12-19T17:48:24Z,chargers,-0.1084777777777777
5544,25623,25623,BoltGang17,"GG Titan bros, it was a hard battle",9.0,nfl,t3_zp85eh,False,0.0,:Chargers: Chargers,2022-12-18T18:27:49Z,chargers,-0.0173
5545,25625,25625,BoltGang17,Nah popped out sadly,2.0,nfl,t3_zp85eh,False,0.0,:Chargers: Chargers,2022-12-18T16:25:10Z,chargers,-0.4939
5546,25626,25626,BoltGang17,"Titans fans are so chill man, love watching this with you guys 🤝",39.0,nfl,t3_zp85eh,False,0.0,:Chargers: Chargers,2022-12-18T16:21:48Z,chargers,0.6666
5547,25628,25628,BoltGang17,Why did we waste a time out?,2.0,nfl,t3_zp85eh,False,0.0,:Chargers: Chargers,2022-12-18T16:19:16Z,chargers,-0.4215
5548,25629,25629,BoltGang17,Great play Lombardi,1.0,nfl,t3_zp85eh,False,0.0,:Chargers: Chargers,2022-12-18T16:16:41Z,chargers,0.7579
5549,25630,25630,BoltGang17,Derek Henry is a bad man,7.0,nfl,t3_zp85eh,False,0.0,:Chargers: Chargers,2022-12-18T16:09:23Z,chargers,-0.5423
6314,26900,26900,BoltofThunder10,How did you forget big dick Herbert and dicker the kicker!!,1.0,nfl,t3_zpcxzr,False,0.0,:Chargers: Chargers :Lions: Lions,2022-12-18T18:58:34Z,chargers,-0.1674
6315,26902,26902,BoltofThunder10,I thought the chargers were bad for how we blow our games and here the colts come smh,1.0,nfl,t3_zohlfp,False,0.0,:Chargers: Chargers :Lions: Lions,2022-12-17T20:13:56Z,chargers,-0.7003
6316,26903,26903,BoltofThunder10,I have watched a lot of colts football this year unfortunately and I’m still surprised this far in. Bravo colts,2.0,nfl,t3_zohli2,False,0.0,:Chargers: Chargers :Lions: Lions,2022-12-17T20:09:18Z,chargers,-0.032
7860,36896,36896,CornrowChris,Matt Rhule went to the LeBron school of emoji spam. Now he just needs some awful cornball hashtags.,1.0,nfl,t3_zs8yrg,False,0.0,:Chargers: Chargers,2022-12-21T20:07:28Z,chargers,-0.3197
7861,36901,36901,CornrowChris,"Before people ask, it’s not the Malik Henry from Last Chance U. 

Had to look that up this morning myself.",63.0,chargers,t3_zrye2d,False,0.0,bolt,2022-12-21T13:34:21Z,chargers,0.0625
7862,36908,36908,CornrowChris,"For years in Madden, Bob was far and away the best player on the free agent market. Any time I started up a new franchise save, the first thing I’d do was pick him up. 

It’s a shame that’s probably what he’s most known for to me, because he was a hell of a player even if it didn’t last very long.",12.0,nfl,t3_zqot52,False,0.0,:Chargers: Chargers,2022-12-20T07:50:04Z,chargers,-0.1905407407407407
7863,36912,36912,CornrowChris,"Man, I hope we have an out somewhere on that contract. What a nightmare this signing has been.",160.0,chargers,t3_zq35u0,False,0.0,bolt,2022-12-19T14:54:38Z,chargers,0.1101
7864,36922,36922,CornrowChris,Staley’s hand is literally shaking holding the play sheet. Jesus Christ.,11.0,chargers,t3_zp7gk8,False,0.0,bolt,2022-12-18T18:19:27Z,chargers,0.14985
7865,36923,36923,CornrowChris,Good old fashioned Chargers football. We literally hold the other teams hand to keep them in the game and bring it down to the wire.,2.0,chargers,t3_zp7gk8,False,0.0,bolt,2022-12-18T18:17:42Z,chargers,0.35705
7866,36924,36924,CornrowChris,"Why do we play to lose like this lol. The conservative shit, and somehow only wasting 14 seconds while doing it.",9.0,chargers,t3_zp7gk8,False,0.0,bolt,2022-12-18T18:09:37Z,chargers,-0.2183999999999999
7867,36925,36925,CornrowChris,"I don’t understand this team. The Titans strength is their run defense, with the worst pass defense in the league. We have the worst rushing offense in the league, and our strength is our passing offense. 

So of-fucking-course we focus entirely on running the ball today, and when we do pass, we’re dogshit. Unreal.",4.0,chargers,t3_zp7gk8,False,0.0,bolt,2022-12-18T18:01:34Z,chargers,-0.00475392
