,Unnamed: 0.1,Unnamed: 0,author,body,score,subreddit,link_id,over_18,controversiality,author_flair_text,created_utc,flair,sentiment
25050,142362,142362,Telivaina,"The only thing that can stop Lombardi from fucking us this season, is him suffering a cardiac arrest in the booth",3.0,chargers,t3_zp7gk8,False,0.0,ASAP,2022-12-18T16:42:57Z,chargers,-0.7717
25051,142363,142363,Telivaina,"Herbert just desperately trying to make up for the shitty playcalling. 

It is what it is.",9.0,chargers,t3_zp7gk8,False,0.0,ASAP,2022-12-18T16:41:07Z,chargers,-0.183775
25052,142365,142365,Telivaina,"This offseason its going to be very simple.

If Staley wants to have even a remote chance he keeps his job, he fires Lombardi. 

If he refuses to do so, fire them both.",9.0,chargers,t3_zp7gk8,False,0.0,ASAP,2022-12-18T16:24:51Z,chargers,-0.0855555555555555
25053,142366,142366,Telivaina,Ask Madden could run a better offense than Lamebardi lmao,2.0,chargers,t3_zp7gk8,False,0.0,ASAP,2022-12-18T16:18:23Z,chargers,0.7003
25054,142367,142367,Telivaina,This is going to be yet another matter of whether Herbie & the guys can carry us to victory in spite of Lombardi's playcalling or nah,12.0,chargers,t3_zp7gk8,False,0.0,ASAP,2022-12-18T16:12:42Z,chargers,-0.5719
25055,142371,142371,Telivaina,Oh no. I hope Tannehill is okay man. Didnt look too good.,4.0,chargers,t3_zp7gk8,False,0.0,ASAP,2022-12-18T15:29:46Z,chargers,-0.0486333333333333
25056,142373,142373,Telivaina,I was so shocked when I saw that I had to do a double take lmao.,28.0,chargers,t3_zogowk,False,0.0,ASAP,2022-12-17T15:28:21Z,chargers,0.2284
25057,142374,142374,Telivaina,"Lol did someone catch that guy in a #32 chargers jersey and a viking helmet on at the vikes game.

I had to do a double take lol",1.0,chargers,t3_zni0l2,False,0.0,ASAP,2022-12-17T15:22:43Z,chargers,0.316125
25058,142375,142375,Telivaina,This officiating crew should be suspended without pay indefinitely for this travesty of a job they have done.,12.0,nfl,t3_zobc26,False,0.0,:Chargers: Chargers,2022-12-17T15:11:42Z,chargers,-0.8008
25709,144404,144404,TheCryptocrat,Chargers Titans had a pretty wild ending too.,1.0,nfl,t3_zpcxzr,False,0.0,:Chargers: Chargers,2022-12-18T18:37:53Z,chargers,0.4939
25710,144405,144405,TheCryptocrat,Thank you Raiders. (I feel strange saying that),12.0,nfl,t3_zpd20c,False,0.0,:Chargers: Chargers,2022-12-18T18:34:50Z,chargers,-0.0108499999999999
25946,145916,145916,TheOneWhoKnocks2012,lol at how accurate you are,1.0,chargers,t3_zr9l69,False,0.0,Felipe Rios,2022-12-21T12:40:44Z,chargers,0.4215
25947,145917,145917,TheOneWhoKnocks2012,"I have an idea marinating for the Chiefs, but we gotta play them again first.",1.0,chargers,t3_zr647v,False,0.0,Felipe Rios,2022-12-21T11:27:03Z,chargers,0.4767
25948,145918,145918,TheOneWhoKnocks2012,"I know, but it was easier than writing “4 yard pass that essentially counts as a run”

And it fit the joke better",17.0,chargers,t3_zr647v,False,0.0,Felipe Rios,2022-12-20T20:07:42Z,chargers,0.9274
25949,145919,145919,TheOneWhoKnocks2012,"Spent my first afternoon learning after effects to make this. Go easy on me haha 

I’m training for the meme wars, brothers. o7",62.0,chargers,t3_zr647v,False,0.0,Felipe Rios,2022-12-20T19:15:47Z,chargers,0.0353555555555555
25950,145921,145921,TheOneWhoKnocks2012,"I dare not mention the big dream until we at least win a playoff game. 

My little heart can’t take that hopium just yet.",3.0,chargers,t3_zptu4k,False,0.0,Felipe Rios,2022-12-19T11:29:31Z,chargers,0.475225
25951,145922,145922,TheOneWhoKnocks2012,"My biggest dream: We go on a run and make playoff noise.

My biggest nightmare: We go on a run and retain Lombardi.",71.0,chargers,t3_zptu4k,False,0.0,Felipe Rios,2022-12-19T09:03:35Z,chargers,0.0625
25952,145924,145924,TheOneWhoKnocks2012,FUCKING RAIDERS OMG THANK YOU!!!!,3.0,chargers,t3_zp7gk8,False,0.0,Felipe Rios,2022-12-18T18:26:13Z,chargers,0.1408
25953,145925,145925,TheOneWhoKnocks2012,Fucking raiders suck ass man,9.0,chargers,t3_zp7gk8,False,0.0,Felipe Rios,2022-12-18T17:57:20Z,chargers,-0.7871
25954,145926,145926,TheOneWhoKnocks2012,"He was already limping.

Hope it’s not Achilles.",1.0,chargers,t3_zp7gk8,False,0.0,Felipe Rios,2022-12-18T16:38:28Z,chargers,0.2202
26547,146868,146868,TheRealPort,The Chargers lost to the 1-31 Browns at Christmas-time. It could happen.,1.0,nfl,t3_zquon9,False,0.0,:Chargers: Chargers,2022-12-20T13:44:38Z,chargers,-0.07955
26548,146870,146870,TheRealPort,"Can’t even blame Staley today, the defense is playing lights out and somehow the Chargers only have 7 points against the ghost of the Titans defense",8.0,nfl,t3_zpbu1t,False,0.0,:Chargers: Chargers,2022-12-18T17:41:59Z,chargers,-0.2263
26549,146871,146871,TheRealPort,"Bro thinks he’s LT

Edit: Shit maybe he is",207.0,nfl,t3_zoprbd,False,0.0,:Chargers: Chargers,2022-12-17T22:20:41Z,chargers,-0.5574
27253,152248,152248,Thejedi887,Prayers up man. My grandpa passed from Cancer I hope everyone suffering from it recovers and lives a happy life.,12.0,chargers,t3_zr0v9h,False,0.0,ASAP,2022-12-20T17:02:22Z,chargers,-0.11315
27254,152252,152252,Thejedi887,That was a beautiful fucking run!!!,6.0,chargers,t3_zp7gk8,False,0.0,ASAP,2022-12-18T17:47:02Z,chargers,0.1672
27255,152253,152253,Thejedi887,Now I know how Kratos feels when he was raging against the gods but like ten times that,3.0,chargers,t3_zp7gk8,False,0.0,ASAP,2022-12-18T17:24:07Z,chargers,0.2617
27256,152254,152254,Thejedi887,What the fuck is in the water these past few games wow,5.0,nfl,t3_zp30dp,False,0.0,:Chargers: Chargers,2022-12-18T15:21:03Z,chargers,0.0772
27595,153237,153237,Thick_Safe1198,Wink is a thick assed union man & Kevin is a sexy teenage heartthrob,67.0,nfl,t3_zrw8ue,False,0.0,:Chargers: Chargers :Bears: Bears,2022-12-21T12:41:50Z,chargers,0.5267
27596,153238,153238,Thick_Safe1198,The greatest show on turf? How about the greatest show on the interstate,31.0,nfl,t3_zr8kk3,False,0.0,:Chargers: Chargers :Bears: Bears,2022-12-20T21:39:14Z,chargers,0.477675
27597,153239,153239,Thick_Safe1198,429.4 yards per play,195.0,nfl,t3_zr8kk3,False,0.0,:Chargers: Chargers :Bears: Bears,2022-12-20T21:10:40Z,chargers,0.34
27598,153242,153242,Thick_Safe1198,Yes. Mike tirico sounds so much better on SNF,-1.0,nfl,t3_zq2poi,False,0.0,:Chargers: Chargers :Bears: Bears,2022-12-19T14:42:16Z,chargers,0.345575
27599,153244,153244,Thick_Safe1198,Thanks for the reminder! Glad to see you in here having fun!,51.0,nfl,t3_zpdtef,False,0.0,:Chargers: Chargers :Bears: Bears,2022-12-18T19:13:35Z,chargers,0.50535
27600,153245,153245,Thick_Safe1198,"This statement could’ve been copy pasted from the chargers sub about 2 weeks ago, don’t give up yet 😂",24.0,nfl,t3_zpd0g1,False,0.0,:Chargers: Chargers :Bears: Bears,2022-12-18T18:44:19Z,chargers,0.4404
27601,153252,153252,Thick_Safe1198,"Let me guess- he’s a government employee who is refusing to delete tik tok

EDIT: look, I read the article, and I still believe his issues to be tik tok related. You all might not see the big picture, but I do (because I have a very high IQ score / incredibly heavy brain)

EDIT 2: fine. Ok. Here you go:



/s",-44.0,nfl,t3_znlwcx,False,0.0,:Chargers: Chargers :Bears: Bears,2022-12-16T12:51:28Z,chargers,0.003055078125
27602,153256,153256,Thick_Safe1198,"When I watched the colts hard knocks in season, I noticed that he was always saying “*you* need to do this or that better” it was never “*we*…” or “*I*…”",9.0,nfl,t3_zniz5u,False,0.0,:Chargers: Chargers :Bears: Bears,2022-12-16T10:51:45Z,chargers,-0.1027
27603,153257,153257,Thick_Safe1198,Chargers playoff odds just increased by 15%,5.0,nfl,t3_znhhg3,False,0.0,:Chargers: Chargers :Bears: Bears,2022-12-16T09:40:49Z,chargers,0.2732
27604,153259,153259,Thick_Safe1198,"Yes yes yes,,,, no",1.0,nfl,t3_znh0li,False,0.0,:Chargers: Chargers :Bears: Bears,2022-12-16T09:28:30Z,chargers,0.7096
27897,155217,155217,TrueJP,"OT left hand visibly holding Macks right shoulder pad. Subtle. But, holding by rule. They're doing this just about every play. Arms, jerseys, pads. Refs consistently allowing it. We'll just need to adapt.",1.0,chargers,t3_zp7gk8,False,0.0,ASAP,2022-12-18T17:01:34Z,chargers,0.0001422073892923
28977,160320,160320,WPG_Charger,Yeah I guess I didnt look at everything required for that to happen.,2.0,chargers,t3_zrgkcj,False,0.0,Bolt Up,2022-12-21T19:02:01Z,chargers,0.296
28978,160321,160321,WPG_Charger,"Yeah personally, anyone thinking the Chiefs are a better matchup than the Jags just cause ""how we play them"" are kidding themselves. Chiefs in January are exponentially better than whatever the Jags put together in January.",4.0,chargers,t3_zrgkcj,False,0.0,Bolt Up,2022-12-21T18:39:13Z,chargers,0.416325
28979,160322,160322,WPG_Charger,"I will take Revenge against the Jags Wild Card Round, Chiefs revenge in the divisional, and take down last years AFC Champs while we punch our ticket to the SB and Revenge against the 49ers, Bosa Bowl. Herbert gets the monkey off the entire Chargers organizations back with a 50 burger.

That's my dream playoff run.",5.0,chargers,t3_zrgkcj,False,0.0,Bolt Up,2022-12-21T18:37:26Z,chargers,0.053237037037037
28980,160323,160323,WPG_Charger,"Uhhhh, isn't this guy one of the main voices in the room during owners meetings when discussing rules?

Is he aware that it is literally impossible to win when you throw a pick 6 in overtime?",-29.0,nfl,t3_zrq6dz,False,0.0,:Chargers: Chargers,2022-12-21T09:23:54Z,chargers,0.29295
28981,160324,160324,WPG_Charger,There's better things to do with your morning than be an ass,3.0,chargers,t3_zrnnb6,False,0.0,Bolt Up,2022-12-21T08:27:15Z,chargers,-0.1531
28982,160325,160325,WPG_Charger,"They Rochambeau for it, sucks to be Guyton.",1.0,chargers,t3_zr6n5u,False,0.0,Bolt Up,2022-12-21T08:23:51Z,chargers,-0.3612
28983,160326,160326,WPG_Charger,"No but the others stacking up losses could be the difference between a ticket with the 5th seed and one with the 7th. Taking care of our own business is obviously priority #1 but that doesnt mean I wont be paying attention to everything else going on and cheering for X team to win (even if it is the Raiders, like last week) if it helps the Chargers get a better playoff spot.",29.0,chargers,t3_zrgkcj,False,0.0,Bolt Up,2022-12-21T07:44:05Z,chargers,0.32865
28984,160327,160327,WPG_Charger,"He even mentioned sitting beside Keenan, ""I keep forgetting I'm mic'd up today, I haven't said anything good""",2.0,chargers,t3_zqvi34,False,0.0,Bolt Up,2022-12-21T07:38:20Z,chargers,-0.3412
28985,160328,160328,WPG_Charger,This is probably the best proposal I've heard and I know you were trying to be absurd lol.,4.0,nfl,t3_zr9szg,False,0.0,:Chargers: Chargers,2022-12-20T22:26:24Z,chargers,0.7906
28986,160330,160330,WPG_Charger,"Rock, paper, scissors: best outta 3",4.0,chargers,t3_zr6n5u,False,0.0,Bolt Up,2022-12-20T20:29:33Z,chargers,0.6369
28987,160334,160334,WPG_Charger,Happy Cake Day!!!!,3.0,chargers,t3_zqs5ti,False,0.0,Bolt Up,2022-12-20T11:30:35Z,chargers,0.1696
28988,160335,160335,WPG_Charger,"Unfortunately for some, trolling others does make them happy. The world we live in.",5.0,chargers,t3_zqs5ti,False,0.0,Bolt Up,2022-12-20T11:25:04Z,chargers,0.07955
28989,160337,160337,WPG_Charger,"That would imply we miss the playoffs with one of the easiest remaining schedules in the league and we currently control our own destiny.

I'm not done with this season and refuse to tap out just cause of a possibility of changing coaches.",16.0,chargers,t3_znfynl,False,0.0,Bolt Up,2022-12-16T08:36:37Z,chargers,-0.074
28990,160338,160338,WPG_Charger,Wins is not a QB stat for a roster consisting of 53 players.,1.0,nfl,t3_zn8tjd,False,0.0,:Chargers: Chargers,2022-12-16T07:46:08Z,chargers,0.5719
28991,160339,160339,WPG_Charger,"They failed him in the sense as someone who runs like a giraffe but is an amazing pocket QB, they continued to neglect to build a decent oline for him and he had to put the team on his back year after year. That's failing generational talent.",1.0,nfl,t3_zn8tjd,False,0.0,:Chargers: Chargers,2022-12-16T07:41:24Z,chargers,-0.013425
28992,160340,160340,WPG_Charger,I'll trade you Joe Lombardi for Todd Downing straight up,1.0,nfl,t3_zn8tjd,False,0.0,:Chargers: Chargers,2022-12-16T07:39:33Z,chargers,0.2263
29679,162995,162995,WildWing22,Even raiders helped us haha,5.0,chargers,t3_zp7gk8,False,0.0,AZBOLT⚡️,2022-12-18T18:27:52Z,chargers,0.4588
29680,162996,162996,WildWing22,I hate,3.0,chargers,t3_zp7gk8,False,0.0,AZBOLT⚡️,2022-12-18T18:20:05Z,chargers,-0.5719
29681,162997,162997,WildWing22,Well fuck me,3.0,chargers,t3_zp7gk8,False,0.0,AZBOLT⚡️,2022-12-18T18:15:31Z,chargers,-0.34
29682,162998,162998,WildWing22,This D has my D hard,5.0,chargers,t3_zp7gk8,False,0.0,AZBOLT⚡️,2022-12-18T18:13:52Z,chargers,-0.1027
29683,162999,162999,WildWing22,What are they fighting about?,9.0,chargers,t3_zp7gk8,False,0.0,AZBOLT⚡️,2022-12-18T18:06:05Z,chargers,-0.3612
29684,163000,163000,WildWing22,The raiders fucking suck,6.0,chargers,t3_zp7gk8,False,0.0,AZBOLT⚡️,2022-12-18T17:54:19Z,chargers,-0.4927
29685,163003,163003,WildWing22,The wheels are falling off,6.0,chargers,t3_zp7gk8,False,0.0,AZBOLT⚡️,2022-12-18T17:34:51Z,chargers,-0.1531
29686,163004,163004,WildWing22,Not a doomer but how can I be happy watching this week in and week out,4.0,chargers,t3_zp7gk8,False,0.0,AZBOLT⚡️,2022-12-18T17:33:10Z,chargers,0.7227
29687,163006,163006,WildWing22,Why is life pain?,7.0,chargers,t3_zp7gk8,False,0.0,AZBOLT⚡️,2022-12-18T17:23:18Z,chargers,-0.5106
29688,163007,163007,WildWing22,Well this has been fun,3.0,chargers,t3_zp7gk8,False,0.0,AZBOLT⚡️,2022-12-18T16:41:13Z,chargers,0.6597
29689,163008,163008,WildWing22,"Everyone relax, we knew Henry was going to be a problem",13.0,chargers,t3_zp7gk8,False,0.0,AZBOLT⚡️,2022-12-18T16:11:56Z,chargers,0.0516
30125,164072,164072,WyldeBolt,I wish the NFL scriptwriters waited until next week smh,1.0,nfl,t3_zru4rj,False,0.0,:Chargers: Chargers,2022-12-21T12:04:49Z,chargers,0.1027
30126,164073,164073,WyldeBolt,"Man, why do the NFL scriptwriters have to do us dirty, again?",1.0,chargers,t3_zrucbb,False,0.0,Chargers,2022-12-21T12:04:13Z,chargers,-0.4404
30127,164075,164075,WyldeBolt,"Maxx Crosby, too 😬",31.0,nfl,t3_zqs4ve,False,0.0,:Chargers: Chargers,2022-12-20T10:58:18Z,chargers,-0.34
30128,164076,164076,WyldeBolt,"Former Chargers legend Rayshawn Jenkins

But seriously I'm happy for him",1.0,nfl,t3_zp8ox8,False,0.0,:Chargers: Chargers,2022-12-18T19:11:33Z,chargers,0.6124
30129,164077,164077,WyldeBolt,"Rhys Ilfans, who plays Otto Hightower on HotD",6.0,nfl,t3_zngfr7,False,0.0,:Chargers: Chargers,2022-12-16T16:18:17Z,chargers,0.25
30130,164078,164078,WyldeBolt,"It wasn't just Raider fans, a lot of NFL media talking heads also got super upset",1.0,chargers,t3_zmshga,False,0.0,Chargers,2022-12-16T08:53:53Z,chargers,0.3182
30404,166741,166741,ZetaDefender,"Coach of the week

Brandon Staley, head coach, L.A. Chargers. The second-year Chargers coach has gotten enough guff for clock management and fourth-down management in his short time running the Chargers. So let’s give him some back-pats for excellent end-of-game management in the Chargers’ 17-14 win over the Titans. With 1:07 left, and the Chargers up 14-7, Tennessee had the ball at the L.A. 21-yard line. Tennessee had no timeouts left. The Chargers had three. Staley had two choices: hope that Tennessee wouldn’t score and the clock would bleed out, or use timeouts in order to give his team a real chance to get in field-goal range in case Tennessee scored a TD to tie it. “I wanted to give my quarterback [a chance] in case the Titans scored there,” Staley told me afterward. But there was something else. Mike Vrabel, the Titans’ coach, might choose to go for two to try to win the game. So Staley knew he had to try to preserve some clock in case Tennessee was up one, or the game was tied. With the ball staying in bounds and Tennessee advancing, Staley used a timeout at :59, at :54 and at :51. After the third timeout, Tennessee scored on a quarterback plunge. Vrabel went for the PAT. The Chargers took over at their 23-yard line with 44 seconds left, enough time for Justin Herbert to move the offense 52 yards in six plays to put Cameron Dicker in place for the winning field goal. “The situation wasn’t ideal,” said Staley, “but you’ve always got to find a way to put your team in the best position.” That’s what Staley did Sunday.""",2.0,chargers,t3_zq2ydw,False,0.0,Chargers,2022-12-19T20:44:34Z,chargers,0.0418636740618296
30858,168320,168320,abw2000,Yeah it’s a massive snub. Though I think I’m also just salty after years of people overlooking EK. He lead the nfl in TDs last year as well with 20. And had no probowl. He always seems to be overlooked as a top NFL RB,232.0,nfl,t3_zs8dtl,False,0.0,:Chargers: Chargers,2022-12-21T21:44:20Z,chargers,0.025876608
30859,168321,168321,abw2000,It’s a win for you. You didn’t have to pay him,101.0,nfl,t3_zs7vme,False,0.0,:Chargers: Chargers,2022-12-21T19:57:40Z,chargers,0.0951249999999999
30860,168322,168322,abw2000,"Ekeler has 1,300 yards (4th in AFC) and 14 TDs (1st in entire NFL) No pro bowl. I know your pain. Probowl makes no sense",801.0,nfl,t3_zs8dtl,False,0.0,:Chargers: Chargers,2022-12-21T19:56:16Z,chargers,-0.1663629629629629
30861,168323,168323,abw2000,Ekeler has more TDs than all of them. Over the past 2 years. No player has more TDs than Ekeler does. The second is well below him,-8.0,nfl,t3_zs7kf4,False,0.0,:Chargers: Chargers,2022-12-21T19:52:29Z,chargers,0.0498
30862,168325,168325,abw2000,"Eh, telesco has drafted a great team, and had always been willing to give his coaches the players they want. As well managed our cap situation incredibly well (least amount of dead cap) Telesco is a divisive subject for our fanbase. Some like him some hate him",3.0,nfl,t3_zrzoc6,False,0.0,:Chargers: Chargers,2022-12-21T16:05:36Z,chargers,-0.0968999999999999
30863,168326,168326,abw2000,"Telesco has hired 2 coaches. Lynn and Staley.  Lynn looked promising then flamed out, Staley still looks like he can be a good coach.  

(I don’t consider McCoy as a telesco hire considering how quickly after telesco got the job McCoy was brought in. There’s no way he had time to make that decision)",7.0,nfl,t3_zrzoc6,False,0.0,:Chargers: Chargers,2022-12-21T15:34:54Z,chargers,-0.0528287999999999
30864,168327,168327,abw2000,It sure is hilarious when every single chargers fan says “Fuck” as soon as we saw the news. Because we all know what this means for our team,15.0,nfl,t3_zrwk4f,False,0.0,:Chargers: Chargers,2022-12-21T13:34:06Z,chargers,0.18575
30865,168328,168328,abw2000,"And said head coach has held the team together despite having many weeks as the most injured team in the NFL. we’re firmly in the playoff picture, and can even clinch this week under the right circumstances

If that can’t be attributed to coaching, I don’t know what can be",3.0,nfl,t3_zrpj46,False,0.0,:Chargers: Chargers,2022-12-21T10:07:48Z,chargers,-0.1144
30866,168330,168330,abw2000,He’s just asking for some bad injury voodoo,15.0,nfl,t3_zrnoe2,False,0.0,:Chargers: Chargers,2022-12-21T08:18:00Z,chargers,-0.743
30867,168332,168332,abw2000,"Ehhh, i was more meaning we have the TEs that fit into most roles rn. We have our yac TE in Everett. We have our big tall te in parham, and McKitty is meant to be the blocking TE. But he’s gotten worse at that. Geisecki doesn’t really fit in the offense cost effective wise. And is also as bad a blocker as McKitty",1.0,nfl,t3_zr7zry,False,0.0,:Chargers: Chargers,2022-12-20T22:02:41Z,chargers,-0.0716414866255144
30868,168334,168334,abw2000,"We can’t afford what he wants. Plus, he also won’t really fit into the offense currently",19.0,nfl,t3_zr7zry,False,0.0,:Chargers: Chargers,2022-12-20T21:52:05Z,chargers,0.1003
30869,168338,168338,abw2000,It just means they’ve never watched multiple chargers games while Herbert has been playing,11.0,nfl,t3_zr31ao,False,0.0,:Chargers: Chargers,2022-12-20T19:01:23Z,chargers,0.2023
30870,168339,168339,abw2000,"I agree 

Also for no reason",2.0,nfl,t3_zr01uv,False,1.0,:Chargers: Chargers,2022-12-20T15:28:08Z,chargers,0.0772
30871,168341,168341,abw2000,Anyone else dislike the gamesmanship nfl player do during 2 minute drills were they just lay on the ball carrier for as long as they can?,7.0,nfl,t3_zp85eh,False,0.0,:Chargers: Chargers,2022-12-18T16:39:34Z,chargers,-0.3818
30872,168342,168342,abw2000,I'm sorry titans bros. You caught our injury bug,5.0,nfl,t3_zp85eh,False,0.0,:Chargers: Chargers,2022-12-18T16:01:41Z,chargers,-0.4767
31324,169212,169212,acelyca,i’m glad we won but justin having his worst statistical game this season made me lose the first round of playoffs ):,-1.0,chargers,t3_zpd07k,False,0.0,17 forever,2022-12-18T18:33:14Z,chargers,-0.8898
31325,169214,169214,acelyca,"just got home from christmas shopping, whatd i miss?",2.0,chargers,t3_zp7gk8,False,0.0,17 forever,2022-12-18T15:47:30Z,chargers,-0.1531
32415,179920,179920,bac17,"I’ve always wanted to see that play happen. Just not against my team, ha, sick play.",17.0,nfl,t3_zp85eh,False,0.0,:Chargers: Chargers,2022-12-18T16:43:33Z,chargers,-0.0281499999999999
32416,179923,179923,bac17,Looked like a pretty clear touch on his helmet to me.,3.0,nfl,t3_zp85eh,False,0.0,:Chargers: Chargers,2022-12-18T15:51:21Z,chargers,0.8074
32417,179924,179924,bac17,It’s weird. But seems like it could be a good indicator of when the snap’s coming.,4.0,nfl,t3_zp85eh,False,0.0,:Chargers: Chargers,2022-12-18T15:50:23Z,chargers,0.353725
32418,179925,179925,bac17,Intentional Grounding on a free play. Incredible,11.0,nfl,t3_zp85eh,False,0.0,:Chargers: Chargers,2022-12-18T15:48:09Z,chargers,0.1727
32419,179926,179926,bac17,How does the NFL not have a chip in the ball like we’re seeing in the World Cup? That seems like basic technology at this point.,2.0,nfl,t3_zobc26,False,0.0,:Chargers: Chargers,2022-12-17T15:19:23Z,chargers,0.2709
32601,185992,185992,blackroseMD1,Sounds like JJ got the wind knocked out of him,2.0,nfl,t3_zobc26,False,0.0,:Chargers: Chargers,2022-12-17T13:17:38Z,chargers,0.6408
32981,190905,190905,boxxkicker,Yes,1.0,chargers,t3_zpd7t5,False,0.0,Deep in Donkey territory ,2022-12-19T07:28:45Z,chargers,0.4019
34063,197881,197881,clutterlustrott,"The lows are low,

But damn.....

The highs are high",7.0,chargers,t3_zqiihb,False,0.0,All My Homies Hate PFF,2022-12-20T11:51:20Z,chargers,-0.167625
34064,197884,197884,clutterlustrott,The alcohol working with the cold to simultaneously constrict and expand his veins to make him look normal,1.0,nfl,t3_zq9526,False,0.0,:Chargers: Chargers,2022-12-19T19:09:48Z,chargers,0.3182
34065,197887,197887,clutterlustrott,"Allen did catch one of those. 

Stupid refs",2.0,nfl,t3_zpdtef,False,0.0,:Chargers: Chargers,2022-12-19T02:26:43Z,chargers,-0.26335
34066,197889,197889,clutterlustrott,Eww. Thanks raiders,2.0,nfl,t3_zpd20c,False,0.0,:Chargers: Chargers,2022-12-18T18:45:17Z,chargers,0.2202
34067,197890,197890,clutterlustrott,The tits are the last fan base that should be making this joke,11.0,nfl,t3_zp85eh,False,0.0,:Chargers: Chargers,2022-12-18T16:45:14Z,chargers,0.4404
34068,197891,197891,clutterlustrott,"FUCK FUXK FUXK FUCJ

you right",3.0,chargers,t3_zp8bxz,False,0.0,All My Homies Hate PFF,2022-12-18T15:43:14Z,chargers,-0.6408
34069,197893,197893,clutterlustrott,"And remember, the sexiest thing in the world

Is consent",1.0,nfl,t3_zonesl,False,0.0,:Chargers: Chargers,2022-12-18T10:34:41Z,chargers,0.2263
34070,197895,197895,clutterlustrott,"Well, you'll be weirded out if you ever go to a SoFi game.

I've seen almost every team and even some Canadian and Australian jerseys",1.0,chargers,t3_zogowk,False,0.0,All My Homies Hate PFF,2022-12-18T10:28:35Z,chargers,0.0683
34071,197899,197899,clutterlustrott,Yeah the secret is that you spend upwards of $2g plus a year for 2 seats and don't do anything else for the rest of the year.,14.0,nfl,t3_zohp2m,False,0.0,:Chargers: Chargers,2022-12-17T17:44:30Z,chargers,0.296
34731,199117,199117,costopule,"I saw that Herbert was 2nd alternate on the Chargers sub and I was a bit mad. Then I came here and saw who was selected above him and now I’m just thankful he’s a high alternate. 

He’s getting his respect with that placement, there’s just that many guys in the AFC performing at a very high level right now, and they’re having better team success, so there’s no reason they shouldn’t be the top 3/4 for the Pro Bowl. 

The case for Herbert above them (mostly about he’s performing well individually in spite of both his own and the team’s injuries, and how his team and coaching is letting him down) isn’t a very convincing one for Pro Bowl voting. 

His excuses for not winning as much as other top QBs through his career and this season are completely valid (and sometimes ignored in discussions about Herbert) but you don’t make Pro Bowl off those excuses, you make the Pro Bowl off results at the end of the day. I’m glad he’s seen as top 5 QB in the AFC this year with the other guys in the conversation.",9.0,nfl,t3_zs7hhi,False,0.0,:Chargers: Chargers,2022-12-21T21:05:58Z,chargers,0.0913466799554183
