,Unnamed: 0.1,Unnamed: 0,author,body,score,subreddit,link_id,over_18,controversiality,author_flair_text,created_utc,flair,sentiment
39470,222975,222975,howmanyballs,"100%. 

I’m so happy to be where we are. 

However, I’m taking this shit one game at a time. 

That’s how all chargers fans should",33.0,chargers,t3_zpe8k9,False,0.0,#97,2022-12-18T20:46:59Z,chargers,-0.0306203125
39471,222977,222977,howmanyballs,"Last year and the beginning of the year were understandably rough for him. 

As I stated he’s doing well now.",13.0,nfl,t3_zpdtef,False,0.0,:Chargers: Chargers,2022-12-18T19:39:23Z,chargers,0.1366
39472,222978,222978,howmanyballs,"Yeah he’s coming along finally. 

I really like him",28.0,nfl,t3_zpdtef,False,0.0,:Chargers: Chargers,2022-12-18T19:30:23Z,chargers,0.2840499999999999
39473,222979,222979,howmanyballs,"Hurt. 

When Josh Palmer, Deandre Carter and Tre McKitty are your top 3 receiving threats for a bunch of games, bad things are gonna happen",104.0,nfl,t3_zpdtef,False,0.0,:Chargers: Chargers,2022-12-18T19:24:15Z,chargers,-0.466925
39474,222980,222980,howmanyballs,"I’m sorry? 

did you watch the offense against this anemic Titans defense? With more of their players dropping like flies? 

Offense was shit today. I’m allowed to call a spade a spade. If you don’t like it mute me lmao",8.0,chargers,t3_zpd07k,False,0.0,#97,2022-12-18T19:05:50Z,chargers,0.1222087362825788
39475,222981,222981,howmanyballs,"Best game as a charger. 


Needed it big time today",21.0,chargers,t3_zpcu09,False,0.0,#97,2022-12-18T18:36:45Z,chargers,0.159225
39476,222982,222982,howmanyballs,"100% 

I know the tits are beat up but god damn dude. Staley masterclass the past two weeks. 

Still fire Lombardi",77.0,chargers,t3_zpd07k,False,0.0,#97,2022-12-18T18:34:46Z,chargers,-0.1255222222222222
39477,222984,222984,howmanyballs,"Wow people took this poorly lmao 

Yeah Staley sucks, I know",1.0,nfl,t3_zorblm,False,0.0,:Chargers: Chargers,2022-12-18T13:23:34Z,chargers,0.8126
39478,222985,222985,howmanyballs,"Just waiting for that dolphins fans post saying “Josh Allen actually didn’t have a great game”

(Yes he did)",55.0,nfl,t3_zoru1p,False,0.0,:Chargers: Chargers,2022-12-18T00:24:30Z,chargers,0.7783
39479,222987,222987,howmanyballs,"God fucking so lucky. 

But I’ll take it",1.0,nfl,t3_zolfwt,False,0.0,:Chargers: Chargers,2022-12-17T22:22:58Z,chargers,0.16685
39480,222988,222988,howmanyballs,Pls tell me he got in,1.0,nfl,t3_zolfwt,False,0.0,:Chargers: Chargers,2022-12-17T22:20:26Z,chargers,0.0772
39481,222989,222989,howmanyballs,Fucking thank you KnOX,4.0,nfl,t3_zolfwt,False,0.0,:Chargers: Chargers,2022-12-17T22:17:27Z,chargers,0.4201
39482,222990,222990,howmanyballs,Lmfao josh must be watching a lot of the World Cup,5.0,nfl,t3_zolfwt,False,0.0,:Chargers: Chargers,2022-12-17T22:15:17Z,chargers,0.5423
39483,222991,222991,howmanyballs,There you go defense,1.0,nfl,t3_zolfwt,False,0.0,:Chargers: Chargers,2022-12-17T22:06:20Z,chargers,0.128
39484,222992,222992,howmanyballs,Lmfao cmon josh.,1.0,nfl,t3_zolfwt,False,0.0,:Chargers: Chargers,2022-12-17T22:04:04Z,chargers,0.5423
39485,222993,222993,howmanyballs,Gonna be hard to overturn it,3.0,nfl,t3_zolfwt,False,0.0,:Chargers: Chargers,2022-12-17T21:51:44Z,chargers,-0.1027
39486,222994,222994,howmanyballs,"Are you dense? 

For Tua and their offense you stupid mother fucker

Can’t even beat the dolphins. Loser ass team",1.0,nfl,t3_zolfwt,False,0.0,:Chargers: Chargers,2022-12-17T21:47:49Z,chargers,-0.3576999999999999
39487,222995,222995,howmanyballs,Bills were BANKING on the snow storm that never came lmfao,9.0,nfl,t3_zolfwt,False,0.0,:Chargers: Chargers,2022-12-17T21:44:23Z,chargers,-0.431
39488,222996,222996,howmanyballs,Is Tua obsessed with throwing the ball deep,1.0,nfl,t3_zolfwt,False,0.0,:Chargers: Chargers,2022-12-17T21:37:28Z,chargers,-0.1779
39489,222997,222997,howmanyballs,Lmao Leslie Frazier needs to be fired before the playoffs,0.0,nfl,t3_zolfwt,False,1.0,:Chargers: Chargers,2022-12-17T21:14:51Z,chargers,0.0772
39490,222998,222998,howmanyballs,"Was just talking to my buddies about this. 

Looks so fuckin funny",1.0,nfl,t3_zolfwt,False,0.0,:Chargers: Chargers,2022-12-17T21:05:25Z,chargers,0.26895
39491,222999,222999,howmanyballs,Jesus Christ  the time in the world LMFAO,4.0,nfl,t3_zolfwt,False,0.0,:Chargers: Chargers,2022-12-17T20:49:53Z,chargers,0.6408
39492,223000,223000,howmanyballs,"Broooo look at these pockets josh has lmao 

Justin was running for his LIFE",7.0,nfl,t3_zolfwt,False,0.0,:Chargers: Chargers,2022-12-17T20:38:28Z,chargers,0.5994
39493,223001,223001,howmanyballs,"So the bills just watched two weeks of 49ers and Chargers playing different defenses and stopping the dolphins and said “fuck it we are still going to do our thing”?? 

Interesting.",9.0,nfl,t3_zolfwt,False,0.0,:Chargers: Chargers,2022-12-17T20:29:25Z,chargers,0.2783
39494,223002,223002,howmanyballs,"Y’all need to stop wishing for this snow. 

My snowblower gave out in the 83” storm. 

I already shoveled today. So fuck off you cucks.",1.0,nfl,t3_zolfwt,False,0.0,:Chargers: Chargers,2022-12-17T19:29:36Z,chargers,-0.1465265624999999
39495,223003,223003,howmanyballs,"Why the fuck don’t the dolphins keep drunning it? 

“Oh we found something that works… stop doing it now”",3.0,nfl,t3_zolfwt,False,0.0,:Chargers: Chargers,2022-12-17T19:22:28Z,chargers,-0.283575
39496,223004,223004,howmanyballs,"Jesus this is going to make me sound like such a hater. 

I want to like Tua so bad. His supporters make it almost impossible",1.0,nfl,t3_zolfwt,False,0.0,:Chargers: Chargers,2022-12-17T18:54:01Z,chargers,0.1163407407407407
39497,223005,223005,howmanyballs,"Activated, but probably won’t play until rams/ broncos",3.0,chargers,t3_zogvq3,False,0.0,#97,2022-12-17T17:00:21Z,chargers,0.4767
39498,223006,223006,howmanyballs,Time to watch this amazing Gus Bradley prevent defense,1.0,nfl,t3_zobc26,False,0.0,:Chargers: Chargers,2022-12-17T15:30:18Z,chargers,0.7269
39499,223007,223007,howmanyballs,Falcons fans are beaming right now lmao,1.0,nfl,t3_zobc26,False,0.0,:Chargers: Chargers,2022-12-17T15:22:13Z,chargers,0.5994
39500,223008,223008,howmanyballs,Bro these refs FUCKED this team TWICE lol,21.0,nfl,t3_zobc26,False,0.0,:Chargers: Chargers,2022-12-17T15:11:25Z,chargers,-0.516
39501,223009,223009,howmanyballs,"Nah. That’s complete bullshit. 

Fuck these refs",1.0,nfl,t3_zobc26,False,0.0,:Chargers: Chargers,2022-12-17T15:03:45Z,chargers,-0.2496703703703703
39502,223010,223010,howmanyballs,Kirk why lmao,1.0,nfl,t3_zobc26,False,0.0,:Chargers: Chargers,2022-12-17T14:48:27Z,chargers,0.5994
39503,223011,223011,howmanyballs,"I know they’re getting healthy. 

I just don’t trust this team yet. Cant. Not yet.",19.0,chargers,t3_znpshj,False,0.0,#97,2022-12-16T16:16:55Z,chargers,0.009548046875
40196,224826,224826,i_run_from_problems,This so feels like a trap game,3.0,chargers,t3_zrucbb,False,0.0,Felipe Rios,2022-12-21T12:31:42Z,chargers,0.1226
40197,224835,224835,i_run_from_problems,Who's technically the home team when we play the rams?,2.0,chargers,t3_zqiihb,False,0.0,Felipe Rios,2022-12-20T16:29:04Z,chargers,0.34
40198,224836,224836,i_run_from_problems,Hey we've got the official NFL account posting in our sub now. Thats kinda cool.,128.0,chargers,t3_zr16er,False,0.0,Felipe Rios,2022-12-20T16:26:57Z,chargers,0.1258
40199,224840,224840,i_run_from_problems,"Yeah, agree with the run part about Drue. I think it was the Atlanta game he just got absolutely trucked at the goal line. Can laugh about it now because we won, but the man just got absolutely run over.",2.0,chargers,t3_zqzj1m,False,0.0,Felipe Rios,2022-12-20T16:06:05Z,chargers,0.2094148148148148
40200,224842,224842,i_run_from_problems,He has had 2 well coached games all year. I'm leaving my posts and comments,3.0,chargers,t3_zqx2n5,False,0.0,Felipe Rios,2022-12-20T15:57:46Z,chargers,0.0683
40201,224843,224843,i_run_from_problems,Lombardi should be fired regardless of how this season ends. Anything the offense achieves is despite him,17.0,chargers,t3_zqx2n5,False,0.0,Felipe Rios,2022-12-20T15:56:57Z,chargers,-0.26435
40202,224857,224857,i_run_from_problems,"I could be wrong, but I think the nfl has already used all of their flexes. Only get a few a year.",3.0,chargers,t3_zq0119,False,0.0,Felipe Rios,2022-12-19T13:12:52Z,chargers,-0.065425
40203,224858,224858,i_run_from_problems,He can chuck a strawberry through a battleship. Or whatever the fuck that one coach said,1.0,nfl,t3_zpdtef,False,0.0,:Chargers: Chargers,2022-12-19T12:44:53Z,chargers,-0.2776
40204,224859,224859,i_run_from_problems,"Honest question, are those seats any good? I feel like you wouldn't be able to see over the players. I ask because one time back at qualcomm I had first row seats right at the 50, directly behind the chargers bench, and couldn't see shit because football players are tall human beings",2.0,chargers,t3_zpezo8,False,0.0,Felipe Rios,2022-12-19T12:43:11Z,chargers,0.2156592592592593
40205,224861,224861,i_run_from_problems,Acho is probably crying in a car right now. Either that or dropped to his knees in a Wal Mart,2.0,nfl,t3_zpdcrc,False,0.0,:Chargers: Chargers,2022-12-19T12:37:00Z,chargers,-0.119175
40206,224865,224865,i_run_from_problems,"Don't get me wrong, I'm not complaining.


BUT HOW THE FUCK IS THIS TEAM ABLE TO CLINCH IN WEEK 16 WE'VE PLAYED LIKE ASS",18.0,chargers,t3_zpxgam,False,0.0,Felipe Rios,2022-12-19T11:51:58Z,chargers,-0.194325
40207,224868,224868,i_run_from_problems,A noble successor to philcember,30.0,chargers,t3_zpd07k,False,0.0,Felipe Rios,2022-12-18T18:40:13Z,chargers,0.5994
40208,224869,224869,i_run_from_problems,You didn't need to win there! You could've sent it to overtime! Absolute negative IQ play,50.0,chargers,t3_zpd07k,False,0.0,Felipe Rios,2022-12-18T18:33:21Z,chargers,-0.1253629629629629
40209,224870,224870,i_run_from_problems,#DICKER THE MOTHERFUCKING KICKER,286.0,chargers,t3_zpd07k,False,0.0,Felipe Rios,2022-12-18T18:31:47Z,chargers,-0.5859
40210,224871,224871,i_run_from_problems,....I don't like how this makes me feel,33.0,chargers,t3_zpcz5z,False,0.0,Felipe Rios,2022-12-18T18:30:47Z,chargers,-0.2755
40211,224872,224872,i_run_from_problems,#DICKER THE MOTHERFUCKING KICKER,117.0,chargers,t3_zpcwz6,False,0.0,Felipe Rios,2022-12-18T18:28:26Z,chargers,-0.5859
40212,224873,224873,i_run_from_problems,DICKER THE MOTHERFUCKING KICKER,1.0,chargers,t3_zp7gk8,False,0.0,Felipe Rios,2022-12-18T18:25:10Z,chargers,-0.5859
40213,224875,224875,i_run_from_problems,STALEY WTF,7.0,chargers,t3_zp7gk8,False,0.0,Felipe Rios,2022-12-18T18:16:50Z,chargers,-0.5859
40214,224876,224876,i_run_from_problems,So we're arguing amongst ourselves now? Grreeeeeaaaaaattt,2.0,chargers,t3_zp7gk8,False,0.0,Felipe Rios,2022-12-18T18:06:05Z,chargers,-0.12675
40215,224877,224877,i_run_from_problems,This is getting ridiculous with the Tennessee injuries. Incredibly bad luck,4.0,chargers,t3_zp7gk8,False,0.0,Felipe Rios,2022-12-18T17:56:36Z,chargers,-0.15615
40216,224878,224878,i_run_from_problems,What a punt.... wow,3.0,chargers,t3_zp7gk8,False,0.0,Felipe Rios,2022-12-18T17:55:14Z,chargers,0.5859
40217,224881,224881,i_run_from_problems,Why do we abandon the pass the moment we get into the rz,2.0,chargers,t3_zp7gk8,False,0.0,Felipe Rios,2022-12-18T17:45:30Z,chargers,-0.4404
40218,224882,224882,i_run_from_problems,"2 sacks... you all know what that means....

FREE BIG MACS ON THE MCDONALD'S APP TOMORROW BAYBEEEEEEEEEE",4.0,chargers,t3_zp7gk8,False,0.0,Felipe Rios,2022-12-18T17:40:12Z,chargers,0.6166
40219,224885,224885,i_run_from_problems,SCHEME SOMEONE OPEN HOLY SHIT LOMBARDI,3.0,chargers,t3_zp7gk8,False,0.0,Felipe Rios,2022-12-18T17:33:15Z,chargers,-0.5574
40220,224886,224886,i_run_from_problems,"Honest question, when was our last 3rd quarter touchdown? Does anyone actually know?",2.0,chargers,t3_zp7gk8,False,0.0,Felipe Rios,2022-12-18T17:29:34Z,chargers,0.12765
40221,224887,224887,i_run_from_problems,DONT YOU PUT THAT EVIL ON ME RICKY BOBBY,2.0,chargers,t3_zp7gk8,False,0.0,Felipe Rios,2022-12-18T17:28:39Z,chargers,-0.6597
40222,224888,224888,i_run_from_problems,"We always play at the level of our opponent. If we play a 1-11 team, we'll play like a 1-11 team. If we play a 10-2 team, we'll play like a 10-2 team. Truly mind boggling",6.0,chargers,t3_zp7gk8,False,0.0,Felipe Rios,2022-12-18T17:27:08Z,chargers,0.169475
40223,224891,224891,i_run_from_problems,Honestly you never can tell in this sub,1.0,chargers,t3_zp7gk8,False,0.0,Felipe Rios,2022-12-18T17:19:34Z,chargers,0.4588
40224,224893,224893,i_run_from_problems,"OK NAS, OK",5.0,chargers,t3_zp7gk8,False,0.0,Felipe Rios,2022-12-18T17:17:05Z,chargers,0.5267
40225,224895,224895,i_run_from_problems,Also... I feel like the worst job in the chargers organization has to be the guy that switches the lettering on the helmets to match the colors of the unis that week. Has to be the most monotonous job ever.,6.0,chargers,t3_zp7gk8,False,0.0,Felipe Rios,2022-12-18T17:12:39Z,chargers,-0.0424222222222222
40226,224896,224896,i_run_from_problems,Yep. Buck stops with the HC,1.0,chargers,t3_zp7gk8,False,0.0,Felipe Rios,2022-12-18T17:08:11Z,chargers,-0.00255
40227,224897,224897,i_run_from_problems,Pretty sure its allowed. I think Newton did it for years,1.0,chargers,t3_zp7gk8,False,0.0,Felipe Rios,2022-12-18T17:07:03Z,chargers,0.167625
40228,224898,224898,i_run_from_problems,Why are you not running Derrick Henry against us? That makes no sense at all.,8.0,chargers,t3_zp7gk8,False,0.0,Felipe Rios,2022-12-18T17:05:32Z,chargers,-0.148
40229,224899,224899,i_run_from_problems,It doesn't surprise me in the slightest that herbert is the most sacked qb. Our O-Line is a sieve made of Swiss cheese,6.0,chargers,t3_zp7gk8,False,0.0,Felipe Rios,2022-12-18T17:01:09Z,chargers,-0.051425
40230,224901,224901,i_run_from_problems,"In the last drive, sure. But why does it take a 2 minute drill for him to throw the ball?",1.0,chargers,t3_zp7gk8,False,0.0,Felipe Rios,2022-12-18T16:54:36Z,chargers,0.07955
40231,224904,224904,i_run_from_problems,"Joe Lombardi is a football terrorist and Brandon Staley cannot manage a clock to save his life. Also, why the fuck did we not challenge what was 100% a catch by allen",7.0,chargers,t3_zp7gk8,False,0.0,Felipe Rios,2022-12-18T16:46:27Z,chargers,-0.3777999999999999
40232,224905,224905,i_run_from_problems,Credit where its due thats a good defensive play,6.0,chargers,t3_zp7gk8,False,0.0,Felipe Rios,2022-12-18T16:40:57Z,chargers,0.7906
40233,224907,224907,i_run_from_problems,What good do 3 yard hooks do us!? This playcalling is atrocious,5.0,chargers,t3_zp7gk8,False,0.0,Felipe Rios,2022-12-18T16:39:43Z,chargers,0.12315
40234,224908,224908,i_run_from_problems,Odd time for the second timeout. Could've spiked it. Save the timeout to rush the fg unit on,7.0,chargers,t3_zp7gk8,False,0.0,Felipe Rios,2022-12-18T16:38:46Z,chargers,0.1528481481481481
40235,224910,224910,i_run_from_problems,Broncos and Rams on national TV? What the fuck Goodell?,8.0,chargers,t3_zp7gk8,False,0.0,Felipe Rios,2022-12-18T16:34:30Z,chargers,-0.27115
40236,224913,224913,i_run_from_problems,CHALLENGE IT YOU ASSHAT. HE WAS ALREADY DOWN,5.0,chargers,t3_zp7gk8,False,0.0,Felipe Rios,2022-12-18T16:22:13Z,chargers,0.0193
40237,224916,224916,i_run_from_problems,Wtf is this commercial,6.0,chargers,t3_zp7gk8,False,0.0,Felipe Rios,2022-12-18T16:01:51Z,chargers,-0.5859
40238,224917,224917,i_run_from_problems,Special teams almost living up to their name again right there,8.0,chargers,t3_zp7gk8,False,0.0,Felipe Rios,2022-12-18T15:57:41Z,chargers,0.4019
40239,224918,224918,i_run_from_problems,Tennessee is the worst passing defense in the league. We should be throwing all day.,5.0,chargers,t3_zp7gk8,False,0.0,Felipe Rios,2022-12-18T15:45:08Z,chargers,-0.13935
40240,224919,224919,i_run_from_problems,"4 straight runs up the gut with Kelley is asking for trouble. Also, tennessee is the worst passing defense in the league. Throw the ball.",1.0,chargers,t3_zp7gk8,False,0.0,Felipe Rios,2022-12-18T15:43:36Z,chargers,-0.0694259259259259
40241,224920,224920,i_run_from_problems,"Good result, but I still hate the playcalling",0.0,chargers,t3_zp7gk8,False,0.0,Felipe Rios,2022-12-18T15:41:41Z,chargers,-0.6249
40242,224922,224922,i_run_from_problems,"True, true.",1.0,chargers,t3_zp7gk8,False,0.0,Felipe Rios,2022-12-18T15:39:30Z,chargers,0.6808
40243,224924,224924,i_run_from_problems,I have no idea why that image of tannehill looking through the tent is funny to me,8.0,chargers,t3_zp7gk8,False,0.0,Felipe Rios,2022-12-18T15:36:09Z,chargers,0.1779
40244,224925,224925,i_run_from_problems,A noble sacrifice,2.0,chargers,t3_zp7gk8,False,0.0,Felipe Rios,2022-12-18T15:34:19Z,chargers,0.4588
40245,224926,224926,i_run_from_problems,Yeah you're right. For whatever reason I had them confused,1.0,chargers,t3_zp7gk8,False,0.0,Felipe Rios,2022-12-18T15:32:31Z,chargers,-0.0851
40246,224928,224928,i_run_from_problems,Flag already? Wow,2.0,chargers,t3_zp7gk8,False,0.0,Felipe Rios,2022-12-18T15:26:34Z,chargers,0.29295
40247,224929,224929,i_run_from_problems,I'm just gonna say it... that reporter is FINE,1.0,chargers,t3_zp7gk8,False,0.0,Felipe Rios,2022-12-18T15:26:02Z,chargers,0.368
40248,224933,224933,i_run_from_problems,"So let me get this straight... against maybe a top 10 defense, miami decides to run all night. Yet against the chargers, who have maybe the worst run defense in the league, you refuse to run the ball? Make that make sense",6.0,nfl,t3_zolfwt,False,0.0,:Chargers: Chargers,2022-12-17T20:29:19Z,chargers,-0.0581555555555555
40249,224935,224935,i_run_from_problems,Nah this isn't Estadio Azteca,1.0,nfl,t3_zolfwt,False,0.0,:Chargers: Chargers,2022-12-17T20:25:22Z,chargers,-0.1027
40250,224937,224937,i_run_from_problems,So the snowballs are going to stop for what.... 5 minutes? No way it holds,2.0,nfl,t3_zolfwt,False,0.0,:Chargers: Chargers,2022-12-17T20:19:46Z,chargers,-0.2219999999999999
40251,224942,224942,i_run_from_problems,I still don't think the vikings are that good,1.0,nfl,t3_zohp2m,False,0.0,:Chargers: Chargers,2022-12-17T16:09:03Z,chargers,0.4404
40252,224943,224943,i_run_from_problems,I still don't think the vikings are that good,4.0,nfl,t3_zobc26,False,0.0,:Chargers: Chargers,2022-12-17T16:03:02Z,chargers,0.4404
40253,224944,224944,i_run_from_problems,Odd reference,5.0,nfl,t3_zobc26,False,0.0,:Chargers: Chargers,2022-12-17T15:59:41Z,chargers,-0.3182
40254,224945,224945,i_run_from_problems,C'mon.... tie the damn thing,3.0,nfl,t3_zobc26,False,0.0,:Chargers: Chargers,2022-12-17T15:59:27Z,chargers,-0.4019
40255,224946,224946,i_run_from_problems,Nothing quite like the nationally televised tie,7.0,nfl,t3_zobc26,False,0.0,:Chargers: Chargers,2022-12-17T15:54:33Z,chargers,-0.3241
40256,224950,224950,i_run_from_problems,"Can't faut Saturday there. Good play call, horrible spot.",1.0,nfl,t3_zobc26,False,0.0,:Chargers: Chargers,2022-12-17T15:19:49Z,chargers,0.10115
41884,235039,235039,kyleheinitz,You guys couldve picked herbert but dont worry. Well probably waste his career like every other great player weve had,128.0,nfl,t3_zonesl,False,0.0,:Chargers: Chargers,2022-12-17T21:12:03Z,chargers,0.47435
41885,235040,235040,kyleheinitz,They probably have a stronger arm than Tua,207.0,nfl,t3_zonesl,False,0.0,:Chargers: Chargers,2022-12-17T20:45:16Z,chargers,0.3818
41934,236748,236748,lusair,Wait what? As someone from Southern California this is a struggle I knew nothing about. The fact that you can pay hundreds to go sit in a plastic seat and watch a game and you show up to a pile of snow blows my sunny peanut mind.,0.0,nfl,t3_zs5wpf,False,1.0,:Chargers: Chargers,2022-12-21T18:07:44Z,chargers,0.0779777777777778
42054,237884,237884,mattisafriend,"If it’s broadcast footage from the 80s/90s it’ll be bad because it was on tape, if it’s NFL Films (which is what this looks like to me) it’ll be film and will look primo",8.0,nfl,t3_zqcdmf,False,0.0,:Chargers: Chargers,2022-12-20T00:34:56Z,chargers,-0.25
42055,237886,237886,mattisafriend,"No you’re not wrong there was a good amount in the mid 2000s with Steve Foley, Shawne Merriman, Vincent Jackson, Shaun Phillips all getting into various amounts of trouble",5.0,nfl,t3_zq30fh,False,0.0,:Chargers: Chargers,2022-12-19T15:22:18Z,chargers,0.1416
42056,237888,237888,mattisafriend,What are you going to play first?,3.0,nfl,t3_zptu0s,False,0.0,:Chargers: Chargers,2022-12-19T11:58:56Z,chargers,0.34
42057,237889,237889,mattisafriend,"I’ve been there, Sack. I was on all the apps for years and several times I was in your situation where things were going very well and then she gave me the news she wasn’t over her ex or some other reason. All I can say is stick with it, you’ll find someone there or IRL that’s your match.",2.0,nfl,t3_zptu0s,False,0.0,:Chargers: Chargers,2022-12-19T11:50:50Z,chargers,0.0376
42058,237890,237890,mattisafriend,Oh and I forgot they were playing the Good Vibrations song when they showed Mark in his suite,7.0,nfl,t3_zptu0s,False,0.0,:Chargers: Chargers,2022-12-19T09:27:41Z,chargers,0.5719
42059,237891,237891,mattisafriend,"So I was at yesterday’s crazy Pats/Raiders game. Wife is a Pats fan so we made the trip. I obviously don’t like either team but good lord that result has me feeling many different emotions.

Also, they showed a few celebs at Allegiant yesterday. Highlights being Mark Wahlberg and Frank Shamrock, but Shamrock was literally walking away so they pulled the camera and he didn’t even wave or anything",9.0,nfl,t3_zptu0s,False,0.0,:Chargers: Chargers,2022-12-19T09:21:01Z,chargers,0.00637552
42340,241354,241354,miquiztli8,"I know this would never happen, but if the team was to trade Bosa, what would be a reasonable asking price? He’s hurt a lot but when he does plays, he’s a game changer.",1.0,chargers,t3_zqiihb,False,0.0,Brandon “Dead Man Walking” Staley ,2022-12-21T12:45:53Z,chargers,0.0386
42341,241355,241355,miquiztli8,"I think the Jags will beat the Jets tomorrow, the Bengals should beat the Pats, and hoping for an early Christmas gift if Steelers can beat the Raiders on the 24th…after that, Chargers just need to take care of business.",2.0,chargers,t3_zrfc3k,False,0.0,Brandon “Dead Man Walking” Staley ,2022-12-21T03:43:54Z,chargers,0.836
42342,241356,241356,miquiztli8,"Lol it’s all good bro, I’m just goofing around 😂",9.0,chargers,t3_zqfe6g,False,0.0,Brandon “Dead Man Walking” Staley ,2022-12-20T00:34:14Z,chargers,0.8225
42343,241357,241357,miquiztli8,"Lmao so now we have to come out with peer reviewed statistical analyses in order criticize underperforming coaches whom 99% of our fanbase, other fanbases, media, and analysts see as a failure?…ok then lol",28.0,chargers,t3_zqfe6g,False,0.0,Brandon “Dead Man Walking” Staley ,2022-12-20T00:02:47Z,chargers,0.6249
42344,241358,241358,miquiztli8,"I wish I could upvote this 1000 times🔥…Staley is ok, Lombardi is an absolute disaster",19.0,chargers,t3_zqfe6g,False,0.0,Brandon “Dead Man Walking” Staley ,2022-12-19T23:48:00Z,chargers,-0.34
42345,241359,241359,miquiztli8,It appears that we’ve identified one of the few remaining Lombardo stans in the sub lmao,35.0,chargers,t3_zqfe6g,False,0.0,Brandon “Dead Man Walking” Staley ,2022-12-19T23:36:39Z,chargers,0.5994
42346,241360,241360,miquiztli8,Yeah he’s definitely smug and I can see how he can come off abrasive to non-Chiefs fans,2.0,chargers,t3_zpx1pw,False,0.0,Brandon “Dead Man Walking” Staley ,2022-12-19T13:23:58Z,chargers,0.6908
42347,241361,241361,miquiztli8,"Nick Wright is actually pretty chill, he’s constantly giving the Chargers and Herbert props",4.0,chargers,t3_zpx1pw,False,0.0,Brandon “Dead Man Walking” Staley ,2022-12-19T12:29:35Z,chargers,0.6808
42348,241362,241362,miquiztli8,"I totally get that. Zion has not been what everyone expected and Feiler is definitely washed, but Lombardi should be able to come up with more creative ways to scheme our skill players open and/or have Justin roll out of the pocket to buy extra time. Our o-line under Steichen was just as bad, if not worse and he was able to design a way more explosive and creative passing offense. If we get bounced in the first round of the playoffs, it’ll most likely be bc of Lombardi’s trash play-calls and I hope management does the right thing and fires his ass.",15.0,chargers,t3_zpi4eh,False,0.0,Brandon “Dead Man Walking” Staley ,2022-12-18T23:51:41Z,chargers,-0.023359375
42349,241364,241364,miquiztli8,"I mean the year we had Shane Steichen as our OC it seemed like Herbert was dropping bombs and airing it out every game, and our offensive line was the worst in the league if I remember correctly. A good OC should be able to scheme players open regardless of how bad the o-line is or limited the skill players are. Joe Lombardi has shown us time and time again that he is not creative whatsoever and doesn’t know how to do that.",12.0,nfl,t3_zpdtef,False,0.0,:Chargers: Chargers,2022-12-18T20:52:06Z,chargers,-0.1790814814814814
42350,241365,241365,miquiztli8,Tbf we had all of our weapons today and Lombardi still managed to make the offense look like absolute dog shit.,91.0,nfl,t3_zpdtef,False,0.0,:Chargers: Chargers,2022-12-18T19:59:41Z,chargers,-0.7184
42351,241366,241366,miquiztli8,"Yeah as much as I want the team to win it all…I’m a realist, and there’s no way they win a SB with Lombardi calling plays on offense. We won’t be able to keep up with teams like the Bills, Chiefs and Bengals, especially in the playoffs.",3.0,chargers,t3_zpd07k,False,0.0,Brandon “Dead Man Walking” Staley ,2022-12-18T19:56:36Z,chargers,0.3896
42352,241367,241367,miquiztli8,Even if we make the playoffs does anyone’s else think Lombardi is still gonna get canned? He sucks so fucking bad,22.0,chargers,t3_zpd07k,False,0.0,Brandon “Dead Man Walking” Staley ,2022-12-18T18:54:04Z,chargers,-0.3815
