,Unnamed: 0.1,Unnamed: 0,author,body,score,subreddit,link_id,over_18,controversiality,author_flair_text,created_utc,flair,sentiment
8442,77520,77520,HammyFresh,"It was not a fumble by rule at the time. And you’re wrong: 

The tuck rule was enforced in a regular season game on October 9, 2005, between the Washington Redskins and the Denver Broncos. Broncos quarterback Jake Plummer lost the football while in the Broncos' own end zone.
https://en.m.wikipedia.org › wiki
Tuck rule (American football) - Wikipedia",3.0,nfl,t3_zpe9kg,False,0.0,:Patriots: Patriots :Patriots: Patriots,2022-12-18T22:15:16Z,patriots,-0.0273359374999999
8443,77521,77521,HammyFresh,"It's controversial to you, not to most. At the time the referees enforced the rule as it was written. They also enforced it that way earlier in the season on another play. It was a bad rule and the competition committee fixed it. That's like saying that the formations the Pats used against the Ravens from 2014 SB run were controversial when they were perfectly legal at the time. Exploiting a bad rule isn't the same as blatantly getting cheated by the NFL and league officials like what we just saw today.",10.0,nfl,t3_zpe9kg,False,0.0,:Patriots: Patriots :Patriots: Patriots,2022-12-18T20:08:37Z,patriots,-0.1150693051268861
8444,77522,77522,HammyFresh,"Was a rule. A bad one, but a rule. This was robbery.",28.0,nfl,t3_zpe9kg,False,0.0,:Patriots: Patriots :Patriots: Patriots,2022-12-18T20:01:39Z,patriots,-0.0341222222222222
8445,77524,77524,HammyFresh,Epstein killed himself.,1.0,nfl,t3_zpe9kg,False,0.0,:Patriots: Patriots :Patriots: Patriots,2022-12-18T19:53:27Z,patriots,-0.6705
8446,77525,77525,HammyFresh,Most fans are willing to stretch the truth a bit but this one is so obvious Ray Charles could see it.,49.0,nfl,t3_zpe9kg,False,0.0,:Patriots: Patriots :Patriots: Patriots,2022-12-18T19:52:45Z,patriots,0.1655
8447,77526,77526,HammyFresh,"It'll be buried under the ending of the game, but this is fucking egregious. Outside of the Rams/Saints no-call PI in the NFC Championship Game from a few years ago, I can't think of a bigger robbery than what we just witnessed. Just how blatantly obvious it was. If the correct call is made the Raiders have 30 seconds, no timeouts, from the 30 yard line and it's 3rd down. The probability that we win the game is extremely high. They can shove this report up their ass sideways.",24.0,nfl,t3_zpe9kg,False,1.0,:Patriots: Patriots :Patriots: Patriots,2022-12-18T19:51:37Z,patriots,-0.0755260288065843
8448,77527,77527,HammyFresh,"Given what happened with the Pats blowing it, nobody is going to remember this play or even see my comment on this but I gotta say it.

Outside of the blatant no PI call from the Rams/Saints NFC Championship Game four years ago, I can't recall a more impactful obviously incorrect call changing a game. The NFL should be fucking ashamed that they have the benefit of replay and that call stands. Absolute dogshit and fucking embarrassing.",0.0,nfl,t3_zpcra6,False,1.0,:Patriots: Patriots :Patriots: Patriots,2022-12-18T19:42:49Z,patriots,-0.1242359375
8449,77529,77529,HammyFresh,"That’s not how stats work. You’re over here merging two completely different stats that don’t take into account a variety of factors that would affect outcomes. Do those stats take into account how often a TE or RB has to stay in to block due to the weak Oline? Do those stats only take into account throws of more than 10 yards down the field? They don’t. If you think we have a good pass blocking offensive line taking into account the entire 14 games we’ve played, you’re either delusional or haven’t been watching.",1.0,patriots,t3_zp6z4w,False,0.0,MAC JONES BAYBAY,2022-12-18T18:42:48Z,patriots,-0.0134070216049382
8450,77530,77530,HammyFresh,I’m going to drive into the nearest lake after chaining myself to the seat. What the fuck was that,21.0,patriots,t3_zpcwgl,False,0.0,MAC JONES BAYBAY,2022-12-18T18:29:56Z,patriots,-0.27115
8451,77531,77531,HammyFresh,You point blank pulled a “fact” out of your ass to fit your narrative.,1.0,patriots,t3_zp6z4w,False,0.0,MAC JONES BAYBAY,2022-12-18T18:22:10Z,patriots,-0.25
8452,77532,77532,HammyFresh,Rigged. I don’t give a fuck what anyone says. That is clearly out of fucking bounds.,9.0,patriots,t3_zp6z4w,False,0.0,MAC JONES BAYBAY,2022-12-18T18:20:12Z,patriots,0.0603333333333333
8453,77533,77533,HammyFresh,I appreciate you illustrating that you’re completely full of shit. I’ve watched every snap of every game. If you think Mac has gotten time for routes to develop you’ve not been watching.,1.0,patriots,t3_zp6z4w,False,0.0,MAC JONES BAYBAY,2022-12-18T18:11:44Z,patriots,-0.0106592592592592
8454,77534,77534,HammyFresh,Share the source,1.0,patriots,t3_zp6z4w,False,0.0,MAC JONES BAYBAY,2022-12-18T17:33:51Z,patriots,0.296
8455,77535,77535,HammyFresh,You’re going off PFF ratings which accounts for far more than how much time a QB has to throw. Anyone who has actually watched the team knows that Mac has gotten pressured at high rates when it’s not a quick pass.,1.0,patriots,t3_zp6z4w,False,0.0,MAC JONES BAYBAY,2022-12-18T17:32:18Z,patriots,-0.11315
8456,77537,77537,HammyFresh,"I don’t give a shit what superficial rating they are given, they are shit.",1.0,patriots,t3_zp6z4w,False,0.0,MAC JONES BAYBAY,2022-12-18T17:02:26Z,patriots,-0.802
8457,77538,77538,HammyFresh,“Don’t rely on Mac Jones”. Vilma is a fucking moron. Anyone with a brain that hasn’t turned to mush knows the issues are on the staff and play of the OLINE. Morons.,3.0,patriots,t3_zp6z4w,False,0.0,MAC JONES BAYBAY,2022-12-18T16:59:18Z,patriots,-0.0667578125
8458,77539,77539,HammyFresh,FUCK YEAH,2.0,patriots,t3_zp6z4w,False,0.0,MAC JONES BAYBAY,2022-12-18T16:56:09Z,patriots,-0.3182
8459,77540,77540,HammyFresh,"If Vilma could shut the fuck up, that’d be great. Who hired this idiot for commentary?!",9.0,patriots,t3_zp6z4w,False,0.0,MAC JONES BAYBAY,2022-12-18T16:32:40Z,patriots,-0.0605518518518518
8460,77541,77541,HammyFresh,How are we on week 14 and still dealing with bullshit like this. It’s basic offensive football.,3.0,patriots,t3_zp6z4w,False,0.0,MAC JONES BAYBAY,2022-12-18T16:23:06Z,patriots,-0.30895
8461,77544,77544,HammyFresh,10 days of rest versus 6 days of rest after an away game. Seems fair.,2.0,patriots,t3_zp6z4w,False,0.0,MAC JONES BAYBAY,2022-12-18T15:05:39Z,patriots,0.1591
8462,77547,77547,HammyFresh,Holy shit. Matt Ryan in shambles.,2.0,nfl,t3_zohlfp,False,0.0,:Patriots: Patriots :Patriots: Patriots,2022-12-17T16:06:10Z,patriots,-0.13935
8463,77549,77549,HammyFresh,I watched them twice this year. They haven’t won a game when I’ve watched so they suck balls.,6.0,nfl,t3_znhge3,False,0.0,:Patriots: Patriots :Patriots: Patriots,2022-12-16T14:08:03Z,patriots,0.06675
8831,80533,80533,Hulk1Gamer,"Best has to be Judon, but Rhamondre Stevenson is close behind him, he leads our team in receptions and rushing, and is the only reason we have anything going on offense. Most underrated is Kyle Dugger, that dude is a beast of a safety and gets almost no recognition",1.0,nfl,t3_zpu5ca,False,0.0,:Patriots: Patriots :49ers: 49ers,2022-12-19T21:17:19Z,patriots,0.1188
9318,86369,86369,Inamanlyfashion,">Also, it's funny you say 'if he was given a full 2 seasons'....HE WAS. And the 2nd year he was so bad that he got benched multiple times and offered up for trade and not a single team in the league saw enough of value to offer more than a conditional 6th.

Yes but also we all know teams are idiots. 

The Panthers paid a second, a fourth, and a sixth that same offseason for Darnold. 

I'd take Minshew over Darnold any day.",4.0,nfl,t3_zr0rb4,False,0.0,:Patriots: Patriots,2022-12-20T18:32:57Z,patriots,0.001095968
9319,86370,86370,Inamanlyfashion,Last couple drafts have been mostly pretty good so maybe he actually had some effect there.,8.0,nfl,t3_zr1tqd,False,0.0,:Patriots: Patriots,2022-12-20T18:21:00Z,patriots,0.7269
9320,86382,86382,Inamanlyfashion,"I'm almost equally furious with that first field goal. 

What the fuck were they doing. Go out to the one yard line with *that* package and then burn two timeouts in like 3 seconds.",3.0,nfl,t3_zptu0s,False,0.0,:Patriots: Patriots,2022-12-19T10:38:25Z,patriots,0.0405074074074074
9321,86383,86383,Inamanlyfashion,No need to curse someone out just for being right.,27.0,nfl,t3_zpe9kg,False,0.0,:Patriots: Patriots,2022-12-18T20:11:08Z,patriots,-0.6908
9322,86384,86384,Inamanlyfashion,What the fucking shit was he thinking,5.0,nfl,t3_zop0n6,False,0.0,:Patriots: Patriots,2022-12-17T21:44:49Z,patriots,-0.5984
9323,86385,86385,Inamanlyfashion,"Bruh I've been driving on a long road trip and I just checked the score. 

Um. What the fuck?",9.0,nfl,t3_zobc26,False,0.0,:Patriots: Patriots,2022-12-17T13:23:26Z,patriots,-0.1807666666666666
9324,86388,86388,Inamanlyfashion,"There's a pizza shop in East Boston, everyone says two things about it:

1) It's almost certainly a mob front

2) It's objectively among the best pizza in the city",15.0,nfl,t3_znvjlb,False,0.0,:Patriots: Patriots,2022-12-16T20:19:19Z,patriots,0.7436
9325,86389,86389,Inamanlyfashion,"Dude shoves his hand into the pasta water?

Ow. And ew.",5.0,nfl,t3_znvjlb,False,0.0,:Patriots: Patriots,2022-12-16T20:17:05Z,patriots,0.0182925925925925
9564,87403,87403,InheritTheWind,Boy they sure must be feeling _deflated!_,-16.0,nfl,t3_zohncl,False,0.0,:Patriots: Patriots,2022-12-17T16:09:32Z,patriots,0.4753
9565,87404,87404,InheritTheWind,BILL COWHER INNOCENT!,1.0,nfl,t3_zohli2,False,0.0,:Patriots: Patriots,2022-12-17T16:06:32Z,patriots,0.4003
9610,88347,88347,Isaythree,"Likewise, except for the dearly beloved part",123.0,nfl,t3_znq92k,False,0.0,:Patriots: Patriots,2022-12-16T15:58:12Z,patriots,0.7269
9706,91379,91379,JAK2222,We have an OC that’s calling in his Taco Bell order instead of a play.,1.0,nfl,t3_zpd20c,False,0.0,:Patriots: Patriots,2022-12-18T19:04:00Z,patriots,0.34
10954,108583,108583,Lord_Burgess,If I apologise for the shutout we gave you does that mean y'all will beat the jets? Cause that would be sweet,1.0,nfl,t3_zp30dp,False,0.0,:Patriots: Patriots,2022-12-18T12:33:01Z,patriots,0.3248499999999999
10955,108584,108584,Lord_Burgess,Bears out there thinking that the forward pass is still illegal,7.0,nfl,t3_zp30dp,False,0.0,:Patriots: Patriots,2022-12-18T12:30:24Z,patriots,-0.5574
10956,108585,108585,Lord_Burgess,Gotta be better than Wilson though,2.0,nfl,t3_zp30dp,False,0.0,:Patriots: Patriots,2022-12-18T12:28:54Z,patriots,0.4404
10957,108586,108586,Lord_Burgess,So why arent the jets playing Flacco?,2.0,nfl,t3_zp30dp,False,0.0,:Patriots: Patriots,2022-12-18T12:27:12Z,patriots,-0.1511
10958,108587,108587,Lord_Burgess,Wait were Dalton and Hill both on the field there? They said it was from Hill but the camera cut to dalton?,6.0,nfl,t3_zp30dp,False,0.0,:Patriots: Patriots,2022-12-18T12:24:00Z,patriots,-0.19595
10959,108601,108601,Lord_Burgess,"Just to let you know mods but you have the box score wrong, need to flip it",4.0,nfl,t3_zobc26,False,0.0,:Patriots: Patriots,2022-12-17T13:36:51Z,patriots,-0.631
11930,112888,112888,LukeyMagukey,Notable and Tua don’t go well together,1.0,nfl,t3_zs7o2o,False,0.0,:Patriots: Patriots,2022-12-21T23:02:14Z,patriots,0.2732
11931,112892,112892,LukeyMagukey,"Hm seems like a controversial post lmao, any arguments or disagreements here? I’d like to know!",0.0,patriots,t3_zr6hw2,False,0.0,:3-28:,2022-12-20T23:50:19Z,patriots,0.2164
11932,112895,112895,LukeyMagukey,Conference* my bad,3.0,patriots,t3_zr6hw2,False,0.0,:3-28:,2022-12-20T19:36:36Z,patriots,-0.5423
11933,112901,112901,LukeyMagukey,"
That was bill who called the timeouts… but yes, fire Patricia",1.0,patriots,t3_zp9grh,False,0.0,:3-28:,2022-12-19T15:29:58Z,patriots,0.1154
11980,113135,113135,MFreak,"He has and he won't be cut, but he's a free agent and at the end of the year we were already expecting to not re-sign him. This clinches that feeling now",7.0,nfl,t3_zpdefy,False,0.0,:Patriots: Patriots,2022-12-18T19:06:42Z,patriots,0.2404
11981,113137,113137,MFreak,"They traded a 2nd, which is less than what Wentz went for, and they made a SB with him.

Jimmy is a legit good QB. He's not elite in the slightest, but he's better than what Ballard has provided these past 5 years",2.0,colts,t3_znfjo2,False,0.0,Andrew Luck,2022-12-16T12:19:47Z,patriots,0.2465
12516,116126,116126,Mattyi,"Only one QB has led his team to 2 SB wins and missed the HoF, and that's because it's Jim Plunkett.

Like it or not, that [goddamn mouth-breathing dummy](https://www.youtube.com/watch?v=bicRZ805fzc&t=14s) deserves to be in there.  You can't tell the story of the NFL without him.",7.0,nfl,t3_zrp4p0,False,0.0,:Patriots: Patriots,2022-12-21T12:49:20Z,patriots,0.0821777777777777
13082,120414,120414,Moss81-,CMC is dope as shit. I have no other words. Goodnight fellas.,2.0,nfl,t3_zn5uoy,False,0.0,:Patriots: Patriots,2022-12-16T00:23:04Z,patriots,-0.0535333333333333
13367,122263,122263,Mulligan0816,You’re actually fuckin kidding,6.0,nfl,t3_zp30dp,False,0.0,:Patriots: Patriots,2022-12-18T18:27:30Z,patriots,0.1761
13368,122265,122265,Mulligan0816,Patricia sucks,5.0,nfl,t3_zp30dp,False,0.0,:Patriots: Patriots,2022-12-18T15:52:26Z,patriots,-0.3612
13369,122266,122266,Mulligan0816,Guys shut up about Mac he’s perfect he can do no wrong,6.0,nfl,t3_zp30dp,False,0.0,:Patriots: Patriots,2022-12-18T15:48:38Z,patriots,0.7394
13370,122267,122267,Mulligan0816,"BRUH LMAO

You act like the Chiefs weren’t the basement of the league before Mahomes and Reid….

What 😂",0.0,nfl,t3_zp30dp,False,0.0,:Patriots: Patriots,2022-12-18T15:30:22Z,patriots,0.419775
13371,122268,122268,Mulligan0816,Congrats. They only won two of them.,-1.0,nfl,t3_zp30dp,False,0.0,:Patriots: Patriots,2022-12-18T15:26:44Z,patriots,0.4176249999999999
13372,122269,122269,Mulligan0816,"Lmao of course the Chiefs win in overtime to a 1-11-1 team lul

“Juggernaut” huh?",-5.0,nfl,t3_zp30dp,False,1.0,:Patriots: Patriots,2022-12-18T15:16:04Z,patriots,0.8271
13373,122270,122270,Mulligan0816,"Your team’s good for like 3 years ans you talk some mega shit lmao

Your team’s ass if you cant beat the Texans outright",0.0,nfl,t3_zp30dp,False,0.0,:Patriots: Patriots,2022-12-18T15:06:35Z,patriots,0.296
13374,122271,122271,Mulligan0816,Kansas City sucks,0.0,nfl,t3_zp30dp,False,0.0,:Patriots: Patriots,2022-12-18T15:02:30Z,patriots,-0.3612
13375,122277,122277,Mulligan0816,But my argument is that it isn’t THAT unorthodox of a hire,1.0,nfl,t3_zobc26,False,0.0,:Patriots: Patriots,2022-12-17T12:50:23Z,patriots,-0.5023
13376,122278,122278,Mulligan0816,"But do people need to immediately jump to racism to explain the situation Irsay was in?

That was completely asinine by a lot of NFL reporters and pretty ignorant to the situation.

An owner shouldn’t have to explain to the tee why they hired someone beyond just their qualifications and standing in the organization.",1.0,nfl,t3_zobc26,False,0.0,:Patriots: Patriots,2022-12-17T12:45:38Z,patriots,0.0018962962962962
13377,122279,122279,Mulligan0816,He’s also an absolute legend in the Colts franchise and I seriously do not see why so many people got up in arms about hiring him,1.0,nfl,t3_zobc26,False,0.0,:Patriots: Patriots,2022-12-17T12:36:40Z,patriots,-0.1779
13378,122280,122280,Mulligan0816,"His record is fair for sure. It isn’t the greatest. But he’s doing what he can with what he has.

Also I’m confused how the process to hire him was wrong or unethical?",1.0,nfl,t3_zobc26,False,0.0,:Patriots: Patriots,2022-12-17T12:35:41Z,patriots,-0.19464609375
13379,122281,122281,Mulligan0816,"Honestly, this is why I hate talking heads in the NFL.

Jeff Saturday gets hired: they say he’s gonna fuckin suck/there were better options/it was racist to hire a white guy over a black guy etc etc

Jeff Saturday’s been doing a great job so far. Obviously he doesn’t have COACHING experience past high school, but who the fuck cares? Some people are gonna do well in a job that seems to be way above their paygrade. You won’t find out how good they are until they do it 🤷🏻‍♂️",2.0,nfl,t3_zobc26,False,0.0,:Patriots: Patriots,2022-12-17T12:32:36Z,patriots,0.098237632
13814,128611,128611,Nollieee,No other coach is getting this roster to 7-6,2.0,nfl,t3_zp7p5n,False,0.0,:Patriots: Patriots,2022-12-18T16:30:36Z,patriots,-0.296
14038,130397,130397,NomzStorM,"im sorry, your flair, I gotta do this   
[a catch](https://imgur.com/a/8KMylwC)",2.0,nfl,t3_zphwlp,False,0.0,:Patriots: Patriots,2022-12-19T08:23:14Z,patriots,-0.0772
14040,130400,130400,NomzStorM,Inser vision monster meme,1.0,nfl,t3_zpf3jv,False,0.0,:Patriots: Patriots,2022-12-19T03:31:29Z,patriots,0.25
14042,130416,130416,NomzStorM,lmao,2.0,nfl,t3_zpdht0,False,0.0,:Patriots: Patriots,2022-12-18T18:57:47Z,patriots,0.5994
14043,130419,130419,NomzStorM,Why is there no pylon cam going up the line,4.0,nfl,t3_zpcra6,False,0.0,:Patriots: Patriots,2022-12-18T18:34:11Z,patriots,-0.296
14044,130420,130420,NomzStorM,There was definitely white turf too,8.0,nfl,t3_zpcra6,False,0.0,:Patriots: Patriots,2022-12-18T18:32:40Z,patriots,0.4019
14220,130730,130730,OTheOwl,"Trying the lateral here makes sense, you are backed up with very little time left, so either you get a miracle or you lose. Where as in the Raiders game that was just an all time brain fart by Stevenson and Meyers.",8.0,nfl,t3_zqs4c5,False,0.0,:Patriots: Patriots,2022-12-20T12:03:51Z,patriots,0.074
14233,130743,130743,OTheOwl,"The draw play was not terrible, the defense may not have been expecting it and you might break out a big run. I don't think any of the coaches expected the players to start lateralling the ball.

Hail Mary is a poor choice, there is a big chance of a strip sack or turnover. A knee was the safest choice but i don't fault them for the run.",3.0,nfl,t3_zpd4z3,False,0.0,:Patriots: Patriots,2022-12-19T09:50:48Z,patriots,0.1337992187499999
14238,130749,130749,OTheOwl,"It's concerning that you need to coach players to not lateral the ball when they are tied.

Let's be honest, that play was not a coaching issue but a player making a boneheaded play.",8.0,nfl,t3_zpd4z3,False,0.0,:Patriots: Patriots,2022-12-18T21:44:18Z,patriots,0.357
15756,139370,139370,Perswayable,Been saying this for months on this sub. Check my history. I agree.,5.0,patriots,t3_zr7bbe,False,0.0,:3-28:,2022-12-21T00:56:41Z,patriots,0.1204
15757,139371,139371,Perswayable,This post is based on hysteria and conspiracy.,1.0,patriots,t3_zr8u1u,False,1.0,:3-28:,2022-12-21T00:47:06Z,patriots,-0.743
15758,139372,139372,Perswayable,"I can admit I do not know how good all of our coaches are. What I do know, is I trust Aikman when he says in his entire career, including QBing and announcing, has he never heard of a defensive coordinator being a competent, good offense coordinator. I agree with him.",48.0,patriots,t3_zph1d1,False,0.0,:3-28:,2022-12-18T21:54:53Z,patriots,0.1996740740740741
15759,139373,139373,Perswayable,"You know. All semantics aside and ""experts,"" it's just boring football. Our defense is more exciting to watch but you have no clue which version is going to come. 

We have a lot of money available next year. If we don't do anything productive next year, I'll probably focus on more important things as well. 

Win or lose, this just feels boring and frustrating.",44.0,patriots,t3_zpgczm,False,0.0,:3-28:,2022-12-18T21:20:45Z,patriots,-0.0658650720164609
16600,147120,147120,ProudBlackMatt,I would not care if my WR1 had the confidence to draw parallels between himself and MJ.,13.0,nfl,t3_zrysjl,False,0.0,:Patriots: Patriots,2022-12-21T13:53:49Z,patriots,0.171
16601,147123,147123,ProudBlackMatt,Rank us lower. We freaking suck and now you can add choke artists to our growing list of negative attributes. Too many wins to tank but too many losses to realistically compete.,1.0,nfl,t3_zrog0v,False,0.0,:Patriots: Patriots,2022-12-21T08:39:11Z,patriots,-0.2100962962962963
16602,147125,147125,ProudBlackMatt,"> I think Bill is allergic to those kind of guys

Yup, Pats passed on George Pickens. Really hope it wasn't for personality reasons because who cares if the WR you drafted actually wants the ball. I don't want to draft a WR who is content running decoy routes all game long.",4.0,patriots,t3_zr7bbe,False,0.0,:jersey80:,2022-12-21T08:22:31Z,patriots,0.0515925925925926
16603,147126,147126,ProudBlackMatt,"> This sub hyped this guy way too much.

Yup. On one hand I get that his case isn't helped by Matt Patricia and an o-line that can't block enough for him to run deep but part of me will always remember that 2 picks after the Pats took Thornton the Steelers took Pickens who is a starter for them and looks great (despite their offense being garbage). Don't buy the ""but he has an attitude!"" argument.",6.0,patriots,t3_zr7bbe,False,0.0,:jersey80:,2022-12-21T08:20:18Z,patriots,-0.0651192
16604,147128,147128,ProudBlackMatt,"Something I notice every week is that not only Pats beat writers but national analysts point out not just the spacing of Pats skill players but the non-complementary nature of the play calling. Stuff like showing them a wrinkle, seeing how they react or don't react to it, then building off it rarely happens. If feels that play to play and drive to drive there isn't anything the Pats are building towards. And this is only worsened when the Pats get into the red zone. If running from under center and passing to the TEs were what got the Pats into the red zone you can be confident they will be abandoned for runs out of shotgun and passes in the flat to the RB. The passes to the RB in the flat when in the red zone were there in week 1 against Miami and have not gone anywhere.",2.0,patriots,t3_zr1shz,False,0.0,:jersey80:,2022-12-20T16:36:06Z,patriots,-9.680426954732516e-05
16605,147129,147129,ProudBlackMatt,Pats need to be ranked lower. We're awful.,6.0,nfl,t3_zqy4bm,False,0.0,:Patriots: Patriots,2022-12-20T14:28:00Z,patriots,-0.3034
16606,147130,147130,ProudBlackMatt,Good for him.,40.0,patriots,t3_zqsnn9,False,0.0,:jersey80:,2022-12-20T10:31:27Z,patriots,0.4404
16607,147131,147131,ProudBlackMatt,Yay we get our Lawrence vs Wilson matchup!,1.0,nfl,t3_zqshwq,False,0.0,:Patriots: Patriots,2022-12-20T10:18:39Z,patriots,0.5707
16608,147132,147132,ProudBlackMatt,Belichick happily flushed the season down the drain so he could have his friend Patricia coach the offense. Simple as that. Man has been in the league for 40 years and could have found an OC knowing McDaniels was going to leave (he even left for the Colts lmao) but instead he wanted to have his minion Patricia around so that's what we got.,14.0,nfl,t3_zq8wdw,False,0.0,:Patriots: Patriots,2022-12-19T19:04:58Z,patriots,0.135637037037037
16609,147133,147133,ProudBlackMatt,"I don't imagine a lot of QBs are going to say ""nah, I can't throw it that far"".",109.0,patriots,t3_zq4t7k,False,0.0,:jersey80:,2022-12-19T15:57:36Z,patriots,-0.1027
16610,147135,147135,ProudBlackMatt,"The crazy thing is he could have even more yards if it wasn't for Zimmer's conservative, run first, philosophy. From the start it should have been about feeding him (and Diggs) the ball. Why pay Kirk the big deal (and later extend his contract) if you're just going to have him hand it off? The man is simply a very efficient passer. Sometimes I wonder if Cook's monster years baited the Vikings into making him the engine of the offense when it really should have been their prolific and highly paid QB.",59.0,nfl,t3_zpulum,False,0.0,:Patriots: Patriots,2022-12-19T09:47:20Z,patriots,-0.0267544
16611,147136,147136,ProudBlackMatt,"Yeah, the beat writers said he can racing down the sideline to get it off before the snap. Wish we had a video of his reaction when it went for a TD. Wonder what he saw in the play that he didn't like. Maybe wanted to check into (another) run out of shotgun or a pass to the flat. Love BB but it's clear he needs to be paired with an actual OC and there's no shame in that.",160.0,patriots,t3_zpsuzn,False,0.0,:jersey80:,2022-12-19T08:23:51Z,patriots,0.15609536
16612,147137,147137,ProudBlackMatt,"And I don't think it's a bad thing. People like to complain about Lamar having his TE wide open in the middle of the field for him for easy passes but Lamar's passing game is predicated on his threat as a runner to create space for his playmakers. Yeah, his target has more than a couple steps on his guy but Lamar is part of the reason that LB had to make sure Lamar wasn't going to take off.",20.0,nfl,t3_zprqto,False,0.0,:Patriots: Patriots,2022-12-19T08:19:06Z,patriots,0.135437037037037
16613,147138,147138,ProudBlackMatt,HAHAHAHAHAHAHAHA 🤣🤣🤣🤣🤣,2.0,nfl,t3_zp7p5n,False,0.0,:Patriots: Patriots,2022-12-18T18:26:26Z,patriots,0.9432
16614,147140,147140,ProudBlackMatt,Sadly I think the only fans who expected this were the Raiders fans.,5.0,nfl,t3_zp7p5n,False,0.0,:Patriots: Patriots,2022-12-18T17:56:27Z,patriots,-0.4215
16615,147141,147141,ProudBlackMatt,I dunno it doesn't sound like he's saying any of this negative stuff to be mean. He's just reflecting how trash the Pats are playing this season. All well deserved.,3.0,nfl,t3_zp7p5n,False,0.0,:Patriots: Patriots,2022-12-18T16:53:04Z,patriots,0.0855111111111111
16616,147142,147142,ProudBlackMatt,Pats and Raiders fighting to have the most penalties tonight,1.0,nfl,t3_zp7p5n,False,0.0,:Patriots: Patriots,2022-12-18T16:48:03Z,patriots,-0.3612
16617,147143,147143,ProudBlackMatt,"* call nothing but conservative screen passes 

* kick field goal in the red zone

* get your punt blocked for a TD anyway

Zach Wilson has really helped disguise what a mess the Pats are this season by handing us 2 games.",8.0,nfl,t3_zp7p5n,False,0.0,:Patriots: Patriots,2022-12-18T16:34:26Z,patriots,-0.8324
16618,147144,147144,ProudBlackMatt,You guys ready to see ~~some~~ a lot more screen passes in the 2nd half?,3.0,nfl,t3_zp7p5n,False,0.0,:Patriots: Patriots,2022-12-18T16:30:37Z,patriots,0.3612
