,Unnamed: 0.1,Unnamed: 0,author,body,score,subreddit,link_id,over_18,controversiality,author_flair_text,created_utc,flair,sentiment
25198,241970,241970,dolladollaclinton,If only half the team shows up to your party do you even have a birthday anymore?,16.0,nfl,t3_zqqcss,False,0.0,:Patriots: Patriots,2022-12-20T16:53:00Z,patriots,0.4019
25200,241978,241978,dolladollaclinton,"Yeah this was blatant too. The second effort by the guy on top of Jefferson and then the guy who tried to tackle Hockenson after the play was dead and they were going to spot the ball. If you let that go, the last couple minute ends up becoming tackle the ball carrier to drain the clock even after the whistle has blown. Absolutely ridiculous by the Colts!",7.0,nfl,t3_zohncl,False,0.0,:Patriots: Patriots,2022-12-17T20:00:04Z,patriots,-0.1216125
25201,241979,241979,dolladollaclinton,"Whenever an INT is that wide open it’s usually the WR running the wrong route or ending their route early, not the QB’s fault.",2.0,nfl,t3_zobc26,False,0.0,:Patriots: Patriots,2022-12-17T14:52:56Z,patriots,-0.2124
25451,245230,245230,fast328,Haha good times,1.0,nfl,t3_zqqzwe,False,0.0,:Patriots: Patriots,2022-12-20T21:36:51Z,patriots,0.7096
25452,245235,245235,fast328,Man I hope we finish this season with higher draft capital. Can't be too mad about this season when we're still 2-0 against the Jets and I knew from the start we're still rebuilding.,1.0,patriots,t3_zqoj4b,False,0.0,Bills = 0 Superbowls ,2022-12-20T12:48:11Z,patriots,0.30385
25453,245241,245241,fast328,"Jack Jones would've made a huge difference in the outcome of this game, in all fairness",1.0,patriots,t3_zp71ca,False,0.0,Bills = 0 Superbowls ,2022-12-18T20:38:32Z,patriots,0.3182
25454,245242,245242,fast328,"Better question, why not just go for a kick? Worst case scenario, overtime. Best case scenario, walk-off win. That whole final play was just stupid.",1.0,patriots,t3_zpdyxj,False,0.0,Bills = 0 Superbowls ,2022-12-18T20:30:02Z,patriots,-0.01803125
25455,245244,245244,fast328,"Bailey Zappe would've won this game for us. Mac Jones missed easy, wide-open passes. Also, he didn't sack Chandler Jones. We're definitely missing the playoffs. L",-3.0,patriots,t3_zp6z4w,False,1.0,Bills = 0 Superbowls ,2022-12-18T18:38:03Z,patriots,0.097347648
25456,245245,245245,fast328,Mac Jones is disappointing with these passes,4.0,patriots,t3_zp6z4w,False,0.0,Bills = 0 Superbowls ,2022-12-18T16:18:58Z,patriots,-0.4939
25457,245246,245246,fast328,L,2.0,patriots,t3_zp731s,False,0.0,Bills = 0 Superbowls ,2022-12-18T16:12:00Z,patriots,0.4588
25458,245250,245250,fast328,"ah yes, classic Matt Ryan blowing a strong lead",3.0,patriots,t3_zobt9o,False,0.0,Bills = 0 Superbowls ,2022-12-17T22:35:00Z,patriots,0.7184
25459,245254,245254,fast328,good that 3 of the most vital players for the team are all available,1.0,patriots,t3_znn1w4,False,0.0,Bills = 0 Superbowls ,2022-12-16T20:10:48Z,patriots,0.659
26030,254903,254903,gucci-chef,Those refs still fucked up on the TD call btw,1.0,nfl,t3_zpcwbl,False,0.0,:Patriots: Patriots,2022-12-18T18:34:13Z,patriots,-0.6597
26190,258533,258533,imfakeithink,Good to know. That must be why they call me Mistah Burn Champion…,2.0,patriots,t3_zrmuk2,False,0.0,:Head_Logo::Head_Logo:,2022-12-21T19:36:53Z,patriots,0.1101
26191,258534,258534,imfakeithink,"Here, you’re the reason god created the middle finger. Oh, and you make everyone happy when you leave the room. #roasted #burned",1.0,patriots,t3_zrmuk2,False,0.0,:Head_Logo::Head_Logo:,2022-12-21T18:52:22Z,patriots,0.0779111111111111
26192,258535,258535,imfakeithink,"Patricia was good, but Flores was just better. This revisionist history we have here just because he’s bad at offensive coaching is not something we should be doing - ever. Remember, both things can be true at the same time!",6.0,patriots,t3_zr2h98,False,0.0,:Head_Logo::Head_Logo:,2022-12-21T04:24:09Z,patriots,0.1001592592592592
26193,258537,258537,imfakeithink,"You wouldn’t be talking about Patricia. I hate the dudes play calling abilities, the rape he did in college and his shit in Detroit, but the man got hired as HC for a reason. Guy was an excellent DC (downvote me all you want, but his defenses are why we won those two super bowls)",4.0,patriots,t3_zr2h98,False,1.0,:Head_Logo::Head_Logo:,2022-12-20T18:28:22Z,patriots,0.2422
26194,258539,258539,imfakeithink,"So, you’re obsessed with being him being a bust. Got it.",-3.0,patriots,t3_zqx9ty,False,0.0,:Head_Logo::Head_Logo:,2022-12-20T17:15:44Z,patriots,-0.044475
26195,258540,258540,imfakeithink,"And you are obsessed with him being a bust, like you’re an Ohio State fan that watched him beat your team to a pulp. You want to drop a first round QB for no apparent reason except a terrible OC and a bad oline, and mediocre receivers - wait, what were we talking about?

Oh yeah, this ain’t Cleveland bud. You wanna steep to Cleveland brown levels of QB mismanagement?",2.0,patriots,t3_zqx9ty,False,0.0,:Head_Logo::Head_Logo:,2022-12-20T17:03:44Z,patriots,0.0068855468749999
26196,258557,258557,imfakeithink,Tank for the easy schedule bb,3.0,patriots,t3_zp6z4w,False,0.0,:Head_Logo::Head_Logo:,2022-12-18T18:26:48Z,patriots,0.4404
26197,258559,258559,imfakeithink,"Question: why are two AFC teams battling it out on Fox, the NFC’s tv channel?",6.0,patriots,t3_zp6z4w,False,0.0,:Head_Logo::Head_Logo:,2022-12-18T18:00:39Z,patriots,-0.2732
26198,258560,258560,imfakeithink,"McCorkle, I love you",4.0,patriots,t3_zp6z4w,False,0.0,:Head_Logo::Head_Logo:,2022-12-18T17:56:39Z,patriots,0.6369
26199,258561,258561,imfakeithink,"37 million on a 4 year deal. I know you’re being rhetorical, but someone might’ve forgotten (Fat Matt)",3.0,patriots,t3_zp6z4w,False,0.0,:Head_Logo::Head_Logo:,2022-12-18T17:46:44Z,patriots,-0.16455
26200,258564,258564,imfakeithink,"No wonder this dickhead commentator is such a dick, drafted by the jets in 2004.",12.0,patriots,t3_zp6z4w,False,0.0,:Head_Logo::Head_Logo:,2022-12-18T17:32:28Z,patriots,-0.8625
26201,258565,258565,imfakeithink,"He didn’t call those timeouts, belichick did.

Anyways, fuck Patricia, fuck belichick for hiring him, and fuck judge bc why not?",1.0,patriots,t3_zp9grh,False,0.0,:Head_Logo::Head_Logo:,2022-12-18T16:40:23Z,patriots,-0.44425
26202,258566,258566,imfakeithink,"It’s ok guys, the trick is to give the raiders the lead so we can come back against them.",2.0,nfl,t3_zp7p5n,False,0.0,:Patriots: Patriots :49ers::bandwagon: 49ers Bandwagon,2022-12-18T16:31:23Z,patriots,0.25
26203,258568,258568,imfakeithink,"If the chargers win, yes.",4.0,nfl,t3_zp7p5n,False,0.0,:Patriots: Patriots :49ers::bandwagon: 49ers Bandwagon,2022-12-18T16:01:13Z,patriots,0.7579
26255,259126,259126,jaleneropepper,"It's so ridiculous. Bill is the HC and GM. Wtf is he going to do, trade himself?",30.0,nfl,t3_zr78xi,False,0.0,:Patriots: Patriots,2022-12-20T21:21:42Z,patriots,-0.2108592592592592
26256,259130,259130,jaleneropepper,">Rhamomdre would have to be having like a nick Chubb year for me to pick him. He's good, but he isn't putting one entire side of the game on his back each and every night like Judon is.

Judon may be the better player but I disagree with this reasoning. Stevenson is hamstrung but Fatty Patricia's awful scheme and the rest of the offense. He really does carry the Patriots offense and if Stevenson was in Chubbs place I think he would have comparible stats. 


Judon doesn't carry the Patriots defense, it's actually a pretty good unit overall.",4.0,nfl,t3_zpu5ca,False,0.0,:Patriots: Patriots,2022-12-19T11:27:41Z,patriots,0.1168658822016461
26257,259131,259131,jaleneropepper,49ers are a great fit but with their injury luck he'd get hurt before the end of their first game.,2.0,nfl,t3_zpw9bs,False,0.0,:Patriots: Patriots,2022-12-19T11:12:11Z,patriots,-0.25
26258,259133,259133,jaleneropepper,"The worst part is, 100% of Patriots fans knew bringing Patricia back was a mistake from the moment it happened. It's been like watching a slow motion train wreck you saw coming from a mile away and not being able to do anything about it. Just watch the chaos unfold or avert your eyes.",6.0,nfl,t3_zpd4z3,False,0.0,:Patriots: Patriots,2022-12-19T10:25:23Z,patriots,-0.2593814814814815
26259,259135,259135,jaleneropepper,"Absolutely stunning. I still can't believe it. Just fall down and go to OT. 


Also I didn't think they even had the confidence to even try anything before OT. Most the season so far, they would've just taken a knee as soon as they got the ball in that situation",29.0,nfl,t3_zpd20c,False,0.0,:Patriots: Patriots,2022-12-18T18:38:55Z,patriots,0.020564512
26709,268248,268248,keleles,"Lovely thing about being a fan of Boston sports is most of the folks on social media have grown up mostly in the last 25 years where EVERY team we pull for has been at least competitive year in & out. Because of that, the kneejerk reactions when we feel like it's fading away come on strong.   
Bad seasons happen. This has been a dud of a season. I've accepted that it's over and I'm gonna move on and stop stressing about them for this year. That being said, if nothing changes and the good ole boys club stays together into next season, I'll be on the train harder than ever.   


Down seasons happen, failure to change the cause of the down season falls on the leader. If BB can't find a real coaching staff for next season, then I don't see myself hoping for many more years of his career.",1.0,patriots,t3_zq5xqu,False,0.0,:Pat_Patriot:,2022-12-20T06:50:47Z,patriots,-0.0478704994261264
26710,268264,268264,keleles,"I hate press conferences with this team. I know the whole idea is to give up as little information as possible, but they're all robots and it's just pointless to watch. If you've watched one Patriots press conference, you've watched them all.",1.0,patriots,t3_zpdyxj,False,0.0,:Pat_Patriot:,2022-12-19T12:28:46Z,patriots,-0.0211814814814814
26711,268265,268265,keleles,"Answer to your question:  
Because they don't want to spend the money to do it. Simple as that. Just the same way each team doesn't have universal cameras that the refs can access, the league goes where the league makes the most money while spending the least. If they fuck games up in the process, oh well, millions will still watch. 

  
At least for this season that Giants-Commanders game will be the last football game I put on my TV.",1.0,patriots,t3_zpfb5x,False,0.0,:Pat_Patriot:,2022-12-19T09:46:18Z,patriots,-0.013618304
26712,268266,268266,keleles,"As far as I'm concerned that was our last game of the season, at least that'll be on my TV & sold our tickets to the Miami game. We'll see where they are next season but at this point the team just manages to get worse every week, and for one year I'm pretty over the nausea in my gut.",3.0,patriots,t3_zpea56,False,0.0,:Pat_Patriot:,2022-12-19T09:28:39Z,patriots,0.01935
26713,268268,268268,keleles,"Glad I wasn't the only one that was like ""wait this dude was actually in by a foot why is everyone complaining on this?"" 

  
I'm finding it harder and harder to be an NFL fan in general because of what strongly feels like choreographed games. The calls lately aren't just poor calls, they're flat wrong and totally change games and I hate having this gut feeling that just won't let me enjoy any game, much less one like last night.",3.0,patriots,t3_zpfb5x,False,0.0,:Pat_Patriot:,2022-12-19T09:24:54Z,patriots,-0.1104074074074074
26714,268271,268271,keleles,Listed our tickets for sale. Not freezing my ass off to watch this team.,6.0,patriots,t3_zp6z4w,False,0.0,:Pat_Patriot:,2022-12-18T18:27:56Z,patriots,0.24235
26877,271715,271715,ksyoung17,"I lack NFL network, and apparently college basketball is seen as the priority here in New England... 

Did Minnesota send a team out for today's game?",5.0,nfl,t3_zobc26,False,0.0,:Patriots: Patriots,2022-12-17T13:18:09Z,patriots,-0.3182
27543,276398,276398,mdmcnally1213,"No but “Comeback”, again to me, means the player has returned to a previously held high-level of play after some sort of adversity or impediment to them playing at that level, be it injury, personal reasons or other. Geno never played at a high level before that he’s returning to",25.0,nfl,t3_zr3ryg,False,0.0,:Patriots: Patriots,2022-12-20T18:12:39Z,patriots,-0.286625
27544,276399,276399,mdmcnally1213,NFL needs a most improved player award,7.0,nfl,t3_zr3ryg,False,0.0,:Patriots: Patriots,2022-12-20T18:05:40Z,patriots,0.7996
27545,276400,276400,mdmcnally1213,"I really wish there was a MIP award, I just don’t see what makes Geno a “Comeback” Player. He didn’t miss time from any impediment besides his own play, and was never playing at this level before so he’s not coming back or returning to a previous form. I am pulling for him, but the “spirit” of the award, to me, would have CMC, Saquon and Henry as the best candidates.",65.0,nfl,t3_zr3ryg,False,0.0,:Patriots: Patriots,2022-12-20T18:01:20Z,patriots,0.3376407407407407
27548,276404,276404,mdmcnally1213,"I want it on site. No connection; phone, internet, etc. to the outside in an independently (with KPMG or other) controlled room.",1.0,nfl,t3_zpxzre,False,0.0,:Patriots: Patriots,2022-12-19T14:59:58Z,patriots,-0.0300296296296296
27549,276405,276405,mdmcnally1213,Solution: Sky-judge,2.0,nfl,t3_zpxzre,False,0.0,:Patriots: Patriots,2022-12-19T14:53:28Z,patriots,0.3182
27550,276406,276406,mdmcnally1213,"NFL needs a Most Improved Player award, because while I want Geno to win an award, I just think CMC is the better Comeback Player candidate.",113.0,nfl,t3_zq2j24,False,0.0,:Patriots: Patriots,2022-12-19T14:48:54Z,patriots,0.9562
27551,276407,276407,mdmcnally1213,"I see it as the opposite, Geno would be the perfect example why the NFL needs a Most Improved player award. I see comeback as exactly what you described first, a player who returned to greatness after injury or other impediment to their playing.

Edit: a word",20.0,nfl,t3_zq2j24,False,0.0,:Patriots: Patriots,2022-12-19T14:46:17Z,patriots,0.0054407407407407
27552,276408,276408,mdmcnally1213,I was super excited initially thinking that is what they did,19.0,nfl,t3_zq2ovo,False,0.0,:Patriots: Patriots,2022-12-19T14:43:08Z,patriots,0.743
27553,276409,276409,mdmcnally1213,"Yes I know, I didn't created the headline for the article.. just posting because of how long Bill has been calling for more camera angles in the endzone.",1.0,nfl,t3_zpxzre,False,0.0,:Patriots: Patriots,2022-12-19T14:11:23Z,patriots,0.2406
27554,276410,276410,mdmcnally1213,I'm of the mindset each game should have a sky judge for quick judgement calls like this that are basically automatically being reviewed without having to go through the elongated process we see currently. So basically almost EVERY play would be reviewable/reviewed independently from the crew on the field.,2.0,nfl,t3_zq0oti,False,0.0,:Patriots: Patriots,2022-12-19T14:09:32Z,patriots,0.2294
27555,276411,276411,mdmcnally1213,"Gotcha... not sure whether it would be reviewable, the part of the play in review wouldn't be the pass specifically so we can't look at direction and there is no other note about bats/tips within the reviewable plays.

>Passing plays:  
 1. Whether a pass was complete, incomplete or intercepted in the field of play.  
 2. Whether a fumble by a Quarterback (Passer) was a pass.  
 3. Whether a forward pass has been touched by any player.  
 4. Whether a pass has been thrown forward or backward.  
5. Whether a forward pass has been thrown from beyond or behind the line of scrimmage.  
 6. Whether a forward pass has been thrown from behind the line of scrimmage after the ball has been beyond the line.",1.0,nfl,t3_zq0oti,False,0.0,:Patriots: Patriots,2022-12-19T14:03:43Z,patriots,2.006480515475761e-13
27556,276413,276413,mdmcnally1213,"Okay, so let's look at each point.

>If a forward pass that is controlled by a player

Well looking closely at it, it does appear he ""controls"" the ball 

>the catch is thrown forward

It doesn't look definitively that it was thrown forward, looks side-ways.",4.0,nfl,t3_zq0oti,False,0.0,:Patriots: Patriots,2022-12-19T13:54:45Z,patriots,0.1931749999999999
27558,276415,276415,mdmcnally1213,"A forward pass in flight can be tipped, batted or directed by any eligible player in any direction  at any time^(1). Since the ball was not yet possessed with two feet inbounds it was still considered in flight and therefore is able to be tipped. This type of play is frequently practiced as a ""tip-drill"".

^(1) NFL Rule Book Section 4: Illegal Bats and Kicks; Article 2: Legal Bat",13.0,nfl,t3_zq0oti,False,0.0,:Patriots: Patriots,2022-12-19T13:46:24Z,patriots,-0.097925
27559,276416,276416,mdmcnally1213,">Article 2: Legal Bat. A forward pass in flight may be tipped, batted, or deflected in any direction by any eligible player at any time.",10.0,nfl,t3_zq0oti,False,0.0,:Patriots: Patriots,2022-12-19T13:41:59Z,patriots,0.032
27561,276418,276418,mdmcnally1213,"That's the point, this article is from 2015... Bill has been calling for these cameras well before then, but hit a tipping point in 2015.. can't wait for this years meetings when he brings this up again",6.0,nfl,t3_zpxzre,False,0.0,:Patriots: Patriots,2022-12-19T12:05:09Z,patriots,0.1406
27562,276419,276419,mdmcnally1213,"Yes, every year Bill brings up adding four or more camera angles to each endzone.... for this EXACT reason",46.0,nfl,t3_zpxzre,False,0.0,:Patriots: Patriots,2022-12-19T11:40:37Z,patriots,0.4019
27563,276421,276421,mdmcnally1213,Not a great way for Belichick to get his vindication on this topic,-12.0,nfl,t3_zpxzre,False,0.0,:Patriots: Patriots,2022-12-19T11:38:35Z,patriots,-0.5096
27569,276432,276432,mdmcnally1213,Y’all winning saved the reputation of the ref who blew the fumble play short and overturned the TD.,11.0,nfl,t3_zohs6b,False,0.0,:Patriots: Patriots,2022-12-17T16:56:56Z,patriots,0.8225
27702,277185,277185,mentalrecon,"“This might be one of the dumbest teams I’ve ever seen.”
-	Scott Zolak",499.0,nfl,t3_zpdvrq,False,0.0,:Patriots: Patriots,2022-12-18T19:16:46Z,patriots,-0.5106
27744,278618,278618,mnelson1370,Lions or Vikings are the big two id love to see,30.0,nfl,t3_zpz3sa,False,0.0,:Patriots: Patriots,2022-12-19T12:19:51Z,patriots,0.6369
28205,287325,287325,noble_29,This is one of the things that sucks about social media. People can just never honorably fade off into the sunset or go away. Some people just always have to try to reclaim the spotlight.,2.0,nfl,t3_zs2xo8,False,0.0,:Patriots: Patriots,2022-12-21T18:11:28Z,patriots,-0.0596888888888888
28206,287341,287341,noble_29,"I know everyone hates the Pats but horrible calls like this have been happening the entire season (with the most egregious being Hunter Henry dropping a ball that never once hit the ground). I can take getting beat because we suck, it’s just hard to stomach getting fleeced on a clear call when it completely alters the course of the game.",15.0,nfl,t3_zperb7,False,0.0,:Patriots: Patriots,2022-12-18T20:13:36Z,patriots,-0.2226
28207,287375,287375,noble_29,"Lmao what? By him being competent enough for the franchise, that alone already makes him better than Wilson 😂",1.0,nfl,t3_zp3mzn,False,0.0,:Patriots: Patriots,2022-12-18T15:39:43Z,patriots,0.5133
28208,287376,287376,noble_29,Lmao Mac isn’t spectacular but every part of his game is better than Wilson’s except for raw athleticism. Wilson is infinitely better at MILF hunting than quarterbacking,1.0,nfl,t3_zp3mzn,False,0.0,:Patriots: Patriots,2022-12-18T14:46:33Z,patriots,0.40595
28209,287377,287377,noble_29,Giving up repeated chunk plays to arguably the worst QB in the league is such a Detroit thing to do,6.0,nfl,t3_zp3mzn,False,0.0,:Patriots: Patriots,2022-12-18T14:41:57Z,patriots,-0.4019
28210,287378,287378,noble_29,I don’t understand how offsides can get cancelled by a hold when the offsides makes it a free play. Such a stupid call,19.0,nfl,t3_zp3mzn,False,0.0,:Patriots: Patriots,2022-12-18T14:36:42Z,patriots,-0.1203749999999999
28211,287380,287380,noble_29,Just one long ass scoring drive Detroit. That’s all anybody in New England is asking for,11.0,nfl,t3_zp3mzn,False,0.0,:Patriots: Patriots,2022-12-18T14:25:24Z,patriots,-0.135575
28212,287381,287381,noble_29,Wilson clearly struggles when on the field,3.0,nfl,t3_zp3mzn,False,0.0,:Patriots: Patriots,2022-12-18T14:23:50Z,patriots,0.0516
28213,287382,287382,noble_29,"Totally, Jets defense is legit, but Detroit has done approximately nothing to adjust. Goff has all day to throw the ball but is also taking all day to let plays develop. Haven’t seen them try to do anything to bring the defense up like WR screens or RPOs, it’s all just shotgun or draw plays.",1.0,nfl,t3_zp3mzn,False,0.0,:Patriots: Patriots,2022-12-18T14:03:23Z,patriots,0.2479703703703704
28214,287383,287383,noble_29,Lions literally just need 1 TD to essentially lock the game up and their offense has completely stalled,11.0,nfl,t3_zp3mzn,False,0.0,:Patriots: Patriots,2022-12-18T13:59:38Z,patriots,-0.4754
28215,287385,287385,noble_29,There’s the Wilson I know and love,4.0,nfl,t3_zp3mzn,False,0.0,:Patriots: Patriots,2022-12-18T13:44:03Z,patriots,0.6369
28216,287386,287386,noble_29,Lmao clear DPI too,26.0,nfl,t3_zp3mzn,False,0.0,:Patriots: Patriots,2022-12-18T13:25:27Z,patriots,0.7579
28217,287387,287387,noble_29,Damn Detroit you really gonna let Zack Wilson cook on you?,4.0,nfl,t3_zp3mzn,False,0.0,:Patriots: Patriots,2022-12-18T13:24:27Z,patriots,-0.4019
28218,287399,287399,noble_29,Josh Allen has negative ball security awareness,2.0,nfl,t3_zolfwt,False,0.0,:Patriots: Patriots,2022-12-17T22:20:14Z,patriots,-0.3182
28219,287402,287402,noble_29,Did the Miami secondary randomly become lockdown or do the Bills suddenly suck? What a 180 from the first half,1.0,nfl,t3_zolfwt,False,0.0,:Patriots: Patriots,2022-12-17T21:54:27Z,patriots,-0.1101
28220,287403,287403,noble_29,Hunter Henry lost a TD against the Vikes on that same exact “non”-catch except he actually had a hand under it,0.0,nfl,t3_zolfwt,False,0.0,:Patriots: Patriots,2022-12-17T21:51:32Z,patriots,0.2263
28221,287404,287404,noble_29,"Don’t blame the penalty, blame the dude who can’t stop himself from tackling the punter when he’s airborne. It’s literally so easy to just not destroy him.",1.0,nfl,t3_zolfwt,False,0.0,:Patriots: Patriots,2022-12-17T21:48:58Z,patriots,0.17215
28222,287405,287405,noble_29,You knew that was about to happen after the roughing penalty. It always does,9.0,nfl,t3_zolfwt,False,0.0,:Patriots: Patriots,2022-12-17T21:43:54Z,patriots,-0.1147
28223,287406,287406,noble_29,"Why? It’s a safety penalty. Punters go airborne with the amount of force they kick with, they’re defenseless. Why shouldn’t they be protected?",2.0,nfl,t3_zolfwt,False,0.0,:Patriots: Patriots,2022-12-17T21:41:52Z,patriots,0.08804375
28224,287407,287407,noble_29,Damn that’s worse than the Pierre Strong penalty a few weeks ago for the Pats. Absolute moronic play,6.0,nfl,t3_zolfwt,False,0.0,:Patriots: Patriots,2022-12-17T21:39:27Z,patriots,-0.326725
28225,287408,287408,noble_29,Yes and fuck your flair,2.0,nfl,t3_zolfwt,False,0.0,:Patriots: Patriots,2022-12-17T21:35:25Z,patriots,-0.2023
28226,287409,287409,noble_29,Wtf Bills,6.0,nfl,t3_zolfwt,False,0.0,:Patriots: Patriots,2022-12-17T21:34:36Z,patriots,-0.5859
28227,287411,287411,noble_29,His center’s ass?,2.0,nfl,t3_zolfwt,False,0.0,:Patriots: Patriots,2022-12-17T21:08:08Z,patriots,-0.5423
28228,287412,287412,noble_29,"Either way with 8 seconds left, take a quick shot at the end zone and you still get the chance to kick if you miss it. Scrambling makes it all or nothing.",1.0,nfl,t3_zolfwt,False,0.0,:Patriots: Patriots,2022-12-17T21:04:31Z,patriots,0.025675
28229,287413,287413,noble_29,Idk what league you’ve been watching but 217 yards and 3 TDs is still a damn good game sheet for the majority of the NFL. Not many QBs have a chance to throw for 400+ on the reg. Maybe Mahomes or Burrow but not really anybody else.,1.0,nfl,t3_zolfwt,False,0.0,:Patriots: Patriots,2022-12-17T20:59:17Z,patriots,0.0287333333333333
28230,287414,287414,noble_29,"Why’re you so angry dude? Take a page from the shirtless dude’s book and chill the f out. And I didn’t make an “argument”, I stated an observation.",1.0,nfl,t3_zolfwt,False,0.0,:Patriots: Patriots,2022-12-17T20:56:49Z,patriots,-0.0237703703703703
28231,287416,287416,noble_29,Cool story bro,0.0,nfl,t3_zolfwt,False,0.0,:Patriots: Patriots,2022-12-17T20:52:33Z,patriots,0.3182
28232,287417,287417,noble_29,Allen would’ve looked so bad had they failed that and he held the ball too long to try for a FG,8.0,nfl,t3_zolfwt,False,0.0,:Patriots: Patriots,2022-12-17T20:50:54Z,patriots,-0.8312
28233,287418,287418,noble_29,About time McKenzie hurts someone besides us,2.0,nfl,t3_zolfwt,False,0.0,:Patriots: Patriots,2022-12-17T20:44:16Z,patriots,-0.4767
28234,287419,287419,noble_29,They wear full on ski gear when it’s like 65° down there. They’re probably too numb to feel the cold at this point,1.0,nfl,t3_zolfwt,False,0.0,:Patriots: Patriots,2022-12-17T20:41:29Z,patriots,-0.0797
28235,287422,287422,noble_29,That’s the dilemma I’m in watching this game lol,1.0,nfl,t3_zolfwt,False,0.0,:Patriots: Patriots,2022-12-17T19:53:19Z,patriots,0.2732
28236,287423,287423,noble_29,"If you check the radar, looks like snow is on the way",2.0,nfl,t3_zolfwt,False,0.0,:Patriots: Patriots,2022-12-17T19:50:57Z,patriots,0.3612
28237,287424,287424,noble_29,"I hope both teams lose, but since this is reality, get fucked Miami",13.0,nfl,t3_zolfwt,False,0.0,:Patriots: Patriots,2022-12-17T19:50:15Z,patriots,-0.7906
28238,287426,287426,noble_29,Wtf where’s all the snow,3.0,nfl,t3_zolfwt,False,0.0,:Patriots: Patriots,2022-12-17T19:15:15Z,patriots,-0.5859
