,Unnamed: 0.1,Unnamed: 0,author,body,score,subreddit,link_id,over_18,controversiality,author_flair_text,created_utc,flair,sentiment
621,8735,8735,Additional-Gas-45,"He used to be so well known for this stat but now... 

Well.... 

That lateral....",28.0,nfl,t3_zqud82,False,0.0,:Patriots: Patriots,2022-12-20T19:30:53Z,patriots,0.5455
622,8736,8736,Additional-Gas-45,He handled the switch well,48.0,nfl,t3_zqzr51,False,0.0,:Patriots: Patriots,2022-12-20T19:26:53Z,patriots,0.2732
623,8742,8742,Additional-Gas-45,"As a pats fan, I've been calling it the Chef's Kiss.",0.0,nfl,t3_zqfb71,False,0.0,:Patriots: Patriots,2022-12-20T06:37:53Z,patriots,0.6249
742,9756,9756,AdonisSebastian,Dicks burgers in WA fuck hard,6.0,nfl,t3_zs4g3n,False,0.0,:Patriots: Patriots,2022-12-21T21:02:38Z,patriots,-0.5994
1449,12977,12977,AkiraleTorimaki,"I’m not denying Slater, but I always will have a soft spot for the likes of Brady, Gronk, Edelman (heck, he’s a pretty good candidate since he played his entire career in New England).
I’m not legally obligated to wear a jersey of a current player…nothing wrong with wearing a jersey of a Pats legend.
Also, I prefer the Brady-era jerseys over the jerseys we have right now (excluding the Pat Patriot uniforms).",2.0,patriots,t3_zpcytq,False,0.0,:jersey12:,2022-12-20T11:21:50Z,patriots,-0.0233666666666666
1450,12984,12984,AkiraleTorimaki,Fair enough…,-1.0,nfl,t3_zpf3jv,False,0.0,:Patriots: Patriots,2022-12-19T09:36:09Z,patriots,0.3182
1451,12985,12985,AkiraleTorimaki,Not that this matters anymore because the Patriots decided to commit seppuku on the field at the last second when they could’ve just went down and into overtime…,5.0,nfl,t3_zpf3jv,False,0.0,:Patriots: Patriots,2022-12-18T22:04:04Z,patriots,0.3237
1452,12988,12988,AkiraleTorimaki,"When I get a new Patriots jersey, I’m just getting a Brady jersey…I know he’s a Buccaneer now but he’ll always be a Patriot in my eyes (and he’s clearly better than whatever we’re seeing on the field).",8.0,patriots,t3_zpcytq,False,0.0,:jersey12:,2022-12-18T19:40:10Z,patriots,0.8126
1542,13364,13364,AlexTheCool1557,“I’m gonna get a nice burger after this lateral to Mac Jones goes for a touchdown”,1.0,patriots,t3_zr2h98,False,0.0,:jersey10::jersey10:,2022-12-20T22:36:54Z,patriots,0.4215
1543,13366,13366,AlexTheCool1557,Fuck the Bills,1.0,nfl,t3_zpukfx,False,0.0,:Patriots: Patriots,2022-12-19T12:37:21Z,patriots,-0.5423
1544,13369,13369,AlexTheCool1557,"Yea, as a Nothern Arizona University student the pats should’ve made their way up to flagstaff to practice and they would’ve won. And me saying this in no way means I just wanted a chance to meet them, but I did see videos of David Andrews signing stuff at UoA so… I mean it would’ve been nice.",2.0,patriots,t3_zpdort,False,0.0,:jersey10::jersey10:,2022-12-18T23:23:21Z,patriots,0.421675
1546,13372,13372,AlexTheCool1557,The fuck we doing,2.0,patriots,t3_zp6z4w,False,0.0,:jersey10::jersey10:,2022-12-18T18:13:28Z,patriots,-0.5423
1547,13373,13373,AlexTheCool1557,I tried the papa johns thin crust and it just taste like a tortilla they put topping on. Was a little disappointed,4.0,patriots,t3_zp6z4w,False,0.0,:jersey10::jersey10:,2022-12-18T18:12:58Z,patriots,-0.1211
1548,13375,13375,AlexTheCool1557,"saw him pop open the champagne on the sideline since his offense took the lead, bro celebrating",1.0,patriots,t3_zp6z4w,False,0.0,:jersey10::jersey10:,2022-12-18T18:09:06Z,patriots,0.5994
1549,13376,13376,AlexTheCool1557,Idk he’s just tryna be annoying as fuck I guess,2.0,patriots,t3_zp6z4w,False,0.0,:jersey10::jersey10:,2022-12-18T18:07:57Z,patriots,-0.765
1550,13377,13377,AlexTheCool1557,Yea would’ve definitely worked with him,1.0,patriots,t3_zp6z4w,False,0.0,:jersey10::jersey10:,2022-12-18T18:07:19Z,patriots,0.4019
1551,13381,13381,AlexTheCool1557,Not Andrews ☹️,4.0,patriots,t3_zp6z4w,False,0.0,:jersey10::jersey10:,2022-12-18T17:45:52Z,patriots,0.2584
1552,13384,13384,AlexTheCool1557,Idk why but I always think he’s only been around for like 5 years,2.0,patriots,t3_zp6z4w,False,0.0,:jersey10::jersey10:,2022-12-18T17:41:14Z,patriots,0.4678
1553,13385,13385,AlexTheCool1557,"Why he keep calling him Mad Max, it’s super annoying",2.0,patriots,t3_zp6z4w,False,0.0,:jersey10::jersey10:,2022-12-18T17:30:21Z,patriots,-0.25
1554,13386,13386,AlexTheCool1557,Come on bro 😕,1.0,patriots,t3_zp6z4w,False,0.0,:jersey10::jersey10:,2022-12-18T16:22:17Z,patriots,-0.3182
1555,13387,13387,AlexTheCool1557,Matt Patricia sends plays in via Morse code. Takes time to decode,5.0,patriots,t3_zp6z4w,False,0.0,:jersey10::jersey10:,2022-12-18T16:20:36Z,patriots,0.0625
1556,13391,13391,AlexTheCool1557,Damn Mac was probably gonna hit the griddy,0.0,patriots,t3_zp6z4w,False,0.0,:jersey10::jersey10:,2022-12-18T15:50:21Z,patriots,-0.4019
1557,13392,13392,AlexTheCool1557,"They got Crosby who is pretty good, other than that I go no clue who that have",1.0,patriots,t3_zp6z4w,False,0.0,:jersey10::jersey10:,2022-12-18T15:42:50Z,patriots,0.5994
1558,13394,13394,AlexTheCool1557,I already got the excuses ready 💪💪 Mac the goat,3.0,patriots,t3_zp6z4w,False,0.0,:jersey10::jersey10:,2022-12-18T15:33:01Z,patriots,0.3612
1559,13395,13395,AlexTheCool1557,Actually I lied we did have a first down but nothing after,1.0,patriots,t3_zp6z4w,False,0.0,:jersey10::jersey10:,2022-12-18T15:28:59Z,patriots,-0.2023
1560,13397,13397,AlexTheCool1557,As a magic fan… it’s pretty nice to see us have some potential 😅,0.0,patriots,t3_zp6z4w,False,0.0,:jersey10::jersey10:,2022-12-18T15:27:20Z,patriots,0.8176
1561,13400,13400,AlexTheCool1557,Well at least the jets lost,2.0,patriots,t3_zp6z4w,False,0.0,:jersey10::jersey10:,2022-12-18T15:15:16Z,patriots,-0.0516
2316,15044,15044,Amm-O-Matic,"That’s exactly what will happen, fuck the Pro Bowl",8.0,nfl,t3_zs7kf4,False,0.0,:Patriots: Patriots,2022-12-21T19:50:17Z,patriots,-0.5423
2317,15045,15045,Amm-O-Matic,How much better has Duvernay been then Marcus?,4.0,patriots,t3_zs7yly,False,0.0,Randy Moss #81,2022-12-21T19:40:21Z,patriots,0.4404
2318,15046,15046,Amm-O-Matic,"That’s why you look at First Team All Pro to truly rate great players, while not obviously not perfect metric and much more concise due to very few selections fans/big markets have no ruling on it.

Rodney Harrison was named First Team All Pro in 2003 and wasn’t named to the Pro Bowl, and again the next year when he was a Second Team All Pro… among countless other examples",226.0,nfl,t3_zs86y8,False,0.0,:Patriots: Patriots,2022-12-21T19:36:21Z,patriots,0.201575
2319,15047,15047,Amm-O-Matic,Just stay healthy Gronk don’t derail your health!,1.0,nfl,t3_zs2xo8,False,0.0,:Patriots: Patriots,2022-12-21T16:25:20Z,patriots,0.2003
2320,15050,15050,Amm-O-Matic,"Seriously. My grandfather recently also just passed away, but at 86. I know it’s different for everybody but still.",20.0,nfl,t3_zrh6j1,False,0.0,:Patriots: Patriots,2022-12-21T07:31:13Z,patriots,-0.0065888888888888
2321,15052,15052,Amm-O-Matic,Such a great guy off the field to the fans. Good on him for coming back and taking some time to do this. Had a memorable moment with him when I was younger myself.,28.0,patriots,t3_zr682m,False,0.0,Randy Moss #81,2022-12-20T19:30:45Z,patriots,0.0720777777777777
2322,15054,15054,Amm-O-Matic,It be your own favorite players :(,10.0,nfl,t3_zq4j1a,False,0.0,:Patriots: Patriots,2022-12-19T18:35:29Z,patriots,0.0258
2323,15057,15057,Amm-O-Matic,"He had his best TD season with Brady last year though, unless there’s something I’m missing.",5.0,nfl,t3_zpf9vc,False,0.0,:Patriots: Patriots,2022-12-18T21:00:47Z,patriots,0.4588
2324,15058,15058,Amm-O-Matic,Bill Parcells literally has never made a SB without Belichick. And BB’s specific scheme against the Buffalo K-Gun offense is literally displayed in the Pro Football HOF.,8.0,nfl,t3_zpdtc4,False,0.0,:Patriots: Patriots,2022-12-18T19:29:34Z,patriots,-0.125
2325,15059,15059,Amm-O-Matic,"Now tell me Bill Walsh’s, Chuck Knoll’s etc. record without their all time great QBs, the most important position in football.",5.0,nfl,t3_zpdtc4,False,0.0,:Patriots: Patriots,2022-12-18T19:25:01Z,patriots,0.3673
2326,15060,15060,Amm-O-Matic,"You tell any of your favorite all-time players like Lawrence Taylor, Ed Reed, Deion Sanders what you just said, and they will laugh at your face.",6.0,nfl,t3_zpdtc4,False,0.0,:Patriots: Patriots,2022-12-18T19:16:32Z,patriots,0.8442
2327,15061,15061,Amm-O-Matic,I said it another thread earlier this week I know we just shat the bed against the Raiders but the Saints really prevented so much chaos not winning that game.,3.0,nfl,t3_zpd8z6,False,0.0,:Patriots: Patriots,2022-12-18T19:03:40Z,patriots,-0.8605
2328,15062,15062,Amm-O-Matic,"He recruited two HOFers in Gronk and AB to TB along with the existing talent, not even comparable to the Pats situation from 2020 onward.",1.0,nfl,t3_zpdht0,False,0.0,:Patriots: Patriots,2022-12-18T19:02:26Z,patriots,0.4215
2329,15063,15063,Amm-O-Matic,"Bill Belichick will never be fired and while hiring Patricia is absolutely his fault, I’m 100% certain the grass is not greener under a new coach.",1.0,nfl,t3_zpdht0,False,0.0,:Patriots: Patriots,2022-12-18T18:58:03Z,patriots,0.2607
2330,15064,15064,Amm-O-Matic,He’s honestly right.,17.0,nfl,t3_zpdghj,False,0.0,:Patriots: Patriots,2022-12-18T18:54:27Z,patriots,0.4588
2331,15065,15065,Amm-O-Matic,Has it really been 20 years since you guys beat us? To be honest the last game I really remember is when Big Vince caught a pick against your QB in 2011.,24.0,nfl,t3_zpdboc,False,0.0,:Patriots: Patriots,2022-12-18T18:50:24Z,patriots,0.2553
2332,15066,15066,Amm-O-Matic,"And they’re still winning the division, so while it’s burning his soul, it’s not hell yet.",262.0,nfl,t3_zpdboc,False,0.0,:Patriots: Patriots,2022-12-18T18:48:45Z,patriots,0.7943
2333,15068,15068,Amm-O-Matic,"Belichick needs a real offensive coordinator, nevermind Brady.",10.0,nfl,t3_zpd135,False,0.0,:Patriots: Patriots,2022-12-18T18:34:41Z,patriots,-0.4588
2334,15070,15070,Amm-O-Matic,He might self-combust what the fuck was that.,1401.0,nfl,t3_zpcwbl,False,0.0,:Patriots: Patriots,2022-12-18T18:28:37Z,patriots,-0.5423
2335,15071,15071,Amm-O-Matic,Yep the cycle continues. We should’ve won in 76 they started it.,1.0,patriots,t3_zp6z4w,False,0.0,Randy Moss #81,2022-12-18T18:23:47Z,patriots,0.35995
2336,15072,15072,Amm-O-Matic,It’s not a Patriots vs. Raiders game without a questionable call.,3.0,nfl,t3_zpcra6,False,0.0,:Patriots: Patriots,2022-12-18T18:23:06Z,patriots,0.11175
2337,15073,15073,Amm-O-Matic,It’s honestly all good I know how much the league hates you guys too but this was done on purpose I’m sure.,1.0,patriots,t3_zp6z4w,False,0.0,Randy Moss #81,2022-12-18T18:21:21Z,patriots,0.6059
2338,15074,15074,Amm-O-Matic,Revenge for Tuck Rule FUCK THE NFL,6.0,patriots,t3_zp6z4w,False,0.0,Randy Moss #81,2022-12-18T18:18:56Z,patriots,-0.824
2339,15075,15075,Amm-O-Matic,That is actually the worst commercial on TV. I cringe every single time.,10.0,nfl,t3_zpcm5p,False,0.0,:Patriots: Patriots,2022-12-18T18:16:13Z,patriots,-0.156225
2340,15077,15077,Amm-O-Matic,This hurts to watch,1.0,nfl,t3_zpc9tb,False,0.0,:Patriots: Patriots,2022-12-18T17:59:33Z,patriots,-0.4767
2341,15078,15078,Amm-O-Matic,"That’s a crazy stat, Burrow passes for a ton of TDs wonder why it’s so infrequent besides injuries.

Higgins is so underrated.",52.0,nfl,t3_zpc1vd,False,0.0,:Patriots: Patriots,2022-12-18T17:49:58Z,patriots,-0.085
2342,15080,15080,Amm-O-Matic,Holy Matt Ryan special!,2.0,nfl,t3_zpbprj,False,0.0,:Patriots: Patriots,2022-12-18T17:33:18Z,patriots,0.4574
2343,15083,15083,Amm-O-Matic,"Vick and Lamar both while having outstanding yards per carry, don’t really get the end zone too often on their feet.

Big bodies like Cam and Josh Allen (who is already tied with Vick in all time rushing touchdowns) are better at getting in the end zone.",17.0,nfl,t3_zp93zl,False,0.0,:Patriots: Patriots,2022-12-18T16:26:27Z,patriots,0.48295
2344,15084,15084,Amm-O-Matic,"He wouldn’t make First Ballot if he retired right now but he would for sure get in. Give him like 5 more years, another MVP, First Team All-Pro, and 1 more SB and it’s a lock for First Ballot the second he retires",-1.0,nfl,t3_zp650a,False,0.0,:Patriots: Patriots,2022-12-18T13:52:34Z,patriots,0.293025
2345,15085,15085,Amm-O-Matic,Where is the pass rush or is Buffalos O-line playing that well.,4.0,nfl,t3_zoo1s0,False,0.0,:Patriots: Patriots,2022-12-17T20:57:57Z,patriots,0.4404
2346,15088,15088,Amm-O-Matic,Greatest video of all time,32.0,nfl,t3_znzm1t,False,0.0,:Patriots: Patriots,2022-12-17T00:35:37Z,patriots,0.6369
2458,17382,17382,ArkBirdFTW,Pretty sure Omaha’s just the snap count. The old Patriot playbooks from 03/04 used Omaha to set the ball to snap on the next sound.,30.0,nfl,t3_znquqf,False,0.0,:Patriots: Patriots,2022-12-17T00:32:57Z,patriots,0.167625
2459,17385,17385,ArkBirdFTW,I think he will he’s already injured his throwing shoulder’s rotator cuff and he injured his hand. He doesn’t seem to bothered atm but it’s stuff like that which compounds and will make him lose his arm strength,1.0,nfl,t3_znlyso,False,0.0,:Patriots: Patriots,2022-12-16T14:43:21Z,patriots,0.18535
3688,24680,24680,BeastlyMandible,"Is this what the Colts fans felt like when they did that dumbass fake punt?

What a rush.",2.0,nfl,t3_zp30dp,False,0.0,:Patriots: Patriots,2022-12-18T18:38:40Z,patriots,-0.159225
3689,24681,24681,BeastlyMandible,"Entire team is horribly disciplined and if you can't see that by the legion of horribly timed penalties and, yes, players lateralling it in a tied game, then I dunno what to tell you",1.0,patriots,t3_zpcwgl,False,0.0,AWWWWW YEEEAAH,2022-12-18T18:37:12Z,patriots,-0.6249
3690,24682,24682,BeastlyMandible,"I never expected to actually burst out laughing watching my favorite team lose, but here I am. 

What a spectacularly dumbass way to lose a game performed by a spectacularly dumbass team. 

Go Pats, baby",25.0,nfl,t3_zp30dp,False,0.0,:Patriots: Patriots,2022-12-18T18:36:26Z,patriots,-0.0855148148148148
3691,24683,24683,BeastlyMandible,"Significant coaching changes need to occur this offseason. 

This is the kinda shit we used to win games on because other teams were run by dumbasses and we victimized them for it. 

Now it's us doing the fucking up. 

Poorly coached team, and it begins at the top with Bill Belichick.",3.0,patriots,t3_zpcwgl,False,0.0,AWWWWW YEEEAAH,2022-12-18T18:33:32Z,patriots,0.046369921875
3692,24684,24684,BeastlyMandible,"[Get fucked, NFL](https://imgur.com/a/D3UVO9Z) 

What the fuck ever lol",11.0,nfl,t3_zp30dp,False,0.0,:Patriots: Patriots,2022-12-18T18:20:29Z,patriots,-0.7269
3693,24685,24685,BeastlyMandible,Hollins hands like a construction site. Nothing but bricks,3.0,patriots,t3_zp6z4w,False,0.0,AWWWWW YEEEAAH,2022-12-18T18:09:52Z,patriots,0.0903
3694,24686,24686,BeastlyMandible,Pay Jakobi,7.0,patriots,t3_zp6z4w,False,0.0,AWWWWW YEEEAAH,2022-12-18T17:58:27Z,patriots,-0.1027
3695,24687,24687,BeastlyMandible,"All Patricia did was accept a job he wasn't qualified for. 

The real vitriol should be towards Belichick for offering him that job to begin with.",10.0,patriots,t3_zp6z4w,False,0.0,AWWWWW YEEEAAH,2022-12-18T16:45:09Z,patriots,0.09545
4439,25687,25687,Beef-523,Hey man sometimes it’s really hard to determine if they should throw the screen to the right or to the left.,2.0,patriots,t3_zq3ghi,False,0.0,:3-28:,2022-12-19T21:05:51Z,patriots,-0.1761
4440,25688,25688,Beef-523,Every time I see a screen I die a little inside,2.0,patriots,t3_zp6z4w,False,0.0,:3-28:,2022-12-18T15:36:12Z,patriots,-0.5994
4441,25689,25689,Beef-523,I’m sad cause I love Damien and I just wanna see this man eat. I wonder if this time he’s missing makes it more likely he stays or more likely he leaves.,2.0,patriots,t3_zo9oxo,False,0.0,:3-28:,2022-12-17T18:25:35Z,patriots,-0.0797
4442,25690,25690,Beef-523,"To be fair, I think the oline troubles are due to coaching and not overall talent.",3.0,patriots,t3_znptz8,False,0.0,:3-28:,2022-12-16T17:59:55Z,patriots,-0.4646
4636,29878,29878,BigMacDaddyJones,I will never know why we could not just let the game go into overtime. What happened that somehow forced us to lateral the ball carelessly.,1.0,patriots,t3_zqm6bb,False,0.0,MacDaddyJones,2022-12-20T14:31:06Z,patriots,-0.3062
4637,29879,29879,BigMacDaddyJones,"Yeah Sure Mac Jones can  ""handle"" A Defensive end that's Barreling towards him that's 6'5ft 260Lbs compared to 6'3Ft 214Lbs, and is a starting qb! What could possibly go wrong!?",1.0,patriots,t3_zpcx63,False,0.0,MacDaddyJones,2022-12-18T18:36:41Z,patriots,-0.0362296296296296
5302,31684,31684,BlueRabbitx,"It’s weird bc it’s so nice is all.  

Like, instead of the niceness, barge in here and be all “hahahaha F**k u guys you smug bastards how’s it taste drinking tears out of all those Lombardi trophies”

That’s what we’re used to.

But don’t apologize dude.  Happy holidays ✌🏼✌🏼🤝🤝",2.0,patriots,t3_zr7t0n,False,0.0,:Pat_Patriot:,2022-12-21T19:15:39Z,patriots,0.239701171875
5303,31686,31686,BlueRabbitx,We’ve got our Zolak for that up here.  I’d love to watch a game with him some day,1.0,nfl,t3_zrth90,False,0.0,:Patriots: Patriots,2022-12-21T16:53:35Z,patriots,0.31845
5304,31687,31687,BlueRabbitx,"Cooper Kupp is a slot guy.  I’d be ok if we drafted him.

Plus Olave and Wilson both said JSN was better than both of them.

I’d be 100% on board if we picked him",4.0,patriots,t3_zs15vy,False,0.0,:Pat_Patriot:,2022-12-21T16:48:11Z,patriots,0.03215
5305,31688,31688,BlueRabbitx,Wait. Bills have Diggs/Knox/McKenzie and Mahomes has Juju and Kelce.  Josh has way better talent to throw to including a top 3ish wr and a top 5 TE.  How does Mahomes have a better receiving core??,2.0,buffalobills,t3_zrxltp,False,0.0,69,2022-12-21T16:42:54Z,patriots,0.0240751999999999
5306,31689,31689,BlueRabbitx,"That’s the hope.

Well, the hope is actually that we have a qb that has the arm strength and time in the pocket to deliver deep balls to him, and that he can actually catch it.  Something unfortunately we haven’t really seen much of this year.",3.0,patriots,t3_zrubq7,False,0.0,:Pat_Patriot:,2022-12-21T16:31:36Z,patriots,-0.0079111111111111
5307,31690,31690,BlueRabbitx,Sad we have no actual idea if Thornton will be good or bad.,8.0,patriots,t3_zrubq7,False,0.0,:Pat_Patriot:,2022-12-21T11:38:14Z,patriots,-0.7096
5308,31692,31692,BlueRabbitx,"People saying we’re inevitably going to get blown out in the playoffs-

Have seen both Allen and Mahomes lay duds before, weather would likely be a factor playing in both KC and Buffalo meaning run game / defensive game is very possible.

Have seen a bad Giants team make a deep run to ruin our SB before.

Not saying it’s likely or probable, but it is in fact possible.  Stay positive- we ain’t dead yet",2.0,patriots,t3_zr6hw2,False,0.0,:Pat_Patriot:,2022-12-21T10:30:25Z,patriots,-0.056206640625
5309,31693,31693,BlueRabbitx,"Mac has in fact missed a lot of throws in frustrating fashion.

And the receivers have also dropped a lot of catchable balls.

For this reason we can’t champion nor condemn him at this point.  Agholor and Bourne need to go.  Patricia needs to go. Then let’s judge him.",40.0,patriots,t3_zrnqp3,True,0.0,:Pat_Patriot:,2022-12-21T08:52:31Z,patriots,0.0005464827674897
5310,31694,31694,BlueRabbitx,"Let’s not lose sight that all is not lost with this team.  There’s a growing group of young talented players- Marcus/Jack Jones, Dugger, barmore, Uche. Mondre.  We’ll have an opportunity at some good picks this off-season and some money to spend.",3.0,patriots,t3_zr8r9a,False,0.0,:Pat_Patriot:,2022-12-21T08:45:34Z,patriots,0.184211328125
5311,31695,31695,BlueRabbitx,"Everyone saying you can’t do this, but you can build a team around the run game.  And I think it would be fun as hell. Probably need an extra power back if you want to.  Let’s draft Jerome Bettis 2.0

League want to get smaller and quicker on defense this would be a good counter",2.0,patriots,t3_zr9l8q,False,0.0,:Pat_Patriot:,2022-12-21T06:10:43Z,patriots,0.142828125
5312,31697,31697,BlueRabbitx,"This is super weird, but also super kind.

Happy festivus broncos guy.  I sincerely wanted to see you guys thrive this year, maybe next year you pop in and we’re both playoff teams",30.0,patriots,t3_zr7t0n,False,0.0,:Pat_Patriot:,2022-12-20T20:47:14Z,patriots,0.2564962962962963
5313,31698,31698,BlueRabbitx,"Nick Caley ain’t gonna coach TE, OL, *and* be the OC tho.  They are short staffed already, unsure who actually fills that role",2.0,patriots,t3_zr4ei4,False,0.0,:Pat_Patriot:,2022-12-20T20:17:55Z,patriots,-0.125
5314,31699,31699,BlueRabbitx,"Crazy part, and honestly something I feel everyone is missing, is that we’re in year 2/3 of a real **rebuild**.  If you can even call it that? And we’re fringe playoff team with a bunch of young talent we can build around (yes, especially on the defense, not so much on the offense).  

Draft a couple tackles, LB, WR, or go out and spend some money on these positions next year.  And yes, some proper coaching staff upgrades would be fantastic",1.0,patriots,t3_zqw4ks,False,0.0,:Pat_Patriot:,2022-12-20T16:55:42Z,patriots,0.1537062079999999
5315,31700,31700,BlueRabbitx,"Looked like Judon and Bentley were swapping roles in parts of the game, actually thought this was clever .  Saw Bentley getting pressure on a few occasions",7.0,patriots,t3_zqr7fc,False,0.0,:Pat_Patriot:,2022-12-20T13:39:45Z,patriots,0.019625
5316,31701,31701,BlueRabbitx,"But, I won’t disagree that he and the coaches aren’t in sync this year.  I also won’t go so far as to say MP has been good.  I just don’t think Mac has been very good either",1.0,patriots,t3_zqsz8q,False,0.0,:Pat_Patriot:,2022-12-20T12:34:52Z,patriots,0.1936592592592592
5317,31702,31702,BlueRabbitx,"He did what was asked of him (short passes, screen passes, hand the ball off) and we went to the playoffs on the back of the defense.

I mean, we won a game with 3 passing attempts if I recall.",3.0,patriots,t3_zqsz8q,False,0.0,:Pat_Patriot:,2022-12-20T12:33:19Z,patriots,0.428925
5318,31703,31703,BlueRabbitx,"This is an unwinnable argument in this sub.

Matt seems to have improved somewhat in both roles this year.  And I honestly believe Mac isn’t bought in, which is likely a bigger problem.  

Watched all of these games, offense gets lined up with 14-16 seconds on the play clock.  Mac is effing around running the play clock down to :02/:01 

Then he gets pissy about the calls not coming in quick enough?? He’s operating the offense without a sense of urgency.  He’s forcing the o-line to stay in stance longer, and allowing defense to get assignments dialed in pre-snap.

However- I’d expect Mac will be back and Matt won’t be the OC next year.  Whatever the cause is, QB or OC, it’s not working.",1.0,patriots,t3_zqsz8q,False,0.0,:Pat_Patriot:,2022-12-20T11:46:28Z,patriots,0.0001447046191199
5319,31705,31705,BlueRabbitx,"Mac Jones wasn’t good last year.  He was mediocre, and Josh/BB had training wheels on him last year.  

Mac is absolutely a problem this year, but I’d say the tension/disconnect between OC/QB is a bigger problem.",3.0,patriots,t3_zqsz8q,False,0.0,:Pat_Patriot:,2022-12-20T11:25:18Z,patriots,-0.2085555555555555
5320,31706,31706,BlueRabbitx,"This sounds great in theory, BUT

Look how this sub reacts to a mediocre fringe playoff team.  Imagine how angry the mob will be if we *actually* were terrible.

Every day there’s be 100 new posts explaining why the new coach/GM should be fired.

Mac needs to be fixed, play calling needs improvement.  We’ve got a shitload of young talent on this team- give it a year and hopefully a new OC and see where we’re at",1.0,patriots,t3_zpd1i7,False,0.0,:Pat_Patriot:,2022-12-19T12:41:05Z,patriots,0.154946752
5321,31707,31707,BlueRabbitx,"I’m surprised Bill hasn’t benched him already, tbh

I thought after some of Mac’s shit throws last night and his constant whining we’d see Zappe.

I’m surprised Bill is letting this kid continue to bitch, at some point the kid has to shut up and just run the plays.",1.0,patriots,t3_zpn4l1,False,0.0,:Pat_Patriot:,2022-12-19T11:52:51Z,patriots,-0.2525
5322,31708,31708,BlueRabbitx,"Hunter Henry’s a win.  Jonnu smith disappears for weeks at a time.

I’ve finally given up on Mac, I think he’s pretty bad.  Not that we have a ton of better options 

Mac is missing throws all over- and it seems like he’s bitching constantly.  I thought it was justified, and maybe is a bit, but he’s getting the play call with plenty of time (14-16 seconds) then running the play clock down to 0-2 seconds on like every play.  I think that contributing to our offensive problems in a few ways.  We lead the league in delay of game penalties.  Our o line is sitting there in their stance for an eternity.  The defense has loads of time to get assignments locked in.

In summary, Mac sucks and if he didn’t suck maybe the tight ends would be more productive",1.0,patriots,t3_zps4x6,False,0.0,:Pat_Patriot:,2022-12-19T09:48:17Z,patriots,-0.0647277771334099
5323,31709,31709,BlueRabbitx,"We can keep Patricia judge AND achord.

Just not in their current roles.

I believe we’re still a bit understaffed on the coaching, maybe achord can go back to assistant ST coach with Judge at the helm of ST.

Pff says our offensive line is good (?!?!?!) so keep Patricia there full time.

Install a new OC.",2.0,patriots,t3_zpdpwk,False,0.0,:Pat_Patriot:,2022-12-19T06:55:22Z,patriots,-0.0029159999999999
5324,31711,31711,BlueRabbitx,Big if true,-1.0,patriots,t3_zp16bt,False,0.0,:Pat_Patriot:,2022-12-18T10:49:58Z,patriots,0.4215
