,Unnamed: 0.1,Unnamed: 0,author,body,score,subreddit,link_id,over_18,controversiality,author_flair_text,created_utc,flair,sentiment
16619,147145,147145,ProudBlackMatt,Man these teams suck to watch. So much talent being wasted on both teams by clown coaching staffs.,1.0,nfl,t3_zp7p5n,False,0.0,:Patriots: Patriots,2022-12-18T16:25:30Z,patriots,-0.1258
16620,147146,147146,ProudBlackMatt,We got the rocket scientist special teams too.,4.0,nfl,t3_zp7p5n,False,0.0,:Patriots: Patriots,2022-12-18T16:24:28Z,patriots,0.4019
16621,147147,147147,ProudBlackMatt,"The funny thing is there were a ton of fans saying ""well, actually Belichick is going to be running the offense"". Still waiting for that Belichick offense to show up...",1.0,nfl,t3_zp7p5n,False,0.0,:Patriots: Patriots,2022-12-18T16:21:58Z,patriots,-0.0103
16622,147148,147148,ProudBlackMatt,A comedy.,5.0,nfl,t3_zp7p5n,False,0.0,:Patriots: Patriots,2022-12-18T16:09:51Z,patriots,0.3612
16623,147150,147150,ProudBlackMatt,We are so stupid,3.0,nfl,t3_zp7p5n,False,0.0,:Patriots: Patriots,2022-12-18T15:46:40Z,patriots,-0.656
16624,147153,147153,ProudBlackMatt,3 screens in a row. Amazing.,3.0,nfl,t3_zp7p5n,False,0.0,:Patriots: Patriots,2022-12-18T15:36:53Z,patriots,0.29295
16625,147155,147155,ProudBlackMatt,Isn't this him sneakily or accidentally giving Brady credit?,1.0,nfl,t3_zonhpv,False,0.0,:Patriots: Patriots,2022-12-17T20:42:21Z,patriots,0.3818
16626,147157,147157,ProudBlackMatt,Hope we keep playing the two rookie RBs. Imo drafting day 3 RBs is pretty good value even as a draft value dork if you can put them out there and have them be productive on such low salaries.,18.0,nfl,t3_zo9xgh,False,0.0,:Patriots: Patriots,2022-12-17T10:36:17Z,patriots,0.518275
16627,147162,147162,ProudBlackMatt,Assuming this is an article of lines who performed the best last *week* and not how good the lines are over the year.,27.0,patriots,t3_znptz8,False,0.0,:jersey80:,2022-12-16T16:32:52Z,patriots,0.4203
16628,147167,147167,ProudBlackMatt,It is tough that players who are playing like the best player in the league like Wentz during his magical season are essentially struck from the list when they tear their ACL.,117.0,nfl,t3_znl9sr,False,0.0,:Patriots: Patriots,2022-12-16T12:22:05Z,patriots,0.8176
16629,147168,147168,ProudBlackMatt,"The mods on /r/nfl are actually pretty good imo. If you think this is bad there are some real ugly mod teams around reddit who are either extremely draconian or determined to make the story about them. Heck, look around the 32 team subreddits and you'll find a lot of absentee teams or ones that will shut down the whole board after a primetime loss.",-54.0,nfl,t3_zni8gn,False,0.0,:Patriots: Patriots,2022-12-16T10:30:48Z,patriots,-0.2185666666666666
16630,147170,147170,ProudBlackMatt,"You guys are really posting Chris ""Zach Wilson is the best QB in the draft"" Simms huh?",1994.0,nfl,t3_znh0li,False,0.0,:Patriots: Patriots,2022-12-16T09:19:58Z,patriots,0.6369
17098,148399,148399,Quiet-Ad-12,I coached youth football for 6 years (I'm not trying to make that a flex) and calling offensive plays was by far the hardest thing related to coaching I've ever experienced. And that was peewee football with a playbook of about 6 formations and 50 plays. It doesn't take a rocket scientist (Matty P pun intended) to realize it's fucking hard.,1.0,patriots,t3_zqsz8q,False,0.0,:superbowl_2001:,2022-12-20T20:29:48Z,patriots,-0.0401814814814814
17099,148408,148408,Quiet-Ad-12,The Bills aren't going to rest starters vs us if they are in a position to knock us out of the playoffs. They've got 22 years of being our bitch to make up for. The hatred is real,1.0,patriots,t3_zop0u2,False,0.0,:superbowl_2001:,2022-12-18T14:28:05Z,patriots,-0.2774
17100,148429,148429,Quiet-Ad-12,"Simms is an idiot. He was a mediocre QB with a good last name. He's an even worse ""expert""",1.0,nfl,t3_znh0li,False,0.0,:Patriots: Patriots,2022-12-16T17:34:46Z,patriots,-0.1288777777777777
17101,148430,148430,Quiet-Ad-12,"Pretty much. They were trying to give Mac more shotgun-spread like he ran at Bama, but we don't have the WRs he had at Bama, nor does our OC know how to scheme routes to create natural openings. WRs have to get open on their own and they aren't really good at that",25.0,patriots,t3_zniffd,False,0.0,:superbowl_2001:,2022-12-16T17:30:01Z,patriots,-0.0241407407407407
17533,154763,154763,Regular-Habit-1206,"Ah yes, the negotiator",3.0,nfl,t3_zr78xi,False,0.0,:Patriots: Patriots :Patriots: Patriots,2022-12-21T08:23:05Z,patriots,0.4019
17534,154764,154764,Regular-Habit-1206,"OP. Please get a life, your weird obsession with Bill is extremely unhealthy",36.0,nfl,t3_zr78xi,False,0.0,:Patriots: Patriots :Patriots: Patriots,2022-12-20T20:43:15Z,patriots,-0.33485
17538,154774,154774,Regular-Habit-1206,"Bro. Hop off Bill's meat GOD DAMN 😭😭😭 
Your entire post feed is about Bill and I swear I saw you like 2 days ago",3.0,nfl,t3_znuz3g,False,0.0,:Patriots: Patriots :Patriots: Patriots,2022-12-17T08:56:06Z,patriots,-0.41125
17539,154779,154779,Regular-Habit-1206,I needed that laugh,0.0,nfl,t3_znp6j8,False,0.0,:Patriots: Patriots :Patriots: Patriots,2022-12-16T15:54:46Z,patriots,0.5574
17542,154782,154782,Regular-Habit-1206,God is a Patriots fan 🙏,1.0,nfl,t3_znhge3,False,0.0,:Patriots: Patriots :Patriots: Patriots,2022-12-16T10:04:10Z,patriots,0.5267
17828,163180,163180,ShanePerkins,"its almost like, if you stay in the pocket you get the protections of a quarterback. If you scramble you are now a RB and roughing the passer is much harder to call.",8.0,nfl,t3_zqvjx7,False,0.0,:Patriots: Patriots,2022-12-20T15:40:38Z,patriots,0.074375
17829,163183,163183,ShanePerkins,Including the browns right when he was a brand new coach. Post Brady he has a winning record if I recall. He also went 11-5 without Brady in 2008 and went 3-1 when Brady was suspended,6.0,nfl,t3_zpd4z3,False,0.0,:Patriots: Patriots,2022-12-19T09:10:40Z,patriots,-0.1003777777777777
18353,166470,166470,Sithlordbelichick,Imagine the insanity if we scored on this,6.0,nfl,t3_zqqzwe,False,0.0,:Patriots: Patriots,2022-12-21T00:34:06Z,patriots,-0.5719
18354,166478,166478,Sithlordbelichick,Lol did u see our game against the jets,1.0,nfl,t3_zol1a4,False,0.0,:Patriots: Patriots,2022-12-17T18:43:26Z,patriots,0.4215
18355,166479,166479,Sithlordbelichick,Pats🤝ravens offensive ineptitude,2.0,nfl,t3_zol1a4,False,0.0,:Patriots: Patriots,2022-12-17T18:43:04Z,patriots,-0.4588
18356,166483,166483,Sithlordbelichick,Take him back plz,3.0,nfl,t3_znsxtb,False,0.0,:Patriots: Patriots,2022-12-17T01:31:49Z,patriots,0.0772
21687,194934,194934,Vivalaredsox,Brett Michaels and Slash have had the same hair for 30 years,2.0,nfl,t3_zq9526,False,0.0,:Patriots: Patriots,2022-12-19T19:16:10Z,patriots,-0.2732
21688,194936,194936,Vivalaredsox,Healthy yes but after yesterday I feel the craving for some chaos,6.0,nfl,t3_zq9526,False,0.0,:Patriots: Patriots,2022-12-19T19:07:16Z,patriots,-0.5187
21689,194937,194937,Vivalaredsox,Damn we have a marathon man over here.  I barely clock in at 1 minute,4.0,nfl,t3_zq9526,False,0.0,:Patriots: Patriots,2022-12-19T18:53:08Z,patriots,-0.100475
21690,194938,194938,Vivalaredsox,Who wouldn't want to coach the future baby GOAT Zappe?  Btw I would bet my life that Belichick isn't getting fired EVER by Kraft.,1.0,nfl,t3_zq7t4q,False,0.0,:Patriots: Patriots,2022-12-19T18:48:25Z,patriots,0.20815
21691,194941,194941,Vivalaredsox,First Willie and now JC.  Somebody better get eyes on Brady.,3.0,nfl,t3_zq3wuj,False,0.0,:Patriots: Patriots,2022-12-19T15:58:37Z,patriots,0.2202
21692,194990,194990,Vivalaredsox,If Pats win tomorrow they will have the same record as the Phins.  Interesting.,1.0,nfl,t3_zoq95f,False,0.0,:Patriots: Patriots,2022-12-17T22:50:38Z,patriots,0.347425
21693,194991,194991,Vivalaredsox,That center's ass really did a number on his noggin.,2.0,nfl,t3_zolfwt,False,0.0,:Patriots: Patriots,2022-12-17T21:15:08Z,patriots,-0.4472
21694,194992,194992,Vivalaredsox,But what if he becomes the next elite Offensive….yeah I can’t even finish this with a straight face,13.0,nfl,t3_zo8gkf,False,0.0,:Patriots: Patriots,2022-12-17T11:00:09Z,patriots,0.3291
21695,194993,194993,Vivalaredsox,Sports are entertainment.  Pat is entertaining.,2.0,nfl,t3_zo6fpq,False,0.0,:Patriots: Patriots,2022-12-17T10:58:11Z,patriots,0.325575
21696,194995,194995,Vivalaredsox,The road to the Super Bowl going through Foxboro,1.0,nfl,t3_zo822a,False,0.0,:Patriots: Patriots,2022-12-17T10:55:46Z,patriots,0.5994
21697,194997,194997,Vivalaredsox,Pretty sure this is nothing to the 80 inches of snow they got a while back.  People who live in this region are used to this.  I would guess this isn't nothing to them.,4.0,nfl,t3_zo5nn4,False,0.0,:Patriots: Patriots,2022-12-17T09:02:39Z,patriots,0.0248333333333333
21698,194999,194999,Vivalaredsox,Hell yeah then Edelman comes out of retirement,1.0,nfl,t3_znlyso,False,0.0,:Patriots: Patriots,2022-12-16T18:37:16Z,patriots,-0.5267
21699,195000,195000,Vivalaredsox,Worth it,1.0,nfl,t3_znknp9,False,0.0,:Patriots: Patriots,2022-12-16T18:31:50Z,patriots,0.2263
22119,200395,200395,YaBoiJim777,Ryan Fitzpatrick? I was too young for his start but the fitzmagic season was pretty cool,1.0,nfl,t3_zsbi37,False,0.0,:Patriots: Patriots,2022-12-21T23:00:46Z,patriots,0.40235
22783,202705,202705,YoungDaquan,So if I had a different flair you wouldn’t have even replied to my original comment.,3.0,nfl,t3_zrxpqh,False,0.0,:Patriots: Patriots,2022-12-21T21:20:30Z,patriots,0.3182
22784,202706,202706,YoungDaquan,One is a 42 year old player leaving in free agency and the other is an owner deciding whether to fire a coach. Don’t see how it’s related,4.0,nfl,t3_zrxpqh,False,0.0,:Patriots: Patriots,2022-12-21T16:31:01Z,patriots,0.056575
22785,202709,202709,YoungDaquan,"Stop making burner accounts, touch grass",1.0,nfl,t3_zrxpqh,False,0.0,:Patriots: Patriots,2022-12-21T13:46:08Z,patriots,-0.296
22786,202710,202710,YoungDaquan,"He’s not getting fired. And if he was, Kraft sure as fuck doesn’t need to do it through media members",35.0,nfl,t3_zrxpqh,False,0.0,:Patriots: Patriots,2022-12-21T13:44:43Z,patriots,-0.0367749999999999
22787,202711,202711,YoungDaquan,"Why would he need to push for a divorce anyway? He’s the owner, he can do whatever he wants. 

I hate when tweets like this get posted when it’s literally a reporters speculation",34.0,nfl,t3_zrxpqh,False,0.0,:Patriots: Patriots,2022-12-21T13:44:00Z,patriots,-0.0986666666666666
22788,202714,202714,YoungDaquan,Wtf is a LA football player doing in Fall River,25.0,nfl,t3_zq30fh,False,0.0,:Patriots: Patriots,2022-12-19T16:41:05Z,patriots,-0.5859
22789,202715,202715,YoungDaquan,He does deserve blame but the only thing that changed from last year to this year is OC. We’ve gone from 6th in PPG to I don’t even wanna know this year,8.0,nfl,t3_zpvfbc,False,0.0,:Patriots: Patriots,2022-12-19T15:30:34Z,patriots,-0.044475
22790,202716,202716,YoungDaquan,Maybe we should give him an OC that actually can….coach offense? Idk maybe that’ll go over bills head,206.0,nfl,t3_zpvfbc,False,0.0,:Patriots: Patriots,2022-12-19T10:11:13Z,patriots,-0.11385
22791,202717,202717,YoungDaquan,You can’t even hear the whistle until *after* the ball gets popped free,46.0,nfl,t3_zodisw,False,0.0,:Patriots: Patriots,2022-12-17T13:14:36Z,patriots,0.5106
22792,202718,202718,YoungDaquan,Patriots at 5 lmfao,43.0,nfl,t3_zntsra,False,0.0,:Patriots: Patriots,2022-12-16T21:25:09Z,patriots,0.5423
22993,205508,205508,Zavehi,Oh no I was really hoping everyone felt bad for me.,9.0,nfl,t3_zpcwbl,False,0.0,:Patriots: Patriots,2022-12-18T18:57:46Z,patriots,-0.3832
22994,205510,205510,Zavehi,"Defense has been good to great. 

Special teams has been average to bad.

Offense has been middle school level. 

This is easily the closest to danger BB has ever been in.",79.0,nfl,t3_zpd4z3,False,0.0,:Patriots: Patriots,2022-12-18T18:44:14Z,patriots,-0.0780921875
22995,205511,205511,Zavehi,Bill is going to go out badly at this point. It’s sad.,-5.0,nfl,t3_zpd6q0,False,0.0,:Patriots: Patriots,2022-12-18T18:41:33Z,patriots,-0.357525
22996,205513,205513,Zavehi,Goodell strikes again,38.0,nfl,t3_zpcra6,False,0.0,:Patriots: Patriots,2022-12-18T18:21:39Z,patriots,-0.3612
22997,205519,205519,Zavehi,This isn’t on Matt exclusively. Offense went mega conservative and the colts literally can’t play defense.,20.0,nfl,t3_zogvj6,False,0.0,:Patriots: Patriots,2022-12-17T15:34:28Z,patriots,0.11315
23259,214254,214254,bassistmuzikman,Fuck. Yes.,0.0,nfl,t3_zr8hb1,False,0.0,:Patriots: Patriots,2022-12-20T22:58:01Z,patriots,0.0653749999999999
23260,214256,214256,bassistmuzikman,He wants to have the most wins ever. He retires after like 20 more wins basically.,3.0,nfl,t3_zr78xi,False,0.0,:Patriots: Patriots,2022-12-20T22:36:25Z,patriots,0.531575
23261,214257,214257,bassistmuzikman,I mean. Judon is for sure a star and Uche and Dugger are both on the way up.,30.0,nfl,t3_zr78xi,False,0.0,:Patriots: Patriots,2022-12-20T22:34:57Z,patriots,0.1591
23263,214267,214267,bassistmuzikman,Either of them would be more effective than Trent has been this season.,1.0,nfl,t3_zqs4ve,False,0.0,:Patriots: Patriots,2022-12-20T17:51:17Z,patriots,0.5256
23420,216071,216071,bigxbluexwwex,"No but fr tho, seems like them dudes go to the playoffs every year and don’t do jack shit. People like to joke on the Cowboys (rightfully so) for going to the playoffs just to lose, but I never see anything about the Titans lol",3.0,jaguars,t3_zpnjmg,False,0.0,:NE:,2022-12-19T15:25:54Z,patriots,0.192875
23421,216073,216073,bigxbluexwwex,"Not even a Jags fan but I’m rooting for y’all to win out and win the AFC South, I’m lowkey sick and tired of seeing the boring ass Titans in the playoffs every year lol",31.0,jaguars,t3_zpnjmg,False,0.0,:NE:,2022-12-19T09:24:28Z,patriots,-0.0644
23422,216079,216079,bigxbluexwwex,Jeff Saturday said he wasn’t losing on NO DAMN SATURDAY ❗️❗️❗️,1.0,nfl,t3_zo8218,False,0.0,:Patriots: Patriots,2022-12-17T13:35:48Z,patriots,-0.088
23423,216080,216080,bigxbluexwwex,"A friend of mine at work recommended me to binge watch The King of Queens…

He gave me a hell of a recommendation this show is fucking hilarious lol",6.0,nfl,t3_zo8218,False,0.0,:Patriots: Patriots,2022-12-17T11:31:11Z,patriots,0.6674
23711,223777,223777,bubbastars,Is it really inaccessible to you? Or just mildly less readable? Because I’d argue if you (I’m assuming you’re not colorblind) can read it then I’ve hit the right balance.,2.0,nfl,t3_zrjlf3,False,0.0,:Patriots: Patriots,2022-12-21T17:23:04Z,patriots,-0.1133333333333333
23712,223780,223780,bubbastars,"I know, it's not perfect, but can you tell me - is it the colors? Or something else?   


\~5-8 of every 100 people viewing this will be color blind, so I chose this palette specifically to make it accessible to them.",2.0,nfl,t3_zrjlf3,False,0.0,:Patriots: Patriots,2022-12-21T12:42:16Z,patriots,-0.1432185185185185
23713,223781,223781,bubbastars,"Agreed, but I'm using colorblind-safe colors here because I've gotten feedback to do that before. Tough to strike a balance but I would rather make things somewhat readable for everyone than readable for most and completely inaccessible for some.

Something like 5-8 of every 100 people viewing this will be color blind - and reds are usually the colors that give them trouble.",8.0,nfl,t3_zrjlf3,False,0.0,:Patriots: Patriots,2022-12-21T12:36:00Z,patriots,-0.1558148148148148
23714,223785,223785,bubbastars,"Made some updates to my chart code - I hope this one is a little more readable. Diamonds = best passing grade of the QB's career, arrows = most recent passing grade.

Notes on methodology: you’re looking at a snap-weighted 3-game rolling average, rather than the individual game scores. This is to cut down on the variance between games while still capturing recent performance levels. The snap weighting is so that a QB who throws 3 passes before getting hurt/pulled doesn’t get overly rewarded or punished for his performance in that game.  


[Chart with alternate colors](https://imgur.com/a/QK0g68e)",9.0,nfl,t3_zrjlf3,False,0.0,:Patriots: Patriots,2022-12-21T08:06:25Z,patriots,0.0002598636831275
23715,223796,223796,bubbastars,"How to read this chart: you’re looking at a snap-weighted 5-game *rolling average* of the offense grade for these QBs. Their latest game is represented by the arrow moving away from their recent average.   


Methodology notes: the purpose of the average is to cut down on the variance between games while still capturing recent performance levels. The snap weighting is so that a QB who throws 3 passes before getting hurt/pulled doesn’t get overly rewarded or punished for his performance in that game.",1.0,nfl,t3_zr6cow,False,0.0,:Patriots: Patriots,2022-12-20T19:28:21Z,patriots,-0.0051515625
23716,223808,223808,bubbastars,Fuck off I said “after his early season struggles”. Has Mac ever looked lost in the last 4-5 games? Also your comment is just not related to the point I was making at all.,0.0,patriots,t3_zp6z4w,False,0.0,:Pat_Patriot:,2022-12-18T16:00:45Z,patriots,-0.0554407407407407
23717,223809,223809,bubbastars,"Does anyone else notice a kind of dad dicking from Mac on those shots of him and Patricia? The body language between them makes me wonder who’s teaching the offense to who sometimes. And I love it haha. After his early season struggles Mac appears completely in control of the offense, albeit not in full control of his throws.",0.0,patriots,t3_zp6z4w,False,1.0,:Pat_Patriot:,2022-12-18T15:56:23Z,patriots,-0.08935625
23718,223810,223810,bubbastars,Haha I love this crowd,2.0,patriots,t3_zp6z4w,False,0.0,:Pat_Patriot:,2022-12-18T15:43:30Z,patriots,0.802
23719,223811,223811,bubbastars,Mac getting some time and Jonnu with some catches… a very pleasant surprise,4.0,patriots,t3_zp6z4w,False,0.0,:Pat_Patriot:,2022-12-18T15:38:39Z,patriots,0.7159
23720,223812,223812,bubbastars,Yep thanks to the Jets we’re currently at 42% (which factors in the difficulty of the next 3). But 23% with a loss today.,1.0,patriots,t3_zoqvra,False,0.0,:Pat_Patriot:,2022-12-18T15:30:23Z,patriots,-0.124375
23721,223813,223813,bubbastars,Whew thank you Greg Zuerlein,1.0,patriots,t3_zp6z4w,False,0.0,:Pat_Patriot:,2022-12-18T15:08:56Z,patriots,0.3612
23722,223815,223815,bubbastars,I don't know if you and others making this comment are being sarcastic but obviously we're in the playoffs if we run the table. We’re in the playoffs as it stands and that wouldn’t change.,1.0,patriots,t3_zoqvra,False,0.0,:Pat_Patriot:,2022-12-18T09:54:12Z,patriots,-0.032
23723,223816,223816,bubbastars,"I think it depends on whether Bills and Chiefs enter Week 18 tied. If Chiefs are ahead by a game, I’d say no chance. If they are tied, maybe 70/30 they play. If they’re tied and the Raiders jump out to a quick lead on the Chiefs, maybe they sit the second half.",2.0,patriots,t3_zoqvra,False,0.0,:Pat_Patriot:,2022-12-18T08:11:33Z,patriots,0.0183171875
23724,223818,223818,bubbastars,Honestly if we win out our offense will have done a lot of things right so I think he would.,8.0,patriots,t3_zoqvra,False,0.0,:Pat_Patriot:,2022-12-18T07:04:49Z,patriots,0.7003
23725,223819,223819,bubbastars,Ugh I can’t tell you how badly I want us to win that game (after winning tomorrow’s). Would make for a nice little trip back to the good times and Miami would be shaking in their boots.,16.0,patriots,t3_zoqvra,False,0.0,:Pat_Patriot:,2022-12-17T23:48:26Z,patriots,0.40165
23726,223820,223820,bubbastars,That’s not true. Or at least it contradicts some well known models. Pats realistically need to go 10-7 with one of those wins being Miami in order to have an 85%+ chance. They can still get in with 9-8 (about 50% chance) but again need one of those wins to be Miami.,6.0,patriots,t3_zop0u2,False,0.0,:Pat_Patriot:,2022-12-17T23:32:27Z,patriots,0.2310734374999999
23727,223822,223822,bubbastars,No that’s not what I’m saying. As a player on the field between the hashes and the 45s it’s very disorienting.,-2.0,nfl,t3_zojtqc,False,0.0,:Patriots: Patriots,2022-12-17T18:30:56Z,patriots,-0.074
23728,223823,223823,bubbastars,"What, because haha VR out of touch narp?",-2.0,nfl,t3_zojtqc,False,0.0,:Patriots: Patriots,2022-12-17T18:28:35Z,patriots,0.4588
23729,223824,223824,bubbastars,I’m not saying it’s lame. as a viewer I love it! But putting myself in the shoes of a player or the league office it’s a little much.,-5.0,nfl,t3_zojtqc,False,0.0,:Patriots: Patriots,2022-12-17T18:24:45Z,patriots,0.0864444444444444
23730,223825,223825,bubbastars,"I’m really curious what players think of it because I played on it in VR (NFL Pro Era) and it’s disorienting in a way that other logos aren’t. The curves, the thick white outline, and how it’s right up against the 45s really messes with your spatial awareness.",-9.0,nfl,t3_zojtqc,False,0.0,:Patriots: Patriots,2022-12-17T18:14:09Z,patriots,0.152875
23731,223826,223826,bubbastars,Delay of game on the defense? Never see that.,2.0,nfl,t3_zobc26,False,0.0,:Patriots: Patriots,2022-12-17T16:02:26Z,patriots,-0.050575
23732,223827,223827,bubbastars,"If the refs had seen it, would that be an illegal bat of the ball forward?",5.0,nfl,t3_zobc26,False,0.0,:Patriots: Patriots,2022-12-17T15:53:40Z,patriots,-0.5574
24615,232718,232718,ctpatsfan77,"There are some other good ones, but, yeah, a lot of them are trash.",0.0,nfl,t3_zrp1xk,False,0.0,:Patriots: Patriots,2022-12-21T12:39:38Z,patriots,0.5789
24616,232719,232719,ctpatsfan77,I am absolutely sure that Belichick treats the one man who can fire him—and has to sign off on his trades—the same way he does the media.,1.0,nfl,t3_zrp1xk,False,0.0,:Patriots: Patriots,2022-12-21T12:35:54Z,patriots,0.0498
24905,235685,235685,dank-nuggetz,"72% comp 382 yds 2 (should have been 3) TDs against the Vikings. Look, I can cherry pick stats too. One game means nothing in the grand scheme.

The grand scheme tells us that with a competent playcaller and offensive line, Mac is a perfectly good starting QB. We saw it last year. A top 10 all time rookie QB season. 2nd highest comp % for a rookie ever. Pro-bowl nod. Patricia comes in and the entire offense falls apart in one season. Bourne, an almost-1000 yard receiver last year has barely seen the field. Henry led TEs in red zone TDs last year, he's been invisible. Etc etc.

So what's more likely: Mac just forgot how to play football over the summer OR Patricia is a fucking fraud and has zero clue how to run a competent offense.",1.0,nfl,t3_zpd4z3,False,0.0,:Patriots: Patriots,2022-12-19T16:15:11Z,patriots,-0.0260314422994501
24906,235687,235687,dank-nuggetz,"We were a 10-7 playoff team last year with a top 10 offense. Talent isn't the issue. We have the same squad as last year + Parker and a 4.28 guy in Thornton. We should have improved this year and started to look like a dangerous offense. The only thing that changed was Patricia and suddenly every single player has regressed below their skill level. Defense is good enough to win a title.

This season is 110% a failure of coaching, the talent on offense is fine.",21.0,nfl,t3_zpd4z3,False,0.0,:Patriots: Patriots,2022-12-18T22:47:58Z,patriots,-0.0089901076203671
24907,235688,235688,dank-nuggetz,Because Mac had a top 10 all time rookie season last year with a competent OC running the show? We know what he's capable of. Give him someone who actually knows what they're doing and he's a top 15 QB. Add a legit WR1 and he's even higher.,-10.0,nfl,t3_zpd4z3,False,1.0,:Patriots: Patriots,2022-12-18T22:44:54Z,patriots,0.020471484375
24908,235689,235689,dank-nuggetz,"This is the same fucking team that went 10-7 last year and had a top 10 offense in the NFL. Only thing we did is add Parker, draft Thornton and swap Patricia for McDaniels. Don't give me this ""lack of talent"" BS. The offense went from top 10 to bottom 5 with a more talented roster than last year. Henry had 9 TDs last year, Bourne was practically a 1000 yard receiver. Everyone has regressed massively. Talent isn't the issue, this is 100% shitty coaching and that starts and ends with Belichick.",4.0,nfl,t3_zpd4z3,False,0.0,:Patriots: Patriots,2022-12-18T22:41:15Z,patriots,-0.0286784704623802
24909,235690,235690,dank-nuggetz,"It 100% cost us the playoffs. We're 7-7, the three wild card spots are the 8-6 Chargers with a cupcake schedule, the 9-5 Ravens and the 8-6 Dolphins who we have to play. 

We have to face the Bengals, Bills and Dolphins and basically need to win out to have a shot. Season's over in such a gross and depressing fashion. Still can't believe it.",1.0,nfl,t3_zpdefy,False,0.0,:Patriots: Patriots,2022-12-18T22:36:16Z,patriots,-0.0224008
24910,235695,235695,dank-nuggetz,"Even still, without the lateral you're sending a game to OT that absolutely should have ended in regulation as a 24-17 Pats win. Them blatantly letting that bullshit ""TD"" stand effectively ended our season. I don't care what happened on the lateral, we should have been back in the locker room celebrating by then.",0.0,nfl,t3_zpcvcl,False,1.0,:Patriots: Patriots,2022-12-18T19:38:21Z,patriots,0.0854888888888888
24911,235698,235698,dank-nuggetz,Absolute HORSESHIT fucking call holy mother of god,6.0,nfl,t3_zobc26,False,0.0,:Patriots: Patriots,2022-12-17T15:03:43Z,patriots,0.2732
25000,239837,239837,djdeforte,"I was literally yelling at my tv. YOU JUST NEEDED TO GET TO OVERTIME!

So fucking stupid. They need to replace  Patrica. He is not a god dam OC.",4.0,nfl,t3_zpcwbl,False,0.0,:Patriots: Patriots,2022-12-18T20:17:41Z,patriots,-0.0460096
25197,241969,241969,dolladollaclinton,"If you’ve ever read Outliers, he talks about how most pro hockey players have birthdays within the same 3 months because they were always the biggest and strongest in their age group growing up so they kept at it more.",3.0,nfl,t3_zqqcss,False,0.0,:Patriots: Patriots,2022-12-20T18:59:18Z,patriots,0.5574
