,Unnamed: 0.1,Unnamed: 0,author,body,score,subreddit,link_id,over_18,controversiality,author_flair_text,created_utc,flair,sentiment
35493,248528,248528,dac09b,"No he needs to improve. But you also can't deny they gifted him a shit situation. 

No run game. 
A terrible scheme. 
Bad oline.
Ask him to throw 50 times a game. 

Show me where we have set him up for success?

Some guys are just special and can handle all of that. I don't think Kenny is. He could improve next year, but If we change schemes again he will still be uncomfortable.",2.0,steelers,t3_yu7cum,False,0.0,:sc::c9::c0::sc: TJ Watt,2022-11-13T13:31:42Z,steelers,-0.03460150343031
35494,248529,248529,dac09b,Who cares I like the hit.,4.0,steelers,t3_yu7cum,False,0.0,:sc::c9::c0::sc: TJ Watt,2022-11-13T13:23:02Z,steelers,0.6705
35495,248530,248530,dac09b,Oh shoot that's nasty.,2.0,steelers,t3_yu7cum,False,0.0,:sc::c9::c0::sc: TJ Watt,2022-11-13T13:17:47Z,steelers,-0.7184
35496,248531,248531,dac09b,Definitely has that shiftiness.,2.0,steelers,t3_yu7cum,False,0.0,:sc::c9::c0::sc: TJ Watt,2022-11-13T13:13:44Z,steelers,0.4019
35497,248532,248532,dac09b,I like Sims.,2.0,steelers,t3_yu7cum,False,0.0,:sc::c9::c0::sc: TJ Watt,2022-11-13T13:13:11Z,steelers,0.3612
35498,248533,248533,dac09b,No penalties right now. Huge coaching win.,1.0,steelers,t3_yu7cum,False,0.0,:sc::c9::c0::sc: TJ Watt,2022-11-13T13:09:46Z,steelers,0.28945
35499,248534,248534,dac09b,"Ya it's got a leash connected to his pads in the back. Basically makes it impossible to move your arm to far away from your body risking the pec. Simple version of this

https://www.donjoyperformance.com/donjoy-shoulder-stabilizer",2.0,steelers,t3_yu7cum,False,0.0,:sc::c9::c0::sc: TJ Watt,2022-11-13T13:06:08Z,steelers,-0.0353555555555555
35500,248535,248535,dac09b,Add tj and we can get pressure with 4,8.0,steelers,t3_yu7cum,False,0.0,:sc::c9::c0::sc: TJ Watt,2022-11-13T13:03:00Z,steelers,-0.296
35501,248536,248536,dac09b,Lol that was a rb draw. Just a bad play call.,9.0,steelers,t3_yu7cum,False,0.0,:sc::c9::c0::sc: TJ Watt,2022-11-13T12:56:27Z,steelers,-0.031225
35502,248537,248537,dac09b,Why would we blame him up 10? No he hasn't looked great but why are you desperate to crucify him?,1.0,steelers,t3_yu7cum,False,0.0,:sc::c9::c0::sc: TJ Watt,2022-11-13T12:47:21Z,steelers,-0.43025
35503,248538,248538,dac09b,Hopefully he is good.,2.0,steelers,t3_yu7cum,False,0.0,:sc::c9::c0::sc: TJ Watt,2022-11-13T12:43:43Z,steelers,0.6808
35504,248540,248540,dac09b,Idk man he took a huge shot to the helmet. Concussion is my guess.,1.0,steelers,t3_yu7cum,False,0.0,:sc::c9::c0::sc: TJ Watt,2022-11-13T12:41:34Z,steelers,0.056575
35505,248541,248541,dac09b,He's a runner. Sadly you can do that.,1.0,steelers,t3_yu7cum,False,0.0,:sc::c9::c0::sc: TJ Watt,2022-11-13T12:41:12Z,steelers,-0.21075
35506,248542,248542,dac09b,Now it was a quick hand off underneath inside to me.,2.0,steelers,t3_yu7cum,False,0.0,:sc::c9::c0::sc: TJ Watt,2022-11-13T12:40:51Z,steelers,0.4939
35507,248543,248543,dac09b,Lol this got me.,1.0,steelers,t3_yu7cum,False,0.0,:sc::c9::c0::sc: TJ Watt,2022-11-13T12:38:07Z,steelers,0.4215
35508,248544,248544,dac09b,"My thoughts on that play was what a terrible throw...

Then oh he was about to get obliterated.",3.0,steelers,t3_yu7cum,False,0.0,:sc::c9::c0::sc: TJ Watt,2022-11-13T12:37:38Z,steelers,-0.5859
35509,248545,248545,dac09b,But if he is overused he will get attacked with faster dudes. Lol,1.0,steelers,t3_yu7cum,False,0.0,:sc::c9::c0::sc: TJ Watt,2022-11-13T12:35:07Z,steelers,0.0576499999999999
35510,248546,248546,dac09b,Idk man seems like the pigeons have a bigger impact.,8.0,steelers,t3_yu7cum,False,0.0,:sc::c9::c0::sc: TJ Watt,2022-11-13T12:33:11Z,steelers,0.2732
35511,248547,248547,dac09b,Lol I was hoping for a kamikazee nickname lol,1.0,steelers,t3_yu7cum,False,0.0,:sc::c9::c0::sc: TJ Watt,2022-11-13T12:31:36Z,steelers,0.8126
35512,248550,248550,dac09b,Want to know why we scored no flags against us.,1.0,steelers,t3_yu7cum,False,0.0,:sc::c9::c0::sc: TJ Watt,2022-11-13T12:28:08Z,steelers,-0.2263
35513,248551,248551,dac09b,That's delusional lol,1.0,steelers,t3_yu7cum,False,0.0,:sc::c9::c0::sc: TJ Watt,2022-11-13T12:20:21Z,steelers,0.4215
35514,248552,248552,dac09b,Ya easily caught by defenses too.,0.0,steelers,t3_yu7cum,False,0.0,:sc::c9::c0::sc: TJ Watt,2022-11-13T12:19:55Z,steelers,0.4767
35515,248553,248553,dac09b,The same but on the field. Minus TJ is fun,1.0,steelers,t3_yu7cum,False,0.0,:sc::c9::c0::sc: TJ Watt,2022-11-13T12:19:27Z,steelers,0.2553
35516,248555,248555,dac09b,Is that not a penalty?,6.0,steelers,t3_yu7cum,False,0.0,:sc::c9::c0::sc: TJ Watt,2022-11-13T12:18:34Z,steelers,0.357
35517,248556,248556,dac09b,We gotta get qbs out of shotgun. It's killer.,3.0,steelers,t3_yu7cum,False,0.0,:sc::c9::c0::sc: TJ Watt,2022-11-13T12:17:36Z,steelers,-0.3243
35518,248557,248557,dac09b,Nice run naj single cut get up field.,3.0,steelers,t3_yu7cum,False,0.0,:sc::c9::c0::sc: TJ Watt,2022-11-13T12:16:44Z,steelers,0.1779
35519,248558,248558,dac09b,Ah I need Sims to actually do returns that's basically our offense.,4.0,steelers,t3_yu7cum,False,0.0,:sc::c9::c0::sc: TJ Watt,2022-11-13T12:13:36Z,steelers,-0.25
35520,248559,248559,dac09b,Ya rolling out already cuts the field in half. And everyone can shade that way. Just a bad play with no play action.,1.0,steelers,t3_yu7cum,False,0.0,:sc::c9::c0::sc: TJ Watt,2022-11-13T12:12:31Z,steelers,-0.1719296296296296
35521,248561,248561,dac09b,"I think Alex korzora made a comment about our Dr's evaluations on Twitter. 

Feels like they shut him down on purpose to save the draft pick since he wasn't 100% healthy.",1.0,steelers,t3_ytk1yy,False,0.0,:sc::c9::c0::sc: TJ Watt,2022-11-13T11:40:58Z,steelers,0.2667
35724,250789,250789,datbeerdude,Dropson is really clever,-1.0,steelers,t3_yx81wa,False,1.0,:PIT1::PIT2: Pittsburgh Steelers,2022-11-16T18:52:33Z,steelers,0.5095
35725,250790,250790,datbeerdude,Are you specifically talking about like late stage Ben?,4.0,steelers,t3_yx81wa,False,0.0,:PIT1::PIT2: Pittsburgh Steelers,2022-11-16T18:49:51Z,steelers,0.3612
35726,250799,250799,datbeerdude,Marvin Harrison was the best at this,1.0,nfl,t3_yt9zvq,False,0.0,:Steelers: Steelers,2022-11-12T21:15:14Z,steelers,0.6369
35827,251869,251869,dirtylaundry99,"well guys, that cj stroud is lookin real good",2.0,steelers,t3_yu7cum,False,1.0,:primantis:Primanti Bro's,2022-11-13T13:44:55Z,steelers,0.6124
35958,256201,256201,drinkduffdry,Are we really dogs to the saints? They are also bad.,26.0,steelers,t3_ysqczk,False,0.0,:sb::b8::b6::sb: Hines Ward,2022-11-11T19:05:35Z,steelers,-0.27115
36047,257791,257791,duderama,I like it,9.0,steelers,t3_yveiqn,False,0.0,Juju,2022-11-14T16:20:34Z,steelers,0.3612
36048,257792,257792,duderama,Glad to provide my dude!,1.0,steelers,t3_yu7cum,False,0.0,Juju,2022-11-13T14:12:10Z,steelers,0.5093
37491,263028,263028,gerg911,wtf was that throw lmao,7.0,steelers,t3_yu7cum,False,0.0,Quack,2022-11-13T13:12:27Z,steelers,0.0258
37492,263031,263031,gerg911,100% concussion FUCK,3.0,steelers,t3_yu7cum,False,0.0,Quack,2022-11-13T12:39:36Z,steelers,-0.6408
38138,270132,270132,ilovetjwatt,Justice for Joe Haden,81.0,steelers,t3_yudvzb,False,0.0,:sc::c9::c0::sc: DPOY 2021 ,2022-11-13T14:56:55Z,steelers,0.5267
38139,270133,270133,ilovetjwatt,"Run, run, run with three different players to close out the game. That was fun",3.0,steelers,t3_yu7cum,False,0.0,:sc::c9::c0::sc: DPOY 2021 ,2022-11-13T14:53:09Z,steelers,0.2553
38140,270134,270134,ilovetjwatt,Najee and Warren have both looked great today. You don’t have to take one side lol,12.0,steelers,t3_yu7cum,False,0.0,:sc::c9::c0::sc: DPOY 2021 ,2022-11-13T14:52:17Z,steelers,0.366975
38141,270135,270135,ilovetjwatt,the Steelers really got flexed out of primetime when the offense finally looks competent 😭😭,13.0,steelers,t3_yu7cum,False,0.0,:sc::c9::c0::sc: DPOY 2021 ,2022-11-13T14:49:11Z,steelers,-0.7096
38142,270137,270137,ilovetjwatt,Bos I miss u,4.0,steelers,t3_yu7cum,False,0.0,:sc::c9::c0::sc: DPOY 2021 ,2022-11-13T14:41:21Z,steelers,-0.1531
38143,270138,270138,ilovetjwatt,Let us not forget the pigeons for their contribution today,11.0,steelers,t3_yu7cum,False,0.0,:sc::c9::c0::sc: DPOY 2021 ,2022-11-13T14:38:30Z,steelers,0.1695
38144,270139,270139,ilovetjwatt,LETS GO DEFENSE,7.0,steelers,t3_yu7cum,False,0.0,:sc::c9::c0::sc: DPOY 2021 ,2022-11-13T14:35:53Z,steelers,0.128
38145,270140,270140,ilovetjwatt,That was some nice secondary,4.0,steelers,t3_yu7cum,False,0.0,:sc::c9::c0::sc: DPOY 2021 ,2022-11-13T14:34:25Z,steelers,0.4215
38146,270141,270141,ilovetjwatt,I can’t feel bad for the saints after the phantom PIs against Joe Haden last matchup,17.0,steelers,t3_yu7cum,False,0.0,:sc::c9::c0::sc: DPOY 2021 ,2022-11-13T14:29:05Z,steelers,-0.5423
38147,270143,270143,ilovetjwatt,I love some 4th quarter Renegade,3.0,steelers,t3_yu7cum,False,0.0,:sc::c9::c0::sc: DPOY 2021 ,2022-11-13T14:19:48Z,steelers,0.6369
38148,270147,270147,ilovetjwatt,Such a good drive that ended with nothing 😑,3.0,steelers,t3_yu7cum,False,0.0,:sc::c9::c0::sc: DPOY 2021 ,2022-11-13T13:54:44Z,steelers,0.4404
38149,270149,270149,ilovetjwatt,Kevin Dotson lol,3.0,steelers,t3_yu7cum,False,0.0,:sc::c9::c0::sc: DPOY 2021 ,2022-11-13T13:52:29Z,steelers,0.4215
38150,270150,270150,ilovetjwatt,That play was beautiful,3.0,steelers,t3_yu7cum,False,0.0,:sc::c9::c0::sc: DPOY 2021 ,2022-11-13T13:50:42Z,steelers,0.743
38151,270151,270151,ilovetjwatt,Nice run Kenny,4.0,steelers,t3_yu7cum,False,0.0,:sc::c9::c0::sc: DPOY 2021 ,2022-11-13T13:48:04Z,steelers,0.4215
38152,270152,270152,ilovetjwatt,Kenny wtf lol,5.0,steelers,t3_yu7cum,False,0.0,:sc::c9::c0::sc: DPOY 2021 ,2022-11-13T13:12:02Z,steelers,-0.25
38153,270153,270153,ilovetjwatt,Another Watt has saved us,2.0,steelers,t3_yu7cum,False,0.0,:sc::c9::c0::sc: DPOY 2021 ,2022-11-13T13:11:17Z,steelers,0.4215
38154,270154,270154,ilovetjwatt,I love DJ but he always runs backwards. Stop this nonsense lol,3.0,steelers,t3_yu7cum,False,0.0,:sc::c9::c0::sc: DPOY 2021 ,2022-11-13T13:08:55Z,steelers,-0.04115
38155,270158,270158,ilovetjwatt,Thanks for the update! Glad Najee is okay and that they evaluated him to make sure,3.0,steelers,t3_yu7cum,False,0.0,:sc::c9::c0::sc: DPOY 2021 ,2022-11-13T12:50:33Z,steelers,0.4906999999999999
38156,270159,270159,ilovetjwatt,Maulet 😍😍,5.0,steelers,t3_yu7cum,False,0.0,:sc::c9::c0::sc: DPOY 2021 ,2022-11-13T12:49:58Z,steelers,0.7184
38157,270162,270162,ilovetjwatt,Nice stop defense,2.0,steelers,t3_yu7cum,False,0.0,:sc::c9::c0::sc: DPOY 2021 ,2022-11-13T12:31:25Z,steelers,0.2732
38158,270163,270163,ilovetjwatt,So many pigeons at the 50 lol,3.0,steelers,t3_yu7cum,False,0.0,:sc::c9::c0::sc: DPOY 2021 ,2022-11-13T12:24:41Z,steelers,0.4215
38159,270166,270166,ilovetjwatt,Great job escaping the sack,3.0,steelers,t3_yu7cum,False,0.0,:sc::c9::c0::sc: DPOY 2021 ,2022-11-13T12:21:24Z,steelers,0.6486
38160,270167,270167,ilovetjwatt,They converted on 4th down 😅,2.0,steelers,t3_yu7cum,False,0.0,:sc::c9::c0::sc: DPOY 2021 ,2022-11-13T12:19:12Z,steelers,0.3612
38161,270168,270168,ilovetjwatt,Yasss Najee. Make the haters shut up,6.0,steelers,t3_yu7cum,False,0.0,:sc::c9::c0::sc: DPOY 2021 ,2022-11-13T12:16:27Z,steelers,-0.24695
38162,270169,270169,ilovetjwatt,Wow TJ makes an immediate impact. Just give him MVP,5.0,steelers,t3_yu7cum,False,0.0,:sc::c9::c0::sc: DPOY 2021 ,2022-11-13T12:12:35Z,steelers,0.146475
38163,270170,270170,ilovetjwatt,We’re about to see TJ again 😍😍😍,2.0,steelers,t3_yu7cum,False,0.0,:sc::c9::c0::sc: DPOY 2021 ,2022-11-13T12:09:13Z,steelers,0.8402
38790,272253,272253,imyourrealdad8,Lol good fuckin luck with that,3.0,steelers,t3_yx7xbr,False,1.0,:sa::a9::a7::sa: Cameron Heyward,2022-11-16T16:49:45Z,steelers,0.8399
38791,272255,272255,imyourrealdad8,BREAKING: Urban Meyer will attend Thursday's game so he can kick the shit out of Lambo once and for all,57.0,nfl,t3_yx5uic,False,0.0,:Steelers: Steelers,2022-11-16T14:56:17Z,steelers,0.6124
38792,272256,272256,imyourrealdad8,"""Yesterday they may have been something other than the Jets. But today, they're the Jets."" -- Greatest Football Mind of Our Time",1.0,nfl,t3_yx1ync,False,0.0,:Steelers: Steelers,2022-11-16T14:44:12Z,steelers,0.2123
38793,272258,272258,imyourrealdad8,"I'm not saying rush him. I'm saying if he's cleared medically and Minkah wants to play, that would be lit. Of course he should sit if he can't go, or isn't cleared by the docs.

I've had my appendix out and cannot imagine playing a football game a week later--I could hardly sit at a desk for 8 hours a week after my appendix was removed, let alone running around and tackling and shit. But Minkah's built different and that's why he's an elite athlete. If he can play and wants to, I'll be glad to cheer him on this Sunday.",1.0,nfl,t3_yx28nq,False,0.0,:Steelers: Steelers,2022-11-16T13:14:42Z,steelers,0.1344449459876543
38794,272261,272261,imyourrealdad8,"Ah yes, the world-renowned appendix expert, Dr. WhoDey42 lmao",41.0,nfl,t3_yx28nq,False,0.0,:Steelers: Steelers,2022-11-16T12:48:39Z,steelers,0.765
38795,272262,272262,imyourrealdad8,Fuck that. See you Sunday Joey.,51.0,nfl,t3_yx28nq,False,0.0,:Steelers: Steelers,2022-11-16T12:46:46Z,steelers,-0.135575
38796,272264,272264,imyourrealdad8,Judge kicked Lambo right in the nuts on the way out the courtroom,59.0,nfl,t3_yx0ytw,False,0.0,:Steelers: Steelers,2022-11-16T12:05:59Z,steelers,-0.3182
38797,272271,272271,imyourrealdad8,"As someone who's had their appendix out, all I can say is: There goes my fucking hero.",54.0,steelers,t3_yw3g48,False,0.0,:sa::a9::a7::sa: Cameron Heyward,2022-11-15T11:42:04Z,steelers,0.5984
38798,272279,272279,imyourrealdad8,Kyle's trying his fuckin best dude,2.0,nfl,t3_yuk8vl,False,0.0,:Steelers: Steelers,2022-11-13T22:20:04Z,steelers,0.6697
38799,272281,272281,imyourrealdad8,She sounds handsome,3.0,nfl,t3_yuk8vl,False,0.0,:Steelers: Steelers,2022-11-13T22:18:00Z,steelers,0.4939
38800,272284,272284,imyourrealdad8,Special Teams coaches HATE this one trick,1.0,nfl,t3_yuk8vl,False,0.0,:Steelers: Steelers,2022-11-13T22:11:06Z,steelers,-0.4466
38801,272286,272286,imyourrealdad8,"I hate the way Tirico says ""McCaff-er-rey""",4.0,nfl,t3_yuk8vl,False,0.0,:Steelers: Steelers,2022-11-13T22:07:31Z,steelers,-0.5719
38802,272288,272288,imyourrealdad8,No ♥️,2.0,nfl,t3_yuk8vl,False,0.0,:Steelers: Steelers,2022-11-13T21:41:19Z,steelers,-0.5216
38803,272289,272289,imyourrealdad8,They're all just Rob Lowe,7.0,nfl,t3_yuk8vl,False,0.0,:Steelers: Steelers,2022-11-13T21:40:20Z,steelers,-0.4767
38804,272290,272290,imyourrealdad8,I don't want a Toyota dude please stop,3.0,nfl,t3_yuk8vl,False,0.0,:Steelers: Steelers,2022-11-13T21:39:43Z,steelers,-0.0315
38805,272294,272294,imyourrealdad8,"NOW HERES A GUY, WHO AGREES WITH ME",6.0,nfl,t3_yuk8vl,False,0.0,:Steelers: Steelers,2022-11-13T21:21:23Z,steelers,0.2023
38806,272299,272299,imyourrealdad8,Cool stuff! How long did this take you to make?,7.0,steelers,t3_yu40fa,False,0.0,:sa::a9::a7::sa: Cameron Heyward,2022-11-13T09:07:32Z,steelers,0.09505
38807,272300,272300,imyourrealdad8,Ain't no way you've watched all Steeler games this season and think Mitch is the better option lol,4.0,nfl,t3_ytkfgf,False,0.0,:Steelers: Steelers,2022-11-12T23:42:05Z,steelers,0.7641
38808,272301,272301,imyourrealdad8,Still better than Money Mitch,50.0,nfl,t3_ytkfgf,False,0.0,:Steelers: Steelers,2022-11-12T16:47:46Z,steelers,0.4404
38809,272304,272304,imyourrealdad8,Lmao cursed ornament,17.0,steelers,t3_ytj245,False,0.0,:sa::a9::a7::sa: Cameron Heyward,2022-11-12T16:25:03Z,steelers,0.5994
38810,272312,272312,imyourrealdad8,"""Put your hands up my ass one last time bro.""  


""Gotchu fam.""",83.0,nfl,t3_ysdjrq,False,0.0,:Steelers: Steelers,2022-11-11T10:45:03Z,steelers,-0.135575
38811,272314,272314,imyourrealdad8,lol Skinny Jimmy Harrison,1.0,steelers,t3_ys1dq3,False,0.0,:sa::a9::a7::sa: Cameron Heyward,2022-11-11T09:41:17Z,steelers,0.4215
40290,281387,281387,knightro2323,"Ben had a CANNON, unfortunately Pickett does not.",9.0,steelers,t3_yx81wa,False,0.0,:sb::b8::b6::sb: Hines Ward,2022-11-16T22:04:18Z,steelers,-0.34
40291,281392,281392,knightro2323,Refs were always going to give a get even call after missing that facemask,4.0,nfl,t3_yvhyye,False,0.0,:Steelers: Steelers,2022-11-14T21:53:52Z,steelers,-0.296
40292,281396,281396,knightro2323,lol damn,1.0,steelers,t3_yu7cum,False,0.0,:sb::b8::b6::sb: Hines Ward,2022-11-13T14:58:33Z,steelers,0.0258
40293,281399,281399,knightro2323,strong hands,2.0,steelers,t3_yu7cum,False,0.0,:sb::b8::b6::sb: Hines Ward,2022-11-13T14:43:46Z,steelers,0.5106
40294,281401,281401,knightro2323,Why is T. Hill even on NO if not for that sneak,5.0,steelers,t3_yu7cum,False,0.0,:sb::b8::b6::sb: Hines Ward,2022-11-13T14:39:13Z,steelers,-0.4466
40295,281402,281402,knightro2323,"overthinking it, Hill is a dead give away but in the end they didn't disguise anything so it was already given away.",3.0,nfl,t3_yu84ll,False,0.0,:Steelers: Steelers,2022-11-13T14:38:17Z,steelers,-0.1381
40296,281407,281407,knightro2323,"they have no plays in the RZ, Pickens nowhere to be seen",1.0,steelers,t3_yu7cum,False,0.0,:sb::b8::b6::sb: Hines Ward,2022-11-13T14:27:37Z,steelers,-0.1877
40297,281409,281409,knightro2323,"They gained yards on the fumble 

LOL",3.0,steelers,t3_yu7cum,False,0.0,:sb::b8::b6::sb: Hines Ward,2022-11-13T14:24:04Z,steelers,0.7297
40298,281410,281410,knightro2323,Kazee doing his best Minkah impression,3.0,steelers,t3_yu7cum,False,0.0,:sb::b8::b6::sb: Hines Ward,2022-11-13T14:22:56Z,steelers,0.7269
40299,281411,281411,knightro2323,"talk about unlucky, kicker contact and its tipped so no penalty",1.0,steelers,t3_yu7cum,False,0.0,:sb::b8::b6::sb: Hines Ward,2022-11-13T14:20:11Z,steelers,0.481
40300,281412,281412,knightro2323,2 successful drives in the second half and the best they can hope for is they make this FG,8.0,steelers,t3_yu7cum,False,0.0,:sb::b8::b6::sb: Hines Ward,2022-11-13T14:16:06Z,steelers,0.8979
40301,281415,281415,knightro2323,"Lets just hope it isn't 12-10 after this drive. 

I see an holding call coming",6.0,steelers,t3_yu7cum,False,0.0,:sb::b8::b6::sb: Hines Ward,2022-11-13T14:04:30Z,steelers,0.1101
40302,281416,281416,knightro2323,You can only laugh at how bad they are,2.0,steelers,t3_yu7cum,False,0.0,:sb::b8::b6::sb: Hines Ward,2022-11-13T14:00:13Z,steelers,0.0258
40303,281418,281418,knightro2323,"zero points out of that

unacceptable",7.0,steelers,t3_yu7cum,False,0.0,:sb::b8::b6::sb: Hines Ward,2022-11-13T13:54:14Z,steelers,-0.4588
40304,281419,281419,knightro2323,Canada sucks but this team can't execute for shit.,7.0,steelers,t3_yu7cum,False,0.0,:sb::b8::b6::sb: Hines Ward,2022-11-13T13:53:32Z,steelers,0.4829
40305,281421,281421,knightro2323,"I won't judge Pickett, but whatever the verdict I hope they don't waffle. If they have a pick that could put a top QB in their locker room take it and let them sort it out on the field. You only win with QBs now and Pickett wasn't Kahn or Wedels pick.",4.0,steelers,t3_yu7cum,False,0.0,:sb::b8::b6::sb: Hines Ward,2022-11-13T13:41:24Z,steelers,0.2435407407407407
40306,281422,281422,knightro2323,They had 2 weeks to prepare and Pickett looks as bad as he has all year.,5.0,steelers,t3_yu7cum,False,1.0,:sb::b8::b6::sb: Hines Ward,2022-11-13T13:27:20Z,steelers,-0.5423
40307,281423,281423,knightro2323,"Their insistence on putting Spillane in coverage situations is nuts. Makes no sense, he is a borderline ST player but they have him out there every week with his 4.77 speed covering athletes 10x his abilities.",7.0,steelers,t3_yu7cum,False,0.0,:sb::b8::b6::sb: Hines Ward,2022-11-13T13:25:10Z,steelers,0.0336
40308,281426,281426,knightro2323,"It was meh because he got injured, he was still 65% completions and 13td only 5 ints",0.0,steelers,t3_yu7cum,False,0.0,:sb::b8::b6::sb: Hines Ward,2022-11-13T13:20:34Z,steelers,-0.4588
40309,281427,281427,knightro2323,"He didn't touch him, that was a flop",9.0,steelers,t3_yu7cum,False,0.0,:sb::b8::b6::sb: Hines Ward,2022-11-13T13:18:29Z,steelers,-0.34
40310,281428,281428,knightro2323,"There was no routes in the middle of the field, on that view. 

edit - looks like one man was trying to get there",1.0,steelers,t3_yu7cum,False,0.0,:sb::b8::b6::sb: Hines Ward,2022-11-13T13:15:07Z,steelers,0.1066
40311,281430,281430,knightro2323,"Throws it into 3 defenders and was 8 yards away from his TE

Pickett has been extremely inaccurate today",7.0,steelers,t3_yu7cum,False,0.0,:sb::b8::b6::sb: Hines Ward,2022-11-13T13:12:07Z,steelers,0.0772
40312,281431,281431,knightro2323,If he didn't do that regularly I wouldn't be so mad about that.,8.0,steelers,t3_yu7cum,False,0.0,:sb::b8::b6::sb: Hines Ward,2022-11-13T13:09:18Z,steelers,-0.6269
40313,281434,281434,knightro2323,Wow Maulett,9.0,steelers,t3_yu7cum,False,0.0,:sb::b8::b6::sb: Hines Ward,2022-11-13T12:49:29Z,steelers,0.5859
40314,281435,281435,knightro2323,>Najee Harris evaluated for a concussion and cleared to return to play. Good news for Steelers offense.,15.0,steelers,t3_yu7cum,False,0.0,:sb::b8::b6::sb: Hines Ward,2022-11-13T12:48:15Z,steelers,0.218525
40315,281437,281437,knightro2323,"3 and 11....5 yard pass because the line gets shredded



DJ was so open the previous play",4.0,steelers,t3_yu7cum,False,0.0,:sb::b8::b6::sb: Hines Ward,2022-11-13T12:43:04Z,steelers,0.34
40316,281439,281439,knightro2323,"Pickens running Claypools plays

That's gonna be close",6.0,steelers,t3_yu7cum,False,0.0,:sb::b8::b6::sb: Hines Ward,2022-11-13T12:23:52Z,steelers,0.25
40868,287010,287010,littlemesix7,You just got some Kenny Wood sounds so much better.,0.0,steelers,t3_yug606,False,0.0,:sa::a9::a7::sa: Cameron Heyward,2022-11-13T20:05:28Z,steelers,0.4902
40870,287012,287012,littlemesix7,Need to make sure they keep Acrisure peregrine falcon free. They love to eat those city chickens.,4.0,steelers,t3_yudyls,False,0.0,:sa::a9::a7::sa: Cameron Heyward,2022-11-13T17:18:41Z,steelers,0.48865
41153,291379,291379,meganutsdeathpunch,Well I’m not. I cant with y’all young asses….,0.0,steelers,t3_ysg4oe,False,0.0,:sb::b9::b2::sb: DEEBO,2022-11-12T21:15:36Z,steelers,0.0683
41910,295747,295747,mitchmatch26,I loved watching him so much I’d watch him and Ben’s highlight tapes before each season those years.,5.0,steelers,t3_yx3hk4,False,0.0,:sb::b8::sb: KENNYTHING IS POSSIBLE,2022-11-16T16:20:15Z,steelers,0.743
41911,295748,295748,mitchmatch26,And then add in Najee’s 300 APY and 4 total TDs 😵😵😵,5.0,steelers,t3_ywwvj3,False,0.0,:sb::b8::sb: KENNYTHING IS POSSIBLE,2022-11-16T16:07:08Z,steelers,-0.6096
41912,295750,295750,mitchmatch26,For sure.,6.0,steelers,t3_yx054r,False,0.0,:sb::b8::sb: KENNYTHING IS POSSIBLE,2022-11-16T11:48:32Z,steelers,0.3182
41913,295751,295751,mitchmatch26,Ogunjobi has looked solid so far so adding even more depth can only help.,78.0,steelers,t3_yx054r,False,0.0,:sb::b8::sb: KENNYTHING IS POSSIBLE,2022-11-16T11:45:51Z,steelers,0.5106
41914,295752,295752,mitchmatch26,Can’t start what you never stopped,3.0,steelers,t3_ywukg6,False,0.0,:sb::b8::sb: KENNYTHING IS POSSIBLE,2022-11-16T11:41:17Z,steelers,0.1695
41915,295754,295754,mitchmatch26,"When TJ bodies La’el Collins again will bengals fans continue to say TJ was *trying* to rip off Collins helmet on the play he got hurt? Or will there be a new narrative? 

Because, as we all know, bang bang plays can’t just happen in games against the Bengals. It’s a scheme by the DIRTY Steelers to harm the innocent Bengals.",22.0,steelers,t3_ywukg6,False,0.0,:sb::b8::sb: KENNYTHING IS POSSIBLE,2022-11-16T08:49:43Z,steelers,-0.1588515625
41916,295755,295755,mitchmatch26,And remove the awful B logo from the chest.,4.0,steelers,t3_ywdwwh,False,0.0,:sb::b8::sb: KENNYTHING IS POSSIBLE,2022-11-15T21:42:49Z,steelers,-0.4588
41917,295757,295757,mitchmatch26,It’s alright haha I wouldn’t expect many to know random Bengal facts and you found out pretty much the same way I did,9.0,steelers,t3_ywdwwh,False,0.0,:sb::b8::sb: KENNYTHING IS POSSIBLE,2022-11-15T19:01:27Z,steelers,0.802
41918,295759,295759,mitchmatch26,No doubt,13.0,steelers,t3_ywdwwh,False,0.0,:sb::b8::sb: KENNYTHING IS POSSIBLE,2022-11-15T18:09:58Z,steelers,0.2755
41919,295760,295760,mitchmatch26,I think they need just a *litttttttle* more orange and they’d be perfect,25.0,steelers,t3_ywdwwh,False,0.0,:sb::b8::sb: KENNYTHING IS POSSIBLE,2022-11-15T18:09:28Z,steelers,0.5719
41920,295762,295762,mitchmatch26,"Im not saying he’s been good, great, bad nor terrible. I even said it’s still not great. Just getting the full scope of the comparison.",4.0,steelers,t3_yw6esj,False,0.0,:sb::b8::sb: KENNYTHING IS POSSIBLE,2022-11-15T17:33:53Z,steelers,-0.0298407407407407
41921,295763,295763,mitchmatch26,Okay,20.0,steelers,t3_yw6esj,False,0.0,:sb::b8::sb: KENNYTHING IS POSSIBLE,2022-11-15T14:59:51Z,steelers,0.2263
41922,295765,295765,mitchmatch26,I mean you ruled out Harbs for the same reason so it would stand to reason that tomlin should be exempt using the same logic.....,11.0,steelers,t3_yw6f7g,False,0.0,:sb::b8::sb: KENNYTHING IS POSSIBLE,2022-11-15T13:47:53Z,steelers,0.1027
41923,295767,295767,mitchmatch26,Stats kinda bullshit. Clausen and Leaf had no rushing TDs to go with their passing TDs. Kenny has 5 total TDs. Still not great but def not 2 TDs total.,110.0,steelers,t3_yw6esj,False,0.0,:sb::b8::sb: KENNYTHING IS POSSIBLE,2022-11-15T13:26:35Z,steelers,-0.0777476562499999
41924,295769,295769,mitchmatch26,"> bear New Orleans which would mean nothing

It would mean we have another win dawg which is better than losing",9.0,steelers,t3_yw4yle,False,0.0,:sb::b8::sb: KENNYTHING IS POSSIBLE,2022-11-15T12:13:48Z,steelers,0.6249
41925,295770,295770,mitchmatch26,He’s got the best blood. The strongest blood. Nobody’s blood comes close. Ask anyone. They’ll tell you. They’ll tell you “Minkah has the best blood.” Go ahead. Ask them.,27.0,steelers,t3_yw3g48,False,0.0,:sb::b8::sb: KENNYTHING IS POSSIBLE,2022-11-15T11:57:33Z,steelers,0.0130024758877192
