,Unnamed: 0.1,Unnamed: 0,author,body,score,subreddit,link_id,over_18,controversiality,author_flair_text,created_utc,flair,sentiment
31638,219649,219649,Zane_Flynt_boyo,Whats embarassing about that? I can just check to what I missed really easily.,4.0,nfl,t3_yt9chc,False,0.0,:Steelers: Steelers :Panthers: Panthers,2022-11-12T11:10:50Z,steelers,0.06315
31639,219651,219651,Zane_Flynt_boyo,AFCN fans will never make the browns forget and yall will deal with it,3.0,nfl,t3_ysuopi,False,0.0,:Steelers: Steelers :Panthers: Panthers,2022-11-12T05:48:06Z,steelers,-0.2263
32097,220868,220868,Zestyclose_Risk_2789,At least 1 person in this thread had a heart attack after that fumble,1.0,steelers,t3_yu7cum,False,0.0,:tomlin1a::tomlin1b:Encroachment,2022-11-13T14:24:10Z,steelers,0.2732
32098,220869,220869,Zestyclose_Risk_2789,Hopefully they do it again,1.0,steelers,t3_yu7cum,False,0.0,:tomlin1a::tomlin1b:Encroachment,2022-11-13T14:22:26Z,steelers,0.4019
32099,220870,220870,Zestyclose_Risk_2789,"I appreciate this dad joke, and also I relate to it",2.0,steelers,t3_yu7cum,False,0.0,:tomlin1a::tomlin1b:Encroachment,2022-11-13T14:21:31Z,steelers,0.5994
32100,220877,220877,Zestyclose_Risk_2789,"Not getting much protection, or should say consistent. Makes it tough to stand there if you’re unsure whether you’re gonna get killed",3.0,steelers,t3_yu7cum,False,0.0,:tomlin1a::tomlin1b:Encroachment,2022-11-13T13:29:28Z,steelers,-0.3953
32101,220879,220879,Zestyclose_Risk_2789,Haha touché,2.0,steelers,t3_yu7cum,False,0.0,:tomlin1a::tomlin1b:Encroachment,2022-11-13T13:23:21Z,steelers,0.4588
32102,220880,220880,Zestyclose_Risk_2789,I literally sit alone every week watching these games. Really appreciate these threads,8.0,steelers,t3_yu7cum,False,0.0,:tomlin1a::tomlin1b:Encroachment,2022-11-13T13:20:23Z,steelers,0.1663
32103,220882,220882,Zestyclose_Risk_2789,"He didn’t call Claypool out, but it was something along the lines of, “we were able to clear our heads and focus better”",1.0,steelers,t3_yu7cum,False,0.0,:tomlin1a::tomlin1b:Encroachment,2022-11-13T13:17:59Z,steelers,0.5267
32104,220883,220883,Zestyclose_Risk_2789,There’s a reason he’s on the the worst network on the C announcer team,2.0,steelers,t3_yu7cum,False,0.0,:tomlin1a::tomlin1b:Encroachment,2022-11-13T13:16:01Z,steelers,-0.6249
32105,220884,220884,Zestyclose_Risk_2789,"Not sure you heard the interview he did this week, but sounds like Claypool was a big distraction for Najee",2.0,steelers,t3_yu7cum,False,0.0,:tomlin1a::tomlin1b:Encroachment,2022-11-13T13:15:07Z,steelers,-0.1608
32106,220885,220885,Zestyclose_Risk_2789,Owes him a nice dinner at Mendys or something,2.0,steelers,t3_yu7cum,False,0.0,:tomlin1a::tomlin1b:Encroachment,2022-11-13T13:14:01Z,steelers,0.4215
32107,220886,220886,Zestyclose_Risk_2789,"This is a guess, so don’t kill me here. I think he’s slow and doesn’t see well. Needs to step back and see where to run.",2.0,steelers,t3_yu7cum,False,0.0,:tomlin1a::tomlin1b:Encroachment,2022-11-13T13:10:31Z,steelers,0.0038185185185185
32108,220887,220887,Zestyclose_Risk_2789,That was a Liberty tubes sized hole that Najee ran past,3.0,steelers,t3_yu7cum,False,0.0,:tomlin1a::tomlin1b:Encroachment,2022-11-13T13:09:17Z,steelers,0.5267
32109,220888,220888,Zestyclose_Risk_2789,It’s amazing how worth every dollar TJ is,11.0,steelers,t3_yu7cum,False,0.0,:tomlin1a::tomlin1b:Encroachment,2022-11-13T13:02:54Z,steelers,0.6908
32110,220891,220891,Zestyclose_Risk_2789,"We haven’t had an explosive RB for a long time. Najee is fast, but not like instant speed like some RBs do",2.0,steelers,t3_yu7cum,False,0.0,:tomlin1a::tomlin1b:Encroachment,2022-11-13T12:56:05Z,steelers,0.0747
32111,220893,220893,Zestyclose_Risk_2789,We should just all refer to him as Artie. Imagine someone meeting him and accidentally calling him that,1.0,steelers,t3_yu7cum,False,0.0,:tomlin1a::tomlin1b:Encroachment,2022-11-13T12:52:23Z,steelers,-0.17
32112,220894,220894,Zestyclose_Risk_2789,Gets to learn from the 2nd best kicker in the league,2.0,steelers,t3_yu7cum,False,0.0,:tomlin1a::tomlin1b:Encroachment,2022-11-13T12:50:48Z,steelers,0.6369
32113,220895,220895,Zestyclose_Risk_2789,"It’s so good, never heard that one before",6.0,steelers,t3_yu7cum,False,0.0,:tomlin1a::tomlin1b:Encroachment,2022-11-13T12:49:50Z,steelers,0.4927
32114,220899,220899,Zestyclose_Risk_2789,"Ahh, maybe I saw a different ad, my bad",2.0,steelers,t3_yu7cum,False,0.0,:tomlin1a::tomlin1b:Encroachment,2022-11-13T12:41:42Z,steelers,-0.5423
32115,220900,220900,Zestyclose_Risk_2789,Impatient and dumb,1.0,steelers,t3_yu7cum,False,0.0,:tomlin1a::tomlin1b:Encroachment,2022-11-13T12:30:45Z,steelers,-0.6705
32116,220901,220901,Zestyclose_Risk_2789,What? Is this really the thread? No one here gives a shit about Qatar right now,0.0,steelers,t3_yu7cum,False,0.0,:tomlin1a::tomlin1b:Encroachment,2022-11-13T12:30:08Z,steelers,-0.2334333333333333
32117,220902,220902,Zestyclose_Risk_2789,"I hope not, but christ let the kid grow and adjust to the NFL.",0.0,steelers,t3_yu7cum,False,0.0,:tomlin1a::tomlin1b:Encroachment,2022-11-13T12:28:29Z,steelers,0.2382
32118,220903,220903,Zestyclose_Risk_2789,"If anyone is wondering, it’s true",1.0,steelers,t3_yu7cum,False,0.0,:tomlin1a::tomlin1b:Encroachment,2022-11-13T12:27:34Z,steelers,0.4215
32119,220905,220905,Zestyclose_Risk_2789,Idiot,1.0,steelers,t3_yu7cum,False,0.0,:tomlin1a::tomlin1b:Encroachment,2022-11-13T12:25:51Z,steelers,-0.5106
32120,220908,220908,Zestyclose_Risk_2789,What an awesome picture,1.0,steelers,t3_ytt2hc,False,0.0,:tomlin1a::tomlin1b:Encroachment,2022-11-13T11:04:34Z,steelers,0.6249
32121,220910,220910,Zestyclose_Risk_2789,"Totally agree. Really stupid to give him that much money. Probably top 3 route runner, but bottom 50 hands",-6.0,steelers,t3_ys2kq4,False,0.0,:tomlin1a::tomlin1b:Encroachment,2022-11-11T09:59:12Z,steelers,-0.0136407407407407
32122,220911,220911,Zestyclose_Risk_2789,You’re dumb,2.0,steelers,t3_ys2kq4,False,0.0,:tomlin1a::tomlin1b:Encroachment,2022-11-11T09:58:10Z,steelers,-0.5106
32294,221925,221925,ZombiePancake45,"Cincy fan's are easily the most insufferable, followed by browns, and the Ravens is mutual hate and respect",5.0,steelers,t3_ywzz56,False,0.0,:troy1::troy2:Troy,2022-11-16T11:42:47Z,steelers,0.2023
32295,221928,221928,ZombiePancake45,I think it would be nice given how he's played in the past year and a half,3.0,steelers,t3_ywi1xe,False,0.0,:troy1::troy2:Troy,2022-11-15T21:20:47Z,steelers,0.6369
32296,221930,221930,ZombiePancake45,"No way Ben typed ""Yee yee""",327.0,steelers,t3_ywh0d6,False,0.0,:troy1::troy2:Troy,2022-11-15T20:33:04Z,steelers,-0.296
32297,221932,221932,ZombiePancake45,lol,2.0,nfl,t3_yvhyye,False,0.0,:Steelers: Steelers,2022-11-14T22:04:13Z,steelers,0.4215
32298,221935,221935,ZombiePancake45,"Get better soon, just not too soon",46.0,steelers,t3_yv6opw,False,0.0,:troy1::troy2:Troy,2022-11-14T11:58:21Z,steelers,0.4404
32299,221943,221943,ZombiePancake45,Thank you Mr. Lions very cool,1.0,nfl,t3_yudyr5,False,0.0,:Steelers: Steelers,2022-11-13T15:03:54Z,steelers,0.624
32300,221946,221946,ZombiePancake45,Those Fox player images are really kind to Kenny's hands,1.0,nfl,t3_yu84ll,False,0.0,:Steelers: Steelers,2022-11-13T14:30:04Z,steelers,0.5709
32301,221949,221949,ZombiePancake45,"Saints, thank you for making us look half-decent today",9.0,nfl,t3_yu84ll,False,0.0,:Steelers: Steelers,2022-11-13T12:40:13Z,steelers,0.3612
32302,221956,221956,ZombiePancake45,Praise be!,9.0,steelers,t3_yshwb2,False,0.0,:troy1::troy2:Troy,2022-11-11T12:02:52Z,steelers,0.5983
32576,224759,224759,amoeba-tower,Kind of odd that he's not on the practice squad and they just straight released him,1.0,nfl,t3_yw4sri,False,0.0,:Steelers: Steelers,2022-11-16T01:15:32Z,steelers,-0.1027
32577,224764,224764,amoeba-tower,"He really does have some of the annoying qualities of Anakin, especially young anakin",-7.0,nfl,t3_yvl0m5,False,0.0,:Steelers: Steelers,2022-11-15T02:07:29Z,steelers,-0.4019
32578,224766,224766,amoeba-tower,"if the concorde was still a thing, perhaps?  although NFL Europe would be awesome to have again",1.0,nfl,t3_yu2gub,False,0.0,:Steelers: Steelers,2022-11-13T11:35:56Z,steelers,0.31245
32579,224767,224767,amoeba-tower,this crowd is now belting out Don't Stop Believin' my god,28.0,nfl,t3_yu2gub,False,0.0,:Steelers: Steelers,2022-11-13T11:29:22Z,steelers,0.4567
32580,224768,224768,amoeba-tower,"but with the scoring of american football or at least hockey, pls thx",0.0,nfl,t3_yu2gub,False,0.0,:Steelers: Steelers,2022-11-13T11:22:28Z,steelers,0.5719
32581,224769,224769,amoeba-tower,this crowd is insane,13.0,nfl,t3_yu2gub,False,0.0,:Steelers: Steelers,2022-11-13T11:20:56Z,steelers,-0.4019
32582,224770,224770,amoeba-tower,the geno fumble had similar vibes to the TJ watt strip sack where geno just stayed face down in disbelief.  and yes that's the memory i'm using as copium,1.0,nfl,t3_yu2gub,False,0.0,:Steelers: Steelers,2022-11-13T10:38:21Z,steelers,0.20095
32583,224774,224774,amoeba-tower,"No he's only good at eating the clipboard, and then fired and becoming homeless on the streets of chicago",1.0,nfl,t3_ytkfgf,False,0.0,:Steelers: Steelers,2022-11-13T02:21:45Z,steelers,-0.4404
33103,226785,226785,anotheroutlaw,I think the Colts want to tank but then the Raiders happened.,1.0,nfl,t3_yujetu,False,0.0,:Steelers: Steelers,2022-11-13T21:31:11Z,steelers,0.0387
33370,229227,229227,basil1025,Jack Lambert was notoriously anti tick tock in the 70s. It's what helped the team win.,16.0,steelers,t3_yveiqn,False,0.0,:watt:TJ Watt,2022-11-14T21:05:18Z,steelers,0.2133999999999999
33371,229236,229236,basil1025,TJ looking like Kratos about to unleash hell on them.,10.0,steelers,t3_yslye8,False,0.0,:watt:TJ Watt,2022-11-11T17:55:17Z,steelers,-0.4767
33372,229238,229238,basil1025,Has Andy Dalton been out of Cincinnati long enough to have survived TJ?,5.0,steelers,t3_yshwb2,False,0.0,:watt:TJ Watt,2022-11-11T13:03:01Z,steelers,0.5106
33596,230174,230174,batdrumman,"Honestly, this was a good get-right game for us, especially off the bye. 3-6 isn't ideal, but hey, those were three good wins. Like BigDaddyRed, I'm also not cool with tanking. Our team should do everything in their power to win games, as that result is just as unsure as tanking is. At the end of the day, that was a fucking great win, and getting to listen to the radio broadcast (thank god for the app working this time) was a lot of fun. HERE WE FUCKING GO FELLAS LET'S KICK THE REST OF THE SEASON'S ASS!",10.0,steelers,t3_yv1vx2,False,0.0,":sc::c9::sc: Bosgod, our lord and savior",2022-11-14T10:01:08Z,steelers,-0.0689913365912208
33597,230175,230175,batdrumman,"Kenny Ett, no picks today",2.0,steelers,t3_yuhqs3,False,0.0,":sc::c9::sc: Bosgod, our lord and savior",2022-11-13T18:41:26Z,steelers,-0.296
33598,230177,230177,batdrumman,"Cannot stress this enough, tailgate with the Steelline. Then motherfuckers know how to party",5.0,steelers,t3_ytus0x,False,0.0,":sc::c9::sc: Bosgod, our lord and savior",2022-11-13T07:13:52Z,steelers,0.28225
34204,236634,236634,billy8988,Heineke was very smart to take the knee,10.0,nfl,t3_yvhyye,False,0.0,:Steelers: Steelers :Bears: Bears,2022-11-14T22:05:18Z,steelers,0.4576
34205,236636,236636,billy8988,weak make up call for missing that face mask call,2.0,nfl,t3_yvhyye,False,0.0,:Steelers: Steelers :Bears: Bears,2022-11-14T21:53:51Z,steelers,-0.6249
34206,236638,236638,billy8988,it’s going to be an interesting call from the head ref. we fucked up the call but it could not be reviewed,2.0,nfl,t3_yvhyye,False,0.0,:Steelers: Steelers :Bears: Bears,2022-11-14T21:41:13Z,steelers,-0.100475
34207,236639,236639,billy8988,how did they miss the face mask? i can see it 300 miles from pittsbugh,8.0,nfl,t3_yvhyye,False,0.0,:Steelers: Steelers :Bears: Bears,2022-11-14T21:39:16Z,steelers,-0.038275
34208,236640,236640,billy8988,not a bad INT. it’s like a good punt,6.0,nfl,t3_yvhyye,False,0.0,:Steelers: Steelers :Bears: Bears,2022-11-14T21:31:41Z,steelers,0.4376
34209,236641,236641,billy8988,Why PA teams are always contending for the worst best teams?,3.0,nfl,t3_yvhyye,False,0.0,:Steelers: Steelers :Bears: Bears,2022-11-14T21:18:41Z,steelers,0.0258
34210,236642,236642,billy8988,He is severely concussed! But he can continue to play. Player safety my ass,5.0,nfl,t3_yuk8vl,False,0.0,:Steelers: Steelers :Bears: Bears,2022-11-13T20:49:10Z,steelers,-0.0251962962962962
34211,236645,236645,billy8988,Metaquest is pretty much going to take Meta down with it,2.0,nfl,t3_yuk8vl,False,0.0,:Steelers: Steelers :Bears: Bears,2022-11-13T20:00:59Z,steelers,0.4939
34212,236646,236646,billy8988,no flag for the helmet to helmet?,12.0,nfl,t3_yuk8vl,False,0.0,:Steelers: Steelers :Bears: Bears,2022-11-13T19:53:41Z,steelers,-0.296
34213,236647,236647,billy8988,VW’s software says the car is stopped but the hardware has its own mind,2.0,nfl,t3_yuk8vl,False,0.0,:Steelers: Steelers :Bears: Bears,2022-11-13T19:51:14Z,steelers,-0.1154
34214,236650,236650,billy8988,Why couldn’t the replay officials stop the play?,3.0,nfl,t3_yu84j2,False,0.0,:Steelers: Steelers :Bears: Bears,2022-11-13T15:23:55Z,steelers,0.0516
34215,236651,236651,billy8988,Holy crap! what a game!!,3.0,nfl,t3_yu84j2,False,0.0,:Steelers: Steelers :Bears: Bears,2022-11-13T15:21:53Z,steelers,-0.0162555555555555
34216,236652,236652,billy8988,Pay $8 to reddit. Elon bought the reddit,1.0,nfl,t3_yu84j2,False,0.0,:Steelers: Steelers :Bears: Bears,2022-11-13T15:15:20Z,steelers,-0.025675
34217,236653,236653,billy8988,Poetic justice for an anti-vaxer,1.0,nfl,t3_yu84j2,False,0.0,:Steelers: Steelers :Bears: Bears,2022-11-13T15:12:12Z,steelers,0.5267
34218,236655,236655,billy8988,Defense jumped the gun,2.0,nfl,t3_yu84j2,False,0.0,:Steelers: Steelers :Bears: Bears,2022-11-13T15:09:02Z,steelers,-0.2263
34219,236658,236658,billy8988,Just know the first yard line you idiot,1.0,nfl,t3_yu84ll,False,0.0,:Steelers: Steelers :Bears: Bears,2022-11-13T13:08:42Z,steelers,-0.5106
34220,236659,236659,billy8988,"If refs are favoring steelers then they could have thrown a flag for late hit out of bounds, it would have been technically correct.",5.0,nfl,t3_yu84ll,False,0.0,:Steelers: Steelers :Bears: Bears,2022-11-13T12:56:49Z,steelers,0.4215
34221,236660,236660,billy8988,Heath Miller is honored today? He deserves a national game,12.0,nfl,t3_yu84ll,False,0.0,:Steelers: Steelers :Bears: Bears,2022-11-13T12:49:21Z,steelers,0.146475
34222,236661,236661,billy8988,it’s good to see NO fans complaining about their coordinators as much as we do,6.0,nfl,t3_yu84ll,False,0.0,:Steelers: Steelers :Bears: Bears,2022-11-13T12:45:59Z,steelers,0.1429
34223,236662,236662,billy8988,"Come on Kenny, not a good throw",4.0,nfl,t3_yu84ll,False,0.0,:Steelers: Steelers :Bears: Bears,2022-11-13T12:42:12Z,steelers,-0.3412
34224,236663,236663,billy8988,That’s the play we all know that never worked but Canada keep calling,5.0,nfl,t3_yu84ll,False,0.0,:Steelers: Steelers :Bears: Bears,2022-11-13T12:39:17Z,steelers,0.1779
34225,236664,236664,billy8988,That’s the Najee we know and love,5.0,nfl,t3_yu84ll,False,0.0,:Steelers: Steelers :Bears: Bears,2022-11-13T12:37:44Z,steelers,0.6369
34226,236665,236665,billy8988,Kordel wishes he was paid like Hill,1.0,nfl,t3_yu84ll,False,0.0,:Steelers: Steelers :Bears: Bears,2022-11-13T12:31:27Z,steelers,0.4767
34391,240658,240658,brinkofhumor,Fucking love warren,7.0,steelers,t3_yu7cum,False,0.0,:sc::c9::c0::sc: TJ Watt,2022-11-13T14:51:13Z,steelers,0.6697
34392,240659,240659,brinkofhumor,"Hate him in coverages, but Spillane run is great",8.0,steelers,t3_yu7cum,False,0.0,:sc::c9::c0::sc: TJ Watt,2022-11-13T14:36:58Z,steelers,0.6486
34393,240660,240660,brinkofhumor,I was just thinking how we haven't had dumb presnap penalties,1.0,steelers,t3_yu7cum,False,0.0,:sc::c9::c0::sc: TJ Watt,2022-11-13T14:17:09Z,steelers,0.4023
35118,244947,244947,chefdan2165,Troy ez,1.0,steelers,t3_ywjg2n,False,0.0,:sb::b0::b8::sb: KENNY FUCKING PICKETT ,2022-11-16T13:15:39Z,steelers,0.3612
35119,244949,244949,chefdan2165,Goddamn never knew Big Ben was livin that thug life,6.0,steelers,t3_ywh0d6,False,0.0,:sb::b0::b8::sb: KENNY FUCKING PICKETT ,2022-11-15T21:28:52Z,steelers,-0.4767
35120,244954,244954,chefdan2165,Now we just need William Jackson to sing that lmfao,1.0,steelers,t3_yug606,False,0.0,:sb::b0::b8::sb: KENNY FUCKING PICKETT ,2022-11-14T18:55:04Z,steelers,0.5423
35121,244956,244956,chefdan2165,I wish Najee would’ve done this from the start this year just good ol power football just fucking burst through the line and knock the light outta people who try to tackle. Him,3.0,steelers,t3_yuj970,False,0.0,:sb::b0::b8::sb: KENNY FUCKING PICKETT ,2022-11-14T15:00:09Z,steelers,0.1702
35122,244957,244957,chefdan2165,Boz lol,1.0,steelers,t3_yunktr,False,0.0,:sb::b0::b8::sb: KENNY FUCKING PICKETT ,2022-11-14T14:56:43Z,steelers,0.4215
35123,244958,244958,chefdan2165,I think we pray that the next 4 weeks goes by fast and boz never fucking retires,1.0,steelers,t3_yunktr,False,0.0,:sb::b0::b8::sb: KENNY FUCKING PICKETT ,2022-11-14T14:55:38Z,steelers,0.3182
35124,244962,244962,chefdan2165,"YOUVE BEEN HIT BY
YOUVE BEEN STRUCK BY 
THE PICKLER",32.0,steelers,t3_yug606,False,0.0,:sb::b0::b8::sb: KENNY FUCKING PICKETT ,2022-11-13T18:04:07Z,steelers,-0.25
35125,244963,244963,chefdan2165,This is the funniest goddamned comment PICKLER FTW,21.0,steelers,t3_yug606,False,0.0,:sb::b0::b8::sb: KENNY FUCKING PICKETT ,2022-11-13T16:40:46Z,steelers,0.6739
35126,244965,244965,chefdan2165,TJ is the leader the coaches nahhhh TJ FUCKING WATT is that reason why we win HE IS THAT READSON,0.0,steelers,t3_yudyls,False,0.0,:sb::b0::b8::sb: KENNY FUCKING PICKETT ,2022-11-13T16:34:42Z,steelers,0.5859
35127,244968,244968,chefdan2165,HOLY SHIT THE STEEL CURTAIN IS BACK LETS FUCKING GO STILLERS D GOIN SUPA BOWL,4.0,steelers,t3_yu7cum,False,0.0,:sb::b0::b8::sb: KENNY FUCKING PICKETT ,2022-11-13T14:43:23Z,steelers,-0.5574
35128,244969,244969,chefdan2165,Boz come back save us,3.0,steelers,t3_yu7cum,False,0.0,:sb::b0::b8::sb: KENNY FUCKING PICKETT ,2022-11-13T14:41:34Z,steelers,0.4939
35129,244971,244971,chefdan2165,No we don’t you do we don’t,4.0,steelers,t3_yu7cum,False,0.0,:sb::b0::b8::sb: KENNY FUCKING PICKETT ,2022-11-13T13:55:12Z,steelers,-0.296
35130,244973,244973,chefdan2165,r/saints for anyone too lazy,1.0,steelers,t3_yu7cum,False,0.0,:sb::b0::b8::sb: KENNY FUCKING PICKETT ,2022-11-13T13:01:52Z,steelers,-0.3612
35131,244974,244974,chefdan2165,THIS LOOKS LIKE SOME STILLERS FOOTBALL,6.0,steelers,t3_yu7cum,False,0.0,:sb::b0::b8::sb: KENNY FUCKING PICKETT ,2022-11-13T12:50:36Z,steelers,0.3612
35132,244976,244976,chefdan2165,HOLY SHIT THE JET SWEEP WORKS,3.0,steelers,t3_yu7cum,False,0.0,:sb::b0::b8::sb: KENNY FUCKING PICKETT ,2022-11-13T12:24:03Z,steelers,-0.5574
35133,244980,244980,chefdan2165,YES SIR ITS MF GAMEDAY WE GOR TJ AND THE PIGEONS BACK THERE AINT NO WAY WE CAN FUCKING LOOSE,1.0,steelers,t3_ytus0x,False,0.0,:sb::b0::b8::sb: KENNY FUCKING PICKETT ,2022-11-13T09:32:25Z,steelers,0.2488
35134,244982,244982,chefdan2165,Fuck. At least we have them pigeons again,30.0,steelers,t3_ytg0c5,False,0.0,:sb::b0::b8::sb: KENNY FUCKING PICKETT ,2022-11-12T13:55:24Z,steelers,-0.135575
35461,248491,248491,dac09b,"Ya but it was clear that not making Najee slam his head into a brick wall for 4 quarters helped him as well.

I get why he started to dance around, because those no gains 2 yards affect your decision making.",1.0,steelers,t3_yufmki,False,0.0,:sc::c9::c0::sc: TJ Watt,2022-11-14T12:40:05Z,steelers,0.0789999999999999
35462,248492,248492,dac09b,Watching our d line get pressure every snap is so fun. Man I missed that.,9.0,steelers,t3_yv1vx2,False,0.0,:sc::c9::c0::sc: TJ Watt,2022-11-14T09:49:36Z,steelers,-0.0314249999999999
35463,248493,248493,dac09b,Ya definitely nice he didn't need to throw 50 times.,15.0,steelers,t3_yuhqs3,False,0.0,:sc::c9::c0::sc: TJ Watt,2022-11-13T17:38:59Z,steelers,0.6705
35464,248494,248494,dac09b,TJ makes me want to be a better fan.,127.0,steelers,t3_yui3qv,False,0.0,:sc::c9::c0::sc: TJ Watt,2022-11-13T17:32:20Z,steelers,0.6705
35465,248495,248495,dac09b,"Which... To be honest that's an improvement for us.

Biggest stats for him for everyone's complaints is no picks. Glad he didn't force a bunch. But he also didn't feel like he had to in order to win.",51.0,steelers,t3_yuhqs3,False,0.0,:sc::c9::c0::sc: TJ Watt,2022-11-13T17:31:37Z,steelers,0.15913671875
35466,248497,248497,dac09b,It's also his second week in the offense. He is probably learning a ton. And they aren't asking him to do much.,11.0,steelers,t3_yue0we,False,0.0,:sc::c9::c0::sc: TJ Watt,2022-11-13T17:23:41Z,steelers,-0.0092592592592592
35467,248498,248498,dac09b,It also really limits your exposure too. Fewer injuries and if one goes out the other has been playing and it's not a huge drop off.,9.0,steelers,t3_yudufg,False,0.0,:sc::c9::c0::sc: TJ Watt,2022-11-13T17:22:28Z,steelers,0.083
35468,248502,248502,dac09b,I missed watching TJ so much lol,7.0,steelers,t3_yudyls,False,0.0,:sc::c9::c0::sc: TJ Watt,2022-11-13T15:05:01Z,steelers,0.2212
35469,248503,248503,dac09b,I think splitting carries actually helps najees game. We see it a lot in the NFL. Nice to not have to always grind out those 2-5 yard runs all game. Paid dividends in the second half when you share the load they were able to punch through for big pick ups.,12.0,steelers,t3_yudyls,False,0.0,:sc::c9::c0::sc: TJ Watt,2022-11-13T15:04:36Z,steelers,0.10183515625
35470,248504,248504,dac09b,"He needs a couple more passing tds lol but not complaining about today. I think he is trying to protect the ball more
 Threw a lot away and gave us a chance.",2.0,steelers,t3_yu7cum,False,0.0,:sc::c9::c0::sc: TJ Watt,2022-11-13T14:56:47Z,steelers,0.389725
35471,248505,248505,dac09b,Smh I know naj won't care but that shit does matter to some players.,1.0,steelers,t3_yu7cum,False,0.0,:sc::c9::c0::sc: TJ Watt,2022-11-13T14:55:44Z,steelers,-0.8028
35472,248506,248506,dac09b,It's clear... The answer was never one or the other. It's both helps both their game.,9.0,steelers,t3_yu7cum,False,0.0,:sc::c9::c0::sc: TJ Watt,2022-11-13T14:54:54Z,steelers,0.1414074074074074
35473,248507,248507,dac09b,Get the fuck under center. Run once then play action pass to muth,1.0,steelers,t3_yu7cum,False,0.0,:sc::c9::c0::sc: TJ Watt,2022-11-13T14:27:45Z,steelers,0.034425
35474,248508,248508,dac09b,Damn huge respect for Warren as a pass catcher. Dude gets yards,1.0,steelers,t3_yu7cum,False,0.0,:sc::c9::c0::sc: TJ Watt,2022-11-13T14:27:02Z,steelers,0.100475
35475,248509,248509,dac09b,Noooo not the red zone. Now we won't score lol,1.0,steelers,t3_yu7cum,False,0.0,:sc::c9::c0::sc: TJ Watt,2022-11-13T14:24:46Z,steelers,-0.1626
35476,248510,248510,dac09b,Close lol,2.0,steelers,t3_yu7cum,False,0.0,:sc::c9::c0::sc: TJ Watt,2022-11-13T14:23:21Z,steelers,0.4215
35477,248512,248512,dac09b,Lol on the timeout TJ was about to obliterate Dalton.,2.0,steelers,t3_yu7cum,False,0.0,:sc::c9::c0::sc: TJ Watt,2022-11-13T14:21:38Z,steelers,-0.2732
35478,248513,248513,dac09b,TJ forced fumble incoming. Calling it now.,7.0,steelers,t3_yu7cum,False,0.0,:sc::c9::c0::sc: TJ Watt,2022-11-13T14:19:10Z,steelers,-0.1147
35479,248514,248514,dac09b,I mean definitely not this year. We have not dominated anything,2.0,steelers,t3_yu7cum,False,0.0,:sc::c9::c0::sc: TJ Watt,2022-11-13T14:16:19Z,steelers,0.100475
35480,248515,248515,dac09b,To be fair the saints have been confusing the hell out of him.,3.0,steelers,t3_yu7cum,False,0.0,:sc::c9::c0::sc: TJ Watt,2022-11-13T14:15:45Z,steelers,-0.6369
35481,248516,248516,dac09b,He did hurt his foot...,1.0,steelers,t3_yu7cum,False,0.0,:sc::c9::c0::sc: TJ Watt,2022-11-13T14:15:10Z,steelers,-0.5267
35482,248517,248517,dac09b,It made him very angry when Tomlin took it out of the locker room.,3.0,steelers,t3_yu7cum,False,0.0,:sc::c9::c0::sc: TJ Watt,2022-11-13T14:13:55Z,steelers,-0.5563
35483,248518,248518,dac09b,"He's just taking after Ben by starting games after the bye terribly.
 Lol",3.0,steelers,t3_yu7cum,False,0.0,:sc::c9::c0::sc: TJ Watt,2022-11-13T14:12:43Z,steelers,0.0713999999999999
35484,248519,248519,dac09b,Haha you got me there.,1.0,steelers,t3_yu7cum,False,0.0,:sc::c9::c0::sc: TJ Watt,2022-11-13T14:10:26Z,steelers,0.4588
35485,248520,248520,dac09b,"Nah he is here for the season buddy.

If they were going to do it, it was two weeks ago.",1.0,steelers,t3_yu7cum,False,0.0,:sc::c9::c0::sc: TJ Watt,2022-11-13T14:05:08Z,steelers,-0.025675
35486,248521,248521,dac09b,Hope you make it out of purgatory soon.,5.0,steelers,t3_yu7cum,False,0.0,:sc::c9::c0::sc: TJ Watt,2022-11-13T14:02:49Z,steelers,0.4404
35487,248522,248522,dac09b,Only good news is he will flame out if that's true. He won't be an athletic promise where you give him a ton of time.,0.0,steelers,t3_yu7cum,False,0.0,:sc::c9::c0::sc: TJ Watt,2022-11-13T13:59:59Z,steelers,0.3318
35488,248523,248523,dac09b,Tomlin looks great in aviators.,2.0,steelers,t3_yu7cum,False,0.0,:sc::c9::c0::sc: TJ Watt,2022-11-13T13:58:46Z,steelers,0.6249
35489,248524,248524,dac09b,What did he do wrong there? Take a sack? Seriously asking.,1.0,steelers,t3_yu7cum,False,0.0,:sc::c9::c0::sc: TJ Watt,2022-11-13T13:56:09Z,steelers,-0.0769555555555555
35490,248525,248525,dac09b,"Ya for sure. We should have gone Mitch /mason until at least this game. 

Not saying Kennys play gets a pass. But we bungled it",2.0,steelers,t3_yu7cum,False,0.0,:sc::c9::c0::sc: TJ Watt,2022-11-13T13:39:00Z,steelers,-0.01490703125
35491,248526,248526,dac09b,This line is a QB killer. Not bad enough to blame them the whole time just inconsistent enough to have you seeing ghosts.,6.0,steelers,t3_yu7cum,False,0.0,:sc::c9::c0::sc: TJ Watt,2022-11-13T13:34:52Z,steelers,-0.1044499999999999
35492,248527,248527,dac09b,Ah I found the curse.,1.0,steelers,t3_yu7cum,False,0.0,:sc::c9::c0::sc: TJ Watt,2022-11-13T13:33:32Z,steelers,-0.5423
