,Unnamed: 0.1,Unnamed: 0,author,body,score,subreddit,link_id,over_18,controversiality,author_flair_text,created_utc,flair,sentiment
138,2214,2214,-dov-,He has three rushing TDs inside the five yard line. The Kenny defenders need to stop pretending he's Michael Vick and that makes up for how bad he's been as a passer.,0.0,steelers,t3_yw6esj,False,1.0,:troy1::troy2:Troy,2022-11-15T21:30:30Z,steelers,-0.3062
139,2217,2217,-dov-,Pickett's 3 rushing TDs have all come within the 5 yard line. No one's scheming their defense as him being a rushing threat as they are for Lamar Jackson being able to break off a 70+ TD run at a moment's notice.,-1.0,steelers,t3_yw6esj,False,0.0,:troy1::troy2:Troy,2022-11-15T18:51:30Z,steelers,-0.31245
140,2218,2218,-dov-,"To qualify as a dual threat, you actually have to be a threat in both categories. To put Pickett in the same sentence as Jackson and Vick is as laughable as the people going ""Manning and Aikman threw a lot of picks as rookies, though!""",-1.0,steelers,t3_yw6esj,False,1.0,:troy1::troy2:Troy,2022-11-15T18:26:44Z,steelers,-0.094425
141,2219,2219,-dov-,Which part of his growth would he say is the most impressive? Pickett not throwing a TD since the Miami game?,0.0,steelers,t3_yw6uol,False,1.0,:troy1::troy2:Troy,2022-11-15T17:35:56Z,steelers,0.18365
142,2221,2221,-dov-,Sean Payton's a scumbag. Neither he or Gregg Williams should have ever been allowed back in the NFL.,1.0,nfl,t3_yvzmt0,False,0.0,:Steelers: Steelers,2022-11-15T17:29:20Z,steelers,-0.159225
143,2227,2227,-dov-,Jeff Saturday has matched the number of wins Joe Thomas had over two years in his first week as HC.,44.0,nfl,t3_yujcj4,False,0.0,:Steelers: Steelers,2022-11-13T21:46:04Z,steelers,0.6124
144,2228,2228,-dov-,"Sports fans with eyes: This guy's thrown 2 TDs and 8 INTS and the only win on his record is when Trubisky had to come in and save the game.

Redditor: LoL sTaTs JuNkY",2.0,nfl,t3_ytkfgf,False,0.0,:Steelers: Steelers,2022-11-13T08:08:39Z,steelers,0.4084
145,2229,2229,-dov-,">Like, he could check the ball down and punt but that's what leads to the Trubisky's of the world.

Do Pickett's defenders even watch the games? He is captain checkdown. He's averaging 5.8 yards per pass and less than 200 yards a game. He makes like one or two decent midlength passes per game and people go ""Yeah, Kenny can spread the field and push the ball!"" except when he actually does try to air it out, that's when most of his interceptions have happened.

Edit: Hi homers downvoting me! [Here's Pickett's pass chart for yesterday's game.](https://i.redd.it/honbqk7rusz91.jpg) He made only three completions longer than 10 yards, while 8 out of 18 were behind or within 2 yards of the line of scrimmage. He is Captain Checkdown.",-4.0,nfl,t3_ytkfgf,False,0.0,:Steelers: Steelers,2022-11-13T08:06:03Z,steelers,6.114962100000002e-07
522,3683,3683,34shadow1,I'm going to say 28-10 in favor of the Steelers especially since Ja'marr chase at practice yesterday was on crutches and didn't practice today either.,2.0,steelers,t3_yx8hc1,False,0.0,:sa::a2::a2::sa: Najee Harris,2022-11-16T17:31:24Z,steelers,0.4019
523,3684,3684,34shadow1,Yeah the chants of FTS (Fuck The Steelers) and the mass upvoted chains of them saying they love burfict. No I'm going to stay the Fuck away from em.,15.0,steelers,t3_ywukg6,False,0.0,:sa::a2::a2::sa: Najee Harris,2022-11-16T10:34:12Z,steelers,-0.2352999999999999
524,3685,3685,34shadow1,"1: Troy Polomalu, for the amazing hair.
2: Hines Ward.
3: Ike Taylor.",2.0,steelers,t3_ywufvf,False,0.0,:sa::a2::a2::sa: Najee Harris,2022-11-16T10:32:14Z,steelers,0.0217
525,3687,3687,34shadow1,Bout to hit em with a different type of Black Air Force One energy.,3.0,steelers,t3_ywdwwh,False,0.0,:sa::a2::a2::sa: Najee Harris,2022-11-15T22:33:44Z,steelers,0.2732
2674,17359,17359,Asphaltjungle33,I don’t agree with the notion of not taking the Covid vaccine because your low risk. It’s not about Harrison smith it’s about his ability to transmit it to others.  All I said was “it knocked him down a tad on cool points” which I stand by,7.0,nfl,t3_ywwub4,False,1.0,:Steelers: Steelers,2022-11-16T13:01:39Z,steelers,0.1348333333333333
2675,17360,17360,Asphaltjungle33,Yea but he’s an anti-vaxer so that definitely knock him down a tad on cool points. Great player though,-17.0,nfl,t3_ywwub4,False,0.0,:Steelers: Steelers,2022-11-16T12:10:11Z,steelers,0.50885
2676,17363,17363,Asphaltjungle33,Isn’t this the girl in Deshaun watsons camp who was making up nonsense about the investigation?,1.0,steelers,t3_yw6f7g,False,0.0,:sa::a2::a2::sa: Najee Harris,2022-11-15T15:21:20Z,steelers,-0.4019
2677,17372,17372,Asphaltjungle33,I really liked Joe Thomas the player but he’s had some pretty big ass clown takes since retiring.,368.0,nfl,t3_ysddlh,False,0.0,:Steelers: Steelers,2022-11-11T09:57:55Z,steelers,0.1522
3688,21794,21794,BEGA500,No more kicking.,3.0,steelers,t3_yu7cum,False,0.0,":sh:32:sh: RD1 CB and also OL, lol Bears",2022-11-13T14:41:35Z,steelers,-0.296
3689,21795,21795,BEGA500,Snap is good. Hold is good. Kick is shit.,3.0,steelers,t3_yu7cum,False,0.0,":sh:32:sh: RD1 CB and also OL, lol Bears",2022-11-13T14:41:25Z,steelers,-0.1205555555555555
3690,21796,21796,BEGA500,Put it on a leash and take it for a walk. Establish dominance.,1.0,steelers,t3_yu7cum,False,0.0,":sh:32:sh: RD1 CB and also OL, lol Bears",2022-11-13T14:37:11Z,steelers,0.10115
3691,21798,21798,BEGA500,That was nice. The defense would have sworn we were handing it to the left and looked confused when Keeny just kept it.,2.0,steelers,t3_yu7cum,False,0.0,":sh:32:sh: RD1 CB and also OL, lol Bears",2022-11-13T14:29:47Z,steelers,0.0042249999999999
3692,21799,21799,BEGA500,We have transitioned to a 2012 Ravens offense.,3.0,steelers,t3_yu7cum,False,0.0,":sh:32:sh: RD1 CB and also OL, lol Bears",2022-11-13T14:28:35Z,steelers,-0.25
3693,21800,21800,BEGA500,The play call for Naj has to have him coming downhill. If he has the option to slow play it or dance he will.,3.0,steelers,t3_yu7cum,False,0.0,":sh:32:sh: RD1 CB and also OL, lol Bears",2022-11-13T14:27:39Z,steelers,0.255
3694,21801,21801,BEGA500,"Roll, read, throw away. Smart. Love it.",6.0,steelers,t3_yu7cum,False,0.0,":sh:32:sh: RD1 CB and also OL, lol Bears",2022-11-13T14:25:55Z,steelers,0.2569555555555555
3695,21802,21802,BEGA500,That little shit is quick,5.0,steelers,t3_yu7cum,False,0.0,":sh:32:sh: RD1 CB and also OL, lol Bears",2022-11-13T14:24:37Z,steelers,-0.5118
3696,21803,21803,BEGA500,Chuks coming out of the pile with the ball like a man,4.0,steelers,t3_yu7cum,False,0.0,":sh:32:sh: RD1 CB and also OL, lol Bears",2022-11-13T14:23:56Z,steelers,0.3612
3697,21804,21804,BEGA500,Tough catch but he should have made it.,5.0,steelers,t3_yu7cum,False,0.0,":sh:32:sh: RD1 CB and also OL, lol Bears",2022-11-13T13:53:39Z,steelers,-0.0644
3698,21805,21805,BEGA500,Pickens is so much faster than he looks. Hes just so smooth that it doesn't seem like he is covering that much ground.,6.0,steelers,t3_yu7cum,False,0.0,":sh:32:sh: RD1 CB and also OL, lol Bears",2022-11-13T13:51:18Z,steelers,-0.13775
3699,21806,21806,BEGA500,Naj heard us talking shit about him.,2.0,steelers,t3_yu7cum,False,0.0,":sh:32:sh: RD1 CB and also OL, lol Bears",2022-11-13T13:49:34Z,steelers,-0.5574
3700,21807,21807,BEGA500,I would prefer they keep calling deep shots trust Kenny to scramble if it isn't there than go back to throwing 3 yard outs.,9.0,steelers,t3_yu7cum,False,0.0,":sh:32:sh: RD1 CB and also OL, lol Bears",2022-11-13T13:49:00Z,steelers,0.5106
3701,21809,21809,BEGA500,He isnt out there on O. He has nothing better to do. Why not let TJ be the OC.,1.0,steelers,t3_yu7cum,False,0.0,":sh:32:sh: RD1 CB and also OL, lol Bears",2022-11-13T13:40:09Z,steelers,-0.0379111111111111
3702,21810,21810,BEGA500,Im so happy someone is finally making quality programming answering the question we all have. How good is Mike Piazza at jumping out of helicopters?,4.0,steelers,t3_yu7cum,False,0.0,":sh:32:sh: RD1 CB and also OL, lol Bears",2022-11-13T13:36:26Z,steelers,0.373075
3703,21812,21812,BEGA500,We are 2-6. We dont get the good crew.,1.0,steelers,t3_yu7cum,False,0.0,":sh:32:sh: RD1 CB and also OL, lol Bears",2022-11-13T13:18:00Z,steelers,-0.1706
3704,21813,21813,BEGA500,It turns out that the DPOY is an important part of the D.,12.0,steelers,t3_yu7cum,False,0.0,":sh:32:sh: RD1 CB and also OL, lol Bears",2022-11-13T13:03:20Z,steelers,0.2023
3705,21814,21814,BEGA500,6’4” with a big vertical. They may work on it but it doesn’t mean there is emphasis on improvement. Doesn’t mean the coach is setting that agenda. Doesn’t mean the coach is good enough to see what is wrong and know how to get him to break those habits.,2.0,steelers,t3_yt1692,False,0.0,":sh:32:sh: RD1 CB and also OL, lol Bears",2022-11-12T23:26:21Z,steelers,-0.0033312499999999
3706,21815,21815,BEGA500,Yes it is Chases fault. Fully agree. Then it goes to the WR coach who should be grinding with him on this basic shit daily. I hate Canada and think he has to go but you can’t blame Canada for everything. The OC can only put players in position to make a play and way too often our guys don’t do basic shit like catch.,6.0,steelers,t3_yt1692,False,0.0,":sh:32:sh: RD1 CB and also OL, lol Bears",2022-11-12T10:53:48Z,steelers,-0.01495504
3707,21816,21816,BEGA500,Are you suggesting Chase Claypools inability to high point a ball is anyones fault other than his position coach?,4.0,steelers,t3_yt1692,False,0.0,":sh:32:sh: RD1 CB and also OL, lol Bears",2022-11-12T10:06:30Z,steelers,-0.6597
3903,24981,24981,Beginning_Repeat9343,Why tf are they on a plane lol? C’mon Commanders,1.0,nfl,t3_yvomau,False,0.0,:Steelers: Steelers,2022-11-15T16:37:03Z,steelers,0.105375
4446,32611,32611,CCPalmeri5,Alex Highsmith has 5 sacks in 2 games when TJ plays lol,28.0,nfl,t3_ywuqp0,False,0.0,:Steelers: Steelers,2022-11-16T08:38:14Z,steelers,0.5859
4447,32614,32614,CCPalmeri5,"I ducking hate Kevin Dotson. Awful player, awful attitude.",3.0,steelers,t3_yu7cum,False,0.0,:sh::h1::h8::sh: Diontae Johnson,2022-11-13T13:57:04Z,steelers,-0.502175
4616,33108,33108,CaffeineAddict88,Lmao,1.0,steelers,t3_yv6opw,False,0.0,43,2022-11-14T14:51:36Z,steelers,0.5994
4617,33110,33110,CaffeineAddict88,This is me when I was a baby in a Charlie Brown Steelers shirt. I want a similar picture done for my recently born daughter and would like to find this same shirt. This was from the early '90s so I doubt that a single one exists but I figured this was the best place to ask. Thanks,7.0,steelers,t3_yuxt2v,False,0.0,43,2022-11-14T06:26:04Z,steelers,0.1610921875
4618,33111,33111,CaffeineAddict88,"What game is this commercial from?

It's a footrace....TOUCHDOWN... IT'S A MIRACLE!",6.0,nfl,t3_yu2gub,False,0.0,:Steelers: Steelers,2022-11-13T09:50:47Z,steelers,0.2079666666666666
4619,33115,33115,CaffeineAddict88,GOD DAMN IT,10.0,steelers,t3_ytg0c5,False,0.0,43,2022-11-12T13:37:21Z,steelers,-0.1531
6002,41491,41491,CouchPotatoFamine,Ugh I've kicked boomerangs straighter than that.,4.0,steelers,t3_yu7cum,False,0.0,50,2022-11-13T14:43:05Z,steelers,-0.4215
6003,41492,41492,CouchPotatoFamine,Dalton looks like an extra from Braveheart.,5.0,steelers,t3_yu7cum,False,0.0,50,2022-11-13T14:40:28Z,steelers,0.3612
6004,41494,41494,CouchPotatoFamine,WTF direct snap to 22...,2.0,steelers,t3_yu7cum,False,0.0,50,2022-11-13T14:28:42Z,steelers,-0.6739
6005,41496,41496,CouchPotatoFamine,He's more explosive than my butt after 3 Taco Bell Gorditas with fire sauce.,3.0,steelers,t3_yu7cum,False,0.0,50,2022-11-13T14:26:43Z,steelers,-0.34
6006,41501,41501,CouchPotatoFamine,While Saturday is playing Doodle Jump on his phone the whole time.,2.0,nfl,t3_ysddlh,False,0.0,:Steelers: Steelers,2022-11-11T19:30:42Z,steelers,0.2023
6165,42536,42536,Cpt_Jack_,You its a run play if Boykin is on the field with the offense,5.0,steelers,t3_yvc25v,False,0.0,:sh::h5::h0::sh: Ryan Shazier,2022-11-14T15:45:47Z,steelers,0.1027
6166,42537,42537,Cpt_Jack_,Alright. Thanks you,1.0,steelers,t3_yu7cum,False,0.0,:sh::h5::h0::sh: Ryan Shazier,2022-11-13T13:36:23Z,steelers,0.2827
6167,42539,42539,Cpt_Jack_,Why is myles jack not playing?,3.0,steelers,t3_yu7cum,False,0.0,:sh::h5::h0::sh: Ryan Shazier,2022-11-13T13:31:48Z,steelers,-0.1511
6168,42540,42540,Cpt_Jack_,"17 points?! Ain't a chance we scoring more than 15

Edit: I'm glad that I was wrong",26.0,steelers,t3_ytxdlu,False,0.0,:sh::h5::h0::sh: Ryan Shazier,2022-11-13T05:30:21Z,steelers,-0.106
6799,43905,43905,Crashhh_96,Damn you described this perfectly lol I get the same feeling,2.0,nfl,t3_yuh1r3,False,0.0,:Steelers: Steelers,2022-11-13T19:07:54Z,steelers,0.765
9337,54669,54669,Dang026,"I feel like it rarely turns into a big gain as compared to the number of times he does it and also loses yards. Not saying it never happens but its not ""a decent amount"" like you are saying it is...",7.0,steelers,t3_yvbfp4,False,0.0,:primantis:Primanti Bro's,2022-11-14T18:37:08Z,steelers,0.401
9338,54671,54671,Dang026,Oop nvm its been updated since i last checked. Thx i feel much better about the deal lol,3.0,steelers,t3_ytk1yy,False,0.0,:primantis:Primanti Bro's,2022-11-13T08:25:48Z,steelers,0.401
9339,54674,54674,Dang026,"The problem with that is that they seldom run offensive sets with multiple TEs. Also Claypool is not an effective blocker in the least. Hes okay at impact blocking smaller players like CBs but he gets technically embarrassed when even going against a cover LB or a more physical safety. I liked him as a big slot player who could switch out with DJ and take the perimeter when called upon. 

I see him getting a more defined role in Chicago although he will have some connection with the TE Cole Kmet. If they were to move him across the line, even using him as a flex or wingback next to the TE i could see him hitting seams in the middle of the field consistently.",1.0,steelers,t3_ysfimc,False,0.0,:primantis:Primanti Bro's,2022-11-11T21:23:39Z,steelers,0.0021422518004115
9340,54675,54675,Dang026,"Chase was actually great in the middle of the field. Thats one of the few places he really thrived was the intermediate crossing routes but Matt Canada removed them from the offense entirely this season. He even looked good on some underneath routes where he could get the ball in his hands and beat corners with his physicality.

 He definitely has his own shortcomings but lets not pretend this OC didn't handcuff everyone on this offense in 2022.",1.0,steelers,t3_ysfimc,False,0.0,:primantis:Primanti Bro's,2022-11-11T19:42:47Z,steelers,-0.012777734375
10411,60604,60604,Dminnick,More of a joke then serious lol,1.0,nfl,t3_ysidtg,False,0.0,:Steelers: Steelers,2022-11-12T15:24:30Z,steelers,0.6077
10412,60605,60605,Dminnick,I fully believe this is how the Steelers eek out a non losing record,21.0,nfl,t3_ysidtg,False,0.0,:Steelers: Steelers,2022-11-11T14:49:41Z,steelers,-0.3818
10778,61559,61559,DontTellSmokey,Breaks my heart to see him retire as a Brown 😞,1.0,steelers,t3_ysldfs,False,0.0,:sc::c1::c4::sc: Slim Pickens ,2022-11-12T11:30:19Z,steelers,0.2732
11665,65230,65230,DruTangClan,"I don’t know about ANY team but i do think we would have won at least 2 of the 4 losses to Browns, Jets, Pats, and Phins",18.0,steelers,t3_yv6opw,False,0.0,:sc::c9::c0::sc: TJ Watt,2022-11-14T13:35:35Z,steelers,0.3612
11666,65233,65233,DruTangClan,Oh i got false hope for days.  Realistically though i’m just happy we had a good run game for once.,1.0,nfl,t3_yudyy7,False,0.0,:Steelers: Steelers,2022-11-14T07:48:11Z,steelers,0.4926
11932,66022,66022,Dtville21,I was at this game and what a fun experience,1.0,steelers,t3_yvz90l,False,0.0,:PIT1::PIT2: Pittsburgh Steelers,2022-11-15T14:53:49Z,steelers,0.5106
12100,68363,68363,Ecnarps,How the fuck is Ben not on most of your lists?,0.0,steelers,t3_ywufvf,False,0.0,:sc::c8::sc: Kenny Fukkin Pickett ,2022-11-16T21:43:21Z,steelers,-0.5423
12101,68365,68365,Ecnarps,Stop tying to make Pickler happen. It’s terrible.,2.0,steelers,t3_yug606,False,0.0,:sc::c8::sc: Kenny Fukkin Pickett ,2022-11-14T13:40:50Z,steelers,-0.31235
12361,69464,69464,EducationAlone1663,Yeah people think his short arms will be a problem but look at Rashawn Slater,1.0,steelers,t3_yw08r2,False,0.0,:sc::c9::c0::sc: TJ Watt,2022-11-15T15:03:55Z,steelers,-0.0644
12362,69466,69466,EducationAlone1663,Paris Johnson or Olu Fashunu in round 1 for sure,18.0,steelers,t3_yw08r2,False,0.0,:sc::c9::c0::sc: TJ Watt,2022-11-15T09:30:11Z,steelers,0.3182
12363,69473,69473,EducationAlone1663,Spillane is terrible,5.0,steelers,t3_yu7cum,False,0.0,:sc::c9::c0::sc: TJ Watt,2022-11-13T13:30:46Z,steelers,-0.4767
13515,80121,80121,FrederickMecury,Oh boy I sure do love living in northern Virginia,8.0,steelers,t3_yxf8qu,False,0.0,Heeeeeaaath,2022-11-16T22:10:08Z,steelers,0.7579
13516,80122,80122,FrederickMecury,"I think you may be missing my point. I never said Kenny was as dangerous as Lamar (or at least I retracted that statement), I simply said that it’s a backwards way of thinking that those rushing TDs are meaningless. Why would a passing TD from one yard out be proper but a QB sneak be “laughable”?",3.0,steelers,t3_yw6esj,False,0.0,Heeeeeaaath,2022-11-15T19:01:42Z,steelers,-0.0907851851851851
13517,80123,80123,FrederickMecury,"Alright I’ll admit it was a bad comparison but the point still stands. It’s not the 70s anymore, QBs have the ability to run a few TDs in. Thinking that QBs should only throw TDs is old-fashioned, they’re here to produce, it doesn’t matter how",3.0,steelers,t3_yw6esj,False,0.0,Heeeeeaaath,2022-11-15T18:44:55Z,steelers,0.0406222222222222
13518,80124,80124,FrederickMecury,If I’m not mistaken Lamar and Vick were both drafted due to their dual threat ability,1.0,steelers,t3_yw6esj,False,0.0,Heeeeeaaath,2022-11-15T18:08:54Z,steelers,0.0026
13519,80128,80128,FrederickMecury,"Had a kick out of bounds and it was assumed that Wright would be better given his greater experience 

It appears the front office was wrong",32.0,steelers,t3_yuk2en,False,0.0,Heeeeeaaath,2022-11-13T19:22:51Z,steelers,0.3182
13520,80131,80131,FrederickMecury,The 3 safety package is sounding better and better,22.0,steelers,t3_yuegrw,False,0.0,Heeeeeaaath,2022-11-13T17:24:21Z,steelers,0.8225
13521,80132,80132,FrederickMecury,Ah I see. My mistake,10.0,steelers,t3_yue0we,False,0.0,Heeeeeaaath,2022-11-13T16:37:56Z,steelers,-0.17
13522,80133,80133,FrederickMecury,"People still not over losing Claypool. Pretty childish tbh

Edit: I appear to have misunderstood the reasoning, oops",-37.0,steelers,t3_yue0we,False,0.0,Heeeeeaaath,2022-11-13T16:18:18Z,steelers,0.02175
13523,80134,80134,FrederickMecury,At least Kazee is back. I have more confidence in him than Norwood or Killebrew,1.0,steelers,t3_yu7cum,False,0.0,Heeeeeaaath,2022-11-13T11:53:42Z,steelers,0.27815
13612,84144,84144,Galifrae,"Heard him say this live and I’m pretty I rolled my eyes with the rest of the hosts of the show. 

This is, by far, not the most egregious thing that’s happened in the NFL. What a bonehead comment.",1.0,nfl,t3_ysddlh,False,0.0,:Steelers: Steelers,2022-11-11T10:54:43Z,steelers,0.0182925925925925
14016,86473,86473,Good-Hank,This is nice for a change,2.0,steelers,t3_yu7cum,False,0.0,:sh::h5::h0::sh: Ryan Shazier,2022-11-13T14:37:44Z,steelers,0.4215
14017,86474,86474,Good-Hank,That was no penalty 😂,3.0,steelers,t3_yu7cum,False,0.0,:sh::h5::h0::sh: Ryan Shazier,2022-11-13T14:28:32Z,steelers,0.6575
14018,86475,86475,Good-Hank,Obligatory wasted time out,1.0,steelers,t3_yu7cum,False,0.0,:sh::h5::h0::sh: Ryan Shazier,2022-11-13T14:20:08Z,steelers,-0.4939
14019,86476,86476,Good-Hank,We must lead the league in illegal formations,14.0,steelers,t3_yu7cum,False,0.0,:sh::h5::h0::sh: Ryan Shazier,2022-11-13T14:15:19Z,steelers,-0.5574
14020,86479,86479,Good-Hank,"Welcome back, King.",1.0,steelers,t3_yu7cum,False,0.0,:sh::h5::h0::sh: Ryan Shazier,2022-11-13T12:10:44Z,steelers,0.4588
14630,88907,88907,GunsmokeG,"BPA, preferably OL or DL.  It will be nice to have plenty of options.",1.0,steelers,t3_yw08r2,False,0.0,:sh::h5::h8::sh: Home Jersey,2022-11-15T17:23:54Z,steelers,0.21075
14631,88915,88915,GunsmokeG,Warren runs like a man possessed.,1.0,steelers,t3_yufmki,False,0.0,:sh::h5::h8::sh: Home Jersey,2022-11-14T17:18:17Z,steelers,0.3612
14632,88922,88922,GunsmokeG,Lol I'l have what he's having,9.0,steelers,t3_yuj3bp,False,0.0,:sh::h5::h8::sh: Home Jersey,2022-11-14T07:35:07Z,steelers,0.4215
14633,88931,88931,GunsmokeG,Legit LOL when I read that.,2.0,steelers,t3_yudwzj,False,0.0,:sh::h5::h8::sh: Home Jersey,2022-11-13T18:24:27Z,steelers,0.5473
14634,88934,88934,GunsmokeG,Kazee with some swaggee.  Love it.,7.0,steelers,t3_yuegrw,False,0.0,:sh::h5::h8::sh: Home Jersey,2022-11-13T17:20:27Z,steelers,0.31845
14635,88937,88937,GunsmokeG,Mike T has now beaten all 31 other teams.,168.0,steelers,t3_yudvzb,False,0.0,:sh::h5::h8::sh: Home Jersey,2022-11-13T16:12:55Z,steelers,-0.4215
14636,88938,88938,GunsmokeG,Yes I think we get to 6.,1.0,steelers,t3_ytfr1b,False,0.0,:sh::h5::h8::sh: Home Jersey,2022-11-12T18:50:37Z,steelers,0.4019
14766,89542,89542,HDTokyo,Highsmith is turning into another Dupree situation. Watt made dupree have better success and got his payday(titans). Highsmith will build his resume and look for a payday as well as long as he keeps up what he’s doing…with the help of TJ on the field.,-1.0,steelers,t3_ywtfyt,False,0.0,:primantis:Primanti Bro's,2022-11-16T14:37:02Z,steelers,0.2803
14767,89544,89544,HDTokyo,I didn’t see it coming either lol.,3.0,steelers,t3_yue300,False,0.0,:primantis:Primanti Bro's,2022-11-13T18:57:11Z,steelers,0.4215
15083,93636,93636,IhamAmerican,"Ogunjobi is older, being able to rotate him in and out will only make the line better.

Leal is so versatile that he's a huge boon to the D-line, even as a rookie",60.0,steelers,t3_yx054r,False,0.0,Quack,2022-11-16T11:47:59Z,steelers,0.2692
15084,93638,93638,IhamAmerican,This is widely considered a good move,94.0,steelers,t3_yx054r,False,0.0,Quack,2022-11-16T11:42:40Z,steelers,0.4404
15085,93639,93639,IhamAmerican,"I want a crazy flare, but I don't want to lose my OG quack flair. It's been tough decision making for me",1.0,steelers,t3_ywamiz,False,0.0,Quack,2022-11-16T11:31:01Z,steelers,-0.0012749999999999
15086,93641,93641,IhamAmerican,He fuckin blows up DJ at the the end there lmao,40.0,steelers,t3_ywj1bb,False,0.0,Quack,2022-11-15T21:59:50Z,steelers,0.5994
15087,93644,93644,IhamAmerican,He just has more moxy and grit than Wentz. Makes it more fun to watch and root for,412.0,nfl,t3_yvl0m5,False,0.0,:Steelers: Steelers,2022-11-14T21:22:06Z,steelers,0.27815
15088,93645,93645,IhamAmerican,"Agreed. I understand why it got called, but it's still soft.",23.0,nfl,t3_yvjcku,False,0.0,:Steelers: Steelers,2022-11-14T19:51:19Z,steelers,0.0683
15089,93646,93646,IhamAmerican,"Agreed. I wouldn't have been mad if they hadn't called it, but I understand why they did. Definitely hand fighting and some pulling, but the DB did more than the WR, so I understand the call",29.0,nfl,t3_yvjcku,False,0.0,:Steelers: Steelers,2022-11-14T19:49:34Z,steelers,0.1316407407407407
15090,93649,93649,IhamAmerican,It definitely doesn't help that he's actually crazy athletic. He scored something like a 9.5 on the RAS in the combine. Kenny has some wheels and he used to be able to use them against any defense. He needs to learn how and when to do it all over again,3.0,steelers,t3_yudyls,False,0.0,Quack,2022-11-13T18:26:37Z,steelers,0.012705859375
15091,93650,93650,IhamAmerican,God I hope DJ starts running more of those routes again. It used to feel like at least once a game that he'd take a slant 30+ yards or for a TD,5.0,steelers,t3_yudyls,False,0.0,Quack,2022-11-13T18:23:37Z,steelers,0.3337
15092,93651,93651,IhamAmerican,"It wasn't even a terrible fumble too. Obviously, you cannot put the ball on the ground and Najee needs to prevent it from happening, but you gotta give credit for the punch out. That shit was clean.",14.0,steelers,t3_yuh9b3,False,0.0,Quack,2022-11-13T18:20:02Z,steelers,-0.0022407407407407
15093,93653,93653,IhamAmerican,Plus that throw to Naj in the end zone was great,34.0,steelers,t3_yudyls,False,0.0,Quack,2022-11-13T15:01:59Z,steelers,0.6249
15094,93654,93654,IhamAmerican,Line bad. RB bad,3.0,nfl,t3_yudztm,False,0.0,:Steelers: Steelers,2022-11-13T14:59:57Z,steelers,-0.406725
15095,93655,93655,IhamAmerican,Ah yes. We won by running the football and explosive plays. Just as we all expected,125.0,nfl,t3_yudyy7,False,0.0,:Steelers: Steelers,2022-11-13T14:58:36Z,steelers,0.0916407407407407
15096,93656,93656,IhamAmerican,"That drive was all Warren, for sure. He came up so clutch",0.0,nfl,t3_yudc6n,False,0.0,:Steelers: Steelers,2022-11-13T14:48:57Z,steelers,0.07955
15097,93658,93658,IhamAmerican,I knew that was going in when I saw Spillane in coverage lol,3.0,nfl,t3_yubaa0,False,0.0,:Steelers: Steelers,2022-11-13T13:28:07Z,steelers,0.4215
15629,96639,96639,Imperial_Lenta,Didn't watch that game but I did watch the London game and if he played like that every week he'd legitimately be top 10-5 because holy shit he was making insane plays that game,2.0,nygiants,t3_yv2ea1,False,0.0,Steelers:Dimes:,2022-11-14T16:28:35Z,steelers,0.1531
15630,96641,96641,Imperial_Lenta,"Yeah, no one is gonna be as challenging as the Steelers were last year.",2.0,kansascitychiefs,t3_yufoc7,False,0.0,Steelers,2022-11-14T05:54:28Z,steelers,0.1531
15631,96643,96643,Imperial_Lenta,"If I was a Chiefs fan I'd still be weary of the Bills and Titans, the Bills beat you and the Titans kept it close",5.0,kansascitychiefs,t3_yufoc7,False,1.0,Steelers,2022-11-13T17:49:17Z,steelers,0.0516
