,Unnamed: 0.1,Unnamed: 0,author,body,score,subreddit,link_id,over_18,controversiality,author_flair_text,created_utc,flair,sentiment
26699,186086,186086,Thankgodfordrugs17,I’m sorry man. GG’s,4.0,steelers,t3_yudtwe,False,0.0,:troy1::troy2:Troy,2022-11-13T15:35:11Z,steelers,-0.0193
26700,186087,186087,Thankgodfordrugs17,"This O line was never good lmfao. 

The sub jumped on the O-line train cause every other aspect of this team looked like shit and the line looked subpar. 

Nonetheless, just good vibes, let’s be happy today.",42.0,steelers,t3_yudzp0,False,0.0,:troy1::troy2:Troy,2022-11-13T15:02:53Z,steelers,0.2008111111111111
26846,187110,187110,The1KrisRoB,"> but I think Pickens's was a little tougher because of the adjustment he had to make to the ball.

That's why I like the Pickens catch better, the body control he needed to use to contort himself into a position to make the catch was incredible.",0.0,nfl,t3_yueax6,False,0.0,:Steelers: Steelers,2022-11-14T00:44:38Z,steelers,0.3687749999999999
27718,190204,190204,TheGrat1,"Nagy was actually a good oc/qb coach in KC, though. He helped coach Alex Smith to the only 3 pro bowls of his career.",1.0,nfl,t3_yv246a,False,0.0,:Steelers: Steelers,2022-11-15T21:15:01Z,steelers,0.1101
27719,190206,190206,TheGrat1,"Some were coverage sacks and the run blocking was very good most of the game. What was it? 3 easy sneaks including a TD? They have played worse this season, much worse. Chukwuma pretty much shut down Cam Jordan.",2.0,steelers,t3_yudzp0,False,1.0,:sh: 4  3 :sh: Troy Polamalu,2022-11-13T16:03:37Z,steelers,0.078915616
27720,190207,190207,TheGrat1,Language! My goodness!,-7.0,steelers,t3_yuegrw,False,0.0,:sh: 4  3 :sh: Troy Polamalu,2022-11-13T15:58:42Z,steelers,0.25465
27721,190208,190208,TheGrat1,Vikings: You call that a choke? Check out this prevent the win defense.,5.0,nfl,t3_yu84j2,False,0.0,:Steelers: Steelers,2022-11-13T15:24:04Z,steelers,0.195675
27722,190210,190210,TheGrat1,Bwahahahaha! Lmao what a choke!,1.0,nfl,t3_yu84j2,False,0.0,:Steelers: Steelers,2022-11-13T15:13:15Z,steelers,0.08795
27723,190212,190212,TheGrat1,"Playing the ball above eye level, which he did not do against New England on their long pass TD, has nothing to do with TJ. That was a great individual play there and it was all technique.

&#x200B;

That being said, TJ has absolutely helped speed Dalton up and force teams to use eligibles to chip him.",2.0,steelers,t3_yu7cum,False,0.0,:sh: 4  3 :sh: Troy Polamalu,2022-11-13T14:50:15Z,steelers,0.0917037037037037
27724,190213,190213,TheGrat1,"That is what happens when you play the ball above eye level!

&#x200B;

Wright. This is your last game as a Steeler.",3.0,steelers,t3_yu7cum,False,0.0,:sh: 4  3 :sh: Troy Polamalu,2022-11-13T14:43:25Z,steelers,0.0148259259259259
27725,190216,190216,TheGrat1,It did not get called when Connor Heyward got hit with the crown of the helmet straight to his facemask earlier.,1.0,nfl,t3_yu84ll,False,0.0,:Steelers: Steelers,2022-11-13T13:28:07Z,steelers,0.2263
27726,190217,190217,TheGrat1,They call that but not Heyward getting blasted with the crown of the helmet. Smh,11.0,nfl,t3_yu84ll,False,0.0,:Steelers: Steelers,2022-11-13T13:25:21Z,steelers,-0.1591
27727,190218,190218,TheGrat1,They call that but not Heyward getting blasted with the crown of the helmet. Smh,6.0,steelers,t3_yu7cum,False,0.0,:sh: 4  3 :sh: Troy Polamalu,2022-11-13T13:22:56Z,steelers,-0.1591
28339,192272,192272,TheOneColt,Miami lost theirs because of tampering,1.0,steelers,t3_yw08r2,False,0.0,:sh::h1::h4::sh: Slim Pickens,2022-11-15T23:27:10Z,steelers,-0.3182
28340,192273,192273,TheOneColt,No I’m suggesting that there are only 31 first round picks this year,1.0,steelers,t3_yw08r2,False,0.0,:sh::h1::h4::sh: Slim Pickens,2022-11-15T21:04:05Z,steelers,-0.296
28341,192274,192274,TheOneColt,"It’s going to be weird to see these in the daytime, even if it’s just for an hour or so",3.0,steelers,t3_ywdwwh,False,0.0,:sh::h1::h4::sh: Slim Pickens,2022-11-15T20:29:42Z,steelers,-0.1779
28342,192275,192275,TheOneColt,If we can get one of them with our 2nd pick absolutely. This team needs to get better in the trenches first,1.0,steelers,t3_yw8dl2,False,0.0,:sh::h1::h4::sh: Slim Pickens,2022-11-15T20:21:40Z,steelers,0.2202
28343,192278,192278,TheOneColt,When you have to face an even stronger Steelers defense without Ja’Marr Chase,32.0,steelers,t3_yw3g48,False,0.0,:sh::h1::h4::sh: Slim Pickens,2022-11-15T11:23:07Z,steelers,0.4767
28344,192281,192281,TheOneColt,They have the same smile,1.0,steelers,t3_yudy0n,False,0.0,:sh::h1::h4::sh: Slim Pickens,2022-11-14T14:34:26Z,steelers,0.3612
28345,192285,192285,TheOneColt,"There is your offensive touchdown, please cherish it until next Sunday",36.0,steelers,t3_yu7cum,False,0.0,:sh::h1::h4::sh: Slim Pickens,2022-11-13T12:25:10Z,steelers,0.2263
28346,192286,192286,TheOneColt,"I don’t know how much of it is injury and how much of it is bad habits.   

Last year he had the lowest average yards before contact in the league, but the best yards after contact. Now he has an average yards before contact, but the lowest yards after contact at 1.6 yards.  

I’m sure he got used to having to jump, dodge, dip, dive, or duck behind the line to get his yards. Now, there are actual holes that he is missing or yards he leaves on the table because of that stupid jump cut.",61.0,steelers,t3_yt3svi,False,0.0,:sh::h1::h4::sh: Slim Pickens,2022-11-12T05:20:53Z,steelers,-0.14491392
28347,192287,192287,TheOneColt,"Agreed, the Vikings can’t be the only ones with a helmet themed helmet.",2.0,steelers,t3_yshi81,False,0.0,:sh::h1::h4::sh: Slim Pickens,2022-11-11T15:03:14Z,steelers,0.2732
28348,192288,192288,TheOneColt,Graham Gano actually won this one due to a clerical error.,54.0,nfl,t3_ysi8o6,False,0.0,:Steelers: Steelers,2022-11-11T15:01:07Z,steelers,0.25
28349,192289,192289,TheOneColt,Be still my beating heart,80.0,steelers,t3_yshwb2,False,0.0,:sh::h1::h4::sh: Slim Pickens,2022-11-11T12:05:27Z,steelers,0.875
28350,192290,192290,TheOneColt,"When no one else got me, I know u/CornDoggyLol got me with a cute doodle. Can I get an amen?",74.0,steelers,t3_yshi81,False,0.0,:sh::h1::h4::sh: Slim Pickens,2022-11-11T11:58:14Z,steelers,0.050575
28897,196991,196991,Tickle_Nuggets,I'm on my PSP playing Madden 10 (Polamalu/Fitzgerald cover) watching the game in Germany on stream. Life's good!,10.0,steelers,t3_yu4yme,False,0.0,:sa::a4::a3::sa: Polamalu,2022-11-13T10:29:32Z,steelers,0.296875
28898,196993,196993,Tickle_Nuggets,"I say we should do the South Park song.. 
BLAME CANADAAAA
BLAME CANADAAAA",13.0,steelers,t3_yu4j9p,False,0.0,:sa::a4::a3::sa: Polamalu,2022-11-13T09:55:45Z,steelers,-0.29295
28899,197002,197002,Tickle_Nuggets,I was joking a bit. I'm just excited to see him play since our CB play this year has been subpar. Well miss him this Sunday,2.0,steelers,t3_ysldfs,False,0.0,:sa::a4::a3::sa: Polamalu,2022-11-12T08:32:09Z,steelers,0.1327259259259259
28900,197006,197006,Tickle_Nuggets,Y'all see Pickens in the back? Lol,8.0,steelers,t3_yskcy7,False,0.0,:sa::a4::a3::sa: Polamalu,2022-11-12T08:15:57Z,steelers,0.21075
28901,197012,197012,Tickle_Nuggets,"Dude just got on our team and is already like ""my back hurts""",5.0,steelers,t3_ysldfs,False,0.0,:sa::a4::a3::sa: Polamalu,2022-11-12T07:17:28Z,steelers,-0.1531
29711,204857,204857,Vaultboy65,In this instance I’m glad it happened. If he hit the kick I lose my bet on the game,1.0,steelers,t3_yuk2en,False,1.0,:sc::c9::c0::sc: TJ Watt,2022-11-13T19:57:17Z,steelers,-0.08625
29712,204858,204858,Vaultboy65,In this instance I’m glad it happened. If he hit the kick I lose my bet on the game,-11.0,steelers,t3_yuk2en,False,0.0,:sc::c9::c0::sc: TJ Watt,2022-11-13T19:56:31Z,steelers,-0.08625
30261,209080,209080,VonDoom47,Is it more difficult to sort by new than it used to be on mobile?,3.0,nfl,t3_yu84ll,False,0.0,:Steelers: Steelers,2022-11-13T12:22:50Z,steelers,-0.4201
30398,209758,209758,WVSmitty,"Should be interesting.  With Minka out, Saints would be smart to pass.  However, they have to stop the pass rush of TJ.

Will 17 points be enough to win against the Saints at home?",40.0,steelers,t3_ytxdlu,False,0.0,:sa:32:sa: Away Jersey,2022-11-13T05:27:10Z,steelers,0.135824609375
31193,217566,217566,YooTone,🥳,38.0,steelers,t3_yxf8qu,False,0.0,:sh:21:sh: Amos Zereoue,2022-11-16T22:41:29Z,steelers,0.3818
31194,217569,217569,YooTone," Round 1 - One of these guys - Kelee Ringo CB. Paris Johnson OT. Bryan Bresee DT. Joey Porter CB.

Round 2 - Two of these guys - Drew Sanders LB. Jaelyn Duncan OT. Garrett Williams CB. Jordan Battle S.",1.0,steelers,t3_yw08r2,False,0.0,:sh:21:sh: Amos Zereoue,2022-11-15T10:52:29Z,steelers,-0.047725
31195,217572,217572,YooTone,Exactly. The people that say shit like that are reactionary fans that don't understand football.,4.0,steelers,t3_yuj970,False,0.0,:sh:21:sh: Amos Zereoue,2022-11-14T14:09:41Z,steelers,-0.1366
31196,217573,217573,YooTone,"Idk why I got downvoted 😆

But are you for real man ? That does sound very cool!",1.0,nfl,t3_yumtrz,False,0.0,:Steelers: Steelers,2022-11-14T01:41:41Z,steelers,0.25395
31197,217574,217574,YooTone,Backup squad kicker would be pretty sick honestly,3.0,nfl,t3_yumtrz,False,0.0,:Steelers: Steelers,2022-11-14T00:26:41Z,steelers,0.4404
31198,217575,217575,YooTone,Bro I could make the same and I'd just throw that shit at the sidelines each time. Sign me the fuck up,62.0,nfl,t3_yumtrz,False,0.0,:Steelers: Steelers,2022-11-14T00:24:40Z,steelers,-0.4105
31199,217576,217576,YooTone,"Yeah no. Just read the other reply lol. I know I got Steelers flair but I have Steelers fans bitching at me for my non yinzer takes because I'm a very neutral person. This doesn't even seem like karma, because it's not. It just sucks. He's a good guy. Burfict literally headshotted a defenseless receiver.",1.0,nfl,t3_yuauvl,False,0.0,:Steelers: Steelers,2022-11-14T00:00:46Z,steelers,-0.0407708541023358
31200,217577,217577,YooTone,"Najee is literally a fucking tank lmao. I know he's struggled this year but gahd damn, I want this guy to be better than Leveon. He's such a good dude on and off the field and literally deserves it.

But anyways, I was driving from eastern PA to Pittsburgh this afternoon and didn't get to watch the game (radio, when clear, only) and holy fuck I just put on the rewind and when I saw Kenny running for this block I got hype as shit. 

Kenny isn't a bad player guys. He's not AMAZING right now either. Let the man fucking learn what he's doing and let's hope for improvement.",38.0,steelers,t3_yuj970,False,0.0,:sh:21:sh: Amos Zereoue,2022-11-13T23:24:44Z,steelers,0.0908554048786766
31201,217579,217579,YooTone,"No that was the first report, it's been confirmed we got the Bears second rounder.

https://www.google.com/amp/s/www.espn.com/nfl/story/_/id/34925571/source-bears-get-chase-claypool-trade-steelers%3fplatform=amp",10.0,steelers,t3_yudyls,False,0.0,:sh:21:sh: Amos Zereoue,2022-11-13T15:42:09Z,steelers,-0.074
31202,217580,217580,YooTone,Hoping for the best,0.0,steelers,t3_yt3svi,False,0.0,:sh:21:sh: Amos Zereoue,2022-11-12T13:22:43Z,steelers,0.7906
31203,217581,217581,YooTone,"Love the outlook, agreed 💯",2.0,steelers,t3_yt3svi,False,0.0,:sh:21:sh: Amos Zereoue,2022-11-12T12:12:54Z,steelers,0.743
31204,217582,217582,YooTone,Yeah I hope things improve for the man,2.0,steelers,t3_yt3svi,False,0.0,:sh:21:sh: Amos Zereoue,2022-11-12T12:02:12Z,steelers,0.7906
31205,217583,217583,YooTone,"Oh yes you're right we have no proof, it's just obvious something is up. The dude knows how to play running back obviously. He has the film to back that up. And idk, wasn't he rated as one of the top 5 to 10 RB's last year?",-1.0,steelers,t3_yt3svi,False,0.0,:sh:21:sh: Amos Zereoue,2022-11-12T12:01:06Z,steelers,0.0314875
31206,217584,217584,YooTone,No. I'm not in denial at all because I'm literally saying he's struggling this year. I just want him to have a great OL and hope he can get to 100% because he doesn't look himself since his lisfranc injury in August.,1.0,steelers,t3_yt3svi,False,0.0,:sh:21:sh: Amos Zereoue,2022-11-12T11:58:07Z,steelers,0.1766666666666666
31207,217585,217585,YooTone,"Team is doing poorly as all sports teams sometimes go through - ""Oh my god the world is ending let's bring out the pitchforks and whatever else we can find""",5.0,steelers,t3_yt3svi,False,0.0,:sh:21:sh: Amos Zereoue,2022-11-12T11:53:24Z,steelers,0.2732
31208,217586,217586,YooTone,"He probably has and I don't blame him. Just for perspective for a second, how many times have football players said they're fine but then they aren't performing at 100%? It's been a lot. Again, people are taking this the wrong way. I agree with you! There's issues this year but don't you think he's avoiding contact too much compared to last year when he was at 100%? That's just what I mean",-1.0,steelers,t3_yt3svi,False,0.0,:sh:21:sh: Amos Zereoue,2022-11-12T11:44:15Z,steelers,-0.008701728750047
31209,217587,217587,YooTone,Agreed! All I mean is that I wish we could have the same like we did with Leveon Bell and that OL.,0.0,steelers,t3_yt3svi,False,0.0,:sh:21:sh: Amos Zereoue,2022-11-12T11:40:23Z,steelers,0.403
31210,217588,217588,YooTone,"Because there's a lot of reactionary homers. These are the same people that said Claypool was only worth a 6th or 7th round pick, and that we need to draft a new QB in the 2023 draft lol. There's A LOT of non smart fans on reddit that don't know what they're talking about besides what they see through the television.",4.0,steelers,t3_yt3svi,False,0.0,:sh:21:sh: Amos Zereoue,2022-11-12T11:39:35Z,steelers,0.1975111111111111
31211,217591,217591,YooTone,"Every NFL player literally says otherwise. I'm not the mindless Tomlin defender, as I think his game plans have been pretty bad in the playoffs. But. Nearly all other coaches, players, analysts etc say he's a top coach. We should probably go with their judgement.",1.0,steelers,t3_yt3svi,False,0.0,:sh:21:sh: Amos Zereoue,2022-11-12T11:32:29Z,steelers,0.00867184
31212,217592,217592,YooTone,You bring up great points!,1.0,steelers,t3_yt3svi,False,0.0,:sh:21:sh: Amos Zereoue,2022-11-12T11:30:14Z,steelers,0.6588
31213,217593,217593,YooTone,"I agree with you, he's not doing well. I'm not shying away from that. And again that's all I'm saying! I hope we can get a mauler OL at some point very soon so our skilled position players can get a little more protection.",2.0,steelers,t3_yt3svi,False,0.0,:sh:21:sh: Amos Zereoue,2022-11-12T11:28:09Z,steelers,0.1134296875
31214,217594,217594,YooTone,Great reply. That's all I'm saying too; I'd love to see a great offensive line with our skill players.,1.0,steelers,t3_yt3svi,False,0.0,:sh:21:sh: Amos Zereoue,2022-11-12T11:26:38Z,steelers,0.527725
31215,217595,217595,YooTone,"Well many of you said Claypool was worth a 7th round pick and that Kenny is trash so we need to draft another QB this year, so I'll go with the Steelers front office rather than random redditors being reactionary.",1.0,steelers,t3_yt3svi,False,0.0,:sh:21:sh: Amos Zereoue,2022-11-12T11:25:42Z,steelers,0.4588
31216,217596,217596,YooTone,"Nah, it's more of Jaylen gets the call on what would be pass plays and picks up 5 yards. He goes in when we'd typically do pass plays. Literally what the other guy said is correct",3.0,steelers,t3_yt3svi,False,0.0,:sh:21:sh: Amos Zereoue,2022-11-12T11:22:25Z,steelers,0.0334481481481481
31217,217597,217597,YooTone,Thank you,1.0,steelers,t3_y3a7hl,False,0.0,:sh:21:sh: Amos Zereoue,2022-11-12T11:20:10Z,steelers,0.3612
31218,217598,217598,YooTone,"Nobody seems to take into account his injury. He is not playing well, I'm not downplaying that at all and I agree. I wish he'd get the surgery or off time he needs to get back to 100%.",-2.0,steelers,t3_yt3svi,False,0.0,:sh:21:sh: Amos Zereoue,2022-11-12T11:19:32Z,steelers,0.1210555555555555
31219,217599,217599,YooTone,Not sure. He looks okay when he's not injured. I'd be more focused on the offensive line if I were you,-1.0,steelers,t3_yt3svi,False,1.0,:sh:21:sh: Amos Zereoue,2022-11-12T06:11:58Z,steelers,0.0359481481481481
31220,217600,217600,YooTone,"Love the vibes bro! I guess I'm just saying we aren't a great team right now so I would love to build,!,",3.0,steelers,t3_yt3svi,False,0.0,:sh:21:sh: Amos Zereoue,2022-11-12T06:10:43Z,steelers,0.34395
31221,217601,217601,YooTone,"Yeah you're not wrong. But the expert analysts disagree with you, so I do too. Give him an OL so he can try to be elite.",1.0,steelers,t3_yt3svi,False,0.0,:sh:21:sh: Amos Zereoue,2022-11-12T06:09:23Z,steelers,-0.0370592592592592
31222,217602,217602,YooTone,"I appreciate everything you said brother. And the last sentence was the most important. It was one of the best lines. So let's try to duplicate that!

What we need to look forward to is the fact we literally do have weapons. And they're rookies or sophomores. If we build this like we'll be good for a long time",2.0,steelers,t3_yt3svi,False,0.0,:sh:21:sh: Amos Zereoue,2022-11-12T06:06:58Z,steelers,0.0984715799903587
31223,217603,217603,YooTone,Appreciate the response. I'm just glad I was accurate in my decision making.,1.0,steelers,t3_y3a7hl,False,0.0,:sh:21:sh: Amos Zereoue,2022-11-12T05:55:17Z,steelers,0.329875
31224,217604,217604,YooTone,"I'm not sure either man. And I completely understand what you're saying.

All I wish, and I hope this doesn't sound too much, is for him to rush behind a great OL like when we had Leveon behind that hall of fame line.",-1.0,steelers,t3_yt3svi,False,1.0,:sh:21:sh: Amos Zereoue,2022-11-12T05:25:58Z,steelers,0.3023037037037037
31225,217606,217606,YooTone,Haha. People downvoted me for not knowing this. And I was correct about our team gaining more draft picks via trades. :),1.0,steelers,t3_y3a7hl,False,0.0,:sh:21:sh: Amos Zereoue,2022-11-12T05:11:15Z,steelers,0.1428359375
31226,217607,217607,YooTone,"We did it buddy, but for a 2nd haha",1.0,steelers,t3_y3a7hl,False,0.0,:sh:21:sh: Amos Zereoue,2022-11-12T05:09:53Z,steelers,0.6124
31227,217608,217608,YooTone,It's funny looking back on this too! None of our Steelers fans thought we'd get a 2nd rounder. And I brought this up before he had his good games this year lmao,2.0,steelers,t3_y3a7hl,False,0.0,:sh:21:sh: Amos Zereoue,2022-11-12T05:06:12Z,steelers,0.2776777777777777
31228,217611,217611,YooTone,"I had to revisit this. Yes you're right. But, blatant stats aren't what's solely important in NFL trades.",1.0,steelers,t3_y3a7hl,False,0.0,:sh:21:sh: Amos Zereoue,2022-11-12T05:01:15Z,steelers,-0.0298444444444444
31229,217612,217612,YooTone,Damn this comment LOL. I was so right.,1.0,steelers,t3_y3a7hl,False,0.0,:sh:21:sh: Amos Zereoue,2022-11-12T05:00:30Z,steelers,0.052575
31230,217613,217613,YooTone,"I know a lot of you are vocal that Najee sucks. He doesn't. He's young still. And it seems he could be injured which has been effecting him. Here's a video less than 2 years ago showing why he's a top talent. And remember his rookie year where he was a top 10 RB just last year. Again; be smart and listen; I'm not saying he's great or amazing, just that we know what he's capable of when he's at 100%.",-3.0,steelers,t3_yt3svi,False,1.0,:sh:21:sh: Amos Zereoue,2022-11-12T04:57:27Z,steelers,0.1057143885625887
31231,217614,217614,YooTone,"Sorry guys and girls. Just posting this to remind us what Najee can do. I know a lot of you are pissed with his performance this year and that's rightfully so. I just hope the lisfranc injury is what is holding him back because he is a force to be reckoned with when he's 100% and if we have a top OL when he's 100%, it will be scary.",0.0,steelers,t3_yt3jz4,False,0.0,:sh:21:sh: Amos Zereoue,2022-11-12T04:44:34Z,steelers,-0.1196578124999999
31232,217615,217615,YooTone,"Honestly? Just take the bus as early as you can and get to Heinz Field as early as possible.  


I went to the Jets / Steelers tailgate at like 930am and it was the most fun I've had in a long ass time, sporting wise.

&#x200B;

You won't be disappointed, just go down to the stadium and you'll literally make friends instantly. I was by myself too.",8.0,steelers,t3_ysnmwo,False,0.0,:sh:21:sh: Amos Zereoue,2022-11-12T04:39:59Z,steelers,0.033115616
31233,217616,217616,YooTone,I think we all know this shit has nothing to do with the WR coaching. I'm not saying this in a bad way either. We seem to be competent in our WR drafting and development so I don't think much else needs to be said.,8.0,steelers,t3_yt1692,False,0.0,:sh:21:sh: Amos Zereoue,2022-11-12T04:37:35Z,steelers,0.0220037037037036
31618,219610,219610,Zane_Flynt_boyo,hes like a white taysom hill,185.0,nfl,t3_yxa1pv,False,0.0,:Steelers: Steelers :Panthers: Panthers,2022-11-16T17:44:52Z,steelers,0.3612
31619,219611,219611,Zane_Flynt_boyo,"You have to be careful when judging by points allowed because they usually dont tell a whole figure. 7 points is 7 points to that stat, no matter if a offense marched 90 yards to do so or if the a turnover spotted the ball at the 10 and all it took was one goal line fade.",38.0,nfl,t3_yx9u6z,False,0.0,:Steelers: Steelers :Panthers: Panthers,2022-11-16T17:33:57Z,steelers,-0.095325
31620,219612,219612,Zane_Flynt_boyo,">dan moore 

lmao what",11.0,nfl,t3_ywyzme,False,0.0,:Steelers: Steelers :Panthers: Panthers,2022-11-16T11:12:19Z,steelers,0.5994
31621,219613,219613,Zane_Flynt_boyo,i wish OP could feel how much I eye rolled at this,248.0,nfl,t3_yww4np,False,0.0,:Steelers: Steelers :Panthers: Panthers,2022-11-16T09:18:52Z,steelers,0.4019
31622,219617,219617,Zane_Flynt_boyo,"You whats wild to me? Some estimates put Art Rooneys net worth at about 500m to 1b

Mahomes contract is for about 500m. 

I never considered that there could be a player with a comparable value to a owner",1.0,nfl,t3_yvzlz2,False,0.0,:Steelers: Steelers :Panthers: Panthers,2022-11-15T20:20:03Z,steelers,0.1384777777777777
31623,219619,219619,Zane_Flynt_boyo,"Im glad Heinz field has turf so natural, pigeons hang out on it",6.0,nfl,t3_yvzlz2,False,0.0,:Steelers: Steelers :Panthers: Panthers,2022-11-15T10:40:05Z,steelers,0.7384
31624,219627,219627,Zane_Flynt_boyo,"i swear every time i think i know what a penalty is in the NFL, they change it up on me",1.0,nfl,t3_yvhyye,False,0.0,:Steelers: Steelers :Panthers: Panthers,2022-11-14T19:58:44Z,steelers,-0.4939
31625,219628,219628,Zane_Flynt_boyo,Jalen Hurts is more attractive than Taylor Swift,2.0,nfl,t3_yvhyye,False,0.0,:Steelers: Steelers :Panthers: Panthers,2022-11-14T19:55:40Z,steelers,0.2247
31626,219631,219631,Zane_Flynt_boyo,No they arent because you can see multiple in this thread right now. Happens in every single minkah post because yall just cant fathom why hes left the team.,26.0,nfl,t3_yv1g37,False,0.0,:Steelers: Steelers :Panthers: Panthers,2022-11-14T09:12:18Z,steelers,-0.074
31627,219632,219632,Zane_Flynt_boyo,"Its so stupid and this guy and those Dolphins fans should be ashamed of themselves. 

their team wanted to tank at the expense of players and coaches, and when the players and coaches protested against this, fans blamed the players and coaches. So immature.",15.0,nfl,t3_yv1g37,False,0.0,:Steelers: Steelers :Panthers: Panthers,2022-11-14T09:02:08Z,steelers,-0.0907407407407407
31628,219633,219633,Zane_Flynt_boyo,"Dolphins fans are so bitter and entitled over that whole situation.

Your GM and coached wanted to tank and throw away your best players. Minkah realized this and wanted out, Flores knew this and didnt want to tank.

Dolphins org fucked over themselves and their fans are bitter towards the people who stood up for themselves.

You guys are emotionally immature twerps for not realizing anything beyond arms reach of what benefits your own team.",177.0,nfl,t3_yv1g37,False,0.0,:Steelers: Steelers :Panthers: Panthers,2022-11-14T08:56:04Z,steelers,0.0487629759999999
31629,219634,219634,Zane_Flynt_boyo,i hope he falls erection first into a fire ant hill,132.0,nfl,t3_yuz3jw,False,0.0,:Steelers: Steelers :Panthers: Panthers,2022-11-14T08:04:00Z,steelers,0.128
31630,219635,219635,Zane_Flynt_boyo,I really dont want to hear any argument that says Herbert is not a top 5 qb in the league,29.0,nfl,t3_yul35x,False,0.0,:Steelers: Steelers :Panthers: Panthers,2022-11-13T19:32:16Z,steelers,-0.5562
31631,219636,219636,Zane_Flynt_boyo,Bills game had a PI called with like 11 secs left,3.0,nfl,t3_yukkuv,False,0.0,:Steelers: Steelers :Panthers: Panthers,2022-11-13T19:28:39Z,steelers,0.3612
31632,219641,219641,Zane_Flynt_boyo,"And he still sees a bunch of snaps especially in dime when hes slow as shit and bad in coverage

43% of defensive snaps when hes singularly a ster",0.0,nfl,t3_yubaa0,False,0.0,:Steelers: Steelers :Panthers: Panthers,2022-11-13T13:32:16Z,steelers,-0.7906
31633,219642,219642,Zane_Flynt_boyo,I hate robert spillane so much but the steelers keep deciding hes not worth upgrading over,1.0,nfl,t3_yubaa0,False,0.0,:Steelers: Steelers :Panthers: Panthers,2022-11-13T13:28:41Z,steelers,-0.5186
31634,219643,219643,Zane_Flynt_boyo,Should have thrown a flag for helmet to helmet on top of that,4.0,nfl,t3_yua5z5,False,0.0,:Steelers: Steelers :Panthers: Panthers,2022-11-13T12:45:44Z,steelers,0.2023
31635,219645,219645,Zane_Flynt_boyo,Fire Canada,2.0,nfl,t3_yu84ll,False,0.0,:Steelers: Steelers :Panthers: Panthers,2022-11-13T12:08:56Z,steelers,-0.34
31636,219646,219646,Zane_Flynt_boyo,"if you drive a pick up truck when you dont necessarily have to, you have voided ur right to complain about gas prices",16.0,nfl,t3_yt9chc,False,0.0,:Steelers: Steelers :Panthers: Panthers,2022-11-12T14:31:14Z,steelers,-0.3612
31637,219648,219648,Zane_Flynt_boyo,am i wrong for thinking 8 hour shifts standing (no mats) with no breaks are a bit bullshit?,16.0,nfl,t3_yt9chc,False,0.0,:Steelers: Steelers :Panthers: Panthers,2022-11-12T12:27:40Z,steelers,-0.8442
