,Unnamed: 0.1,Unnamed: 0,author,body,score,subreddit,link_id,over_18,controversiality,author_flair_text,created_utc,flair,sentiment
21102,109535,109535,Jruzzin,"What about comparing the team to the entire history of the NFL? I don’t think there is ever an excuse to give up historically bad defense. Every player sets a personal best, the Seahawks never had to punt, and they rank at the bottom in the league in defense. Other teams have done more with less, I’m sick of the excuses.",1.0,detroitlions,t3_y6a14v,False,0.0,Yas Lions,2022-10-18T12:55:45Z,detroitlions,-0.0787796875
21103,109536,109536,Jruzzin,"I could understand what you mean about the offense. Outside of last week I’d agree, they’ve outperformed themselves. I’m more speaking about the HISTORICALLY bad defense that is can’t make a stop. It’s concerning. I like DC and AG and i hope they turn it around but i am really worried.",3.0,detroitlions,t3_y6df02,False,0.0,Yas Lions,2022-10-17T17:02:51Z,detroitlions,-0.03219728
21104,109537,109537,Jruzzin,"I don’t think it’s that, it’s the way they’re using games. Injuries are rough and the defense isn’t super talented but good coaches get the best out of what they have and they put their guys in the best position possible to win. The coaching staff isn’t doing that.",6.0,detroitlions,t3_y6df02,False,0.0,Yas Lions,2022-10-17T16:03:50Z,detroitlions,0.1089777777777777
21105,109539,109539,Jruzzin,"I’m not being a jackass, i didn’t call the guy names or anything. I just don’t think you should say “jamo is definitely doing this” when there is no real proof this is his finsta.",-2.0,detroitlions,t3_y5tbxg,False,0.0,Yas Lions,2022-10-17T10:49:57Z,detroitlions,0.1452999999999999
21106,109540,109540,Jruzzin,"This isn’t even the same Instagram as the one in your post. Lol cmon now. 

Also unverified and could be made by anyone. Get outta here.",-1.0,detroitlions,t3_y5tbxg,False,0.0,Yas Lions,2022-10-17T09:29:28Z,detroitlions,0.0065859375
21107,109542,109542,Jruzzin,"No, it’s bigsgjamo. I’ll send you my cash app. 

If you’re going to make things up then at least make it a semi believable fake name.",-1.0,detroitlions,t3_y5tbxg,False,0.0,Yas Lions,2022-10-17T09:25:32Z,detroitlions,-0.1589
21108,109543,109543,Jruzzin,"Great, give me $1000 then",1.0,detroitlions,t3_y5tbxg,False,0.0,Yas Lions,2022-10-17T09:21:59Z,detroitlions,0.6249
21109,109544,109544,Jruzzin,Fake,-1.0,detroitlions,t3_y5tbxg,False,0.0,Yas Lions,2022-10-17T09:13:38Z,detroitlions,-0.4767
21110,109545,109545,Jruzzin,"It’s fake news dude. This isn’t Jamo’s Instagram, OP is just trolling.",-5.0,detroitlions,t3_y5tbxg,False,0.0,Yas Lions,2022-10-17T09:13:16Z,detroitlions,-0.119175
21111,109546,109546,Jruzzin,"You won’t really know the difficulty of the schedule until the season is over. I don’t think people are mad we are losing, it’s the manor in which we’re closing games.",6.0,detroitlions,t3_y5vj7u,False,0.0,Yas Lions,2022-10-17T06:20:51Z,detroitlions,-0.448825
21112,109547,109547,Jruzzin,Dude me too😂,2.0,detroitlions,t3_y5316m,False,0.0,Yas Lions,2022-10-16T11:53:20Z,detroitlions,0.4404
21113,109548,109548,Jruzzin,"This nails it. It’s so pitiful seeing people defend a 29-0 loss to a third string QB and a 1-3 team. 

I’m not quite ready to throw in the towel with DC yet but that was embarrassing and terrible and deserves high criticism.",6.0,detroitlions,t3_y4o42s,False,0.0,Yas Lions,2022-10-15T17:37:32Z,detroitlions,-0.3842777777777778
21114,109549,109549,Jruzzin,"Nah, too small of a sample size for that to be a risk right now. Especially after that last game.",2.0,detroitlions,t3_y4gt5v,False,0.0,Yas Lions,2022-10-15T11:41:37Z,detroitlions,-0.0903
21115,109550,109550,Jruzzin,"Not just lost, got humiliated by.",2.0,detroitlions,t3_y3yb8v,False,0.0,Yas Lions,2022-10-15T08:02:35Z,detroitlions,-0.1124
21116,109551,109551,Jruzzin,"If things continue to unwind from here I’d say it is. And so far it seems like it’s headed that way. 

Those are games that should have been won if not for questionable play calling from our HC. I’m a fan of DC and i hope he gets it together but these historical losses and records we are giving up at embarrassing.",1.0,detroitlions,t3_y3yb8v,False,0.0,Yas Lions,2022-10-14T17:54:44Z,detroitlions,-0.0367437499999999
21117,109552,109552,Jruzzin,Loser mentality. Things need to improve this year year and next year they need to be in the playoffs or really darn close to justify any longer.,1.0,detroitlions,t3_y3yb8v,False,0.0,Yas Lions,2022-10-14T17:51:50Z,detroitlions,0.088525
21118,109553,109553,Jruzzin,You wouldn’t consider this complete unwinding a train wreck? We just got blanked by a 1-3 team. Embarrassing losses and it turns out that our only win was against the worst team in the NFL.,4.0,detroitlions,t3_y3yb8v,False,0.0,Yas Lions,2022-10-14T17:50:45Z,detroitlions,-0.2432444444444444
22154,119471,119471,Kstoffeefan,I’m sure some Mr. Unlimiteds as well.,6.0,nfl,t3_y79z21,False,0.0,:Lions: Lions,2022-10-18T11:18:14Z,detroitlions,0.5267
22155,119484,119484,Kstoffeefan,"Chiefs Chargers was a really good game, but broadly yeah.",10.0,detroitlions,t3_y3hzga,False,0.0,Welcome to Detroit!,2022-10-14T00:16:17Z,detroitlions,0.5989
22429,125754,125754,LionintheATL,But I also love Jack Fox. I honestly love both punters,17.0,nfl,t3_y7rphz,False,0.0,:Lions: Lions :NFL: NFL,2022-10-19T00:28:35Z,detroitlions,0.595575
22430,125757,125757,LionintheATL,You must know our curse on 2nd round picks,4.0,nfl,t3_y4ujcg,False,0.0,:Lions: Lions :NFL: NFL,2022-10-15T15:03:25Z,detroitlions,-0.5423
23022,126968,126968,LionsC2H5OH,I appreciate that we can use this gif every year,1.0,detroitlions,t3_y2f4bf,False,0.0,Ragnowrok,2022-10-14T07:54:22Z,detroitlions,0.4019
24653,134468,134468,Magnum3k,Surprised they don’t show Raiders in Oakland and LA as often as possible,1.0,detroitlions,t3_y84uq6,False,0.0,MC⚡DC,2022-10-19T11:13:44Z,detroitlions,0.2263
24873,137154,137154,MichiganMedium,Yeah I didn’t see the part about not wanting to move him,1.0,detroitlions,t3_y6i1li,False,0.0,Tecmo Barry,2022-10-18T06:09:56Z,detroitlions,0.296
25903,147092,147092,OlacAttack,damn... gas is like 3.25 here right now... we just dont have many popeyes,2.0,nfl,t3_y6qmrj,False,0.0,:Lions: Lions,2022-10-17T21:48:21Z,detroitlions,-0.0516
25904,147093,147093,OlacAttack,sure looked like it,1.0,nfl,t3_y6qmrj,False,0.0,:Lions: Lions,2022-10-17T21:47:33Z,detroitlions,0.5859
25905,147097,147097,OlacAttack,whens the last time zeke broke a long one?,2.0,nfl,t3_y5vohw,False,0.0,:Lions: Lions,2022-10-16T21:37:00Z,detroitlions,-0.4215
26385,151371,151371,ParticularCanary3130,I give them the benefit of the doubt from Pre season. Everyone thought Russell would lead this team to the super bowl. Now? At this point? They better be flexing those games bc they Know how terrible that team is.,1.0,detroitlions,t3_y74g37,False,0.0,Sun God,2022-10-18T08:19:23Z,detroitlions,-0.00932
26386,151375,151375,ParticularCanary3130,Took me Waaay too long to figure out what AA meant lol. Westsider here. Hopefully that explains it,5.0,detroitlions,t3_y5316m,False,0.0,Sun God,2022-10-15T20:12:00Z,detroitlions,0.1495777777777777
27068,152580,152580,Pinkaroundme,Lmfao so you’re saying Swift isn’t a good pick?,-3.0,detroitlions,t3_y6jhrl,False,1.0,Growley Cats,2022-10-17T16:25:23Z,detroitlions,0.8158
27069,152581,152581,Pinkaroundme,Did he opt out because of injury or because of COVID?,4.0,detroitlions,t3_y6jhrl,False,0.0,Growley Cats,2022-10-17T16:20:49Z,detroitlions,-0.4215
27070,152582,152582,Pinkaroundme,This isn’t Jamo’s Instagram account. Why are you blatantly lying?,-3.0,detroitlions,t3_y5tbxg,False,1.0,Growley Cats,2022-10-16T19:07:59Z,detroitlions,-0.26335
28575,164205,164205,RedWingWay,"Good: Giants, Jets and Eagles

Bad: Rams, Raiders, GB",1.0,nfl,t3_y7w5un,False,0.0,:Lions: Lions,2022-10-19T09:22:07Z,detroitlions,-0.1531
28576,164206,164206,RedWingWay,Act like Bill Belichick before actually winning anything.,2.0,detroitlions,t3_y7h0ey,False,0.0,Dan Friggin' Campbell,2022-10-18T20:52:02Z,detroitlions,0.7096
28577,164207,164207,RedWingWay,"I'd have more respect for Hackett if he just came out and said ""We didn't have any plays featuring fumbles"".",14.0,nfl,t3_y7lxu7,False,0.0,:Lions: Lions,2022-10-18T18:46:51Z,detroitlions,0.3925
28578,164209,164209,RedWingWay,"I would really love to be able to boo people at work like the crowds are able to boo players. 

Bad presentation Janice.... BOOOOOOOOOOOO!",14.0,nfl,t3_y6c224,False,0.0,:Lions: Lions,2022-10-17T12:24:25Z,detroitlions,-0.0948499999999999
28579,164211,164211,RedWingWay,"WWJD?

- Fire Jack Easterby.",1.0,nfl,t3_y6asjg,False,0.0,:Lions: Lions,2022-10-17T12:17:15Z,detroitlions,-0.17
28580,164212,164212,RedWingWay,Sauce turned heel pretty quick huh?,3.0,nfl,t3_y5tw0i,False,1.0,:Lions: Lions,2022-10-16T17:52:42Z,detroitlions,0.4939
28581,164215,164215,RedWingWay,"I'm a die hard Dodgers fan. We lost. We deserved to lose. Starting pitching was terrible, none of the bats showed up. We looked like we were beat going into the last game. No emotion. 

I absolutely hate the Padres but they deserved the win and the fans got to see them win at home.

Baseball is baseball.",2.0,nfl,t3_y5e04d,False,0.0,:Lions: Lions,2022-10-16T10:20:33Z,detroitlions,0.0131203611612319
28582,164216,164216,RedWingWay,Ah the old 1-2-1 base defense.,1.0,nfl,t3_y42f2p,False,0.0,:Lions: Lions,2022-10-14T15:40:59Z,detroitlions,0.128
28583,164217,164217,RedWingWay,Does Giselle have to pay half of it now?,9.0,nfl,t3_y42ova,False,0.0,:Lions: Lions,2022-10-14T15:39:33Z,detroitlions,-0.1027
28584,164218,164218,RedWingWay,DAN CAMPBELL WILL FIGURE OUT A WAY TO LOSE THE BYE WEEK.,130.0,nfl,t3_y44be6,False,0.0,:Lions: Lions,2022-10-14T15:36:53Z,detroitlions,-0.4019
28585,164219,164219,RedWingWay,After years of having life by the balls Tom is getting shit on in every direction this year.,1.0,nfl,t3_y3ygoo,False,0.0,:Lions: Lions,2022-10-14T15:35:50Z,detroitlions,-0.5574
28586,164220,164220,RedWingWay,This is some weird shit.,7.0,nfl,t3_y41fnp,False,0.0,:Lions: Lions,2022-10-14T15:28:02Z,detroitlions,-0.6486
28587,164221,164221,RedWingWay,Best offense in the NFL. - Tony Buzbee,126.0,nfl,t3_y42zp7,False,0.0,:Lions: Lions,2022-10-14T15:21:27Z,detroitlions,0.123475
30177,178031,178031,ShippingNotIncluded,"Minimal. 

I think legit criticisms can be made about his lack of addressing certain positions (Linebacker, backup QB, secondary) but so far I think the good outweighs the bad",3.0,detroitlions,t3_y7lds5,False,0.0,70s logo,2022-10-18T20:21:48Z,detroitlions,-0.1753
30178,178033,178033,ShippingNotIncluded,In 3yrs: Can new HC Jim Harbaugh get us over the hump like he did Michigan?,0.0,detroitlions,t3_y6ln05,False,0.0,70s logo,2022-10-18T06:41:10Z,detroitlions,0.3612
30179,178037,178037,ShippingNotIncluded,TL;DR - All of them are better than us,14.0,detroitlions,t3_y5uzox,False,0.0,70s logo,2022-10-16T18:37:51Z,detroitlions,0.4404
30180,178038,178038,ShippingNotIncluded,Best QB since Bobby Lane,-1.0,detroitlions,t3_y5qjo9,False,0.0,70s logo,2022-10-16T15:12:56Z,detroitlions,0.6369
30181,178041,178041,ShippingNotIncluded,"Goffaholics in shambles. 


Draft a real franchise QB, not someone who got dumped by his old team",1.0,detroitlions,t3_y5b0vc,False,1.0,70s logo,2022-10-16T05:31:47Z,detroitlions,-0.20095
30182,178042,178042,ShippingNotIncluded,"Yes , without question",-1.0,detroitlions,t3_y57ek1,False,1.0,70s logo,2022-10-16T00:44:51Z,detroitlions,0.4019
30183,178043,178043,ShippingNotIncluded,"Gotta love the “give him time” crowd. It’s like putting Microsoft Excel experience on your resume, you get the job and now they want you to put that skill to work..or you going to say “give me time”?",-2.0,detroitlions,t3_y4gt5v,False,1.0,70s logo,2022-10-15T05:36:55Z,detroitlions,0.509375
30184,178046,178046,ShippingNotIncluded,"He’s been underwhelming this far, anyone saying otherwise is in denial or UofM slap.

Nobody is rooting for him to fail, but it’s troublesome to see the no. 2 pick being invisible.",20.0,detroitlions,t3_y3uah6,False,0.0,70s logo,2022-10-14T11:30:13Z,detroitlions,-0.080074074074074
32169,185453,185453,SpikedZer0,"Yeah but that’s just stating that they are playing the Chargers on MNF. It’s not clarifying that it’s in the history of only MNF. 

It’s poor sentence structure. And most likely just a misleading and click baity way of wording it",3.0,denverbroncos,t3_y6wa6q,False,0.0,DT,2022-10-18T09:05:00Z,detroitlions,-0.125172265625
32170,185454,185454,SpikedZer0,It’s been all season. Looks like he’s about to shit himself every time he drops back,1.0,denverbroncos,t3_y6pxw6,False,0.0,DT,2022-10-17T21:04:46Z,detroitlions,-0.1366
32171,185455,185455,SpikedZer0,Yeah lol. Thinking about it now though it is kind of a weird way to put it if you didn’t know,1.0,denverbroncos,t3_y6pxw6,False,0.0,DT,2022-10-17T20:58:34Z,detroitlions,0.06415
32172,185456,185456,SpikedZer0,I think that’s the point. Like go get checked out by a doctor so you can catch the fact that you have cancer before it is too late,1.0,denverbroncos,t3_y6pxw6,False,0.0,DT,2022-10-17T20:56:48Z,detroitlions,-0.2202
32972,191702,191702,TBoneTheOriginal,"Well he forgot to add the fact that the Lions have done nothing to show they deserve more than one prime time game, so thanksgiving is it.",2.0,nfl,t3_y6fve0,False,0.0,:Lions: Lions ,2022-10-17T21:51:15Z,detroitlions,0.2732
32973,191703,191703,TBoneTheOriginal,Are we the stupid ones or are they?,1.0,detroitlions,t3_y6bg02,False,0.0,Don't Stop Believin',2022-10-17T20:08:45Z,detroitlions,-0.5267
32974,191704,191704,TBoneTheOriginal,"I’m 0-2.

49ers last year and Thanksgiving like 20+ years ago.

I’m flying in for the Packers game on week 6, so if you don’t mind, OP… join me.",3.0,detroitlions,t3_y6df3r,False,0.0,Don't Stop Believin',2022-10-17T13:50:03Z,detroitlions,0.1388
32975,191705,191705,TBoneTheOriginal,I’ll be at that game too! Flying up from South Carolina to be there with my best friend who is a Packers fan.,4.0,detroitlions,t3_y6bg02,False,0.0,Don't Stop Believin',2022-10-17T10:40:45Z,detroitlions,0.4329
32976,191709,191709,TBoneTheOriginal,"I mean I agree… but this comparison is stupid, man. It assumes everything other than the coach is the same. It’s not even close.",5.0,detroitlions,t3_y5rkho,False,0.0,Don't Stop Believin',2022-10-16T17:06:36Z,detroitlions,-0.0252148148148148
32977,191710,191710,TBoneTheOriginal,This apples and oranges bullshit is getting pretty old.,1.0,detroitlions,t3_y5rkho,False,1.0,Don't Stop Believin',2022-10-16T17:03:37Z,detroitlions,-0.1531
32978,191712,191712,TBoneTheOriginal,I have no many filters on Apollo I’m surprised there’s anything left of Reddit to show me.,3.0,detroitlions,t3_y5h6cs,False,0.0,Don't Stop Believin',2022-10-16T13:46:21Z,detroitlions,-0.0772
34062,200153,200153,TheHalf,"I'm starting to lose faith in Najee, took him 1st. But at least I have Barkley",2.0,nfl,t3_y5qd0c,False,0.0,:Lions: Lions :Bills: Bills,2022-10-16T21:17:05Z,detroitlions,0.00645
35403,211824,211824,Try2Relate2AllSides,Lol nothing particularly dangerous about Chicago.,-4.0,detroitlions,t3_y8hcpk,False,0.0,Welcome to Detroit!,2022-10-19T22:33:23Z,detroitlions,0.6778
35404,211825,211825,Try2Relate2AllSides,"Did you just guess 40% or see it somewhere?

I swear they rarely have 3LBS out there",-1.0,detroitlions,t3_y8ihbc,False,0.0,Welcome to Detroit!,2022-10-19T22:31:50Z,detroitlions,-0.0258
35405,211826,211826,Try2Relate2AllSides,"Did you just guess 40% or see it somewhere?

I swear they rarely have 3LBS out there",2.0,detroitlions,t3_y8ihbc,False,0.0,Welcome to Detroit!,2022-10-19T22:31:42Z,detroitlions,-0.0258
35406,211827,211827,Try2Relate2AllSides,"This might go down as the dumbest comment I’ve ever read on Reddit.

You’re like the guy old man saying cars won’t ever be a thing, because reasons",-4.0,detroitlions,t3_y87e8h,False,0.0,Welcome to Detroit!,2022-10-19T16:08:45Z,detroitlions,0.05295
35407,211833,211833,Try2Relate2AllSides,Funny that it’s the official Seahawks YT,2.0,detroitlions,t3_y7qluw,False,0.0,Welcome to Detroit!,2022-10-18T23:46:23Z,detroitlions,0.4404
35408,211838,211838,Try2Relate2AllSides,I agree. I’d like to never pick in the second round again,16.0,detroitlions,t3_y7k8y8,False,0.0,Welcome to Detroit!,2022-10-18T18:14:57Z,detroitlions,0.2709
35409,211839,211839,Try2Relate2AllSides,Valenti is such a douche.,2.0,detroitlions,t3_y7lds5,False,1.0,Welcome to Detroit!,2022-10-18T18:14:17Z,detroitlions,-0.3612
35410,211841,211841,Try2Relate2AllSides,"ACL injuries are an absolute nothing. The ligament comes back stronger than ever.

How can you possibly be concerned at all about an ACL injury?",0.0,detroitlions,t3_y6h7td,False,0.0,Welcome to Detroit!,2022-10-18T13:40:11Z,detroitlions,-0.0980777777777777
35411,211842,211842,Try2Relate2AllSides,"Jerry probably doesn’t give a fuck about the PR disaster coming his way, does he?",2.0,nfl,t3_y7dies,False,0.0,:Lions: Lions,2022-10-18T12:40:21Z,detroitlions,-0.8225
35412,211844,211844,Try2Relate2AllSides,ACL injury means nothing nowadays. Absolutely nothing.,0.0,detroitlions,t3_y6h7td,False,0.0,Welcome to Detroit!,2022-10-18T08:12:56Z,detroitlions,-0.105375
35413,211845,211845,Try2Relate2AllSides,Tbf the DTs aren’t helping the LBs.,30.0,detroitlions,t3_y74ic6,False,0.0,Welcome to Detroit!,2022-10-18T07:48:06Z,detroitlions,0.296
35414,211847,211847,Try2Relate2AllSides,"Please help an old man out.

This is a joke or it’s really another instagram confirmed to be Jamos? How do we know it’s really his?",0.0,detroitlions,t3_y5tbxg,False,0.0,Welcome to Detroit!,2022-10-17T18:34:28Z,detroitlions,0.0555703703703703
35415,211852,211852,Try2Relate2AllSides,"We don’t have enough to cover his salary. Kind sucks, obv we could make it happen tho.",0.0,detroitlions,t3_y6avi5,False,1.0,Welcome to Detroit!,2022-10-17T09:33:43Z,detroitlions,0.11315
35416,211855,211855,Try2Relate2AllSides,"If anybody needs help interpreting this, I got you.

The coin accurately predicts losses. How it get ever other W correct.

So we lose against the cowboys, and beat the Dolphins.",6.0,detroitlions,t3_y5xber,False,0.0,Welcome to Detroit!,2022-10-17T07:07:04Z,detroitlions,-0.118434765625
35417,211856,211856,Try2Relate2AllSides,"Your type of optimism is my favorite type of optimIsm. Just hype, not toxically positive.",6.0,detroitlions,t3_y5ykbc,False,0.0,Welcome to Detroit!,2022-10-17T07:05:01Z,detroitlions,-0.0037
35418,211859,211859,Try2Relate2AllSides,"Lol, I really hope the Spartans improve. You guys are toxic.

How am I thin skinned? Because I’m sick of listening to Spartan rage? I really do hope we stop drafting Wolverines because the Spartan fans screeching is annoying. It doesn’t matter if Moody made kicks or not, we’d all have to put up toxic Sparties regardless. 

Hopefully your team does better next year, I always root for MSU, I just wish they didn’t vent all their anger here.",0.0,detroitlions,t3_y4xqz2,False,0.0,Welcome to Detroit!,2022-10-16T14:19:29Z,detroitlions,0.0718299610342143
35419,211860,211860,Try2Relate2AllSides,lol,1.0,detroitlions,t3_y5h6cs,False,0.0,Welcome to Detroit!,2022-10-16T08:46:47Z,detroitlions,0.4215
35420,211865,211865,Try2Relate2AllSides,"Just delete this. It’s gross sharing vids of kids doing embarrassing things.

FTP",2.0,detroitlions,t3_y50os7,False,0.0,Welcome to Detroit!,2022-10-15T18:25:22Z,detroitlions,-0.0489333333333333
35421,211867,211867,Try2Relate2AllSides,"Oh god please no more Wolverines.

Two of the most toxic people in this sub are Spartans and apparently save all their decency for their beloved Spartans, because they aren’t toxic in their sub.

I’m so sick of Spartans venting their frustrations here just because both their favorite teams suck.",3.0,detroitlions,t3_y4xqz2,False,1.0,Welcome to Detroit!,2022-10-15T16:57:41Z,detroitlions,-0.1572925925925925
35422,211874,211874,Try2Relate2AllSides,"Joke as old as time itself.

MCDC- This is unacceptable, it comes down to me. I’m going to take a deep look at everything",4.0,detroitlions,t3_y4sd54,False,0.0,Welcome to Detroit!,2022-10-15T13:17:21Z,detroitlions,-0.0400148148148148
35423,211878,211878,Try2Relate2AllSides,"I’m concerned his word is starting to mean less. That’s a scary slope. He just said this is rock bottom, another poor performance next week will be closer to rock bottom Dan.

I loved how he was accountable, but those words mean nothing if nothing gets fixed.",8.0,detroitlions,t3_y4gt5v,False,0.0,Welcome to Detroit!,2022-10-15T08:29:52Z,detroitlions,0.0501390625
35424,211879,211879,Try2Relate2AllSides,"Honestly man, Anzalone isn’t the problem. The interior routinely puts him in very difficult situations. Also, he isn’t good.

BUT

Harris and Buggs are playing way too many snaps for their quality. They are playing fine for backups, but everything starts with our front 4 and those two poor play + 1 safety poor play + 1 CB poor play = our huge struggles. If those positions were playing good our defense would be respectable",4.0,detroitlions,t3_y4gt5v,False,0.0,Welcome to Detroit!,2022-10-15T08:28:10Z,detroitlions,0.1347494813100137
35425,211889,211889,Try2Relate2AllSides,"Last year would have cost him 4.5mil total, at same fine for every first down they had",1.0,nfl,t3_y3ygoo,False,0.0,:Lions: Lions,2022-10-14T13:38:15Z,detroitlions,0.2648
35426,211890,211890,Try2Relate2AllSides,The logo being different than the one on Apple Podcasts confused the fuck out of me,5.0,detroitlions,t3_y3zynz,False,0.0,Welcome to Detroit!,2022-10-14T12:36:52Z,detroitlions,-0.7003
35939,216429,216429,WentWin,"As a Philly resident, this is nice. But now I get to watch them lose on TV instead of my twitter feed",2.0,detroitlions,t3_y84uq6,False,0.0,CornDoggyLOL,2022-10-19T12:43:55Z,detroitlions,-0.169575
35940,216432,216432,WentWin,"Went in on the Broncos in Fantasy Football. Drafted Russ and Courtland Sutton. 

I'm close to ending it all. Good news is I've got Saquan, Dalvin Cook, Dameon Pierce, and Travis Ettiene. Gonna dangle all of them and Russ to trade",3.0,detroitlions,t3_y74g37,False,0.0,CornDoggyLOL,2022-10-18T12:33:14Z,detroitlions,0.017616
36663,218435,218435,Wiggymaster,"The bad news is, that competent QB, whoever he may be, is unlikely to end up being a Lion.",2.0,detroitlions,t3_y87ewc,False,0.0,90s logo,2022-10-19T13:26:15Z,detroitlions,-0.296
36904,220463,220463,Wizardofsmiles,I guy in Denver would wear a Kitna jersey to the copper mug and I'd always get a chuckle at that.,1.0,detroitlions,t3_y5lciz,False,0.0,90s logo,2022-10-16T23:13:42Z,detroitlions,0.4019
38593,231937,231937,benhadtue,All these posts about the long term rebuild miss the point that MCDC is making boneheaded mistakes.  Consistently.  In no one’s long term rebuild roadmap does “boneheaded coaching mistakes that cost the team wins” exist as a positive.,16.0,detroitlions,t3_y6df02,False,0.0,Sun God,2022-10-17T11:20:29Z,detroitlions,-0.0262555555555555
38594,231939,231939,benhadtue,"Really not sure how tight the locker room is honestly.  Players did love him, but if he is making stupid decisions that cost games, that love unravels quickly.",3.0,detroitlions,t3_y47hp1,False,0.0,Sun God,2022-10-15T08:31:15Z,detroitlions,0.341075
38595,231940,231940,benhadtue,Five wins and a handful of grit?,0.0,detroitlions,t3_y47hp1,False,0.0,Sun God,2022-10-15T08:29:03Z,detroitlions,0.5719
38596,231941,231941,benhadtue,"Yeah, under 4 wins is a gots-to-go situation.  Giving another half year/year does not benefit the team.  But even if it is 6 wins but DC specific fuckups continue to contribute to losses or make games harder than they need to be I can see him gone too.

Basically, extremely thin ice and a hot seat.  Not good Bob.",2.0,detroitlions,t3_y47hp1,False,0.0,Sun God,2022-10-15T08:27:50Z,detroitlions,-0.065156448
38597,231942,231942,benhadtue,This.  If the FG was good a TD still would beat you.  FG was  the worst option.  Punting and pinning them probably the best option.  But holding on to the ball and bleeding the clock was the surest way to win.  MCDC chose the least good option.,1.0,detroitlions,t3_y3yb8v,False,0.0,Sun God,2022-10-14T17:41:44Z,detroitlions,-0.0308380401234567
38873,234917,234917,blue_shadow_,"I did watch it, unfortunately. I'm away from my laptop with my dataset. IIRC though, it was the ""recent games"" performance that put the Vikes over the Chiefs. 3-1 with their only loss to the lone undefeated team against 2-2 with a loss to the Colts mixed in. Honestly, I kinda wish I could put both teams at #3.5 and call it a day, but that's no bueno.",1.0,nfl,t3_y7fp07,False,0.0,:Lions: Lions :Lions: Lions,2022-10-18T16:53:36Z,detroitlions,-0.0327208
38874,234921,234921,blue_shadow_,"It's easier to say which season the team *wasn't* one (in the SB era).

1991.

That's it.",1.0,nfl,t3_y6fznw,False,0.0,:Lions: Lions :Lions: Lions,2022-10-17T12:34:20Z,detroitlions,0.0156111111111111
38875,234923,234923,blue_shadow_,"Dude, you're relitigating a nearly 3 week old power ranking that's locked in and, ultimately, doesn't matter one bit beyond what people think is going on right then, with only 1 of the 32 rankers.

What, exactly, are you hoping to accomplish?",6.0,nfl,t3_y4oz4h,False,0.0,:Lions: Lions :Lions: Lions,2022-10-15T16:46:16Z,detroitlions,0.335625
38876,234924,234924,blue_shadow_,"It's /r/NFL's composite ranking from 32 people. The Dolphins/ Bills game was, by consensus, considered not to be a fair test of who was truly better at the time - godawful heat and humidity played a huge role in that game.

You can disagree all you want, and if and when your particular fanbase's spot opens up, feel free to apply to join to be one of us.",15.0,nfl,t3_y4oz4h,False,0.0,:Lions: Lions :Lions: Lions,2022-10-15T15:22:30Z,detroitlions,0.2641555555555555
