,Unnamed: 0.1,Unnamed: 0,author,body,score,subreddit,link_id,over_18,controversiality,author_flair_text,created_utc,flair,sentiment
860,4660,4660,4runninglife,"Or, or you can have one for many years and don't win shit.",8.0,nfl,t3_y6wwd5,False,0.0,:Lions: Lions,2022-10-18T04:58:17Z,detroitlions,-0.0382
861,4665,4665,4runninglife,"im going to be that guy..Im sure a few of these women were victims of unwarrented sexual advances, but lets be honest some of these were groupies that saw an NFL QB come into their shop and gave him head, and now they have a story to tell, he's just pulling them all out the woodwork now. Im just thinking from a numbers perspective, me as a regular guy went to as many massage parlors has Watson, lets say atleast 2 out 10 parlors, I can probably get some head.",-1.0,nfl,t3_y4tuu0,False,1.0,:Lions: Lions,2022-10-15T22:43:44Z,detroitlions,0.1663
1076,7047,7047,ADuckUnreal,Bro you need to ease off the drugs.  We’ll be lucky to win 3 more games.,1.0,nfl,t3_y61eoh,False,0.0,:Lions: Lions,2022-10-17T06:19:03Z,detroitlions,0.4728
1077,7049,7049,ADuckUnreal,"I love Campbell as a person, motivator, and leader.  

His game management, coupled with his willingness to make the same mistakes over and over are red flags.  Add in him throwing Goff under the bus after the Seahawks game, and the fact that other teams with similar situations are showing more promise.  I am starting to doubt that he is the right man for the job.

I want to give him some time to right the ship, and I ***want*** him to be the guy.  I’m just not sure he can be, and his leash has gotten significantly shorter after the start to this season.",34.0,detroitlions,t3_y4gt5v,False,0.0,Welcome to Detroit!,2022-10-15T06:34:43Z,detroitlions,-0.0373088155864197
1078,7050,7050,ADuckUnreal,I love when people attempt to gatekeep fandom.,29.0,detroitlions,t3_y3urs0,False,0.0,Welcome to Detroit!,2022-10-14T10:17:11Z,detroitlions,0.6369
1737,8452,8452,Acid_Braindrops,This is worse than usual lol,4.0,nfl,t3_y5l3xc,False,0.0,:Lions: Lions,2022-10-16T13:13:12Z,detroitlions,-0.0772
2630,13356,13356,Apollo_Krill,Hes Cyclops when he loses his visor.,629.0,nfl,t3_y8aoau,False,0.0,:Lions: Lions,2022-10-19T14:14:10Z,detroitlions,-0.3182
2631,13365,13365,Apollo_Krill,"Tracy Walker (Starting Safety)- Out for season
Levi Onwuzurike (2021 2nd rounder) - Out for season
Joshua Paschal (2022 2nd rounder) - Out for first 5 weeks and counting
Jerry Jacobs - (3rd CB) - ACL out first 5 weeks and counting
John Cominsky - Out since week 3
Romeo Okwara - Out till estimated week 9

Also recently hurt Charles Harris, Melifonwu, Will Harris.

Take a historically bad defense + those injuries + players like Amani Oruwariye just falling apart and you get a new historically bad defense.  Aaron Glenn isnt all to blame but he's not adjusting to the players he has. Way too many blitzes, no pressure from the defensive tackles, & the most banged up and horrible secondary in the league. Our defense is a complete joke right now.",12.0,nfl,t3_y6fve0,False,0.0,:Lions: Lions,2022-10-17T16:19:49Z,detroitlions,0.065843968
2632,13366,13366,Apollo_Krill,Spicy Chicken sandwich ftw,1.0,nfl,t3_y5vohw,False,0.0,:Lions: Lions,2022-10-16T20:53:54Z,detroitlions,0.4588
2634,13368,13368,Apollo_Krill,Damn Matt Ryan coming alive.,3.0,nfl,t3_y5kdtc,False,0.0,:Lions: Lions,2022-10-16T14:09:15Z,detroitlions,-0.0258
2993,14495,14495,Arjak987,So help me if they overturn this,7.0,nfl,t3_y5kdtc,False,0.0,:Lions: Lions,2022-10-16T18:32:34Z,detroitlions,0.4576
2994,14496,14496,Arjak987,Mahomes is gonna win this with like 10 seconds left isn’t he,2.0,nfl,t3_y5kdtc,False,0.0,:Lions: Lions,2022-10-16T18:26:52Z,detroitlions,0.743
3211,15803,15803,Arro,"Basically the only thing I play CoD for, personally.",1.0,nfl,t3_y5l3z0,False,0.0,:Lions: Lions,2022-10-16T14:24:30Z,detroitlions,0.34
3212,15805,15805,Arro,"Top should read: ""Hutch: 3 sacks in one half""

Bottom should read: ""That's all he had in 5 games, and the half was against Wentz""

Something like that.

Idk why this bothers me so much but it does.",18.0,detroitlions,t3_y3uah6,False,0.0,Logo,2022-10-14T15:27:50Z,detroitlions,0.0511
3213,15807,15807,Arro,"this meme makes no sense, sorry",1.0,detroitlions,t3_y3uah6,False,0.0,Logo,2022-10-14T12:03:48Z,detroitlions,-0.2448
3214,15808,15808,Arro,"Definitely should’ve done that.  I didn’t want to wait a week or 2 for that, so I just did it myself.  But it was not worth it.",2.0,nfl,t3_y3ur2x,False,0.0,:Lions: Lions,2022-10-14T10:57:59Z,detroitlions,-0.0598037037037037
3215,15809,15809,Arro,"Bought a washer and dryer this week, got them home, got them inside, installed them, and they are finally working.  Every single step I just listed was arduous as hell with multiple complications.

Thank fucking god I'm done.",16.0,nfl,t3_y3ur2x,False,0.0,:Lions: Lions,2022-10-14T10:42:37Z,detroitlions,0.1238222222222222
5713,31273,31273,BrantMKF,"mike williams wouldve been an awful signing here, he gets no seperation at all. i like mike williams but not with goff",10.0,detroitlions,t3_y6vpef,False,0.0,DETROIT -VS- EVERYBODY,2022-10-18T07:29:28Z,detroitlions,-0.064175
5714,31274,31274,BrantMKF,i hate to say it but this has always been oruwariye. almost all of his picks last year were lucky picks and he often got burnt last year too,7.0,detroitlions,t3_y5rkho,False,0.0,DETROIT -VS- EVERYBODY,2022-10-16T23:08:16Z,detroitlions,0.128475
5715,31275,31275,BrantMKF,no i think they are very bad. i read your comment as you saying its bad but then putting /s,-1.0,detroitlions,t3_y5mn0g,False,0.0,DETROIT -VS- EVERYBODY,2022-10-16T13:44:55Z,detroitlions,-0.3329999999999999
5716,31276,31276,BrantMKF,blaming the superbowl loss on mcvay is crazy,1.0,detroitlions,t3_y57ek1,False,0.0,DETROIT -VS- EVERYBODY,2022-10-16T13:44:21Z,detroitlions,-0.7845
5717,31277,31277,BrantMKF,"kyler too, hasnt won a playoff game buts he undoubtedly elite and is currently carrying his team",-1.0,detroitlions,t3_y57ek1,False,0.0,DETROIT -VS- EVERYBODY,2022-10-16T13:42:32Z,detroitlions,-0.4585
5718,31278,31278,BrantMKF,if bryce drops to us not picking him would be crazy,1.0,detroitlions,t3_y57ek1,False,0.0,DETROIT -VS- EVERYBODY,2022-10-16T13:34:21Z,detroitlions,-0.34
5719,31279,31279,BrantMKF,"why the /s, this is true",-2.0,detroitlions,t3_y5mn0g,False,0.0,DETROIT -VS- EVERYBODY,2022-10-16T13:33:53Z,detroitlions,0.4215
5720,31280,31280,BrantMKF,this is what has perplexed me the most. golladay was still great with david blough as his QB for most of the 2019 season,6.0,nfl,t3_y425ki,False,0.0,:Lions: Lions,2022-10-14T20:31:33Z,detroitlions,0.2329
6213,36242,36242,Charles_Bass,Ironic as the game ended on a fumble.,35.0,nfl,t3_y8am3i,False,0.0,:Lions: Lions,2022-10-19T14:44:32Z,detroitlions,-0.128
6214,36253,36253,Charles_Bass,That’s the rule within 2 minutes. I guess unfair advantage if you don’t burn the TO. Look at how much rest that defense just got.,1.0,nfl,t3_y6qmrj,False,0.0,:Lions: Lions,2022-10-17T22:08:35Z,detroitlions,0.0123111111111111
6509,38270,38270,ChefCurrySauce,"Believe what? Rebuilds do not take 3-4-5 years in the NFL no matter how much this sub tries to say that they do.

There are some reasons to be hopeful and optimistic but I think that there are many more reasons to be frustrated.

I think toxic positivity is much worse than the negativity. At least the negativity is historically-backed lmao",-14.0,detroitlions,t3_y87e8h,False,1.0,Spiciest Memelord,2022-10-19T11:48:23Z,detroitlions,0.00814944
6510,38271,38271,ChefCurrySauce,Funny how ownership is frustrated yet there are 5 posts a day here talking about how if you’re upset in any way shape or form then you just don’t understand rebuilding,-25.0,detroitlions,t3_y87e8h,False,1.0,Spiciest Memelord,2022-10-19T11:40:51Z,detroitlions,-0.4767
6511,38272,38272,ChefCurrySauce,"This is a good write up, but I have serious trouble believing that this regime is willing to hitch their wagon to Goff long term.

If we’re picking in the top 3, we’re grabbing Young or Stroud. I wouldn’t be surprised if every other pick after that is defense with maybe a kicker thrown in (would love moody)",27.0,detroitlions,t3_y832c2,False,0.0,Spiciest Memelord,2022-10-19T08:46:58Z,detroitlions,0.2134518518518518
6512,38273,38273,ChefCurrySauce,"I literally could care less about what teams we play every year and I’m stunned that people consistently make a big deal about it 

The teams we’ll end up playing will never 100% align with how good or bad we thought they’d be before the season",56.0,detroitlions,t3_y7a4jr,False,0.0,Spiciest Memelord,2022-10-18T10:34:49Z,detroitlions,0.6597
6513,38274,38274,ChefCurrySauce,"Yep, the last big excuse that I recall was that anyone questioning Patricia was soft",12.0,detroitlions,t3_y6jjny,False,0.0,Spiciest Memelord,2022-10-17T14:21:24Z,detroitlions,0.2732
6514,38275,38275,ChefCurrySauce,"Seeing Saleh and Daboll’s success has sparked excuses the likes of which I’ve never seen. I didn’t think even r/detroitlions was capable of the mental gymnastics it took to excuse our coaching, but I shouldn’t be surprised that it is.

Some of the top comments on posts about this topic over the past day or so have been hilarious to me. I saw an unorinic “Daboll inherited a much better situation”.",30.0,detroitlions,t3_y6jjny,False,0.0,Spiciest Memelord,2022-10-17T14:06:48Z,detroitlions,0.157344921875
6515,38276,38276,ChefCurrySauce,Very good use of a high second round pick if you ask me,68.0,detroitlions,t3_y6jhrl,False,0.0,Spiciest Memelord,2022-10-17T14:02:59Z,detroitlions,0.4927
6516,38277,38277,ChefCurrySauce,"I have never ever ever ever ever seen someone double down so many times after being straight up wrong 

Go read some of the other comments here, multiple people confirming this is his finsta including a guy who looked it up and admitted he was wrong",8.0,detroitlions,t3_y5tbxg,False,0.0,Spiciest Memelord,2022-10-17T09:32:50Z,detroitlions,-0.5994
6517,38278,38278,ChefCurrySauce,"That’s his main account, people have alternate instagrams called “finstas”. What I linked is jamo’s finsta, as multiple commenters here have pointed out

$1000 please",6.0,detroitlions,t3_y5tbxg,False,0.0,Spiciest Memelord,2022-10-17T09:28:12Z,detroitlions,0.1591
6518,38279,38279,ChefCurrySauce,"On what planet are you doubling down after being wrong lmao. Bigsgjamo is his main account and this account I just linked is his finsta

Here you go bud: https://instagram.com/waymodanu?igshid=MDE2OWE1N2Q=",4.0,detroitlions,t3_y5tbxg,False,0.0,Spiciest Memelord,2022-10-17T09:26:08Z,detroitlions,0.050575
6519,38280,38280,ChefCurrySauce,"Buddy, 55benfrank is jamo’s finsta. 

Where do u think that video of him cutting came from? He posted it himself from there.",2.0,detroitlions,t3_y5tbxg,False,0.0,Spiciest Memelord,2022-10-17T09:23:45Z,detroitlions,-0.0142222222222222
6520,38283,38283,ChefCurrySauce,"It’s his finsta

Blatantly lying?",3.0,detroitlions,t3_y5tbxg,False,1.0,Spiciest Memelord,2022-10-16T19:27:12Z,detroitlions,-0.5267
6521,38284,38284,ChefCurrySauce,lmao it’s his finsta dude,4.0,detroitlions,t3_y5tbxg,False,0.0,Spiciest Memelord,2022-10-16T19:27:00Z,detroitlions,0.5994
7953,44534,44534,CoRe23,It's been five games... a few rookies haven't played any!,2.0,detroitlions,t3_y7lds5,False,1.0,Peni Swell,2022-10-18T18:16:51Z,detroitlions,-0.3244
8163,45873,45873,Codegreenman,"Bye Week undefeated , -10000 on FanDuel ML 😮‍💨 chalk up another loss for the Quinntricia era defense 😔",-1.0,detroitlions,t3_y5jgs4,False,0.0,Sun God,2022-10-16T10:44:39Z,detroitlions,-0.128
10185,61624,61624,DetLoins,"Flair bet, Chargers let the best asset in the league call his own number and play hurt.",6.0,nfl,t3_y425ki,False,0.0,:Lions: Lions,2022-10-14T18:01:37Z,detroitlions,0.7184
10186,61625,61625,DetLoins,"Darrell Bevell was cooking up a storm with his playcalling that year, only thing that gave me any hope during those miserable 3 years",6.0,nfl,t3_y425ki,False,0.0,:Lions: Lions,2022-10-14T17:54:57Z,detroitlions,-0.0772
13099,67940,67940,DisownedWaffle1,Your flair hurts me,16.0,nfl,t3_y5l3xc,False,0.0,:Lions: Lions,2022-10-16T16:24:28Z,detroitlions,-0.4767
14158,75527,75527,Ephan,"Everyone else is playing the game wrong, not us. Pay no attention to our record.",2.0,nfl,t3_y838zj,False,0.0,:Lions: Lions,2022-10-19T11:33:47Z,detroitlions,-0.2704499999999999
14529,76175,76175,Evanredditz,"I’m 0-1

Eagles L 2022",1.0,detroitlions,t3_y6df3r,False,0.0,Welcome to Detroit!,2022-10-17T21:44:38Z,detroitlions,0.5766
14530,76176,76176,Evanredditz,"Yeah, I don’t even know if I’d want a first rounder. I just want him.",6.0,detroitlions,t3_y5xw4w,False,0.0,Welcome to Detroit!,2022-10-16T21:39:49Z,detroitlions,0.1289
14531,76177,76177,Evanredditz,"Definitely a bad trade, but at least we got some decent-ish guys. Obviously not the same value at all, though",7.0,detroitlions,t3_y5xw4w,False,0.0,Welcome to Detroit!,2022-10-16T21:34:48Z,detroitlions,-0.154875
14532,76178,76178,Evanredditz,"Yes, let’s sign a player who is on the team we crushed offensively earlier this year. Not to mention inactive despite being healthy. Makes perfect sense!",1.0,detroitlions,t3_y44z5l,False,0.0,Welcome to Detroit!,2022-10-15T12:49:32Z,detroitlions,0.1472777777777778
15182,78122,78122,Fangletron,"Coach Meathead turned the ball over 6 times.  How we gonna win that game?


Edit- a word",-7.0,detroitlions,t3_y4o42s,False,0.0,FTW Lions,2022-10-15T09:49:54Z,detroitlions,0.0651
15183,78124,78124,Fangletron,I’m ok with just forcing them to punt a few times a game.,3.0,detroitlions,t3_y30d8r,False,0.0,FTW Lions,2022-10-14T06:48:59Z,detroitlions,0.296
15184,78125,78125,Fangletron,Reynolds is superior to Do Nothing Chark,1.0,detroitlions,t3_xw2hdp,False,0.0,FTW Lions,2022-10-14T02:58:50Z,detroitlions,0.5423
15185,78126,78126,Fangletron,"Coach meathead turned the ball over 6 times last week, just like Ty Detmer.  how many times will Coach Meathead turn the ball over next week?",-13.0,detroitlions,t3_y3hzga,False,0.0,FTW Lions,2022-10-14T01:14:56Z,detroitlions,0.156225
16201,84040,84040,FloridaJit999,Absolutely agree why y’all mfs need to know I wear a Large,2.0,detroitlions,t3_y56t2o,False,0.0,Sun God,2022-10-16T16:09:12Z,detroitlions,0.4201
16746,87793,87793,Fricktator,"I would have been far happier losing to the Patriots 42-35 and would come out of the loss feeling happy, than leaving the game questioning whether we had the right leadership in place.",8.0,detroitlions,t3_y84uq6,False,0.0,MC⚡DC,2022-10-19T14:03:50Z,detroitlions,0.5106
16747,87794,87794,Fricktator,"If we lose every game the rest of the season where we put up 35+, but our defense allows 40+, I'd be much happier going into next season, than if we win 4 or 5 more, but both our offense and defense are up and down. Then we know, fix our defense and we are a legit team.",25.0,detroitlions,t3_y84uq6,False,0.0,MC⚡DC,2022-10-19T12:34:38Z,detroitlions,0.282375
16748,87800,87800,Fricktator,7bwins with a top 10 scoring offense means your defense is atrocious,1.0,detroitlions,t3_y5rkho,False,0.0,MC⚡DC,2022-10-17T18:10:32Z,detroitlions,0.0772
16749,87801,87801,Fricktator,"I really wish the offense had done something against the Patriots, to force Belichick to score more. It's hard to fire your DC when his defense allowed the least it's allowed all season. Maybe if Dak and Zeke light us up after the bye he will fire Glenn, or consider the season a wash and fire him after.",10.0,nfl,t3_y6fve0,False,0.0,:Lions: Lions,2022-10-17T14:39:27Z,detroitlions,-0.2238
16750,87802,87802,Fricktator,Ahh ok,1.0,detroitlions,t3_y5rkho,False,0.0,MC⚡DC,2022-10-16T18:57:50Z,detroitlions,0.296
16751,87804,87804,Fricktator,"Looking at the rest of our schedule, I see at best 4 wins (Bears 2x, Jaguars, and Panthers). I don't see us winning anything other than those. 

If that's all we win, how does Holmes keep Campbell? I understand we dont have heaps of talent, but how do you see a guy who's record with your team being 8-25-1 as the guy to lead you to success. Especially when he isn't an X's and O's guy, but a motivator and leader. I can't imagine players are going to be motivated in year three after winning 3 games in year one and 5 in year 2. His words will fall on deaf ears and guys with contracts ending will want out.",11.0,detroitlions,t3_y5ripb,False,0.0,MC⚡DC,2022-10-16T16:39:29Z,detroitlions,0.0267073016223803
16752,87805,87805,Fricktator,"My thought is, if we don't win 7 games in year 2, Aaron Glenn should be fired. Not winning 7 games means we had the worst defense in the league for the 2nd year in a row. That's a coaching problem.

If Dan is too loyal to Glenn and doesn't cut him loose, then Dan needs to go. 

If Brad Holmes won't cut Campbell, he can go to.",42.0,detroitlions,t3_y5rkho,False,0.0,MC⚡DC,2022-10-16T16:32:54Z,detroitlions,0.064776352
17392,91387,91387,GODDAMN_FARM_SHAMAN,"I heard Glover Quin on a podcast recently and I thought he put it pretty well. Caldwell was a good coach but fell short of expectations a lot so we brought in Patricia and his main job was to get us that extra win. To bring us from a 9 win team to a 10+ win team. Instead he came in with his massive ego and said ""No, this is all wrong. The Lions are losers and the only way to get better is to rip everything to the studs and rebuild the culture 'the patriot way'"". He then went through and got rid of everyone who said ""Hey maybe we can just build on what we have"" (Slay and Diggs) because he's the boss and what he says goes. Then he dug through the Patriots trash pile to fill in the blanks. Drafted ""under the radar"" players who were actually just busts. Then, when it all was obviously blowing up in his face he said ""Well it was always a full rebuild what did you expect in 3 years?"" and left us with a defense with a ton of dead money and no talent.",18.0,detroitlions,t3_y87e8h,False,0.0,Ooooh Yeahhhh!,2022-10-19T14:36:20Z,detroitlions,-0.07022816658094
17393,91389,91389,GODDAMN_FARM_SHAMAN,Literally ONE of their defensive starters (Sauce) is a first/second year player.,15.0,detroitlions,t3_y5rkho,False,0.0,Ooooh Yeahhhh!,2022-10-16T19:58:47Z,detroitlions,0.0258
17394,91391,91391,GODDAMN_FARM_SHAMAN,"""Couldn't stop him"" is bs. The defense gave up 1 touchdown. The bigger issue by far is that the offense couldn't finish a single drive. If we score more it puts more pressure on their QB to make bigger plays. Instead we had zero points all day and the patriots called the most conservative offense possible with short high percentage plays and took field goals.",5.0,detroitlions,t3_y4o42s,False,0.0,Ooooh Yeahhhh!,2022-10-15T11:33:58Z,detroitlions,-0.0211156799999999
17395,91392,91392,GODDAMN_FARM_SHAMAN,Slay also dropped an easy pick in the red zone in the Eagles game,1.0,detroitlions,t3_y331rl,False,0.0,Ooooh Yeahhhh!,2022-10-14T15:24:40Z,detroitlions,0.4404
18276,100475,100475,Ilovelamp024,Our sub tends to panic and freak for no reason. It’s frustrating. Especially the negative ones are the ones that are more vocal,46.0,detroitlions,t3_y7pvqb,False,0.0,Onzuwhatevethefuck,2022-10-18T22:26:47Z,detroitlions,-0.2822296296296296
18277,100476,100476,Ilovelamp024,I get embarrassed a lot of times on how this sub is represented…. It’s definitely not everyone but some of the over reactions on here is cringe worthy,2.0,detroitlions,t3_y7g6p1,False,0.0,Onzuwhatevethefuck,2022-10-18T19:14:25Z,detroitlions,0.2551
18278,100477,100477,Ilovelamp024,The cry babies on here are always more vocal,7.0,detroitlions,t3_y5rhbk,False,0.0,Onzuwhatevethefuck,2022-10-16T21:02:58Z,detroitlions,-0.4767
18279,100479,100479,Ilovelamp024,The refs fucked us again,5.0,detroitlions,t3_y4sd54,False,0.0,Onzuwhatevethefuck,2022-10-15T19:42:47Z,detroitlions,-0.6597
18280,100481,100481,Ilovelamp024,"Honest question, do LBs ever go in the top 5 range? Feel like it’s mostly de or corner in top spots in draft. I could be wrong but feel it’s because of positional scarcity. Lbs are always easier to come by than a de or corner",2.0,detroitlions,t3_y3yd5v,False,0.0,Onzuwhatevethefuck,2022-10-14T20:11:53Z,detroitlions,0.099437890625
18281,100482,100482,Ilovelamp024,Still want to see Kirby Joseph improve…. He hasn’t been great but I feel he’s been getting incrementally better …. If he panned out to be a starter that be HUGE,4.0,detroitlions,t3_y42cm2,False,0.0,Onzuwhatevethefuck,2022-10-14T17:56:02Z,detroitlions,0.2411925925925926
19410,103051,103051,JaHoog,Ok guy,1.0,nfl,t3_y8aoau,False,0.0,:Lions: Lions,2022-10-19T17:54:27Z,detroitlions,0.296
19412,103061,103061,JaHoog,Terrible take,6.0,nfl,t3_y6mrb6,False,0.0,:Lions: Lions,2022-10-17T20:29:19Z,detroitlions,-0.4767
19413,103062,103062,JaHoog,Seems fair? Why would they be in crisis mode at 3-3 lol,3.0,nfl,t3_y6mrb6,False,1.0,:Lions: Lions,2022-10-17T20:27:35Z,detroitlions,-0.07955
20760,105495,105495,Jew_3,Just like Run CMC.,2.0,detroitlions,t3_y88w7n,False,0.0,Rodrigo!,2022-10-19T22:22:22Z,detroitlions,0.3612
20761,105496,105496,Jew_3,Fire all the coaches. Fire Brad. Fire Rod. Fire Shelia. Exhume and fire WCF2. Fire Godell. Fire Duggan. Fire Whitmer. Fire McConnell. Fire Biden. Fire Truss. Fire Charles III. BURN IT DOWN. Everything is ruined. This season is over. The offense sucks. Fire Goff. Fire Swift. Fire Hock. Burn it to the ground.,1.0,detroitlions,t3_y88w7n,False,0.0,Rodrigo!,2022-10-19T22:21:37Z,detroitlions,-0.0008714323418708
20762,105498,105498,Jew_3,"Damned if you do, damned if you don’t.",0.0,detroitlions,t3_y6df02,False,0.0,Rodrigo!,2022-10-17T22:47:34Z,detroitlions,-0.6369
20763,105499,105499,Jew_3,"You lose 5 on an off tackle run when the running back does hero’s work not fumbling a bad exchange (I never saw a good enough angle to know if it was the QB or RB who caused it). We honestly should have lost possession instead of the 5 yards, because it was only secured with an elbow and rib for a second there.",1.0,detroitlions,t3_y6df02,False,0.0,Rodrigo!,2022-10-17T22:46:01Z,detroitlions,0.1862249999999999
20764,105500,105500,Jew_3,I’m hoping Rodrigo and Jerry Jacobs are the start of the luck. Getting good players as UDFAs or as day 3 picks are what takes an average team and makes them good (assuming the day one and 2 picks aren’t Mike Williams and Titus Young quality.,5.0,detroitlions,t3_y6mxzm,False,0.0,Rodrigo!,2022-10-17T22:31:45Z,detroitlions,0.525225
20765,105501,105501,Jew_3,"Man, Titus Young was such a joke at the end of his career, but honestly, I feel bad I made fun of him. He obviously had bad CTE and also has since been diagonsed with Bi-polar disorder, which I’m sure isn’t helped by the CTE. To be perfectly honest, I’m surprised he’s still alive, so much so I had to check to see if he was. I wish all the best to him now, because, like many things, life perspective changes as you get older.",9.0,detroitlions,t3_y6mxzm,False,0.0,Rodrigo!,2022-10-17T22:28:26Z,detroitlions,0.26329921875
20766,105503,105503,Jew_3,"Someone said we need a 30 for 30 on the second pick. I went back all the way to the 2000 draft class. Here are the high points of a future 30 for 30. 


In 2001 we snagged Dominic Raiola and Shaun Rogers. Raiola was a solid player who saw the Lions though some dark days, never a pro bowler, he stated 203 games for us. If 50% of the guys we drafted since in the second round could have started half that many games, we might not be as bad as we are. Rogers played in 88 games for the Lions, twice being a Pro Bowler while in Detroit. Again, had we kept this type of production, this meme literally wouldn’t exist. 

In 2007 we got Drew Stanton, and though he did basically nothing for us, he had a long career, mostly as a backup. Not really a win but also not Teddy Lehman or Titus Young. He did start 4 games for us going 2-2. His career Detroit stat line consists of 5 TDs to 9 Picks. He’s 5th in the list of top 5 second round draft picks since 2000, and it could be argued that he’s not even that good. I gave him plus points for staying in the league for multiple years and actually being good at his intended job, career backup QB.

In 2013 we got Darius Slay 2 picks before Manti Te’o, which honestly should count for 2 wins because Te’o seems like an obvious Lions 2nd rounder (but honestly probably too good for us, as he would also be top 5 on this list). 

In 2020 we got D’andre Swift, the most hyped running back we had gotten since Kerryon Johnson 2 years before, also in the second round. If he’s healthy he looks like he could be the real deal.",3.0,detroitlions,t3_y6mxzm,False,0.0,Rodrigo!,2022-10-17T22:20:21Z,detroitlions,0.0383598112645118
20767,105504,105504,Jew_3,"Gotcha. I thought you meant great for Mahomes. If we can keep opposing QBs to 188 1/1, we will actually become competitive.",2.0,detroitlions,t3_y4o42s,False,0.0,Rodrigo!,2022-10-15T19:02:13Z,detroitlions,0.1287333333333333
20768,105505,105505,Jew_3,"If Mahomes had that stat line, it would be a pretty disappointing performance. Outside of completion percentage, that’s pedestrian at best.",6.0,detroitlions,t3_y4o42s,False,0.0,Rodrigo!,2022-10-15T18:57:16Z,detroitlions,0.31845
20769,105506,105506,Jew_3,Agreed.,1.0,detroitlions,t3_y4gt5v,False,0.0,Rodrigo!,2022-10-15T12:50:51Z,detroitlions,0.2732
20770,105507,105507,Jew_3,"This. 


I did upvote as well for any bots watching.",1.0,detroitlions,t3_y47q4z,False,0.0,Rodrigo!,2022-10-15T09:24:21Z,detroitlions,0.1366
21101,109534,109534,Jruzzin,Such is the way of the lions fan.,1.0,detroitlions,t3_y6iq8p,False,0.0,Yas Lions,2022-10-18T12:56:47Z,detroitlions,0.3182
