,Unnamed: 0.1,Unnamed: 0,author,body,score,subreddit,link_id,over_18,controversiality,author_flair_text,created_utc,flair,sentiment
38877,234925,234925,blue_shadow_,"https://www.reddit.com/r/nfl/comments/xppln5/official_rnfl_week_3_power_rankings/

Would you like to try again?",10.0,nfl,t3_y4oz4h,False,0.0,:Lions: Lions :Lions: Lions,2022-10-15T15:16:55Z,detroitlions,0.3612
39728,238761,238761,boerumhill,"u/davebirkett  
A lot of you asking about Robert Saleh this morning, The feedback I got was that his interview with the Lions went well, they liked his presentation and potential staff.  
https://twitter.com/davebirkett/status/1347924542874902530?s=20&t=HC47ew-bNaIkP2BQHIidww",2.0,detroitlions,t3_y5p3x3,False,0.0,MC⚡DC,2022-10-17T04:42:47Z,detroitlions,0.14985
39729,238762,238762,boerumhill,"u/davebirkett  
A lot of you asking about Robert Saleh this morning, The feedback I got was that his interview with the Lions went well, they liked his presentation and potential staff.  
https://twitter.com/davebirkett/status/1347924542874902530?s=20&t=HC47ew-bNaIkP2BQHIidww",2.0,detroitlions,t3_y5p3x3,False,0.0,MC⚡DC,2022-10-17T04:42:39Z,detroitlions,0.14985
39730,238763,238763,boerumhill,"u/davebirkett  
A lot of you asking about Robert Saleh this morning, The feedback I got was that his interview with the Lions went well, they liked his presentation and potential staff.

https://twitter.com/davebirkett/status/1347924542874902530?s=20&t=HC47ew-bNaIkP2BQHIidww",2.0,detroitlions,t3_y5p3x3,False,0.0,MC⚡DC,2022-10-17T04:42:08Z,detroitlions,0.14985
40162,240098,240098,boonkles,"A WR over 6 foot for kyler, probably a good thing",1.0,nfl,t3_y6gfeo,False,0.0,:Lions: Lions :Lions: Lions,2022-10-17T12:09:04Z,detroitlions,0.4404
40163,240099,240099,boonkles,Some running backs are just more fun to watch than others,7.0,nfl,t3_y6flgj,False,0.0,:Lions: Lions :Lions: Lions,2022-10-17T11:56:56Z,detroitlions,0.5256
40425,241000,241000,caint1154,I live in Greenville sc so yay!,1.0,detroitlions,t3_y84uq6,False,0.0,Logo,2022-10-19T10:23:34Z,detroitlions,0.6867
40426,241001,241001,caint1154,"I keep hearing about how well coached the Eagles giants and jets are. Daboll is first year and saleh and sirianni are both in year 2 just like MCDC. I get eagles and jets have better rosters than us(NYG debatable) but the Lions are OBVIOUSLY a poorly coached team thru 5 games this year, especially on defense. Campbell and AG have 12 games to achieve the perception of competence but if they can’t it’s time to move on. It is a terrible idea to draft your future franchise qb into a coaching staff whose asses are on fire.",0.0,detroitlions,t3_y6df02,False,0.0,Logo,2022-10-17T14:09:57Z,detroitlions,-0.129597056
40631,244016,244016,ckrobinett,"I've seen this so many times and my reaction is still a genuine ""what the fuck was that?""",2.0,nfl,t3_y6wwd5,False,0.0,:Lions: Lions,2022-10-18T15:31:59Z,detroitlions,-0.5423
40632,244017,244017,ckrobinett,Sounds like some Steven Seagal shit.,1.0,nfl,t3_y6wwd5,False,0.0,:Lions: Lions,2022-10-18T15:28:48Z,detroitlions,-0.2732
41017,249989,249989,drfjgjbu,"That doesn’t refute what was said. PFF grades are based on results, and although he hasn’t gotten those (because he’s the only thing the opposing team needs to scheme against) he is still playing very well. His grades will improve if anyone else on the line forces the opponent to respect them and takes a little pressure off Hutch.",1.0,detroitlions,t3_y7g6p1,False,0.0,48,2022-10-18T20:03:30Z,detroitlions,0.2627444444444444
41018,249991,249991,drfjgjbu,"Lions have a full-time FB, but he’s on the PUP list so we’ve been using our backup TEs and a 315-pound OT in the role, to pretty good effect.",1.0,nfl,t3_y6vow5,False,0.0,:Lions: Lions,2022-10-18T10:54:21Z,detroitlions,0.8462
41019,249992,249992,drfjgjbu,"“Pace” doesn’t exist until halfway through the season, and it especially doesn’t exist with Wins as a stat. Wins are the least predictive stat of future wins within a single season, especially with a sample size like we have now and with games like the ones we’ve seen. We’ve had some pretty fucking bad breaks so 7 may very well be out of the picture at this point but 3-4 is far from a guarantee.",2.0,detroitlions,t3_y6df02,False,0.0,48,2022-10-17T23:13:46Z,detroitlions,0.2688814814814815
41457,255893,255893,franchise2020,"Pistons were looking sick last night too with our main lineup in, I really like Ivey and Duren",88.0,detroitlions,t3_y3urs0,False,0.0,Peni Swell,2022-10-14T09:27:05Z,detroitlions,-0.1298
42591,258565,258565,future_shoes,"The only consistent piece to being a contender rebuild or otherwise is to have a quality QB.  Without that you are usually destined to below-average to mediocre team.  There are exceptions to the rule but they are you know exceptions.

Three years is a pretty decent number to gage a rebuild by since in three years most teams turnover a majority of their roster (even for a non-rebuild).  So at that point the coach and GM should have a lot of ""there guys"" in place.  It's also long to understand if the players are really buying into the new regime or not.

For the Lions while the first five games have been frustrating they have been pretty upfront they were working on a rebuild plan that would have them be competitive/playoff contenders by year three.  That has seemed to influence a lot of their personal decisions be it drafting high upside players who can contribute immediately due to injury or being very frugal in the FA I the first two years.  So it's really hard to judge the Lions rebuild until next year.",2.0,detroitlions,t3_y87e8h,False,0.0,Ragnowrok,2022-10-19T17:34:26Z,detroitlions,-0.0317412288935498
42592,258567,258567,future_shoes,Does he lock in on his guy? Or you going by the highly edited Inside the Den videos from the Draft that make it seem like every single pick the lions make was the only guy they wanted?,33.0,detroitlions,t3_y6jhrl,False,0.0,Ragnowrok,2022-10-17T17:52:09Z,detroitlions,0.1806
42593,258571,258571,future_shoes,"Pettigrew gets so much hate.  If you go back and look at the draft class and look at Pettigrew's career in comparison to most of the 1st round picks that year, it was actually a pretty good pick.",10.0,detroitlions,t3_y5lciz,False,0.0,Ragnowrok,2022-10-16T13:55:03Z,detroitlions,0.21105
42594,258580,258580,future_shoes,I don't know man.  It's not like I'm on an island here saying Glenn got the most out the talent they had last year.  The national press were singing his praises and he was getting HC interest.  But everyone is entitled to their own opinion.,1.0,detroitlions,t3_y3yb8v,False,0.0,Ragnowrok,2022-10-14T16:19:20Z,detroitlions,0.1486234375
42595,258581,258581,future_shoes,"The defense over performed last year compared to talent.  So far this year they are underperforming.

I'm just saying I'll be interested to see how they perform when they get some consistent level of talent on the defensive side of the ball.",1.0,detroitlions,t3_y3yb8v,False,0.0,Ragnowrok,2022-10-14T16:01:54Z,detroitlions,0.2458444444444444
42596,258582,258582,future_shoes,"The cowboys, 49ers, and bills didn't combine that with the mess of a defense left behind by Patricia and Quinn.",0.0,detroitlions,t3_y3yb8v,False,0.0,Ragnowrok,2022-10-14T15:57:03Z,detroitlions,-0.25
42597,258583,258583,future_shoes,They have spent no real money on defense.  Because they have no money.  Because Quinntricia made a lot of bad FA deals.  Next year the dead money is gone and they can actually get legit starters in FA.,5.0,detroitlions,t3_y3yb8v,False,0.0,Ragnowrok,2022-10-14T15:47:39Z,detroitlions,-0.2013636718749999
44884,274986,274986,jklovesfood,Bay Area reach is incredible and I think that’s part of the reason why Raiders stayed relevant down there even once they went back to Oakland.,1.0,nfl,t3_y4vh5c,False,0.0,:Lions: Lions,2022-10-16T01:13:55Z,detroitlions,0.0258
44885,274987,274987,jklovesfood,"The Raiders is LA’s team and anything else is just the NFL being petty. Al Davis was so stubborn and pissed off Pete Rozelle and Paul Tagliabue so much by his antics with moving and stadium demands, they were never going to be allowed to settle there again. Rams shouldn’t have left StL, Chargers should have stayed in SD, and Raiders should have LA market to themselves. But whatever, I’m not a Billionaire.",1.0,nfl,t3_y4vh5c,False,0.0,:Lions: Lions,2022-10-15T15:44:04Z,detroitlions,-0.013888671875
44886,274993,274993,jklovesfood,A Super Bowl was won at the Silverdome….,4.0,detroitlions,t3_y3a1zv,False,0.0,DETROIT -VS- EVERYBODY,2022-10-14T10:51:03Z,detroitlions,0.8225
45107,276248,276248,joelbartlett33,"Noted above, injuries aside, as in, if KG was 100% this would still be the case. I can’t speak to the impact of his injuries but I watched every damn game he played with the Lions and when Stafford was hurt, our backups had the same problem as DJones.",4.0,nfl,t3_y425ki,False,0.0,:Lions: Lions,2022-10-14T22:25:41Z,detroitlions,-0.43125
45108,276249,276249,joelbartlett33,"It’s not just deep balls tho, it’s the speed and super tight windows Stafford throws too. The ball was pretty much ALWAYS in the exact perfect spot. (Note for Stafford detractors, talking when they played together.)",50.0,nfl,t3_y425ki,False,0.0,:Lions: Lions,2022-10-14T21:07:37Z,detroitlions,0.2227
45773,282365,282365,kingdom55,Taysom Hill would be a better comparison lol,2.0,nfl,t3_y3iljc,False,0.0,:Lions: Lions,2022-10-14T12:18:32Z,detroitlions,0.6908
46804,291684,291684,murdo1tj,Yes they are,1.0,detroitlions,t3_y84uq6,False,0.0,Dan Friggin' Campbell,2022-10-19T15:01:57Z,detroitlions,0.4019
46805,291685,291685,murdo1tj,"I’m in the Bay Area, CA. Does this mean it won’t play on my RedZone?",1.0,detroitlions,t3_y84uq6,False,0.0,Dan Friggin' Campbell,2022-10-19T12:27:19Z,detroitlions,0.17
47044,294766,294766,nameisEmery,"Depth is one thing. It's another thing entirely to lose Tracy Walker, Cominsky, Charles Harris, and have Oruwariye regress like he has. I'm talking about keeping the guys we have as starters healthy. Shit happens, but how many we've lost, on both sides of the ball, isn't normal, and no amount of depth can really make up for that. Look at how many DBs dropped last game against the Pats, what, 3 guys go down? Not good in terms of what we are doing off of the field to keep guys playing, which, again, will interesting to see what we do to curb whatever it is going on.",3.0,detroitlions,t3_y88w7n,False,0.0,Ooooh Yeahhhh!,2022-10-19T15:05:38Z,detroitlions,0.0448647119341563
47045,294767,294767,nameisEmery,"It was somehow way worse than the box score/stats. Jaw on the floor bad. Ugh I'll see you on Sunday, man 👊",3.0,detroitlions,t3_y88w7n,False,0.0,Ooooh Yeahhhh!,2022-10-19T12:51:12Z,detroitlions,-0.2184111111111111
47046,294768,294768,nameisEmery,"Its a good thing you didn't watch the Patriots game. I don't think I've ever seen worse coaching in the NFL in my life, and I consider myself a fan of Dan Campbell. That game changed a lot of my outlook on this team, its direction and his ability to make decisions. 

Not totally on topic, I saw you said you missed it and felt the need to reiterate that it was one of the worst games I've seen us play, probably ever- and I'm not a Lions doomer by any means.",1.0,detroitlions,t3_y88w7n,False,1.0,Ooooh Yeahhhh!,2022-10-19T12:44:05Z,detroitlions,-0.131403125
47047,294769,294769,nameisEmery,Would be great to have a defense that isn't eternally injured. Let's hope changes to practice will change something. Depressing.,11.0,detroitlions,t3_y88w7n,False,0.0,Ooooh Yeahhhh!,2022-10-19T12:41:11Z,detroitlions,-0.049374074074074
49113,306810,306810,scorpiosultan,"Mac Jones comes back, is super vanilla, and ignites Zappe fever to new heights",20.0,nfl,t3_y7dn02,False,0.0,:Lions: Lions,2022-10-18T12:52:56Z,detroitlions,0.5994
49114,306811,306811,scorpiosultan,"Well I sure would love to see it, but I feel like that's too nice a thing for me to have in my life.",10.0,nfl,t3_y7dn02,False,0.0,:Lions: Lions,2022-10-18T12:49:49Z,detroitlions,0.8945
49257,308523,308523,silentguy876,"swift has also played much less than both, at the same time Jamaal is playing lights out and Craig Reynolds seems to get good runs every now and then",35.0,detroitlions,t3_y7g6p1,False,0.0,I wanna die,2022-10-18T15:53:07Z,detroitlions,0.7845
49258,308524,308524,silentguy876,O-Line coaches and Schemes are worse than the players itself,1.0,nfl,t3_y6vow5,False,0.0,:Lions: Lions,2022-10-18T00:38:35Z,detroitlions,-0.4767
49259,308525,308525,silentguy876,"> his durability issues

? he's missed 4 games in 3 seasons what durability issues?",7.0,detroitlions,t3_y5xw4w,False,0.0,I wanna die,2022-10-17T01:29:08Z,detroitlions,-0.148
49260,308526,308526,silentguy876,"i think the difference is that the jets and giants got a coach that actively takes part of the side of the ball they lacked the most. 

Brian daboll has turned that offense and Daniel Jones from trash to actually good, the negatives they had last year were QB play and O-line.

Saleh on the other hand has turned the defense from trash to somewhat decent by investing even more on it, Carl Lawson, Kwon Alexander and CJ Mosley in free agency, Quinnen Williams, Sauce Gardner, Solomon Thomas all drafted in the first round. How many of our were drafted in the first, Okudah and?",2.0,detroitlions,t3_y5qbyb,False,0.0,I wanna die,2022-10-16T16:06:03Z,detroitlions,0.05863359375
49261,308527,308527,silentguy876,"Sauce Gardner is great, but coming into the season we thought we were good with Okudah and Oruwariye so it didnt make any sense to draft him. 

On the other hand Kavyon Thibodeaux doesnt get double teamed nearly as much as Hutchinson is.

But reality is they have invested much, much more on defense than we have",5.0,detroitlions,t3_y5qbyb,False,0.0,I wanna die,2022-10-16T15:33:37Z,detroitlions,0.1788777777777777
49666,310684,310684,sliccricc83,This has Dan Campbell energy except Saleh is more successful so I actually believe him,55.0,nfl,t3_y6htlf,False,0.0,:Lions: Lions,2022-10-17T13:15:16Z,detroitlions,0.7346
49667,310685,310685,sliccricc83,The Giants won't beat the Lions; we will beat ourselves. Arguably even easier,4.0,nfl,t3_y6cggi,False,0.0,:Lions: Lions,2022-10-17T10:38:43Z,detroitlions,0.10115
49668,310688,310688,sliccricc83,Love watching Rodgers get wrecked,-6.0,nfl,t3_y5nyrw,False,1.0,:Lions: Lions,2022-10-16T13:26:35Z,detroitlions,0.6369
49669,310689,310689,sliccricc83,Stunning and Brave,7.0,nfl,t3_y3ypbo,False,0.0,:Lions: Lions,2022-10-14T13:01:53Z,detroitlions,0.7184
49670,310690,310690,sliccricc83,"Fun fact: slots/games at casinos that are themed, like an NFL slot machine or deal or no deal, etc, have lowered chances of winning bc the casino has to pay royalties to the companies that they are themed after",5.0,nfl,t3_y3zipe,False,0.0,:Lions: Lions,2022-10-14T13:01:12Z,detroitlions,0.7845
50168,311982,311982,sloppifloppi,"I think the Chargers game later that season that clinched the playoffs was peak Detroit Lions, but I might be biased because I was at the game.",1.0,detroitlions,t3_y6mxzm,False,0.0,Sun God,2022-10-18T11:59:25Z,detroitlions,-0.3919
50169,311984,311984,sloppifloppi,"Best was a 1st round pick, just wanted to point that out.",115.0,detroitlions,t3_y6mxzm,False,0.0,Sun God,2022-10-17T16:37:49Z,detroitlions,0.6369
50170,311985,311985,sloppifloppi,He probably would have panned out if we traded up for him. This is happening because of our 2nd round curse.,33.0,detroitlions,t3_y6jhrl,False,0.0,Sun God,2022-10-17T15:03:07Z,detroitlions,-0.27115
51603,315613,315613,snatchmachine,">Mobile QBs are what all the top QBs are nowadays, time for the Lions to join the fun.

This is true to an extent, but Stroud is much more than a ""mobile QB""",2.0,detroitlions,t3_y832c2,False,0.0,Ooooh Yeahhhh!,2022-10-19T13:20:49Z,detroitlions,0.2989
51604,315615,315615,snatchmachine,"So much this. 

I'm still hopeful for Campbell and have faith in Holmes,  but there are serious concerns about game management, scheme, personnel decisions, strength and conditioning etc. 

A rebuild doesn't mean you pick in the top 3 for 4 straight years and then in the 5th year you win the superbowl... I just want to see some damn improvement from Campbell with in game decisions and I want to see improvement in the record.",3.0,detroitlions,t3_y87e8h,False,0.0,Ooooh Yeahhhh!,2022-10-19T12:54:58Z,detroitlions,0.2094765625
51605,315618,315618,snatchmachine,"I imagine it’s much easier being a Detroit pro sports/buckeye fan in Michigan. 

I say that being one. Unless I’m on the golf course tailgating, I don’t get too much shit from Michigan fans. Just the normal “Ohio’s players are all criminals and couldn’t get into to Michigan” from the Walmart wolverines.",1.0,detroitlions,t3_y84uq6,False,0.0,Ooooh Yeahhhh!,2022-10-19T11:43:57Z,detroitlions,-0.175371484375
51606,315619,315619,snatchmachine,"They get the highest ratings, they sell the most merchandise, they have the largest social media followings, they typically get the most Primetime games, it’s the most valuable sports franchise. 

So yea they are still earning that moniker 

“Americas team” was a nickname given by a narrator in the 70’s that stuck. So it’s more of a branding thing at this point. Even if another team passes them in all of those categories, you will still think of the cowboys when someone says “americas team.”",1.0,detroitlions,t3_y84uq6,False,0.0,Ooooh Yeahhhh!,2022-10-19T11:41:44Z,detroitlions,-0.001853125
51607,315622,315622,snatchmachine,"Last season he had a PFF run blocking of 45.1 which is abysmal. 

This season is still being written, but I have personally noticed a few missed blocks. I may be weighing the few I saw too heavily for this year. But last year was real bad. Especially for a guy who ranked so high coming out of Iowa partly because of his run blocking.",5.0,detroitlions,t3_y7g6p1,False,0.0,Ooooh Yeahhhh!,2022-10-18T16:10:41Z,detroitlions,-0.105315776
51608,315623,315623,snatchmachine,That is not a good example,37.0,detroitlions,t3_y7g6p1,False,0.0,Ooooh Yeahhhh!,2022-10-18T15:53:00Z,detroitlions,-0.3412
51609,315625,315625,snatchmachine,His run blocking over the last 2 seasons has been below average at best,23.0,detroitlions,t3_y7g6p1,False,0.0,Ooooh Yeahhhh!,2022-10-18T15:50:43Z,detroitlions,0.3818
51610,315629,315629,snatchmachine,For about 4 months until the season started. Winning wipes all of that away,7.0,detroitlions,t3_y5p3x3,False,0.0,Ooooh Yeahhhh!,2022-10-17T09:01:43Z,detroitlions,0.26335
51611,315630,315630,snatchmachine,"Adding 15 lbs of muscle in an offseason while maintaining your speed and agility is not the same as you adding 15 lbs of Doritos and being constipated. 

Please don’t try to compare the two.",1.0,detroitlions,t3_y57ek1,False,0.0,Ooooh Yeahhhh!,2022-10-17T06:31:01Z,detroitlions,0.1591
51612,315631,315631,snatchmachine,"Not sure about those weight gains and losses for Tavai, do you have sources on that? That’s an extreme amount of weight to add and lose in such a short amount of time. For any position. 

But adding weight to a 6’2 thumper linebacker is not the same as it is to a small framed QB. 20lbs is a lot of weight to add to someone Bryce’s size. Especially in a single offseason, that’s a bit absurd. Guys are usually down in weight heading into the draft to improve their agility in drills. 

I also think the 185lbs could be a bit exaggerated already. I will be very interested in his combine measurements.",1.0,detroitlions,t3_y57ek1,False,0.0,Ooooh Yeahhhh!,2022-10-16T19:21:24Z,detroitlions,0.0501806483001987
51613,315632,315632,snatchmachine,"I personally like Stroud’s upside in the NFL better, due to his size and arm strength. Both are very accurate QB’s. Young is such a savvy QB, I’m a big fan of the way he plays. 

My main concern is not only his height but his frame. He is very slight for a QB. I’m not saying he can’t be a star, he absolutely has the ability. But 185 lbs in the NFL scares the shit out of me.",6.0,detroitlions,t3_y57ek1,False,0.0,Ooooh Yeahhhh!,2022-10-16T10:33:48Z,detroitlions,0.0829150524016353
52883,326798,326798,upcat,"Lol even if I ran as fast as I could and threw my entire body at Milano I don't think I'd be able to slow him down for more than 0.5 seconds, it's crazy what these guys are capable of",7.0,miamidolphins,t3_y873pv,False,0.0,.,2022-10-19T12:39:49Z,detroitlions,0.4588
52884,326800,326800,upcat,I can bench 155 and squat 185. An NFL defensive lineman would push me aside like tissue paper lol.,14.0,miamidolphins,t3_y873pv,False,0.0,.,2022-10-19T11:57:09Z,detroitlions,0.32985
52885,326812,326812,upcat,"Looking at Tua's first three games...my rankings are:

1. Mahomes
2. Lamar
3. Allen
4. Tua

Tua is a top 5 QB and only going to get better. Yes, limited sample size but with average OL protection and some weapons at the skill positions he looking f'ing awesome.",0.0,miamidolphins,t3_y3fvow,False,0.0,.,2022-10-14T07:26:49Z,detroitlions,0.0982027777777777
53135,329276,329276,warningtrackpower12,And hamilton! I thought we were going to trade up for hamilton and instead we got Jamo. Good deal.,3.0,detroitlions,t3_y7g6p1,False,0.0,MC⚡DC,2022-10-18T20:58:26Z,detroitlions,0.1468
53136,329292,329292,warningtrackpower12,He might not be great but he's exciting and fun to watch. I was hoping he'd get another shot. Kind of like a minshew except not as good looking,1.0,nfl,t3_y4oler,False,0.0,:Lions: Lions,2022-10-15T12:10:06Z,detroitlions,0.0853999999999999
53137,329293,329293,warningtrackpower12,"My place is weird. People have thrown things at people and just got a talking to, and then someone said ""shut off your phone, it's rude"" and got suspended... Heck it's kind of like the NFL lol",1.0,nfl,t3_y3ygoo,False,0.0,:Lions: Lions,2022-10-15T08:11:25Z,detroitlions,-0.180275
53138,329297,329297,warningtrackpower12,"Yeah if I did that I would be suspended for a week, and would be out well more than 40 bucks.",1.0,nfl,t3_y3ygoo,False,0.0,:Lions: Lions,2022-10-15T05:26:15Z,detroitlions,0.0516
53139,329308,329308,warningtrackpower12,"Nature can be just like watching the lions, cruel and sad",2.0,detroitlions,t3_y3fwnl,False,0.0,MC⚡DC,2022-10-14T06:13:26Z,detroitlions,-0.6597
54094,333298,333298,wtfmynamegotdeleted,The notion that people are still defending this organization is insane.,0.0,detroitlions,t3_y7pvqb,False,1.0,Cheese Grater,2022-10-19T08:49:21Z,detroitlions,-0.4019
54095,333299,333299,wtfmynamegotdeleted,I'm mostly referring to the dozens of other injured and bust players we drafted in the 2nd round.,5.0,detroitlions,t3_y74ic6,False,0.0,Cheese Grater,2022-10-18T16:17:57Z,detroitlions,-0.4019
54096,333300,333300,wtfmynamegotdeleted,Why didn't you just retire the military?! Obviously it's just like the NFL which you can easily retire.,1.0,nfl,t3_y7b6vv,False,0.0,:Lions: Lions :Steelers: Steelers,2022-10-18T14:18:02Z,detroitlions,0.2997
54097,333302,333302,wtfmynamegotdeleted,I really hope Paschal is a dude... I'm sick of wasting 2nd round picks on injured players and busts.,59.0,detroitlions,t3_y74ic6,False,0.0,Cheese Grater,2022-10-18T10:33:40Z,detroitlions,-0.2903749999999999
54098,333304,333304,wtfmynamegotdeleted,"I'm sure this will be an unpopular opinion here, but get me Ryan Day as HC.",1.0,detroitlions,t3_y5z38c,False,0.0,Cheese Grater,2022-10-17T12:34:19Z,detroitlions,0.1655
54513,334841,334841,xproofx,"> a shitty team

The Lions?  A shitty team?  Where is your evidence?",1.0,detroitlions,t3_y5lciz,False,0.0,Ebron,2022-10-16T17:48:28Z,detroitlions,-0.0825777777777777
54514,334847,334847,xproofx,"Tom Landry's first 5 seasons with the Cowboys were all losing records.

Season 6 he was .500.

Coached the team from 1960 to 1988. With the exception of his last 3 seasons he never had another season .500 or worse after those first 6.",1.0,detroitlions,t3_y389by,False,0.0,Ebron,2022-10-14T12:47:03Z,detroitlions,-0.12066640625
