,Unnamed: 0.1,Unnamed: 0,author,body,score,subreddit,link_id,over_18,controversiality,author_flair_text,created_utc,flair,sentiment
33561,254527,254527,cincythunder,damnit we have had some so unlucky breaks including dropped INTs and now that hubbard almost deflected it,10.0,bengals,t3_zckj53,False,0.0, ,2022-12-04T17:01:34Z,bengals,-0.5267
33562,254528,254528,cincythunder,what happened to our run defense?,5.0,bengals,t3_zckj53,False,0.0, ,2022-12-04T16:23:01Z,bengals,0.128
33563,254529,254529,cincythunder,fuck tackle him low!!,2.0,bengals,t3_zckj53,False,0.0, ,2022-12-04T16:21:15Z,bengals,-0.1772
33564,254530,254530,cincythunder,they are starting to bringing more pressure and it resulted in 3 and out. gotta adjust,8.0,bengals,t3_zckj53,False,0.0, ,2022-12-04T16:14:05Z,bengals,-0.089925
33565,254531,254531,cincythunder,we getting gashed badly on the ground,2.0,bengals,t3_zckj53,False,0.0, ,2022-12-04T15:41:29Z,bengals,-0.4767
34203,255743,255743,cirespieler,Oh nice there it is! Don’t know how he got Montana on there but I’m here for it.,8.0,bengals,t3_zf8ve0,False,0.0, ,2022-12-07T12:18:56Z,bengals,0.118825
34204,255745,255745,cirespieler,"It was poorly reffed, many games are, but at the end of the day we let Mike White throw underneath over and over and rack up 400 yards and 3 TDs in his first start. First time the Jets went over 400 yards passing since 2000. Can’t put that on the refs, just a stinker of a game for our squad that included some shitty officiating. 

We had 5 penalties for 51 yards while the Jets were flagged 8 times for 46 yards…",2.0,bengals,t3_zekaz0,False,0.0, ,2022-12-07T00:11:18Z,bengals,-0.04543125
34205,255747,255747,cirespieler,"Totally appreciate it, that is a solid idea. u/pfftYeahRight",3.0,bengals,t3_ze4b0h,False,0.0, ,2022-12-06T17:38:17Z,bengals,0.139075
34206,255748,255748,cirespieler,They are pretty flag happy. At least they got the call right despite the whistle fuck up.,16.0,bengals,t3_zekaz0,False,0.0, ,2022-12-06T17:22:17Z,bengals,0.411625
34207,255750,255750,cirespieler,More or less what the meet the enemy weekly post is for.,1.0,bengals,t3_ze4b0h,False,0.0, ,2022-12-06T16:08:44Z,bengals,-0.5423
34208,255751,255751,cirespieler,"Such a bad take, that was a monster hit and Dalton threw an absolute dime.",13.0,nfl,t3_zduxbz,False,0.0,:Bengals: Bengals,2022-12-05T23:14:17Z,bengals,-0.5423
34209,255752,255752,cirespieler,MVS could be so good but he has stone hands. Somehow he caught those two huge passes and dropped his other 4 targets.,16.0,bengals,t3_zdt40z,False,0.0, ,2022-12-05T22:57:33Z,bengals,0.2425
34210,255753,255753,cirespieler,"YOU SICK FUCK 
YOU SICK FUCK",3.0,bengals,t3_zdehxe,False,0.0, ,2022-12-05T22:08:19Z,bengals,-0.9274
34211,255754,255754,cirespieler,"Palmer had more raw talent, and he was a first rounder so the expectations were higher. Despite that Dalton accomplished more.",6.0,bengals,t3_zdslrz,False,0.0, ,2022-12-05T20:54:06Z,bengals,-0.0524
34212,255755,255755,cirespieler,"Pretty sure it’s a fake injury, but just for the record Logan Wilson has the green dot helmet.

Could cost a timeout or fine for obvious ones but it seems like that might just cause players to sell it more and waste time or falsely cause real concern. Idk what the best solution is but flopping has been going on at least as far back as when the 80s Bengals ran No Huddle and teams would flop left and right to slow it down. Weak shit.",7.0,nfl,t3_zcny6j,False,0.0,:Bengals: Bengals,2022-12-04T23:42:32Z,bengals,-0.2184859375
34213,255761,255761,cirespieler,Damn that’s a hell of a story. Dude always seemed humble and I’m loving his ascension.,6.0,nfl,t3_zcr1fc,False,0.0,:Bengals: Bengals,2022-12-04T22:36:59Z,bengals,0.09785
34214,255763,255763,cirespieler,Good luck proving it was fake… It most likely was but how do you prove that definitively.,13.0,bengals,t3_zcteto,False,0.0, ,2022-12-04T20:03:03Z,bengals,0.4497
34215,255765,255765,cirespieler,"It’s really wild because without that game idk if it’s even a question. Mixon is still a stud though, what an embarrassment of riches we have at RB all of a sudden.",8.0,bengals,t3_zcrt8v,False,0.0, ,2022-12-04T19:44:20Z,bengals,0.08305
34216,255767,255767,cirespieler,"🍍 E N E R G Y  🍍 

  
  
  
  


Side note my fantasy team is the Energy Pineapples and this is my team pic. About to be 12-1 with my Burrow Higgins stack. 

Conclusion- Energy Pineapple is lucky",38.0,bengals,t3_zcqxy6,False,0.0, ,2022-12-04T18:29:56Z,bengals,0.2099185185185185
34217,255768,255768,cirespieler,What an incredible game. I can’t believe after I watched us get absolutely destroyed against Mahomes years ago that we would win 3 in a row. This team is legit.,38.0,bengals,t3_zcr1af,False,0.0, ,2022-12-04T18:27:05Z,bengals,0.0087777777777777
34218,255769,255769,cirespieler,"Exactly. As Jim and Tony said it’s a TD if Los does what he’s supposed to, but he sniffed it out, just a really solid play by Dunlap.",9.0,bengals,t3_zckj53,False,0.0, ,2022-12-04T16:50:25Z,bengals,0.3528
34219,255770,255770,cirespieler,Straight to the shadow realm,3.0,bengals,t3_zckj53,False,0.0, ,2022-12-04T16:33:44Z,bengals,0.2263
34220,255771,255771,cirespieler,Feel like I’ve been seeing that exact bus forever,2.0,bengals,t3_zcgcr2,False,0.0, ,2022-12-04T13:04:47Z,bengals,0.3612
34221,255774,255774,cirespieler,"Heard Kelce had the flu yesterday too, wonder if he’s feeling better.",7.0,bengals,t3_zcevp5,False,0.0, ,2022-12-04T11:51:05Z,bengals,0.2023
34222,255777,255777,cirespieler,Drafted Burrow and Higgins in my superflex league. Flex QB is Mahomes and ended up picking up Perine and traded Mooney for Hurst a few weeks back. Only have one loss all season.,1.0,bengals,t3_zbpvn2,False,0.0, ,2022-12-03T23:20:37Z,bengals,-0.1060666666666666
34223,255781,255781,cirespieler,"Dope, love the starfish lows. Wanted ‘em bad but have the SBB lows and electro orange highs I’m rocking tomorrow.",3.0,bengals,t3_zby9yb,False,0.0, ,2022-12-03T22:55:55Z,bengals,-0.135625
34224,255786,255786,cirespieler,"Well damn, you’re right, wrong video. Hopefully there is one this week.",1.0,bengals,t3_zacd29,False,0.0, ,2022-12-02T00:17:03Z,bengals,0.057975
34660,259918,259918,corranhorn57,"Okay, I’m not allowed to pick up QBs in fantasy anymore. Every single one I have has been injured.",1.0,nfl,t3_zcrmym,False,0.0,:Bengals: Bengals :Bills: Bills,2022-12-04T18:53:07Z,bengals,-0.1443749999999999
34661,259919,259919,corranhorn57,Best part? That game will also be on ABC. Whole country can watch that one!,5.0,nfl,t3_zcr1r7,False,0.0,:Bengals: Bengals :Bills: Bills,2022-12-04T18:43:41Z,bengals,0.0235888888888888
34662,259925,259925,corranhorn57,"Your line thought he had committed to the run, that’s how that one happened.",0.0,nfl,t3_zcld40,False,0.0,:Bengals: Bengals :Bills: Bills,2022-12-04T16:06:54Z,bengals,0.2732
34663,259928,259928,corranhorn57,"Okay, that roughing was soft. Perine is a beast though.",8.0,nfl,t3_zcld40,False,0.0,:Bengals: Bengals :Bills: Bills,2022-12-04T15:54:01Z,bengals,0.056575
34664,259929,259929,corranhorn57,"I’m sorry, Jimmy G is hurt?",1.0,nfl,t3_zcld40,False,0.0,:Bengals: Bengals :Bills: Bills,2022-12-04T15:35:52Z,bengals,-0.5719
34771,260391,260391,credscbengs,"It should be known we are spammed with advertisements that look exactly like this on a quite frequent basis. You have zero history in this community, and that's okay, everyone starts at zero. But can you not admit it's a bit suspicious that your only engagement in this community is what appears to be spamming a photo that is always posted with the same group of comments that shortly follow? 

Omg where did you buy that?
I totally want it. 
Just bought mine! 

Forgive me if I'm wrong here, but as someone who has fallen victim to spam and fraudulent sellers before, I simply feel the need to help others within this community not repeat what I have mistakenly done before.",-2.0,bengals,t3_zdr07f,False,0.0, ,2022-12-06T15:24:56Z,bengals,-0.1312664663533051
34772,260393,260393,credscbengs,"What really stands out to me is all of your best teams, minus the Titans, are leading this chart. Titans make sense considering their strength is Derrick Henry, though.",55.0,bengals,t3_zec8i6,False,0.0, ,2022-12-06T11:50:00Z,bengals,0.406175
34773,260394,260394,credscbengs,But what if you're coming in peace... /s,31.0,bengals,t3_ze4b0h,False,0.0, ,2022-12-06T10:17:16Z,bengals,0.6956
34774,260396,260396,credscbengs,Interesting how these spam posts always make their way back onto the sub. What's your wife's name? Where did you meet? How much do you make off of your Etsy site you're advertising?,28.0,bengals,t3_zdr07f,False,0.0, ,2022-12-05T20:52:21Z,bengals,0.0002015625
34775,260397,260397,credscbengs,"Took me a second, but when it clicked -- ouch. Lol",2.0,bengals,t3_zdap1m,False,0.0, ,2022-12-05T11:31:46Z,bengals,0.21075
34776,260398,260398,credscbengs,"If we were to lose Lou, our team is a much more attractive destination than it has ever been before. We will have our pick of quality (available) coordinators. Other coaches will want to be a part of this organization's current and future success.",24.0,bengals,t3_zdcx7e,False,0.0, ,2022-12-05T11:29:38Z,bengals,0.2088111111111111
34777,260399,260399,credscbengs,"His confidence, which was never lacking to begin with, is skyrocketing these last few games.",14.0,bengals,t3_zd76u4,False,0.0, ,2022-12-05T09:08:52Z,bengals,0.5106
34778,260400,260400,credscbengs,"Watching live, and even during the replay, it seemed like Joe was going to be obliterated. I can't comprehend how he threw this ball so effortlessly and so accurately within a split second of getting hit like that. Unbelievable. At one point I even thought he gave up on the play -- thought maybe there was a whistle I didn't hear.",21.0,bengals,t3_zd76u4,False,0.0, ,2022-12-05T08:19:27Z,bengals,0.102689453125
34779,260401,260401,credscbengs,"Oh wow, this is gold. Hahaha",86.0,bengals,t3_zcw0rx,False,0.0, ,2022-12-04T21:58:00Z,bengals,0.4251749999999999
34780,260402,260402,credscbengs,They keep the energy in the comment section. Wow. Lol,3.0,bengals,t3_zcusjx,False,0.0, ,2022-12-04T21:15:59Z,bengals,0.2157185185185185
34781,260403,260403,credscbengs,"First time I've seen ZT fired up like that. He was laying into him, but then topped it all off with a high 5. Lol",7.0,bengals,t3_zcnr6y,False,0.0, ,2022-12-04T21:11:50Z,bengals,0.1303814814814814
34782,260404,260404,credscbengs,That entire Chiefs team looked defeated after that play.,5.0,bengals,t3_zcro9w,False,0.0, ,2022-12-04T21:09:58Z,bengals,-0.1779
35313,261466,261466,creutzml,"Would you shut yo ass up?! If I say we’ll go, then we’ll go!",1.0,nfl,t3_zfg6m2,False,0.0,:Bengals: Bengals,2022-12-07T18:03:21Z,bengals,-0.1462
35314,261467,261467,creutzml,"Why is it so difficult for our fanbase to realize that coaches can adapt and grow as much as the players? We gave Joe a little bit of criticism after the 0-2 start, but nobody was saying “trade him, or the season’s lost!” Same shit was happening with criticism of Pollack! 

Is it the “instant gratification” world that we live in today? … I think I’ll say this till I’m blue in the face: we are extremely fortunate to have a young, malleable head coach that is loved by our young, rising superstar QB. There will be bumps and bruises, but the two of them will only get better with time.",4.0,bengals,t3_zf42p3,False,0.0, Bingo Bengo Bongo 🐅,2022-12-07T17:23:32Z,bengals,0.148774592
35315,261468,261468,creutzml,"agreed mate. his last full game, he set a Bengals record for most TDs by an RB in a single game… two games later, MFers trying to put him on the trade block yeesh",12.0,bengals,t3_zfdfam,False,0.0, Bingo Bengo Bongo 🐅,2022-12-07T17:04:31Z,bengals,-0.1519
35316,261469,261469,creutzml,"true. but also the Panthers game? when he set a TD record for Bengal’s RBs? yeah, I want some of that this weekend.

Fuck Nickeem Chunt, I wanna see Samajoe Mixrine",30.0,bengals,t3_zfdfam,False,0.0, Bingo Bengo Bongo 🐅,2022-12-07T17:03:25Z,bengals,-0.09387712
35317,261470,261470,creutzml,"right? when he broke that third down run with Perine blocking, I was both hyped and terrified… especially when he tried the spin move at the end hahaha",17.0,bengals,t3_zfdfam,False,0.0, Bingo Bengo Bongo 🐅,2022-12-07T17:00:46Z,bengals,-0.10115
35318,261474,261474,creutzml,"that’s for the homemade Skyline nights. In restaurant, spaghetti or bust. And NO twirling. Cut and scoop with the fork ;)",3.0,bengals,t3_zeybyd,False,0.0, Bingo Bengo Bongo 🐅,2022-12-07T16:33:29Z,bengals,-0.0022375
35319,261475,261475,creutzml,"you rang, evil step-brother? lol",2.0,bengals,t3_zf9bln,False,0.0, Bingo Bengo Bongo 🐅,2022-12-07T16:29:04Z,bengals,0.045825
35320,261476,261476,creutzml,"idk about you, but it looks like he is literally choked on every play haha",7.0,bengals,t3_zf7hpr,False,0.0, Bingo Bengo Bongo 🐅,2022-12-07T16:21:08Z,bengals,0.7184
35321,261480,261480,creutzml,"woah now. don’t get too upset here. He has no allegiances to the stoolers, only the city. And how can you not poke fun about the lack of a practice facility? He’s actually fucking hyped for us now that we got the bubble set up.",2.0,bengals,t3_zem0gt,False,0.0, Bingo Bengo Bongo 🐅,2022-12-07T10:43:02Z,bengals,-0.0274828799999999
35322,261481,261481,creutzml,"or it's just a lack of ability? Shelvin seemed to have done well on that LSU squad because he was a huge body, and not much more. Unlike Reader, who's more flexible than and quick-twitching than some WR's out there lol",1.0,bengals,t3_zefrxy,False,0.0, Bingo Bengo Bongo 🐅,2022-12-07T10:18:15Z,bengals,0.2623555555555555
35323,261482,261482,creutzml,"First and foremost, limit the offensive mistakes. Seems like every time we have played them, there’s been at least one crucial turnover that left points on the field, or even gave Cleveland points. If we get the ball first and score on our first possession, we will finally get this Browns “monkey” off our back",3.0,bengals,t3_zdt6vi,False,0.0, Bingo Bengo Bongo 🐅,2022-12-06T12:14:42Z,bengals,0.0417666666666666
35324,261491,261491,creutzml,Agreed. It’s more than obvious that our o-line finally took that “next step” in their chemistry. I think a lot of different RBs would have success running behind that line at this point.,1.0,bengals,t3_zcspaz,False,0.0, Bingo Bengo Bongo 🐅,2022-12-05T14:59:12Z,bengals,0.2007518518518518
35325,261492,261492,creutzml,both plays were against Reid… I think that alone should give him back to back Angry Run’s haha,1.0,bengals,t3_zcspaz,False,0.0, Bingo Bengo Bongo 🐅,2022-12-05T12:21:55Z,bengals,-0.0772
35326,261493,261493,creutzml,"… oh, no doubt. I’m not saying that as a negative. It always felt to me like Baker’s wife was doing a nice job helping him capitalize on every opportunity that being in the NFL has allowed him.",8.0,nfl,t3_zda7y7,False,0.0,:Bengals: Bengals,2022-12-05T11:57:48Z,bengals,0.2306259259259259
35327,261495,261495,creutzml,The Bash Brother special,2.0,nfl,t3_zcmu1g,False,0.0,:Bengals: Bengals,2022-12-05T10:57:54Z,bengals,0.4019
35328,261497,261497,creutzml,"I get your point, but Brady definitely had his mainstays that he needed for success: Edelman and Gronk come to mind the quickest",4.0,bengals,t3_zd9iq2,False,0.0, Bingo Bengo Bongo 🐅,2022-12-05T10:50:56Z,bengals,0.8625
35329,261498,261498,creutzml,"A damn good BOOT from Chrisman, too. Seemed to have great hang time and still barely inside the 20",7.0,nfl,t3_zcs1a3,False,0.0,:Bengals: Bengals,2022-12-04T19:18:22Z,bengals,0.32535
35330,261500,261500,creutzml,Knew it. Still had to click it lol,1.0,bengals,t3_zbj5gx,False,0.0, Bingo Bengo Bongo 🐅,2022-12-04T09:29:44Z,bengals,0.21075
35331,261502,261502,creutzml,"Agreed. And Perine has proven more than capable in Joe’s absence, especially with Williams having some great touches as a secondary back.",9.0,bengals,t3_zc0sd3,False,0.0, Bingo Bengo Bongo 🐅,2022-12-04T09:26:57Z,bengals,0.46295
35332,261503,261503,creutzml,Can't wait to see Reid sent to the Shadow Realm this Sunday :),1.0,bengals,t3_z9xkoq,False,0.0, Bingo Bengo Bongo 🐅,2022-12-02T15:57:03Z,bengals,0.4588
36168,263237,263237,datdudebdub,"Why? Do you not remember Mixon's last game with 211 yards and 5 TDs, arguably the greatest single performance by a Bengals running back ever? The following week he already had 62 total yards before being knocked out of the game midway through the second quarter. 

Once our OL started to gel, so did Mixon. Perine has certainly played himself into the rotation but those asking for Mixon to lose his job are being silly.",34.0,bengals,t3_zfdfam,False,0.0, ,2022-12-07T15:20:38Z,bengals,-0.04920976
36169,263238,263238,datdudebdub,"Oh stop it, we've been among the top spenders in the NFL for several years now. We gave Carson Palmer the biggest contract at the time in NFL history. 

This narrative is so old its got an AARP card.",13.0,bengals,t3_zf1bww,False,0.0, ,2022-12-07T11:24:26Z,bengals,-0.0038037037037037
36170,263239,263239,datdudebdub,"> I didn't say it would make me happy. I said it might be something for Burrow to consider, as many great QBs before him have considered.

You want a better product on the field for your own selfish reasons. Lets not pretend you are free of bias

> My job doesn't have a salary cap. So... your point here is irrelevant.

Sorry that I assumed an adult had the ability to consider a hypothetical

> As for abolishing the cap

I didn't say anything about abolishing the cap? Just that the cap isn't Burrow's problem.

I think you are confused on my overall messaging. I'm saying Burrow is allowed to do what he wants and we, as fans, should pass zero judgement on what decisions he makes. We are not him, we do not know him or his life. To act like he should take less $$ because Brady did is complete fucking nonsense.",-7.0,bengals,t3_zf1bww,False,0.0, ,2022-12-07T10:51:09Z,bengals,-0.0115014901876652
36171,263241,263241,datdudebdub,"I'm not pretending anything. But insinuating that a grown man who is entitled to X should take less than X because it would make you happy is fucking stupid. You wouldn't take less money from your company so they could pay more to Bob in accounting would you? Why do you expect someone else to?

Also, while I'm at it, fuck the salary cap too. It's not Joe's job to figure that out, its the organization's. I refuse to judge another grown man for being paid their worth regardless of context. Its completely ridiculous",-7.0,bengals,t3_zf1bww,False,0.0, ,2022-12-07T10:20:44Z,bengals,-0.0538516084313392
36172,263242,263242,datdudebdub,"This is such a dumb take that people spew on here all the time.

Joe has singlehandedly changed everything about this franchise, and by extension, he's singlehandedly turned a city that has always been a baseball town into a HUGE football city with one of the most passionate fanbases going. 

Joe is entitled to every single penny he gets and if he wants to be the highest-paid quarterback ever he will be. He deserves it. 

It's on the front office to put a competent team around your players, not on the players to take less money to bail out an organization that can't draft and develop and instead has to throw big cash at free agents.",-7.0,bengals,t3_zf1bww,False,0.0, ,2022-12-07T10:05:26Z,bengals,0.139419808
36173,263244,263244,datdudebdub,"Cincinnati will burn Paycor to the ground if they don't keep Joe.

Book it right now, the Bengals are handing Joe Burrow a blank check and telling him to write whatever number keeps him in stripes for life.",24.0,bengals,t3_zf1bww,False,0.0, ,2022-12-07T09:25:02Z,bengals,0.0386
36174,263245,263245,datdudebdub,"Tee may want the chance to play outside the shadow of a true #1 just like Marvin Jones did. If he does, we can't blame him. He deserves that opportunity if that is what he wants",8.0,bengals,t3_zf1bww,False,0.0, ,2022-12-07T09:24:22Z,bengals,0.2003296296296296
36175,263247,263247,datdudebdub,"Flacco postseason win % was 66%, Ben's was 56%

Flacco is elite.",4.0,nfl,t3_zejdzx,False,0.0,:Bengals: Bengals,2022-12-06T16:07:22Z,bengals,0.5859
36176,263249,263249,datdudebdub,"I don't give a fuck about analyst praise, half of them don't know what they are talking about and the other half just spew corporate pre-determined lines for clicks/views 

What I care about is winning. And buddy it feels **good**",37.0,bengals,t3_zeibsp,False,0.0, ,2022-12-06T15:37:16Z,bengals,0.45005
36177,263252,263252,datdudebdub,He played in NY and LA. That's about it.,0.0,nfl,t3_zefl7r,False,0.0,:Bengals: Bengals,2022-12-06T13:29:46Z,bengals,0.085
36178,263262,263262,datdudebdub,"Mixon had 211 scrimmage yards and 5 touchdowns his last healthy game.

They'll be splitting work.",7.0,nfl,t3_zdcriu,False,0.0,:Bengals: Bengals,2022-12-05T11:46:50Z,bengals,0.100475
36179,263263,263263,datdudebdub,"The cop-out but also accurate answer is whoever Zac thinks it should be. He fought to get Lou on the staff and I hated it, time has shown that I'm just a fucking idiot. Gotta trust Zac can get his guy.",55.0,bengals,t3_zdcx7e,False,0.0, ,2022-12-05T11:19:11Z,bengals,0.0726777777777777
36180,263264,263264,datdudebdub,"I agree they should split. Perine has been really solid for us.

BUT I've been seeing a lot of people saying to bench Mixon (not you, specifically) who are forgetting the last game he played just so happened to be one of the best running back performances in the history of football.",3.0,bengals,t3_zdbwgx,False,0.0, ,2022-12-05T11:15:01Z,bengals,0.3290111111111111
36181,263265,263265,datdudebdub,"Sat in the stands to get soaked to the bone in the rain for that game.

I'll never, ever forget it. Every time something good happens that game creeps into the back of my mind, constantly reminding me to not get my hopes up. 

But with Joe? I feel like I'm finally confident in saying that we're not the same old Bengals anymore.",7.0,bengals,t3_zd85dx,False,0.0, ,2022-12-05T10:23:46Z,bengals,0.139592
36182,263266,263266,datdudebdub,"It's absurd how we can beat literally every team in the NFL and can't beat the Browns. Not trying to throw shade, it just legitimately makes no sense.",32.0,nfl,t3_zcqy4g,False,0.0,:Bengals: Bengals,2022-12-05T09:47:59Z,bengals,-0.148
36183,263271,263271,datdudebdub,"No he isn’t. Passer rating 11 points lower, more INTs through 12 games than he had in 16, lower TD% and higher INT%, 5% lower completion percentage, significant drop in ANY/A

Sure, more pressure or whatever. But you have to rise above it. He’s down in most of the significant throwing categories.",1.0,nfl,t3_za4gx2,False,0.0,:Bengals: Bengals,2022-12-03T09:26:15Z,bengals,0.05369375
36604,266831,266831,dotdee,"TB dropped a dime when he was wide open for a TD. -4 points. We didn’t get a 4th and inch, which might have been a TD, but at least 3. 

I say that to say, the score isn’t exactly indicative of how well the offense drove the ball.",2.0,nfl,t3_ze7lsv,False,0.0,:Bengals: Bengals,2022-12-06T08:52:59Z,bengals,0.00645
37751,285273,285273,heading4homer,Sounds like he's been watching the World Cup,14.0,nfl,t3_zduz76,False,0.0,:Bengals: Bengals,2022-12-06T11:23:13Z,bengals,0.3612
37752,285274,285274,heading4homer,"I actually thought Bengal's fucked themselves with all the mistakes they made. Drop interception, long drive with 0 points, terrible 4th down play, and TB dropped TD. Good game.",13.0,nfl,t3_zcld40,False,0.0,:Bengals: Bengals,2022-12-04T19:39:22Z,bengals,0.0709111111111111
37753,285275,285275,heading4homer,Love you boo,1.0,nfl,t3_zcqy4g,False,0.0,:Bengals: Bengals,2022-12-04T19:30:52Z,bengals,0.6369
37754,285276,285276,heading4homer,Hopefully next week. Won't be surprised at all if we go down to them though.,47.0,nfl,t3_zcqy4g,False,0.0,:Bengals: Bengals,2022-12-04T19:25:25Z,bengals,0.0157249999999999
38177,290590,290590,idontcare111,1 PM is a great time for kickoff. Envious of the central time zone with the noon kickoffs.,1.0,nfl,t3_zf48ac,False,0.0,:Bengals: Bengals,2022-12-07T22:28:32Z,bengals,0.019625
38178,290596,290596,idontcare111,Dalton could maybe win a playoff game with the 49ers.,1.0,nfl,t3_zdpyj0,False,0.0,:Bengals: Bengals,2022-12-05T21:05:36Z,bengals,0.5859
38179,290599,290599,idontcare111,No that’s impossible! They just keep getting lucky with these fluke wins.,3.0,nfl,t3_zcqy4g,False,0.0,:Bengals: Bengals,2022-12-05T11:34:44Z,bengals,0.289075
38180,290600,290600,idontcare111,My favorite argument I witnessed was that we have better skill players but aren’t the better team despite winning 3 in a row.,3.0,nfl,t3_zcqy4g,False,0.0,:Bengals: Bengals,2022-12-05T11:33:00Z,bengals,0.3369
38181,290601,290601,idontcare111,Yeah we all have them.,2.0,nfl,t3_zcqy4g,False,0.0,:Bengals: Bengals,2022-12-05T11:25:43Z,bengals,0.296
38182,290602,290602,idontcare111,Last year was so funny for this. In total I believe we won 7 Super Bowls last year. Too bad we lost the actual one or we could have gotten the unironic “this is their Super Bowl”,9.0,nfl,t3_zcqy4g,False,0.0,:Bengals: Bengals,2022-12-05T11:20:17Z,bengals,0.0373518518518518
38183,290603,290603,idontcare111,"Dalton to Bengals fans is like a dude being friend zoned. 

“He’s a nice guy but…”",5.0,nfl,t3_zcqy4g,False,0.0,:Bengals: Bengals,2022-12-05T11:12:40Z,bengals,0.3834499999999999
38184,290605,290605,idontcare111,The rare L formation,28.0,nfl,t3_zcrnkp,False,0.0,:Bengals: Bengals,2022-12-04T22:32:05Z,bengals,0.5766
38185,290606,290606,idontcare111,"No matter how, 54 points is fucking nuts.",7.0,nfl,t3_zcrnkp,False,0.0,:Bengals: Bengals,2022-12-04T22:26:55Z,bengals,-0.3954
38186,290607,290607,idontcare111,A 12-5 Cowboys team is really about to go to 8-9 TB and lose to Brady in some grand fashion.,10.0,nfl,t3_zcrnkp,False,0.0,:Bengals: Bengals,2022-12-04T22:25:44Z,bengals,0.0772
