,Unnamed: 0.1,Unnamed: 0,author,body,score,subreddit,link_id,over_18,controversiality,author_flair_text,created_utc,flair,sentiment
18,995,995,0ZNEB,"Carmen Electra, Jerry Springer, George Clooney are the ones I know off the top.",62.0,bengals,t3_zfo5fd,False,0.0, ,2022-12-07T21:59:51Z,bengals,0.2023
19,998,998,0ZNEB,"Holy fucking shit can y’all not tell what a fucking audible is?!?? 

Seriously this subs IQ on football is fucking pathetic.",8.0,bengals,t3_zckj53,False,0.0, ,2022-12-04T16:44:04Z,bengals,-0.5183500000000001
782,8114,8114,AllGenreBuffaloClub,"Burrow put up the greatest QB season in cfb history in the hardest conference. His ceiling is MVP and Champion, he has shown as such already",11.0,nfl,t3_zf1eji,False,0.0,:Bengals: Bengals,2022-12-07T11:42:10Z,bengals,0.458925
783,8115,8115,AllGenreBuffaloClub,"I mean if we’re talking accolades, Herbert has achieved only 1 thing Burrow didn’t and that’s OROY.
Otherwise Burrow is stacked with winning everything else that matters.",34.0,nfl,t3_zf1eji,False,0.0,:Bengals: Bengals,2022-12-07T10:38:43Z,bengals,0.27115
784,8120,8120,AllGenreBuffaloClub,So what’s your Record during that stretch if you don’t have Dalvin cook or JJets for most of it? The Bengals are deep and they’re playing to their potential. Which is Super Bowl contender.,1.0,nfl,t3_ze70ne,False,0.0,:Bengals: Bengals,2022-12-06T09:19:56Z,bengals,0.2423777777777777
785,8122,8122,AllGenreBuffaloClub,"A Joe Burrow team getting some serious momentum in the back half of the year, we have seen this one more than once",19.0,nfl,t3_ze70ne,False,0.0,:Bengals: Bengals,2022-12-06T08:03:23Z,bengals,-0.0772
786,8126,8126,AllGenreBuffaloClub,"I fully expect the chiefs to win those games, but I would be surprised if Mahomes has pedestrian numbers.
The only way Burrow wins MVP is if the Bengals win out and can claim #1 seed while playing this mistake free efficient football.",6.0,nfl,t3_zdh4xf,False,0.0,:Bengals: Bengals,2022-12-05T14:14:50Z,bengals,0.601075
787,8128,8128,AllGenreBuffaloClub,People just bitched about JuJu’s social media. It’s wild what people bitch about.,3.0,nfl,t3_zcld40,False,0.0,:Bengals: Bengals,2022-12-04T15:45:05Z,bengals,-0.4323
788,8133,8133,AllGenreBuffaloClub,I love that quantum leap vibe.,3.0,bengals,t3_zblodh,False,0.0, Ryan Finley shaped our destiny.,2022-12-03T14:23:45Z,bengals,0.6369
1216,10645,10645,AngryTurtleGaming,"Same. Typically taunting penalties get on my nerves, but  this one made me smile.",11.0,bengals,t3_zcnr6y,False,0.0, ,2022-12-04T23:16:05Z,bengals,0.2339
1217,10647,10647,AngryTurtleGaming,Now we have a coach like Zac who actually yells at his guys not to do that. It’s certainly refreshing especially with a young team.,7.0,bengals,t3_zcnr6y,False,0.0, ,2022-12-04T20:49:47Z,bengals,0.2603
1218,10649,10649,AngryTurtleGaming,"Honestly. I don’t mind the taunting penalty against him. Love the energy.

Edit: obviously I don’t like giving the Chiefs extra yardage, but Reid talked smack and got smacked.",142.0,bengals,t3_zcnr6y,False,0.0, ,2022-12-04T16:29:24Z,bengals,0.1287109375
1219,10654,10654,AngryTurtleGaming,"I thought he was after the 2017 super bowl, but I feel like everyone else acknowledged him as such after the 2021 SB. He didn’t have Belichick (which I never held against him).",1.0,nfl,t3_zbzumd,False,0.0,:Bengals: Bengals,2022-12-04T01:09:31Z,bengals,0.1727
1220,10658,10658,AngryTurtleGaming,Because he’s playing good ol’ Steelers football!,122.0,bengals,t3_zbx9a9,False,0.0, ,2022-12-03T20:15:15Z,bengals,0.6114
1402,17295,17295,BarleyBo,And Jessie Bates having a cramp while 12 men were on the field,8.0,bengals,t3_zdpywt,False,0.0, ,2022-12-05T19:18:25Z,bengals,-0.2023
1403,17299,17299,BarleyBo,I cut mine before the game… I should do that from now on,1.0,bengals,t3_zcr1af,False,0.0, ,2022-12-04T18:42:35Z,bengals,-0.2732
1404,17301,17301,BarleyBo,I kind of like that Romo had to watch Cincinnati win 3 times in a row,138.0,bengals,t3_zcr1af,False,0.0, ,2022-12-04T18:35:45Z,bengals,0.719
1405,17304,17304,BarleyBo,It’s all good.,1.0,bengals,t3_zckj53,False,0.0, ,2022-12-04T18:24:34Z,bengals,0.4404
1406,17305,17305,BarleyBo,First December loss for KC in recent history,12.0,bengals,t3_zckj53,False,0.0, ,2022-12-04T18:23:15Z,bengals,-0.3182
1407,17307,17307,BarleyBo,Worst case we go up 7,-3.0,bengals,t3_zckj53,False,0.0, ,2022-12-04T18:18:54Z,bengals,-0.6249
1408,17311,17311,BarleyBo,Or a chop block,1.0,bengals,t3_zckj53,False,0.0, ,2022-12-04T17:04:48Z,bengals,-0.4404
1409,17312,17312,BarleyBo,Vonn Bell Pick Six please,4.0,bengals,t3_zckj53,False,0.0, ,2022-12-04T16:18:35Z,bengals,0.3182
1410,17313,17313,BarleyBo,Missed field goal?,2.0,bengals,t3_zckj53,False,0.0, ,2022-12-04T14:59:27Z,bengals,-0.296
1411,17315,17315,BarleyBo,Bengals haven’t lost to KC at home since 1984. KC hasn’t lost in December since before 2019. I think the home game win streak survives between the two.,3.0,bengals,t3_zckj53,False,0.0, ,2022-12-04T14:28:41Z,bengals,0.1481592592592592
1412,17316,17316,BarleyBo,"Yep, I’m no Dr. but saw Lamar walking on the sidelines and thought he would be good. I was wrong",1.0,bengals,t3_zcisfy,False,0.0, ,2022-12-04T14:26:29Z,bengals,-0.090175
1413,17317,17317,BarleyBo,Montgomery Inn? That’s worse than being slimed,3.0,bengals,t3_zcjdwx,False,0.0, ,2022-12-04T14:20:39Z,bengals,-0.23835
1414,17318,17318,BarleyBo,Now Jackson is ruled out. Bizarre because between the two I’d though Lamar would be back in and Trevor out.,9.0,bengals,t3_zcisfy,False,0.0, ,2022-12-04T14:06:33Z,bengals,-0.1591
1415,17319,17319,BarleyBo,"I hope this post does not come off as me rooting for injuries, that’s not what I intended. I was just hoping someone could quickly post a video so we could see what happened.",32.0,bengals,t3_zcisfy,False,0.0, ,2022-12-04T14:03:16Z,bengals,0.3208499999999999
1416,17320,17320,BarleyBo,Thanks for the reply. Looks like he will be fine.,4.0,bengals,t3_zcisfy,False,0.0, ,2022-12-04T13:23:28Z,bengals,0.3654
1417,17321,17321,BarleyBo,He looks like someone who hasn’t played for over 700 days.,1.0,bengals,t3_zci801,False,0.0, ,2022-12-04T13:01:50Z,bengals,0.5994
1418,17323,17323,BarleyBo,"From what I read, it was pre-teens and some was his own home made content. I liked Jon Kitna and had a few run ins with him when he played here. Jon was always cool when I meet him. But his son can rot in jail. Disgusting person.",3.0,bengals,t3_zch8fc,False,0.0, ,2022-12-04T12:32:45Z,bengals,-0.1017753599999999
1419,17324,17324,BarleyBo,Yes.,1.0,bengals,t3_zch8fc,False,0.0, ,2022-12-04T12:25:44Z,bengals,0.4019
1420,17326,17326,BarleyBo,It would be cool to see Vonn get a pick six while wearing his Pick Six cleats,2.0,bengals,t3_zcg0l6,False,0.0, ,2022-12-04T11:56:29Z,bengals,0.3182
1421,17327,17327,BarleyBo,"KC hasn’t won in Cincinnati since 1984. 

A streak is being broken today, and I think it’s this December win streak that ends.",14.0,bengals,t3_zc9hwi,False,0.0, ,2022-12-04T11:32:05Z,bengals,0.231925
1422,17330,17330,BarleyBo,"If serious there’s one at Findlay market and the other is at 3313 Riverside Dr, Cincinnati, OH 45226",1.0,bengals,t3_zaqfap,False,0.0, ,2022-12-02T21:53:13Z,bengals,-0.0772
1810,18683,18683,BeerNinja17,"Check those names watsonte listed again. Aside from Palmer, they’re all 2nd rounders or later. So, I guess you’re correct that drafting them was something “anyone could have done” considering literally every team passed on them….but they didn’t. The Bengals did after they hired Tobin in 1999. Because Brown wanted to win and realized he needed someone more competent than himself.

Tobin + Marvin equaled a culture change and respectability. Tobin + ZT has equaled a real shot at the title.",2.0,bengals,t3_zd5o40,False,0.0, Kiss the baby,2022-12-06T00:27:57Z,bengals,0.012935860058309
1811,18684,18684,BeerNinja17,"Pittsburgh can definitely beat them. Don’t they usually split their series? I feel like it’s one of those rivalries where record doesn’t matter.

Plus, aren’t the Steelers delusional in thinking they have a shot at the playoffs still? Which is fine by me. Keep that draft pick number going up.",1.0,bengals,t3_zd9uhd,False,0.0, Kiss the baby,2022-12-05T14:07:37Z,bengals,0.0187893239883401
1812,18685,18685,BeerNinja17,"True, but that switch ended the Colts as part of the big three",1.0,bengals,t3_zcqxio,False,0.0, Kiss the baby,2022-12-05T12:35:56Z,bengals,0.2263
1813,18686,18686,BeerNinja17,Pretty even trifecta if you ask me!,1.0,bengals,t3_zcu0ad,False,0.0, Kiss the baby,2022-12-05T07:34:42Z,bengals,0.5411
1814,18688,18688,BeerNinja17,"True, I just meant as a top three. I definitely rooted for the Colts in those AFC championship games.",2.0,bengals,t3_zcqxio,False,0.0, Kiss the baby,2022-12-04T21:49:29Z,bengals,0.47975
1815,18689,18689,BeerNinja17,Bengals/Bills/Chiefs is so much better than Patriots/Colts/Steelers,124.0,bengals,t3_zcqxio,False,0.0, Kiss the baby,2022-12-04T18:36:54Z,bengals,0.4902
1816,18690,18690,BeerNinja17,Chase is amazing. That is all,9.0,bengals,t3_zckj53,False,0.0, Kiss the baby,2022-12-04T16:37:51Z,bengals,0.146475
1817,18691,18691,BeerNinja17,Hard to do so with Mahomes,2.0,bengals,t3_zckj53,False,0.0, Kiss the baby,2022-12-04T16:24:15Z,bengals,-0.1027
1818,18693,18693,BeerNinja17,No need to wonder. Just look at his 2019 stats when he was the WR1.,35.0,bengals,t3_zbkgtj,False,0.0, Kiss the baby,2022-12-03T10:48:42Z,bengals,-0.074
1819,18695,18695,BeerNinja17,Same. Not surprised though. Late game with the Chargers existing? Gotta take a BITE outta the NFL.,1.0,bengals,t3_za1277,False,0.0, Kiss the baby,2022-12-02T07:35:09Z,bengals,-0.0026484375
2133,22205,22205,Bigpotatozzzz,Bengals against Steelers that was like the easiest win we could’ve gotten,2.0,nfl,t3_zbkrjh,False,0.0,:Bengals: Bengals :Lions: Lions,2022-12-03T14:08:48Z,bengals,0.8442
2678,24233,24233,BrandieBassen,Clint Boling was decent as well,11.0,bengals,t3_zd6ybh,False,0.0,B,2022-12-05T12:28:28Z,bengals,0.2732
2679,24235,24235,BrandieBassen,"I swear the Chiefs fans in the gamethread almost takes the cake as most salty fan base, and I participated in all the Bengals - Steeles gamethreads from 2014 to 2016",69.0,nfl,t3_zcqy4g,False,0.0,:Bengals: Bengals :Bengals: Bengals,2022-12-04T19:05:55Z,bengals,0.3353
2680,24236,24236,BrandieBassen,Definetly number 2. Or Joe was so cool it created an AoE freeze to any opponent,8.0,nfl,t3_zcqxlw,False,0.0,:Bengals: Bengals :Bengals: Bengals,2022-12-04T18:37:02Z,bengals,0.3521499999999999
2681,24237,24237,BrandieBassen,"They sucked big time in the early season, but now the interior is playing really well. The tackles are still an issue though if you have a speedy edge rusher",298.0,nfl,t3_zcr1fc,False,0.0,:Bengals: Bengals :Bengals: Bengals,2022-12-04T18:32:00Z,bengals,0.127225
2682,24238,24238,BrandieBassen,Gawd damn almighty. That last throw with the defensive line right in his face,118.0,bengals,t3_zcr1af,False,0.0,B,2022-12-04T18:29:15Z,bengals,-0.087575
2683,24239,24239,BrandieBassen,These Chief fans funny as hell. How you gonna blame the reffs for an objective foul like ineligible man down field lol,10.0,nfl,t3_zcld40,False,0.0,:Bengals: Bengals :Bengals: Bengals,2022-12-04T16:10:25Z,bengals,0.119725
2684,24240,24240,BrandieBassen,"Trying to play tough, physical football is just not the way to beat the AFC North lol",26.0,bengals,t3_zbx9a9,False,0.0,B,2022-12-04T04:07:05Z,bengals,0.5719
3222,27964,27964,CNJ339,For home-field advantage. Thats it.,1.0,nfl,t3_zcld40,False,0.0,:Bengals: Bengals,2022-12-06T10:37:52Z,bengals,0.0625
3223,27967,27967,CNJ339,"The Bengals are two home wins against the Browns and Ravens away from winning the AFC North. They’re still very much trying to win the division and have a real shot of doing so. But honestly, with this Bengals team, a WC spot would be just fine. They have proven time and time again they can win anytime and anywhere. 

For me personally, I don’t care about divisional titles. I've seen the Bengals win like 7 of them in my life and they only did shit in the playoffs with one of them.",1.0,nfl,t3_zcld40,False,0.0,:Bengals: Bengals,2022-12-05T09:45:59Z,bengals,0.0840749014060356
3224,27968,27968,CNJ339,"They can still easily win the division by beating the Browns and Ravens at home. I'm not saying those games will be easy at all, but the Bengals absolutely control their own destiny right now.",1.0,nfl,t3_zcld40,False,0.0,:Bengals: Bengals,2022-12-05T09:41:51Z,bengals,0.2425749999999999
3225,27971,27971,CNJ339,"The 2013/2014 season still kills me though...record breaking year, won the division, everyone healthy, really looking like Super Bowl contenders. Only to get absolutely blown out at home by a pretty mediocre Chargers team.  

That loss ripped my heart out and I still consider it the worst loss we've ever had.",2.0,nfl,t3_zcqy4g,False,0.0,:Bengals: Bengals,2022-12-05T06:14:23Z,bengals,-0.0936555555555555
3226,27973,27973,CNJ339,"Shit man, I thought you were responding to my comment below the one you actually responded to. 

My fault.",1.0,nfl,t3_zcqy4g,False,0.0,:Bengals: Bengals,2022-12-04T19:40:17Z,bengals,-0.3403
3227,27974,27974,CNJ339,"Yeah definitely. The fan engagement and marketing team has been so much better. The team doing well has obviously helped that, but what doesn't winning help?",17.0,nfl,t3_zcqy4g,False,0.0,:Bengals: Bengals,2022-12-04T19:31:07Z,bengals,-0.1265666666666667
3228,27975,27975,CNJ339,"To be honest, the Bengals haven't been a bad organization for some time and our fans don't give them enough credit...hell from '05-'15 we went to the playoffs 7 times, only Pittsburgh, Greenbay, and New England did it more. They also won 4 AFC North titles. Sure we lost every first round game, but lets forget about that. 

Since Mike Brown has given most of the everyday decision making to Katie Blackburn the franchise has only gotten better, on and off the field. I would truly consider the Bengals a ""good"" organization now, even if you didn't think so three years ago.

Ive been a Bengal fan since 2003 and have seen more success than most franchises have seen in 30+ years.",167.0,nfl,t3_zcqy4g,False,0.0,:Bengals: Bengals,2022-12-04T18:47:19Z,bengals,0.1450769483024691
3229,27976,27976,CNJ339,"Joe Burrow is Joe Burrow.

If anything, he and Chase look like the next Montana/Rice with their chemistry and style.",34.0,nfl,t3_zcr05r,False,0.0,:Bengals: Bengals,2022-12-04T18:31:34Z,bengals,0.1806
3230,27978,27978,CNJ339,"The Chiefs have only lost 5 games in the past calendar year. 3 of them have been against the Bengals. 

Bingo Bengo.",199.0,nfl,t3_zcr05r,False,0.0,:Bengals: Bengals,2022-12-04T18:26:57Z,bengals,-0.0117851851851851
3268,28469,28469,CWG4BF,Good analysis!,158.0,nfl,t3_zec330,False,0.0,:Bengals: Bengals,2022-12-06T11:20:43Z,bengals,0.4926
3269,28473,28473,CWG4BF,"I’m case you didn’t know, ESPN analytics had the Saints win probability at 98.7% at one point. They refer to that last 1.3% percent as the “Mark Ingram factor”.",1.0,nfl,t3_zdv0jq,False,0.0,:Bengals: Bengals,2022-12-05T22:19:15Z,bengals,0.146475
3270,28474,28474,CWG4BF,"Jokes on you, the Saints purposely blew that game to tank for an even better draft pick!


….oh dear god.",702.0,nfl,t3_zdv0jq,False,0.0,:Bengals: Bengals,2022-12-05T22:18:07Z,bengals,0.4449499999999999
3271,28478,28478,CWG4BF,Zac was pissed at Ja’Marr for that taunting,61.0,nfl,t3_zcn8fk,False,0.0,:Bengals: Bengals,2022-12-04T16:02:51Z,bengals,-0.6369
3633,31560,31560,Carvedcraftedforged,"Lol, that felt like a plea for him to retire.",2.0,nfl,t3_zdpyj0,False,0.0,:Bengals: Bengals ,2022-12-05T21:28:48Z,bengals,0.6486
3634,31561,31561,Carvedcraftedforged,"I was just thinking, ""wow, can't believe Andy looks good in primetime.""",1.0,nfl,t3_zdpyj0,False,0.0,:Bengals: Bengals ,2022-12-05T21:23:43Z,bengals,0.7717
3637,31565,31565,Carvedcraftedforged,Fejedelem sounds like it would be the name of some obscure bone in your elbow or something lol.,2.0,nfl,t3_zbt3v1,False,0.0,:Bengals: Bengals ,2022-12-04T09:34:15Z,bengals,0.6486
3639,31568,31568,Carvedcraftedforged,Some of us suck dick and some of us bust our behinds.,3.0,nfl,t3_zatldd,False,0.0,:Bengals: Bengals ,2022-12-02T15:28:01Z,bengals,-0.7351
5035,37074,37074,ClintBeastwood91,"Wasn’t gonna be able to watch this week anyway, so it’s an okay week to be in Steelers country.",1.0,bengals,t3_zf8ztg,False,0.0,"Who, and i cant understate this, Dey?",2022-12-07T15:26:33Z,bengals,0.2878
5036,37075,37075,ClintBeastwood91,We were the NFL leader going into the game with some absurd percentage like 78%. This was the one off game.,1.0,bengals,t3_zda8hc,False,0.0,"Who, and i cant understate this, Dey?",2022-12-06T18:31:17Z,bengals,0.0903
5037,37076,37076,ClintBeastwood91,That line was perfection.,3.0,bengals,t3_zeeusf,False,0.0,"Who, and i cant understate this, Dey?",2022-12-06T18:26:15Z,bengals,0.5719
5038,37077,37077,ClintBeastwood91,Our queen looking like an absolute dime while talking up the Bengals. Love to see it.,4.0,bengals,t3_zeibsp,False,0.0,"Who, and i cant understate this, Dey?",2022-12-06T18:19:29Z,bengals,0.40875
5039,37078,37078,ClintBeastwood91,"Eh, we’re in exactly the same position we were in this time last year. I doubt we run the table through the rest of the year, but I also see no automatic losses either. Lamar being out means this division should be ours for the taking.",10.0,kansascitychiefs,t3_ze7vgm,False,0.0,Bengals,2022-12-06T11:59:20Z,bengals,-0.0187444444444444
5040,37079,37079,ClintBeastwood91,"We’re built for the Ravens, we just happen to be able to play other teams with mobile QBs well.",1.0,kansascitychiefs,t3_zdq0vx,False,0.0,Bengals,2022-12-06T11:06:17Z,bengals,0.5423
5041,37080,37080,ClintBeastwood91,I’m cheering for them through 3 more games. I want their defense to murder Watson and I want them to either beat or tie the Ravens.,8.0,nfl,t3_ze70ne,False,0.0,:Bengals: Bengals,2022-12-06T10:35:47Z,bengals,-0.15105
5042,37081,37081,ClintBeastwood91,"Damn, did we really get another false win against the Chiefs? Thanks ESPN and SN.",7.0,nfl,t3_ze70ne,False,0.0,:Bengals: Bengals,2022-12-06T10:01:27Z,bengals,0.2885
5043,37082,37082,ClintBeastwood91,I don’t want to see what it’s like after the Bills game. I want to imagine our friendship lives on. I feel like if we knock them out of the 1-Seed our friendship dies with it.,2.0,bengals,t3_zdgyf2,False,0.0,"Who, and i cant understate this, Dey?",2022-12-05T17:47:14Z,bengals,0.2903888888888888
5044,37083,37083,ClintBeastwood91,"Willie Anderson, Palmer, Takeo Spikes, and anyone who got a good sized contract from the Bengals in the last 20 years. The Bengals learned their lesson with Big Whit, they aren’t going to cheap out on their most important positions.",1.0,bengals,t3_zd9iq2,False,0.0,"Who, and i cant understate this, Dey?",2022-12-05T11:25:35Z,bengals,0.2459
5045,37084,37084,ClintBeastwood91,"We have historically paid our QB and WR1s top of the market contracts. Skip and Shannon don’t know anything about this organization except the name and location.

The only people I listen to when it comes to contracts are the guys who used to play here.",1.0,bengals,t3_zd9iq2,False,0.0,"Who, and i cant understate this, Dey?",2022-12-05T11:22:03Z,bengals,0.1208259259259259
5046,37085,37085,ClintBeastwood91,They act like Kelce doesn’t absolutely body people to get open as much as he does.,27.0,bengals,t3_zda8hc,False,0.0,"Who, and i cant understate this, Dey?",2022-12-05T11:20:13Z,bengals,0.3612
5047,37086,37086,ClintBeastwood91,Lions definitely won the second place competition in the Cat Bro rankings. Now meet us in the Super Bowl so we can have the Cat Bro Bowl.,1.0,nfl,t3_zcl5ro,False,0.0,:Bengals: Bengals,2022-12-05T08:32:00Z,bengals,0.48735
5048,37087,37087,ClintBeastwood91,It was a lot like the SEC noise comparison that Burrow made last year. Burrow said SEC games were louder than any NFL stadium and Chiefs took it as a personal affront to Arrowhead.,2.0,nfl,t3_zcs1a3,False,0.0,:Bengals: Bengals,2022-12-05T08:29:32Z,bengals,0.0903
5049,37088,37088,ClintBeastwood91,"Not maybe, they are the two best. TJ Watt and Micah Parsons get theirs whether they’re playing against Jonah Williams or Anthony Munoz, I don’t care what anyone says.",3.0,nfl,t3_zcr1r7,False,0.0,:Bengals: Bengals,2022-12-05T08:26:50Z,bengals,0.465425
5050,37089,37089,ClintBeastwood91,"ONCE IS LUCKY

TWICE IS A COINCIDENCE 

THREE TIMES IS A PATTERN",2.0,bengals,t3_zcqzg5,False,0.0,"Who, and i cant understate this, Dey?",2022-12-04T18:24:35Z,bengals,0.4215
5051,37090,37090,ClintBeastwood91,"Yeah, the NFL is definitely helping a bottom 5 market win over the “dynasty”.",1.0,nfl,t3_zcld40,False,0.0,:Bengals: Bengals,2022-12-04T18:19:15Z,bengals,0.872
5052,37091,37091,ClintBeastwood91,"Once is lucky, twice is a coincidence, three times is a PATTERN!",3.0,nfl,t3_zcld40,False,0.0,:Bengals: Bengals,2022-12-04T18:17:00Z,bengals,0.4753
5053,37094,37094,ClintBeastwood91,That one drop a year from TB had to be today,2.0,nfl,t3_zcld40,False,0.0,:Bengals: Bengals,2022-12-04T17:13:32Z,bengals,-0.2732
5054,37095,37095,ClintBeastwood91,Burrow switched to it. Can Can is the audible. Perine moved up to be ready for the fake.,7.0,nfl,t3_zcld40,False,0.0,:Bengals: Bengals,2022-12-04T16:45:06Z,bengals,-0.0510333333333333
5055,37096,37096,ClintBeastwood91,"Right call, but it looks like something Los may have remembered from his time here. Damn.",4.0,nfl,t3_zcld40,False,0.0,:Bengals: Bengals,2022-12-04T16:43:23Z,bengals,-0.075375
5056,37097,37097,ClintBeastwood91,We see it but the media denies our existence until we’re literally IN the Super Bowl.,30.0,nfl,t3_zcld40,False,0.0,:Bengals: Bengals,2022-12-04T15:45:47Z,bengals,0.3919
5057,37099,37099,ClintBeastwood91,I want Trey Hendrickson to take Watson’s head off next week. I wouldn’t be mad if someone from Houston did first though.,4.0,nfl,t3_zcfr0m,False,0.0,:Bengals: Bengals,2022-12-04T12:20:32Z,bengals,-0.22765
5058,37100,37100,ClintBeastwood91,"Yeah, he’s that guy back from injury. More of a finesse guy.",2.0,bengals,t3_zc6l0a,False,0.0,"Who, and i cant understate this, Dey?",2022-12-04T12:17:34Z,bengals,-0.038275
5059,37101,37101,ClintBeastwood91,THANK YOU! I HOPE YOUR TEAM DOES REALLY WELL BUT ULTIMATELY IT ISNT ENOUGH TO WIN!,6.0,kansascitychiefs,t3_zc8h9f,False,0.0,Bengals,2022-12-04T08:49:18Z,bengals,-0.101225
5060,37102,37102,ClintBeastwood91,I wish you all good fortune in the wars to come.,7.0,kansascitychiefs,t3_zc8h9f,False,0.0,Bengals,2022-12-04T08:45:40Z,bengals,0.25
5061,37103,37103,ClintBeastwood91,Dunlap has been pretty good since he left here. It’s really weird seeing him in a single digit jersey though.,5.0,bengals,t3_zbzjwv,False,0.0,"Who, and i cant understate this, Dey?",2022-12-04T04:45:49Z,bengals,0.0575249999999999
5062,37107,37107,ClintBeastwood91,"It really would be. 

I feel like Lou built our defense specifically for the Ravens offense. By extension we are more readily built for mobile QBs than other defenses. The top teams in the AFC have offenses with more mobile QBs and we have matched up well against them the last two years. 

The Eagles have the most dynamic running game in the league and really remind me of the 2019 Ravens. If we were to play them in the Super Bowl, Lou would 100% hear that song from Kill Bill before making a defensive game plan to hold them to 20 rushing yards.",33.0,bengals,t3_zbj5gx,False,0.0,"Who, and i cant understate this, Dey?",2022-12-03T11:38:27Z,bengals,0.042492103909465
5063,37110,37110,ClintBeastwood91,I feel like Chiefs fans were too before they got their HIM.,2.0,bengals,t3_z8qsm0,False,0.0,"Who, and i cant understate this, Dey?",2022-12-02T13:10:52Z,bengals,0.3612
5064,37112,37112,ClintBeastwood91,"*sees your flair*

Yeah! That guy is a bandwagoner!",4.0,nfl,t3_zabamd,False,0.0,:Bengals: Bengals,2022-12-02T09:05:55Z,bengals,0.089875
5543,39273,39273,Cnsrbstrmp,All I know is the Geno Redemption Arc better win some kind of award,3.0,nfl,t3_zd9e0r,False,0.0,:Bengals: Bengals,2022-12-05T19:39:21Z,bengals,0.8722
5921,41292,41292,CompetitiveDuck,I would say Bengals/Chiefs the teams is a bigger rivalry at this point. They legit don’t like eachother.,4.0,nfl,t3_zd92be,False,0.0,:Bengals: Bengals ,2022-12-05T12:39:46Z,bengals,0.1806
5922,41293,41293,CompetitiveDuck,He really only gets heat by the National media who probably don’t even watch the Bengals games. Fans get frustrated by his play calling (literally every fan does this) but he does a really good job of managing the clock and the culture he has built in Cincinnati is undeniable. I think it is okay to hold your coach to a high standard and he was never really on the hot seat since he just got extended.,2.0,nfl,t3_zd92be,False,0.0,:Bengals: Bengals ,2022-12-05T12:37:21Z,bengals,0.1492111111111111
5929,41308,41308,CompetitiveDuck,"Right, but the Bengals have won 3 in a throw but have all been close games. He is always a threat up until the end.",3.0,nfl,t3_zcr1fc,False,0.0,:Bengals: Bengals ,2022-12-04T20:06:59Z,bengals,-0.0826749999999999
5931,41311,41311,CompetitiveDuck,Better at pass blocking too,16.0,nfl,t3_zcr1fc,False,0.0,:Bengals: Bengals ,2022-12-04T19:36:55Z,bengals,0.0772
5932,41312,41312,CompetitiveDuck,Because you have that bad man.,9.0,nfl,t3_zcr1fc,False,0.0,:Bengals: Bengals ,2022-12-04T19:23:32Z,bengals,-0.5423
5933,41313,41313,CompetitiveDuck,And still left points on the field. Half time miss and Boyd face mask drop.,14.0,nfl,t3_zcr1fc,False,0.0,:Bengals: Bengals ,2022-12-04T19:15:26Z,bengals,-0.20095
5934,41314,41314,CompetitiveDuck,Yeah the chiefs didn’t do a whole lot minus the 2 big passes to MVS on 3rd downs.,2.0,nfl,t3_zcr1fc,False,0.0,:Bengals: Bengals ,2022-12-04T19:12:43Z,bengals,0.296
