,Unnamed: 0.1,Unnamed: 0,author,body,score,subreddit,link_id,over_18,controversiality,author_flair_text,created_utc,flair,sentiment
26372,197290,197290,TheReaver88,"""Flukey"" probably isn't the right word, but I know what you mean. These games have been exceptionally close both in score and in game narrative. On average, you'd expect each team would have at least one.

I'm gonna have fun saying we own you guys, but anyone involved knows that meeting No. 4 - whenever it is - will be another dogfight.",10.0,nfl,t3_zcr1fc,False,0.0,:Bengals: Bengals,2022-12-04T18:31:14Z,bengals,0.011384
26373,197291,197291,TheReaver88,"I'm so sad we have to play you guys with probably a good bit on the line. I'd like to just proceed to the postseason with all our tables in working order, tyvm.",45.0,nfl,t3_zcr1fc,False,0.0,:Bengals: Bengals,2022-12-04T18:29:16Z,bengals,0.4162
26374,197292,197292,TheReaver88,"One of my favorite pastas. This is what's it's felt like, honestly. ""Why do we always play our worst game against the Bengals???""

You don't.",101.0,nfl,t3_zcr1fc,False,0.0,:Bengals: Bengals,2022-12-04T18:27:51Z,bengals,-0.019025
26375,197293,197293,TheReaver88,It definitely *looks* like that. I'd love to see another angle or a comment by him. What a strange sequence.,5.0,nfl,t3_zcqxlw,False,0.0,:Bengals: Bengals,2022-12-04T18:25:15Z,bengals,0.0269222222222222
26376,197294,197294,TheReaver88,Burrow already reached the sack quota and the .exe didn't fire.,12.0,nfl,t3_zcqxlw,False,0.0,:Bengals: Bengals,2022-12-04T18:24:12Z,bengals,0.3476
26377,197296,197296,TheReaver88,"Oddly enough, that's one thing I would never expect him to screw up. Dude has really good hands... usually.",0.0,nfl,t3_zceybg,False,0.0,:Bengals: Bengals,2022-12-04T17:14:25Z,bengals,0.220675
26378,197297,197297,TheReaver88,"We do need points to win. 7 is more than 3, I think. I can double check that for you.",-1.0,nfl,t3_zceybg,False,1.0,:Bengals: Bengals,2022-12-04T16:46:38Z,bengals,0.0217
26379,197299,197299,TheReaver88,"Stop. Take the high road, please.",6.0,nfl,t3_zcld40,False,0.0,:Bengals: Bengals,2022-12-04T16:22:09Z,bengals,0.0851
26380,197300,197300,TheReaver88,don't do that. Stop starting shit.,1.0,nfl,t3_zcld40,False,0.0,:Bengals: Bengals,2022-12-04T16:21:48Z,bengals,-0.35015
26381,197302,197302,TheReaver88,"Chiefs fans bitching about the refs literally immediately after a call went their way *because the call went their way.*

You guys have a problem...",32.0,nfl,t3_zcld40,False,0.0,:Bengals: Bengals,2022-12-04T16:13:00Z,bengals,-0.26925
26382,197304,197304,TheReaver88,"It's worked for 3+ quarters in a row now, so I'm cool with it.",0.0,nfl,t3_zcld40,False,0.0,:Bengals: Bengals,2022-12-04T16:10:06Z,bengals,0.3774
26383,197306,197306,TheReaver88,"It was a soft call earlier, but don't pretend you don't know the difference.",-2.0,nfl,t3_zcld40,False,1.0,:Bengals: Bengals,2022-12-04T16:06:16Z,bengals,0.1139
26384,197307,197307,TheReaver88,I think it's valid to complain about a correct call if the rule sucks and there wasn't a reasonable way for the player to avoid it. It just feels like you got victimized.,0.0,nfl,t3_zceybg,False,0.0,:Bengals: Bengals,2022-12-04T16:02:43Z,bengals,-0.222375
26385,197324,197324,TheReaver88,I bet a guy 5 bucks in high school the Bengals would win that game. He paid up.,20.0,nfl,t3_zayf0j,False,0.0,:Bengals: Bengals,2022-12-02T18:45:13Z,bengals,0.146475
26386,197327,197327,TheReaver88,"Ok that part I didn't know. At first, I was thinking ""you guys are overreacting, we all do know how impressive a beat down that was.""

Maybe there will always be one more ridiculous bit of blowout trivia from that game...",9.0,nfl,t3_zalxcg,False,0.0,:Bengals: Bengals,2022-12-02T10:27:50Z,bengals,-0.072337037037037
26829,200386,200386,Timberrr15,Thank you very much :),1.0,nfl,t3_zceybg,False,0.0,:Bengals: Bengals,2022-12-04T18:23:39Z,bengals,0.6983
26957,206121,206121,UnitedIndividual6768,Yes,3.0,bengals,t3_zdfgnc,False,0.0, Tee Higgins #85,2022-12-05T14:55:30Z,bengals,0.4019
26958,206122,206122,UnitedIndividual6768,"That’s actually so fucking sad, imagine wishing severe injuries on another human being",2.0,bengals,t3_zdhivc,False,0.0, Tee Higgins #85,2022-12-05T14:53:29Z,bengals,-0.6258
26959,206129,206129,UnitedIndividual6768,Leaked super bowl matchup 👀,22.0,bengals,t3_zbj5gx,False,0.0, Tee Higgins #85,2022-12-03T11:18:26Z,bengals,0.3818
27572,209084,209084,Viedt,Truth!,3.0,nfl,t3_zf1eji,False,0.0,:Bengals: Bengals,2022-12-07T19:01:20Z,bengals,0.3802
28325,210727,210727,WhoDey42,"You know I really like when people talk at our team, so I encourage him to tweet at our WR’s every day! Worked last week",2.0,nfl,t3_zen3kn,False,0.0,:Bengals: Bengals,2022-12-06T18:29:14Z,bengals,0.192325
28326,210728,210728,WhoDey42,Same :(,0.0,nfl,t3_zej0ye,False,0.0,:Bengals: Bengals,2022-12-06T16:40:05Z,bengals,-0.4404
28327,210729,210729,WhoDey42,"I’m not taking anything away from y’all, you earned that ring. It’s just such a game of inches and a few bounces of the ball impact legacy so much.

Hell if Burrow wins that game his number would be retired for sure. Hopefully still will be though!",1.0,nfl,t3_zej0ye,False,0.0,:Bengals: Bengals,2022-12-06T16:39:52Z,bengals,0.12546875
28328,210731,210731,WhoDey42,"Someone do the math, best case what round would that be?",1513.0,nfl,t3_zeid8e,False,0.0,:Bengals: Bengals,2022-12-06T15:18:45Z,bengals,0.6369
28329,210732,210732,WhoDey42,"I’m not biased at all, but I mean he should be in the conversation for sure. Take out his first two weeks and he has been lights out for the most part",13.0,nfl,t3_zee067,False,0.0,:Bengals: Bengals,2022-12-06T12:37:11Z,bengals,0.129975
28330,210738,210738,WhoDey42,"I know power rankings are a little silly, but maybe the Bengals should have gone up a spot or two after beating the chiefs?",59.0,nfl,t3_ze5rks,False,0.0,:Bengals: Bengals,2022-12-06T06:46:53Z,bengals,-0.6245
28331,210739,210739,WhoDey42,"Brady is gonna sneak into the playoffs and win the NFC.

Only half kidding",200.0,nfl,t3_zduxbz,False,0.0,:Bengals: Bengals,2022-12-05T22:14:58Z,bengals,0.011025
28332,210741,210741,WhoDey42,It was time. Was one of the worst punters in the league before he got benched,88.0,nfl,t3_zdhr2s,False,0.0,:Bengals: Bengals,2022-12-05T14:04:16Z,bengals,-0.31245
28333,210742,210742,WhoDey42,End of an era. Thanks for all the years of service Kevin,21.0,nfl,t3_zdhr2s,False,0.0,:Bengals: Bengals,2022-12-05T14:03:55Z,bengals,0.2202
28334,210745,210745,WhoDey42,Y’all are so good GG man,13.0,nfl,t3_zcr2c3,False,0.0,:Bengals: Bengals,2022-12-04T19:24:20Z,bengals,0.7877
28335,210749,210749,WhoDey42,What a game! I love being relevant again!,33.0,nfl,t3_zcqbs9,False,0.0,:Bengals: Bengals,2022-12-04T17:59:37Z,bengals,0.3348
28336,210750,210750,WhoDey42,You have a Super Bowl yall are fine,4.0,nfl,t3_zcoeoc,False,0.0,:Bengals: Bengals,2022-12-04T17:15:14Z,bengals,0.6908
28337,210752,210752,WhoDey42,Thanks for the Vietnam flashbacks hahaha,25.0,nfl,t3_zcoeoc,False,0.0,:Bengals: Bengals,2022-12-04T16:48:13Z,bengals,0.7579
28338,210753,210753,WhoDey42,"Eh people are gonna do the “Zac Taylor sucks” thing, but I really think that was a great play from Dunlap",46.0,nfl,t3_zcoeoc,False,0.0,:Bengals: Bengals,2022-12-04T16:45:33Z,bengals,0.8674
28339,210755,210755,WhoDey42,Haters hate cause you payed a repeat sexual deviant so much money,11.0,nfl,t3_zciput,False,0.0,:Bengals: Bengals,2022-12-04T13:22:52Z,bengals,-0.7845
28340,210756,210756,WhoDey42,I disagree,-9.0,nfl,t3_zciput,False,0.0,:Bengals: Bengals,2022-12-04T13:19:25Z,bengals,-0.3818
28341,210757,210757,WhoDey42,He walked into the locker room and did not look easy for him :(,61.0,nfl,t3_zcho4q,False,0.0,:Bengals: Bengals,2022-12-04T12:42:28Z,bengals,-0.6492
28342,210758,210758,WhoDey42,God damn hope he is ok,3.0,nfl,t3_zcho4q,False,0.0,:Bengals: Bengals,2022-12-04T12:42:01Z,bengals,0.5423
28559,211691,211691,Whoooyumyum,"Because he’s been on the best team, how many times do people need to hear that wins aren’t a QB stat…

Kellen Moore is the winningest college QB, there’s tons of QBs that win but aren’t that talented.",34.0,nfl,t3_zejmhp,False,0.0,:Bengals: Bengals,2022-12-06T17:00:02Z,bengals,0.8957
28560,211692,211692,Whoooyumyum,"Because it’s all rigged by the media, he doesn’t deserve to be there at all",5.0,nfl,t3_zejmhp,False,1.0,:Bengals: Bengals,2022-12-06T16:25:55Z,bengals,-0.3612
28561,211718,211718,Whoooyumyum,Pratt doesn’t get enough love,14.0,bengals,t3_zcsrjv,False,0.0,:3,2022-12-04T20:04:09Z,bengals,0.6369
28562,211744,211744,Whoooyumyum,They’re the same player but people are biased because Jimmy G is handsome and Mac is a bit ugly,30.0,nfl,t3_zad966,False,0.0,:Bengals: Bengals,2022-12-02T01:41:08Z,bengals,-0.4215
28842,213373,213373,WolfChaoticz,"🫡

God speed Major Burrow",3.0,bengals,t3_zf97i8,False,0.0, 🐅 bingo bengo 🐅,2022-12-07T15:24:54Z,bengals,0.2732
28843,213375,213375,WolfChaoticz,"Luckily he’s a super athlete and will likely recovery quickly :D 

Lots of illness going around right now. Stay healthy Bengo bros",3.0,bengals,t3_zf9bln,False,0.0, 🐅 bingo bengo 🐅,2022-12-07T14:48:03Z,bengals,0.416
28844,213378,213378,WolfChaoticz,Hell yeah! Thank you! 🧡🧡,2.0,bengals,t3_zdcxwh,False,0.0, 🐅 bingo bengo 🐅,2022-12-06T11:44:19Z,bengals,0.3106851851851852
28845,213379,213379,WolfChaoticz,"I'm a Mixon fan, and nothing at all against him, but Perine has been so good, it just feels like we gotta get him involved more",49.0,bengals,t3_zdruhn,False,0.0, 🐅 bingo bengo 🐅,2022-12-05T21:28:50Z,bengals,0.8753
28846,213380,213380,WolfChaoticz,"Honestly I don’t know how it  won’t disrupt the culture if they don’t let him play more. This team is big into earning your spot and boy has Perine earned his. 

So much talent. WHO DEY!",68.0,bengals,t3_zdruhn,False,0.0, 🐅 bingo bengo 🐅,2022-12-05T21:01:14Z,bengals,0.0321269531249999
28847,213382,213382,WolfChaoticz,Kay Adams is that you? 😂 (in reference to her tweet to Uzomah),2.0,bengals,t3_zcsops,False,0.0, 🐅 bingo bengo 🐅,2022-12-05T16:57:21Z,bengals,0.2202
28848,213383,213383,WolfChaoticz,This goes so hard.,1.0,bengals,t3_zctveu,False,0.0, 🐅 bingo bengo 🐅,2022-12-05T16:52:43Z,bengals,-0.2183
28849,213384,213384,WolfChaoticz,"They have some meme LORDS over there. Top quality, hilarious stuff.",5.0,bengals,t3_zcw6a1,False,0.0, 🐅 bingo bengo 🐅,2022-12-05T16:50:15Z,bengals,0.27115
28850,213385,213385,WolfChaoticz,"Amazing. I will say, I really am glad they brought out our meme team. Y’all are great 🧡🖤",3.0,bengals,t3_zcw6a1,False,0.0, 🐅 bingo bengo 🐅,2022-12-05T16:49:02Z,bengals,0.3867
28851,213386,213386,WolfChaoticz,"Posts like this hype me up so much. Please share more if you have any. 

Great work :)",3.0,bengals,t3_zdcxwh,False,0.0, 🐅 bingo bengo 🐅,2022-12-05T16:47:06Z,bengals,0.3391
28852,213387,213387,WolfChaoticz,"I like Mahomes so I get a kick out of them. 

Sure beats some of the old ones. Like the insurance one where the guy just screams “Rodgers!”",3.0,bengals,t3_zcw0rx,False,0.0, 🐅 bingo bengo 🐅,2022-12-05T16:44:40Z,bengals,0.0991
28853,213389,213389,WolfChaoticz,"I like it. 

Fuck both of them, but I like this.",2.0,bengals,t3_zd9uhd,False,0.0, 🐅 bingo bengo 🐅,2022-12-05T16:33:40Z,bengals,0.2153
28854,213390,213390,WolfChaoticz,"I totally agree, but also think it was a blessing. I think he would have poisoned the team if he stayed. 

He’s still so salty today I can’t imagine how insufferable he was then.",10.0,bengals,t3_zdfgnc,False,0.0, 🐅 bingo bengo 🐅,2022-12-05T16:32:05Z,bengals,-0.0276592592592592
28855,213391,213391,WolfChaoticz,"I slept like I was on a cloud last night.

Cannot stop thinking about the game.",4.0,bengals,t3_zd85dx,False,0.0, 🐅 bingo bengo 🐅,2022-12-05T13:58:57Z,bengals,0.20205
28856,213392,213392,WolfChaoticz,Thank you :D,2.0,bengals,t3_zcqxio,False,0.0, 🐅 bingo bengo 🐅,2022-12-05T13:11:47Z,bengals,0.7603
28857,213393,213393,WolfChaoticz,We are happy to help! 😎,2.0,buffalobills,t3_zce54o,False,0.0,:CIN:,2022-12-04T18:55:57Z,bengals,0.4222
28858,213397,213397,WolfChaoticz,🧡🖤,1.0,bengals,t3_zckj53,False,0.0, 🐅 bingo bengo 🐅,2022-12-04T18:19:07Z,bengals,0.8555
28859,213398,213398,WolfChaoticz,I LOVE THIS TEAM SO MUCH,4.0,bengals,t3_zckj53,False,0.0, 🐅 bingo bengo 🐅,2022-12-04T18:15:58Z,bengals,0.6369
28860,213404,213404,WolfChaoticz,Miss Ocho so much.,1.0,bengals,t3_zckj53,False,0.0, 🐅 bingo bengo 🐅,2022-12-04T16:03:11Z,bengals,-0.1531
28861,213405,213405,WolfChaoticz,We will never hate chase so… ;),1.0,bengals,t3_zckj53,False,0.0, 🐅 bingo bengo 🐅,2022-12-04T16:02:22Z,bengals,0.5991
28862,213406,213406,WolfChaoticz,Sheeeeesh this is fire,2.0,bengals,t3_zby9yb,False,0.0, 🐅 bingo bengo 🐅,2022-12-04T12:23:36Z,bengals,-0.34
29049,217386,217386,ZachDey,Losers blame officials,13.0,bengals,t3_zekaz0,False,0.0, Vonn Bells Hit Stick,2022-12-06T18:17:09Z,bengals,-0.7003
29050,217389,217389,ZachDey,Idk if I can forgive the Texans for this,1.0,nfl,t3_zcl1w6,False,0.0,:Bengals: Bengals,2022-12-04T14:46:13Z,bengals,0.1779
29617,218450,218450,Zazierx,"I had to rewind to double check, But I think at that last cut back to Andy Dalton, it looked like he was crying? 

Did anyone else notice that?",4.0,nfl,t3_zdv0jq,False,0.0,:Bengals: Bengals,2022-12-05T22:20:44Z,bengals,-0.137475
29618,218451,218451,Zazierx,Was Andy crying?,1.0,nfl,t3_zdpyj0,False,0.0,:Bengals: Bengals,2022-12-05T22:17:24Z,bengals,-0.4767
29619,218453,218453,Zazierx,"I'm sorry, Andy. This isn't on you.",3.0,nfl,t3_zdpyj0,False,0.0,:Bengals: Bengals,2022-12-05T22:06:17Z,bengals,-0.0193
29620,218455,218455,Zazierx,Probably! Try it out it's actually freaking amazing. You could leave your TV on and run the vacuum in the background and RTX voice (now called broadcast) will your gpu and AI to remove it. [It's crazy.](https://youtu.be/uWUHkCgslNE),3.0,nfl,t3_zdpyj0,False,0.0,:Bengals: Bengals,2022-12-05T20:53:31Z,bengals,-0.0136128
29621,218456,218456,Zazierx,"Nvidia RTX voice is a free application that will filter out background noise...

*like the announcer and music blaring in the background* with a push of a button... 

But I guess the NFL haven't discovered such things yet.",5.0,nfl,t3_zdpyj0,False,0.0,:Bengals: Bengals,2022-12-05T20:40:52Z,bengals,0.175075
29622,218457,218457,Zazierx,"> The division looks... **AWFUL**

Lol",2.0,nfl,t3_zdpyj0,False,0.0,:Bengals: Bengals,2022-12-05T20:35:59Z,bengals,-0.2342
29623,218459,218459,Zazierx,"After Andy started growing that beard, I think he already was.",3.0,nfl,t3_zdpyj0,False,0.0,:Bengals: Bengals,2022-12-05T20:24:54Z,bengals,0.1779
29624,218460,218460,Zazierx,Dalton is a sexy sob,3.0,nfl,t3_zdpyj0,False,0.0,:Bengals: Bengals,2022-12-05T20:19:57Z,bengals,0.34
29625,218464,218464,Zazierx,Andy's last two seasons were pretty hard to watch too.,2.0,nfl,t3_zcqy4g,False,0.0,:Bengals: Bengals,2022-12-05T05:35:21Z,bengals,0.4215
29626,218466,218466,Zazierx,So this is what it feels like...,1.0,nfl,t3_zcqy4g,False,0.0,:Bengals: Bengals,2022-12-05T05:24:16Z,bengals,0.3612
29627,218467,218467,Zazierx,Not looking forward to playing them next week... But beating DeShaun Watson would be very satisfying.,4.0,kansascitychiefs,t3_zcrh1u,False,0.0,Bengals Helmet,2022-12-05T05:04:53Z,bengals,0.106975
29628,218469,218469,Zazierx,">The Chiefs schedule is a cakewalk - Broncos twice, Texans, Raiders and Seahawks.

Jesus. Other than the Raiders... Come the fuck on!",3.0,nfl,t3_zcqy4g,False,0.0,:Bengals: Bengals,2022-12-04T20:01:54Z,bengals,-0.1949333333333333
29629,218470,218470,Zazierx,Have to imagine the similar uniforms must be a little confusing.,1.0,nfl,t3_zcrnkp,False,0.0,:Bengals: Bengals,2022-12-04T19:57:40Z,bengals,-0.1548
29630,218471,218471,Zazierx,"I mean, who doesn't like fruit snacks?",12.0,kansascitychiefs,t3_zclqat,False,0.0,Bengals Helmet,2022-12-04T18:45:40Z,bengals,-0.2755
29631,218472,218472,Zazierx,"I'm getting a little tired of every game we win being called a ""statement win"", we were in the damn Superbowl last year!",22.0,nfl,t3_zcr1fc,False,0.0,:Bengals: Bengals,2022-12-04T18:42:17Z,bengals,0.5551
29632,218479,218479,Zazierx,Ah yes the well known conspiracy against the leagues favorite team.,1.0,nfl,t3_zcld40,False,0.0,:Bengals: Bengals,2022-12-04T16:10:20Z,bengals,0.5267
29633,218480,218480,Zazierx,Perhaps the Chiefs should stop doing penalties? Just spit balling,1.0,nfl,t3_zcld40,False,0.0,:Bengals: Bengals,2022-12-04T16:09:31Z,bengals,-0.074
30145,224436,224436,ask0009,I swear to god it feels like Dallas is home every fking game,7.0,nfl,t3_zcrnkp,False,0.0,:Bengals: Bengals,2022-12-04T21:41:49Z,bengals,0.5267
30146,224437,224437,ask0009,Who decided this is the Sunday night game. Fuck that gona play warzone..,13.0,nfl,t3_zceybg,False,0.0,:Bengals: Bengals,2022-12-04T18:45:40Z,bengals,-0.1366
30167,224462,224462,ask0009,"Loool, ironic",-4.0,nfl,t3_zceybg,False,0.0,:Bengals: Bengals,2022-12-04T16:49:22Z,bengals,-0.128
30168,224463,224463,ask0009,So much for the refs giving us the game. Two clear offsides not given.,-8.0,nfl,t3_zceybg,False,0.0,:Bengals: Bengals,2022-12-04T16:47:39Z,bengals,0.2759
30479,224976,224976,attackz,i just woke up from a 1.5 year coma. This comment is super confusing to me,1.0,nfl,t3_zcld40,False,0.0,:Bengals: Bengals,2022-12-04T16:52:32Z,bengals,0.2294
30480,224977,224977,attackz, I forget this every week because I keep saying it every time I see him,1.0,bengals,t3_zckj53,False,0.0, ,2022-12-04T16:43:45Z,bengals,-0.2263
30892,229332,229332,beerguy_etcetera,"To add, the NFL is designed for every game to be close. The draft, salary caps, scheduling, etc. there’s so many ways they try and ‘level the playing field’.",14.0,browns,t3_zf4cm4,False,0.0,:bengals:,2022-12-07T12:07:09Z,bengals,0.0674333333333333
30893,229336,229336,beerguy_etcetera,TEE WINNING GAMES,5.0,bengals,t3_zckj53,False,0.0,🐅,2022-12-04T18:20:51Z,bengals,0.5267
30894,229337,229337,beerguy_etcetera,Negative yards was the worst outside of an interception or fumble.,2.0,bengals,t3_zckj53,False,0.0,🐅,2022-12-04T18:19:19Z,bengals,-0.8316
30895,229338,229338,beerguy_etcetera,Play clock was going to end before 2:00.,1.0,bengals,t3_zckj53,False,0.0,🐅,2022-12-04T18:18:14Z,bengals,0.34
30896,229340,229340,beerguy_etcetera,"Yeah, and then another 48 in the second half.",3.0,bengals,t3_zckj53,False,0.0,🐅,2022-12-04T16:08:42Z,bengals,0.296
30897,229342,229342,beerguy_etcetera,"Welcome anytime, cat brother.",5.0,bengals,t3_zckj53,False,0.0,🐅,2022-12-04T15:35:03Z,bengals,0.4588
30898,229343,229343,beerguy_etcetera,The denial of having a piece of shit at the helm.,95.0,nfl,t3_zchnqu,False,0.0,:Bengals: Bengals,2022-12-04T12:42:47Z,bengals,-0.5574
30899,229348,229348,beerguy_etcetera,"Yeah, I don’t mind it. Sure, I’d like to see them utilize any form of the cats more, but the B doesn’t rile me up like the rest of this sub.",11.0,bengals,t3_zav92s,False,0.0,🐅,2022-12-02T14:38:20Z,bengals,0.4169
31152,230206,230206,befuchs,"~~the NFL~~ all of professional sports. FTFY.

Love you.",25.0,buffalobills,t3_zcqwzg,False,0.0,:CIN:,2022-12-04T21:01:13Z,bengals,0.2123
31153,230212,230212,befuchs,Beautiful champ,2.0,buffalobills,t3_zcricl,False,0.0,:CIN:,2022-12-04T18:55:57Z,bengals,0.7906
31228,231230,231230,bfofree,He’s so good and everyone knows it,29.0,nfl,t3_zdgo4i,False,0.0,:Bengals: Bengals,2022-12-05T13:31:29Z,bengals,0.4927
31229,231232,231232,bfofree,They really embraced the complaining about the refs thing,1.0,nfl,t3_zcm05v,False,0.0,:Bengals: Bengals,2022-12-04T20:42:39Z,bengals,-0.2648
31230,231233,231233,bfofree,"I’m angry because the browns, ravens and Steelers all won, but happy because deshaun looked terrible and the bengals beat the chiefs.",1.0,nfl,t3_zcm05v,False,0.0,:Bengals: Bengals,2022-12-04T20:34:40Z,bengals,0.2732
31231,231236,231236,bfofree,I hate redundancy,1.0,nfl,t3_zcl80b,False,0.0,:Bengals: Bengals,2022-12-04T19:42:16Z,bengals,-0.5719
31435,237485,237485,bluegrassgazer,That's my team 😂,226.0,nfl,t3_zcr2c3,False,0.0,:Bengals: Bengals,2022-12-04T18:45:10Z,bengals,0.4404
31436,237492,237492,bluegrassgazer,LOL oh well.,2.0,nfl,t3_x5qo88,False,0.0,:Bengals: Bengals,2022-12-04T15:05:51Z,bengals,0.6841
31910,244014,244014,busty-ruckets,worth it,6.0,nfl,t3_zcn97u,False,0.0,:Bengals: Bengals,2022-12-04T16:05:23Z,bengals,0.2263
32731,251129,251129,chewymilk02,Also it was hilarious as a one off,3.0,nfl,t3_zcr2c3,False,1.0,:Bengals: Bengals,2022-12-04T21:52:50Z,bengals,0.4019
32732,251130,251130,chewymilk02,"We’ve had a lot of super bowls this year, according to their fans",10.0,nfl,t3_zcqy4g,False,0.0,:Bengals: Bengals,2022-12-04T19:47:16Z,bengals,0.5994
32733,251131,251131,chewymilk02,"Chiefs fans do that to every team that beats them. 


They just happen to tell us that a lot more than most lmao",139.0,nfl,t3_zcqy4g,False,0.0,:Bengals: Bengals,2022-12-04T19:40:28Z,bengals,0.33295
32734,251132,251132,chewymilk02,"It was their Super Bowl, so",-6.0,nfl,t3_zcld40,False,0.0,:Bengals: Bengals,2022-12-04T18:24:44Z,bengals,0.5994
32735,251133,251133,chewymilk02,Great game,7.0,nfl,t3_zcld40,False,0.0,:Bengals: Bengals,2022-12-04T18:23:56Z,bengals,0.6249
32741,251143,251143,chewymilk02,Burrow changed the play,2.0,nfl,t3_zcld40,False,0.0,:Bengals: Bengals,2022-12-04T16:45:47Z,bengals,0.34
32742,251144,251144,chewymilk02,I think burrow changed the play there,3.0,nfl,t3_zcld40,False,0.0,:Bengals: Bengals,2022-12-04T16:43:36Z,bengals,0.34
32743,251145,251145,chewymilk02,Just qb sneak 😢,2.0,nfl,t3_zcld40,False,0.0,:Bengals: Bengals,2022-12-04T16:41:36Z,bengals,-0.4767
32744,251147,251147,chewymilk02,Lmao,1.0,nfl,t3_zcld40,False,0.0,:Bengals: Bengals,2022-12-04T16:37:04Z,bengals,0.5994
32745,251148,251148,chewymilk02,I hope they pull the kicker into the blue tent for a concussion check. That hit was SCARY 😧,1.0,nfl,t3_zcld40,False,0.0,:Bengals: Bengals,2022-12-04T16:33:29Z,bengals,-0.27685
32747,251150,251150,chewymilk02,Cue the rush of chiefs fans making the same chase push off joke lmao,3.0,nfl,t3_zcld40,False,0.0,:Bengals: Bengals,2022-12-04T16:11:33Z,bengals,0.7269
32748,251151,251151,chewymilk02,No the NFL is clearly out for the perennially bullied chiefs. Don’t worry about them being the 3rd least penalized team.,2.0,nfl,t3_zcld40,False,0.0,:Bengals: Bengals,2022-12-04T16:09:47Z,bengals,-0.35955
32749,251152,251152,chewymilk02,Goddamn refs making Mahomes overthrow his receiver on 3rd down 😡,6.0,nfl,t3_zcld40,False,1.0,:Bengals: Bengals,2022-12-04T16:08:20Z,bengals,-0.4767
32750,251153,251153,chewymilk02,Chiefs throwing hands on that kickoff. No flag though,-1.0,nfl,t3_zcld40,False,0.0,:Bengals: Bengals,2022-12-04T16:03:50Z,bengals,-0.148
32751,251154,251154,chewymilk02,Free my man Chase,1.0,nfl,t3_zcld40,False,0.0,:Bengals: Bengals,2022-12-04T16:02:32Z,bengals,0.5106
33243,252467,252467,chrisball96,"I am very interested to see his progression from game to game. Last week was rough, but as you've all noted, the Browns always play very well against the Bengals, so it'll be interesting to see if that carries over to Watson's game, too.",2.0,bengals,t3_zeybyd,False,0.0, Joe Burrow is My Hero,2022-12-07T12:27:54Z,bengals,0.55385
33244,252468,252468,chrisball96,"I think that there have been a few factors, namely the offensive line playing much better after having more time to gel since 3/5 of them were new FA signings. Also, the emergence of Perine as an every-down back has given us a big boost as well. 

Also, having Burrow always helps!",8.0,bengals,t3_zeybyd,False,0.0, Joe Burrow is My Hero,2022-12-07T12:19:35Z,bengals,0.2179888888888889
33245,252472,252472,chrisball96,"That one was as tiny as a dollhouse window, but Burrow snapped in there, and with pressure in his face no less. Such a key play.",1.0,bengals,t3_zctq32,False,0.0, Joe Burrow is My Hero,2022-12-04T20:15:30Z,bengals,-0.0001999999999999
33246,252473,252473,chrisball96,"Sweet Lou! Help us out with the defense, my man. That first half was great. Need to focus now!",6.0,bengals,t3_zckj53,False,0.0, Joe Burrow is My Hero,2022-12-04T17:04:34Z,bengals,0.048762890625
33247,252474,252474,chrisball96,The defense did great in the first half too. Excited to see what they come out with in the second.,1.0,bengals,t3_zckj53,False,0.0, Joe Burrow is My Hero,2022-12-04T16:49:04Z,bengals,0.3402
33248,252475,252475,chrisball96,Are you a bath bomb guy?,1.0,bengals,t3_zckj53,False,0.0, Joe Burrow is My Hero,2022-12-04T16:47:27Z,bengals,-0.4939
33249,252476,252476,chrisball96,Still up at halftime against a great Chiefs team. Second half adjustments coming up and we buckle down.,4.0,bengals,t3_zckj53,False,0.0, Joe Burrow is My Hero,2022-12-04T16:45:30Z,bengals,0.156225
33250,252477,252477,chrisball96,Bengals defense playing Kelce very well. That’s tough to do.,6.0,bengals,t3_zckj53,False,0.0, Joe Burrow is My Hero,2022-12-04T16:44:05Z,bengals,0.0787249999999999
33251,252478,252478,chrisball96,Wow that throw was pretty ugly,16.0,nfl,t3_zcfr0m,False,0.0,:Bengals: Bengals,2022-12-04T13:53:52Z,bengals,0.5719
33252,252479,252479,chrisball96,"Browns fans, how much time do you give Watson before you start to worry? Or are you already worrying?",8.0,nfl,t3_zcfr0m,False,0.0,:Bengals: Bengals,2022-12-04T13:29:39Z,bengals,-0.2801
33345,253050,253050,christmascumshot,Oh hell yeah,2.0,bengals,t3_zckj53,False,0.0, ,2022-12-04T15:43:29Z,bengals,-0.5267
33558,254522,254522,cincythunder,"if we don’t score this drive, this could get out of reach",4.0,bengals,t3_zckj53,False,0.0, ,2022-12-04T17:31:59Z,bengals,0.0258
33559,254524,254524,cincythunder,"if we lose, we definitely lost it ourselves",8.0,bengals,t3_zckj53,False,0.0, ,2022-12-04T17:25:05Z,bengals,-0.3182
33560,254526,254526,cincythunder,awful spot wtf that was a 1st or at least 2 and inches,3.0,bengals,t3_zckj53,False,0.0, ,2022-12-04T17:09:52Z,bengals,-0.7783
