,Unnamed: 0.1,Unnamed: 0,author,body,score,subreddit,link_id,over_18,controversiality,author_flair_text,created_utc,flair,sentiment
15567,103482,103482,JustSomeRandomClown,Can't we all stop talking about each other?,1.0,nfl,t3_zcld40,False,0.0,:Bengals: Bengals,2022-12-04T16:31:30Z,bengals,0.2235
15568,103483,103483,JustSomeRandomClown,You want to see a replay? Too bad!,4.0,nfl,t3_zcld40,False,0.0,:Bengals: Bengals,2022-12-04T16:30:20Z,bengals,-0.2731
15569,103485,103485,JustSomeRandomClown,For sure. Glad he at least had to miss the next play,1.0,nfl,t3_zcld40,False,0.0,:Bengals: Bengals,2022-12-04T16:28:49Z,bengals,0.3725
15570,103486,103486,JustSomeRandomClown,Pure comedy on those last 2 events lol,6.0,nfl,t3_zcld40,False,0.0,:Bengals: Bengals,2022-12-04T16:25:50Z,bengals,0.6486
15571,103487,103487,JustSomeRandomClown,Give him an Oscar lol,10.0,nfl,t3_zcld40,False,0.0,:Bengals: Bengals,2022-12-04T16:25:13Z,bengals,0.4215
15572,103488,103488,JustSomeRandomClown,So you complain about the complain about the circle of complaining. And now I complain about you complaining lol,1.0,nfl,t3_zcld40,False,0.0,:Bengals: Bengals,2022-12-04T16:25:05Z,bengals,-0.245275
15573,103490,103490,JustSomeRandomClown,Good play by JuJu,6.0,nfl,t3_zcld40,False,0.0,:Bengals: Bengals,2022-12-04T16:21:42Z,bengals,0.6486
15574,103493,103493,JustSomeRandomClown,How is it disingenuous? Is he not a Chief? And you act like the Chiefs as a team didn't talk a bunch of shit last year,1.0,nfl,t3_zceybg,False,0.0,:Bengals: Bengals,2022-12-04T16:11:14Z,bengals,-0.0910666666666666
15575,103494,103494,JustSomeRandomClown,Reminder that this is an NFL game and it's still super early,2.0,nfl,t3_zcld40,False,0.0,:Bengals: Bengals,2022-12-04T16:10:08Z,bengals,0.5994
15576,103495,103495,JustSomeRandomClown,"Yeah, 1 yard. I didn't see how far they were on replay",6.0,nfl,t3_zceybg,False,0.0,:Bengals: Bengals,2022-12-04T16:08:39Z,bengals,0.074
15577,103496,103496,JustSomeRandomClown,Lol,-3.0,nfl,t3_zceybg,False,1.0,:Bengals: Bengals,2022-12-04T16:07:26Z,bengals,0.4215
15578,103497,103497,JustSomeRandomClown,Since the Bengals won twice last year,2.0,nfl,t3_zceybg,False,0.0,:Bengals: Bengals,2022-12-04T16:06:52Z,bengals,0.5719
15579,103498,103498,JustSomeRandomClown,The original comment was asking why Ja'Marr did that. So I gave him some context. Sorry I didn't specify that one single guy for you. I'll make sure to account for your feelings next time,1.0,nfl,t3_zceybg,False,0.0,:Bengals: Bengals,2022-12-04T16:05:07Z,bengals,0.0759679687499999
15580,103499,103499,JustSomeRandomClown,"Yeah, it's weird how many Patriots fans were bringing him up. Like sorry not sorry y'all lol",2.0,nfl,t3_zceybg,False,0.0,:Bengals: Bengals,2022-12-04T16:03:37Z,bengals,0.0436
15581,103501,103501,JustSomeRandomClown,Well that's why Chase taunted to that one guy. Is it that hard to understand?,-1.0,nfl,t3_zceybg,False,0.0,:Bengals: Bengals,2022-12-04T16:02:10Z,bengals,0.01695
15582,103502,103502,JustSomeRandomClown,It's literally just because that dude on the Chiefs was talking shit this week,-2.0,nfl,t3_zceybg,False,1.0,:Bengals: Bengals,2022-12-04T16:01:12Z,bengals,-0.5574
15583,103503,103503,JustSomeRandomClown,Cause Chiefs were talking shit all week,-3.0,nfl,t3_zceybg,False,1.0,:Bengals: Bengals,2022-12-04T15:59:44Z,bengals,-0.5574
15584,103505,103505,JustSomeRandomClown,"Nice to know all the people who are watching the Bengals for the first time claiming Burrow gets more ""superstar"" calls than anyone. Refs are highly inconsistent",5.0,nfl,t3_zceybg,False,0.0,:Bengals: Bengals,2022-12-04T15:57:56Z,bengals,0.105375
15585,103506,103506,JustSomeRandomClown,It's so early man. Our offense will stall at some point. Good to take the points there,0.0,nfl,t3_zceybg,False,0.0,:Bengals: Bengals,2022-12-04T15:56:51Z,bengals,0.0999666666666666
15586,103507,103507,JustSomeRandomClown,"Yeah, people act like refs don't miss so many key calls for almost every team. Chiefs fans were silent on the trip but woke up on the last 2 calls lol",2.0,nfl,t3_zceybg,False,0.0,:Bengals: Bengals,2022-12-04T15:55:45Z,bengals,0.4435249999999999
15587,103508,103508,JustSomeRandomClown,Tell Cindy I love her too,3.0,nfl,t3_zceybg,False,0.0,:Bengals: Bengals,2022-12-04T15:41:02Z,bengals,0.6369
15588,103509,103509,JustSomeRandomClown,Basically.  We fucked up on the easy part of our schedule though,1.0,nfl,t3_zceybg,False,0.0,:Bengals: Bengals,2022-12-04T15:00:00Z,bengals,-0.1806
15589,103510,103510,JustSomeRandomClown,"Yeah, true. Slayton is also not that guy. Gotta put it on a platter for him.",1.0,nfl,t3_zceybg,False,0.0,:Bengals: Bengals,2022-12-04T14:58:51Z,bengals,0.0226814814814814
15590,103511,103511,JustSomeRandomClown,They all are playing the 3 worst teams in the league,1.0,nfl,t3_zceybg,False,0.0,:Bengals: Bengals,2022-12-04T14:57:35Z,bengals,-0.5106
15591,103512,103512,JustSomeRandomClown,"Yeah but we're also spoiled by the elite receivers. Also, it's a walk in TD with a decent throw",1.0,nfl,t3_zceybg,False,0.0,:Bengals: Bengals,2022-12-04T14:52:36Z,bengals,0.038275
15592,103513,103513,JustSomeRandomClown,They really gonna blame Slayton for that one? Such a shit throw,3.0,nfl,t3_zceybg,False,0.0,:Bengals: Bengals,2022-12-04T14:47:42Z,bengals,-0.3781
15593,103514,103514,JustSomeRandomClown,"Can they do it on a cold, rainy night in Stoke?",2.0,nfl,t3_zceybg,False,0.0,:Bengals: Bengals,2022-12-04T14:44:29Z,bengals,-0.0772
15594,103516,103516,JustSomeRandomClown,Fire Tennessee's Special Teams coach already,2.0,nfl,t3_zceybg,False,0.0,:Bengals: Bengals,2022-12-04T14:41:34Z,bengals,0.0772
16057,108229,108229,KreatorOfReddit,"Slow the fuck down sir, WE don't even say good things about the reds currently.... but, where else you gonna go?!",2.0,nfl,t3_zcqy4g,False,0.0,:Bengals: Bengals,2022-12-05T10:10:21Z,bengals,-0.112575
16058,108230,108230,KreatorOfReddit,"in all fairness, one of those wins was against our 3rd stringers last year, but it still pisses me off to no end we can't beat the browns....",1.0,nfl,t3_zcr1r7,False,0.0,:Bengals: Bengals,2022-12-05T09:51:09Z,bengals,-0.5499
16059,108231,108231,KreatorOfReddit,looking like the cowboys or eagles now....,1.0,nfl,t3_zcr1r7,False,0.0,:Bengals: Bengals,2022-12-05T09:49:33Z,bengals,0.3612
16119,109290,109290,Kswiss66,KC has to win one to make it a rivalry,1.0,nfl,t3_zcn97u,False,0.0,:Bengals: Bengals,2022-12-05T07:26:14Z,bengals,0.5859
16462,114424,114424,Lionheart_513,"The NFL pays for 150 rings, they go to anybody the owner wants to have them, but some teams choose to make more. The entire active roster and practice squad will basically always get rings.

I think I remember reading the Seahawks got rings for everybody, like even including custodians, team cafeteria workers, etc.",3.0,bengals,t3_zf22sn,False,0.0,#JusticeForIrwin,2022-12-07T22:30:15Z,bengals,0.1650555555555555
16463,114425,114425,Lionheart_513,"Hubbard owns the Chiefs. He always has phenomenal games against their OL, including one of the greatest DE plays of the season at the end of the AFC Championship.",2.0,bengals,t3_zf7hpr,False,0.0,#JusticeForIrwin,2022-12-07T20:13:01Z,bengals,0.4221
16464,114426,114426,Lionheart_513,"Party at our place, January 2nd 🐅🦬",-1.0,bengals,t3_zfffn1,False,0.0,#JusticeForIrwin,2022-12-07T20:06:51Z,bengals,0.4019
16465,114428,114428,Lionheart_513,The Bengals had two different unnecessary roughness penalties last year where the league chose not to fine the player in question. The league basically admitted that both of those were bullshit.,8.0,bengals,t3_zekaz0,False,0.0,#JusticeForIrwin,2022-12-06T22:04:50Z,bengals,-0.301125
16466,114429,114429,Lionheart_513,"It’s crazy because there’s people still mad about that whistle rule.

When the whistle was blown, there were no DBs able to make a play on the ball, and the ball was already like 6 inches away from Tyler‘s hands. The whistle effectively did nothing to end the play.",16.0,bengals,t3_zekaz0,False,0.0,#JusticeForIrwin,2022-12-06T22:03:45Z,bengals,0.2356407407407407
16467,114430,114430,Lionheart_513,"I actually think the most important game was that Titans game last week. I feel like that was the game where we really adapted the ""do your job"" mentality, and we went on the road to play a team who has mastered that style of football, and we beat them at their own game.

We continued all of that into this week. We just went in and did our job. There was no doubt left on the table. We didn't win off of anything remotely flukey, we were just better last night.",34.0,bengals,t3_zdgyf2,False,0.0,#JusticeForIrwin,2022-12-05T17:08:26Z,bengals,0.0003356824417009
16468,114431,114431,Lionheart_513,We have a chance to beat every AFC team on our schedule.,1.0,bengals,t3_zdb7je,False,0.0,#JusticeForIrwin,2022-12-05T16:56:21Z,bengals,0.25
16469,114432,114432,Lionheart_513,The NFLPA is really hoping the NFL starts that battle tho. They'd be foaming at the mouth over the thought of that lawsuit.,7.0,bengals,t3_zcteto,False,0.0,#JusticeForIrwin,2022-12-04T23:33:55Z,bengals,-0.081575
16470,114434,114434,Lionheart_513,"I would only root for someone to get injured if they were an absolute monster. They'd have to do something crazy like... Sexually assault 30+ women and pretty much get away with all of it? Yeah, then I'd root for that player to get injured.",2.0,bengals,t3_zcisfy,False,0.0,#JusticeForIrwin,2022-12-04T23:25:30Z,bengals,-0.071774074074074
16471,114435,114435,Lionheart_513,I've never wished injury on any player but I hope specifically Sam Hubbard does something to cause Deshaun Watson to leave the game.,3.0,bengals,t3_zcisfy,False,0.0,#JusticeForIrwin,2022-12-04T23:24:09Z,bengals,0.6388
16472,114436,114436,Lionheart_513,They had a pretty nice return later in the game but not on that kick specifically.,1.0,bengals,t3_zcnr6y,False,0.0,#JusticeForIrwin,2022-12-04T23:19:53Z,bengals,0.4588
16473,114438,114438,Lionheart_513,Top 5 make perfect sense. Commanders? Really?,1.0,bengals,t3_zco5wm,False,0.0,#JusticeForIrwin,2022-12-04T22:43:45Z,bengals,0.0248333333333333
16474,114439,114439,Lionheart_513,"Knowing this team, we’re going to give up another five to Cleveland, lose by 60, win out the rest of the season, win the Super Bowl.",4.0,bengals,t3_zcr1af,False,0.0,#JusticeForIrwin,2022-12-04T21:20:16Z,bengals,0.8689
16475,114441,114441,Lionheart_513,"Absolute W wife.

Embarrassing comments in this thread tho. Thought our fans were better than this.",9.0,bengals,t3_zcsops,False,0.0,#JusticeForIrwin,2022-12-04T20:49:46Z,bengals,0.1043777777777777
17765,123632,123632,Monkeyfeng,The latest flu or rsv wave is quite strong.,3.0,bengals,t3_zf9bln,False,0.0,:3,2022-12-07T16:29:51Z,bengals,0.2484
17766,123637,123637,Monkeyfeng,I like Perine more because he is the better blocker and he catches the ball quite well in the backfield.,5.0,bengals,t3_zdruhn,False,0.0,:3,2022-12-05T22:25:10Z,bengals,0.7778
17767,123639,123639,Monkeyfeng,Perine is possibly the strongest guy in the locker room. He supposedly bench press more than most linemen. He bench pressed 30 reps at the combine.,6.0,bengals,t3_zdg1c6,False,0.0,:3,2022-12-05T14:41:37Z,bengals,0.0163111111111111
17768,123648,123648,Monkeyfeng,Joe Cool,1.0,bengals,t3_zctq32,False,0.0,:3,2022-12-04T20:15:45Z,bengals,0.3182
17769,123650,123650,Monkeyfeng,I would keep Perine as starter because he is better pass blocker and he has better patient and vision when running.,10.0,bengals,t3_zcrt8v,False,0.0,:3,2022-12-04T19:09:32Z,bengals,0.7783
17770,123652,123652,Monkeyfeng,He audibled that terrible 4th down stop.,31.0,nfl,t3_zcr05r,False,0.0,:Bengals: Bengals,2022-12-04T18:44:57Z,bengals,-0.6486
17771,123653,123653,Monkeyfeng,:3,5.0,bengals,t3_zcr1af,False,0.0,:3,2022-12-04T18:36:18Z,bengals,0.5106
17772,123655,123655,Monkeyfeng,Tee Higbee for the win!,11.0,bengals,t3_zckj53,False,0.0,:3,2022-12-04T18:22:33Z,bengals,0.6239
17773,123656,123656,Monkeyfeng,Holy fuck,1.0,bengals,t3_zckj53,False,0.0,:3,2022-12-04T18:20:12Z,bengals,-0.5423
17774,123663,123663,Monkeyfeng,Damn boyd,3.0,bengals,t3_zckj53,False,0.0,:3,2022-12-04T17:13:00Z,bengals,-0.4019
17775,123664,123664,Monkeyfeng,I actually think Perine is better than Joe Mixon right now. He is a much better pass blocker than Mixon.,28.0,bengals,t3_zckj53,False,0.0,:3,2022-12-04T16:32:32Z,bengals,0.3303
17907,125249,125249,MrSnazzyGoose,We’ve got one here in Tampa (Clearwater) and it’s wonderful,3.0,bengals,t3_zeybyd,False,0.0,Joe Brrrr,2022-12-07T16:05:50Z,bengals,0.5719
17908,125250,125250,MrSnazzyGoose,Thank god he’s also a terrible football player so we don’t have to fake root for him,2.0,bengals,t3_zeybyd,False,0.0,Joe Brrrr,2022-12-07T16:04:24Z,bengals,-0.3818
17909,125255,125255,MrSnazzyGoose,"It’s time for us haters to repent

Praise Perine",33.0,bengals,t3_zcqr81,False,0.0,Joe Brrrr,2022-12-04T18:36:19Z,bengals,0.1027
17911,125260,125260,MrSnazzyGoose,"This might be my favorite Gif so far, what a great use of Ricky Bobby",29.0,bengals,t3_zalsfx,False,0.0,Joe Brrrr,2022-12-02T07:43:15Z,bengals,0.7964
18379,127025,127025,Nascent_Vagabond,"Every other penalty besides the RTP has been legit, cry more, it’s free after all",0.0,nfl,t3_zcld40,False,0.0,:Bengals: Bengals,2022-12-04T16:21:18Z,bengals,-0.3657
18380,127026,127026,Nascent_Vagabond,One soft penalty in our favor and the tin foil hats come out lmao,0.0,nfl,t3_zcld40,False,0.0,:Bengals: Bengals,2022-12-04T16:12:39Z,bengals,0.5574
18381,127027,127027,Nascent_Vagabond,"Jesus Christ the game is so early calm tf down doomer, I don’t feel comfortable as a bengals fan at all rn",1.0,nfl,t3_zcld40,False,0.0,:Bengals: Bengals,2022-12-04T16:10:34Z,bengals,0.8008
18382,127028,127028,Nascent_Vagabond,Cry,2.0,nfl,t3_zcld40,False,1.0,:Bengals: Bengals,2022-12-04T16:09:01Z,bengals,-0.4767
18387,127037,127037,Nascent_Vagabond,Do us all a favor and google water fowl hunting and then go touch as much grass as possible,1.0,nfl,t3_zbqtv8,False,0.0,:Bengals: Bengals,2022-12-03T16:15:51Z,bengals,0.4019
18389,127040,127040,Nascent_Vagabond,"Guys it’s cool he doesn’t even play anymore haha

Please don’t get angry…",75.0,nfl,t3_zatds9,False,0.0,:Bengals: Bengals,2022-12-02T14:25:38Z,bengals,0.8402
19003,135887,135887,OneSprinkles6720,The best way I can describe the intangible thing is that even when we're down 3 scores at half time I am still on the edge of my seat (maybe even moreso) because I know that kid has sassafras in his pipe.,13.0,nfl,t3_zf1eji,False,0.0,:Bengals: Bengals,2022-12-07T12:42:23Z,bengals,0.6369
20261,141805,141805,PhenomenalJJS,Words do not describe how much I love this man,192.0,nfl,t3_zcrzki,False,0.0,:Bengals: Bengals,2022-12-04T19:05:13Z,bengals,0.6369
20262,141807,141807,PhenomenalJJS,The predator would like that actually,61.0,nfl,t3_zchnqu,False,0.0,:Bengals: Bengals,2022-12-04T12:42:07Z,bengals,0.3612
20966,151176,151176,RacksDiciprine,God I got Office Space vibes. The scene when guy asked Michael Bolton why he didn't go by Mike.,8.0,nfl,t3_zf7wg0,False,0.0,:Bengals: Bengals,2022-12-07T16:30:06Z,bengals,0.0683
20967,151177,151177,RacksDiciprine,I watched a interview with Joe explaining that they do that to get a easy first down. But also to put it on tape so later in the year when they take shots in those situations it comes as a surprise because they have been doing QB sneaks all year. Interesting strategy,1.0,bengals,t3_zec8i6,False,0.0,18,2022-12-07T12:54:21Z,bengals,0.1938222222222222
20968,151178,151178,RacksDiciprine,It comes down to blocking for Joey. The games we've lost to the Browns they have roughed our boy up.,6.0,bengals,t3_zf2vpz,False,0.0,18,2022-12-07T11:28:18Z,bengals,-0.25455
20969,151179,151179,RacksDiciprine,Classy move. He still gets a paycheck and health insurance won't change. Glad he gets to stay around,8.0,bengals,t3_zf22sn,False,0.0,18,2022-12-07T11:26:09Z,bengals,0.1692444444444444
20970,151180,151180,RacksDiciprine,Bengal Jim or riot,45.0,bengals,t3_zf40cl,False,0.0,18,2022-12-07T11:25:04Z,bengals,-0.5574
20971,151181,151181,RacksDiciprine,Certainly Fuck the Steelers,8.0,bengals,t3_zenauv,False,0.0,18,2022-12-06T21:28:08Z,bengals,-0.2732
20972,151182,151182,RacksDiciprine,I hope the Raiders can sneak one on them. They looked good Sunday,1.0,bengals,t3_zdw619,False,0.0,18,2022-12-06T12:09:40Z,bengals,0.3303
20973,151183,151183,RacksDiciprine,Joe Burrow hurts Chiefs more than the US Government.. best line I heard all weekend,2.0,bengals,t3_zeb3qg,False,0.0,18,2022-12-06T12:08:16Z,bengals,0.2732
20974,151184,151184,RacksDiciprine,This Chiefs game was Zac's best game play calling he's ever had. Honestly felt like he didn't make a wrong call off the top of my head. 3 of Joe's 6 incompletions we're either easy touchdowns or just out of bounds but still caught it's.,47.0,bengals,t3_zec8i6,False,0.0,18,2022-12-06T12:07:26Z,bengals,0.2004
20975,151185,151185,RacksDiciprine,"The AFC North family ... 



The Ravens and Steelers are like twin brothers who constantly fight. The Bengals are the late bloomer of the family who certainly have taken their lumps and started doing right. The Browns are the adopted step child who sets the carpet on fire.",89.0,nfl,t3_zec0aw,False,0.0,:Bengals: Bengals,2022-12-06T12:03:49Z,bengals,-0.064153125
20976,151189,151189,RacksDiciprine,Good night sweet Prince,6.0,bengals,t3_zdhu0f,False,0.0,18,2022-12-05T15:55:23Z,bengals,0.7096
20977,151190,151190,RacksDiciprine,Hopefully week 17 is irrelevant for both teams and we can both just watch our backups slut it out,66.0,nfl,t3_zcqyqd,False,0.0,:Bengals: Bengals,2022-12-04T20:21:50Z,bengals,-0.2732
20978,151191,151191,RacksDiciprine,Illogically yes that's what the prophecy foretold,8.0,nfl,t3_zcr1r7,False,0.0,:Bengals: Bengals,2022-12-04T19:58:08Z,bengals,0.4019
20979,151192,151192,RacksDiciprine,Love you too bby,7.0,bengals,t3_zcrkzg,False,0.0,18,2022-12-04T18:49:55Z,bengals,0.6369
20980,151194,151194,RacksDiciprine,Wilson and Pratt both whiff on a heads up play with Mahomes fml,5.0,bengals,t3_zckj53,False,0.0,18,2022-12-04T17:26:12Z,bengals,0.34
20981,151195,151195,RacksDiciprine,C'mon Bates step up I want to love you,1.0,bengals,t3_zckj53,False,0.0,18,2022-12-04T17:23:13Z,bengals,0.6705
20982,151196,151196,RacksDiciprine,This is the best offense in the league bro they ain't doing bad keep it together,0.0,bengals,t3_zckj53,False,0.0,18,2022-12-04T17:20:59Z,bengals,0.7227
20983,151197,151197,RacksDiciprine,I also refused to spell his last name when I commented about the catch,1.0,bengals,t3_zckj53,False,0.0,18,2022-12-04T17:20:43Z,bengals,-0.296
20984,151198,151198,RacksDiciprine,Fucking pretty good coverage from Hilton god damn what a catch,11.0,bengals,t3_zckj53,False,0.0,18,2022-12-04T17:19:23Z,bengals,0.7245
20985,151199,151199,RacksDiciprine,The Mahomes dick riding continues,11.0,bengals,t3_zckj53,False,0.0,18,2022-12-04T17:17:52Z,bengals,-0.5106
20986,151200,151200,RacksDiciprine,That's what Bates isn't doing. Stop mentioning him Tony,1.0,bengals,t3_zckj53,False,0.0,18,2022-12-04T17:17:12Z,bengals,-0.148
20987,151201,151201,RacksDiciprine,I feel like I could have caught that pass for real,9.0,bengals,t3_zckj53,False,0.0,18,2022-12-04T17:13:50Z,bengals,0.3612
20988,151202,151202,RacksDiciprine,That's why we pay Higgins after this season and not Boyd,9.0,bengals,t3_zckj53,False,0.0,18,2022-12-04T17:13:03Z,bengals,-0.1027
20989,151204,151204,RacksDiciprine,Add another body to Perrines stiff arm murder list.,14.0,bengals,t3_zckj53,False,0.0,18,2022-12-04T16:32:04Z,bengals,-0.6908
20990,151205,151205,RacksDiciprine,I think it should be a felony.  personally.,4.0,bengals,t3_zckj53,False,0.0,18,2022-12-04T16:30:29Z,bengals,-0.135575
20991,151212,151212,RacksDiciprine,"It's just his lack of production. Last week for instance he had 1 tackle and 3 assists.

Edit. Week before that 1 tackle 1 assist",1.0,bengals,t3_zckj53,False,0.0,18,2022-12-04T15:55:10Z,bengals,-0.00124296875
20992,151213,151213,RacksDiciprine,Oof that's a tough one,3.0,bengals,t3_zckj53,False,0.0,18,2022-12-04T15:52:37Z,bengals,-0.128
20993,151214,151214,RacksDiciprine,Bates needs to start producing if he wants to top tier money next year. He's gone after this season if I had to guess,3.0,bengals,t3_zckj53,False,0.0,18,2022-12-04T15:45:33Z,bengals,0.050575
20994,151215,151215,RacksDiciprine,This ain't the first game we started slow. Last week Bates flat out refused to come down hill and lay some hits so I'm curious to see if he makes his presence known this week or not,1.0,bengals,t3_zckj53,False,0.0,18,2022-12-04T15:44:39Z,bengals,0.0486
20995,151217,151217,RacksDiciprine,"Somebody needs to check on that ""That's Good Sports"" guy.",7.0,bengals,t3_zcljnw,False,0.0,18,2022-12-04T15:41:06Z,bengals,0.4404
20996,151218,151218,RacksDiciprine,Our defense has been exploited  a few times by screens this year,1.0,bengals,t3_zckj53,False,0.0,18,2022-12-04T15:38:19Z,bengals,-0.3612
20997,151220,151220,RacksDiciprine,Our defense is gonna bend today but I really hope we hit Mahomes a few times. He gets away with the craziest scrambles unscathed,2.0,bengals,t3_zckj53,False,0.0,18,2022-12-04T15:36:16Z,bengals,0.14285
20998,151222,151222,RacksDiciprine,Ty,1.0,bengals,t3_zckj53,False,0.0,18,2022-12-04T15:34:55Z,bengals,0.3818
20999,151223,151223,RacksDiciprine,Oh word. Our offense hits so much different with Perrine starting.  Hope the carries are split pretty evenly when he gets back,2.0,bengals,t3_zckj53,False,0.0,18,2022-12-04T15:34:42Z,bengals,0.2145222222222222
23099,164366,164366,Sanity0004,"Wait, I actually felt like Romo was non stop praising Bengals and loving the team the second half of the game? Dude straight up was saying Taylor doesn't get enough credit.",84.0,bengals,t3_zcr1af,False,0.0, ,2022-12-04T18:45:56Z,bengals,0.170225
23100,164367,164367,Sanity0004,When your first comment gets downvoted so you just delete and repost it 🤣 it’s sure to work eventually,1.0,nfl,t3_zcfr0m,False,0.0,:Bengals: Bengals,2022-12-04T14:56:44Z,bengals,0.6705
23101,164368,164368,Sanity0004,Lol I just can’t,3.0,nfl,t3_zcfr0m,False,0.0,:Bengals: Bengals,2022-12-04T14:52:42Z,bengals,0.4215
23374,167658,167658,Sensitive_Blacksmith,Ahhh I was at this game 😊,2.0,nfl,t3_zbt3v1,False,0.0,:Bengals: Bengals :Bengals: Bengals,2022-12-03T17:08:57Z,bengals,0.7184
23871,169774,169774,ShineOn7579,"I traded Jacobs for Chase. In hindsight may have been an idiot move, but I am 5th in my 20 man league and the current Jacobs owner is 15th lmao",1.0,bengals,t3_zbpvn2,False,0.0,9,2022-12-04T18:41:16Z,bengals,0.31845
23872,169775,169775,ShineOn7579,SORRY ABOUT YOUR HOT DOGS,4.0,bengals,t3_zckj53,False,0.0,9,2022-12-04T18:24:09Z,bengals,-0.0772
23873,169776,169776,ShineOn7579,HELL YES TEE,2.0,bengals,t3_zckj53,False,0.0,9,2022-12-04T18:22:10Z,bengals,-0.4404
23874,169778,169778,ShineOn7579,Reminded me of Boyd’s Super Bowl drop,5.0,bengals,t3_zckj53,False,0.0,9,2022-12-04T17:15:25Z,bengals,0.4215
23875,169780,169780,ShineOn7579,Sadly it was a Burrow audible,2.0,bengals,t3_zckj53,False,0.0,9,2022-12-04T16:43:12Z,bengals,-0.4215
24184,187497,187497,SuperOhioBros,"Him, Bengal Jim, the Captain, or the Bengalorian would all be perfect for this. Zim also gets a nod here.",24.0,bengals,t3_zf40cl,False,0.0,:3,2022-12-07T11:57:23Z,bengals,0.142975
24853,189839,189839,THATSTHEBOTTOMLINE,"The NFL: you beat the Chiefs 3 times in a row?

Burrow: what is that hard or something?",141.0,nfl,t3_zcr1fc,False,0.0,:Bengals: Bengals :Bills: Bills,2022-12-04T18:26:54Z,bengals,-0.05135
24854,189840,189840,THATSTHEBOTTOMLINE,I will never get used to people saying the Bengals get favorable calls. It’s as surreal as the Sacramento Kings right now.,10.0,nfl,t3_zcn8fk,False,0.0,:Bengals: Bengals :Bills: Bills,2022-12-04T16:05:05Z,bengals,0.119175
25057,190776,190776,Table100,you better shut the fuck up right now young man,1.0,nfl,t3_zcld40,False,0.0,:Bengals: Bengals,2022-12-04T18:19:46Z,bengals,-0.1531
25058,190777,190777,Table100,if it makes you feel any better the browns currently own us lol,1.0,nfl,t3_zcld40,False,0.0,:Bengals: Bengals,2022-12-04T18:10:15Z,bengals,0.6908
25059,190778,190778,Table100,"it is, but i cant really complain after the ticky tacky rtp call lol.",3.0,nfl,t3_zceybg,False,0.0,:Bengals: Bengals,2022-12-04T16:02:02Z,bengals,0.7711
25060,190781,190781,Table100,ravens injury tent is stocked with a chamber pot,1.0,nfl,t3_zceybg,False,0.0,:Bengals: Bengals,2022-12-04T12:44:36Z,bengals,-0.4215
25061,190784,190784,Table100,im going all in on my fuck deshaun watsons,10.0,nfl,t3_zceybg,False,0.0,:Bengals: Bengals,2022-12-04T11:08:33Z,bengals,-0.5423
25062,190785,190785,Table100,and some of the best ever around him. iirc each of his first three rings all came from seasons where both the pats defense and special teams were top three in the league.,3.0,nfl,t3_zbzumd,False,0.0,:Bengals: Bengals,2022-12-04T08:09:10Z,bengals,0.465425
25191,192728,192728,TheBrokeBoiii,Tee Higgins is a Bengals fan and probably has a lot of memorabilia,2.0,bengals,t3_zf40cl,False,0.0,Daxton Hill DROY,2022-12-07T15:19:29Z,bengals,0.3182
26369,197266,197266,TheReaver88,That's... also not good for us.,1.0,nfl,t3_zf1eji,False,0.0,:Bengals: Bengals,2022-12-07T14:55:09Z,bengals,-0.3412
26370,197284,197284,TheReaver88,"They eat corn to get big and strong, they eat glass because it's fun.",5.0,bengals,t3_zd6ybh,False,0.0, ,2022-12-05T14:57:31Z,bengals,0.765
26371,197286,197286,TheReaver88,"I think I'm permanently done with /r/nfl game threads. It's just not an environment that facilitates anything but salt and animosity. Occasionally I watch a Bengals game with a fan of the other team, and it's... fine sometimes? But I have to hold my tongue a lot, and I *know that person*. Reddit anonymity for hundreds of fans from each side just results in a horrible, horrible time, and it tends to bring me down with it rather than generate anything fun.",12.0,bengals,t3_zda8hc,False,0.0, ,2022-12-05T11:47:28Z,bengals,-0.11151472
