,Unnamed: 0.1,Unnamed: 0,author,body,score,subreddit,link_id,over_18,controversiality,author_flair_text,created_utc,flair,sentiment
6767,60151,60151,HyKaliber,I'd be very okay if they flexed us out of primetime,1.0,colts,t3_zahmd3,False,0.0,I Hate Gus Bradley,2022-12-02T06:41:29Z,colts,0.2944
8080,70195,70195,Jdenney71,Chris I can put my finger on why that is! Our O-Line can’t block a 4 man rush and our QB is a noodle armed statue!,3.0,nfl,t3_zcrnkp,False,0.0,:Colts: Colts,2022-12-04T20:46:41Z,colts,-0.2463
8081,70197,70197,Jdenney71,I’ve always hated Dallas’ jerseys cause the colors just don’t make sense too,4.0,nfl,t3_zcrnkp,False,0.0,:Colts: Colts,2022-12-04T20:17:53Z,colts,-0.6369
8082,70198,70198,Jdenney71,Cause it’s shit,1.0,nfl,t3_zcrnkp,False,0.0,:Colts: Colts,2022-12-04T20:14:16Z,colts,-0.5574
8083,70199,70199,Jdenney71,If you don’t like unfinished tackles in the secondary you don’t like colts football,1.0,nfl,t3_zcrnkp,False,0.0,:Colts: Colts,2022-12-04T20:09:16Z,colts,0.6124
8084,70200,70200,Jdenney71,If I had a nickel for the amount of times opposing ads have brought full house pressure and we just don’t even kind of see it coming or have a quick check down to get out of it I’d have like 20 bucks. Not a lot but way too much for that fucking shit to happen 5 times a game,8.0,nfl,t3_zcrnkp,False,0.0,:Colts: Colts,2022-12-04T20:04:10Z,colts,-0.35375
8085,70201,70201,Jdenney71,Jesus fuck how many times can Ryan throw a deflected pass this season. At a certain point it ain’t the O-Lines fault anymore,2.0,nfl,t3_zcrnkp,False,0.0,:Colts: Colts,2022-12-04T20:02:02Z,colts,-0.212125
8086,70202,70202,Jdenney71,To be fair our defense is always upbeat Chris. It’s our offense that looks like a team of walking mummified corpses most of the time,20.0,nfl,t3_zcrnkp,False,0.0,:Colts: Colts,2022-12-04T19:57:19Z,colts,0.169375
8087,70203,70203,Jdenney71,Holy shit I think we remembered how to play offensive football. That was by far the best drive we’ve had all season. It’s not even close,6.0,nfl,t3_zcrnkp,False,0.0,:Colts: Colts,2022-12-04T19:50:31Z,colts,0.0471777777777777
8088,70204,70204,Jdenney71,As bad as this year has been Jonathan Taylor is still undeniably a monster,7.0,nfl,t3_zcrnkp,False,0.0,:Colts: Colts,2022-12-04T19:48:33Z,colts,-0.5423
8089,70205,70205,Jdenney71,Better red than dead,1.0,nfl,t3_zcrnkp,False,0.0,:Colts: Colts,2022-12-04T19:46:19Z,colts,-0.34
8090,70208,70208,Jdenney71,If you say you don’t like the red stripe you hate the troops and America and are a Marxist-Leninist-Stalinist-Maoist communist,20.0,nfl,t3_zcrnkp,False,0.0,:Colts: Colts,2022-12-04T19:43:11Z,colts,-0.296
8091,70209,70209,Jdenney71,Wow guess you hate the troops and America smh my head /s,1.0,nfl,t3_zcrnkp,False,0.0,:Colts: Colts,2022-12-04T19:42:16Z,colts,-0.296
8092,70211,70211,Jdenney71,We’re gonna win a late nail biter on a Chase McLaughlin 48 yd field goal. 23-21 Colts. It’s the most 2020s Colts thing that could possibly happen.,3.0,colts,t3_zcbdrn,False,0.0,A big ass pork tenderloin sandwich,2022-12-04T12:03:15Z,colts,0.0217
8505,72673,72673,Jinno,"I mean, his issue is that he’s a good coach that has consistently coached his team to late round draft licks where getting the best talent generally means accepting some risk. As such - you get the stable of characters that he’s had to coach.",6.0,nfl,t3_zechgh,False,0.0,:Colts: Colts,2022-12-06T19:55:46Z,colts,0.3695
8506,72674,72674,Jinno,Acceptance is a portion of the stages of grief. Having the full story from Andrew's side helps move people toward acceptance.,3.0,colts,t3_ze6ytd,False,0.0,Dhalsim,2022-12-06T10:33:36Z,colts,0.3274999999999999
8507,72675,72675,Jinno,"I don't know if it ""forced"" him to love football, but rather forced him to go about it in a mentally unhealthy way. The whole concept of ""the best ability is availability"" lead to a lot of Andrew's unhealthy approach to injuries, which were the biggest source this article seems to call out for making him not want to play anymore.",12.0,colts,t3_ze6ytd,False,0.0,Dhalsim,2022-12-06T10:29:41Z,colts,-0.1038499999999999
8508,72677,72677,Jinno,Rodney Thomas showing up really well for a late round flyer.,5.0,colts,t3_zdnjpy,False,0.0,Dhalsim,2022-12-06T00:23:37Z,colts,0.3384
8509,72682,72682,Jinno,"Raimann’s had like 2 extremely good games and the rest have been shaky in one way or another. He’s certainly making a case for being worthwhile to keep in the role. But that said - he’s not beyond competition. 

I still would prefer a QB in the first round, but if there are no good ones in our reach and we can’t trade up - and a great OL prospect is there - I’d take an OL prospect to compete with Raimann in a heartbeat.",3.0,colts,t3_zdi4mw,False,0.0,Dhalsim,2022-12-05T19:01:30Z,colts,0.224339453125
8510,72683,72683,Jinno,"If they can’t agree to terms and Geno’s stubborn enough to force it, I really don’t see them letting him walk and trying the market out themselves. 

*someone* will pay Geno for his performance this season. And there’s a 99% chance that Seattle will be paying him regardless of the eventual price.",0.0,colts,t3_zdgq6q,False,0.0,Dhalsim,2022-12-05T18:53:50Z,colts,0.0700111111111111
8511,72688,72688,Jinno,"I can maybe understand Kylen having a good number of snaps, given he’s generally good hands and a high completion rate, but the near complete absence I don’t really have a justification for.",1.0,colts,t3_zcqpgz,False,0.0,Dhalsim,2022-12-04T21:58:56Z,colts,0.4678
8512,72690,72690,Jinno,Hooker was injured constantly and didn’t produce while he was here.,2.0,colts,t3_zcqpgz,False,0.0,Dhalsim,2022-12-04T21:52:07Z,colts,-0.4019
8513,72691,72691,Jinno,Oh ffs,2.0,colts,t3_zcqpgz,False,0.0,Dhalsim,2022-12-04T21:48:24Z,colts,-0.5859
8514,72692,72692,Jinno,I saw hands underneath the ball between the ground and the ball. Are you blind?,1.0,colts,t3_zcqpgz,False,0.0,Dhalsim,2022-12-04T21:46:20Z,colts,-0.20095
8515,72693,72693,Jinno,"… 2 pt conversion ties the game. Why would you not go for it? Play call could have been better, but the decision to go for it wasn’t a dumb one, it’s common sense.",2.0,colts,t3_zcqpgz,False,0.0,Dhalsim,2022-12-04T21:32:19Z,colts,-0.1404999999999999
8516,72695,72695,Jinno,… did we just have a successful screen? Is that legal?,1.0,colts,t3_zcqpgz,False,0.0,Dhalsim,2022-12-04T21:25:21Z,colts,0.210475
8517,72697,72697,Jinno,"So… are teams better about hardcounts now, or was Andrew just godlike at it to induce as many false starts as he did?",7.0,colts,t3_zcqpgz,False,0.0,Dhalsim,2022-12-04T20:30:29Z,colts,0.4404
8518,72698,72698,Jinno,"Yo, who’s dick does Jim Irsay gotta suck to get refs to care about our QB’s head and neck area?",2.0,colts,t3_zcqpgz,False,0.0,Dhalsim,2022-12-04T20:22:41Z,colts,-0.4588
8519,72699,72699,Jinno,"Did kelly get hurt, why the hell is Pryor in?",6.0,colts,t3_zcqpgz,False,0.0,Dhalsim,2022-12-04T20:15:35Z,colts,-0.8402
8520,72701,72701,Jinno,… I’m not encouraged by that clip of Ngakoue struggling against their tackle… with the same fucking bull rush 3 times in a row.,7.0,colts,t3_zcqpgz,False,0.0,Dhalsim,2022-12-04T20:09:40Z,colts,-0.6007
8521,72702,72702,Jinno,It’s almost like Collinsworth doesn’t actually watch any of our tape.,3.0,colts,t3_zcqpgz,False,0.0,Dhalsim,2022-12-04T20:05:46Z,colts,0.2975
8522,72703,72703,Jinno,"Whoever finally decided to encourage Matty to use some bengay on that shoulder, thank you.",6.0,colts,t3_zcqpgz,False,0.0,Dhalsim,2022-12-04T19:53:37Z,colts,0.7003
8523,72704,72704,Jinno,Benefit of the doubt - dude may be referring to the “not a fumble” earlier in the drive.,1.0,colts,t3_zcqpgz,False,0.0,Dhalsim,2022-12-04T19:46:54Z,colts,0.128
8524,72705,72705,Jinno,Jeff should have challenged. Not doing so lead to the TD.,2.0,colts,t3_zcqpgz,False,0.0,Dhalsim,2022-12-04T19:46:03Z,colts,-0.025675
8525,72707,72707,Jinno,"Psh, we all know his favorite aspect of pokemon.",2.0,nfl,t3_zclr3k,False,0.0,:Colts: Colts,2022-12-04T18:16:05Z,colts,0.4588
8749,74702,74702,K0liver15,I want what your smoking,1.0,colts,t3_zcqpgz,False,0.0,A big ass pork tenderloin sandwich,2022-12-04T22:20:25Z,colts,0.0772
9254,83815,83815,LoudBoiDragoon,I would rather make JT our QB before we get one more washed up QB,1.0,nfl,t3_zcrnkp,False,0.0,:Colts: Colts,2022-12-04T20:47:32Z,colts,0.3885
9255,83817,83817,LoudBoiDragoon,That was weird that they didn't run. We clearly couldn't stop it,2.0,nfl,t3_zcrnkp,False,0.0,:Colts: Colts,2022-12-04T20:38:44Z,colts,0.233325
9256,83818,83818,LoudBoiDragoon,I think he's on the Vikings practice squad as of this week. Got waived after like week 3 for lost confidence,2.0,nfl,t3_zcrnkp,False,0.0,:Colts: Colts,2022-12-04T20:35:34Z,colts,0.27115
9257,83821,83821,LoudBoiDragoon,"""Can you BELIEVE they would hire a former PLAYER! Not even Peyton Manning! Ridiculous and hilarious!""",2.0,nfl,t3_zcrnkp,False,0.0,:Colts: Colts,2022-12-04T20:17:59Z,colts,0.042
9258,83822,83822,LoudBoiDragoon,"Look I get it we've had a memeable qb history but can we please talk about something else already

The lack of originality is actually killing me",5.0,nfl,t3_zcrnkp,False,0.0,:Colts: Colts,2022-12-04T20:14:33Z,colts,-0.7964
9259,83823,83823,LoudBoiDragoon,"Happy, as far as anyone can tell he just kinda chills. Going back to Stanford for a masters",5.0,nfl,t3_zcrnkp,False,0.0,:Colts: Colts,2022-12-04T20:09:27Z,colts,0.142975
9260,83825,83825,LoudBoiDragoon,Dak Prescott looks like he took the worst shot of bourbon in his life whenever he comes off the field. Mouth breathing desperate for saliva,8.0,nfl,t3_zcrnkp,False,0.0,:Colts: Colts,2022-12-04T19:59:10Z,colts,-0.25455
9261,83826,83826,LoudBoiDragoon,"He played in 1 game after being injured, and now had season ending surgery. So he's been dead then",2.0,nfl,t3_zcrnkp,False,0.0,:Colts: Colts,2022-12-04T19:41:10Z,colts,-0.35785
9262,83828,83828,LoudBoiDragoon,"Couldn't pay him what he's worth, but also Tannehill isn't as good as Hurts. Controversial I know",1.0,nfl,t3_zcfr94,False,0.0,:Colts: Colts,2022-12-04T14:28:50Z,colts,-0.293425
9263,83829,83829,LoudBoiDragoon,He'd probably do really well for you and I would just HATE it,1.0,nfl,t3_zcfr75,False,0.0,:Colts: Colts,2022-12-04T14:00:57Z,colts,-0.466
9264,83830,83830,LoudBoiDragoon,"I hear Frank Reich is available.

That'd be the irony none of us want",1.0,nfl,t3_zcfr75,False,0.0,:Colts: Colts,2022-12-04T13:58:05Z,colts,-0.05415
9265,83831,83831,LoudBoiDragoon,Every year since I've been really back into football (last 3 years) it seems like your roster is missing huge pieces all year. Vrabel is an incredible couch for that alone,1.0,nfl,t3_zcfr75,False,0.0,:Colts: Colts,2022-12-04T13:52:46Z,colts,-0.02955
9266,83832,83832,LoudBoiDragoon,"What's funny is I'm not sure anyone would even want to touch him for his public shit, but that contract will keep everyone from even opening an email from Browns GM",1.0,nfl,t3_zcfr0m,False,0.0,:Colts: Colts,2022-12-04T13:47:01Z,colts,-0.1732
9267,83833,83833,LoudBoiDragoon,10% pay for 100% of effectiveness is the kind of deal I wanna see more of,3.0,nfl,t3_zcfr0m,False,0.0,:Colts: Colts,2022-12-04T13:45:27Z,colts,-0.1027
9268,83834,83834,LoudBoiDragoon,I'll agree with that. Before was so unislnspiring that it made me want to switch to anything else,61.0,nfl,t3_zbmc4e,False,0.0,:Colts: Colts,2022-12-03T12:37:29Z,colts,0.1289
10004,85184,85184,LuckOfTheIrish3,"I think Irsay has made it loud and clear that we’re drafting a QB. I still find it odd that everyone thought this years QB class was supposed to be so good, but now it’s a dumpster fire and now next years class is better, again. And everyone expects it to hold up. 
We’re 1-2 games from a top 2-5 pick. Pull the plug. 

Pat Mahomes - #10 overall

Josh Allen - #7

Justin Herbert - #6

Tua - #5

Lamar - #32

Joey B - #1

Justin Fields - #11

You don’t have to pick #1 to get a good QB anymore. We just have to keep next years 1st, and roll with it.",14.0,colts,t3_zdryjn,False,0.0,Julian Blackmon,2022-12-05T21:11:42Z,colts,0.0090737145479956
10854,87549,87549,LuskSGV,Anthony Richardson makes Malik Willis look like a finished project,1.0,colts,t3_zdepc7,False,1.0,Bryce Young is QB1,2022-12-05T12:31:01Z,colts,0.3612
10855,87556,87556,LuskSGV,"Irsay making Ballard watch the shitty team he put together

![gif](giphy|uVOTxMagGsgXS)",20.0,colts,t3_zcqpgz,False,0.0,Bryce Young is QB1,2022-12-04T22:11:36Z,colts,-0.149575
10856,87559,87559,LuskSGV,GOOD LORD GET RID OF HIM,4.0,colts,t3_zcqpgz,False,0.0,Bryce Young is QB1,2022-12-04T22:08:12Z,colts,0.4404
10857,87560,87560,LuskSGV,Matt Ryan is putting his helmet back on 😂😂,6.0,colts,t3_zcqpgz,False,0.0,Bryce Young is QB1,2022-12-04T22:01:59Z,colts,0.7003
10858,87561,87561,LuskSGV,God bless Grover Stewart,2.0,colts,t3_zcqpgz,False,0.0,Bryce Young is QB1,2022-12-04T22:00:31Z,colts,0.5994
10859,87565,87565,LuskSGV,Where ya going Ballard?? Can't watch this shitty team you put together??????,10.0,colts,t3_zcqpgz,False,0.0,Bryce Young is QB1,2022-12-04T21:51:30Z,colts,-0.0817666666666666
10860,87566,87566,LuskSGV,It was a two point game like five minutes ago lmao,7.0,colts,t3_zcqpgz,False,0.0,Bryce Young is QB1,2022-12-04T21:48:43Z,colts,0.7506
10861,87567,87567,LuskSGV,"Alright Mo, go fuck yourself.",4.0,colts,t3_zcqpgz,False,0.0,Bryce Young is QB1,2022-12-04T21:47:15Z,colts,-0.3612
10862,87570,87570,LuskSGV,"That's honestly perfect, I want to score but not win. 

PIERCE IS A DOG!!!!",2.0,colts,t3_zcqpgz,False,0.0,Bryce Young is QB1,2022-12-04T21:28:31Z,colts,-0.0057444444444444
10863,87572,87572,LuskSGV,Parris :),1.0,colts,t3_zcqpgz,False,0.0,Bryce Young is QB1,2022-12-04T21:24:55Z,colts,0.4588
10864,87573,87573,LuskSGV,Why the hell did we EVER have Coutee returning punts,12.0,colts,t3_zcqpgz,False,0.0,Bryce Young is QB1,2022-12-04T21:15:42Z,colts,-0.6808
10865,87574,87574,LuskSGV,Why the hell you got them jolly rancher shoes on EJ,0.0,colts,t3_zcqpgz,False,0.0,Bryce Young is QB1,2022-12-04T21:10:36Z,colts,-0.3182
10866,87576,87576,LuskSGV,"Nick Cross has had a fall from grace, eh?",4.0,colts,t3_zcqpgz,False,0.0,Bryce Young is QB1,2022-12-04T21:07:42Z,colts,0.4215
10867,87577,87577,LuskSGV,Where will the Colts be draft wise with a loss tonight?,4.0,colts,t3_zcqpgz,False,0.0,Bryce Young is QB1,2022-12-04T20:53:08Z,colts,0.2023
10868,87579,87579,LuskSGV,*sigh*,5.0,colts,t3_zcqpgz,False,0.0,Bryce Young is QB1,2022-12-04T20:43:50Z,colts,0.0258
10869,87580,87580,LuskSGV,Just get a goddamn field goal. End zone is impossible I'm sure.,8.0,colts,t3_zcqpgz,False,0.0,Bryce Young is QB1,2022-12-04T20:38:45Z,colts,0.0399249999999999
10870,87581,87581,LuskSGV,KWITY SUPREMACY,8.0,colts,t3_zcqpgz,False,0.0,Bryce Young is QB1,2022-12-04T20:37:33Z,colts,0.0516
10871,87584,87584,LuskSGV,The Colts would have the #2 pick in the draft if it wasn't for Stephon Gilmore (love him to death),7.0,colts,t3_zcqpgz,False,0.0,Bryce Young is QB1,2022-12-04T20:27:49Z,colts,0.0772
10872,87585,87585,LuskSGV,GILLY COCK,8.0,colts,t3_zcqpgz,False,0.0,Bryce Young is QB1,2022-12-04T20:26:34Z,colts,-0.1531
10873,87586,87586,LuskSGV,"Dude looks like a ""Mom I threw up"" meme",5.0,colts,t3_zcqpgz,False,0.0,Bryce Young is QB1,2022-12-04T20:21:15Z,colts,0.3612
10874,87587,87587,LuskSGV,I still blame Pryor for that,23.0,colts,t3_zcqpgz,False,0.0,Bryce Young is QB1,2022-12-04T20:20:24Z,colts,-0.34
10875,87589,87589,LuskSGV,Matt Pryor waddling out there trying to find a block lol,8.0,colts,t3_zcqpgz,False,0.0,Bryce Young is QB1,2022-12-04T20:16:41Z,colts,-0.0258
10876,87590,87590,LuskSGV,Our tight ends have been surprisingly mediocre this year!,6.0,colts,t3_zcqpgz,False,0.0,Bryce Young is QB1,2022-12-04T20:16:03Z,colts,0.3595
10877,87591,87591,LuskSGV,Why the fuck is Pryor in??????,5.0,colts,t3_zcqpgz,False,0.0,Bryce Young is QB1,2022-12-04T20:14:36Z,colts,-0.16655
10878,87593,87593,LuskSGV,"Offense shows up, defense shits the bed.",6.0,colts,t3_zcqpgz,False,0.0,Bryce Young is QB1,2022-12-04T20:09:39Z,colts,-0.5574
10879,87594,87594,LuskSGV,Yannick getting locked down by Tyler Smith lol,2.0,colts,t3_zcqpgz,False,0.0,Bryce Young is QB1,2022-12-04T20:07:55Z,colts,0.4215
10880,87596,87596,LuskSGV,Flamin hot Cheetos 🔥🔥🔥,1.0,colts,t3_zcqpgz,False,0.0,Bryce Young is QB1,2022-12-04T19:52:36Z,colts,-0.7351
10881,87597,87597,LuskSGV,Matt Ryan is incapable of throwing an incompletion,3.0,colts,t3_zcqpgz,False,0.0,Bryce Young is QB1,2022-12-04T19:52:08Z,colts,-0.3818
10882,87600,87600,LuskSGV,Yannick has been our best pass rusher in a long time? That's news to me!!,10.0,colts,t3_zcqpgz,False,0.0,Bryce Young is QB1,2022-12-04T19:39:49Z,colts,0.0235888888888888
10883,87602,87602,LuskSGV,We are winning the Super Bowl,5.0,colts,t3_zcqpgz,False,0.0,Bryce Young is QB1,2022-12-04T19:26:48Z,colts,0.8074
10884,87603,87603,LuskSGV,I'm so excited for our bye week,10.0,colts,t3_zcqpgz,False,0.0,Bryce Young is QB1,2022-12-04T19:18:48Z,colts,0.4005
10885,87604,87604,LuskSGV,I expect to look a lot better than we are tonight (or we look god awful and lose by a lot which is better for us in the long run),1.0,colts,t3_zcqpgz,False,0.0,Bryce Young is QB1,2022-12-04T19:13:44Z,colts,0.296
10886,87605,87605,LuskSGV,Mom come pick me up I'm scared,16.0,colts,t3_zcqpgz,False,0.0,Bryce Young is QB1,2022-12-04T19:00:56Z,colts,-0.4404
10887,87606,87606,LuskSGV,I know but has he been on the sideline? I assume he has but I haven't heard of him or seen him since his injury.,1.0,colts,t3_zcek26,False,0.0,Bryce Young is QB1,2022-12-04T13:14:06Z,colts,-0.28595
10888,87608,87608,LuskSGV,Don't we technically want the Lions to win since they are a QB needy team?,2.0,colts,t3_z8izj7,False,0.0,Bryce Young is QB1,2022-12-04T12:25:42Z,colts,0.291
10889,87609,87609,LuskSGV,This is just plain wrong.,0.0,colts,t3_zbgmoj,False,0.0,Bryce Young is QB1,2022-12-03T12:18:51Z,colts,-0.4767
10890,87610,87610,LuskSGV,Nah Matt Ryan will be frowning after Parsons is done with him,1.0,colts,t3_zatltq,False,0.0,Bryce Young is QB1,2022-12-02T14:52:53Z,colts,-0.4215
10891,87611,87611,LuskSGV,To be fair it's a lose-lose situation,10.0,colts,t3_zav4e3,False,0.0,Bryce Young is QB1,2022-12-02T13:51:54Z,colts,0.3182
10892,87612,87612,LuskSGV,You'd like to think the better player would see the field!!,12.0,colts,t3_zav4e3,False,0.0,Bryce Young is QB1,2022-12-02T13:46:06Z,colts,0.1725
11453,89906,89906,MattyIceMyDaddy,I think it’s pretty clear at this point that Tom Brady carried Belichick in New England.,-16.0,colts,t3_zf0ymf,False,0.0,Touchdown Jesus,2022-12-07T09:00:58Z,colts,0.7003
11454,89911,89911,MattyIceMyDaddy,"Wow, such groundbreaking journalism. It’s not like the entire NFL world has known this for over a month now.",94.0,colts,t3_zcdlt6,False,0.0,Touchdown Jesus,2022-12-04T10:11:48Z,colts,0.0087249999999999
11838,92919,92919,Mpango87,If ever there were a time to force rookies in to get them experience it would be now. Like we can’t lose any worse than we just did. I’m not buying this game flow crap.,4.0,colts,t3_zf1k0u,False,0.0,Jonathan Taylor,2022-12-07T09:24:41Z,colts,-0.184
11839,92920,92920,Mpango87,It’s easy to see why athletes lives fall apart once they are done. They probably retire and have no friends or family left since they can neglect everyone around them. Seems like luck pulled himself out of it before it could happen but you could tell it was insanely challenging to do so.,39.0,colts,t3_ze6ytd,False,0.0,Jonathan Taylor,2022-12-06T09:47:21Z,colts,0.1294222222222222
11840,92921,92921,Mpango87,"Oh yeah we could easily lose out, our schedule is insane minus the last game against the Texans. It wouldn’t shock me if we lose to them too. We already tied them week 1.",4.0,nfl,t3_zd6wf8,False,0.0,:Colts: Colts,2022-12-05T10:43:24Z,colts,-0.0795592592592592
11841,92922,92922,Mpango87,This is what I’ve thought especially since he got Fuckin smashed on his shoulder and was out a few weeks. His arm is so weak/inaccurate. Defenses know this and either blitz extra guys or have their corners play tight coverage close to the line and we can’t do shit. That’s why the occasional deep ball was such a shock last night because we either never have time to do it or Ryan’s arm is so weak no one is scared of it.,39.0,nfl,t3_zd6wf8,False,0.0,:Colts: Colts,2022-12-05T10:07:02Z,colts,-0.23145
13116,102706,102706,OMG_Someone,I have been in the community for years. I still don’t understand the Sigma drama. Nor do I care to.,2.0,colts,t3_zf4l7n,False,0.0,Who the Hell is Mel Kiper?,2022-12-07T13:56:32Z,colts,-0.1291666666666666
13117,102707,102707,OMG_Someone,I wish I had missed it. Sadly I watched the whole thing.,2.0,nfl,t3_zcwxbs,False,0.0,:Colts: Colts,2022-12-05T17:00:29Z,colts,-0.17875
13118,102708,102708,OMG_Someone,We like our guys.,6.0,colts,t3_zcqpgz,False,0.0,Who the Hell is Mel Kiper?,2022-12-04T22:01:07Z,colts,0.3612
13119,102710,102710,OMG_Someone,What did Chris Collinsworth do to y’all. So much anger lol,-2.0,colts,t3_zcqpgz,False,0.0,Who the Hell is Mel Kiper?,2022-12-04T21:22:01Z,colts,-0.1149
13120,102711,102711,OMG_Someone,Fair enough.,3.0,colts,t3_zcnty1,False,0.0,Who the Hell is Mel Kiper?,2022-12-04T16:56:32Z,colts,0.3182
13479,103658,103658,OladipoForThree,"Titans have had a good amount of misses… Isaiah Wilson,  Julio Jones, AJ Brown trade, etc. But regardless of that they’ve won 3 straight division titles, were the 1st seed last year, etc. I don’t know. I can see an argument for both sides. But Jon Robinson has inarguably had a better track record than Chris Ballard, and we still have folks here defending him.",37.0,colts,t3_zec45k,False,0.0,Jonathan Taylor,2022-12-06T11:33:17Z,colts,0.105533088
13480,103663,103663,OladipoForThree,"Basically, an indicator overall of how many yards the team is gaining on average from a QB’s passing down. Factors in sacks, picks, etc.",6.0,colts,t3_zdawnd,False,0.0,Jonathan Taylor,2022-12-05T13:38:17Z,colts,0.105375
13481,103665,103665,OladipoForThree,Those look like really good seats. Sorry man,1.0,colts,t3_zcrrss,False,0.0,Jonathan Taylor,2022-12-04T22:50:38Z,colts,0.133925
13482,103668,103668,OladipoForThree,It’s the sjw culture that has infiltrated a lot of pro sports leagues lately. Most notably in the media. Jeff Saturday hire was criticized because of the color of his skin even though he’s one of the greatest centers ever.,-5.0,colts,t3_zaww7s,False,1.0,Jonathan Taylor,2022-12-02T21:18:40Z,colts,0.1339666666666666
14377,106281,106281,PadKrapowKhaiDao,I really wish I hadn’t read that Andrew was the kind of person who orders for everyone.,6.0,colts,t3_ze6ytd,False,0.0,MegaStrachan,2022-12-06T14:49:41Z,colts,0.4576
14378,106283,106283,PadKrapowKhaiDao,"I actually wanted Derek Carr a few years ago, so what do i know lol",1.0,colts,t3_zbj1hk,False,0.0,MegaStrachan,2022-12-04T13:47:10Z,colts,0.4215
14379,106285,106285,PadKrapowKhaiDao,"“Clickbait article even if the writing is good.” That doesn’t even make sense. So, it’s good, but it should be criticized anyway?",-1.0,colts,t3_zbj1hk,False,0.0,MegaStrachan,2022-12-03T22:18:09Z,colts,-0.1591
14380,106286,106286,PadKrapowKhaiDao,"Oh god, please no. That dude has already fallen off the cliffX and he’s closer to the ground than he is the edge.",6.0,colts,t3_zbj1hk,False,0.0,MegaStrachan,2022-12-03T22:12:53Z,colts,-0.048925
14381,106287,106287,PadKrapowKhaiDao,The fact that the four word comment you replied to has 50+ upvotes and no one has upvoted you when you’re just speaking the truth and obviously have done the research (1500’words?!) is very telling of how things go on this sub. Everybody just wants to be angry armchair GMs.,-4.0,colts,t3_zbj1hk,False,1.0,MegaStrachan,2022-12-03T22:09:46Z,colts,-0.1664703703703703
14382,106290,106290,PadKrapowKhaiDao,"I actually wanted Hooker for this reason, but I’m not sure what to expect of him post-injury.  I also didn’t have a problem with his age, but now that he’s gonna have to sit a year and be having his first full season in the field at like 26-27 makes him a no-go for me.",1.0,colts,t3_zbgmoj,False,0.0,MegaStrachan,2022-12-03T10:04:16Z,colts,0.082725
14383,106292,106292,PadKrapowKhaiDao," No offense, but based  off your description alone I don’t want anything to do with him. “Not mobile, decent arm…”",1.0,colts,t3_zbgmoj,False,0.0,MegaStrachan,2022-12-03T09:46:21Z,colts,-0.043225
14615,108776,108776,Pktur3,"Honestly, Ballard would probably be better off in this position. He’s a great scout, but his team making abilities are lacking. It would make him look really good and would capitalize on his best aspect.",13.0,colts,t3_zcdlt6,False,0.0,Retired Unofficial Colts Outsider,2022-12-04T11:52:39Z,colts,0.3657592592592593
14870,110086,110086,Primary-Bath803,I dont know why but I like Dalton. He seems to be a good guy,1.0,nfl,t3_ze7oaz,False,0.0,:Colts: Colts,2022-12-06T15:10:38Z,colts,0.345775
14875,110092,110092,Primary-Bath803,That doesnt make any sense for me. I thought he was one of the main reasons for you guys to be that good,1.0,nfl,t3_zec330,False,0.0,:Colts: Colts,2022-12-06T11:18:24Z,colts,0.2202
14876,110093,110093,Primary-Bath803,">Lol owners watched AJ brown dominate them and said fuck was Robinson thinking

We should do the same",26.0,nfl,t3_zec330,False,0.0,:Colts: Colts,2022-12-06T11:17:43Z,colts,-0.296
14877,110094,110094,Primary-Bath803,What? He was fired before Ballard,7.0,nfl,t3_zec330,False,0.0,:Colts: Colts,2022-12-06T11:16:14Z,colts,-0.2787
15491,115146,115146,RelentlessRogue,"For what it's worth, the Bills haven't either. And their offense would blow the doors off Lucas Oil right now.",3.0,colts,t3_zf8mgh,False,0.0,COLTS,2022-12-07T13:13:09Z,colts,-0.068425
15492,115157,115157,RelentlessRogue,"You're not wrong, but that being said, we did also beat the 9-3 Chiefs, so anything is possible",15.0,colts,t3_zcxrau,False,0.0,COLTS,2022-12-05T00:33:43Z,colts,0.1967
