,Unnamed: 0.1,Unnamed: 0,author,body,score,subreddit,link_id,over_18,controversiality,author_flair_text,created_utc,flair,sentiment
15493,115158,115158,RelentlessRogue,"Good news is, since we have next week off, if any of the 4-8 teams win, we win.

Edit: Actually. We'll go up to 8th if New Orleans beats Tampa tomorrow night. And we can go higher if Jacksonville upsets Tennessee, the Panthers beat the Seahawks, or the Cardinals beat the Patriots in week 14.

So by the end of the bye week, we could have the 5th pick.",47.0,colts,t3_zcxrau,False,0.0,COLTS,2022-12-04T23:33:52Z,colts,-0.01416368
15494,115162,115162,RelentlessRogue,"I mean, Braden hasn't been ass this year. 

But I'm pretty sure I could get open vs Kenny Moore, and I'm horribly out of shape.",3.0,colts,t3_zav4e3,False,0.0,COLTS,2022-12-02T16:04:47Z,colts,0.3037
15495,115163,115163,RelentlessRogue,Guys. Andrew Luck isn't going to play football ever again. Get the fuck over it.,25.0,colts,t3_zay7rm,False,0.0,COLTS,2022-12-02T16:00:58Z,colts,-0.1539333333333333
15925,115955,115955,RestoredX123,We are way beyond Wentz. Last year we had a semi competent team to supplement his at times competent play. Now there’s nothing there.,2.0,colts,t3_zcqpgz,False,0.0,Rookie Manning,2022-12-04T22:14:37Z,colts,0.0798222222222222
15926,115956,115956,RestoredX123,Yup. Irsay needs to clean house at this point.,1.0,colts,t3_zcqpgz,False,0.0,Rookie Manning,2022-12-04T22:04:42Z,colts,0.20095
15927,115957,115957,RestoredX123,Never was huge on him in the first place. He was always just a “potential” guy that never put it all together.,2.0,colts,t3_zcqpgz,False,0.0,Rookie Manning,2022-12-04T21:48:59Z,colts,-0.060275
15928,115959,115959,RestoredX123,Got about 30 min in me then right behind you lol,2.0,colts,t3_zcqpgz,False,0.0,Rookie Manning,2022-12-04T21:06:18Z,colts,0.4215
15929,115960,115960,RestoredX123,This team was eventually due to have a down year where young players were going to have to go through trial by fire. But Ballard’s aversion to free agency really didn’t help mitigate anything here.,11.0,colts,t3_zctb04,False,0.0,Rookie Manning,2022-12-04T21:05:17Z,colts,0.25375
15930,115963,115963,RestoredX123,You’d think the recency bias would’ve faded by now but Peyton is still largely shown in his Broncos uniform in most pictures that I still see of him. Pretty weird honestly.,2.0,colts,t3_zb6fhw,False,0.0,Rookie Manning,2022-12-03T12:38:26Z,colts,0.3223499999999999
16698,119196,119196,Schofield6,"With defo our defence tanks hard, so we solve one problem (maybe cause who know what stroud becomes) and great a huge hole on the other side. In short? FUCK no",2.0,colts,t3_zfkcb0,False,0.0,RTDB,2022-12-07T20:24:45Z,colts,-0.2251703703703703
16699,119197,119197,Schofield6,If ifs were fifths we’d all be drunk,12.0,colts,t3_zfh8b2,False,0.0,RTDB,2022-12-07T20:22:18Z,colts,-0.34
16700,119205,119205,Schofield6,You know we will beat the Vikings and chargers and lose to Texans and giants because that’s colts football baby! We almost beat both the eagles and cowboys back to back until we’ll saw that game,5.0,colts,t3_zeimjv,False,0.0,RTDB,2022-12-06T18:32:57Z,colts,-0.11435
16701,119209,119209,Schofield6,Or… here me out… we get a qb in the first and a RG in the second round and figure out best available after that,0.0,colts,t3_ze7krx,False,0.0,RTDB,2022-12-06T11:21:45Z,colts,0.6369
16702,119212,119212,Schofield6,Poor gilly lock mans playing lights out but this team is dog shit,11.0,colts,t3_zdnjpy,False,0.0,RTDB,2022-12-05T18:29:27Z,colts,-0.7615
16703,119217,119217,Schofield6,I heard it was an expedited call meaning they already called New York and “confirmed” the call so a challenger would’ve been pointless HOWEVER that call on Franklin when the ball wasn’t whistled dead should’ve been overturned,2.0,colts,t3_zddyjy,False,0.0,RTDB,2022-12-05T15:41:14Z,colts,-0.5456
16704,119219,119219,Schofield6,Some of y’all think we have the worst roster in the world which if you’ve watched any games this season you can see the defence (with Shaq healthy) is easily a top 5 unit (especially if we can get any sort of pass rush). The problems are exclusively on the offence and very much on the OL. Unsure if they had been good if Ryan would be better or not but yes a qb as well is the problem since Ryan can’t throw past 20 yards. If we can learn to use FA. We can get competent OL (like literally anyone other than Pryor) and draft a qb next year and hope he pans out,2.0,colts,t3_zdb5zg,False,0.0,RTDB,2022-12-05T11:24:23Z,colts,0.15077808
16705,119220,119220,Schofield6,"TLDR we need an a over average QB, a OL worth even half a fuck, and pass rush to be generated",7.0,colts,t3_zdb5zg,False,0.0,RTDB,2022-12-05T11:17:55Z,colts,-0.3818
16706,119222,119222,Schofield6,I mean foles or Sam gotta start just to literally save his life at this point it’s unfair to send him out there and get killed every quarter. Not even about winning but at least not being totally useless,2.0,colts,t3_zd5vw0,False,0.0,RTDB,2022-12-05T08:14:26Z,colts,0.008825
16707,119223,119223,Schofield6,Maybe cause Matt Goddamn “turnstile” Pryor has a job,21.0,colts,t3_zctb04,False,0.0,RTDB,2022-12-04T20:36:33Z,colts,-0.4767
16708,119224,119224,Schofield6,Then I want a proper OC and keep Saturday as HC,1.0,colts,t3_zcu9qz,False,1.0,RTDB,2022-12-04T20:35:48Z,colts,0.0772
16709,119225,119225,Schofield6,This is what I thought too. So many said “there’s no way the cowboys lose this game” I’m like well here we go we about to win when we shouldn’t,2.0,colts,t3_zcqpgz,False,0.0,RTDB,2022-12-04T19:12:24Z,colts,0.27115
16710,119227,119227,Schofield6,"Lack of mobility is a red flag as most passers in the NFL of the last 4 seasons or so have been mobile QBs. This causes defences to have to plan for RB run, pass or qb run. Does the perfect qb need to be mobile? No, accuracy and arm strength id say are far more important as if you can hit from down field and not turn the ball over or miss receivers you’re in a much better spot but traditional only pocket passers may not be as sought after as 20 years ago. That said if we are picking in the mid teens and we could get him in the mid second round than I’d have no problems getting the best OL player and drafting him second",1.0,colts,t3_zbgmoj,False,0.0,RTDB,2022-12-03T16:38:07Z,colts,0.175770816
17213,120728,120728,Simpleton216,"There are still places you'll get stabbed or shot for saying ""Sherman.""",4.0,nfl,t3_zf37d6,False,0.0,:Colts: Colts,2022-12-07T15:48:48Z,colts,-0.4404
17214,120734,120734,Simpleton216,"Yeah, but they at least have draft picks.",22.0,nfl,t3_zeng9c,False,0.0,:Colts: Colts,2022-12-06T19:02:49Z,colts,0.1531
17215,120735,120735,Simpleton216,"Broncos offense making Colts fans say ""well, could be worse"".",2.0,nfl,t3_zd8jax,False,0.0,:Colts: Colts,2022-12-05T19:30:14Z,colts,-0.4588
17216,120737,120737,Simpleton216,"How to fix soccer:

If you flop, the other player gets a free hit on you.

If you run away, you get red carded.",8.0,nfl,t3_zd92be,False,0.0,:Colts: Colts,2022-12-05T14:28:36Z,colts,0.056575
17217,120739,120739,Simpleton216,I feel like that guy doesn't know how to cook rice.,4.0,nfl,t3_zd92be,False,0.0,:Colts: Colts,2022-12-05T14:02:24Z,colts,0.3612
17218,120741,120741,Simpleton216,Lmao this remix and the comments  https://youtu.be/FQnD4rt8Vog,2.0,nfl,t3_zd92be,False,0.0,:Colts: Colts,2022-12-05T12:25:53Z,colts,0.5994
17219,120742,120742,Simpleton216,I've ordered so much stuff I can't even get on Amazon.,3.0,nfl,t3_zd92be,False,0.0,:Colts: Colts,2022-12-05T12:23:12Z,colts,0.1779
17220,120745,120745,Simpleton216,Pick 6 and 2 accidental safeties?,7.0,nfl,t3_zcfr0m,False,0.0,:Colts: Colts,2022-12-04T13:09:04Z,colts,0.296
17221,120747,120747,Simpleton216,The Texans didn't consent to penetration.,1.0,nfl,t3_zcfr0m,False,0.0,:Colts: Colts,2022-12-04T13:00:50Z,colts,-0.1695
17222,120748,120748,Simpleton216,And people say the AFCS sucks.,4.0,nfl,t3_zcfr0m,False,0.0,:Colts: Colts,2022-12-04T12:59:44Z,colts,-0.3612
17223,120749,120749,Simpleton216,Hate is a good band.,3.0,nfl,t3_zcfr0m,False,0.0,:Colts: Colts,2022-12-04T12:55:15Z,colts,-0.2023
17224,120750,120750,Simpleton216,We tried to warn you.,3.0,nfl,t3_zcfr0m,False,0.0,:Colts: Colts,2022-12-04T12:54:53Z,colts,-0.1027
17225,120751,120751,Simpleton216,He has changed. He might be a shit qb now.,6.0,nfl,t3_zcfr0m,False,0.0,:Colts: Colts,2022-12-04T12:48:30Z,colts,-0.2787
17226,120752,120752,Simpleton216,Texans about to be Lovable Winners.,3.0,nfl,t3_zcfr0m,False,0.0,:Colts: Colts,2022-12-04T12:47:51Z,colts,0.7964
17227,120756,120756,Simpleton216,"Yeah I think OP just wants attention. I do vaguely remember seeing refs with a Z at some point, but it may have been an S and I'm misremembering.",1.0,nfl,t3_zceqlp,False,0.0,:Colts: Colts,2022-12-04T11:14:30Z,colts,0.074
17228,120757,120757,Simpleton216,"https://www.viqtorysports.com/wp-content/uploads/2019/09/image-1024x549.png.webp

I think that offends them or something.",1.0,nfl,t3_zceqlp,False,0.0,:Colts: Colts,2022-12-04T11:12:50Z,colts,-0.4588
17229,120759,120759,Simpleton216,Was that the one with 3 missed field goals?,7.0,nfl,t3_zbzumd,False,0.0,:Colts: Colts,2022-12-03T22:51:11Z,colts,-0.296
17230,120764,120764,Simpleton216,Watson is back need a distraction.,2.0,nfl,t3_zbjuhm,False,0.0,:Colts: Colts,2022-12-03T10:46:16Z,colts,-0.3818
17231,120765,120765,Simpleton216,Rise of the Morning Glory by Edguy is the best song ever written about an erection.,3.0,nfl,t3_zaoeju,False,0.0,:Colts: Colts,2022-12-02T16:16:25Z,colts,0.8271
17440,122358,122358,SmokeyBearEnthusiast,Frazier would not be a good hire,4.0,colts,t3_zf0ymf,False,0.0,(Colts),2022-12-07T08:52:10Z,colts,-0.3412
17441,122359,122359,SmokeyBearEnthusiast,"*Insert joke about this team causing our mental health to decline*

In all seriousness this is such a cool initiative the Colts do and despite what’s happening on the field this season, I’m very proud to be a fan of this team",14.0,colts,t3_zecbbx,False,0.0,(Colts),2022-12-06T11:19:54Z,colts,0.8399
17442,122360,122360,SmokeyBearEnthusiast,Stop,5.0,colts,t3_zdgq6q,False,0.0,(Colts),2022-12-05T13:27:41Z,colts,-0.296
17443,122364,122364,SmokeyBearEnthusiast,Shut the fuck up,0.0,colts,t3_zcqpgz,False,0.0,(Colts),2022-12-04T22:14:39Z,colts,-0.5423
17444,122365,122365,SmokeyBearEnthusiast,This is a stupid comment,-1.0,colts,t3_zcqpgz,False,0.0,(Colts),2022-12-04T22:11:56Z,colts,-0.5267
17445,122366,122366,SmokeyBearEnthusiast,I think right now 10 and if the Saints win tomorrow it’s 8,1.0,colts,t3_zcqpgz,False,0.0,(Colts),2022-12-04T22:07:08Z,colts,0.5859
17446,122367,122367,SmokeyBearEnthusiast,Holy shit I hate the Cowboys,5.0,colts,t3_zcqpgz,False,0.0,(Colts),2022-12-04T19:41:54Z,colts,-0.8074
17447,122368,122368,SmokeyBearEnthusiast,"Hey Zak - you and Holder were the reason I subscribe to the Athletic and now James is doing a great job so appreciate you guys! 

What do you think the likelihood is of Saturday getting the permanent gig? I know Irsay is going to go through the whole process and there’s some good external candidates but any vibes you’re getting from inside the building about it?",41.0,colts,t3_zam7zq,False,0.0,(Colts),2022-12-02T07:29:56Z,colts,0.1094666666666666
17748,123935,123935,SourrOnline,I’ve said it several times. There is a lot of talent on this roster if we can get the right coach and qb.,2.0,colts,t3_zf1k0u,False,0.0,The Maniac,2022-12-07T16:27:17Z,colts,0.21075
17749,123938,123938,SourrOnline,"Idk why, but he feels like one of those no one wants this job so give him another try coaches. I hope if we hire him I’m wrong.",1.0,colts,t3_zf0ymf,False,0.0,The Maniac,2022-12-07T11:08:22Z,colts,-0.0097
17750,123940,123940,SourrOnline,I need someone to explain to me how a well made pair of jeans is going to solve our QB issues.,2.0,colts,t3_zdwe0z,False,0.0,The Maniac,2022-12-06T19:23:32Z,colts,0.4404
17751,123948,123948,SourrOnline,You’re reacting how most people should. It’s a blown year and we have an interim coach. People’s expectations are ridiculous.,2.0,colts,t3_zcyhx2,False,0.0,The Maniac,2022-12-05T16:04:35Z,colts,-0.1204
17752,123949,123949,SourrOnline,It just shows me we have a lot of pieces that we can build on. Let’s get through this interim season and get excited for what the future holds.,1.0,colts,t3_zctb04,False,0.0,The Maniac,2022-12-05T15:59:30Z,colts,0.17
17753,123951,123951,SourrOnline,"Yeah, even past the contract, I think he’s a guy you’re building with. I hate it, but I don’t think any other players will be off the table for trade.",2.0,colts,t3_zdjyxv,False,0.0,The Maniac,2022-12-05T15:54:20Z,colts,-0.09055
17754,123952,123952,SourrOnline,"I don’t think guys like JT, Nelson or Leonard are going anywhere.",10.0,colts,t3_zdjyxv,False,0.0,The Maniac,2022-12-05T15:31:48Z,colts,0.3612
17755,123954,123954,SourrOnline,"Play scared? We played like shit in one quarter but nothing looked scared? Also, didn’t reihman own him all night?",1.0,colts,t3_zcybr0,False,0.0,The Maniac,2022-12-05T15:22:31Z,colts,0.051237037037037
17756,123955,123955,SourrOnline,"IMO if we don’t move up higher by losing out, I think we trade with chicago if they’re still up there. The higher we are, the less it will cost.",2.0,colts,t3_zdgmyx,False,0.0,The Maniac,2022-12-05T15:19:00Z,colts,-0.09545
17757,123956,123956,SourrOnline,"They’re both bad. If wentz had stayed, the locker room would have been gone faster. This isn’t really a comparison tbh. But we’re equally disappointing.",1.0,colts,t3_zdfw8l,False,0.0,The Maniac,2022-12-05T14:42:57Z,colts,-0.1642683593749999
17758,123958,123958,SourrOnline,"What a messed up, tasteless title. Reported.",-2.0,colts,t3_zd7g71,False,0.0,The Maniac,2022-12-05T11:49:13Z,colts,-0.085
17759,123960,123960,SourrOnline,We fired our coach and have an interim head coach. What in the actual fuck were your completely illogical expectations after that?,2.0,colts,t3_zcwsny,False,1.0,The Maniac,2022-12-04T23:03:51Z,colts,-0.4105
17760,123962,123962,SourrOnline,An interim head coach. Interim. Not his staff. Not his player. Interim. Stop trying to have an opinion.,1.0,colts,t3_zcqpgz,False,0.0,The Maniac,2022-12-04T22:22:21Z,colts,-0.0493333333333333
17761,123963,123963,SourrOnline,"Yeah who cares to have a fairly officiate game. FYI, 5 of their touchdowns were walked down the field by officials s",0.0,colts,t3_zcqpgz,False,0.0,The Maniac,2022-12-04T22:17:08Z,colts,0.343225
17762,123964,123964,SourrOnline,"It absolutely was, this shit is why the nba is fucking joke.",1.0,colts,t3_zcqpgz,False,0.0,The Maniac,2022-12-04T22:16:34Z,colts,-0.4743
17763,123967,123967,SourrOnline,There are multiple trolls in here now that are not colts fans just trolling. Idk why you felt defensive about it.,1.0,colts,t3_zcqpgz,False,0.0,The Maniac,2022-12-04T22:06:41Z,colts,-0.0386
17764,123968,123968,SourrOnline,"Hey mods, wanna handle the non colts fan trollls we have in here?",3.0,colts,t3_zcqpgz,False,0.0,The Maniac,2022-12-04T22:04:33Z,colts,0.3182
17765,123969,123969,SourrOnline,Are you a colts fan or just trolling our board?,4.0,colts,t3_zcqpgz,False,0.0,The Maniac,2022-12-04T22:01:49Z,colts,0.3182
17766,123970,123970,SourrOnline,I don’t want to watch Matt Ryan anymore. He’s be very very bad.,6.0,colts,t3_zcqpgz,False,0.0,The Maniac,2022-12-04T21:58:26Z,colts,-0.2914
17767,123971,123971,SourrOnline,I can’t wait to read another rant regarding a team with an interim coach that’s kept in every game. Ffs smh.,0.0,colts,t3_zcqpgz,False,1.0,The Maniac,2022-12-04T21:45:56Z,colts,-0.44845
17768,123972,123972,SourrOnline,He’s not shitting on us but yes he is?,2.0,colts,t3_zcqpgz,False,0.0,The Maniac,2022-12-04T21:44:26Z,colts,0.6388
17769,123973,123973,SourrOnline,And if we lose it and we’re at the end and don’t have enough timeouts you’d say that’s why he isn’t cut out to be a head coach.,5.0,colts,t3_zcqpgz,False,0.0,The Maniac,2022-12-04T21:40:18Z,colts,-0.5859
17770,123974,123974,SourrOnline,Wow lnfao. The JerryFL reigns supreme,7.0,colts,t3_zcqpgz,False,0.0,The Maniac,2022-12-04T21:37:26Z,colts,0.4251749999999999
17771,123975,123975,SourrOnline,"I’m not sure, but I heard we’ve also had a lot of quarterbacks",3.0,colts,t3_zcqpgz,False,0.0,The Maniac,2022-12-04T21:34:32Z,colts,-0.1232
17772,123976,123976,SourrOnline,Holding our entire line every run okay makes their run game look really good.,8.0,colts,t3_zcqpgz,False,0.0,The Maniac,2022-12-04T21:33:57Z,colts,0.624
17773,123977,123977,SourrOnline,Pierce is gonna be a beast in this league. Great pick,8.0,colts,t3_zcqpgz,False,0.0,The Maniac,2022-12-04T21:29:07Z,colts,0.31245
17774,123979,123979,SourrOnline,They threw a 40 yard bomb to pierce just a little bit ago? And tried again but it was off? Just stop.,0.0,colts,t3_zcqpgz,False,0.0,The Maniac,2022-12-04T20:52:01Z,colts,-0.1169592592592592
17775,123980,123980,SourrOnline,"He stands proudly on the shoulders of emmit smith, Michael Irvin and arguably the greatest oline of all time and acts like he did something.",2.0,colts,t3_zcqpgz,False,0.0,The Maniac,2022-12-04T20:43:07Z,colts,0.8519
17776,123982,123982,SourrOnline,Kwitty gettin shitty,4.0,colts,t3_zcqpgz,False,0.0,The Maniac,2022-12-04T20:38:28Z,colts,-0.5574
17777,123984,123984,SourrOnline,They’re still running his offense.,6.0,colts,t3_zcqpgz,False,0.0,The Maniac,2022-12-04T20:35:59Z,colts,-0.25
17778,123985,123985,SourrOnline,Interim head coach with a first time play caller. Calm down.,2.0,colts,t3_zcqpgz,False,1.0,The Maniac,2022-12-04T20:34:47Z,colts,0.2440999999999999
17779,123986,123986,SourrOnline,Their o line is really good but they are getting away with some atrocious holding calls right now,1.0,colts,t3_zcqpgz,False,0.0,The Maniac,2022-12-04T20:12:18Z,colts,0.2724
17780,123987,123987,SourrOnline,Gotta love that clothesline block lmfao fuckin zebras.,4.0,colts,t3_zcqpgz,False,0.0,The Maniac,2022-12-04T20:11:11Z,colts,0.7003
17781,123988,123988,SourrOnline,"So has everyone else he’s played? He’s also not, he’s had 3 qb hurries.",2.0,colts,t3_zcqpgz,False,0.0,The Maniac,2022-12-04T20:09:08Z,colts,0.085
17782,123989,123989,SourrOnline,"Yeah, I don’t think he’s mentally recovered from losing his kid. I feel bad for the guy but we gotta make a change.",2.0,colts,t3_zcqpgz,False,0.0,The Maniac,2022-12-04T20:06:23Z,colts,-0.179225
17783,123991,123991,SourrOnline,"Ugh, what happened to Kelly.",2.0,colts,t3_zcqpgz,False,0.0,The Maniac,2022-12-04T20:04:50Z,colts,-0.4215
17784,123992,123992,SourrOnline,Diggs is so bad lmfao,2.0,colts,t3_zcqpgz,False,0.0,The Maniac,2022-12-04T19:51:38Z,colts,-0.181
17785,123996,123996,SourrOnline,"Jesus man, no one is gaslighting anyone. Just trying to get people to stop being doomers. But this is the internet, you can do whatever you want.",0.0,colts,t3_zcbdrn,False,0.0,The Maniac,2022-12-04T13:39:42Z,colts,-0.0053851851851851
17786,123998,123998,SourrOnline,You’re taking this really wrong because you’re angry and defensive. It’s nuts how toxic this fan base has gotten in the past few years. It’s ludicrous to watch a team with an interim head coach and to rage if they aren’t playing elite or winning every game. But keep it up. YOU must be a delight irl.,-1.0,colts,t3_zcbdrn,False,0.0,The Maniac,2022-12-04T13:19:09Z,colts,0.11795872
17787,123999,123999,SourrOnline,"Nope, I just think you’re all idiot for acting like spoiled children. I’m sure you’re bandwagon all to hell when we are back on top. Keep overreacting to everything in life. Usually fairs well.",-2.0,colts,t3_zcbdrn,False,0.0,The Maniac,2022-12-04T13:13:37Z,colts,0.061866015625
17788,124000,124000,SourrOnline,"Weekly reminder that we are playing with a broken qb and an interim head coach. Calm the fuck down. Also, holy shit you’re overreacting to how good the cowboys are. We nearly beat the eagle. Smh.",-2.0,colts,t3_zcbdrn,False,0.0,The Maniac,2022-12-04T13:08:17Z,colts,-0.065638624
17789,124002,124002,SourrOnline,"Castanzo was meant to start day 1. Bernard wasn’t. This speaks very highly of Bernard. Plus, I’d be interested in seeing his pre and post reich stats",3.0,colts,t3_zcdh0v,False,0.0,The Maniac,2022-12-04T12:12:22Z,colts,0.100475
17790,124003,124003,SourrOnline,Oh god no.,1.0,colts,t3_zc0cvk,False,0.0,The Maniac,2022-12-03T22:53:46Z,colts,0.2732
17791,124007,124007,SourrOnline,Lol I should have put /s. It was a joke on this sub doing that every time anyone mentions an Ohio state player.,3.0,colts,t3_zb7790,False,0.0,The Maniac,2022-12-03T11:49:27Z,colts,0.253375
17792,124008,124008,SourrOnline,Lol sorry I should have put /s. It was a joke on how every time you mention stroud or anyone from Ohio state half the sub freaks out saying no Ohio state players.,3.0,colts,t3_zb7790,False,0.0,The Maniac,2022-12-03T11:47:41Z,colts,0.03895
17793,124010,124010,SourrOnline,"Nope, no usc players. Sam darnold sucks. Nope nope nope.

Edit: should have put /s. Was a joke on how everyone on this sub freaks out if you mention an Ohio state player.",-8.0,colts,t3_zb7790,False,0.0,The Maniac,2022-12-02T22:32:24Z,colts,0.0399536
18174,127140,127140,Superawesomecoolman,Is it possible to cut everyone on a football team all at once?,16.0,colts,t3_zcxapq,False,0.0,Pimp Luck,2022-12-04T22:56:04Z,colts,-0.2732
18409,130103,130103,TheAndrewArc,"I feel like you'll probably get a lot of ""as an insider what do you think is going to happen...."" Forget that man, As far as GM, HC, and QB or anything else, what changes are YOU wanting to see happen to this team next year?",3.0,colts,t3_zam7zq,False,0.0,Jonathan Taylor,2022-12-02T08:43:11Z,colts,0.1531
19067,133859,133859,TimR0604,"Appreciate it, and I say this with much respect, the titans are a much better football team than the colts right now 🙏",2.0,nfl,t3_zbx9in,False,0.0,:Colts: Colts,2022-12-03T20:06:19Z,colts,0.8271
19068,133860,133860,TimR0604,Say you're a pats fan without saying you're a pats fan,4.0,nfl,t3_zbx9in,False,0.0,:Colts: Colts,2022-12-03T19:59:40Z,colts,0.5574
19709,138143,138143,TurdWranglin,"I took the turning off the lights thing was just to his bedroom, not to the whole house to make them leave haha",10.0,colts,t3_ze6ytd,False,0.0,Big-Q,2022-12-06T12:25:13Z,colts,0.4215
19710,138144,138144,TurdWranglin,What do you mean? He knew like a week before everyone else. The draft already happened so it’s not like it would change who he drafted. The season was still only 2 weeks from starting.,16.0,colts,t3_ze6ytd,False,0.0,Big-Q,2022-12-06T12:24:12Z,colts,-0.01525
19711,138146,138146,TurdWranglin,That was the first game of the season. We weren’t tanking yet. Also a tie is better than us straight up winning.,4.0,colts,t3_zcxrau,False,0.0,Big-Q,2022-12-05T08:36:52Z,colts,0.2673333333333333
19712,138147,138147,TurdWranglin,It’s better than if we beat them though.,4.0,colts,t3_zcxrau,False,0.0,Big-Q,2022-12-05T08:35:53Z,colts,0.4404
19713,138148,138148,TurdWranglin,I’d rather Chicago keep losing so we have a trade partner at 2.,16.0,colts,t3_zd7g71,False,0.0,Big-Q,2022-12-05T08:20:21Z,colts,-0.3818
19714,138149,138149,TurdWranglin,Lol. I don’t think Reggie is the Colts tech liaison.,8.0,colts,t3_zcsmab,False,0.0,Big-Q,2022-12-04T22:04:04Z,colts,0.105375
19715,138154,138154,TurdWranglin,"Yeah, even the Texans didn’t lose to us. What a weird game that was for both our teams.",20.0,nfl,t3_zbkrjh,False,0.0,:Colts: Colts,2022-12-03T11:59:36Z,colts,-0.12095
19716,138155,138155,TurdWranglin,"In some cases it does. It also refers to when a player gets injured in practice. Im not making this up. Go back and look at last year when TY got hurt in practice.

Source: [See bottom paragraph of page 3. “A healthy player who is injured during practice and, as the result, is unable to complete the practice should also be listed as “Limited Participation,” with an accompanying description of the player’s new injury or reaggravation of a prior injury.”](https://operations.nfl.com/media/2683/2017-nfl-injury-report-policy.pdf)",1.0,colts,t3_z9zs0l,False,0.0,Big-Q,2022-12-03T10:14:06Z,colts,-0.0703817772633744
19717,138156,138156,TurdWranglin,"He practiced Wednesday and then was limited practice on Thursday. In the past that usually means they got hurt in practice and didn’t finish. Hopefully it’s a minor knee thing, but it isn’t a good look when you have no issue one day and then the next you don’t finish practice.",0.0,colts,t3_z9zs0l,False,0.0,Big-Q,2022-12-02T18:18:16Z,colts,0.0798962962962963
19718,138157,138157,TurdWranglin,Usually it means they got hurt in practice and left early (which is why it’s limited).,1.0,colts,t3_z9zs0l,False,0.0,Big-Q,2022-12-02T16:56:56Z,colts,-0.6486
20449,143234,143234,Urgonnahateme4ever,Of course YOU'RE willing to take that chance lol. Come on man,14.0,colts,t3_zfkcb0,False,0.0,General Luck,2022-12-07T19:26:56Z,colts,0.146475
20450,143235,143235,Urgonnahateme4ever,"But there's no guarantee Stroud is gonna be that good.   Manning and Luck were sure things.  If Stroud was a ""can't miss"" guy I'd be all for it.",12.0,colts,t3_zfkcb0,False,0.0,General Luck,2022-12-07T19:21:10Z,colts,0.1252111111111111
20451,143236,143236,Urgonnahateme4ever,"What the Fuck are you smoking?!?!??! That's a Peyton Manning/Andrew Luck God tier trade price tag!  

2 1sts AND Defo? Get the fuck outta here with that shit",34.0,colts,t3_zfkcb0,False,0.0,General Luck,2022-12-07T19:16:23Z,colts,-0.19171953125
20452,143237,143237,Urgonnahateme4ever,"We're talking about MVP in 2019? Bro it's about to be 2023.  He has one...ONE playoff win and he wasn't even the reason they won that game.

Josh Allen is better
Mahomes is better
Burrow is better
Brady is old as shit and is still better
Hurts is better
  

AND there's a few more guys that are outplaying him this season as well.",1.0,colts,t3_zf4cie,False,0.0,General Luck,2022-12-07T11:53:26Z,colts,0.2601
