,Unnamed: 0.1,Unnamed: 0,author,body,score,subreddit,link_id,over_18,controversiality,author_flair_text,created_utc,flair,sentiment
200,1850,1850,365wong,Just leaving the real GOAT Payton off your list. Shame. (Biased),2.0,nfl,t3_zbzumd,False,0.0,:Colts: Colts,2022-12-04T06:17:15Z,colts,-0.1440333333333333
651,8798,8798,AndThenHeToreHisAss,the Colts getting blown out in primetime with the post-game interview being Malik Hooker is the beginning of my Joker arc,200.0,colts,t3_zcww6r,False,0.0,Big Dick Ballard,2022-12-04T22:41:22Z,colts,0.128
652,8800,8800,AndThenHeToreHisAss,Is this what it feels like? I am covered in piss and my girlfriend locked herself in the bathroom. Is this what being a Colts fan is supposed to be? What happened?,17.0,colts,t3_zcqpgz,False,0.0,Big Dick Ballard,2022-12-04T22:32:18Z,colts,0.0150187499999999
653,8801,8801,AndThenHeToreHisAss,"Hear me out guys — 

We fire Jeff Saturday and bring in longtime Colts consultant, Satan",16.0,colts,t3_zcqpgz,False,0.0,Big Dick Ballard,2022-12-04T22:30:29Z,colts,-0.34
654,8802,8802,AndThenHeToreHisAss,This is like Remember The Titans except I am going to kill myself,13.0,colts,t3_zcqpgz,False,0.0,Big Dick Ballard,2022-12-04T22:27:50Z,colts,-0.4939
655,8803,8803,AndThenHeToreHisAss,Imma just pretend that we won this game and we actually scored 50 points lol I am gaslighting myself for the rest of the season. Hope you guys have fun in your own way coping with this actual bag of flaming dogshit that is this team,5.0,colts,t3_zcqpgz,False,0.0,Big Dick Ballard,2022-12-04T22:24:15Z,colts,0.549275
656,8804,8804,AndThenHeToreHisAss,"Look around folks — this is our Indianapolis Colts team for a long while. We are not quite bad enough to get a good draft reset, not quite good enough to get anywhere near the playoffs. 

Welcome to limbo. Get comfortable.",4.0,colts,t3_zcqpgz,False,0.0,Big Dick Ballard,2022-12-04T22:20:54Z,colts,0.164415625
985,13181,13181,AtlasInElysium,Brilliant pun,3.0,colts,t3_zdawnd,False,0.0,The Ghost,2022-12-05T16:41:46Z,colts,0.5859
1579,18748,18748,BroIBeliveAtYou,You mean like the [illegal snap](https://www.youtube.com/watch?v=Yc-XarAST1k) from the Ohio State / Michigan game?,2.0,nfl,t3_zcodwq,False,0.0,:Colts: Colts,2022-12-04T16:46:34Z,colts,-0.3527
1599,21145,21145,Capinhappy,"The same could have been said for Lamar. All of this. In his MVP season he averaged 200 ypg. What was the difference? Baltimore developed a system around their qb, they didn't try to change the qb to their system. Chicago's best qb they had before fields was Jay Cutler and he came to them very developed and regressed. Systems like Chicago, Cleveland, and Jacksonville (possibly different now with Pederson) have been bad teams because they can't develop their quarterback or hold them back trying to change their game.",8.0,colts,t3_zb8e87,False,0.0,Playoffs? PLAYOFFS!?,2022-12-03T09:02:33Z,colts,-0.0227163265306122
1600,21146,21146,Capinhappy,So we are going to just completely gloss over Chicago's horrible history of developing quarterbacks? Fields has had to adapt to a run-based offense and has done amazing. Couple that with his leadership he showed recently and I think he is a guy who could be a star in the league.,19.0,colts,t3_zb8e87,False,0.0,Playoffs? PLAYOFFS!?,2022-12-03T08:08:28Z,colts,0.0267481481481481
1601,21147,21147,Capinhappy,You're being down voted but you're not wrong.,0.0,colts,t3_zb8e87,False,0.0,Playoffs? PLAYOFFS!?,2022-12-03T08:05:39Z,colts,0.5157
3045,36853,36853,DaftWarrior,They hated Jesus because he told the truth. Or something like that lol.,2.0,colts,t3_zf69xm,False,0.0,Jimmy from the Colts,2022-12-07T13:32:58Z,colts,0.2141999999999999
3046,36854,36854,DaftWarrior,"Nah. I see him taking interim job as helping his buddy, Irsay.  He's been saying all the right things and keeping (?) the players motivated. Realistically, I expect Irsay to hire a legitimate HC this offseason.",4.0,colts,t3_zf69xm,False,0.0,Jimmy from the Colts,2022-12-07T12:45:54Z,colts,0.0187927359999999
3047,36856,36856,DaftWarrior,What I'd do to have another year with Rivers. At the time people thought he was cooked. Rivers with last year's JT...We win a playoff game at the least. If only they knew how bad it would get.,3.0,colts,t3_zf0obu,False,0.0,Jimmy from the Colts,2022-12-07T09:36:24Z,colts,-0.09895625
3048,36857,36857,DaftWarrior,Luck made this dude. Ebron's career was the most affected when Luck retired.,2.0,colts,t3_zeri19,False,0.0,Jimmy from the Colts,2022-12-07T09:24:43Z,colts,0.2815
3049,36866,36866,DaftWarrior,Right? They haven't been to the playoff since 2016 lol.,3.0,colts,t3_zdfbhy,False,0.0,Jimmy from the Colts,2022-12-05T12:55:22Z,colts,0.21075
3050,36867,36867,DaftWarrior,"Must not be seeing the posts in this sub, then. People want him.",1.0,colts,t3_zdepc7,False,0.0,Jimmy from the Colts,2022-12-05T12:52:32Z,colts,0.0386
3051,36868,36868,DaftWarrior,One of this sub's criticism about Ballard is drafting developmental project players. Why do we suddenly want a project QB?,3.0,colts,t3_zdepc7,False,0.0,Jimmy from the Colts,2022-12-05T12:50:31Z,colts,-0.0715
3052,36870,36870,DaftWarrior,"To all those who wanted Baker in the offseason, now is our chance lol. (Please don't)",13.0,colts,t3_zdafwr,False,0.0,Jimmy from the Colts,2022-12-05T10:37:35Z,colts,0.305575
3053,36872,36872,DaftWarrior,"It’s the fact that every game we look competent in some form building hope, only to shit it all away in terrible fashion.",1.0,colts,t3_zcyhx2,False,0.0,Jimmy from the Colts,2022-12-05T09:17:45Z,colts,-0.3612
3054,36873,36873,DaftWarrior,"Dude…if you fire your HC mid season you’ve admitted you’re cooked. Saturday was brought in to evaluate the team going into next year. Nothing more, nothing less.",2.0,colts,t3_zcww6r,False,0.0,Jimmy from the Colts,2022-12-04T22:58:06Z,colts,-0.0092592592592592
3055,36874,36874,DaftWarrior,"Dude, this team is not worth staying up for",13.0,colts,t3_zcww6r,False,0.0,Jimmy from the Colts,2022-12-04T22:50:51Z,colts,-0.1695
3056,36875,36875,DaftWarrior,Matt Ryan is so fucking bad. He can’t be our QB next season,120.0,colts,t3_zcww6r,False,0.0,Jimmy from the Colts,2022-12-04T22:32:46Z,colts,-0.15535
3057,36876,36876,DaftWarrior,Still didn’t score more than 20 damn,5.0,colts,t3_zcqpgz,False,0.0,Jimmy from the Colts,2022-12-04T22:28:57Z,colts,-0.4522
3058,36877,36877,DaftWarrior,Matt Ryan fucking SUCKS,2.0,colts,t3_zcqpgz,False,0.0,Jimmy from the Colts,2022-12-04T22:22:40Z,colts,-0.5463
3059,36879,36879,DaftWarrior,Another pick LOL,4.0,colts,t3_zcqpgz,False,0.0,Jimmy from the Colts,2022-12-04T22:08:39Z,colts,0.5473
3060,36880,36880,DaftWarrior,LOL,4.0,colts,t3_zcqpgz,False,0.0,Jimmy from the Colts,2022-12-04T21:47:39Z,colts,0.4215
3061,36886,36886,DaftWarrior,Wtf is Ryan doing,0.0,colts,t3_zcqpgz,False,0.0,Jimmy from the Colts,2022-12-04T21:23:46Z,colts,-0.5859
3062,36887,36887,DaftWarrior,Parks get off Reddit and call a better game,3.0,colts,t3_zcqpgz,False,0.0,Jimmy from the Colts,2022-12-04T21:02:25Z,colts,0.4404
3063,36889,36889,DaftWarrior,Yes,3.0,colts,t3_zcqpgz,False,0.0,Jimmy from the Colts,2022-12-04T20:51:31Z,colts,0.4019
3064,36890,36890,DaftWarrior,Please eat the dead cap and cut Ryan jesus,12.0,colts,t3_zcqpgz,False,0.0,Jimmy from the Colts,2022-12-04T20:50:20Z,colts,-0.6249
3065,36891,36891,DaftWarrior,Can thank the clock stopping on every first down for that,1.0,colts,t3_zcqpgz,False,0.0,Jimmy from the Colts,2022-12-04T19:59:55Z,colts,0.2263
3066,36892,36892,DaftWarrior,Will try. Was great seeing y’all spank the tits,8.0,colts,t3_zcqpgz,False,0.0,Jimmy from the Colts,2022-12-04T19:58:09Z,colts,0.24695
3067,36896,36896,DaftWarrior,ARE WE GONNA WIN??,4.0,colts,t3_zcqpgz,False,0.0,Jimmy from the Colts,2022-12-04T19:50:13Z,colts,0.146475
3068,36897,36897,DaftWarrior,Are we gonna fuck around and win this game bruh,5.0,colts,t3_zcqpgz,False,0.0,Jimmy from the Colts,2022-12-04T19:49:17Z,colts,0.0772
3069,36898,36898,DaftWarrior,JT is so damn good,1.0,colts,t3_zcqpgz,False,0.0,Jimmy from the Colts,2022-12-04T19:48:30Z,colts,0.425
3070,36899,36899,DaftWarrior,All TDs are reviewed smart guy,4.0,colts,t3_zcqpgz,False,0.0,Jimmy from the Colts,2022-12-04T19:44:39Z,colts,0.4019
3071,36923,36923,DaftWarrior,"Guarantee he goes back to Denver before Indy.

Edit: Im talking about Manning btw, smart guys.",-1.0,colts,t3_zbj1hk,False,1.0,Jimmy from the Colts,2022-12-03T16:50:30Z,colts,0.2634499999999999
3072,36926,36926,DaftWarrior,Just threw a bad pick,-2.0,colts,t3_zb7790,False,0.0,Jimmy from the Colts,2022-12-02T22:32:59Z,colts,-0.5423
4312,44027,44027,Dredais,A dumpster for the colts @ jags game,68.0,colts,t3_zf4jlu,False,0.0,#99 Buckner,2022-12-07T10:23:05Z,colts,-0.1531
4313,44028,44028,Dredais,Correct me if I’m wrong but wasn’t he a pretty meh head coach before?,179.0,colts,t3_zf0ymf,False,0.0,#99 Buckner,2022-12-07T07:29:24Z,colts,0.4215
4314,44030,44030,Dredais,His pretty plays are very pretty. I dunno if this team can develop him or if he’s capable of taking the next step though,2.0,colts,t3_zeetvc,False,0.0,#99 Buckner,2022-12-06T13:16:28Z,colts,0.3975999999999999
4315,44031,44031,Dredais,This is the most uncomfortable r/Colts post ever,114.0,colts,t3_zdgq6q,False,0.0,#99 Buckner,2022-12-05T13:29:05Z,colts,-0.4391
4316,44032,44032,Dredais,If we do that I hope we’re a hell of a lot better at developing qbs than defensive ends,27.0,colts,t3_zdeuwi,False,0.0,#99 Buckner,2022-12-05T12:23:16Z,colts,0.0772
4317,44033,44033,Dredais,I fell asleep at the start of the 4th woke up to the final score and wasn’t even surprised. This team is something else,50.0,colts,t3_zdba02,False,0.0,#99 Buckner,2022-12-05T10:21:33Z,colts,0.056575
4318,44035,44035,Dredais,My bad man I’m trying,5.0,colts,t3_zcqpgz,False,0.0,#99 Buckner,2022-12-04T20:22:09Z,colts,-0.5423
4319,44036,44036,Dredais,"Great moments are born from great opportunity, and that's what you have here tonight, boys. That's what you've earned here tonight. One game; if we played them ten times, they might win nine. But not this game, not tonight. Tonight, we hit with them. Tonight we stay with them, and we shut them down because we can. Tonight, we are the greatest football team in the world.",4.0,colts,t3_zcqpgz,False,0.0,#99 Buckner,2022-12-04T19:12:13Z,colts,0.0910305449745793
4320,44037,44037,Dredais,This is probably the first game this year where I don’t care a whole lot about the results,4.0,colts,t3_zcatfm,False,0.0,#99 Buckner,2022-12-04T08:34:43Z,colts,0.4939
4321,44038,44038,Dredais,"Mr. Keefer

If forced to pick between Anthony Richardson and Will Levis, who you got?",6.0,colts,t3_zam7zq,False,0.0,#99 Buckner,2022-12-02T08:01:32Z,colts,-0.4588
6026,57467,57467,HighlightWrong7555,Ha I thought this was in reference to Parks,2.0,colts,t3_zf0ymf,False,0.0,Jimmy from the Colts,2022-12-07T09:35:50Z,colts,0.34
6696,60048,60048,HyKaliber,"Thank you!! I appreciate the response

I'm getting dusted in the comments but I've been trying to compile in my comment both sides of the story to stay clear of bias, including this aspect of the case. I appreciate it",2.0,nfl,t3_zfch46,False,0.0,:Colts: Colts,2022-12-07T18:29:29Z,colts,0.2142592592592592
6697,60049,60049,HyKaliber,"Because each of the details are, in their own right, concerning. But all together make for a much more concerning picture

I don't know what AITA is but I'll remove it if it's confusing or distracting",-5.0,nfl,t3_zfch46,False,0.0,:Colts: Colts,2022-12-07T16:33:12Z,colts,-0.3155
6698,60050,60050,HyKaliber,That's why I prefaced my original comment with alledged,-13.0,nfl,t3_zfch46,False,0.0,:Colts: Colts,2022-12-07T16:31:59Z,colts,0.3182
6699,60051,60051,HyKaliber,"Wouldn't that be perjury of the accuser's representatives to say that there was a phone call, detail parts of the transcript in the [document](https://mobile.twitter.com/DaveGreber4/status/1562955186233978880?ref_src=twsrc%5Etfw%7Ctwcamp%5Etweetembed%7Ctwterm%5E1562955186233978880%7Ctwgr%5E9176600d641d119173322df4981b14b0a20d988a%7Ctwcon%5Es1_&ref_url=https%3A%2F%2Fdailysnark.com%2F2022%2F08%2F26%2Fmatt-araiza-told-alleged-victim-to-get-tested-for-stds-during-a-police-monitored-phone-call%2F), and confirm that law enforcement was present and monitoring?

Edit: have yet to get an answer or explanation for this. Genuinely asking",0.0,nfl,t3_zfch46,False,1.0,:Colts: Colts,2022-12-07T15:24:37Z,colts,0.0153666666666666
6700,60052,60052,HyKaliber,"Thanks, I'll add that to my original comment for an update

Edit: I'd like to note, we dont even know who the accuser is. This video is still irrelevant",-8.0,nfl,t3_zfch46,False,1.0,:Colts: Colts,2022-12-07T14:44:51Z,colts,0.192925
6701,60053,60053,HyKaliber,">There’s video of her telling people at the party she was 18…

Source?

Edit: added the source to my comment! Thanks",-17.0,nfl,t3_zfch46,False,1.0,:Colts: Colts,2022-12-07T14:41:32Z,colts,0.1616851851851851
6702,60054,60054,HyKaliber,Yeah I removed that point because it's possible they didn't know they had Chlamydia until it flared up,4.0,nfl,t3_zfch46,False,0.0,:Colts: Colts,2022-12-07T14:40:54Z,colts,0.296
6703,60055,60055,HyKaliber,"They gave a 17 year old alcohol and had sex, even if she lied, she was still 17 and intoxicated. That is undisputable.",-79.0,nfl,t3_zfch46,False,0.0,:Colts: Colts,2022-12-07T14:35:56Z,colts,-0.09545
6704,60056,60056,HyKaliber,"It was on a phone call. Let me find it

[Here](https://www.dailymail.co.uk/sport/sportsnews/article-11149189/Bills-punter-Matt-Araiza-told-rape-accuser-17-tested-STDs.html). Don't love the daily mail, but you can look it up, there are a bunch of different articles covering it",5.0,nfl,t3_zfch46,False,1.0,:Colts: Colts,2022-12-07T14:30:39Z,colts,-0.0974666666666666
6705,60057,60057,HyKaliber,"And the details were [horrific](https://www.nbcnews.com/news/us-news/woman-accusing-matt-araiza-rape-says-cant-stop-thinking-assault-rcna46060)

[Pictures](https://darik.news/usa/sports/photos-allege-injury-caused-by-matt-araiza-sdsu-teammates-gang-rape-nbc-7-san-diego.html) of bruising to the neck and legs

Confirmed:

* 17 years old *([alledged video](https://twitter.com/_majornews/status/1565148412726710273?s=46&t=rnYXm7SrsLQX8DgIPtYMXg) of a woman at a party claiming to be 18. The accuser's identity has not been released, so this doesn't Inherently support Matt without the identity of the accuser)*
* Intoxicated
* Had sex with a 17 y/o

^*Obviously* ^*not* ^*a* ^*lawyer*",106.0,nfl,t3_zfch46,False,0.0,:Colts: Colts,2022-12-07T14:21:43Z,colts,-0.053975
6706,60058,60058,HyKaliber,"You could say the same about Urlacher, too. Adding the variable of ""different career trajectories"" makes the whole discussion too muddy.

The question and the original comment states ""Urlacher **is** a HOFer"" which implies we're sticking with the same skill/career path for Tom Brady, as well.",1.0,nfl,t3_zer3bv,False,0.0,:Colts: Colts,2022-12-07T09:07:31Z,colts,0.1755666666666666
6707,60060,60060,HyKaliber,He quit on the team part-way through the season after he wasn't getting targeted and complained on Twitter. Good riddance,2.0,colts,t3_zeri19,False,0.0,I Hate Gus Bradley,2022-12-07T08:22:51Z,colts,0.119725
6708,60061,60061,HyKaliber,"Jimmy: ""Jelani's playing really well....too well 🤨 bench him.""",1.0,colts,t3_zf1k0u,False,0.0,I Hate Gus Bradley,2022-12-07T08:18:58Z,colts,0.4902
6709,60062,60062,HyKaliber,"Tbf they're so right. The real reason we're an awful team?

Special Teams

Edit: /s",6.0,colts,t3_zeri19,False,0.0,I Hate Gus Bradley,2022-12-07T05:15:46Z,colts,0.0829888888888888
6710,60063,60063,HyKaliber,"That cannot ""*literally*"" be the stupidest comment you have **ever** seen. There's no way",8.0,colts,t3_zeri19,False,0.0,I Hate Gus Bradley,2022-12-07T02:31:54Z,colts,-0.279675
6711,60064,60064,HyKaliber,">I don't really see where you see an argument

I just meant it as a clarification in case it came off as otherwise",1.0,nfl,t3_zer3bv,False,0.0,:Colts: Colts,2022-12-06T23:39:58Z,colts,-0.3612
6712,60065,60065,HyKaliber,Choosing to believe this because it supports my stance,12.0,colts,t3_zeri19,False,0.0,I Hate Gus Bradley,2022-12-06T22:30:00Z,colts,0.3612
6713,60067,60067,HyKaliber,"Absolutely agreed. It's unfortunate that it's most accessible feature –PFF Grades– are so controversial and don't align with the eye test.

That being said, it's tracking it's undeniably the best",9.0,nfl,t3_zeo88z,False,0.0,:Colts: Colts,2022-12-06T21:39:23Z,colts,0.1519444444444444
6714,60068,60068,HyKaliber,"As long as PFR is still going, I'm happy",26.0,nfl,t3_zeo88z,False,0.0,:Colts: Colts,2022-12-06T19:23:42Z,colts,0.5719
6715,60069,60069,HyKaliber,I have no horse in this AFC North race. Just seemed needlessly argumentative and petty,27.0,nfl,t3_zejmhp,False,0.0,:Colts: Colts,2022-12-06T16:28:38Z,colts,-0.3293
6716,60070,60070,HyKaliber,"Not even what that comment was about, why did you feel the need to try and start an argument",33.0,nfl,t3_zejmhp,False,0.0,:Colts: Colts,2022-12-06T16:22:33Z,colts,-0.3612
6717,60071,60071,HyKaliber,"Two sides

* ""Wow Lamar is so succesful and at so young!""

* ""Is stetson a fossil?""",276.0,nfl,t3_zejmhp,False,0.0,:Colts: Colts,2022-12-06T16:15:37Z,colts,0.155975
6718,60072,60072,HyKaliber,But...this is the internet? There's no way,3.0,colts,t3_ze2p72,False,0.0,I Hate Gus Bradley,2022-12-06T07:02:36Z,colts,-0.148
6719,60073,60073,HyKaliber,"No shot

We're full steam on Thomas the Tank",24.0,nfl,t3_ze3rba,False,0.0,:Colts: Colts,2022-12-06T06:05:13Z,colts,-0.296
6720,60074,60074,HyKaliber,"24mil dead cap, I don't know

Where did you see/hear this?",3.0,colts,t3_ze2p72,False,0.0,I Hate Gus Bradley,2022-12-06T05:05:08Z,colts,-0.6486
6721,60075,60075,HyKaliber,The actual reason is the current top [comment](https://www.reddit.com/r/colts/comments/zdocj8/_/iz2ki7u?context=1000),1.0,colts,t3_zdocj8,False,0.0,I Hate Gus Bradley,2022-12-05T20:00:35Z,colts,0.2023
6722,60076,60076,HyKaliber,Because [that](https://www.reddit.com/r/colts/comments/zdocj8/_/iz2jduu?context=1000) reason isn't true lol,1.0,colts,t3_zdocj8,False,0.0,I Hate Gus Bradley,2022-12-05T19:17:39Z,colts,-0.5667
6723,60077,60077,HyKaliber,"In retrospect, it would read like ""yeah...we've seen enough of this fucking garbage""",134.0,nfl,t3_zdor8g,False,0.0,:Colts: Colts,2022-12-05T18:35:11Z,colts,0.3612
6724,60078,60078,HyKaliber,Yeah it's kinda backwards,9.0,colts,t3_zdgq6q,False,0.0,I Hate Gus Bradley,2022-12-05T18:29:00Z,colts,0.296
6725,60079,60079,HyKaliber,"Bad shoulder>rushed back>released>started hot>COVID>we bad again

Edit: I'm agreeing with the user above me",8.0,nfl,t3_zdjjjw,False,0.0,:Colts: Colts,2022-12-05T15:04:32Z,colts,-0.6808
6726,60082,60082,HyKaliber,"This comment is so funny.

Too much anime lmao

I don't even watch anime but it's worded so funny",18.0,nfl,t3_zcyb5l,False,0.0,:Colts: Colts,2022-12-04T23:48:45Z,colts,0.554725
6727,60083,60083,HyKaliber,Super yes,16.0,nfl,t3_zcxgbz,False,0.0,:Colts: Colts,2022-12-04T23:10:46Z,colts,0.765
6728,60086,60086,HyKaliber,"What's it like being the only AFCS team not having a top 10 draft pick

*...and going to the playoffs or whatever* 🙄",35.0,nfl,t3_zcwz61,False,0.0,:Colts: Colts,2022-12-04T22:38:14Z,colts,0.2283
6729,60088,60088,HyKaliber,"Yo we are not a good team

LETS GOOOO",130.0,colts,t3_zcww6r,False,0.0,I Hate Gus Bradley,2022-12-04T22:31:41Z,colts,-0.3412
6730,60089,60089,HyKaliber,I always knew Malik was still a Colt 💙,15.0,nfl,t3_zcw0lc,False,0.0,:Colts: Colts,2022-12-04T21:49:45Z,colts,0.6369
6731,60092,60092,HyKaliber,"Silence mixed with the audio of cigarette drags

....so basically [Mac's mom](https://youtu.be/fshwooKkKkk)",12.0,nfl,t3_zcti06,False,0.0,:Colts: Colts,2022-12-04T20:04:31Z,colts,-0.1779
6732,60095,60095,HyKaliber,"Trust me, they were not",19.0,nfl,t3_zct6xv,False,0.0,:Colts: Colts,2022-12-04T19:52:09Z,colts,0.5106
6733,60096,60096,HyKaliber,What the fuck was that,40.0,nfl,t3_zct6xv,False,0.0,:Colts: Colts,2022-12-04T19:51:16Z,colts,-0.5423
6734,60099,60099,HyKaliber,"Liz Frank, That bitch",51.0,nfl,t3_zcrm19,False,0.0,:Colts: Colts,2022-12-04T18:49:13Z,colts,-0.5859
6735,60100,60100,HyKaliber,"Risky decision wow

Ignores the RB Checkdown for the absolute missile to Hill",62.0,nfl,t3_zcq5b3,False,0.0,:Colts: Colts,2022-12-04T17:52:04Z,colts,0.2263
6736,60101,60101,HyKaliber,"That looks really bad, but ankles can bend in weird ways without being super fucked

Key word: *super*",17.0,nfl,t3_zcnco3,False,0.0,:Colts: Colts,2022-12-04T16:14:35Z,colts,0.5359
6737,60104,60104,HyKaliber,I feel attacked and we weren't even mentioned,36.0,nfl,t3_zcm91e,False,0.0,:Colts: Colts,2022-12-04T15:27:23Z,colts,-0.4588
6738,60105,60105,HyKaliber,Texans got assaulted on the scorebox,47.0,nfl,t3_zcm05v,False,0.0,:Colts: Colts,2022-12-04T15:19:13Z,colts,-0.5267
6739,60106,60106,HyKaliber,">*surely you can get a yard in 3 attempts no matter how good the run defense has been*

You haven't watched the Colts, then.",12.0,nfl,t3_zclv04,False,0.0,:Colts: Colts,2022-12-04T15:16:37Z,colts,0.7372
6740,60107,60107,HyKaliber,"They tried twice before that

If they ran it again, we'd be saying ""how stupid can you be to run on 3 of 4 plays in a row""",107.0,nfl,t3_zclv04,False,0.0,:Colts: Colts,2022-12-04T15:13:52Z,colts,-0.34
6741,60109,60109,HyKaliber,"Hurts is washed, obviously",107.0,nfl,t3_zclch4,False,0.0,:Colts: Colts,2022-12-04T14:55:19Z,colts,-0.4767
6742,60110,60110,HyKaliber,"Yeah I didn't love saying it either

Enemy of my enemy, though",1.0,nfl,t3_zchnqu,False,0.0,:Colts: Colts,2022-12-04T14:05:33Z,colts,-0.8469
6743,60111,60111,HyKaliber,"Yes, they were accused of it. But I'm asking for the proof or official confirmation that they knew and knowingly enabled it",2.0,nfl,t3_zchnqu,False,1.0,:Colts: Colts,2022-12-04T13:59:40Z,colts,0.032
6744,60112,60112,HyKaliber,"Whoah, that's crazy.

>Werent they were the ones that allowed watson do the sexual assaults

And the source that they knowingly did this?",-3.0,nfl,t3_zchnqu,False,0.0,:Colts: Colts,2022-12-04T13:48:58Z,colts,-0.35615
6745,60113,60113,HyKaliber,Sounds good,3.0,nfl,t3_zcip8e,False,0.0,:Colts: Colts,2022-12-04T13:45:29Z,colts,0.4404
6746,60114,60114,HyKaliber,"Wow, where's the source on that",0.0,nfl,t3_zchnqu,False,0.0,:Colts: Colts,2022-12-04T13:45:15Z,colts,0.5859
6747,60116,60116,HyKaliber,"A rare time somebody uses the injury tag correctly

Edit: OH FUCK. Hope he's okay",120.0,nfl,t3_zcj93j,False,0.0,:Colts: Colts,2022-12-04T13:39:15Z,colts,0.0948249999999999
6748,60117,60117,HyKaliber,"Really getting your money's worth out of this 8 day old account hey. Who's the next QB?

Keep it up",65.0,nfl,t3_zcj6cy,False,0.0,:Colts: Colts,2022-12-04T13:37:14Z,colts,0.0083814814814814
6749,60121,60121,HyKaliber,The Aaron Rodgers interview last year was pretty close,16.0,nfl,t3_zci7ep,False,0.0,:Colts: Colts,2022-12-04T13:02:14Z,colts,0.4939
6750,60122,60122,HyKaliber,"YOU LOVE TO SEE  IT

Don't love that for Chubb on my fantasy team

BUT THAT'S OKAY",274.0,nfl,t3_zci7ep,False,0.0,:Colts: Colts,2022-12-04T13:00:40Z,colts,0.6407
6751,60123,60123,HyKaliber,I love the Houston Texans,1736.0,nfl,t3_zchnqu,False,0.0,:Colts: Colts,2022-12-04T12:40:11Z,colts,0.6369
6752,60126,60126,HyKaliber,"I agree, but that's why I specified it's ""kind of a silver lining""",10.0,nfl,t3_zceg17,False,0.0,:Colts: Colts,2022-12-04T11:45:42Z,colts,0.1901
6753,60128,60128,HyKaliber,But isn't the NFL Players Association supposed to be biased to..the players?,16.0,nfl,t3_zceg17,False,0.0,:Colts: Colts,2022-12-04T11:42:42Z,colts,-0.3919
6754,60129,60129,HyKaliber,Atleast you agree he's a rapist,7.0,nfl,t3_zcfr0m,False,0.0,:Colts: Colts,2022-12-04T11:39:39Z,colts,-0.5267
6755,60130,60130,HyKaliber,"Hate Deshaun as much as everyone, but at least the NFLPA  Is unbiased to their members 🤷‍♂️ kind of a silver lining I guess",9.0,nfl,t3_zceg17,False,0.0,:Colts: Colts,2022-12-04T11:38:48Z,colts,-0.3612
6756,60133,60133,HyKaliber,Yeah!,7.0,nfl,t3_zcd55u,False,0.0,:Colts: Colts,2022-12-04T10:22:18Z,colts,0.3595
6757,60134,60134,HyKaliber,Gross,3.0,nfl,t3_zcdiet,False,0.0,:Colts: Colts,2022-12-04T10:08:57Z,colts,-0.4767
6758,60138,60138,HyKaliber,"I remember this game so well.

1. ""Luck's back!!!""

2. Doyle with a very rare mistake",44.0,nfl,t3_zbt3v1,False,0.0,:Colts: Colts,2022-12-03T18:06:04Z,colts,-0.079388768
6759,60140,60140,HyKaliber,I would be so insufferable as a bama/phins fan,95.0,nfl,t3_zbmjax,False,0.0,:Colts: Colts,2022-12-03T12:20:52Z,colts,0.3182
6760,60144,60144,HyKaliber,"PR, his HC, and GM all told him ""apologize and make up some excuse ffs""

Taking a millionaires word at face value that keeps him a millionaire is so naive",29.0,nfl,t3_zatamd,False,0.0,:Colts: Colts,2022-12-02T13:03:45Z,colts,-0.5332
6761,60145,60145,HyKaliber,"It's a valid system, originally layed out by the Glicko-2 rating system.

Removing anomalies or outliers (good **and** bad) you get a better picture of their performance",24.0,nfl,t3_zasoxh,False,0.0,:Colts: Colts,2022-12-02T12:07:47Z,colts,0.1591
6762,60146,60146,HyKaliber,"Sure, but what about the rest of his body?",65.0,nfl,t3_zas8yk,False,0.0,:Colts: Colts,2022-12-02T11:46:50Z,colts,0.1655
6763,60147,60147,HyKaliber,"""Meltdown"" or essentially being called a liar lol",32.0,nfl,t3_zarqa3,False,0.0,:Colts: Colts,2022-12-02T11:21:35Z,colts,-0.128
6764,60148,60148,HyKaliber,The fact anybody is going along with this is pretty cringe,45.0,nfl,t3_zaoy9k,False,0.0,:Colts: Colts,2022-12-02T09:25:28Z,colts,0.4939
6765,60149,60149,HyKaliber,sorry,1.0,nfl,t3_zanik0,False,0.0,:Colts: Colts,2022-12-02T09:17:14Z,colts,-0.0772
6766,60150,60150,HyKaliber,"If it was real lightning, the cameras sensor would be so unbelievabley over-exposed. It would be entirely white. The fact that it looked like someone lit a sparkler, instead, gives it away.",12.0,nfl,t3_zamgni,False,0.0,:Colts: Colts,2022-12-02T07:53:02Z,colts,0.1204
