,Unnamed: 0.1,Unnamed: 0,author,body,score,subreddit,link_id,over_18,controversiality,author_flair_text,created_utc,flair,sentiment
23717,161158,161158,bufoeichwaldi,"I hate this season as much as anyone but it's literally 13-21 at the half and people are pissing and shitting lmao. Stfu and get ready for the second half.

EDIT: so many malders responding to me LMAO",7.0,colts,t3_zcqpgz,False,1.0,sigma = downvote,2022-12-04T20:52:18Z,colts,0.249562962962963
23718,161159,161159,bufoeichwaldi,When does the suffering end?,17.0,colts,t3_zam7zq,False,0.0,sigma = downvote,2022-12-02T08:22:31Z,colts,-0.4767
24401,164802,164802,chadowan,Agreed. Maybe we can fool the Bears into taking Ryan Kelly + the 6th pick to go up to #2. I'd be happy to have an excuse to draft a center in the 3rd or 4th round anyways.,1.0,colts,t3_zdgmyx,False,0.0,A big ass pork tenderloin sandwich,2022-12-05T18:40:11Z,colts,0.1653185185185185
24402,164803,164803,chadowan,"I'm almost certain they're taking a QB, but they might fall in love with someone else in the process. Zach Wilson wasn't a highly lauded pick in 2020, but the Jets fell in love and took him #2 anyways.",3.0,colts,t3_zdgmyx,False,0.0,A big ass pork tenderloin sandwich,2022-12-05T18:33:06Z,colts,0.5897
24403,164804,164804,chadowan,"Depends on where Chicago ends up and what the Texans do. If Bryce Young is available the Bears will have a bidding war between the Panthers and Colts and likely more with Atlanta, Detroit, and Washington all in the mix. Regardless they're likely getting a pile of picks and a good player or two.",1.0,colts,t3_zdgmyx,False,0.0,A big ass pork tenderloin sandwich,2022-12-05T18:30:31Z,colts,0.0802
24404,164805,164805,chadowan,"It's the Texans we're talking about, they're not always known for making the best decisions for the future.",2.0,colts,t3_zdgmyx,False,0.0,A big ass pork tenderloin sandwich,2022-12-05T18:25:26Z,colts,0.6369
24405,164806,164806,chadowan,"True, we'll see on all that. Honestly I just wanted to think out loud on who we're likely to be competing with for QBs in this draft.",1.0,colts,t3_zdgmyx,False,0.0,A big ass pork tenderloin sandwich,2022-12-05T18:05:51Z,colts,0.334775
24406,164807,164807,chadowan,"Probably true. I'd bet they trade him to a team like the Bucs who think they're a veteran QB away from a SB and then draft a new guy with their Rams pick, but they're not a super well run organization, so it's hard to say.",1.0,colts,t3_zdgmyx,False,0.0,A big ass pork tenderloin sandwich,2022-12-05T16:21:59Z,colts,-0.280725
24407,164808,164808,chadowan,"I'm pretty sure someone is going to trade for #2 (possibly us), but it depends on how the draft boards shake out and what Houston does with #1.",2.0,colts,t3_zdgmyx,False,0.0,A big ass pork tenderloin sandwich,2022-12-05T14:54:21Z,colts,0.1779
24408,164809,164809,chadowan,All fair points. Maybe they should be closer to a 6 or 7 out of 10. Not guaranteed but very likely to draft a QB.,2.0,colts,t3_zdgmyx,False,0.0,A big ass pork tenderloin sandwich,2022-12-05T14:53:22Z,colts,0.0117851851851851
24409,164811,164811,chadowan,"Yeah, Houston is probably locked at #1 but 2-15 is totally up in the air still",12.0,colts,t3_zcmcc2,False,0.0,A big ass pork tenderloin sandwich,2022-12-04T16:33:39Z,colts,0.1531
24410,164813,164813,chadowan,You might need to start giving Ryan actual noodle arms in the future.,19.0,colts,t3_zatltq,False,0.0,A big ass pork tenderloin sandwich,2022-12-02T12:36:38Z,colts,0.34
25065,171140,171140,darcys_beard,"Manning was a pretty good QB too, you know. Didn't get the rings but he could play.",2.0,nfl,t3_zduxn3,False,0.0,:Colts: Colts,2022-12-06T03:46:05Z,colts,0.420075
25313,174523,174523,dixonjt89,I had PTSD of my hate for Cowher after those comments about Saturday. I kind of cooled off on him but now I’m back on the fuck him wagon.,13.0,colts,t3_zf7zp0,False,0.0,33-0,2022-12-07T14:14:07Z,colts,-0.4907749999999999
25314,174524,174524,dixonjt89,"Idk i’d prob put the Texans below Jags and Steelers, hard to be a team you hate when you own them",1.0,colts,t3_zf7zp0,False,0.0,33-0,2022-12-07T14:12:42Z,colts,-0.6705
25315,174525,174525,dixonjt89,"Here's the deal.

We can keep Jeff Saturday and he can be the motivator/calling people out type of coach with that hard nosed coaching style to make sure a fire is lit under peoples asses. Barring the 4th quarter of the Dallas game, the squad has fought HARD for him and have been competitive against two really really good teams, even a third team with how hot las vegas is getting.

If we keep him though, it's going to make the offensive coordinator position more important than it has been. We basically need another ""head coach"" at that position but a head coach who only focuses on the offense.

Or, we hire an offensive minded coach who will leave his imprint on the offense similar to what Frank did, and it's more of a head coach-offensive coordinator tandem approach.

I'm gonna be honest. I like the Saturday pick, and that's because he reminds me of another coach we had. Tony Dungy. Dungy seemed like he was a very hands off type of coach and didn't interfere too much which is OC or DC, and trusted the X's and O's to them. He managed the game more or less, and focused on supporting the players after a big play or talk them back up after a mistake.

Saturday is a bit on the opposite spectrum as being loud and calling people out, vs Dungy's style of quiet, talk individually type of talks though, but I think we need a more hard nosed coach after Franks timid coaching.",20.0,colts,t3_zf69xm,False,0.0,33-0,2022-12-07T12:29:14Z,colts,-0.040855109038347
25316,174563,174563,dixonjt89,"You hit the nail on the head.

You build an offense around the QB's strengths. If he has a big arm, then you draft tall speedy wide recievers who can either burn their guy or go up and get the ball at it's highest point. If he doesn't have a big arm and leans more on accuracy, then you get slippery route runners who can get open with their technique and fundamentals to get open, or the intelligence to expose a zone play.

When you try to plug and play a QB, you have to hope that someone who is coming up in Free Agency or the Draft has the traits to fit the team you have created. WR's and Linemen are a dime a dozen, whereas QB's are not. So it's easier to draft those positions to fit the QB, rather than drafting a QB to fit the WR's and Linemen.",5.0,colts,t3_zcz7pv,False,0.0,33-0,2022-12-05T08:22:56Z,colts,0.116467193091314
25317,174572,174572,dixonjt89,"Yeah, in this draft he would probably be around the 7th QB taken in rounds 3-4, if he has a repeat year of what he did this year he could likely shoot up to be in the top 3 and a 1st round pick…just in time for us to take him",1.0,colts,t3_zcv1ow,False,0.0,33-0,2022-12-05T00:18:36Z,colts,0.1531
25318,174573,174573,dixonjt89,Lmao this is amazing,10.0,colts,t3_zcwznb,False,0.0,33-0,2022-12-05T00:14:29Z,colts,0.8271
25319,174588,174588,dixonjt89,"Right now, your house has to be unable to not get Direct TV satellite to be able to get the streaming version by itself, to stream to your phone or computer through the internet.

If it is available, you MUST have a direct tv satellite service to then purchase the Sunday Ticket add on which will let you watch in on your TV, but then you also get the streaming to phone or computer for free I believe.

After the 2022 season, the sunday ticket rights expire for Direct TV, and Direct TV declined to negotiate to re-up the rights. Goodell has been on record saying it's going to go to streaming service, and right now four people have shown interest. Apple, Amazon, Disney and Google.",12.0,colts,t3_zajcm4,False,0.0,33-0,2022-12-02T12:34:37Z,colts,0.05499632
25556,177523,177523,fleckstin,"Idk man, there's been several times where everything just looks washed out and dull",-1.0,nfl,t3_zcll9y,False,0.0,:Colts: Colts,2022-12-04T15:47:24Z,colts,-0.4767
25557,177524,177524,fleckstin,"Well, yeah, but they're the Bills. The odds of them having a good/exciting game are pretty high naturally",1.0,nfl,t3_zcll9y,False,0.0,:Colts: Colts,2022-12-04T15:46:29Z,colts,0.3181
25558,177525,177525,fleckstin,"Amen, brother. The Colts are usually my main team but I found myself getting way too emotionally invested and taking whatever shitty things happened w them way too deeply. I decided to step back from following them as much just so I could appreciate the fact this is all a game and doesn't actually affect my life.

So naturally I decided to support the Lions",12.0,nfl,t3_zcll9y,False,0.0,:Colts: Colts,2022-12-04T15:13:14Z,colts,0.1176499999999999
25559,177527,177527,fleckstin,This was basically a better version of the Bills-Patriots game from the playoffs last year,6.0,nfl,t3_zclikw,False,0.0,:Colts: Colts,2022-12-04T15:08:33Z,colts,0.4404
25560,177528,177528,fleckstin,Interesting dual flairs you got there,13.0,nfl,t3_zcll9y,False,0.0,:Colts: Colts,2022-12-04T15:06:42Z,colts,0.4019
25561,177529,177529,fleckstin,Dude right? What is it w/ Thursday night games this year? Even the camera and production quality sucks,12.0,nfl,t3_zcll9y,False,0.0,:Colts: Colts,2022-12-04T15:06:26Z,colts,-0.1204
25562,177530,177530,fleckstin,Is your dual flair because you like mobile QB's,6.0,nfl,t3_zchqlf,False,0.0,:Colts: Colts,2022-12-04T15:03:28Z,colts,0.3612
25563,177531,177531,fleckstin,"This is the Lamar arc all over again lol. Shit the Lamar arc is still going and now people are pulling that dumb shit on Fields too.

Like, does anyone actually watch these guys play before they spout garbage takes?",44.0,nfl,t3_zcie97,False,0.0,:Colts: Colts,2022-12-04T15:02:04Z,colts,0.1166888888888889
25564,177532,177532,fleckstin,"I'm high and listening to music instead of watching so yes, yes I am",1.0,nfl,t3_zcfr5z,False,0.0,:Colts: Colts,2022-12-04T13:06:02Z,colts,0.7557
25565,177538,177538,fleckstin,When the ravens are on and Lamar is playing like Lamar they’re very exciting. Just inconsistent and the defense is disappointing. But dolphins are crazy fun too,1.0,nfl,t3_zbmc4e,False,0.0,:Colts: Colts,2022-12-03T16:10:57Z,colts,0.0938518518518518
25748,180808,180808,ghettomuffin,Probably embarrassed that he said we would go 14-2,3.0,colts,t3_zf4l7n,False,0.0,Strike gold for darnold,2022-12-07T19:27:31Z,colts,-0.3612
25749,180811,180811,ghettomuffin,Literally the biggest douche on this subreddit,19.0,colts,t3_zf4l7n,False,0.0,Strike gold for darnold,2022-12-07T13:35:23Z,colts,-0.3612
25750,180812,180812,ghettomuffin,"Good riddance. That guy was annoying as fuck, but I’m sure he’ll be back",9.0,colts,t3_zf4l7n,False,0.0,Strike gold for darnold,2022-12-07T13:34:52Z,colts,0.09075
25751,180821,180821,ghettomuffin,Why would you feel bad for him. He got the bag. I’m sure he feels just fine.,2.0,nfl,t3_zdf0el,False,0.0,:Colts: Colts,2022-12-06T05:52:25Z,colts,0.1388148148148148
25752,180825,180825,ghettomuffin,"Well he was wrong, what a fucking asshole…",5.0,nfl,t3_zcx71x,False,0.0,:Colts: Colts,2022-12-05T08:04:58Z,colts,-0.25
26255,183925,183925,holywhitefang1,"Oof, you may not be wrong which is sad. I've always loved Matt.",1.0,colts,t3_zf0obu,False,0.0,Playoffs? PLAYOFFS!?,2022-12-07T22:01:23Z,colts,0.2648
26256,183926,183926,holywhitefang1,"Love him, hope he stays to coach the o-line because he's made improvements. But as a head coach, I'd rather someone who can develop a QB.",1.0,colts,t3_zf69xm,False,0.0,Playoffs? PLAYOFFS!?,2022-12-07T13:13:45Z,colts,0.213875
26257,183927,183927,holywhitefang1,"Not sure why you're getting downvoted, it's true. Had he turned this season around people wouldn't have been mad at him. But no one could have turned this season around",1.0,colts,t3_zf0obu,False,0.0,Playoffs? PLAYOFFS!?,2022-12-07T12:06:58Z,colts,-0.0896111111111111
26258,183928,183928,holywhitefang1,"Andrew luck had one of if not his best seasons under frank, Philip rivers, Brisset prior to injury, and although Wentz had key terrible interceptions, he had one of his best statistical seasons. He's now a backup in Washington mind you, because they couldn't max out his potential. I'll die on this hill lol.

Google the statistics of each QB before and after Frank. Ryan is the only outlier.",19.0,colts,t3_zf0obu,False,0.0,Playoffs? PLAYOFFS!?,2022-12-07T07:16:12Z,colts,-0.002270656
26259,183929,183929,holywhitefang1,I hate how accurate this feels lol. Football season sucks this year 🤣,1.0,colts,t3_zcbdrn,False,0.0,Playoffs? PLAYOFFS!?,2022-12-04T15:48:29Z,colts,0.032375
26260,183930,183930,holywhitefang1,"In colts fashion, it will be just in reach as we choke in the 4th lol",15.0,colts,t3_zcbdrn,False,0.0,Playoffs? PLAYOFFS!?,2022-12-04T09:50:15Z,colts,-0.1531
26361,186932,186932,humanafterallex,Good night y’all!,6.0,colts,t3_zcqpgz,False,0.0,:ty: ty,2022-12-04T21:52:56Z,colts,0.4926
26362,186933,186933,humanafterallex,At least he didn’t lose the ball.,3.0,colts,t3_zcqpgz,False,0.0,:ty: ty,2022-12-04T20:06:14Z,colts,-0.4019
26879,191303,191303,jackrack1721,*Cries in Quarterback*,1.0,nfl,t3_zduxbz,False,0.0,:Colts: Colts,2022-12-05T22:16:45Z,colts,-0.4019
26880,191305,191305,jackrack1721,Brady throwing dimes but his offense is determined to lose.,0.0,nfl,t3_zdpyj0,False,0.0,:Colts: Colts,2022-12-05T21:23:18Z,colts,-0.4497
26882,191311,191311,jackrack1721,"We *almost* weren't horrible the first 46 minutes. Then someone zapped all of our players talents, ala Space Jam, NFL edition.",3.0,nfl,t3_zcwz61,False,0.0,:Colts: Colts,2022-12-04T23:11:00Z,colts,0.3234
27431,193138,193138,jbaugues,"That is my thinking too.  Reason I asked the question.  

I have seen so many comments that Russell has killed his HOF by playing this bad this year and I didn't think it was really possible.",7.0,nfl,t3_zddzai,False,0.0,:Colts: Colts,2022-12-05T12:02:08Z,colts,-0.2775666666666667
27432,193139,193139,jbaugues,Jelani woods used to play qb.,72.0,nfl,t3_zbibz5,False,0.0,:Colts: Colts,2022-12-03T10:45:15Z,colts,0.34
27433,193144,193144,jbaugues,Also can face copyright problems if hats are not officially licensed by nfl.,9.0,nfl,t3_zably5,False,0.0,:Colts: Colts,2022-12-02T10:50:39Z,colts,-0.4019
27664,194025,194025,jbvann05,"That's a really good point, though I still think trading DeFo and next year's first to move up seven picks is a bit too much",1.0,colts,t3_zfkcb0,False,0.0,Blue,2022-12-07T23:26:06Z,colts,0.4927
27665,194026,194026,jbvann05,"A good QB is obviously important yes, but trading a known elite player for an unproven QB is not a good idea, let alone to package our first round pick with it which is our insurance if whoever we pick doesn't work out",2.0,colts,t3_zfkcb0,False,0.0,Blue,2022-12-07T20:49:15Z,colts,-0.3419
27666,194027,194027,jbvann05,Throwing our defense away on a QB that might not even work is moronic. Even if it was a generational talent we need an elite defense to win a ring,1.0,colts,t3_zfkcb0,False,1.0,Blue,2022-12-07T20:41:33Z,colts,0.274725
28021,202218,202218,lotusbloom74,"I agree the loss is good long-term, being blown out probably isn’t but still could be depending if it makes more of the roster and front office be evaluated critically.",2.0,colts,t3_zcwznb,False,0.0,COLTS,2022-12-05T00:38:16Z,colts,0.2617
28022,202219,202219,lotusbloom74,Why not? We are in full tank mode (or should be) and he may actually give us the best chance to lose.,7.0,colts,t3_zcww6r,False,0.0,COLTS,2022-12-05T00:12:06Z,colts,0.27115
28023,202220,202220,lotusbloom74,"It’s not as far off as I was initially thinking. We actually did have some talented players in 2011 on offense even if they were towards the end of their careers, the quarterback woes really just do kill a team. The hope was that Taylor would be so good in combination with our (now overpaid) line that the offense could be great this year even with a QB on his way out of the league. Honestly it’s sad this once-promising season has turned into memories of 2011 especially considering there is no Andrew Luck on the other side.",3.0,colts,t3_zcyhx2,False,0.0,COLTS,2022-12-05T00:06:28Z,colts,-0.10349375
28024,202221,202221,lotusbloom74,"Cool dude, you beat one of the worst teams in the league at home.",27.0,colts,t3_zcybr0,False,0.0,COLTS,2022-12-04T23:55:35Z,colts,-0.4215
28025,202222,202222,lotusbloom74,"The Brawl sucked, I agree. That and the couple seasons after definitely bled fans. In general since like 2012 or so the Pacers have been pretty fun to watch though. Once the football season ends I recommend you check them out sometime, Halliburton is perhaps the best point guard they have ever had and Mathurin is a very promising rookie.",2.0,colts,t3_zcxcb5,False,0.0,COLTS,2022-12-04T23:51:27Z,colts,0.2746671875
28026,202223,202223,lotusbloom74,"I can see that viewpoint too but it’s just a different game. You must really not like baseball! Personally basketball has probably always been my favorite sport so I am a bit biased. I just would like the area to support the Pacers too, they were always the bigger attraction until Peyton.",1.0,colts,t3_zcxcb5,False,0.0,COLTS,2022-12-04T23:42:15Z,colts,0.208425
28027,202226,202226,lotusbloom74,"Pacers definitely have some hope for the future with their young talent. Tough road trip for them but they’ll be home soon, I’d like to go to the Washington game this Friday! I really wish Colts fans would support the Pacers more, it’s tough to see their attendance so low when the tickets are pretty reasonable.",1.0,colts,t3_zcxcb5,False,0.0,COLTS,2022-12-04T23:00:51Z,colts,0.3056185185185185
28028,202227,202227,lotusbloom74,"They at least have some redeeming qualities, but they clearly quit on this game due to offensive woes (understandable in my opinion but they’re also paid to be out there performing every snap).",2.0,colts,t3_zcww6r,False,0.0,COLTS,2022-12-04T22:44:50Z,colts,-0.6486
28029,202228,202228,lotusbloom74,"Football is such a painful sport most of the time being a Colts and IU fan lmao. We have some good pieces especially on defense but it’s clear this team needs a massive reset, not “we’re happy with the guys we have” mindset.",13.0,colts,t3_zcww6r,False,0.0,COLTS,2022-12-04T22:40:27Z,colts,0.22175
28030,202229,202229,lotusbloom74,"You imagine I care a lot more than I do, you’re the ignoramus wasting time in another team’s sub.",1.0,colts,t3_zcqpgz,False,0.0,COLTS,2022-12-04T22:30:17Z,colts,-0.34
28031,202230,202230,lotusbloom74,This is among the most embarrassing colts games I have ever seen. Jeff Saturday may be the GOAT tank commander.,12.0,colts,t3_zcqpgz,False,0.0,COLTS,2022-12-04T22:27:31Z,colts,-0.109775
28032,202231,202231,lotusbloom74,You’re quite the comedian! Nah Boston fans are just pricks for every sport,1.0,colts,t3_zcqpgz,False,0.0,COLTS,2022-12-04T22:23:12Z,colts,-0.0368749999999999
28033,202232,202232,lotusbloom74,God I hate Boston sports fans,1.0,colts,t3_zcqpgz,False,0.0,COLTS,2022-12-04T22:16:25Z,colts,-0.3818
28034,202233,202233,lotusbloom74,"The really pathetic thing is that the AFC South is so fucking weak that it should be nearly automatic to coast into first for the Colts. But alas, we suck too.",6.0,colts,t3_zcqpgz,False,0.0,COLTS,2022-12-04T22:04:12Z,colts,-0.582925
28035,202235,202235,lotusbloom74,Woods is already better,1.0,colts,t3_zcqpgz,False,0.0,COLTS,2022-12-04T21:49:34Z,colts,0.4404
29087,210767,210767,onmf,"You can’t just assume we *could’ve traded up*, this isn’t Madden. Plus if Ballard traded two or more high picks to move up and grab Mac jones and we had the Patriots record this year y’all would be after his head regardless.

I’m of the opinion that he should be given one last chance, he clearly has his problems but the grass is always greener.",2.0,colts,t3_ze9iuv,False,0.0,Dhalsim,2022-12-06T14:19:44Z,colts,0.0426666666666666
29088,210771,210771,onmf,Haha,4.0,colts,t3_zcqpgz,False,0.0,Dhalsim,2022-12-04T22:33:16Z,colts,0.4588
29089,210772,210772,onmf,A knee? Fuck this,11.0,colts,t3_zcqpgz,False,0.0,Dhalsim,2022-12-04T22:31:41Z,colts,-0.27115
29090,210773,210773,onmf,Colts bad,2.0,colts,t3_zcqpgz,False,0.0,Dhalsim,2022-12-04T22:05:47Z,colts,-0.5423
29091,210774,210774,onmf,He’s aight but the Colts are **BAD**,3.0,colts,t3_zcqpgz,False,0.0,Dhalsim,2022-12-04T21:50:56Z,colts,-0.7814
29092,210775,210775,onmf,This team is straight dick,4.0,colts,t3_zcqpgz,False,0.0,Dhalsim,2022-12-04T21:47:44Z,colts,-0.34
29093,210776,210776,onmf,"Carson was really bad, and I didn’t like him at all, but Ryan is burnt toast. It’s a real bummer.",3.0,colts,t3_zcqpgz,False,0.0,Dhalsim,2022-12-04T20:50:38Z,colts,-0.2320499999999999
29094,210777,210777,onmf,Hope Shaq can get healthy and return to form,1.0,colts,t3_zcqpgz,False,0.0,Dhalsim,2022-12-04T20:49:51Z,colts,0.6808
29296,219310,219310,runningstart23,Truth.,1.0,colts,t3_zctb04,False,0.0,Playoffs? PLAYOFFS!?,2022-12-04T19:59:22Z,colts,0.3182
29297,219311,219311,runningstart23,Got a chuckle outta me,1.0,colts,t3_zckg2m,False,0.0,Playoffs? PLAYOFFS!?,2022-12-04T19:53:24Z,colts,0.4019
30766,222933,222933,sirius4778,"I'm not surprised he was ever a mod, I am surprised how long it took to get his mod priveleges taken away",3.0,colts,t3_zf4l7n,False,0.0,squirrel,2022-12-07T19:53:49Z,colts,0.0603
30767,222934,222934,sirius4778,Last year was fun??,6.0,colts,t3_zf4l7n,False,0.0,squirrel,2022-12-07T18:43:42Z,colts,0.12765
30768,222935,222935,sirius4778,"He hasn't been a mod in a while, doesn't make him less of a jerk",2.0,colts,t3_zf4l7n,False,0.0,squirrel,2022-12-07T18:42:25Z,colts,-0.2815
30769,222936,222936,sirius4778,Too true,0.0,colts,t3_zf4l7n,False,1.0,squirrel,2022-12-07T18:41:49Z,colts,0.4215
30770,222937,222937,sirius4778,Best one,3.0,colts,t3_zf4jlu,False,0.0,squirrel,2022-12-07T18:39:43Z,colts,0.6369
30771,222938,222938,sirius4778,That is so fucking funny lol,3.0,colts,t3_zf4jlu,False,0.0,squirrel,2022-12-07T17:49:36Z,colts,0.7791
30772,222939,222939,sirius4778,Vikings look really good sans Zimmer,1.0,colts,t3_zf0ymf,False,0.0,squirrel,2022-12-07T11:56:11Z,colts,0.4927
30773,222940,222940,sirius4778,Vikings look really good sans Zimmer,5.0,colts,t3_zf0ymf,False,0.0,squirrel,2022-12-07T11:55:57Z,colts,0.4927
30774,222941,222941,sirius4778,"All those great defenses the Patriots had, all Brady",2.0,colts,t3_zf0ymf,False,0.0,squirrel,2022-12-07T11:54:27Z,colts,0.7003
30775,222942,222942,sirius4778,Brady went to one of the most stacked defenses and offenses we've seen this century lol,1.0,colts,t3_zf0ymf,False,0.0,squirrel,2022-12-07T11:53:53Z,colts,0.3134
30776,222943,222943,sirius4778,Now do all the coaches with losing records after 5 years,1.0,colts,t3_zf0ymf,False,0.0,squirrel,2022-12-07T11:52:46Z,colts,-0.3818
30777,222944,222944,sirius4778,"I was sure that TY, Moncrief, and Dorsett were going to be the best receiving room in the league. What could have been.",12.0,colts,t3_zeri19,False,0.0,squirrel,2022-12-07T08:49:18Z,colts,0.189475
30778,222945,222945,sirius4778,"It's not like we have a other qb worth a damn. Paying him an obscene amount of money, may as well play him. Last thing we want is him to realize he can make 40 mil sitting on the bench next season.",1.0,colts,t3_zejidp,False,0.0,squirrel,2022-12-07T06:40:38Z,colts,0.000774074074074
30779,222946,222946,sirius4778,"NFL should not do a lottery, there isn't a league in America with this much parity, they're gonna mess it up if they fuck with it",8.0,colts,t3_zeimjv,False,0.0,squirrel,2022-12-06T21:20:01Z,colts,-0.7184
30780,222947,222947,sirius4778,Guy is literally just me playing madden,4.0,colts,t3_zeetvc,False,0.0,squirrel,2022-12-06T15:48:12Z,colts,0.2023
30781,222948,222948,sirius4778,I always felt of all the great football players Luck most of all had an identity outside of the game.,24.0,colts,t3_ze6ytd,False,0.0,squirrel,2022-12-06T11:31:49Z,colts,0.7964
30782,222949,222949,sirius4778,Depends on who the qb next season is. I'd be concerned with a new LT we draft mid 1st and lose out on our good qb prospect,1.0,colts,t3_ze7krx,False,0.0,squirrel,2022-12-06T11:28:55Z,colts,0.17
30783,222951,222951,sirius4778,"Media kept yelling that Ryan gives us the best chance to win, now they want him benched",1.0,colts,t3_zcxft6,False,0.0,squirrel,2022-12-05T20:19:55Z,colts,0.8834
30784,222952,222952,sirius4778,"I agree, I'm just saying there is a lot of talent on this team and people should be surprised if we don't lose out despite front office/coaching staff.",1.0,colts,t3_zdam3k,False,0.0,squirrel,2022-12-05T18:42:29Z,colts,0.8155
30785,222953,222953,sirius4778,"I agree with you regarding ownership and decisions being made in the last couple months, but you're telling me players aren't trying to win?",1.0,colts,t3_zdam3k,False,0.0,squirrel,2022-12-05T16:19:40Z,colts,-0.52
30786,222954,222954,sirius4778,Seems like bad news to op,1.0,colts,t3_zdam3k,False,0.0,squirrel,2022-12-05T14:26:07Z,colts,-0.25
30787,222955,222955,sirius4778,Denver and NO giving their picks to those teams is just brutal,1.0,colts,t3_zcxrau,False,0.0,squirrel,2022-12-05T12:47:16Z,colts,-0.7826
30788,222956,222956,sirius4778,I hate to break this to you but we're trying to win games too.,7.0,colts,t3_zdam3k,False,0.0,squirrel,2022-12-05T11:48:55Z,colts,0.5927
30789,222957,222957,sirius4778,Holy shit,16.0,colts,t3_zd1aan,False,0.0,squirrel,2022-12-05T11:47:32Z,colts,-0.5574
30790,222959,222959,sirius4778,Equally surprising during preseason would be Seahawks being favored by 6.5 against the Rams in LA,1.0,colts,t3_zcxrau,False,0.0,squirrel,2022-12-05T11:42:09Z,colts,0.5994
30791,222960,222960,sirius4778,"Shutout to the Jags just this season was worse. Most of this game was fine, one super lousy quarter. We didn't put a single point on the board against the Jaguars. I want to throw up just thinking about it.",2.0,colts,t3_zcwpgy,False,0.0,squirrel,2022-12-05T00:54:32Z,colts,0.022062890625
30792,222961,222961,sirius4778,How many schools have good track records?,8.0,colts,t3_zcwpgy,False,0.0,squirrel,2022-12-05T00:52:19Z,colts,0.4404
