,Unnamed: 0.1,Unnamed: 0,author,body,score,subreddit,link_id,over_18,controversiality,author_flair_text,created_utc,flair,sentiment
290,1381,1381,2020Psychedelia,"not football teams, no

but when the dodgers play a west coast team their stadium is almost always covered in blue",1.0,nfl,t3_xnwr3j,False,0.0,:Rams: Rams,2022-09-25T15:43:33Z,losangelesrams,0.549
291,1382,1382,2020Psychedelia,"true, there's also millions of people who were born and grew up in the LA area though",1.0,nfl,t3_xnwr3j,False,0.0,:Rams: Rams,2022-09-25T15:36:35Z,losangelesrams,0.4215
292,1383,1383,2020Psychedelia,he loves his job lol,1.0,losangelesrams,t3_xnwhkr,False,0.0,Blue & Yellow Retro Ram,2022-09-25T15:32:45Z,losangelesrams,0.7579
293,1384,1384,2020Psychedelia,its pretty much only teams that were good in the 20 years no team was in LA that have fan bases here - not many people in cities with no teams pick bad ones lol,1.0,nfl,t3_xnwr3j,False,0.0,:Rams: Rams,2022-09-25T15:21:11Z,losangelesrams,0.5106
417,7009,7009,AnnenbergTrojan,"The cheapest way will be to take Metro Rail. In a couple of weeks they will be opening a new line, the K Line, with a station at Downtown Inglewood and a shuttle to SoFi. The K line connects at the north end to the Expo Line, which goes between downtown LA and Santa Monica. 

If you can find a hotel near Metro Rail, that would be your best bet. Otherwise, park at the Culver City Expo Line station and transfer to the K Line at Expo/Crenshaw.

But if you're good with paying $35+ for it, offsite parking with a direct shuttle to the stadium would probably be the easiest option.",2.0,losangelesrams,t3_xpkr17,False,0.0,Blue & Yellow #56,2022-09-27T15:19:48Z,losangelesrams,0.1396319444444444
418,7011,7011,AnnenbergTrojan,"Raheem has ordered his defense not to get a 3 and out until his apology form has at least 50,000 signatures.

He will make us sweat with long, 12+ play drives that end in a field goal until we have completed our penance.",6.0,losangelesrams,t3_xo2qwm,False,0.0,Blue & Yellow #56,2022-09-25T23:08:07Z,losangelesrams,0.214475
419,7012,7012,AnnenbergTrojan,Is every Broncos game gonna be like this?,11.0,losangelesrams,t3_xo7w8g,False,0.0,Blue & Yellow #56,2022-09-25T23:05:49Z,losangelesrams,0.3612
420,7018,7018,AnnenbergTrojan,"Raheem's punishing us for wanting his head last year. His boys will get that goal line stop, but not before giving up a load of yardage.",3.0,losangelesrams,t3_xnwhkr,False,0.0,Blue & Yellow #56,2022-09-25T16:42:17Z,losangelesrams,-0.3823499999999999
421,7019,7019,AnnenbergTrojan,"He didn't throw past the line of scrimmage, so yes it would have been grounding.",7.0,losangelesrams,t3_xnwhkr,False,0.0,Blue & Yellow #56,2022-09-25T15:58:20Z,losangelesrams,0.541
422,7020,7020,AnnenbergTrojan,Stafford making up for the penalty with the best first down dive and handoff you'll see all year. That play doesn't work without QB1 timing it perfectly.,8.0,losangelesrams,t3_xnwhkr,False,0.0,Blue & Yellow #56,2022-09-25T15:51:37Z,losangelesrams,0.4565
504,8986,8986,BIGDADDYCRYPTO6900,Tracy Morgan did a “bathroom bump” during commercials… haha,4.0,nfl,t3_xp0kxs,False,0.0,:Rams: Rams,2022-09-26T21:14:26Z,losangelesrams,0.4588
505,8987,8987,BIGDADDYCRYPTO6900,"Tracy, Ice T, Coco and her daughter Chanel on one photo … hahaha",3.0,nfl,t3_xp0kxs,False,0.0,:Rams: Rams,2022-09-26T21:12:13Z,losangelesrams,0.5574
506,8988,8988,BIGDADDYCRYPTO6900,"Tracy Morgan acting a fool on TV. Hahaha. 

Would love to see some MCU actors like Wong with Madisynn and or Jamela Jamil",-2.0,nfl,t3_xp0kxs,False,1.0,:Rams: Rams,2022-09-26T21:10:53Z,losangelesrams,0.3028555555555556
507,8989,8989,BIGDADDYCRYPTO6900,Nice,2.0,nfl,t3_xo2u11,False,0.0,:Rams: Rams,2022-09-26T14:23:20Z,losangelesrams,0.4215
561,9508,9508,Baconbac28,I’m curious to why we signed him. Don’t we have higbee?,1.0,losangelesrams,t3_xllvx9,False,0.0,St. Louis Rams,2022-09-23T12:30:35Z,losangelesrams,0.07955
968,20189,20189,CelebratingCheescake,We don’t even play man these days 🥲,1.0,losangelesrams,t3_xm7iu4,False,0.0,Blue & Yellow #99,2022-09-23T17:20:22Z,losangelesrams,0.34
1765,34628,34628,CrashBandicoot2,Lions offense is for real,3.0,detroitlions,t3_xpjatf,False,0.0,Rams,2022-09-27T13:43:59Z,losangelesrams,-0.25
1766,34629,34629,CrashBandicoot2,"Well, to each their own, u/\_TurkeyFucker\_",8.0,nfl,t3_xp2pzg,False,0.0,:Rams: Rams,2022-09-27T09:35:15Z,losangelesrams,0.2732
1767,34630,34630,CrashBandicoot2,"Fuck this narrative. Did we already forget Calvin Johnson exists? Shit, even last year he was giving Odell TDs like every game",-3.0,nfl,t3_xp2pzg,False,1.0,:Rams: Rams,2022-09-27T09:28:02Z,losangelesrams,-0.0194962962962962
1768,34631,34631,CrashBandicoot2,All hail the white Cooper Kupp,2.0,losangelesrams,t3_xozjyb,False,0.0,White & Yellow #99,2022-09-27T07:03:03Z,losangelesrams,0.0772
1769,34632,34632,CrashBandicoot2,"I don't know why, but I love this",49.0,nfl,t3_xp2pzg,False,0.0,:Rams: Rams,2022-09-27T07:02:13Z,losangelesrams,0.7783
1770,34633,34633,CrashBandicoot2,"I'll back you up. I like Sanchez, but the way he forced in the Shakira and Rihanna references were cringe af.",14.0,nfl,t3_xp2pzg,False,0.0,:Rams: Rams,2022-09-27T07:00:39Z,losangelesrams,-0.25115
1771,34634,34634,CrashBandicoot2,Okay but can we have it after the super bowl so that the pro bowlers in the super bowl might actually participate?,1.0,nfl,t3_xoi9my,False,0.0,:Rams: Rams,2022-09-26T09:53:31Z,losangelesrams,0.9209
2285,41063,41063,Daddydj1_1,"20-12. Good game and great defensive effort, offense was ok besides that Akers fumble",2.0,losangelesrams,t3_xnwhkr,False,0.0,Tavon Austin,2022-09-25T18:26:27Z,losangelesrams,0.4037
2420,45063,45063,DontxTripx420,You guys need a flair lol,24.0,losangelesrams,t3_xo2qwm,False,0.0,Los Angeles Rams,2022-09-25T19:04:00Z,losangelesrams,0.4215
2421,45064,45064,DontxTripx420,"I’m starting to believe that The Rams read our game threads and make the games harder than they need to be just for shits and giggles from seeing you doomers freak out lmfao

Oh yeah btw fuck the cardihoes we stay dominating them!!!",56.0,losangelesrams,t3_xo2iid,False,0.0,Los Angeles Rams,2022-09-25T18:30:29Z,losangelesrams,-0.1747
2422,45066,45066,DontxTripx420,LFG we needed that stop!,2.0,losangelesrams,t3_xnwhkr,False,0.0,Los Angeles Rams,2022-09-25T17:54:50Z,losangelesrams,-0.3595
2423,45067,45067,DontxTripx420,The sports betting sites had the chokers as favorites too lmfao damn prop 27 needs to pass lol,1.0,losangelesrams,t3_xnwhkr,False,0.0,Los Angeles Rams,2022-09-25T17:52:50Z,losangelesrams,0.7506
2424,45068,45068,DontxTripx420,Damn even Ramsey is dropping sure catches,2.0,losangelesrams,t3_xnwhkr,False,0.0,Los Angeles Rams,2022-09-25T16:52:34Z,losangelesrams,-0.1027
2425,45069,45069,DontxTripx420,What a frustrating fucking drive,2.0,losangelesrams,t3_xnwhkr,False,0.0,Los Angeles Rams,2022-09-25T16:42:07Z,losangelesrams,-0.4404
2426,45070,45070,DontxTripx420,As long as he keeps playing good all that will go away which I hope he hope he does,1.0,losangelesrams,t3_xnwhkr,False,0.0,Los Angeles Rams,2022-09-25T16:13:33Z,losangelesrams,0.8591
2427,45071,45071,DontxTripx420,Ahh yes it’s McVay playing his good old game of 7D chess,2.0,losangelesrams,t3_xnwhkr,False,0.0,Los Angeles Rams,2022-09-25T16:10:02Z,losangelesrams,0.7506
2428,45073,45073,DontxTripx420,Damn you know Stafford is pissed this game should be 21-0,10.0,losangelesrams,t3_xnwhkr,False,0.0,Los Angeles Rams,2022-09-25T16:07:54Z,losangelesrams,-0.7845
2429,45074,45074,DontxTripx420,I know I wasn’t the only one scared of skow dropping that one lol,9.0,losangelesrams,t3_xnwhkr,False,0.0,Los Angeles Rams,2022-09-25T16:02:21Z,losangelesrams,-0.0258
2430,45075,45075,DontxTripx420,Glad we got Blanton back!,3.0,losangelesrams,t3_xnwhkr,False,0.0,Los Angeles Rams,2022-09-25T16:00:49Z,losangelesrams,0.5093
2431,45076,45076,DontxTripx420,LMFAO HE SACKED HIM WITH HIS FINGERTIPS THAT LITTLE BOY IS SCARED OF AD,8.0,losangelesrams,t3_xnwhkr,False,0.0,Los Angeles Rams,2022-09-25T15:57:27Z,losangelesrams,0.2177
2432,45077,45077,DontxTripx420,LFG who needs running backs when we got coop on those sweeps,5.0,losangelesrams,t3_xnwhkr,False,0.0,Los Angeles Rams,2022-09-25T15:51:14Z,losangelesrams,-0.0516
2433,45078,45078,DontxTripx420,Our dual threat qb lmao,4.0,losangelesrams,t3_xnwhkr,False,0.0,Los Angeles Rams,2022-09-25T15:49:33Z,losangelesrams,0.128
2434,45079,45079,DontxTripx420,Our defense is dominating so far our offense just has to score some TDs,3.0,losangelesrams,t3_xnwhkr,False,0.0,Los Angeles Rams,2022-09-25T15:41:26Z,losangelesrams,-0.4522
2435,45080,45080,DontxTripx420,The refs fucked us on that one but Robinson should’ve caught that too smh fuck it we scored better than nothing,6.0,losangelesrams,t3_xnwhkr,False,0.0,Los Angeles Rams,2022-09-25T15:35:43Z,losangelesrams,-0.7615
2436,45081,45081,DontxTripx420,LFG the cardihoes aint got shit on us,3.0,losangelesrams,t3_xnwhkr,False,0.0,Los Angeles Rams,2022-09-25T15:28:54Z,losangelesrams,0.4449
2737,47833,47833,Dxnes_L,lmao you ain’t wrong,5.0,losangelesrams,t3_xo2qwm,False,0.0,Dick “Night Train” Lane,2022-09-25T18:55:44Z,losangelesrams,0.2023
2738,47834,47834,Dxnes_L,Defense didn’t allow a touchdown. Worked well today. It definitely gets frustrating though when they just give 10-15 yards of space,46.0,losangelesrams,t3_xo2mmu,False,0.0,Dick “Night Train” Lane,2022-09-25T18:38:36Z,losangelesrams,0.0257481481481481
2739,47835,47835,Dxnes_L,Were the announcers paid to talk about Benny Skow? lol all he did was change positions,6.0,losangelesrams,t3_xnwhkr,False,0.0,Dick “Night Train” Lane,2022-09-25T15:51:38Z,losangelesrams,0.21075
3373,49085,49085,EdAv51,This combo is awesome IMO.,34.0,losangelesrams,t3_xn37rs,False,0.0,Blue & Gold #10,2022-09-24T16:13:59Z,losangelesrams,0.6249
4069,60058,60058,Glatius_Maximus,"Are you me? lol This is exactly the same as my Rams origin story, also living in Raleigh NC",3.0,losangelesrams,t3_xqnzq8,False,0.0,Deacon Jones,2022-09-28T21:18:36Z,losangelesrams,0.21075
4070,60060,60060,Glatius_Maximus,"Let's pretend Greg Robinson was never picked please, for my sanity",9.0,nfl,t3_xpiu2r,False,0.0,:Rams: Rams,2022-09-27T11:45:36Z,losangelesrams,-0.3318
4071,60061,60061,Glatius_Maximus,"Woods was also an incredible blocker, miss that man",17.0,losangelesrams,t3_xoxw7f,False,0.0,Deacon Jones,2022-09-26T18:31:15Z,losangelesrams,-0.2212
4072,60062,60062,Glatius_Maximus,Inject this shit into my veins,30.0,losangelesrams,t3_xoxa99,False,0.0,Deacon Jones,2022-09-26T17:46:27Z,losangelesrams,-0.5574
4306,60758,60758,GoRams,while being double/triple teamed for most of his snaps. insane!,3.0,losangelesrams,t3_xo8zf7,False,0.0,Blue/Yellow Helmet Logo,2022-09-26T15:58:20Z,losangelesrams,-0.2287
4307,60760,60760,GoRams,These refs are ass.,11.0,losangelesrams,t3_xnwhkr,False,0.0,Blue/Yellow Helmet Logo,2022-09-25T16:02:58Z,losangelesrams,-0.5423
4847,71302,71302,JaredCircusbear,Fuck the niners,29.0,losangelesrams,t3_xqhvim,False,0.0,Marshall Faulk,2022-09-28T12:38:10Z,losangelesrams,-0.5423
4848,71307,71307,JaredCircusbear,"Exactly, most insightful Rams podcast there is. Rodrigue is hands down the best beat reporter in the league and we are lucky to have her covering our team!",5.0,losangelesrams,t3_xps71b,False,0.0,Marshall Faulk,2022-09-28T00:34:21Z,losangelesrams,0.4035
6025,75310,75310,JohnArtemus,I honestly don't know why Thunder Gun killed me like it did but I can't stop fucking laughing,92.0,nfl,t3_xpvikq,False,0.0,:Rams: Rams,2022-09-27T18:33:34Z,losangelesrams,-0.4828
6026,75314,75314,JohnArtemus,"I’m a USC fan so I’m still salty that Bryce Young, a kid from Mater Dei, switched his commitment to Alabama.  Luckily Riley is keeping all the SoCal kids at home.

At long last.",1.0,nfl,t3_xp54y1,False,0.0,:Rams: Rams,2022-09-27T02:05:04Z,losangelesrams,0.0789333333333333
6028,75318,75318,JohnArtemus,I was just saying when the score was 7-5 this is how those B1G games on CBS are gonna be 🤣,2.0,nfl,t3_xo7wqk,False,0.0,:Rams: Rams,2022-09-25T23:55:36Z,losangelesrams,0.4939
6030,75320,75320,JohnArtemus,McKenzie should have just ran straight out of bounds instead of trying to get more yards.,2.0,nfl,t3_xnxr98,False,0.0,:Rams: Rams,2022-09-25T16:22:07Z,losangelesrams,0.2263
6185,76054,76054,Jrsaz404,"If the tablets survive the slam, wouldn’t it help sales? I want tablets that can survive the equivalent of a 6 year old throwing it during a tantrum.",18.0,nfl,t3_xns18v,False,0.0,:Rams: Rams,2022-09-25T11:58:59Z,losangelesrams,-0.17415
6631,77835,77835,Kingjuke24,"I have faith in Floyd picking it up, it always seems to take him a little bit of time for him to heat up during the season. Also Lewis looks like he’s getting better every game. If this is still an issue during the bye week though then we should def consider getting our hands on a veteran pass rusher.",58.0,losangelesrams,t3_xpq8ok,False,0.0,Donald Is Dolphin,2022-09-27T14:35:44Z,losangelesrams,0.0889111111111111
6632,77838,77838,Kingjuke24,What a beautiful tackle oml,1.0,losangelesrams,t3_xnwhkr,False,0.0,Donald Is Dolphin,2022-09-25T16:30:27Z,losangelesrams,0.5994
6633,77839,77839,Kingjuke24,Tutu actually got targeted lol,5.0,losangelesrams,t3_xnwhkr,False,0.0,Donald Is Dolphin,2022-09-25T16:18:37Z,losangelesrams,0.4215
6634,77840,77840,Kingjuke24,Kareem Orr time😈,3.0,losangelesrams,t3_xm7iu4,False,0.0,Donald Is Dolphin,2022-09-23T17:52:59Z,losangelesrams,0.4588
6848,80249,80249,LAFAN44,"Okay, but I’ll be happier if we beat them next week.",18.0,losangelesrams,t3_xo7w8g,False,0.0,Blue/Yellow Helmet Logo,2022-09-25T22:44:56Z,losangelesrams,0.7227
6849,80252,80252,LAFAN44,What’s with all this autumn wind shit?,1.0,losangelesrams,t3_xnwhkr,False,0.0,Blue/Yellow Helmet Logo,2022-09-25T17:29:54Z,losangelesrams,-0.5574
6850,80253,80253,LAFAN44,Soft ass coverage.,2.0,losangelesrams,t3_xnwhkr,False,0.0,Blue/Yellow Helmet Logo,2022-09-25T16:55:09Z,losangelesrams,-0.5423
6851,80258,80258,LAFAN44,The bone jerseys look better with the blue pants than they do with the bone pants.,7.0,losangelesrams,t3_xn37rs,False,0.0,Blue/Yellow Helmet Logo,2022-09-24T16:36:38Z,losangelesrams,0.4404
7796,84899,84899,LosAngelesVikings,I just saw the score and it annoyed tf out of me. Gah damn.,1.0,nfl,t3_xo2zfq,False,0.0,:Rams: Rams,2022-09-25T21:36:24Z,losangelesrams,-0.2964
7797,84901,84901,LosAngelesVikings,"I love my mf ramily 



*cries*",8.0,nfl,t3_xo2inr,False,0.0,:Rams: Rams,2022-09-25T18:42:23Z,losangelesrams,0.3612
8131,88601,88601,Metrostars1029,"He's a real ""first in, last out"" kind of guy. He's the kind of player you would want dating your daughter.",16.0,nfl,t3_xp2pzg,False,0.0,:Rams: Rams,2022-09-27T07:12:45Z,losangelesrams,0.0386
8132,88602,88602,Metrostars1029,clearly a conspiracy  to help....the new york giants.,1.0,nfl,t3_xp1vhg,False,0.0,:Rams: Rams,2022-09-27T07:09:54Z,losangelesrams,-0.1779
8133,88606,88606,Metrostars1029,Love this redemption arc for Benny Stone Hands.,1.0,losangelesrams,t3_xo2iid,False,0.0,Blue & Yellow #29,2022-09-26T07:58:16Z,losangelesrams,0.6369
8134,88607,88607,Metrostars1029,I feel like it was a more comfortable win for the rams then the score line indicates. Penalties and errors . But I have a feeling sloppy wins will be the MO for the team this season,7.0,nfl,t3_xo2inr,False,0.0,:Rams: Rams,2022-09-25T19:40:33Z,losangelesrams,0.2542444444444444
8135,88608,88608,Metrostars1029,I love that 90 is the number it’s just so…imperfect. Yet impressive,25.0,losangelesrams,t3_xno19p,False,0.0,Blue & Yellow #29,2022-09-25T09:14:51Z,losangelesrams,0.422925
8136,88609,88609,Metrostars1029,Yeah and violence on the football field and domestic violence are different too. So maybe every thread about AD shouldn’t have highly upvoted comments speculating he hits his wife,-8.0,nfl,t3_xnk0jr,False,0.0,:Rams: Rams,2022-09-25T09:07:16Z,losangelesrams,-0.19765
8137,88610,88610,Metrostars1029,I’ll use the Reddit logic that people use on Aaron Donald here.. I bet Tom does this shit at home and harms his loved ones.,-32.0,nfl,t3_xnk0jr,False,0.0,:Rams: Rams,2022-09-25T06:18:45Z,losangelesrams,-0.27495
8274,89361,89361,Mister_Sasquatch,Who they playing?,1.0,nfl,t3_xo7wqk,False,0.0,:Rams: Rams,2022-09-25T23:33:26Z,losangelesrams,0.2023
8275,89362,89362,Mister_Sasquatch,My girlfriend walked in on the highlights showing him stumbling around the field and she assumed he was seriously injured. I informed her that he finished and won the game. She was confused.,4.0,nfl,t3_xo7wqk,False,0.0,:Rams: Rams,2022-09-25T23:33:05Z,losangelesrams,-0.0620296296296296
8276,89363,89363,Mister_Sasquatch,That whole song before the game was so funny and weird.,1.0,nfl,t3_xo7wqk,False,0.0,:Rams: Rams,2022-09-25T23:30:15Z,losangelesrams,0.4171
8277,89365,89365,Mister_Sasquatch,Karma for 49ers fans doing nothing but aggressively hate their own team for the last 3 years.,2.0,nfl,t3_xo7wqk,False,0.0,:Rams: Rams,2022-09-25T23:14:07Z,losangelesrams,0.7536
8335,90746,90746,Mormonster,Idk our defense has been tremendous (outside of being gassed in the 2nd half of the Bills game),19.0,losangelesrams,t3_xoqr61,False,0.0,McVay Head,2022-09-26T13:29:43Z,losangelesrams,0.0258
9075,97168,97168,NotAnNFLGM,"Golden Corral permanently banned me (a wide receiver one Popeye’s biscuit away from a tight end) for this comment:

> I ate at a Golden Corral and they ran out of mashed potatoes, one of the worst meals I’ve ever ate in my life.

> I ate at a Golden Corral and they stopped serving the lunch special Pot Pies at 4pm instead of 5, one of the worst meals I’ve ever ate in my life.

> This is concerning.

What is wrong with their management?",1.0,nfl,t3_xoqzxx,False,0.0,:Rams: Rams,2022-09-26T13:16:11Z,losangelesrams,-0.1302640625
9223,99602,99602,OkLuck1317,My bad.  My post history counted you out.,6.0,losangelesrams,t3_xo2eg6,False,0.0,Deacon Jones,2022-09-25T18:27:03Z,losangelesrams,-0.135575
9224,99603,99603,OkLuck1317,Our two minute drill sucked. Now it cost us 3 points.  But we got this.  Let’s go ARod and Snow.  Help Kupp.,6.0,losangelesrams,t3_xnwhkr,False,0.0,Deacon Jones,2022-09-25T16:55:24Z,losangelesrams,0.0802331839999999
9225,99604,99604,OkLuck1317,I’m feeling a little anxious.,1.0,losangelesrams,t3_xnwhkr,False,0.0,Deacon Jones,2022-09-25T16:48:35Z,losangelesrams,-0.0534
9226,99605,99605,OkLuck1317,Hate is strong.  But I’m not seeing the hype yet.,2.0,losangelesrams,t3_xnwhkr,False,0.0,Deacon Jones,2022-09-25T16:47:51Z,losangelesrams,-0.025675
9227,99610,99610,OkLuck1317,Great interview.,5.0,losangelesrams,t3_xln7t5,False,0.0,Deacon Jones,2022-09-23T09:32:30Z,losangelesrams,0.6249
9349,100356,100356,Ole_FE_Lung,"Love the Rams, fuck Kroenke, but like I get it...I'd move to LA too if I could. On top of that, I can't just stop rooting for a team that I grew up with and love. I was here for the shit years and I'll be here for every year after. I love this team. Watching SJ39 and Chris Long play their hearts out for a bad team inspires me still",1.0,losangelesrams,t3_xqnzq8,False,0.0,Blue & Yellow #39,2022-09-28T23:35:21Z,losangelesrams,0.177187648
9470,102568,102568,PaulPryJr,Constantly suspicious and willing to be convinced. For 5 months straight...,50.0,losangelesrams,t3_xqy1h9,False,0.0,Blue & Gold #99,2022-09-28T23:59:22Z,losangelesrams,0.12605
9471,102573,102573,PaulPryJr,Tutu for Creed. Straight up.,3.0,losangelesrams,t3_xoqr61,False,0.0,Blue & Gold #99,2022-09-26T16:21:40Z,losangelesrams,0.11315
9473,102577,102577,PaulPryJr,When you order Kupp from Wish dot com,12.0,losangelesrams,t3_xo2gln,False,0.0,Blue & Gold #99,2022-09-25T19:25:16Z,losangelesrams,0.4019
9709,105121,105121,PrettyassDolphin,This is when the super soft coverage actually helps. Making them waste tons of time to move the ball while they're down 2 possessions.,7.0,losangelesrams,t3_xnwhkr,False,0.0,St. Louis Rams,2022-09-25T18:16:37Z,losangelesrams,-0.0212749999999999
9710,105123,105123,PrettyassDolphin,Can not have literally the slowest corner in the league (Kendrick) cover one of the fastest receivers lol,1.0,losangelesrams,t3_xnwhkr,False,0.0,St. Louis Rams,2022-09-25T17:46:46Z,losangelesrams,0.4215
10485,110447,110447,RaymonM,"Yep, NFL is to blame if protocol wasn't followed.",5.0,nfl,t3_xny73t,False,0.0,:Rams: Rams,2022-09-25T21:55:57Z,losangelesrams,-0.0516
10880,118046,118046,Ryuster99,Oh hell no. Look at the O-line protection,1.0,nfl,t3_xqjqk7,False,0.0,:Rams: Rams,2022-09-28T13:55:40Z,losangelesrams,-0.1702
10881,118049,118049,Ryuster99,Look up how the 2010 Chargers missed the playoffs despite having the #1 offense and #1 defense,3.0,nfl,t3_xpp3co,False,0.0,:Rams: Rams,2022-09-27T14:02:57Z,losangelesrams,-0.4019
10882,118051,118051,Ryuster99,This guy has a hate boner for Matthew Stafford. He prefers Baker Mayfield and Jimmy G over Stafford.,48.0,losangelesrams,t3_xponvj,False,0.0,Blue & Yellow #99,2022-09-27T13:50:28Z,losangelesrams,-0.142975
10883,118052,118052,Ryuster99,Daboll's face 🤣,5.0,nfl,t3_xozzgy,False,0.0,:Rams: Rams,2022-09-26T20:33:54Z,losangelesrams,0.4939
10884,118053,118053,Ryuster99,"Penalty decline led to touchback. If the penalty was accepted, the ball would have landed within the 5 yard line",1.0,nfl,t3_xozzgy,False,0.0,:Rams: Rams,2022-09-26T20:25:37Z,losangelesrams,-0.22785
10885,118054,118054,Ryuster99,500 IQ from Daboll declining the penalty,9.0,nfl,t3_xozzgy,False,0.0,:Rams: Rams,2022-09-26T20:21:48Z,losangelesrams,-0.4588
10886,118056,118056,Ryuster99,Gotta involve a defensive player. Could it be... Robert Quinn?,17.0,losangelesrams,t3_xoqr61,False,0.0,Blue & Yellow #99,2022-09-26T13:27:12Z,losangelesrams,0.00645
10887,118057,118057,Ryuster99,Battle of Mid,5.0,losangelesrams,t3_xo7w8g,False,0.0,Blue & Yellow #99,2022-09-25T23:20:39Z,losangelesrams,-0.3818
10888,118058,118058,Ryuster99,Anyone else exhausted from watching this game?,4.0,nfl,t3_xo2zfq,False,0.0,:Rams: Rams,2022-09-25T21:36:49Z,losangelesrams,-0.3612
10889,118060,118060,Ryuster99,I will sleep well this week,4.0,losangelesrams,t3_xnwhkr,False,0.0,Blue & Yellow #99,2022-09-25T18:26:26Z,losangelesrams,0.2732
10890,118061,118061,Ryuster99,I'm shocked he managed to reach Murray,24.0,nfl,t3_xnyutl,False,0.0,:Rams: Rams,2022-09-25T15:59:18Z,losangelesrams,-0.296
10891,118062,118062,Ryuster99,Nice stop by the Lions,5.0,nfl,t3_xnrz6s,False,0.0,:Rams: Rams,2022-09-25T12:15:14Z,losangelesrams,0.1531
11201,119781,119781,SPNCER,"As much as I never want Stafford to be injured, I've been very hyped to one day see what Wolford is capable of. When he was in for the brief moment in 2020 I saw a sparkle in McVay's eyes I hadn't seen in awhile.",4.0,losangelesrams,t3_xnqrx6,False,0.0,St. Louis Rams,2022-09-25T10:54:41Z,losangelesrams,0.190025
11202,119782,119782,SPNCER,Should be a good one. Hope everyone walks away healthy.,4.0,azcardinals,t3_xnl35g,False,0.0,:rams: Rams,2022-09-25T10:49:05Z,losangelesrams,0.4505
11371,121798,121798,SeanMcVay,"I know it’s not football.  I know Stl vs LA is contentious.  However as a Stl Rams fan, I’m sure LA fans can also agree that the Machine is the man!!",7.0,losangelesrams,t3_xmxjfd,False,0.0,Blue/Yellow Helmet Logo,2022-09-24T11:40:18Z,losangelesrams,0.04225
12504,128315,128315,Soaring_Seagull24,Brady is very disliked lol,4.0,nfl,t3_xqmf9y,False,0.0,:Rams: Rams,2022-09-28T18:43:01Z,losangelesrams,0.022
12505,128316,128316,Soaring_Seagull24,Nah at worst he's inauthentic which bothers a lot of people.,50.0,nfl,t3_xqmf9y,False,0.0,:Rams: Rams,2022-09-28T15:21:58Z,losangelesrams,-0.743
12506,128317,128317,Soaring_Seagull24,"That's why Goff was considered the new Andy Dalton line. If you get Goff great playmakers, great blocking, and a great fun game, then he will look damn good. The problem is you can't expect to have that every season and Goff faulters when that happens.

It's noteworthy to point out though that most QB advanced stats like pff say he isn't playing that well. It's just that the things around him are excelling and he's good in those kinds of environments. I think that basically sums him up.",8.0,losangelesrams,t3_xqjbv5,False,0.0,McVay Head,2022-09-28T15:16:01Z,losangelesrams,0.0222064171810699
12507,128320,128320,Soaring_Seagull24,"The first two fumbles were completely his fault. Bad ball security and it got ripped out. The one yesterday he reached for the goal line , as they're taught to do, and a HELMET hit the ball. Not a defender doing anything skillful. A helmet. Quit being obtuse.",0.0,losangelesrams,t3_xo43ok,False,0.0,McVay Head,2022-09-26T19:47:27Z,losangelesrams,-0.0003184177812071
12508,128322,128322,Soaring_Seagull24,comparing a helmet hitting the nose of the football to a batter timing a pitch is stupid as hell,0.0,losangelesrams,t3_xo43ok,False,0.0,McVay Head,2022-09-26T10:43:21Z,losangelesrams,-0.8402
12509,128323,128323,Soaring_Seagull24,Someone downvoted you lol haterz big mad,1.0,losangelesrams,t3_xo2qwm,False,0.0,McVay Head,2022-09-26T10:42:33Z,losangelesrams,-0.1027
12510,128325,128325,Soaring_Seagull24,And the offensive line getting the running backs zero yards before contact. Zero.,9.0,nfl,t3_xogvbv,False,0.0,:Rams: Rams,2022-09-26T07:24:19Z,losangelesrams,-0.123475
12511,128326,128326,Soaring_Seagull24,Jimmy's safety was a big highlight for me.,49.0,losangelesrams,t3_xo7w8g,False,0.0,McVay Head,2022-09-25T23:06:39Z,losangelesrams,0.6369
12512,128327,128327,Soaring_Seagull24,I love Sunday nights.,8.0,nfl,t3_xo8gbc,False,0.0,:Rams: Rams,2022-09-25T23:00:00Z,losangelesrams,0.6369
12513,128328,128328,Soaring_Seagull24,"I hear you. Some of these runners are running by tacklers, who are obviously now trailing the play, and not protecting the ball.",3.0,nfl,t3_xo7udl,False,0.0,:Rams: Rams,2022-09-25T22:35:17Z,losangelesrams,0.17
12514,128329,128329,Soaring_Seagull24,Hope he's okay. Dude is always in some collisions.,4.0,losangelesrams,t3_xo561b,False,0.0,McVay Head,2022-09-25T20:27:10Z,losangelesrams,0.0098749999999999
