,Unnamed: 0.1,Unnamed: 0,author,body,score,subreddit,link_id,over_18,controversiality,author_flair_text,created_utc,flair,sentiment
12515,128330,128330,Soaring_Seagull24,Yeah honestly if the helmet didn't perfectly hit the ball he would've been okay.,1.0,losangelesrams,t3_xo43ok,False,0.0,McVay Head,2022-09-25T20:10:49Z,losangelesrams,0.4082
12516,128331,128331,Soaring_Seagull24,Escape? Damn the game was rough but it wasn't ever really in question.,15.0,losangelesrams,t3_xo4jiz,False,0.0,McVay Head,2022-09-25T20:09:58Z,losangelesrams,-0.062725
12517,128332,128332,Soaring_Seagull24,Skow brigade lol,10.0,losangelesrams,t3_xo2qwm,False,0.0,McVay Head,2022-09-25T19:34:26Z,losangelesrams,0.4215
12518,128333,128333,Soaring_Seagull24,Facts lmao,6.0,losangelesrams,t3_xo2qwm,False,0.0,McVay Head,2022-09-25T18:51:45Z,losangelesrams,0.5994
12519,128334,128334,Soaring_Seagull24,Skow defenders come get our badges!!,115.0,losangelesrams,t3_xo2qwm,False,0.0,McVay Head,2022-09-25T18:51:27Z,losangelesrams,0.037775
12520,128336,128336,Soaring_Seagull24,Well she's basing that on her insight so it's hopefully closer than what we're speculating.,8.0,losangelesrams,t3_xmywc2,False,0.0,McVay Head,2022-09-24T14:43:47Z,losangelesrams,0.6222
12521,128339,128339,Soaring_Seagull24,Damn I'm guessing Rochell is cb2 and Nick Scott and Taylor Rapp are safeties. Kendrick in the slot? Injuries Lowkey bodying us.,43.0,losangelesrams,t3_xm7iu4,False,0.0,McVay Head,2022-09-23T15:50:07Z,losangelesrams,-0.0019111111111111
12849,131018,131018,SpendrickLamar,Which city do you mean? Cuz they ain't even from San Francisco those Santa Clara bitches,10.0,losangelesrams,t3_xqntni,False,0.0,Blue & Gold #28,2022-09-28T19:49:44Z,losangelesrams,-0.2997
12850,131021,131021,SpendrickLamar,I'm from Montana and didn't have an allegiance to any team but always used the rams on nfl blitz in 99 and then watched them win the superbowl that year when I was 9 and there was no going back,3.0,losangelesrams,t3_xqnzq8,False,0.0,Blue & Gold #28,2022-09-28T19:38:43Z,losangelesrams,0.5267
12851,131023,131023,SpendrickLamar,Dude those teams can say that all they want.... we have won not one but TWO Superbowls since any of them did,2.0,losangelesrams,t3_xox11y,False,0.0,Blue & Gold #28,2022-09-27T19:14:30Z,losangelesrams,0.3612
12852,131024,131024,SpendrickLamar,It's great to see keyboard warriors call him an idiot when he (a triple crown winner) literally calls out the next triple crown lol,10.0,losangelesrams,t3_xpv93x,False,0.0,Blue & Gold #28,2022-09-27T18:37:08Z,losangelesrams,0.8126
12853,131027,131027,SpendrickLamar,I subscribed to the athletic just to read her write-ups. She's legit and is always responding to people in the comments which is cool,26.0,losangelesrams,t3_xps71b,False,0.0,Blue & Gold #28,2022-09-27T15:59:28Z,losangelesrams,0.1591
12854,131028,131028,SpendrickLamar,"Arizona's write-up is fucking hilarious haha. I think we've all felt pretty good about our Smash Bros skills after beating the CPU as well, only to get dominated in real life.",532.0,nfl,t3_xppln5,False,0.0,:Rams: Rams,2022-09-27T14:13:16Z,losangelesrams,0.50365
12855,131029,131029,SpendrickLamar,"I have my tickets for that game so don't worry, they will win with my presence",3.0,losangelesrams,t3_xox11y,False,0.0,Blue & Gold #28,2022-09-27T09:51:41Z,losangelesrams,0.7568
12856,131030,131030,SpendrickLamar,Anytime you can flat-back a defensive legend you earn respect in my book,53.0,losangelesrams,t3_xozjyb,False,0.0,Blue & Gold #28,2022-09-26T18:49:36Z,losangelesrams,0.4939
12857,131031,131031,SpendrickLamar,Shit looks easier everytime I look at it,11.0,losangelesrams,t3_xox11y,False,0.0,Blue & Gold #28,2022-09-26T18:42:52Z,losangelesrams,-0.2023
12858,131033,131033,SpendrickLamar,Ah shit.. here we go again,21.0,losangelesrams,t3_xoyhjj,False,0.0,Blue & Gold #28,2022-09-26T18:20:18Z,losangelesrams,-0.5574
12859,131036,131036,SpendrickLamar,An Iowa Hawkeyes game or some shit,204.0,nfl,t3_xo6ey9,False,0.0,:Rams: Rams,2022-09-25T21:26:28Z,losangelesrams,-0.5574
12860,131038,131038,SpendrickLamar,Yeah I cursed his name after the dropped TD against the bucs and suoerbowl tip interception,34.0,losangelesrams,t3_xo2qwm,False,0.0,Blue & Gold #28,2022-09-25T19:05:28Z,losangelesrams,0.296
12861,131039,131039,SpendrickLamar,He made up for that dropped interception really well!,17.0,losangelesrams,t3_xo3anl,False,0.0,Blue & Gold #28,2022-09-25T19:04:21Z,losangelesrams,0.3989
12862,131041,131041,SpendrickLamar,He played fierce today. Guy was on a mission,37.0,losangelesrams,t3_xo2iid,False,0.0,Blue & Gold #28,2022-09-25T18:35:59Z,losangelesrams,0.085
12863,131043,131043,SpendrickLamar,That face is already looking appetizing! Can't wait for about 10 more wins to really get it saucy,14.0,losangelesrams,t3_xo2jcc,False,0.0,Blue & Gold #28,2022-09-25T18:34:19Z,losangelesrams,0.30575
12864,131045,131045,SpendrickLamar,Agree,1.0,losangelesrams,t3_xnwhkr,False,0.0,Blue & Gold #28,2022-09-25T18:03:57Z,losangelesrams,0.3612
12865,131047,131047,SpendrickLamar,McVay might call less dumb 1 yard screens. This is not a bad thing,3.0,losangelesrams,t3_xnwhkr,False,0.0,Blue & Gold #28,2022-09-25T17:03:07Z,losangelesrams,0.100475
12866,131048,131048,SpendrickLamar,Yes that exact one. No it didn't damage anything at all just hang it up to dry,2.0,losangelesrams,t3_xnotif,False,0.0,Blue & Gold #28,2022-09-25T13:15:35Z,losangelesrams,0.1553749999999999
12867,131049,131049,SpendrickLamar,Love to see my beloved Bobby Trees doing well again,2.0,nfl,t3_xnr6u2,False,0.0,:Rams: Rams,2022-09-25T12:57:37Z,losangelesrams,0.8625
12868,131050,131050,SpendrickLamar,This what I did and it's totally fine. Superbowl patch is good still,4.0,losangelesrams,t3_xnotif,False,0.0,Blue & Gold #28,2022-09-25T10:23:08Z,losangelesrams,0.2881
12869,131052,131052,SpendrickLamar,I cannot put into words how much I love this absolute DAWG,127.0,nfl,t3_xnnzzf,False,0.0,:Rams: Rams,2022-09-25T09:09:25Z,losangelesrams,0.6369
12870,131054,131054,SpendrickLamar,I like that 👌,1.0,losangelesrams,t3_xmywc2,False,0.0,Blue & Gold #28,2022-09-24T17:14:09Z,losangelesrams,0.824
12871,131056,131056,SpendrickLamar,Fire up LANCE MCLUTCH!,136.0,losangelesrams,t3_xmywc2,False,0.0,Blue & Gold #28,2022-09-24T12:36:01Z,losangelesrams,-0.4003
12872,131058,131058,SpendrickLamar,Rosen is going to do great things for the cards... haha holy Jesus this thread is amazing,1.0,nfl,t3_xm1w9z,False,0.0,:Rams: Rams,2022-09-23T21:17:53Z,losangelesrams,0.8979
12873,131059,131059,SpendrickLamar,I remember thinking we were toast that game and it ended up being one of the most enjoyable games of the season lol,5.0,losangelesrams,t3_xm7iu4,False,0.0,Blue & Gold #28,2022-09-23T17:34:29Z,losangelesrams,0.7178
13216,132413,132413,SpiralHornedUngulate,Not if you‘be been a fan of the team for more than 2 years.,2.0,nfl,t3_xmb4uw,False,0.0,:Rams: Rams,2022-09-24T10:25:24Z,losangelesrams,0.3182
13322,132733,132733,Steak_n_sheik,Why has Skorownek been mentioned like 50 times today? Did I miss something last week?,6.0,losangelesrams,t3_xnwhkr,False,0.0,St. Louis Rams,2022-09-25T16:08:06Z,losangelesrams,0.0137499999999999
13954,137882,137882,TheHottuB,"Thank you for your service. I admire your strength and commitment. 

Cheers 🍻",2.0,losangelesrams,t3_xqnzq8,False,0.0,Ram It!,2022-09-28T23:24:30Z,losangelesrams,0.2651666666666666
13955,137883,137883,TheHottuB,"Rams fan through and through. I have lived 30 minutes outside of LA 95% of my life. I've always loved trips up to SF. Yes it's gotten worse over time and it's ugly in places. So is LA. 

My issue with the niners is from real conflict with niners fans. Come to our stadium with all that bull shit.",2.0,losangelesrams,t3_xqntni,False,0.0,Ram It!,2022-09-28T23:20:37Z,losangelesrams,-0.0863245913085291
13956,137887,137887,TheHottuB,I'd like to have more Nick Scott & Deebo Samuel interaction please.,2.0,losangelesrams,t3_xo7x1g,False,0.0,Ram It!,2022-09-26T18:10:57Z,losangelesrams,0.5859
13957,137889,137889,TheHottuB,"Can we not give it to Akers?

Edit: ok that looked a little better.

Edit two: 😳 I stand corrected.

Edit three: g'damn it Akers!!!!",0.0,losangelesrams,t3_xnwhkr,False,0.0,Ram It!,2022-09-25T17:32:00Z,losangelesrams,0.0009388799999999
14136,141476,141476,Thevulgarcommander,I miss the old days of being able to name my team Two Gurleys One Kupp.,7.0,nfl,t3_xnnzzf,False,0.0,:Rams: Rams,2022-09-25T13:39:26Z,losangelesrams,-0.1531
14137,141478,141478,Thevulgarcommander,These are sick asf dude.,8.0,losangelesrams,t3_xn8ne8,False,0.0,Gurley,2022-09-24T22:18:22Z,losangelesrams,-0.5106
14138,141479,141479,Thevulgarcommander,I needed up forcing circumstances to work where I was able to leave earlier to the game and ended up just driving both ways.,1.0,losangelesrams,t3_wzm2om,False,0.0,Gurley,2022-09-24T21:48:06Z,losangelesrams,-0.0516
14322,143348,143348,ToThisDay,And then still be strong enough for when Derrick Henry tries to stiff arm you to the shadow realm,2.0,nfl,t3_xnzcsj,False,0.0,:Rams: Rams :Lions: Lions,2022-09-26T10:34:19Z,losangelesrams,0.5106
14994,148586,148586,Tunatron_Prime,"Sorry Ben Skewroneck. 
We’ll learn to spell it soon",1.0,losangelesrams,t3_xo2eg6,False,0.0,Matt Gay,2022-09-26T12:29:51Z,losangelesrams,-0.0193
14995,148589,148589,Tunatron_Prime,"He started stealing their lunch money I heard. 
Also the pudding cups their moms packed.

Source: trust me",-1.0,nfl,t3_xnlhun,False,0.0,:Rams: Rams,2022-09-25T11:07:11Z,losangelesrams,0.1490185185185185
14996,148590,148590,Tunatron_Prime,"I love how all offseason the convo has been arguing whether Jefferson, Adams, Hopkins, etc is the best WR in the league.

Like why the fuck not Kupp??",26.0,losangelesrams,t3_xno19p,False,0.0,Matt Gay,2022-09-25T11:06:16Z,losangelesrams,2.222222222222594e-05
15122,150106,150106,V3nMxiLLMaTic,When I see Jalen post the shhhhh pic then I’ll go crazy,52.0,losangelesrams,t3_xoqr61,False,0.0,Los Angeles Rams,2022-09-26T13:04:51Z,losangelesrams,-0.34
15123,150107,150107,V3nMxiLLMaTic,Still NFL doesn’t give him the respect as #1 receiver in the league,38.0,losangelesrams,t3_xno19p,False,0.0,Los Angeles Rams,2022-09-25T10:33:36Z,losangelesrams,0.4767
15849,152179,152179,Videoman2011,"I think the teams that are 2-1 to miss the playoffs are the Cowboys, Gaints, Bears, Browns and the Broncos. Teams that are 1-2 that i think will make the playoffs Lions, Titans, and 49ers.",2.0,nfl,t3_xovgwl,False,0.0,:Rams: Rams,2022-09-27T04:48:50Z,losangelesrams,-0.038275
15850,152180,152180,Videoman2011,They have our number in the past few years so i not surprise it time to show up and remind the football world who the defending super bowl champs are.,1.0,losangelesrams,t3_xp38vu,False,0.0,St. Louis Rams,2022-09-27T04:07:56Z,losangelesrams,0.7116
15851,152182,152182,Videoman2011,I think he have 4 more years left and i think he can maybe get between 130 and 150. But if i have say a number i say 142.,1.0,nfl,t3_xnyutl,False,0.0,:Rams: Rams,2022-09-26T00:00:01Z,losangelesrams,0.0577
15852,152183,152183,Videoman2011,Nope. He look good but i want to see how the rest of season goes before i sign,3.0,losangelesrams,t3_xo2qwm,False,0.0,St. Louis Rams,2022-09-25T23:47:24Z,losangelesrams,0.17
15853,152184,152184,Videoman2011,"Are people hating on Cam for that fumble? I think there was no player that could have hold onto the ball from a hit like that. 

He was great the second half there was this play not sure what quarter but he went right and there was just a wall and no gaps to go and it looked like the play was going to be for a loss but he turn around and went left and managed to get back to the line of scrimmage for no gain.",2.0,losangelesrams,t3_xo43ok,False,0.0,St. Louis Rams,2022-09-25T23:45:03Z,losangelesrams,-0.0206666666666666
15854,152185,152185,Videoman2011,You be surprised i been seeing more fans this year than in the last few years. They could be bandwagons but the more the merrier.,2.0,losangelesrams,t3_xo2iid,False,0.0,St. Louis Rams,2022-09-25T20:52:42Z,losangelesrams,0.3606749999999999
15855,152186,152186,Videoman2011,Nope from St. Louis who support the Rams and the Baseball Cardinals.,4.0,losangelesrams,t3_xo2iid,False,0.0,St. Louis Rams,2022-09-25T20:48:37Z,losangelesrams,0.4019
15856,152187,152187,Videoman2011,It a thing of beauty,10.0,losangelesrams,t3_xo3vme,False,0.0,St. Louis Rams,2022-09-25T19:38:23Z,losangelesrams,0.5859
15857,152188,152188,Videoman2011,His return was much needed. I confused a lot of people today at B-dubs when i cheer for LA and the Cardinals. They saw me be both happy and sad that my teams won and lost.,5.0,losangelesrams,t3_xo2iid,False,0.0,St. Louis Rams,2022-09-25T18:55:00Z,losangelesrams,0.1807111111111111
15858,152189,152189,Videoman2011,It ok just glad Pujols got 700,36.0,losangelesrams,t3_xo2iid,False,0.0,St. Louis Rams,2022-09-25T18:49:26Z,losangelesrams,0.6369
15859,152190,152190,Videoman2011,Why the fuck are we getting all the penalties called,3.0,losangelesrams,t3_xnwhkr,False,0.0,St. Louis Rams,2022-09-25T16:33:18Z,losangelesrams,-0.5423
16310,156342,156342,Wapow217,"Hmmm so does this mean the Rams are actually better then it looks?

I would have figured they would have been good defense, bad offense. 

For the most part the D has been a bright spot out side of the Buffalo game. 

Ramsey for instance since The Bills has 4 broken up passes, 1 int, 10 total tackles, with 1.5 stuffs. Not saying they are world beater by any means but more shocked by the placement.",2.0,nfl,t3_xqe9wd,False,0.0,:Rams: Rams,2022-09-28T14:57:10Z,losangelesrams,-0.120860992
16311,156343,156343,Wapow217,"I have said this many times on multiple threads about Goff. 

HE IS A SUPER BOWL WINNING CALIBER QB.

You will not win because of Goff you will win with him. Which is a big difference. And one the few weaknesses of McVay. You can fish for a man and he eats for a day or you can teach him how to fish and will eat for a life time. McVay will fish for you. He creates offense off the players he has. He is currently doing it with the o-line and the bad Rb they have. 

Goff very well could be turned into a win because of if given the right coach, much like Brees. Goff has all the intangibles to do it but as we saw this last weekend will make bone headed mistakes from time to time which is where McVay was able to actually help. He created a Madden offense for Goff that was dumbed down. Most routes had two options the short pass if the DB goes long with the other WR or a long pass to the other WR as the db goes for the short WR. McVay would read the defense for Goff and tell him where to look and go. It wasn't till later in the season that teams began to pick up on this and would wait for the headset to turn off and then switch to the actual defense. Best example was the Bears.

This is why McVay wanted Stafford. With Stafford you can win because of him right now not just with. Stafford can over come those issues that Bears caused. Goff could have won the Super Bowl last year with the Rams as well but it would have depended more on the rest of the team which I don't think there was enough fire power on offense for Goff. Stafford got the Rams to the Super Bowl by his sheer force of will something Goff can't do yet.",-1.0,nfl,t3_xqjqk7,False,0.0,:Rams: Rams,2022-09-28T13:59:28Z,losangelesrams,0.0283998455308917
16312,156360,156360,Wapow217,"This is where it's kind of hard to describe because it's both yes and no. I think Sean Payton or Dan Orlovski pointed this out and it was just a quick blurb but made a lot of sense. This is the best I can describe it. 

McVay can coach around any QB and make them look great by creating a system QB. But he is only getting them the fish. He is not teaching them how to fish though.  So the system QB will stay at just that or have little improvement compared to if you taught them how to fish. An example of this is Sean telling and talking to Goff and reading the defense for him up to the radio cut-off. That doesn't help Goff when the radio is off, the defense would then switch its coverage.  In the 2018 season, teams like the Bears started to hone in on this and just waited for the 24-sec mark when the radio shut off, and then they adjusted and it would through Goff off. 

Then you take Stafford who is like a coach and knows how to read a defense. Sean is talking with his QB not at.",1.0,nfl,t3_xmrhld,False,0.0,:Rams: Rams,2022-09-25T11:29:31Z,losangelesrams,0.0033865244290578
16313,156363,156363,Wapow217,"Goff is a Super Bowl winning QB IF you have a team around him.  Detriot has something similar to 2018 Rams and that run game. You take pressure off Goff and that dude throws fucking dimes and daggers all over the field. Goff can break a deffense. But he is not someone who can do it himself like Rodgers or Brady ir even Stafford.  With the right coach Goff might be able turn into a better Brees, sadly McVay one weakness is molding a QB the way Goff needs. Maybe Detriot has that coach for Goff. But this was my dark horse team and the x factor was Goff. Goff only reason for falling off was because the run game fell off and put all the pressure on him. 
Goff will take them to a Super Bowl. Will his team help him is the question.",10.0,nfl,t3_xmrhld,False,0.0,:Rams: Rams,2022-09-24T11:33:09Z,losangelesrams,0.0411732022472048
16314,156364,156364,Wapow217,"As a die hard Rams fan. Get T Swift back in the Super Bowl.  And I promise you, Detriot will Goff. This is the way.",1.0,nfl,t3_xmrhld,False,0.0,:Rams: Rams,2022-09-24T11:21:15Z,losangelesrams,0.0288890625
16315,156365,156365,Wapow217,"Sadly, I know this. Yes, not sure if it was his rookie year or first year with mcvay but he was had an interview talking about how he was huge fan of T Swift.",1.0,nfl,t3_xm7irp,False,0.0,:Rams: Rams,2022-09-24T11:16:13Z,losangelesrams,0.302675
16316,156378,156378,Wapow217,Jared Goff is devastated. Had she gone I would have bet my house on Detroit making it to the Super Bowl.,2.0,nfl,t3_xm7irp,False,0.0,:Rams: Rams,2022-09-23T16:06:10Z,losangelesrams,0.1466
16934,158022,158022,Wenis_Aurelius,"Dear god, it's disgusting. I love it.",10.0,losangelesrams,t3_xqkp60,False,0.0,Donald Dolphin <3,2022-09-28T14:57:57Z,losangelesrams,0.33775
16935,158023,158023,Wenis_Aurelius,We need to figure out if 9er fans hate Frisco or San Fran more and exclusively use whichever one it is.,19.0,losangelesrams,t3_xqkp60,False,0.0,Donald Dolphin <3,2022-09-28T14:48:37Z,losangelesrams,-0.5719
16936,158026,158026,Wenis_Aurelius,"Five sentences of you sucking your own dick...hard pass. There's no right or wrong here. It's a matter of perception based on action. It's subjective, so do you.",1.0,nfl,t3_xokn36,False,0.0,:Rams: Rams :Dolphins: Dolphins,2022-09-26T16:30:22Z,losangelesrams,0.0032359375
16937,158027,158027,Wenis_Aurelius,"Lol, grade A reading comprehension. 

> Everything about the Bucs **offense** was an upgrade over what Brady left in New England and the defense wasn't a significant downgrade.

I made no exceptions about everything I claimed was an upgrade. 

The [o-line was an upgrade](https://www.pff.com/news/nfl-offensive-line-rankings-following-2019-regular-season), the receivers were a massive upgrade, the TEs were an upgrade especially considering he brought the GOAT TE out of retirement with him, the running back corp was an upgrade...this is so stupid and bizarre coming from a Bucs fan. The Raiders were a massive downgrade on both sides of the ball. 

> People doubted Brady just as hard and thought he was just coming here to chill in the sun.

Must be why [Vegas gave the Bucs the best preseason odds](https://www.pro-football-reference.com/years/2020/preseason_odds.htm) ) of winning the NFCCG and 3rd best for winning the Super Bowl

Also, [the most popular consensus among members of your own sub is that people immediately began talking the Bucs up as Super Bowl contenders and lauded Brady's decision as ""genius""](https://www.reddit.com/r/buccaneers/comments/psijq8/when_did_the_narrative_that_the_bucs_are_a_super/):

> the majority of talking heads (Eisen, Florio, McAfee) immediately picked the Bucs to win the Superbowl and thought Brady made a genius move...",2.0,nfl,t3_xokn36,False,0.0,:Rams: Rams :Dolphins: Dolphins,2022-09-26T15:46:11Z,losangelesrams,0.1329957952408071
16938,158028,158028,Wenis_Aurelius,"Lol, I'm not reading all this. There's no right or wrong here. I'm not arguing with you. You said you were confused by the prevailing sentiment of this thread, so I tried to help contextualize the thought process. My bad, go on being confused.",-3.0,nfl,t3_xokn36,False,0.0,:Rams: Rams :Dolphins: Dolphins,2022-09-26T14:41:07Z,losangelesrams,-0.13281552
16939,158029,158029,Wenis_Aurelius,Lol wuuuuuuuut???? Everything about the Bucs offense was an upgrade over what Brady left in New England and the defense wasn't a significant downgrade. Literally everything about the Raiders is a downgrade from Green Bay. The situations are so widely incomparable. I can't believe this is coming from a Bucs fan.,1.0,nfl,t3_xokn36,False,0.0,:Rams: Rams :Dolphins: Dolphins,2022-09-26T14:31:16Z,losangelesrams,0.063391456
16940,158030,158030,Wenis_Aurelius,"People are capable of caring about multiple things and prioritize what's most important. 

Tae prioritized playing for his favorite team with his college buddy over winning for all the reasons listed above. If you assumed that he prioritized winning despite leaving everything above, maybe that's on you and that's why you're confused by the prevailing sentiment of this thread and your comment is sitting at -1.",-2.0,nfl,t3_xokn36,False,0.0,:Rams: Rams :Dolphins: Dolphins,2022-09-26T14:07:59Z,losangelesrams,0.2092185185185185
16941,158031,158031,Wenis_Aurelius,It's fun having a team in the other conference to root for.,1.0,nfl,t3_xokn36,False,0.0,:Rams: Rams :Dolphins: Dolphins,2022-09-26T13:53:21Z,losangelesrams,0.5106
16942,158032,158032,Wenis_Aurelius,"No one's saying he should be cool with losing because he went to a different team, people just assumed he didn't really care because of the decision he made. 

He turned down more money by a team that perennially goes to the playoffs, has a QB who's been the league MVP for damn near half of the past decade, and an offensive minded head coach from the Shannahan/McVay tree which tend to have postseason success, because he wanted to go play for his childhood favorite team that hasn't won a playoff game since before the iPhone was invented and play with his buddy who's career averages out to being solid B QB if you're being generous and a head coach from the Belicheck tree who's teams traditionally watch the post season from Cabo.",1.0,nfl,t3_xokn36,False,0.0,:Rams: Rams :Dolphins: Dolphins,2022-09-26T13:19:44Z,losangelesrams,0.22255
17385,158824,158824,WilliamBillPatterson,"You know in the college football video games when a recruit didn't have a position and was just an ""athlete"", yeah that's Skow lol",5.0,losangelesrams,t3_xoyhjj,False,0.0,Blue/Yellow Helmet,2022-09-26T21:39:32Z,losangelesrams,0.6124
17386,158826,158826,WilliamBillPatterson,There's was this one clown last year that would constantly shit on Stafford week after week. It was actually pretty sad how much he despised him. Haven't seen him since in this thread after we won the SB lol.,16.0,losangelesrams,t3_xoyhjj,False,0.0,Blue/Yellow Helmet,2022-09-26T19:41:25Z,losangelesrams,0.1895666666666666
17387,158827,158827,WilliamBillPatterson,He's the most hated player not named Tutu Atwell in this thread up until the Falcons game,68.0,losangelesrams,t3_xoyhjj,False,0.0,Blue/Yellow Helmet,2022-09-26T18:19:08Z,losangelesrams,-0.6697
17388,158828,158828,WilliamBillPatterson,"Weird, certainly doesn't seem like it lol",-2.0,nfl,t3_xoxohy,False,0.0,:Rams: Rams,2022-09-26T17:21:49Z,losangelesrams,0.3378
17731,160682,160682,YaketyMax,Unrelated: Whataburger can go ahead and ban me because In-N-Out is way better!,2.0,nfl,t3_xmf8md,False,0.0,:Rams: Rams,2022-09-23T20:44:24Z,losangelesrams,-0.2481
17732,160683,160683,YaketyMax,Just book Chris Brown and go full villain mode,1953.0,nfl,t3_xmbyq8,False,0.0,:Rams: Rams,2022-09-23T18:03:15Z,losangelesrams,-0.5574
18275,162571,162571,_-__----,Yah it was really good too cause you could tell Murray was getting frustrated with those little progresses and always being on 3rd down. Not good if the qb are more patient,1.0,losangelesrams,t3_xnwhkr,False,0.0,Blue & Gold #17,2022-09-25T18:30:00Z,losangelesrams,-0.18395
18276,162573,162573,_-__----,Finally robinson! I’ll never stop believing in you,3.0,losangelesrams,t3_xnwhkr,False,0.0,Blue & Gold #17,2022-09-25T18:01:11Z,losangelesrams,0.11175
18277,162574,162574,_-__----,"Seriously, 11 min to go!?! Like why go for it",2.0,losangelesrams,t3_xnwhkr,False,0.0,Blue & Gold #17,2022-09-25T17:57:04Z,losangelesrams,0.101925
18823,166522,166522,admiralnel,"Some good insight on our defense in the past episode. That's probably favorite thing about the pod, she has an inside view of the team/game so what she says comes from a place of knowing. As opposed to fans and some other pods/sites where it's mostly reactions based on the broadcast.",3.0,losangelesrams,t3_xps71b,False,0.0,Blue & Gold #39,2022-09-28T06:40:49Z,losangelesrams,0.0704851851851851
18824,166523,166523,admiralnel,"Currently Fuller is the 3rd safety, he's playing part time while the other 2 are full time.",17.0,losangelesrams,t3_xookc6,False,0.0,Blue & Gold #39,2022-09-26T12:53:33Z,losangelesrams,0.5574
18825,166524,166524,admiralnel,"That was always part of the plan though. I don't know why they would plan on releasing 4 but only keeping 3. It is possible but it wouldn't be that hard or unreasonable to carry 4 unis. 7-white, 6-blue, 2-bone, 2-alt",3.0,losangelesrams,t3_xo3tz6,False,0.0,Blue & Gold #39,2022-09-25T21:30:00Z,losangelesrams,0.00711875
