,Unnamed: 0.1,Unnamed: 0,author,body,score,subreddit,link_id,over_18,controversiality,author_flair_text,created_utc,flair,sentiment
18826,166526,166526,admiralnel,"The offense plays a part in that too. 3-8 on 3rd. 3 3-and-outs. Only 1 turnover this week, yay progress",1.0,losangelesrams,t3_xo2iid,False,0.0,Blue & Gold #39,2022-09-25T19:34:37Z,losangelesrams,0.183775
18827,166527,166527,admiralnel,"Lol. Mack, Van Noy, Samuel Jr, SJD, and a few other 1st or 2nd rounders  (Tillery, Adderley, Johnson). The Rams might have more top end talent (AD, Ramsey, Wagner*)but is lacking overall. The other 2 corners that played was Kendrick, a 6th rounder playing a his first snaps and some guy off of the PS (Haley). 

 (*) Wagner is obviously a future HOF, but he's lost a step. Back to back weeks he's missed a key tackle on 3rd down.",1.0,losangelesrams,t3_xnwhkr,False,0.0,Blue & Gold #39,2022-09-25T18:49:46Z,losangelesrams,-0.059041891718107
18828,166528,166528,admiralnel,Totally. 20 points is good for a modern offense. Oh wait its not...,2.0,losangelesrams,t3_xnwhkr,False,0.0,Blue & Gold #39,2022-09-25T18:25:33Z,losangelesrams,0.0251444444444444
18829,166529,166529,admiralnel,The defensive genius just gave up 38 to the Jags. Go fuck yourself,1.0,losangelesrams,t3_xnwhkr,False,0.0,Blue & Gold #39,2022-09-25T18:24:38Z,losangelesrams,-0.2647
18830,166530,166530,admiralnel,Yeah. I swear people on here are expecting madden like results.,3.0,losangelesrams,t3_xnwhkr,False,0.0,Blue & Gold #39,2022-09-25T18:22:58Z,losangelesrams,0.2330999999999999
18831,166531,166531,admiralnel,"There's not that many ""lock down"" type defenses out there anymore. And we certainly don't have the overall talent for that type. We also weren't when Staley was the DC.",2.0,losangelesrams,t3_xnwhkr,False,0.0,Blue & Gold #39,2022-09-25T18:20:33Z,losangelesrams,0.0773555555555555
18832,166533,166533,admiralnel,That was definitely off coverage.,1.0,losangelesrams,t3_xnwhkr,False,0.0,Blue & Gold #39,2022-09-25T17:58:44Z,losangelesrams,0.4019
18833,166535,166535,admiralnel,"Some of you guys need to chill. Doom, gloom, and hatred as soon as things get difficult.",4.0,losangelesrams,t3_xnwhkr,False,0.0,Blue & Gold #39,2022-09-25T17:11:32Z,losangelesrams,-0.4593
18834,166537,166537,admiralnel,"People act like its solely Raheem, a bunch of teams plays it now. Noticed it a lot watching the early games.",1.0,losangelesrams,t3_xnwhkr,False,0.0,Blue & Gold #39,2022-09-25T16:39:58Z,losangelesrams,0.135575
20912,172809,172809,barrenarrows,Tbf they were without all their best receivers outside Hollywood and he had over 100 yards receiving. Jimmy gets the ball out quick and they have Deebo and Aiyuk and that speedster rookie. If they play that far off this week that won’t do us any favors. But hopefully we get some of our secondary back.,2.0,losangelesrams,t3_xq3tad,False,0.0,Hekker Head,2022-09-28T10:45:59Z,losangelesrams,0.16835625
20913,172810,172810,barrenarrows,You think being a cards fan he’d be used to it by now.,72.0,nfl,t3_xpls1j,False,0.0,:Rams: Rams,2022-09-27T13:00:51Z,losangelesrams,0.3182
20914,172812,172812,barrenarrows,"You act like every game is a blow out 😂😂😂 look at the scores. They’re close games. Also recency bias is a thing, and rams beat them in their last match up. Maybe try to believe in your team? Kinda sus to just write them off. But go off I guess bud. Maybe you should root for the Niners.",2.0,losangelesrams,t3_xo7yjs,False,0.0,Hekker Head,2022-09-26T20:21:26Z,losangelesrams,-5.041145392529595e-06
20915,172813,172813,barrenarrows,Pls cross post to r/nfl and watch the excuses pile up,32.0,losangelesrams,t3_xoxa99,False,0.0,Hekker Head,2022-09-26T19:57:15Z,losangelesrams,0.0772
20916,172814,172814,barrenarrows,"We also always had poor LB play all those years, we figured out their run game for the playoffs and honestly should’ve won that week 18 game. Having Bobby wagner and EJ out there at the same time stop Jimmy from his bread and butter which is handing the ball off and throwing to a TE or RB in the middle of the field. They couldn’t even put up more than 10 points against a horrid broncos team that lost to the Seahawks and barely put away the Texans.",1.0,losangelesrams,t3_xo7yjs,False,0.0,Hekker Head,2022-09-26T19:07:23Z,losangelesrams,-0.2397148148148148
20917,172816,172816,barrenarrows,And somehow you’ll still make it to the NFC championship game while the media ask if Shanahan is on the hot seat.,3.0,nfl,t3_xov1sf,False,0.0,:Rams: Rams,2022-09-26T18:35:20Z,losangelesrams,-0.368
20918,172817,172817,barrenarrows,Lmao what the fuck lets go Benny.,22.0,losangelesrams,t3_xoxw7f,False,0.0,Hekker Head,2022-09-26T17:45:55Z,losangelesrams,0.1027
20919,172818,172818,barrenarrows,If you read the replies he says to tune into his podcast because they’ll be a “very special guest”,9.0,losangelesrams,t3_xoqr61,False,0.0,Hekker Head,2022-09-26T15:30:05Z,losangelesrams,0.4019
20920,172819,172819,barrenarrows,Tbf a majority of that is from the blowout when we lost by 3 touchdowns and only scored 10 points.,2.0,losangelesrams,t3_xo7yjs,False,0.0,Hekker Head,2022-09-26T14:22:10Z,losangelesrams,-0.3182
20921,172820,172820,barrenarrows,"He literally fumbled two times alone in the bucs post season game my guy.

Also: https://www.espn.com/nfl/player/stats/_/id/4039359/darrell-henderson-jr

Take a look at How many times Henderson fumbled in way more career games. (Spoiler it’s 0 times)",2.0,losangelesrams,t3_xo43ok,False,0.0,Hekker Head,2022-09-26T11:06:26Z,losangelesrams,-0.0092592592592592
20922,172822,172822,barrenarrows,"This Niners team looks way different. Also lost Trent Williams to a high ankle sprain tonight. Plus, they always killed us with their run game and that’s a huge reason we brought in Bobby. That being said, I agree, we can’t beat them in the regular season, im hoping that narrative goes away next Monday.",3.0,losangelesrams,t3_xo7yjs,False,0.0,Hekker Head,2022-09-26T05:52:44Z,losangelesrams,0.126309375
20923,172823,172823,barrenarrows,Doesn’t help 31 came from one game 😓,3.0,losangelesrams,t3_xo7yjs,False,0.0,Hekker Head,2022-09-25T23:45:06Z,losangelesrams,-0.0258
20924,172824,172824,barrenarrows,"That’s fine today,  it AZ was without their best receivers, we can’t get away with that shit every week. I have faith in morris, but playing that far off top tier wide outs and above average QBs is gonna look like Buffalo all over again.",7.0,losangelesrams,t3_xo2mmu,False,0.0,Hekker Head,2022-09-25T21:55:49Z,losangelesrams,0.2269
20925,172825,172825,barrenarrows,"If this hadn’t been a thing he did multiple times already I wouldn’t be mad, but he just can’t hold on to the ball. It’s Henderson’s last season with us, run him as much as you can, he’s consistent and not known to lose the ball.",7.0,losangelesrams,t3_xo43ok,False,0.0,Hekker Head,2022-09-25T19:54:03Z,losangelesrams,0.08615
20926,172826,172826,barrenarrows,😎,1.0,nfl,t3_xmz5y1,False,0.0,:Rams: Rams,2022-09-25T19:07:29Z,losangelesrams,0.4588
20927,172827,172827,barrenarrows,Hurt his hamstring last game.,5.0,losangelesrams,t3_xnvvh3,False,0.0,Hekker Head,2022-09-25T14:21:32Z,losangelesrams,-0.5267
20928,172828,172828,barrenarrows,CLUTCH IS ACTIVE THIS IS NOT A DRILL 🚨,38.0,losangelesrams,t3_xnvvh3,False,0.0,Hekker Head,2022-09-25T14:01:18Z,losangelesrams,0.5319
20929,172829,172829,barrenarrows,Looked like whiplash.,2.0,nfl,t3_xnr6u2,False,0.0,:Rams: Rams,2022-09-25T13:24:32Z,losangelesrams,0.3612
20930,172830,172830,barrenarrows,Sounds tight. I used to love getting a growler because it was a great excuse to crush 4 pints in one sitting because you didn’t want it to go flat.,4.0,nfl,t3_xnr6u2,False,0.0,:Rams: Rams,2022-09-25T11:20:03Z,losangelesrams,0.42595
20931,172832,172832,barrenarrows,"Man, I haven’t gotten a growler in idk how long. What did you get?",3.0,nfl,t3_xnr6u2,False,0.0,:Rams: Rams,2022-09-25T11:10:11Z,losangelesrams,-0.025675
20932,172833,172833,barrenarrows,We saw him a few times last year and it left a lot to be desired. I also think that sparkle was the fact he wasn’t watching Goff throw it away on 4th down while behind double digits.,11.0,losangelesrams,t3_xnqrx6,False,0.0,Hekker Head,2022-09-25T11:08:58Z,losangelesrams,0.27905
20933,172834,172834,barrenarrows,"To everyone calling tutu a bust, let’s consider this following statement. 

He was drafted with last years roster. We need to remember a few things about last years roster. The BIGGEST part was that our line was light years above this years like. We could actually have time of a deep threat. Tutu wasn’t used a lot because he was raw, but could develop and that’s a big reason for having Jackson as part of the WR group last season before he requested to leave. Tutu unfortunately (and I get it it’s assumed this would happen) got hurt on special teams last season so he never got to develop time with the 1’s to get into a rhythm.

I think a second issue is we didn’t expect or realize the issue with staffords arm was going to be as big of an issue as it’s become, he’s clearly not comfortable and is having issues pushing the ball deep downfield (yes I know teams are also playing two high shells which doesn’t help the situation)

Lastly, he was drafted to be a motion guy/deep threat. This sub acts like he was taken to be our WR 1 and that’s just not realistic. He’s a -late- second round pick and was seen to be a WR 3 at best.

I don’t think he’s great, I don’t think he was worth the pick given the other options available; but he wasn’t drafted to be the future rams HOF WR option on this team. The amount of hate he gets is so weird and dumb. Don’t be mad at him. He’s a dude playing wide receiver and wants to be great, if you follow him on IG he’s constantly working hard at doing what he can to contribute to the team. I’m waiting for the end of the season to come before I make an accurate thought on him. If he sucks he’ll get cut, but let’s see him get snaps when this line can keep stafford up right and when the offense is able to be on a roll, which is what he was supposed to be a part of.",2.0,losangelesrams,t3_xn2qth,False,0.0,Hekker Head,2022-09-24T22:45:09Z,losangelesrams,-0.0364633796147932
20934,172840,172840,barrenarrows,Did it? We won the game lol.,2.0,nfl,t3_xmz5y1,False,0.0,:Rams: Rams,2022-09-24T16:16:06Z,losangelesrams,0.37895
20935,172845,172845,barrenarrows,That prime time game against the packers in 2019 with the two fake hands to the face penalties had me livid. Then Mason Crosby doing the leap at the end after essentially being handed the game was so cringe.,0.0,nfl,t3_xmrhld,False,0.0,:Rams: Rams,2022-09-24T14:22:32Z,losangelesrams,-0.19125
20936,172846,172846,barrenarrows,"“He was terrible last year through the playoffs”

He had two dropped passes. One in the SB was stafford trying to force the ball to him and it hit his finger tips then bounced. I’ll never understand why people see him as god awful. He’s a 7th round dude drafted for ST’s. He had clutch catches in that ravens game and the COVID Seahawks game for first downs. He rarely got a chance to even practice with the 1’s last year. I don’t know where you have seen that he can’t create separation, there’s film that says otherwise.",15.0,nfl,t3_xmz5y1,False,0.0,:Rams: Rams,2022-09-24T14:12:47Z,losangelesrams,0.0351839157153906
20937,172848,172848,barrenarrows,"Exactly. Which leads me to believe this won’t be a short term IR, really worried he’ll end up missing this season. He’s huge for the deep threat game.",62.0,losangelesrams,t3_xmywc2,False,0.0,Hekker Head,2022-09-24T12:38:30Z,losangelesrams,-0.1545
20938,172849,172849,barrenarrows,It was wild to me every team didn’t pick up on that. Matt fucking Patricia figured that out in our week 13 game then vangio did the same the next week and after that teams just stop adjusting their defense after the 15 second mark until the SB where bill just embarrassed us. Was really fun watching CJ Anderson in that cowboys game though. Dude was having fun.,7.0,nfl,t3_xmgcfl,False,0.0,:Rams: Rams,2022-09-24T11:27:13Z,losangelesrams,0.1547015625
20939,172850,172850,barrenarrows,Tbf 7 of their 13 is on there for rest or personal reasons not injury.,23.0,losangelesrams,t3_xmaxd0,False,0.0,Hekker Head,2022-09-23T20:32:00Z,losangelesrams,0.3252
20940,172851,172851,barrenarrows,Yes. I love glass-man.,11.0,nfl,t3_xlyivi,True,0.0,:Rams: Rams,2022-09-23T12:34:19Z,losangelesrams,0.418925
21033,173034,173034,barrynice29,A rob is looking not that great of a signing,-1.0,losangelesrams,t3_xnwhkr,False,0.0,Isaac Bruce,2022-09-25T15:39:37Z,losangelesrams,-0.7842
21444,183281,183281,chestbeard10,That’s the only one i thought “maybe”. They’re in a great position. Especially if Hurts continues to play like he is.,2.0,nfl,t3_xpgnf1,False,0.0,:Rams: Rams,2022-09-27T08:33:57Z,losangelesrams,0.1139333333333333
21445,183282,183282,chestbeard10,"Well the obvious answer is until they lose. 

But my god the Eagles have a favorable schedule to say the least. Is there a game they wouldn’t be favored in if you had to make the lines right now?",2.0,nfl,t3_xpgnf1,False,0.0,:Rams: Rams,2022-09-27T08:25:51Z,losangelesrams,0.2213074074074074
21548,184114,184114,clownbaby4_,I really wanna start Higbee over Hockenson but the only player I could drop is Mattison and I don’t think that’s a good idea,1.0,nfl,t3_xnqm6y,False,0.0,:Rams: Rams,2022-09-25T11:25:58Z,losangelesrams,0.296
22264,186228,186228,cy1763,"Typically Home Field yields a 3 point advantage.  So it's essentially pick'em.  I'm sure we'll get more bets in our favor in light of how the Niners looked Sunday night.  


That said,  Shanahan has had our number through the years and has beaten us even when the Niners have been injury riddled.    


We can and should win this game but I wouldn't overlook the Niners just because they haven't looked great so far this year.  Ideally, we press the pedal down and achieve our first blowout win this year.",1.0,losangelesrams,t3_xp38vu,False,0.0,St. Louis Rams,2022-09-27T07:45:21Z,losangelesrams,0.1120251114540466
22265,186229,186229,cy1763,I’m glad they are giving more time for Peyton and Eli to watch the game. Sometimes that’s where you get the best little tid bits.,2.0,nfl,t3_xp0kxs,False,0.0,:Rams: Rams,2022-09-26T22:00:37Z,losangelesrams,0.483375
22266,186232,186232,cy1763,You got to hand it to Peyton and Eli. They are carving out their own path post retirement resulting in prolly a similar amount of money (if not more) with more creative control.,5.0,nfl,t3_xoll1n,False,0.0,:Rams: Rams,2022-09-26T14:23:50Z,losangelesrams,0.391275
22267,186233,186233,cy1763,Brandon Staley: **visibly confused**,66.0,nfl,t3_xosrcg,False,0.0,:Rams: Rams,2022-09-26T14:16:33Z,losangelesrams,-0.3182
22268,186234,186234,cy1763,Those Goff turnovers were awful.,2.0,nfl,t3_xop2yi,False,0.0,:Rams: Rams,2022-09-26T12:05:10Z,losangelesrams,-0.4588
22269,186235,186235,cy1763,Nice.,3521.0,nfl,t3_xo2u11,False,0.0,:Rams: Rams,2022-09-25T18:44:04Z,losangelesrams,0.4215
22270,186236,186236,cy1763,"A division win is always a little sweeter. 

The defense played well overall. I’ll be satisfied when the defense keeps the opposing teams at 12 points. 

The offense got the job done but wasn’t too buttoned up today compared to the defense. 

Regardless, we are 2-1! Hope to be back here in February!",132.0,losangelesrams,t3_xo2iid,False,0.0,St. Louis Rams,2022-09-25T18:30:16Z,losangelesrams,0.0828834426440329
22271,186237,186237,cy1763,A good first half defensively. Offense I wish was more productive. I wish they’d capitalize more when the defense had shut down the cards offense for 1 1/2 quarters.,7.0,losangelesrams,t3_xnwhkr,False,0.0,St. Louis Rams,2022-09-25T16:56:02Z,losangelesrams,0.1493851851851851
22272,186239,186239,cy1763,"Maybe halfway through the season at the earliest. By then, you can place teams in 3 categories. Bad, struggling and doing well.",2.0,nfl,t3_xm64nc,False,0.0,:Rams: Rams,2022-09-23T14:05:41Z,losangelesrams,-0.2123
22799,189415,189415,darkwombat45,Im not gay but jesus Jimmy is good looking.,12.0,nfl,t3_xo2zfq,False,0.0,:Rams: Rams,2022-09-25T20:41:10Z,losangelesrams,0.5927
22800,189416,189416,darkwombat45,it might as well be 20-0,2.0,nfl,t3_xo2zfq,False,0.0,:Rams: Rams,2022-09-25T20:02:29Z,losangelesrams,0.2732
22801,189419,189419,darkwombat45,"if its on Dever...

IT WAS BLOWN DEAD its on the 49ers guarantted and no defense players was near the QB, god Mike sucks..",1.0,nfl,t3_xo2zfq,False,0.0,:Rams: Rams,2022-09-25T19:49:56Z,losangelesrams,-0.3892
22802,189420,189420,darkwombat45,"Was thinking the same thing, i couldnt spot anyone back lol",1.0,nfl,t3_xo2zfq,False,0.0,:Rams: Rams,2022-09-25T19:29:31Z,losangelesrams,0.4215
22803,189421,189421,darkwombat45,As a Rams fan it hurts to say those road white 49ers uniforms with red and gold trim will always be fire.,9.0,nfl,t3_xo2zfq,False,0.0,:Rams: Rams,2022-09-25T19:07:55Z,losangelesrams,-0.4939
22804,189422,189422,darkwombat45,Green Bay might be able to weather these young receivers by having a better than expected defense..,9.0,nfl,t3_xnr6u2,False,0.0,:Rams: Rams,2022-09-25T18:28:00Z,losangelesrams,0.5267
22809,189430,189430,darkwombat45,dirty cards push out of bounds,-1.0,nfl,t3_xnr6u2,False,0.0,:Rams: Rams,2022-09-25T16:46:07Z,losangelesrams,-0.4404
22810,189431,189431,darkwombat45,Whenever Brady beats my team and my wife watches it makes me feel like a cuck.,1.0,nfl,t3_xnr6u2,False,0.0,:Rams: Rams,2022-09-25T16:39:39Z,losangelesrams,0.3612
22811,189432,189432,darkwombat45,"Yeah I agree, could it be the Eagles are the best in the NFC right now?",2.0,nfl,t3_xnr6u2,False,0.0,:Rams: Rams,2022-09-25T16:38:46Z,losangelesrams,0.5372
22812,189433,189433,darkwombat45,Kupp is sneaky fast,4.0,nfl,t3_xnr6u2,False,0.0,:Rams: Rams,2022-09-25T15:51:50Z,losangelesrams,-0.2263
23244,193870,193870,downtownjj,hes nice to look at but hes a selfish lover,43.0,nfl,t3_xo7wqk,False,0.0,:Rams: Rams,2022-09-26T00:04:59Z,losangelesrams,0.4497
23245,193871,193871,downtownjj,i enjoyed it,1.0,nfl,t3_xo7wqk,False,0.0,:Rams: Rams,2022-09-26T00:04:10Z,losangelesrams,0.5106
24504,205630,205630,hack5amurai,Please trade mac to a competent offense. Yall are wasting him.,-7.0,nfl,t3_xp0pny,False,1.0,:Rams: Rams,2022-09-26T21:03:20Z,losangelesrams,-0.1055
24505,205631,205631,hack5amurai,Good for Mac. Why rush back to get thrown to wolves with Patricia calling plays.,1.0,nfl,t3_xp0pny,False,0.0,:Rams: Rams,2022-09-26T21:01:46Z,losangelesrams,0.2351
24506,205636,205636,hack5amurai,He saved 4 points right there which was like a fifth of all the points scored.,7.0,nfl,t3_xo7wqk,False,0.0,:Rams: Rams,2022-09-25T23:36:22Z,losangelesrams,0.6486
24507,205640,205640,hack5amurai,Whatchall want for conner dude would be perfect for us.,3.0,nfl,t3_xnx9pd,False,0.0,:Rams: Rams,2022-09-25T16:30:46Z,losangelesrams,0.6124
24508,205641,205641,hack5amurai,Whatchall want for conner dude would be perfect for us.,3.0,nfl,t3_xnr6u2,False,0.0,:Rams: Rams,2022-09-25T16:30:01Z,losangelesrams,0.6124
24509,205642,205642,hack5amurai,The Los Angeles cooper kupps are ready to repeat baby!!!!,7.0,nfl,t3_xnx9pd,False,0.0,:Rams: Rams,2022-09-25T15:53:02Z,losangelesrams,0.130725
24510,205651,205651,hack5amurai,But our secondary though. I would say oline but the dudes we have out there now looked better than the starters so idk on that one.,3.0,nfl,t3_xmz5y1,False,0.0,:Rams: Rams,2022-09-24T13:10:26Z,losangelesrams,0.18585
24511,205652,205652,hack5amurai,Jesus fucking christ the last five years of good injury luck coming back to bite us all at once.,64.0,nfl,t3_xmz5y1,False,0.0,:Rams: Rams,2022-09-24T13:09:21Z,losangelesrams,0.4767
24821,207050,207050,headsmanjaeger,The Bills are playing too great out the gate to make the Super Bowl. It’ll probably be something boring like Bucs Chiefs,2.0,nfl,t3_xmb4uw,False,0.0,:Rams: Rams,2022-09-24T09:28:56Z,losangelesrams,0.243025
25502,212432,212432,idolpriest,"You need a ""/r/losangelesrams said he was ass"" checkbox",15.0,losangelesrams,t3_xo2qwm,False,0.0,sYsTeM qUaRtErBaCk,2022-09-25T19:12:35Z,losangelesrams,-0.5423
25503,212434,212434,idolpriest,"also we are preventing deep outside passes, and allowing the middle of the field to open because they need 2 scores, take 5 yard passes all day for 3 yards, for 10 in the middle and burn that clock",2.0,losangelesrams,t3_xnwhkr,False,0.0,sYsTeM qUaRtErBaCk,2022-09-25T18:22:16Z,losangelesrams,-0.0258
25504,212435,212435,idolpriest,"Give us back Staley when Morris gets a HC job, we'll take him, I know hes so terrible who would ever want him, but we'll help out a fellow LA team",12.0,nfl,t3_xo20vw,False,0.0,:Rams: Rams,2022-09-25T18:20:32Z,losangelesrams,0.2969
25505,212436,212436,idolpriest,"We obviously going to win, but its just about consitency at this point, ESPECIALLY with akers",1.0,losangelesrams,t3_xnwhkr,False,0.0,sYsTeM qUaRtErBaCk,2022-09-25T18:04:45Z,losangelesrams,0.34
25506,212437,212437,idolpriest,"Im just screaming throw a fucking fade to Kupp, shit is so automatic",2.0,losangelesrams,t3_xnwhkr,False,0.0,sYsTeM qUaRtErBaCk,2022-09-25T18:03:52Z,losangelesrams,-0.7351
25507,212438,212438,idolpriest,"People losing their minds in this game thread, but realize we only have given up 9 points, 3 field goals, 0 touchdowns.  Im not going to act like im fine sitting here watch them play 10 yards off on 3rd & short everytime, but its not like are defense is letting us down",7.0,losangelesrams,t3_xnwhkr,False,0.0,sYsTeM qUaRtErBaCk,2022-09-25T17:57:11Z,losangelesrams,-0.098125
25508,212439,212439,idolpriest,"More than Sapp in 68 less games, seriously ridiculous",46.0,nfl,t3_xnyutl,False,0.0,:Rams: Rams,2022-09-25T15:59:18Z,losangelesrams,-0.3935
25509,212440,212440,idolpriest,Why Jalen the only one wearing yellow socks lmao,9.0,losangelesrams,t3_xnwhkr,False,0.0,sYsTeM qUaRtErBaCk,2022-09-25T15:41:48Z,losangelesrams,0.5994
25510,212443,212443,idolpriest,whoevers playing for the Falcons,2.0,nfl,t3_xn951o,False,0.0,:Rams: Rams,2022-09-24T20:52:03Z,losangelesrams,0.2023
25511,212445,212445,idolpriest,"Its only 2 games, so take it with a grain of salt, but Ive noticed about Raheems defensive philsophy seems to be a lot of being stalwart in the red zone, and using the condensed field to our advantage, a lot of people hated on Raheem for his poor looking defense because teams could drive on us, but we still had a really low PPG allowed, so we really rely on keeping offensives to field goals, not letting them get huge plays, and winning the turnover battle",1.0,nfl,t3_xlywo4,False,0.0,:Rams: Rams,2022-09-23T18:49:51Z,losangelesrams,-0.7343
26147,213603,213603,itsuhdamnsecret,Im so mad,4.0,losangelesrams,t3_xo3tz6,False,0.0,Ram It!,2022-09-25T20:08:40Z,losangelesrams,-0.5413
26148,213605,213605,itsuhdamnsecret,"Good win. Defense was lights out honestly. Holding them to 4 field goals. Cant be mad at that especially when the offense fell completely asleep. Offensive line actually played ok today which i am surprised about. Offense as a whole, i will say i am a smidge disappointed. We shouldve had about 28 at the half. They have been the weakest link of the season so far.",15.0,losangelesrams,t3_xo2iid,False,0.0,Ram It!,2022-09-25T18:32:36Z,losangelesrams,-0.0649541631877422
26149,213606,213606,itsuhdamnsecret,Good win,11.0,losangelesrams,t3_xnwhkr,False,0.0,Ram It!,2022-09-25T18:30:41Z,losangelesrams,0.7717
26562,216375,216375,justmikewilldo,"It’s ok to say, he’s playing better this year.",2.0,losangelesrams,t3_xo1z2d,False,0.0,Rams,2022-09-25T19:06:07Z,losangelesrams,0.7096
26617,216974,216974,kawaii5o,after listening to christian wilkins mic'd up i'm surprised he isn't involved in 3 fights per game minimum,12.0,nfl,t3_xnrz5g,False,0.0,:Rams: Rams,2022-09-25T14:48:30Z,losangelesrams,-0.2023
26723,218433,218433,kramel7676,Still our biggest weakness,0.0,losangelesrams,t3_xnwhkr,False,0.0,Marshall Faulk,2022-09-25T16:20:16Z,losangelesrams,-0.4215
26724,218434,218434,kramel7676,Agreed on run play,1.0,losangelesrams,t3_xnwhkr,False,0.0,Marshall Faulk,2022-09-25T15:41:40Z,losangelesrams,0.5423
26725,218435,218435,kramel7676,I mean we we already giving up huge plays with our starting secondary so mind as well try something different,2.0,losangelesrams,t3_xnvvh3,False,0.0,Marshall Faulk,2022-09-25T14:45:28Z,losangelesrams,0.7943
26915,219464,219464,kreepyvision,Agreed,2.0,losangelesrams,t3_xq3tad,False,0.0,Blue & Yellow #5,2022-09-28T15:27:24Z,losangelesrams,0.2732
26916,219465,219465,kreepyvision,Yes.. you get me 👍🏾,0.0,losangelesrams,t3_xookc6,False,1.0,Blue & Yellow #5,2022-09-26T14:47:34Z,losangelesrams,0.4019
26917,219466,219466,kreepyvision,"With all due respect to you and them, the staff can't be trusted. They're too optimistic and unrealistic for my blood. I hope so, though!! I really liked how he hyped up McCutcheon during preseason.",-32.0,losangelesrams,t3_xookc6,False,0.0,Blue & Yellow #5,2022-09-26T13:17:28Z,losangelesrams,0.1581109375
26918,219467,219467,kreepyvision,"Yooo! Lots of missed opportunities. Cam Akers fumbled the bag. Jalen and the defense looked back to top form. I LOVE THE YELLOW SOCKS! McVay continues to innovate, but the offense didn’t execute to its potential. 2-1 feels good!!",2.0,losangelesrams,t3_xo2iid,False,0.0,Blue & Yellow #5,2022-09-25T19:15:52Z,losangelesrams,0.0076695252895355
26919,219470,219470,kreepyvision,Hmmmm… I kinda feel like it’s tempting fate. I want us to be done with all blue,3.0,losangelesrams,t3_xn37rs,False,0.0,Blue & Yellow #5,2022-09-24T21:17:47Z,losangelesrams,0.1138
27208,220138,220138,le0beast55,Yea I think his impact in the run game can be much more beneficial than what he can bring as a wr. But whatever helps us win I’m for it haha 🙌🏻🐏,5.0,losangelesrams,t3_xo1z2d,False,0.0,Blue/Yellow Helmet Logo,2022-09-25T18:34:54Z,losangelesrams,0.586875
