,Unnamed: 0.1,Unnamed: 0,author,body,score,subreddit,link_id,over_18,controversiality,author_flair_text,created_utc,flair,sentiment
27209,220139,220139,le0beast55,Yea I agree. I don’t think he was great at all last season and to me just didn’t seem reliable. Happy that he’s making some big plays for us,6.0,losangelesrams,t3_xo1z2d,False,0.0,Blue/Yellow Helmet Logo,2022-09-25T18:28:00Z,losangelesrams,0.3130777777777778
27443,220964,220964,lojafr,#6 welcome to the team!!,3.0,losangelesrams,t3_xnwhkr,False,0.0,LA Rams,2022-09-25T17:55:35Z,losangelesrams,0.127325
27444,220965,220965,lojafr,Is Skow the best Rams FB since Brian Leonard,2.0,losangelesrams,t3_xnwhkr,False,0.0,LA Rams,2022-09-25T17:47:35Z,losangelesrams,0.6369
27445,220968,220968,lojafr,"Bend don’t break defense. Good first half in my opinion. Staff and McVay need to spread it out. Morris, Ramsey, Donald need to keep it locked up.",6.0,losangelesrams,t3_xnwhkr,False,0.0,LA Rams,2022-09-25T16:56:02Z,losangelesrams,0.00738125
27446,220970,220970,lojafr,Powell is clear of Tutu. Allen is not gelling with the offense.,7.0,losangelesrams,t3_xnwhkr,False,0.0,LA Rams,2022-09-25T15:34:31Z,losangelesrams,-0.02955
28059,232424,232424,mtnrangeman,"- Looks like OBJ and the Rams are getting back together
- Refuses to elaborate 
- Leaves",3.0,losangelesrams,t3_xpygnk,False,0.0,Blue & Yellow #10,2022-09-27T22:38:37Z,losangelesrams,0.3612
28060,232425,232425,mtnrangeman,"Listed on the depth chart as WR/TE/FB/OL. No need to fact check that.

Also, if JJ Watt is a HOFer, and Ben Skowronek put JJ Watt on his ass….👀",154.0,losangelesrams,t3_xoxa99,False,0.0,Blue & Yellow #10,2022-09-26T17:06:39Z,losangelesrams,0.1894111111111111
28061,232426,232426,mtnrangeman,"No love for the Niners, but you never want to see guys get hurt.",1.0,losangelesrams,t3_xo561b,False,0.0,Blue & Yellow #10,2022-09-25T20:32:14Z,losangelesrams,-0.7974
28062,232428,232428,mtnrangeman,Well that was only the scariest thing ever,5.0,losangelesrams,t3_xo2iid,False,0.0,Blue & Yellow #10,2022-09-25T18:30:48Z,losangelesrams,0.2732
28063,232430,232430,mtnrangeman,"This is somehow the most frustrated ever been while giving up 9 points. Convert 3rd, convert 3rd, convert 4th, convert 2nd, convert 3rd, field goal. Offensive line needs to wake up",6.0,losangelesrams,t3_xnwhkr,False,0.0,Blue & Yellow #10,2022-09-25T17:31:10Z,losangelesrams,-0.1646629629629629
28064,232431,232431,mtnrangeman,"Fuck he’s so good, so sneaky fast",4.0,nfl,t3_xnyp6f,False,0.0,:Rams: Rams,2022-09-25T15:51:56Z,losangelesrams,-0.4815
28432,233345,233345,nerosighted,I don’t apologize because even though he was doing other good things last year his receiving was terrible. Could not hold onto the ball. Now that he’s doing more it’s excusable.,7.0,losangelesrams,t3_xo2qwm,False,0.0,Goff Head,2022-09-25T20:49:27Z,losangelesrams,0.0019111111111111
28548,234422,234422,newbmycologist,Damn👀👀 that was a nice ass pancake,3.0,losangelesrams,t3_xoxa99,False,0.0,Studman,2022-09-26T21:16:01Z,losangelesrams,-0.5267
28549,234424,234424,newbmycologist,Hell yea!,5.0,losangelesrams,t3_xop4nz,False,0.0,Studman,2022-09-26T12:04:43Z,losangelesrams,-0.7088
28550,234425,234425,newbmycologist,"49ers game winning field goal incoming

Edit: jinxed it, my work here is done🍾",24.0,nfl,t3_xo7jfi,False,0.0,:Rams: Rams,2022-09-25T22:15:01Z,losangelesrams,0.5267
28551,234426,234426,newbmycologist,I really do hate seeing the big cushion we give but shit it does work most of the time,26.0,losangelesrams,t3_xo2mmu,False,0.0,Studman,2022-09-25T18:51:58Z,losangelesrams,-0.8121
28552,234427,234427,newbmycologist,Really love the new Swiss Army knife role he’s playing,15.0,losangelesrams,t3_xo2u1s,False,0.0,Studman,2022-09-25T18:50:47Z,losangelesrams,0.7425
28701,237064,237064,nicereiss,Too soon to call Hill a HOF receiver.  The bar is pretty high for WRs.,7.0,nfl,t3_xqf2j2,False,0.0,:Rams: Rams,2022-09-28T11:15:30Z,losangelesrams,0.24695
28702,237066,237066,nicereiss,"Because one Int offsets the value of 2 TDs and 100 rushing yards, obviously.",54.0,nfl,t3_xqe3cj,False,0.0,:Rams: Rams,2022-09-28T09:50:24Z,losangelesrams,0.34
28703,237071,237071,nicereiss,This also confirms what we've already known: the AFC looks much stronger than the NFC this season.,38.0,nfl,t3_xpdf9r,False,0.0,:Rams: Rams,2022-09-27T07:58:27Z,losangelesrams,-0.4278
28704,237073,237073,nicereiss,He learned from Tom how to steal the souls of young talented players.  Poor Lance.,2.0,nfl,t3_xo2zfq,False,0.0,:Rams: Rams,2022-09-25T20:15:27Z,losangelesrams,-0.2319
28705,237074,237074,nicereiss,I like to make fun of Kyler as much as any division rival but he is unbelievably talented and his ability to make big plays off of a scramble have covered a lot of Kingsbury's deficiencies.,23.0,nfl,t3_xn4id5,False,0.0,:Rams: Rams,2022-09-24T17:16:25Z,losangelesrams,0.9223
28984,239030,239030,ofmiceomen,Arob will hit his stride don't worry about it. I still see 70 catches in his future.,3.0,losangelesrams,t3_xoawcd,False,0.0,White & Yellow #99,2022-09-26T09:52:27Z,losangelesrams,0.0853
28985,239033,239033,ofmiceomen,"Damn... Everyone is so reasonable in this thread. If it was Aaron Donald y'all would be calling for his arrest. This sub is a fucking joke.

EDIT: r/nfl is a clown show",-5.0,nfl,t3_xlkg1y,False,0.0,:Rams: Rams,2022-09-23T07:36:17Z,losangelesrams,0.015598828125
30407,253245,253245,rams4lif3,"Hollins and Lewis look good so far, and Takk looked good in the snaps I saw last game",4.0,losangelesrams,t3_xpq8ok,False,0.0,Blue & Gold #2,2022-09-27T15:47:25Z,losangelesrams,0.7003
30408,253246,253246,rams4lif3,"I still like my nickname I gave him while his hands were brick, but now I can use it because it sounds badass!Have a year, Stone Cold Benny Skow!

That being said, I will sign this form✍️",47.0,losangelesrams,t3_xo2qwm,False,0.0,Blue & Gold #2,2022-09-25T18:49:34Z,losangelesrams,0.081425
30409,253247,253247,rams4lif3,"He has shown out for a late round draft pick, love to see that development.",17.0,losangelesrams,t3_xo2gln,False,0.0,Blue & Gold #2,2022-09-25T18:46:42Z,losangelesrams,0.6369
30410,253248,253248,rams4lif3,"I would have to agree with your point there, that Akers needs to learn when fighting for extra yardage can become a liability. That being said, I think he needs a bit more experience in these short yardage/goal line situations to fully realize that. I think he was thinking that with a touchdown, the game was iced and he tried to fight for more, and that backfired. 

I think Akers can play, but he needs a slight bit more playing time to not make any of these small mistakes, as he has only really played for a season and a bit.",3.0,losangelesrams,t3_xo1z2d,False,0.0,Blue & Gold #2,2022-09-25T18:45:03Z,losangelesrams,0.100247265625
30411,253249,253249,rams4lif3,"I understand the fumbles in the Bucs Divisional game, but that fumble was not his fault, simple as that. It was a very heads up defensive play and I would not put that on Akers",1.0,losangelesrams,t3_xo1z2d,False,0.0,Blue & Gold #2,2022-09-25T18:37:23Z,losangelesrams,0.3167
30412,253250,253250,rams4lif3,"Akers is playing fine, what are you talking about? He is having a good game and then he fumbles because the ball was hit as he was trying to reach out for his 2nd TD of the game",8.0,losangelesrams,t3_xo1z2d,False,0.0,Blue & Gold #2,2022-09-25T18:16:18Z,losangelesrams,0.3248499999999999
30413,253251,253251,rams4lif3,"Hopefully the D line gets pressure today, for the secondary's sake",3.0,losangelesrams,t3_xnvvh3,False,0.0,Blue & Gold #2,2022-09-25T14:29:54Z,losangelesrams,0.128
30414,253252,253252,rams4lif3,McClutch! Also DK is finally active!,10.0,losangelesrams,t3_xnvvh3,False,0.0,Blue & Gold #2,2022-09-25T14:10:09Z,losangelesrams,0.2287
30415,253253,253253,rams4lif3,Takk Attack,2.0,losangelesrams,t3_xnsc1z,False,0.0,Blue & Gold #2,2022-09-25T12:56:00Z,losangelesrams,-0.4767
30670,253796,253796,ramzie,This rivarly is insane. As usual its going to be a bloodbath. They are as hungry to beat up on us as we are. Garappolo usually does well against us as well.,15.0,losangelesrams,t3_xq3tad,False,0.0,Blue & Yellow #32,2022-09-28T05:46:04Z,losangelesrams,0.121905078125
30671,253797,253797,ramzie,Noteboom has been a bit disappointing for us. He played better when he was a backup and made the occassional start. Havenstein still solid. David Edwards still a hit or miss in his 3rd full year of starting. Coleman Shelton is in his first year as a starter and has been surprisingly good.,0.0,nfl,t3_xq188u,False,0.0,:Rams: Rams,2022-09-28T04:29:18Z,losangelesrams,0.1209605119999999
30672,253799,253799,ramzie,What is wrong with what I said?,3.0,nfl,t3_xq3vwx,False,0.0,:Rams: Rams,2022-09-28T03:00:10Z,losangelesrams,-0.4767
30673,253800,253800,ramzie,Every year NFL does a list of the top 100 players. Just google NFL Top 100 + whichever year.,3.0,nfl,t3_xq3vwx,False,0.0,:Rams: Rams,2022-09-28T00:50:47Z,losangelesrams,0.151725
30674,253801,253801,ramzie,Good podcast. Pretty hard for any other Rams podcast to compete with a beat writer that has access to the building.,2.0,losangelesrams,t3_xps71b,False,0.0,Blue & Yellow #32,2022-09-28T00:47:26Z,losangelesrams,0.3208499999999999
30675,253803,253803,ramzie,"He was a 7th round pick that was ushered into playing loads of offensive snaps for us as a rookie and made some mistakes. On special teams he was great and you could see he was a very athletic, assertive and aggressive player with loads of potential. Wanting to get rid of him simply because of the dropped passes was a knee jerk laymans opinion.",8.0,nfl,t3_xozl5s,False,0.0,:Rams: Rams,2022-09-26T22:42:09Z,losangelesrams,-0.052837037037037
30676,253805,253805,ramzie,All the casual fans wanted to get rid of this guy because of dropped passes last year. He is a very athletic and fearless player. Cant believe we got him in the 7th round.,68.0,nfl,t3_xozl5s,False,0.0,:Rams: Rams,2022-09-26T18:38:07Z,losangelesrams,0.0616814814814814
30677,253807,253807,ramzie,What are your top 3 uniforms this season? Coming from another uniform enthusiast.,17.0,nfl,t3_xommjt,False,0.0,:Rams: Rams,2022-09-26T11:08:29Z,losangelesrams,0.231175
30678,253808,253808,ramzie,If someone would be hitting Donald under a pile and he'd do this he'd get slandered like no tomorrow on this sub. But for Allen its ok.,1.0,nfl,t3_xomun9,False,0.0,:Rams: Rams,2022-09-26T10:59:31Z,losangelesrams,0.0193
30679,253816,253816,ramzie,I assume he'll still be back at some point? Seemed like he was day-to-day before the season and now suddenly on IR without any major updates?,5.0,losangelesrams,t3_xmywc2,False,0.0,Blue & Yellow #32,2022-09-24T13:49:27Z,losangelesrams,0.1806
32273,266880,266880,superspamtastic,Crazy horse collar and facemask and yet the review its neither! Sick 4 point swing by the refs,6.0,losangelesrams,t3_xnwhkr,False,0.0,Goff Head,2022-09-25T15:37:14Z,losangelesrams,-0.355375
32274,266881,266881,superspamtastic,Bad take. Woods was traded due to his cap hit. 10 mil < 1 Mil cap number.,26.0,nfl,t3_xmz5y1,False,0.0,:Rams: Rams,2022-09-24T13:01:40Z,losangelesrams,0.0056481481481481
33088,272207,272207,thortmb,"Same as last year honestly, at times it seems great and at times I hate it",143.0,losangelesrams,t3_xqy1h9,False,0.0,Ram It!,2022-09-28T23:49:25Z,losangelesrams,0.5267
33089,272210,272210,thortmb,"Stafford is amazing against blitz, literally why we had a good year last year",11.0,nfl,t3_xqjqk7,False,0.0,:Rams: Rams,2022-09-28T14:46:45Z,losangelesrams,0.7717
33090,272212,272212,thortmb,"Holy shit how quickly people forget the jared go-off/goof experience

I love Jared but without an awesome run game and good line he crumbles under blitzes and confusing defensive schemes. He went like 36/4 when our line won best line of the year and had Todd Gurley

He also had 4 turnovers in one half a couple years later.

I want the best for him but we aren't seeing anything new, this is jared goff",55.0,nfl,t3_xqjqk7,False,0.0,:Rams: Rams,2022-09-28T13:59:13Z,losangelesrams,0.2191185185185185
33091,272217,272217,thortmb,I get strong jared goff vibes,3.0,nfl,t3_xp573f,False,0.0,:Rams: Rams,2022-09-26T23:21:55Z,losangelesrams,0.5106
33092,272220,272220,thortmb,Lol post this to nfcwestmemewar,6.0,losangelesrams,t3_xo7x1g,False,0.0,Ram It!,2022-09-25T22:59:20Z,losangelesrams,0.4215
33093,272222,272222,thortmb,"Brandon can be our deebo, I truly believe that

Am I delusional? Perhaps!?",34.0,losangelesrams,t3_xn2qth,False,0.0,Ram It!,2022-09-24T15:38:49Z,losangelesrams,0.0163111111111111
33094,272223,272223,thortmb,Give me bone zone or give me death!,21.0,losangelesrams,t3_xn37rs,False,0.0,Ram It!,2022-09-24T15:38:18Z,losangelesrams,-0.636
33095,272225,272225,thortmb,I guess it's good to get these injuries out of the way early....?,20.0,losangelesrams,t3_xm7iu4,False,0.0,Ram It!,2022-09-23T15:15:29Z,losangelesrams,0.4404
33096,272226,272226,thortmb,Fucking god damn haha,1.0,losangelesrams,t3_xm5381,False,0.0,Ram It!,2022-09-23T15:13:45Z,losangelesrams,0.3976
33476,275363,275363,tricky_trig,"I mean, McVay, has been dipped in coaching since birth. It'll be hard to find someone similar. At least with Brad Holmes at the helm, the Lions will draft well. MCDC might not be the best coach, but building a new culture from decades of losing is extremely hard to do.",2.0,losangelesrams,t3_xqegw5,False,0.0,LA Rams,2022-09-28T23:00:23Z,losangelesrams,-0.1761796875
33477,275364,275364,tricky_trig,The 49ers defense will still be a tough nut to crack. I sincerely hope we've developed more wrinkles in our offense. Skow as a FB and Kupp out of the backfield are just those wrinkles that will throw our opponents off.,2.0,losangelesrams,t3_xqegw5,False,0.0,LA Rams,2022-09-28T22:57:38Z,losangelesrams,0.0680444444444444
33478,275367,275367,tricky_trig,"Or we can see progress. And root for a 14-2 record.

Both, both is good.",1.0,detroitlions,t3_xqbiya,False,0.0,MC⚡DC,2022-09-28T12:52:10Z,losangelesrams,0.1624111111111111
33479,275369,275369,tricky_trig,"Goff has better stats than Stafford so far in 2022.

Rams are just the better overall team though. Especially on defense",13.0,losangelesrams,t3_xqegw5,False,0.0,LA Rams,2022-09-28T11:40:02Z,losangelesrams,0.1309111111111111
33480,275370,275370,tricky_trig,"Thankfully, Goff has practice with Williams, Reynolds, Hock for over a season. He's still off with Chark.",2.0,detroitlions,t3_xpjatf,False,0.0,MC⚡DC,2022-09-27T15:38:29Z,losangelesrams,0.105375
33481,275371,275371,tricky_trig,"Yeah, that happened with the Rams ala Cooper Kupp and Todd Gurley.",1.0,detroitlions,t3_xpjatf,False,0.0,MC⚡DC,2022-09-27T15:11:12Z,losangelesrams,0.296
33482,275372,275372,tricky_trig,"Uh huh. 

The old ex-QB Stafford is sitting at 74/102 7.5 YPA /4 TD/5 INT rn. With a super bowl winning team no less. And now has a higher cap hit. 

Moreover, only Geno Smith has a lower cap hit than Goff and it's not as though Goff has Wentz dead cap space. Goff is squarely in the middle but has better squads than the Raiders, Commies, and Seahawks. 

If there's the cap space after the dead cap hit, then possibly the Lions can sign Jackson. There's still finding a trade partner for Goff; while $30 mil is a lot, it might make sense for Carolina, Seattle, or Houston (if Mills doesn't work out, long shot)

And no, I don't think Brad Holmes is building around Goff, but is building a well rounded team that can be taken to the next level when they move on. Goff, with a couple first round picks, isn't too bad to accelerate that vision. A possible 2 more years with Goff is enough time to find the next, best QB 1. I also don't know if spending 40 million or more to fight against an undead Aaron Rodgers and chippy Vikings squad is really worth Lamar. But, if the FO feels like that, then let's go.

In Brad I trust.",4.0,detroitlions,t3_xpjatf,False,0.0,MC⚡DC,2022-09-27T13:26:37Z,losangelesrams,0.0421937899493806
33483,275373,275373,tricky_trig,"Amen to that. 

I just want the Escalator gang to take their L already.",1.0,losangelesrams,t3_xp38vu,False,0.0,LA Rams,2022-09-27T13:03:52Z,losangelesrams,0.3083
33484,275374,275374,tricky_trig,"If Goff restructures, it might look better.

Also, if you're complaining about Goff being a cap hit, than do I have some bad news about Lamar Jackson...

And have you looked at QBs around the league? Rather have Goff than Geno Smith or Derek Carr or whatever the Panthers situation is.",11.0,detroitlions,t3_xpjatf,False,0.0,MC⚡DC,2022-09-27T12:34:20Z,losangelesrams,-0.0557555555555555
33485,275375,275375,tricky_trig,"Yep. I saw takes like the above just before the season started.

I wish something this sub would get is that picks do not equal good players",11.0,detroitlions,t3_xpjatf,False,0.0,MC⚡DC,2022-09-27T11:39:06Z,losangelesrams,0.0763296296296296
33486,275376,275376,tricky_trig,"Because it was completely winnable.

There's losing because we suck and there's winning because we beat ourselves. This game was 100% the latter.",3.0,detroitlions,t3_xolavb,False,0.0,MC⚡DC,2022-09-27T11:28:57Z,losangelesrams,-0.0127481481481481
33487,275377,275377,tricky_trig,"Lol Williams, Chark, Hock, Reynolds, and a deep O-line. Lions will be fine.",1.0,detroitlions,t3_xpjatf,False,0.0,MC⚡DC,2022-09-27T11:27:23Z,losangelesrams,0.206525
33488,275378,275378,tricky_trig,"Nope, gotta trade away Goff for more picks and get a hotshot QB who may or may not pan out. And then in 3 years trade Hutch for more picks and draft another CB with high upside...

And on and on and on. 

I'm glad I'm seeing more takes like yours. Stay the course and baby steps.",76.0,detroitlions,t3_xpjatf,False,0.0,MC⚡DC,2022-09-27T11:26:01Z,losangelesrams,0.04364375
33489,275379,275379,tricky_trig,"Nah, it's Deebo, Kittle, Aiyuk, and that running game that will get us. Jimmy G will not win a game by himself.",2.0,losangelesrams,t3_xp38vu,False,0.0,LA Rams,2022-09-27T11:18:34Z,losangelesrams,-0.261525
33490,275380,275380,tricky_trig,"Ramsey is the Rambassador.

Sorry Eric.",2.0,losangelesrams,t3_xoqr61,False,0.0,LA Rams,2022-09-26T17:20:10Z,losangelesrams,-0.0386
33491,275381,275381,tricky_trig,"They lost on bad coaching decisions. They might do well in their division, but they are still a dark horse for playoffs.",5.0,losangelesrams,t3_xo7yjs,False,0.0,LA Rams,2022-09-26T00:19:10Z,losangelesrams,-0.104775
33492,275382,275382,tricky_trig,"But we are winning. And our lone loss is to the Bills.

This ain't the look tho.",13.0,losangelesrams,t3_xo7yjs,False,0.0,LA Rams,2022-09-26T00:17:42Z,losangelesrams,-0.0333074074074074
33493,275383,275383,tricky_trig,Whaaaatt the fuck,3.0,nfl,t3_xo2zfq,False,0.0,:Rams: Rams,2022-09-25T22:27:54Z,losangelesrams,-0.5423
33494,275385,275385,tricky_trig,And there's the Jimmy G we know and love,3.0,nfl,t3_xo2zfq,False,0.0,:Rams: Rams,2022-09-25T22:21:40Z,losangelesrams,0.6369
33495,275386,275386,tricky_trig,"The look on that woman's face was ""free me from this pain""",1.0,nfl,t3_xo2zfq,False,0.0,:Rams: Rams,2022-09-25T21:36:32Z,losangelesrams,-0.1469
33496,275387,275387,tricky_trig,Because of course he'd miss,4.0,nfl,t3_xo2zfq,False,0.0,:Rams: Rams,2022-09-25T21:36:09Z,losangelesrams,-0.1531
33497,275388,275388,tricky_trig,"First ruining Trey and now a drop back in the end zone leading to a safety.

Shanny's on a role with QBs",2.0,nfl,t3_xo2zfq,False,0.0,:Rams: Rams,2022-09-25T21:27:19Z,losangelesrams,-0.0193
33498,275391,275391,tricky_trig,His game plan decisions leave something to be desired.,1.0,detroitlions,t3_xnyb1n,False,0.0,MC⚡DC,2022-09-25T20:11:23Z,losangelesrams,0.2263
33499,275392,275392,tricky_trig,Reverse those last 4th down drives and it would've been fine,1.0,detroitlions,t3_xnykli,False,0.0,MC⚡DC,2022-09-25T20:07:51Z,losangelesrams,0.2023
33500,275393,275393,tricky_trig,"God, I'll take the dub, but ugh.",6.0,losangelesrams,t3_xnwhkr,False,0.0,LA Rams,2022-09-25T18:26:28Z,losangelesrams,-0.4854
33501,275395,275395,tricky_trig,"Oh okay, good call ref",2.0,losangelesrams,t3_xnwhkr,False,0.0,LA Rams,2022-09-25T18:10:31Z,losangelesrams,0.5859
33502,275397,275397,tricky_trig,"I'm okay with the playcall, but I'm still unclear why we didn't try a fade",3.0,losangelesrams,t3_xnwhkr,False,0.0,LA Rams,2022-09-25T18:05:16Z,losangelesrams,-0.2617
33503,275401,275401,tricky_trig,"Can we get some love for our FB SKOW!

Great job Akers!",4.0,losangelesrams,t3_xnwhkr,False,0.0,LA Rams,2022-09-25T17:39:48Z,losangelesrams,0.4968
33504,275402,275402,tricky_trig,Bradshaw for sure is,3.0,losangelesrams,t3_xnwhkr,False,0.0,LA Rams,2022-09-25T17:09:15Z,losangelesrams,0.3182
33505,275403,275403,tricky_trig,"We're winning by 7, but it feels like we're trying to experiment rather than win.",3.0,losangelesrams,t3_xnwhkr,False,0.0,LA Rams,2022-09-25T16:59:08Z,losangelesrams,0.8922
33506,275404,275404,tricky_trig,"Okay, tighten the fuck up Rams. Should not be this close",1.0,losangelesrams,t3_xnwhkr,False,0.0,LA Rams,2022-09-25T16:55:11Z,losangelesrams,-0.09545
33507,275405,275405,tricky_trig,Really feeling that cobbled together secondary,2.0,losangelesrams,t3_xnwhkr,False,0.0,LA Rams,2022-09-25T16:52:11Z,losangelesrams,0.2006
33508,275407,275407,tricky_trig,We got lazy out here,0.0,losangelesrams,t3_xnwhkr,False,0.0,LA Rams,2022-09-25T16:21:25Z,losangelesrams,-0.3612
33509,275408,275408,tricky_trig,Or they don't want another 28-3,5.0,losangelesrams,t3_xnwhkr,False,0.0,LA Rams,2022-09-25T16:08:31Z,losangelesrams,-0.0572
33510,275411,275411,tricky_trig,"I graduated college at 27. 

Cooper is legit crazy",3.0,losangelesrams,t3_xnwhkr,False,0.0,LA Rams,2022-09-25T15:55:38Z,losangelesrams,-0.34
33511,275416,275416,tricky_trig,There's the refs we all know and love,1.0,detroitlions,t3_xnqf05,False,0.0,MC⚡DC,2022-09-25T14:15:02Z,losangelesrams,0.6369
33512,275417,275417,tricky_trig,"3/4 for 4th down isn't too shabby.

But going for it on the 50 was moronic.",1.0,detroitlions,t3_xnqf05,False,0.0,MC⚡DC,2022-09-25T13:39:33Z,losangelesrams,-0.36135
33513,275418,275418,tricky_trig,"Vikes get the ball back. Still a winnable game, this was going to be a tough one.",2.0,detroitlions,t3_xnqf05,False,0.0,MC⚡DC,2022-09-25T13:22:48Z,losangelesrams,0.1591
33514,275419,275419,tricky_trig,This running game is really giving us grief,3.0,detroitlions,t3_xnqf05,False,0.0,MC⚡DC,2022-09-25T12:57:54Z,losangelesrams,-0.1952
33515,275420,275420,tricky_trig,"I've been an avid Goff defender, but the arguments come down to he has a ceiling, he got found out, he won't win a game by himself.

I've seen him ball in person. He's easily a top 10 QB with a good group, but he's pretty mid without a decent o-line. Honestly, he could be the Lions QB1 for a few years. There should be no rush until there is a good QB candidate.

Also, Brad Holmes drafted the man. In 2 years, he's done wonders. I hardly recognize the Lions anymore.",1.0,detroitlions,t3_xnqf05,False,0.0,MC⚡DC,2022-09-25T12:55:22Z,losangelesrams,6.047738194465637e-05
33516,275421,275421,tricky_trig,In standings and in our hearts,2.0,detroitlions,t3_xnqf05,False,0.0,MC⚡DC,2022-09-25T12:51:04Z,losangelesrams,0.6486
33517,275422,275422,tricky_trig,Ben Johnson is fucking killing it,2.0,detroitlions,t3_xnqf05,False,0.0,MC⚡DC,2022-09-25T12:50:46Z,losangelesrams,-0.6901
33518,275424,275424,tricky_trig,"Goff's like ""Cooper who? I got Sun God and Reynolds""",2.0,detroitlions,t3_xnqf05,False,0.0,MC⚡DC,2022-09-25T12:48:32Z,losangelesrams,0.2269
33519,275428,275428,tricky_trig,"Yknow what's better than big plays?

Scoring. And Lions have scored 30+ in both games.",1.0,detroitlions,t3_xm0h3e,False,0.0,MC⚡DC,2022-09-24T16:18:07Z,losangelesrams,0.0222
33520,275429,275429,tricky_trig,Good for him!,1.0,losangelesrams,t3_xmbmr2,False,0.0,LA Rams,2022-09-24T15:50:37Z,losangelesrams,0.4926
33521,275432,275432,tricky_trig,"Meh, Benny Skow is doing just fine at FB",2.0,nfl,t3_xmz5y1,False,0.0,:Rams: Rams,2022-09-24T15:47:54Z,losangelesrams,0.128
33522,275433,275433,tricky_trig,"BeCaUsE hE lOsT tHe SuPeR BoWl.

Dumb narratives never die.",1.0,nfl,t3_xmrhld,False,0.0,:Rams: Rams,2022-09-24T15:46:43Z,losangelesrams,0.0756
33523,275435,275435,tricky_trig,"Lions gave Goff what he always needed.

A QB coach and a good o-line.

He's always shit the first year and then goes off the second. Rams fucked up because they expected him to be fine after the SB and got rid of dedicated QB coaches. Love Staffdaddy, but Rams didn't put their best foot forward with Goofy.",1.0,nfl,t3_xmrhld,False,0.0,:Rams: Rams,2022-09-24T15:44:03Z,losangelesrams,-0.09989856
33524,275436,275436,tricky_trig,"He's a dork, but he's a tough SoB",3.0,nfl,t3_xmrhld,False,0.0,:Rams: Rams,2022-09-24T15:41:48Z,losangelesrams,-0.6059
33525,275438,275438,tricky_trig,"You're implying the Lions would win multiple playoffs games to get to the Super Bowl.

Detroit would legit stop working to watch the Lions.",1.0,nfl,t3_xmrhld,False,0.0,:Rams: Rams,2022-09-24T15:40:19Z,losangelesrams,0.0587749999999999
34059,278181,278181,txyesboy,"Noteboom be like ""uh, ok, you just lay there then.""",3.0,nfl,t3_xp2pzg,False,0.0,:Rams: Rams,2022-09-27T06:36:08Z,losangelesrams,0.3612
34060,278190,278190,txyesboy,Who's that all alone in first in the NFC West??,141.0,losangelesrams,t3_xo7w8g,False,0.0,Blue & Yellow Retro Ram,2022-09-25T22:32:05Z,losangelesrams,-0.188275
34061,278192,278192,txyesboy,"I still love me some Goff, but this is primo Goff stuff",1.0,nfl,t3_xnxt6s,False,0.0,:Rams: Rams,2022-09-25T21:54:18Z,losangelesrams,0.3818
34062,278206,278206,txyesboy,Cardinals are gonna have double the offensive plays run by game's end.,1.0,nfl,t3_xnx9pd,False,0.0,:Rams: Rams,2022-09-25T18:16:57Z,losangelesrams,-0.25
34063,278207,278207,txyesboy,"They desperately need to get the run game established. So long as they hold onto the ball, I'm ok with it.",2.0,nfl,t3_xnx9pd,False,0.0,:Rams: Rams,2022-09-25T18:04:53Z,losangelesrams,0.05255
