,Unnamed: 0.1,Unnamed: 0,author,body,score,subreddit,link_id,over_18,controversiality,author_flair_text,created_utc,flair,sentiment
19176,108796,108796,TideAtOmahaBeach,"100%. People don’t realize you have to be patient with a team like this with a young, inexperienced coaching staff and a QB who’s played in 1 system his entire 10-year career thus far. Shit like that takes time to gel but since we aren’t 5-0 we need to cut Russ and fire Paton apparently.",1.0,denverbroncos,t3_xxprmu,False,0.0,:CWxQy4O:,2022-10-07T17:10:19Z,denverbroncos,-0.1810666666666666
19177,108797,108797,TideAtOmahaBeach,Finally one rational person on this whole fucking sub. I get people are pissed but holy shit are our fans a bunch of drama queens. It’s been 5 games and people are calling the Russ trade the worst move in NFL history. Everybody needs to calm the fuck down and take their shitty hot takes to the NFL sub.,3.0,denverbroncos,t3_xxprmu,False,0.0,:CWxQy4O:,2022-10-07T16:18:31Z,denverbroncos,-0.22690625
19178,108798,108798,TideAtOmahaBeach,"I know KJ’s rightfully pissed but at least I’ve seen Melvin Gordon and Dre’Mont Jones both defending Russ on social media. Gordon called out SportsCenter for stirring up shit with that picture of him looking at Russ, saying that he believes in and loves Russ. And Dre’Mont liked a tweet from Shady McCoy clapping back at RG3 for talking shit about Russ. So hopefully not all is lost yet.",3.0,denverbroncos,t3_xxpolx,False,0.0,:CWxQy4O:,2022-10-07T14:33:06Z,denverbroncos,0.13791796875
19179,108799,108799,TideAtOmahaBeach,"It seems like we REALLY need another reliable receiving option other than Sutton. Russ doesn’t trust anybody else at all. Patrick coming back next season will certainly help and I’m excited to see what Dulcich can do. Honestly if we want to try and improve the receiving corps this season, our best option is to sign OBJ and hope he’s ready to go by the end of the season. I really feel like he and Sutton together could help Russ greatly.",2.0,denverbroncos,t3_xxr98q,False,0.0,:CWxQy4O:,2022-10-07T11:15:58Z,denverbroncos,0.178287744
19180,108800,108800,TideAtOmahaBeach,Oh yeah? Well just wait until we go down 24-0 at half against the Chargers and then kick 8 unanswered FGs to tie it up 24-24 and head into OT. Only for a fatal pick in the end zone when Russ throws to a quadruple-covered Sutton. The Chargers don’t even cover Jeudy and Hamler because they know Russ won’t look at them anyway.,3.0,denverbroncos,t3_xxos3x,False,0.0,:CWxQy4O:,2022-10-07T10:48:28Z,denverbroncos,-0.02846875
19181,108801,108801,TideAtOmahaBeach,Even if Hackett and Russ bust I’m at least happy we made a move to try to be competitive in the first place. I’m glad we didn’t want to just sit around in football purgatory during the Mahomes era like the entire AFC East did during the Brady dynasty. If the whole plan fails that definitely sucks ass but at least we made an effort and didn’t just roll over.,14.0,denverbroncos,t3_xxz6ln,False,0.0,:CWxQy4O:,2022-10-07T09:54:12Z,denverbroncos,-0.0536888888888888
19182,108802,108802,TideAtOmahaBeach,I still have some faith in Russ even though this game was absolute dogshit from him. I just really don’t trust the rest of our offense or Hackett at all.,1.0,denverbroncos,t3_xxos3x,False,0.0,:CWxQy4O:,2022-10-07T00:52:19Z,denverbroncos,0.294075
19183,108803,108803,TideAtOmahaBeach,Nah Russ was bad tonight but I still think he deserves some more time. Not like we’re gonna find a better QB than him anytime soon anyway. Might as well try to find a way to build around him for a few seasons.,1.0,denverbroncos,t3_xxos94,False,0.0,:CWxQy4O:,2022-10-07T00:31:50Z,denverbroncos,0.1002925925925926
19184,108804,108804,TideAtOmahaBeach,I’m now fully convinced we only hired Hackett to lure Rodgers over here lmao. Shame it didn’t work cuz I think Rodgers would actually have us at 5-0 rn,12.0,denverbroncos,t3_xxos94,False,0.0,:CWxQy4O:,2022-10-07T00:28:18Z,denverbroncos,-0.042325
19185,108806,108806,TideAtOmahaBeach,I honestly think Russ doesn’t trust any receiver other than Sutton lol. That’s why he keeps forcing the ball to him.,6.0,denverbroncos,t3_xxos94,False,0.0,:CWxQy4O:,2022-10-07T00:22:32Z,denverbroncos,0.21105
19186,108807,108807,TideAtOmahaBeach,Our defense is great and I still have faith in Russ but I don’t trust the rest of our offense or Hackett at all. We desperately need Tim Patrick back and I’m honestly thinking we should sign OBJ soon to give our offense a playmaker not named Sutton.,1.0,denverbroncos,t3_xxos94,False,0.0,:CWxQy4O:,2022-10-07T00:21:09Z,denverbroncos,0.1155499999999999
19751,111737,111737,Trevans,I mean ... it's not like he stabbed anyone. Yet.,35.0,nfl,t3_y27206,False,0.0,:Broncos: Broncos,2022-10-12T10:54:41Z,denverbroncos,0.01905
21657,120362,120362,XDCaboose,No matter how many games they give him the NFL will look bad.,3.0,denverbroncos,t3_y27yr3,False,0.0,14:denver-broncos-logo-tran:,2022-10-12T15:05:22Z,denverbroncos,-0.5535
21658,120363,120363,XDCaboose,How much does your gatekeeper position pay?,1.0,denverbroncos,t3_y1dmfi,False,0.0,14:denver-broncos-logo-tran:,2022-10-11T18:09:04Z,denverbroncos,-0.1027
21659,120365,120365,XDCaboose,I also don't want to watch our team on primetime,8.0,denverbroncos,t3_y1aowr,False,0.0,14:denver-broncos-logo-tran:,2022-10-11T10:45:03Z,denverbroncos,-0.0572
21660,120372,120372,XDCaboose,"""involved in that horrible accident"". Ok let's just downplay it",3.0,denverbroncos,t3_y06sma,False,0.0,14:denver-broncos-logo-tran:,2022-10-10T10:29:08Z,denverbroncos,-0.04325
21661,120373,120373,XDCaboose,That makes Paton look worse IMO,0.0,denverbroncos,t3_xzn6lm,False,1.0,14:denver-broncos-logo-tran:,2022-10-09T10:56:05Z,denverbroncos,-0.4767
21662,120385,120385,XDCaboose,Do we have to play another prime time game?,2.0,denverbroncos,t3_xy1sil,False,0.0,14:denver-broncos-logo-tran:,2022-10-07T10:58:08Z,denverbroncos,0.34
21663,120387,120387,XDCaboose,I'd give Paton one more HC before letting him go. I am really questioning our HC hiring process if we thought Hackett was the best candidate.,1.0,denverbroncos,t3_xxr98q,False,0.0,14:denver-broncos-logo-tran:,2022-10-07T07:16:57Z,denverbroncos,0.2717
23195,126965,126965,baha24,"> What irritates me is how he ~~never~~ **rarely** makes plays on the ball.

I think Jeudy has the ability to make a play if he tried. His [breakout TD](https://www.youtube.com/watch?v=6AG6nuz9SHE) from 2 seasons ago is proof of that.",1.0,denverbroncos,t3_y06sma,False,0.0,Kenny,2022-10-10T11:59:00Z,denverbroncos,0.0529814814814814
23196,126966,126966,baha24,People genuinely need to invest themselves less in a silly game and find meaning and purpose in more productive things. Your weekend shouldn’t be ruined when your team loses a game (maybe unless it’s the Super Bowl). And I say this as a nearly 30-year fan of this team.,15.0,denverbroncos,t3_xz9m8y,False,0.0,Kenny,2022-10-08T23:56:33Z,denverbroncos,0.0902814814814814
23197,126967,126967,baha24,"KJ was Russ’s #1 read on that play and was wide open. Hackett schemed it perfectly. Russ went to the wrong guy (because maybe he only trusts Sutton or something, idk). Not sure if you watch Tim Jenkins’s film breakdowns, but you should check out his latest on the Colts game. The plays were there to be made, which is a credit to Hackett. For some reason, Russ is just not making good decisions.",7.0,denverbroncos,t3_xz5np6,False,0.0,Kenny,2022-10-08T23:54:16Z,denverbroncos,-0.0419437542866941
23198,126968,126968,baha24,"Tim is a gem. Also, his analysis is making me realize that Hackett is scheming up this offense really well. We just cannot execute (or, increasingly, stay healthy...)",7.0,denverbroncos,t3_xy89ml,False,0.0,Kenny,2022-10-07T19:10:00Z,denverbroncos,0.1380666666666666
23199,126969,126969,baha24,"> But I can say, unequivocally, that as a fan base, we’re are part of the problem too.

This fan base is extremely spoiled. Fans of at least half the other teams in the league would kill to have the success we've had in our franchise's history, including, it's worth remembering, within *just the last decade.* You will get no crocodile tears from Browns, Jets, Lions, Jaguars, Texans, Panthers, etc. fans for us. I'm with you, u/TheDebateMatters -- I'm not suggesting we have to be green-eyed about the poor play we've seen so far, especially from a QB for whom we backed up the Brinks truck. Totally fine to critique this team. But man, so many fans have insane levels of entitlement. I mean, the boo birds were out during our first home game!? GTFO.

Expectations were *way* too high coming into this season. In Peyton Frikkin' Manning's first season, we were so close to starting 2–4 (and people were even calling for the return of Tebow, lmao), but because PFM was a generational talent, we found a way to get right sooner than later. I love Russell as both a player and person and think he has had an elite career, but he's not PFM. And the whole offense is operating in a new system with a first-time HC. Do people not remember what happened in during Zac Taylor's first two seasons in Cincy? They went 2–14! Then they went 4–12, including 2–7–1 before Burrow got injured. Again, *have some perspective.*

Yes, Russ is a vet. Yes, he is playing worse than he has for most of his career. You can acknowledge these things while also 1) assuming that at some point they will get things on the right track, even if it takes longer than we'd like (Russ's mistakes seem to be more mental than physical, and Hackett has nowhere to go but up as he gains more experience) and 2) not melting down because we didn't become a Super Bowl contender from Week 1.

I've been a Broncos fan since 1997, so I obviously want to see this team succeed every season. But I feel like several years of mediocrity and irrelevance (and I'm not talking about the 6 post-PFM seasons) might humble this fan base a bit. Truly disappointing to see this.

(And if anyone reading this thinks I'm tone-policing about how to be a good fan, yes, I am. There are ways to be a good fan and ways to look like a spoiled brat. Far too many in Broncos Country are doing the latter.)",3.0,denverbroncos,t3_xy2fbp,False,0.0,Kenny,2022-10-07T18:37:10Z,denverbroncos,0.0010983381512642
23200,126970,126970,baha24,"1000%. And FWIW, we didn't even have immediate results with Peyton. We nearly started the 2012 season 2–4, and the offense stunk to high heaven for the first several games. (Remember the calls for Elway to bring back Tebow? LOL.) Then suddenly, it just clicked, and there was no looking back. People need to have some perspective.",2.0,denverbroncos,t3_xy2fbp,False,0.0,Kenny,2022-10-07T18:29:06Z,denverbroncos,-0.0048165466769798
24037,132274,132274,bigpancakeguy,I feel the same way I felt when I was younger and my parents told me they were disappointed in me,2.0,denverbroncos,t3_y1gi9t,False,0.0,Demaryius Thomas,2022-10-11T19:55:01Z,denverbroncos,-0.4767
24179,136458,136458,broncofan303,"Could have made it all go away if he helped him up and apologized. I get the frustration of losing in the manner they did, but no excuse for this. Also not the type of media circus you want when your team is 1-4 and on the brink of failure for the season.",0.0,nfl,t3_y15uy2,False,0.0,:Broncos: Broncos,2022-10-11T11:28:52Z,denverbroncos,-0.1957037037037037
24180,136461,136461,broncofan303,"At least that’s the one thing the Broncos don’t need help with. Defense has been playing extremely well, which makes it even more pathetic we are 2-3 when the defense has given up 16 or less points in 4 of the 5 games. 😂😂",34.0,nfl,t3_y0ecls,False,0.0,:Broncos: Broncos,2022-10-10T10:21:37Z,denverbroncos,0.2540518518518518
24352,138408,138408,catalinaicon,Fuck columbus,12.0,denverbroncos,t3_y0yls0,False,0.0,Broncos Country Let's Ride 🐴,2022-10-10T23:48:29Z,denverbroncos,-0.5423
24353,138409,138409,catalinaicon,"Well, they are more “they” than white armchair redditors trying to speak for them",4.0,denverbroncos,t3_y0yls0,False,1.0,Broncos Country Let's Ride 🐴,2022-10-10T23:47:54Z,denverbroncos,0.2732
24622,144118,144118,crazywe,"I recently saw Davante Adams at a grocery store in Las Vegas. I told him how cool it was to meet him in person, but I didn’t want to be a douche and bother him and ask him for photos or anything.
He said, “Oh, like you’re doing now?”
I was taken aback, and all I could say was “Huh?” but he kept cutting me off and going “huh? huh? huh?” and closing his hand shut in front of my face. I walked away and continued with my shopping, and I heard him chuckle as I walked off. When I came to pay for my stuff up front I saw him trying to walk out the doors with like fifteen Milky Ways in his hands without paying.
The girl at the counter was very nice about it and professional, and was like “Sir, you need to pay for those first.” At first he kept pretending to be tired and not hear her, but eventually turned back around and brought them to the counter.
When she took one of the bars and started scanning it multiple times, he stopped her and told her to scan them each individually “to prevent any electrical infetterence,” and then turned around and winked at me. I don’t even think that’s a word. After she scanned each bar and put them in a bag and started to say the price, he kept interrupting her by yawning really loudly.",445.0,nfl,t3_y1bzc3,False,0.0,:Broncos: Broncos,2022-10-11T10:34:20Z,denverbroncos,-0.0270445510168174
24938,149839,149839,elchupacabron,Was thinking the same thing lmao,2.0,denverbroncos,t3_y1iw1n,False,0.0,:CWxQy4O:,2022-10-11T19:02:31Z,denverbroncos,0.5994
24939,149840,149840,elchupacabron,"Lots of weenies on reddit, sky is falling every week...""im done with this team"" they say. Football is football good bad or ugly, I wont miss a game!",1.0,denverbroncos,t3_xz0zje,False,0.0,:CWxQy4O:,2022-10-08T15:20:45Z,denverbroncos,-0.327625
25091,150289,150289,eric_saites,This sounds like something from I Think You Should Leave,3.0,nfl,t3_y15uy2,False,0.0,:Broncos: Broncos,2022-10-11T12:35:34Z,denverbroncos,0.3182
26052,158301,158301,iSamurai,I don’t know the extent of the injury but I do hope the coaching staff is being smart about it,8.0,denverbroncos,t3_y1iw1n,False,0.0,Kyle,2022-10-11T23:28:59Z,denverbroncos,0.7579
26053,158302,158302,iSamurai,Very true,2.0,denverbroncos,t3_y1gi9t,False,0.0,Kyle,2022-10-11T23:28:23Z,denverbroncos,0.4754
26054,158303,158303,iSamurai,It may surprise you but go look at Peyton Manning tape and he threw behind the sticks on third down plenty of times. Often it’s the best option when other options are covered and give your guy a chance to make a YAC play rather than throw an INT or incompletion.,7.0,denverbroncos,t3_y1iw1n,False,0.0,Kyle,2022-10-11T23:28:07Z,denverbroncos,0.4464
26055,158304,158304,iSamurai,100% lol,2.0,denverbroncos,t3_y1gi9t,False,0.0,Kyle,2022-10-11T17:13:09Z,denverbroncos,0.4215
26056,158305,158305,iSamurai,Well I think people just don’t have patience anymore and want instant gratification.,2.0,denverbroncos,t3_y1gi9t,False,0.0,Kyle,2022-10-11T17:12:56Z,denverbroncos,0.6124
26057,158308,158308,iSamurai,Certain people at The Fan are the worst as well was a certain person working for Woody Paige. BCT is the only way to make me feel better after reading crap here and twitter all day lol,8.0,denverbroncos,t3_y1gi9t,False,0.0,Kyle,2022-10-11T14:51:55Z,denverbroncos,0.32865
26058,158309,158309,iSamurai,"I don’t even think it’s exclusive to our fanbase. It’s just the way of the world nowadays, especially on social media. I haven’t looked at other subs of teams having struggles, but I’m willing to bet they are pretty toxic too.",7.0,denverbroncos,t3_y1gi9t,False,0.0,Kyle,2022-10-11T14:50:18Z,denverbroncos,0.1880407407407407
26059,158314,158314,iSamurai,What’s to guarantee the sky judge isn’t just as dumb? Or don’t want to go against their friends?,41.0,nfl,t3_y0wdex,False,0.0,:Broncos: Broncos :Seahawks: Seahawks,2022-10-10T23:00:07Z,denverbroncos,0.1837999999999999
26060,158315,158315,iSamurai,We need to have America vote on every penalty,164.0,nfl,t3_y0wdex,False,0.0,:Broncos: Broncos :Seahawks: Seahawks,2022-10-10T22:59:27Z,denverbroncos,-0.4588
26061,158316,158316,iSamurai,Lol exactly,10.0,nfl,t3_y0ncev,False,0.0,:Broncos: Broncos :Seahawks: Seahawks,2022-10-10T18:48:02Z,denverbroncos,0.4215
26062,158323,158323,iSamurai,Lets say they did and a starter got hurt. Now we have one more player on IR. I don’t get this argument at all.,3.0,denverbroncos,t3_xz1sbc,False,1.0,Kyle,2022-10-09T01:45:23Z,denverbroncos,-0.1647407407407407
26063,158324,158324,iSamurai,"Better yet, leave it to twitter",2.0,denverbroncos,t3_xz2d31,False,0.0,Kyle,2022-10-09T01:44:13Z,denverbroncos,0.4019
26064,158325,158325,iSamurai,"Yeah, I also mentioned here that after the game Melvin said that Russ was “dealing with something” but wouldn’t say what. Speculation was the shoulder was worse than let on.",3.0,denverbroncos,t3_xz2d31,False,0.0,Kyle,2022-10-09T01:43:38Z,denverbroncos,-0.200075
26065,158326,158326,iSamurai,Confusing though because his footwork was bad a lot of the time. that has nothing to do with your shoulder does it?,2.0,denverbroncos,t3_xz2d31,False,0.0,Kyle,2022-10-09T01:42:02Z,denverbroncos,-0.164925
26066,158328,158328,iSamurai,😬,1.0,denverbroncos,t3_xyt4n6,False,0.0,Kyle,2022-10-08T23:25:14Z,denverbroncos,-0.34
26067,158330,158330,iSamurai,Just gotta trust the process and not try to do too much 😆,3.0,denverbroncos,t3_xyt4n6,False,0.0,Kyle,2022-10-08T14:44:40Z,denverbroncos,0.7003
26068,158331,158331,iSamurai,Haha yeah no worries,3.0,denverbroncos,t3_xyt4n6,False,0.0,Kyle,2022-10-08T14:29:28Z,denverbroncos,0.7602
26069,158332,158332,iSamurai,No offense but this has been posted like 5 times now,-2.0,denverbroncos,t3_xyt4n6,False,1.0,Kyle,2022-10-08T14:19:21Z,denverbroncos,0.5603
26070,158334,158334,iSamurai,💯 lol,6.0,denverbroncos,t3_xydsnt,False,0.0,Kyle,2022-10-07T20:01:38Z,denverbroncos,0.4215
26071,158335,158335,iSamurai,Has he ever missed time before? I couldn’t think of any. Really shitty situation,5.0,denverbroncos,t3_xydsnt,False,0.0,Kyle,2022-10-07T19:56:35Z,denverbroncos,-0.2104296296296296
26072,158336,158336,iSamurai,I had no idea they only advertised a female stream and a Spanish stream.,1.0,denverbroncos,t3_xy89ml,False,0.0,Kyle,2022-10-07T18:58:34Z,denverbroncos,-0.296
26073,158337,158337,iSamurai,"Morning sports show personalities mostly, specifically Brandt’s rant. https://twitter.com/kylebrandt/status/1578347405342539776",30.0,denverbroncos,t3_xy692y,False,0.0,Kyle,2022-10-07T16:16:58Z,denverbroncos,-0.085
26074,158339,158339,iSamurai,Melvin is very close to Russ rn and on KOA last night he said Russ has been going through something but didn’t want to say what. Dunno if that means his shoulder is worse than we thought or something personal I don’t know,18.0,denverbroncos,t3_xy0kq2,False,0.0,Kyle,2022-10-07T14:43:39Z,denverbroncos,-0.2095
26075,158340,158340,iSamurai,Seems ok,18.0,denverbroncos,t3_xy5afl,False,0.0,Kyle,2022-10-07T12:46:19Z,denverbroncos,0.296
26123,158468,158468,iamfrominternet,"Thats fucking football right there. None of that pansy ass dick tugging smile for the camera bullshit. Men puke, men poop on the field, men deliver their new born baby on the side lines. Fucking hard core dick in the ass butterball foosball fuck it chuck it game time shit",10.0,nfl,t3_xzx7f5,False,0.0,:Broncos: Broncos,2022-10-09T20:15:20Z,denverbroncos,-0.281584375
28208,166901,166901,kawhinottheraptors,"Just watched the Peyton interview you linked. He really doesn’t sound any different than Russ here, he tries to keep things positive and says “we’ll be better” and “we’ll eliminate those mistakes” and “I don’t see these mistakes being a trend for us down the road”

Russ is literally saying the same stuff in his interview, but just cause he talks a bit differently doesn’t change the message they’re trying to give.

As a QB, it’s your job to make sure the players believe the team can win and for Russ I’d imagine some of it is to hold himself accountable too and speak the wins into existence. He’s not pretending he’s been playing well. He probably wants to win just as much as the next guy and it’s just because he came to town with excitement, saying “let’s ride” and the likes that he’s getting hate. It’s not 100% his fault. Winning cures everything.",2.0,nfl,t3_xy7pmg,False,0.0,:Broncos: Broncos :Vikings: Vikings,2022-10-07T21:17:24Z,denverbroncos,0.0838784248059907
28719,171896,171896,lordcheeto,The primetime games will continue until morale improves.,1.0,denverbroncos,t3_y1dmfi,False,0.0,Vance Joseph,2022-10-11T14:10:44Z,denverbroncos,0.4215
28720,171899,171899,lordcheeto,"FTR, FMFF, but FTC more with that racist ass chant **today**.",1.0,denverbroncos,t3_y0wa2x,False,0.0,Vance Joseph,2022-10-10T21:37:23Z,denverbroncos,-0.9126
28721,171904,171904,lordcheeto,Is this a cry for help?,1.0,denverbroncos,t3_xzba9l,False,0.0,Vance Joseph,2022-10-10T11:43:11Z,denverbroncos,-0.1027
28722,171907,171907,lordcheeto,"And those that really, really can't obsess over hating something so much that they go out of their way to talk shit in every single thread. Go touch some grass.",5.0,denverbroncos,t3_xz12tk,False,0.0,Vance Joseph,2022-10-09T03:39:53Z,denverbroncos,0.024675
28723,171908,171908,lordcheeto,"> It's a weird microcosm of the way people react to him.

It's a little out of left field, but I'm reminded of [this](https://thestefansmith.substack.com/p/political-cringe) post about what happens when cringe is weaponized against someone. Russ is a bit of a dork, he can be cringeworthy sometimes. I think people feel he should be embarrassed, and because he's not, that's bringing out a lot of toxicity.",4.0,denverbroncos,t3_xy2fbp,False,0.0,Vance Joseph,2022-10-07T15:26:04Z,denverbroncos,-0.112244921875
28724,171909,171909,lordcheeto,Is this a cry for help?,1.0,denverbroncos,t3_xxxflh,False,0.0,Vance Joseph,2022-10-07T10:02:39Z,denverbroncos,-0.1027
28725,171910,171910,lordcheeto,"Fingers crossed that they pull it together over this long break. It's like preseason just ended, right?",7.0,denverbroncos,t3_xxyeor,False,0.0,Vance Joseph,2022-10-07T09:49:41Z,denverbroncos,0.1806
28818,172466,172466,lukneuns,I see with Browning now why we didn't try and resign Von in the off season.  He was an absolute freak last night.,2.0,denverbroncos,t3_xy208c,False,0.0,:CWxQy4O:,2022-10-07T16:04:02Z,denverbroncos,-0.1556
29466,175404,175404,manbeqrpig,Again though it’s a big difference between what we’ve seen this year. Turnovers and just general sloppiness are fixable things that stabilize. Peyton was rusty and it showed but he got going pretty quickly and the second half of the Chargers game was the culmination of the progress he was making each week. Russ has shown absolutely zero progress in this offense and Hackett has looked completely overwhelmed by the job with the only improvements coming from reducing his responsibility. There aren’t any positives to grasp onto with this offense like there were in 2012 and the injuries are only making a significant improvement less likely,0.0,denverbroncos,t3_y1gi9t,False,1.0,Demaryius Thomas,2022-10-11T16:28:45Z,denverbroncos,0.1935656
29467,175405,175405,manbeqrpig,"People love to pile onto bandwagons. This is just the inverse of when the media and everyone was sucking off Mahomes and the Chiefs before they earned it. While I don’t think playoff expectations will be met, it’s not gonna be THIS bad all year. Hell if it’s this bad another 3 weeks we’re gonna see a historically short HC tenure. Things will cool off as we go",2.0,denverbroncos,t3_y1gi9t,False,0.0,Demaryius Thomas,2022-10-11T16:21:50Z,denverbroncos,0.0241558079999999
29468,175406,175406,manbeqrpig,"It doesn’t matter if your a decent guy. If you get traded, have the new organization base everything they’re doing around you, and then have by far the worst start to the season of your career then you deserve the criticism. Yes some of it has gone to far and gotten far too personal but Russ absolutely deserves the grilling he’s getting from the media",8.0,denverbroncos,t3_y1hns1,False,0.0,Demaryius Thomas,2022-10-11T15:18:23Z,denverbroncos,-0.0154222222222222
29469,175407,175407,manbeqrpig,"When there’s reason to be positive, this sub will be positive. Vibes were great in the sub before the season because there was a legit reason to be positive. Right now there really isn’t much of a reason to be positive with a bad coaching hire looking like it’s going to sink an absolutely critical season.",0.0,denverbroncos,t3_y1gi9t,False,1.0,Demaryius Thomas,2022-10-11T15:12:34Z,denverbroncos,0.1222037037037037
29470,175408,175408,manbeqrpig,The Manning comparison just breaks down outside the basics of being 2-3 with a new HOF QB. The lowest point total in those first 5 games was 21 points. They had over 300 yards of offense in all 5 games. The offense wasn’t clicking but it was still decent. This offense has been inept. There aren’t 1-2 things that need to be cleaned up like 2012. There are positives to be sure but this is a season that we just can’t afford to waste and quite frankly it would take a minor miracle for us to figure it out so we don’t waste this year.,26.0,denverbroncos,t3_y1gi9t,False,0.0,Demaryius Thomas,2022-10-11T15:07:35Z,denverbroncos,0.0159425630477097
