,Unnamed: 0.1,Unnamed: 0,author,body,score,subreddit,link_id,over_18,controversiality,author_flair_text,created_utc,flair,sentiment
836,5831,5831,AaawhDamn,"I used to come in here for every game thread. I've started avoiding the sub during and after games because it's just nothing but negativity, and consuming that shit enough really affects your ability to enjoy something. Best decision I've ever made.

I peep back in because I'm a masochist, but still, i wish I wouldn't",2.0,denverbroncos,t3_y1gi9t,False,0.0,Demaryius Thomas,2022-10-12T19:27:23Z,denverbroncos,0.1509171875
837,5833,5833,AaawhDamn,"Seahawks fans literally worse than any divisional rivals fans lmao.

Speaking of divisional opponents, are you old enough to remember when Seattle was in our division?",2.0,denverbroncos,t3_y0y84v,False,0.0,Demaryius Thomas,2022-10-10T23:31:23Z,denverbroncos,0.050575
1259,8980,8980,Akomack31,the beatings will continue until morale improves,4.0,nfl,t3_xy7pmg,False,0.0,:Broncos: Broncos,2022-10-07T22:21:37Z,denverbroncos,0.4215
1839,9975,9975,AlaskanAssassin98,The defense did win our last Super Bowl,1.0,denverbroncos,t3_y1gi9t,False,0.0,Cam’s Kryptonite,2022-10-12T12:38:17Z,denverbroncos,0.8481
2101,11546,11546,Anteup21,yeah this guy is high.,2.0,denverbroncos,t3_y27fxh,False,0.0,Lindsay Salute,2022-10-12T22:11:56Z,denverbroncos,0.296
2102,11547,11547,Anteup21,No a torn lat cannot heal that fast...,0.0,denverbroncos,t3_y1iw1n,False,0.0,Lindsay Salute,2022-10-12T22:04:32Z,denverbroncos,-0.1179
2103,11548,11548,Anteup21,"lol to people not seeing that this ""injury"" was a scapegoat to the criticism.",1.0,denverbroncos,t3_y1iw1n,False,0.0,Lindsay Salute,2022-10-12T22:02:25Z,denverbroncos,-0.7227
2104,11549,11549,Anteup21,not sure why you're getting downvoted...i agree.,1.0,denverbroncos,t3_y27yr3,False,0.0,Lindsay Salute,2022-10-12T21:53:02Z,denverbroncos,0.1376
2105,11550,11550,Anteup21,Being a transplant fan I love the prime time games. We just need to perform!,1.0,denverbroncos,t3_y1dmfi,False,0.0,Lindsay Salute,2022-10-11T14:42:44Z,denverbroncos,0.189475
2106,11551,11551,Anteup21,Not sure what you mean by 18 but I have been a die hard broncos fan since 1995. I have seen many of highs and lows but do a couple YouTube searches (Tim and Kurt come to mind). He’s missing throws/reads that most college level QBs make. I hope ownership and the fan base can cut ties sooner than later if it isn’t fixed by this time next season.,0.0,denverbroncos,t3_y0vngi,False,0.0,Lindsay Salute,2022-10-11T11:07:38Z,denverbroncos,0.096458984375
2107,11552,11552,Anteup21,Really enjoy these videos from a very experienced mind that knows much more about QB play than I. Farther proof that the routes/pay calls aren’t the problem. Russ needs to remember how to play QB.,2.0,denverbroncos,t3_xy89ml,False,0.0,Lindsay Salute,2022-10-10T23:35:54Z,denverbroncos,0.095774074074074
2108,11553,11553,Anteup21,He will never ever be Peyton…people need to stop with the nonsense.,0.0,denverbroncos,t3_y0san3,False,1.0,Lindsay Salute,2022-10-10T22:58:09Z,denverbroncos,-0.5994
2109,11554,11554,Anteup21,The fear of Brett out playing him would kill the narrative. Honestly I think any other NFL worthy QB would have 2 more wins if not more in the same scenarios.,4.0,denverbroncos,t3_y0san3,False,0.0,Lindsay Salute,2022-10-10T22:55:37Z,denverbroncos,0.2368
2110,11555,11555,Anteup21,This. He isn’t injured…it’s a good excuse to calm the heat…let Brett cook if he is hurt.,0.0,denverbroncos,t3_y0san3,False,1.0,Lindsay Salute,2022-10-10T22:52:57Z,denverbroncos,0.1366
2111,11556,11556,Anteup21,The injury is an excuse to quite the heat. That’s all there is to that.,-7.0,denverbroncos,t3_y0vngi,False,0.0,Lindsay Salute,2022-10-10T22:45:30Z,denverbroncos,-0.0903
2112,11557,11557,Anteup21,I continuously applaud Paton for the draft pick of PS2. Guy is legitimately our best player. Loved Javonte until he got injured just hope he isn’t a shell of himself. I can’t blame Gorge for not seeing the fools gold that is Russell let’s just hope we jump out of his contract as soon as it’s able.,-4.0,denverbroncos,t3_y0vngi,False,0.0,Lindsay Salute,2022-10-10T22:43:37Z,denverbroncos,0.171175
2113,11558,11558,Anteup21,Wow that meme hurts my soul…might be why we are so bad in the red zone he locks in on Sutton.,1.0,denverbroncos,t3_y0j41f,False,0.0,Lindsay Salute,2022-10-10T22:37:38Z,denverbroncos,-0.5847
2114,11559,11559,Anteup21,I will be honest the chiefs offense looks like the best offense I have seen in forever. Kelce is unstoppable and Mahomes is a wizard…love seeing FTR run into each other to end the game.,2.0,denverbroncos,t3_y0wa2x,False,0.0,Lindsay Salute,2022-10-10T22:31:49Z,denverbroncos,0.0964999999999999
2115,11560,11560,Anteup21,"Been trying to say this...maybe Rus will get more gelled with the offense but he is reason we are losing games. He doesn't know where to go with the ball, can not see over the oline, and forgot how to scramble.",4.0,denverbroncos,t3_xzqisi,False,0.0,Lindsay Salute,2022-10-09T17:31:00Z,denverbroncos,-0.14985
2116,11561,11561,Anteup21,Yep that’s what I meant by it. Personally I would of snuck for the 1st down but when you hand the ball off 7 yards in the backfield it’s tough,1.0,denverbroncos,t3_xxtr00,False,0.0,Lindsay Salute,2022-10-07T23:24:59Z,denverbroncos,0.34895
2117,11562,11562,Anteup21,This is a better explanation for sure. I agree with you.,7.0,denverbroncos,t3_xxpm9q,False,0.0,Lindsay Salute,2022-10-07T08:00:45Z,denverbroncos,0.339825
2118,11563,11563,Anteup21,"I would cut him after next year if he’s not any better and be actively looking for a QB. They need time to gel but any high school QB could of came out of that game with a dub, given the circumstances late in the game…It’s inexcusable.",-1.0,denverbroncos,t3_xxtr00,False,0.0,Lindsay Salute,2022-10-07T07:39:45Z,denverbroncos,-0.074325
2119,11564,11564,Anteup21,Lol I agree. Russ is a mile high past his prime…can’t even see over the OLine much less a wide open WR. Count down the days until you can cut him and try something else. This is awful.,0.0,denverbroncos,t3_xxxefl,False,1.0,Lindsay Salute,2022-10-07T07:27:06Z,denverbroncos,-0.12924140625
2120,11565,11565,Anteup21,Russ can’t see over the OLine. That’s why he’s always in shotgun…his problem is he is just to short to see the reads.,9.0,denverbroncos,t3_xxpm9q,False,0.0,Lindsay Salute,2022-10-07T07:19:39Z,denverbroncos,-0.20095
2121,11566,11566,Anteup21,Fire Russ not Hackett…Russ fails to see over his OLine. He’s washed and again we made a huge mistake at QB after not being able to acquire Aaron.,0.0,denverbroncos,t3_xxtr00,False,1.0,Lindsay Salute,2022-10-07T07:11:07Z,denverbroncos,-0.0173
2688,12805,12805,AqibTalib21,Love him. He drops some easy balls but his toute running is some of the best we ever had.,2.0,denverbroncos,t3_y06sma,False,0.0,Talib,2022-10-10T08:30:45Z,denverbroncos,0.573925
3132,15667,15667,BWasTaken,PAIN.,2.0,nfl,t3_y16ntb,False,0.0,:Broncos: Broncos,2022-10-11T09:10:59Z,denverbroncos,-0.5106
3133,15671,15671,BWasTaken,WHAT A PLAY.,1.0,nfl,t3_y0xwjd,False,0.0,:Broncos: Broncos,2022-10-10T22:02:14Z,denverbroncos,0.34
3134,15672,15672,BWasTaken,Shouldn’t the clock have stopped when Jacobs went out of bounds?,-1.0,nfl,t3_y0tru9,False,0.0,:Broncos: Broncos,2022-10-10T21:33:12Z,denverbroncos,-0.2263
5270,22264,22264,Bronco4life21,Absolutely well said,4.0,denverbroncos,t3_xyen5g,False,0.0,:randy:,2022-10-07T19:29:21Z,denverbroncos,0.3384
5271,22265,22265,Bronco4life21,My buddy played against him and Baylor in college! My claim to fame 😅,8.0,denverbroncos,t3_xy692y,False,0.0,:randy:,2022-10-07T19:15:47Z,denverbroncos,0.429925
5855,26619,26619,CapsuleCorp,"Claypool has got to be one of the laziest pro receivers I've seen in a while. Giving up on routes where he is a primary target, making zero effort on contested catches. Boggles the mind.",16.0,nfl,t3_xzpsw4,False,0.0,:Broncos: Broncos,2022-10-09T14:56:52Z,denverbroncos,0.0165962962962963
5856,26620,26620,CapsuleCorp,Goddamn Claypool has been a bum this year lmao,9.0,nfl,t3_xzpsw4,False,0.0,:Broncos: Broncos,2022-10-09T14:42:46Z,denverbroncos,0.2023
5857,26621,26621,CapsuleCorp,I'm sorry how is that a legal hit on the QB? Since when can you hit a sliding QB?,18.0,nfl,t3_xzpsw4,False,0.0,:Broncos: Broncos,2022-10-09T14:24:14Z,denverbroncos,0.0129
6204,27484,27484,CaptCarlos,I hope he ain’t referring to their heights…lol,3.0,denverbroncos,t3_xy4k9r,False,0.0,:full_bronco:,2022-10-07T12:19:43Z,denverbroncos,0.4404
6754,29405,29405,ChickenParm18,"I’ve been pretty spoiled being a fan of this team in my almost 30 years of existence. There have definitely been some sore thumb moments that stick out, but for the most part we’ve had it better then almost any other fan base.

With that being said, last night was probably the worst game I have ever watched as a fan of the team. When you combine our expectations this season, how absolute ass and injured the Colts were, our 3rd primetime game in 5 weeks, and this is what we get.

I worked 12 hours yesterday so by the time I got home I honestly wasn’t excited about the game. I just told myself well let’s see not how we win but how we just don’t lose. And then drive after drive of nothing, Matt Ryan literally BEGGING us to stay in the game with his terrible INTs. They lost their backup RB on the first drive, which is apparently our kryptonite because whenever we play a team with a 3rd string RB we lose.

It’s only 5 games, but it’s officially fair to ask these questions. Is Russ…bamboozling us? Is he actually any good anymore? Every game has had underthrown bombs, overthrown fades, short passes with way too much heat on it, and top it off with his INTs and miss on the final play. How does he miss Hamler? HOW? Is Hackett even remotely ready to be a head coach? He looks lost and confused, and the team doesn’t feel bought in. When we were in shotgun on 4th and 1 then a timeout was called I thought surely, now he’ll go under center and we’ll easily run this for a first or TD, as the running game had gotten better throughout. Then we go back out in shotgun again, time out. Surely this time we’ll figure it out! Nope, shotgun again.

I could keep going, but any excitement I had for this season is over. The only hope I have is seemingly the entire league except maybe 3-5 teams look like .500 at best right now. But the worst part is as we keep shitting the bed all we’re doing is helping Seattles draft stock. Every game I’ve told myself this is the one things start clicking. The 2-3 start with Chargers on MNF is an ironic parallel, but it’s not the same. This team is not going on an 11 game win streak. We can’t even run 11 plays without a hold.",1.0,denverbroncos,t3_xy4cus,False,0.0,PFM,2022-10-07T18:15:49Z,denverbroncos,0.0100596362381528
7096,31609,31609,CommanderThorn217,"He’ll get better I believe in him, everyone’s working on gelling together and I am sure they’re gonna hit their stride soon if not this season then next season. They’re learning and growing together as a team, they’ve got this!",1.0,denverbroncos,t3_y0j41f,False,0.0,2,2022-10-10T17:39:16Z,denverbroncos,0.283275
7124,34895,34895,DeathlyPenguin7,100% yeah,1.0,denverbroncos,t3_xx5luh,False,0.0,:1962_broncos:,2022-10-07T02:11:30Z,denverbroncos,0.296
7125,34896,34896,DeathlyPenguin7,Nice! Thank you!,1.0,denverbroncos,t3_xx5luh,False,0.0,:1962_broncos:,2022-10-07T02:11:11Z,denverbroncos,0.328775
8329,49008,49008,GearsofTed14,"And this isn’t even a hot take. He’s literally that valuable, to the point where the ravens don’t even have to *worry* about kicks anymore",4.0,nfl,t3_y2b5ns,False,0.0,:Broncos: Broncos,2022-10-12T23:15:47Z,denverbroncos,0.0258
8330,49010,49010,GearsofTed14,Just like Rodgers to Denver in 2021 was supposedly a “done deal”,7.0,nfl,t3_y2buue,False,0.0,:Broncos: Broncos,2022-10-12T18:25:01Z,denverbroncos,0.3612
8331,49011,49011,GearsofTed14,At least your uniforms are cool,6.0,nfl,t3_y2e267,False,0.0,:Broncos: Broncos,2022-10-12T18:18:57Z,denverbroncos,0.3182
8332,49016,49016,GearsofTed14,At least we didn’t waste the toppiest of those top defenses,3.0,nfl,t3_y1hkhb,False,0.0,:Broncos: Broncos,2022-10-11T16:31:44Z,denverbroncos,-0.0772
8333,49017,49017,GearsofTed14,Super Bowl hangover,1.0,nfl,t3_y1k7hj,False,0.0,:Broncos: Broncos,2022-10-11T16:28:01Z,denverbroncos,0.5994
8334,49018,49018,GearsofTed14,Maybe not missing is their good karma for missing so bad on leaf,2.0,nfl,t3_y1kbr4,False,0.0,:Broncos: Broncos,2022-10-11T16:24:34Z,denverbroncos,-0.441
8335,49019,49019,GearsofTed14,They’re the special teams farm system for the NFL,9.0,nfl,t3_y1kds0,False,0.0,:Broncos: Broncos,2022-10-11T16:22:29Z,denverbroncos,0.4019
8336,49021,49021,GearsofTed14,You could go full Denver fan and leave at overtime,11.0,denverbroncos,t3_y1iasj,False,0.0,Super Bowl 33,2022-10-11T15:56:11Z,denverbroncos,0.2732
8337,49022,49022,GearsofTed14,I’ll have won $200 if that happens,3.0,denverbroncos,t3_y1iasj,False,0.0,Super Bowl 33,2022-10-11T15:54:54Z,denverbroncos,0.5719
8338,49023,49023,GearsofTed14,"Could they? Yes.

Should they? No.

Will they? No.",12.0,denverbroncos,t3_y1js6m,False,0.0,Super Bowl 33,2022-10-11T15:40:59Z,denverbroncos,5.1684670781893e-05
8339,49024,49024,GearsofTed14,"The Chargers are to us what we are to the Raiders. They’re our dead cat bounce, “get off the mat” game. Every, single, year, no matter how good or bad each team is. And since we don’t play them again until the last week, it would not be crazy at all for the Broncos to suddenly look decent, while LA plays down assuming the Broncos won’t show up after 10 days of ridicule, and maybe Staley does another weird 4th down thing that costs them the game",14.0,denverbroncos,t3_y1iasj,False,0.0,Super Bowl 33,2022-10-11T15:40:09Z,denverbroncos,0.025828125
8340,49025,49025,GearsofTed14,So I’ll have some hope when the team quits and goes into halftime down 24-0,109.0,denverbroncos,t3_y1iasj,False,0.0,Super Bowl 33,2022-10-11T14:51:02Z,denverbroncos,0.4404
8341,49029,49029,GearsofTed14,"…kyler? 

😬 Nnnnnot that Murray

CUT TO:

Latavius getting stuffed at the goal line on 4th down",1.0,denverbroncos,t3_y0wtfm,False,0.0,Super Bowl 33,2022-10-10T23:37:41Z,denverbroncos,-0.3204
8342,49032,49032,GearsofTed14,"They feel they’re about to go FULL week 2 raider in this game. 

Like a 27-26 loss incoming",7.0,denverbroncos,t3_y0virj,False,0.0,Super Bowl 33,2022-10-10T20:34:52Z,denverbroncos,0.0258
8343,49033,49033,GearsofTed14,"Only way Hackett goes mid season is if a weird off field story or allegation comes out, otherwise he’s safe in that regard I think",2.0,denverbroncos,t3_xzvipy,False,0.0,Super Bowl 33,2022-10-10T15:38:02Z,denverbroncos,0.296
8344,49034,49034,GearsofTed14,Before today it actually might not have been that undesirable a matchup to watch,2.0,nfl,t3_y02pev,False,0.0,:Broncos: Broncos,2022-10-09T21:49:08Z,denverbroncos,-0.4404
8345,49036,49036,GearsofTed14,"Tyler Polumbus told a story of one time when he was with Washington, playing at Philadelphia, and Washington had a very janky, awkward, difficult opening drive that ended in a field goal, and the crowd booed the Philly defense off the field",4.0,denverbroncos,t3_xzz3or,False,0.0,Super Bowl 33,2022-10-09T20:02:46Z,denverbroncos,-0.3274
8346,49038,49038,GearsofTed14,"Rhule is for sure gone

I think for Hackett, it not only depends on what the record is, but how those games look. If the offense never gets it’s figured out, then he’s in real danger of going one and done (stating the obvious here)",7.0,denverbroncos,t3_xzvipy,False,0.0,Super Bowl 33,2022-10-09T17:17:10Z,denverbroncos,-0.288475
8347,49043,49043,GearsofTed14,Well done. This is the type of troll post I needed to make me feel better about this week,4.0,denverbroncos,t3_xyvmrq,False,0.0,Super Bowl 33,2022-10-09T01:30:01Z,denverbroncos,0.2885
8348,49045,49045,GearsofTed14,Oh my god that’s so beautiful—in the most reddit way possible,5.0,denverbroncos,t3_xz2ohp,False,0.0,Super Bowl 33,2022-10-08T22:00:08Z,denverbroncos,0.2732
8349,49047,49047,GearsofTed14,"No I’m in total agreement about the Wilson thing. You don’t give someone all that money just to move on from them 12 months later. I personally think Paton is distant enough from the major problems to avoid the major blast, since these failures don’t seem to be general personnel things, leaving Hackett as the odd man out, and if he’s gone, I think they’ll let Paton pick another guy (a second time HC I’d have to imagine, rather than a 4th first timer) and if *that* doesn’t work, then Paton and New Guy are gone together",1.0,denverbroncos,t3_xye822,False,0.0,Super Bowl 33,2022-10-07T20:48:49Z,denverbroncos,-0.2774703703703703
8350,49049,49049,GearsofTed14,"Yeah. And Same with Trevor Siemian, Mr 4-0 himself. Teddy B, 3-0. Obviously this doesn’t mean Russ is gonna suddenly ascend, but to do the “opening games comparison” things with QBs we’ve all thought we’re shit for years is one hell of a Cherry to pick",5.0,denverbroncos,t3_xybxon,False,0.0,Super Bowl 33,2022-10-07T20:04:08Z,denverbroncos,-0.22961875
8351,49051,49051,GearsofTed14,"In this scenario (where there is no “all 3” option), I think Hackett is the easiest the answer to be fired. While Russ has definitely played bad for good chunks thus far, Hackett has more of the cloud hanging over his head (fairly or not) which makes it easier to make him the fall guy, and while the one and done coaches are certainly a bad look, they can just chalk him up as the next Freddie Kitchens or Steve Wilks or Chip Kelly—all of whom were replaced by much better coaches. It’s a lot harder to one-and-done your $250M QB while he’s still young enough to be effective, coming off his first year in an entirely different situation where there were more problems than just him; and frankly, his name value far exceeds Hackett’s, and that’s gonna keep Russ here at *least* another two years I’d say, bare minimum. They’ll make sure he’s bad with *two* head coaches before tossing him overboard. Paton is safe for next year I think—despite the redditor freak outs saying otherwise, he’s not some primary source to blame for a lot of this, and is still considered one of the top talent evaluators in the league, and has built a very good roster in the limited time he’s been here—yes, there are OL issues, but no GM is perfect. To fire *him* after this season would be extremely hotheaded and not only *not* solving a problem, but creating a new one.

I think it’s not outside the realm of possibility that Hackett is one and done—but I think this would have to be a 6, 7 win team, with several more losses similar to last night (and week 1).",0.0,denverbroncos,t3_xye822,False,0.0,Super Bowl 33,2022-10-07T19:42:50Z,denverbroncos,0.0407724345905435
8352,49052,49052,GearsofTed14,"This is true, and actually makes me feel a lot better about this. Just bc it’s looked bad so far doesn’t mean it was the wrong move at the time. This year it *felt* like they were trying really hard to make that jump—far better than what they’ve done in the past.

And any bronco fan who thinks they knew this wasn’t going to work in the first place are lying about that, and are only making it seem like they always knew as some sort of emotional compensation for having to deal with the disappointment thus far. 

If we had just stuck with drew or teddy or some new Bandaid guy, all the same people shitting their pants about Russ would’ve had their heads going through the roof in response to how much this franchise doesn’t seem to care.

It’s all a shitty situation rn, but it’s good to at least look back and be objective about it",2.0,denverbroncos,t3_xxz6ln,False,0.0,Super Bowl 33,2022-10-07T18:30:10Z,denverbroncos,0.0562779235253772
8353,49053,49053,GearsofTed14,This sounds so bronco it’s not even funny,5.0,denverbroncos,t3_xxz6ln,False,0.0,Super Bowl 33,2022-10-07T16:48:49Z,denverbroncos,-0.3412
8354,49054,49054,GearsofTed14,I pretty much just binge on politics and geopolitics stuff—because I need something else to upset me,2.0,denverbroncos,t3_xy4hmv,False,0.0,Super Bowl 33,2022-10-07T15:48:41Z,denverbroncos,0.1531
10519,65641,65641,Kablooiee,Cool we at pace to draft Archie Manning!,1.0,denverbroncos,t3_xxpesz,False,0.0,:CWxQy4O:,2022-10-07T04:07:08Z,denverbroncos,0.3802
11291,69854,69854,Lieutenant_Meeper,This motherfucker is going to one day throw a complete pass from behind his own head. Probably against us.,2.0,nfl,t3_y0w2vb,False,0.0,:Broncos: Broncos,2022-10-10T20:47:36Z,denverbroncos,-0.1702
11292,69860,69860,Lieutenant_Meeper,"We expected Robo-Russ to be modular like a PC seeing as he came from Seattle.  We should have known Robo-Russ was built like a fucking Apple product: sealed up with proprietary software, and it would seem only Pete Carroll is certified to open him up.",3.0,nfl,t3_xypskb,False,0.0,:Broncos: Broncos,2022-10-08T13:12:17Z,denverbroncos,0.2709
11293,69862,69862,Lieutenant_Meeper,"It was Wilson. Not only is KJ open, *he is supposed to be the first fucking read*.  The whole reason they went with that play, instead of running, and instead of getting behind center, is because it's a pick for that exact defensive look. And it was wide open.",6.0,denverbroncos,t3_xy9reg,False,0.0,Barrelman,2022-10-07T19:52:02Z,denverbroncos,0.022575
11294,69864,69864,Lieutenant_Meeper,"I can understand a few here and there, and we've already talked about the last play. But that one at about 16:27 made me curse out loud. The whole POINT of that play is to get to KJ deep, and he never even looks, and bails on the play. And as he says: ""IT'S THIRD. AND TEN!""

It's like Russ doesn't know the playbook. Mr. ""I only sleep 4 hours a day"" either doesn't know his progressions or doesn't understand the play concepts. 

Russ was Paxton level bad, maybe worse.",5.0,denverbroncos,t3_xy89ml,False,0.0,Barrelman,2022-10-07T19:29:09Z,denverbroncos,-0.09895510764122
11295,69865,69865,Lieutenant_Meeper,"I think it was less about that particular game than it was 6 years of shit-ass football. We got a new coach and a borderline HOF quarterback after years of being in QB hell, and *it is, unbelievably, actually worse*.  

There's just no more patience left.",4.0,nfl,t3_xy1psn,False,0.0,:Broncos: Broncos,2022-10-07T18:47:07Z,denverbroncos,-0.1919222222222222
11296,69866,69866,Lieutenant_Meeper,"Troy Renck is absolute gold. Every time he's on air or is a guest on local sports radio he is a fount of zingers and arcane expressions, mixed in with rock solid analysis.",74.0,nfl,t3_xxpevs,False,0.0,:Broncos: Broncos,2022-10-07T06:54:35Z,denverbroncos,0.07655
11671,71713,71713,Looscannon994,Hackett next pls,1.0,nfl,t3_y0h5zf,False,0.0,:Broncos: Broncos :Broncos: Broncos,2022-10-10T10:13:03Z,denverbroncos,0.0772
11672,71715,71715,Looscannon994,I fucking hate this subreddit.,-3.0,nfl,t3_xz6l54,False,0.0,:Broncos: Broncos :Broncos: Broncos,2022-10-09T06:32:37Z,denverbroncos,-0.6115
11673,71718,71718,Looscannon994,"Yeah, it absolutely would lmao. Now, looking in the direction of a wide-open receiver is another story.",7.0,denverbroncos,t3_xz2ohp,False,0.0,Newer D Helmet,2022-10-08T16:52:06Z,denverbroncos,0.18725
11674,71720,71720,Looscannon994,I think the remaining holdouts in the Bolles Haters Club are going to have a wake-up call when they realize how important he is to the line.,35.0,denverbroncos,t3_xy5afl,False,0.0,Newer D Helmet,2022-10-07T13:33:58Z,denverbroncos,-0.34
11675,71721,71721,Looscannon994,I decided to play Phasmophobia with my friends halfway through the 4th. I already knew how it would end.,25.0,nfl,t3_xy1psn,False,0.0,:Broncos: Broncos :Broncos: Broncos,2022-10-07T13:23:29Z,denverbroncos,0.167625
12152,75835,75835,MikeJL21,For all the people defending Adams here....hes not gonna suck your dick. You need to accept that,21.0,nfl,t3_y2nf5b,False,1.0,:Broncos: Broncos,2022-10-12T23:16:05Z,denverbroncos,0.134675
12153,75837,75837,MikeJL21,DK gang for sure!,2.0,nfl,t3_y2l4q0,False,0.0,:Broncos: Broncos,2022-10-12T23:10:45Z,denverbroncos,0.3802
12154,75838,75838,MikeJL21,I for one would love to see Wes Welker line up across DK Metcalf,196.0,nfl,t3_y2l4q0,False,0.0,:Broncos: Broncos,2022-10-12T22:23:34Z,denverbroncos,0.6369
13360,80200,80200,Myoplasmic,"Another thing is it means we normally kick off at 1am for my local time so I can never watch them, not like they’re worth watching anyway",1.0,denverbroncos,t3_y1dmfi,False,0.0,Tim Patrick,2022-10-11T16:10:49Z,denverbroncos,-0.4168
13361,80201,80201,Myoplasmic,"I’m seeing that game in London in person… and guess what, it’s my first broncos game 😂 lucky me I guess",6.0,nfl,t3_y1etiu,False,0.0,:Broncos: Broncos,2022-10-11T13:46:04Z,denverbroncos,0.6908
13362,80202,80202,Myoplasmic,"There is no one else’s hands that I would trust with my life than Tim Patrick. 

I’m not biased because I bought his jersey but imo he was the most devastating injury for this season",1.0,denverbroncos,t3_y0peqq,False,0.0,Tim Patrick,2022-10-11T01:54:21Z,denverbroncos,-0.3828
13982,82064,82064,Najfore,"Noooo. This is ridiculous, it does nothing for us",8.0,denverbroncos,t3_y2jt3o,False,0.0,18,2022-10-12T19:15:10Z,denverbroncos,-0.1806
13983,82065,82065,Najfore,"Ya I DMed just to ask why mine was deleted yet this one left up ....just ignored me.

I know it's not a big deal....just so odd the places they use to demonstrate power. Was it a seniority thing? OP of this thread know them better or something?",3.0,denverbroncos,t3_y27yr3,False,0.0,18,2022-10-12T17:31:44Z,denverbroncos,0.10171328125
