,Unnamed: 0.1,Unnamed: 0,author,body,score,subreddit,link_id,over_18,controversiality,author_flair_text,created_utc,flair,sentiment
29471,175415,175415,manbeqrpig,I agree with you that scheme itself is better. The problem is how Hackett is implementing it. The play sequencing and game management (this point applies to Russ as well) is just plain bad. His insistance on being an almost exclusive shotgun team in the red zone is a major reason why we’re completely abysmal (threat of the run is a lot greater under center). The Colts game was the perfect encapsulation of all these issues with Hackett that Aaron Rodgers and Matt LeFleur papered over. Every wanted to turn a blind eye after he was fired that his offenses when he was calling plays with Buffalo and Jacksonville were mediocre at best but it’s showing now,1.0,denverbroncos,t3_xym9j2,False,0.0,Demaryius Thomas,2022-10-09T07:17:09Z,denverbroncos,-0.0189944894547325
29472,175416,175416,manbeqrpig,"Last year, our offense averaged 19.5 first downs per game with 3.1 red zone trips per game. This year, our offense is averaging 16.8 first downs per game with 2.8 red zone trips per game. We were getting more opportunities last year than we have this year",1.0,denverbroncos,t3_xym9j2,False,0.0,Demaryius Thomas,2022-10-09T06:41:04Z,denverbroncos,0.1093296296296296
29473,175417,175417,manbeqrpig,"From 2012-2020, Russ never missed a game. Last year he breaks his finger and misses 3 games. This year he injured his shoulder. Sure it could be a fluke but nobody’s body is able to withstand the same stress at 33 than it was at 23. He’s not a pure drop back passer so the toll the game takes is going to hurt his game more than most. It’ll be shocking if Russ is playing at an elite level in 3-4 years",1.0,denverbroncos,t3_xz9m8y,False,0.0,Demaryius Thomas,2022-10-09T05:02:50Z,denverbroncos,-0.0507446051954732
29474,175418,175418,manbeqrpig,"There weren’t too many expectations. The Russ injury report emphasizes even more how important this year is. His body is already starting to break down. If he still can play at an elite level, he doesn’t have much longer. This contention window is short so we can’t waste this season",-6.0,denverbroncos,t3_xz9m8y,False,0.0,Demaryius Thomas,2022-10-09T02:07:27Z,denverbroncos,-0.08075312
29475,175419,175419,manbeqrpig,"Stop lying about the offense moving the ball better on the whole. Last season we had a success rate of 44%, this year it’s 39%. Russ’s struggles help explain the passing drop off but the rush game has gotten worse as well. This isn’t just bad QB play sinking an offense. The play sequencing is poor. The game management is bad. The actual play calls are just as unimaginative as Shurmer. The easiest way to get the offense back on its feet is for Russ to get going but Hackett has to be be better as well",1.0,denverbroncos,t3_xym9j2,False,0.0,Demaryius Thomas,2022-10-09T02:01:33Z,denverbroncos,0.1022563631117343
29476,175420,175420,manbeqrpig,"I think your missing my point. There isn’t a single position group on offense where we’ve seen development from our returnees. Jeudy has plateaued, Albert O hasn’t taken a step forward to become a reliable option at the spot, the returning starters on the OL have regressed. Ya plays need to be made on Russ and the players aren’t blameless in this debacle but Hackett and his staff have been downgrade from Shurmer and his staff on the coaching front. He looks completely overwhelmed.",0.0,denverbroncos,t3_xym9j2,False,0.0,Demaryius Thomas,2022-10-08T14:53:22Z,denverbroncos,0.03334128
29477,175421,175421,manbeqrpig,You bring up a good point on the rest of the offensive coaching staff. Can you point to a single position group where the guys who are back have taken a clear step forward? To say Hackett is fine tho is being really really generous,0.0,denverbroncos,t3_xym9j2,False,0.0,Demaryius Thomas,2022-10-08T09:31:13Z,denverbroncos,0.2708
29478,175422,175422,manbeqrpig,"Yes it is. Hackett’s play sequencing is abysmal and more importantly, he’s trying to force Russ to be someone he’s not. Russ has very obvious weaknesses yet Hackett is designing and calling plays that emphasize the weaknesses. Part of the issue is that Russ is pressing and just not letting the game come to him but Hackett has to design this offense around Russ. Quit trying to make these short passes in the middle third the bread and butter of the offense cause that’s just not what Russ is good at",-1.0,denverbroncos,t3_xykuio,False,1.0,Demaryius Thomas,2022-10-08T02:49:53Z,denverbroncos,0.024883008
30242,178029,178029,monochrome_f3ar,I w want to believe,2.0,nfl,t3_y0o3q8,False,0.0,:Broncos: Broncos,2022-10-10T16:05:55Z,denverbroncos,0.0772
30243,178032,178032,monochrome_f3ar,That’s gg,2.0,nfl,t3_xzzz3u,False,0.0,:Broncos: Broncos,2022-10-09T22:15:10Z,denverbroncos,0.296
30244,178033,178033,monochrome_f3ar,Always thought if it was over the goalpost like that’s it’s no good?,2.0,nfl,t3_xzzz3u,False,0.0,:Broncos: Broncos,2022-10-09T22:09:04Z,denverbroncos,0.0243
30245,178035,178035,monochrome_f3ar,4 straight throws from the 2?!,5.0,nfl,t3_xzzz3u,False,0.0,:Broncos: Broncos,2022-10-09T21:30:04Z,denverbroncos,0.056575
30544,184255,184255,rgryffin13,"I still don't buy it though. To be clear I'm not doubting your ability to read the site which is why I'm not commenting on the 4th and 1 vs 3rd and 2. I just don't accept that statistic as true. There's no chance that a team with 3rd and 2 at the 6 yard line down 3 points has a 99% chance to win. That kind of probability would be if it was tied and a FG would win the game. 

I think u/Scared_By_A_Smile has it right that the algorithm is assuming tie = win or something similar. There are just too many ways to not win in that scenario. Even if it was the chiefs, if you gave me 100:1 odds in that scenario that the chiefs don't win, I'll take those odds. Just no way 99% is true.",1.0,denverbroncos,t3_xxpesz,False,0.0,TD,2022-10-07T11:02:02Z,denverbroncos,0.0106410347608125
30545,184256,184256,rgryffin13,I think that's it. Also their algorithm must assume that teams will see a win or a tie as equal outcomes. Then you're looking at settling for a FG and having a very high percentage chance of making it.,1.0,denverbroncos,t3_xxpesz,False,0.0,TD,2022-10-07T10:57:21Z,denverbroncos,0.1684999999999999
30546,184257,184257,rgryffin13,"Sure it's high but it's nowhere close to 99%. Just start with 4th and 1. If I asked you the odds of a team converting fourth and one it's not going to be 99%. And then if you get that, it's not a guaranteed touchdown if you're first and goal from the three. Combine those and it's not close to 99%.",13.0,denverbroncos,t3_xxpesz,False,0.0,TD,2022-10-07T01:00:57Z,denverbroncos,5.296000000000001e-05
30547,184258,184258,rgryffin13,There's no way that's true...,28.0,denverbroncos,t3_xxpesz,False,0.0,TD,2022-10-07T00:22:29Z,denverbroncos,0.1531
30985,188317,188317,smeego78,"Can he hit Hamler in the endzone? If yes, bring him home!",3.0,denverbroncos,t3_y2jt3o,False,0.0,Ma’a Tanuvasa,2022-10-12T20:00:01Z,denverbroncos,0.2287
30986,188323,188323,smeego78,"I can’t wait, starving like a mofo over here",13.0,denverbroncos,t3_y0virj,False,0.0,Ma’a Tanuvasa,2022-10-10T21:39:51Z,denverbroncos,-0.5719
30987,188325,188325,smeego78,"I hate both but the chiefs a little less so yeah, going with kermit and his minions",3.0,denverbroncos,t3_y0wa2x,False,0.0,Ma’a Tanuvasa,2022-10-10T21:36:06Z,denverbroncos,0.1111
30988,188326,188326,smeego78,"Imagine being a Chiefs fan, you can be down by 4 TDs and you’re still in it.",32.0,denverbroncos,t3_y0virj,False,0.0,Ma’a Tanuvasa,2022-10-10T20:21:26Z,denverbroncos,0.3182
30989,188327,188327,smeego78,Personally I think TP is a much more reliable receiver than Sutton and the rest of our WRs. I strongly think we’d be at least 3-2 if he wasn’t on IR.,1.0,denverbroncos,t3_y0peqq,False,0.0,Ma’a Tanuvasa,2022-10-10T20:01:07Z,denverbroncos,0.1366
30990,188328,188328,smeego78,"Yep, anytime a defender is within arms length he drops it",13.0,denverbroncos,t3_y06sma,False,0.0,Ma’a Tanuvasa,2022-10-10T01:38:56Z,denverbroncos,0.3818
30991,188330,188330,smeego78,"Beautiful routes, Butterful hands",68.0,denverbroncos,t3_y06sma,False,0.0,Ma’a Tanuvasa,2022-10-10T01:35:07Z,denverbroncos,0.5994
30992,188332,188332,smeego78,Lol that’s cold my bro…,10.0,denverbroncos,t3_xyd6h7,False,0.0,Ma’a Tanuvasa,2022-10-07T20:53:11Z,denverbroncos,0.4215
30993,188333,188333,smeego78,"Here’s some history for you:

Remember 10 years ago going into the chargers game, we were 2-3  and turned our season around by winning that game.


That’s not happening this year. 2-4 here we come.",-1.0,denverbroncos,t3_xy4cus,False,0.0,Ma’a Tanuvasa,2022-10-07T14:39:12Z,denverbroncos,0.0195074074074074
30994,188336,188336,smeego78,"When the NFL finalised the 2022 schedule, they must have thought this game was going to be a shootout between two 4-0 teams lol.",38.0,denverbroncos,t3_xxr98q,False,0.0,Ma’a Tanuvasa,2022-10-07T01:16:47Z,denverbroncos,0.4215
31277,194529,194529,theBPPE,"Same but for different reasons.  I've got young kids.  From 6pm to 8pm, between dinner, bath, potty time, pajamas, reading, lights out, etc., they require my full attention.  I don't even really get to turn on the prime time games until the second half.  Every once in a while is still fun, but 4 times in 6 weeks is stupid.",1.0,denverbroncos,t3_y1dmfi,False,0.0,Broncos,2022-10-11T13:12:29Z,denverbroncos,-0.1069199999999999
31581,197417,197417,tjn24,make sure you still contribute to that 401(k),2.0,nfl,t3_xzzgcn,False,0.0,:Broncos: Broncos,2022-10-10T06:05:04Z,denverbroncos,0.3182
32471,205700,205700,yearz,"If Russ has been hitting his wide open targets, everyone would be happy with Hackett because the team would be scoring points.  for that reason i think throwing Hackett under the bus is premature.  play calling is not the main problem",16.0,denverbroncos,t3_y0j41f,False,0.0,Broncos,2022-10-10T15:28:14Z,denverbroncos,0.2098148148148148
32472,205701,205701,yearz,"my personal opinion: Fans may have every reason to be frustrated, but booing hurts the team.  it doesn’t help the players.  it’s all about you and your need to vent even if it hurts the team.  it’s classless and selfish",-2.0,denverbroncos,t3_y0j41f,False,1.0,Broncos,2022-10-10T15:26:13Z,denverbroncos,-0.145606640625
32473,205702,205702,yearz,it’s really about helping the team by supporting the players.  booing feels satisfying but it doesnt help the players play better.  that’s why my opinion is that booing is the act of a selfish fan,7.0,denverbroncos,t3_y0j41f,False,0.0,Broncos,2022-10-10T15:23:12Z,denverbroncos,0.0373333333333333
32474,205708,205708,yearz,With QB play like this it's hard to imagine any offensive scheme looking good,5.0,denverbroncos,t3_xy4cus,False,0.0,Broncos,2022-10-07T14:52:15Z,denverbroncos,0.5267
32475,205709,205709,yearz,"Russ *was* a great QB. right not he's not league average, and it's not mainly because of the oline or the playcall, it's because he cant throw an accurate football",2.0,denverbroncos,t3_xy4cus,False,1.0,Broncos,2022-10-07T14:50:35Z,denverbroncos,0.156225
32476,205710,205710,yearz,"Probably in the minority, i don't have a problem trying to be agressive and seal the game with a TD.   The problem is Russel can no longer be trusted.  The play is designed to either hit the WR or overthrow it out of bounds.  Wilson made a flat out terrible throw, the Hack needs to realize he can't trust Wilson until further notice.",18.0,denverbroncos,t3_xy4cus,False,0.0,Broncos,2022-10-07T14:48:21Z,denverbroncos,-0.155829296875
32477,205711,205711,yearz,"This is speculative, no?  Maybe Wilson is walking on Hack.  It looks to me like Hack is calling plays, or maybe he calls multiple and lets Wilson make the decisions?  At the end of the day, delivering the ball accurately to an open receiver is what has to happen in any case, right?",3.0,denverbroncos,t3_xy4b0r,False,0.0,Broncos,2022-10-07T12:42:36Z,denverbroncos,0.034294921875
