,Unnamed: 0.1,Unnamed: 0,author,body,score,subreddit,link_id,over_18,controversiality,author_flair_text,created_utc,flair,sentiment
13984,82067,82067,Najfore,"Nah not your fault. I posted the guy pressed charges, and I agreed as to it's relevance....then had it deleted and told it was unrelated to the reddit",6.0,denverbroncos,t3_y27yr3,False,0.0,18,2022-10-12T13:24:47Z,denverbroncos,0.054075
13985,82070,82070,Najfore,Maybe slightly less toxic? Still bad tho,6.0,denverbroncos,t3_y222c1,False,0.0,18,2022-10-12T11:39:56Z,denverbroncos,-0.27115
13986,82071,82071,Najfore,Not denying it's toxic here,5.0,denverbroncos,t3_y222c1,False,0.0,18,2022-10-12T11:39:39Z,denverbroncos,0.2584
13987,82073,82073,Najfore,That sub is toxic as shit,16.0,denverbroncos,t3_y222c1,False,0.0,18,2022-10-12T10:17:22Z,denverbroncos,-0.5574
13988,82074,82074,Najfore,"I don't advocate moving on from Hackett, I like him. I see passion with Harbaugh tho, and a QB guru",1.0,denverbroncos,t3_y1gqot,False,0.0,18,2022-10-11T16:07:17Z,denverbroncos,0.3197
13989,82075,82075,Najfore,Glad he said it. Maybe some recognition from someone of his status can get people to shut up with the whining,21.0,denverbroncos,t3_y1gi9t,False,0.0,18,2022-10-11T15:07:51Z,denverbroncos,0.0015499999999999
13990,82076,82076,Najfore,"Everyone seems to hate the suggestion, and with Michigan doing good it won't happen...I still stand by wishing we had pushed for Jim Harbaugh",2.0,denverbroncos,t3_y1gqot,False,0.0,18,2022-10-11T15:05:46Z,denverbroncos,0.0258
13991,82077,82077,Najfore,"Do I think? No. Absolutely certain. Russ was mocked by Sherman one prime time, Kyle Brandt on good morning football. This isn't just a reddit thing",1.0,denverbroncos,t3_y16g63,False,0.0,18,2022-10-11T14:42:35Z,denverbroncos,0.0088312
13992,82079,82079,Najfore,"No, not rebuilding....I just think at this point we need to accept this season is getting our coaching staff/QB and team to mesh.

Clearly they didn't do enough in the offseason",3.0,denverbroncos,t3_y16g63,False,0.0,18,2022-10-11T11:58:54Z,denverbroncos,0.2964
13993,82084,82084,Najfore,"With ya. I get the tradition, but it shocks me that most fans hate the raiders more than KC. KC and their fans are absolutely the worse.

Did anyone see they were shouting racial slurs at the raiders heading into the locker room at half? Fuck KC",6.0,denverbroncos,t3_y0ydal,False,0.0,18,2022-10-11T09:25:57Z,denverbroncos,-0.11404
13994,82085,82085,Najfore,The guy is a walking twig. Look at our injuries now....do think he comes here and thrives? I honestly don't think he's getting off the plane without a season ending injury,1.0,denverbroncos,t3_y19hxc,False,0.0,18,2022-10-11T09:23:33Z,denverbroncos,0.0172
13995,82086,82086,Najfore,"We have to accept this season is a building season. My main concern is Wilson's injury, and confidence.

We don't know the extent of his injury or how it's playing on his psyche. He seems flustered and desperate and scared, all at the same time.

At the same time, someone mentioned in another thread, he was a media darling in Seattle. He pretty much never faced scrutiny or judgement, he was just adored. Ya of course now Seattle fans act like he's this horrible cringe guy, but they are fake as shit.

I'm afraid the negative publicity and scrutiny is just pushing him further down into his hole.

That's not to excuse it, he has to be able to perform on the level he's being paid. Short of the injury that might need time to heal, he has to get it figured out. With how much Wilson was paid, Hackett will pay the price for his poor play. They are gonna try a new coach before they look past Russ.",1.0,denverbroncos,t3_y16g63,False,0.0,18,2022-10-11T09:20:49Z,denverbroncos,-0.0021464793854898
13996,82089,82089,Najfore,"If we are smart, Russ won't play till after the bye. He's injured, and it can't get better without him sitting",3.0,denverbroncos,t3_xzmd2h,False,0.0,18,2022-10-09T22:57:22Z,denverbroncos,-0.27055
13997,82090,82090,Najfore,"Long range between booing your team at home, week 2....and applauding dysfunctional play.",1.0,denverbroncos,t3_xzz8i7,False,0.0,18,2022-10-09T18:50:07Z,denverbroncos,0.6705
13998,82091,82091,Najfore,"I agree, but the fact our fans booed our team their first week at home, it's hard to say we aren't trashy.

It's a spoiled fanbase that expects Superbowls every year. Literally if one wideouts drops a pass they call for the coach to be fired.

Also take with a grain of salt that the loudest people are the most vitriol, so more complaints on the internet than optimism.

I agree though, it's seemed especially bad this season, first time I've thought about staying away from the sub for awhile",4.0,denverbroncos,t3_xzz8i7,False,0.0,18,2022-10-09T18:20:03Z,denverbroncos,-0.0654308159999999
13999,82092,82092,Najfore,"Tis best you move on, good call.",-1.0,denverbroncos,t3_xzba9l,False,0.0,18,2022-10-09T17:24:13Z,denverbroncos,0.7964
14000,82093,82093,Najfore,"The broad statement? The one that 97% of any concussed player could fall under?

I understood your blanket statement. It's been made clear the injury he has does not fall under ""if he's healthy enough to be on the field.""",0.0,denverbroncos,t3_xzba9l,False,0.0,18,2022-10-09T17:17:16Z,denverbroncos,0.0903
14001,82096,82096,Najfore,And injured,11.0,denverbroncos,t3_xzpnsq,False,0.0,18,2022-10-09T13:59:10Z,denverbroncos,-0.4019
14002,82097,82097,Najfore,Defense isnt making our QB miss open guys and our receivers drop balls,26.0,denverbroncos,t3_xzn6lm,False,0.0,18,2022-10-09T11:14:27Z,denverbroncos,-0.296
14003,82098,82098,Najfore,Don't worry about random dumbasses and just live life,7.0,denverbroncos,t3_xzp6yx,False,0.0,18,2022-10-09T11:13:08Z,denverbroncos,0.3412
14004,82099,82099,Najfore,"Unless he's not healthy enough to play, and still is. You guys are so dense and delusional this season",-5.0,denverbroncos,t3_xzba9l,False,0.0,18,2022-10-09T11:12:18Z,denverbroncos,0.00915
14005,82100,82100,Najfore,"The difference is expecting him *while* injured. If Hackett knew about the injury and still put in Russ hands....it's on him.

Whether Russ downplayed everything, that's on russ",-1.0,denverbroncos,t3_xzba9l,False,1.0,18,2022-10-09T09:49:39Z,denverbroncos,-0.0617185185185185
14006,82103,82103,Najfore,"Ya, prime games (Thurs) have 3 viewing options. One is prime vision, zoomed out camera with players highlighted and stats. Kind of like playing Madden",4.0,denverbroncos,t3_xy89ml,False,0.0,18,2022-10-07T18:42:40Z,denverbroncos,0.1979777777777778
14007,82104,82104,Najfore,"I like Russ....but we have to stop this. Manning was/is one of a kind. We can't keep comparing to literally the greatest QB to ever play the game. He didn't need a coach, he wasn't gonna miss open receivers, he used his players and elevated them.

I hope Russ can do it soon, but he doesn't have the same skill sets as Manning",6.0,denverbroncos,t3_xyd79n,False,0.0,18,2022-10-07T18:38:54Z,denverbroncos,0.059183424
14008,82105,82105,Najfore,Spoiled fanbase. We should be use to this by now and not crying at every bad game,-4.0,denverbroncos,t3_xy7uit,False,1.0,18,2022-10-07T18:35:01Z,denverbroncos,-0.11865
14009,82106,82106,Najfore,"Money is on Wilson. I don't think we make a change there, deff not after one year (barring major injury). Whether the issues are mostly Hackett or Wilson, they are wanting the most outta Wilson and Hackett will be gone if this continues",1.0,denverbroncos,t3_xyawh0,False,0.0,18,2022-10-07T18:02:28Z,denverbroncos,-0.0528222222222222
14010,82114,82114,Najfore,"Thanks for the insight. Ya he's trying to stay a pocket passer and honestly afraid he might be starting to see ghost.

People hate on his pressers, I'd much rather hear him saying we will get it together and trying to be confident then just pull a cam newton",2.0,denverbroncos,t3_xy4r2w,False,0.0,18,2022-10-07T16:13:59Z,denverbroncos,-0.0065888888888888
14011,82115,82115,Najfore,"How much more to the throwing shoulder injury do we think there is? I'm sure it's been downplayed, and I'm not saying it's an excuse...but even Seattle fans are saying something just looks very off",4.0,denverbroncos,t3_xy4r2w,False,0.0,18,2022-10-07T12:53:29Z,denverbroncos,0.0537249999999999
14012,82116,82116,Najfore,"Manning? I dunno if he translates to head coach, and I don't think he's shown any interest",1.0,denverbroncos,t3_xy36to,False,0.0,18,2022-10-07T12:36:39Z,denverbroncos,0.2294
14013,82120,82120,Najfore,Agreed,4.0,denverbroncos,t3_xxz6ln,False,0.0,18,2022-10-07T10:13:56Z,denverbroncos,0.2732
14014,82121,82121,Najfore,Ah man...might be the worst Russ insult I've seen,6.0,nfl,t3_xy09cl,False,0.0,:Broncos: Broncos,2022-10-07T09:38:20Z,denverbroncos,-0.8126
14015,82123,82123,Najfore,">Politics don’t matter if you’re losing

2016-2020 in the United States of America disagrees with this statement",0.0,denverbroncos,t3_xxxefl,False,0.0,18,2022-10-07T09:32:16Z,denverbroncos,-0.25
14016,82125,82125,Najfore,"5 games into an entirely new staff/QB/Owner and you're discussing a rebuild.

I can agree with jeudy, and maybe Albert O, depending on what Dulcich can do.

It may be a bust, but I think it's way to early to talk about a rebuild",-1.0,denverbroncos,t3_xxzkuw,False,0.0,18,2022-10-07T09:18:18Z,denverbroncos,0.0401333333333333
14017,82126,82126,Najfore,"Liked him too, but he wasn't better than russ",6.0,denverbroncos,t3_xxzmxd,False,0.0,18,2022-10-07T08:55:47Z,denverbroncos,-0.298
14018,82127,82127,Najfore,Overreaction,-2.0,denverbroncos,t3_xxzkuw,False,1.0,18,2022-10-07T08:53:51Z,denverbroncos,-0.1779
14019,82129,82129,Najfore,"This looks a lot different from the view of a fan.

They are 2-3 and as players, still believe it can be turned around. Every loss is frustrating and there are going to be upset players (justifiably so for Hamler).

My optimism is starting to wobble....but I don't think the world is over yet. Maybe Hackett doesn't work out, maybe Russ is a bust. It's all possible......at the same time they could click and it all work out.

I didn't expect a Superbowl this year, woulda liked it, but it wasn't fair to expect that.

Have a choice to stay positive and hope for the best, or fall into football depression. Day after deserves to be spent stewing, but the season isn't over yet...",18.0,denverbroncos,t3_xxz6ln,False,0.0,18,2022-10-07T08:50:34Z,denverbroncos,0.0095709708610687
14020,82132,82132,Najfore,"Tbf we all just jumped in the car with a stranger who said ""let's ride"".....there was no word on the kind of ride",5.0,denverbroncos,t3_xxprmu,False,0.0,18,2022-10-07T07:33:30Z,denverbroncos,-0.296
14021,82135,82135,Najfore,"Honestly, in the case we have a losing record it would be surprising that the new owners want to bring in their own coach.

Regardless of the season, no way we move on from Russ after just one. Whether people agree or disagree, the failures of this season will primarily be put on Hackett",9.0,denverbroncos,t3_xxw5ve,False,0.0,18,2022-10-07T06:09:45Z,denverbroncos,-0.1761777777777777
15209,87236,87236,OpabiniaGlasses,Have you seen the ownership group? He's not even the greatest villain in that stadium every game.,2.0,denverbroncos,t3_xyfgob,False,0.0,D Helmet,2022-10-07T22:34:48Z,denverbroncos,-0.39435
15210,87238,87238,OpabiniaGlasses,"Have some perspective, it could be worse.

The team could be owned by a family who is responsible for exploiting millions of poor Americans, destroying countless small businesses and brought on a war criminal to the ownership group as the cherry on top.",6.0,denverbroncos,t3_xyesff,False,0.0,D Helmet,2022-10-07T19:45:27Z,denverbroncos,-0.584175
15211,87239,87239,OpabiniaGlasses,"I'll always remember Joe and Troy calling a Lions/Bears Thanksgiving game and something happened on a kickoff and they had to redo the play and Buck said, ""Do we have to do it again?"".",16.0,nfl,t3_xxn39v,False,0.0,:Broncos: Broncos,2022-10-07T09:34:28Z,denverbroncos,0.085
16018,93935,93935,Sbesozzi,It makes me so sad that we're wasting a championship grade defense with a garbage offense :(,1.0,denverbroncos,t3_xyeolg,False,0.0,:denver-broncos-logo-tran:,2022-10-08T10:26:17Z,denverbroncos,-0.8015
16019,93937,93937,Sbesozzi,Are you kidding me? The front page is full of this kind of meme right now. Lol @ low effort. I can assure you the editing for this required more effort than the top post with basic word art haha,1.0,denverbroncos,t3_xy336g,False,0.0,:denver-broncos-logo-tran:,2022-10-07T12:03:38Z,denverbroncos,0.195294921875
16542,96710,96710,ShareTheHotSauce,I think the offensive system is to blame. Russ skill sets flourish when he rolls out of the pocket and forces the defense to move away or loose track of the receivers,5.0,denverbroncos,t3_xy2i39,False,0.0,Judge ⚖️ Jeudy,2022-10-07T11:12:16Z,denverbroncos,-0.266075
17331,103616,103616,SupMaelstrom,"Let's face it. We're one month into the season. Many will say ""it's only 5 games"" and yes, I agree, but there's NO apparent evolution. In fact, it seems like we are regressing as if this was possible. Saying that the Broncos' offense will improve is an exercise in faith, not a sports analysis. For an ""offensive guru"", Hackett hasn't shown ANYTHING that makes me think ""well, at least that's an improvement"".  

But we can't put all the fault in Hackett for this game. I don't recognize Russell Wilson. Missing wide open guys, trying too hard to make throws that weren't there, throwing 2 mind-boggling interceptions. Guys, 2 INTs in FG range and one blocked FG. Just a single point in one of these 3 plays and this would be a win.  

I don't want to be that pessimistic and I know I'm probably overreacting after watching probably one of the Top 5 worst games of my entire life, but things don't seem like they'll get much better. To add insult to injury, the injury bug is running rampant again and we're losing one starter after another.

I'd say we should start thinking about the Draft but we've got no 1st and 2nd round picks because we traded them for our $250M QB that's somehow playing as bad as, if not worse than, our 11 other QBs after Manning. Sheesh.",4.0,denverbroncos,t3_xy4cus,False,0.0,1 Star Mod,2022-10-07T12:07:02Z,denverbroncos,-0.0023211504469761
17332,103617,103617,SupMaelstrom,"Before the season I was confident in grabbing a wild card with 12-5 or something. Two weeks into the season, I lowered my expectations to a winning record of at least 9-8.  

Now? We'll be extremely lucky to win 3 or 4 more games.",6.0,denverbroncos,t3_xxxvd8,False,0.0,1 Star Mod,2022-10-07T07:48:26Z,denverbroncos,0.2087105468749999
17845,106486,106486,TheGookieMonster,"lol yes you are, especially if you’re in public",1.0,nfl,t3_y0yo6m,False,0.0,:Broncos: Broncos ,2022-10-10T22:59:21Z,denverbroncos,0.6705
17846,106487,106487,TheGookieMonster,Context like rich and famous people are allowed to get away with battery because they can’t handle their fee fees when us peons would go to jail for the same thing?,2.0,nfl,t3_y0yo6m,False,0.0,:Broncos: Broncos ,2022-10-10T22:57:49Z,denverbroncos,0.7269
17847,106489,106489,TheGookieMonster,lol the chiefs are gonna win this game now,8.0,nfl,t3_y0tru9,False,0.0,:Broncos: Broncos ,2022-10-10T20:45:04Z,denverbroncos,0.765
18345,107414,107414,TheHeroOfAllTime,Just wish this news was about Hackett…,18.0,nfl,t3_y0h67w,False,0.0,:Broncos: Broncos,2022-10-10T10:11:55Z,denverbroncos,0.4019
18346,107415,107415,TheHeroOfAllTime,I’m not even a hockey fan so I have no hope!,9.0,denverbroncos,t3_xz1cma,False,0.0,SB Elway,2022-10-08T19:45:13Z,denverbroncos,0.1153
18347,107417,107417,TheHeroOfAllTime,Low and slow babyyyyyyy… 😭,12.0,nfl,t3_xyvr61,False,0.0,:Broncos: Broncos,2022-10-08T14:09:30Z,denverbroncos,-0.6369
18348,107419,107419,TheHeroOfAllTime,I think it was a mistake moving on from Scangs as fast as we did. Especially by going to Shurmur…,1.0,denverbroncos,t3_xybxon,False,0.0,SB Elway,2022-10-08T09:49:45Z,denverbroncos,-0.085
19143,108760,108760,TideAtOmahaBeach,It’s understandable because Adams plays for this dude’s favorite team obviously,38.0,nfl,t3_y0zk4p,False,0.0,:Broncos: Broncos,2022-10-11T06:20:55Z,denverbroncos,0.6124
19144,108761,108761,TideAtOmahaBeach,"They’re not destroying our chances for the playoffs because we have no chance of winning the division anyway. Our only hope is a Wild Card spot so we should be rooting for the Chargers and other mid-tier teams to be losing every week. Plus the Chiefs winning this game effectively ended the Raiders season and kicked them out of the Wild Card race, so that benefits us a lot anyway.",3.0,denverbroncos,t3_y0yd9m,False,0.0,:CWxQy4O:,2022-10-11T06:06:37Z,denverbroncos,0.3136555555555556
19145,108762,108762,TideAtOmahaBeach,But then we would be last place in the division so fuck that. Last place should be reserved for the Raiders,2.0,denverbroncos,t3_y0yd9m,False,0.0,:CWxQy4O:,2022-10-11T02:16:20Z,denverbroncos,-0.201
19146,108763,108763,TideAtOmahaBeach,People can say whatever they want but I’d rather have 2 ugly af wins than 4 “quality losses”. FTR,17.0,denverbroncos,t3_y0ydal,False,0.0,:CWxQy4O:,2022-10-11T00:59:13Z,denverbroncos,0.047525
19147,108764,108764,TideAtOmahaBeach,All 3 of our teams arguably have bottom 5 coaches in the league lmao,7.0,denverbroncos,t3_y0ydal,False,0.0,:CWxQy4O:,2022-10-11T00:57:30Z,denverbroncos,0.4404
19148,108765,108765,TideAtOmahaBeach,"My mom’s a Chiefs fan unfortunately but at least every time they win I can at least be happy that she’s happy, despite my complete hatred for the Chiefs. But there’s nothing to enjoy about a Raiders win, which is why I want them to go 0-17 every season.",3.0,denverbroncos,t3_y0ydal,False,0.0,:CWxQy4O:,2022-10-11T00:56:21Z,denverbroncos,0.490475
19149,108766,108766,TideAtOmahaBeach,Oh God does this mean Davante’s about to throw a bomb in Derek Carr’s face?,2.0,nfl,t3_y0ynaf,False,0.0,:Broncos: Broncos,2022-10-10T23:40:01Z,denverbroncos,-0.2732
19150,108767,108767,TideAtOmahaBeach,“I’m gonna put some dirt in your eye” - Davante Adams to a random cameraman,1.0,nfl,t3_y0ynaf,False,0.0,:Broncos: Broncos,2022-10-10T23:32:10Z,denverbroncos,-0.34
19151,108768,108768,TideAtOmahaBeach,Don’t care still have more wins than the Raiders lmao,9.0,nfl,t3_y0tru9,False,0.0,:Broncos: Broncos,2022-10-10T22:46:36Z,denverbroncos,0.902
19152,108769,108769,TideAtOmahaBeach,It’s a shame every other team in the AFC West has a brain-dead monkey for a head coach because the Chiefs actually look vulnerable this season.,15.0,nfl,t3_y0yfh6,False,0.0,:Broncos: Broncos,2022-10-10T22:34:31Z,denverbroncos,-0.6124
19153,108770,108770,TideAtOmahaBeach,That would require Carr to be a good QB,1.0,nfl,t3_y0tru9,False,0.0,:Broncos: Broncos,2022-10-10T22:29:07Z,denverbroncos,0.4404
19154,108771,108771,TideAtOmahaBeach,"Don’t worry, Raiders fans will still act like the refs hate them and are always trying to make them lose.",3.0,nfl,t3_y0w5y3,False,0.0,:Broncos: Broncos,2022-10-10T21:04:19Z,denverbroncos,-0.7783
19155,108772,108772,TideAtOmahaBeach,"I would do anything to get Kubiak back at this point. If he didn’t retire so suddenly, I bet our franchise doesn’t go straight to hell for the next 7 years.",2.0,denverbroncos,t3_xz2ohp,False,0.0,:CWxQy4O:,2022-10-10T08:42:59Z,denverbroncos,-0.28595
19156,108773,108773,TideAtOmahaBeach,I have more faith in Russ having a good game than Rypien lmao,1.0,denverbroncos,t3_xz2ohp,False,0.0,:CWxQy4O:,2022-10-09T15:06:28Z,denverbroncos,0.8718
19157,108774,108774,TideAtOmahaBeach,Not really one of the best pass rushes at the moment since Bosa’s on short-term IR,1.0,denverbroncos,t3_xz2ohp,False,0.0,:CWxQy4O:,2022-10-09T10:22:17Z,denverbroncos,0.6369
19158,108775,108775,TideAtOmahaBeach,Lmao same boat here. Not a chance I’m traveling to LA to watch fuckin Brett Rypien,1.0,denverbroncos,t3_xz2ohp,False,0.0,:CWxQy4O:,2022-10-09T10:19:46Z,denverbroncos,0.056
19159,108776,108776,TideAtOmahaBeach,"Nobody thought trading for him was a terrible idea at the time, that’s just hindsight causing people to act like they’re smarter than Paton. Extending him was probably a bad move, but it makes sense if you’re confident in Russ being great to lock him up before Lamar, Burrow, and Herbert start getting gigantic extensions.",1.0,denverbroncos,t3_xz2ohp,False,0.0,:CWxQy4O:,2022-10-09T10:17:48Z,denverbroncos,0.5179
19160,108777,108777,TideAtOmahaBeach,Good thing we have an incredibly competent head coach! 😐,2.0,denverbroncos,t3_xz2ohp,False,0.0,:CWxQy4O:,2022-10-09T10:12:54Z,denverbroncos,0.174725
19161,108778,108778,TideAtOmahaBeach,"See you’re probably right, but counterpoint: I’ll be at the game next Monday and if I’m traveling to LA to watch Brett Rypien I’m going to kill myself.",1.0,denverbroncos,t3_xz2ohp,False,0.0,:CWxQy4O:,2022-10-09T10:11:21Z,denverbroncos,-0.8201
19162,108780,108780,TideAtOmahaBeach,Yeah I’m super excited. Just hoping Russ actually plays and isn’t injured though lol,1.0,nfl,t3_xz5kn7,False,0.0,:Broncos: Broncos,2022-10-08T21:08:41Z,denverbroncos,0.5041
19163,108781,108781,TideAtOmahaBeach,"Exactly. Good luck next Monday. Hope it’s a great game, especially since I’ll be there in-person.",1.0,nfl,t3_xz5kn7,False,0.0,:Broncos: Broncos,2022-10-08T20:37:37Z,denverbroncos,0.3423777777777777
19164,108783,108783,TideAtOmahaBeach,Jesus Christ our fanbase is embarrassing lmao. 5 games into a 7-year contract and people already want him benched wtf,7.0,nfl,t3_xz5kn7,False,0.0,:Broncos: Broncos,2022-10-08T20:16:21Z,denverbroncos,-0.1916
19165,108784,108784,TideAtOmahaBeach,Yeah but it’s Hackett whose job is on the line lmao. I would hope Hackett has enough confidence in himself to think we can make the playoffs.,8.0,denverbroncos,t3_xz5np6,False,0.0,:CWxQy4O:,2022-10-08T19:57:30Z,denverbroncos,0.56445
19166,108785,108785,TideAtOmahaBeach,He’s been on rotation but we’re trying to let him develop his run defense a little more. We have plenty of depth at edge so we don’t need to rush him out. He had a big hit against Hines on Thursday though.,4.0,nfl,t3_xyhnwz,False,0.0,:Broncos: Broncos,2022-10-08T08:12:42Z,denverbroncos,0.0070407407407407
19167,108786,108786,TideAtOmahaBeach,We wouldn’t have either of our 2 wins without Russ and he fought like hell to keep us in the Raiders game. You think Rypien is able to have those clutch drives in the Texans and Niners games to give us the lead late? The fact that there are even people thinking Rypien would be a better option as a starter is embarrassing.,7.0,denverbroncos,t3_xyg8dv,False,0.0,:CWxQy4O:,2022-10-07T23:19:19Z,denverbroncos,0.0191444444444444
19168,108787,108787,TideAtOmahaBeach,Jesus Christ we’re not 0-5. We certainly would be if Rypien had been starting though,4.0,denverbroncos,t3_xyg8dv,False,1.0,:CWxQy4O:,2022-10-07T22:27:17Z,denverbroncos,0.17
19169,108788,108788,TideAtOmahaBeach,Lmao Rypien would be a disaster and we all know it. Russ just had a great game last week so we know he’s capable of it. Wanting Russ cut and Rypien as the starter is just asking the team to fail.,-3.0,denverbroncos,t3_xyg8dv,False,1.0,:CWxQy4O:,2022-10-07T21:59:26Z,denverbroncos,-0.1430999999999999
19170,108789,108789,TideAtOmahaBeach,Tbh tho fans really do need to be a bit more patient this season. I know we had high expectations but we have a young and inexperienced coaching staff and a QB who’s only played in one system his entire 10-year career prior to this season. There’s a lot that needs to be worked out. I’ve already seen “fans” on here saying we need to cut Russ or start Rypien which is just a ridiculous overreaction.,21.0,denverbroncos,t3_xyg8dv,False,1.0,:CWxQy4O:,2022-10-07T21:29:13Z,denverbroncos,-0.1547015625
19171,108790,108790,TideAtOmahaBeach,Russ is just the punching bag of r/nfl right now so they have to post anything that can be twisted into a negative.,7.0,nfl,t3_xy7pmg,False,0.0,:Broncos: Broncos,2022-10-07T21:17:00Z,denverbroncos,-0.5719
19172,108791,108791,TideAtOmahaBeach,It’s nothing out of the ordinary but the anti-Russ circlejerk in this sub is strong,11.0,nfl,t3_xy7pmg,False,0.0,:Broncos: Broncos,2022-10-07T21:14:22Z,denverbroncos,0.6652
19173,108793,108793,TideAtOmahaBeach,Gordon responded to the clip on Instagram and said that he was looking at Russ like that because he was concerned about his concussion and was hoping he was okay. They’ve been friends for a long time so he was understandably concerned about his physical health (and probably mental health too let’s be honest).,36.0,nfl,t3_xy7pmg,False,0.0,:Broncos: Broncos,2022-10-07T21:08:26Z,denverbroncos,0.559075
19174,108794,108794,TideAtOmahaBeach,"Honestly I think losing Tim Patrick really hurt this season right from the beginning because he’s a huge leader in the locker room. He and Russ seemed to be vibing really well with each other and Patrick is always defensive of Russ on social media. I feel like if he were playing, the offense as a whole would have a lot more energy because they could rally around both Russ and Patrick. 

Justin Simmons has also been on IR the past 4 games and he’s a huge leader on the team as well. Most of these dudes didn’t know Russ until he got here, so Russ needs the support of the already established leaders to get the team hyped up imo",7.0,nfl,t3_xy7pmg,False,0.0,:Broncos: Broncos,2022-10-07T21:04:14Z,denverbroncos,0.1065112319999999
19175,108795,108795,TideAtOmahaBeach,He literally took full responsibility in his post-game press conference last night and said that it’s his fault we lost. Russ seems like a very high character guy and he has plenty of teammates defending him on social media rn.,7.0,denverbroncos,t3_xy692y,False,0.0,:CWxQy4O:,2022-10-07T20:37:19Z,denverbroncos,0.0274999999999999
